headline,org,date
"Ant's crown jewel, Alipay, is a supercharged version of popular American apps like Venmo and PayPal. Here's everything you need to know about the app used by more than 1 billion Chinese residents.",msnmoney,2020-12-30 14:29:28
The best time to buy almost anything in 2021,msnmoney,2020-12-30 14:29:28
17 Ways These $20 Lights Will Upgrade Your Home,msnmoney,2020-12-30 14:29:28
"Mega Millions jackpot jumps to $401 million, Powerball's top prize is $363 million. Here's how to protect your privacy if you win",msnmoney,2020-12-30 14:29:28
13 Brilliant Ways To Save Money on Your New Year’s Resolutions,msnmoney,2020-12-30 14:29:28
Top credit card wipes out interest until 2022 (seriously),msnmoney,2020-12-30 14:29:28
Perella Weinberg Inks Deal With Betsy Cohen’s SPAC,msnmoney,2020-12-30 14:29:28
The Average Retirement Age in Every State,msnmoney,2020-12-30 14:29:28
What's Happening to Residential Buildings With Retail Space?,msnmoney,2020-12-30 14:29:28
Unique Tip If Your Car Has Automatic Headlights,msnmoney,2020-12-30 14:29:28
"Jeff Bezos’ Record Net Worth, Donations and Amazon Drama: A Look Back at His 2020",msnmoney,2020-12-30 14:29:28
"Stock Expert Issues Rare ""Home Run Buy"" Alert",msnmoney,2020-12-30 14:29:28
AMC hopes to raise $125 million in fresh funding round as it fights bankruptcy,msnmoney,2020-12-30 14:29:28
How To Manage All the Extra Debt You Piled Up in 2020,msnmoney,2020-12-30 14:29:28
Argentina becomes the first large Latin American country to legalize abortion,msnmoney,2020-12-30 14:29:28
What Experts Say 2021 Will Look Like for Your Wallet,msnmoney,2020-12-30 14:29:28
Amazon to buy podcast maker Wondery,msnmoney,2020-12-30 14:29:28
Staff Share Advice About Shopping At IKEA,msnmoney,2020-12-30 14:29:28
100 top money-saving tips for 2021,msnmoney,2020-12-30 14:29:28
Smart Investors Avoid Macy's No Matter How Good the Price,msnmoney,2020-12-30 14:29:28
States With the Largest (and Smallest) Tax Burden,msnmoney,2020-12-30 14:29:28
This Bank Is Offering $250 to Babies Born on Dec. 31,msnmoney,2020-12-30 14:29:28
Tax Strategies That Save You Money,msnmoney,2020-12-30 14:29:28
"Incredible Blanket Puts Humans In A Deep Sleep, Melting Stress Away",msnmoney,2020-12-30 14:29:28
U.S. Posts Record Goods-Trade Gap Ahead of Holiday Season,msnmoney,2020-12-30 14:29:28
States Where the Virus Spread Is Slowing (and Where It’s Still Getting Worse),msnmoney,2020-12-30 14:29:28
"30-Year Interest Rates for December 30, 2020 | Rates up",msnmoney,2020-12-30 14:29:28
15 things that will cost more in 2021,msnmoney,2020-12-30 14:29:28
N.Y. Jewelry Wholesaler Guilty in $200 Million Ponzi Scam,msnmoney,2020-12-30 14:29:28
New Car Gadget Magically Removes Scratches & Dents,msnmoney,2020-12-30 14:29:28
5 Things That Make Life More Meaningful for Retirees,msnmoney,2020-12-30 14:29:28
Retirement Resolutions for 2021,msnmoney,2020-12-30 14:29:28
Things you should stop buying in 2021,msnmoney,2020-12-30 14:29:28
Trump Faces Another Legal Battle Over Stiffer Solar Tariffs,msnmoney,2020-12-30 14:29:28
How to Pay for College: 5 Strategies and Tips,msnmoney,2020-12-30 14:29:28
Best Credit Cards of December 2020,msnmoney,2020-12-30 14:29:28
Where’s Your Second $600 Stimulus Check?,msnmoney,2020-12-30 14:29:28
2020 in Review: How Small-Business Owners Got Creative in the Time of COVID-19,msnmoney,2020-12-30 14:29:28
"Stocks making the biggest moves midday: AMC, Levi Strauss, Dynatrace, AstraZeneca & more",msnmoney,2020-12-30 14:29:28
2020 in Review: The Year for Mark Zuckerberg,msnmoney,2020-12-30 14:29:28
What Is Taxable Income?,msnmoney,2020-12-30 14:29:28
"Spend $500, pocket $200 fast with this top card",msnmoney,2020-12-30 14:29:28
18 Resolutions To Get Rich in 2021,msnmoney,2020-12-30 14:29:28
Soy Breaches $13 a Bushel as Strong Demand Outweighs Labor Deal,msnmoney,2020-12-30 14:29:28
2020 in Review: The Year for Apple,msnmoney,2020-12-30 14:29:28
How to Recover From Your Post-Holiday Financial Hangover,msnmoney,2020-12-30 14:29:28
What Homes Will Be Worth in Your State by the End of 2021,msnmoney,2020-12-30 14:29:28
Refinance rates at 2.22% APR (15yr). Calculate your rate now,msnmoney,2020-12-30 14:29:28
2020's biggest winners and losers in business,msnmoney,2020-12-30 14:29:28
Avoid These Expensive Decor Trends That Won’t Last,msnmoney,2020-12-30 14:29:28
Can You Retire a Millionaire Saving $500 per Month?,msnmoney,2020-12-30 14:29:28
Ways the pandemic changed our lives in 2020,msnmoney,2020-12-30 14:29:28
"Coinbase paid women and Black employees significantly less than counterparts in comparable roles, and the wage gaps were wider than at other tech firms, report says",msnmoney,2020-12-30 14:29:28
What a brilliant way to save on car insurance!,msnmoney,2020-12-30 14:29:28
Coronavirus Has Made These 100+ Brands More Valuable Than Ever,msnmoney,2020-12-30 14:29:28
A No-Resolution Plan for Better Finances in 2021,msnmoney,2020-12-30 14:29:28
Is Your Resume Up To Par With the Competition?,msnmoney,2020-12-30 14:29:28
"How the pandemic drove massive stock market gains, and what happens next",msnmoney,2020-12-30 14:29:28
The Best and Worst Ways To Spend Your Year-End Bonus,msnmoney,2020-12-30 14:29:28
22 Filthy Rich People Who Will Give Away Their Fortunes,msnmoney,2020-12-30 14:29:28
20 Questions to Tell If You're Ready to Retire,msnmoney,2020-12-30 14:29:28
2020 in Review: Popular Venues That Closed,msnmoney,2020-12-30 14:29:28
Record number of women took over Fortune 500 companies in 2020,msnmoney,2020-12-30 14:29:28
Companies That Exceeded Expectations Last Quarter,msnmoney,2020-12-30 14:29:28
Wall Street's best year ever? Why the pandemic has been great for billionaires,msnmoney,2020-12-30 14:29:28
The 10 Most Popular Home Improvements Amid COVID-19,msnmoney,2020-12-30 14:29:28
"Here are 9 fascinating facts to know about BlackRock, the world's largest asset manager popping up in the Biden administration",msnmoney,2020-12-30 14:29:28
"Why January 20th Could Set off ""Second Wave"" for Stocks",msnmoney,2020-12-30 14:29:28
Secrets realtors don’t want you to know,msnmoney,2020-12-30 14:29:28
"Ant's crown jewel, Alipay, is a supercharged version of popular American apps like Venmo and PayPal. Here's everything you need to know about the app used by more than 1 billion Chinese residents.",msnmoney,2020-12-30 14:29:28
The best time to buy almost anything in 2021,msnmoney,2020-12-30 14:29:28
17 Ways These $20 Lights Will Upgrade Your Home,msnmoney,2020-12-30 14:29:28
"Mega Millions jackpot jumps to $401 million, Powerball's top prize is $363 million. Here's how to protect your privacy if you win",msnmoney,2020-12-30 14:29:28
13 Brilliant Ways To Save Money on Your New Year’s Resolutions,msnmoney,2020-12-30 14:29:28
Top credit card wipes out interest until 2022 (seriously),msnmoney,2020-12-30 14:29:28
Perella Weinberg Inks Deal With Betsy Cohen’s SPAC,msnmoney,2020-12-30 14:29:28
The Average Retirement Age in Every State,msnmoney,2020-12-30 14:29:28
What's Happening to Residential Buildings With Retail Space?,msnmoney,2020-12-30 14:29:28
Unique Tip If Your Car Has Automatic Headlights,msnmoney,2020-12-30 14:29:28
"Jeff Bezos’ Record Net Worth, Donations and Amazon Drama: A Look Back at His 2020",msnmoney,2020-12-30 14:29:28
"Stock Expert Issues Rare ""Home Run Buy"" Alert",msnmoney,2020-12-30 14:29:28
AMC hopes to raise $125 million in fresh funding round as it fights bankruptcy,msnmoney,2020-12-30 14:29:28
How To Manage All the Extra Debt You Piled Up in 2020,msnmoney,2020-12-30 14:29:28
Argentina becomes the first large Latin American country to legalize abortion,msnmoney,2020-12-30 14:29:28
What Experts Say 2021 Will Look Like for Your Wallet,msnmoney,2020-12-30 14:29:28
Amazon to buy podcast maker Wondery,msnmoney,2020-12-30 14:29:28
Staff Share Advice About Shopping At IKEA,msnmoney,2020-12-30 14:29:28
100 top money-saving tips for 2021,msnmoney,2020-12-30 14:29:28
Smart Investors Avoid Macy's No Matter How Good the Price,msnmoney,2020-12-30 14:29:28
States With the Largest (and Smallest) Tax Burden,msnmoney,2020-12-30 14:29:28
This Bank Is Offering $250 to Babies Born on Dec. 31,msnmoney,2020-12-30 14:29:28
Tax Strategies That Save You Money,msnmoney,2020-12-30 14:29:28
"Incredible Blanket Puts Humans In A Deep Sleep, Melting Stress Away",msnmoney,2020-12-30 14:29:28
U.S. Posts Record Goods-Trade Gap Ahead of Holiday Season,msnmoney,2020-12-30 14:29:28
States Where the Virus Spread Is Slowing (and Where It’s Still Getting Worse),msnmoney,2020-12-30 14:29:28
"30-Year Interest Rates for December 30, 2020 | Rates up",msnmoney,2020-12-30 14:29:28
15 things that will cost more in 2021,msnmoney,2020-12-30 14:29:28
N.Y. Jewelry Wholesaler Guilty in $200 Million Ponzi Scam,msnmoney,2020-12-30 14:29:28
New Car Gadget Magically Removes Scratches & Dents,msnmoney,2020-12-30 14:29:28
5 Things That Make Life More Meaningful for Retirees,msnmoney,2020-12-30 14:29:28
Retirement Resolutions for 2021,msnmoney,2020-12-30 14:29:28
Things you should stop buying in 2021,msnmoney,2020-12-30 14:29:28
Trump Faces Another Legal Battle Over Stiffer Solar Tariffs,msnmoney,2020-12-30 14:29:28
How to Pay for College: 5 Strategies and Tips,msnmoney,2020-12-30 14:29:28
Best Credit Cards of December 2020,msnmoney,2020-12-30 14:29:28
Where’s Your Second $600 Stimulus Check?,msnmoney,2020-12-30 14:29:28
2020 in Review: How Small-Business Owners Got Creative in the Time of COVID-19,msnmoney,2020-12-30 14:29:28
"Stocks making the biggest moves midday: AMC, Levi Strauss, Dynatrace, AstraZeneca & more",msnmoney,2020-12-30 14:29:28
2020 in Review: The Year for Mark Zuckerberg,msnmoney,2020-12-30 14:29:28
What Is Taxable Income?,msnmoney,2020-12-30 14:29:28
"Spend $500, pocket $200 fast with this top card",msnmoney,2020-12-30 14:29:28
18 Resolutions To Get Rich in 2021,msnmoney,2020-12-30 14:29:28
Soy Breaches $13 a Bushel as Strong Demand Outweighs Labor Deal,msnmoney,2020-12-30 14:29:28
2020 in Review: The Year for Apple,msnmoney,2020-12-30 14:29:28
How to Recover From Your Post-Holiday Financial Hangover,msnmoney,2020-12-30 14:29:28
What Homes Will Be Worth in Your State by the End of 2021,msnmoney,2020-12-30 14:29:28
Refinance rates at 2.22% APR (15yr). Calculate your rate now,msnmoney,2020-12-30 14:29:28
2020's biggest winners and losers in business,msnmoney,2020-12-30 14:29:28
Avoid These Expensive Decor Trends That Won’t Last,msnmoney,2020-12-30 14:29:28
Can You Retire a Millionaire Saving $500 per Month?,msnmoney,2020-12-30 14:29:28
Ways the pandemic changed our lives in 2020,msnmoney,2020-12-30 14:29:28
"Coinbase paid women and Black employees significantly less than counterparts in comparable roles, and the wage gaps were wider than at other tech firms, report says",msnmoney,2020-12-30 14:29:28
What a brilliant way to save on car insurance!,msnmoney,2020-12-30 14:29:28
Coronavirus Has Made These 100+ Brands More Valuable Than Ever,msnmoney,2020-12-30 14:29:28
A No-Resolution Plan for Better Finances in 2021,msnmoney,2020-12-30 14:29:28
Is Your Resume Up To Par With the Competition?,msnmoney,2020-12-30 14:29:28
"How the pandemic drove massive stock market gains, and what happens next",msnmoney,2020-12-30 14:29:28
The Best and Worst Ways To Spend Your Year-End Bonus,msnmoney,2020-12-30 14:29:28
22 Filthy Rich People Who Will Give Away Their Fortunes,msnmoney,2020-12-30 14:29:28
20 Questions to Tell If You're Ready to Retire,msnmoney,2020-12-30 14:29:28
2020 in Review: Popular Venues That Closed,msnmoney,2020-12-30 14:29:28
Record number of women took over Fortune 500 companies in 2020,msnmoney,2020-12-30 14:29:28
Companies That Exceeded Expectations Last Quarter,msnmoney,2020-12-30 14:29:28
Wall Street's best year ever? Why the pandemic has been great for billionaires,msnmoney,2020-12-30 14:29:28
The 10 Most Popular Home Improvements Amid COVID-19,msnmoney,2020-12-30 14:29:28
"Here are 9 fascinating facts to know about BlackRock, the world's largest asset manager popping up in the Biden administration",msnmoney,2020-12-30 14:29:28
"Why January 20th Could Set off ""Second Wave"" for Stocks",msnmoney,2020-12-30 14:29:28
Secrets realtors don’t want you to know,msnmoney,2020-12-30 14:29:28
"Stocks rise, adding to year-end advances",yahoofinance,2020-12-30 14:42:21
Power of McDonald's McRib might shock Wall Street in January,yahoofinance,2020-12-30 14:42:21
Amazon to acquire Wondery in podcast push,yahoofinance,2020-12-30 14:42:21
Popeye’s chicken sandwich faces headwinds in 2021,yahoofinance,2020-12-30 14:42:21
Breaking down the 7 biggest investing lessons of 2020,yahoofinance,2020-12-30 14:42:21
Why have stocks gone up so much in 2020?,yahoofinance,2020-12-30 14:42:21
The chart that explains 2020's crazy stock market,yahoofinance,2020-12-30 14:42:21
Pending home sales fall for 3rd straight month,yahoofinance,2020-12-30 14:42:21
"West Chester, Pennsylvania: Did You Know About This?",yahoofinance,2020-12-30 14:42:21
ICE’s Jeffrey Sprecher Turns Billionaire on Eve of Wife’s Georgia Runoff,yahoofinance,2020-12-30 14:42:21
Dow Jones On Track For New Closing High; McConnell Unveils New Stimulus Bill,yahoofinance,2020-12-30 14:42:21
Dow Jones Futures Rally As McConnell Introduces Competing Stimulus-Check Bill; Apple Reverses From New Buy Point,yahoofinance,2020-12-30 14:42:21
6 Social Security Changes for 2021,yahoofinance,2020-12-30 14:42:21
3 Big Dividend Stocks Yielding Over 7%; Raymond James Says ‘Buy’,yahoofinance,2020-12-30 14:42:21
Congress is giving you a new stimulus check — and here's when to expect it,yahoofinance,2020-12-30 14:42:21
Warren Buffett's Top 12 Stocks This Year Aren't All Obvious,yahoofinance,2020-12-30 14:42:21
Best Dividend Stocks For 2021: Five Strong-Yield Stocks Beating The S&P 500,yahoofinance,2020-12-30 14:42:21
These are the 20 worst-performing S&P 500 stocks of 2020 — analysts see double-digit rebounds for 6 of them in 2021,yahoofinance,2020-12-30 14:42:21
"How to Invest $500,000",yahoofinance,2020-12-30 14:42:21
"We’re 56, have $400,000 in debt, can save $50,000 a year and just want to retire — what should we do?",yahoofinance,2020-12-30 14:42:21
"These 2 Penny Stocks Are Poised to Go Boom, Say Analysts",yahoofinance,2020-12-30 14:42:21
These Stocks Have Been Left Behind in the Rally. They May Be Ripe for Picking.,yahoofinance,2020-12-30 14:42:21
Is my stimulus check taxable income? Will it reduce my tax return? Burning questions about the second COVID-19 stimulus,yahoofinance,2020-12-30 14:42:21
My husband and I are planning to give our daughter a home for the New Year. Are we making a mistake?,yahoofinance,2020-12-30 14:42:21
"I’m 38 with $315,000 saved for retirement, but have $30,000 in debt. Should I lower my 401(k) contributions to get rid of that debt?",yahoofinance,2020-12-30 14:42:21
Moderna Shares Are 40% Off the Highs. Buy the Dip.,yahoofinance,2020-12-30 14:42:21
Is Nio Stock A Buy As China EV Leader Rebounds Bullishly Ahead Of Big Annual Event?,yahoofinance,2020-12-30 14:42:21
BABA Stock: Potential 69% Return With This Bull Put Spread,yahoofinance,2020-12-30 14:42:21
Penny Stocks to Watch for January 2021,yahoofinance,2020-12-30 14:42:21
Time to Buy the Dip in fuboTV Stock? Analyst Weighs In,yahoofinance,2020-12-30 14:42:21
"How to Retire in Norway: Costs, Visas and More",yahoofinance,2020-12-30 14:42:21
"Dow Jones Rallies As Stimulus-Check Battle Continues; Apple Eyes Buy Point, While Nio, Tesla Jump",yahoofinance,2020-12-30 14:42:21
Myovant Shares Soar on $4.2 Billion Development Collaboration with Pfizer; Target Price $42,yahoofinance,2020-12-30 14:42:21
"Goldman’s Sheila Patel, Chairman of $1.8 Trillion Manager, to Retire",yahoofinance,2020-12-30 14:42:21
"AMC, Fighting Bankruptcy, to Offer 50 Million More Shares",yahoofinance,2020-12-30 14:42:21
Tesla Q4 Delivery Figures Could ‘Handily’ Beat Estimates,yahoofinance,2020-12-30 14:42:21
"Be Careful, Breadth Is Weakening and Warning Signs Are Starting to Appear",yahoofinance,2020-12-30 14:42:21
Charles Schwab vs. TD Ameritrade: Which Is Best?,yahoofinance,2020-12-30 14:42:21
9 Things You Didn't Know Were Tax Deductions,yahoofinance,2020-12-30 14:42:21
"How to Retire in Taiwan: Costs, Visas and More",yahoofinance,2020-12-30 14:42:21
GILD Stock: Using Options To Buy The Stock At A 7% Discount,yahoofinance,2020-12-30 14:42:21
Is My Stimulus Check Taxable Income? Will It Reduce My Tax Return? What to Know.,yahoofinance,2020-12-30 14:42:21
"Is Ford Stock A Buy Now As Earnings, Shares Rebound?",yahoofinance,2020-12-30 14:42:21
Return On Capital Employed Overview: Bionano Genomics,yahoofinance,2020-12-30 14:42:21
Furlough vs. Layoff: What's the Difference for Your Taxes?,yahoofinance,2020-12-30 14:42:21
"Is QQQ Stock A Buy Right Now? Here's What Earnings, Charts Show",yahoofinance,2020-12-30 14:42:21
Warren Buffett Called Bitcoin 'Rat Poison' — Now It's Closing In On Berkshire Hathaway's Valuation,yahoofinance,2020-12-30 14:42:21
Merck Had a Disappointing 2020. Why Its Strategy Could Pay Off in 2021.,yahoofinance,2020-12-30 14:42:21
"Here’s How to Prepare Your Portfolio for the New Year, According to Charles Schwab’s Liz Ann Sonders",yahoofinance,2020-12-30 14:42:21
"Velodyne Lidar: Primed to Lead in the Age of Autonomy, Say Analysts",yahoofinance,2020-12-30 14:42:21
Alibaba's Jack Ma Now Trails Pinduoduo And Tencent CEOs In Wealth,yahoofinance,2020-12-30 14:42:21
Investors Lose $609 Billion On 8 Giant Stocks This Year,yahoofinance,2020-12-30 14:42:21
Canadian cannabis company Sundial acquires special purpose vehicle for about $46 million,yahoofinance,2020-12-30 14:42:21
Analysis-Intel has few good options as investor demands break-up,yahoofinance,2020-12-30 14:42:21
Cathie Wood’s Flagship Fund Posts Largest Outflow on Record,yahoofinance,2020-12-30 14:42:21
"Is IBM Stock A Buy Right Now? Here's What Earnings, Charts Show",yahoofinance,2020-12-30 14:42:21
Analysts See More Gains for Chip Stocks. Here Are Their Top Picks.,yahoofinance,2020-12-30 14:42:21
"Is BYND Stock A Buy? Here's What Beyond Meat Earnings, Chart Show",yahoofinance,2020-12-30 14:42:21
Will Nvidia Or Micron Stock Grow More By 2022?,yahoofinance,2020-12-30 14:42:21
More store closings in 2021? These are the most vulnerable major retailers of 2021 as pandemic continues,yahoofinance,2020-12-30 14:42:21
Apple stock's stunning 2020 in three stats,yahoofinance,2020-12-30 14:42:21
Is Shopify Stock A Buy After Coming Off Record High?,yahoofinance,2020-12-30 14:42:21
Make these 8 money moves today to get the new year off to a strong start,yahoofinance,2020-12-30 14:42:21
Graham Holdings Is One of Barron’s Top Stock Picks for the New Year. Here’s Why.,yahoofinance,2020-12-30 14:42:21
Tesla’s Dominant Position in China Could Be Threatened Next Year,yahoofinance,2020-12-30 14:42:21
How To Combat Depression After Retirement,yahoofinance,2020-12-30 14:42:21
"Bitcoin Rally Likely To Peak Out In Coming Weeks, Says Technical Analyst",yahoofinance,2020-12-30 14:42:21
Eaton Is One of Barron’s Top Stock Picks for the New Year. Here’s Why.,yahoofinance,2020-12-30 14:42:21
Is Chevron Stock A Buy Now As Oil Markets Look To 2021?,yahoofinance,2020-12-30 14:42:21
Tata grabs bigger slice of AirAsia and India's airline industry,yahoofinance,2020-12-30 14:42:21
"Now that Trump has signed the stimulus checks bill, when do you get your cash?",yahoofinance,2020-12-30 14:42:21
Beyond Cannabis: How This German Company Is Disrupting The Cannabis Market,yahoofinance,2020-12-30 14:42:21
"Moderna Makes COVID-19 Vaccine Available To Board, Staff, And Contractors On Priority",yahoofinance,2020-12-30 14:42:21
5 Value Stocks In The Technology Sector,yahoofinance,2020-12-30 14:42:21
Wrong-Way Bet on Covid Is Changing Oil-Trading Industry Forever,yahoofinance,2020-12-30 14:42:21
Mizuho's Top Semiconductor Stocks For 2021: Do You Own Them?,yahoofinance,2020-12-30 14:42:21
IBD 50 Stocks To Watch: No. 2-Ranked Semiconductor Stock In A Buy Range,yahoofinance,2020-12-30 14:42:21
Gold Rebound Pauses As Investors Await Two Key Signals,yahoofinance,2020-12-30 14:42:21
Cannabis Countdown: Top 10 Marijuana And Psychedelic Stock News Stories Of The Week,yahoofinance,2020-12-30 14:42:21
Deutsche Bank’s 2021 Outlook: 3 Stocks to Buy,yahoofinance,2020-12-30 14:42:21
"Yes, the stock market’s looking like the dot-com bubble — no, it’s not time to sell, strategist says",yahoofinance,2020-12-30 14:42:21
Wall Street Is Pounding The Table For These Semiconductor Stocks,yahoofinance,2020-12-30 14:42:21
SolarWinds or Datadog: Which Tech Stock Has Higher Upside Potential?,yahoofinance,2020-12-30 14:42:21
Cisco Had a Rough 2020. Here’s How the Stock Could Rebound in 2021.,yahoofinance,2020-12-30 14:42:21
ROCE Insights For Biolase,yahoofinance,2020-12-30 14:42:21
"Is Etsy Stock A Buy Right Now? Here's What Earnings, Charts Show",yahoofinance,2020-12-30 14:42:21
Big Data Companies And Data Analytics: The Stocks To Buy And Watch,yahoofinance,2020-12-30 14:42:21
Tesla: Soaring share price creates army of 'Teslanaires',yahoofinance,2020-12-30 14:42:21
"Record 5G Spectrum Auction Pauses As Investors Mull Verizon, AT&T, Comcast Bidding",yahoofinance,2020-12-30 14:42:21
China's Yahua agrees five-year deal to supply lithium to Tesla,yahoofinance,2020-12-30 14:42:21
"WDC Stock: Is It A Buy Right Now? Here's What Earnings, Western Digital Stock Charts Show",yahoofinance,2020-12-30 14:42:21
Is WBA Stock A Buy Ahead Of Earnings Report While Vaccines Roll Out?,yahoofinance,2020-12-30 14:42:21
Are Your Financial Advisor Fees Tax Deductible?,yahoofinance,2020-12-30 14:42:21
China EV Maker Inks Deal With State-Owned Bank Amid Beijing Crackdown,yahoofinance,2020-12-30 14:42:21
Apple Stock Hits Record High On Bullish 2021 Prediction,yahoofinance,2020-12-30 14:42:21
"Tesla On Track To Beat Its Ambitious Delivery Target Of 500,000 Deliveries For 2020, Says Wedbush",yahoofinance,2020-12-30 14:42:21
Scandal-battered utility now faces specter of pricy lawsuits,yahoofinance,2020-12-30 14:42:21
Wealthfront vs. Vanguard: Which Is Best for You?,yahoofinance,2020-12-30 14:42:21
"China-U.S. ties hold up property deal with Hong Kong consulate, Hang Lung says",yahoofinance,2020-12-30 14:42:21
U.K. Authorizes AstraZeneca-Oxford Covid-19 Vaccine,wsj,2020-12-30 14:44:54
Bumpy Partnership Hangs Over AstraZeneca-Oxford Vaccine’s Future,wsj,2020-12-30 14:44:54
Police Received Warning About Nashville Bombing Suspect in 2019,wsj,2020-12-30 14:44:54
"Global Digital-Tax Detente Ends, as U.S. and France Exchange Blows",wsj,2020-12-30 14:44:54
"Pandemic Boosted Netflix, Other Streaming Players in 2020",wsj,2020-12-30 14:44:54
Record IPO Surge Set to Roll On,wsj,2020-12-30 14:44:54
"Yes, It Is Possible to Have Too Much Stimulus",wsj,2020-12-30 14:44:54
Xi’s China Crafts Campaign to Boost Youth Patriotism,wsj,2020-12-30 14:44:54
Boston Businesses Struggle in Pandemic ‘Ghost Town’,wsj,2020-12-30 14:44:54
"The Missing 100,000: Quest to Establish the Real Death Toll",wsj,2020-12-30 14:44:54
Dry January Will Be Wetter Than Ever,wsj,2020-12-30 14:44:54
Argentina Makes Abortion Legal in Landmark Vote,wsj,2020-12-30 14:44:54
Post-Vaccine Vacation Dreamers Plot to ‘Get the Hell Out of Their House’,wsj,2020-12-30 14:44:54
The Year in Pictures,wsj,2020-12-30 14:44:54
"Banks Pile Into Government Debt, Setting Up ‘Doom Loop’ Sequel in Europe",wsj,2020-12-30 14:44:54
Fed Panel Gets New Members Amid Uncertain Outlook,wsj,2020-12-30 14:44:54
"Uber, Gig Companies Seek Labor Deals to Avoid Workers Becoming Employees",wsj,2020-12-30 14:44:54
LVMH and Tiffany to Have Short Honeymoon,wsj,2020-12-30 14:44:54
"Hyundai, Kia Pick Up Speed in 2020",wsj,2020-12-30 14:44:54
"Biden, Trump to Campaign in Georgia Senate Runoffs",wsj,2020-12-30 14:44:54
Yemen Airport Attack Kills 22 as New Saudi-Backed Government Arrives,wsj,2020-12-30 14:44:54
"U.K. Lawmakers Approve Brexit Trade Deal, Cementing EU Exit",wsj,2020-12-30 14:44:54
Why Four Teams Dominate the College Football Playoff,wsj,2020-12-30 14:44:54
Don’t Want to Go (Entirely) Meatless? Try These Recipes,wsj,2020-12-30 14:44:54
English Soccer Scrambles to Reschedule,wsj,2020-12-30 14:44:54
Three Ways to Hibernate in Vermont During Covid,wsj,2020-12-30 14:44:54
"As 2020 Limps to an End, Ad Executives Look Warily to 2021",wsj,2020-12-30 14:44:54
The Regulatory Issues Madison Avenue May Face in 2021,wsj,2020-12-30 14:44:54
Super Bowl Advertisers Gravitate to Humor in a Hard Time,wsj,2020-12-30 14:44:54
"Shift Gears, Accelerate: CIOs Reordered IT Priorities in 2020",wsj,2020-12-30 14:44:54
"Post-Pandemic, Office Life May Never Be the Same, CIOs Say",wsj,2020-12-30 14:44:54
Nashville Bombing Exposes Weak Point for Business Communications,wsj,2020-12-30 14:44:54
Finance Executives Look to Advance Libor Transition in 2021,wsj,2020-12-30 14:44:54
Barnes & Noble Education CFO Eyes More Cuts as Campuses Remain Closed,wsj,2020-12-30 14:44:54
CFOs Share Their Favorite Reads of 2020,wsj,2020-12-30 14:44:54
Defense Bill Proposes to Expand SEC’s Authority in Seeking Disgorgement,wsj,2020-12-30 14:44:54
Treasury Warns Banks of Covid-19 Vaccine Fraud,wsj,2020-12-30 14:44:54
"Money Laundering Watchdog Turns Focus to Digital Tools, Extremism",wsj,2020-12-30 14:44:54
Radial Looks to Build on a Year of Frantic Logistics Growth,wsj,2020-12-30 14:44:54
Shipping Faces New Turmoil in European Emissions Trading Plan,wsj,2020-12-30 14:44:54
Logistics Report: Delivering More Doses; Crackdown on Alibaba; Peloton’s Faster Gear,wsj,2020-12-30 14:44:54
JPMorgan Chase Stock Is a Beaten-Down Bet on Better Times,wsj,2020-12-30 14:44:54
Tesla Q4 Delivery Figures Could ‘Handily’ Beat Estimates,wsj,2020-12-30 14:44:54
Worldwise: Aerin Lauder’s Favorite Things,wsj,2020-12-30 14:44:54
Ireland extends strict lockdown to Jan. 31 as COVID-19 cases rise,wsj,2020-12-30 14:44:54
Gift annuities help charities and give you tax breaks and annual return,wsj,2020-12-30 14:44:54
