headline,org,date
Reddit Ignites Mall Stock and Fund Cashes Out $500 Million,msnmoney,2021-01-29 09:09:29
50 Brands With Lifetime Warranties,msnmoney,2021-01-29 09:09:29
Luxury Assisted Living Near Arlington Might Have Seniors Packing Their Bags,msnmoney,2021-01-29 09:09:29
3 Scary Healthcare Facts That a Retirement HSA Could Remedy,msnmoney,2021-01-29 09:09:29
How Oprah and These Other Big-Name Celebs Made Their Fortunes,msnmoney,2021-01-29 09:09:29
Woman Fixes Poor Posture And Back Pain With Simple Trick,msnmoney,2021-01-29 09:09:29
Don’t be a pig — GameStop advice as Robinhood reopens the spigot,msnmoney,2021-01-29 09:09:29
Saving strategies that could cost you money,msnmoney,2021-01-29 09:09:29
Guide to Walmart Pay,msnmoney,2021-01-29 09:09:29
Expert: “This credit card is so good I signed up personally”,msnmoney,2021-01-29 09:09:29
7 Products With Big Price Spikes on Amazon During the Pandemic,msnmoney,2021-01-29 09:09:29
"Before you renew Amazon Prime, read this",msnmoney,2021-01-29 09:09:29
Dow Futures Slump As GameStop Short Squeeze Stokes Risk Concern; Johnson & Johnson Vaccine Disappoints,msnmoney,2021-01-29 09:09:29
This Is the Worst COVID-19 Hot Spot in Each State,msnmoney,2021-01-29 09:09:29
"Wall Street Is Volatile, But How Safe Is Your 401(K)?",msnmoney,2021-01-29 09:09:29
"The secrets behind Listerine, Adidas and more brands",msnmoney,2021-01-29 09:09:29
Avoid These 4 Common but COSTLY Retirement Income Mistakes,msnmoney,2021-01-29 09:09:29
Seniors Are Getting These Unsold 2020 SUVs For Dirt Cheap,msnmoney,2021-01-29 09:09:29
15 Cities With the Most Minority-Owned Startups,msnmoney,2021-01-29 09:09:29
Will the Biden Administration Continue to Give U.S. Bank Stocks a Shot in the Arm?,msnmoney,2021-01-29 09:09:29
Awesome vacation rentals that are perfect for pups,msnmoney,2021-01-29 09:09:29
Shockingly expensive abandoned mansions,msnmoney,2021-01-29 09:09:29
Why You Shouldn’t Do Your Own Taxes Anymore,msnmoney,2021-01-29 09:09:29
Sean Connery's Old Mansion is Unsellable and it's No Secret Why,msnmoney,2021-01-29 09:09:29
"Parler registered 7,029 new users per minute during the November election, say Stanford researchers",msnmoney,2021-01-29 09:09:29
These 10 Countries Pay Less in Taxes Than Americans,msnmoney,2021-01-29 09:09:29
How communication tools can fuel burnout—and what to do about it,msnmoney,2021-01-29 09:09:29
Don’t Fall For One of the ‘Dirty Dozen’ Tax Scams,msnmoney,2021-01-29 09:09:29
"No tuna in Subway's tuna sandwiches, lawsuit claims",msnmoney,2021-01-29 09:09:29
16 Silly Things People Are Wasting Their Money On (Bet You're Guilty Too),msnmoney,2021-01-29 09:09:29
Secrets on Your Tax Forms That Could Ruin You,msnmoney,2021-01-29 09:09:29
Peek inside the Hemsworth brothers' Malibu home,msnmoney,2021-01-29 09:09:29
5 Cheap Pantry Items To Keep on Hand in 2021,msnmoney,2021-01-29 09:09:29
Lilly Earnings Beat Estimates as Covid Antibody Sales Take Off,msnmoney,2021-01-29 09:09:29
Never Too Early: A Parents’ Guide To Teaching Your Kids About Money,msnmoney,2021-01-29 09:09:29
Best & Worst Refinance Mortgage Companies of 2021,msnmoney,2021-01-29 09:09:29
Get the best price on a new home—here's how,msnmoney,2021-01-29 09:09:29
50 Highest-Paying Jobs With No Experience Required,msnmoney,2021-01-29 09:09:29
SpaceX is being investigated by the Department of Justice over alleged hiring discrimination,msnmoney,2021-01-29 09:09:29
25 Ways the Coronavirus Has Upended the Auto Industry Across the Globe,msnmoney,2021-01-29 09:09:29
How to turn your recipes into cash,msnmoney,2021-01-29 09:09:29
Forget Expensive Roofing (Do This Instead),msnmoney,2021-01-29 09:09:29
The most memorable advertising characters ever,msnmoney,2021-01-29 09:09:29
Opinion: I'm one of the 1%. We should support Biden in raising our taxes,msnmoney,2021-01-29 09:09:29
Stocks To Keep in Your Portfolio for the Next 30 Years,msnmoney,2021-01-29 09:09:29
5 Things That Make Life More Meaningful for Retirees,msnmoney,2021-01-29 09:09:29
These Elite Colleges Went Virtual — But Raised Tuition Anyway,msnmoney,2021-01-29 09:09:29
1 Simple Trick to Cut Your Electric Bill by 90%,msnmoney,2021-01-29 09:09:29
"Here are the biggest short squeezes in the stock market, including GameStop and AMC",msnmoney,2021-01-29 09:09:29
The 10 Best Closed-End Funds (CEFs) for 2021,msnmoney,2021-01-29 09:09:29
22 Filthy Rich People Who Will Give Away Their Fortunes,msnmoney,2021-01-29 09:09:29
45 Jobs That Can Make You a Millionaire Before Retirement,msnmoney,2021-01-29 09:09:29
Southeastern Grocers postpones planned IPO,msnmoney,2021-01-29 09:09:29
Insanely Cool Dog Toy That Keeps Your Pet Fit,msnmoney,2021-01-29 09:09:29
7 Money Moves To Make When Starting a New Job,msnmoney,2021-01-29 09:09:29
Top places for Americans to retire to in 2021,msnmoney,2021-01-29 09:09:29
50 Ways You’re Throwing Money Away,msnmoney,2021-01-29 09:09:29
"Canada’s EV Agenda Gets Supercharged by Biden, Ford, and GM Green Plans",msnmoney,2021-01-29 09:09:29
"Mountain Dew, moonshine, and more secret brand histories",msnmoney,2021-01-29 09:09:29
Billionaire Shanghvi’s Sun Jumps as Profit Beats All Estimates,msnmoney,2021-01-29 09:09:29
Sean Connery's Old Mansion is Unsellable and it's No Secret Why,msnmoney,2021-01-29 09:09:29
How to prepare for the post-pandemic dining scene,msnmoney,2021-01-29 09:09:29
"$2.3 Billion Battery Plant Planned for Hungary, Europe’s Largest",msnmoney,2021-01-29 09:09:29
7 Top Costly Mistakes Investors Made Last Year,msnmoney,2021-01-29 09:09:29
"H&M Warns Profit Outlook Has Worsened on Lockdowns, Discounts",msnmoney,2021-01-29 09:09:29
"Absolutely Massive Homes Listed for Less Than $100,000",msnmoney,2021-01-29 09:09:29
Gigi Hadid's New York pad and other supermodel homes,msnmoney,2021-01-29 09:09:29
Little-Known Trick For Gutters,msnmoney,2021-01-29 09:09:29
The 50 Cities Best Prepared To Reignite Their Economy and Job Market,msnmoney,2021-01-29 09:09:29
"Farming, seen as a cause and victim of climate change, is seeing radical new tech drive innovation",msnmoney,2021-01-29 09:09:29
See What a $100K Salary Looks Like After Taxes in Your State,msnmoney,2021-01-29 09:09:29
This Is the Best Company To Work for in Indiana,msnmoney,2021-01-29 09:09:29
10 Cities With the Best Work-Life Balance for 2021,msnmoney,2021-01-29 09:09:29
"Daimler, BMW and VW Get Little Credit for All the Cash Piling In",msnmoney,2021-01-29 09:09:29
Reddit Ignites Mall Stock and Fund Cashes Out $500 Million,msnmoney,2021-01-29 09:09:29
50 Brands With Lifetime Warranties,msnmoney,2021-01-29 09:09:29
Luxury Assisted Living Near Arlington Might Have Seniors Packing Their Bags,msnmoney,2021-01-29 09:09:29
3 Scary Healthcare Facts That a Retirement HSA Could Remedy,msnmoney,2021-01-29 09:09:29
How Oprah and These Other Big-Name Celebs Made Their Fortunes,msnmoney,2021-01-29 09:09:29
Woman Fixes Poor Posture And Back Pain With Simple Trick,msnmoney,2021-01-29 09:09:29
Don’t be a pig — GameStop advice as Robinhood reopens the spigot,msnmoney,2021-01-29 09:09:29
Saving strategies that could cost you money,msnmoney,2021-01-29 09:09:29
Guide to Walmart Pay,msnmoney,2021-01-29 09:09:29
Expert: “This credit card is so good I signed up personally”,msnmoney,2021-01-29 09:09:29
7 Products With Big Price Spikes on Amazon During the Pandemic,msnmoney,2021-01-29 09:09:29
"Before you renew Amazon Prime, read this",msnmoney,2021-01-29 09:09:29
Dow Futures Slump As GameStop Short Squeeze Stokes Risk Concern; Johnson & Johnson Vaccine Disappoints,msnmoney,2021-01-29 09:09:29
This Is the Worst COVID-19 Hot Spot in Each State,msnmoney,2021-01-29 09:09:29
"Wall Street Is Volatile, But How Safe Is Your 401(K)?",msnmoney,2021-01-29 09:09:29
"The secrets behind Listerine, Adidas and more brands",msnmoney,2021-01-29 09:09:29
Avoid These 4 Common but COSTLY Retirement Income Mistakes,msnmoney,2021-01-29 09:09:29
Seniors Are Getting These Unsold 2020 SUVs For Dirt Cheap,msnmoney,2021-01-29 09:09:29
15 Cities With the Most Minority-Owned Startups,msnmoney,2021-01-29 09:09:29
Will the Biden Administration Continue to Give U.S. Bank Stocks a Shot in the Arm?,msnmoney,2021-01-29 09:09:29
Awesome vacation rentals that are perfect for pups,msnmoney,2021-01-29 09:09:29
Shockingly expensive abandoned mansions,msnmoney,2021-01-29 09:09:29
Why You Shouldn’t Do Your Own Taxes Anymore,msnmoney,2021-01-29 09:09:29
Sean Connery's Old Mansion is Unsellable and it's No Secret Why,msnmoney,2021-01-29 09:09:29
"Parler registered 7,029 new users per minute during the November election, say Stanford researchers",msnmoney,2021-01-29 09:09:29
These 10 Countries Pay Less in Taxes Than Americans,msnmoney,2021-01-29 09:09:29
How communication tools can fuel burnout—and what to do about it,msnmoney,2021-01-29 09:09:29
Don’t Fall For One of the ‘Dirty Dozen’ Tax Scams,msnmoney,2021-01-29 09:09:29
"No tuna in Subway's tuna sandwiches, lawsuit claims",msnmoney,2021-01-29 09:09:29
16 Silly Things People Are Wasting Their Money On (Bet You're Guilty Too),msnmoney,2021-01-29 09:09:29
Secrets on Your Tax Forms That Could Ruin You,msnmoney,2021-01-29 09:09:29
Peek inside the Hemsworth brothers' Malibu home,msnmoney,2021-01-29 09:09:29
5 Cheap Pantry Items To Keep on Hand in 2021,msnmoney,2021-01-29 09:09:29
Lilly Earnings Beat Estimates as Covid Antibody Sales Take Off,msnmoney,2021-01-29 09:09:29
Never Too Early: A Parents’ Guide To Teaching Your Kids About Money,msnmoney,2021-01-29 09:09:29
Best & Worst Refinance Mortgage Companies of 2021,msnmoney,2021-01-29 09:09:29
Get the best price on a new home—here's how,msnmoney,2021-01-29 09:09:29
50 Highest-Paying Jobs With No Experience Required,msnmoney,2021-01-29 09:09:29
SpaceX is being investigated by the Department of Justice over alleged hiring discrimination,msnmoney,2021-01-29 09:09:29
25 Ways the Coronavirus Has Upended the Auto Industry Across the Globe,msnmoney,2021-01-29 09:09:29
How to turn your recipes into cash,msnmoney,2021-01-29 09:09:29
Forget Expensive Roofing (Do This Instead),msnmoney,2021-01-29 09:09:29
The most memorable advertising characters ever,msnmoney,2021-01-29 09:09:29
Opinion: I'm one of the 1%. We should support Biden in raising our taxes,msnmoney,2021-01-29 09:09:29
Stocks To Keep in Your Portfolio for the Next 30 Years,msnmoney,2021-01-29 09:09:29
5 Things That Make Life More Meaningful for Retirees,msnmoney,2021-01-29 09:09:29
These Elite Colleges Went Virtual — But Raised Tuition Anyway,msnmoney,2021-01-29 09:09:29
1 Simple Trick to Cut Your Electric Bill by 90%,msnmoney,2021-01-29 09:09:29
"Here are the biggest short squeezes in the stock market, including GameStop and AMC",msnmoney,2021-01-29 09:09:29
The 10 Best Closed-End Funds (CEFs) for 2021,msnmoney,2021-01-29 09:09:29
22 Filthy Rich People Who Will Give Away Their Fortunes,msnmoney,2021-01-29 09:09:29
45 Jobs That Can Make You a Millionaire Before Retirement,msnmoney,2021-01-29 09:09:29
Southeastern Grocers postpones planned IPO,msnmoney,2021-01-29 09:09:29
Insanely Cool Dog Toy That Keeps Your Pet Fit,msnmoney,2021-01-29 09:09:29
7 Money Moves To Make When Starting a New Job,msnmoney,2021-01-29 09:09:29
Top places for Americans to retire to in 2021,msnmoney,2021-01-29 09:09:29
50 Ways You’re Throwing Money Away,msnmoney,2021-01-29 09:09:29
"Canada’s EV Agenda Gets Supercharged by Biden, Ford, and GM Green Plans",msnmoney,2021-01-29 09:09:29
"Mountain Dew, moonshine, and more secret brand histories",msnmoney,2021-01-29 09:09:29
Billionaire Shanghvi’s Sun Jumps as Profit Beats All Estimates,msnmoney,2021-01-29 09:09:29
Sean Connery's Old Mansion is Unsellable and it's No Secret Why,msnmoney,2021-01-29 09:09:29
How to prepare for the post-pandemic dining scene,msnmoney,2021-01-29 09:09:29
"$2.3 Billion Battery Plant Planned for Hungary, Europe’s Largest",msnmoney,2021-01-29 09:09:29
7 Top Costly Mistakes Investors Made Last Year,msnmoney,2021-01-29 09:09:29
"H&M Warns Profit Outlook Has Worsened on Lockdowns, Discounts",msnmoney,2021-01-29 09:09:29
"Absolutely Massive Homes Listed for Less Than $100,000",msnmoney,2021-01-29 09:09:29
Gigi Hadid's New York pad and other supermodel homes,msnmoney,2021-01-29 09:09:29
Little-Known Trick For Gutters,msnmoney,2021-01-29 09:09:29
The 50 Cities Best Prepared To Reignite Their Economy and Job Market,msnmoney,2021-01-29 09:09:29
"Farming, seen as a cause and victim of climate change, is seeing radical new tech drive innovation",msnmoney,2021-01-29 09:09:29
See What a $100K Salary Looks Like After Taxes in Your State,msnmoney,2021-01-29 09:09:29
This Is the Best Company To Work for in Indiana,msnmoney,2021-01-29 09:09:29
10 Cities With the Best Work-Life Balance for 2021,msnmoney,2021-01-29 09:09:29
"Daimler, BMW and VW Get Little Credit for All the Cash Piling In",msnmoney,2021-01-29 09:09:29
The GameStop saga finds its villain,yahoofinance,2021-01-29 09:11:24
"Stock futures fall, looking to end the week lower",yahoofinance,2021-01-29 09:11:24
Robinhood pauses instant buying of crypto currencies,yahoofinance,2021-01-29 09:11:24
'I vividly remember': Redditors recall growing up during recession,yahoofinance,2021-01-29 09:11:24
AMC analyst on short seller squeeze: things will ‘revert back to some type of normality’,yahoofinance,2021-01-29 09:11:24
Price is the only truth that matters in this world: veteran trader,yahoofinance,2021-01-29 09:11:24
Poll: 40% Americans ready to attend sports event,yahoofinance,2021-01-29 09:11:24
Richest 20% of America are the real supersavers,yahoofinance,2021-01-29 09:11:24
"Arlington, Virginia: Why Americans Are Revisiting Their Insurance..",yahoofinance,2021-01-29 09:11:24
Who’s the next GameStop? These are the 10 most shorted stocks,yahoofinance,2021-01-29 09:11:24
"Bitcoin Investors May Lose Everything, Central Banker Warns",yahoofinance,2021-01-29 09:11:24
What minimum wage increases did to McDonald’s restaurants — and their employees,yahoofinance,2021-01-29 09:11:24
'I vividly remember': Redditors cheering on market mayhem recall growing up amid the Great Recession,yahoofinance,2021-01-29 09:11:24
"Dow Jones Futures Tumble On J&J Vaccine News; GME Stock, Apple Chipmaker, Novavax Soar",yahoofinance,2021-01-29 09:11:24
The GameStop saga finds its villain: Morning Brief,yahoofinance,2021-01-29 09:11:24
Silver Is the Latest Market Hit by Reddit Day-Trader Frenzy,yahoofinance,2021-01-29 09:11:24
Tiny Driller Skyrockets 959% After Reddit Craze Spreads to Oil,yahoofinance,2021-01-29 09:11:24
Lawmakers announce hearings on GameStop and online trading platforms,yahoofinance,2021-01-29 09:11:24
GameStop: Meet the amateur traders fighting Wall Street,yahoofinance,2021-01-29 09:11:24
"Time to Turn Bullish on These 2 Oil Stocks, Says Raymond James",yahoofinance,2021-01-29 09:11:24
Silver rallies after Reddit post about executing a ‘short squeeze’,yahoofinance,2021-01-29 09:11:24
"These 2 Penny Stocks Could Rally All the Way to $11, Say Analysts",yahoofinance,2021-01-29 09:11:24
Apple Had a Huge Quarter. Why the Stock Is Down Anyway.,yahoofinance,2021-01-29 09:11:24
'How free exactly is the market?' asks WallStreetBets founder  ,yahoofinance,2021-01-29 09:11:24
Ericsson tops forecasts as 5G lifts off,yahoofinance,2021-01-29 09:11:24
Chevron Posts Surprise Loss As Revenue Also Misses,yahoofinance,2021-01-29 09:11:24
"With Natural Gas in Peril, Pipeline Owners Look to Hydrogen",yahoofinance,2021-01-29 09:11:24
The somewhat boring reason it appears that Robinhood yanked trading on some securities,yahoofinance,2021-01-29 09:11:24
"Blockchain Bites: DOGE Chases After GameStop, Guggenheim Doubts $30K Bitcoin",yahoofinance,2021-01-29 09:11:24
"Get ready for a 10% stock drop, driven by the 3 ‘Rs,’ warns Bank of America",yahoofinance,2021-01-29 09:11:24
How WallStreetBets Is Fueling A Rally In Silver Stocks,yahoofinance,2021-01-29 09:11:24
Robinhood Raises $1 Billion in Dash for Cash After Trader Revolt,yahoofinance,2021-01-29 09:11:24
"Stock market news live updates: Stock futures fall, looking to end the week lower",yahoofinance,2021-01-29 09:11:24
EV Battery Start-Up QuantumScape Is Driven Solely by Promise,yahoofinance,2021-01-29 09:11:24
Mark Cuban’s Advice for Day Traders Who ‘Get Long and Get Loud’,yahoofinance,2021-01-29 09:11:24
How AMC and Naked Brands Are Seizing on the Short Squeeze to Raise Cash,yahoofinance,2021-01-29 09:11:24
"Apple Stock, AMD Stock Among Leaders In Reach With This Top Tech Play",yahoofinance,2021-01-29 09:11:24
It isn’t just GameStop: Here are some of the other heavily shorted stocks shooting higher,yahoofinance,2021-01-29 09:11:24
Hedge-Fund Titans Lose Billions to Reddit Traders Running Amok,yahoofinance,2021-01-29 09:11:24
Bitcoin Shoots Up 11%: Did Elon Musk-Dogecoin Boost Help?,yahoofinance,2021-01-29 09:11:24
Reddit-Fueled Rally In Mall Stock Allows Its Largest Investor To Cash Out,yahoofinance,2021-01-29 09:11:24
Electric-vehicle firm Faraday Future to go public via $3.4 billion SPAC deal,yahoofinance,2021-01-29 09:11:24
"Fastest-Growing Stocks To Watch: Etsy, Crocs Among 17 Stocks Expecting Up To 966% Growth",yahoofinance,2021-01-29 09:11:24
Reddit Ignites Mall Stock and Fund Cashes Out $500 Million,yahoofinance,2021-01-29 09:11:24
Billionaire David Tepper says ‘gangup.inc’ war on shorts might not end well for stock-market investors,yahoofinance,2021-01-29 09:11:24
How new Treasury Secretary Janet Yellen will impact retirement in the future,yahoofinance,2021-01-29 09:11:24
Is AMD Stock A Buy After Chipmaker's Fourth-Quarter Earnings Report?,yahoofinance,2021-01-29 09:11:24
Rite Aid Joins Elite Club Of Stocks With RS Ratings Over 90,yahoofinance,2021-01-29 09:11:24
"Chevron Posts Surprise Loss on Refining, Noble Deal Charges",yahoofinance,2021-01-29 09:11:24
"Here are the biggest short squeezes in the stock market, including GameStop and AMC",yahoofinance,2021-01-29 09:11:24
"Siebert Financial stock rockets nearly 5-fold on heavy volume, with no news released",yahoofinance,2021-01-29 09:11:24
Looking Into Inovio Pharmaceuticals's Return On Capital Employed,yahoofinance,2021-01-29 09:11:24
Eli Lilly Stock Rises Near Highs As Lilly Earnings Beat Views,yahoofinance,2021-01-29 09:11:24
Caterpillar Sees Housing Boom Leading 2021 Sales Recovery,yahoofinance,2021-01-29 09:11:24
GM Drops an EV Bomb. What It Means for the Auto Industry and Other EV Makers.,yahoofinance,2021-01-29 09:11:24
Not All Retirement Accounts Should Be Tax-Deferred,yahoofinance,2021-01-29 09:11:24
Major GameStop Shareholder Sells Entire Stake,yahoofinance,2021-01-29 09:11:24
"Does Modest Share Price Make Carnival Stock A Buy Right Now? Here's What Earnings, Charts Show",yahoofinance,2021-01-29 09:11:24
Silver Drives Higher in Jittery Trade After Reddit Options Chaos,yahoofinance,2021-01-29 09:11:24
Biden Could Send Electric Vehicle Stocks Soaring,yahoofinance,2021-01-29 09:11:24
Electric Car Wars: Who Will Come Out on Top?,yahoofinance,2021-01-29 09:11:24
AMC Considers Selling More Stock Amid Reddit-Fueled Rally,yahoofinance,2021-01-29 09:11:24
FTX Exchange Lists WallStreetBets Futures to Capitalize on Investing Movement,yahoofinance,2021-01-29 09:11:24
"Koss stock surges 45% after hours following quarterly profit, Robinhood change",yahoofinance,2021-01-29 09:11:24
"Webull, M1 and Public remove restrictions on 'meme stocks' after citing trade settlement firm as the cause",yahoofinance,2021-01-29 09:11:24
"Robinhood Hits American Airlines Stock After Big Spike, Q4 Results; Southwest Up",yahoofinance,2021-01-29 09:11:24
"GameStop, Robinhood, Novavax, Dogecoin - 5 Things You Must Know Friday",yahoofinance,2021-01-29 09:11:24
Apple Analysts Lift Price Targets Following 'Jaw Dropper' Q1: 4 Sell-Side Takes,yahoofinance,2021-01-29 09:11:24
Penny Stocks to Watch for February 2021,yahoofinance,2021-01-29 09:11:24
"Charter sees customer growth slow, stock falls after earnings",yahoofinance,2021-01-29 09:11:24
"Yes, Elon Musk Still Hates Short Sellers",yahoofinance,2021-01-29 09:11:24
Vegas Mall That Lost 95% of Value Might Be Just the Beginning,yahoofinance,2021-01-29 09:11:24
"WallStreetBets Fever Hits Dogecoin, Price Soars 142%",yahoofinance,2021-01-29 09:11:24
Infrastructure Stocks and Funds Offer Solid Dividend Yields. Here’s Where to Look.,yahoofinance,2021-01-29 09:11:24
Here’s Another Way to Find the Next Potential Short Squeeze,yahoofinance,2021-01-29 09:11:24
"Apple’s Sales Grow 21% in Latest Quarter, and Two More Numbers to Know",yahoofinance,2021-01-29 09:11:24
Silver Seizes the Spotlight Following Reddit Day-Trader Frenzy,yahoofinance,2021-01-29 09:11:24
"'This is unacceptable': AOC, Ted Cruz and others side with retail investors, slam Robinhood and Wall Street amid GameStop mania",yahoofinance,2021-01-29 09:11:24
Caterpillar Earnings Top Q4 Estimates; CAT Stock Rises Near Early Entry,yahoofinance,2021-01-29 09:11:24
"Chip Shortages Hinder Automobile, PC, Consumer Electronics Production",yahoofinance,2021-01-29 09:11:24
Electric Vehicles Are On Fire,yahoofinance,2021-01-29 09:11:24
FuelCell: Long-Term Potential Overshadowed by Lofty Valuation,yahoofinance,2021-01-29 09:11:24
"Stock market news live updates: Stocks sink after Fed decision, S&P 500 posts worst session in three months",yahoofinance,2021-01-29 09:11:24
Will the SEC sue GameStop traders? The case could pose a 'super weird' challenge,yahoofinance,2021-01-29 09:11:24
Is Apple Stock A Buy After Its December-Quarter Earnings Blowout?,yahoofinance,2021-01-29 09:11:24
"DraftKings Stock Surges On Latest Analyst Upgrades, Is It A Buy Right Now?",yahoofinance,2021-01-29 09:11:24
Alibaba Faces Investors After Crackdown on Jack Ma’s Empire,yahoofinance,2021-01-29 09:11:24
"Dow Jones Today, Futures Drop To Test Support; Caterpillar Climbs, Bitcoin Rallies, Short Squeeze Broadens",yahoofinance,2021-01-29 09:11:24
Robinhood stops the games,yahoofinance,2021-01-29 09:11:24
"Will AMD, Nvidia Or Intel Stock Grow The Most By 2022?",yahoofinance,2021-01-29 09:11:24
Understanding Capital Gains Tax on a Real Estate Investment Property,yahoofinance,2021-01-29 09:11:24
Norway Wealth Fund Dumps Oil Stocks Amid $10 Billion Loss,yahoofinance,2021-01-29 09:11:24
"Robinhood raises $1 billion, will reopen GameStop stock purchases on Friday",yahoofinance,2021-01-29 09:11:24
"Eli Lilly beats profit and sales forecasts, to deliver 500,000 more COVID-19 treatment doses by end of March",yahoofinance,2021-01-29 09:11:24
"My daughters inherited my ex-wife’s 401(k), should they convert it to a Roth?",yahoofinance,2021-01-29 09:11:24
"Mortgage rates sink back down, giving borrowers a second chance",yahoofinance,2021-01-29 09:11:24
"Honeywell Reports Earnings Beat, Issues Outlook In-Line With Estimates",yahoofinance,2021-01-29 09:11:24
Why short-sellers dumping GameStop puts Reddit followers and other day traders at greater risk,yahoofinance,2021-01-29 09:11:24
Is American Airlines Stock A Buy As Short-Selling Backlash Takes Over Wall Street?,yahoofinance,2021-01-29 09:11:24
Wall Street needs to learn from GameStop mania: strategist,yahoofinance,2021-01-29 09:11:24
GameStop shareholder sells off stake valued at over $1 billion,yahoofinance,2021-01-29 09:11:24
2 Monster Growth Stocks Flying Under the Radar,yahoofinance,2021-01-29 09:11:24
"Is MA Stock A Buy Right Now? Here's What Earnings, Mastercard Stock Chart Show",yahoofinance,2021-01-29 09:11:24
"Colgate-Palmolive beats earnings expectations, warns of uncertainty ahead",yahoofinance,2021-01-29 09:11:24
Stocks Showing Market Leadership: Sorrento Therapeutics Earns 93 RS Rating,yahoofinance,2021-01-29 09:11:24
BlackBerry execs sold shares as Reddit-driven rally started,yahoofinance,2021-01-29 09:11:24
Tesla Board Member Mizuno Blasts Calls for Short-Squeeze Curbs,yahoofinance,2021-01-29 09:11:24
2 Consumer Defensive Stocks Facing Potential Short Squeeze,yahoofinance,2021-01-29 09:11:24
Oil prices edge higher as investors await supply cuts,yahoofinance,2021-01-29 09:11:24
GameStop Up Off-Hours as Robinhood Loosens Curbs,wsj,2021-01-29 09:14:36
Robinhood Raises $1 Billion to Meet Surging Cash Demands,wsj,2021-01-29 09:14:36
"Household Income, Savings Rose at End of Last Year",wsj,2021-01-29 09:14:36
J&J’s Single-Dose Covid-19 Vaccine Was 66% Effective,wsj,2021-01-29 09:14:36
Chevron Posts Quarterly Loss to Cap Worst Year Since 2016,wsj,2021-01-29 09:14:36
China’s HNA Says Creditors Filed Petition for Its Bankruptcy,wsj,2021-01-29 09:14:36
"Hack Extends Far Beyond SolarWinds, Investigators Say",wsj,2021-01-29 09:14:36
"CEOs on Covid-19, the Economy, Leadership and More",wsj,2021-01-29 09:14:36
"Officials Try Financial Lures, Threats to Reopen Schools",wsj,2021-01-29 09:14:36
Defense Chief Holds Up Trump Nominees to Pentagon Boards,wsj,2021-01-29 09:14:36
"For Golf, Covid Is Even Better Than Tiger",wsj,2021-01-29 09:14:36
"Cicely Tyson, Trailblazing Actor, Dead at 96",wsj,2021-01-29 09:14:36
The NBA’s Best Young Stars Loved the Same Player. He Hated the NBA.,wsj,2021-01-29 09:14:36
Pizza Hut Launches ‘Detroit-Style’ Pizza; America Says ‘Huh?’,wsj,2021-01-29 09:14:36
China’s Top Bottled-Water Group Swells to an $85 Billion Valuation,wsj,2021-01-29 09:14:36
WeWork in Talks to Combine With SPAC or Raise Money Privately,wsj,2021-01-29 09:14:36
McKinsey Is in Settlement Talks With States Over Opioid Work,wsj,2021-01-29 09:14:36
Two Lose Attempt to Avoid Extradition in Ghosn Case,wsj,2021-01-29 09:14:36
"American, Southwest Post Record Losses",wsj,2021-01-29 09:14:36
Coinbase Global Intends to Go Public Via Direct Listing,wsj,2021-01-29 09:14:36
Qualtrics Shares Jump in Trading Debut,wsj,2021-01-29 09:14:36
Hedge Fund Billionaire Takes Climate Fight to S&P 500,wsj,2021-01-29 09:14:36
Two Democratic Senators Have Outsized Influence on Biden’s Agenda,wsj,2021-01-29 09:14:36
China Targets U.K.’s Hong Kong Passports Over Citizenship Plan,wsj,2021-01-29 09:14:36
"As Poland Abortion Law Takes Effect, Women Protest",wsj,2021-01-29 09:14:36
