headline,org,date
How to invest in stocks if record-high prices and volatility make you…,msnmoney,2020-09-08 08:22:53
Where to Find Black-Owned Banks and How You Can Support Them,msnmoney,2020-09-08 08:22:53
India Bond Traders Are on Edge Amid Conflicting RBI Signals,msnmoney,2020-09-08 08:22:53
Money Markets Have a $750 Billion Problem in Zero-Rate World,msnmoney,2020-09-08 08:22:53
"Thanks to red tape, nurses are about to spend more time on…",msnmoney,2020-09-08 08:22:53
Tourist Hotspot Phuket’s Reopening Delayed by New Virus Case,msnmoney,2020-09-08 08:22:53
Willie Walsh bows out as IAG raises capital,msnmoney,2020-09-08 08:22:53
EU aims for strategic economic autonomy after COVID pandemic,msnmoney,2020-09-08 08:22:53
Defense Firm Hensoldt Plans Germany’s Biggest IPO of 2020,msnmoney,2020-09-08 08:22:53
Online Sales Boom Prompts EU Re-Think on Antitrust Rules,msnmoney,2020-09-08 08:22:53
Goldman Sachs says Wall Street's fear gauge is flashing a warning sign…,msnmoney,2020-09-08 08:22:53
Europe has a diesel problem; refiners are feeling the heat,msnmoney,2020-09-08 08:22:53
"The Pre-Markets Rundown: September 08, 2020",msnmoney,2020-09-08 08:22:53
China Set to Be Top World Corn Buyer on Crop Woes and Demand,msnmoney,2020-09-08 08:22:53
No need for political discussion over Nord Stream 2 project: Ifax…,msnmoney,2020-09-08 08:22:53
Expect China to focus on domestic demand in its five-year plan: Economist,msnmoney,2020-09-08 08:22:53
Luxury Sydney home with an incredible man cave hits the market,msnmoney,2020-09-08 08:22:53
WeChat and TikTok Taking Chinese Censorship Global…,msnmoney,2020-09-08 08:22:53
EU Makes Latvia’s Dombrovskis Trade Chief to Deal With U.S.,msnmoney,2020-09-08 08:22:53
8 ways to make extra money while social distancing,msnmoney,2020-09-08 08:22:53
Japan Kitchen Battle Ends With Rare Hostile Bid Victory,msnmoney,2020-09-08 08:22:53
Temasek’s China Exposure Surpasses Singapore for First Time,msnmoney,2020-09-08 08:22:53
Oil Falls Past Two-Month Low on Bleak Short-Term Demand Outlook,msnmoney,2020-09-08 08:22:53
European Fund Troubles Resound in Korea as $303 Million Fund Frozen,msnmoney,2020-09-08 08:22:53
Farmers Shunning Sugar May Leave Europe More Reliant on Imports,msnmoney,2020-09-08 08:22:53
"Euro zone GDP revised up, but still a record drop",msnmoney,2020-09-08 08:22:53
Merkel Allies Step Up Pressure for State Support for Car Sector,msnmoney,2020-09-08 08:22:53
Bank of England Chief Economist Warns Against Extending Furlough…,msnmoney,2020-09-08 08:22:53
Omega Diagnostics’ share price has soared. Here are 5 things you…,msnmoney,2020-09-08 08:22:53
Skills lost due to COVID school closures will hit output for generations…,msnmoney,2020-09-08 08:22:53
Jump in Hottest Hong Kong IPO Makes Founder China’s Second Richest,msnmoney,2020-09-08 08:22:53
15 Places Where You Are Most Likely to Catch Coronavirus,msnmoney,2020-09-08 08:22:53
"Scholarships, grants & student loans for New Jersey students",msnmoney,2020-09-08 08:22:53
"Dear Wall Street, Your Boss Wants You to Come Back to the Office",msnmoney,2020-09-08 08:22:53
Texans escape high power prices of last summer,msnmoney,2020-09-08 08:22:53
Rebound in China Car Sales Accelerates With Pandemic Easing,msnmoney,2020-09-08 08:22:53
New EU Trade Chief Dombrovskis Wants `Substance Before…,msnmoney,2020-09-08 08:22:53
Philippine Central Bank to Make Bond Sales Main Liquidity Tool,msnmoney,2020-09-08 08:22:53
Dollar’s to Blame But Central Bank Wants Shekel Going No Further,msnmoney,2020-09-08 08:22:53
"UK takeover deals slump in second quarter, statistics office says",msnmoney,2020-09-08 08:22:53
Nongfu's HK stock debut shoots founder up the China rich ranks,msnmoney,2020-09-08 08:22:53
"Google Abandons Plan to Rent Dublin Office for 2,000 Workers",msnmoney,2020-09-08 08:22:53
Why You Should NOT Invest Like a Pro,msnmoney,2020-09-08 08:22:53
"Mortgage Rates Today, September 8, 2020 | Rates retreat",msnmoney,2020-09-08 08:22:53
Nongfu Spring IPO: Chinese bottled water founder worth $50 billion as Hong Kong lands…,msnmoney,2020-09-08 08:22:53
7 Steps to Prepare for Your Future Career,msnmoney,2020-09-08 08:22:53
Tesla Declines Accelerate After S&P 500 Snub,msnmoney,2020-09-08 08:22:53
6 Ways to Heap Up Savings Before You Retire,msnmoney,2020-09-08 08:22:53
"Tesla, Boeing, Dow Futures, Slack - 5 Things You Must Know Tuesday",msnmoney,2020-09-08 08:22:53
13 Best Home Improvement Projects To Tackle This Fall,msnmoney,2020-09-08 08:22:53
Tesla shares crater 12% in premarket trade after S&P 500 snub,msnmoney,2020-09-08 08:22:53
Refinanced Your Mortgage? 8 Things to Do With the Savings,msnmoney,2020-09-08 08:22:53
S&P's Tesla snub shows the risks to this overheating Nasdaq…,msnmoney,2020-09-08 08:22:53
Mortgage rates are near record low during brief break from new fee…,msnmoney,2020-09-08 08:22:53
Beyond Meat to Build Factories Near Shanghai in Major China Push,msnmoney,2020-09-08 08:22:53
Deed Fraud: How To Stay Protected From This Growing Trend,msnmoney,2020-09-08 08:22:53
Emerging-Market Stocks Weighed Down by Growing Virus Cases,msnmoney,2020-09-08 08:22:53
Unemployment diary: I'm a 29-year-old magazine editor-in-chief in…,msnmoney,2020-09-08 08:22:53
China’s Chemicals Mega-Merger May Have Come Too Late,msnmoney,2020-09-08 08:22:53
Unemployment diary: I'm a 47-year-old anthropologist in…,msnmoney,2020-09-08 08:22:53
VW CEO Says No Deal Cooking After Meeting Elon Musk in Germany,msnmoney,2020-09-08 08:22:53
Unemployment diary: I'm a 31-year-old youth care worker in Delaware…,msnmoney,2020-09-08 08:22:53
Stricter 2030 Climate Goal For EU To Be Unveiled Next Week,msnmoney,2020-09-08 08:22:53
"Unemployment diary: I'm a 34-year-old bartender, teaching assistant, and…",msnmoney,2020-09-08 08:22:53
Visa is being investigated by the European Commission over its…,msnmoney,2020-09-08 08:22:53
Unemployment diary: I'm a 21-year-old Disney World intern in Idaho…,msnmoney,2020-09-08 08:22:53
"Amazon bans foreign sales of ""mystery"" seeds in U.S.",msnmoney,2020-09-08 08:22:53
Unemployment diary: I'm a 22-year-old actress and barista in Maryland…,msnmoney,2020-09-08 08:22:53
Unemployment diary: I'm a 27-year-old public relations manager in…,msnmoney,2020-09-08 08:22:53
This analysis of Wall Street stock ratings is sounding a warning for…,msnmoney,2020-09-08 08:22:53
Unemployment diary: I'm a 50-year-old business development director in…,msnmoney,2020-09-08 08:22:53
Weekend reads: An early warning sign for Tesla’s stock,msnmoney,2020-09-08 08:22:53
Unemployment diary: I'm a 39-year-old restaurant server in Mississippi…,msnmoney,2020-09-08 08:22:53
Does a 40% Bond Allocation Make Sense in Today’s Portfolios?,msnmoney,2020-09-08 08:22:53
Unemployment diary: I'm a 55-year-old help desk coordinator in Ohio…,msnmoney,2020-09-08 08:22:53
"'We're certainly in a bubble,' strategist warns — but don't expect it to…",msnmoney,2020-09-08 08:22:53
Unemployment diary: I'm a 44-year-old vice president of…,msnmoney,2020-09-08 08:22:53
"Indian Stocks Advance, Ignoring Rising Infections, Weak Economy",msnmoney,2020-09-08 08:22:53
Unemployment diary: I'm a 40-year-old marketing manager in South…,msnmoney,2020-09-08 08:22:53
Where Investors Can Find Value Stocks,msnmoney,2020-09-08 08:22:53
Unemployment diary: I'm a 55-year-old visitor services manager in…,msnmoney,2020-09-08 08:22:53
Primark Says Its Market Share Has Increased Since Covid-19,msnmoney,2020-09-08 08:22:53
Unemployment diary: I'm a 30-year-old marketing specialist in Texas who's…,msnmoney,2020-09-08 08:22:53
"SMIC slumps, SoftBank drops in mixed Asia markets",msnmoney,2020-09-08 08:22:53
Unemployment diary: I'm a 43-year-old administrative assistant…,msnmoney,2020-09-08 08:22:53
Evergrande Offers Deepest Ever Discount to Boost Home Sales,msnmoney,2020-09-08 08:22:53
Unemployment diary: I'm a 37-year-old shift manager in Wisconsin…,msnmoney,2020-09-08 08:22:53
"China says August exports beat expectations, jumping…",msnmoney,2020-09-08 08:22:53
3 Ways to Fight Zoom Fatigue,msnmoney,2020-09-08 08:22:53
This Whole Foods doesn't allow customers inside,msnmoney,2020-09-08 08:22:53
Is It Time for Investors to Ditch Their 401(k)s for Retirement?,msnmoney,2020-09-08 08:22:53
"Suez’s Main Owners Must Remain French, Finance Minister Says",msnmoney,2020-09-08 08:22:53
How to financially prepare for a hurricane,msnmoney,2020-09-08 08:22:53
"Israel to Ask U.S. for Arms to Offset UAE F-35 Sale, Report Says",msnmoney,2020-09-08 08:22:53
How to Tell if a Credit Card’s Annual Fee Is Worth It,msnmoney,2020-09-08 08:22:53
VW Says It May Soon Be Overtaking Tesla,msnmoney,2020-09-08 08:22:53
Here’s exactly how much home staging costs — and when it’s worth it,msnmoney,2020-09-08 08:22:53
"The economy still has a mountain to climb, but it’s digging itself out…",msnmoney,2020-09-08 08:22:53
"Today’s Mortgage Rates, September 7, 2020 | Rates lower",msnmoney,2020-09-08 08:22:53
Stock-market rout: Why it’s too early to call tech plunge the start of a…,msnmoney,2020-09-08 08:22:53
3 Great Reasons to Take Social Security Benefits at 62,msnmoney,2020-09-08 08:22:53
These money and investing tips can keep your portfolio strong…,msnmoney,2020-09-08 08:22:53
What to Do if Unemployment Isn't Boosted for Weeks,msnmoney,2020-09-08 08:22:53
S&P 500 adds three companies not named Tesla — ‘a bit of a…,msnmoney,2020-09-08 08:22:53
21 Steps to More Leisure — and Less Labor — in Your Life,msnmoney,2020-09-08 08:22:53
The stock market is peaking — these are the 26 stocks to own…,msnmoney,2020-09-08 08:22:53
History of workers' strikes in America,msnmoney,2020-09-08 08:22:53
"After Apple and Tesla’s stock splits, read this before jumping in",msnmoney,2020-09-08 08:22:53
The 10 Best Outdoor Home Upgrades for Your Money,msnmoney,2020-09-08 08:22:53
Stocks fall but end off session lows as investors continue to rotate out…,msnmoney,2020-09-08 08:22:53
The Right Way to Mix Money and Marriage,msnmoney,2020-09-08 08:22:53
Now Arby's is selling meat by the pound,msnmoney,2020-09-08 08:22:53
"Homeowners should move fast to beat new refinance fee, experts say",msnmoney,2020-09-08 08:22:53
The Los Angeles Police Department's barely used fleet of BMW i3 EVs is…,msnmoney,2020-09-08 08:22:53
24 simple ways to add value to your home,msnmoney,2020-09-08 08:22:53
Is the Stock Market Closed on Labor Day 2020?,msnmoney,2020-09-08 08:22:53
12 Social Security Facts to Help You Prepare for Retirement,msnmoney,2020-09-08 08:22:53
Ant Hires Goldman Sachs as Joint Lead Manager for IPO,msnmoney,2020-09-08 08:22:53
3 Signs You Shouldn't Claim Social Security Early,msnmoney,2020-09-08 08:22:53
Etsy joins the S&P 500 Index but Tesla is still out,msnmoney,2020-09-08 08:22:53
Fitness Center for Your Rental Property: Worth the Investment?,msnmoney,2020-09-08 08:22:53
Why buying real estate may be a bad deal for you amid the pandemic,msnmoney,2020-09-08 08:22:53
Berkshire Hathaway Slashes Stake in Troubled Lender Wells Fargo,msnmoney,2020-09-08 08:22:53
"Retirees Have Shockingly Little Retirement Savings, Data Shows",msnmoney,2020-09-08 08:22:53
U.S. regains 1.4 million jobs in August and unemployment drops to…,msnmoney,2020-09-08 08:22:53
Millions of Americans Believe a Dangerous Social Security Myth…,msnmoney,2020-09-08 08:22:53
"Tesla falls after S&P 500 adds Etsy and two others, bypassing carmaker",msnmoney,2020-09-08 08:22:53
Here's How Much Social Security Income Joe Biden Is Receiving,msnmoney,2020-09-08 08:22:53
"Disney releases ""Mulan"" — here's how much it costs to stream",msnmoney,2020-09-08 08:22:53
Old-School Money Advice You Shouldn’t Follow Anymore,msnmoney,2020-09-08 08:22:53
Investment Giants Urge Texas to End Most Natural Gas Flaring,msnmoney,2020-09-08 08:22:53
6 key traits leaders must develop for the future of work,msnmoney,2020-09-08 08:22:53
"Trending Market News Friday - Florida Vacay, California Energy",msnmoney,2020-09-08 08:22:53
24 Cities Where You Must Work Overtime Just to Pay the Rent,msnmoney,2020-09-08 08:22:53
Stock Market Today: Uplifting Jobs Report Softens Bears' Bite,msnmoney,2020-09-08 08:22:53
9 Jobs From Home You Can Get and Keep,msnmoney,2020-09-08 08:22:53
Stocks stage late comeback but still end day lower,msnmoney,2020-09-08 08:22:53
7 Things to Do ASAP When Your Spouse Wants a Divorce,msnmoney,2020-09-08 08:22:53
How to Tailor Your Spending for Online or Hybrid Back-to-School,msnmoney,2020-09-08 08:22:53
"Move aside robots, Tesla bets on aluminium casting",msnmoney,2020-09-08 08:22:53
"Today's Mortgage Rates -- September 8, 2020: The 30-Year Is Still Under 3%",msnmoney,2020-09-08 08:22:53
Fleeing the city for the suburbs? Consider these 5 ways the move could…,msnmoney,2020-09-08 08:22:53
South African Recession Deepens With 51% Annualized GDP Drop,msnmoney,2020-09-08 08:22:53
Gaps in the CDC’s eviction ban could leave some renters homeless…,msnmoney,2020-09-08 08:22:53
"To defeat COVID-19, ‘we need a unified national strategy,’ says public…",msnmoney,2020-09-08 08:22:53
Renters in U.S. cannot be evicted through the end of the year due to…,msnmoney,2020-09-08 08:22:53
Racist Advertising Controversy Hits South Africa’s Biggest…,msnmoney,2020-09-08 08:22:53
Japan's economy sinks deeper into contraction,msnmoney,2020-09-08 08:22:53
JPMorgan Summons More Investment Bankers to Offices: WFH Tracker,msnmoney,2020-09-08 08:22:53
Drugmakers Make Safety Pledge; Tighter U.K. Rules: Virus Update,msnmoney,2020-09-08 08:22:53
"COVID-19 and the U.S.–Japan Trade Agreement, Phase 2",msnmoney,2020-09-08 08:22:53
Indian Stocks Swing in Volatile Trade as Investors Assess Risks,msnmoney,2020-09-08 08:22:53
U.S. Weighs Barring Products With Cotton From China’s Xinjiang,msnmoney,2020-09-08 08:22:53
French Economic Activity Has Returned to 95% Normal Levels,msnmoney,2020-09-08 08:22:53
"BlackRock downgrades IG credit to neutral, ups exposure to high-yield…",msnmoney,2020-09-08 08:22:53
A blockbuster IPO briefly made a bottled water entrepreneur China’s…,msnmoney,2020-09-08 08:22:53
Nasdaq futures fall 2% as tech sell-off resumes,msnmoney,2020-09-08 08:22:53
Tesla stock tanks after the automaker's surprise exclusion from the S&P…,msnmoney,2020-09-08 08:22:53
"Don't bet against the U.S. market, it's likely going higher, BlackRock's…",msnmoney,2020-09-08 08:22:53
Millennial Money: Is moving now your best financial move?,msnmoney,2020-09-08 08:22:53
Op-Ed: Trump's Housing Department wants to make transgender…,msnmoney,2020-09-08 08:22:53
Brexit ‘Trash Talking’ Lifts U.K. Debt Demand to $99 Billion,msnmoney,2020-09-08 08:22:53
Maybe Capitalism Isn’t the Real Culprit Behind Climate Change,msnmoney,2020-09-08 08:22:53
This Gas Station Scam Is Victimizing More Drivers,msnmoney,2020-09-08 08:22:53
Insurers bearing the brunt of COVID-19 test costs. That might mean higher…,msnmoney,2020-09-08 08:22:53
The stock market's 'summer of love' gave way to selling—but it's…,msnmoney,2020-09-08 08:22:53
How to Tailor Your Spending for Online or Hybrid Back-to-School,msnmoney,2020-09-08 08:22:53
Polish Premier Sees Scope for Zloty Gains as Economy Awakens,msnmoney,2020-09-08 08:22:53
"Tech Leads Stocks Lower, Nasdaq Futures Slump: Markets Wrap",msnmoney,2020-09-08 08:22:53
"Persona 5 Royal, One of Today's Best RPGs, is Down to $40",msnmoney,2020-09-08 08:22:53
Ghana Wants to Invest Gold Royalty IPO Proceeds in Similar Funds,msnmoney,2020-09-08 08:22:53
Tesla stock tanks after the automaker's surprise exclusion from the S&P…,msnmoney,2020-09-08 08:22:53
"Don't bet against the U.S. market, it's likely going higher, BlackRock's…",msnmoney,2020-09-08 08:22:53
Millennial Money: Is moving now your best financial move?,msnmoney,2020-09-08 08:22:53
Op-Ed: Trump's Housing Department wants to make transgender…,msnmoney,2020-09-08 08:22:53
Brexit ‘Trash Talking’ Lifts U.K. Debt Demand to $99 Billion,msnmoney,2020-09-08 08:22:53
"Ignore Stock Splits, Even Those of Apple and Tesla",msnmoney,2020-09-08 08:22:53
Maybe Capitalism Isn’t the Real Culprit Behind Climate Change,msnmoney,2020-09-08 08:22:53
This Gas Station Scam Is Victimizing More Drivers,msnmoney,2020-09-08 08:22:53
How to invest in stocks if record-high prices and volatility make you…,msnmoney,2020-09-08 08:22:53
Where to Find Black-Owned Banks and How You Can Support Them,msnmoney,2020-09-08 08:22:53
India Bond Traders Are on Edge Amid Conflicting RBI Signals,msnmoney,2020-09-08 08:22:53
Money Markets Have a $750 Billion Problem in Zero-Rate World,msnmoney,2020-09-08 08:22:53
"Thanks to red tape, nurses are about to spend more time on…",msnmoney,2020-09-08 08:22:53
Tourist Hotspot Phuket’s Reopening Delayed by New Virus Case,msnmoney,2020-09-08 08:22:53
Willie Walsh bows out as IAG raises capital,msnmoney,2020-09-08 08:22:53
EU aims for strategic economic autonomy after COVID pandemic,msnmoney,2020-09-08 08:22:53
Defense Firm Hensoldt Plans Germany’s Biggest IPO of 2020,msnmoney,2020-09-08 08:22:53
Online Sales Boom Prompts EU Re-Think on Antitrust Rules,msnmoney,2020-09-08 08:22:53
Goldman Sachs says Wall Street's fear gauge is flashing a warning sign…,msnmoney,2020-09-08 08:22:53
Europe has a diesel problem; refiners are feeling the heat,msnmoney,2020-09-08 08:22:53
"The Pre-Markets Rundown: September 08, 2020",msnmoney,2020-09-08 08:22:53
China Set to Be Top World Corn Buyer on Crop Woes and Demand,msnmoney,2020-09-08 08:22:53
No need for political discussion over Nord Stream 2 project: Ifax…,msnmoney,2020-09-08 08:22:53
Expect China to focus on domestic demand in its five-year plan: Economist,msnmoney,2020-09-08 08:22:53
Luxury Sydney home with an incredible man cave hits the market,msnmoney,2020-09-08 08:22:53
WeChat and TikTok Taking Chinese Censorship Global…,msnmoney,2020-09-08 08:22:53
EU Makes Latvia’s Dombrovskis Trade Chief to Deal With U.S.,msnmoney,2020-09-08 08:22:53
8 ways to make extra money while social distancing,msnmoney,2020-09-08 08:22:53
Japan Kitchen Battle Ends With Rare Hostile Bid Victory,msnmoney,2020-09-08 08:22:53
Temasek’s China Exposure Surpasses Singapore for First Time,msnmoney,2020-09-08 08:22:53
Oil Falls Past Two-Month Low on Bleak Short-Term Demand Outlook,msnmoney,2020-09-08 08:22:53
European Fund Troubles Resound in Korea as $303 Million Fund Frozen,msnmoney,2020-09-08 08:22:53
Farmers Shunning Sugar May Leave Europe More Reliant on Imports,msnmoney,2020-09-08 08:22:53
"Euro zone GDP revised up, but still a record drop",msnmoney,2020-09-08 08:22:53
Merkel Allies Step Up Pressure for State Support for Car Sector,msnmoney,2020-09-08 08:22:53
Bank of England Chief Economist Warns Against Extending Furlough…,msnmoney,2020-09-08 08:22:53
Omega Diagnostics’ share price has soared. Here are 5 things you…,msnmoney,2020-09-08 08:22:53
Skills lost due to COVID school closures will hit output for generations…,msnmoney,2020-09-08 08:22:53
Jump in Hottest Hong Kong IPO Makes Founder China’s Second Richest,msnmoney,2020-09-08 08:22:53
15 Places Where You Are Most Likely to Catch Coronavirus,msnmoney,2020-09-08 08:22:53
"Scholarships, grants & student loans for New Jersey students",msnmoney,2020-09-08 08:22:53
"Dear Wall Street, Your Boss Wants You to Come Back to the Office",msnmoney,2020-09-08 08:22:53
Texans escape high power prices of last summer,msnmoney,2020-09-08 08:22:53
Rebound in China Car Sales Accelerates With Pandemic Easing,msnmoney,2020-09-08 08:22:53
New EU Trade Chief Dombrovskis Wants `Substance Before…,msnmoney,2020-09-08 08:22:53
Philippine Central Bank to Make Bond Sales Main Liquidity Tool,msnmoney,2020-09-08 08:22:53
Dollar’s to Blame But Central Bank Wants Shekel Going No Further,msnmoney,2020-09-08 08:22:53
"UK takeover deals slump in second quarter, statistics office says",msnmoney,2020-09-08 08:22:53
Nongfu's HK stock debut shoots founder up the China rich ranks,msnmoney,2020-09-08 08:22:53
"Google Abandons Plan to Rent Dublin Office for 2,000 Workers",msnmoney,2020-09-08 08:22:53
"
Updated
                                            UPDATE: Nikola shares soar 45% premarket on news of GM partnership; GM to receive $2 billion in Nikola stock
                                        ",marketwatch,2020-09-08 08:24:46
"
                                            General Mills makes gains in the U.S. and abroad due to COVID-related at-home eating habits
                                        ",marketwatch,2020-09-08 08:24:46
"
                                            SVB analysts downgrade Moderna's stock, citing 'competitive pressure' from other COVID vaccine developers
                                        ",marketwatch,2020-09-08 08:24:46
"
Updated
                                            Apple Stock Slides, Tesla Tumbles, and Nikola Soars
                                        ",marketwatch,2020-09-08 08:24:46
"
                                            Salesforce stock drops 4.2% premarket; implied price fall would reduce the Dow by about 70 pts
                                        ",marketwatch,2020-09-08 08:24:46
"
Updated
                                            The Trump administration wants to discourage your 401(k) from including ESG investment options
                                        ",marketwatch,2020-09-08 08:24:46
"
                                            Apple stock's implied price decline would shave about 45 pts off the Dow's price; Dow futures down 150 pts
                                        ",marketwatch,2020-09-08 08:24:46
"
                                            Apple's stock sinks 5.7% to pace the Dow's premarket decliners
                                        ",marketwatch,2020-09-08 08:24:46
"
                                            Duck Creek started at neutral with $43 stock price target at J.P. Morgan
                                        ",marketwatch,2020-09-08 08:24:46
"
Updated
                                            Indiana’s alternative to vote by mail: 28 days of early in-person voting
                                        ",marketwatch,2020-09-08 08:24:46
"
                            
                            Goldman says bull market has plenty of room to run, but a 10% selloff can’t be ruled out
                        ",marketwatch,2020-09-08 08:24:46
"
                            
                            Goldman says bull market has plenty of room to run, but a 10% selloff can’t be ruled out
                        ",marketwatch,2020-09-08 08:24:46
"
                            
                            Nine drug-company CEOs pledge to make sure COVID-19 vaccine follows full regulatory path
                        ",marketwatch,2020-09-08 08:24:46
"
                            
                            Google pulls out of key office deal for 2,000 workers
                        ",marketwatch,2020-09-08 08:24:46
"
                            
                            Amazon is hiring a new team to work on its cooler-sized autonomous delivery robots
                        ",marketwatch,2020-09-08 08:24:46
"
                            
                            Census Bureau must temporarily halt plan to wind down operations early
                        ",marketwatch,2020-09-08 08:24:46
"
                            
                            Trump suggests Pentagon brass support military action in service to defense contractors
                        ",marketwatch,2020-09-08 08:24:46
"
                            
                            S&P 500 adds three companies not named Tesla — ‘a bit of a shocker,’ analyst says
                        ",marketwatch,2020-09-08 08:24:46
"
Opinion: 
                            This is one Trump tax cut you really don’t want
                        ",marketwatch,2020-09-08 08:24:46
"
Opinion: 
                            The Trump administration wants to discourage your 401(k) from including ESG investment options
                        ",marketwatch,2020-09-08 08:24:46
"
                            
                            Another coronavirus aid package is probably ‘not happening’ after August jobs report and deal to avoid government shutdown, analyst says
                        ",marketwatch,2020-09-08 08:24:46
"
                            
                            Spain virology experts say country’s COVID-19 resurgence contains valuable lessons for the world
                        ",marketwatch,2020-09-08 08:24:46
Covid Response Boosts Green Metals,marketwatch,2020-09-08 08:24:46
"
                            
                            Profit with purpose? How this REIT aims to combat homelessness
                        ",marketwatch,2020-09-08 08:24:46
"
                            
                            My father left me money for a house — and my husband put his name on the deed. How do I ensure it goes to our kids?
                        ",marketwatch,2020-09-08 08:24:46
"
                            
                            Peter Strzok says he saw Trump as counterintelligence risk while at FBI — and still does
                        ",marketwatch,2020-09-08 08:24:46
"
                            
                            Mylan to pay equivlant of $757 million to buy Aspen's  Europe thrombosis business
                        ",marketwatch,2020-09-08 08:24:46
"
                            
                            Cloud company Sumo Logic to offer 14.8 million shares in planned IPO, priced at $17 to $21 each
                        ",marketwatch,2020-09-08 08:24:46
"
                            
                            Credit Suisse’s ‘Spygate’ scandal may go further — report
                        ",marketwatch,2020-09-08 08:24:46
