headline,org,date
French experience could provide a blueprint for other countries facing distrust over Covid jabs,financialtimes,2020-12-11 10:37:37
Trump administration tries to secure another 100m doses of jab,financialtimes,2020-12-11 10:37:37
"Publicans are facing financial ruin and being forced to dismantle, inch by inch, everything that makes us hospitable",financialtimes,2020-12-11 10:37:37
Trump administration tries to secure another 100m doses of jab,financialtimes,2020-12-11 10:37:37
The US securities regulator sought documents on Epstein’s brokerage and investment advisory activities.,financialtimes,2020-12-11 10:37:37
Worst economic crisis since fall of Soviet Union forces government to accelerate reforms,financialtimes,2020-12-11 10:37:37
Erdogan attacks ‘disrespectful’ plan by Trump administration for penalties against Ankara,financialtimes,2020-12-11 10:37:37
Warner is endangering the blockbuster by putting new releases on HBO Max next year ,financialtimes,2020-12-11 10:37:37
Boris Johnson has warned Britain to prepare for a no-deal Brexit ,financialtimes,2020-12-11 10:37:37
Showdowns looming over Brexit and rule of law,financialtimes,2020-12-11 10:37:37
Brazilian who migrated from Lebanon built an international business empire ,financialtimes,2020-12-11 10:37:37
US investigators allege pattern of anti-competitive behaviour as Facebook bought or squashed its rivals,financialtimes,2020-12-11 10:37:37
"Once a golden ticket for expatriates, the Saudi Arabian state oil giant is under fire from whistleblowers",financialtimes,2020-12-11 10:37:37
British lenders fall more than 5% and sterling slides as leaders warn ‘no deal’ likely,financialtimes,2020-12-11 10:37:37
Specialists in private company loans face losses as months of pandemic restrictions take toll on already-struggling sector  ,financialtimes,2020-12-11 10:37:37
Global funds have bought a net $5bn of shares since the start of November,financialtimes,2020-12-11 10:37:37
Acquisition by South Korean carmaker part of its transition into broader range of mobility services,financialtimes,2020-12-11 10:37:37
Allowing new innovative competitors to emerge is critical,financialtimes,2020-12-11 10:37:37
Co-founder remains wary of home-rental company’s spectacular stock market debut during the pandemic,financialtimes,2020-12-11 10:37:37
Coronavirus latest: UK shortens self-isolation period from two weeks to 10 days,financialtimes,2020-12-11 10:37:37
US offers to help increase production of Pfizer/BioNTech Covid vaccine,financialtimes,2020-12-11 10:37:37
Covid vaccine setbacks for Sanofi/GSK and Australian jabs ,financialtimes,2020-12-11 10:37:37
"Jim Cramer on Pfizer, Costco, Disney - Live!",thestreet,2020-12-11 10:39:16
Stocks Fall as Stimulus Talks Remain at a Stalemate,thestreet,2020-12-11 10:39:16
"Pfizer Shares Jump Ahead of FDA Vaccine Approval, Dividend Boost",thestreet,2020-12-11 10:39:16
Disney Jumps as Wall Street Hails Streaming Domination Plans,thestreet,2020-12-11 10:39:16
Morning Bell With Jim Cramer: Tesla Can Go Higher,thestreet,2020-12-11 10:39:16
Jim Cramer: Want to Break Up Facebook? Give Me a Break,thestreet,2020-12-11 10:39:16
Rev Shark: Recent Flurry of Stock Offerings Provides Excuse for Corrective Action,thestreet,2020-12-11 10:39:16
Price: I Told You There Was Still a Lot Worth Buying ...,thestreet,2020-12-11 10:39:16
Meisler: Let's Take a Different Look at Market Breadth,thestreet,2020-12-11 10:39:16
Jhonsa: 3 Possibilities for When the Bubble Bursts for High-Multiple Tech Stocks,thestreet,2020-12-11 10:39:16
Stocks Under $10 to Buy for 2021,thestreet,2020-12-11 10:39:16
Qualcomm Slips on Apple's Plans to Make Its Own Modems,thestreet,2020-12-11 10:39:16
Tesla Falls on Jefferies Downgrade Questioning EV Dominance,thestreet,2020-12-11 10:39:16
Insight on Tesla's S&P 500 Inclusion from J.P. Morgan,thestreet,2020-12-11 10:39:16
Apple Stock: A Look at Wall Street Opinions This Week,thestreet,2020-12-11 10:39:16
Are Democrats or Republicans More to Blame for the Covid Impasse?,thestreet,2020-12-11 10:39:16
7 Top Marijuana ETFs for 2021,thestreet,2020-12-11 10:39:16
Drivers of Disruption and Innovation in the PPE Space,thestreet,2020-12-11 10:39:16
Sectors Driving Disruption in the PPE Market,thestreet,2020-12-11 10:39:16
How Major Companies Played a Role in PPE Manufacturing,thestreet,2020-12-11 10:39:16
Inheritance Planning Strategies for Advisers and Clients,thestreet,2020-12-11 10:39:16
Disability Insurance: Planning for a More Secure Future,thestreet,2020-12-11 10:39:16
The Longevity Economy and The Factors That Have Given Rise to the Current Landscape,thestreet,2020-12-11 10:39:16
Year-end Financial and Retirement Planning Tips,thestreet,2020-12-11 10:39:16
Deductions Allowed for Contributions to a Traditional IRA,thestreet,2020-12-11 10:39:16
Take Advantage of Special Tax Deductions for Charitable Giving in 2020,thestreet,2020-12-11 10:39:16
Why Airbnb IPO Has Jim Cramer Worried About Valuation,thestreet,2020-12-11 10:39:16
Jim Cramer Says Tesla Stock Is Biding Its Time,thestreet,2020-12-11 10:39:16
Gaming Stocks to Watch in 2021,thestreet,2020-12-11 10:39:16
Jobless Claims Surge Alongside Covid-19 Infections and Deaths,thestreet,2020-12-11 10:39:16
Is Your Money Manager Working for You?,thestreet,2020-12-11 10:39:16
What to Expect in the Economy Post-Election,thestreet,2020-12-11 10:39:16
What do low Interest Rates Mean for Investors?,thestreet,2020-12-11 10:39:16
Politics and Your Portfolio: Tuning Out the Noise,thestreet,2020-12-11 10:39:16
Presidential Elections and the Market: What History Tells Investors,thestreet,2020-12-11 10:39:16
This Day in Wall Street History: Dec. 11 - Bernie Madoff Arrested,thestreet,2020-12-11 10:39:16
Analysts Hop on Broadcom Post-Earnings Bandwagon,thestreet,2020-12-11 10:39:16
Ferrari CEO Camilleri Resigns Abruptly for 'Personal Reasons',thestreet,2020-12-11 10:39:16
Best Stocks of the Year That Missed the Cut: Pfizer and Nio,thestreet,2020-12-11 10:39:16
Analysts Hail Disney's Bid to Be Streaming Content King,thestreet,2020-12-11 10:39:16
"LIVE: Jim Cramer on Pfizer, Costco, Disney, Bitcoin, Stock Market Friday",thestreet,2020-12-11 10:39:16
Lululemon Q3 Beat: What Wall Street Is Saying,thestreet,2020-12-11 10:39:16
Oracle Gets Faint Praise From Analysts After Earnings Beat,thestreet,2020-12-11 10:39:16
"Disney, NIO, Lululemon, Pfizer - Friday's Premarket Movers",thestreet,2020-12-11 10:39:16
Broadcom Quarterly Earnings Beat Spurs Raft of Analyst Upgrades,thestreet,2020-12-11 10:39:16
Year-end Financial and Retirement Planning Tips,thestreet,2020-12-11 10:39:16
"AMC Warns on Liquidity As Pandemic Limits Movie Seats, Disney and Warner Brothers Focus on Online Releases",thestreet,2020-12-11 10:39:16
Traveling With Pets? How to Find the Right Hotel,thestreet,2020-12-11 10:39:16
"Dow Futures Slide As Stimulus Deadlock, Hard Brexit Concerns Cloud Vaccine Progress",thestreet,2020-12-11 10:39:16
"Pfizer Covid Vaccine, Disney, Costco, Airbnb - 5 Things You Must Know Friday",thestreet,2020-12-11 10:39:16
Don't Bet Against the Bulls: Cramer's 'Mad Money' Recap (Thursday 12/10/20),thestreet,2020-12-11 10:39:16
FDA Committee Recommends Approval of Pfizer/BioNTech Vaccine,thestreet,2020-12-11 10:39:16
Disney Spotlights Disney+ Growth at Investor Event,thestreet,2020-12-11 10:39:16
Costco Higher After Profit and Revenue Beat Estimates,thestreet,2020-12-11 10:39:16
Why Airbnb IPO Has Jim Cramer Worried About Valuation,thestreet,2020-12-11 10:39:16
Lululemon Q3 Beat: What Wall Street Is Saying,thestreet,2020-12-11 10:39:16
Physician on FDA advisory board explains her decision to vote against Pfizer vaccine,googlenews,2020-12-11 10:41:23
The antitrust case against Facebook: Here's what you need to know,googlenews,2020-12-11 10:41:23
"Sanofi, GlaxoSmithKline delay COVID-19 vaccine rollout to late 2021",googlenews,2020-12-11 10:41:23
Hyundai confirms its $1.1 billion acquisition of Boston Dynamics,googlenews,2020-12-11 10:41:23
"While IPOs for Airbnb and DoorDash skyrocketed this week, don't buy hype, experts say",googlenews,2020-12-11 10:41:23
Almost 40% of Americans plan to spend less this holiday season as the Covid pandemic lingers,googlenews,2020-12-11 10:41:23
Is Moderna’s Stock Fully Valued at Current Levels? Analyst Weighs In,googlenews,2020-12-11 10:41:23
"Goodbye Covid, Hello Inflation?",googlenews,2020-12-11 10:41:23
"Asian shares boosted by vaccines hopes, Brexit deadline casts shadow",googlenews,2020-12-11 10:41:23
"Dow Jones Futures Signal Solid Losses; FDA To 'Rapidly' OK Pfizer Coronavirus Vaccine; Disney, Tesla, Nio Among Key Stocks Moving",googlenews,2020-12-11 10:41:23
Big Tech has an antitrust target on its back. Here's why that should concern investors,googlenews,2020-12-11 10:41:23
Got $500? These Stocks Can Make You a Boatload of Money,googlenews,2020-12-11 10:41:23
Ferrari CEO Camilleri steps down for personal reasons,googlenews,2020-12-11 10:41:23
"BREAKING: Mylan's Morgantown facility plans July 31 shutdown; 1,500 jobs to be lost",googlenews,2020-12-11 10:41:23
"Cramer calls IPO pricing ‘broken’ and ‘embarrassing’ after Airbnb, DoorDash debuts skyrocket",googlenews,2020-12-11 10:41:23
Window opens for Virgin Galactic test flight from spaceport,googlenews,2020-12-11 10:41:23
Southwest Airlines to add new flights between New Orleans and one of its most popular stops,googlenews,2020-12-11 10:41:23
FDA committee votes to recommend COVID-19 vaccine emergency use authorization,googlenews,2020-12-11 10:41:23
4-Year-Old Asks for Happiness in Sad Letter to Santa,googlenews,2020-12-11 10:41:23
California nurse who took part in Pfizer vaccine trial describes illness after receiving shot,googlenews,2020-12-11 10:41:23
Colin Kaepernick immortalized in frozen yogurt by Ben & Jerry’s,googlenews,2020-12-11 10:41:23
China's iron ore prices spike 10% to a record high on supply concerns,googlenews,2020-12-11 10:41:23
Austin’s top doctor: Stage 5 restrictions could trigger curfew,googlenews,2020-12-11 10:41:23
Elon Musk says ‘too many MBAs’ are running American companies,googlenews,2020-12-11 10:41:23
Moderna doses first patients in Phase 2/3 study of COVID-19 vaccine in adolescents,googlenews,2020-12-11 10:41:23
How Much Money Will Moderna Make From Its COVID Vaccine?,googlenews,2020-12-11 10:41:23
World carbon dioxide emissions drop 7% in pandemic-hit 2020,googlenews,2020-12-11 10:41:23
"Walgreens, FedEx, and others rapidly increase hiring to support coronavirus vaccine distribution",googlenews,2020-12-11 10:41:23
Bill Gates on vaccine fight: 'There's a lot of heroes' to ending pandemic,googlenews,2020-12-11 10:41:23
Teachers moving to front of COVID-19 vaccine line as Utah eclipses 1K disease deaths Thursday,googlenews,2020-12-11 10:41:23
The hurdles we face before reaching herd immunity,googlenews,2020-12-11 10:41:23
Select Hy-Vee locations to offer rapid antigen COVID-19 testing,googlenews,2020-12-11 10:41:23
"Student loan payments set to resume, unless Democrats get their way",googlenews,2020-12-11 10:41:23
"Oregon reports 13 more COVID-19 deaths, including Deschutes County's 16th",googlenews,2020-12-11 10:41:23
"Unemployment Claims Jump, Casting New Shadow Over U.S. Economy",googlenews,2020-12-11 10:41:23
"Bipartisan Covid relief plan includes more PPP, plus tax deductions for small businesses",googlenews,2020-12-11 10:41:23
Stockpicking legend Warren Buffett and index champion John Bogle both knew the other was right about investing,googlenews,2020-12-11 10:41:23
Delaware restaurants and bars will have curfew under latest COVID-19 restrictions,googlenews,2020-12-11 10:41:23
Diamond engagement ring dropped in Salvation Army red kettle in Jacksonville,googlenews,2020-12-11 10:41:23
Another Amazon driver robbed at gunpoint in Cleveland,googlenews,2020-12-11 10:41:23
PayPal-backed fintech start-up Tink valued at more than $800 million after fresh funding,googlenews,2020-12-11 10:41:23
Can your employer force you to get a COVID-19 vaccine?,googlenews,2020-12-11 10:41:23
Fitch upgrades its China growth forecast for 2021,googlenews,2020-12-11 10:41:23
"California Covid-19 Update: Wednesday Marks Deadliest Day Of Pandemic In State, And It’s Going To Get Worse",googlenews,2020-12-11 10:41:23
Watchdog Raises Possible Kushner Link to $700M Rescue Loan,googlenews,2020-12-11 10:41:23
Here's Where SpaceX Has Promised to Provide Starlink Internet,googlenews,2020-12-11 10:41:23
Costco Trounces Q1 Estimates,googlenews,2020-12-11 10:41:23
"Postal Service: Nearly 20 packages found dumped in Southwest Side garbage handled by FedEx, not USPS",googlenews,2020-12-11 10:41:23
Dry ice sales booming as hospitals get ready to store Pfizer's Covid vaccine at minus 94 degrees,googlenews,2020-12-11 10:41:23
ECB unleashes $600 billion in new stimulus to prop up Europe's economy,googlenews,2020-12-11 10:41:23
Broadcom Stock Slips Even as Chip Maker Beats Earnings Estimates,googlenews,2020-12-11 10:41:23
Airbnb is larger than all hotel stocks after its IPO. Why that valuation makes sense,googlenews,2020-12-11 10:41:23
McDonald's to offer Christmas freebies with $1 purchases starting Monday,googlenews,2020-12-11 10:41:23
"Massachusetts superspreader: Biogen conference tied to 300,000 coronavirus cases",googlenews,2020-12-11 10:41:23
Singapore Officials Say COVID-19 Scare on Royal Caribbean Cruise Ship Quantum of the Seas Was False Alarm,googlenews,2020-12-11 10:41:23
"Data from by Pfizer/BioNTeh, Moderna for COVID-19 vaccines 'very robust'-EMA",googlenews,2020-12-11 10:41:23
FDA commissioner says agency striving to remain transparent on vaccine,googlenews,2020-12-11 10:41:23
The CDC advises COVID-19 tests for holiday travel: 8 do's and don'ts ahead of your trip,googlenews,2020-12-11 10:41:23
"Coronavirus (COVID-19) Update: December 10, 2020",googlenews,2020-12-11 10:41:23
"What is an mRNA vaccine, and how does it work?",googlenews,2020-12-11 10:41:23
"Colorado may have dodged a Thanksgiving COVID-19 spike, though virus still widespread",googlenews,2020-12-11 10:41:23
Timnit Gebru: Google’s ‘dehumanizing’ memo paints me as an angry Black woman,googlenews,2020-12-11 10:41:23
California Rolls Out a Virus Exposure Alert Tool. Here's How It Works,googlenews,2020-12-11 10:41:23
Big Tech Stocks Just Had a Big Winning Streak. That Usually Means They’re a Buy.,googlenews,2020-12-11 10:41:23
Google's Year in Search makes 2020 seem like an entire decade,googlenews,2020-12-11 10:41:23
A former NSA hacker breaks down the FireEye hack,googlenews,2020-12-11 10:41:23
"Minn. Drive-Thru Sees 2-Day, $10K Pay-It-Forward Chain",googlenews,2020-12-11 10:41:23
Crime wave hits New York bodegas with six people killed during first eight months of pandemic,googlenews,2020-12-11 10:41:23
Oracle's stock shakes off decline after upbeat forecast,googlenews,2020-12-11 10:41:23
United Airlines turns to CO2 removal technology to offset emissions,googlenews,2020-12-11 10:41:23
F.D.A. Panel Gives Green Light to Pfizer's Covid Vaccine,googlenews,2020-12-11 10:41:23
FDA advisers recommend authorization of Pfizer/BioNTech coronavirus vaccine,googlenews,2020-12-11 10:41:23
"Bahrain plans free shots, Saudi Arabia approves Pfizer jab",googlenews,2020-12-11 10:41:23
Vaccine Watch: Getting the vaccine to Americans,googlenews,2020-12-11 10:41:23
'The Wrath Of Mark': 4 Takeaways From The Government's Case Against Facebook,googlenews,2020-12-11 10:41:23
FTC Claims Facebook's Acquisition of WhatsApp and Instagram Were Anti-Competitive,googlenews,2020-12-11 10:41:23
"When it Comes to Facebook, the Need for Action Has Been Obvious for a Long Time",googlenews,2020-12-11 10:41:23
Break up Facebook? That’s a tough sell.,googlenews,2020-12-11 10:41:23
"GlaxoSmithKline, Sanofi say COVID-19 shot won't be ready until late 2021",googlenews,2020-12-11 10:41:23
Covid vaccine by Sanofi-GSK delayed after disappointing results in older patients,googlenews,2020-12-11 10:41:23
Sanofi suffers major setback in development of a Covid-19 vaccine,googlenews,2020-12-11 10:41:23
"European stocks fall as investors watch U.S. stimulus talks, Brexit and vaccine news",googlenews,2020-12-11 10:41:23
Hyundai Motor to buy robot maker Boston Dynamics,googlenews,2020-12-11 10:41:23
Hyundai takes control of Boston Dynamics in $1.1B deal,googlenews,2020-12-11 10:41:23
Hyundai Motor Group to acquire 80% stake of U.S. robotics firm Boston Dynamics,googlenews,2020-12-11 10:41:23
Hyundai Motor to buy controlling stake in U.S. robot firm from SoftBank,googlenews,2020-12-11 10:41:23
Two IPO veterans on what could be next for DoorDash and Airbnb,googlenews,2020-12-11 10:41:23
"Airbnb skyrockets 112% in public market debut, giving it a market cap of $86.5 billion",googlenews,2020-12-11 10:41:23
Breakingviews - Airbnb IPO surge puts pressure on next unicorns,googlenews,2020-12-11 10:41:23
Airbnb’s red-hot IPO will bring problems too,googlenews,2020-12-11 10:41:23
"Tesla, Trading at $650, Gets $90 Price Target From JPMorgan",googlenews,2020-12-11 10:41:23
"Corporations Over-Credentialing Job Openings, IBM's Rometty Says",googlenews,2020-12-11 10:41:23
EU Leaders Approve Historic $2.2 Trillion Stimulus Plan,googlenews,2020-12-11 10:41:23
Jobless Claims Hit Highs Akin to the Great Recession,googlenews,2020-12-11 10:41:23
U.S. producer prices increase slightly in November,googlenews,2020-12-11 10:41:23
U.S. Inflation Measure Rose by More Than Forecast in November,googlenews,2020-12-11 10:41:23
U.S. wholesale inflation posts smallest increase in seven months as coronavirus slams economy again,googlenews,2020-12-11 10:41:23
Consumer prices up as energy costs rise | Columbia Basin,googlenews,2020-12-11 10:41:23
European markets drop as Brexit and U.S. stimulus doubts weigh,googlenews,2020-12-11 10:41:23
US stocks mixed as near-term U.S. fiscal stimulus appears unlikely,googlenews,2020-12-11 10:41:23
"Stocks subdued by Brexit, U.S. stimulus doubts",googlenews,2020-12-11 10:41:23
Gold Up Over US Stimulus Uncertainty By Investing.com,googlenews,2020-12-11 10:41:23
AstraZeneca PLC ADR stock outperforms competitors despite losses on the day,googlenews,2020-12-11 10:41:23
5 things to know before the stock market opens Friday,googlenews,2020-12-11 10:41:23
"Dow Jones Futures: FDA Panel Backs Pfizer Coronavirus Vaccine; Disney, Nio Among Key Stocks Moving",googlenews,2020-12-11 10:41:23
E-mini Dow Jones Industrial Average (YM) Futures Technical Analysis – Reaction to 29780 Sets Tone into Close,googlenews,2020-12-11 10:41:23
Ferrari CEO Louis Camilleri Resigns After Bout With Covid-19,googlenews,2020-12-11 10:41:23
Ferrari CEO Camilleri announces shock retirement,googlenews,2020-12-11 10:41:23
Ferrari Owners and F1 Fans Get Some Troubling News,googlenews,2020-12-11 10:41:23
Ferrari CEO Camilleri retires with immediate effect after fight with Covid-19,googlenews,2020-12-11 10:41:23
"Pharmaceutical giant Mylan to close its Morgantown, West Virginia plant, 1,500 jobs to be lost next summer",googlenews,2020-12-11 10:41:23
Viatris Inc. Announces Additional Details of Previously Disclosed Global Restructuring Initiative,googlenews,2020-12-11 10:41:23
"Mylan's Morgantown manufacturing plant to close, nearly 1500 jobs will be lost",googlenews,2020-12-11 10:41:23
Viatris announced planned closure of Mylan manufacturing facility in Morgantown,googlenews,2020-12-11 10:41:23
Cramer recommends trimming positions with market near highs,googlenews,2020-12-11 10:41:23
Morning Bell With Jim Cramer: Tesla Can Go Higher,googlenews,2020-12-11 10:41:23
"Cramer says it's 'crazier' to short the market than to buy Airbnb, DoorDash at current levels",googlenews,2020-12-11 10:41:23
Jim Cramer: Take profits in electric vehicle SPAC names,googlenews,2020-12-11 10:41:23
Virgin Galactic Is Launching a Historic Manned Spaceflight This Weekend,googlenews,2020-12-11 10:41:23
Here's what we learned from Morgan Stanley's annual space summit as investor interest booms,googlenews,2020-12-11 10:41:23
SPCE Stock: Virgin Galactic Stock Climbs Ahead of Test Flight,googlenews,2020-12-11 10:41:23
Virgin Galactic poised for launch from Spaceport America,googlenews,2020-12-11 10:41:23
"Southwest Airlines adds 16 new routes, including from Houston and Long Beach",googlenews,2020-12-11 10:41:23
Long Beach Airport to offer 6 new nonstop destinations in March,googlenews,2020-12-11 10:41:23
Dallas-based Southwest Airlines takes off with new Texas route for $29,googlenews,2020-12-11 10:41:23
"Southwest plans 3 new flights to Columbus, Pittsburgh and Indianapolis from Sarasota-Bradenton",googlenews,2020-12-11 10:41:23
Pfizer Covid Vaccine: FDA Aiming for Quick Authorization,googlenews,2020-12-11 10:41:23
FDA panel recommends emergency use authorization of Pfizer vaccine,googlenews,2020-12-11 10:41:23
Biden Team Flubs FDA Advisory Panel’s Vaccine Announcement,googlenews,2020-12-11 10:41:23
Trump pressures FDA to approve coronavirus vaccine | TheHill,googlenews,2020-12-11 10:41:23
USPS Operation Santa letters detail pandemic's impact on children before Christmas: 'We got closer',googlenews,2020-12-11 10:41:23
USPS Letters To Santa Reveal The Heartbreaking Toll COVID Is Taking On Kids,googlenews,2020-12-11 10:41:23
‘End of Covid 19. New X Box’: Children plead for pandemic relief and gifts in letters to Santa,googlenews,2020-12-11 10:41:23
America Together: Texas mom writes 'Santa letters' for front-line parents,googlenews,2020-12-11 10:41:23
FDA advisory panel votes in favor of emergency authorization of Pfizer COVID-19 vaccine,googlenews,2020-12-11 10:41:23
Sacramento expecting first coronavirus vaccines early next week,googlenews,2020-12-11 10:41:23
Kits to administer Covid-19 vaccine arrive in Louisville via UPS,googlenews,2020-12-11 10:41:23
"Pfizer's COVID-19 vaccine one step closer to approval, following endorsement from US panel",googlenews,2020-12-11 10:41:23
"Right now with cbs8.com | What people are talking about online on December 10, 2020",googlenews,2020-12-11 10:41:23
"Colin Kaepernick, Ben & Jerry's collaborate for new 'Change the Whirled' flavor",googlenews,2020-12-11 10:41:23
Opinion: Colin Kaepernick's activism moves to freezer section with Ben & Jerry's flavor,googlenews,2020-12-11 10:41:23
Ben & Jerry’s Colin Kaepernick ice cream delivers the sickening taste of unwarranted martyrdom and is a blatant money grab,googlenews,2020-12-11 10:41:23
China's Australia Threats Are Biden's First Crisis,googlenews,2020-12-11 10:41:23
Iron ore soars on China demand but speculative buying stokes caution,googlenews,2020-12-11 10:41:23
Iron ore price goes parabolic after cyclone warning - MINING.COM,googlenews,2020-12-11 10:41:23
China Is Blocking Australian Exports. Here’s How the U.S. Can Help.,googlenews,2020-12-11 10:41:23
"As COVID vaccines near federal approval, RI prepares to launch distribution plan",googlenews,2020-12-11 10:41:23
11 Austin hospitals among first in nation to receive COVID-19 vaccines,googlenews,2020-12-11 10:41:23
Elon Musk: How To Become an Expert In Any Field,googlenews,2020-12-11 10:41:23
Elon Musk Advises 'Stop Wasting Time With Power Point',googlenews,2020-12-11 10:41:23
"Missed Tesla’s 12,551% Rise? Don’t Feel So Bad",googlenews,2020-12-11 10:41:23
California’s corporate residents hit the road for business-friendly alternatives,googlenews,2020-12-11 10:41:23
"Data from Pfizer/BioNTech, Moderna for COVID-19 vaccines 'very robust'-EMA",googlenews,2020-12-11 10:41:23
Hartford HealthCare Hopes to Have COVID-19 Vaccine by Start of Next Week,googlenews,2020-12-11 10:41:23
"Walmart preparing more than 5,000 stores for vaccine rollout",googlenews,2020-12-11 10:41:23
"EU drug regulator hacked, data on COVID-19 vaccine accessed",googlenews,2020-12-11 10:41:23
Covid pandemic drove a record drop in global carbon emissions in 2020,googlenews,2020-12-11 10:41:23
World’s carbon dioxide emissions dropped 7% in pandemic-hit 2020,googlenews,2020-12-11 10:41:23
"In 2020, world carbon dioxide emissions fell 7 percent",googlenews,2020-12-11 10:41:23
Global Carbon Project: Coronavirus causes ‘record fall’ in fossil-fuel emissions in 2020,googlenews,2020-12-11 10:41:23
Walmart prepares to administer the Covid vaccine in 5000 pharmacies across the U.S.,googlenews,2020-12-11 10:41:23
How Will the Coronavirus Vaccine Get to You?,googlenews,2020-12-11 10:41:23
US FDA advisory panel votes in favor of Pfizer's coronavirus vaccine | World News | WION News,googlenews,2020-12-11 10:41:23
"As Pfizer prepares to ship COVID-19 vaccine, Michigan manufacturing plant takes center stage",googlenews,2020-12-11 10:41:23
The Gates Foundation adds $250M gift to fight COVID-19 worldwide: Melinda Gates explains why,googlenews,2020-12-11 10:41:23
Gates Foundation commits another $250 million to fight COVID-19 | TheHill,googlenews,2020-12-11 10:41:23
Melinda Gates: Covid-19 vaccine needs to be distributed worldwide for a faster economic recovery,googlenews,2020-12-11 10:41:23
Melinda Gates: We have a moral responsibility to make sure everybody gets COVID-19 vaccine,googlenews,2020-12-11 10:41:23
COVID-19 vaccine reaction in UK,googlenews,2020-12-11 10:41:23
"Fauci Spotlights Dr. Kizzmekia Corbett, the 34-Year-Old Black Woman at the Forefront of COVID Vaccine Development",googlenews,2020-12-11 10:41:23
WATCH: When could the U.S. achieve herd immunity?,googlenews,2020-12-11 10:41:23
"Don't Do This Right After Getting a COVID Vaccine, Expert Warns",googlenews,2020-12-11 10:41:23
Student Loan Cancellation Sets Up Clash Between Biden and the Left,googlenews,2020-12-11 10:41:23
Student loan relief 'would be fantastic' as debt soars past a trillion,googlenews,2020-12-11 10:41:23
Can Joe Biden cancel student loan debt without Congress?,googlenews,2020-12-11 10:41:23
Student loan forbearance is extended through January 2021 but you should be planning for the future,googlenews,2020-12-11 10:41:23
