headline,org,date
Why Apple and Tesla shares surged after getting split,yahoofinance,2020-09-01 08:06:36
"Walmart unveils $98 membership with access to gas, groceries, more",yahoofinance,2020-09-01 08:06:36
ChinData readying U.S. IPO of up to $400 million,yahoofinance,2020-09-01 08:06:36
UK manufacturing output grows at fastest pace since 2014,yahoofinance,2020-09-01 08:06:36
Why this real estate CEO say homebuyers are heading to sunbelt cities,yahoofinance,2020-09-01 08:06:36
'The entire sector has been entirely left behind': Dan Dicker on energy,yahoofinance,2020-09-01 08:06:36
What is a stock split: Yahoo U,yahoofinance,2020-09-01 08:06:36
We've entered the next phase of the uncertainty cycle,yahoofinance,2020-09-01 08:06:36
How to invest in water sustainability,yahoofinance,2020-09-01 08:06:36
Billionaire George Soros Places Bet on 3 High-Yield Dividend Stocks,yahoofinance,2020-09-01 08:06:36
"The Worst Is Over. Buy Bank of America and These 5 Other Stocks Now, Analysts Say.",yahoofinance,2020-09-01 08:06:36
Why Apple and Tesla shares surged after getting split: Morning Brief,yahoofinance,2020-09-01 08:06:36
"Walmart unveils 'ultimate life hack,' a $98 membership with access to gas, groceries and free delivery",yahoofinance,2020-09-01 08:06:36
$4 Billion in Just Hours: Zoom CEO’s Wealth Jumps on Results,yahoofinance,2020-09-01 08:06:36
Trump’s Payroll Tax Deferral Gets Rolling,yahoofinance,2020-09-01 08:06:36
Tesla's stock pares gains after $5 billion stock offering disclosed,yahoofinance,2020-09-01 08:06:36
"Zoom Video, Apple, Kodak, Dow Futures - 5 Things You Must Know Tuesday",yahoofinance,2020-09-01 08:06:36
"Investors riding high on Apple and Tesla stock splits could get clipped, data shows",yahoofinance,2020-09-01 08:06:36
Solid Insider Buying Puts These 3 Stocks in Focus,yahoofinance,2020-09-01 08:06:36
An ‘extreme’ August on the stock market might be telling us something about the November election,yahoofinance,2020-09-01 08:06:36
Zoom Zooms on Analysts' Upgrades Following Blowout Earnings,yahoofinance,2020-09-01 08:06:36
Stock split behavior confuses billionaire and analysts,yahoofinance,2020-09-01 08:06:36
A Look At Berkshire Hathaway's Top 9 Holdings On Warren Buffett's 90th Birthday,yahoofinance,2020-09-01 08:06:36
Is Apple Stock A Buy After Its 4-For-1 Stock Split?,yahoofinance,2020-09-01 08:06:36
Can Amarin Win Its Vascepa Appeal Case? Analyst Weighs In,yahoofinance,2020-09-01 08:06:36
"U.S. dollar's woes are only beginning, some bears say",yahoofinance,2020-09-01 08:06:36
Here's When Virgin Galactic Could Go From Zero To $1 Billion,yahoofinance,2020-09-01 08:06:36
TikTok Picks Winning Offer Despite Surprise Obstacle From Beijing: Report,yahoofinance,2020-09-01 08:06:36
"‘A man cave on wheels’: My husband’s RV is his pride and joy — but he owes $75,000 on it. If he dies, am I liable?",yahoofinance,2020-09-01 08:06:36
"8 Stocks Turned $10,000 Into $326,178 In 8 Months",yahoofinance,2020-09-01 08:06:36
"Sorrento Stock Is Dashing Towards a Brighter Future, Says Analyst",yahoofinance,2020-09-01 08:06:36
5 of the Best Stocks to Buy for September,yahoofinance,2020-09-01 08:06:36
General Electric (GE) Approaches Key Decision Point,yahoofinance,2020-09-01 08:06:36
Kodak Surges After Hedge Fund D.E. Shaw Purchases 5.2% Stake,yahoofinance,2020-09-01 08:06:36
A big Tesla stock bull says this is one of the most common misperceptions on Tesla,yahoofinance,2020-09-01 08:06:36
"Tesla stock price target raised, but RBC analyst says it is 'fundamentally overvalued'",yahoofinance,2020-09-01 08:06:36
Dividend ETFs To Buy And Watch For 2020,yahoofinance,2020-09-01 08:06:36
Tesla Rival Nio Boosts Share Offering Amid Strong Demand For Electric Car Stocks,yahoofinance,2020-09-01 08:06:36
Kodak Shares Up 31% On Hedge Fund Stake Disclosure,yahoofinance,2020-09-01 08:06:36
These Mining Stocks Are Rising on Higher Gold and Copper Prices. There Are More Gains to Come.,yahoofinance,2020-09-01 08:06:36
Workhorse Stock Is Higher Because the EV Start-up Has a Giant Partner,yahoofinance,2020-09-01 08:06:36
Trump’s payroll tax order will mean bigger paychecks this year — but 2021 is a different story,yahoofinance,2020-09-01 08:06:36
Investors Dump ‘Dead Weight’ Cash-Like ETFs at Record Pace,yahoofinance,2020-09-01 08:06:36
BigCommerce Stock Sags as Wall Street Takes a Cautious View. Morgan Stanley Says Sell.,yahoofinance,2020-09-01 08:06:36
Kodak stock surges after D.E. Shaw takes 5.2% stake,yahoofinance,2020-09-01 08:06:36
Big Oil's patchy deals record casts shadow over green makeover,yahoofinance,2020-09-01 08:06:36
Walmart To Launch 'Ultimate Life Hack' Subscription Service This Month,yahoofinance,2020-09-01 08:06:36
"Huawei Ban to Further Impact Micron’s Business, Says Analyst",yahoofinance,2020-09-01 08:06:36
Is Disney Stock A Buy After An Earnings Surprise And Breakout?,yahoofinance,2020-09-01 08:06:36
"Is American Airlines Stock A Buy? Here's What Earnings, Charts Show",yahoofinance,2020-09-01 08:06:36
"New bull market in stocks could last three years and may produce another 30% in gains, veteran strategist says",yahoofinance,2020-09-01 08:06:36
History reveals September 2020 may be bad for the stock market,yahoofinance,2020-09-01 08:06:36
"Is Visa Stock A Buy Right Now? Here's What Earnings, Visa Chart Show",yahoofinance,2020-09-01 08:06:36
Rackspace stock reverses to rise after hours on first post-IPO earnings,yahoofinance,2020-09-01 08:06:36
Silver Price Forecast – Silver Markets Break Barrier,yahoofinance,2020-09-01 08:06:36
Where Will The World’s Next Giant Gold Discovery Be Made?,yahoofinance,2020-09-01 08:06:36
These Companies Kept Their Dividends but Cut 401(k) Matches,yahoofinance,2020-09-01 08:06:36
Gogo shares soar 31% premarket on news to sell commercial aviation business to Intelsat for $400 million,yahoofinance,2020-09-01 08:06:36
What's New In Solar Energy: A Rundown Of 6 Solar-Related Stocks,yahoofinance,2020-09-01 08:06:36
"Why Buffett's bet on Japan could turn on higher inflation, weakening dollar",yahoofinance,2020-09-01 08:06:36
Schlumberger to merge North America fracking unit with Liberty Oilfield Services,yahoofinance,2020-09-01 08:06:36
Elon Musk Is Now Richer Than Mark Zuckerberg After Tesla Stock Split,yahoofinance,2020-09-01 08:06:36
You Think FAANG Is Distorting the S&P? Consider ATM,yahoofinance,2020-09-01 08:06:36
Nio Sold Stock at $17. What You Need to Know.,yahoofinance,2020-09-01 08:06:36
10 Things You Need to Know About Medicare,yahoofinance,2020-09-01 08:06:36
Penny Stocks to Buy Using Technical Analysis for September 2020,yahoofinance,2020-09-01 08:06:36
Bill Ackman on saving capitalism: Every child in the U.S. could be given enough money at birth to become millionaires by retirement,yahoofinance,2020-09-01 08:06:36
"Dow Jones Futures: Stock Market Rally All About Techs As Tesla Plans Stock Sale, Ultimate Coronavirus Play Zoom Video Spikes On Earnings",yahoofinance,2020-09-01 08:06:36
"Sanofi, Regeneron Rheumatoid Arthritis Drug Proves Ineffective Against COVID-19",yahoofinance,2020-09-01 08:06:36
"No Ordinary Month, Fear September?, Put/Call Ratio, TikTok Bidding War, Amazon",yahoofinance,2020-09-01 08:06:36
Why Stocks Are Rising Even as Investors Pull Out From Equity Funds,yahoofinance,2020-09-01 08:06:36
"If Doing Less Means Saving More, Try These 5 Money Moves",yahoofinance,2020-09-01 08:06:36
Why General Electric's Stock Is Trading Lower Today,yahoofinance,2020-09-01 08:06:36
Novavax Inks Deal To Sell Coronavirus Vaccine To Canada; Stock Rises,yahoofinance,2020-09-01 08:06:36
Ether Price Hits 2-Year High,yahoofinance,2020-09-01 08:06:36
Earnings Preview for At Home Group,yahoofinance,2020-09-01 08:06:36
This graduate degree will be a job magnet as the world recovers from COVID-19,yahoofinance,2020-09-01 08:06:36
"Musk Crosses Zuckerberg To Be World's Third-Richest Person, After Tesla Stock Split",yahoofinance,2020-09-01 08:06:36
Best FANG Stocks ETFs for Q4 2020,yahoofinance,2020-09-01 08:06:36
Selling DirecTV Could Simplify AT&T's Business: BofA Analyst,yahoofinance,2020-09-01 08:06:36
Merkel’s Government in Focus as Lawmakers Deepen Wirecard Probe,yahoofinance,2020-09-01 08:06:36
Goldman Sachs: Bet on These 2 Stocks for Over 30% Returns,yahoofinance,2020-09-01 08:06:36
Tesla Stock Rocketed Higher. It Isn’t Because of the Split.,yahoofinance,2020-09-01 08:06:36
"Dow Jones Falls 150 Points Amid Coronavirus Vaccine News; Apple, Tesla Jump On Stock Splits, But Nio Dives 9%",yahoofinance,2020-09-01 08:06:36
How Does a Progressive Tax System Work?,yahoofinance,2020-09-01 08:06:36
Unusual Options Activity Insight: Carnival,yahoofinance,2020-09-01 08:06:36
"Is Etsy Stock A Buy Right Now? Here's What Earnings, Charts Show",yahoofinance,2020-09-01 08:06:36
Warren Buffett is still being sent cheeseballs from Utz CEO — Here's why,yahoofinance,2020-09-01 08:06:36
"U.S. crackdowns on Huawei prompt chip stockpiling, proposed aid not enough: VLSI Research",yahoofinance,2020-09-01 08:06:36
"Gold Rebounds Toward $2,000 After Dollar Drops to Two-Year Low",yahoofinance,2020-09-01 08:06:36
3 Monster Growth Stocks That Still Have Room to Run,yahoofinance,2020-09-01 08:06:36
"The Fed takes new approach to inflation: What it means for your savings, credit-card debt — and your mortgage rate",yahoofinance,2020-09-01 08:06:36
How Google Could Change The Streaming Space With Kaleidoscope,yahoofinance,2020-09-01 08:06:36
A Preview Of H&R Block's Earnings,yahoofinance,2020-09-01 08:06:36
Three Stocks To Watch As Natural Gas Prices Bounce Back,yahoofinance,2020-09-01 08:06:36
"Zoom Soars on Surging Sales, Forecasts That Swamp Estimates",yahoofinance,2020-09-01 08:06:36
Workers will see smaller paychecks next year under Trump's payroll tax deferral,yahoofinance,2020-09-01 08:06:36
Stock market news live updates: Futures flat as investors look to carry over August momentum,yahoofinance,2020-09-01 08:06:36
Zoom made as much money in three months as it did in all of 2019; stock shoots 22% higher,yahoofinance,2020-09-01 08:06:36
Amazon Gets FAA Approval For Commercial Delivery With Fleet Of Drones,yahoofinance,2020-09-01 08:06:36
Best Tech Stocks To Buy Or Watch Now: 5 Growth Stocks Leading The Stock Market,yahoofinance,2020-09-01 08:06:36
"Stock market news live updates: Wall Street ends best month in decades; Apple, Tesla rally into split",yahoofinance,2020-09-01 08:06:36
Coalition to Bill Barr: Imprison pharma executives for their roles in opioid crisis,yahoofinance,2020-09-01 08:06:36
Buffett’s 1977 Letter Hints at Why He Likes Japan Trading Houses,yahoofinance,2020-09-01 08:06:36
"Chegg: Fall Semester Enrollment Concerns Are Overblown, Says 5-Star Analyst",yahoofinance,2020-09-01 08:06:36
Follow Big Money Instead of Questioning Market's Moves,yahoofinance,2020-09-01 08:06:36
"Bill Gates says this might be ‘the most important thing’ he’s learned from Warren Buffett, who just turned 90",yahoofinance,2020-09-01 08:06:36
"Tesla's stock keeps rising, after soaring 74% in August for biggest monthly gain in 7 years",yahoofinance,2020-09-01 08:06:36
"IBD 50 Stocks To Watch: ASML Tests Support, Builds New Base",yahoofinance,2020-09-01 08:06:36
Mortgage rates tumble toward new all-time lows as refinance fee is delayed,yahoofinance,2020-09-01 08:06:36
IPO Edge’s Jannarone: Buy DMS and Canoo – TD Ameritrade Network,yahoofinance,2020-09-01 08:06:36
Gold Price Prediction – Prices Rise and Recapture Resistance as the Dollar Slides,yahoofinance,2020-09-01 08:06:36
9 Best Stocks in the Nasdaq in August,yahoofinance,2020-09-01 08:06:36
Dollar weakness lifts pound to 8-month highs ahead of Bailey's speech,yahoofinance,2020-09-01 08:06:36
Amazon Now Authorized To Fly Commercial Delivery Drones,yahoofinance,2020-09-01 08:06:36
"How to Diversify Investing in Stocks, Bonds and a Bit Beyond",yahoofinance,2020-09-01 08:06:36
What to do with your money now if the 2020 presidential election is giving you fits,yahoofinance,2020-09-01 08:06:36
Murphy ‘Very Seriously’ Mulling New Jersey Tax on High-Volume Trades,yahoofinance,2020-09-01 08:06:36
Chinese EV Maker Xpeng Stock Soars in First Day of Trading,yahoofinance,2020-09-01 08:06:36
"Fuel Rebound Fizzles, Challenging Economy, Industry",wsj,2020-09-01 08:09:01
Retail Eviction Proceedings Pick Up as Economy Restarts,wsj,2020-09-01 08:09:01
Walmart Tries Again to Find Its Answer to Amazon Prime,wsj,2020-09-01 08:09:01
"American, Delta End Most Domestic Change Fees",wsj,2020-09-01 08:09:01
Key to Preventing Covid-19 Indoors: Ventilation,wsj,2020-09-01 08:09:01
Zoom Boosts Outlook as Sales Surge in Shift to Remote Work,wsj,2020-09-01 08:09:01
Trump Payroll-Tax Deferral Leaves Employers Wary as Plan Starts,wsj,2020-09-01 08:09:01
How Trump Sowed Covid Supply Chaos. ‘Try Getting It Yourselves.’,wsj,2020-09-01 08:09:01
"In France, the Young Lose Their Jobs to Coronavirus",wsj,2020-09-01 08:09:01
The Science of Wildfires: Why They’re Getting More Extreme,wsj,2020-09-01 08:09:01
"From ‘Call of Duty’ to ‘Fortnite,’ Here’s How Videogame Pricing Works",wsj,2020-09-01 08:09:01
Portland Shooting Suspect Identified as Antifa Supporter,wsj,2020-09-01 08:09:01
Coronavirus Has Indians Selling the Family Gold,wsj,2020-09-01 08:09:01
"The College Student’s Guide to Back-to-School Quarantine: Pop-Tarts, Cross-Stitch, Prison Morse Code",wsj,2020-09-01 08:09:01
Beauty Stocks Face New Reality Amid Coronavirus Pandemic,wsj,2020-09-01 08:09:01
Copper Hits Two-Year High on China Rebound,wsj,2020-09-01 08:09:01
"Lee Jae-yong, Samsung’s De Facto Leader, Is Indicted Again",wsj,2020-09-01 08:09:01
Local TV Stations Team Up to Launch Streaming Service,wsj,2020-09-01 08:09:01
Robot Trucks Are Seeking Inroads Into Freight Business,wsj,2020-09-01 08:09:01
"Biden, Trump Teams Plan for Mid-Crisis Transition",wsj,2020-09-01 08:09:01
Massachusetts Primaries Test Grip of Incumbent Democrats,wsj,2020-09-01 08:09:01
"In Kenosha, Protests and Violence Roil Key Presidential Battleground",wsj,2020-09-01 08:09:01
Shinzo Abe’s Departure Throws Wrench Into U.S.-Japan Ties,wsj,2020-09-01 08:09:01
Demand for Houses Boosts Home Construction,wsj,2020-09-01 08:09:01
Apartment Values Stay Solid in Private Market,wsj,2020-09-01 08:09:01
He Decided Not to Play. The Bucks and the NBA Followed.,wsj,2020-09-01 08:09:01
"No Rafa, No Roger, No Towel Service: How the 2020 U.S. Open Will Be Different",wsj,2020-09-01 08:09:01
An Alzheimer’s Quest: Enrolling More Black People in Clinical Trials,wsj,2020-09-01 08:09:01
"Country Songs: Sung, Strummed and Streaming",wsj,2020-09-01 08:09:01
 Top Fed Official Says New Framework Provides More Humble Approach to Setting Rates ,wsj,2020-09-01 08:09:01
" Economy Week Ahead: Factories, Trade and Jobs ",wsj,2020-09-01 08:09:01
" The Fed Lays Out New Goals, but Its Tools Could Be Lacking ",wsj,2020-09-01 08:09:01
 How an Ornate Home Can Avoid Looking Cluttered ,wsj,2020-09-01 08:09:01
 Phil Swift of Infomercial Fame Buys Florida Home for $20 Million ,wsj,2020-09-01 08:09:01
" In the Caribbean and Bahamas, Turnkey Properties Are the Biggest Luxury ",wsj,2020-09-01 08:09:01
 The Padres Go All-In on a World Series Run ,wsj,2020-09-01 08:09:01
 Legendary Georgetown Coach John Thompson Dies at the Age of 78 ,wsj,2020-09-01 08:09:01
 He Decided Not to Play. The Bucks and the NBA Followed. ,wsj,2020-09-01 08:09:01
Should We Forgive All Federal Student-Loan Debt?,wsj,2020-09-01 08:09:01
Readers’ Tips on Having the Estate-Planning Talk With Aging Parents,wsj,2020-09-01 08:09:01
Game Plan: Their Income Took a Coronavirus Hit. Here’s Some Advice.,wsj,2020-09-01 08:09:01
"Apple Can’t Block ‘Fortnite’ Creator From Developer Tools, Judge Rules",wsj,2020-09-01 08:09:01
WPP Shares Climb as It Says the Worst of the Crisis Is Likely Over,wsj,2020-09-01 08:09:01
Facebook CMO Antonio Lucio to Exit,wsj,2020-09-01 08:09:01
"AI, Cloud Aim to Enhance the U.S. Open Fan Experience",wsj,2020-09-01 08:09:01
Data-Center Operators Holding Their Own During Pandemic,wsj,2020-09-01 08:09:01
Tech Companies Adapt Collaborative Culture to Remote Work,wsj,2020-09-01 08:09:01
"Auditors Struggle to Access Data, Count Inventory During Remote Work",wsj,2020-09-01 08:09:01
"Lemonade CFO Promotes Do-Good Status, Path to Profitability to New Investors",wsj,2020-09-01 08:09:01
Volkswagen CFO Plans to Target New Investors With Green Bond,wsj,2020-09-01 08:09:01
U.S. Increasingly Uses Trade Blacklist for Foreign Policy Goals,wsj,2020-09-01 08:09:01
Herbalife Nutrition Agrees to Pay $123 Million to Settle China Bribery Allegations,wsj,2020-09-01 08:09:01
U.K. Regulator Seeks to Expand Financial Crime Reporting Requirements,wsj,2020-09-01 08:09:01
Shipping Lines Learn to Make Money By Balancing Supply and Demand,wsj,2020-09-01 08:09:01
"From ‘Freezer Farms’ to Jets, Logistics Operators Prepare for a Covid-19 Vaccine",wsj,2020-09-01 08:09:01
Today's Logistics Report: Shipping Loads Profits; Building Vaccine Logistics; Asia's Energy for Renewables,wsj,2020-09-01 08:09:01
Macy’s Reports Earnings Tomorrow. Here’s What to Expect.,wsj,2020-09-01 08:09:01
These Mining Stocks Are Rising on Higher Gold and Copper Prices,wsj,2020-09-01 08:09:01
Global Stocks Improve While Dollar Slump Continues,wsj,2020-09-01 08:09:01
FDA approves new Medtronic device for children with Type 1 diabetes,wsj,2020-09-01 08:09:01
"Here’s what could trigger more stock market pullbacks this year, says Schwab trading pro",wsj,2020-09-01 08:09:01
Gold prices rise near two-week high to start September as dollar slumps to around two-year nadir,wsj,2020-09-01 08:09:01
A Turnkey European-Style Chateau on 35 Acres in the Mountains of Colorado,wsj,2020-09-01 08:09:01
High-Tech Cocktails at Home: A Guide To Smart Drink Makers,wsj,2020-09-01 08:09:01
This 13-Acre Compound Comes With Its Own Professional Hockey Rink,wsj,2020-09-01 08:09:01
"Christie’s Asian Art Week Will Feature More Than 1,000 Objects in 12 Auctions",wsj,2020-09-01 08:09:01
"Michael Jordan Rookie Trading Card Sells for a Record $420,000",wsj,2020-09-01 08:09:01
20 Minutes With: Smythson CEO Xavier Rougeaux,wsj,2020-09-01 08:09:01
Opinion | The Democratic State Budget Scare,wsj,2020-09-01 08:09:01
Opinion | Portland’s Half-Century of Ruinous Leadership,wsj,2020-09-01 08:09:01
Opinion | Biden Speaks on the Violence,wsj,2020-09-01 08:09:01
The Science of Wildfires: Why They’re Getting More Extreme,wsj,2020-09-01 08:09:01
Rural Families Struggle With Work and School With No Home Internet,wsj,2020-09-01 08:09:01
North Korea’s New Push to Export Its Propaganda,wsj,2020-09-01 08:09:01
College Town Economies Brace for Covid Blow,wsj,2020-09-01 08:09:01
President Trump’s Full RNC Speech,wsj,2020-09-01 08:09:01
Trump’s RNC Speech Sheds Light on His Re-Election Strategy,wsj,2020-09-01 08:09:01
"Cities After Covid: More Tech, Health and Open Spaces",wsj,2020-09-01 08:09:01
North Korea’s New Push to Export Its Propaganda,wsj,2020-09-01 08:09:01
Portland Shooting Suspect Identified as Antifa Supporter ,wsj,2020-09-01 08:09:01
"Jacob Blake Shooting: What Happened in Kenosha, Wis.? ",wsj,2020-09-01 08:09:01
Opinion: California’s Radical Indoctrination,wsj,2020-09-01 08:09:01
M.B.A. Job Offers Dry Up,wsj,2020-09-01 08:09:01
Who Is Kyle Rittenhouse and What Happened in the Kenosha Shootings? ,wsj,2020-09-01 08:09:01
3 Beaten-Down Dividend Aristocrats We're 'SWANning' With Anyway,seekingalpha,2020-09-01 08:10:49
Wall Street Breakfast: Out With The Fundamentals,seekingalpha,2020-09-01 08:10:49
"AT&T: Bag $20 Billion, Get Rid Of A Problem",seekingalpha,2020-09-01 08:10:49
Stripe: The Internet's Most Undervalued Company,seekingalpha,2020-09-01 08:10:49
"Diageo Buys Aviation Gin, I'm Buying Diageo Stock",seekingalpha,2020-09-01 08:10:49
AT&T Might Not Get $20 Billion For DirecTV,seekingalpha,2020-09-01 08:10:49
"Zoom Video: A Jackpot Quarter, But Don't Chase It Here",seekingalpha,2020-09-01 08:10:49
5 High-Quality Dividend Growth Stocks I Don't Own,seekingalpha,2020-09-01 08:10:49
AT&T: The Potential Benefits Of A DirecTV Sale,seekingalpha,2020-09-01 08:10:49
Energy Stocks To Provide A Safe Haven When The Tech Bubble Bursts,seekingalpha,2020-09-01 08:10:49
Booted Exxon Gets All The Attention While The Big Winner (Chevron) Gets Ignored,seekingalpha,2020-09-01 08:10:49
Tesla raising capital with at-the-market agreement for up to $5B in shares,seekingalpha,2020-09-01 08:10:49
Robinhood and its customers are changing the brokerage industry - here's how,seekingalpha,2020-09-01 08:10:49
AstraZeneca starts U.S. final-stage trial of COVID-19 vaccine,seekingalpha,2020-09-01 08:10:49
Facebook threatens to pull the plug on news sharing Down Under,seekingalpha,2020-09-01 08:10:49
Nasdaq leads gains after best August in decades,seekingalpha,2020-09-01 08:10:49
Stock split mania continues for Tesla and Apple investors,seekingalpha,2020-09-01 08:10:49
Qualcomm gains as former bear upgrades on Huawei benefit,seekingalpha,2020-09-01 08:10:49
Zoom price target raised at BofA after 'unprecedented' results,seekingalpha,2020-09-01 08:10:49
Chesapeake seeks to cancel $300M Energy Transfer contract,seekingalpha,2020-09-01 08:10:49
Penn +4% after Craig-Hallum talks up potential four-bagger within a few years,seekingalpha,2020-09-01 08:10:49
Schlumberger to combine OneStim business with Liberty Oilfield Services,seekingalpha,2020-09-01 08:10:49
"Independent Bank: Earnings Likely To Be Stable, But Risks Are High",seekingalpha,2020-09-01 08:10:49
"Tencent's Dreams, Part II: Investing In The Metaverse",seekingalpha,2020-09-01 08:10:49
Coca-Cola's Friday Breakout,seekingalpha,2020-09-01 08:10:49
Citigroup Short: A Bet On The Falling U.S. Dollar,seekingalpha,2020-09-01 08:10:49
Intel Is Down - Not Out,seekingalpha,2020-09-01 08:10:49
"Baird still believes this pharma will double, after seeing rival data",seekingalpha,2020-09-01 08:10:49
"Needham's medtech look sees continued gains through year-end, names picks",seekingalpha,2020-09-01 08:10:49
KBW examines reinsurance picks in Hurricane Laura's aftermath,seekingalpha,2020-09-01 08:10:49
Baird revisits vertical software favorites for 2021 after 'pause',seekingalpha,2020-09-01 08:10:49
"Evercore weighs comparative growth, COVID opportunities for payment networks",seekingalpha,2020-09-01 08:10:49
"Diageo Buys Aviation Gin, I'm Buying Diageo Stock",seekingalpha,2020-09-01 08:10:49
The Fed At Zero Forever - Tony Dwyer Joins Alpha Trader (Podcast),seekingalpha,2020-09-01 08:10:49
The Week The S&P 500 Closed At New Record Highs Every Day,seekingalpha,2020-09-01 08:10:49
Ethereum: Fairly Valued But Potential For High Returns,seekingalpha,2020-09-01 08:10:49
The Fed's Footprints Are All Over The Financial Markets,seekingalpha,2020-09-01 08:10:49
"Diageo Buys Aviation Gin, I'm Buying Diageo Stock",seekingalpha,2020-09-01 08:10:49
Stripe: The Internet's Most Undervalued Company,seekingalpha,2020-09-01 08:10:49
T-Mobile: A Powerhouse To Contend With,seekingalpha,2020-09-01 08:10:49
Sberbank: Too Big To Fail,seekingalpha,2020-09-01 08:10:49
"AerCap Holdings: Exiting Turbulence, Stock Looks Cheap",seekingalpha,2020-09-01 08:10:49
"CVS Health Offers Investors A Trifecta Of Yield, Growth, And Total Return Potential",seekingalpha,2020-09-01 08:10:49
3 Beaten-Down Dividend Aristocrats We're 'SWANning' With Anyway,seekingalpha,2020-09-01 08:10:49
Frontline: A Medium-Term Dividend Play,seekingalpha,2020-09-01 08:10:49
5 High-Quality Dividend Growth Stocks I Don't Own,seekingalpha,2020-09-01 08:10:49
Welcome To Brighthouse,seekingalpha,2020-09-01 08:10:49
More Downside In Store For KOLD Traders,seekingalpha,2020-09-01 08:10:49
Fading The S&P Oil & Gas Exploration & Production ETF,seekingalpha,2020-09-01 08:10:49
ESPO: The Gaming Boom Is Near Its End,seekingalpha,2020-09-01 08:10:49
QUAL: Recent Underperformance Highlights Limitations Of Strategy,seekingalpha,2020-09-01 08:10:49
Income Lab Ideas: Section 19a Notice Can Be Misleading,seekingalpha,2020-09-01 08:10:49
The Week The S&P 500 Closed At New Record Highs Every Day,seekingalpha,2020-09-01 08:10:49
Ethereum: Fairly Valued But Potential For High Returns,seekingalpha,2020-09-01 08:10:49
The Fed's Footprints Are All Over The Financial Markets,seekingalpha,2020-09-01 08:10:49
Dollar Lurches Lower,seekingalpha,2020-09-01 08:10:49
MLP Monthly Report: August 2020,seekingalpha,2020-09-01 08:10:49
Summer reality check,cnnbusiness,2020-09-01 08:13:06
Corporate America is getting more worried even as stocks soar,cnnbusiness,2020-09-01 08:13:06
"Zoom profit skyrockets 3,300%",cnnbusiness,2020-09-01 08:13:06
Apple is no longer king of the Dow. Meet tech's new leader,cnnbusiness,2020-09-01 08:13:06
'People have died unnecessarily.' Ex-Google CEO Eric Schmidt slams US coronavirus failure,cnnbusiness,2020-09-01 08:13:06
Samsung heir indicted over controversial merger,cnnbusiness,2020-09-01 08:13:06
"Detention of CGTN anchor shows that in Xi Jinping's China, not even the propagandists are safe",cnnbusiness,2020-09-01 08:13:06
Facebook says it will block users in Australia from sharing news if new rules go forward,cnnbusiness,2020-09-01 08:13:06
London asks public to decide fate of slave owner's statue in financial district ,cnnbusiness,2020-09-01 08:13:06
Amazon gets closer to drone delivery with FAA approval,cnnbusiness,2020-09-01 08:13:06
These people have left big cities for good. Here's where they landed,cnnbusiness,2020-09-01 08:13:06
What Congress got wrong about the unemployment insurance benefit,cnnbusiness,2020-09-01 08:13:06
Refi rates at 2.42% APR (15 yr). Do you qualify?,cnnbusiness,2020-09-01 08:13:06
Walmart unveils Walmart+ to take on Amazon Prime,cnnbusiness,2020-09-01 08:13:06
Airlines desperately need people to fly. So the top 3 US carriers dumped change fees,cnnbusiness,2020-09-01 08:13:06
How 'Cobra Kai' went from obscurity to No. 1 on Netflix,cnnbusiness,2020-09-01 08:13:06
