headline,org,date
Pfizer stock rockets as potential COVID-19 vaccine delivery by end of 2020,googlenews,2020-09-15 08:30:35
Pfizer Says It Could Know If Its COVID-19 Vaccine Candidate Works in October,googlenews,2020-09-15 08:30:35
What Jim Cramer Wants to Hear From Pfizer,googlenews,2020-09-15 08:30:35
3 Social Security Must-Knows After Getting Divorced,googlenews,2020-09-15 08:30:35
These mistakes will take a huge bite out of your Social Security income,googlenews,2020-09-15 08:30:35
"Retire this man: After promising to protect the retirement programs, Trump has made mischief with Social Security and Medicare",googlenews,2020-09-15 08:30:35
Letter: Another cruel hoax | SteamboatToday.com,googlenews,2020-09-15 08:30:35
Ghosn's Alleged Accomplice Kelly Faces Tokyo Trial,googlenews,2020-09-15 08:30:35
"Japan begins trial of Nissan, ex-executive over Ghosn's pay",googlenews,2020-09-15 08:30:35
Former Nissan executive Kelly's trial begins in Tokyo without Ghosn,googlenews,2020-09-15 08:30:35
Former Nissan Executive Greg Kelly Pleads Not Guilty at Tokyo Trial,googlenews,2020-09-15 08:30:35
Fed warnings on economy fail to resonate with Congress | TheHill,googlenews,2020-09-15 08:30:35
"First Mover: As Central Banks Print $1.4B an Hour, Bitcoiners Bet on Federal Reserve 'Capture' - CoinDesk",googlenews,2020-09-15 08:30:35
Does the Fed’s Big Spread Help the Economy?,googlenews,2020-09-15 08:30:35
Sound the alarm bells on inflation | TheHill,googlenews,2020-09-15 08:30:35
Regulators Prepare to Reprimand Citigroup for Failing to Improve Risk Systems,googlenews,2020-09-15 08:30:35
Citigroup to Resume Job Cuts After Pausing for Pandemic,googlenews,2020-09-15 08:30:35
Citigroup is trading lower after report that federal regulators could reprimand the bank for not imp,googlenews,2020-09-15 08:30:35
Citigroup May Be Reprimanded by Regulators Over Risk Controls. Shares Fell Almost 6%.,googlenews,2020-09-15 08:30:35
USD/CAD forecast at 1.30 on a three-month horizon – CitiBank,googlenews,2020-09-15 08:30:35
EUR/USD Daily Forecast - Euro Starts The Week On A Positive Note,googlenews,2020-09-15 08:30:35
"I moved into my in-laws’ home. My husband wants to pay his parents’ mortgage, but it will come out of my income. How can I protect myself?",googlenews,2020-09-15 08:30:35
"Nikola shares take wild ride after denial of short-seller’s allegations, report of SEC inquiry",googlenews,2020-09-15 08:30:35
Hobby Lobby raises minimum wage to $17 for full-time employees,googlenews,2020-09-15 08:30:35
Hobby Lobby raises minimum wage to $17,googlenews,2020-09-15 08:30:35
Hobby Lobby to raise minimum wage to $17 per hour,googlenews,2020-09-15 08:30:35
Hobby Lobby raises minimum wage to $17 per hour,googlenews,2020-09-15 08:30:35
New York Sports Club owner files for bankruptcy,googlenews,2020-09-15 08:30:35
Boston Sports Clubs’ owner is filing for bankruptcy. Here’s what that means.,googlenews,2020-09-15 08:30:35
New York Sports Clubs' owner files for bankruptcy after forced gym closures,googlenews,2020-09-15 08:30:35
"New York Sports Club owner files for bankruptcy, with gyms hit by pandemic",googlenews,2020-09-15 08:30:35
Free Spicy Chicken McNuggets: McDonald's offering 'Spicesurance' buy-one-get-one deal Wednesday on app,googlenews,2020-09-15 08:30:35
"China's August Output, Retail Sales Beat Estimates",googlenews,2020-09-15 08:30:35
"China’s Economy Picks Up Speed as Shoppers, Moviegoers Return",googlenews,2020-09-15 08:30:35
China's economic recovery gained speed in August,googlenews,2020-09-15 08:30:35
"China's retail sales rise the first time this year in August, as the world's second largest economy recovers from the pandemic | Markets",googlenews,2020-09-15 08:30:35
Beyond Meat Is Launching This Brand New Item In Grocery Stores,googlenews,2020-09-15 08:30:35
Beyond Meat to launch meatless 'meatballs' at grocery stores in October - Business Insider,googlenews,2020-09-15 08:30:35
Beyond Meatballs Coming To Grocery Stores Nationwide,googlenews,2020-09-15 08:30:35
"How to get free Beyond Meatballs in LA on Wednesday, Sept. 16",googlenews,2020-09-15 08:30:35
"Gold price ""coiling"" suggests bigger move coming soon",googlenews,2020-09-15 08:30:35
Gold hits near 2-week peak on softer dollar; focus on Fed meeting,googlenews,2020-09-15 08:30:35
Gold Price Eyes Bullish Breakout as USD Drops Ahead of FOMC,googlenews,2020-09-15 08:30:35
The U.S. Dollar Through The End Of The Year,googlenews,2020-09-15 08:30:35
Macy’s Thanksgiving Day Parade to be virtual this year,googlenews,2020-09-15 08:30:35
Macy's Thanksgiving Parade 're-imagined' as television-only event this year,googlenews,2020-09-15 08:30:35
"Macy's Thanksgiving Day Parade will be TV-only event, without live procession",googlenews,2020-09-15 08:30:35
Eye On The Day 9/15,googlenews,2020-09-15 08:30:35
"Snowflake bumps expected IPO price by about 30%, could debut at more than $30 billion valuation",googlenews,2020-09-15 08:30:35
"Snowflake IPO: Don't Overpay, $50 Target Price",googlenews,2020-09-15 08:30:35
In defence of the IPO,googlenews,2020-09-15 08:30:35
IPO market gears up for busiest week since May 2019 — when Uber went public — with 12 deals on tap,googlenews,2020-09-15 08:30:35
Analyst breaks down Nvidia deal to buy ARM Holdings from Softbank for $40 billion,googlenews,2020-09-15 08:30:35
The State of Play on Airline Bailouts,googlenews,2020-09-15 08:30:35
Nvidia Buys Arm? Don't Count On It,googlenews,2020-09-15 08:30:35
Opinion: Nvidia's bad deal is not yet done,googlenews,2020-09-15 08:30:35
"Amazon hiring 100000 workers in US, Canada to keep up with surge in online shopping",googlenews,2020-09-15 08:30:35
Amazon Hiring Spree: Company Looking To Add 650 Jobs In Boston Area,googlenews,2020-09-15 08:30:35
Amazon to hire 600 new workers across Lehigh Valley as part of big national hiring push,googlenews,2020-09-15 08:30:35
"Amazon hiring again: 100,000 full- and part-time openings",googlenews,2020-09-15 08:30:35
Didn't receive a stimulus check? The IRS wants to help you.,googlenews,2020-09-15 08:30:35
IRS to send out notices to non-filers who may be eligible for money,googlenews,2020-09-15 08:30:35
How to know if you're one of the qualifying adults who could get a second stimulus check,googlenews,2020-09-15 08:30:35
Facebook buys an unused headquarters even as more employees work remotely,googlenews,2020-09-15 08:30:35
"Facebook buys REI’s new HQ for $367M, expanding Seattle-area footprint beyond 3M square feet",googlenews,2020-09-15 08:30:35
Facebook buying REI's never-used new headquarters building,googlenews,2020-09-15 08:30:35
Facebook Takes Advantage Of Pandemic To Score REI's Sprawling Seattle Area Headquarters,googlenews,2020-09-15 08:30:35
San Antonio City Council members are revisiting binging Chick-fil-A to the airport,googlenews,2020-09-15 08:30:35
"San Antonio says city not ordered to bring Chick-fil-A to the airport, despite Paxton's statement",googlenews,2020-09-15 08:30:35
AG Paxton: Chick-fil-A now allowed in San Antonio airport after religious belief ban reversal,googlenews,2020-09-15 08:30:35
Chick-fil-A no longer pursuing restaurant at San Antonio airport after chain's plans denied more than a year ago,googlenews,2020-09-15 08:30:35
Microsoft's underwater data centre resurfaces after two years,googlenews,2020-09-15 08:30:35
"Microsoft reveals findings from Project Natick, its experimental undersea datacenter",googlenews,2020-09-15 08:30:35
Microsoft retrieves its experimental underwater data center,googlenews,2020-09-15 08:30:35
Microsoft's Underwater Data Center Rises From the Seafloor a Grimy Success,googlenews,2020-09-15 08:30:35
"OPEC Lowers Forecast for Oil Demand, Prices Slip",googlenews,2020-09-15 08:30:35
"OPEC cuts 2020 oil demand forecast, trims 2021 outlook on pandemic fallout",googlenews,2020-09-15 08:30:35
Is OPEC's Power Over the Oil Market Broken?,googlenews,2020-09-15 08:30:35
Is OPEC’s Power Over the Oil Market Broken?,googlenews,2020-09-15 08:30:35
Lego is replacing its clear plastic bags with recyclable paper,googlenews,2020-09-15 08:30:35
Lego to switch to eco-friendly paper bags in its packaging,googlenews,2020-09-15 08:30:35
Lego unveils $400m investment to drive low-carbon transition and single-use plastic phase-out,googlenews,2020-09-15 08:30:35
The LEGO Group to invest $400 million in sustainability drive,googlenews,2020-09-15 08:30:35
"2022 Hyundai Tucson: Design, Interior, Engines, Photos",googlenews,2020-09-15 08:30:35
2022 Tucson Global Reveal | Hyundai,googlenews,2020-09-15 08:30:35
"Almost 190,000 Hyundai And Kia Models Recalled Due To ABS Issue",googlenews,2020-09-15 08:30:35
2021 Hyundai Tucson Debuts Today: See The Livestream Right Here,googlenews,2020-09-15 08:30:35
"Gilead to buy Immunomedics, expanding cancer drug portfolio",googlenews,2020-09-15 08:30:35
Immunomedics soars 106% after Gilead agrees to acquire the cancer-drug company for $21 billion | Markets,googlenews,2020-09-15 08:30:35
Gilead's $21 Billion Deal Splurge May End in Regret,googlenews,2020-09-15 08:30:35
Gilead Sciences to acquire Immunomedics in $21 billion deal,googlenews,2020-09-15 08:30:35
AstraZeneca resumes COVID vaccine trials halted by patient illness,googlenews,2020-09-15 08:30:35
Vaccine trial resumes as virus continues grim march,googlenews,2020-09-15 08:30:35
"Pfizer, Trump, Fauci Give Timelines for New Coronavirus Vaccine",googlenews,2020-09-15 08:30:35
"Americans could get COVID vaccine shot before year-end, Pfizer CEO says",googlenews,2020-09-15 08:30:35
Pfizer and BioNTech Propose Expansion of Pivotal COVID-19 Vaccine Trial,googlenews,2020-09-15 08:30:35
Eli Lilly CEO on drug that could aid Covid-19 recovery when paired with remdesivir,googlenews,2020-09-15 08:30:35
Eli Lilly's drug cuts COVID-19 recovery time in remdesivir-combo study,googlenews,2020-09-15 08:30:35
Lily drug found to shorten COVID-19 hospital stay,googlenews,2020-09-15 08:30:35
Drugmaker says anti-inflamatory medicine may shorten COVID-19 recovery time | TheHill,googlenews,2020-09-15 08:30:35
"Personal information of roughly 46,000 veterans exposed in VA hack",googlenews,2020-09-15 08:30:35
"Attack on VA computer systems exposed personal information of about 46,000 veterans",googlenews,2020-09-15 08:30:35
Data Breach Hits 46000 US Veterans,googlenews,2020-09-15 08:30:35
46000 Veterans' Data Exposed In Financial Services Center Breach,googlenews,2020-09-15 08:30:35
Tallahassee's bars and breweries reopen their doors at half capacity,googlenews,2020-09-15 08:30:35
Most Florida bars can reopen at 50% capacity today,googlenews,2020-09-15 08:30:35
Tampa Bay area bars still cautious as state allows them to reopen,googlenews,2020-09-15 08:30:35
Florida Bars Reopen Monday After Months of Being Closed,googlenews,2020-09-15 08:30:35
"Daimler AG, Mercedes-Benz to Pay $1.5 Billion to Settle Emissions Case",googlenews,2020-09-15 08:30:35
"Another diesel exhaust cheat scheme, this time with Mercedes-Benz",googlenews,2020-09-15 08:30:35
Daimler to pay $1.5bn over emissions cheat claims in US,googlenews,2020-09-15 08:30:35
Daimler to pay $1.5 billion in emissions cheating settlement with the US,googlenews,2020-09-15 08:30:35
Subway commuters in NYC to face fine for not wearing mask,googlenews,2020-09-15 08:30:35
MTA Begins Fining Riders For Lack Of Face Coverings,googlenews,2020-09-15 08:30:35
"Business leaders seek NYC aid from Trump, bypass de Blasio and Cuomo",googlenews,2020-09-15 08:30:35
Police issuing warnings — but not fines — on first day of MTA mask crackdown,googlenews,2020-09-15 08:30:35
Salt Lake City School District classes begin,googlenews,2020-09-15 08:30:35
"Exclusive first look at Delta’s largest, brand-new Sky Club in Salt Lake City",googlenews,2020-09-15 08:30:35
Proposed housing development north of Salt Lake City International Airport has lots of opponents,googlenews,2020-09-15 08:30:35
Salt Lake City leaders try to tackle vacant building problem,googlenews,2020-09-15 08:30:35
Amazon Launches Luxury Stores on Its Mobile App With Oscar de la Renta as First Brand Partner,googlenews,2020-09-15 08:30:35
"Woman approved for COVID-19 relief aid, but then bank freezes her accounts",googlenews,2020-09-15 08:30:35
"Fraud reports rise as banks dole out PPP loans, report finds",googlenews,2020-09-15 08:30:35
A warning about Paycheck Protection loans,googlenews,2020-09-15 08:30:35
PPP loans: $165M went to Shore employers showing no jobs saved. Some say feds never asked,googlenews,2020-09-15 08:30:35
Mall owner Simon Property Group will keep stores closed on Thanksgiving,googlenews,2020-09-15 08:30:35
"2 Upstate malls will be closed Thanksgiving Day, officials say",googlenews,2020-09-15 08:30:35
Three of Pittsburgh’s most popular shopping centers will be closed on Thanksgiving,googlenews,2020-09-15 08:30:35
Simon Malls closed on Thanksgiving,googlenews,2020-09-15 08:30:35
Verizon to Buy TracFone in Deal Valued at Nearly $7 Billion,googlenews,2020-09-15 08:30:35
Verizon CEO Hans Vestberg on acquisition of pre-paid phone provider Tracfone,googlenews,2020-09-15 08:30:35
Verizon acquires Tracfone in a deal worth more than $6 billion,googlenews,2020-09-15 08:30:35
Verizon to Acquire Tracfone for $6+ Billion,googlenews,2020-09-15 08:30:35
Pharma CEO warns that millions worldwide won't get COVID vaccine until 2024,googlenews,2020-09-15 08:30:35
Novavax aims for two billion COVID-19 vaccine doses with expanded Serum Institute deal,googlenews,2020-09-15 08:30:35
"Coronavirus Vaccine Won't Be Available to Everyone Until 2024, CEO of World's Biggest Producer Says",googlenews,2020-09-15 08:30:35
"There Won't Be Enough COVID Vaccines for Everybody Until 2024, Warn Vaccine Makers",googlenews,2020-09-15 08:30:35
Global report: Covid cases near 30m as China expects vaccine as soon as November,googlenews,2020-09-15 08:30:35
AstraZeneca Resumes U.K. Clinical Trials of Its Coronavirus Vaccine After a Safety Pause,googlenews,2020-09-15 08:30:35
"Valneva signs $1.6B supply, development agreement with UK for coronavirus vaccine hopeful",googlenews,2020-09-15 08:30:35
Exclusive: AstraZeneca COVID-19 vaccine trial in US on hold until at least midweek - sources,googlenews,2020-09-15 08:30:35
General Motors to unveil Hummer EV pickup with 'crab mode' in October,googlenews,2020-09-15 08:30:35
GMC HUMMER EV | “A Revolutionary Turn” | GMC,googlenews,2020-09-15 08:30:35
Here's What the GMC Hummer EV's 'Crab Mode' Looks Like in Action,googlenews,2020-09-15 08:30:35
The Electric Hummer's Crab Walk Is One Of Its Party Tricks,googlenews,2020-09-15 08:30:35
"ESPN enters co-exclusive agreement with Caesars, DraftKings",googlenews,2020-09-15 08:30:35
"Caesars, DraftKings ink ESPN deals; AGA intros new betting marketing code",googlenews,2020-09-15 08:30:35
DraftKings surges after announcing ESPN deal,googlenews,2020-09-15 08:30:35
DraftKings and Caesars shares soar following ESPN deal,googlenews,2020-09-15 08:30:35
Walmart+ membership 'the first of 10 steps' needed to ramp up heavyweight Amazon rivalry,googlenews,2020-09-15 08:30:35
Walmart Plus launches Tuesday,googlenews,2020-09-15 08:30:35
Walmart Plus launches today — here's everything you need to know,googlenews,2020-09-15 08:30:35
"Walmart launches Amazon Prime subscription competitor, 'Walmart+'",googlenews,2020-09-15 08:30:35
Park MGM on Las Vegas Strip to reopen as smoke-free casino,googlenews,2020-09-15 08:30:35
This Will Be the First Smoke-free Casino Resort on the Las Vegas Strip,googlenews,2020-09-15 08:30:35
Park MGM Confirms It Will Be Smoke-Free Upon Reopening Sep. 30,googlenews,2020-09-15 08:30:35
Park MGM set to reopen Sept. 30,googlenews,2020-09-15 08:30:35
Delta will use frequent-flyer program to back $6.5 billion in debt,googlenews,2020-09-15 08:30:35
Delta leverages frequent flyer program to borrow $6.5 billion,googlenews,2020-09-15 08:30:35
Delta Air Lines Lifts the Curtain on Its SkyMiles Program,googlenews,2020-09-15 08:30:35
Delta Air Lines guides September capacity to be down ~60% Y/Y,googlenews,2020-09-15 08:30:35
Google plans to power its operations with carbon-free energy by 2030,googlenews,2020-09-15 08:30:35
Google says its carbon footprint is now zero,googlenews,2020-09-15 08:30:35
Google announced one of the biggest green pledges from tech yet,googlenews,2020-09-15 08:30:35
Google to run entire business on carbon-free energy by 2030,googlenews,2020-09-15 08:30:35
Taco Bell is now selling its own custom wine,googlenews,2020-09-15 08:30:35
"Taco Bell unveils new house wine, Jalapeño Noir",googlenews,2020-09-15 08:30:35
Taco Bell rolls out 'Jalapeno Noir' wine only available in Canada,googlenews,2020-09-15 08:30:35
Taco Bell is Now Selling Its Own Wine,googlenews,2020-09-15 08:30:35
China Books Biggest U.S. Corn Sale Since Sept. 1,googlenews,2020-09-15 08:30:35
DATA: Four reasons why Chinese purchases of US soybeans may slow,googlenews,2020-09-15 08:30:35
"Soybeans top $10/bushel on Chinese demand, smaller U.S. crop",googlenews,2020-09-15 08:30:35
Record-high wheat production in September - WASDE,googlenews,2020-09-15 08:30:35
Walmart and Zipline team up to bring their own drone delivery to the U.S.,googlenews,2020-09-15 08:30:35
Amazon and Walmart's emerging delivery drone battle escalates with Zipline deal,googlenews,2020-09-15 08:30:35
Walmart launches drone delivery in Northwest Arkansas,googlenews,2020-09-15 08:30:35
Zipline Partners With Walmart on Commercial Drone Delivery,googlenews,2020-09-15 08:30:35
ASU President sent AZDHS director a letter about concerns over bars on Mill Ave.,googlenews,2020-09-15 08:30:35
Berkshire Hathaway’s BNSF Railway Names Kathryn Farmer as CEO,googlenews,2020-09-15 08:30:35
BNSF names Kathryn Farmer as its next CEO,googlenews,2020-09-15 08:30:35
She has worked at this Fort Worth railroad for almost 3 decades. Now she’ll lead it.,googlenews,2020-09-15 08:30:35
"Matt Igoe Named Executive Vice President, Operations",googlenews,2020-09-15 08:30:35
JPMorgan CEO Dimon says economic recovery could be derailed,googlenews,2020-09-15 08:30:35
JPMorgan chief: Young workers’ productivity slipped at home – especially Mondays and Fridays,googlenews,2020-09-15 08:30:35
JPMorgan’s WFH model changed worker productivity—especially on two days of the week,googlenews,2020-09-15 08:30:35
JPMorgan’s Jamie Dimon Tells Analysts Reserve Releases Could Come,googlenews,2020-09-15 08:30:35
PepsiCo to launch drink to aid sleep as consumers struggle with stress,googlenews,2020-09-15 08:30:35
Pepsi to release new beverage meant to help people fall asleep,googlenews,2020-09-15 08:30:35
How PepsiCo Plans to Fight Coronavirus Insomnia,googlenews,2020-09-15 08:30:35
PepsiCo is launching a drink to get a piece of the $1 billion sleep aid industry,googlenews,2020-09-15 08:30:35
"Peeps Won't Produce Christmas, Halloween or Valentine's Treats",googlenews,2020-09-15 08:30:35
"Company behind Peeps says candy won’t be available for Halloween, Christmas due to pandemic",googlenews,2020-09-15 08:30:35
"No Halloween, Christmas Peeps this year due to COVID-19 related production halt",googlenews,2020-09-15 08:30:35
There will be no Peeps this Halloween,googlenews,2020-09-15 08:30:35
Venus de Milo in Swansea to be sold; food to star elsewhere | Gallery,googlenews,2020-09-15 08:30:35
Venus de Milo to close; landmark banquet hall up for sale,googlenews,2020-09-15 08:30:35
"The Venus de Milo is up for sale; deposits will be returned immediately, owner says",googlenews,2020-09-15 08:30:35
Venus de Milo for Sale for $4.75 Million,googlenews,2020-09-15 08:30:35
Klarna raises $650 million at a $10.6 billion valuation,googlenews,2020-09-15 08:30:35
Klarna Valued At $10.65B After $650M Funding Round,googlenews,2020-09-15 08:30:35
Silver Lake-Led Group Pours $650 Million Into Payments Company Klarna,googlenews,2020-09-15 08:30:35
Fintech Startup Klarna Is Valued at $10.65 Billion in New Funding,googlenews,2020-09-15 08:30:35
Elon Musk Rebuts Bill Gates on Tesla Semi,googlenews,2020-09-15 08:30:35
Tesla’s 12V batteries set to receive major improvements through software update,googlenews,2020-09-15 08:30:35
Tesla HVAC: Elon Musk teases “super-efficient” home energy system,googlenews,2020-09-15 08:30:35
Elon Musk thinks baby X Æ A-12’s name sounds like a password,googlenews,2020-09-15 08:30:35
Manhattan’s Newest Skyscraper Opens Up to a Dead Midtown,googlenews,2020-09-15 08:30:35
Manhattan's Newest Skyscraper Is Officially Open,googlenews,2020-09-15 08:30:35
One Vanderbilt Officially Opens in Midtown East,googlenews,2020-09-15 08:30:35
Iconic new tower opens as pandemic crushes Manhattan office market,googlenews,2020-09-15 08:30:35
A guide to CBD products with Professor Mike Barnes,googlenews,2020-09-15 08:30:35
"Medical Marijuana Should Be Legal For Toothaches, Texas Agriculture Commissioner Says",googlenews,2020-09-15 08:30:35
New Guidelines Issued on Medical Cannabis for Chronic Pain,googlenews,2020-09-15 08:30:35
Hemp industry aims to break into health and wellness market,googlenews,2020-09-15 08:30:35
Dow Jones Futures: Stock Market Rally Gets A Win; Apple In Buy Zone; Tesla Rival Nikola Sinks On SEC Probe,googlenews,2020-09-15 08:30:35
"Global Cues: Nifty set for +ve open, Dow Fut up 200 pts, S&P Futures up 0.6%, Nasdaq Futures up 1%",googlenews,2020-09-15 08:30:35
19 Stocks That Have Bucked a Wicked September,googlenews,2020-09-15 08:30:35
Market rebounds as technology leads a broad bounce-back,googlenews,2020-09-15 08:30:35
Morning Brief: Net metering still under attack by utilities and institutional corruption,googlenews,2020-09-15 08:30:35
Why the era of solar specialization is over: Part II,googlenews,2020-09-15 08:30:35
"US Solar Power — Hit, Kicked, But Still Running",googlenews,2020-09-15 08:30:35
"Report finds 7,332 schools nationwide using solar power",googlenews,2020-09-15 08:30:35
"Got $1,000? Here Are 3 Stocks to Consider Buying Right Now",motleyfool,2020-09-15 08:32:50
4 Investing Lessons You Can Learn From Warren Buffett,motleyfool,2020-09-15 08:32:50
"Second Coronavirus Market Correction: Where You'll Want to Invest $1,000",motleyfool,2020-09-15 08:32:50
2 Great Financial Stocks You Can Buy on Sale,motleyfool,2020-09-15 08:32:50
You Should Be More Than Halfway to Earning 3 Valuable Tax Breaks,motleyfool,2020-09-15 08:32:50
"If You Invested $5,000 in Vaxart in the March Market Crash, This Is How Much You'd Have Today",motleyfool,2020-09-15 08:32:50
Where Will AT&T Be in 5 Years?,motleyfool,2020-09-15 08:32:50
4 Asset Allocation Mistakes and How You Can Avoid Them,motleyfool,2020-09-15 08:32:50
4 Things Dave Ramsey Gets Wrong About Investing,motleyfool,2020-09-15 08:32:50
How Risky Is Square?,motleyfool,2020-09-15 08:32:50
Better Buy: Disney vs. Target,motleyfool,2020-09-15 08:32:50
9.1%-Yielding CenturyLink Changes Its Name to Lumen: What It Means for Investors,motleyfool,2020-09-15 08:32:50
Zscaler Postponed Its Long-Term Profitability Goal: Should Shareholders Worry?,motleyfool,2020-09-15 08:32:50
Retired? Here's How to Avoid Getting Hurt by a Stock Market Crash,motleyfool,2020-09-15 08:32:50
1 Thing to Look for During Tesla's Battery Day,motleyfool,2020-09-15 08:32:50
Is the Worst Over for Bank of America?,motleyfool,2020-09-15 08:32:50
Is Vaxart a Good Coronavirus Stock to Buy?,motleyfool,2020-09-15 08:32:50
"Could You Live on $22,212 in Retirement?",motleyfool,2020-09-15 08:32:50
What's Fueling Growth at Thermo Fisher Scientific?,motleyfool,2020-09-15 08:32:50
Pot Stock Aurora Cannabis Finally Faces the Music,motleyfool,2020-09-15 08:32:50
Delta Air Lines Lifts the Curtain on Its SkyMiles Program,motleyfool,2020-09-15 08:32:50
4 Investing Lessons You Can Learn From Warren Buffett,motleyfool,2020-09-15 08:32:50
"Second Coronavirus Market Correction: Where You'll Want to Invest $1,000",motleyfool,2020-09-15 08:32:50
Unity Software's IPO Just Took a Bizarre Twist,motleyfool,2020-09-15 08:32:50
"If You're Retired, Consider Buying These 3 Stocks",motleyfool,2020-09-15 08:32:50
1 Question Berkshire Hathaway Has to Answer,motleyfool,2020-09-15 08:32:50
Could This COVID-19 Drug Developer's Stock Make You Filthy Rich?,motleyfool,2020-09-15 08:32:50
Should You Buy Vir Biotechnology Stock on the Dip?,motleyfool,2020-09-15 08:32:50
3 Reasons Zoom Video Communications Stock Still Looks Like a Long-Term Winner,motleyfool,2020-09-15 08:32:50
3 Things in Green Thumb's Q2 Results That Make It a Great Buy Now,motleyfool,2020-09-15 08:32:50
Is Biogen Stock a Buy?,motleyfool,2020-09-15 08:32:50
Why Investors Don't Fear a Stock Market Crash,motleyfool,2020-09-15 08:32:50
Should You Buy Gilead Now That It's Acquiring Immunomedics?,motleyfool,2020-09-15 08:32:50
These 3 Coronavirus Stocks Could More Than Double by the End of 2020,motleyfool,2020-09-15 08:32:50
"5 ""Buffett Stocks"" Buffett Didn't Actually Buy",motleyfool,2020-09-15 08:32:50
"Got $1,000? Here Are 3 Stocks to Consider Buying Right Now",motleyfool,2020-09-15 08:32:50
Here's Why 62 Is the Perfect Age to Claim Social Security,motleyfool,2020-09-15 08:32:50
How Novavax Is Keeping Up With the Big Players in the Coronavirus Vaccine Race,motleyfool,2020-09-15 08:32:50
2 Great Financial Stocks You Can Buy on Sale,motleyfool,2020-09-15 08:32:50
4 Stocks That'll Make Robinhood Investors Richer,motleyfool,2020-09-15 08:32:50
"Excited About AstraZeneca's Coronavirus Vaccine, Are Investors Immune to the Bigger Picture?",motleyfool,2020-09-15 08:32:50
Charlotte's Web Falls on Q2 Misses,motleyfool,2020-09-15 08:32:50
"Unity Software, an Epic Games Competitor, Is Going Public This Week",motleyfool,2020-09-15 08:32:50
Video Game Sales Up 37% Year Over Year in August,motleyfool,2020-09-15 08:32:50
US stock futures tick up ahead of economic data,foxbusiness,2020-09-15 08:34:58
Netflix's 'Cuties' prompts 'churn' as domestic subscribers flee,foxbusiness,2020-09-15 08:34:58
No coronavirus vaccine for entire world until 2024... at best: CEO of producer,foxbusiness,2020-09-15 08:34:58
