headline,org,date
Top Wall Street analysts say buy stocks like Netflix and Alphabet amid renewed market volatility,msnmoney,2020-10-25 09:20:46
Private colleges with the best return on investment,msnmoney,2020-10-25 09:20:46
How to buy Apple devices without paying Apple prices,msnmoney,2020-10-25 09:20:46
What to do right now if you've lost your job,msnmoney,2020-10-25 09:20:46
No pension. No 401(k). How to get by on Social Security,msnmoney,2020-10-25 09:20:46
"Internet Providers Don't Want You Buying One, But They're Not Illegal",msnmoney,2020-10-25 09:20:46
Saudi Chemicals Maker Sabic Posts Profit as Demand Revives,msnmoney,2020-10-25 09:20:46
Smart things for singles and couples to buy from Costco,msnmoney,2020-10-25 09:20:46
Here's the Average Social Security Benefit in 2021,msnmoney,2020-10-25 09:20:46
"Grandma Lived With Hunched Back For Years, Until She Did This",msnmoney,2020-10-25 09:20:46
9 ways to give yourself a stimulus check (and forget Washington),msnmoney,2020-10-25 09:20:46
Not Everyone Is Feeling The Pandemic Equally ,msnmoney,2020-10-25 09:20:46
"ANA Holdings to Slash 3,500 Jobs, Transfer Workers, Yomiuri Says",msnmoney,2020-10-25 09:20:46
Cost of oil the year you were born,msnmoney,2020-10-25 09:20:46
57 money facts that seem too weird to be true,msnmoney,2020-10-25 09:20:46
"The Best-Paying, Fastest-Growing Jobs in Each State",msnmoney,2020-10-25 09:20:46
"Lee Kun-hee, Korean Icon Who Transformed Samsung, Dies at 78",msnmoney,2020-10-25 09:20:46
Facts no one knows about Rat Pack member Dean Martin,msnmoney,2020-10-25 09:20:46
Common household items that are worth money,msnmoney,2020-10-25 09:20:46
Gen Z homebuyers like this Utah city the best,msnmoney,2020-10-25 09:20:46
How COVID-19 Has Transformed the Way We Spend,msnmoney,2020-10-25 09:20:46
Vedanta’s Debt Maturities Are Prompting Credit Rating Warnings,msnmoney,2020-10-25 09:20:46
What to do if you win a million dollars,msnmoney,2020-10-25 09:20:46
Most wine drinkers in the US don't know these 5 simple Dos and Don'ts,msnmoney,2020-10-25 09:20:46
From the Bronx to Bel Air: J.Lo's amazing property portfolio,msnmoney,2020-10-25 09:20:46
Home projects you should tackle this fall,msnmoney,2020-10-25 09:20:46
American Airlines plans customer tours of Boeing 737 Max and pilot calls to boost confidence in jets,msnmoney,2020-10-25 09:20:46
"As Apple Hits $2 Trillion, Which Stocks Are Headed the Other Direction?",msnmoney,2020-10-25 09:20:46
The 10 Best U.S. Cities for Remote Workers,msnmoney,2020-10-25 09:20:46
Americans Are Obsessed With New Blanket That Puts You To Sleep In Minutes,msnmoney,2020-10-25 09:20:46
Best small college in every state,msnmoney,2020-10-25 09:20:46
"‘It’s daunting to think about what the consequences will be.’ With no stimulus deal, much of America’s temporary financial safety net will expire Dec. 31",msnmoney,2020-10-25 09:20:46
"10 countries where you can retire on just $100,000",msnmoney,2020-10-25 09:20:46
Opinion: ‘Trump stocks’ have significantly lagged the U.S. market since 2016 — while ‘Clinton stocks’ have soared,msnmoney,2020-10-25 09:20:46
8 Major Retailers Closed for Thanksgiving This Year,msnmoney,2020-10-25 09:20:46
23 New Gadgets That Will Sell Out Before Holidays,msnmoney,2020-10-25 09:20:46
"Children in West Africa are working night shifts to fuel a $100-billion chocolate industry that has failed to crack down on child labor, a US government-commissioned report found",msnmoney,2020-10-25 09:20:46
Things every retiree should get rid of,msnmoney,2020-10-25 09:20:46
60% of Retirement Savers Who Made This Financial Decision Regret It,msnmoney,2020-10-25 09:20:46
Warning signs a job isn't as good as it sounds,msnmoney,2020-10-25 09:20:46
How a 21-year-old CEO landed $3.5 million for software that he originally built to help his mom's struggling dog grooming business keep repeat customers,msnmoney,2020-10-25 09:20:46
"Before you renew Amazon Prime, read this",msnmoney,2020-10-25 09:20:46
When renting a house is better than buying,msnmoney,2020-10-25 09:20:46
The best county for retirees in every single state,msnmoney,2020-10-25 09:20:46
How a Biden presidency could affect seniors,msnmoney,2020-10-25 09:20:46
Google's long-time rivals say DOJ antitrust suit shows it's lost its 'halo' in the eyes of regulators,msnmoney,2020-10-25 09:20:46
Things you should never try to sell on eBay,msnmoney,2020-10-25 09:20:46
Open Enrollment Is Now! Find Out About Your Medicare Options,msnmoney,2020-10-25 09:20:46
Can't find your dream home? Unlisted houses might be your answer,msnmoney,2020-10-25 09:20:46
Best and Worst States for Pensions,msnmoney,2020-10-25 09:20:46
"More Macy's Stores May Be Dark for the Holidays, and That's a Good Thing",msnmoney,2020-10-25 09:20:46
"Netflix, Redbox and more of the best and worst company makeovers",msnmoney,2020-10-25 09:20:46
Maxing Out Your 401(k) Can Make You a Millionaire By 45,msnmoney,2020-10-25 09:20:46
1 Simple Trick to Cut Your Electric Bill by 90%,msnmoney,2020-10-25 09:20:46
Unique tiny homes around the world,msnmoney,2020-10-25 09:20:46
"Opinion: S&P 500 corporate boards lack diversity, but these top companies are leading change — and the stock market rewards them",msnmoney,2020-10-25 09:20:46
"You Can Buy a Vacation Home for Under $200,000 in These Cities",msnmoney,2020-10-25 09:20:46
"Mortgage rates dive deeper, extending the boon for borrowers",msnmoney,2020-10-25 09:20:46
25 Top-Paying Dividend Stocks That Will Make You Rich,msnmoney,2020-10-25 09:20:46
Postal Service awards $5 million contract to DeJoy's former company,msnmoney,2020-10-25 09:20:46
Terrifying Culprit that Destroys Arteries - Handled,msnmoney,2020-10-25 09:20:46
Industries With the Biggest (and Smallest) Racial Pay Gap,msnmoney,2020-10-25 09:20:46
Where Will American Homes 4 Rent Be in 3 Years?,msnmoney,2020-10-25 09:20:46
Reasons Your Unemployment Claim Was Rejected — And How To Fix It,msnmoney,2020-10-25 09:20:46
Opinion: How to invest in the S&P 500 without betting hard on the ‘FAAMG’ stocks that are 20% of the index,msnmoney,2020-10-25 09:20:46
Celebrities Who Have Lost Millions During COVID-19,msnmoney,2020-10-25 09:20:46
Are We Headed for Another Foreclosure Crisis? 9 Housing Experts Share Their Predictions,msnmoney,2020-10-25 09:20:46
Drone Captures What No One Was Supposed To See,msnmoney,2020-10-25 09:20:46
10 Steps to Help Get Your Career Back on Track,msnmoney,2020-10-25 09:20:46
Media executives are finally accepting the decline of cable TV as they plot a new path forward,msnmoney,2020-10-25 09:20:46
15 Mighty Mid-Cap Stocks to Buy for 2021,msnmoney,2020-10-25 09:20:46
Is COVID-19 going to ruin your credit?,msnmoney,2020-10-25 09:20:46
Signs that you're getting scammed while shopping online,msnmoney,2020-10-25 09:20:46
"Rising rates seem to signal a recovery is near, but investors wonder whether they can be believed",msnmoney,2020-10-25 09:20:46
(Photos) The Wild Party Life Back In The Days,msnmoney,2020-10-25 09:20:46
Fastest-growing jobs that pay over $100K,msnmoney,2020-10-25 09:20:46
Mortgage and real estate news this week: The end of the refinance boom?,msnmoney,2020-10-25 09:20:46
7 Ways to Ensure You Never Have Enough Money to Retire,msnmoney,2020-10-25 09:20:46
Latest Sign of Venezuela’s Oil Collapse Is 84% Surge in Stockpiles,msnmoney,2020-10-25 09:20:46
Quiz: Do You Have What It Takes To Start a Business?,msnmoney,2020-10-25 09:20:46
Tips on buying a foreclosed home,msnmoney,2020-10-25 09:20:46
How to buy Apple devices without paying Apple prices,msnmoney,2020-10-25 09:20:46
Top Wall Street analysts say buy stocks like Netflix and Alphabet amid renewed market volatility,msnmoney,2020-10-25 09:20:46
Private colleges with the best return on investment,msnmoney,2020-10-25 09:20:46
How to buy Apple devices without paying Apple prices,msnmoney,2020-10-25 09:20:46
What to do right now if you've lost your job,msnmoney,2020-10-25 09:20:46
No pension. No 401(k). How to get by on Social Security,msnmoney,2020-10-25 09:20:46
"Internet Providers Don't Want You Buying One, But They're Not Illegal",msnmoney,2020-10-25 09:20:46
Saudi Chemicals Maker Sabic Posts Profit as Demand Revives,msnmoney,2020-10-25 09:20:46
Smart things for singles and couples to buy from Costco,msnmoney,2020-10-25 09:20:46
Here's the Average Social Security Benefit in 2021,msnmoney,2020-10-25 09:20:46
"Grandma Lived With Hunched Back For Years, Until She Did This",msnmoney,2020-10-25 09:20:46
9 ways to give yourself a stimulus check (and forget Washington),msnmoney,2020-10-25 09:20:46
Not Everyone Is Feeling The Pandemic Equally ,msnmoney,2020-10-25 09:20:46
"ANA Holdings to Slash 3,500 Jobs, Transfer Workers, Yomiuri Says",msnmoney,2020-10-25 09:20:46
Cost of oil the year you were born,msnmoney,2020-10-25 09:20:46
57 money facts that seem too weird to be true,msnmoney,2020-10-25 09:20:46
"The Best-Paying, Fastest-Growing Jobs in Each State",msnmoney,2020-10-25 09:20:46
"Lee Kun-hee, Korean Icon Who Transformed Samsung, Dies at 78",msnmoney,2020-10-25 09:20:46
Facts no one knows about Rat Pack member Dean Martin,msnmoney,2020-10-25 09:20:46
Common household items that are worth money,msnmoney,2020-10-25 09:20:46
Gen Z homebuyers like this Utah city the best,msnmoney,2020-10-25 09:20:46
How COVID-19 Has Transformed the Way We Spend,msnmoney,2020-10-25 09:20:46
Vedanta’s Debt Maturities Are Prompting Credit Rating Warnings,msnmoney,2020-10-25 09:20:46
What to do if you win a million dollars,msnmoney,2020-10-25 09:20:46
Most wine drinkers in the US don't know these 5 simple Dos and Don'ts,msnmoney,2020-10-25 09:20:46
From the Bronx to Bel Air: J.Lo's amazing property portfolio,msnmoney,2020-10-25 09:20:46
Home projects you should tackle this fall,msnmoney,2020-10-25 09:20:46
American Airlines plans customer tours of Boeing 737 Max and pilot calls to boost confidence in jets,msnmoney,2020-10-25 09:20:46
"As Apple Hits $2 Trillion, Which Stocks Are Headed the Other Direction?",msnmoney,2020-10-25 09:20:46
The 10 Best U.S. Cities for Remote Workers,msnmoney,2020-10-25 09:20:46
Americans Are Obsessed With New Blanket That Puts You To Sleep In Minutes,msnmoney,2020-10-25 09:20:46
Best small college in every state,msnmoney,2020-10-25 09:20:46
"‘It’s daunting to think about what the consequences will be.’ With no stimulus deal, much of America’s temporary financial safety net will expire Dec. 31",msnmoney,2020-10-25 09:20:46
"10 countries where you can retire on just $100,000",msnmoney,2020-10-25 09:20:46
Opinion: ‘Trump stocks’ have significantly lagged the U.S. market since 2016 — while ‘Clinton stocks’ have soared,msnmoney,2020-10-25 09:20:46
8 Major Retailers Closed for Thanksgiving This Year,msnmoney,2020-10-25 09:20:46
23 New Gadgets That Will Sell Out Before Holidays,msnmoney,2020-10-25 09:20:46
"Children in West Africa are working night shifts to fuel a $100-billion chocolate industry that has failed to crack down on child labor, a US government-commissioned report found",msnmoney,2020-10-25 09:20:46
Things every retiree should get rid of,msnmoney,2020-10-25 09:20:46
60% of Retirement Savers Who Made This Financial Decision Regret It,msnmoney,2020-10-25 09:20:46
Warning signs a job isn't as good as it sounds,msnmoney,2020-10-25 09:20:46
How a 21-year-old CEO landed $3.5 million for software that he originally built to help his mom's struggling dog grooming business keep repeat customers,msnmoney,2020-10-25 09:20:46
"Before you renew Amazon Prime, read this",msnmoney,2020-10-25 09:20:46
When renting a house is better than buying,msnmoney,2020-10-25 09:20:46
The best county for retirees in every single state,msnmoney,2020-10-25 09:20:46
How a Biden presidency could affect seniors,msnmoney,2020-10-25 09:20:46
Google's long-time rivals say DOJ antitrust suit shows it's lost its 'halo' in the eyes of regulators,msnmoney,2020-10-25 09:20:46
Things you should never try to sell on eBay,msnmoney,2020-10-25 09:20:46
Open Enrollment Is Now! Find Out About Your Medicare Options,msnmoney,2020-10-25 09:20:46
Can't find your dream home? Unlisted houses might be your answer,msnmoney,2020-10-25 09:20:46
Best and Worst States for Pensions,msnmoney,2020-10-25 09:20:46
"More Macy's Stores May Be Dark for the Holidays, and That's a Good Thing",msnmoney,2020-10-25 09:20:46
"Netflix, Redbox and more of the best and worst company makeovers",msnmoney,2020-10-25 09:20:46
Maxing Out Your 401(k) Can Make You a Millionaire By 45,msnmoney,2020-10-25 09:20:46
1 Simple Trick to Cut Your Electric Bill by 90%,msnmoney,2020-10-25 09:20:46
Unique tiny homes around the world,msnmoney,2020-10-25 09:20:46
"Opinion: S&P 500 corporate boards lack diversity, but these top companies are leading change — and the stock market rewards them",msnmoney,2020-10-25 09:20:46
"You Can Buy a Vacation Home for Under $200,000 in These Cities",msnmoney,2020-10-25 09:20:46
"Mortgage rates dive deeper, extending the boon for borrowers",msnmoney,2020-10-25 09:20:46
25 Top-Paying Dividend Stocks That Will Make You Rich,msnmoney,2020-10-25 09:20:46
Postal Service awards $5 million contract to DeJoy's former company,msnmoney,2020-10-25 09:20:46
Terrifying Culprit that Destroys Arteries - Handled,msnmoney,2020-10-25 09:20:46
Industries With the Biggest (and Smallest) Racial Pay Gap,msnmoney,2020-10-25 09:20:46
Where Will American Homes 4 Rent Be in 3 Years?,msnmoney,2020-10-25 09:20:46
Reasons Your Unemployment Claim Was Rejected — And How To Fix It,msnmoney,2020-10-25 09:20:46
Opinion: How to invest in the S&P 500 without betting hard on the ‘FAAMG’ stocks that are 20% of the index,msnmoney,2020-10-25 09:20:46
Celebrities Who Have Lost Millions During COVID-19,msnmoney,2020-10-25 09:20:46
Are We Headed for Another Foreclosure Crisis? 9 Housing Experts Share Their Predictions,msnmoney,2020-10-25 09:20:46
Drone Captures What No One Was Supposed To See,msnmoney,2020-10-25 09:20:46
10 Steps to Help Get Your Career Back on Track,msnmoney,2020-10-25 09:20:46
Media executives are finally accepting the decline of cable TV as they plot a new path forward,msnmoney,2020-10-25 09:20:46
15 Mighty Mid-Cap Stocks to Buy for 2021,msnmoney,2020-10-25 09:20:46
Is COVID-19 going to ruin your credit?,msnmoney,2020-10-25 09:20:46
Signs that you're getting scammed while shopping online,msnmoney,2020-10-25 09:20:46
"Rising rates seem to signal a recovery is near, but investors wonder whether they can be believed",msnmoney,2020-10-25 09:20:46
(Photos) The Wild Party Life Back In The Days,msnmoney,2020-10-25 09:20:46
Fastest-growing jobs that pay over $100K,msnmoney,2020-10-25 09:20:46
Mortgage and real estate news this week: The end of the refinance boom?,msnmoney,2020-10-25 09:20:46
7 Ways to Ensure You Never Have Enough Money to Retire,msnmoney,2020-10-25 09:20:46
Latest Sign of Venezuela’s Oil Collapse Is 84% Surge in Stockpiles,msnmoney,2020-10-25 09:20:46
Quiz: Do You Have What It Takes To Start a Business?,msnmoney,2020-10-25 09:20:46
Tips on buying a foreclosed home,msnmoney,2020-10-25 09:20:46
How to buy Apple devices without paying Apple prices,msnmoney,2020-10-25 09:20:46
Op-Ed: Why Joe Biden would be the real jobs president,yahoofinance,2020-10-25 09:22:47
"Big Tech earnings, Q3 GDP: What to know in the week ahead",yahoofinance,2020-10-25 09:22:47
This startup lets you custom build your home virtually,yahoofinance,2020-10-25 09:22:47
Apollo investor revolt swells over Black’s Epstein ties,yahoofinance,2020-10-25 09:22:47
Bollinger Motors founder and CEO on what's next for the company,yahoofinance,2020-10-25 09:22:47
New restaurant openings down 10% in Q3 2020 year-over-year: Yelp,yahoofinance,2020-10-25 09:22:47
Trumponomics: The corner we’re not turning,yahoofinance,2020-10-25 09:22:47
Final Trump-Biden debate falls flat with viewers,yahoofinance,2020-10-25 09:22:47
Multi-asset investing for uncertain times,yahoofinance,2020-10-25 09:22:47
Some wealthy Americans are already prepping their finances for a Joe Biden presidency — here’s how,yahoofinance,2020-10-25 09:22:47
How much switching to an electric vehicle could really save you,yahoofinance,2020-10-25 09:22:47
7 Unhealthy Biotech Stocks To Sell Before They Sicken Your Portfolio,yahoofinance,2020-10-25 09:22:47
"Lee Kun-hee, who made South Korea's Samsung a global powerhouse, dies at 78",yahoofinance,2020-10-25 09:22:47
Here’s How Much You Would Pay Under Biden’s and Trump’s Tax Plans,yahoofinance,2020-10-25 09:22:47
"In these 10 countries, you could retire on just $100,000",yahoofinance,2020-10-25 09:22:47
'Shark Tank' star Kevin O'Leary: 'You have to save money',yahoofinance,2020-10-25 09:22:47
The Top 10 Tech Stocks to Buy Before the 2020 Election,yahoofinance,2020-10-25 09:22:47
AMD Earnings Are Coming. Here’s What to Expect.,yahoofinance,2020-10-25 09:22:47
"Dow Jones Futures: Stock Market Rally Faces Pivotal Week; Microsoft, These Tech Giants Near Buy Points",yahoofinance,2020-10-25 09:22:47
3 Utility Stocks With Tried-and-True Gains,yahoofinance,2020-10-25 09:22:47
6 Tech Stocks Every Investor Should Watch,yahoofinance,2020-10-25 09:22:47
Workhorse Group Is a Buy Even with the USPS Contract Delay,yahoofinance,2020-10-25 09:22:47
Why GoodRx Stock Is Now a Screaming ‘BUY’,yahoofinance,2020-10-25 09:22:47
Trump has faced a decade-long tax audit — here’s how long IRS audits usually take and which taxpayers are most likely to get audited,yahoofinance,2020-10-25 09:22:47
"A Huge Pension Bought PayPal, Cisco, and Activision Stock. Here’s What It Sold.",yahoofinance,2020-10-25 09:22:47
U.S Mortgage Rates Fall to Yet another All-time Low,yahoofinance,2020-10-25 09:22:47
The Pandemic Turned My Parents Into Day Traders,yahoofinance,2020-10-25 09:22:47
Long-Term Investors Can Consider Investing in Nokia,yahoofinance,2020-10-25 09:22:47
"Stock Wars: ExxonMobil Vs. NextEra, A Battle Of Old Vs. New In Energy",yahoofinance,2020-10-25 09:22:47
"4 Top Stock Trades for Monday: TWLO, SNAP, SPAQ, GILD",yahoofinance,2020-10-25 09:22:47
"GE stock is on a tear ahead of earnings, as analysts tout it as a COVID-19 vaccine play",yahoofinance,2020-10-25 09:22:47
"Investing Pro: Why PayPal, Square Are Getting Hit 'Square In The Gut'",yahoofinance,2020-10-25 09:22:47
Canada's Cenovus Energy to buy Husky Energy for $18 billion,yahoofinance,2020-10-25 09:22:47
"Ant Group IPO pricing ""history's largest"", says Alibaba's Jack Ma",yahoofinance,2020-10-25 09:22:47
Big Oil Loses Refining Crutch With Margins Crushed Last Quarter,yahoofinance,2020-10-25 09:22:47
"Is it possible to prepay taxes, as President Trump claims he did?",yahoofinance,2020-10-25 09:22:47
9 ways to give yourself a stimulus check (and forget Washington),yahoofinance,2020-10-25 09:22:47
3 Reasons Why Cisco Stock Is a Great Investment,yahoofinance,2020-10-25 09:22:47
"Cenovus Energy, Husky to Merge in C$23.6 Billion Deal",yahoofinance,2020-10-25 09:22:47
"IBM’s Retirement Fund Bought IBM, Apple, and Microsoft Stock. Here’s What It Sold.",yahoofinance,2020-10-25 09:22:47
"Mortgage rates dive even deeper, extending a boon for borrowers",yahoofinance,2020-10-25 09:22:47
Analysis: Investors' bold bets on Biden win pose market risk,yahoofinance,2020-10-25 09:22:47
How Coke Is Shaking Things Up — and Why Its Stock Is a Buy,yahoofinance,2020-10-25 09:22:47
Madoff Whistleblower Flags Next Big Financial Scandals (RE-RELEASE),yahoofinance,2020-10-25 09:22:47
Boeing's 'Pivotal Moment': Analyst Says Company Needs New Airplane,yahoofinance,2020-10-25 09:22:47
"Is QQQ Stock A Buy Right Now? Here's What Earnings, Charts Show",yahoofinance,2020-10-25 09:22:47
What pandemic? Many people are still optimistic about their retirement prospects — although maybe they shouldn’t be,yahoofinance,2020-10-25 09:22:47
Virgin Galactic Stock Sees First Sign Of Doubt On Wall Street,yahoofinance,2020-10-25 09:22:47
Apollo Investor Revolt Swells Over Black’s Epstein Ties,yahoofinance,2020-10-25 09:22:47
"Citigroup Stock Has Tumbled, but Director Jay Jacobs Bought Up Shares",yahoofinance,2020-10-25 09:22:47
AT&T And Verizon Beat Estimates,yahoofinance,2020-10-25 09:22:47
Whirlpool and 3 Other Companies That Raised Their Dividends This Week,yahoofinance,2020-10-25 09:22:47
"Big Tech earnings, Q3 GDP: What to know in the week ahead",yahoofinance,2020-10-25 09:22:47
Virgin Galactic May Be an Interstellar Buy as Breakout Looms,yahoofinance,2020-10-25 09:22:47
Bitcoin Price Closes Above $13K for First Time Since January 2018 Driven by a Flurry of Good News,yahoofinance,2020-10-25 09:22:47
Is Tesla Just A Series Of Startups? Elon Musk Lays Out The Case,yahoofinance,2020-10-25 09:22:47
Samsung's Lee: tainted titan who built a global tech giant,yahoofinance,2020-10-25 09:22:47
Natural Gas Weekly Price Forecast – Natural Gas Markets Shoot Straight Up,yahoofinance,2020-10-25 09:22:47
Dating Going Digital Has Been Terrible For Naked Brand Group Stock,yahoofinance,2020-10-25 09:22:47
All-Boeing Airline Southwest Opens Door To Rival Airbus,yahoofinance,2020-10-25 09:22:47
AMD earnings: Gain expected from Intel’s pain yet again,yahoofinance,2020-10-25 09:22:47
"Dow Jones Stocks To Buy And Watch In October 2020: Apple, Microsoft Offer New Buy Points",yahoofinance,2020-10-25 09:22:47
"Cramer Weighs In On Corsair, Marvell And More",yahoofinance,2020-10-25 09:22:47
Switchback Energy Is an EV SPAC That’s Actually Worth a Look,yahoofinance,2020-10-25 09:22:47
ROCE Insights For Ford Motor,yahoofinance,2020-10-25 09:22:47
Best Stocks To Buy Or Watch This Week Include Taiwan Semiconductor Holding Above Buy Point,yahoofinance,2020-10-25 09:22:47
How Large Option Traders Are Playing Intel Following Earnings Sell-Off,yahoofinance,2020-10-25 09:22:47
Natural Gas Looks to Join the Energy Merger Wave. EQT Is Said to Be Pursuing CNX.,yahoofinance,2020-10-25 09:22:47
Stay Away From Kodak Stock Until Its Hobby Is a Business,yahoofinance,2020-10-25 09:22:47
Is GM Stock A Buy As General Motors Soars With Hummer EV?,yahoofinance,2020-10-25 09:22:47
Intel stock plummets because of woes ‘specific to Intel’,yahoofinance,2020-10-25 09:22:47
"A Tale of Two Housing Markets: Owners, Renters Face Contrasting Realities",yahoofinance,2020-10-25 09:22:47
Automotive Voice Assistant Leader Cerence Holds Off Rivals,yahoofinance,2020-10-25 09:22:47
"As Shares Tread Water, Wait for a Pullback With Apple",yahoofinance,2020-10-25 09:22:47
Bitcoin’s Rivalry With Gold Plus Millennial Interest Gives It ‘Considerable’ Upside Potential: JPMorgan,yahoofinance,2020-10-25 09:22:47
The Most Famous Leveraged Buyouts,yahoofinance,2020-10-25 09:22:47
Wells Fargo Is Weighing a Sale of Its Asset Management Business. Bids Are Said to Be Due Next Week.,yahoofinance,2020-10-25 09:22:47
Apple earnings will be missing the usual star attraction,yahoofinance,2020-10-25 09:22:47
Snap’s Blowout Earnings Are Great News for Pinterest Stock,yahoofinance,2020-10-25 09:22:47
"Intel’s problems ‘are likely just getting started,’ analyst warns as stock slides",yahoofinance,2020-10-25 09:22:47
Investors' bold bets on Biden win pose market risk,yahoofinance,2020-10-25 09:22:47
Wells Fargo Reverses Decision to Scrap 401(k) Match,yahoofinance,2020-10-25 09:22:47
Transocean Receives NYSE Notice,yahoofinance,2020-10-25 09:22:47
Wait for a Post-Election Pullback to Buy Array Technologies Stock,yahoofinance,2020-10-25 09:22:47
"Benzinga's Top Upgrades, Downgrades For October 23, 2020",yahoofinance,2020-10-25 09:22:47
Can Legal Cannabis Relieve Fiscal Deficits? These Economists Say 'Not Necessarily',yahoofinance,2020-10-25 09:22:47
"LUV Stock: Is It A Buy? What Earnings, Value Metrics, Stock Chart Show Today",yahoofinance,2020-10-25 09:22:47
Demand for Health Care Is Returning. 3 Medical REITs to Play the Trend.,yahoofinance,2020-10-25 09:22:47
LCA Stock a Buy Set to Fly,yahoofinance,2020-10-25 09:22:47
Will a capital-gains tax increase squelch stock gains?,yahoofinance,2020-10-25 09:22:47
Stock-market investors brace for busiest week of earnings in October’s final hurrah,yahoofinance,2020-10-25 09:22:47
Gilead Sciences Shares Rise 6% After U.S. FDA Approves Remdesivir for COVID-19 Treatment; Target Price $75,yahoofinance,2020-10-25 09:22:47
Why Snap’s Surge Is Good News for Social Media,yahoofinance,2020-10-25 09:22:47
Trump keeps calling $750 tax payment a 'filing fee.' Experts say there's no such thing,yahoofinance,2020-10-25 09:22:47
"Small Cap Stocks Outrun Nasdaq, Dow Jones; Will These New IPOs Rule The Stock Market In Q4?",yahoofinance,2020-10-25 09:22:47
Silver Weekly Price Forecast – Silver Markets Form Bears Candle,yahoofinance,2020-10-25 09:22:47
Top 4 Shareholders of Chipotle Mexican Grill,yahoofinance,2020-10-25 09:22:47
Analyzing Occidental Petroleum's Unusual Options Activity,yahoofinance,2020-10-25 09:22:47
Why Spartan Energy Is an Electric Buy Before Its EV Merger,yahoofinance,2020-10-25 09:22:47
Crude Oil Weekly Price Forecast – Crude Oil Continues Range Bound,yahoofinance,2020-10-25 09:22:47
"Amazon.com Inc. stock rises Friday, outperforms market",yahoofinance,2020-10-25 09:22:47
10-Year Bond Yield Hits 4-Month High,yahoofinance,2020-10-25 09:22:47
Brazil soars to China's No. 3 crude oil supplier in Sept,yahoofinance,2020-10-25 09:22:47
7 Cryptocurrencies to Stand the Test of Time,yahoofinance,2020-10-25 09:22:47
"Outback Steakhouse parent shares sink, presenting a 'buying opportunity,' analysts say",yahoofinance,2020-10-25 09:22:47
What a Blue Wave Could Mean for the Bond Market,yahoofinance,2020-10-25 09:22:47
Chegg's Earnings Outlook,yahoofinance,2020-10-25 09:22:47
"Intel stock downgraded at Bank of America: 'No easy fix' for manufacturing woes, analyst says",yahoofinance,2020-10-25 09:22:47
China Reconsiders Its Global Strategy for the Yuan,yahoofinance,2020-10-25 09:22:47
"Pence’s Chief of Staff, Campaign Adviser Test Positive for Coronavirus",wsj,2020-10-25 09:25:06
