headline,org,date
IPO expert says Airbnb and DoorDash launch echoes internet bubble and predicts value stocks will outperform,msnmoney,2020-12-12 10:53:50
New Car Brands Ranked From Best to Worst,msnmoney,2020-12-12 10:53:50
"Before You Renew Amazon Prime, Read This",msnmoney,2020-12-12 10:53:50
Why Your Healthcare Costs as a Senior Could Be Higher Than Planned,msnmoney,2020-12-12 10:53:50
28 Tips for Negotiating With Car Dealers,msnmoney,2020-12-12 10:53:50
Unique Tip If Your Car Has Automatic Headlights,msnmoney,2020-12-12 10:53:50
Tesla to replace Apartment Investment and Management in S&P 500,msnmoney,2020-12-12 10:53:50
Gov. Newsom Wants To Ban Gas Cars by 2035: The True Cost of Going Electric,msnmoney,2020-12-12 10:53:50
How to keep your holiday spending and end-of-year finances in check. Your questions answered,msnmoney,2020-12-12 10:53:50
39 Gifts That Are Selling Like Hotcakes During The Holidays,msnmoney,2020-12-12 10:53:50
How to plan financially for the holidays …and after,msnmoney,2020-12-12 10:53:50
Annual Enrollment Is Here: Here’s What You Need To Know,msnmoney,2020-12-12 10:53:50
Nio joins Tesla and other rivals in rush to offer more shares in electric-vehicle companies,msnmoney,2020-12-12 10:53:50
Holiday Supplies You Should Buy at the Dollar Store,msnmoney,2020-12-12 10:53:50
The ultimate home inspection checklist,msnmoney,2020-12-12 10:53:50
Don't make this common retirement mistake,msnmoney,2020-12-12 10:53:50
The 30 retailers and restaurant chains that filed for bankruptcy in 2020,msnmoney,2020-12-12 10:53:50
Top credit card wipes out interest until 2022 (seriously),msnmoney,2020-12-12 10:53:50
Cheap and free family traditions for the holidays,msnmoney,2020-12-12 10:53:50
15 Year-End Money Moves You Need to Make,msnmoney,2020-12-12 10:53:50
What to do when a loved one dies,msnmoney,2020-12-12 10:53:50
Stock-market uncertainty runs high headed into Fed’s final meeting of 2020,msnmoney,2020-12-12 10:53:50
The big differences between Costco and Costco.com,msnmoney,2020-12-12 10:53:50
[Photos] Have Any of These 41 Items? You Could Be Rich,msnmoney,2020-12-12 10:53:50
More than half of Americans said they would consider living in a tiny home in a new survey as the lifestyle increases in popularity amid the pandemic,msnmoney,2020-12-12 10:53:50
5 Must-Have COVID-19 Comfort Items and How Much They Cost,msnmoney,2020-12-12 10:53:50
IPO frenzy goes into overdrive - Inside Coatue's short-lived quant fund - Blackstone TV,msnmoney,2020-12-12 10:53:50
19 Unspoken Gift-Giving Etiquette Rules,msnmoney,2020-12-12 10:53:50
Jeff Ubben bets on underperforming for-profit education stock,msnmoney,2020-12-12 10:53:50
This Is the Present Everyone's Talking About,msnmoney,2020-12-12 10:53:50
The best RV accessories to get at Costco,msnmoney,2020-12-12 10:53:50
This Weekend's Best Mortgage Rates: Dec. 12 & 13,msnmoney,2020-12-12 10:53:50
35 Retirement Planning Mistakes That Waste Your Money,msnmoney,2020-12-12 10:53:50
Airbus' Domination of Boeing Continued in November,msnmoney,2020-12-12 10:53:50
25 Things To Sell When You’re Ready To Retire,msnmoney,2020-12-12 10:53:50
New Car Gadget Magically Removes Scratches & Dents,msnmoney,2020-12-12 10:53:50
Congo Agrees to Freeport’s Sale of Copper Mine to China Moly,msnmoney,2020-12-12 10:53:50
"20 Jobs Where You Can Make $60,000 Out of College",msnmoney,2020-12-12 10:53:50
How to give presents this season without blowing your budget,msnmoney,2020-12-12 10:53:50
6 ways to stay on top of your mortgage payments,msnmoney,2020-12-12 10:53:50
25 bank stocks with dividend yields of at least 3.5% that passed two important tests,msnmoney,2020-12-12 10:53:50
Man Who Predicted 2020 Crash Issues Next Major Warning,msnmoney,2020-12-12 10:53:50
20 Ways To Get an Extra $500 in Your Paycheck by the End of the Year,msnmoney,2020-12-12 10:53:50
14 easy steps that got us out of debt,msnmoney,2020-12-12 10:53:50
The Cost To Own a 3-Bedroom Home in Every State,msnmoney,2020-12-12 10:53:50
30 stocks of companies expected to increase sales the most in 2021,msnmoney,2020-12-12 10:53:50
Costly Mistakes People Make While Grocery Shopping,msnmoney,2020-12-12 10:53:50
Why Costco Really Checks Your Receipt,msnmoney,2020-12-12 10:53:50
"Tampa, Fla., real estate overview",msnmoney,2020-12-12 10:53:50
Walmart and Instacart Team Up To Fight Amazon and 17 More Big Business Moves in 2020,msnmoney,2020-12-12 10:53:50
"Germany to Buy 25% Hensoldt Stake From KKR, Reuters Reports",msnmoney,2020-12-12 10:53:50
Beware: These states are the worst for retirement taxes,msnmoney,2020-12-12 10:53:50
"Modest market returns in 2021 risk disappointing today's overexcited investors, Bank of America says",msnmoney,2020-12-12 10:53:50
22 Amazing Gifts That Will Knock Your Holiday Stockings Off,msnmoney,2020-12-12 10:53:50
How Coronavirus Exposed America’s Mistreatment of the Elderly,msnmoney,2020-12-12 10:53:50
15 Great Work-at-Home Jobs for Moms,msnmoney,2020-12-12 10:53:50
Jeff Bezos and 14 Other Wealthy People & Families Chipping In To Fund Education,msnmoney,2020-12-12 10:53:50
A 3-floor apartment building is being built in Germany with a 3D printer - see how it's being done,msnmoney,2020-12-12 10:53:50
The Richest Royals in the World,msnmoney,2020-12-12 10:53:50
15 U.S. Cities with the Biggest Decline in Air Pollution,msnmoney,2020-12-12 10:53:50
Rare Photographs Capture Eerie Last Known Moments,msnmoney,2020-12-12 10:53:50
Are Your Favorite Delivery Apps Worth the Money?,msnmoney,2020-12-12 10:53:50
Pantone's Colors of the Year are intended to reflect 'resilience and hope' for 2021. But the annual decision also has a trickle-down effect on everything from high fashion to iPhones.,msnmoney,2020-12-12 10:53:50
18 ways to go broke trying to get rich,msnmoney,2020-12-12 10:53:50
25 Ways to Spend Less on Food,msnmoney,2020-12-12 10:53:50
10 States With the Worst Drivers,msnmoney,2020-12-12 10:53:50
IPO Mania Sweeps Over Robinhood Crowd and Stokes a 111% Rally,msnmoney,2020-12-12 10:53:50
These Clingy Dog Breeds Will Stay by Your Side,msnmoney,2020-12-12 10:53:50
Cities Losing the Most Jobs in Every State,msnmoney,2020-12-12 10:53:50
22 ways to score free gift cards,msnmoney,2020-12-12 10:53:50
8 Ways to Free Yourself of Retirement Debt,msnmoney,2020-12-12 10:53:50
Italian Prosecutors Charge Vivendi’s Bollore Over Mediaset Case,msnmoney,2020-12-12 10:53:50
Every State’s Best Public High School,msnmoney,2020-12-12 10:53:50
Tech Giants Gird for Business Threats Under Strict New EU Laws,msnmoney,2020-12-12 10:53:50
Unsold 2018 SUVs Now Almost Being Given Away: See Prices,msnmoney,2020-12-12 10:53:50
Companies That Performed Exceptionally Well in 2020,msnmoney,2020-12-12 10:53:50
Goldman Gets High Court Review It Sought on Investor Suits,msnmoney,2020-12-12 10:53:50
The Average Social Security Check the Year You Were Born,msnmoney,2020-12-12 10:53:50
21 side hustles if you need more income during the holidays,msnmoney,2020-12-12 10:53:50
The Average Price of Christmas Trees at Top US Retailers,msnmoney,2020-12-12 10:53:50
California Watchdog Wants SoCalGas to Pay Bigger Lobby Fine,msnmoney,2020-12-12 10:53:50
IPO expert says Airbnb and DoorDash launch echoes internet bubble and predicts value stocks will outperform,msnmoney,2020-12-12 10:53:50
New Car Brands Ranked From Best to Worst,msnmoney,2020-12-12 10:53:50
"Before You Renew Amazon Prime, Read This",msnmoney,2020-12-12 10:53:50
Why Your Healthcare Costs as a Senior Could Be Higher Than Planned,msnmoney,2020-12-12 10:53:50
28 Tips for Negotiating With Car Dealers,msnmoney,2020-12-12 10:53:50
Unique Tip If Your Car Has Automatic Headlights,msnmoney,2020-12-12 10:53:50
Tesla to replace Apartment Investment and Management in S&P 500,msnmoney,2020-12-12 10:53:50
Gov. Newsom Wants To Ban Gas Cars by 2035: The True Cost of Going Electric,msnmoney,2020-12-12 10:53:50
How to keep your holiday spending and end-of-year finances in check. Your questions answered,msnmoney,2020-12-12 10:53:50
39 Gifts That Are Selling Like Hotcakes During The Holidays,msnmoney,2020-12-12 10:53:50
How to plan financially for the holidays …and after,msnmoney,2020-12-12 10:53:50
Annual Enrollment Is Here: Here’s What You Need To Know,msnmoney,2020-12-12 10:53:50
Nio joins Tesla and other rivals in rush to offer more shares in electric-vehicle companies,msnmoney,2020-12-12 10:53:50
Holiday Supplies You Should Buy at the Dollar Store,msnmoney,2020-12-12 10:53:50
The ultimate home inspection checklist,msnmoney,2020-12-12 10:53:50
Don't make this common retirement mistake,msnmoney,2020-12-12 10:53:50
The 30 retailers and restaurant chains that filed for bankruptcy in 2020,msnmoney,2020-12-12 10:53:50
Top credit card wipes out interest until 2022 (seriously),msnmoney,2020-12-12 10:53:50
Cheap and free family traditions for the holidays,msnmoney,2020-12-12 10:53:50
15 Year-End Money Moves You Need to Make,msnmoney,2020-12-12 10:53:50
What to do when a loved one dies,msnmoney,2020-12-12 10:53:50
Stock-market uncertainty runs high headed into Fed’s final meeting of 2020,msnmoney,2020-12-12 10:53:50
The big differences between Costco and Costco.com,msnmoney,2020-12-12 10:53:50
[Photos] Have Any of These 41 Items? You Could Be Rich,msnmoney,2020-12-12 10:53:50
More than half of Americans said they would consider living in a tiny home in a new survey as the lifestyle increases in popularity amid the pandemic,msnmoney,2020-12-12 10:53:50
5 Must-Have COVID-19 Comfort Items and How Much They Cost,msnmoney,2020-12-12 10:53:50
IPO frenzy goes into overdrive - Inside Coatue's short-lived quant fund - Blackstone TV,msnmoney,2020-12-12 10:53:50
19 Unspoken Gift-Giving Etiquette Rules,msnmoney,2020-12-12 10:53:50
Jeff Ubben bets on underperforming for-profit education stock,msnmoney,2020-12-12 10:53:50
This Is the Present Everyone's Talking About,msnmoney,2020-12-12 10:53:50
The best RV accessories to get at Costco,msnmoney,2020-12-12 10:53:50
This Weekend's Best Mortgage Rates: Dec. 12 & 13,msnmoney,2020-12-12 10:53:50
35 Retirement Planning Mistakes That Waste Your Money,msnmoney,2020-12-12 10:53:50
Airbus' Domination of Boeing Continued in November,msnmoney,2020-12-12 10:53:50
25 Things To Sell When You’re Ready To Retire,msnmoney,2020-12-12 10:53:50
New Car Gadget Magically Removes Scratches & Dents,msnmoney,2020-12-12 10:53:50
Congo Agrees to Freeport’s Sale of Copper Mine to China Moly,msnmoney,2020-12-12 10:53:50
"20 Jobs Where You Can Make $60,000 Out of College",msnmoney,2020-12-12 10:53:50
How to give presents this season without blowing your budget,msnmoney,2020-12-12 10:53:50
6 ways to stay on top of your mortgage payments,msnmoney,2020-12-12 10:53:50
25 bank stocks with dividend yields of at least 3.5% that passed two important tests,msnmoney,2020-12-12 10:53:50
Man Who Predicted 2020 Crash Issues Next Major Warning,msnmoney,2020-12-12 10:53:50
20 Ways To Get an Extra $500 in Your Paycheck by the End of the Year,msnmoney,2020-12-12 10:53:50
14 easy steps that got us out of debt,msnmoney,2020-12-12 10:53:50
The Cost To Own a 3-Bedroom Home in Every State,msnmoney,2020-12-12 10:53:50
30 stocks of companies expected to increase sales the most in 2021,msnmoney,2020-12-12 10:53:50
Costly Mistakes People Make While Grocery Shopping,msnmoney,2020-12-12 10:53:50
Why Costco Really Checks Your Receipt,msnmoney,2020-12-12 10:53:50
"Tampa, Fla., real estate overview",msnmoney,2020-12-12 10:53:50
Walmart and Instacart Team Up To Fight Amazon and 17 More Big Business Moves in 2020,msnmoney,2020-12-12 10:53:50
"Germany to Buy 25% Hensoldt Stake From KKR, Reuters Reports",msnmoney,2020-12-12 10:53:50
Beware: These states are the worst for retirement taxes,msnmoney,2020-12-12 10:53:50
"Modest market returns in 2021 risk disappointing today's overexcited investors, Bank of America says",msnmoney,2020-12-12 10:53:50
22 Amazing Gifts That Will Knock Your Holiday Stockings Off,msnmoney,2020-12-12 10:53:50
How Coronavirus Exposed America’s Mistreatment of the Elderly,msnmoney,2020-12-12 10:53:50
15 Great Work-at-Home Jobs for Moms,msnmoney,2020-12-12 10:53:50
Jeff Bezos and 14 Other Wealthy People & Families Chipping In To Fund Education,msnmoney,2020-12-12 10:53:50
A 3-floor apartment building is being built in Germany with a 3D printer - see how it's being done,msnmoney,2020-12-12 10:53:50
The Richest Royals in the World,msnmoney,2020-12-12 10:53:50
15 U.S. Cities with the Biggest Decline in Air Pollution,msnmoney,2020-12-12 10:53:50
Rare Photographs Capture Eerie Last Known Moments,msnmoney,2020-12-12 10:53:50
Are Your Favorite Delivery Apps Worth the Money?,msnmoney,2020-12-12 10:53:50
Pantone's Colors of the Year are intended to reflect 'resilience and hope' for 2021. But the annual decision also has a trickle-down effect on everything from high fashion to iPhones.,msnmoney,2020-12-12 10:53:50
18 ways to go broke trying to get rich,msnmoney,2020-12-12 10:53:50
25 Ways to Spend Less on Food,msnmoney,2020-12-12 10:53:50
10 States With the Worst Drivers,msnmoney,2020-12-12 10:53:50
IPO Mania Sweeps Over Robinhood Crowd and Stokes a 111% Rally,msnmoney,2020-12-12 10:53:50
These Clingy Dog Breeds Will Stay by Your Side,msnmoney,2020-12-12 10:53:50
Cities Losing the Most Jobs in Every State,msnmoney,2020-12-12 10:53:50
22 ways to score free gift cards,msnmoney,2020-12-12 10:53:50
8 Ways to Free Yourself of Retirement Debt,msnmoney,2020-12-12 10:53:50
Italian Prosecutors Charge Vivendi’s Bollore Over Mediaset Case,msnmoney,2020-12-12 10:53:50
Every State’s Best Public High School,msnmoney,2020-12-12 10:53:50
Tech Giants Gird for Business Threats Under Strict New EU Laws,msnmoney,2020-12-12 10:53:50
Unsold 2018 SUVs Now Almost Being Given Away: See Prices,msnmoney,2020-12-12 10:53:50
Companies That Performed Exceptionally Well in 2020,msnmoney,2020-12-12 10:53:50
Goldman Gets High Court Review It Sought on Investor Suits,msnmoney,2020-12-12 10:53:50
The Average Social Security Check the Year You Were Born,msnmoney,2020-12-12 10:53:50
21 side hustles if you need more income during the holidays,msnmoney,2020-12-12 10:53:50
The Average Price of Christmas Trees at Top US Retailers,msnmoney,2020-12-12 10:53:50
California Watchdog Wants SoCalGas to Pay Bigger Lobby Fine,msnmoney,2020-12-12 10:53:50
Our priority is getting safely back to school: Baltimore Schools CEO,yahoofinance,2020-12-12 10:55:55
'Every industry is adapting. The Oscars are no exception',yahoofinance,2020-12-12 10:55:55
How Beyond Meat can 'hit the jackpot' after Costco meatball rollout,yahoofinance,2020-12-12 10:55:55
Senator Warren: ‘We need to broadly cancel student loan debt’,yahoofinance,2020-12-12 10:55:55
'The pandemic has shot us all into a streaming universe': SAG-AFTRA President Gabrielle Carteris,yahoofinance,2020-12-12 10:55:55
How Biden's presidency will differ from Obama's,yahoofinance,2020-12-12 10:55:55
Universal Basic Income has been a family ‘lifesaver’,yahoofinance,2020-12-12 10:55:55
Should you buy Apple’s new $549 AirPods Max?,yahoofinance,2020-12-12 10:55:55
How to invest in water sustainability,yahoofinance,2020-12-12 10:55:55
Beware: These states are the worst for retirement taxes,yahoofinance,2020-12-12 10:55:55
Nasdaq to remove four Chinese companies' shares from indexes after U.S. order,yahoofinance,2020-12-12 10:55:55
15 of the Best Dividend Stocks to Buy for 2021,yahoofinance,2020-12-12 10:55:55
Congress looking to change or even abolish this key 401(k) provision,yahoofinance,2020-12-12 10:55:55
Fastest-Growing Stocks: Square Stock Among 8 Stocks Expecting Up To 144% Growth In 2021,yahoofinance,2020-12-12 10:55:55
AstraZeneca to Buy Alexion for $39 Billion in Rare-Disease Push,yahoofinance,2020-12-12 10:55:55
"Oracle Moves Headquarters to Texas, Joining Valley Exodus",yahoofinance,2020-12-12 10:55:55
"NIO, Xpeng, and Li Auto Are Not the Next Tesla. Why It’s Time to Unplug From Chinese EV Stocks",yahoofinance,2020-12-12 10:55:55
"What Warren Buffett Says About High-Profile IPOs Like Airbnb, DoorDash",yahoofinance,2020-12-12 10:55:55
"Dow Jones Futures: Pfizer Coronavirus Vaccine Distribution Begins; Tesla's 'High-Class Problem'; AMD, Shopify Near Buy Points",yahoofinance,2020-12-12 10:55:55
3 ‘Strong Buy’ Stocks with Over 7% Dividend Yield,yahoofinance,2020-12-12 10:55:55
From Elon Musk to Oracle — the coronavirus accelerates California exodus,yahoofinance,2020-12-12 10:55:55
What to Do When a Bear Market Whacks Your 401(k),yahoofinance,2020-12-12 10:55:55
"Campbell Soup, Pfizer, Mastercard, and Other Companies That Raised Their Dividends This Week",yahoofinance,2020-12-12 10:55:55
"AMD, SolarEdge, Twilio Lead Top Stocks That Are Buys Now",yahoofinance,2020-12-12 10:55:55
2 Stocks That Are Flirting With a Bottom; Analysts Say ‘Buy’,yahoofinance,2020-12-12 10:55:55
"There Are 5 Types of Retirement Savers, New Research Says. Which One Are You?",yahoofinance,2020-12-12 10:55:55
Suze Orman says these are the biggest money no-nos,yahoofinance,2020-12-12 10:55:55
Will Microsoft's Stock Reach $300 By 2022?,yahoofinance,2020-12-12 10:55:55
Is Pfizer Stock A Buy After FDA Promises To 'Rapidly' Authorize Covid Vaccine?,yahoofinance,2020-12-12 10:55:55
Oppenheimer Says These 2 Stocks Could Spike Over 100%,yahoofinance,2020-12-12 10:55:55
Is Nvidia Stock A Buy Now As M&A Drives Growth?,yahoofinance,2020-12-12 10:55:55
How to Rescue Your Retirement Portfolio,yahoofinance,2020-12-12 10:55:55
Delisting Chinese Companies Could Be Bad for Investors. But It’s the Right Thing to Do.,yahoofinance,2020-12-12 10:55:55
7 Best T. Rowe Price Funds for Retirement,yahoofinance,2020-12-12 10:55:55
Qualcomm: Much More Than Just a 5G Play,yahoofinance,2020-12-12 10:55:55
8 Best Monthly Dividend Stocks to Buy Now,yahoofinance,2020-12-12 10:55:55
Cramer Says Time To Take Profit In These Electric Vehicle SPAC Stocks,yahoofinance,2020-12-12 10:55:55
Analyst Worries About Snowflake Stock IPO Lockup Agreement Expiring,yahoofinance,2020-12-12 10:55:55
A Letter From 9 Million U.S. Expats to Janet Yellen,yahoofinance,2020-12-12 10:55:55
Altria Has Had a Tough Year. Why 2021 May Be Better.,yahoofinance,2020-12-12 10:55:55
Exxon Mobil to cut 700 jobs in Houston -government notice,yahoofinance,2020-12-12 10:55:55
"Cramer Advises Viewers On CVS Health, Cheesecake Factory, More",yahoofinance,2020-12-12 10:55:55
"Half of those making $100,000 fear they’ll never retire",yahoofinance,2020-12-12 10:55:55
IPO Mania Sweeps Over Robinhood Crowd and Stokes a 111% Rally,yahoofinance,2020-12-12 10:55:55
AstraZeneca to buy Alexion for $39 billion to expand in immunology,yahoofinance,2020-12-12 10:55:55
Airbnb and DoorDash are losing lots of money but it may be the perfect recipe for huge IPO-day stock price gains,yahoofinance,2020-12-12 10:55:55
"Morgan Stanley Upgrades Diamondback Energy, Valero Energy, Sees 'Sustained Rally' For Oil Stocks",yahoofinance,2020-12-12 10:55:55
"Royal Caribbean, Norwegian Cruise Line Are Put on Credit Watch Over Extended Suspensions",yahoofinance,2020-12-12 10:55:55
"Boeing, Best Buy: Latest Upgrades and Downgrades",yahoofinance,2020-12-12 10:55:55
Why We Sold Into Strength On ROKU Stock,yahoofinance,2020-12-12 10:55:55
Is Disney Stock A Buy As Disney+ Targets Netflix With Aggressive Growth Plans?,yahoofinance,2020-12-12 10:55:55
Top 5 Shareholders of Tesla,yahoofinance,2020-12-12 10:55:55
"From Airbnb to Tesla, It’s Starting to Feel Like 1999 All Over Again. It May End the Same Way.",yahoofinance,2020-12-12 10:55:55
Little Known Nano One May Hold the Key to EV Battery Technology,yahoofinance,2020-12-12 10:55:55
Oracle moves headquarters to Texas from Silicon Valley,yahoofinance,2020-12-12 10:55:55
First Cryptocurrency Index Fund Listed on OTC Markets,yahoofinance,2020-12-12 10:55:55
"Viatris to cut up to 9,000 jobs",yahoofinance,2020-12-12 10:55:55
Return On Capital Employed Overview: Novavax,yahoofinance,2020-12-12 10:55:55
"Vaxart’s 2,000% Rally on Vaccine Pill Leaves Bears on Edge",yahoofinance,2020-12-12 10:55:55
"Tesla Will Replace REIT In S&P 500, Occidental Petroleum In S&P 100",yahoofinance,2020-12-12 10:55:55
Certara IPO Soars 66%. Employees Will Get Shares.,yahoofinance,2020-12-12 10:55:55
Nio Trades Lower On 60M Share Follow-On Offering: What EV Investors Need To Know,yahoofinance,2020-12-12 10:55:55
German court halts felling of trees at site of Tesla plant,yahoofinance,2020-12-12 10:55:55
"This Coronavirus Stock Has Over 80% Upside, Says J.P. Morgan",yahoofinance,2020-12-12 10:55:55
Smaller Firms Look To Make A Splash In The Booming EV Space,yahoofinance,2020-12-12 10:55:55
Nio Joins Rivals In Race For Cash As EV Battle Heats Up,yahoofinance,2020-12-12 10:55:55
Ex-Dividend Date Insight: Ares Capital,yahoofinance,2020-12-12 10:55:55
"'Halftime Report' Final Trades: General Motors, DraftKings, More",yahoofinance,2020-12-12 10:55:55
Next Week's Game Plan: Cramer's 'Mad Money' Recap (Friday 12/11/20),yahoofinance,2020-12-12 10:55:55
"How Much Interest Can I Earn on $100, $1K or $10K?",yahoofinance,2020-12-12 10:55:55
30 stocks of companies expected to increase sales the most in 2021,yahoofinance,2020-12-12 10:55:55
Wall Street Is Starting to Sour on Airline Stocks. Here’s Why.,yahoofinance,2020-12-12 10:55:55
"GE Stock Is Up 90% in Three Months. More Gains Are Ahead, Analyst Says.",yahoofinance,2020-12-12 10:55:55
DraftKings CEO: Sports betting in more states will take company to ‘hyper growth’,yahoofinance,2020-12-12 10:55:55
"Nikola is the worst company of the year, according to Yahoo Finance's audience",yahoofinance,2020-12-12 10:55:55
Fiat CEO Manley in pole position for top job at Ferrari - paper,yahoofinance,2020-12-12 10:55:55
Top Railroad Stocks for Q1 2021,yahoofinance,2020-12-12 10:55:55
"Sorting Out Tony Hsieh’s Estate, From LLCs to Thousands of Sticky Notes",yahoofinance,2020-12-12 10:55:55
"Apollo, Blackstone Said in Talks to Buy Wells’ Student Loan Book",yahoofinance,2020-12-12 10:55:55
"‘You don't need Congress’: Biden increasingly pressured to unilaterally forgive up to $50,000 student debt",yahoofinance,2020-12-12 10:55:55
Top Steel Stocks for Q1 2021,yahoofinance,2020-12-12 10:55:55
Tesla joining the S&P 500 is ‘mother of all’ stock-market events,yahoofinance,2020-12-12 10:55:55
How Tesla Makes Money: all-electric cars and energy generation,yahoofinance,2020-12-12 10:55:55
Copper-Market Cocktail Means Miners Have Rarely Had It So Good,yahoofinance,2020-12-12 10:55:55
"AbCellera Rockets 195%, 4D Molecular Up 76% as Flurry of Health-Care IPOs Begin Trading",yahoofinance,2020-12-12 10:55:55
"Is Etsy Stock A Buy Right Now? Here's What Earnings, Charts Show",yahoofinance,2020-12-12 10:55:55
Mexico president wants central bank to buy up dirty cash,yahoofinance,2020-12-12 10:55:55
Will Apple Stop At Intel — Or Are More Suppliers In Danger?,yahoofinance,2020-12-12 10:55:55
Oil’s Female Trading Trio Belies Industry’s Gender Gap,yahoofinance,2020-12-12 10:55:55
Mnuchin Would Not Have Made $700M Loan To YRC,yahoofinance,2020-12-12 10:55:55
Qualcomm Stock Tumbles on Report Apple Will Build Its Own Modem Chips,yahoofinance,2020-12-12 10:55:55
"Roku Analyst: Streaming Stock Executing Well, With Attractive Valuation",yahoofinance,2020-12-12 10:55:55
It Was a Crazy Week for IPOs. Here Are 9 Things Investors Need to Know.,yahoofinance,2020-12-12 10:55:55
Glaxo Bids $120 a Share for Eidos in Rival Offer,yahoofinance,2020-12-12 10:55:55
Why QuantumSpace Is A 'High-Level Short Squeeze Candidate',yahoofinance,2020-12-12 10:55:55
BlackRock President Rob Kapito on the Outlook for Stocks—And How He’s Investing Now,yahoofinance,2020-12-12 10:55:55
What Is Inflation And Why Does It Matter To The Fed — And You?,yahoofinance,2020-12-12 10:55:55
Is ADBE Stock A Buy Now After Earnings Beat Views?,yahoofinance,2020-12-12 10:55:55
Electric vehicle sales expected to grow 50% in 2021,yahoofinance,2020-12-12 10:55:55
Top Tobacco Stocks for Q1 2021,yahoofinance,2020-12-12 10:55:55
Thiel-Backed Developer of Covid-19 Therapy Surges in Debut,yahoofinance,2020-12-12 10:55:55
"Why Airbnb being valued at $101 billion and DoorDash at $66 billion may end badly, quickly",yahoofinance,2020-12-12 10:55:55
Investors swap China holdings from Wall Street to Hong Kong as delisting threat brews,yahoofinance,2020-12-12 10:55:55
Dow Jones Stocks To Buy And Watch In December 2020: Apple Tests New Buy Point,yahoofinance,2020-12-12 10:55:55
Caterpillar Stock Is About to Hit a Sweet Spot,yahoofinance,2020-12-12 10:55:55
Citigroup Execs Tried to ‘Lessen the Pain’ of $900 Million Error,yahoofinance,2020-12-12 10:55:55
What Does Exxon Mobil's Debt Look Like?,yahoofinance,2020-12-12 10:55:55
EUR/USD Weekly Price Forecast – Euro Neutral for the Week,yahoofinance,2020-12-12 10:55:55
TG Therapeutics Stock Jumps On Positive Results For Multiple Sclerosis Treatment,yahoofinance,2020-12-12 10:55:55
U.S. Authorizes the First Vaccine to Fight Pandemic,wsj,2020-12-12 10:58:38
Pfizer-BioNTech shot to be available within days,wsj,2020-12-12 10:58:38
"How Pfizer Delivered in Record Time: Crazy Deadlines, a Pushy CEO",wsj,2020-12-12 10:58:38
"Q&A: Distribution, Side Effects and What You Need to Know",wsj,2020-12-12 10:58:38
From Factory to Front Line: A Supply Chain Takes Shape to Deliver Vaccine,wsj,2020-12-12 10:58:38
AstraZeneca Agrees to Buy Alexion for $39 Billion,wsj,2020-12-12 10:58:38
High Court Rejects Texas Challenge to Biden’s Victory,wsj,2020-12-12 10:58:38
"Trump Pursues Appointing Special Counsel for Election, Hunter Biden",wsj,2020-12-12 10:58:38
Tesla to Replace Real-Estate Stock in S&P 500,wsj,2020-12-12 10:58:38
Tech IPO Bonanza Yields Riches for Venture-Capital Firms,wsj,2020-12-12 10:58:38
NFL Ratings Drop Leaves Networks Scrambling to Make Advertisers Whole,wsj,2020-12-12 10:58:38
The Quest to Bring Loved Ones to Life After They Die,wsj,2020-12-12 10:58:38
"Gargling Could Slow Covid-19 Spread, Mouthwash Makers Say",wsj,2020-12-12 10:58:38
