headline,org,date
"If You’re Following #FinTok or #StockTok on TikTok, Look Out for This Bad Advice",msnmoney,2021-01-20 18:47:17
Here Are the Most and Least Tax-Friendly Countries,msnmoney,2021-01-20 18:47:17
The $4.6B EP Market Will Exceed $8.6B by 2024,msnmoney,2021-01-20 18:47:17
Financial Moves You Can Make on the First Day of a New Presidency,msnmoney,2021-01-20 18:47:17
Tax Season Has Begun — 26 Things To Do This Month To Be Prepared,msnmoney,2021-01-20 18:47:17
Your Best Refinance Rates for January 2021,msnmoney,2021-01-20 18:47:17
Biden Blocking Keystone Threatens to End Mega Pipelines Era,msnmoney,2021-01-20 18:47:17
Everything You Can Buy for the Cost of One Super Bowl Ticket,msnmoney,2021-01-20 18:47:17
Why We Fail At Our Money Resolutions — And How You Can Reverse the Trend,msnmoney,2021-01-20 18:47:17
"Man Who Predicted 2020 Crash Says ""Now Is The Time""",msnmoney,2021-01-20 18:47:17
Top Stocks To Consider as Biden Takes Over,msnmoney,2021-01-20 18:47:17
These Are the Top Financial Advisors in Virginia,msnmoney,2021-01-20 18:47:17
"NRA Says It’s ‘Not Afraid’ of N.Y. Lawsuit, Will Continue Fight",msnmoney,2021-01-20 18:47:17
How to Turn Your Natural Talent Into Cold Hard Cash,msnmoney,2021-01-20 18:47:17
Stock market posts best Inauguration Day rise in 36 years as Biden takes office,msnmoney,2021-01-20 18:47:17
Jeff Bezos’ Most Outrageous Business Failures,msnmoney,2021-01-20 18:47:17
Married Filing Separately: What You Need To Know for This Tax Year,msnmoney,2021-01-20 18:47:17
Top credit card wipes out interest for 18 months,msnmoney,2021-01-20 18:47:17
4 Reasons People Should Be Happy With Donald Trump’s Impact on Taxes,msnmoney,2021-01-20 18:47:17
United Air Targets Pre-Virus Margins in 2023 After Record Loss,msnmoney,2021-01-20 18:47:17
Are you ignoring these harmful money myths?,msnmoney,2021-01-20 18:47:17
10 steps to getting your family finances back on track,msnmoney,2021-01-20 18:47:17
Just How Rich Are President Joe Biden and These Other Big Names?,msnmoney,2021-01-20 18:47:17
Here’s What Roofers Do Instead of Cleaning Gutters (It’s Genius),msnmoney,2021-01-20 18:47:17
Pfizer Inc. stock underperforms Wednesday when compared to competitors,msnmoney,2021-01-20 18:47:17
10 Steps to Help Get Your Career Back on Track,msnmoney,2021-01-20 18:47:17
Experts say some stock investors could be at risk of getting burned. How to make sure you're not one of them,msnmoney,2021-01-20 18:47:17
The 10 Most and 10 Least Densely Populated Major Cities in America,msnmoney,2021-01-20 18:47:17
California Tops 3 Million Cases; N.Y. Supply Woes: Virus Update,msnmoney,2021-01-20 18:47:17
New Car Gadget Magically Removes Scratches & Dents,msnmoney,2021-01-20 18:47:17
8 Ways To Land Your Dream Job in 2021,msnmoney,2021-01-20 18:47:17
"3 steps a millennial couple took to pay off $118,000 of student-loan debt in just one year",msnmoney,2021-01-20 18:47:17
10 Common Myths About Remote Work,msnmoney,2021-01-20 18:47:17
Stock-market performance under Trump trails only Obama and Clinton,msnmoney,2021-01-20 18:47:17
The Hardest College to Get Into in Every State,msnmoney,2021-01-20 18:47:17
2020 SUVs Fire Sale. Deals under $19K Won't Last.,msnmoney,2021-01-20 18:47:17
Mortgage experts evenly split on where rates will go next week,msnmoney,2021-01-20 18:47:17
Everything New Parents Need To Know About Filing Taxes This Year,msnmoney,2021-01-20 18:47:17
BlackRock Takes First Step Into Crypto Exposure in Two Funds,msnmoney,2021-01-20 18:47:17
Quiz: Do You Have What It Takes To Start a Business?,msnmoney,2021-01-20 18:47:17
A master limited partnership is a venture that trades like a public company but offers the rich returns and tax breaks of a private investment,msnmoney,2021-01-20 18:47:17
Luxury Assisted Living Near Arlington Might Have Seniors Packing Their Bags,msnmoney,2021-01-20 18:47:17
10 Simple Ways Baby Boomers Can Catch Up on Retirement Savings,msnmoney,2021-01-20 18:47:17
Current Car Loan Interest Rates,msnmoney,2021-01-20 18:47:17
How Biden’s First Week in Office Could Affect Your Bank Account,msnmoney,2021-01-20 18:47:17
The Pros and Cons of Retiring at Age 50,msnmoney,2021-01-20 18:47:17
Expert Advice on How To Reset Your Finances in 2021,msnmoney,2021-01-20 18:47:17
How to buy Apple devices without paying Apple prices,msnmoney,2021-01-20 18:47:17
Payments Startup Payoneer in Merger Talks With SPAC,msnmoney,2021-01-20 18:47:17
All the Numbers You Need To Know for Your 2020 Taxes,msnmoney,2021-01-20 18:47:17
6 steps to finding the best mortgage lender,msnmoney,2021-01-20 18:47:17
9 myths about early retirement,msnmoney,2021-01-20 18:47:17
"Amazon Prime member total reaches 142 million in U.S. with more shoppers opting in for a full year, data shows",msnmoney,2021-01-20 18:47:17
"Here's Why We're ""Tripling Down"" on This 1 Stock",msnmoney,2021-01-20 18:47:17
Charming cabins for sale across America,msnmoney,2021-01-20 18:47:17
10 States Where Shoppers Love to Get Cash Back,msnmoney,2021-01-20 18:47:17
This Is the County in Every State With the Most COVID-19 Deaths,msnmoney,2021-01-20 18:47:17
Obalon Therapeutics skyrockets 568% after announcing merger with weight-loss company ReShape Lifesciences,msnmoney,2021-01-20 18:47:17
Democrats in charge: how seniors could be affected,msnmoney,2021-01-20 18:47:17
17 important things to know about retirement,msnmoney,2021-01-20 18:47:17
17 Ways These $20 Lights Will Upgrade Your Home,msnmoney,2021-01-20 18:47:17
"Treehouses, shipping containers, and other unique mountain getaways",msnmoney,2021-01-20 18:47:17
Citigroup to Cut Bonuses for Top Executives After U.S. Reprimand,msnmoney,2021-01-20 18:47:17
Hours of Work Needed to Pay Rent in the 10 Largest Cities,msnmoney,2021-01-20 18:47:17
President Biden to extend break on student loan payments,msnmoney,2021-01-20 18:47:17
Secrets realtors don’t want you to know,msnmoney,2021-01-20 18:47:17
"Belk's top lenders, including KKR, looking to avoid taking department store through bankruptcy, WSJ says",msnmoney,2021-01-20 18:47:17
"Incredible Blanket Puts Humans In A Deep Sleep, Melting Stress Away",msnmoney,2021-01-20 18:47:17
The strangest things you can buy at Costco,msnmoney,2021-01-20 18:47:17
Where will Trump live after The White House?,msnmoney,2021-01-20 18:47:17
25 Most Outlandish Taxes Since the Boston Tea Party,msnmoney,2021-01-20 18:47:17
Covid Death Rate in U.S. Expected to Dip Further in Next Month,msnmoney,2021-01-20 18:47:17
The Most Fascinating Things You Never Knew You Could Invest In,msnmoney,2021-01-20 18:47:17
"FHFA Extending Foreclosure, Eviction Moratoriums: What It Means for Investors",msnmoney,2021-01-20 18:47:17
Refinance rates at 2.22% APR (15yr). Calculate your rate now,msnmoney,2021-01-20 18:47:17
Jobs you can do from home with no experience,msnmoney,2021-01-20 18:47:17
Netflix's CEO says it has to catch up with Disney+ on animated family hits like 'Soul',msnmoney,2021-01-20 18:47:17
Elon Musk’s Essential Tips for Aspiring Entrepreneurs,msnmoney,2021-01-20 18:47:17
Texas and Florida could become the next business hubs as employers look to flee San Francisco and New York City,msnmoney,2021-01-20 18:47:17
Turn Your $50K Salary Into A $1M Retirement Fund,msnmoney,2021-01-20 18:47:17
"After a Billion-Dollar Year, Australia Eyes Even More Tech IPOs",msnmoney,2021-01-20 18:47:17
"If You’re Following #FinTok or #StockTok on TikTok, Look Out for This Bad Advice",msnmoney,2021-01-20 18:47:17
Here Are the Most and Least Tax-Friendly Countries,msnmoney,2021-01-20 18:47:17
The $4.6B EP Market Will Exceed $8.6B by 2024,msnmoney,2021-01-20 18:47:17
Financial Moves You Can Make on the First Day of a New Presidency,msnmoney,2021-01-20 18:47:17
Tax Season Has Begun — 26 Things To Do This Month To Be Prepared,msnmoney,2021-01-20 18:47:17
Your Best Refinance Rates for January 2021,msnmoney,2021-01-20 18:47:17
Biden Blocking Keystone Threatens to End Mega Pipelines Era,msnmoney,2021-01-20 18:47:17
Everything You Can Buy for the Cost of One Super Bowl Ticket,msnmoney,2021-01-20 18:47:17
Why We Fail At Our Money Resolutions — And How You Can Reverse the Trend,msnmoney,2021-01-20 18:47:17
"Man Who Predicted 2020 Crash Says ""Now Is The Time""",msnmoney,2021-01-20 18:47:17
Top Stocks To Consider as Biden Takes Over,msnmoney,2021-01-20 18:47:17
These Are the Top Financial Advisors in Virginia,msnmoney,2021-01-20 18:47:17
"NRA Says It’s ‘Not Afraid’ of N.Y. Lawsuit, Will Continue Fight",msnmoney,2021-01-20 18:47:17
How to Turn Your Natural Talent Into Cold Hard Cash,msnmoney,2021-01-20 18:47:17
Stock market posts best Inauguration Day rise in 36 years as Biden takes office,msnmoney,2021-01-20 18:47:17
Jeff Bezos’ Most Outrageous Business Failures,msnmoney,2021-01-20 18:47:17
Married Filing Separately: What You Need To Know for This Tax Year,msnmoney,2021-01-20 18:47:17
Top credit card wipes out interest for 18 months,msnmoney,2021-01-20 18:47:17
4 Reasons People Should Be Happy With Donald Trump’s Impact on Taxes,msnmoney,2021-01-20 18:47:17
United Air Targets Pre-Virus Margins in 2023 After Record Loss,msnmoney,2021-01-20 18:47:17
Are you ignoring these harmful money myths?,msnmoney,2021-01-20 18:47:17
10 steps to getting your family finances back on track,msnmoney,2021-01-20 18:47:17
Just How Rich Are President Joe Biden and These Other Big Names?,msnmoney,2021-01-20 18:47:17
Here’s What Roofers Do Instead of Cleaning Gutters (It’s Genius),msnmoney,2021-01-20 18:47:17
Pfizer Inc. stock underperforms Wednesday when compared to competitors,msnmoney,2021-01-20 18:47:17
10 Steps to Help Get Your Career Back on Track,msnmoney,2021-01-20 18:47:17
Experts say some stock investors could be at risk of getting burned. How to make sure you're not one of them,msnmoney,2021-01-20 18:47:17
The 10 Most and 10 Least Densely Populated Major Cities in America,msnmoney,2021-01-20 18:47:17
California Tops 3 Million Cases; N.Y. Supply Woes: Virus Update,msnmoney,2021-01-20 18:47:17
New Car Gadget Magically Removes Scratches & Dents,msnmoney,2021-01-20 18:47:17
8 Ways To Land Your Dream Job in 2021,msnmoney,2021-01-20 18:47:17
"3 steps a millennial couple took to pay off $118,000 of student-loan debt in just one year",msnmoney,2021-01-20 18:47:17
10 Common Myths About Remote Work,msnmoney,2021-01-20 18:47:17
Stock-market performance under Trump trails only Obama and Clinton,msnmoney,2021-01-20 18:47:17
The Hardest College to Get Into in Every State,msnmoney,2021-01-20 18:47:17
2020 SUVs Fire Sale. Deals under $19K Won't Last.,msnmoney,2021-01-20 18:47:17
Mortgage experts evenly split on where rates will go next week,msnmoney,2021-01-20 18:47:17
Everything New Parents Need To Know About Filing Taxes This Year,msnmoney,2021-01-20 18:47:17
BlackRock Takes First Step Into Crypto Exposure in Two Funds,msnmoney,2021-01-20 18:47:17
Quiz: Do You Have What It Takes To Start a Business?,msnmoney,2021-01-20 18:47:17
A master limited partnership is a venture that trades like a public company but offers the rich returns and tax breaks of a private investment,msnmoney,2021-01-20 18:47:17
Luxury Assisted Living Near Arlington Might Have Seniors Packing Their Bags,msnmoney,2021-01-20 18:47:17
10 Simple Ways Baby Boomers Can Catch Up on Retirement Savings,msnmoney,2021-01-20 18:47:17
Current Car Loan Interest Rates,msnmoney,2021-01-20 18:47:17
How Biden’s First Week in Office Could Affect Your Bank Account,msnmoney,2021-01-20 18:47:17
The Pros and Cons of Retiring at Age 50,msnmoney,2021-01-20 18:47:17
Expert Advice on How To Reset Your Finances in 2021,msnmoney,2021-01-20 18:47:17
How to buy Apple devices without paying Apple prices,msnmoney,2021-01-20 18:47:17
Payments Startup Payoneer in Merger Talks With SPAC,msnmoney,2021-01-20 18:47:17
All the Numbers You Need To Know for Your 2020 Taxes,msnmoney,2021-01-20 18:47:17
6 steps to finding the best mortgage lender,msnmoney,2021-01-20 18:47:17
9 myths about early retirement,msnmoney,2021-01-20 18:47:17
"Amazon Prime member total reaches 142 million in U.S. with more shoppers opting in for a full year, data shows",msnmoney,2021-01-20 18:47:17
"Here's Why We're ""Tripling Down"" on This 1 Stock",msnmoney,2021-01-20 18:47:17
Charming cabins for sale across America,msnmoney,2021-01-20 18:47:17
10 States Where Shoppers Love to Get Cash Back,msnmoney,2021-01-20 18:47:17
This Is the County in Every State With the Most COVID-19 Deaths,msnmoney,2021-01-20 18:47:17
Obalon Therapeutics skyrockets 568% after announcing merger with weight-loss company ReShape Lifesciences,msnmoney,2021-01-20 18:47:17
Democrats in charge: how seniors could be affected,msnmoney,2021-01-20 18:47:17
17 important things to know about retirement,msnmoney,2021-01-20 18:47:17
17 Ways These $20 Lights Will Upgrade Your Home,msnmoney,2021-01-20 18:47:17
"Treehouses, shipping containers, and other unique mountain getaways",msnmoney,2021-01-20 18:47:17
Citigroup to Cut Bonuses for Top Executives After U.S. Reprimand,msnmoney,2021-01-20 18:47:17
Hours of Work Needed to Pay Rent in the 10 Largest Cities,msnmoney,2021-01-20 18:47:17
President Biden to extend break on student loan payments,msnmoney,2021-01-20 18:47:17
Secrets realtors don’t want you to know,msnmoney,2021-01-20 18:47:17
"Belk's top lenders, including KKR, looking to avoid taking department store through bankruptcy, WSJ says",msnmoney,2021-01-20 18:47:17
"Incredible Blanket Puts Humans In A Deep Sleep, Melting Stress Away",msnmoney,2021-01-20 18:47:17
The strangest things you can buy at Costco,msnmoney,2021-01-20 18:47:17
Where will Trump live after The White House?,msnmoney,2021-01-20 18:47:17
25 Most Outlandish Taxes Since the Boston Tea Party,msnmoney,2021-01-20 18:47:17
Covid Death Rate in U.S. Expected to Dip Further in Next Month,msnmoney,2021-01-20 18:47:17
The Most Fascinating Things You Never Knew You Could Invest In,msnmoney,2021-01-20 18:47:17
"FHFA Extending Foreclosure, Eviction Moratoriums: What It Means for Investors",msnmoney,2021-01-20 18:47:17
Refinance rates at 2.22% APR (15yr). Calculate your rate now,msnmoney,2021-01-20 18:47:17
Jobs you can do from home with no experience,msnmoney,2021-01-20 18:47:17
Netflix's CEO says it has to catch up with Disney+ on animated family hits like 'Soul',msnmoney,2021-01-20 18:47:17
Elon Musk’s Essential Tips for Aspiring Entrepreneurs,msnmoney,2021-01-20 18:47:17
Texas and Florida could become the next business hubs as employers look to flee San Francisco and New York City,msnmoney,2021-01-20 18:47:17
Turn Your $50K Salary Into A $1M Retirement Fund,msnmoney,2021-01-20 18:47:17
"After a Billion-Dollar Year, Australia Eyes Even More Tech IPOs",msnmoney,2021-01-20 18:47:17
Stock futures drift near record levels after Inauguration Day,yahoofinance,2021-01-20 18:49:22
United Airlines pledges more cost cuts after virus-driven loss,yahoofinance,2021-01-20 18:49:22
Biden extends pause on federally-backed student loan payments,yahoofinance,2021-01-20 18:49:22
How Netflix’s overseas expansion fueled its explosive growth,yahoofinance,2021-01-20 18:49:22
The economic impact of Biden's COVID-19 relief plan,yahoofinance,2021-01-20 18:49:22
Inauguration 2021: Amanda Gorman is the youngest poet to perform at a presidential inauguration,yahoofinance,2021-01-20 18:49:22
Trump gives clemency to 12 weed offenders,yahoofinance,2021-01-20 18:49:22
Trump grants Levandowski full pardon,yahoofinance,2021-01-20 18:49:22
"Arlington, Virginia: Why Americans Are Revisiting Their Insurance..",yahoofinance,2021-01-20 18:49:22
3 Stocks That Could Win Big As The Biden Administration Takes The Wheel,yahoofinance,2021-01-20 18:49:22
"Your next stimulus check — for $1,400 — is about to start moving closer",yahoofinance,2021-01-20 18:49:22
"Bitcoin Sells Off on Bearish Sentiment, Yellen Worries",yahoofinance,2021-01-20 18:49:22
"Biden to Bar Keystone Pipeline, Reversing Early Trump Move",yahoofinance,2021-01-20 18:49:22
A survey says we're keeping too much money in cash — do this instead,yahoofinance,2021-01-20 18:49:22
How the stock market and economy performed under Democratic presidents,yahoofinance,2021-01-20 18:49:22
A ‘Social Security bridge’ may be the best option for generating lifetime income from 401(k) plans,yahoofinance,2021-01-20 18:49:22
"If You Bought Tesla Stock Instead Of A Model S At Launch, Here's How Much You'd Have Now",yahoofinance,2021-01-20 18:49:22
8 Quality Dividend Stocks for Durable Growth and Income,yahoofinance,2021-01-20 18:49:22
12 red flags that could lead to an IRS audit,yahoofinance,2021-01-20 18:49:22
Six Stocks to Buy for the Next Oil-Price Surge,yahoofinance,2021-01-20 18:49:22
Why Netflix stock is going haywire after its latest earnings report,yahoofinance,2021-01-20 18:49:22
"Ethereum surges near all-time highs, may rally 650% to $10,500: analysts",yahoofinance,2021-01-20 18:49:22
Are These 3 Electric Car Stocks Still Worth Buying? Analyst Weighs In,yahoofinance,2021-01-20 18:49:22
7 of IBM Watson's Top Stock Picks,yahoofinance,2021-01-20 18:49:22
Obalon Therapeutics stock soars to lead all gainers on massive volume after ReShape merger deal,yahoofinance,2021-01-20 18:49:22
Intel Says It Will Top Sales Guidance. Here’s How Much the Beat Could Be.,yahoofinance,2021-01-20 18:49:22
"Why This ATV, Motorcycle Maker Is An Overlooked Electric Vehicle Stock: Analyst",yahoofinance,2021-01-20 18:49:22
Stock Market Today With Jim Cramer: Buy Ford,yahoofinance,2021-01-20 18:49:22
FuelCell Energy's Earnings Outlook,yahoofinance,2021-01-20 18:49:22
Billionaire investor: Enjoy the bull market while it lasts,yahoofinance,2021-01-20 18:49:22
"Cramer Gives His Opinion On Canopy Growth, Quanta Services And More",yahoofinance,2021-01-20 18:49:22
"United Airlines Stock Falls Late As Q4 Loss Misses, Q1 Outlook Weak",yahoofinance,2021-01-20 18:49:22
Plug Power Drops After Kerrisdale Unveils Short Position,yahoofinance,2021-01-20 18:49:22
BlackBerry Stock Extends Rally On Facebook Settlement; More Upside From AWS?,yahoofinance,2021-01-20 18:49:22
Top Dividend Stocks for February 2021,yahoofinance,2021-01-20 18:49:22
Wall Street is in its riskiest mindset in 20 years: BofA survey,yahoofinance,2021-01-20 18:49:22
"The Ultimate Warren Buffett Stock Is Near Buy Zone, But Should You Buy It?",yahoofinance,2021-01-20 18:49:22
"Social Security, Medicare and Retirement Plan Changes in 2021",yahoofinance,2021-01-20 18:49:22
Top Technology Stocks for February 2021,yahoofinance,2021-01-20 18:49:22
Ford Has a Hidden Asset Just Like GM. Its Stock Could Rise Soon Too.,yahoofinance,2021-01-20 18:49:22
The credit score to get a mortgage has soared — what can a borrower do?,yahoofinance,2021-01-20 18:49:22
IBM Reports Earnings Tomorrow. Here’s What to Expect.,yahoofinance,2021-01-20 18:49:22
United Airlines Loses $1.9 Billion in Latest Quarter,yahoofinance,2021-01-20 18:49:22
Is Nio Stock A Buy As China EV Leader Surges After Unveiling Luxury Sedan?,yahoofinance,2021-01-20 18:49:22
Berenberg Upgrades Boeing On 737 Max Prospects,yahoofinance,2021-01-20 18:49:22
UPDATE: Bionano Genomics prices $200 million underwritten stock offering at a discount of $6 a share,yahoofinance,2021-01-20 18:49:22
"BlackBerry's stock soars toward a record 4-day rally, and highest close in nearly 3 years",yahoofinance,2021-01-20 18:49:22
Biden Blocking Keystone Threatens to End Mega Pipelines Era,yahoofinance,2021-01-20 18:49:22
2021's Dividend Aristocrats List: All 65 Stocks,yahoofinance,2021-01-20 18:49:22
Alibaba's Jack Ma makes first public appearance in three months,yahoofinance,2021-01-20 18:49:22
Is DraftKings Stock A Buy Or Sell Right Now After Key Analyst Upgrade?,yahoofinance,2021-01-20 18:49:22
Bitcoin miner’s stocks hammered as crypto prices skid lower Wednesday,yahoofinance,2021-01-20 18:49:22
"Gritstone Touches Record, Defying Analyst’s Double Downgrade",yahoofinance,2021-01-20 18:49:22
"Tesla analyst more than doubles stock price target to $1,036",yahoofinance,2021-01-20 18:49:22
Here Is What’s Behind Today’s Big Tech Stock Rally,yahoofinance,2021-01-20 18:49:22
"Dow Jones Stocks To Buy And Watch In January 2021: Apple, Microsoft Surge",yahoofinance,2021-01-20 18:49:22
United Airlines posts fourth straight quarterly loss and pledges more cost cuts,yahoofinance,2021-01-20 18:49:22
Is Caladrius Stock a Buy Right Now? This Is What You Need to Know,yahoofinance,2021-01-20 18:49:22
Top Utilities Stocks for February 2021,yahoofinance,2021-01-20 18:49:22
"As Change Comes to Washington, One Analyst Is Nervous About Palantir",yahoofinance,2021-01-20 18:49:22
"Dow Jones Rallies 250 Points, Helped By Bullish Moves From Apple, Microsoft; 2 FANG Stocks Give Buy Signals",yahoofinance,2021-01-20 18:49:22
These Stocks Are More of a Gamble Than an Investment,yahoofinance,2021-01-20 18:49:22
VW CEO Talks a Little Trash With Tesla’s Musk in Twitter Debut,yahoofinance,2021-01-20 18:49:22
"Snowflake Stock Is Cheaper, but Not Cheap Enough",yahoofinance,2021-01-20 18:49:22
"GameStop's stock drops, ahead of short seller's livestream on 5 reasons to sell",yahoofinance,2021-01-20 18:49:22
"Is PayPal Stock A Buy Right Now? Here's What Earnings, Charts Show",yahoofinance,2021-01-20 18:49:22
A Short Seller Pans Plug Power Stock. But Wall Street Disagrees.,yahoofinance,2021-01-20 18:49:22
Is Now the Time to Pull the Trigger on Luminar Stock? This Analyst Says ‘Yes’,yahoofinance,2021-01-20 18:49:22
Top Small Cap Stocks for February 2021,yahoofinance,2021-01-20 18:49:22
"As mortgage rates rise, borrowers hold back — and may regret it",yahoofinance,2021-01-20 18:49:22
SPAC Churchill Capital declines comment on whether it is pursuing specific merger following 'unusual' trading of its stock,yahoofinance,2021-01-20 18:49:22
"Return On Capital Employed Overview: Senseonics Holdings, Inc. Common Stock",yahoofinance,2021-01-20 18:49:22
Procter & Gamble Slips After Earnings - Is It a Buying Opportunity?,yahoofinance,2021-01-20 18:49:22
Eli Lilly Stock Is Surging on Hope for Alzheimer’s Drug. Analyst Says It Won’t Last.,yahoofinance,2021-01-20 18:49:22
Qualcomm's Strong Composite Rating Strengthens,yahoofinance,2021-01-20 18:49:22
"Dow Jones Futures: Stock Market Rally Hits Record Highs As Joe Biden Sworn In, But This Risk Returns; Netflix Leads Six Breakouts",yahoofinance,2021-01-20 18:49:22
Chip-Gear Maker ASML Crushes Fourth-Quarter Views Amid Capital Spending Rush,yahoofinance,2021-01-20 18:49:22
States with the Lowest Taxes and the Highest Taxes,yahoofinance,2021-01-20 18:49:22
"After The Hottest Year On Record, 3 Stock Ideas That Are Green For The Planet",yahoofinance,2021-01-20 18:49:22
"Ford Must Recall 3M Vehicles Due To Dangerous Airbags, Orders NHTSA",yahoofinance,2021-01-20 18:49:22
"Is Amazon Stock A Buy Right Now? Here's What Earnings, Charts Show",yahoofinance,2021-01-20 18:49:22
Best Tech Stocks To Buy Or Watch Now: 5 Growth Stocks Leading The Stock Market,yahoofinance,2021-01-20 18:49:22
Jack Ma Is Back but Is Alibaba? Let's Look at the Chart,yahoofinance,2021-01-20 18:49:22
"Stock Market Winners, Losers From Biden's Finance Nominations",yahoofinance,2021-01-20 18:49:22
"Is Ford Stock A Buy Now, As Earnings Rebound?",yahoofinance,2021-01-20 18:49:22
5 reasons why 2021 just might be the year GM’s stock price stands up to Tesla,yahoofinance,2021-01-20 18:49:22
"Warren Buffett Stocks: Pool Stock, Veeva, PayPal Among 10 Stocks On This Screen",yahoofinance,2021-01-20 18:49:22
Vanguard Signals Fee War Intensifies With Active Bond ETF Plan,yahoofinance,2021-01-20 18:49:22
Trump pardons former Google engineer Anthony Levandowski,yahoofinance,2021-01-20 18:49:22
"Is BYND Stock A Buy? Here's What Beyond Meat Earnings, Chart Show",yahoofinance,2021-01-20 18:49:22
Tesla Stock Forecasts Keep Hitting Highs As Wall Street Struggles To See Ceiling,yahoofinance,2021-01-20 18:49:22
Here’s the maximum amount Biden’s stimulus checks and tax credits would deliver to America’s poorest families,yahoofinance,2021-01-20 18:49:22
Cannabis Stocks Watchlist: When to Buy Canopy Growth,yahoofinance,2021-01-20 18:49:22
Intel Reports Earnings Tomorrow. Here’s What to Expect.,yahoofinance,2021-01-20 18:49:22
The Space SPAC Stable Road Spiked 34%. The Question Is Why.,yahoofinance,2021-01-20 18:49:22
Bank of New York Mellon's stock drops to lead S&P 500 losers after profit miss,yahoofinance,2021-01-20 18:49:22
The Most Tax-Friendly States to Retire,yahoofinance,2021-01-20 18:49:22
2 Big Dividend Stocks Yielding at Least 10%; Here’s What You Need to Know,yahoofinance,2021-01-20 18:49:22
Top REITs for February 2021,yahoofinance,2021-01-20 18:49:22
"4 Consumer-Staples Stocks, From Estee Lauder to Coca-Cola, Set to Outperform",yahoofinance,2021-01-20 18:49:22
"Is Virgin Galactic Stock A Buy As Test Flight Redo Nears, Spinoff Eyes SPAC Deal?",yahoofinance,2021-01-20 18:49:22
"Is Alibaba Stock A Buy Right Now? Here's What Earnings, Chart Show",yahoofinance,2021-01-20 18:49:22
Arrival Group (CIIC): One of the Best Positioned Electrification Plays,yahoofinance,2021-01-20 18:49:22
Lumentum Is Merging With Coherent to Bulk Up in Lasers. Here’s What Wall Street Thinks of the Deal.,yahoofinance,2021-01-20 18:49:22
"Can I Use My 401(K) to Buy a House? And If So, Should I?",yahoofinance,2021-01-20 18:49:22
"Nike Stock Hits Buy Zone, But Is It A Good Buy Amid Soaring Digital Sales?",yahoofinance,2021-01-20 18:49:22
9 Top Nasdaq Stocks Are Already Beating The Market By 15X,yahoofinance,2021-01-20 18:49:22
RBC: These 2 Tech Stocks Are Poised to Surge by Over 40%,yahoofinance,2021-01-20 18:49:22
"My husband is a felon and his work plummeted. He did not file a 2019 tax return. Will we get $1,400 stimulus checks under President Biden?",yahoofinance,2021-01-20 18:49:22
Biden Takes Office as 46th President With a Call for Unity,wsj,2021-01-20 18:52:03
"‘This is democracy’s day,’ new president says as Harris makes history",wsj,2021-01-20 18:52:03
First Day Brings Range of Executive Orders,wsj,2021-01-20 18:52:03
