headline,org,date
Russian monk charged with inciting suicidal acts in sermons,googlenews,2020-12-29 16:53:43
Mortgage refinance rates continue hitting record lows – here’s how to get the best deal now,googlenews,2020-12-29 16:53:43
Omni Hotels Accepted Millions In PPP Funds But Didn't Pay Workers,googlenews,2020-12-29 16:53:43
What Chase’s new booking platform acquisition could mean for you,googlenews,2020-12-29 16:53:43
Apple Wallet Receipt Could Serve As First Proof Of An Individual's Vaccination Status,googlenews,2020-12-29 16:53:43
"GLOBAL MARKETS-Global stocks, oil lead risk rally on U.S. stimulus hopes",googlenews,2020-12-29 16:53:43
"Fed, Treasury Provide One-Week Reprieve for ‘Main Street’ Program After Demand Surges",googlenews,2020-12-29 16:53:43
"If you want to travel next year, you may need a vaccine passport",googlenews,2020-12-29 16:53:43
Lil Pump banned from flying JetBlue after rapper refuses to wear face mask on flight,googlenews,2020-12-29 16:53:43
Louisville opening 'mass vaccination' site next week,googlenews,2020-12-29 16:53:43
"A historic oil price collapse, with worries headed into 2021",googlenews,2020-12-29 16:53:43
Understanding Palantir Technologies's Unusual Options Activity,googlenews,2020-12-29 16:53:43
Inside the Google-Facebook Ad Deal at the Heart of a Price-Fixing Lawsuit,googlenews,2020-12-29 16:53:43
ER nurse tests positive for COVID-19 eight days after receiving vaccine,googlenews,2020-12-29 16:53:43
This Was the Busiest Year for IPOs Since the Dot-Com Bubble. Expect Another Busy Year in 2021.,googlenews,2020-12-29 16:53:43
Trump's unplanned gift to Biden: Clean energy on the rise,googlenews,2020-12-29 16:53:43
"Dec. 28 COVID-19 update: Active cases, hospitalizations dropping in Minnesota",googlenews,2020-12-29 16:53:43
"Will COVID-19 vaccines be available at Publix, Walmart, CVS, Walgreens and others?",googlenews,2020-12-29 16:53:43
Girl Scout Cookies Linked to Child Labor,googlenews,2020-12-29 16:53:43
"COVID-19 In Pennsylvania: Dept. Of Health Will Not Lift Restrictions, Indoor Dining Ban Before Jan. 4, Status Unclear Going Forward",googlenews,2020-12-29 16:53:43
"TSA reports coronavirus travel record, screening nearly 1.3M travelers Sunday",googlenews,2020-12-29 16:53:43
Bitcoin mining: The next decade of sustainable crypto innovation begins today,googlenews,2020-12-29 16:53:43
Fired boss at Tyson Iowa pork plant says COVID-19 betting pool was a 'morale boost',googlenews,2020-12-29 16:53:43
Turning 66 Next Year? Beware This Social Security Change,googlenews,2020-12-29 16:53:43
Nvidia rival Graphcore raises $222 million for AI chips with potential IPO on the horizon,googlenews,2020-12-29 16:53:43
AstraZeneca Stock Pops On Reports Its Covid Vaccine Could Snag UK Authorization,googlenews,2020-12-29 16:53:43
SAP Unit Qualtrics Heads for IPO,googlenews,2020-12-29 16:53:43
Does America's preferred student loan repayment program work? 'That is the big question',googlenews,2020-12-29 16:53:43
"House approves stimulus-payment hike, as Democrats try to broaden eligibility in preview of next fight",googlenews,2020-12-29 16:53:43
Did you wake up richer? 2 winning lottery tickets sold in Houston area,googlenews,2020-12-29 16:53:43
"Hershey unveils holiday candy 2021 lineup, including chocolate Build-A-Bunny",googlenews,2020-12-29 16:53:43
AstraZeneca’s COVID-19 jab expected to receive emergency nod within days,googlenews,2020-12-29 16:53:43
"US STOCKS-S&P, Nasdaq futures at record levels as Trump signs stimulus aid bill",googlenews,2020-12-29 16:53:43
The 11 days of drama at sea that changed cruising forever,googlenews,2020-12-29 16:53:43
'We want to get back to normal': Long-term care sites start to get vaccine,googlenews,2020-12-29 16:53:43
COVID-19 Relief Bill – What Employers Need to Know Heading Into 2021,googlenews,2020-12-29 16:53:43
Is Dairy Farming Cruel to Cows?,googlenews,2020-12-29 16:53:43
Looking Into Moderna's Return On Capital Employed,googlenews,2020-12-29 16:53:43
Snap Shares Surge on Goldman Sachs Price Target Boost to Wall Street-High $70,googlenews,2020-12-29 16:53:43
Simon Property finally closes Taubman purchase,googlenews,2020-12-29 16:53:43
"Winning numbers for Idaho $1,000,000 Raffle announced",googlenews,2020-12-29 16:53:43
ARCT Stock Crumbles On 'Underwhelming' Coronavirus Vaccine Update,googlenews,2020-12-29 16:53:43
Stocks open at record levels - Here are the top gainers for the S&P 500,googlenews,2020-12-29 16:53:43
"Stocks close lower after hitting record highs, Dow and S&P 500 snap 3-day winning streak",googlenews,2020-12-29 16:53:43
Quarter by Painful Quarter: A Look Back at 2020 By Investing.com,googlenews,2020-12-29 16:53:43
Dow Jones Futures Rise: Apple Eyes Breakout As Tech Giants Lead Stock Market Rally,googlenews,2020-12-29 16:53:43
Crypto token XRP falls as much as 31% after Coinbase says it will halt trading following SEC complaint against Ripple,googlenews,2020-12-29 16:53:43
Coinbase says it will suspend XRP trading next month - The Block,googlenews,2020-12-29 16:53:43
Coinbase halts trading of XRP following SEC suit against Ripple,googlenews,2020-12-29 16:53:43
XRP Plummets Another 19% As Coinbase Delivers Latest Jolt,googlenews,2020-12-29 16:53:43
Small mom-and-pop businesses that took PPP loans may face a surprise tax bomb,googlenews,2020-12-29 16:53:43
Tampa Bay businesses anxious for next round of PPP help,googlenews,2020-12-29 16:53:43
What’s different about the second round of PPP loans?,googlenews,2020-12-29 16:53:43
Congress reverses IRS; expenses paid with PPP loan proceeds are deductible,googlenews,2020-12-29 16:53:43
US to allow small drones to fly over people and at night,googlenews,2020-12-29 16:53:43
US to allow drones to fly over people during the day and night,googlenews,2020-12-29 16:53:43
US Approves Delivery Drones Over Populated Areas,googlenews,2020-12-29 16:53:43
FAA finally sets rules for piloting small drones,googlenews,2020-12-29 16:53:43
"190,000 ceiling fans recalled because the blades detach and fly off",googlenews,2020-12-29 16:53:43
"Ceiling fans with blades that can detach recalled; about 80,000 sold at Home Depot",googlenews,2020-12-29 16:53:43
Hampton Bay ceiling fans sold at Home Depot recalled,googlenews,2020-12-29 16:53:43
"182K ceiling fans sold at Home Depot recalled as blades can detach, fly off",googlenews,2020-12-29 16:53:43
Not runnin' fast enough? Dunkin's brewing up coffee with 20% more caffeine,googlenews,2020-12-29 16:53:43
"Dunkin’ unveiling new items for 2021: Confetti donuts, ‘extra charged’ coffee with 20% more caffeine and more",googlenews,2020-12-29 16:53:43
Dunkin' Launches 'Extra Charged Coffee' with 20 Percent More Caffeine,googlenews,2020-12-29 16:53:43
This Fast-Food Chain's New Coffee Packs 20% More Caffeine | Eat This Not That,googlenews,2020-12-29 16:53:43
2020 Saw the Fewest Bitcoin ‘Obituaries’ in 8 Years - CoinDesk,googlenews,2020-12-29 16:53:43
"After recent price spike, bitcoin requires enough power for a country of more than 200 million people",googlenews,2020-12-29 16:53:43
Bitcoin price rally cools down as Polkadot gains 34% in first week of ‘altseason’,googlenews,2020-12-29 16:53:43
"Is This Why Bitcoin, Ethereum, Litecoin And Other Cryptocurrencies Have Suddenly Shot Higher?",googlenews,2020-12-29 16:53:43
Moderna Inc. stock underperforms Monday when compared to competitors,googlenews,2020-12-29 16:53:43
AstraZeneca PLC ADR outperforms market on strong trading day,googlenews,2020-12-29 16:53:43
"Tesla Inc. stock rises Monday, still underperforms market",googlenews,2020-12-29 16:53:43
Microsoft Corp. stock outperforms market on strong trading day,googlenews,2020-12-29 16:53:43
Fauci: Vaccine numbers below target set for end of December,googlenews,2020-12-29 16:53:43
Trump Admin. Fails To Keep Trump's Promises On Covid-19 Vaccine Distribution Timing | Rachel Maddow,googlenews,2020-12-29 16:53:43
Federal COVID-19 vaccination goal falls short,googlenews,2020-12-29 16:53:43
Vaccination promises are coming up a bit short,googlenews,2020-12-29 16:53:43
"Essential workers to be removed from Utah vaccine plan as focus turns to age, risk",googlenews,2020-12-29 16:53:43
"Utah reports more than 2,700 new COVID-19 cases, 16 deaths",googlenews,2020-12-29 16:53:43
"1716 more COVID-19 cases, 5 deaths reported in Utah Monday",googlenews,2020-12-29 16:53:43
Utahns 75 and over moved up in priority for COVID-19 vaccine; essential workers moved down,googlenews,2020-12-29 16:53:43
"These 2 Penny Stocks Are Poised to Go Boom, Say Analysts",googlenews,2020-12-29 16:53:43
Portfolio Manger on stimulus: ‘In this instance we absolutely need it’,googlenews,2020-12-29 16:53:43
Coffee shop co-owner shares frustration over Uber Eats using her company for unauthorized listing,googlenews,2020-12-29 16:53:43
Here’s what has to happen for Tesla to grow into its valuation,googlenews,2020-12-29 16:53:43
China's central bank says Ant Group to set up financial holding firm,googlenews,2020-12-29 16:53:43
China Eyes Shrinking Jack Ma’s Business Empire,googlenews,2020-12-29 16:53:43
The Goldman Solution Could Work Out Fine for Jack Ma,googlenews,2020-12-29 16:53:43
China strives to get balance right with move on tech giants,googlenews,2020-12-29 16:53:43
Novavax kicks off late-stage vaccine trial,googlenews,2020-12-29 16:53:43
COVID-19 vaccine from Novavax is latest to enter Phase 3 trial in U.S.,googlenews,2020-12-29 16:53:43
Novavax Vaccine Will Probably Work on New Covid Strain: CEO,googlenews,2020-12-29 16:53:43
The latest on the coronavirus pandemic and vaccines: Live updates,googlenews,2020-12-29 16:53:43
DHS launches new COVID-19 vaccine data page,googlenews,2020-12-29 16:53:43
"Wisconsin DHS: Coronavirus cases up 2,384; deaths up 72",googlenews,2020-12-29 16:53:43
19 more dead from COVID-19 in Wisconsin; 82 newly hospitalized,googlenews,2020-12-29 16:53:43
82 more hospitalized with COVID-19 in Wisconsin; health officials report drop in new cases,googlenews,2020-12-29 16:53:43
Intel shares rise after Third Point urges chipmaker to explore strategic alternatives as market share deteriorates,googlenews,2020-12-29 16:53:43
Intel soars 8% after activist hedge fund Third Point urges chipmaker to explore strategic alternatives,googlenews,2020-12-29 16:53:43
Intel Up as Hedge Fund Third Point Urges Review of Alternatives,googlenews,2020-12-29 16:53:43
"Vandalism leaves 3,500 customers without heat or hot water amid freezing temperatures in Colorado",googlenews,2020-12-29 16:53:43
Gas outage continues in Pitkin County after weekend vandalism to sites,googlenews,2020-12-29 16:53:43
Thousands Without Heat Or Water In Aspen Area After Vandals Target Natural Gas System,googlenews,2020-12-29 16:53:43
"Vandalism string leaves thousands in Colorado without heat, hot water | TheHill",googlenews,2020-12-29 16:53:43
These tech companies are paying workers the same rates across US,googlenews,2020-12-29 16:53:43
City's COVID-19 Rate Reaches 7.45% as Deaths Top 25000,googlenews,2020-12-29 16:53:43
"NYC hits another grim COVID milestone with 25,000 deaths",googlenews,2020-12-29 16:53:43
NYC Open Storefronts program extended through September 2021,googlenews,2020-12-29 16:53:43
Open Storefronts Program Extended - and Expanded to Include Restaurants,googlenews,2020-12-29 16:53:43
Alaska Airlines to stop allowing emotional support animals on flights,googlenews,2020-12-29 16:53:43
Alaska Airlines Bans Emotional Support Animals,googlenews,2020-12-29 16:53:43
Alaska Airlines Announces Ban on Emotional Support Animals from All Flights,googlenews,2020-12-29 16:53:43
"Starting next month, emotional support animals will be banned on Alaska Airlines flights",googlenews,2020-12-29 16:53:43
"COVID-19: Margaret Keenan, first patient to get Pfizer vaccine, receives second jab",googlenews,2020-12-29 16:53:43
COVID-19 vaccine brings relief for Missoula hospital workers,googlenews,2020-12-29 16:53:43
‘A momentous day’: Annie Lynch (79) first person to get Covid-19 vaccine in State,googlenews,2020-12-29 16:53:43
"What exactly is the Pfizer vaccine, who will get it, and is it safe?",googlenews,2020-12-29 16:53:43
"Tesla will start selling cars in India next year, government says",googlenews,2020-12-29 16:53:43
5 Electric Car Stocks to Watch (Besides Tesla and Apple),googlenews,2020-12-29 16:53:43
Tesla is on its way in,googlenews,2020-12-29 16:53:43
Tesla's Latest System Update Sounds Like Real Gas,googlenews,2020-12-29 16:53:43
ETFs are booming. Could options make them even more popular?,googlenews,2020-12-29 16:53:43
Small Caps Routed As Stocks Fall Broadly; These Indexes Hold Up,googlenews,2020-12-29 16:53:43
5 High-Flying Stocks of the Top ETF in Q4,googlenews,2020-12-29 16:53:43
Defiance ETFs Hits $1 Billion in AUM,googlenews,2020-12-29 16:53:43
Anaheim White House among small businesses receiving financial help from Barstool Fund |ABC7,googlenews,2020-12-29 16:53:43
Freddie's Beach Bar Gets Support from Barstool Sports COVID-19 Relief Fund,googlenews,2020-12-29 16:53:43
Barstool Sports lending a hand to Tonawanda bar,googlenews,2020-12-29 16:53:43
"Barstool Sports' ""Barstool Fund"" helps struggling small business in Catskill",googlenews,2020-12-29 16:53:43
"Nearly 500 Moderna COVID vaccine doses discarded in Grafton, Wisconsin at Aurora Medical Center",googlenews,2020-12-29 16:53:43
Dozens of vials of coronavirus vaccine thrown out due to 'human error' at Wisconsin clinic | TheHill,googlenews,2020-12-29 16:53:43
Nearly 500 doses of COVID-19 vaccine thrown out at Aurora Medical Center-Grafton,googlenews,2020-12-29 16:53:43
Wisconsin Medical Center Had to Throw Away 500 Spoiled Vaccine Doses,googlenews,2020-12-29 16:53:43
"Today's best mortgage and refinance rates: Tues, Dec 29, 2020 | Rates stay low",googlenews,2020-12-29 16:53:43
"30-Year Interest Rates, December 29, 2020 | Important rate rises",googlenews,2020-12-29 16:53:43
Why Do Mortgage Refinance Lenders Care So Much About Credit Scores?,googlenews,2020-12-29 16:53:43
"Today's Best Mortgage and Refinance Rates: December 29, 2020 | Rates Rise",googlenews,2020-12-29 16:53:43
JPMorgan is acquiring a major credit card rewards business in a bet that travel will rebound next year,googlenews,2020-12-29 16:53:43
JPMorgan Chase Acquiring Customer Loyalty Division of cxLoyalty Group,googlenews,2020-12-29 16:53:43
JPMorgan Chase to buy credit card loyalty platform cxLoyalty,googlenews,2020-12-29 16:53:43
JPMorgan to buy credit-card reward business in bet travel will rebound,googlenews,2020-12-29 16:53:43
First Doses of Moderna COVID-19 Vaccine Administered in Chicago,googlenews,2020-12-29 16:53:43
German pilot traces massive syringe in recent flight to honor coronavirus vaccination campaign,googlenews,2020-12-29 16:53:43
German pilot makes his point with syringe in the sky,googlenews,2020-12-29 16:53:43
Japan's Nikkei 225 surges to levels not seen since early 1990s; Asia-Pacific markets mixed,googlenews,2020-12-29 16:53:43
Japanese Stocks Are Soaring. What’s Behind the Surge.,googlenews,2020-12-29 16:53:43
Japan stocks lead Asian shares higher as U.S. stimulus fuels rally,googlenews,2020-12-29 16:53:43
Asian shares jump on hopes of bigger US fiscal stimulus measures,googlenews,2020-12-29 16:53:43
Fed extends Main Street Lending Program,googlenews,2020-12-29 16:53:43
Fed extends Main Street loan program as last-minute applications surge,googlenews,2020-12-29 16:53:43
Fed extends business lending facility to deal with surge in applications,googlenews,2020-12-29 16:53:43
Fed extends Main Street Lending Program to Jan. 8,googlenews,2020-12-29 16:53:43
Walgreens releases statement after COVID-19 vaccines were given to the public in Lexington,googlenews,2020-12-29 16:53:43
Arwady gets COVID-19 vaccine at Chicago's new mass vaccination site,googlenews,2020-12-29 16:53:43
AstraZeneca jumps 4% after CEO says its COVID-19 vaccine could reach 95% efficacy,googlenews,2020-12-29 16:53:43
No masks required. 2021 Manatee County Fair will have these COVID-19 safety rules,googlenews,2020-12-29 16:53:43
Lil Pump is 'no longer welcome' to fly JetBlue after refusing to wear a face mask during flight,googlenews,2020-12-29 16:53:43
Lil Pump Banned from JetBlue for Refusing to Wear a Mask,googlenews,2020-12-29 16:53:43
JetBlue bans Lil Pump over mask refusal: report,googlenews,2020-12-29 16:53:43
MAGA Rapper Lil Pump Banned by Airline After Anti-Mask Tantrum,googlenews,2020-12-29 16:53:43
Louisville Walgreens gives out extra doses of COVID-19 vaccine to general public,googlenews,2020-12-29 16:53:43
"Louisville health officials confident in early vaccination results, ready for next phase",googlenews,2020-12-29 16:53:43
Louisville prepares to open site to administer mass vaccinations for COVID-19,googlenews,2020-12-29 16:53:43
Broadbent Arena drive-thru vaccination site to open in Louisville for first responders,googlenews,2020-12-29 16:53:43
Crude Oil Price Forecast - Crude Oil Continue to Drift in Thin Trading,googlenews,2020-12-29 16:53:43
Oil prices dip as demand concerns counter U.S. stimulus,googlenews,2020-12-29 16:53:43
Was 2020 Really So Bad for Oil?,googlenews,2020-12-29 16:53:43
When could we see $60 Oil again?,googlenews,2020-12-29 16:53:43
This was Google's code name for its 'unlawful agreement' with Facebook,googlenews,2020-12-29 16:53:43
US officials promised 20 million vaccinated against coronavirus by the end of the year. It's going slower than that,googlenews,2020-12-29 16:53:43
COVID-19 vaccine timeline: from clinical trials to rollout in nine months,googlenews,2020-12-29 16:53:43
"How, where, when: The COVID-19 vaccine in Washington state",googlenews,2020-12-29 16:53:43
Frontline workers line up to receive COVID-19 vaccine at Holy Cross Health,googlenews,2020-12-29 16:53:43
The Spectacular Rise Of SPACs: The Backwards IPO That's Taking Over Wall Street,googlenews,2020-12-29 16:53:43
5 SPAC IPOs to Watch in 2021,googlenews,2020-12-29 16:53:43
Why These 3 SPAC IPOs Are Collapsing Today,googlenews,2020-12-29 16:53:43
How NYSE’s Top Salesman Fought for IPOs in 2020,googlenews,2020-12-29 16:53:43
Why Renewable Energy Stocks Jumped and Dropped Today,googlenews,2020-12-29 16:53:43
Hunting hydrogen: who's leading the race for green hydrogen leadership,googlenews,2020-12-29 16:53:43
Sunrise brief: Solar project that supplies LADWP is sold,googlenews,2020-12-29 16:53:43
Green Energy Will Need More Storage Space,googlenews,2020-12-29 16:53:43
"13 New COVID-19 Related Deaths, 1087 New Cases in MN on Monday",googlenews,2020-12-29 16:53:43
Minnesota reports 36 more COVID-19 deaths,googlenews,2020-12-29 16:53:43
"Iowa reports 67 additional COVID-19 deaths, 1,475 confirmed cases",googlenews,2020-12-29 16:53:43
"COVID-19 in Iowa: Tracking virus cases, deaths",googlenews,2020-12-29 16:53:43
Temporary COVID-19 restrictions in Pennsylvania could end as soon as Monday,googlenews,2020-12-29 16:53:43
"Coronavirus in Pennsylvania: 8,545 new cases, 622,349 total as of Dec. 29, 2020",googlenews,2020-12-29 16:53:43
Levine: Appears Cases Plateauing; Warns Against New Year's Gatherings,googlenews,2020-12-29 16:53:43
PA. HEALTH SECRETARY: Temporary COVID-19 restrictions won't be lifted early,googlenews,2020-12-29 16:53:43
TSA screens highest number of airport passengers since pandemic started,googlenews,2020-12-29 16:53:43
Air travel hits pandemic record amid surging infections and hospitalizations,googlenews,2020-12-29 16:53:43
More than 1.2 million people traveled through US airports on Sunday,googlenews,2020-12-29 16:53:43
More people flew Sunday than on any other day since the pandemic began,googlenews,2020-12-29 16:53:43
"Chart points to bitcoin ‘peaking out’ in early 2021, trader says",googlenews,2020-12-29 16:53:43
Market Wrap: Bitcoin Hovers Around $27K While ETH/BTC Pair Goes Bullish - CoinDesk,googlenews,2020-12-29 16:53:43
Bitcoin on Longest Winning Run Since 2019 After Topping $28000,googlenews,2020-12-29 16:53:43
"Grayscale Has $19B in Crypto Assets Under Management, Up From $16.4B Last Week",googlenews,2020-12-29 16:53:43
A fired Tyson manager who bet on how many workers would get COVID-19 said the office pool was an attempt to boost morale,googlenews,2020-12-29 16:53:43
Fired Tyson Foods manager defends betting on workers as 'morale boost' | TheHill,googlenews,2020-12-29 16:53:43
Fired Tyson boss says COVID office pool was a 'morale boost',googlenews,2020-12-29 16:53:43
Tyson boss fired for COVID betting pool says it was a 'morale boost',googlenews,2020-12-29 16:53:43
AI chipmaker Graphcore raises $222M at a $2.77B valuation and puts an IPO in its sights,googlenews,2020-12-29 16:53:43
Graphcore raises $222 million to scale up AI chip production,googlenews,2020-12-29 16:53:43
UK chipmaker Graphcore valued at $2.8bn after it raises $222m,googlenews,2020-12-29 16:53:43
AI chipmaker Graphcore raises $222m as it takes on Nvidia,googlenews,2020-12-29 16:53:43
"AstraZeneca vaccine not ready for quick European approval, watchdog official says",googlenews,2020-12-29 16:53:43
Orange County begins COVID-19 vaccinations for those 65 and older,googlenews,2020-12-29 16:53:43
UK expected to approve Oxford-AstraZeneca Covid vaccine this week,googlenews,2020-12-29 16:53:43
AstraZeneca: Shot will be effective against COVID-19 variant,googlenews,2020-12-29 16:53:43
Qualtrics files largest IPO in Utah history with up to $14.4 billion valuation,googlenews,2020-12-29 16:53:43
"Qualtrics files IPO papers, aiming for valuation of up to $14.4 billion after spinning out of SAP",googlenews,2020-12-29 16:53:43
Qualtrics IPO Seeks $14 Billion Valuation,googlenews,2020-12-29 16:53:43
SAP files IPO for Qualtrics as demand for ‘experience management’ software rises 36%,googlenews,2020-12-29 16:53:43
Denied for student loan refinancing? Here's what you can do,googlenews,2020-12-29 16:53:43
"How to partially refinance student loans, and who should consider it",googlenews,2020-12-29 16:53:43
Should You Keep Paying Your Student Loans Even If They Might Get Forgiven?,googlenews,2020-12-29 16:53:43
Student Debt Payments To Resume In February,googlenews,2020-12-29 16:53:43
Dollar falls as Congress votes more stimulus,googlenews,2020-12-29 16:53:43
Dollar dips as U.S. stimulus optimism boosts risk taking,googlenews,2020-12-29 16:53:43
"Opening Bell: Futures, Stocks Gather Momentum On Stimulus, Brexit Deal; Oil Up",googlenews,2020-12-29 16:53:43
Stocks Move Higher After Trump Signs Coronavirus Aid Package,googlenews,2020-12-29 16:53:43
"Mega Millions, Powerball climb | A chance at $739 million",googlenews,2020-12-29 16:53:43
$1 million Powerball ticket was sold in NC. Lucky winner may be unaware,googlenews,2020-12-29 16:53:43
"Mega Millions Drawing For 12/29/20, Tuesday Jackpot is $376 Million",googlenews,2020-12-29 16:53:43
Three Winning Powerball Tickets Good For $50K Sold In New Jersey,googlenews,2020-12-29 16:53:43
AstraZeneca-Oxford COVID vaccine could get U.K. approval as soon as this week,googlenews,2020-12-29 16:53:43
AstraZeneca chief says new COVID-19 vaccine will fight UK mutation,googlenews,2020-12-29 16:53:43
Dublin grandmother Annie Lynch becomes first in Republic to get coronavirus vaccine,googlenews,2020-12-29 16:53:43
AstraZeneca says vaccine will be effective against COVID-19 variant,googlenews,2020-12-29 16:53:43
"Stock market news live updates: Stock futures open higher, adding to record levels",googlenews,2020-12-29 16:53:43
US stocks leap to new record high on Trump U-turn,googlenews,2020-12-29 16:53:43
Wall St at record levels after Trump signs fiscal aid bill,googlenews,2020-12-29 16:53:43
Nifty End at Fresh Highs as Trump Signs the Stimulus Bill; Dow Jones Up,googlenews,2020-12-29 16:53:43
New Coronavirus Relief Legislation Impacts Employers in Two Key Areas,googlenews,2020-12-29 16:53:43
Paid COVID-19 Leave Extended Through March 31,googlenews,2020-12-29 16:53:43
"FFCRA Tax Credit Extended, FFCRA Leave Not",googlenews,2020-12-29 16:53:43
COVID-19 Stimulus Package FFCRA Employer Considerations,googlenews,2020-12-29 16:53:43
Is There More Growth In Store For Etsy's (NASDAQ:ETSY) Returns On Capital?,googlenews,2020-12-29 16:53:43
Why Goldman Sachs Is Getting More Bullish on Snap Stock,googlenews,2020-12-29 16:53:43
"Snapchat will surge 45% on product-driven revenue growth, Goldman Sachs says",googlenews,2020-12-29 16:53:43
Snap’s 2020 Rally Nears 220% After Goldman’s Street-High Target,googlenews,2020-12-29 16:53:43
Why Snap Stock Popped Today,googlenews,2020-12-29 16:53:43
Idaho Lottery Announces Winning Numbers in $1M Raffle,googlenews,2020-12-29 16:53:43
"Winning million-dollar raffle ticket sold in Jerome County, and a $10000 ticket sold in eastern Idaho",googlenews,2020-12-29 16:53:43
North Versailles tobacco shop sells winning $100000 lottery ticket,googlenews,2020-12-29 16:53:43
Idaho Lottery announces $1 million Raffle winning number,googlenews,2020-12-29 16:53:43
Arcturus Therapeutics shares slide 55% after COVID vaccine data are deemed 'underwhelming',googlenews,2020-12-29 16:53:43
Why Arcturus Therapeutics Stock Is Plunging Today,googlenews,2020-12-29 16:53:43
Arcturus Therapeutics plummets 53% after analyst downgrades following COVID-19 vaccine trial updates,googlenews,2020-12-29 16:53:43
WHO says coronavirus pandemic is ‘not the big one’ the world needs to brace for,googlenews,2020-12-29 16:53:43
"As the Sun Sets on 2020, These 5 Stocks Are My Highest-Conviction Holdings",motleyfool,2020-12-29 16:55:37
3 Solid Stocks for a Winning Retirement Portfolio,motleyfool,2020-12-29 16:55:37
2020 Wrapped: Is Spotify Stock a Buy?,motleyfool,2020-12-29 16:55:37
Zoom Stock Surged 425% in 2020: Is It a Buy for 2021?,motleyfool,2020-12-29 16:55:37
Bitcoin Stocks Continued Their Volatile Ride on Tuesday,motleyfool,2020-12-29 16:55:37
Arcturus Reports Results From Early-Stage Testing of Its Coronavirus Vaccine,motleyfool,2020-12-29 16:55:37
Why Ampio Pharmaceuticals Stock Tanked Today,motleyfool,2020-12-29 16:55:37
