headline,org,date
McMillan: Boyband BTS Sees Management Company Shares Blow Up Then Implode,thestreet,2020-10-18 09:20:01
Rev Shark: Spotting 2 New Buys While Recent Favorites Continue to Run,thestreet,2020-10-18 09:20:01
Pfizer to Seek Emergency Use Approval From FDA for Covid Vaccine in November,thestreet,2020-10-18 09:20:01
How Twitter Can Rally to $50 Ahead of the Election,thestreet,2020-10-18 09:20:01
Nikola CEO Russell Says Company Can Make Do Without GM Deal,thestreet,2020-10-18 09:20:01
What Fastly Taught Jim Cramer About Valuation,thestreet,2020-10-18 09:20:01
"The Jokers, The Tokers, Millennials & Gen Z-ers are The New Age Smokers - Cowen Takes a Look at Cannabis Use Among Younger Cohorts",thestreet,2020-10-18 09:20:01
Jim Cramer Breaks Down Walgreens Earnings,thestreet,2020-10-18 09:20:01
All of Tesla's 2021 Model Year Updates,thestreet,2020-10-18 09:20:01
Retail Sales Surge in September - What to Make of It?,thestreet,2020-10-18 09:20:01
iPhone 12 Sends Apple Shares Higher,thestreet,2020-10-18 09:20:01
Jim Cramer's Week 6 DraftKings Game Stacks: Pairing Up Players in High Scoring Affairs,thestreet,2020-10-18 09:20:01
Helping Employees Prepare for Open Enrollment,thestreet,2020-10-18 09:20:01
529 Plans: Understanding Changes to Help with College Funding,thestreet,2020-10-18 09:20:01
Using Appreciated Securities for Charitable Giving,thestreet,2020-10-18 09:20:01
Jim Cramer Names the Stock Winners and Losers for the Election,thestreet,2020-10-18 09:20:01
"What 2020 Election Result Could Mean For Your IRA, 401(K)",thestreet,2020-10-18 09:20:01
This Is How 258-year-old Fraunces Tavern Is Surviving the Pandemic,thestreet,2020-10-18 09:20:01
This Stock up 500% Wants to Be Amazon of CarParts,thestreet,2020-10-18 09:20:01
The Stock Market and Economy: Still Separate,thestreet,2020-10-18 09:20:01
Patience: The Most Underused Investing Skill,thestreet,2020-10-18 09:20:01
Why Investors Shouldn’t Chase Gold After Its Red-Hot Run,thestreet,2020-10-18 09:20:01
Fisher Investments Reveals the 3 Biggest Risks of Holding Cash,thestreet,2020-10-18 09:20:01
Terrible Unemployment Numbers Don’t Hold Back Stocks,thestreet,2020-10-18 09:20:01
5 Best Stocks in the Dow This Past Week: Caterpillar Rises,thestreet,2020-10-18 09:20:01
Presidential Polls Index: Will Trump Win the Heart of Georgia?,thestreet,2020-10-18 09:20:01
Stock Rally Was Cautious Friday: What Wall Street's Saying,thestreet,2020-10-18 09:20:01
"Navistar, CIT Group: 5 Top Stock Gainers for Friday",thestreet,2020-10-18 09:20:01
"Stocks End Mixed Amid Retail Sales, Consumer Sentiment; Boeing Up",thestreet,2020-10-18 09:20:01
"Do Stocks Need Stimulus? Regardless, Here's Where to Look",thestreet,2020-10-18 09:20:01
Junior Miners Valuations Now Showing ‘Overbought’ Signals,thestreet,2020-10-18 09:20:01
Rules for Claiming a Dependent on Your Tax Return,thestreet,2020-10-18 09:20:01
9 Things You Didn't Know Were Tax Deductions,thestreet,2020-10-18 09:20:01
Are Contributions to School District Programs Tax Deductible?,thestreet,2020-10-18 09:20:01
"Ford, Twitter: Latest Upgrades and Downgrades",thestreet,2020-10-18 09:20:01
What 2020 Election Means for Social Security,thestreet,2020-10-18 09:20:01
Jim Cramer Discusses 3 Key Stocks to Watch After the Election,thestreet,2020-10-18 09:20:01
"What Rising Positive Tests Mean For NFL: Top Stories, Sports & Business News - Oct. 16",thestreet,2020-10-18 09:20:01
Wynn Downgraded to Hold at Jefferies on Macau Concern,thestreet,2020-10-18 09:20:01
Del Taco Falls as Current-Quarter Comparable Sales Lag,thestreet,2020-10-18 09:20:01
Midday Market Update: Stock Gains Hold Strong,thestreet,2020-10-18 09:20:01
Chewy Climbs as Jefferies Upgrade Cites Pet-Care Potential,thestreet,2020-10-18 09:20:01
What Happens to Markets And Economy If Biden Wins,thestreet,2020-10-18 09:20:01
GTT Stock Up on Pact to Sell an Infrastructure Unit at $2.15B,thestreet,2020-10-18 09:20:01
Traton's Nears Acquisition of Navistar as Deadline Approaches,thestreet,2020-10-18 09:20:01
Costco Upgraded by Jefferies to Buy on Growth Prospects,thestreet,2020-10-18 09:20:01
Jim Cramer Names the Stock Winners and Losers for the Election,thestreet,2020-10-18 09:20:01
Junior Miners Valuations Now Showing ‘Overbought’ Signals,thestreet,2020-10-18 09:20:01
"Stanford study examines how COVID-19 infection impacts brain, memory",googlenews,2020-10-18 09:22:03
7 Changes to Social Security in 2021,googlenews,2020-10-18 09:22:03
"Trump admin partners with CVS, Walgreens to get some seniors vaccinated for COVID-19",googlenews,2020-10-18 09:22:03
Gov. David Ige lists 8 ‘trusted testing partners’ for interisland travel to Kauai and Maui,googlenews,2020-10-18 09:22:03
NYC authorities break up 200-person party at Queens catering hall,googlenews,2020-10-18 09:22:03
My Quest For Net Zero & Beyond With Tesla Model 3 — Part 5,googlenews,2020-10-18 09:22:03
Diet cola TAB is the latest victim of the pandemic,googlenews,2020-10-18 09:22:03
The next economic crisis: Empty retail space,googlenews,2020-10-18 09:22:03
Carnival Cruise ship comes to the rescue of 24 people as their boat sinks,googlenews,2020-10-18 09:22:03
Chicago is the 'rattiest city' in America for the sixth year in a row,googlenews,2020-10-18 09:22:03
Study Shows Remdesivir Is Ineffective At Reducing COVID-19 Mortality,googlenews,2020-10-18 09:22:03
"Best Amazon Prime Day Deals Still Live On Great Games, Roku, Echo And AirPods",googlenews,2020-10-18 09:22:03
"Unemployment claims increase, but local company struggling to find workers",googlenews,2020-10-18 09:22:03
How Robert Smith played hardball with IRS over unpaid taxes,googlenews,2020-10-18 09:22:03
How Massachusetts Plans To Distribute Coronavirus Vaccines,googlenews,2020-10-18 09:22:03
What Is the Most Popular Medicare Supplement Plan?,googlenews,2020-10-18 09:22:03
"Faster development of COVID-19 vaccine could raise global incomes by $9 trillion, IMF says",googlenews,2020-10-18 09:22:03
"US STOCKS-Wall Street gains on vaccine news, retail sales surprise",googlenews,2020-10-18 09:22:03
US resorts adapt to new normal of skiing amid pandemic,googlenews,2020-10-18 09:22:03
Seller shortage? Bitcoin exchange reserves plunge as BitMEX bleeds BTC,googlenews,2020-10-18 09:22:03
Talks are underway to expand tourism from Japan as visitors return to Hawai'i,googlenews,2020-10-18 09:22:03
"As Richards Group hemorrhages clients, Dallas ad industry leaders warn of potential ripple effects",googlenews,2020-10-18 09:22:03
Oil Markets Are In For A Second Round Of Trouble,googlenews,2020-10-18 09:22:03
Pennsylvania sees another big monthly drop in jobless rate,googlenews,2020-10-18 09:22:03
26 Colorado beers win medals at Great American Beer Festival,googlenews,2020-10-18 09:22:03
Video of the Day – Cameron Peak fire from Estes Park,googlenews,2020-10-18 09:22:03
"With Just 8 Words, the CEO of United Airlines Just Shared the Perfect Leadership Message for 2020",googlenews,2020-10-18 09:22:03
Retail sales post big gain in September as consumers show unexpected strength,googlenews,2020-10-18 09:22:03
House report: Treasury Dept. encouraged banks to prioritize existing clients for PPP loans,googlenews,2020-10-18 09:22:03
Who decides when vaccine studies are done? Internal documents show Fauci plays a key role,googlenews,2020-10-18 09:22:03
Hard Rock International lays out employment opportunities for community,googlenews,2020-10-18 09:22:03
Cruise will soon hit San Francisco with no hands on the wheel,googlenews,2020-10-18 09:22:03
Jet Airways Revival: Kalrock Capital-Jalan Consortium Wins Bid,googlenews,2020-10-18 09:22:03
Coronavirus Tanked the Economy. Then Credit Scores Went Up.,googlenews,2020-10-18 09:22:03
United Maintains Robust Order Book With No Major Retirements,googlenews,2020-10-18 09:22:03
Today's Mortgage and Refinance Rates for October 17 and 18,googlenews,2020-10-18 09:22:03
This Social Security Misconception Could Cost You $450 a Month,googlenews,2020-10-18 09:22:03
Here are Morgan Stanley's top picks for the earnings season,googlenews,2020-10-18 09:22:03
"Risk of COVID-19 exposure on airplanes low, study shows",googlenews,2020-10-18 09:22:03
"Coronavirus update: Washington state COVID-19 cases pass 97,000",googlenews,2020-10-18 09:22:03
"Ripple Survey Unveils Real-World Interest in Bitcoin, Ethereum, XRP, Stablecoins and CBDCs Among Payments Executives",googlenews,2020-10-18 09:22:03
How to Invest Your 401(K) in Causes You Care About,googlenews,2020-10-18 09:22:03
Navistar's stock soars after company said it's ready to accept Traton's higher buyout bid,googlenews,2020-10-18 09:22:03
"Texas unemployment jumps to 8.3%, topping the US rate, as job growth slows statewide",googlenews,2020-10-18 09:22:03
Lawsuit challenging H-1B wage hikes filed in US court,googlenews,2020-10-18 09:22:03
"Child gets into mother’s purse, accidentally fires gun inside Ohio Sam’s Club store",googlenews,2020-10-18 09:22:03
"Lone Pine, Allagash take home top prizes at national beer festival",googlenews,2020-10-18 09:22:03
"Amazon announces new fulfillment center at old Woodlands site in Kansas City, Kansas",googlenews,2020-10-18 09:22:03
"Coronavirus: 85 new cases, 8 deaths in Orange County on Oct. 17",googlenews,2020-10-18 09:22:03
Walmart reinvents Black Friday with 3 huge savings events in November,googlenews,2020-10-18 09:22:03
GM makes $2.2 billion investment in electric vehicle plant where HUMMER EV will be produced,googlenews,2020-10-18 09:22:03
"People returning to Pa. from 25 states, including Florida, should quarantine, health department says",googlenews,2020-10-18 09:22:03
Motorcyclist dies in Saturday morning crash,googlenews,2020-10-18 09:22:03
Top Pandemic Doctor Explains Hong Kong's Low Covid-19 Fatality Rate,googlenews,2020-10-18 09:22:03
Why a 40-year-old quit his job of 18 years to resell items on Amazon,googlenews,2020-10-18 09:22:03
Black Restaurant Week features 22 Philadelphia eateries; runs through Oct. 25,googlenews,2020-10-18 09:22:03
"Hertz Primed To Get $1.65 Billion In Financing, Could Use $1 Billion On New Cars, Shares Soar 143%",googlenews,2020-10-18 09:22:03
Grandfather pleads guilty in toddler’s cruise ship death,googlenews,2020-10-18 09:22:03
Starburst is Texas’ favorite Halloween candy — here’s each state’s confection selection,googlenews,2020-10-18 09:22:03
Instagram is cracking down on rule-breaking influencers,googlenews,2020-10-18 09:22:03
Dark déjà vu for European economy as virus cases spike,googlenews,2020-10-18 09:22:03
Advisers to G4S bidder GardaWorld in line for £312m payday,googlenews,2020-10-18 09:22:03
3 Moves to Be Ready if the Stock Market Crashes Tomorrow,googlenews,2020-10-18 09:22:03
Racine and Kenosha counties are about to get a lot more access to COVID testing,googlenews,2020-10-18 09:22:03
Hamden restaurant closes temporarily after worker tests positive for COVID,googlenews,2020-10-18 09:22:03
"Amid tensions with China, India warns Amazon, Flipkart over country of origin rule",googlenews,2020-10-18 09:22:03
Wheat jumps to highest in nearly six years on dry global weather,googlenews,2020-10-18 09:22:03
Fed officials call for tougher regulation to prevent asset bubbles: FT,googlenews,2020-10-18 09:22:03
"US reports 69,000 new COVID infections in just 24 hours - the highest daily increase since JULY",googlenews,2020-10-18 09:22:03
"What gives Bill Gates hope about the world, and one thing he says we should all do right now",googlenews,2020-10-18 09:22:03
What Can a COVID-19 Vaccine Actually Do?,googlenews,2020-10-18 09:22:03
We’re not getting a coronavirus vaccine before the election,googlenews,2020-10-18 09:22:03
Kentucky Department for Public Health announces COVID-19 vaccine distribution draft plan,googlenews,2020-10-18 09:22:03
Rhode Island and Massachusetts release COVID-19 vaccine plans,googlenews,2020-10-18 09:22:03
Feds planning now to get coronavirus shots to nursing homes,googlenews,2020-10-18 09:22:03
Federal health officials unveil plan to get coronavirus shots to nursing homes,googlenews,2020-10-18 09:22:03
"CVS, Walgreens to help distribute COVID vaccines to nursing homes",googlenews,2020-10-18 09:22:03
"Trump announces CVS, Walgreens free coronavirus vaccines deal to help seniors",googlenews,2020-10-18 09:22:03
"Honolulu offering free COVID-19 testing at Waikiki Shell, Kapolei Hale",googlenews,2020-10-18 09:22:03
Hawaii records 1 new coronavirus death on Oahu and 96 new infections statewide,googlenews,2020-10-18 09:22:03
State announces 8 trusted testing partners for inter-county travel,googlenews,2020-10-18 09:22:03
"Forecast: Threat of rain continues for Kauai, possibly Oahu",googlenews,2020-10-18 09:22:03
Police bust Queens banquet hall with more than 200 inside,googlenews,2020-10-18 09:22:03
Sheriffs shut down party with over 200 people at Queens catering hall,googlenews,2020-10-18 09:22:03
More Than 200 People Found Inside Queens Banquet Hall For Illegal Party,googlenews,2020-10-18 09:22:03
COVID News: Police bust Queens banquet hall with more than 200 inside,googlenews,2020-10-18 09:22:03
First look at Tesla Model 3 ‘refresh’ powered lift gate,googlenews,2020-10-18 09:22:03
"Tesla Model S/X/3/Y Comparison (Range, Price, Acceleration) October 2020",googlenews,2020-10-18 09:22:03
"Regretting That Tesla You Just Bought? Well, You Might Be Stuck With It Now",googlenews,2020-10-18 09:22:03
Tesla increases the range for existing Model Y EVs through an update,googlenews,2020-10-18 09:22:03
Carnival Sensation to the Rescue,googlenews,2020-10-18 09:22:03
24 People on Distressed Boat Rescued by Carnival Cruise Ship,googlenews,2020-10-18 09:22:03
Is it worth it to book a short 3-night cruise?,googlenews,2020-10-18 09:22:03
Carnival Cruise Ship Rescues 24 From Sinking Boat,googlenews,2020-10-18 09:22:03
WHO-backed study finds no remdesivir benefit for hospitalized COVID-19 patients,googlenews,2020-10-18 09:22:03
Remdesivir does little to help COVID-19 patients: WHO study,googlenews,2020-10-18 09:22:03
"US touted COVID-19 cure, Remdesivir, fails WHO trials as US confirmed cases surge past 8m",googlenews,2020-10-18 09:22:03
WHO to soon issue guidelines on use of emergency drug Remdesivir,googlenews,2020-10-18 09:22:03
Save on Apple AirPods and other Prime Day 2020 leftovers this weekend,googlenews,2020-10-18 09:22:03
The 12 Best Post-Prime Day Deals to Shop This Weekend — Including Apple AirPods and Bissell Vacuums,googlenews,2020-10-18 09:22:03
Amazon Primes the Third-Party Pump,googlenews,2020-10-18 09:22:03
Amazon says this month’s Prime Day sales increased 60% year over year,googlenews,2020-10-18 09:22:03
Software CEO Robert Brockman charged in $2 billion tax evasion case,googlenews,2020-10-18 09:22:03
Vivid Seats Owner Implicated in Enormous Tax Fraud Scheme,googlenews,2020-10-18 09:22:03
Denver-born billionaire Robert Smith reaches $139 million tax settlement with federal prosecutors,googlenews,2020-10-18 09:22:03
Billionaire Robert Smith Reaches $140 Million Settlement With DOJ Over Tax Problems,googlenews,2020-10-18 09:22:03
Scientists worry as more Americans say they’ll refuse COVID-19 vaccine,googlenews,2020-10-18 09:22:03
Pfizer says coronavirus vaccine won’t be ready until Thanksgiving – at the earliest,googlenews,2020-10-18 09:22:03
"Coronavirus update: Concerns with the surge in cases, plus the latest on vaccine timeline,",googlenews,2020-10-18 09:22:03
Covid vaccines roll off Pfizer production line in image of hope for the world as jabs could be out by New Year,googlenews,2020-10-18 09:22:03
Blend Extra: Take the Scare Out of Medicare During Open Enrollment,googlenews,2020-10-18 09:22:03
Walmart now offering Medicare plans as election season heats up,googlenews,2020-10-18 09:22:03
4 Ways to Slash Your Medicare Costs in Retirement,googlenews,2020-10-18 09:22:03
Medicare open enrollment has arrived. Here are tips for navigating the maze,googlenews,2020-10-18 09:22:03
"Covid-19 has resulted in largest global economic contraction in 80 years, say World Bank & IMF",googlenews,2020-10-18 09:22:03
Global Economic Virus Pain Is Far From Over: IMF Takeaways,googlenews,2020-10-18 09:22:03
IMF head Kristalina Georgieva warns chancellor: 'Now isn't the time to balance the books',googlenews,2020-10-18 09:22:03
IMF urges policymakers to avoid premature withdrawal of support for the economy,googlenews,2020-10-18 09:22:03
"S&P 500 Weekly Update: Despite Abundant Negativity, The Indices Remain Resilient",googlenews,2020-10-18 09:22:03
"Dow rises, S&P ekes out gain",googlenews,2020-10-18 09:22:03
Dow Jones Industrial Average Edges Higher on Week as Stock Market Navigates Mixes Messages,googlenews,2020-10-18 09:22:03
"S&P limps into the close as energy sinks, but ends just up for the week",googlenews,2020-10-18 09:22:03
OKEx Token Price Tumbles Added 20% in Wake of Suspended Withdrawals - CoinDesk,googlenews,2020-10-18 09:22:03
OKEx sees massive Bitcoin (BTC) deposit after freezing withdrawals,googlenews,2020-10-18 09:22:03
No Timeline for Resuming Bitcoin Withdrawals: OKEx,googlenews,2020-10-18 09:22:03
"Crucial Bitcoin Signal That Formed Prior to $2,000 Crash Returns",googlenews,2020-10-18 09:22:03
What's Next For the Clients That Fired The Richards Group?,googlenews,2020-10-18 09:22:03
"After Offensive Comments, Stan Richards Leaves His Dallas Ad Agency",googlenews,2020-10-18 09:22:03
H-E-B cuts ties with Dallas advertising firm after founder's racist remarks,googlenews,2020-10-18 09:22:03
Richards Group gets canceled after CEO remarks and more Dallas news,googlenews,2020-10-18 09:22:03
Oil Price Fundamental Daily Forecast – Spike in COVID-19 Cases Expected to Drag on Demand in US and Europe,googlenews,2020-10-18 09:22:03
WEEKLY ENERGY RECAP: Market awaits major OPEC+ meet,googlenews,2020-10-18 09:22:03
"Reuters: Oil dips on COVID-19 resurgence, fears of more supply | KyivPost - Ukraine's Global Voice",googlenews,2020-10-18 09:22:03
"Oil Settles Above $40, U.S. Crude Clings to Weekly Gain",googlenews,2020-10-18 09:22:03
Pennsylvania's Unemployment Rate Drops To 8.1 Percent In September,googlenews,2020-10-18 09:22:03
"Unemployment rate in Pa. drops to 8.1%, but economists remain wary",googlenews,2020-10-18 09:22:03
State Dept. of Labor: Tennessee unemployment rate dropped to 6.3% in September,googlenews,2020-10-18 09:22:03
Alabama unemployment rate in September 1% greater than in August,googlenews,2020-10-18 09:22:03
Penrose Brewing wins gold for Goofy Boots at GABF 2020,googlenews,2020-10-18 09:22:03
Greater Cleveland breweries win at 2020 Great American Beer Festival,googlenews,2020-10-18 09:22:03
"In an Off-Year, a Few Big Flexes for Colorado GABF Medalists",googlenews,2020-10-18 09:22:03
CEO Roundtable: Boulder brewers brace for winter,googlenews,2020-10-18 09:22:03
United Airlines: Preparing For The Rebound,googlenews,2020-10-18 09:22:03
Airlines: There Will Be Tears,googlenews,2020-10-18 09:22:03
United's recovery plan built around late 2021 arrival of vaccine,googlenews,2020-10-18 09:22:03
Few people are flying. What is an airline to do? Lots of fine-tuning.,googlenews,2020-10-18 09:22:03
US retail sales blow past expectations,googlenews,2020-10-18 09:22:03
"Retail Sales Surge in September, What to Make of It?",googlenews,2020-10-18 09:22:03
US retail sales beat expectations; outlook murky,googlenews,2020-10-18 09:22:03
How September Retail Sales Stole August’s Thunder,googlenews,2020-10-18 09:22:03
Who carried the weight of reported minority PPP lending in SA,googlenews,2020-10-18 09:22:03
"PPP, SMBs And The Challenges Of KYC",googlenews,2020-10-18 09:22:03
Banks need to play their part in addressing racial inequality | TheHill,googlenews,2020-10-18 09:22:03
PPP: SBA Issues Guidance on Changes in Ownership and Full Forgiveness Eased for Smaller Loans,googlenews,2020-10-18 09:22:03
Pfizer update on coronavirus vaccine trial,googlenews,2020-10-18 09:22:03
"Hard Rock International, Bristol Chamber of Commerce host job information session for proposed casino",googlenews,2020-10-18 09:22:03
Driverless Vehicles (Without Any Humans) Coming to SF,googlenews,2020-10-18 09:22:03
Cruise allowed to drive empty in San Francisco,googlenews,2020-10-18 09:22:03
GM to run robot cars in San Francisco without human backups,googlenews,2020-10-18 09:22:03
Cruise self-driving cars no longer need a safety driver in California,googlenews,2020-10-18 09:22:03
"Jet airways close to get its wings back, creditors agree on revival | Indian Airline | World News",googlenews,2020-10-18 09:22:03
Jet Airways creditors agree to new owners after months of talks,googlenews,2020-10-18 09:22:03
What Could The New Jet Airways Look Like?,googlenews,2020-10-18 09:22:03
Jet Airways' Lenders Approve Resolution Plan for Bankrupt Firm,googlenews,2020-10-18 09:22:03
Airlines plan for prolonged coronavirus travel drought,googlenews,2020-10-18 09:22:03
When to Refinance Your Mortgage (HELPFUL GUIDE),googlenews,2020-10-18 09:22:03
Mortgage and real estate news this week: Rates fall and credit tightens,googlenews,2020-10-18 09:22:03
How do interest rates affect debt?,googlenews,2020-10-18 09:22:03
How Much Further Could Record Low Mortgage Rates Fall?,googlenews,2020-10-18 09:22:03
"Merrill vs. Morgan Stanley: Which Added More Assets, Advisors in Q3?",googlenews,2020-10-18 09:22:03
Big Banks’ Earnings Indicate More M&A on the Way,googlenews,2020-10-18 09:22:03
"A Biden-led blue wave election outcome is already priced into markets, Morgan Stanley CFO says | Markets",googlenews,2020-10-18 09:22:03
Morgan Stanley Limits E*Trade Customer Referrals to Specialized Brokers,googlenews,2020-10-18 09:22:03
"COVID-19: Virus Risk Extremely Low On Airplanes If Passengers Follow Mask Rule, Study Shows",googlenews,2020-10-18 09:22:03
"Can you get coronavirus on an airplane? United Airlines, DOD release new study",googlenews,2020-10-18 09:22:03
Study: Masks on Planes Make Covid-19 Risk 'Virtually Nonexistent',googlenews,2020-10-18 09:22:03
Study claims catching COVID-19 on a plane is ‘extremely unlikely’ while wearing a mask,googlenews,2020-10-18 09:22:03
Here’s Why Bitcoin Breaking Higher Now Would Trigger a Massive Move,googlenews,2020-10-18 09:22:03
"As election frenzy grips US, how will Bitcoin’s price react?",googlenews,2020-10-18 09:22:03
Ethereum Price Prediction: ETH must hold this crucial support for bullish outlook to $400,googlenews,2020-10-18 09:22:03
Bitcoin Key Indicators Suggest A Strengthening Case For Rally Above $11.5K,googlenews,2020-10-18 09:22:03
10 Active Angles On Today's Market Challenges,googlenews,2020-10-18 09:22:03
Sustainability Drives Success in Post-Coronavirus World,googlenews,2020-10-18 09:22:03
VW raises Navistar bid to $44.50 per share to clinch trucks deal,googlenews,2020-10-18 09:22:03
Volkswagen truck unit agrees to buy remainder of Navistar shares for $3.7B,googlenews,2020-10-18 09:22:03
VW buys International Trucks parent Navistar in $3.7B deal,googlenews,2020-10-18 09:22:03
Volkswagen nearing a deal with Carl Icahn to buy trucking giant Navistar,googlenews,2020-10-18 09:22:03
Southeast Texas unemployment numbers up to 12.5 percent for September,googlenews,2020-10-18 09:22:03
Midland joins other Texas metros in unemployment jump,googlenews,2020-10-18 09:22:03
"Texas unemployment rate rises to 8.3% in September, seven months into economic recession",googlenews,2020-10-18 09:22:03
Texas unemployment surges in September,googlenews,2020-10-18 09:22:03
Trump Administration Overhaul of H-1B Visa Program Challenged in Court,googlenews,2020-10-18 09:22:03
BREAKING: Tech Cos. File First Challenge To H-1B Wage Hikes,googlenews,2020-10-18 09:22:03
Two Cincy breweries bring home gold from the Great American Beer Festival in Denver,googlenews,2020-10-18 09:22:03
Texas at the Great American Beer Festival Recap 2020,googlenews,2020-10-18 09:22:03
Perry Street Brewing takes home gold medal in this year's Great American Beer Fest,googlenews,2020-10-18 09:22:03
"Amazon plans large fulfillment centers in KCK, Wichita",googlenews,2020-10-18 09:22:03
"Amazon plans two new Kansas fulfillment centers, bringing 1,000 jobs. Here’s where",googlenews,2020-10-18 09:22:03
Amazon Building 2 New Fulfillment Centers in Kansas,googlenews,2020-10-18 09:22:03
"Amazon fulfillment center coming to Park City will add 500 new jobs, company says",googlenews,2020-10-18 09:22:03
The One Thing You Shouldn't Be Doing at Walmart,googlenews,2020-10-18 09:22:03
"Walmart Announces “Black Friday Deals for Days,” a Reinvented Black Friday Shopping Experience",googlenews,2020-10-18 09:22:03
"Will the holiday shopping season be different this year? Yes, because it’s already begun",googlenews,2020-10-18 09:22:03
Walmart Just Said They're Reinstating This COVID Safety Measure,googlenews,2020-10-18 09:22:03
"General Motors ""Factory ZERO"" Is Where the 2022 GMC Hummer EV Will Be Made",googlenews,2020-10-18 09:22:03
GM renames its Detroit-Hamtramck plant Factory Zero,googlenews,2020-10-18 09:22:03
GM's Detroit-Hamtramck Assembly plant renamed 'Factory ZERO' amid shift to all-electric,googlenews,2020-10-18 09:22:03
GM Says It Is All About The Future Now,googlenews,2020-10-18 09:22:03
Ann Arbor-area high school football scoreboard for Week 5,googlenews,2020-10-18 09:22:03
LIVE: Get high school football updates from across the area,googlenews,2020-10-18 09:22:03
Live stream: Trinity at Big Spring in high school football (10/16/20),googlenews,2020-10-18 09:22:03
Live stream: Warwick at Solanco in high school football (10/16/20),googlenews,2020-10-18 09:22:03
"Motorcyclist dies in crash Saturday at I-435, I-470",googlenews,2020-10-18 09:22:03
"Motorcyclist killed in crash after losing control on Interstate 435 ramp, police say",googlenews,2020-10-18 09:22:03
How home shopping networks reinvented themselves for live-streaming,googlenews,2020-10-18 09:22:03
Here's what 7 CEOs of major financial firms are saying about the return to office and the future of their real estate footprints,googlenews,2020-10-18 09:22:03
