headline,org,date
"Tech Stocks Surge With Apple Leading Gains, But Wall Street Cautious in Election Deadlock",msnmoney,2020-11-04 08:31:21
Nintendo to Hatchimals: Gifts that sparked Black Friday insanity,msnmoney,2020-11-04 08:31:21
Most wine drinkers in the US don't know these 5 simple Dos and Don'ts,msnmoney,2020-11-04 08:31:21
Planning to Retire? Aim to Save More Than Just the CPP Pension,msnmoney,2020-11-04 08:31:21
15 Jobs for Retirees That Can Be Done From Home,msnmoney,2020-11-04 08:31:21
"39 Hottest Gifts Of 2020 (Hurry, These Will Be Gone Very Soon)",msnmoney,2020-11-04 08:31:21
Trump or Biden? It's Too Close to Call: 5 Things You Must Know Wednesday,msnmoney,2020-11-04 08:31:21
Best rural counties for retirees in America,msnmoney,2020-11-04 08:31:21
Think Social Security Benefits Are Tax-Free? Think Again.,msnmoney,2020-11-04 08:31:21
23 New Gadgets That Will Sell Out Before Holidays,msnmoney,2020-11-04 08:31:21
Brilliant Holiday Budget Tips From Financial Advisors,msnmoney,2020-11-04 08:31:21
"Before you renew Amazon Prime, read this",msnmoney,2020-11-04 08:31:21
"Lloyds Cuts 730 More Tech, Retail Jobs as Restructuring Deepens",msnmoney,2020-11-04 08:31:21
Lessons To Live By From These 13 Rags-to-Riches Athletes,msnmoney,2020-11-04 08:31:21
This Secret Saver's Tax Credit Gets More Attractive in 2021,msnmoney,2020-11-04 08:31:21
Do You Invest Like These Millionaire Stars?,msnmoney,2020-11-04 08:31:21
European Car Sales Backslide in the Midst of Another Virus Wave,msnmoney,2020-11-04 08:31:21
"39 Hottest Gifts Of 2020 (Hurry, These Will Be Gone Very Soon)",msnmoney,2020-11-04 08:31:21
9 Ways To Negotiate Your Bills and Get Out of Debt Fast,msnmoney,2020-11-04 08:31:21
What Will the High Cost of Building Do To Land Prices?,msnmoney,2020-11-04 08:31:21
How To Shave Hundreds Off Your Credit Card Balance Before the End of the Year,msnmoney,2020-11-04 08:31:21
Bankers Reel as Ant IPO Collapse Risks $400 Million Payday,msnmoney,2020-11-04 08:31:21
Where 51 CEOs Went to College,msnmoney,2020-11-04 08:31:21
Black Friday and Cyber Monday Shoppers: Do This Before You Buy Anything Online,msnmoney,2020-11-04 08:31:21
"Jumbo and FHA mortgage rates set record lows, juicing refinance demand",msnmoney,2020-11-04 08:31:21
Best Early Bird Holiday Shopping Deals,msnmoney,2020-11-04 08:31:21
Cellnex Nears $12 Billion Tower Unit Deal With CK Hutchison,msnmoney,2020-11-04 08:31:21
Safe Hotels To Stay in for Under $200,msnmoney,2020-11-04 08:31:21
19 ways you can pay it forward on a budget,msnmoney,2020-11-04 08:31:21
Seniors On Medicare Are Getting a Big Pay Day in November,msnmoney,2020-11-04 08:31:21
The 50 Lowest-Paying Jobs in America,msnmoney,2020-11-04 08:31:21
Uber Won Its Prized Contractor Status for Drivers. Now What?,msnmoney,2020-11-04 08:31:21
10 Ways To Bounce Back From a Heavy Spending Month on Your Credit Card,msnmoney,2020-11-04 08:31:21
10 magnificent mansions bought with dirty money,msnmoney,2020-11-04 08:31:21
Seasonal Jobs You Can Get Right Now,msnmoney,2020-11-04 08:31:21
"Pour Salt Down Your Drain At Night, Here's Why",msnmoney,2020-11-04 08:31:21
China Alzheimer Drug Seeks Global Legitimacy With U.S. Trial,msnmoney,2020-11-04 08:31:21
25 Tricks To Sell Your House for a Bigger Profit,msnmoney,2020-11-04 08:31:21
Here's where you should keep your will,msnmoney,2020-11-04 08:31:21
13 Hot Upcoming IPOs to Watch For in 2020 and 2021,msnmoney,2020-11-04 08:31:21
Mitsubishi Motors Posts Quarterly Loss as Demand Collapses,msnmoney,2020-11-04 08:31:21
Gerber Life Insurance is with you every step of the way.,msnmoney,2020-11-04 08:31:21
Data says this is who puts up campaign signs,msnmoney,2020-11-04 08:31:21
How to talk about finances with your family,msnmoney,2020-11-04 08:31:21
23 Reasons You Will Always Be Poor,msnmoney,2020-11-04 08:31:21
Vestas Shares Slump as Trump Risk Spooks Green Investors,msnmoney,2020-11-04 08:31:21
Elon Musk’s Biggest Bets That Paid Off,msnmoney,2020-11-04 08:31:21
7 Mistakes You'll Make Hiring A Financial Advisor,msnmoney,2020-11-04 08:31:21
A Chinese stock whose name sounds like 'Trump wins big' to Mandarin speakers surged nearly 10% on US election day,msnmoney,2020-11-04 08:31:21
Cheap renovations that increase a home's value,msnmoney,2020-11-04 08:31:21
Is it worth the money to buy a home in a good school district?,msnmoney,2020-11-04 08:31:21
Warning signs a job isn't as good as it sounds,msnmoney,2020-11-04 08:31:21
"Credit Agricole Gets Boost From Bond Sales, Lower Provisions",msnmoney,2020-11-04 08:31:21
"Man Who Predicted 2020 Crash Says ""Now Is The Time""",msnmoney,2020-11-04 08:31:21
"Tech Stocks Surge With Apple Leading Gains, But Wall Street Cautious in Election Deadlock",msnmoney,2020-11-04 08:31:21
Nintendo to Hatchimals: Gifts that sparked Black Friday insanity,msnmoney,2020-11-04 08:31:21
Most wine drinkers in the US don't know these 5 simple Dos and Don'ts,msnmoney,2020-11-04 08:31:21
Planning to Retire? Aim to Save More Than Just the CPP Pension,msnmoney,2020-11-04 08:31:21
15 Jobs for Retirees That Can Be Done From Home,msnmoney,2020-11-04 08:31:21
"39 Hottest Gifts Of 2020 (Hurry, These Will Be Gone Very Soon)",msnmoney,2020-11-04 08:31:21
Trump or Biden? It's Too Close to Call: 5 Things You Must Know Wednesday,msnmoney,2020-11-04 08:31:21
Best rural counties for retirees in America,msnmoney,2020-11-04 08:31:21
Think Social Security Benefits Are Tax-Free? Think Again.,msnmoney,2020-11-04 08:31:21
23 New Gadgets That Will Sell Out Before Holidays,msnmoney,2020-11-04 08:31:21
Brilliant Holiday Budget Tips From Financial Advisors,msnmoney,2020-11-04 08:31:21
"Before you renew Amazon Prime, read this",msnmoney,2020-11-04 08:31:21
"Lloyds Cuts 730 More Tech, Retail Jobs as Restructuring Deepens",msnmoney,2020-11-04 08:31:21
Lessons To Live By From These 13 Rags-to-Riches Athletes,msnmoney,2020-11-04 08:31:21
This Secret Saver's Tax Credit Gets More Attractive in 2021,msnmoney,2020-11-04 08:31:21
Do You Invest Like These Millionaire Stars?,msnmoney,2020-11-04 08:31:21
European Car Sales Backslide in the Midst of Another Virus Wave,msnmoney,2020-11-04 08:31:21
"39 Hottest Gifts Of 2020 (Hurry, These Will Be Gone Very Soon)",msnmoney,2020-11-04 08:31:21
9 Ways To Negotiate Your Bills and Get Out of Debt Fast,msnmoney,2020-11-04 08:31:21
What Will the High Cost of Building Do To Land Prices?,msnmoney,2020-11-04 08:31:21
How To Shave Hundreds Off Your Credit Card Balance Before the End of the Year,msnmoney,2020-11-04 08:31:21
Bankers Reel as Ant IPO Collapse Risks $400 Million Payday,msnmoney,2020-11-04 08:31:21
Where 51 CEOs Went to College,msnmoney,2020-11-04 08:31:21
Black Friday and Cyber Monday Shoppers: Do This Before You Buy Anything Online,msnmoney,2020-11-04 08:31:21
"Jumbo and FHA mortgage rates set record lows, juicing refinance demand",msnmoney,2020-11-04 08:31:21
Best Early Bird Holiday Shopping Deals,msnmoney,2020-11-04 08:31:21
Cellnex Nears $12 Billion Tower Unit Deal With CK Hutchison,msnmoney,2020-11-04 08:31:21
Safe Hotels To Stay in for Under $200,msnmoney,2020-11-04 08:31:21
19 ways you can pay it forward on a budget,msnmoney,2020-11-04 08:31:21
Seniors On Medicare Are Getting a Big Pay Day in November,msnmoney,2020-11-04 08:31:21
The 50 Lowest-Paying Jobs in America,msnmoney,2020-11-04 08:31:21
Uber Won Its Prized Contractor Status for Drivers. Now What?,msnmoney,2020-11-04 08:31:21
10 Ways To Bounce Back From a Heavy Spending Month on Your Credit Card,msnmoney,2020-11-04 08:31:21
10 magnificent mansions bought with dirty money,msnmoney,2020-11-04 08:31:21
Seasonal Jobs You Can Get Right Now,msnmoney,2020-11-04 08:31:21
"Pour Salt Down Your Drain At Night, Here's Why",msnmoney,2020-11-04 08:31:21
China Alzheimer Drug Seeks Global Legitimacy With U.S. Trial,msnmoney,2020-11-04 08:31:21
25 Tricks To Sell Your House for a Bigger Profit,msnmoney,2020-11-04 08:31:21
Here's where you should keep your will,msnmoney,2020-11-04 08:31:21
13 Hot Upcoming IPOs to Watch For in 2020 and 2021,msnmoney,2020-11-04 08:31:21
Mitsubishi Motors Posts Quarterly Loss as Demand Collapses,msnmoney,2020-11-04 08:31:21
Gerber Life Insurance is with you every step of the way.,msnmoney,2020-11-04 08:31:21
Data says this is who puts up campaign signs,msnmoney,2020-11-04 08:31:21
How to talk about finances with your family,msnmoney,2020-11-04 08:31:21
23 Reasons You Will Always Be Poor,msnmoney,2020-11-04 08:31:21
Vestas Shares Slump as Trump Risk Spooks Green Investors,msnmoney,2020-11-04 08:31:21
Elon Musk’s Biggest Bets That Paid Off,msnmoney,2020-11-04 08:31:21
7 Mistakes You'll Make Hiring A Financial Advisor,msnmoney,2020-11-04 08:31:21
A Chinese stock whose name sounds like 'Trump wins big' to Mandarin speakers surged nearly 10% on US election day,msnmoney,2020-11-04 08:31:21
Cheap renovations that increase a home's value,msnmoney,2020-11-04 08:31:21
Is it worth the money to buy a home in a good school district?,msnmoney,2020-11-04 08:31:21
Warning signs a job isn't as good as it sounds,msnmoney,2020-11-04 08:31:21
"Credit Agricole Gets Boost From Bond Sales, Lower Provisions",msnmoney,2020-11-04 08:31:21
"Man Who Predicted 2020 Crash Says ""Now Is The Time""",msnmoney,2020-11-04 08:31:21
The election presents investors as many questions as answers,yahoofinance,2020-11-04 08:33:16
Stock futures whipsawed as election outcome hangs in balance,yahoofinance,2020-11-04 08:33:16
"Private payrolls grew by 365,000 in October",yahoofinance,2020-11-04 08:33:16
5 states legalize marijuana,yahoofinance,2020-11-04 08:33:16
"Democrats keep control of House, continue fight to take Senate majority",yahoofinance,2020-11-04 08:33:16
U.S. futures up as election results trickle in,yahoofinance,2020-11-04 08:33:16
Wall St's red-hot 'blue wave' trade unravels,yahoofinance,2020-11-04 08:33:16
"Betting markets completely reverse, favor Trump",yahoofinance,2020-11-04 08:33:16
How to invest in water sustainability,yahoofinance,2020-11-04 08:33:16
Jack Ma's Blunt Words Just Cost Him $35 Billion,yahoofinance,2020-11-04 08:33:16
I have a seven-figure nest egg — am I saving too much for retirement?,yahoofinance,2020-11-04 08:33:16
Dave Ramsey warns: Don't do these 10 things with your money,yahoofinance,2020-11-04 08:33:16
"Dow Jones Futures Rise, While Tech Futures Soar; Trump Claims 'A Big WIN!' But Election Results Unclear",yahoofinance,2020-11-04 08:33:16
"Shares of Uber, Lyft soar on expected passage of California gig-labor ballot measure",yahoofinance,2020-11-04 08:33:16
"Dow Futures Gain As Biden Holds Electoral College Lead, Narrows Gap in Michigan; Trump Says Will Challenge Results",yahoofinance,2020-11-04 08:33:16
Marijuana Stocks Fall Despite Cannabis Legalization Winning In Several States,yahoofinance,2020-11-04 08:33:16
I’m a 57-year-old nurse with no retirement savings and I want to retire within seven years. What can I do?,yahoofinance,2020-11-04 08:33:16
3 ‘Strong Buy’ Stocks With at Least 5% Dividend Yield,yahoofinance,2020-11-04 08:33:16
ExxonMobil Announces US Job Cuts,yahoofinance,2020-11-04 08:33:16
"The U.S. could split up, Gundlach says. Here’s how he’d invest for that.",yahoofinance,2020-11-04 08:33:16
Intel Makes Its Second AI Acquisition In A Week,yahoofinance,2020-11-04 08:33:16
"Dow Jones Today, Futures Soar; Biden Vs. Trump Down To The Wire; AMD Gets Goldman Upgrade",yahoofinance,2020-11-04 08:33:16
U.S. Stock Limit Rules Halted Nasdaq Trading as Futures Soared,yahoofinance,2020-11-04 08:33:16
‘I watch our finances like a hawk’: My husband owes $12K in unpaid tax — and he never told me. Should I file separately?,yahoofinance,2020-11-04 08:33:16
"Cramer Gives His Opinion On Jumia Technologies, Nio, More",yahoofinance,2020-11-04 08:33:16
"I’m 60, my wife thinks ‘money is for spending,’ I just lost my job and plan to retire — how can we avoid money fights?",yahoofinance,2020-11-04 08:33:16
Alibaba Is Reporting Earnings Thursday. Here’s What to Expect.,yahoofinance,2020-11-04 08:33:16
"Nio Stock Is a Winner, But How Much Higher Can It Go?",yahoofinance,2020-11-04 08:33:16
Time to rethink your retirement — the '4% rule' just changed,yahoofinance,2020-11-04 08:33:16
"Does CDC Hint Of Cruise Resumption Make Carnival Stock A Buy Right Now? Here's What Earnings, Charts Show",yahoofinance,2020-11-04 08:33:16
Jack Ma Loses $3B In A Day After Alibaba's Stock Crash,yahoofinance,2020-11-04 08:33:16
Is Wells Fargo Stock A Buy As Warren Buffett Continues To Cut Stake?,yahoofinance,2020-11-04 08:33:16
How a Trump or Biden presidency could affect your retirement plan,yahoofinance,2020-11-04 08:33:16
"Is Ford Stock A Buy After Earnings? Here's What Fundamentals, Chart Show",yahoofinance,2020-11-04 08:33:16
Dividend ETFs To Buy And Watch For 2020,yahoofinance,2020-11-04 08:33:16
Roku Reports Earnings Tomorrow. Here’s What to Look for.,yahoofinance,2020-11-04 08:33:16
"Is MO Stock A Buy As Juul Writedowns Pile Up? Here's What Earnings, Altria Stock Chart Show",yahoofinance,2020-11-04 08:33:16
3 “Strong Buy” Stocks Poised for a Year-End Rally,yahoofinance,2020-11-04 08:33:16
Alibaba at sea after Beijing blocks Ant Group float,yahoofinance,2020-11-04 08:33:16
Americans Awake to Unsettled Presidential Election,wsj,2020-11-04 08:35:51
"As vote counting continues in a few battleground states, strong potential for legal action hangs over race",wsj,2020-11-04 08:35:51
Rivals Locked in Close Battleground Contests,wsj,2020-11-04 08:35:51
Capital Journal: This Election Shows How Divided the Nation Remains,wsj,2020-11-04 08:35:51
What Markets Are Telling Us as Election Results Roll In,wsj,2020-11-04 08:35:51
The Election Leaves Markets—and the Country—in Suspended Animation,wsj,2020-11-04 08:35:51
Markets Swing as Investors Brace for Drawn-Out Election Results,wsj,2020-11-04 08:35:51
"Democrats Flip Senate Seats in Colorado, Arizona; Republicans Win in Alabama, Iowa",wsj,2020-11-04 08:35:51
"California Voters Pass Prop 22, Exempting Uber, Lyft From Reclassifying Drivers",wsj,2020-11-04 08:35:51
Oregon to Decriminalize All Drugs,wsj,2020-11-04 08:35:51
GOP Congressman Beats Lt. Gov in Montana’s Heated Governor’s Race,wsj,2020-11-04 08:35:51
Ballot Measure to Legalize Marijuana Passes in New Jersey,wsj,2020-11-04 08:35:51
New York Retailers Brace for Possible Unrest Over Election Outcome,wsj,2020-11-04 08:35:51
Suspended Ant IPO Shows Growing Regulatory Focus on Fintech Giant,wsj,2020-11-04 08:35:51
"Covid-19 Surge Forces Europeans to Stay Home, Dragging on Economy",wsj,2020-11-04 08:35:51
Daily Covid-19 Cases Hit Second-Highest,wsj,2020-11-04 08:35:51
"Uber, Lyft, Apple, Facebook, Amazon.com: What to Watch When the Stock Market Opens Today",wsj,2020-11-04 08:35:51
International M.B.A. Students Look for Alternatives to U.S.,wsj,2020-11-04 08:35:51
BMW Sales Boosted by China’s Strong Covid-19 Recovery,wsj,2020-11-04 08:35:51
Cold Weather Thaws Natural-Gas Prices,wsj,2020-11-04 08:35:51
Why Fewer Chips Say ‘Made in the U.S.A.’,wsj,2020-11-04 08:35:51
Seeking a Lockdown-Free Vacation? Head to the Beach,wsj,2020-11-04 08:35:51
Readers Share Their Tips on Pandemic Fatigue,wsj,2020-11-04 08:35:51
Josh Allen Is the NFL’s Myth-Busting Quarterback,wsj,2020-11-04 08:35:51
A Guide to Buying a House in This Crazy Covid Market,wsj,2020-11-04 08:35:51
What New Orleans’s Oldest Restaurant Can Teach Us About Resilience,wsj,2020-11-04 08:35:51
"Enrollment Is Dropping in New York City Schools, Parents Say",wsj,2020-11-04 08:35:51
Major Sydney Casino Opening Overshadowed by Investigations,wsj,2020-11-04 08:35:51
Prudential Posts Profit Increase of Almost 5%,wsj,2020-11-04 08:35:51
"Comcast, Walmart in Talks to Develop, Distribute Smart TVs",wsj,2020-11-04 08:35:51
"Saudis, Other OPEC Producers Consider Deeper Cuts Amid Pandemic",wsj,2020-11-04 08:35:51
Natural-Gas Drillers Outshine Oil Peers as Covid-19 Surges,wsj,2020-11-04 08:35:51
Brazilian President Jair Bolsonaro’s Son Faces Graft Charges,wsj,2020-11-04 08:35:51
Hurricane Eta Crashes Into Nicaragua as Category 4,wsj,2020-11-04 08:35:51
Vienna Shooting Suspect Had Previous Terrorism Conviction,wsj,2020-11-04 08:35:51
Families Second-Guess School Choices as Covid Cases Rise,wsj,2020-11-04 08:35:51
When Closing a Home Becomes a Fight to the Finish,wsj,2020-11-04 08:35:51
"If Pollock Designed a Race Car, It Might Look Like This BMW",wsj,2020-11-04 08:35:51
David Lynch and Gillian Anderson Explain How They Broke Through,wsj,2020-11-04 08:35:51
Political Groups Elude Facebook’s Election Controls; Airlines Are Giving Away Seats; Walmart Puts Guns Back,wsj,2020-11-04 08:35:51
WPP Shows Signs of Recovery in Third Quarter,wsj,2020-11-04 08:35:51
Ad Giant Omnicom Reports 11.5% Revenue Drop in Third Quarter,wsj,2020-11-04 08:35:51
‘Sneakernet’ Helps Election Officials Process Results,wsj,2020-11-04 08:35:51
Officials Are on the Lookout for Disinformation,wsj,2020-11-04 08:35:51
How to Get Big Ideas Off the Ground,wsj,2020-11-04 08:35:51
What CFOs Are Saying About This Week’s Elections,wsj,2020-11-04 08:35:51
Five Things That Could Change for CFOs After the Nov. 3 Elections,wsj,2020-11-04 08:35:51
General Motors Poaches Delta CFO to Fill Finance Seat,wsj,2020-11-04 08:35:51
JPMorgan Faces Possible Fine Related to Internal Controls,wsj,2020-11-04 08:35:51
Citigroup Chief Risk Officer to Depart,wsj,2020-11-04 08:35:51
Treasury Department Warns Art Market Against Sanctions Risks,wsj,2020-11-04 08:35:51
Software Firm Coupa to Buy Supply-Chain Tech Provider Llamasoft,wsj,2020-11-04 08:35:51
Supply-Chain Delays Hit Retailer Restocking Efforts,wsj,2020-11-04 08:35:51
Today's Logistics Report: Merging Supply Chain Software; Save the Robots; Taking Luxury Online,wsj,2020-11-04 08:35:51
Peloton Reports Earnings on Thursday. Here’s What to Expect.,wsj,2020-11-04 08:35:51
Global Markets Swing Around as U.S. Awaits Election Results,wsj,2020-11-04 08:35:51
"Why a Winning Fund Likes Tesla, Amazon, and Mastercard Stock",wsj,2020-11-04 08:35:51
Gold prices fight for altitude as prospect for 'blue wave' fiscal-aid package in Congress seen dimming,wsj,2020-11-04 08:35:51
"Pace of private sector job growth slows October, ADP says",wsj,2020-11-04 08:35:51
"Dow, S&P 500 futures rise, Nasdaq-100 surges more than 3% as Trump-Biden locked in tight election race",wsj,2020-11-04 08:35:51
"A Gothic-Style Mansion in Coconut Grove, Florida",wsj,2020-11-04 08:35:51
Open Up a Botanical World Indoors With Large Plants and Trees,wsj,2020-11-04 08:35:51
Mayfair’s Grosvenor Square is London’s Priciest Neighborhood in 2020,wsj,2020-11-04 08:35:51
Future Returns: Strategies for Investing in Dividend-Paying Stocks,wsj,2020-11-04 08:35:51
Takin’ It to the Track: New BMWs at Monticello Motor Club,wsj,2020-11-04 08:35:51
Renovated Historic Southampton House Sells for More Than $18 Million,wsj,2020-11-04 08:35:51
The Work Problems I Wish AI Could Solve,wsj,2020-11-04 08:35:51
AI May Help Identify Patients With Early-Stage Dementia,wsj,2020-11-04 08:35:51
How to Make Artificial Intelligence Less Biased,wsj,2020-11-04 08:35:51
"Philly, Catholics and Foster Kids",wsj,2020-11-04 08:35:51
A Diagnosis for American Polarization,wsj,2020-11-04 08:35:51
So Much for the Election Landslide,wsj,2020-11-04 08:35:51
"Trump, Biden Address Nation on Election Status, Vote Count Continues",wsj,2020-11-04 08:35:51
"Ernst, Kelly Score Key Victories in Tight Senate Races ",wsj,2020-11-04 08:35:51
"What Is Ant, the Chinese Fintech Giant With Record IPO Plans?",wsj,2020-11-04 08:35:51
Joe Biden Speaks on Election Night as Vote Count Continues,wsj,2020-11-04 08:35:51
"Ernst, Kelly Score Key Victories in Tight Senate Races ",wsj,2020-11-04 08:35:51
"Election Update: America Votes, Battleground States to Watch",wsj,2020-11-04 08:35:51
‘Stay Home’ Robocalls Target Voters on Election Day,wsj,2020-11-04 08:35:51
Nikola and the Race to Find the Next Tesla ,wsj,2020-11-04 08:35:51
"Trump, Biden Locked in Close Election Contest",wsj,2020-11-04 08:35:51
When Will We Know the 2020 Presidential Election Results? A Guide to Possible Delays,wsj,2020-11-04 08:35:51
Jeffrey Epstein’s Palm Beach Mansion to Be Demolished,wsj,2020-11-04 08:35:51
What Is the Electoral College and How Does It Work?    ,wsj,2020-11-04 08:35:51
"Opinion: California, the Shoplifting State",wsj,2020-11-04 08:35:51
The election night Wall Street feared,cnnbusiness,2020-11-04 08:40:17
Investors brace for uncertainty as the presidential election remains too close to call,cnnbusiness,2020-11-04 08:40:17
Stock futures extend their gains,cnnbusiness,2020-11-04 08:40:17
US dollar: Why the greenback will remain weak,cnnbusiness,2020-11-04 08:40:17
The Fed: The central bank starts its two-day policy meeting today,cnnbusiness,2020-11-04 08:40:17
Executive orders: Get ready for more ,cnnbusiness,2020-11-04 08:40:17
News anchors forcefully call out Trump for prematurely declaring victory,cnnbusiness,2020-11-04 08:40:17
Twitter and Facebook label Trump posts,cnnbusiness,2020-11-04 08:40:17
"Analysis: For the media, 13 burning questions that the election may answer  ",cnnbusiness,2020-11-04 08:40:17
On the trail: Reporters share what it was like to cover the Trump and Biden campaigns,cnnbusiness,2020-11-04 08:40:17
Late night shows: Comedians make a case against President Trump,cnnbusiness,2020-11-04 08:40:17
Analysis: Beijing just yanked Ant Group's IPO to show Jack Ma who's really in charge,cnnbusiness,2020-11-04 08:40:17
Uber and Lyft soar after Prop 22 passes in California,cnnbusiness,2020-11-04 08:40:17
Breakfast continues to bolster Wendy's,cnnbusiness,2020-11-04 08:40:17
Waymo pulls self-driving cars in San Francisco as cities nationwide brace for unrest,cnnbusiness,2020-11-04 08:40:17
The end of $600 stimulus checks has left unemployed Americans facing financial ruin,cnnbusiness,2020-11-04 08:40:17
This solar company's stock has spiked 300% in 2020. Here's why,cnnbusiness,2020-11-04 08:40:17
US cruise lines cancel sailings through at least end of 2020,cnnbusiness,2020-11-04 08:40:17
He helps Americans get Italian passports. Business is booming,cnnbusiness,2020-11-04 08:40:17
Here's how stores are changing Black Friday for the pandemic,cnnbusiness,2020-11-04 08:40:17
Refinance rates at 2.39% APR (15yr). Calculate your rate now,cnnbusiness,2020-11-04 08:40:17
How the pandemic has changed Americans' spending and saving habits,cnnbusiness,2020-11-04 08:40:17
10 charts that show how the economy did under Trump,cnnbusiness,2020-11-04 08:40:17
US economy grew in Q3 but the crisis isn't over,cnnbusiness,2020-11-04 08:40:17
Which states are recovering fastest and slowest,cnnbusiness,2020-11-04 08:40:17
Opinion: Hoping for a lucky break in the pandemic could cost the US economy dearly ,cnnbusiness,2020-11-04 08:40:17
Why we don't know exactly what happened during a near-collision,cnnbusiness,2020-11-04 08:40:17
Rocket Lab CEO: Space is becoming too crowded,cnnbusiness,2020-11-04 08:40:17
See Virgin Galactic's Under Armour spacesuits,cnnbusiness,2020-11-04 08:40:17
NASA wants to buy moon rocks,cnnbusiness,2020-11-04 08:40:17
SpaceX strapped a camera to a Falcon 9 rocket. Watch what happened,cnnbusiness,2020-11-04 08:40:17
Here's how to spot misinformation online,cnnbusiness,2020-11-04 08:40:17
Disney's new robot has a creepily human gaze,cnnbusiness,2020-11-04 08:40:17
See the baby white rhino born at Disney's Animal Kingdom,cnnbusiness,2020-11-04 08:40:17
Businesses prepare for possible post-election unrest,cnnbusiness,2020-11-04 08:40:17
Watch this flying car complete its first flight,cnnbusiness,2020-11-04 08:40:17
Should you talk politics at work?,cnnbusiness,2020-11-04 08:40:17
Car company that claimed speed record will do it over,cnnbusiness,2020-11-04 08:40:17
Bugatti unveils a super light hypercar that can top 300 mph,cnnbusiness,2020-11-04 08:40:17
"Thanks to Covid-19, some folks are broke and some are flush. Here's how to talk about it",cnnbusiness,2020-11-04 08:40:17
Beijing just yanked Ant Group's IPO to show Jack Ma who's really in charge,cnnbusiness,2020-11-04 08:40:17
Pennsylvania emerges as early focus of online Election Day misinformation ,cnnbusiness,2020-11-04 08:40:17
China halts Ant Group's giant IPO after dust up with billionaire Jack Ma ,cnnbusiness,2020-11-04 08:40:17
Ant Group's Jack Ma called in to talk to Chinese regulators ahead of IPO ,cnnbusiness,2020-11-04 08:40:17
News anchors forcefully call out Trump for prematurely declaring victory,cnnbusiness,2020-11-04 08:40:17
"For the media, 13 burning questions that the election may start to answer  ",cnnbusiness,2020-11-04 08:40:17
'Schitt's Creek' actresses bring comic flair to holiday ad,cnnbusiness,2020-11-04 08:40:17
'Surreal.' Reporters share what it was like to cover the Trump and Biden campaigns,cnnbusiness,2020-11-04 08:40:17
Smart sensors could track social distancing in the office,cnnbusiness,2020-11-04 08:40:17
Perovskites could revolutionize solar power,cnnbusiness,2020-11-04 08:40:17
Sam's Club is putting robot janitors in all of its stores during the pandemic,cnnbusiness,2020-11-04 08:40:17
New Photoshop tool could help fight fake images,cnnbusiness,2020-11-04 08:40:17
How NASA's Apollo program kicked off Silicon Valley's tech revolution,cnnbusiness,2020-11-04 08:40:17
Jeff Bezos just sold $1.8 billion worth of Amazon stock. Here's why,cnnbusiness,2020-11-04 08:40:17
Bill Nye's experimental spacecraft that sails on sunlight declares mission success ,cnnbusiness,2020-11-04 08:40:17
SpaceX's massive Starship prototype lifts off ,cnnbusiness,2020-11-04 08:40:17
This is what the new Burger King and Popeyes drive-thrus will look like,cnnbusiness,2020-11-04 08:40:17
How the pandemic has changed Americans' spending and saving habits,cnnbusiness,2020-11-04 08:40:17
"Harley-Davidson's ebike is here, just don't call it a Harley",cnnbusiness,2020-11-04 08:40:17
Outdoor heaters aren't enough to save restaurants this winter,cnnbusiness,2020-11-04 08:40:17
