headline,org,date
"Deutsche Bank upgrades FedEx, says a big quarter could help drive stock higher ",cnbc,2020-09-28 08:57:48
Virgin Galactic given two more buy ratings as Wall Street remains unanimous ,cnbc,2020-09-28 08:57:48
"Deadly Armenia-Azerbaijan clashes unlikely to cause an oil spike, analyst says ",cnbc,2020-09-28 08:57:48
5 things to know before the stock market opens Monday ,cnbc,2020-09-28 08:57:48
Want to be a better investor during pandemic? Manage your emotions ,cnbc,2020-09-28 08:57:48
"Monday’s biggest analyst calls: FedEx, Virgin Galactic, UPS, Snap & more ",cnbc,2020-09-28 08:57:48
"Don’t trust the bounce in cruise stocks, traders say after bullish analyst call ",cnbc,2020-09-28 08:57:48
 Health certificates may be the new ‘visas’ that allow air travel: Etihad ,cnbc,2020-09-28 08:57:48
Final UK-EU trade talks begin this week as officials race to seal a Brexit deal  ,cnbc,2020-09-28 08:57:48
Uber granted 18-month London license as judge overturns ban ,cnbc,2020-09-28 08:57:48
"Treasury yields higher as investors monitor coronavirus, political developments ",cnbc,2020-09-28 08:57:48
Indian start-up ShareChat is one of many looking to fill the vacuum left by TikTok ban ,cnbc,2020-09-28 08:57:48
European markets rally as banks bounce; HSBC up 8.8% ,cnbc,2020-09-28 08:57:48
Allbirds: Sneaker company wants people to understand shoes’ carbon footprint ,cnbc,2020-09-28 08:57:48
U.S. sanctions on chipmaker SMIC hit at the heart of China’s tech ambitions ,cnbc,2020-09-28 08:57:48
"U.S.-China tech tensions won’t go away even if Biden wins election, analyst says ",cnbc,2020-09-28 08:57:48
Amazon Prime Day set for Oct 13 and 14 after coronavirus delays ,cnbc,2020-09-28 08:57:48
South Korea K-pop sensation BTS’ label prices IPO at top end of range ,cnbc,2020-09-28 08:57:48
Canada’s pension fund plans to invest a third of its funds in emerging markets by 2025 ,cnbc,2020-09-28 08:57:48
Judge blocks Trump administration’s ban on TikTok downloads from U.S. app stores  ,cnbc,2020-09-28 08:57:48
SMIC shares in Hong Kong fall following reports of U.S. sanctions; Asia markets mixed ,cnbc,2020-09-28 08:57:48
Dow futures surge more than 300 points following a 4-week losing streak ,cnbc,2020-09-28 08:57:48
"Trump paid little to no federal income taxes over several years as he piled up losses and debt, NYT reports ",cnbc,2020-09-28 08:57:48
It’s too risky to put new money in stocks right now: Wells Fargo’s Chris Harvey ,cnbc,2020-09-28 08:57:48
Pelosi believes coronavirus stimulus deal still possible as Democrats prepare new package ,cnbc,2020-09-28 08:57:48
Supreme Court confirmation hearings set to start in two weeks ,cnbc,2020-09-28 08:57:48
Democrats make Supreme Court fight about future of Obamacare ,cnbc,2020-09-28 08:57:48
San Francisco housing has cooled as some flee the city ,cnbc,2020-09-28 08:57:48
"Antarctica, the only continent without coronavirus, braces for summer rotation ",cnbc,2020-09-28 08:57:48
September market swoon did most of what corrections are supposed to do ,cnbc,2020-09-28 08:57:48
"Stock market live updates: Dow futures surge 350 points, Pelosi says stimulus deal possible ",cnbc,2020-09-28 08:57:48
Judge blocks Trump administration’s ban on new TikTok downloads from U.S. app stores ,cnbc,2020-09-28 08:57:48
"Trump paid little to no federal income taxes over several years as he piled up losses and debt, NYT reports",cnbc,2020-09-28 08:57:48
Former Trump campaign manager Brad Parscale hospitalized after self-harm threats,cnbc,2020-09-28 08:57:48
Coronavirus live updates: Positivity rate tops 25% in some Midwest states; small businesses create succession plans,cnbc,2020-09-28 08:57:48
Amazon Prime Day set for Oct 13 and 14 after coronavirus delayed original summer date,cnbc,2020-09-28 08:57:48
Beyond COVID — preparing for the next business disruption,cnbc,2020-09-28 08:57:48
Uber granted 18-month London license as judge overturns ban,cnbc,2020-09-28 08:57:48
"Here are Monday’s biggest analyst calls of the day: FedEx, Virgin Galactic, UPS, Snap & more",cnbc,2020-09-28 08:57:48
Redfield voices alarm over influence of Trump’s new coronavirus task force adviser,cnbc,2020-09-28 08:57:48
"Stocks making the biggest moves premarket: Spotify, Caesars, Virgin Galactic & more",cnbc,2020-09-28 08:57:48
Pelosi believes coronavirus stimulus deal still possible as Democrats prepare new package,cnbc,2020-09-28 08:57:48
K-pop sensation BTS’ label prices IPO at top end of range,cnbc,2020-09-28 08:57:48
Democrats seek to turn Supreme Court fight into referendum on Obamacare,cnbc,2020-09-28 08:57:48
"How Tesla, GM and others aim to fix electric vehicle range anxiety",cnbc,2020-09-28 08:57:48
"San Francisco housing has cooled as some flee the city, but demand is still there",cnbc,2020-09-28 08:57:48
We analyzed 111 rewards cards: Here’s our No. 1 pick for best overall,cnbc,2020-09-28 08:57:48
Here’s what your monthly budget will look like if you retire with $2 million,cnbc,2020-09-28 08:57:48
"Don’t trust the bounce in cruise stocks, traders say after analysts call ‘inflection point’",cnbc,2020-09-28 08:57:48
Looking to move abroad? Here’s how this family saved enough cash to buy a house in Portugal,cnbc,2020-09-28 08:57:48
Here’s how to manage your emotions while investing through the pandemic,cnbc,2020-09-28 08:57:48
U.S. has ‘long way to go’ before herd immunity with less than 10% showing coronavirus antibodies,cnbc,2020-09-28 08:57:48
Amy Coney Barrett Supreme Court confirmation hearings to start in two weeks,cnbc,2020-09-28 08:57:48
Cleveland-Cliffs to buy U.S. assets of ArcelorMittal for about $1.4 billion,cnbc,2020-09-28 08:57:48
5 things to know before the stock market opens Monday,cnbc,2020-09-28 08:57:48
"Here are Monday’s biggest analyst calls of the day: FedEx, Virgin Galactic, UPS, Snap & more",cnbc,2020-09-28 08:57:48
"Stock market live updates: Dow futures surge 350 points, Pelosi says stimulus deal possible",cnbc,2020-09-28 08:57:48
Dow futures surge more than 300 points following a 4-week losing streak,cnbc,2020-09-28 08:57:48
Dr. Fauci says to take vitamin D if you’re deficient — here’s how to know,cnbc,2020-09-28 08:57:48
"Stocks making the biggest moves premarket: Spotify, Caesars, Virgin Galactic & more",cnbc,2020-09-28 08:57:48
5 things to know before the stock market opens Monday,cnbc,2020-09-28 08:57:48
Dow futures surge more than 300 points following a 4-week losing streak,cnbc,2020-09-28 08:57:48
K-pop sensation BTS’ label prices IPO at top end of range,cnbc,2020-09-28 08:57:48
"Bitcoin Price Sets A New Record: 63 Straight Days Of Closing Above $10,000",ibtimes,2020-09-28 08:59:50
Coffee Deals For National Coffee Day 2020,ibtimes,2020-09-28 08:59:50
Accenture Is In A Holding Pattern As The Pandemic Drags On,ibtimes,2020-09-28 08:59:50
3 Key Ways Netflix Has Changed Its Content Strategy,ibtimes,2020-09-28 08:59:50
Billionaire Reveals Why Bitcoin Is Better Than Stocks,ibtimes,2020-09-28 08:59:50
"As CARES Act Funds Run Out, Airlines Plead For More Aid",ibtimes,2020-09-28 08:59:50
EU-UK Trade Talks Resume Under Brexit Bill Cloud,ibtimes,2020-09-28 08:59:50
The Countries With The Highest Density Of Robot Workers,ibtimes,2020-09-28 08:59:50
Bitcoin Only Has 2.5 Million Coins Left To Mine: What Happens Next?,ibtimes,2020-09-28 08:59:50
Trump's TikTok Ban Blocked By Judge,ibtimes,2020-09-28 08:59:50
"TikTok Will Survive Donald Trump, US Users Say",ibtimes,2020-09-28 08:59:50
"Poland’s Plan To Phase Out Coal Mines, Opens The Door For Solar Energy",ibtimes,2020-09-28 08:59:50
Hire Better Employees Online And Make The Most Of Their Abilities,ibtimes,2020-09-28 08:59:50
DIY A Bright Spot For Consumer Spending,ibtimes,2020-09-28 08:59:50
A Look At The Power Shift From FinTech To TechFin,ibtimes,2020-09-28 08:59:50
Macy's Is Thinking Outside The Mall ,ibtimes,2020-09-28 08:59:50
Google Bans Political Ads While Votes Being Counted,ibtimes,2020-09-28 08:59:50
Banks Brace For Trading Surge Around Election,ibtimes,2020-09-28 08:59:50
Mushrooms Recall Leads To Multi-State Salmonella Outbreak,ibtimes,2020-09-28 08:59:50
Did These Firms Even Need PPP Loans In The First Place?,ibtimes,2020-09-28 08:59:50
McDonald’s Cactus Jack Sweepstakes Giving Away Travis Scott Action Figures,ibtimes,2020-09-28 08:59:50
EU Appeals Ruling In Apple’s $15 Billion Irish Tax Case,ibtimes,2020-09-28 08:59:50
Tel Aviv To Be The First City To Test Electric Roads,ibtimes,2020-09-28 08:59:50
China Chip Giant SMIC Shares Dive On US Export Controls,ibtimes,2020-09-28 08:59:50
32 Biggest Wall Street Bets That Failed Miserably,ibtimes,2020-09-28 08:59:50
34 Successful Companies With Terrible Early Business Plans,ibtimes,2020-09-28 08:59:50
What Are The Cheapest Cities To Live In The World?,ibtimes,2020-09-28 08:59:50
A Vaccine Before The US Election? Depends On Science -- Or Politics,ibtimes,2020-09-28 08:59:50
Jennifer Garner Shares Hilarious Back-To-School Video: 'The Juggle Is Real',ibtimes,2020-09-28 08:59:50
Blackpink’s 'Ice Cream' Surpasses 100 Million Views On YouTube,ibtimes,2020-09-28 08:59:50
Business,ibtimes,2020-09-28 08:59:50
Technology,ibtimes,2020-09-28 08:59:50
World,ibtimes,2020-09-28 08:59:50
National,ibtimes,2020-09-28 08:59:50
Media & Culture,ibtimes,2020-09-28 08:59:50
Opinion,ibtimes,2020-09-28 08:59:50
Sports,ibtimes,2020-09-28 08:59:50
Luxury,ibtimes,2020-09-28 08:59:50
Billionaire Reveals Why Bitcoin Is Better Than Stocks,ibtimes,2020-09-28 08:59:50
Bitcoin Only Has 2.5 Million Coins Left To Mine: What Happens Next?,ibtimes,2020-09-28 08:59:50
McDonald’s Cactus Jack Sweepstakes Giving Away Travis Scott Action Figures,ibtimes,2020-09-28 08:59:50
Reese’s Fans Beg For A Bite Of Big Cups With Pretzels,ibtimes,2020-09-28 08:59:50
Next,ibtimes,2020-09-28 08:59:50
Most Read,ibtimes,2020-09-28 08:59:50
,ibtimes,2020-09-28 08:59:50
,ibtimes,2020-09-28 08:59:50
,ibtimes,2020-09-28 08:59:50
,ibtimes,2020-09-28 08:59:50
,ibtimes,2020-09-28 08:59:50
About Us,ibtimes,2020-09-28 08:59:50
Advertise with Us,ibtimes,2020-09-28 08:59:50
Media Kit,ibtimes,2020-09-28 08:59:50
Terms & Conditions,ibtimes,2020-09-28 08:59:50
Privacy Policy,ibtimes,2020-09-28 08:59:50
Cookie Policy,ibtimes,2020-09-28 08:59:50
Australia,ibtimes,2020-09-28 08:59:50
India,ibtimes,2020-09-28 08:59:50
Singapore,ibtimes,2020-09-28 08:59:50
United Kingdom,ibtimes,2020-09-28 08:59:50
United States,ibtimes,2020-09-28 08:59:50
"US COVID-19 Cases Rise In 21 States, Experts Warn 'Huge Surge'",ibtimes,2020-09-28 08:59:50
Saudi Arabia Sends Maiden Shipment Of Blue Ammonia Fuel To Japan,ibtimes,2020-09-28 08:59:50
Trump Ex-Campaign Manager Brad Parscale Allegedly Threatens Suicide,ibtimes,2020-09-28 08:59:50
Huawei Exec To Accuse US Of Misleading Canada In Extradition Case,ibtimes,2020-09-28 08:59:50
"How NASA's Kate Rubins Will Vote From The ISS, Again",ibtimes,2020-09-28 08:59:50
China Chip Giant SMIC Shares Plunge After US Export Controls,ibtimes,2020-09-28 08:59:50
Death Toll Rises As Armenia-Azerbaijan Fighting Enters Second Day,ibtimes,2020-09-28 08:59:50
Dozens Dead As World Leaders Urge Halt To Azerbaijan-Armenia Clashes,ibtimes,2020-09-28 08:59:50
Commerzbank Names Deutsche Bank's Manfred Knof As New CEO,ibtimes,2020-09-28 08:59:50
Cadets Among 22 Dead In 'Shock' Ukraine Military Plane Crash,ibtimes,2020-09-28 08:59:50
Mexico Orders Arrest Of Soldiers Over Case Of 43 Missing Students,ibtimes,2020-09-28 08:59:50
Bombshell Report Claims Trump Avoided Taxes For Years,ibtimes,2020-09-28 08:59:50
Amazon Prime Day Begins Oct 13: Report,ibtimes,2020-09-28 08:59:50
"Bitcoin Price Should Now Be $15,000, Bloomberg Analyst Says",ibtimes,2020-09-28 08:59:50
TikTok Gets Reprieve As Judge Halts Trump Download Ban,ibtimes,2020-09-28 08:59:50
"As CARES Act Funds Run Out, Airlines Plead For More Aid",ibtimes,2020-09-28 08:59:50
iOS 14 Tip: How To Get Cycling Directions In Apple Maps,ibtimes,2020-09-28 09:01:31
Some Apple Watch Series 3 Owners Claim watchOS 7 Is 'Buggiest Upgrade',ibtimes,2020-09-28 09:01:31
Chinese Startup Xpeng Reveals New Flying Vehicle At Beijing Auto Show,ibtimes,2020-09-28 09:01:31
"iPhone 12 Pro Max, AirPods Studio And AirPower Mini Design, Features Leaked",ibtimes,2020-09-28 09:01:31
Apple Still Working On iPhone 'Glasses' Based On Leaked Patent,ibtimes,2020-09-28 09:01:31
Saudi Arabia Sends Maiden Shipment Of Blue Ammonia Fuel To Japan,ibtimes,2020-09-28 09:01:31
YouTube Takes Steps To Dispel Misinformation Around Mail-in Voting,ibtimes,2020-09-28 09:01:31
Judge Prepares Ruling After Hearing On Trump TikTok Download Ban,ibtimes,2020-09-28 09:01:31
AMD Confirms Radeon RX6000 Series Will Have Ample Supply At Launch,ibtimes,2020-09-28 09:01:31
Bad News About ‘Halo Infinite’ Confirmed By Community Director,ibtimes,2020-09-28 09:01:31
‘Final Fantasy XVI’ Announcement Trailer Bares More Details; Game Could Release Sooner Than Anticipated,ibtimes,2020-09-28 09:01:31
Xbox Series X Expandable Storage Confirmed At $219.99 Price,ibtimes,2020-09-28 09:01:31
Sega Announces Surprise Franchise Revival,ibtimes,2020-09-28 09:01:31
Amazon Luna's Plan To Get Around Apple Is An Open Secret,ibtimes,2020-09-28 09:01:31
How To Protect Your Password From Hacking And Identity Theft Online?,ibtimes,2020-09-28 09:01:31
Hydrogen-Powered Planes May Be On The Horizon,ibtimes,2020-09-28 09:01:31
Drones In The Home? Ring’s Latest Security Camera Takes Flight,ibtimes,2020-09-28 09:01:31
"Apple Changes Policy For Solo, Braided Solo Loop Replacements",ibtimes,2020-09-28 09:01:31
iOS 14 Tip: How To Translate Languages In Safari On iPhone,ibtimes,2020-09-28 09:01:31
Apple Fitness+: What We Know About Workout Service So Far,ibtimes,2020-09-28 09:01:31
‘Alien’ Malware: See List Of Android Apps Affected,ibtimes,2020-09-28 09:01:31
Apple Working On VR Headset That Projects Simulated Environments To Users' Eyes,ibtimes,2020-09-28 09:01:31
"Nokia Announces New Budget Smartphones, Wireless Earbuds With 150-Hour Battery Life",ibtimes,2020-09-28 09:01:31
China Chip Giant SMIC Shares Dive On US Export Controls,ibtimes,2020-09-28 09:01:31
32 Biggest Wall Street Bets That Failed Miserably,ibtimes,2020-09-28 09:01:31
34 Successful Companies With Terrible Early Business Plans,ibtimes,2020-09-28 09:01:31
What Are The Cheapest Cities To Live In The World?,ibtimes,2020-09-28 09:01:31
A Vaccine Before The US Election? Depends On Science -- Or Politics,ibtimes,2020-09-28 09:01:31
Jennifer Garner Shares Hilarious Back-To-School Video: 'The Juggle Is Real',ibtimes,2020-09-28 09:01:31
Blackpink’s 'Ice Cream' Surpasses 100 Million Views On YouTube,ibtimes,2020-09-28 09:01:31
Business,ibtimes,2020-09-28 09:01:31
Technology,ibtimes,2020-09-28 09:01:31
World,ibtimes,2020-09-28 09:01:31
National,ibtimes,2020-09-28 09:01:31
Media & Culture,ibtimes,2020-09-28 09:01:31
Opinion,ibtimes,2020-09-28 09:01:31
Sports,ibtimes,2020-09-28 09:01:31
Luxury,ibtimes,2020-09-28 09:01:31
Apple Maps In iOS 14 Tip: How To Get Cycling Directions,ibtimes,2020-09-28 09:01:31
"Apple Changes Policy For Solo, Braided Solo Loop Replacements",ibtimes,2020-09-28 09:01:31
Next,ibtimes,2020-09-28 09:01:31
Most Read,ibtimes,2020-09-28 09:01:31
,ibtimes,2020-09-28 09:01:31
,ibtimes,2020-09-28 09:01:31
,ibtimes,2020-09-28 09:01:31
,ibtimes,2020-09-28 09:01:31
,ibtimes,2020-09-28 09:01:31
About Us,ibtimes,2020-09-28 09:01:31
Advertise with Us,ibtimes,2020-09-28 09:01:31
Media Kit,ibtimes,2020-09-28 09:01:31
Terms & Conditions,ibtimes,2020-09-28 09:01:31
Privacy Policy,ibtimes,2020-09-28 09:01:31
Cookie Policy,ibtimes,2020-09-28 09:01:31
Australia,ibtimes,2020-09-28 09:01:31
India,ibtimes,2020-09-28 09:01:31
Singapore,ibtimes,2020-09-28 09:01:31
United Kingdom,ibtimes,2020-09-28 09:01:31
United States,ibtimes,2020-09-28 09:01:31
"US COVID-19 Cases Rise In 21 States, Experts Warn 'Huge Surge'",ibtimes,2020-09-28 09:01:31
Saudi Arabia Sends Maiden Shipment Of Blue Ammonia Fuel To Japan,ibtimes,2020-09-28 09:01:31
Trump Ex-Campaign Manager Brad Parscale Allegedly Threatens Suicide,ibtimes,2020-09-28 09:01:31
Huawei Exec To Accuse US Of Misleading Canada In Extradition Case,ibtimes,2020-09-28 09:01:31
"How NASA's Kate Rubins Will Vote From The ISS, Again",ibtimes,2020-09-28 09:01:31
China Chip Giant SMIC Shares Plunge After US Export Controls,ibtimes,2020-09-28 09:01:31
Death Toll Rises As Armenia-Azerbaijan Fighting Enters Second Day,ibtimes,2020-09-28 09:01:31
Dozens Dead As World Leaders Urge Halt To Azerbaijan-Armenia Clashes,ibtimes,2020-09-28 09:01:31
Commerzbank Names Deutsche Bank's Manfred Knof As New CEO,ibtimes,2020-09-28 09:01:31
Cadets Among 22 Dead In 'Shock' Ukraine Military Plane Crash,ibtimes,2020-09-28 09:01:31
Mexico Orders Arrest Of Soldiers Over Case Of 43 Missing Students,ibtimes,2020-09-28 09:01:31
Bombshell Report Claims Trump Avoided Taxes For Years,ibtimes,2020-09-28 09:01:31
iOS 14 Update: How To Use New Control Center Features,ibtimes,2020-09-28 09:01:31
iPhone Update: Why You Can No Longer Downgrade To iOS 13.7,ibtimes,2020-09-28 09:01:31
TikTok Gets Reprieve As Judge Halts Trump Download Ban,ibtimes,2020-09-28 09:01:31
"As CARES Act Funds Run Out, Airlines Plead For More Aid",ibtimes,2020-09-28 09:01:31
The biggest risk in business right now is grief,fortune,2020-09-28 09:03:30
Donald Trump is a master of hypnotism. How he used the power on America—and then himself,fortune,2020-09-28 09:03:30
Will India’s Jio be the next tech giant?,fortune,2020-09-28 09:03:30
The best and worst places in the U.S. to invest in real estate during the pandemic,fortune,2020-09-28 09:03:30
America’s Black brain drain: Why African-American professionals are moving abroad—and staying there,fortune,2020-09-28 09:03:30
"As the United States crosses 200,000 deaths from COVID-19, employers are reckoning with the stress, burnout, and trauma that will affect workers for years to come.",fortune,2020-09-28 09:03:30
Real hypnotism doesn’t involve someone clucking like a chicken.,fortune,2020-09-28 09:03:30
Silicon Valley heavyweights like Facebook and Alphabet are betting on it to break through.,fortune,2020-09-28 09:03:30
The pandemic is reshaping the real estate market. So Fortune analyzed the data to find the 10 best and worst housing markets to invest in right now. ,fortune,2020-09-28 09:03:30
"""I'd never been American first, and then Black. It's a refreshing change.""",fortune,2020-09-28 09:03:30
The funding gap between Black- and white-led organizations is clear—and alarming,fortune,2020-09-28 09:03:30
Uber shares soar as London court gives license go-ahead,fortune,2020-09-28 09:03:30
3 key rulings are a window into the views of Trump Supreme Court nominee Amy Coney Barrett,fortune,2020-09-28 09:03:30
Fans of K-Pop’s BTS are mobilizing on a new platform: the stock market,fortune,2020-09-28 09:03:30
,fortune,2020-09-28 09:03:30
,fortune,2020-09-28 09:03:30
,fortune,2020-09-28 09:03:30
,fortune,2020-09-28 09:03:30
Why Trump nominated Amy Coney Barrett to the Supreme Court,fortune,2020-09-28 09:03:30
Fortune’s latest list celebrates the startups tackling society’s big problems,fortune,2020-09-28 09:03:30
"Investors look to buck a four-week losing streak, sending global stocks higher",fortune,2020-09-28 09:03:30
How do you explain your resume gap in a COVID job market?,fortune,2020-09-28 09:03:30
Breonna Taylor’s case is as painful as it unsurprising,fortune,2020-09-28 09:03:30
Spotify CEO Daniel Ek pledges over $1 billion of his personal wealth to “moonshots”,fortune,2020-09-28 09:03:30
,fortune,2020-09-28 09:03:30
,fortune,2020-09-28 09:03:30
,fortune,2020-09-28 09:03:30
,fortune,2020-09-28 09:03:30
,fortune,2020-09-28 09:03:30
,fortune,2020-09-28 09:03:30
,fortune,2020-09-28 09:03:30
,fortune,2020-09-28 09:03:30
,fortune,2020-09-28 09:03:30
,fortune,2020-09-28 09:03:30
,fortune,2020-09-28 09:03:30
,fortune,2020-09-28 09:03:30
,fortune,2020-09-28 09:03:30
,fortune,2020-09-28 09:03:30
,fortune,2020-09-28 09:03:30
,fortune,2020-09-28 09:03:30
,fortune,2020-09-28 09:03:30
,fortune,2020-09-28 09:03:30
,fortune,2020-09-28 09:03:30
,fortune,2020-09-28 09:03:30
,fortune,2020-09-28 09:03:30
,fortune,2020-09-28 09:03:30
,fortune,2020-09-28 09:03:30
,fortune,2020-09-28 09:03:30
,fortune,2020-09-28 09:03:30
,fortune,2020-09-28 09:03:30
,fortune,2020-09-28 09:03:30
,fortune,2020-09-28 09:03:30
FTC commissioner: Is antitrust the next stakeholder capitalism battleground?,fortune,2020-09-28 09:03:30
"To ethically tackle COVID-19, Big Pharma needs an overhaul",fortune,2020-09-28 09:03:30
"If companies don’t recruit from HBCUs, they’re missing out on promising employees",fortune,2020-09-28 09:03:30
COVID showed why we need to make financial literacy a national priority,fortune,2020-09-28 09:03:30
"Amid vaccine trials, the FDA is on trial itself",fortune,2020-09-28 09:03:30
Can the corporate ‘offsite’ survive COVID?,fortune,2020-09-28 09:03:30
,fortune,2020-09-28 09:03:30
,fortune,2020-09-28 09:03:30
,fortune,2020-09-28 09:03:30
,fortune,2020-09-28 09:03:30
,fortune,2020-09-28 09:03:30
,fortune,2020-09-28 09:03:30
,fortune,2020-09-28 09:03:30
,fortune,2020-09-28 09:03:30
China’s ambitious new climate goals mean it must completely phase out coal by 2050,fortune,2020-09-28 09:03:30
COVID and the flu present a clash of viruses,fortune,2020-09-28 09:03:30
U.S. antitrust investigation of Google is coming to a head. Here’s what you need to know,fortune,2020-09-28 09:03:30
"Down a stunning 23%, London’s once mighty FTSE is trading like an emerging-market stock exchange",fortune,2020-09-28 09:03:30
Erin Brockovich has given up on the federal government saving the environment,fortune,2020-09-28 09:03:30
"Ford, just admit it: You’re a truckmaker now",fortune,2020-09-28 09:03:30
A Q&A with the provocative mind behind watchmaker H. Moser,fortune,2020-09-28 09:03:30
5 better ways to help your employees mourn at the office,fortune,2020-09-28 09:03:30
The biggest risk in business right now is grief,fortune,2020-09-28 09:03:30
"Down a stunning 23%, London’s once mighty FTSE is trading like an emerging-market stock exchange",fortune,2020-09-28 09:03:30
Trust in business is enjoying a moment,fortune,2020-09-28 09:03:30
Goldman Sachs to investors: Fears of a delayed presidential election result are overblown,fortune,2020-09-28 09:03:30
Sexual misconduct allegations are playing out just like they did in 2016—even after the #MeToo movement,fortune,2020-09-28 09:03:30
Why online voting will have to wait,fortune,2020-09-28 09:03:30
The activist employee hasn’t gone away,fortune,2020-09-28 09:03:30
Boris Johnson is urging parents to send their children back to school this fall,fortune,2020-09-28 09:03:30
Airport COVID testing hubs and new travel corridors are part of a plan to revive U.S.-Europe air travel,fortune,2020-09-28 09:03:30
"Refuse to wear a mask in England, and it will cost you. Fines now can run as high as $4,189",fortune,2020-09-28 09:03:30
Bars are fighting to stay in compliance with their states’ changing regulations,fortune,2020-09-28 09:03:30
Is oil giant BP finally ready to ‘think outside the barrel’?,fortune,2020-09-28 09:03:30
How a Canadian convenience store giant built its empire,fortune,2020-09-28 09:03:30
Why Nestlé’s CEO has been in the office every day since COVID-19 hit,fortune,2020-09-28 09:03:30
Why the China-U.S. rivalry is at a crucial turning point—and what it means for business,fortune,2020-09-28 09:03:30
Gold bugs are on the back foot as COVID concerns climb and stimulus-check hopes fade,fortune,2020-09-28 09:03:30
Congress and Trump to restart stimulus negotiations as $300 unemployment benefit expires,fortune,2020-09-28 09:03:30
"‘It’s all about the dollar:’ As the greenback strengthens, the markets tumble",fortune,2020-09-28 09:03:30
Investors send markets higher even as COVID concerns grow,fortune,2020-09-28 09:03:30
Are people really fleeing cities because of COVID? Here’s what the data shows,fortune,2020-09-28 09:03:30
To buy or to rent? Residential real estate calculus in the time of COVID-19,fortune,2020-09-28 09:03:30
A comprehensive guide for first-time homebuyers,fortune,2020-09-28 09:03:30
This is what every generation thinks of real estate—and what each has spent on it,fortune,2020-09-28 09:03:30
PayPal’s CEO on why moral leadership makes clear capitalism needs an upgrade,fortune,2020-09-28 09:03:30
How this Black woman tech CEO learned to be ‘unapologetically ambitious’,fortune,2020-09-28 09:03:30
"Trump’s ‘wrong track’ gambit: The president is betting that the worse Americans feel, the more likely they are to reelect him",fortune,2020-09-28 09:03:30
Levi Strauss’s Chip Bergh on why he’s taking his most direct stance yet against structural racism,fortune,2020-09-28 09:03:30
How reborn pharma giant AstraZeneca is taking the lead against COVID-19,fortune,2020-09-28 09:03:30
Inside China’s drive for digital currency dominance,fortune,2020-09-28 09:03:30
A kind of ‘Magic’: One nerd’s quest to shake up video games and create a $1 billion market,fortune,2020-09-28 09:03:30
‘They killed her’: Why are breast implants still putting millions of women at risk?,fortune,2020-09-28 09:03:30
Why Nvidia’s purchase of Arm worries the U.K. tech sector,fortune,2020-09-28 09:03:30
"How Google, Facebook, and Twitter plan to handle misinformation surrounding 2020 presidential election results",fortune,2020-09-28 09:03:30
Apple’s iPhone sales have lagged in India for years. It’s only now unleashing its branding firepower,fortune,2020-09-28 09:03:30
Match’s CEO explains how dating has changed during the COVID pandemic,fortune,2020-09-28 09:03:30
"5 cheap electric cars to buy until Tesla delivers on its $25,000...",fortune,2020-09-28 09:03:30
‘You can’t self-proclaim it:’ How to be an action-driven ally,fortune,2020-09-28 09:03:30
How would Instagram co-founder Kevin Systrom redesign TikTok as CEO?,fortune,2020-09-28 09:03:30
