headline,org,date
"Dow Up 350 Points as Retail Trading Frenzy Ebbs, Nasdaq Jumps 2.6%",msnmoney,2021-02-01 14:56:51
How the Stock Market Performed Under Each President,msnmoney,2021-02-01 14:56:51
20 Questions to Tell If You're Ready to Retire,msnmoney,2021-02-01 14:56:51
11 Things That Are Free in February,msnmoney,2021-02-01 14:56:51
"Advice From Mark Cuban, Warren Buffett and Other Experts That Can Help You Survive a Crisis",msnmoney,2021-02-01 14:56:51
Top credit card wipes out interest until 2022 (seriously),msnmoney,2021-02-01 14:56:51
First Solar stock slips after UBS analyst backs away from long-time bullish stance,msnmoney,2021-02-01 14:56:51
32 Pandemic Habits That Are Worth Keeping,msnmoney,2021-02-01 14:56:51
"What Is the 1040 and What’s the Difference Between the 1040, 1040A and 1040EZ?",msnmoney,2021-02-01 14:56:51
Best & Worst Refinance Mortgage Companies of 2021,msnmoney,2021-02-01 14:56:51
Top Stocks To Watch Heading Into February,msnmoney,2021-02-01 14:56:51
This Is The Best Home Security System Of 2021,msnmoney,2021-02-01 14:56:51
GameStop short squeeze fuels new stock-market services tracking Reddit messages,msnmoney,2021-02-01 14:56:51
5 Questions To Ask When Deciding If You Should Buy a New or Used Car,msnmoney,2021-02-01 14:56:51
Never Got Your Stimulus Check? Claim It on Your Taxes,msnmoney,2021-02-01 14:56:51
Another beloved pizza chain has filed for bankruptcy,msnmoney,2021-02-01 14:56:51
Stocks rally as Wall Street tries to move past short squeeze jitters,msnmoney,2021-02-01 14:56:51
Expert: “This credit card is so good I signed up personally”,msnmoney,2021-02-01 14:56:51
5 Smart Devices You Need for Your New Home,msnmoney,2021-02-01 14:56:51
"7 signs you're rich, even if it doesn't feel like it",msnmoney,2021-02-01 14:56:51
Absolutely massive homes listed for less than $100K,msnmoney,2021-02-01 14:56:51
Company offering COVID-19 test kits via vending machines,msnmoney,2021-02-01 14:56:51
20 must-read books about money,msnmoney,2021-02-01 14:56:51
Sean Connery's Old Mansion is Unsellable and it's No Secret Why,msnmoney,2021-02-01 14:56:51
"Time for more record earnings reports from Big Tech, led by Amazon’s first $100 billion quarter",msnmoney,2021-02-01 14:56:51
How Much It Cost To Retire in the Year You Were Born,msnmoney,2021-02-01 14:56:51
Smart Money Podcast: Jackpot Windfall and Extra COVID Cash,msnmoney,2021-02-01 14:56:51
The Cheapest Neighborhoods in the 50 Biggest US Cities,msnmoney,2021-02-01 14:56:51
"U.S. manufacturers still growing rapidly, ISM finds, despite COVID setbacks",msnmoney,2021-02-01 14:56:51
24 Unique Gifts Everybody Actually Wants,msnmoney,2021-02-01 14:56:51
What to do if the government wants its pandemic money back,msnmoney,2021-02-01 14:56:51
The mysterious abandoned mansion said to be built on gold,msnmoney,2021-02-01 14:56:51
Things you should (and shouldn't) buy in February,msnmoney,2021-02-01 14:56:51
Alibaba Earnings Preview: How to Trade It After the Print,msnmoney,2021-02-01 14:56:51
15 ways it’s tougher than ever to run a small business,msnmoney,2021-02-01 14:56:51
Best & Worst Refinance Mortgage Companies of 2021,msnmoney,2021-02-01 14:56:51
January’s Gone: Here’s How You Can Still Make Financial Resolutions You’ll Keep All Year,msnmoney,2021-02-01 14:56:51
8 Easy Ways to Make a Great Impression in Seconds,msnmoney,2021-02-01 14:56:51
GameStop Short Interest Plunges in Sign Traders Are Covering,msnmoney,2021-02-01 14:56:51
This beloved chocolate shop is closing all of its locations,msnmoney,2021-02-01 14:56:51
"Don't waste money on a master's degree during the pandemic, says career expert of 15 years—here’s why",msnmoney,2021-02-01 14:56:51
These Food Items At Costco Should Never Be In Your Cart,msnmoney,2021-02-01 14:56:51
15 U.S. Cities With the Most Single-Family Rentals,msnmoney,2021-02-01 14:56:51
Best no-penalty CD rates for February 2021,msnmoney,2021-02-01 14:56:51
Autographs that are worth millions of dollars,msnmoney,2021-02-01 14:56:51
17 things everyone should know about retirement,msnmoney,2021-02-01 14:56:51
The dirtiest and cleanest cities in the U.S.,msnmoney,2021-02-01 14:56:51
Costco Workers Reveal 14 Things They'd Never Buy From The Store,msnmoney,2021-02-01 14:56:51
"Democrats Probe Tyson, Smithfield, OSHA Over Covid Outbreaks",msnmoney,2021-02-01 14:56:51
Charming cabins for sale across America,msnmoney,2021-02-01 14:56:51
14 easy personal finance tips,msnmoney,2021-02-01 14:56:51
25 Top-Paying Dividend Stocks That Will Make You Rich,msnmoney,2021-02-01 14:56:51
Jim Cramer Says Market Is Dominated by Regulatory Risk Monday,msnmoney,2021-02-01 14:56:51
20 Questions to Tell If You're Ready to Retire,msnmoney,2021-02-01 14:56:51
How a Biden presidency may affect seniors,msnmoney,2021-02-01 14:56:51
Should Your First House Be a Condo?,msnmoney,2021-02-01 14:56:51
Biggest Stock Market Surprises at the Start of 2021,msnmoney,2021-02-01 14:56:51
Liberty Bid Puts Negative Value on Thyssenkrupp Steel Arm,msnmoney,2021-02-01 14:56:51
The Pros and Cons of Continuing To Work Remotely Post-Pandemic,msnmoney,2021-02-01 14:56:51
Mortgage Outlook: A Slight Uphill Climb for February Rates,msnmoney,2021-02-01 14:56:51
"Before you renew Amazon Prime, read this",msnmoney,2021-02-01 14:56:51
Things that have decimated women's retirement savings,msnmoney,2021-02-01 14:56:51
Knotel Files for Bankruptcy as Pandemic Strains Office Rentals,msnmoney,2021-02-01 14:56:51
How Rich Are These Top CEOs?,msnmoney,2021-02-01 14:56:51
Here's how to boost your income and find creative ways to make money,msnmoney,2021-02-01 14:56:51
Why Now Is the Time To Invest In These 10 Companies,msnmoney,2021-02-01 14:56:51
"Tesla Gets Lofty $1,200 Price Target as ‘Fireworks’ Not Over",msnmoney,2021-02-01 14:56:51
"If You Have More Than $1,000 in Your Checking Account, Make These 4 Moves",msnmoney,2021-02-01 14:56:51
What Actually Happens If You Don’t Pay Your Taxes,msnmoney,2021-02-01 14:56:51
Should you leave chapter 13 bankruptcy protection early?,msnmoney,2021-02-01 14:56:51
"Mountain Dew, moonshine, and more secret brand histories",msnmoney,2021-02-01 14:56:51
Robinhood raises trading limit on GameStop further to 20 shares,msnmoney,2021-02-01 14:56:51
Signs that you should be preparing to buy a new car,msnmoney,2021-02-01 14:56:51
Firefighters Face Unique Challenges with Deferred Comp,msnmoney,2021-02-01 14:56:51
"Dow Up 350 Points as Retail Trading Frenzy Ebbs, Nasdaq Jumps 2.6%",msnmoney,2021-02-01 14:56:51
How the Stock Market Performed Under Each President,msnmoney,2021-02-01 14:56:51
20 Questions to Tell If You're Ready to Retire,msnmoney,2021-02-01 14:56:51
11 Things That Are Free in February,msnmoney,2021-02-01 14:56:51
"Advice From Mark Cuban, Warren Buffett and Other Experts That Can Help You Survive a Crisis",msnmoney,2021-02-01 14:56:51
Top credit card wipes out interest until 2022 (seriously),msnmoney,2021-02-01 14:56:51
First Solar stock slips after UBS analyst backs away from long-time bullish stance,msnmoney,2021-02-01 14:56:51
32 Pandemic Habits That Are Worth Keeping,msnmoney,2021-02-01 14:56:51
"What Is the 1040 and What’s the Difference Between the 1040, 1040A and 1040EZ?",msnmoney,2021-02-01 14:56:51
Best & Worst Refinance Mortgage Companies of 2021,msnmoney,2021-02-01 14:56:51
Top Stocks To Watch Heading Into February,msnmoney,2021-02-01 14:56:51
This Is The Best Home Security System Of 2021,msnmoney,2021-02-01 14:56:51
GameStop short squeeze fuels new stock-market services tracking Reddit messages,msnmoney,2021-02-01 14:56:51
5 Questions To Ask When Deciding If You Should Buy a New or Used Car,msnmoney,2021-02-01 14:56:51
Never Got Your Stimulus Check? Claim It on Your Taxes,msnmoney,2021-02-01 14:56:51
Another beloved pizza chain has filed for bankruptcy,msnmoney,2021-02-01 14:56:51
Stocks rally as Wall Street tries to move past short squeeze jitters,msnmoney,2021-02-01 14:56:51
Expert: “This credit card is so good I signed up personally”,msnmoney,2021-02-01 14:56:51
5 Smart Devices You Need for Your New Home,msnmoney,2021-02-01 14:56:51
"7 signs you're rich, even if it doesn't feel like it",msnmoney,2021-02-01 14:56:51
Absolutely massive homes listed for less than $100K,msnmoney,2021-02-01 14:56:51
Company offering COVID-19 test kits via vending machines,msnmoney,2021-02-01 14:56:51
20 must-read books about money,msnmoney,2021-02-01 14:56:51
Sean Connery's Old Mansion is Unsellable and it's No Secret Why,msnmoney,2021-02-01 14:56:51
"Time for more record earnings reports from Big Tech, led by Amazon’s first $100 billion quarter",msnmoney,2021-02-01 14:56:51
How Much It Cost To Retire in the Year You Were Born,msnmoney,2021-02-01 14:56:51
Smart Money Podcast: Jackpot Windfall and Extra COVID Cash,msnmoney,2021-02-01 14:56:51
The Cheapest Neighborhoods in the 50 Biggest US Cities,msnmoney,2021-02-01 14:56:51
"U.S. manufacturers still growing rapidly, ISM finds, despite COVID setbacks",msnmoney,2021-02-01 14:56:51
24 Unique Gifts Everybody Actually Wants,msnmoney,2021-02-01 14:56:51
What to do if the government wants its pandemic money back,msnmoney,2021-02-01 14:56:51
The mysterious abandoned mansion said to be built on gold,msnmoney,2021-02-01 14:56:51
Things you should (and shouldn't) buy in February,msnmoney,2021-02-01 14:56:51
Alibaba Earnings Preview: How to Trade It After the Print,msnmoney,2021-02-01 14:56:51
15 ways it’s tougher than ever to run a small business,msnmoney,2021-02-01 14:56:51
Best & Worst Refinance Mortgage Companies of 2021,msnmoney,2021-02-01 14:56:51
January’s Gone: Here’s How You Can Still Make Financial Resolutions You’ll Keep All Year,msnmoney,2021-02-01 14:56:51
8 Easy Ways to Make a Great Impression in Seconds,msnmoney,2021-02-01 14:56:51
GameStop Short Interest Plunges in Sign Traders Are Covering,msnmoney,2021-02-01 14:56:51
This beloved chocolate shop is closing all of its locations,msnmoney,2021-02-01 14:56:51
"Don't waste money on a master's degree during the pandemic, says career expert of 15 years—here’s why",msnmoney,2021-02-01 14:56:51
These Food Items At Costco Should Never Be In Your Cart,msnmoney,2021-02-01 14:56:51
15 U.S. Cities With the Most Single-Family Rentals,msnmoney,2021-02-01 14:56:51
Best no-penalty CD rates for February 2021,msnmoney,2021-02-01 14:56:51
Autographs that are worth millions of dollars,msnmoney,2021-02-01 14:56:51
17 things everyone should know about retirement,msnmoney,2021-02-01 14:56:51
The dirtiest and cleanest cities in the U.S.,msnmoney,2021-02-01 14:56:51
Costco Workers Reveal 14 Things They'd Never Buy From The Store,msnmoney,2021-02-01 14:56:51
"Democrats Probe Tyson, Smithfield, OSHA Over Covid Outbreaks",msnmoney,2021-02-01 14:56:51
Charming cabins for sale across America,msnmoney,2021-02-01 14:56:51
14 easy personal finance tips,msnmoney,2021-02-01 14:56:51
25 Top-Paying Dividend Stocks That Will Make You Rich,msnmoney,2021-02-01 14:56:51
Jim Cramer Says Market Is Dominated by Regulatory Risk Monday,msnmoney,2021-02-01 14:56:51
20 Questions to Tell If You're Ready to Retire,msnmoney,2021-02-01 14:56:51
How a Biden presidency may affect seniors,msnmoney,2021-02-01 14:56:51
Should Your First House Be a Condo?,msnmoney,2021-02-01 14:56:51
Biggest Stock Market Surprises at the Start of 2021,msnmoney,2021-02-01 14:56:51
Liberty Bid Puts Negative Value on Thyssenkrupp Steel Arm,msnmoney,2021-02-01 14:56:51
The Pros and Cons of Continuing To Work Remotely Post-Pandemic,msnmoney,2021-02-01 14:56:51
Mortgage Outlook: A Slight Uphill Climb for February Rates,msnmoney,2021-02-01 14:56:51
"Before you renew Amazon Prime, read this",msnmoney,2021-02-01 14:56:51
Things that have decimated women's retirement savings,msnmoney,2021-02-01 14:56:51
Knotel Files for Bankruptcy as Pandemic Strains Office Rentals,msnmoney,2021-02-01 14:56:51
How Rich Are These Top CEOs?,msnmoney,2021-02-01 14:56:51
Here's how to boost your income and find creative ways to make money,msnmoney,2021-02-01 14:56:51
Why Now Is the Time To Invest In These 10 Companies,msnmoney,2021-02-01 14:56:51
"Tesla Gets Lofty $1,200 Price Target as ‘Fireworks’ Not Over",msnmoney,2021-02-01 14:56:51
"If You Have More Than $1,000 in Your Checking Account, Make These 4 Moves",msnmoney,2021-02-01 14:56:51
What Actually Happens If You Don’t Pay Your Taxes,msnmoney,2021-02-01 14:56:51
Should you leave chapter 13 bankruptcy protection early?,msnmoney,2021-02-01 14:56:51
"Mountain Dew, moonshine, and more secret brand histories",msnmoney,2021-02-01 14:56:51
Robinhood raises trading limit on GameStop further to 20 shares,msnmoney,2021-02-01 14:56:51
Signs that you should be preparing to buy a new car,msnmoney,2021-02-01 14:56:51
Firefighters Face Unique Challenges with Deferred Comp,msnmoney,2021-02-01 14:56:51
"Stocks jump to recover some losses, silver prices surge while GameStop slides",yahoofinance,2021-02-01 14:58:53
GameStop saga revives calls in Congress for transaction tax,yahoofinance,2021-02-01 14:58:53
Gamestop shares down 26% — a big move for anyone who just got in,yahoofinance,2021-02-01 14:58:53
Running list who DC politicians are blaming for the Gamestop saga,yahoofinance,2021-02-01 14:58:53
Rep. Nancy Mace: 'There needs to be hearings and an investigation' into the Reddit-fueled surges,yahoofinance,2021-02-01 14:58:53
'We need to get to a very high level of vaccination compliance across the planet before we can really slow this virus down': Expert,yahoofinance,2021-02-01 14:58:53
"Reddit, GameStop tale is about 5 big trends",yahoofinance,2021-02-01 14:58:53
Robinhood CEO on why it suspended GameStop trading,yahoofinance,2021-02-01 14:58:53
"Arlington, Virginia Mortgage Refi at 1.99% APR",yahoofinance,2021-02-01 14:58:53
GameStop saga revives calls in Congress for a financial transaction tax,yahoofinance,2021-02-01 14:58:53
Reddit Traders Declare ‘BioWar’ as Shorted Biotechs Soar,yahoofinance,2021-02-01 14:58:53
Nine Investors Instantly Make $16 Billion On GameStop Stock 'Squeeze',yahoofinance,2021-02-01 14:58:53
'Spill the beans man:' Elon Musk grills Robinhood CEO ,yahoofinance,2021-02-01 14:58:53
3 ‘Strong Buy’ Stocks With 8% Dividend Yield,yahoofinance,2021-02-01 14:58:53
Dow Rallies As Republicans Offer Biden Stimulus Bargain; Microsoft Surges As GameStop Collapses,yahoofinance,2021-02-01 14:58:53
Tesla challenger Faraday Future has an aggressive sales plan,yahoofinance,2021-02-01 14:58:53
Novavax Surges On Highly Effective Covid Shot; Is NVAX Stock A Buy?,yahoofinance,2021-02-01 14:58:53
Wall St. strategist warns on GameStop: 'There's not an infinite pool of greater fools',yahoofinance,2021-02-01 14:58:53
GameStop Short Interest Plunges in Sign Traders Are Covering,yahoofinance,2021-02-01 14:58:53
"Your next stimulus check: New $1,400 payment faces big votes this week",yahoofinance,2021-02-01 14:58:53
‘My family won’t let me go hungry’: Two young traders surf GameStop’s epic wave — but not without regrets,yahoofinance,2021-02-01 14:58:53
"Nio, Xpeng Sales Soar To Start 2021 After 2020 Boom; Li Auto Due",yahoofinance,2021-02-01 14:58:53
Nokia Stock Gets an Upgrade Because Ericsson’s Earnings and 5G Performance Were So Good,yahoofinance,2021-02-01 14:58:53
Citadel Silver Holding Exposes Rifts in WallStreetBets Army,yahoofinance,2021-02-01 14:58:53
"Elon Musk Turns Tough Interviewer For Robinhood CEO, Demands Answers On GameStop Events",yahoofinance,2021-02-01 14:58:53
GameStop traders may inflict even more pain on Wall Street: Goldman,yahoofinance,2021-02-01 14:58:53
"Is Alibaba Stock A Buy Right Now? Here's What Earnings, Chart Show",yahoofinance,2021-02-01 14:58:53
Redditors divided on shift to push up Silver,yahoofinance,2021-02-01 14:58:53
Apple Selling $14 Billion of Bonds as Share Buybacks Seen Rising,yahoofinance,2021-02-01 14:58:53
"Stock market news live updates: Stocks jump to recover some losses, silver prices surge",yahoofinance,2021-02-01 14:58:53
"After 10 Years of Underperformance, Commodities Are Set to Boom. Here’s How to Play the Rally.",yahoofinance,2021-02-01 14:58:53
10 Ways to Reduce Your 401(k) Taxes,yahoofinance,2021-02-01 14:58:53
"Alibaba could show big earnings from 11.11 shopping event, but regulatory concerns increasing",yahoofinance,2021-02-01 14:58:53
Zomedica Stock Is up 330% in One Month; Is There Room for More Upside?,yahoofinance,2021-02-01 14:58:53
"Tesla is in decline, SUVs are king, and more insights from the world’s largest electric-vehicle market",yahoofinance,2021-02-01 14:58:53
Is Virgin Galactic Stock A Buy With Big Test Flight Coming Up?,yahoofinance,2021-02-01 14:58:53
The Two Moves Gilead Just Made Send These Biotech Stocks Skyward,yahoofinance,2021-02-01 14:58:53
"Is Home Depot Stock A Buy Right Now After A Key Upgrade? Here's What Earnings, Charts Show",yahoofinance,2021-02-01 14:58:53
Greylock Files for Bankruptcy After Losses Spur Withdrawals,yahoofinance,2021-02-01 14:58:53
Cannabis Countdown: Top 10 Marijuana And Psychedelic Stock News Stories Of The Week,yahoofinance,2021-02-01 14:58:53
JNJ Stock Dips On Less Effective Covid Vaccine; Is It A Buy Right Now?,yahoofinance,2021-02-01 14:58:53
Wall Street analysts say Chevron merger talks a sideshow before Exxon loss,yahoofinance,2021-02-01 14:58:53
Four ways the market today is eerily similar to the dot-com bubble: BofA,yahoofinance,2021-02-01 14:58:53
"5 Low-Priced, Small-Cap Stocks Poised for Big Gains in 2021",yahoofinance,2021-02-01 14:58:53
Here's What The World's Richest Person Thinks About Bitcoin,yahoofinance,2021-02-01 14:58:53
Pfizer Earnings: What to Look For From PFE,yahoofinance,2021-02-01 14:58:53
Why Bank of America Thinks Moderna Stock Has Gone High Enough,yahoofinance,2021-02-01 14:58:53
3 Silver Stocks To Look At Amid Metal's Rapid Rise,yahoofinance,2021-02-01 14:58:53
I Was Wrong About Amazon Stock Before… I Won’t Make That Mistake Again,yahoofinance,2021-02-01 14:58:53
It Could Be Time to Take Profits on Discovery and ViacomCBS,yahoofinance,2021-02-01 14:58:53
"AMC Entertainment stock now a ‘sell’ at MKM, as analyst’s price target drops to $1",yahoofinance,2021-02-01 14:58:53
Billionaire Fertitta's hotel company to go public through SPAC deal at $6.6 bln valuation,yahoofinance,2021-02-01 14:58:53
"Is DAL Stock A Buy Right Now? Here's What Earnings, Delta Stock Chart Show",yahoofinance,2021-02-01 14:58:53
Silver: Is it Too Late to Jump on Board?,yahoofinance,2021-02-01 14:58:53
EV battery maker Microvast to go public via merger with SPAC Tuscan Holdings in deal valued at about $3 billion,yahoofinance,2021-02-01 14:58:53
Why hedge funds are more likely to cause a market crisis than Robinhood's GameStop traders,yahoofinance,2021-02-01 14:58:53
"Time for more record earnings reports from Big Tech, led by Amazon’s first $100 billion quarter",yahoofinance,2021-02-01 14:58:53
"Nio, XPeng report rising sales as Wall Street awaits U.S. auto sales snapshot",yahoofinance,2021-02-01 14:58:53
"Tesla Gets Lofty $1,200 Price Target as ‘Fireworks’ Not Over",yahoofinance,2021-02-01 14:58:53
Nokia upped to buy after Ericsson results,yahoofinance,2021-02-01 14:58:53
EV Battery Start-Up QuantumScape Is Driven Solely by Promise,yahoofinance,2021-02-01 14:58:53
"DraftKings Stock Surges On Latest Analyst Upgrades, Is It A Buy Right Now?",yahoofinance,2021-02-01 14:58:53
Amazon earnings preview: Prime Day and the holidays mean Amazon will add to its most profitable year,yahoofinance,2021-02-01 14:58:53
Robinhood Narrows Trading Restrictions to Eight Companies,yahoofinance,2021-02-01 14:58:53
"Dow Jones Stocks To Buy And Watch In February 2021: Apple, Microsoft Jump",yahoofinance,2021-02-01 14:58:53
Chip Stocks at Cusp of Intermediate Correction,yahoofinance,2021-02-01 14:58:53
Robinhood in a tough position as it faces a wave of lawsuits over GameStop saga,yahoofinance,2021-02-01 14:58:53
3 Gold Stocks Ready to Glitter,yahoofinance,2021-02-01 14:58:53
Silver Prices Surge to Eight-Year High Amid Reddit-Fueled Frenzy,yahoofinance,2021-02-01 14:58:53
GameStop stock retreats from record gains after more than half of short positions eliminated,yahoofinance,2021-02-01 14:58:53
Is Zoom Stock A Buy Right Now? Equity Offering Sets Stage For Acquisition,yahoofinance,2021-02-01 14:58:53
American Airlines Stock Gets a Downgrade as Shares Get Squeezed,yahoofinance,2021-02-01 14:58:53
Exclusive-Mexican tax authorities to seek over $500 million from Canada's First Majestic,yahoofinance,2021-02-01 14:58:53
3 Monster Growth Stocks to  Beat the Volatility,yahoofinance,2021-02-01 14:58:53
Intel Needs New Ideas. Is a Mobileye Spinoff One of Them?,yahoofinance,2021-02-01 14:58:53
Stitch Fix Has Surged on Short Squeezes. Another Bull Throws in the Towel.,yahoofinance,2021-02-01 14:58:53
Largest Oil Merger Ever Would Still Be A Fraction Of Tesla's Value,yahoofinance,2021-02-01 14:58:53
"Is PayPal Stock A Buy Right Now Amid Bitcoin Boost? Here's What Earnings, Charts Show",yahoofinance,2021-02-01 14:58:53
Sorrento: Breaking Down B. Riley’s New Bullish Call,yahoofinance,2021-02-01 14:58:53
AMZN Stock: Bull Put Spread For Earnings,yahoofinance,2021-02-01 14:58:53
Ford exit casts long shadow over Brazil’s car industry,yahoofinance,2021-02-01 14:58:53
GameStop stores are still empty despite Reddit-fueled trading frenzy,yahoofinance,2021-02-01 14:58:53
U.S Mortgage Rates Fall for a 2nd Consecutive Week Supporting Demand,yahoofinance,2021-02-01 14:58:53
Battery Maker Microvast Agrees to Merger With Tuscan SPAC,yahoofinance,2021-02-01 14:58:53
Top Casino Stocks for Q1 2021,yahoofinance,2021-02-01 14:58:53
Nikola stock rallies after Wedbush analyst says it’s no longer a sell,yahoofinance,2021-02-01 14:58:53
Biden’s Green Energy Boom Could Send The Electric Car Sector Into Overdrive,yahoofinance,2021-02-01 14:58:53
Return On Capital Employed Overview: Zynga,yahoofinance,2021-02-01 14:58:53
Dividend Stocks to Watch and Buy in 2021,yahoofinance,2021-02-01 14:58:53
Gamestop shares are down 26% — a big move for anyone who just got in,yahoofinance,2021-02-01 14:58:53
Reddit is coming for silver. A short squeeze? Unlikely,yahoofinance,2021-02-01 14:58:53
Best Tech Stocks To Buy Or Watch Now: 5 Growth Stocks Leading The Stock Market,yahoofinance,2021-02-01 14:58:53
ROCE Insights For Intl Flavors & Fragrances,yahoofinance,2021-02-01 14:58:53
Silver Coin Sites Seize Up as Buying Frenzy Takes Hold,yahoofinance,2021-02-01 14:58:53
Another Analyst Says Expedia Stock Looks Too Cheap. Here’s Why.,yahoofinance,2021-02-01 14:58:53
The GameStop short squeeze was 'the grand awakening': expert,yahoofinance,2021-02-01 14:58:53
Investors Love These Less-Followed 8 Stocks In February,yahoofinance,2021-02-01 14:58:53
First Mover: Silver Is the New GameStop as Musk’s #Bitcoin Stalls,yahoofinance,2021-02-01 14:58:53
Shark Bites: Anatomy of a Trade - Aurinia Pharmaceuticals,yahoofinance,2021-02-01 14:58:53
Analyzing Nokia's Unusual Options Activity,yahoofinance,2021-02-01 14:58:53
Grayscale Reopens Its Ethereum Trust to Investors,yahoofinance,2021-02-01 14:58:53
Silver stocks litter NYSE biggest gainers list,yahoofinance,2021-02-01 14:58:53
FuboTV's stock soars after Wedbush analyst boosts price target by 25%,yahoofinance,2021-02-01 14:58:53
The Reddit Frenzy Has Already Quadrupled Silver’s Options Volume,yahoofinance,2021-02-01 14:58:53
Blockchain Bites: The ‘Silver Lining’ for Bitcoin,yahoofinance,2021-02-01 14:58:53
"If You Like Tesla, Check Out These 3 Companies",yahoofinance,2021-02-01 14:58:53
Honeywell’s Shares Fall as Q4 Profit Slumps About 13%; Target Price $210,yahoofinance,2021-02-01 14:58:53
What Will The Death Of Keystone XL Mean For Canada?,yahoofinance,2021-02-01 14:58:53
"GameStop Sinks as Short Interest Drops, Retail Recalibrates",yahoofinance,2021-02-01 14:58:53
Robinhood Raises Another $2.4 Billion From Shareholders,wsj,2021-02-01 15:01:46
Online Traders Propel Silver; AMC Shares Gain,wsj,2021-02-01 15:01:46
Facebook to Counter Apple Privacy Update With Its Own Prompt,wsj,2021-02-01 15:01:46
Republicans Propose $618 Billion Covid-19 Stimulus Plan,wsj,2021-02-01 15:01:46
Pandemic Wears on Essential Workers: ‘Everybody Forgets You’re Still on the Front Line’,wsj,2021-02-01 15:01:46
Covid-19 Vaccines to Stress-Test Grocery Stores and Pharmacies,wsj,2021-02-01 15:01:46
"Myanmar’s Coup Derails Fragile Democracy, Posing Test for Biden",wsj,2021-02-01 15:01:46
"Snowstorm Batters Northeast, Delaying Vaccinations, Testing",wsj,2021-02-01 15:01:46
Covid-19 Vaccines Leave Pregnant Women in Quandary,wsj,2021-02-01 15:01:46
"Israeli Leaders, Ultraorthodox Clash Over Covid Lockdowns",wsj,2021-02-01 15:01:46
Is This Cycling Duel the Best Rivalry in Sports?,wsj,2021-02-01 15:01:46
Worried About Ageism? Where You Live Matters,wsj,2021-02-01 15:01:46
Theo Epstein Joins Firm That Is Buying Stakes in Teams,wsj,2021-02-01 15:01:46
"After the Covid Vaccine, People Find Joy in Little Things",wsj,2021-02-01 15:01:46
Ford to Use Google’s Android in Most Cars,wsj,2021-02-01 15:01:46
Emerson CEO Dave Farr to Retire,wsj,2021-02-01 15:01:46
"Golden Nugget Parent, Private-Jet Operator Wheels Up Join SPAC Frenzy",wsj,2021-02-01 15:01:46
Exxon-Chevron Tie-Up Not as Crazy as It Sounds,wsj,2021-02-01 15:01:46
U.S. Manufacturing Growth Continued Early in 2021,wsj,2021-02-01 15:01:46
Covid-19 Pandemic Motivates Younger People to Buy Life Insurance,wsj,2021-02-01 15:01:46
Former JPMorgan Banker Acquitted in Bribery Trial,wsj,2021-02-01 15:01:46
Wintry Weather Lifts Natural-Gas Prices,wsj,2021-02-01 15:01:46
Exiled Uighurs Fear China’s Reach Will Erode Turkish Haven,wsj,2021-02-01 15:01:46
Pause in Corporate PAC Spending Triggers Political Pushback,wsj,2021-02-01 15:01:46
Pennsylvania’s Top Election Official Leaves Post,wsj,2021-02-01 15:01:46
Why Lee Daniels Is Fasting During the Covid-19 Pandemic,wsj,2021-02-01 15:01:46
Advice for Making the Most of the WSJ Fitness Challenge,wsj,2021-02-01 15:01:46
