headline,org,date
Tech stocks claw back gains after rout,yahoofinance,2020-09-18 08:33:06
Trump bans TikTok and WeChat from US app store,yahoofinance,2020-09-18 08:33:06
A slow September for the U.S. economy,yahoofinance,2020-09-18 08:33:06
Tencent rebrands WeChat work app ahead of Trump ban,yahoofinance,2020-09-18 08:33:06
Snowflake slides after historic rally in public debut,yahoofinance,2020-09-18 08:33:06
Vote Quadrant founder on how to push criminal justice reform: 'We have the power in our vote locally to make this change happen immediately',yahoofinance,2020-09-18 08:33:06
"Podcast: TikTok saga continues, Instagram's rough day, Fed update",yahoofinance,2020-09-18 08:33:06
Vaccine makers ramp up as Trump stirs debate,yahoofinance,2020-09-18 08:33:06
"2.4% FIXED Mortgage Refi, No Hidden Fees/Points",yahoofinance,2020-09-18 08:33:06
Billionaire investor Ray Dalio on capitalism’s crisis: The world is going to change ‘in shocking ways’ in the next five years,yahoofinance,2020-09-18 08:33:06
Jim Cramer: You Saw Snowflake. Now Get Ready for the Blizzard,yahoofinance,2020-09-18 08:33:06
Some wealthy Americans are already prepping their finances for a Joe Biden presidency — here’s how,yahoofinance,2020-09-18 08:33:06
Tesla stock gets a price target bump to $515 at Piper Sandler,yahoofinance,2020-09-18 08:33:06
Is Apple Stock A Buy Ahead Of iPhone 12 Launch Event?,yahoofinance,2020-09-18 08:33:06
3 Nasdaq Stocks to Buy Off Their Corrective Bottoms,yahoofinance,2020-09-18 08:33:06
Intel Stock Is a Dud That Can No Longer Keep Up,yahoofinance,2020-09-18 08:33:06
Semiconductor Stocks To Buy And Watch Before Third-Quarter Earnings,yahoofinance,2020-09-18 08:33:06
7 Closed-End Funds With Big Dividends,yahoofinance,2020-09-18 08:33:06
Hertz Bonuses Rejected by Judge Who Calls Them ‘Offensive’,yahoofinance,2020-09-18 08:33:06
Even Fidelity’s $230 Billion Star Manager Has Robinhood Anxiety,yahoofinance,2020-09-18 08:33:06
3 “Strong Buy” Healthcare Stocks With Major Catalysts Approaching,yahoofinance,2020-09-18 08:33:06
"Pete Najarian Sees Unusual Options Activity In AMD, Bausch Health And Applied Materials",yahoofinance,2020-09-18 08:33:06
"Tesla's stock bounces after Wedbush analyst boosts price target, but keeps rating at neutral",yahoofinance,2020-09-18 08:33:06
3 “Perfect 10” Dividend Stocks Yielding at Least 5%,yahoofinance,2020-09-18 08:33:06
Corporate Insiders Pull the Trigger on These 3 Stocks,yahoofinance,2020-09-18 08:33:06
Everything Investors Need to Know About Tesla’s Battery Day,yahoofinance,2020-09-18 08:33:06
Rivian Provides A New Teaser - But Can It Deliver?,yahoofinance,2020-09-18 08:33:06
Nvidia's Acquisition Of Arm Proves A Boon For Rival Chipmaker,yahoofinance,2020-09-18 08:33:06
Do You Own The 10 Most Expensive Stocks Right Now?,yahoofinance,2020-09-18 08:33:06
Is it Too Late to Get Involved With General Electric?,yahoofinance,2020-09-18 08:33:06
Mortgage rates remain near record lows — now the challenge will be finding a lender willing to give you one,yahoofinance,2020-09-18 08:33:06
Electric vehicle tech provider XL Fleet to merge with SPAC Pivotal Investment in deal valued at about $1 billion,yahoofinance,2020-09-18 08:33:06
"Tesla wins case against former employee accused of hacking, transferring data",yahoofinance,2020-09-18 08:33:06
How a Biden presidency could change your tax bill,yahoofinance,2020-09-18 08:33:06
Ericsson to buy networking specialist Cradlepoint in $1.1 billion 5G deal,yahoofinance,2020-09-18 08:33:06
Treasury Savings Bonds Can Yield More Than Junk,yahoofinance,2020-09-18 08:33:06
Arrowhead Hits the Bullseye in Phase 2 Study of ARO-AAT; Analyst Targets Over 90% Upside,yahoofinance,2020-09-18 08:33:06
Top Silver Stocks for Q4 2020,yahoofinance,2020-09-18 08:33:06
3 things to know about Tesla’s ‘battery day’,yahoofinance,2020-09-18 08:33:06
Gold Forecast – The September Breakdown in Gold is Beginning,yahoofinance,2020-09-18 08:33:06
"Micron’s Long-Term Prospects Remain Strong, Says 5-Star Analyst",yahoofinance,2020-09-18 08:33:06
Sumo Logic Priced at $22. Here’s Where the Stock Finished Trading.,yahoofinance,2020-09-18 08:33:06
"Apple Is Set Up for Huge 5G iPhone Sales, Analyst Says",yahoofinance,2020-09-18 08:33:06
Is Cisco Stock A Buy Or Sell? Tech Icon May Need Big Acquisition Amid Covid-19,yahoofinance,2020-09-18 08:33:06
"Top Stocks Nvidia, Taiwan Semi Still In Reach Thanks To These Tech Plays",yahoofinance,2020-09-18 08:33:06
Volkswagen Has A Very Ambitious Production Target For Its Electric Vehicle Line,yahoofinance,2020-09-18 08:33:06
"Beyond Meat Slumps After JPMorgan Downgrade Cites Stock Overshoot, Increasing Competition",yahoofinance,2020-09-18 08:33:06
"Unity Software Gets Its Game On, In 3D, With $1.2 Billion IPO",yahoofinance,2020-09-18 08:33:06
3 Artificial intelligence Stocks to Consider as the Trend Heats Up,yahoofinance,2020-09-18 08:33:06
Walmart Stock Is In Buy Zone As Dow Giant Steps Up Amazon Fight,yahoofinance,2020-09-18 08:33:06
Morgan Stanley Bets on These 3 Stocks; Sees Over 40% Upside,yahoofinance,2020-09-18 08:33:06
Richard Branson And Virgin Group Launch SPAC,yahoofinance,2020-09-18 08:33:06
‘We bet on the wrong horse’: I co-signed my nephew’s $55K student loan: He has no degree and no job. What should we do?,yahoofinance,2020-09-18 08:33:06
Fidelity’s $230 billion man explains why he dumped Tesla shares but still bets big on Warren Buffett,yahoofinance,2020-09-18 08:33:06
UPS Plans Management Buyouts in Bid to Trim Payroll Costs,yahoofinance,2020-09-18 08:33:06
"CVS Is Transforming Health Care, Piper Sandler Says In Upgrade",yahoofinance,2020-09-18 08:33:06
"If Nikola goes up in flames, GM might only get singed, analysts say",yahoofinance,2020-09-18 08:33:06
NetEase's stock surges to pace Nasdaq 100's premarket gainers after 5-for-1 stock split,yahoofinance,2020-09-18 08:33:06
GE’s stock surges to best 2-day rally in 6 months after CEO Larry Culp’s upbeat comments,yahoofinance,2020-09-18 08:33:06
Kensington Capital Stock Is a Hot Investment in Next-Gen Batteries,yahoofinance,2020-09-18 08:33:06
Stock Traders Brace for Quadruple Witching Amid Options Anxiety,yahoofinance,2020-09-18 08:33:06
Understanding Workhorse Group's Unusual Options Activity,yahoofinance,2020-09-18 08:33:06
Top Technology Penny Stocks for Q4 2020,yahoofinance,2020-09-18 08:33:06
Oil Falls After Libyan Warlord Says Exports Can Resume,yahoofinance,2020-09-18 08:33:06
GE Stock Jumped Because It Expects Positive Free Cash Flow. What Wall Street Is Saying.,yahoofinance,2020-09-18 08:33:06
Is The Ultimate Warren Buffett Stock A Buy As It Nears Buy Point Amid Coronavirus Rally?,yahoofinance,2020-09-18 08:33:06
"Is Citigroup Stock A Buy As New CEO To Take Over? Here's What Earnings, Chart Show",yahoofinance,2020-09-18 08:33:06
Kinross Gold Pays First Dividend in 7 Years With Metal Rallying,yahoofinance,2020-09-18 08:33:06
"Here's How Much Investing $1,000 In AMD At Dot-Com Bubble Peak Would Be Worth Today",yahoofinance,2020-09-18 08:33:06
Freeport-McMoRan (FCX) Could Enter New Uptrend,yahoofinance,2020-09-18 08:33:06
"Sumo Logic IPO Raises $326 Million, Stock Climbs As Trading Begins",yahoofinance,2020-09-18 08:33:06
"'Halftime Report' Traders Share Their Thoughts On Danaher, Uber And IBM",yahoofinance,2020-09-18 08:33:06
Coca-Cola Pleads For Consumers To Aid Restaurants,yahoofinance,2020-09-18 08:33:06
Tilson Says Nikola's Trevor Milton Will Land 'Behind Bars For Securities Fraud',yahoofinance,2020-09-18 08:33:06
Nvidia Analyst Says Chipmaker Could Try This 'Plan B' If Arm Deal Falls Through,yahoofinance,2020-09-18 08:33:06
GM Unveiled More Electric-Vehicle Technology. That Could Be Bad News for These Stocks.,yahoofinance,2020-09-18 08:33:06
"Salesforce To Add 12,000 Jobs In A Year, As Part Of Fire-And-Hire Plan",yahoofinance,2020-09-18 08:33:06
"51Job, U.S. Steel, Sorrento: 5 Top Stock Gainers for Thursday",yahoofinance,2020-09-18 08:33:06
Wynn Las Vegas reveals 548 positive COVID-19 cases among employees,yahoofinance,2020-09-18 08:33:06
Exclusive: Electric vehicle charge network ChargePoint nears deal to go public - sources,yahoofinance,2020-09-18 08:33:06
"Dow Jones Stocks To Buy And Watch In September 2020: Amgen, Apple, Home Depot, Microsoft",yahoofinance,2020-09-18 08:33:06
Top Casino Stocks for Q4 2020,yahoofinance,2020-09-18 08:33:06
Return On Capital Employed Overview: Oasis Petroleum,yahoofinance,2020-09-18 08:33:06
Texas Instruments raises dividend by 13%,yahoofinance,2020-09-18 08:33:06
"Benzinga's Top Upgrades, Downgrades For September 17, 2020",yahoofinance,2020-09-18 08:33:06
"Is Tilray Stock A Buy Right Now? Here's What Earnings, Charts Show",yahoofinance,2020-09-18 08:33:06
5 Value Stocks To Watch In The Financial Services Sector,yahoofinance,2020-09-18 08:33:06
Aurora Cannabis Stock Is Under the Hammer; Here’s What You Need to Know,yahoofinance,2020-09-18 08:33:06
Investors in Snowflake’s IPO should prepare for a second-day slump,yahoofinance,2020-09-18 08:33:06
"Mortgage rates stay close to record lows, but new fee is nearing",yahoofinance,2020-09-18 08:33:06
Google-Backed American Well Stock Rises 28% in Market Debut,yahoofinance,2020-09-18 08:33:06
It’s time for income-seeking investors to take a fresh look at these 28 utility stocks,yahoofinance,2020-09-18 08:33:06
"Is Lockheed Stock A Buy Right Now? Here's What Earnings, Chart Say About LMT",yahoofinance,2020-09-18 08:33:06
Apollo Weighs Deal for $10 Billion Plastics Firm Covestro,yahoofinance,2020-09-18 08:33:06
"Transocean's stock drops after long-time bull downgrades, slashes price target",yahoofinance,2020-09-18 08:33:06
Investing in Apple Stock (AAPL),yahoofinance,2020-09-18 08:33:06
Is AstraZeneca Still A Safe Bet?,yahoofinance,2020-09-18 08:33:06
Arm rival SiFive says Nvidia deal spurs interest in its technology,yahoofinance,2020-09-18 08:33:06
Top Oil and Gas Stocks for Q4 2020,yahoofinance,2020-09-18 08:33:06
"5G Stocks To Buy And Watch: 5G Smartphone Prices Fall, Apple Still To Come",yahoofinance,2020-09-18 08:33:06
"Medtronic (MDT) Beats Estimates, Holds 200-Day SMA",yahoofinance,2020-09-18 08:33:06
Powell Laid the Blueprint for Tech’s Eventual Wreck With QE Punt,yahoofinance,2020-09-18 08:33:06
"Trulieve Analyst Bullish On Pennsylvania Entry, Questions Timing Of Equity Offering",yahoofinance,2020-09-18 08:33:06
"For 401(k) and IRA Holders, Sept. 30 Is Key Deadline for Designating Beneficiaries",yahoofinance,2020-09-18 08:33:06
Top Beer Stocks for Q4 2020,yahoofinance,2020-09-18 08:33:06
"Dave & Buster’s stock plunges 26% on bankruptcy fears, but analysts say it’s investor ‘overreaction’",yahoofinance,2020-09-18 08:33:06
"Dow Futures, Coronavirus, Unity Software - 5 Things You Must Know Friday",yahoofinance,2020-09-18 08:33:06
Top Oil and Gas Penny Stocks for Q4 2020,yahoofinance,2020-09-18 08:33:06
Airlines are using frequent flyer programs to sell debt. Here’s how it works,yahoofinance,2020-09-18 08:33:06
U.S. to Ban WeChat Use After Sunday,wsj,2020-09-18 08:35:30
Lawmakers Close In on Spending Deal to Avert Shutdown,wsj,2020-09-18 08:35:30
"Oracle, Walmart Aim for Significant Stakes in TikTok",wsj,2020-09-18 08:35:30
U.S. Stock Futures Waver as Investors Brace for Volatile Trading,wsj,2020-09-18 08:35:30
Millions Are House-Rich but Cash-Poor. Wall Street Landlords Are Ready.,wsj,2020-09-18 08:35:30
Doctors and Hospitals Are Better Prepared to Treat Covid-19 This Fall,wsj,2020-09-18 08:35:30
Snowflake CEO Slootman Scores IPO Hat Trick With Big Bet on Data,wsj,2020-09-18 08:35:30
2021 Best Colleges in America: Harvard Leads the Rankings,wsj,2020-09-18 08:35:30
"In Brazil, Covid-19 Deals Blow to Children Disbled by Zika",wsj,2020-09-18 08:35:30
How to Navigate Covid Travel Restrictions,wsj,2020-09-18 08:35:30
The LeBron James of Playing with LeBron James,wsj,2020-09-18 08:35:30
Pandemic Plays Supervillain to Hollywood’s $200 Million Movie Machine,wsj,2020-09-18 08:35:30
Is America’s Favorite Retirement Plan Broken?,wsj,2020-09-18 08:35:30
Console Makers Now Have Bigger Game to Play,wsj,2020-09-18 08:35:30
LSE Eyes Sale of Italian Unit to Help Secure Refinitiv Approval,wsj,2020-09-18 08:35:30
"Platinum, Palladium Prices Diverge as Car Makers See Uneven Recovery",wsj,2020-09-18 08:35:30
"SoftBank Sells Brightstar, Carrying On Its Divestiture Spree",wsj,2020-09-18 08:35:30
"Europe Is Lagging Behind on 5G Rollout, Companies Warn",wsj,2020-09-18 08:35:30
"How Biden Might Alter Tax Rules, From Nonprofits to Opportunity Zones",wsj,2020-09-18 08:35:30
"Trump, Biden Both Hit Campaign Trail in More Conventional Sparring",wsj,2020-09-18 08:35:30
Where Trump and Biden Stand on Big Tech,wsj,2020-09-18 08:35:30
The Worst Month for U.S. Traffic Deaths,wsj,2020-09-18 08:35:30
"Navalny’s Hotel Room Had Traces of Nerve Agent Novichok, Supporters Say",wsj,2020-09-18 08:35:30
"Five Countries Are Weighing Normalized Ties to Israel, Trump Aide Says",wsj,2020-09-18 08:35:30
How Bill Nye Draws Power From Being Insignificant,wsj,2020-09-18 08:35:30
The Pit Stop That Could Decide the Tour de France,wsj,2020-09-18 08:35:30
‘I Don’t Want to Be an Oracle.’ Writer Roger Angell at 100.,wsj,2020-09-18 08:35:30
‘The Devil All the Time’: Waging the War Within,wsj,2020-09-18 08:35:30
Microsoft and Sony Square Off With Multiple Game Consoles; Amazon Music Joins the Podcast Battle,wsj,2020-09-18 08:35:30
Omnicom Shakes Up Media-Agency Ranks Amid Pandemic,wsj,2020-09-18 08:35:30
Facebook Starts an Ad-Free Section for College Students,wsj,2020-09-18 08:35:30
"Pandemic Broadband Speeds Are Faster, but Insufficient for Some",wsj,2020-09-18 08:35:30
Nasdaq Ramps Up Cloud Move,wsj,2020-09-18 08:35:30
"California Utilities Hope Drones, AI Will Lower Risk of Future Wildfires",wsj,2020-09-18 08:35:30
PG&E CFO Leaving for Another Utility,wsj,2020-09-18 08:35:30
Companies Brace for Higher Taxes After U.S. Election,wsj,2020-09-18 08:35:30
"U.K. Accounting Watchdog Fines Deloitte, Former Partners Over Autonomy Audits",wsj,2020-09-18 08:35:30
SEC Charges Former NS8 Chief With Defrauding Investors,wsj,2020-09-18 08:35:30
U.S. Charges Two Russian Nationals Who Allegedly Stole Cryptocurrencies,wsj,2020-09-18 08:35:30
Canada’s Former U.S. Envoy Violated Ethics Law in Palantir Role,wsj,2020-09-18 08:35:30
East Coast Ports Get More Shipping Volumes as Trade Routes Change,wsj,2020-09-18 08:35:30
West Coast Freight Networks ‘Bursting at the Seams’ With Surging Imports,wsj,2020-09-18 08:35:30
Today’s Logistics Report: Shipping Trade Heads East; Coal’s Slowing Burn; Turnaround for LNG,wsj,2020-09-18 08:35:30
Rolex’s Perpetual Planet Expands the Brand’s Sustainability Efforts,wsj,2020-09-18 08:35:30
Global Stocks Mixed as Investors Cautious on Quadruple Witching Day,wsj,2020-09-18 08:35:30
Bad Weather May Disrupt Soybean Production. That Will Boost Prices.,wsj,2020-09-18 08:35:30
Tesla stock gets a price target bump to $515 at Piper Sandler,wsj,2020-09-18 08:35:30
Tech bubble? Credit Suisse strategists say ‘no’ but say it’s time to get pickier with these stocks,wsj,2020-09-18 08:35:30
Pactiv Evergreen begins trading below IPO price and sinks further,wsj,2020-09-18 08:35:30
City Skyline Views Are on Display From This Milan Duplex,wsj,2020-09-18 08:35:30
"As Winter Approaches, Caribbean Islands May Be a Lure for Both Investors and Second Home Seekers",wsj,2020-09-18 08:35:30
"Penthouse Atop a Prewar Manhattan Co-op Chops One-Third Off Its Listing Price, to $10 Million",wsj,2020-09-18 08:35:30
Tom Ford to Release Luxury Watch Made From Ocean Plastic,wsj,2020-09-18 08:35:30
Good Company: Luxie Is Changing the Beauty Industry One Brush at a Time,wsj,2020-09-18 08:35:30
Passing Values Through Generations With Family Legacy Trusts,wsj,2020-09-18 08:35:30
How the Secure Act Could Affect Retirement Savers,wsj,2020-09-18 08:35:30
The Game Plan: Their Small Business Has Done OK in the Pandemic. Now What?,wsj,2020-09-18 08:35:30
Amending a Tax Return Just Got a Lot Easier,wsj,2020-09-18 08:35:30
Get Ready for an Election Crisis,wsj,2020-09-18 08:35:30
Bill Barr’s Prosecutorial Warning,wsj,2020-09-18 08:35:30
From Russia (to Biden) With Love,wsj,2020-09-18 08:35:30
Nalvany Supporters Say They Found Traces of Novichok in Hotel Room,wsj,2020-09-18 08:35:30
Biden Takes Aim at Trump on Social Security,wsj,2020-09-18 08:35:30
Some Covid-19 Survivors Grapple With Large Medical Bills ,wsj,2020-09-18 08:35:30
Anthony Fauci on What It Will Take to Put Covid-19 Behind Us,wsj,2020-09-18 08:35:30
"Disney’s ‘Mulan,’ Tailored for Chinese Audience, Struggles to Connect ",wsj,2020-09-18 08:35:30
iOS 14: 14 Tips for Apple’s New iPhone Operating System,wsj,2020-09-18 08:35:30
The Rise of TikTok: From Chinese App to Global Sensation,wsj,2020-09-18 08:35:30
Storm Sally Leaves Trail of Destruction Across Gulf Coast,wsj,2020-09-18 08:35:30
"iOS 14: Your iPhone Will Look Completely Different Now, if You Want ",wsj,2020-09-18 08:35:30
Best Colleges 2021: Explore the Full WSJ/THE College Ranking List,wsj,2020-09-18 08:35:30
2021 Best Colleges in America: Harvard Leads the University Rankings,wsj,2020-09-18 08:35:30
Dr. Fauci Says ‘There Will Be an End’ to Covid-19    ,wsj,2020-09-18 08:35:30
U.S. Stocks Fall as Fed Outlook Rattles Investors    ,wsj,2020-09-18 08:35:30
The Truth: Your S&P 500 ETF Is Riskier Than You Realize,seekingalpha,2020-09-18 08:37:16
AbbVie: High Yield Dividend Anxiety,seekingalpha,2020-09-18 08:37:16
"How I'd Invest $29,998.44 Today",seekingalpha,2020-09-18 08:37:16
CVS: Value Hiding In Plain Sight,seekingalpha,2020-09-18 08:37:16
W.P. Carey: The Sustainable 6% Yield,seekingalpha,2020-09-18 08:37:16
Nvidia Pays An Arm And A Leg,seekingalpha,2020-09-18 08:37:16
Workhorse: Let's Pull In The Reins,seekingalpha,2020-09-18 08:37:16
The Mathematical Mindset,seekingalpha,2020-09-18 08:37:16
Wall Street Breakfast: Volatile Week Ends In Quad Witching Session,seekingalpha,2020-09-18 08:37:16
Cisco Systems: Undervalued Once Again,seekingalpha,2020-09-18 08:37:16
S&P 500: At A Critical Inflection Point,seekingalpha,2020-09-18 08:37:16
TikTok and WeChat downloads to be barred in U.S. starting Sunday,seekingalpha,2020-09-18 08:37:16
New restrictions across Europe as COVID-19 cases rise dramatically,seekingalpha,2020-09-18 08:37:16
Tech looks to snap back in quad witching session,seekingalpha,2020-09-18 08:37:16
Sanofi and Glaxo finalize deal in Europe to supply 300M doses of COVID-19 vaccine,seekingalpha,2020-09-18 08:37:16
Number of mortgages in active forbearance declines for fourth straight week,seekingalpha,2020-09-18 08:37:16
RBC sees Amazon's logistics network as powerful tailwind,seekingalpha,2020-09-18 08:37:16
Cassava Sciences +21% on insider purchase,seekingalpha,2020-09-18 08:37:16
Pandemic closures see restaurants hit the hardest,seekingalpha,2020-09-18 08:37:16
"Home Depot, Lowe's dip after Oppy downgrade on outlook for slowing growth",seekingalpha,2020-09-18 08:37:16
European advisory group back Pfizer's Neulasta biosimilar,seekingalpha,2020-09-18 08:37:16
"Freeport not likely to be sold at less than $30, Jefferies says in Buy rating",seekingalpha,2020-09-18 08:37:16
SunPower shines as Morgan Stanley upgrades on better margin expansion,seekingalpha,2020-09-18 08:37:16
"Revenue Growth Stocks Run Will End Soon, Look For These Types Of Companies To Buy Now",seekingalpha,2020-09-18 08:37:16
CloudMD: Massive Growth From Canadian Telehealth Player,seekingalpha,2020-09-18 08:37:16
GDX: Good Time To Take Profits On Gold Miners,seekingalpha,2020-09-18 08:37:16
"Palantir Has A Long Uphill Battle Towards Customer Acquisition, But Benefits From Stickiness And Contract Expansion",seekingalpha,2020-09-18 08:37:16
12 Years Post Lehman: Top Stocks Then And Now,seekingalpha,2020-09-18 08:37:16
BofA highlights two mid-cap banks set to gain from NYC rebound,seekingalpha,2020-09-18 08:37:16
"Luxury names look to take wallet share despite pandemic, UBS finds",seekingalpha,2020-09-18 08:37:16
"Evercore adds industrial, energy names to best small/mid-cap ideas list",seekingalpha,2020-09-18 08:37:16
Wait for rent growth to bottom on these apartment REITs - Baird,seekingalpha,2020-09-18 08:37:16
Needham highlights value drivers implying 70% upside for this ad industry player,seekingalpha,2020-09-18 08:37:16
Retirement: Preservation Of Income Is Your Best Friend,seekingalpha,2020-09-18 08:37:16
Now Let's Talk Risk,seekingalpha,2020-09-18 08:37:16
CVS: Value Hiding In Plain Sight,seekingalpha,2020-09-18 08:37:16
Identiv Inc (INVE) Investor Presentation - Slideshow,seekingalpha,2020-09-18 08:37:16
InfuSystem Holdings Inc (INFU) Investor Presentation - Slideshow,seekingalpha,2020-09-18 08:37:16
CVS: Value Hiding In Plain Sight,seekingalpha,2020-09-18 08:37:16
South State: Long-Term Profitability Runway And A Solid Credit Outlook Should Boost Shares,seekingalpha,2020-09-18 08:37:16
"Citigroup: The Path To A Double, Part 2",seekingalpha,2020-09-18 08:37:16
"AbbVie - Still A 20% Undervalued, High-Yielding Buy",seekingalpha,2020-09-18 08:37:16
East Asia Minerals Corporation: Big Potential In A Long-Forgotten Name,seekingalpha,2020-09-18 08:37:16
Retirement: Preservation Of Income Is Your Best Friend,seekingalpha,2020-09-18 08:37:16
Swedish Match: A Tobacco Stock With Double-Digit Growth And Returns,seekingalpha,2020-09-18 08:37:16
10% Yields With One Clear Winner From Chimera,seekingalpha,2020-09-18 08:37:16
Balfour Beatty: Limited Upside Drivers For Now,seekingalpha,2020-09-18 08:37:16
W.P. Carey: The Sustainable 6% Yield,seekingalpha,2020-09-18 08:37:16
Best CEF Deals At The Moment Part II: August 2020,seekingalpha,2020-09-18 08:37:16
A Closer Look At WisdomTree MidCap Dividend ETF,seekingalpha,2020-09-18 08:37:16
"VWO: Emerging Markets Offer Diversification, But Not As Much As You Might Think",seekingalpha,2020-09-18 08:37:16
ProShares Short QQQ ETF: A Timely Trade Idea,seekingalpha,2020-09-18 08:37:16
Tradeweb Exchange-Traded Funds Update - August 2020,seekingalpha,2020-09-18 08:37:16
Midstream/MLP Capex And Projects: Where's The Growth?,seekingalpha,2020-09-18 08:37:16
"When Everything Is Said And Done, More Is Said Than Done",seekingalpha,2020-09-18 08:37:16
"Iron Ore Price Falls, But Is It A Pause Before Further Rises Or The Top?",seekingalpha,2020-09-18 08:37:16
Real Retail Sales Gains Join Industrial Production In Sharp Deceleration,seekingalpha,2020-09-18 08:37:16
Why The U.S.-Canada Exchange Rate Is Moving Amid The Pandemic,seekingalpha,2020-09-18 08:37:16
US restricts Chinese apps,cnnbusiness,2020-09-18 08:39:25
The Commerce Department will ban WeChat and TikTok downloads on Sunday,cnnbusiness,2020-09-18 08:39:25
What's happening with TikTok? Here's the latest,cnnbusiness,2020-09-18 08:39:25
The hot tech IPOs just keep coming,cnnbusiness,2020-09-18 08:39:25
Brianna Keilar calls out Fox News guest's Covid-19 misinformation,cnnbusiness,2020-09-18 08:39:25
Small stocks may thrive in 2021 — no matter who wins the election,cnnbusiness,2020-09-18 08:39:25
Workers fear cyborgs will steal their jobs by 2035,cnnbusiness,2020-09-18 08:39:25
Amazon's stock is getting beat by a warehouse chain this year. And it's not Costco,cnnbusiness,2020-09-18 08:39:25
Rent the Runway is ditching its unlimited subscription,cnnbusiness,2020-09-18 08:39:25
Nintendo is discontinuing the 3DS,cnnbusiness,2020-09-18 08:39:25
Robot 'bees' could help save the world's honey bees,cnnbusiness,2020-09-18 08:39:25
"To help working parents, companies are getting creative",cnnbusiness,2020-09-18 08:39:25
The workplace lawsuits have begun,cnnbusiness,2020-09-18 08:39:25
Refi rates at 2.42% APR (15 yr). Do you qualify?,cnnbusiness,2020-09-18 08:39:25
US billionaires' fortunes have skyrocketed $845 billion since March,cnnbusiness,2020-09-18 08:39:25
Ford to build new electric F-150 at historic Dearborn site,cnnbusiness,2020-09-18 08:39:25
"Six months into the pandemic, this 128-year old shoe store is still standing",cnnbusiness,2020-09-18 08:39:25
Richard Branson's still looking for new deals,cnnbusiness,2020-09-18 08:39:25
Why 2020 is the year of the SPACs,cnnbusiness,2020-09-18 08:39:25
Snowflake had biggest software IPO ever,cnnbusiness,2020-09-18 08:39:25
Ant's IPO could be among biggest in history,cnnbusiness,2020-09-18 08:39:25
London's IPO drought is over ,cnnbusiness,2020-09-18 08:39:25
NASA astronauts have a new task: make videos of Estée Lauder products,cnnbusiness,2020-09-18 08:39:25
New show to send winner to space for 10 days,cnnbusiness,2020-09-18 08:39:25
NASA wants to buy moon rocks,cnnbusiness,2020-09-18 08:39:25
See Virgin Galactic's Under Armour spacesuits,cnnbusiness,2020-09-18 08:39:25
Colonizing Mars could be dangerous and ridiculously expensive. Elon Musk wants to do it anyway,cnnbusiness,2020-09-18 08:39:25
Watch: Apple unveils latest line-up of colorful iPads,cnnbusiness,2020-09-18 08:39:25
Nissan gives a glimpse of its first Z car in more than a decade,cnnbusiness,2020-09-18 08:39:25
See robot stacking shelves in Japan,cnnbusiness,2020-09-18 08:39:25
Here's one major issue Trump and Biden agree on,cnnbusiness,2020-09-18 08:39:25
SpaceX strapped a camera to a Falcon 9 rocket. Watch what happened,cnnbusiness,2020-09-18 08:39:25
WeWork CEO talks about its new tenants ,cnnbusiness,2020-09-18 08:39:25
N95 masks are still in hot demand. 3M is trying to answer the call,cnnbusiness,2020-09-18 08:39:25
This Shark Tank star is partnering with Lowe's to help minority-owned businesses ,cnnbusiness,2020-09-18 08:39:25
Nissan gives us an early glimpse of its first new Z sports car in over a decade,cnnbusiness,2020-09-18 08:39:25
Is this the end of WeChat in the US? It's still not clear,cnnbusiness,2020-09-18 08:39:25
TikTok and Oracle might have a deal. But Trump still needs to sign off,cnnbusiness,2020-09-18 08:39:25
A side-by-side comparison of the PlayStation 5 and the Xbox Series X,cnnbusiness,2020-09-18 08:39:25
