headline,org,date
Price: Good Friday Beckons,thestreet,2021-01-14 09:01:03
Meisler: This Indicator Is Giving Out a Curious Reading,thestreet,2021-01-14 09:01:03
"Guilfoyle: Wednesday's Woe, Biden's Plan, U.S. Dollar, J&J Vaccine, Trading Intel",thestreet,2021-01-14 09:01:03
Rev Shark: The Market Is Anticipating Another Wave of Liquidity,thestreet,2021-01-14 09:01:03
Tesla Slips on Model S and Model X Recall Demand From NHTSA,thestreet,2021-01-14 09:01:03
Johnson & Johnson Single-Shot Vaccine Safe in Trials: Report,thestreet,2021-01-14 09:01:03
Morning Bell With Jim Cramer: Buy Visa Before Travel Increases,thestreet,2021-01-14 09:01:03
NIO Day Strategies Compared With Tesla,thestreet,2021-01-14 09:01:03
Apple Earnings Preview: iPhone to Finally Boost China Revenue,thestreet,2021-01-14 09:01:03
ARK to Launch Space Exploration ETF,thestreet,2021-01-14 09:01:03
Why Did Apple Ban Parler and Should Investors Care?,thestreet,2021-01-14 09:01:03
Buying Stocks at the Top,thestreet,2021-01-14 09:01:03
Drivers of Disruption and Innovation in the PPE Space,thestreet,2021-01-14 09:01:03
Sectors Driving Disruption in the PPE Market,thestreet,2021-01-14 09:01:03
How Major Companies Played a Role in PPE Manufacturing,thestreet,2021-01-14 09:01:03
Answering Client Questions About Investing in Gold,thestreet,2021-01-14 09:01:03
PPP Forgiveness: What Business Owners Need to Know,thestreet,2021-01-14 09:01:03
For Financial Advisers: Business Trends to Watch in 2021,thestreet,2021-01-14 09:01:03
Tips to Reduce Self-Employment Taxes,thestreet,2021-01-14 09:01:03
The Difference Between a 1099 and a W-2 Tax Form,thestreet,2021-01-14 09:01:03
Who Can I Claim as a Tax Dependent?,thestreet,2021-01-14 09:01:03
Jim Cramer: GameStop's Run Is 'Game Over' for the Shorts,thestreet,2021-01-14 09:01:03
"Why Jim Cramer Says Marvell, Not Qualcomm, Is 5G Stock to Watch",thestreet,2021-01-14 09:01:03
What Worries Jim Cramer a Week After Violence on Capitol Hill,thestreet,2021-01-14 09:01:03
What Does CEO Change Mean For Intel? Jim Cramer Talks Path Forward,thestreet,2021-01-14 09:01:03
Winklevoss Twins Mull Public Listing for Bitcoin Exchange,thestreet,2021-01-14 09:01:03
Signet Jewelers Up as Sales Estimate Beats Expectations,thestreet,2021-01-14 09:01:03
"Delta, Virgin Galactic, Plug Power - Thursday's Premarket Movers",thestreet,2021-01-14 09:01:03
The Best Cities for Snowbirds (of All Ages),thestreet,2021-01-14 09:01:03
Tips to Reduce Self-Employment Taxes,thestreet,2021-01-14 09:01:03
The Difference Between a 1099 and a W-2 Tax Form,thestreet,2021-01-14 09:01:03
9 Ways to Save on Your Homeowners Insurance,thestreet,2021-01-14 09:01:03
"TSMC Boosts Q1 Revenue Forecast, Apple Supplier Sees Surging Global Chip Demand",thestreet,2021-01-14 09:01:03
Try a One-Month Spending Freeze—How to Do It,thestreet,2021-01-14 09:01:03
"Dow Futures Climb on Reports Of $2 Trillion Biden Stimulus, China Trade Data; Weekly Jobless Claims Jump to 965,000",thestreet,2021-01-14 09:01:03
Engines of Innovation: Cramer's 'Mad Money' Recap (Wednesday 1/13/21),thestreet,2021-01-14 09:01:03
CES 2021: Top Concept Products from Flying Cars to Rollable Phones,thestreet,2021-01-14 09:01:03
Stocks End Flat as House Votes to Impeach Trump; Intel Leads Tech,thestreet,2021-01-14 09:01:03
House Votes to Impeach President Trump for the Second Time,thestreet,2021-01-14 09:01:03
House Votes to Impeach President Trump: Here's What Impeachment Means,thestreet,2021-01-14 09:01:03
"GameStop, Intel, Hexo: 5 Top Stock Gainers for Wednesday",thestreet,2021-01-14 09:01:03
Exxon Mobil Upgraded as J.P. Morgan Says Estimates Too Low,thestreet,2021-01-14 09:01:03
Party City Falls on Weak Q4 Preliminary Results,thestreet,2021-01-14 09:01:03
How to Trade Delta Air Lines After Earnings Report,thestreet,2021-01-14 09:01:03
Jim Cramer: GameStop's Run Is 'Game Over' for the Shorts,thestreet,2021-01-14 09:01:03
9 Ways to Save on Your Homeowners Insurance,thestreet,2021-01-14 09:01:03
"Twitter CEO says banning Trump was not a decision to ""celebrate,"" but an action with ""real and significant ramifications""",googlenews,2021-01-14 09:02:58
"Delta halves cash burn in the fourth quarter, narrows losses to cap worst year ever",googlenews,2021-01-14 09:02:58
"Dow Futures Climb on Reports Of $2 Trillion Biden Stimulus, China Trade Data; Weekly Jobless Claims in Focus",googlenews,2021-01-14 09:02:58
New rule could force banks to lend to oil companies,googlenews,2021-01-14 09:02:58
$1 million Powerball lottery tickets sold in Michigan; jackpot grows to $640 million,googlenews,2021-01-14 09:02:58
Parler CEO says social media app may not return,googlenews,2021-01-14 09:02:58
"Moderna needs at least 3,000 adolescent volunteers for its COVID-19 vaccine trial. They're struggling to find them.",googlenews,2021-01-14 09:02:58
Goldman Sachs says the S&P 500 will rise 14% in 2021. Here's the road map,googlenews,2021-01-14 09:02:58
A guide to the new COVID-19 testing rules for travel to the US,googlenews,2021-01-14 09:02:58
"Intel CEO Resigns, B560 RAM Unlocked, 11900K Specs, & Chipset Differences (B560, H570, Z590)",googlenews,2021-01-14 09:02:58
China is winning the trade war and its exports have never been higher,googlenews,2021-01-14 09:02:58
Is China changing its strategy towards decoupling from the world economy? | DW News,googlenews,2021-01-14 09:02:58
"La Puente shooting: 5-year-old boy wounded, search for gunman underway",googlenews,2021-01-14 09:02:58
Treasury yields turn flat after worse-than-expected jobless claims,googlenews,2021-01-14 09:02:58
Is a new rally brewing as Bitcoin reclaims $38K and stablecoins 'flooding' exchanges?,googlenews,2021-01-14 09:02:58
"Norwegian Air Ends Long Haul Flights, Dumps 787",googlenews,2021-01-14 09:02:58
Costco is shutting down all of its photo centers,googlenews,2021-01-14 09:02:58
"TSMC logs highest quarterly profit, sees record revenue and capital spending",googlenews,2021-01-14 09:02:58
"NHTSA wants Tesla to recall 158,000 Tegra 3-equipped vehicles",googlenews,2021-01-14 09:02:58
Stable Road Acquisition joins space names running higher as Ark Investment plans Space ETF,googlenews,2021-01-14 09:02:58
Johnson & Johnson Single-Shot Vaccine Safe in Trials: Report,googlenews,2021-01-14 09:02:58
WATCH: Girl Scout has irresistible cookie sales pitch for neighbor via doorbell cam,googlenews,2021-01-14 09:02:58
"Johnson & Johnson's one-dose COVID-19 vaccine is safe, early trial shows",googlenews,2021-01-14 09:02:58
Moderna CEO says the world will have to live with Covid 'forever',googlenews,2021-01-14 09:02:58
Bank earnings to outline optimism for economic recovery in 2021,googlenews,2021-01-14 09:02:58
CEO of world's largest money manager sees stocks rallying in 2021 but not as much as last year,googlenews,2021-01-14 09:02:58
Germany's economy contracted by 5% in 2020 as coronavirus lockdowns hit growth,googlenews,2021-01-14 09:02:58
Fintech Lender Affirm IPO Nearly Doubles on Its First Day of Trading,googlenews,2021-01-14 09:02:58
Programmer has two password guesses left before losing $266M in Bitcoin,googlenews,2021-01-14 09:02:58
Multiple dog foods recalled after 70 dogs died due to suspected poisoning - Business Insider,googlenews,2021-01-14 09:02:58
Global Business News: Live Market Updates,googlenews,2021-01-14 09:02:58
FuelCell Energy (FCEL) Outpaces Stock Market Gains: What You Should Know,googlenews,2021-01-14 09:02:58
$100B in PPP loans forgiven: SBA | TheHill,googlenews,2021-01-14 09:02:58
Circle K's owners offer $20 billion for France's biggest retailer,googlenews,2021-01-14 09:02:58
Pharmacist accused of spoiling vaccine has license suspended,googlenews,2021-01-14 09:02:58
Bonds slip as markets bet Biden goes big,googlenews,2021-01-14 09:02:58
Judge rules in favor of some orange zone restaurants suing state,googlenews,2021-01-14 09:02:58
"Trump Is Impeached Again, Faces Senate Trial on Capitol Riot",googlenews,2021-01-14 09:02:58
All the smart home products at CES 2021,googlenews,2021-01-14 09:02:58
Okta CEO says Parler was 'not even trying' to suppress terrorist threats,googlenews,2021-01-14 09:02:58
"Chobani to debut a line of cold brew coffee drinks, expanding further beyond yogurt",googlenews,2021-01-14 09:02:58
Royal Caribbean will launch cruises from Barbados for the first time,googlenews,2021-01-14 09:02:58
Fed survey finds economy slowing in some areas of country,googlenews,2021-01-14 09:02:58
Proof-of-Work and Yield Farming: Binance and Poolin Launch Tokens Backed by Bitcoin Hashrate,googlenews,2021-01-14 09:02:58
How Sheldon Adelson’s Death Could Affect the GOP's Future,googlenews,2021-01-14 09:02:58
Trump administration tries to hamstring Biden on student loan forgiveness,googlenews,2021-01-14 09:02:58
"Qualcomm will acquire Nuvia, server CPU maker led by ex-Apple chip architect",googlenews,2021-01-14 09:02:58
Nordstrom shares drop as retailer says holiday sales tumbled 22%,googlenews,2021-01-14 09:02:58
One of Boeing's Most Important Customers Says 777X Debut Could Slip Beyond 2022,googlenews,2021-01-14 09:02:58
Apple’s first major racial equity investments include a Detroit developer center and HBCU tech hub,googlenews,2021-01-14 09:02:58
United Airlines delays hotly anticipated return to New York-JFK,googlenews,2021-01-14 09:02:58
Siemens spin-offs to develop offshore wind turbines that produce green hydrogen – Reuters,googlenews,2021-01-14 09:02:58
J&J One-Shot Vaccine Grants Lasting Response in Early Study,googlenews,2021-01-14 09:02:58
"Trump scraps plan to ban China’s Alibaba, Tencent, Baidu: Sources",googlenews,2021-01-14 09:02:58
"Here are the 10 best places to work in 2021, according to employees",googlenews,2021-01-14 09:02:58
WRAPUP 1-Gasoline pushes U.S. consumer prices higher in December,googlenews,2021-01-14 09:02:58
LNG Price Boom Obliterates Rally In Bitcoin,googlenews,2021-01-14 09:02:58
"A Last-Mile EV Delivery Van, Flying Cadillac Car Sends GM's Stock To New Highs",googlenews,2021-01-14 09:02:58
Facebook and other tech giants could soon face a flood of court cases in Europe over data privacy,googlenews,2021-01-14 09:02:58
Period tracking app settles charges it lied to users about privacy,googlenews,2021-01-14 09:02:58
Operation Warp Speed's Slaoui says he submitted resignation at Biden's request,googlenews,2021-01-14 09:02:58
TikTok Overhauls The Way Teens Can Share Content,googlenews,2021-01-14 09:02:58
Lagarde Blasts Bitcoin’s Role in Facilitating Money Laundering,googlenews,2021-01-14 09:02:58
"Petco IPO’s Exceeds Expectations, Raising $864 Million",googlenews,2021-01-14 09:02:58
Apple announces first-of-its-kind educational hub in Atlanta for HBCU community,googlenews,2021-01-14 09:02:58
Google to pause U.S. political ads ahead of presidential inauguration,googlenews,2021-01-14 09:02:58
"More Trust in Business Than in Government and Media, Survey Finds",googlenews,2021-01-14 09:02:58
Gold closes fractionally higher amidst dollar strength and higher US treasury yields,googlenews,2021-01-14 09:02:58
"Dropbox will lay off 315 employees, COO to step down",googlenews,2021-01-14 09:02:58
"Pfizer Inc. stock falls Wednesday, underperforms market",googlenews,2021-01-14 09:02:58
Twitter CEO Jack Dorsey speaks out on banning Trump,googlenews,2021-01-14 09:02:58
"Twitter CEO Jack Dorsey defends Trump ban, but admits company's power sets 'dangerous' precedent",googlenews,2021-01-14 09:02:58
Trump and Twitter,googlenews,2021-01-14 09:02:58
Twitter Doubles Down on Decision to Ban Donald Trump by Matt Vespa,googlenews,2021-01-14 09:02:58
"Delta posts steep quarterly, annual earnings loss; COVID-19 caps 'toughest year' in company history",googlenews,2021-01-14 09:02:58
Delta Air Lines Announces December Quarter and Full Year 2020 Financial Results,googlenews,2021-01-14 09:02:58
"5 Stocks To Watch For January 14, 2021",googlenews,2021-01-14 09:02:58
Delta Air Lines posts record loss of $12.4 billion in 2020,googlenews,2021-01-14 09:02:58
Stock Futures Creep Up Ahead of Biden’s Stimulus Speech,googlenews,2021-01-14 09:02:58
"Dow futures hold higher, even as weekly jobless claims come in at highest since late August",googlenews,2021-01-14 09:02:58
"Dow, S&P futures perk up with eye on Biden's stimulus plan",googlenews,2021-01-14 09:02:58
"Stock market live updates: Dow futures rise, awaiting Biden stimulus plan, GameStop pops another 20%",googlenews,2021-01-14 09:02:58
Wall Street Fumes Over Last-Minute Rule From Trump Bank Watchdog,googlenews,2021-01-14 09:02:58
"In a first for the crypto industry, Visa-backed Anchorage gets a federal bank charter",googlenews,2021-01-14 09:02:58
Fintechs that get bank charters should be subject to CRA. Period.,googlenews,2021-01-14 09:02:58
"Financial Censorship After Capitol Riot 'Truly Chilling,' Says OCC's Brooks - CoinDesk",googlenews,2021-01-14 09:02:58
Powerball lottery numbers drawn as jackpot tops $550M,googlenews,2021-01-14 09:02:58
Powerball jackpot hits $640M as Mega Millions grows to $750M,googlenews,2021-01-14 09:02:58
No winners of Powerball and Mega Millions drawings push both jackpots to more than $600 million each,googlenews,2021-01-14 09:02:58
"Mt. Pleasant Mega Millions player wins $20,000 in Tuesday night drawing",googlenews,2021-01-14 09:02:58
Parler's CEO says the app may shut down permanently after getting booted from Amazon Web Services,googlenews,2021-01-14 09:02:58
Parler CEO admits Pro-Trump Social Media Platform May Never Come Back Online,googlenews,2021-01-14 09:02:58
Parler CEO says social media app may never return as Amazon calls platform's lawsuit meritless,googlenews,2021-01-14 09:02:58
"Slack dropped Parler as customer, Parler CEO claims in AWS lawsuit - Business Insider",googlenews,2021-01-14 09:02:58
"Pfizer, CDC probing death of Florida doctor who took COVID-19 vaccine",googlenews,2021-01-14 09:02:58
Here's how some of the leading coronavirus vaccines work,googlenews,2021-01-14 09:02:58
Vaccine administration is much harder than it seems,googlenews,2021-01-14 09:02:58
Opinion | Biden Should Boost Covid Vaccine Supply With New Manufacturing Plan,googlenews,2021-01-14 09:02:58
CDC to require COVID-19 tests for all air passengers entering US l GMA,googlenews,2021-01-14 09:02:58
Travellers warned of no entry in England without negative COVID-19 test,googlenews,2021-01-14 09:02:58
Is this the end of the international weekend trip?,googlenews,2021-01-14 09:02:58
"New CDC rule requires all people flying to U.S. get COVID test, negative result before getting on plane",googlenews,2021-01-14 09:02:58
"Intel CEO Bob Swan to step down, VMware CEO Pat Gelsinger to replace him",googlenews,2021-01-14 09:02:58
Intel Ousts CEO Bob Swan,googlenews,2021-01-14 09:02:58
Intel New CEO Pat Gelsinger Gives Turnaround a Fighting Chance,googlenews,2021-01-14 09:02:58
Can Pat Gelsinger get Intel back on track?,googlenews,2021-01-14 09:02:58
China Ends 2020 With Record Trade Surplus as Pandemic Goods Soar,googlenews,2021-01-14 09:02:58
"China Exports Boom to Record Year, While Covid-19 Ravages Global Economy",googlenews,2021-01-14 09:02:58
China's 2020 meat imports nearly at 10 million tonnes,googlenews,2021-01-14 09:02:58
AUD/USD retains bid tone after China reports above-forecast exports,googlenews,2021-01-14 09:02:58
Dollar holds gains as expectations for Biden's stimulus grow,googlenews,2021-01-14 09:02:58
Dollar nears 3-week high ahead of Biden's stimulus plans,googlenews,2021-01-14 09:02:58
Gold on back foot ahead of Biden's U.S. stimulus plan,googlenews,2021-01-14 09:02:58
Rising Yields Approach Trigger Point That Risks Upsetting Stocks,googlenews,2021-01-14 09:02:58
Analysts Are Gloomy About Bitcoin's Short-Term Price Outlook Right Now - CoinDesk,googlenews,2021-01-14 09:02:58
Is Bitcoin Boom a 'Better Gold' or Just Another Bubble?,googlenews,2021-01-14 09:02:58
What's wrong with Bitcoin?,googlenews,2021-01-14 09:02:58
Explained: Storing Cryptocurrency,googlenews,2021-01-14 09:02:58
"Gatwick: Norwegian axes 1,000 jobs at airport in long haul cuts",googlenews,2021-01-14 09:02:58
"Norwegian Air abandons long-haul flights, ending its $100 travel between the US and Europe",googlenews,2021-01-14 09:02:58
Norwegian Air to axe long-haul operations in bid to survive,googlenews,2021-01-14 09:02:58
No More Cheap Transatlantic Hops – Norwegian Moves To Short Haul,googlenews,2021-01-14 09:02:58
"TSM Stock Rises As Q4 Earnings, Outlook Beat Views",googlenews,2021-01-14 09:02:58
"TSMC fourth quarter profit rises 23% to record high on work-from-home, iPhone boost",googlenews,2021-01-14 09:02:58
"As Chip Rivals Struggle, TSMC Moves In for the Kill",googlenews,2021-01-14 09:02:58
"TSMC's Q4 profit rises 23%, beats market estimates",googlenews,2021-01-14 09:02:58
"U.S. vehicle safety agency asks Tesla to recall 158,716 older vehicles over touchscreen glitches",googlenews,2021-01-14 09:02:58
"Feds ask Tesla to recall 158,000 vehicles over failing touchscreen displays",googlenews,2021-01-14 09:02:58
"Tesla asked to recall 158,000 cars for failing displays",googlenews,2021-01-14 09:02:58
"Tesla asked by federal regulator to voluntarily recall 158,000 vehicles over safety-functions-related defect",googlenews,2021-01-14 09:02:58
Cathie Wood's ARK Invest plans 'ARKX' space exploration ETF to tap the growing industry,googlenews,2021-01-14 09:02:58
Cathie Wood Plans to Start Space ETF After Dominating With ARKK,googlenews,2021-01-14 09:02:58
Virgin Galactic jumps after ARK files to launch space exploration ETF,googlenews,2021-01-14 09:02:58
SPCE Stock: What to Know about Virgin Galactic and the ARKX ETF,googlenews,2021-01-14 09:02:58
India to kick off one of the world's largest Covid vaccination drives this weekend,googlenews,2021-01-14 09:02:58
Delays overshadow Johnson & Johnson vaccine's long-lasting potential,googlenews,2021-01-14 09:02:58
Vaccines expected to begin rolling out to Arizona assisted-living facilities on Monday,googlenews,2021-01-14 09:02:58
Memphis Dollar General stores offering pay to employees to get vaccinated,googlenews,2021-01-14 09:02:58
You Can Your Get Girl Scout Cookies Delivered by Grub Hub,googlenews,2021-01-14 09:02:58
Girl Scouts troop skips selling cookies over palm oil investigation,googlenews,2021-01-14 09:02:58
Girl scout cookies return Feb. 1!,googlenews,2021-01-14 09:02:58
LA area Girl Scouts get creative to sell your favorite treats during coronavirus pandemic,googlenews,2021-01-14 09:02:58
US on track for herd immunity by summer,googlenews,2021-01-14 09:02:58
Moderna CEO warns the coronavirus is 'not going away' | TheHill,googlenews,2021-01-14 09:02:58
The Pharma Industry Expects Covid-19 To Be Around For The Long Haul,googlenews,2021-01-14 09:02:58
Moderna CEO: We will have to live with COVID-19 ‘forever’,googlenews,2021-01-14 09:02:58
Here's Why Wells Fargo Stock Could Finally Be Ready to Soar,googlenews,2021-01-14 09:02:58
"JPMorgan, Wells Fargo & Citigroup may kick off a banner earnings season",googlenews,2021-01-14 09:02:58
Wells Fargo CEO to unveil cost-cutting plan,googlenews,2021-01-14 09:02:58
Could This Make Wells Fargo Stock Outperform in 2021?,googlenews,2021-01-14 09:02:58
BlackRock posts EPS and revenue beats for Q4,googlenews,2021-01-14 09:02:58
BlackRock assets surge to record $8.68tn,googlenews,2021-01-14 09:02:58
"BlackRock profit, revenue beat estimates as assets surge to record of nearly $8.7 trillion",googlenews,2021-01-14 09:02:58
BlackRock CEO Larry Fink: Stocks will rally in 2021 but not as much as last year,googlenews,2021-01-14 09:02:58
German economy contracted 5.0% in 2020 on pandemic,googlenews,2021-01-14 09:02:58
German economy shrank by 5% in 2020,googlenews,2021-01-14 09:02:58
"German Economy Stalls, Probably Evading Double-Dip Recession",googlenews,2021-01-14 09:02:58
German economy braces for second wave impact,googlenews,2021-01-14 09:02:58
Max Levchin's Affirm pops nearly 100% in market debut,googlenews,2021-01-14 09:02:58
Lender Affirm soars in public debut: Here's how the stock is doing,googlenews,2021-01-14 09:02:58
"Covid Retail Shifts Are Here to Stay, Max Levchin Says",googlenews,2021-01-14 09:02:58
"Shopify just made a $2 billion windfall on Affirm IPO, six months after their partnership",googlenews,2021-01-14 09:02:58
San Francisco man who can't remember Bitcoin password says he's 'made peace' with $220 million loss,googlenews,2021-01-14 09:02:58
"Programmer Has $240 Million of Bitcoin Locked on a Hard Drive, and Only 2 Password Guesses Left to Access It - IGN",googlenews,2021-01-14 09:02:58
Ex-Ripple CTO Can't Remember Password to Access $240M in Bitcoin - CoinDesk,googlenews,2021-01-14 09:02:58
SF man who can't remember Bitcoin password says he's 'made peace' with $220M loss,googlenews,2021-01-14 09:02:58
Pet Food Company Expanding Recall For Some Sportmix Products,googlenews,2021-01-14 09:02:58
Pet Food Recall is Expanded After 70 Dogs Die,googlenews,2021-01-14 09:02:58
US pet food recalled after 70 dogs die and others fall sick,googlenews,2021-01-14 09:02:58
Pet food recall issued for product shipped to New Mexico,googlenews,2021-01-14 09:02:58
"Top Stock Picks for Week of January 11, 2021",googlenews,2021-01-14 09:02:58
5 Stocks to Buy at Deep Discount to Gain From Market Rally,googlenews,2021-01-14 09:02:58
Will UPS (UPS) Beat Estimates Again in Its Next Earnings Report?,googlenews,2021-01-14 09:02:58
3 Biotech Stocks Poised to Outperform Amid Coronavirus Pandemic,googlenews,2021-01-14 09:02:58
Hotel Lawyer on PPP2 and the COVID Relief Bill's changes to Paycheck Protection Program | By Jim Butler,googlenews,2021-01-14 09:02:58
Small businesses prepare to apply for second round of PPP loans,googlenews,2021-01-14 09:02:58
More Businesses Will be Able to Apply for P.P.P. Loans Next Week,googlenews,2021-01-14 09:02:58
"Hurting long before COVID-19, failing companies took stimulus money then closed anyway",googlenews,2021-01-14 09:02:58
France Opposes Couche-Tard's Carrefour Bid,googlenews,2021-01-14 09:02:58
Investors question Couche-Tard's bid for Carrefour as food retail not an expertise: Analyst,googlenews,2021-01-14 09:02:58
Couche-Tard/Carrefour: what a hoot,googlenews,2021-01-14 09:02:58
Carrefour shares leap on Couche-Tard merger talks,googlenews,2021-01-14 09:02:58
Dow futures rise 100 points ahead of Biden stimulus package unveiling,googlenews,2021-01-14 09:02:58
"Nasdaq, S&P rise as House readies 2nd Trump impeachment",googlenews,2021-01-14 09:02:58
"Dow Jones Industrial Average Slipped, but Big Tech Stocks Powered Higher",googlenews,2021-01-14 09:02:58
US STOCKS-S&P closes higher with defensive sectors leading gains,googlenews,2021-01-14 09:02:58
"In Buffalo, restaurants win ruling against Cuomo’s orange zone rules",googlenews,2021-01-14 09:02:58
Officials continue to clear up confusion with vaccine rollout,googlenews,2021-01-14 09:02:58
Restaurants suing NYS land win in court,googlenews,2021-01-14 09:02:58
Poloncarz says 10 fans were removed from Colts game at Bills Stadium for not wearing masks,googlenews,2021-01-14 09:02:58
YouTube is suspending Trump's channel,googlenews,2021-01-14 09:02:58
Vice President Pence says he opposes removing President Trump with the 25th Amendment,googlenews,2021-01-14 09:02:58
Aurora Police investigate two attempted child abductions,googlenews,2021-01-14 09:02:58
Clyburn calls for Trump to be barred from holding future office,googlenews,2021-01-14 09:02:58
"CES 2021: From Toilets to Coffee Tables, the Best Smart-Home Gadgets Hide the Tech",googlenews,2021-01-14 09:02:58
All the smart kitchen tech from CES 2021,googlenews,2021-01-14 09:02:58
"Amazon responds to Parler lawsuit, cites violent content, Section 230 - Business Insider",googlenews,2021-01-14 09:02:58
Amazon says it repeatedly warned Parler about death threat posts,googlenews,2021-01-14 09:02:58
"Amazon hits back at Parler lawsuit, claims 'unwillingness and inability' to remove violent content",googlenews,2021-01-14 09:02:58
Reuters: What is Parler and why has it been pulled offline? | KyivPost - Ukraine's Global Voice,googlenews,2021-01-14 09:02:58
Disney Cruise Line extends suspension over COVID-19 pandemic,googlenews,2021-01-14 09:02:58
Royal Caribbean's Grandeur of the Seas Has a New Homeport,googlenews,2021-01-14 09:02:58
Royal Caribbean suspends sailings through April,googlenews,2021-01-14 09:02:58
Grand Cayman Says Cruise Ships Unlikely To Return in 2021,googlenews,2021-01-14 09:02:58
Fed's first Beige Book of 2021: Economic activity increased modestly,googlenews,2021-01-14 09:02:58
"U.S. Economy Saw Modest Growth in Late 2020, Fed’s Beige Book Shows",googlenews,2021-01-14 09:02:58
"US economy gets boost but unemployment, lockdowns sap recovery",googlenews,2021-01-14 09:02:58
Fed’s Beige Book Shows Modest U.S. Recovery as Job Growth Slows,googlenews,2021-01-14 09:02:58
Bitcoin in Race for Adoption Before Central Banks Launch Digital Currencies: Australia's Macquarie,googlenews,2021-01-14 09:02:58
Dow narrowly avoids setting new record as investors eye Trump impeachment vote,googlenews,2021-01-14 09:02:58
Indian Doctors Warn of Illegal Covid-19 Vaccine Sales for Bitcoin: Citizens Urged to Wait for Government Approved Vaccine | Emerging Markets,googlenews,2021-01-14 09:02:58
Bitcoin Miner Marathon to Raise $250M in Direct Stock Offering,googlenews,2021-01-14 09:02:58
"Sheldon Adelson, casino mogul and GOP kingmaker, dies",googlenews,2021-01-14 09:02:58
"Sheldon Adelson’s Death Won’t Derail Las Vegas Sands, Wall Street Analysts Say",googlenews,2021-01-14 09:02:58
Tributes for Sheldon Adelson continue in Las Vegas,googlenews,2021-01-14 09:02:58
Sheldon Adelson's Business Will Cope Without Him,googlenews,2021-01-14 09:02:58
Biden to extend pause on federal student loan payments,googlenews,2021-01-14 09:02:58
Biden will extend payment pause for student loan borrowers. Yet timeline remains unclear,googlenews,2021-01-14 09:02:58
What happens if Biden’s student loan forgiveness plan passes?,googlenews,2021-01-14 09:02:58
