headline,org,date
"Federal inquiries, allegations of sexual assault, a resignation, and billions on the line: Here's everything you need to know about Nikola and its founder's controversial last 5 weeks",msnmoney,2020-10-18 08:34:03
Retirement scams to watch out for,msnmoney,2020-10-18 08:34:03
Legendary Investor Reacts to Recent Gold Moves With Massive Prediction,msnmoney,2020-10-18 08:34:03
These Are All the States With Trump Properties and Businesses,msnmoney,2020-10-18 08:34:03
I joined Costco. Here's what I wasn't expecting,msnmoney,2020-10-18 08:34:03
"Man Who Predicted 2020 Crash Says ""Now Is The Time""",msnmoney,2020-10-18 08:34:03
Wall Street’s top analysts are betting on stocks like Apple and Snap this earnings season,msnmoney,2020-10-18 08:34:03
Things real estate agents don't want you to know,msnmoney,2020-10-18 08:34:03
15 Jobs That Look Drastically Different as the Economy Reopens,msnmoney,2020-10-18 08:34:03
"39 Hottest Gifts Of 2020 (Hurry, These Will Be Gone Very Soon)",msnmoney,2020-10-18 08:34:03
18 things to do if you want to retire early,msnmoney,2020-10-18 08:34:03
Old Man's Neighbor Blocks His Driveway With Cinder Blocks So He Teaches Him A Cruel Lesson,msnmoney,2020-10-18 08:34:03
U.K.’s G4S Continues to Reject GardaWorld Terms for Takeover,msnmoney,2020-10-18 08:34:03
10 ways to DIY your next stimulus check (and forget Congress),msnmoney,2020-10-18 08:34:03
5 Things You Should Know About a Real Estate Market Before Buying a Home,msnmoney,2020-10-18 08:34:03
T-Mobile and Sprint — and 5 Other Surprising Company Mergers During COVID-19,msnmoney,2020-10-18 08:34:03
‘Made in Iran’ Thrives in Economy Trump Tried to Crush,msnmoney,2020-10-18 08:34:03
This $99 Drone Might Be The Most Amazing Invention of 2020,msnmoney,2020-10-18 08:34:03
Use it or lose it: What to buy with your FSA money,msnmoney,2020-10-18 08:34:03
"Mortgage rates slide to new low, but borrowers miss the memo",msnmoney,2020-10-18 08:34:03
The most disastrous product launches ever,msnmoney,2020-10-18 08:34:03
Opinion: Value stocks are poised to crush growth stocks after the presidential election,msnmoney,2020-10-18 08:34:03
These 47 Billionaires Got Richer During The Pandemic,msnmoney,2020-10-18 08:34:03
"[Photos] Mom Left Him Alone with Dog for Seconds, Then This Happened",msnmoney,2020-10-18 08:34:03
Want $365 More a Month From Social Security? Here's How to Get It,msnmoney,2020-10-18 08:34:03
Major Companies Going Bankrupt in 2020,msnmoney,2020-10-18 08:34:03
Opinion: Don’t just default to the S&P 500: Consider this simple four-fund portfolio,msnmoney,2020-10-18 08:34:03
All the ways parents waste money on kids,msnmoney,2020-10-18 08:34:03
German Economy Minister Against Nationalization of Thyssenkrupp,msnmoney,2020-10-18 08:34:03
Seniors On Medicare Are Getting a Big Pay Day,msnmoney,2020-10-18 08:34:03
Secrets to help retirees save money,msnmoney,2020-10-18 08:34:03
This couple created their own tiny house island,msnmoney,2020-10-18 08:34:03
I shopped at Aldi for the first time. Here's what surprised me,msnmoney,2020-10-18 08:34:03
Earnings season is highlighting the uneven playing field in the year of the pandemic,msnmoney,2020-10-18 08:34:03
Facts about apples that will take you by surprise,msnmoney,2020-10-18 08:34:03
New Car Gadget Magically Removes Scratches & Dents,msnmoney,2020-10-18 08:34:03
4 Types of Remote Jobs You Can Land Quickly,msnmoney,2020-10-18 08:34:03
"If You Invested $5,000 in These Stocks During the Crash in March, You’d Be Rich",msnmoney,2020-10-18 08:34:03
Atlantia Set to Sell $1.2 Billion Stake in Telepass Unit,msnmoney,2020-10-18 08:34:03
"22 safe and reliable used cars you can get for under $15,000",msnmoney,2020-10-18 08:34:03
What Investors Can Learn From 'Windy City Rehab',msnmoney,2020-10-18 08:34:03
How to buy Apple devices without paying Apple prices,msnmoney,2020-10-18 08:34:03
The Best and Worst State Capitals To Live In,msnmoney,2020-10-18 08:34:03
iPhone price wars are back as carriers compete for 5G customers,msnmoney,2020-10-18 08:34:03
Reasons you shouldn't buy a house,msnmoney,2020-10-18 08:34:03
22 cliffhanging homes with unbelievable views,msnmoney,2020-10-18 08:34:03
These senior discounts will stretch your retirement savings,msnmoney,2020-10-18 08:34:03
[Photos] Jackie Kennedy's Granddaughter Is A Billionaire,msnmoney,2020-10-18 08:34:03
Warren Buffett plowed $5 billion into Bank of America during the debt crisis. Here's the story of how the investor helped the bank and made a fortune in the process.,msnmoney,2020-10-18 08:34:03
28 Most Luxurious Celebrity Cars in the World,msnmoney,2020-10-18 08:34:03
Maybe Apple Isn’t as Green as It Claims,msnmoney,2020-10-18 08:34:03
People in these states use debt the least,msnmoney,2020-10-18 08:34:03
Bringing the outside into the office: Coronavirus bolsters push towards healthier building design,msnmoney,2020-10-18 08:34:03
1 Simple Trick to Cut Your Electric Bill by 90%,msnmoney,2020-10-18 08:34:03
The Redskins and 18 More Offensive Logos That Came Under Fire,msnmoney,2020-10-18 08:34:03
Alcoa Investors Focus on the Future With Green Dominating Agenda,msnmoney,2020-10-18 08:34:03
15 Unexpected Things We’ve Been Buying More of Since the Coronavirus Crisis Hit,msnmoney,2020-10-18 08:34:03
3 Investing Moves to Make by the End of 2020,msnmoney,2020-10-18 08:34:03
Here’s the Highest-Paid Job in Your State — Excluding Doctors,msnmoney,2020-10-18 08:34:03
Starboard looks to keep its great track record going in the chip industry,msnmoney,2020-10-18 08:34:03
Unseen Photographs Expose A Different Side To Infamous Nightclub,msnmoney,2020-10-18 08:34:03
7 Small-Cap Tech Stocks That Pack a Punch,msnmoney,2020-10-18 08:34:03
Are you bad with money? How to know & what to do,msnmoney,2020-10-18 08:34:03
21 Purchases You Should Never Skimp On,msnmoney,2020-10-18 08:34:03
"Biden Won’t Ban Fracking, But His Clean Grid Would Choke Gas",msnmoney,2020-10-18 08:34:03
"15 ways to boost your income, starting this weekend",msnmoney,2020-10-18 08:34:03
‘Zoom towns’ are exploding in the West,msnmoney,2020-10-18 08:34:03
How to buy Apple devices without paying Apple prices,msnmoney,2020-10-18 08:34:03
How COVID-19 Has Transformed the Way We Spend,msnmoney,2020-10-18 08:34:03
Jet Airways’ Lenders Approve Resolution Plan for Bankrupt Firm,msnmoney,2020-10-18 08:34:03
10 Downsides of a Cashless Society,msnmoney,2020-10-18 08:34:03
7 Major Expenses That Shrink When You Retire,msnmoney,2020-10-18 08:34:03
15 Retirement Mistakes and Why They'll Shrink Your Nest Egg,msnmoney,2020-10-18 08:34:03
Blackstone Signs Non-Binding Agreement to Buy Prestige’s Assets,msnmoney,2020-10-18 08:34:03
4 Warnings Signs Of Dementia (#2 Is Scary),msnmoney,2020-10-18 08:34:03
Cash and 21 Other Everyday Things Wiped Out by COVID-19,msnmoney,2020-10-18 08:34:03
"AirAsia X to Liquidate Indonesia Operations Amid Woes, Star Says",msnmoney,2020-10-18 08:34:03
Dave Ramsey says don't ever do these 10 things with your money,msnmoney,2020-10-18 08:34:03
These money and investing tips can help you enjoy a smoother ride down Wall Street,msnmoney,2020-10-18 08:34:03
27 Ugly Truths About Retirement,msnmoney,2020-10-18 08:34:03
10 products I've bought during the pandemic to make my home more livable,msnmoney,2020-10-18 08:34:03
"Federal inquiries, allegations of sexual assault, a resignation, and billions on the line: Here's everything you need to know about Nikola and its founder's controversial last 5 weeks",msnmoney,2020-10-18 08:34:03
Retirement scams to watch out for,msnmoney,2020-10-18 08:34:03
Legendary Investor Reacts to Recent Gold Moves With Massive Prediction,msnmoney,2020-10-18 08:34:03
These Are All the States With Trump Properties and Businesses,msnmoney,2020-10-18 08:34:03
I joined Costco. Here's what I wasn't expecting,msnmoney,2020-10-18 08:34:03
"Man Who Predicted 2020 Crash Says ""Now Is The Time""",msnmoney,2020-10-18 08:34:03
Wall Street’s top analysts are betting on stocks like Apple and Snap this earnings season,msnmoney,2020-10-18 08:34:03
Things real estate agents don't want you to know,msnmoney,2020-10-18 08:34:03
15 Jobs That Look Drastically Different as the Economy Reopens,msnmoney,2020-10-18 08:34:03
"39 Hottest Gifts Of 2020 (Hurry, These Will Be Gone Very Soon)",msnmoney,2020-10-18 08:34:03
18 things to do if you want to retire early,msnmoney,2020-10-18 08:34:03
Old Man's Neighbor Blocks His Driveway With Cinder Blocks So He Teaches Him A Cruel Lesson,msnmoney,2020-10-18 08:34:03
U.K.’s G4S Continues to Reject GardaWorld Terms for Takeover,msnmoney,2020-10-18 08:34:03
10 ways to DIY your next stimulus check (and forget Congress),msnmoney,2020-10-18 08:34:03
5 Things You Should Know About a Real Estate Market Before Buying a Home,msnmoney,2020-10-18 08:34:03
T-Mobile and Sprint — and 5 Other Surprising Company Mergers During COVID-19,msnmoney,2020-10-18 08:34:03
‘Made in Iran’ Thrives in Economy Trump Tried to Crush,msnmoney,2020-10-18 08:34:03
This $99 Drone Might Be The Most Amazing Invention of 2020,msnmoney,2020-10-18 08:34:03
Use it or lose it: What to buy with your FSA money,msnmoney,2020-10-18 08:34:03
"Mortgage rates slide to new low, but borrowers miss the memo",msnmoney,2020-10-18 08:34:03
The most disastrous product launches ever,msnmoney,2020-10-18 08:34:03
Opinion: Value stocks are poised to crush growth stocks after the presidential election,msnmoney,2020-10-18 08:34:03
These 47 Billionaires Got Richer During The Pandemic,msnmoney,2020-10-18 08:34:03
"[Photos] Mom Left Him Alone with Dog for Seconds, Then This Happened",msnmoney,2020-10-18 08:34:03
Want $365 More a Month From Social Security? Here's How to Get It,msnmoney,2020-10-18 08:34:03
Major Companies Going Bankrupt in 2020,msnmoney,2020-10-18 08:34:03
Opinion: Don’t just default to the S&P 500: Consider this simple four-fund portfolio,msnmoney,2020-10-18 08:34:03
All the ways parents waste money on kids,msnmoney,2020-10-18 08:34:03
German Economy Minister Against Nationalization of Thyssenkrupp,msnmoney,2020-10-18 08:34:03
Seniors On Medicare Are Getting a Big Pay Day,msnmoney,2020-10-18 08:34:03
Secrets to help retirees save money,msnmoney,2020-10-18 08:34:03
This couple created their own tiny house island,msnmoney,2020-10-18 08:34:03
I shopped at Aldi for the first time. Here's what surprised me,msnmoney,2020-10-18 08:34:03
Earnings season is highlighting the uneven playing field in the year of the pandemic,msnmoney,2020-10-18 08:34:03
Facts about apples that will take you by surprise,msnmoney,2020-10-18 08:34:03
New Car Gadget Magically Removes Scratches & Dents,msnmoney,2020-10-18 08:34:03
4 Types of Remote Jobs You Can Land Quickly,msnmoney,2020-10-18 08:34:03
"If You Invested $5,000 in These Stocks During the Crash in March, You’d Be Rich",msnmoney,2020-10-18 08:34:03
Atlantia Set to Sell $1.2 Billion Stake in Telepass Unit,msnmoney,2020-10-18 08:34:03
"22 safe and reliable used cars you can get for under $15,000",msnmoney,2020-10-18 08:34:03
What Investors Can Learn From 'Windy City Rehab',msnmoney,2020-10-18 08:34:03
How to buy Apple devices without paying Apple prices,msnmoney,2020-10-18 08:34:03
The Best and Worst State Capitals To Live In,msnmoney,2020-10-18 08:34:03
iPhone price wars are back as carriers compete for 5G customers,msnmoney,2020-10-18 08:34:03
Reasons you shouldn't buy a house,msnmoney,2020-10-18 08:34:03
22 cliffhanging homes with unbelievable views,msnmoney,2020-10-18 08:34:03
These senior discounts will stretch your retirement savings,msnmoney,2020-10-18 08:34:03
[Photos] Jackie Kennedy's Granddaughter Is A Billionaire,msnmoney,2020-10-18 08:34:03
Warren Buffett plowed $5 billion into Bank of America during the debt crisis. Here's the story of how the investor helped the bank and made a fortune in the process.,msnmoney,2020-10-18 08:34:03
28 Most Luxurious Celebrity Cars in the World,msnmoney,2020-10-18 08:34:03
Maybe Apple Isn’t as Green as It Claims,msnmoney,2020-10-18 08:34:03
People in these states use debt the least,msnmoney,2020-10-18 08:34:03
Bringing the outside into the office: Coronavirus bolsters push towards healthier building design,msnmoney,2020-10-18 08:34:03
1 Simple Trick to Cut Your Electric Bill by 90%,msnmoney,2020-10-18 08:34:03
The Redskins and 18 More Offensive Logos That Came Under Fire,msnmoney,2020-10-18 08:34:03
Alcoa Investors Focus on the Future With Green Dominating Agenda,msnmoney,2020-10-18 08:34:03
15 Unexpected Things We’ve Been Buying More of Since the Coronavirus Crisis Hit,msnmoney,2020-10-18 08:34:03
3 Investing Moves to Make by the End of 2020,msnmoney,2020-10-18 08:34:03
Here’s the Highest-Paid Job in Your State — Excluding Doctors,msnmoney,2020-10-18 08:34:03
Starboard looks to keep its great track record going in the chip industry,msnmoney,2020-10-18 08:34:03
Unseen Photographs Expose A Different Side To Infamous Nightclub,msnmoney,2020-10-18 08:34:03
7 Small-Cap Tech Stocks That Pack a Punch,msnmoney,2020-10-18 08:34:03
Are you bad with money? How to know & what to do,msnmoney,2020-10-18 08:34:03
21 Purchases You Should Never Skimp On,msnmoney,2020-10-18 08:34:03
"Biden Won’t Ban Fracking, But His Clean Grid Would Choke Gas",msnmoney,2020-10-18 08:34:03
"15 ways to boost your income, starting this weekend",msnmoney,2020-10-18 08:34:03
‘Zoom towns’ are exploding in the West,msnmoney,2020-10-18 08:34:03
How to buy Apple devices without paying Apple prices,msnmoney,2020-10-18 08:34:03
How COVID-19 Has Transformed the Way We Spend,msnmoney,2020-10-18 08:34:03
Jet Airways’ Lenders Approve Resolution Plan for Bankrupt Firm,msnmoney,2020-10-18 08:34:03
10 Downsides of a Cashless Society,msnmoney,2020-10-18 08:34:03
7 Major Expenses That Shrink When You Retire,msnmoney,2020-10-18 08:34:03
15 Retirement Mistakes and Why They'll Shrink Your Nest Egg,msnmoney,2020-10-18 08:34:03
Blackstone Signs Non-Binding Agreement to Buy Prestige’s Assets,msnmoney,2020-10-18 08:34:03
4 Warnings Signs Of Dementia (#2 Is Scary),msnmoney,2020-10-18 08:34:03
Cash and 21 Other Everyday Things Wiped Out by COVID-19,msnmoney,2020-10-18 08:34:03
"AirAsia X to Liquidate Indonesia Operations Amid Woes, Star Says",msnmoney,2020-10-18 08:34:03
Dave Ramsey says don't ever do these 10 things with your money,msnmoney,2020-10-18 08:34:03
These money and investing tips can help you enjoy a smoother ride down Wall Street,msnmoney,2020-10-18 08:34:03
27 Ugly Truths About Retirement,msnmoney,2020-10-18 08:34:03
10 products I've bought during the pandemic to make my home more livable,msnmoney,2020-10-18 08:34:03
American plans to return Boeing 737 Max to service at year-end,yahoofinance,2020-10-18 08:35:57
China passes export-control law following U.S. moves,yahoofinance,2020-10-18 08:35:57
"‘Heard all this before’: Industry skeptical to Trump, Biden appeals",yahoofinance,2020-10-18 08:35:57
'No surprise' Covid surging in Republican areas: ER doctor,yahoofinance,2020-10-18 08:35:57
Education is the ultimate bipartisan issue: Fmr. Education Secretary Arne Duncan,yahoofinance,2020-10-18 08:35:57
Eargo CEO on company outlook amid NASDAQ listing,yahoofinance,2020-10-18 08:35:57
School closures will cost students in future earnings,yahoofinance,2020-10-18 08:35:57
Biden bests Trump's Town Hall: Nielsen,yahoofinance,2020-10-18 08:35:57
How to invest in water sustainability,yahoofinance,2020-10-18 08:35:57
Dave Ramsey says don't ever do these 10 things with your money,yahoofinance,2020-10-18 08:35:57
Workhorse Stock Could Skyrocket on a U.S. Postal Service Contract,yahoofinance,2020-10-18 08:35:57
Biden's plan to overhaul 401(k) tax breaks could force some companies to cut retirement benefits,yahoofinance,2020-10-18 08:35:57
Big Contrarian Investor Sells AT&T and Gold Stocks. Here’s What It Bought.,yahoofinance,2020-10-18 08:35:57
"Stock Market Rally At Turning Point: Amazon Offers Lower Buy Point, Tesla, Netflix Earnings On Tap",yahoofinance,2020-10-18 08:35:57
These Are The 5 Best Stocks To Buy And Watch Now,yahoofinance,2020-10-18 08:35:57
"I want to retire next year, but I have $25,000 in credit card debt and a major monthly mortgage payment — I also live with my three kids and ex",yahoofinance,2020-10-18 08:35:57
3 Marijuana Stocks to Buy With Decriminalization on the Table,yahoofinance,2020-10-18 08:35:57
"Retirement: Average Boomer's savings would only last seven years, study finds",yahoofinance,2020-10-18 08:35:57
Canada Pension Plan (CPP) vs. U.S. Social Security,yahoofinance,2020-10-18 08:35:57
Revisiting Nio's Dream Run This Week,yahoofinance,2020-10-18 08:35:57
Stay Clear of Exxon Mobil Until the Turbulence Fades,yahoofinance,2020-10-18 08:35:57
Is Boeing Stock A Buy Right Now As 737 Max Nears Return?,yahoofinance,2020-10-18 08:35:57
"Here’s What Nikola, Hyliion, and These 6 Other EV SPACs Are Really Worth",yahoofinance,2020-10-18 08:35:57
"Forget the Rent, Collect the Yield: Why Investors Looking to Retire Early Should Consider REITs",yahoofinance,2020-10-18 08:35:57
"Bulls And Bears Of The Week: Citigroup, Eli Lilly, Ford, GE And More",yahoofinance,2020-10-18 08:35:57
"4 Top Stock Trades for Monday: PTON, PFE, FSLY, SPAQ",yahoofinance,2020-10-18 08:35:57
The interest on your savings stinks — here are some remedies,yahoofinance,2020-10-18 08:35:57
"Barron's Picks And Pans: eBay, Honeywell, Morgan Stanley And More",yahoofinance,2020-10-18 08:35:57
Buy the Next Dip in Red-Hot Nvidia Stock,yahoofinance,2020-10-18 08:35:57
4 Semiconductor Stocks Making the Guts of Everything Electronic,yahoofinance,2020-10-18 08:35:57
U.S Mortgage Rates Slide to another All-Time Low,yahoofinance,2020-10-18 08:35:57
Buffett Inches Toward Wells Fargo Exit as Scharf Sets Course,yahoofinance,2020-10-18 08:35:57
"Apple, Amazon, Microsoft Lead Tech Giants Close To Finishing This Classic Bullish Base",yahoofinance,2020-10-18 08:35:57
You may be able to nearly triple your return with U.S. Treasurys,yahoofinance,2020-10-18 08:35:57
"Despite Government Threat, General Electric Is Still Treading Water",yahoofinance,2020-10-18 08:35:57
Nikola Stock Plunges As CEO Hints It Can Go On Without Badger Partner GM,yahoofinance,2020-10-18 08:35:57
"Kodak’s Moment of Investor Insanity Has Passed, But Its Future Is Unclear",yahoofinance,2020-10-18 08:35:57
Tesla Earnings: What to Look For From TSLA,yahoofinance,2020-10-18 08:35:57
"Palantir Is An Interesting Company, But There Is Little Reason To Own It",yahoofinance,2020-10-18 08:35:57
7 Red-Hot Recent IPOs to Ditch Now,yahoofinance,2020-10-18 08:35:57
Tesla and Netflix put their big 2020 gains on the line in the coming week,yahoofinance,2020-10-18 08:35:57
"Is Virgin Galactic A Buy As Stock Clears Entry? Here's What Earnings, Charts Show",yahoofinance,2020-10-18 08:35:57
"Biden Won’t Ban Fracking, But His Clean Grid Would Choke Gas",yahoofinance,2020-10-18 08:35:57
Live Long and … Prosper? There’s a Retirement Savings Disconnect for Many Americans,yahoofinance,2020-10-18 08:35:57
First Solar Stock Isn’t the Best Name in the Sector for Growth Investors,yahoofinance,2020-10-18 08:35:57
Canaccord Predicts Over 100% Rally for These 3 “Strong Buy” Stocks,yahoofinance,2020-10-18 08:35:57
Preferred Stocks’ Yields Are Dropping. These 5 Are Still Worth Buying.,yahoofinance,2020-10-18 08:35:57
5 Value Stocks To Watch In The Basic Materials Sector,yahoofinance,2020-10-18 08:35:57
5 Apartment REITs to Watch,yahoofinance,2020-10-18 08:35:57
Tips on Delaying Social Security Benefits,yahoofinance,2020-10-18 08:35:57
Shopify Stock Is Showing Echoes of Amazon.com Circa 1999,yahoofinance,2020-10-18 08:35:57
Airlines: There Will Be Tears,yahoofinance,2020-10-18 08:35:57
It’s Time to Give Cisco Stock a Second Chance After the Plunge,yahoofinance,2020-10-18 08:35:57
DiamondPeak Stock Could Potentially Double,yahoofinance,2020-10-18 08:35:57
3 Flashy Precious Metals Stocks to Show Off Now,yahoofinance,2020-10-18 08:35:57
Is Spirit Airlines a Better Buy Than All Four of the Majors?,yahoofinance,2020-10-18 08:35:57
3 Biotech Stocks to Buy Right Now,yahoofinance,2020-10-18 08:35:57
5 Value Stocks In The Consumer Defensive Sector,yahoofinance,2020-10-18 08:35:57
New Allegations Make Workhorse Even More Unappealing,yahoofinance,2020-10-18 08:35:57
"At $550, Nvidia Is Just Way Too Costly to Justify",yahoofinance,2020-10-18 08:35:57
Taking Workhorse Stock Profit Quickly Kept The Trade Positive,yahoofinance,2020-10-18 08:35:57
The Biggest Techs Can Get Bigger—and More Profitable. A Veteran Analyst Tells Why.,yahoofinance,2020-10-18 08:35:57
"Amid tensions with China, India warns Amazon, Flipkart over country of origin rule",yahoofinance,2020-10-18 08:35:57
Why Goldman Sachs sees a ‘blue wave’ in November as positive for U.S. credit markets,yahoofinance,2020-10-18 08:35:57
Trump’s Debts Are the Least Mysterious Aspect of His Finances,yahoofinance,2020-10-18 08:35:57
"The Week In Cannabis: Aphria Earnings, Canopy's Distribution Deal, And A Big Conference",yahoofinance,2020-10-18 08:35:57
"GLOBAL MARKETS-Pfizer vaccine hopes lift world stocks; dollar, gold on the defensive",yahoofinance,2020-10-18 08:35:57
"Gaming, Data Centers Seen Providing Third-Quarter Upside For AMD",yahoofinance,2020-10-18 08:35:57
"BofA Brushes Aside Roku Investor Concerns, Raises Price Target",yahoofinance,2020-10-18 08:35:57
OPEC+ Faces Growing Pressure to Change Course as Ministers Meet,yahoofinance,2020-10-18 08:35:57
IBM earnings: Chief executive’s first big move will be more scrutinized than the numbers,yahoofinance,2020-10-18 08:35:57
"Cramer Discusses EV SPACs, Highlights Fisker, Hyliion",yahoofinance,2020-10-18 08:35:57
Vertex (VRTX) Drops 20% After Failed Drug Trial,yahoofinance,2020-10-18 08:35:57
"Wall Street Prepares for a Biden Victory, Higher Taxes and All",yahoofinance,2020-10-18 08:35:57
Vaxart: An Alternative Opportunity in the COVID-19 Vaccine Landscape,yahoofinance,2020-10-18 08:35:57
Facebook to crack down on Instagram influencers over illegal ‘hidden advertising’ after a regulator probe,yahoofinance,2020-10-18 08:35:57
"Carter Worth, Mike Khouw's Procter & Gamble Trade",yahoofinance,2020-10-18 08:35:57
String of Firms That Imploded Have Something in Common: Ernst & Young Audited Them,yahoofinance,2020-10-18 08:35:57
"'Halftime Report' Traders Share Their Thoughts On Boeing, Sysco",yahoofinance,2020-10-18 08:35:57
Got Guts? Buy Nio Stock at This Super-High Valuation,yahoofinance,2020-10-18 08:35:57
"Newmont CEO sees copper growth, not worried about Barrick takeover",yahoofinance,2020-10-18 08:35:57
Gold Price Forecast – Gold Continues to Dance Around 50 Day EMA,yahoofinance,2020-10-18 08:35:57
Fidelity Capital & Income Fund Performance Study,yahoofinance,2020-10-18 08:35:57
Hearing-Aid Maker Eargo Soars 87% in Its First Trading Day,yahoofinance,2020-10-18 08:35:57
A Tale of 3 IPO Stocks; 2 to Buy and 1 to Avoid,yahoofinance,2020-10-18 08:35:57
"Bankrupt car rental firm Hertz secures $1.65 bln in financing, shares soar",yahoofinance,2020-10-18 08:35:57
An Analyst Plays Matchmaker With Chevron and Exxon,yahoofinance,2020-10-18 08:35:57
"US STOCKS-Wall Street gains on vaccine news, retail sales surprise",yahoofinance,2020-10-18 08:35:57
How Large Option Traders Are Playing GE's Stock After Regulators Clear 737 Max,yahoofinance,2020-10-18 08:35:57
Credit Scores Rise Amid Recession,wsj,2020-10-18 08:38:20
Pelosi Sets Deadline for White House on Coronavirus Relief,wsj,2020-10-18 08:38:20
This Holiday Crunch Starts Early With More Packages Than Means to Deliver Them,wsj,2020-10-18 08:38:20
Pressure on New York Commercial Real Estate Worries Investors,wsj,2020-10-18 08:38:20
"Trump Trails Among Seniors, a Key Group in Many States",wsj,2020-10-18 08:38:20
China Warns It May Detain Americans,wsj,2020-10-18 08:38:20
What People Really Love (and Hate) About Remote Work,wsj,2020-10-18 08:38:20
"In Michigan Plot to Kidnap Governor, Informants Were Key",wsj,2020-10-18 08:38:20
"With Fewer Covid-19 Curbs, South’s Economy Outperforms Nation",wsj,2020-10-18 08:38:20
Coronavirus Threatens to Push the Child-Care Industry Over the Edge,wsj,2020-10-18 08:38:20
Part of the Brooklyn Covid-19 Uptick Traces to Jersey Shore Town,wsj,2020-10-18 08:38:20
A Pastry Chef Ditches Desserts for Data Analysis,wsj,2020-10-18 08:38:20
The Rays Epitomize Baseball in 2020—for Better or for Worse,wsj,2020-10-18 08:38:20
An Air Force Vet Needs to Cut Expenses and Debt. Here’s Some Advice.,wsj,2020-10-18 08:38:20
Wall Street’s Hottest Financing Tool Makes Me Worry About the Market,wsj,2020-10-18 08:38:20
Tech’s Influence Over Markets Eclipses Dot-Com Peak,wsj,2020-10-18 08:38:20
This Japanese Engineer Created the Robots That Make Your Cars,wsj,2020-10-18 08:38:20
Joseph Sullivan III Helped Create Chicago Options Exchange,wsj,2020-10-18 08:38:20
Immigrant Founded Diana’s Mexican Food Products,wsj,2020-10-18 08:38:20
French Teacher’s Lesson on Charlie Hebdo Fueled Online Dispute Before Beheading,wsj,2020-10-18 08:38:20
Bolivian Election Shapes Up as Battle Over Former President Evo Morales,wsj,2020-10-18 08:38:20
Coronavirus Deals a Blow to Global Battle Against Poverty,wsj,2020-10-18 08:38:20
Thailand Curtails Mass Transit as Protesters Defy Gathering Ban,wsj,2020-10-18 08:38:20
Fall in Love With These Autumn Styles,wsj,2020-10-18 08:38:20
No Rocks Required for This Strength-Building Climbing Workout,wsj,2020-10-18 08:38:20
What Is a ‘Nap Dress’ and Why Do Women Want It So Badly?,wsj,2020-10-18 08:38:20
"The Garden Is the New Home Office, Thanks to the Sanity Shed",wsj,2020-10-18 08:38:20
" U.S. Budget Gap Tripled to Record $3.1 Trillion in Fiscal 2020, Treasury Says ",wsj,2020-10-18 08:38:20
 U.S. Industrial Production Fell 0.6% in September ,wsj,2020-10-18 08:38:20
" Pandemic Aid Swelled Savings of the Unemployed, Study Shows. Now They Are Running Low. ",wsj,2020-10-18 08:38:20
 Blackstone Deal Values BioMed at $14.6 Billion as Pandemic Raises the Stakes ,wsj,2020-10-18 08:38:20
