headline,org,date
"Nordstrom Will Now Require Face Masks in All Stores, Effective…",msnmoney,2020-07-18 20:52:30
"I’m retired, my wife isn’t — how should we pay off our $60,000 mortgage…",msnmoney,2020-07-18 20:52:30
Opinion: We want a diverse area with moderate population…,msnmoney,2020-07-18 20:52:30
Here's how much men and women earn at every age,msnmoney,2020-07-18 20:52:30
Forget gold and Bitcoin. This is how I’d invest in stocks to get rich,msnmoney,2020-07-18 20:52:30
The 11 best coastal cities to live in after the pandemic,msnmoney,2020-07-18 20:52:30
Indonesia boosts tax incentives to limit economic impact from…,msnmoney,2020-07-18 20:52:30
Mo'Nique's discrimination 'lowballing' lawsuit against Netflix over pay…,msnmoney,2020-07-18 20:52:30
Update: BlackBerry (TSX:BB) Now Controls 175 Million Smart Vehicles,msnmoney,2020-07-18 20:52:30
2 Top Energy Stocks to Invest in That AREN’T Oil,msnmoney,2020-07-18 20:52:30
Inside Apollo's shift to soften its culture from kids' storytime to a new…,msnmoney,2020-07-18 20:52:30
More than 3 in 4 college students plan to return to campus this fall — but…,msnmoney,2020-07-18 20:52:30
Collecting CERB? Here’s How Much You May Have to Pay in Taxes to the…,msnmoney,2020-07-18 20:52:30
"For 20 years, Rob Hutsel's cleaned up and protected the San Diego River. Let…",msnmoney,2020-07-18 20:52:30
These business owners got a PPP loan. It may not be enough,msnmoney,2020-07-18 20:52:30
Big financial bubbles that spectacularly burst,msnmoney,2020-07-18 20:52:30
Will the economy ever return to 'normal'?,msnmoney,2020-07-18 20:52:30
Spotify rises further above Apple Music with Joe Rogan acquisition,msnmoney,2020-07-18 20:52:30
Tradeoff between reopening and worsening coronavirus crisis 'a big…,msnmoney,2020-07-18 20:52:30
Opinion: These tips can help millennials and Gen-Zers make their point…,msnmoney,2020-07-18 20:52:30
CRA: 3 Tips To Maximize Your Refund and Avoid Paying More,msnmoney,2020-07-18 20:52:30
"Opinion: Tesla is like a SpaceX rocket to stock investors, but the car…",msnmoney,2020-07-18 20:52:30
Here’s why all of the S&P 500’s gains since April came after the market…,msnmoney,2020-07-18 20:52:30
It Looks Like This Wild Stock Market Is Here to Stay,msnmoney,2020-07-18 20:52:30
EU’s Vestager Says State Role in Companies Acceptable During Crisis,msnmoney,2020-07-18 20:52:30
CRA Update: 3 Huge Changes Coming Before 2021,msnmoney,2020-07-18 20:52:30
Opinion: Seniors who rely on dividend income may be in for some lean times,msnmoney,2020-07-18 20:52:30
Opinion: S&P 500 stocks post their biggest gains when company earnings make this move,msnmoney,2020-07-18 20:52:30
"Tesla’s prayer for profit, earnings tests for Intel and Microsoft highlight first big week of…",msnmoney,2020-07-18 20:52:30
Opinion: There is more to picking a place to retire than low taxes — avoid these 5…,msnmoney,2020-07-18 20:52:30
Diversify? Almost half of Warren Buffett’s Berkshire Hathaway portfolio is now…,msnmoney,2020-07-18 20:52:30
"With rates under 3%, most mortgages are due for a refinance, study says",msnmoney,2020-07-18 20:52:30
These money and investing tips can help you if stocks and bonds…,msnmoney,2020-07-18 20:52:30
"He had $35,000 in retirement savings in March — 350 trades…",msnmoney,2020-07-18 20:52:30
Cruise stocks hit hard as CDC extension of no-sail order could be just the…,msnmoney,2020-07-18 20:52:30
"When will I get my tax refund? ‘We’re focused on the paper returns,’…",msnmoney,2020-07-18 20:52:30
Wall Street bankers: We’ll gladly pay higher taxes to get rid of ‘the existential…,msnmoney,2020-07-18 20:52:30
Why ETFs remain some of the most tax-efficient vehicles for your money,msnmoney,2020-07-18 20:52:30
"Investors face ‘a scary, out-of-whack’ scenario — just look at this chart",msnmoney,2020-07-18 20:52:30
Better Buy: AvalonBay Communities vs. Essex Property Trust,msnmoney,2020-07-18 20:52:30
Opinion: The No. 1 market-timer of the 1980s and 1990s has this…,msnmoney,2020-07-18 20:52:30
"If you're considering moving from the city to a suburb, here are 5…",msnmoney,2020-07-18 20:52:30
Opinion: 4 reasons why being a responsible ESG investor can help your…,msnmoney,2020-07-18 20:52:30
Longtime Elon Musk critic has a strong message for investors looking to bet…,msnmoney,2020-07-18 20:52:30
The back-to-school shopping season will be a ‘dud’ one analyst says…,msnmoney,2020-07-18 20:52:30
'My savings ran out a month into this': Workers laid off because of co…,msnmoney,2020-07-18 20:52:30
Super cheap mortgage rates spark homebuyer bidding wars,msnmoney,2020-07-18 20:52:30
How does Revised Pay As You Earn (REPAYE) work?,msnmoney,2020-07-18 20:52:30
"Moderna Keeps Surging, MGM Stumbles",msnmoney,2020-07-18 20:52:30
"5 at 5: Your Daily Digest for Real Estate Investing, 07/17/2020",msnmoney,2020-07-18 20:52:30
Mass evictions: The next crisis that could hit New York City,msnmoney,2020-07-18 20:52:30
Bidding wars erupt as shortage of homes for sale intensifies,msnmoney,2020-07-18 20:52:30
More than 25M to lose $600 unemployment boost,msnmoney,2020-07-18 20:52:30
A 'handful' of Cisco employees were fired after posting offensi…,msnmoney,2020-07-18 20:52:30
Rising coronavirus cases threaten U.S. economic rebound,msnmoney,2020-07-18 20:52:30
Zuckerberg slams Trump administration response to COVID-19,msnmoney,2020-07-18 20:52:30
Twitter says hackers targeted 130 accounts in Bitcoin scam,msnmoney,2020-07-18 20:52:30
What is a short sale?,msnmoney,2020-07-18 20:52:30
6 inherited IRA rules all beneficiaries must know,msnmoney,2020-07-18 20:52:30
"American Airlines CEO: ‘Let’s go fly, for God’s sake’",msnmoney,2020-07-18 20:52:30
Your Midyear Retirement Finances Review,msnmoney,2020-07-18 20:52:30
Is Going to Grad School a Good Financial Decision During a Recession?,msnmoney,2020-07-18 20:52:30
8 ways to save money on the cost of your next car (Hint: It pays to be nice),msnmoney,2020-07-18 20:52:30
Housing starts gain steam as builders ramp up construction despite…,msnmoney,2020-07-18 20:52:30
Amazon Warehouse Worker Alleges Retaliation for Safety…,msnmoney,2020-07-18 20:52:30
How to open a savings account: Here are the steps to take,msnmoney,2020-07-18 20:52:30
Investor spotlight: Warren Buffet investment strategy,msnmoney,2020-07-18 20:52:30
Partners Group Nears Deal to Buy Bridgepoint’s Rovensa,msnmoney,2020-07-18 20:52:30
7 tips for Job hunting in the age of COVID-19,msnmoney,2020-07-18 20:52:30
British Airways retires its entire fleet of Boeing 747 jets,msnmoney,2020-07-18 20:52:30
Ways to upgrade your home without blowing your budget,msnmoney,2020-07-18 20:52:30
Daimler’s Late-Quarter Recovery Limits Loss to $1.9 Billion,msnmoney,2020-07-18 20:52:30
Macquarie sees the dollar weakening ahead of U.S. presidential election,msnmoney,2020-07-18 20:52:30
"Ask Bankrate: Questions about losing money in IRAs, the future of the…",msnmoney,2020-07-18 20:52:30
PG&E power lines caused biggest California fire of ‘19,msnmoney,2020-07-18 20:52:30
"Stocks Reverse, Twitter Hack Raises Concerns",msnmoney,2020-07-18 20:52:30
LendingTree raises outlook on mortgage refinance demand,msnmoney,2020-07-18 20:52:30
Taking out a personal loan to buy a timeshare,msnmoney,2020-07-18 20:52:30
15 Things No One Tells You About Moving to a Small Town,msnmoney,2020-07-18 20:52:30
Here's Who Would Be Eligible for A Second Stimulus Check,msnmoney,2020-07-18 20:52:30
14 Things Everyone Pays Way Too Much For,msnmoney,2020-07-18 20:52:30
Intriguing abandoned American buildings for sale,msnmoney,2020-07-18 20:52:30
"For sale by owner, or FSBO, explained",msnmoney,2020-07-18 20:52:30
What Steve Jobs—and a surgeon—can teach us about using body…,msnmoney,2020-07-18 20:52:30
"American Air Makes Big Bet on NYC, Boston With JetBlue Alliance",msnmoney,2020-07-18 20:52:30
This is how many employers kept the 401(k) match—the number…,msnmoney,2020-07-18 20:52:30
Does a swimming pool add value to your home?,msnmoney,2020-07-18 20:52:30
Opinion: Pioneer of target-date funds looks to the future: hedging and…,msnmoney,2020-07-18 20:52:30
Should I Get a Financial Advisor?,msnmoney,2020-07-18 20:52:30
The 10 Best Cities to Buy an Affordable Family Home,msnmoney,2020-07-18 20:52:30
Retail sales rise for second straight month,msnmoney,2020-07-18 20:52:30
The Guide to Title Insurance,msnmoney,2020-07-18 20:52:30
Op-ed: Employers will be failing their workers if they don't learn these…,msnmoney,2020-07-18 20:52:30
Picking up the financial pieces after a loss: 'We planned life but we…,msnmoney,2020-07-18 20:52:30
"If you’ve started day trading, you have until July 15 to opt for this…",msnmoney,2020-07-18 20:52:30
American Airlines Calls to Extend Billions in Aid Through 2021,msnmoney,2020-07-18 20:52:30
"Stick to Apple and Microsoft, at least for now, says this fund…",msnmoney,2020-07-18 20:52:30
Vox Media to lay off about 72 employees as advertising revenue…,msnmoney,2020-07-18 20:52:30
16 States With Sales Tax Breaks This Summer,msnmoney,2020-07-18 20:52:30
"Almost 650,000 people in Britain lost their jobs in the past 3 months, and…",msnmoney,2020-07-18 20:52:30
Atlanta housing market: Trends & prices,msnmoney,2020-07-18 20:52:30
Five Alternative Data Points to Watch in the Covid-19 Economy,msnmoney,2020-07-18 20:52:30
Lumber prices have skyrocketed — and that’s bad news for home…,msnmoney,2020-07-18 20:52:30
12 Dumb Mistakes People Make While Trying To Get Out of Debt,msnmoney,2020-07-18 20:52:30
Europe Issues Alert to Airlines About Flying in Iranian Airspace,msnmoney,2020-07-18 20:52:30
UAE Seeks to Help Tesla Accelerate Autonomous Driving Push,msnmoney,2020-07-18 20:52:30
Alcoa Says Cost Cuts Drove Cash Increase in ‘Challenging’ Market,msnmoney,2020-07-18 20:52:30
Virgin Galactic Taps Disney Consumer Veteran to Be New CEO,msnmoney,2020-07-18 20:52:30
Q&A With T. Rowe Price Economist: Alan Levenson,msnmoney,2020-07-18 20:52:30
10 Things HR People Won’t Tell You About Salaries and Raises,msnmoney,2020-07-18 20:52:30
Amazon is letting employees work from home until early January,msnmoney,2020-07-18 20:52:30
Money Moves You Will Be Thankful For,msnmoney,2020-07-18 20:52:30
Meet ‘Middle Neighborhoods’: The Sweet Spot Between the…,msnmoney,2020-07-18 20:52:30
"At Lockdown’s Worst, 10 States Had Under 50% of Populace Working",msnmoney,2020-07-18 20:52:30
Wells Fargo is a hot mess. It has only itself to blame,msnmoney,2020-07-18 20:52:30
Ramit Sethi: Here's how to plan for losing your job,msnmoney,2020-07-18 20:52:30
"If you file your taxes by today, Uncle Sam will pay up to 5% interest on…",msnmoney,2020-07-18 20:52:30
Pooled testing okayed in US for virus detection,msnmoney,2020-07-18 20:52:30
Petition urges Trader Joe's to change ethnic food labels,msnmoney,2020-07-18 20:52:30
"Facebook loses Disney Plus ad dollars amid boycott, report says",msnmoney,2020-07-18 20:52:30
Oklahoma assistant DeMarco Murray part of group bidding to buy…,msnmoney,2020-07-18 20:52:30
G-20 to make debt relief extension call closer to year end,msnmoney,2020-07-18 20:52:30
Retail Workers' Tips for Shopping During the Coronavirus,msnmoney,2020-07-18 20:52:30
"Facebook’s Top Advertiser Disney Cuts Ad Spending, WSJ Says",msnmoney,2020-07-18 20:52:30
And now for the bad news: our record unemployment is…,msnmoney,2020-07-18 20:52:30
Apex Legends' next rumoured TLM wants you to Always Be Closing,msnmoney,2020-07-18 20:52:30
"Get free ice cream, National Ice Cream Day deals at Baskin-Robbins…",msnmoney,2020-07-18 20:52:30
Boeing Faces Financial Drag From Dozens of Undelivered 787 Jets,msnmoney,2020-07-18 20:52:30
Hackers are getting better at tricking people into handing over passwords…,msnmoney,2020-07-18 20:52:30
Mexico Finance Minister Says Recovery to Take Longer on Covid,msnmoney,2020-07-18 20:52:30
"Notable Insider Buys: Bed Bath & Beyond, Poseida Therapeutics And More",msnmoney,2020-07-18 20:52:30
"Bulls And Bears Of The Week: Disney, GE, Tesla And More",msnmoney,2020-07-18 20:52:30
Azerbaijan warns of risks to Caspian energy exports from conflict…,msnmoney,2020-07-18 20:52:30
G20 finance officials eye solution to digital tax row this year,msnmoney,2020-07-18 20:52:30
"Stimulus check income limit, amount, qualifications…",msnmoney,2020-07-18 20:52:30
"No end in sight, Congress confronts new virus crisis rescue",msnmoney,2020-07-18 20:52:30
Is the ‘great rotation’ in the stock market under way as coronavirus…,msnmoney,2020-07-18 20:52:30
Get used to an up and down recovery: Economy sags as coronavirus…,msnmoney,2020-07-18 20:52:30
"$10,000 in This Growth Stock in 2010 Would Be Worth $360,000 Today",msnmoney,2020-07-18 20:52:30
Trump’s Ex-Partner Sapir Claims Rosen Extracted Millions,msnmoney,2020-07-18 20:52:30
"John Lewis, lion of civil rights and Congress, dead at 80",msnmoney,2020-07-18 20:52:30
Algeria sees state carrier's losses from coronavirus at $272 million this year,msnmoney,2020-07-18 20:52:30
CRA: 3 Ways to Use Your TFSA,msnmoney,2020-07-18 20:52:30
BREAKING: 85% Want the Border to Remain Closed Through 2020,msnmoney,2020-07-18 20:52:30
Opinion: The hidden risk in your S&P 500 index fund,msnmoney,2020-07-18 20:52:30
Trump claims golf is his ‘exercise’ as video of him driving a cart with his…,msnmoney,2020-07-18 20:52:30
Power Your Dividend Portfolios With These 2 Renewable Energy Stocks,msnmoney,2020-07-18 20:52:30
Fauci holds up New York as model for fighting virus,msnmoney,2020-07-18 20:52:30
Her biscuit restaurant was a hot spot until the pandemic forced her to…,msnmoney,2020-07-18 20:52:30
G20 officials pledge to keep cooperating to bolster global economy,msnmoney,2020-07-18 20:52:30
UConn releases COVID-19 testing strategy for fall semester,msnmoney,2020-07-18 20:52:30
"U.S. reports more than 70,000 new coronavirus infections for second…",msnmoney,2020-07-18 20:52:30
"Trail of missing Wirecard executive leads to Belarus, Der Spiegel…",msnmoney,2020-07-18 20:52:30
"Home Depot, Walmart, and More Retailers Requiring Face Masks",msnmoney,2020-07-18 20:52:30
Xbox Live Gold Kills Off Yearly Subscription Option,msnmoney,2020-07-18 20:52:30
The 1 Thing You Must Do to Retire Early by 10 Years,msnmoney,2020-07-18 20:52:30
Opinion: Why early retirement IS all it’s cracked up to be,msnmoney,2020-07-18 20:52:30
Fisker Ocean SUV to arrive in late 2022 as electric vehicle startup…,msnmoney,2020-07-18 20:52:30
4 Pillars for Raising Entrepreneurial Children,msnmoney,2020-07-18 20:52:30
Germany Pledges Extra 3 Billion Euros for Global Aid at G-20,msnmoney,2020-07-18 20:52:30
Sidestep the CRA: 3 Top Growth Stocks to Buy in Your TFSA Now,msnmoney,2020-07-18 20:52:30
The open secret in commercial real estate is that owners regularly…,msnmoney,2020-07-18 20:52:30
Fisker is going public: Five things to know about the electric-car maker…,msnmoney,2020-07-18 20:52:30
Russia Is Trying to Beat the West to a Covid-19 Vaccine,msnmoney,2020-07-18 20:52:30
March of Zombie Companies Just Gets Louder in Stock Market,msnmoney,2020-07-18 20:52:30
Over 3.6 million confirmed coronavirus cases in U.S. as face…,msnmoney,2020-07-18 20:52:30
Why Did Shopify Stock Fall 12% This Week?,msnmoney,2020-07-18 20:52:30
Will Handing Executives $10 Million in Severance Pay Save Bombardier…,msnmoney,2020-07-18 20:52:30
Maryland’s Republican governor slams Trump’s handling of coronavirus…,msnmoney,2020-07-18 20:52:30
Rule change for how hospitals report coronavirus data to…,msnmoney,2020-07-18 20:52:30
Former Wall Street Trader Seeks to Make Sense of Crypto World,msnmoney,2020-07-18 20:52:30
"$2,000 CERB: Do This 3-Step Checklist to Make Sure the CRA Won’t…",msnmoney,2020-07-18 20:52:30
‘I now fear the worst’: four grim tales of working life upended by Covid-19,msnmoney,2020-07-18 20:52:30
Fauci says he’s ‘cautiously optimistic’ U.S. on track to getting coronavirus…,msnmoney,2020-07-18 20:52:30
Tesla’s earnings on tap next week: Will a loss end its blowout stock rally?,msnmoney,2020-07-18 20:52:30
Air Canada (TSX:AC): More Bad News as Credit Is Downgraded,msnmoney,2020-07-18 20:52:30
Mnuchin suggests forgiving ‘small’ PPP loans,msnmoney,2020-07-18 20:52:30
CRA CERB: Will It Be Extended Further?,msnmoney,2020-07-18 20:52:30
"Iran's rial hits new low on unofficial market; virus, sanctions weigh",msnmoney,2020-07-18 20:52:30
WARNING: Don’t Miss This Key Advice From Banks in July,msnmoney,2020-07-18 20:52:30
"This company was fully remote with 1,300 employees long before…",msnmoney,2020-07-18 20:52:30
"Black women are often ignored by social justice movements, a new…",msnmoney,2020-07-18 20:52:30
2 Ways You Can Get Rich From the Next Recession,msnmoney,2020-07-18 20:52:30
Your guide to calling a credit card reconsideration line,msnmoney,2020-07-18 20:52:30
New Yorkers paying thousands to live in luxury condos slam…,msnmoney,2020-07-18 20:52:30
CRA Tax Update 2020: 2 Massive Changes You Should Know,msnmoney,2020-07-18 20:52:30
He flaunted fancy cars and designer clothes on Instagram for years —…,msnmoney,2020-07-18 20:52:30
Is BlackBerry (TSX:BB) a Millionaire-Maker Stock?,msnmoney,2020-07-18 20:52:30
These restaurant chains filed for bankruptcy during the pandemic,msnmoney,2020-07-18 20:52:30
Gary Vaynerchuk's advice to one small business owner who made a…,msnmoney,2020-07-18 20:52:30
Dangote $2 Billion Fertilizer Plant Set for 2020 Start,msnmoney,2020-07-18 20:52:30
"Bridgepoint Eyes Stake in English Women’s Soccer, Sky Reports",msnmoney,2020-07-18 20:52:30
American billionaires have made an average of $42 billion a week…,msnmoney,2020-07-18 20:52:30
Bankrupt Nieman Marcus seeks bonuses for top execs,msnmoney,2020-07-18 20:52:30
AOC’s Anti-Billionaire Crusaders Are Spreading in New York City,msnmoney,2020-07-18 20:52:30
Jamie Dimon's warning for the U.S. economy — nobody knows what…,msnmoney,2020-07-18 20:52:30
Buy Alert: 2 TSX Stocks to Buy if Markets Continue to March Ahead,msnmoney,2020-07-18 20:52:30
Five steps to fix your budget and restart your career if you just lost…,msnmoney,2020-07-18 20:52:30
"Nordstrom Will Now Require Face Masks in All Stores, Effective…",msnmoney,2020-07-18 20:52:30
"I’m retired, my wife isn’t — how should we pay off our $60,000 mortgage…",msnmoney,2020-07-18 20:52:30
Opinion: We want a diverse area with moderate population…,msnmoney,2020-07-18 20:52:30
Here's how much men and women earn at every age,msnmoney,2020-07-18 20:52:30
Forget gold and Bitcoin. This is how I’d invest in stocks to get rich,msnmoney,2020-07-18 20:52:30
The 11 best coastal cities to live in after the pandemic,msnmoney,2020-07-18 20:52:30
Indonesia boosts tax incentives to limit economic impact from…,msnmoney,2020-07-18 20:52:30
Mo'Nique's discrimination 'lowballing' lawsuit against Netflix over pay…,msnmoney,2020-07-18 20:52:30
Update: BlackBerry (TSX:BB) Now Controls 175 Million Smart Vehicles,msnmoney,2020-07-18 20:52:30
2 Top Energy Stocks to Invest in That AREN’T Oil,msnmoney,2020-07-18 20:52:30
Inside Apollo's shift to soften its culture from kids' storytime to a new…,msnmoney,2020-07-18 20:52:30
More than 3 in 4 college students plan to return to campus this fall — but…,msnmoney,2020-07-18 20:52:30
Collecting CERB? Here’s How Much You May Have to Pay in Taxes to the…,msnmoney,2020-07-18 20:52:30
"For 20 years, Rob Hutsel's cleaned up and protected the San Diego River. Let…",msnmoney,2020-07-18 20:52:30
These business owners got a PPP loan. It may not be enough,msnmoney,2020-07-18 20:52:30
Big financial bubbles that spectacularly burst,msnmoney,2020-07-18 20:52:30
Will the economy ever return to 'normal'?,msnmoney,2020-07-18 20:52:30
Spotify rises further above Apple Music with Joe Rogan acquisition,msnmoney,2020-07-18 20:52:30
Tradeoff between reopening and worsening coronavirus crisis 'a big…,msnmoney,2020-07-18 20:52:30
Opinion: These tips can help millennials and Gen-Zers make their point…,msnmoney,2020-07-18 20:52:30
CRA: 3 Tips To Maximize Your Refund and Avoid Paying More,msnmoney,2020-07-18 20:52:30
"Opinion: Tesla is like a SpaceX rocket to stock investors, but the car…",msnmoney,2020-07-18 20:52:30
Here’s why all of the S&P 500’s gains since April came after the market…,msnmoney,2020-07-18 20:52:30
It Looks Like This Wild Stock Market Is Here to Stay,msnmoney,2020-07-18 20:52:30
EU’s Vestager Says State Role in Companies Acceptable During Crisis,msnmoney,2020-07-18 20:52:30
CRA Update: 3 Huge Changes Coming Before 2021,msnmoney,2020-07-18 20:52:30
"
Updated
                                            I filed a joint tax return with my estranged wife because she is a gambler and her finances are a mess. But I got NO stimulus check — what can I do?
                                        ",marketwatch,2020-07-18 20:54:26
"
Updated
                                            I didn’t get my stimulus check because I owe back child support. It’s not fair. My stepchildren rely on me — what can I do?
                                        ",marketwatch,2020-07-18 20:54:26
"
Updated
                                            Fauci takes aim at Trump administration, state lawmakers and young Americans: ‘You’re propagating the pandemic’
                                        ",marketwatch,2020-07-18 20:54:26
"
Updated
                                            White House animus toward Fauci may escalate as disease expert poses for InStyle magazine and calls Trump coronavirus response ‘perilous’
                                        ",marketwatch,2020-07-18 20:54:26
"
Updated
                                            Defiant Fauci tells InStyle magazine: ‘With all due modesty, I think I’m pretty effective’
                                        ",marketwatch,2020-07-18 20:54:26
"
                                            The hidden risk in your S&P 500 index fund
                                        ",marketwatch,2020-07-18 20:54:26
"
Updated
                                            EU leaders extend summit by extra day as they haggle over budget, coronavirus aid package
                                        ",marketwatch,2020-07-18 20:54:26
"
                                            Disney slashes ad spending on Facebook amid growing boycott 
                                        ",marketwatch,2020-07-18 20:54:26
"
Updated
                                            Seniors who rely on dividend income may be in for some lean times
                                        ",marketwatch,2020-07-18 20:54:26
"
Updated
                                            Gold timers have rarely been more bullish than they are today — that’s a bad sign
                                        ",marketwatch,2020-07-18 20:54:26
"
Opinion: 
                            There is a hidden risk in your S&P 500 index fund that makes you a bigger gambler than you think
                        ",marketwatch,2020-07-18 20:54:26
"
Opinion: 
                            There is a hidden risk in your S&P 500 index fund that makes you a bigger gambler than you think
                        ",marketwatch,2020-07-18 20:54:26
"
                            
                            John Lewis, lion of civil rights and Congress, dead at 80
                        ",marketwatch,2020-07-18 20:54:26
"
                            
                            No end in sight, Congress confronts new virus crisis rescue
                        ",marketwatch,2020-07-18 20:54:26
"
                            
                            EU leaders extend summit by extra day as they haggle over budget, coronavirus aid package
                        ",marketwatch,2020-07-18 20:54:26
"
                            
                            Coronavirus update: U.S. reports yet another  record case tally for a single day while global cases top 14 million
                        ",marketwatch,2020-07-18 20:54:26
"
                            
                            Weekend reads: Tesla’s earnings report is  next moment of truth for bulls and bears
                        ",marketwatch,2020-07-18 20:54:26
"
                            
                            American Airlines CEO: ‘Let’s go fly, for God’s sake’
                        ",marketwatch,2020-07-18 20:54:26
"
                            
                            Defiant Fauci tells InStyle: ‘I don’t regret anything I said’ — and talks about being ‘persona non grata’ in Trump’s White House
                        ",marketwatch,2020-07-18 20:54:26
"
Opinion: 
                            I want to take money out of my Roth IRA tax-free — when can I do that?
                        ",marketwatch,2020-07-18 20:54:26
"
                            
                            Bernanke and Yellen warn pace of recovery from pandemic could be ‘slow and uneven’
                        ",marketwatch,2020-07-18 20:54:26
"
                            
                            Tesla stock price does not reflect risk, CFRA says; stock rating lowered to sell
                        ",marketwatch,2020-07-18 20:54:26
Will The Election Take A Backseat To Coronavirus?,marketwatch,2020-07-18 20:54:26
"
                            
                            Here’s how to be that ‘go-to’ person on the job — even if you’re working from home
                        ",marketwatch,2020-07-18 20:54:26
"
                            
                            Walmart, Target, Home Depot now require customers to wear face coverings at its stores
                        ",marketwatch,2020-07-18 20:54:26
