headline,org,date
Looming Delisting Jolts Chinese Telecom Stocks,googlenews,2021-01-04 09:32:08
Moderna vaccine doses may be cut in half to hasten rollout,googlenews,2021-01-04 09:32:08
Oil prices edge lower ahead of OPEC meeting and output level discussions,googlenews,2021-01-04 09:32:08
NIO and Tesla shares rise after record vehicle deliveries,googlenews,2021-01-04 09:32:08
8 Stocks That Could Double Your Money in 2021,googlenews,2021-01-04 09:32:08
Alibaba and Ant Group founder Jack Ma hasn't been seen in 2 months - Business Insider,googlenews,2021-01-04 09:32:08
"200 mph Tesla Model S 'Plaid' may arrive sooner than expected, Elon Musk teases",googlenews,2021-01-04 09:32:08
"PA. GOVERNOR'S temporary, stricter, coronavirus restrictions expire",googlenews,2021-01-04 09:32:08
MGM makes $11 billion bid for UK gambling group,googlenews,2021-01-04 09:32:08
"Discovery+ to Roll Out in U.K., 11 More Markets Via Vodafone Deal",googlenews,2021-01-04 09:32:08
Local restaurant helping its servers as indoor dining reopens,googlenews,2021-01-04 09:32:08
"China's factory sector rose in December, sustained pre-Covid levels",googlenews,2021-01-04 09:32:08
Quibi reportedly in talks to sell its shows to Roku,googlenews,2021-01-04 09:32:08
Feds Reverse $14K Fee For Distillers Making Hand Sanitizer,googlenews,2021-01-04 09:32:08
"Pfizer, BioNTech to offer vaccine to volunteers who took placebo",googlenews,2021-01-04 09:32:08
"What history tells us happens to the S&P 500 after a strong year-end rally, strategist says",googlenews,2021-01-04 09:32:08
"The Unorthodox Trades That Will Drive Value in 2021, feat. Tony Greer - CoinDesk",googlenews,2021-01-04 09:32:08
COVID-19 hospitalizations spike in NC as positive test rates reach record highs,googlenews,2021-01-04 09:32:08
"Despite trend, Pace gym sees membership increase amid COVID-19 pandemic",googlenews,2021-01-04 09:32:08
Moderna faces a technical test going into the new year: Sector Watch,googlenews,2021-01-04 09:32:08
"Bitcoin is breaking records because bigger investors are buying it now, says PwC",googlenews,2021-01-04 09:32:08
"Stocks making the biggest moves in the premarket: Magellan Health, FLIR Systems, Tesla & more",googlenews,2021-01-04 09:32:08
Britain's Ferguson to sell UK business for $421 mln,googlenews,2021-01-04 09:32:08
Increase in minimum wage may mean tough decisions for Massachusetts businesses,googlenews,2021-01-04 09:32:08
Cybersecurity firm FireEye says massive Russia hack was waged inside U.S.,googlenews,2021-01-04 09:32:08
Struggling minority-owned businesses were kept waiting until the last minute for PPP loans - Business Insider,googlenews,2021-01-04 09:32:08
"Barstool Fund help 'a miracle,' New York restaurant owner says",googlenews,2021-01-04 09:32:08
MGM Resorts Raises Entain Bid to More Than $10 Billion,googlenews,2021-01-04 09:32:08
Tolls increase on Pennsylvania Turnpike | wnep.com,googlenews,2021-01-04 09:32:08
The world's safest airlines for 2021 revealed,googlenews,2021-01-04 09:32:08
Pizza Hut rolls out a new stuffed crust — minus the pizza,googlenews,2021-01-04 09:32:08
Epic Games to transform Cary Towne Center into new headquarters by 2024,googlenews,2021-01-04 09:32:08
Powerball results for 01/02/21; did anyone win the $390M jackpot?,googlenews,2021-01-04 09:32:08
SpaceX will try to 'catch' its Super Heavy rocket using the launch tower,googlenews,2021-01-04 09:32:08
"Coronavirus in Utah: State sees 1819 new cases, now in US top five in cases per capita",googlenews,2021-01-04 09:32:08
Foxconn Seals Manufacturing Deal With Chinese EV Startup Byton,googlenews,2021-01-04 09:32:08
Covid pandemic sends Singapore's economy to its worst ever recession in 2020,googlenews,2021-01-04 09:32:08
Jan. 3 update on COVID-19 in MN: Watching for a possible change in trends,googlenews,2021-01-04 09:32:08
Pedestrian dies after being struck by vehicle on Alapai Street on Oahu,googlenews,2021-01-04 09:32:08
Pink's hot dog stand shutting down for several months,googlenews,2021-01-04 09:32:08
"Asia shares hit record, Nikkei restrained by risk of Tokyo virus curbs",googlenews,2021-01-04 09:32:08
Pfizer and BioNTech to offer COVID vaccine to volunteers who got placebo,googlenews,2021-01-04 09:32:08
Johnson & Johnson's single-dose vaccine next to seek emergency use authorization,googlenews,2021-01-04 09:32:08
Watch A Ford Mustang Mach-E And A Tesla Model Y Go Head To Head,googlenews,2021-01-04 09:32:08
Pinduoduo Worker’s Death Renews Scrutiny of 996 Work Culture,googlenews,2021-01-04 09:32:08
Jimmy Iovine sells producer catalog royalties to Hipgnosis (so he can build a school),googlenews,2021-01-04 09:32:08
Inside NYC's ornate new Penn Station train hall,googlenews,2021-01-04 09:32:08
FTSE 100 surges as Oxford-AstraZeneca vaccine rollout begins,googlenews,2021-01-04 09:32:08
World stocks ring in new year with record highs,googlenews,2021-01-04 09:32:08
Royal Caribbean Is Rushing to Sell as Much Stock as It Can,googlenews,2021-01-04 09:32:08
Rime ice vs. hoar frost,googlenews,2021-01-04 09:32:08
"Gold, silver see solid price gains above $1900 to start 2021",googlenews,2021-01-04 09:32:08
Stay-At-Home Order Remains In Effect for Greater Sacramento Region,googlenews,2021-01-04 09:32:08
The Latest: Texas hospitalizations hit yet another record,googlenews,2021-01-04 09:32:08
3 Energy Stocks to Buy With 2030 in Mind,googlenews,2021-01-04 09:32:08
Miami's Mayor Considers Putting Some of City's Treasury Reserves in Bitcoin | Regulation,googlenews,2021-01-04 09:32:08
"China's Dec factory activity growth slows, higher costs hit firms",googlenews,2021-01-04 09:32:08
"Target recalls 480,000 infant rompers and children's swimsuits",googlenews,2021-01-04 09:32:08
Tesla’s China rival Xpeng to use lidar sensors from DJI affiliate Livox,googlenews,2021-01-04 09:32:08
EDD accounts suspended over suspected fraud,googlenews,2021-01-04 09:32:08
Milwaukee flight makes emergency landing in South Dakota,googlenews,2021-01-04 09:32:08
"More than 20 years of airline passenger traffic growth got erased in 2020, report finds",googlenews,2021-01-04 09:32:08
"Oregon is No. 41 in nation for its slow coronavirus vaccine rollout, trailing U.S. average",googlenews,2021-01-04 09:32:08
PSA shareholders approve mega-merger with Fiat,googlenews,2021-01-04 09:32:08
The Chrysler brand could be axed under Stellantis management,googlenews,2021-01-04 09:32:08
Shareholders vote to approve PSA merger with Fiat Chrysler,googlenews,2021-01-04 09:32:08
Fiat Chrysler’s John Elkann Nears Crowning Achievement With PSA Merger,googlenews,2021-01-04 09:32:08
First full week of trade in the new year to start on a good note; SGX indicates 14100 and above!,googlenews,2021-01-04 09:32:08
Stock futures climb as Wall Street looks for a positive start to the new year,googlenews,2021-01-04 09:32:08
"S&P 500, Dow aim record open as economic rebound hopes fuel rally",googlenews,2021-01-04 09:32:08
December 2020 Market Wrap: Modest Gains After A Huge Year. What's Next?,googlenews,2021-01-04 09:32:08
Bitcoin falls over 10% as record-breaking rally loses steam,googlenews,2021-01-04 09:32:08
Bitcoin price briefly fell below $30000 as derivatives positions worth more than a billion-dollar get liquidated,googlenews,2021-01-04 09:32:08
Bitcoin Suddenly Drops 13% as Altcoins Continue to Rise,googlenews,2021-01-04 09:32:08
Bitcoin plummets 17% for its biggest drop since March as record-shattering rally stumbles,googlenews,2021-01-04 09:32:08
Chipotle's newest food is anti-carb and it will cost you $2 extra,googlenews,2021-01-04 09:32:08
"Chipotle launches Cilantro-Lime Cauliflower Rice, four new lifestyle bowls in time for New Year's resolutions",googlenews,2021-01-04 09:32:08
Chipotle Launches Cilantro-Lime Cauliflower Rice in US and Canadian Restaurants,googlenews,2021-01-04 09:32:08
"Chipotle's slimming down for the new year too, adding cauliflower rice to its menu",googlenews,2021-01-04 09:32:08
"Google, Alphabet employees to form union",googlenews,2021-01-04 09:32:08
"Hundreds of Google Employees Unionize, Culminating Years of Activism",googlenews,2021-01-04 09:32:08
Google employees announce creation of union | TheHill,googlenews,2021-01-04 09:32:08
"Google Workers Unionize, Escalating Tension With Management",googlenews,2021-01-04 09:32:08
Brookfield offers to take real estate arm private in $5.9 billion deal,googlenews,2021-01-04 09:32:08
Brookfield Asset Management offers to buy limited partnership units of Brookfield Property for $5.9 billion,googlenews,2021-01-04 09:32:08
Brookfield to take real estate division private for $5.9B,googlenews,2021-01-04 09:32:08
Brookfield to take real estate arm private in $5.9bn deal,googlenews,2021-01-04 09:32:08
Carl Icahn cuts Herbalife stake and relinquishes his five board seats,googlenews,2021-01-04 09:32:08
Carl Icahn sells over half of his stake in Herbalife,googlenews,2021-01-04 09:32:08
Carl Icahn Sells More Than Half of His Herbalife Stake,googlenews,2021-01-04 09:32:08
"Icahn Sells $600 Million Herbalife Stake, Gives Up Board Seats",googlenews,2021-01-04 09:32:08
Wall Street will kick out three big Chinese telecom companies,googlenews,2021-01-04 09:32:08
China Oil Majors May Be Next U.S. Target After Telcos Delisting,googlenews,2021-01-04 09:32:08
NYSE delists top Chinese mobile operators in latest US crackdown,googlenews,2021-01-04 09:32:08
China’s Big Telcos lose US$1.5 billion of value on NYSE delisting plan,googlenews,2021-01-04 09:32:08
"Feds may cut Moderna vaccine doses in half so more people get shots, Warp Speed adviser says",googlenews,2021-01-04 09:32:08
"U.S. may cut some Moderna vaccine doses in half to speed rollout, official says",googlenews,2021-01-04 09:32:08
Sally Pipes: COVID vaccinations are going much too slowly — here’s how to speed them up and save lives,googlenews,2021-01-04 09:32:08
Will 'Warp Speed' come to a grinding halt?,googlenews,2021-01-04 09:32:08
"Oil prices give up early gains, trade lower on rising Covid cases",googlenews,2021-01-04 09:32:08
Oil Erases Gain With OPEC+ Set to Decide on February Output,googlenews,2021-01-04 09:32:08
"Oil Up, Even as Fuel Demand Worries Linger",googlenews,2021-01-04 09:32:08
Oil Price Fundamental Daily Forecast – Heightened Volatility as OPEC+ Debates February Output Strategy,googlenews,2021-01-04 09:32:08
Chinese electric car company Nio doubles deliveries in 2020 as local competition ramps up for Tesla,googlenews,2021-01-04 09:32:08
XPeng Is the Latest EV Company to Report Positive Delivery News,googlenews,2021-01-04 09:32:08
Nio's Record Run Continues As Deliveries Spike 121% In December; EV Maker Confirms Sedan Launch On 'Nio Day',googlenews,2021-01-04 09:32:08
Nio Launches 'NIO Certified' Used Car Service in China Amid Competitive Pressure From Tesla,googlenews,2021-01-04 09:32:08
Chinese billionaire Jack Ma suspected missing since October | World News | WION News,googlenews,2021-01-04 09:32:08
Chinese billionaire Jack Ma suspected missing,googlenews,2021-01-04 09:32:08
Beijing’s Ant-Eaters,googlenews,2021-01-04 09:32:08
Where Is Alibaba Founder Jack Ma? What the Saga of One of the World's Richest Men Reveals About China Under Xi Jinping,googlenews,2021-01-04 09:32:08
Redesigned Tesla Model S Reportedly Spotted in Palo Alto,googlenews,2021-01-04 09:32:08
Tesla fell 450 vehicles short of sales target in 2020,googlenews,2021-01-04 09:32:08
Tesla updates Model 3 with new design accent and heated steering wheel,googlenews,2021-01-04 09:32:08
Tesla's record run continues,googlenews,2021-01-04 09:32:08
What’s reopening Monday in Philadelphia and Pennsylvania,googlenews,2021-01-04 09:32:08
"Pa. indoor dining ban, some other pandemic restrictions expire Monday",googlenews,2021-01-04 09:32:08
"COVID-19 In Pittsburgh: Gyms, Restaurants Ready To Reopen As Coronavirus Restrictions Are Lifted",googlenews,2021-01-04 09:32:08
A breakdown of the COVID restrictions being lifted and those still in effect,googlenews,2021-01-04 09:32:08
MGM Makes $11 Billion Offer for Ladbrokes Owner Entain,googlenews,2021-01-04 09:32:08
MGM Resorts looking to buy Ladbrokes owner Entain,googlenews,2021-01-04 09:32:08
"MORNING BUSINESS REPORT: CT's best small town, MGM resorts, growing in space",googlenews,2021-01-04 09:32:08
Ladbrokes owner Entain receives $11 billion takeover offer from MGM,googlenews,2021-01-04 09:32:08
"Discovery Plus is Already Available to Download on Apple TV, Amazon Fire TV, Roku Android TV, & Mobile",googlenews,2021-01-04 09:32:08
"Discovery+ streaming service goes live with new '90 Day' series, and shows from Chip and Joanna Gaines",googlenews,2021-01-04 09:32:08
Discovery+ Launches Today: Here's What to Know About the New Streaming Service,googlenews,2021-01-04 09:32:08
Discovery Prepares for ‘Company-vs.-Company Combat’ as Discovery+ Debuts,googlenews,2021-01-04 09:32:08
PA indoor dining ban and some other coronavirus restrictions expire Monday,googlenews,2021-01-04 09:32:08
Restaurant owners ready for return of indoor dining,googlenews,2021-01-04 09:32:08
"Bars, restaurants in Pennsylvania preparing to reopen for indoor dining Monday",googlenews,2021-01-04 09:32:08
Indoor Activities to Resume in PA,googlenews,2021-01-04 09:32:08
South Korean and China's Shenzhen stocks surge in first trading day of 2021,googlenews,2021-01-04 09:32:08
Asia Manufacturing Picks Up Pace as China Starts to Moderate,googlenews,2021-01-04 09:32:08
Manufacturers Overcame Covid-19 Setbacks to End 2020 on High Note,googlenews,2021-01-04 09:32:08
Euro zone manufacturing ends 2020 on high as German factories hum -PMIs,googlenews,2021-01-04 09:32:08
Roku Nears Deal to Buy Rights to Quibi’s Content,googlenews,2021-01-04 09:32:08
Roku In Talks To Acquire Rights To Quibi’s Library – Report,googlenews,2021-01-04 09:32:08
Roku In Advanced Talks To Grab Beleaguered Quibi's Content Library: WSJ,googlenews,2021-01-04 09:32:08
Quibi's content library could make its way to Roku,googlenews,2021-01-04 09:32:08
"Hand sanitizer manufacturers hit with 'surprise' fee, later reversed, but leaves one with gallons it can't sell",googlenews,2021-01-04 09:32:08
"Distillery owners rejoice after $14,000 fee for making hand sanitizer during pandemic waived",googlenews,2021-01-04 09:32:08
"Distilleries that made hand sanitizer avoid $14,000 fee",googlenews,2021-01-04 09:32:08
Thousands in fees dropped against local distillers who assisted in hand sanitizer efforts,googlenews,2021-01-04 09:32:08
It’s time to consider delaying the second dose of coronavirus vaccine,googlenews,2021-01-04 09:32:08
NJ hospital workers to get 2nd dose of COVID vaccine Monday,googlenews,2021-01-04 09:32:08
"The Covid vaccine is safe, whatever anti-vaxxers say. Here's why we can trust it.",googlenews,2021-01-04 09:32:08
Op-Ed: Should Those Who Recovered From COVID Take the Vaccine?,googlenews,2021-01-04 09:32:08
Record COVID-19 hospitalizations in NC surge past 3500; nearly 6500 new cases,googlenews,2021-01-04 09:32:08
COVID-19 hospitalizations hit record high in North Carolina,googlenews,2021-01-04 09:32:08
"More than 10,000 North Carolina students unaccounted for",googlenews,2021-01-04 09:32:08
"NC coronavirus update January 4: Free COVID-19 testing continues in Raleigh, Wake County",googlenews,2021-01-04 09:32:08
Need to workout but worried about gyms? Here are some options,googlenews,2021-01-04 09:32:08
"Check these 3 things at your gym for COVID-19 safety, health expert urges",googlenews,2021-01-04 09:32:08
Gyms and fitness studios need clear guidelines to stay open and survive the pandemic | Opinion,googlenews,2021-01-04 09:32:08
New Year’s resolutions look different for gyms during pandemic,googlenews,2021-01-04 09:32:08
"Tesla, FLIR Systems, Roku, Magellan Health - Monday's Premarket Movers",googlenews,2021-01-04 09:32:08
What to watch today: Wall Street set to pick up where 2020 left off,googlenews,2021-01-04 09:32:08
Wolseley sold for £308m,googlenews,2021-01-04 09:32:08
"Ferguson sells UK arm to Clayton, Dubilier & Rice for £308m",googlenews,2021-01-04 09:32:08
New owners for Wolseley UK,googlenews,2021-01-04 09:32:08
Ferguson inks £308m sale of plumbing supplies business Wolseley UK,googlenews,2021-01-04 09:32:08
"Minimum wage increase good for workers, tough on California small businesses during pandemic",googlenews,2021-01-04 09:32:08
New laws taking effect in 2021,googlenews,2021-01-04 09:32:08
Minimum wage increases in Missouri and Illinois,googlenews,2021-01-04 09:32:08
All the states raising their minimum wages in the new year,googlenews,2021-01-04 09:32:08
SolarWinds hack may be bigger than previously believed,googlenews,2021-01-04 09:32:08
SolarWinds hack may be much worse than originally feared,googlenews,2021-01-04 09:32:08
U.S. officials are reportedly privately worried Russia stole blueprints for U.S. blackout restoration,googlenews,2021-01-04 09:32:08
SolarWinds hack may have been much wider than first thought,googlenews,2021-01-04 09:32:08
What we know about the new PPP loans for small businesses,googlenews,2021-01-04 09:32:08
"Minority-owned companies waited months for PPP loans, data shows",googlenews,2021-01-04 09:32:08
"Minority-owned companies waited months for loans, data shows",googlenews,2021-01-04 09:32:08
Will Paycheck Protection rule changes prevent 'rich get richer situation?',googlenews,2021-01-04 09:32:08
'It just stopped my heart': Cash from Barstool a 'lifesaver' for Wallingford restaurant,googlenews,2021-01-04 09:32:08
Barstool Sports lends a hand to Wallingford restaurant struggling amid pandemic,googlenews,2021-01-04 09:32:08
Fairport restaurant gets financial lifesaver from Barstool Sports,googlenews,2021-01-04 09:32:08
Banks Billiards keeps doors open thanks to help from Barstool Sports,googlenews,2021-01-04 09:32:08
Toll increases now in effect on Pennsylvania Turnpike,googlenews,2021-01-04 09:32:08
Tolls on the Pennsylvania Turnpike went up on January 3rd,googlenews,2021-01-04 09:32:08
Editorial: Endless Pennsylvania Turnpike toll hikes must come to an end,googlenews,2021-01-04 09:32:08
PA Turnpike prices increase again,googlenews,2021-01-04 09:32:08
World's Safest Airlines ; Qantas tops once again as safest airline for 2021,googlenews,2021-01-04 09:32:08
Government reinforces Air Serbia as turbulence rocks Balkan carriers,googlenews,2021-01-04 09:32:08
Europe’s airline industry after COVID,googlenews,2021-01-04 09:32:08
Top Twenty Safest Airlines for 2021,googlenews,2021-01-04 09:32:08
"Pizza Hut Is Giving Away New 'Nothing But Stuffed Crust' At These Select Locations From Jan. 5 To Jan. 7, 2021",googlenews,2021-01-04 09:32:08
Breakfast Briefing: 5 things for PR pros to know on Monday morning,googlenews,2021-01-04 09:32:08
Epic Games Buys a Shopping Mall,googlenews,2021-01-04 09:32:08
Epic Games to buy Cary Towne Center for future headquarters,googlenews,2021-01-04 09:32:08
Epic Games announces new headquarters at Cary Towne Center site,googlenews,2021-01-04 09:32:08
"Epic Games buys Cary Towne Center for $95M, plans new headquarters campus",googlenews,2021-01-04 09:32:08
Feeling lucky? These lottery prizes are above $400M,googlenews,2021-01-04 09:32:08
Iowa lottery jackpots to rise in 2021 after low prizes due to pandemic,googlenews,2021-01-04 09:32:08
"Major Powerball, Mega Millions jackpots start out 2021",googlenews,2021-01-04 09:32:08
"KY Man Plays Numbers Based Off Movie, Claims $2M Powerball Prize",googlenews,2021-01-04 09:32:08
"Sunday update shows 1819 new COVID-19 cases, 7 deaths in Utah",googlenews,2021-01-04 09:32:08
"Sunday brings Utah 1,819 new COVID-19 cases, 7 deaths",googlenews,2021-01-04 09:32:08
"Jan 3. data: Over 1,300 total deaths as positive testing rate nears 30%",googlenews,2021-01-04 09:32:08
"Utah's COVID-19 positive testing rate nears 30% as total deaths reach over 1,300",googlenews,2021-01-04 09:32:08
Singapore Continues Slow Recovery From Worst Economic Slump,googlenews,2021-01-04 09:32:08
Singapore Fourth Quarter GDP Better Than Expected,googlenews,2021-01-04 09:32:08
Singapore's virus-hit economy suffers worst decline in 2020,googlenews,2021-01-04 09:32:08
Singapore’s recovery from its worst recession proves to be patchy,googlenews,2021-01-04 09:32:08
Sunday COVID update includes data from Friday and Saturday,googlenews,2021-01-04 09:32:08
Alibi Drinkery Vandalized With Graffiti After Opening Against Order On New Year’s Eve,googlenews,2021-01-04 09:32:08
"Minnesota sees 53 more COVID deaths, 2714 new cases in two-day report",googlenews,2021-01-04 09:32:08
Statewide COVID-19 numbers continue downward trend,googlenews,2021-01-04 09:32:08
Iconic Pink's Hot Dogs In Fairfax District To Temporarily Close,googlenews,2021-01-04 09:32:08
COVID-19 surge prompts two month closure of iconic Pink’s hot dogs,googlenews,2021-01-04 09:32:08
Owner says Pink’s Hot Dogs is temporarily closing to keep people safe amid COVID-19 surge,googlenews,2021-01-04 09:32:08
Coronavirus Surge Prompts Two-Month Closure of Pink's Hot Dogs,googlenews,2021-01-04 09:32:08
Dollar starts 2021 in the cellar with a hangover,googlenews,2021-01-04 09:32:08
Dollar extends 2020 losing streak amid upbeat sentiment; yuan shines,googlenews,2021-01-04 09:32:08
How Japan can truly reinvent itself as a global financial hub,googlenews,2021-01-04 09:32:08
"Asia shares start new year in upbeat mood, much already priced in",googlenews,2021-01-04 09:32:08
Covid-19: Oxford-AstraZeneca vaccine rollout to begin @BBC News live - BBC,googlenews,2021-01-04 09:32:08
"Pfizer, BioNTech to offer vaccine to volunteers who got placebo",googlenews,2021-01-04 09:32:08
Questions over UK vaccination plans as Oxford/AstraZeneca roll-out begins - BBC News,googlenews,2021-01-04 09:32:08
Factbox: Astra-Oxford vaccine - what's been said about dosage and efficacy,googlenews,2021-01-04 09:32:08
Should Investors Be Worried About Pfizer and BioNTech's Coronavirus Vaccine Rollout?,googlenews,2021-01-04 09:32:08
1 Green Flag and 1 Red Flag For Pfizer's and Moderna's Vaccine Rollouts,googlenews,2021-01-04 09:32:08
Johnson & Johnson's single-dose vaccine next to seek emergency use authorization,googlenews,2021-01-04 09:32:08
Here Are the Unanswered Questions Coronavirus Vaccine-Makers Still Face,googlenews,2021-01-04 09:32:08
Inside Penn Station’s new train hall: Soaring skylights brighten commuter hub,googlenews,2021-01-04 09:32:08
Eyes on the Street: All Rise for the New Moynihan Train Hall (Because You Can't SIT There!),googlenews,2021-01-04 09:32:08
"""Long Overdue"": Visitors Marvel At New Moynihan Train Hall In First Walkthrough",googlenews,2021-01-04 09:32:08
The new Moynihan Train Station offers hope for out-of-town commuters,googlenews,2021-01-04 09:32:08
Mining sector drives big rally for FTSE 100 as gold and other metals surge,googlenews,2021-01-04 09:32:08
European markets bounce in first trading session of the new year; Travel stocks up 3.1%,googlenews,2021-01-04 09:32:08
"What to watch: Shares surge as post-Brexit era begins, Ladbrokes rejects takeover offer, and Sir Martin Sorrell's deal making",googlenews,2021-01-04 09:32:08
FTSE 100 jumps as Covid vaccine prompts recovery hopes,googlenews,2021-01-04 09:32:08
"What Cruise Changes Will Royal Caribbean Bring From Singapore to the US? What's Staying, What's Going",googlenews,2021-01-04 09:32:08
Rime Ice vs. Hoarfrost,googlenews,2021-01-04 09:32:08
Freezing Fog lays down a feathery frost across the QCA,googlenews,2021-01-04 09:32:08
"Daily Gold News: Monday, Jan. 4 – Gold Breaking Higher",googlenews,2021-01-04 09:32:08
"Commodity strategies: Gold, silver, crude, base metals",googlenews,2021-01-04 09:32:08
"Gold prices climb above Rs 51,000/10 gm on safe-haven demand, silver rises Rs 2,000 a kg",googlenews,2021-01-04 09:32:08
Gold prices surge today as yellow metal hit 8-week high internationally; silver jumps over 2%,googlenews,2021-01-04 09:32:08
'Now is not the time to loosen restrictions': Stay-at-home order for Greater Sacramento region ex...,googlenews,2021-01-04 09:32:08
Greater Sacramento Region Remains Under Regional Stay at Home Order,googlenews,2021-01-04 09:32:08
Sacramento to remain under Regional Stay at Home Order,googlenews,2021-01-04 09:32:08
Stay-at-home order for Greater Sacramento region extended,googlenews,2021-01-04 09:32:08
Solar now 'cheapest electricity in history': How much will it matter?,googlenews,2021-01-04 09:32:08
Georgia Sends Renewable Energy Love Letter To Rust Belt State,googlenews,2021-01-04 09:32:08
Adani to develop 600MW solar-wind hybrid project following SECI auction success,googlenews,2021-01-04 09:32:08
Total: Renewable Natural Gas Adds To Green Growth Engine,googlenews,2021-01-04 09:32:08
U.S. dollar index falls to lowest level since April 2018,googlenews,2021-01-04 09:32:08
It’s Genesis Block Day. Do You Know Where Your Bitcoin Keys Are?,googlenews,2021-01-04 09:32:08
All-time highs meet altseason: 5 things to watch in Bitcoin this week,googlenews,2021-01-04 09:32:08
"Bitcoin rallies above $30,000 for first time after advancing over 300% in 2020",googlenews,2021-01-04 09:32:08
"Target recalling tens of thousands of infant rompers, swimsuits due to choking hazard",googlenews,2021-01-04 09:32:08
"Recall Roundup: Rashguard Swimsuit, Infant Rompers, and French Silk Pie",googlenews,2021-01-04 09:32:08
Target issues recall on some baby clothing due to choking hazards,googlenews,2021-01-04 09:32:08
Target recalls baby clothes over possible choking hazard,googlenews,2021-01-04 09:32:08
Readers respond: Oregon flubs vaccine rollout,googlenews,2021-01-04 09:32:08
Readers respond: Elderly should get vaccine soon,googlenews,2021-01-04 09:32:08
8 Stocks That Could Double Your Money in 2021,motleyfool,2021-01-04 09:34:06
Start Your Investing Resolutions Off Right With This Classic Stock Bundle,motleyfool,2021-01-04 09:34:06
My 3 Best Stocks to Buy in January,motleyfool,2021-01-04 09:34:06
There's a Big Problem With FuboTV Stock,motleyfool,2021-01-04 09:34:06
