headline,org,date
"Beautiful whole towns for sale starting at $500,000",msnmoney,2021-03-23 09:32:28
Beautiful old homes for sale across America,msnmoney,2021-03-23 09:32:28
Forget the 30yr mortgage if you owe less than $356K. (Do this instead),msnmoney,2021-03-23 09:32:28
The Trump family’s secret $49m Florida home is up for sale,msnmoney,2021-03-23 09:32:28
"People who don't get a $1,400 direct payment by March 24 can expect mailed checks, Treasury says",msnmoney,2021-03-23 09:32:28
New Rule For Cars Used Less Than 50 Miles a Day,msnmoney,2021-03-23 09:32:28
GOP Sen. Ron Johnson falsely claimed Greenland only recently froze and now admits he has 'no idea' about its history,msnmoney,2021-03-23 09:32:28
US Marine Corps fires another commander over the assault amphibious vehicle accident that killed 9 troops,msnmoney,2021-03-23 09:32:28
"The 5 worst things people are doing with stimulus checks, Suze Orman says",msnmoney,2021-03-23 09:32:28
This Will Purify The Air In Your House In No Time,msnmoney,2021-03-23 09:32:28
Photos capture Trump's personal Boeing 757 sitting unused at Stewart International Airport,msnmoney,2021-03-23 09:32:28
Skip the Doctor and Upgrade to the World's Smartest CPAP,msnmoney,2021-03-23 09:32:28
"Some $1,400 stimulus checks will be mailed payments. It's not junk mail, so here's how to make sure you don't miss them",msnmoney,2021-03-23 09:32:28
Amazon.com Inc. stock underperforms Monday when compared to competitors despite daily gains,msnmoney,2021-03-23 09:32:28
Donald Trump's new business idea could be his most controversial yet,msnmoney,2021-03-23 09:32:28
Why Are White Caterpillars So Bad For Your Garden?,msnmoney,2021-03-23 09:32:28
"Opinion: Erase student loan debt up to $10,000, but only for borrowers under this income threshold",msnmoney,2021-03-23 09:32:28
A lucrative card for Americans with good credit,msnmoney,2021-03-23 09:32:28
Baidu has rallied 200% in the past year. Analysts bet it can keep going as it lists in Hong Kong,msnmoney,2021-03-23 09:32:28
"Existing home sales fell sharply in February, as supply dropped by the largest amount on record",msnmoney,2021-03-23 09:32:28
How the home appraisal gap makes homeownership more difficult and costly for Black families,msnmoney,2021-03-23 09:32:28
"Top student loans trends for the week of March 22, 2021: Borrowers to receive forgiveness through borrower defense to repayment",msnmoney,2021-03-23 09:32:28
10 Best Home Improvement Projects Under $500,msnmoney,2021-03-23 09:32:28
25 Hilarious Construction Mistakes You Have to See to Believe,msnmoney,2021-03-23 09:32:28
Loop Capital's Chukumba on GameStop: Fundamentals have 'completely' been disconnected with stock price,msnmoney,2021-03-23 09:32:28
Peter Cecchini: I'm seeing surge in growth stocks 'inorganic' mostly driven by stimulus,msnmoney,2021-03-23 09:32:28
Why Tom McClellan is warning of a 'scary feeling' market dip,msnmoney,2021-03-23 09:32:28
Op-ed: There's an increased demand for financial advice. Are advisors up to the challenge?,msnmoney,2021-03-23 09:32:28
Manhattan Apartment Sales Up 73% in February: Could NYC Recover Faster Than Expected?,msnmoney,2021-03-23 09:32:28
Woman Uses Trick To Turn Dusty House Into Fresh Air Paradise,msnmoney,2021-03-23 09:32:28
"Pension funds have to buy bonds to rebalance portfolios, and that might be good for stocks",msnmoney,2021-03-23 09:32:28
"As a second batch of $1,400 stimulus payments arrives this week, some Social Security and other federal beneficiaries are left out",msnmoney,2021-03-23 09:32:28
The ECB’s Lane says lockdowns won’t derail European recovery. The market is starting to get jittery.,msnmoney,2021-03-23 09:32:28
Did you know the government owns a piece of your traditional 401(k) or IRA? Here's how to get it back,msnmoney,2021-03-23 09:32:28
"ETF Wrap: We’ve gone to the dogs, and more on the Barstool bro for March Madness",msnmoney,2021-03-23 09:32:28
Uncommon Facts About Royal Pregnancies,msnmoney,2021-03-23 09:32:28
"Taco Bell is adding 1,000 drive-thru 'bellhops' as chain tweaks traditional and Cantina stores for a post pandemic world",msnmoney,2021-03-23 09:32:28
"Bitcoin may be entering the 'later stages' of a bull market, crypto analysts say, as talk of a price plunge grows",msnmoney,2021-03-23 09:32:28
"My landlord gave me a waiver on rent as I waited for Section 8 rental assistance — 25 years later, she wants me to pay $1,700",msnmoney,2021-03-23 09:32:28
Abandoned shopping malls closed for good,msnmoney,2021-03-23 09:32:28
"IRS says more stimulus checks on the way: But when will seniors, others on Social Security get COVID payments?",msnmoney,2021-03-23 09:32:28
"[Gallery] Jaclyn Smith Is Almost 80, This Is Her Now",msnmoney,2021-03-23 09:32:28
"‘I feel un-American’: I was broke in my 20s, and live in fear of debt. My wife wants to upgrade our home and life. What do I do?",msnmoney,2021-03-23 09:32:28
"Tesla Scores The World's First 8,000-Ton Casting Machine For Its Cybertruck: Report",msnmoney,2021-03-23 09:32:28
"Johnson & Johnson stock rises Monday, still underperforms market",msnmoney,2021-03-23 09:32:28
Here’s more evidence that the next decade for stocks won’t be as good as the last,msnmoney,2021-03-23 09:32:28
Renters have more leverage than ever—here are 6 tips to negotiate your next lease,msnmoney,2021-03-23 09:32:28
54 Classified Photos Just Released To The Public,msnmoney,2021-03-23 09:32:28
Citigroup CEO Jane Fraser has banned video calls on a Friday and launched a 'Citi Reset Day' holiday to relieve stress on staff,msnmoney,2021-03-23 09:32:28
Lockheed Martin partners with satellite start-up Omnispace to build a space-based 5G network,msnmoney,2021-03-23 09:32:28
Global stocks: Chinese markets slump as tit-for-tat sanctions raise tension with US and Europe,msnmoney,2021-03-23 09:32:28
Making it rain: DraftKings co-founders pocket more than $600 million combined in 2020,msnmoney,2021-03-23 09:32:28
"Upstart shares are up 171% in three days, as momentum pours into fintech company",msnmoney,2021-03-23 09:32:28
Cat Memes So Funny We Could Just Cry,msnmoney,2021-03-23 09:32:28
"GameStop earnings countdown: But what’s the fun in fundamentals, ask Reddit traders on the rocket-emoji launchpad",msnmoney,2021-03-23 09:32:28
13 slick ways to make yourself save more money,msnmoney,2021-03-23 09:32:28
Monopoly is eliminating beauty contest ‘Community Chest’ cards as it updates for modern players,msnmoney,2021-03-23 09:32:28
Mortgage and real estate news this week: Tips for homebuying season and pandemic moving trends,msnmoney,2021-03-23 09:32:28
Postmaster General set to announce 10-year plan including longer mail delivery times and cuts to post office hours,msnmoney,2021-03-23 09:32:28
"Bitcoin, crypto investors will be watching these 5 questions facing the Biden administration",msnmoney,2021-03-23 09:32:28
People Are Freaking Out About The Ram Pickup Price Drop,msnmoney,2021-03-23 09:32:28
"5 Top Stock Gainers for Monday: Synnex, Cubic, Kansas City Southern",msnmoney,2021-03-23 09:32:28
Retirement Planning for the Self-Employed: 5 Options for Lowering Taxes and Maximizing Saving,msnmoney,2021-03-23 09:32:28
One Beneficiary Mistake You Really Don’t Want to Make,msnmoney,2021-03-23 09:32:28
"Beautiful whole towns for sale starting at $500,000",msnmoney,2021-03-23 09:32:28
Beautiful old homes for sale across America,msnmoney,2021-03-23 09:32:28
Forget the 30yr mortgage if you owe less than $356K. (Do this instead),msnmoney,2021-03-23 09:32:28
The Trump family’s secret $49m Florida home is up for sale,msnmoney,2021-03-23 09:32:28
"People who don't get a $1,400 direct payment by March 24 can expect mailed checks, Treasury says",msnmoney,2021-03-23 09:32:28
New Rule For Cars Used Less Than 50 Miles a Day,msnmoney,2021-03-23 09:32:28
GOP Sen. Ron Johnson falsely claimed Greenland only recently froze and now admits he has 'no idea' about its history,msnmoney,2021-03-23 09:32:28
US Marine Corps fires another commander over the assault amphibious vehicle accident that killed 9 troops,msnmoney,2021-03-23 09:32:28
"The 5 worst things people are doing with stimulus checks, Suze Orman says",msnmoney,2021-03-23 09:32:28
This Will Purify The Air In Your House In No Time,msnmoney,2021-03-23 09:32:28
Photos capture Trump's personal Boeing 757 sitting unused at Stewart International Airport,msnmoney,2021-03-23 09:32:28
Skip the Doctor and Upgrade to the World's Smartest CPAP,msnmoney,2021-03-23 09:32:28
"Some $1,400 stimulus checks will be mailed payments. It's not junk mail, so here's how to make sure you don't miss them",msnmoney,2021-03-23 09:32:28
Amazon.com Inc. stock underperforms Monday when compared to competitors despite daily gains,msnmoney,2021-03-23 09:32:28
Donald Trump's new business idea could be his most controversial yet,msnmoney,2021-03-23 09:32:28
Why Are White Caterpillars So Bad For Your Garden?,msnmoney,2021-03-23 09:32:28
"Opinion: Erase student loan debt up to $10,000, but only for borrowers under this income threshold",msnmoney,2021-03-23 09:32:28
A lucrative card for Americans with good credit,msnmoney,2021-03-23 09:32:28
Baidu has rallied 200% in the past year. Analysts bet it can keep going as it lists in Hong Kong,msnmoney,2021-03-23 09:32:28
"Existing home sales fell sharply in February, as supply dropped by the largest amount on record",msnmoney,2021-03-23 09:32:28
How the home appraisal gap makes homeownership more difficult and costly for Black families,msnmoney,2021-03-23 09:32:28
"Top student loans trends for the week of March 22, 2021: Borrowers to receive forgiveness through borrower defense to repayment",msnmoney,2021-03-23 09:32:28
10 Best Home Improvement Projects Under $500,msnmoney,2021-03-23 09:32:28
25 Hilarious Construction Mistakes You Have to See to Believe,msnmoney,2021-03-23 09:32:28
Loop Capital's Chukumba on GameStop: Fundamentals have 'completely' been disconnected with stock price,msnmoney,2021-03-23 09:32:28
Peter Cecchini: I'm seeing surge in growth stocks 'inorganic' mostly driven by stimulus,msnmoney,2021-03-23 09:32:28
Why Tom McClellan is warning of a 'scary feeling' market dip,msnmoney,2021-03-23 09:32:28
Op-ed: There's an increased demand for financial advice. Are advisors up to the challenge?,msnmoney,2021-03-23 09:32:28
Manhattan Apartment Sales Up 73% in February: Could NYC Recover Faster Than Expected?,msnmoney,2021-03-23 09:32:28
Woman Uses Trick To Turn Dusty House Into Fresh Air Paradise,msnmoney,2021-03-23 09:32:28
"Pension funds have to buy bonds to rebalance portfolios, and that might be good for stocks",msnmoney,2021-03-23 09:32:28
"As a second batch of $1,400 stimulus payments arrives this week, some Social Security and other federal beneficiaries are left out",msnmoney,2021-03-23 09:32:28
The ECB’s Lane says lockdowns won’t derail European recovery. The market is starting to get jittery.,msnmoney,2021-03-23 09:32:28
Did you know the government owns a piece of your traditional 401(k) or IRA? Here's how to get it back,msnmoney,2021-03-23 09:32:28
"ETF Wrap: We’ve gone to the dogs, and more on the Barstool bro for March Madness",msnmoney,2021-03-23 09:32:28
Uncommon Facts About Royal Pregnancies,msnmoney,2021-03-23 09:32:28
"Taco Bell is adding 1,000 drive-thru 'bellhops' as chain tweaks traditional and Cantina stores for a post pandemic world",msnmoney,2021-03-23 09:32:28
"Bitcoin may be entering the 'later stages' of a bull market, crypto analysts say, as talk of a price plunge grows",msnmoney,2021-03-23 09:32:28
"My landlord gave me a waiver on rent as I waited for Section 8 rental assistance — 25 years later, she wants me to pay $1,700",msnmoney,2021-03-23 09:32:28
Abandoned shopping malls closed for good,msnmoney,2021-03-23 09:32:28
"IRS says more stimulus checks on the way: But when will seniors, others on Social Security get COVID payments?",msnmoney,2021-03-23 09:32:28
"[Gallery] Jaclyn Smith Is Almost 80, This Is Her Now",msnmoney,2021-03-23 09:32:28
"‘I feel un-American’: I was broke in my 20s, and live in fear of debt. My wife wants to upgrade our home and life. What do I do?",msnmoney,2021-03-23 09:32:28
"Tesla Scores The World's First 8,000-Ton Casting Machine For Its Cybertruck: Report",msnmoney,2021-03-23 09:32:28
"Johnson & Johnson stock rises Monday, still underperforms market",msnmoney,2021-03-23 09:32:28
Here’s more evidence that the next decade for stocks won’t be as good as the last,msnmoney,2021-03-23 09:32:28
Renters have more leverage than ever—here are 6 tips to negotiate your next lease,msnmoney,2021-03-23 09:32:28
54 Classified Photos Just Released To The Public,msnmoney,2021-03-23 09:32:28
Citigroup CEO Jane Fraser has banned video calls on a Friday and launched a 'Citi Reset Day' holiday to relieve stress on staff,msnmoney,2021-03-23 09:32:28
Lockheed Martin partners with satellite start-up Omnispace to build a space-based 5G network,msnmoney,2021-03-23 09:32:28
Global stocks: Chinese markets slump as tit-for-tat sanctions raise tension with US and Europe,msnmoney,2021-03-23 09:32:28
Making it rain: DraftKings co-founders pocket more than $600 million combined in 2020,msnmoney,2021-03-23 09:32:28
"Upstart shares are up 171% in three days, as momentum pours into fintech company",msnmoney,2021-03-23 09:32:28
Cat Memes So Funny We Could Just Cry,msnmoney,2021-03-23 09:32:28
"GameStop earnings countdown: But what’s the fun in fundamentals, ask Reddit traders on the rocket-emoji launchpad",msnmoney,2021-03-23 09:32:28
13 slick ways to make yourself save more money,msnmoney,2021-03-23 09:32:28
Monopoly is eliminating beauty contest ‘Community Chest’ cards as it updates for modern players,msnmoney,2021-03-23 09:32:28
Mortgage and real estate news this week: Tips for homebuying season and pandemic moving trends,msnmoney,2021-03-23 09:32:28
Postmaster General set to announce 10-year plan including longer mail delivery times and cuts to post office hours,msnmoney,2021-03-23 09:32:28
"Bitcoin, crypto investors will be watching these 5 questions facing the Biden administration",msnmoney,2021-03-23 09:32:28
People Are Freaking Out About The Ram Pickup Price Drop,msnmoney,2021-03-23 09:32:28
"5 Top Stock Gainers for Monday: Synnex, Cubic, Kansas City Southern",msnmoney,2021-03-23 09:32:28
Retirement Planning for the Self-Employed: 5 Options for Lowering Taxes and Maximizing Saving,msnmoney,2021-03-23 09:32:28
One Beneficiary Mistake You Really Don’t Want to Make,msnmoney,2021-03-23 09:32:28
Futures fall after Germany extends lockdown; traders await Powell,yahoofinance,2021-03-23 09:33:24
"Tesla stock is off its high, but it's not 'on sale': trader",yahoofinance,2021-03-23 09:33:24
Cineworld to reopen cinemas in the US and UK,yahoofinance,2021-03-23 09:33:24
"DoorDash gets into COVID testing, offers delivery",yahoofinance,2021-03-23 09:33:24
Matt Damon: Bill Gates taught me humanity ‘moving in right direction’,yahoofinance,2021-03-23 09:33:24
Yahoo Finance Presents: Scott Keogh,yahoofinance,2021-03-23 09:33:24
Tax hikes are the next big investor worry,yahoofinance,2021-03-23 09:33:24
Bed Bath & Beyond launched a first attack on Target,yahoofinance,2021-03-23 09:33:24
NJ:  Notice For Cars Used Less Than 25 Miles A Day,yahoofinance,2021-03-23 09:33:24
"‘I feel un-American’: I was broke in my 20s, and live in fear of debt. My wife wants to upgrade our home and life. What do I do?",yahoofinance,2021-03-23 09:33:24
Analysts Say ‘Buy the Pullback’ in These 3 Stocks,yahoofinance,2021-03-23 09:33:24
Obamacare health insurance just got much cheaper for early retirees,yahoofinance,2021-03-23 09:33:24
Joe Biden Wants to Raise Taxes. What It Would Mean for the Stock Market.,yahoofinance,2021-03-23 09:33:24
Why This High Dividend REIT Could Be A Steal Right Now,yahoofinance,2021-03-23 09:33:24
5 Growing Renewable Energy Stocks That Have Dropped Sharply,yahoofinance,2021-03-23 09:33:24
Pensions Giant Says Treasury Yields at 3% Will Change Everything,yahoofinance,2021-03-23 09:33:24
Best Dividend Stocks For 2021: Five Strong-Yield Stocks Beating The S&P 500,yahoofinance,2021-03-23 09:33:24
Why Cathie Wood's Ark Is Unimpressed With Volkswagen's EV Battery Plans,yahoofinance,2021-03-23 09:33:24
"'Bitcoin Winter' Could Last For Years After Price Hits $300,000: BTCC Exchange Founder",yahoofinance,2021-03-23 09:33:24
"The 5 worst things people are doing with stimulus checks, Suze Orman says",yahoofinance,2021-03-23 09:33:24
AI Is Booming: 2 ‘Strong Buy’ Stocks That Stand to Benefit,yahoofinance,2021-03-23 09:33:24
5 Stocks Top Analysts Are Heavily Bullish On Heading Into April,yahoofinance,2021-03-23 09:33:24
Shares in companies linked to non-fungible tokens soar,yahoofinance,2021-03-23 09:33:24
The Economy Is Beginning to Reopen. Here Are 6 REITs That Stand to Benefit.,yahoofinance,2021-03-23 09:33:24
Coherent stock gains after Lumentum counters II-VI's latest bid with a higher buyout proposal,yahoofinance,2021-03-23 09:33:24
"IRS says more stimulus checks on the way: But when will seniors, others on Social Security get COVID payments?",yahoofinance,2021-03-23 09:33:24
Warren Buffett’s Berkshire Hathaway Pared Down Its Bank Holdings. That Looks Like a $10 Billion Mistake.,yahoofinance,2021-03-23 09:33:24
Why ARK Innovation’s red-hot returns aren’t as impressive as they seem,yahoofinance,2021-03-23 09:33:24
"Ionis, 3D Systems, Unity, BYD, Deere — What Cathie Wood's Ark Bought And Sold Today",yahoofinance,2021-03-23 09:33:24
Are Any Marijuana Stocks Good Buys Amid March Cooldown?,yahoofinance,2021-03-23 09:33:24
QuantumScape Seeks $859 Million to Fund Pilot Line Expansion,yahoofinance,2021-03-23 09:33:24
Dow Jones Futures Fall: Are Tech Stocks Back? 3 Tech Giants Lead Stock Market Rally,yahoofinance,2021-03-23 09:33:24
3 Railroad Stocks To Watch Amid Canadian Pacific And Kansas City Southern Merger,yahoofinance,2021-03-23 09:33:24
Is Pfizer Stock A Buy As The Company Bolsters Its Covid Vaccine Supply?,yahoofinance,2021-03-23 09:33:24
"Adobe to Post Q1 Earnings, Revenue Growth of About 22%; Target Price $563",yahoofinance,2021-03-23 09:33:24
5 Easy Ways to Protect Your Retirement  Savings from Taxes,yahoofinance,2021-03-23 09:33:24
These Stocks Are More of a Gamble Than an Investment — and the #1 Is a Reddit Favorite,yahoofinance,2021-03-23 09:33:24
Stock market news live updates: Futures fall after Germany extends lockdown; traders await Powell,yahoofinance,2021-03-23 09:33:24
UPDATE 3-GameStop loses second senior exec as shakeup deepens,yahoofinance,2021-03-23 09:33:24
"Treasury yields fall as market readies for Powell testimony, debt auctions",yahoofinance,2021-03-23 09:33:24
Plug Power and FuelCell Boom Raises Specter of 2000 Bust,yahoofinance,2021-03-23 09:33:24
Support.com stock skyrockets after merger deal with bitcoin mining company,yahoofinance,2021-03-23 09:33:24
Best Tech Stocks To Buy Or Watch Now: 5 Growth Stocks Holding Up Well Amid Tech Sell-Off,yahoofinance,2021-03-23 09:33:24
Microsoft Said To Be In Discussions To Acquire Discord For Over $10B,yahoofinance,2021-03-23 09:33:24
UPDATE 2-Mega insurance merger derailed as Hartford rejects rival Chubb's offer,yahoofinance,2021-03-23 09:33:24
"Keep on Buying Alibaba Stock, Says Analyst Following Investor Meeting",yahoofinance,2021-03-23 09:33:24
QuantumScape Stock Is Sliding. Here’s Why.,yahoofinance,2021-03-23 09:33:24
"Investors are getting worried about a stock market bubble, but Goldman says relax",yahoofinance,2021-03-23 09:33:24
"Cramer: $3,000 Tesla Price Target Would Be 'Hype' From Anyone But Cathie Wood",yahoofinance,2021-03-23 09:33:24
"'Halftime Report' Final Trades: Roku, AbbVie And More",yahoofinance,2021-03-23 09:33:24
"Ocugen: Potential Covid-19 Vaccine EUA Warrants a Buy, Says Analyst",yahoofinance,2021-03-23 09:33:24
Volkswagen Stock Jumps As Electric Vehicle Crown Expected Soon,yahoofinance,2021-03-23 09:33:24
What the Top 1% Are Hiding From the IRS,yahoofinance,2021-03-23 09:33:24
3 Small-Cap Energy Sectors With Major Upside,yahoofinance,2021-03-23 09:33:24
Why Analysts See More Upside To Baidu Stock Over The 200% Surge In Past Year,yahoofinance,2021-03-23 09:33:24
Market Recap With Jim Cramer: Stocks to Buy Now,yahoofinance,2021-03-23 09:33:24
"Dow Jones Today Dips, Nasdaq Futures Rise Ahead Of Powell/Yellen Hearing; China Stocks Stumble After U.S. Sanctions",yahoofinance,2021-03-23 09:33:24
Earnings Preview: Bionano Genomics,yahoofinance,2021-03-23 09:33:24
Microvision Stock Gains Ground Monday: Technical Levels To Watch,yahoofinance,2021-03-23 09:33:24
Top Oil Stocks To Watch In U.S. Shale As Crude Prices Rise,yahoofinance,2021-03-23 09:33:24
"'Mad Money' Lightning Round: Marvell Tech, Lithia, more",yahoofinance,2021-03-23 09:33:24
IRS misses ‘substantial’ tax evasion by the wealthiest Americans — this study calculates just how much,yahoofinance,2021-03-23 09:33:24
What's Happening With UPST Stock And ROKU Stock Today?,yahoofinance,2021-03-23 09:33:24
Baidu becomes first technology giant to make a flat debut in Hong Kong stock market this year as investors spurn the pivot by China's dominant search engine towards artificial intelligence,yahoofinance,2021-03-23 09:33:24
Butterflies In Apple's Stomach? Judge Allows Macbook Owners To File Class Action Lawsuit,yahoofinance,2021-03-23 09:33:24
"Luminar Is on Course to Lead the Auto Lidar Industry, Says Analyst",yahoofinance,2021-03-23 09:33:24
BioCryst Technical Levels To Watch,yahoofinance,2021-03-23 09:33:24
Change of menu: Kraft Heinz bets on old brands to win new consumers,yahoofinance,2021-03-23 09:33:24
"General Mills to sell its stake in Yoplait European operations, take ownership of Canadian Yoplait business",yahoofinance,2021-03-23 09:33:24
Oil prices sink 4% as European COVID curbs raise demand worries,yahoofinance,2021-03-23 09:33:24
US Oil Prices Fall Below $60 As European Lockdowns Hit Demand,yahoofinance,2021-03-23 09:33:24
"Hartford Financial rejects Chubb's hostile buyout bid, stock falls",yahoofinance,2021-03-23 09:33:24
"Banned From WallStreetBets, Reddit User Tired Of GameStop Talks Creates 'WallStreetSilver'",yahoofinance,2021-03-23 09:33:24
Build Your Portfolio With These Best Mutual Funds That Repeatedly Top The Market,yahoofinance,2021-03-23 09:33:24
Looking Into Palantir Technologies's Return On Capital Employed,yahoofinance,2021-03-23 09:33:24
Broadcom: Abundant Growth And Margin Opportunities Could Push Shares Higher,yahoofinance,2021-03-23 09:33:24
"How ExxonMobil Makes Money: Upstream, Downstream, Chemical",yahoofinance,2021-03-23 09:33:24
"Nio, Xpeng, Li Auto Hire Investment Advisors For Hong Kong IPO: Report",yahoofinance,2021-03-23 09:33:24
Bank of America CEO Says Its Earnings Are Poised to ‘Substantially Increase’ as Rates Rise,yahoofinance,2021-03-23 09:33:24
"Bitcoin Breaks Below Short-Term Uptrend, Lower Support Around $50K",yahoofinance,2021-03-23 09:33:24
Futures Edge Down as Oil Slumps; Bonds Advance: Markets Wrap,yahoofinance,2021-03-23 09:33:24
What 6 Analyst Ratings Have To Say About ONEOK,yahoofinance,2021-03-23 09:33:24
2 Highflying Social Media Stocks Just Got Downgraded. Why Their Runs Could Be Over.,yahoofinance,2021-03-23 09:33:24
5 Value Stocks To Watch In The Healthcare Sector,yahoofinance,2021-03-23 09:33:24
Why GRPN Stock And ODT Stock Are Trading Lower Today,yahoofinance,2021-03-23 09:33:24
3 Monster Growth Stocks With Potential for Further Gains,yahoofinance,2021-03-23 09:33:24
Odonate Therapeutics stock plummets toward record low after plan to 'wind down' operations,yahoofinance,2021-03-23 09:33:24
DraftKings Stock: Is It A Buy Right Now After Deal With UFC?,yahoofinance,2021-03-23 09:33:24
"Is Home Depot Stock A Buy Right Now After Q4 Earnings? Here's What Earnings, Charts Show",yahoofinance,2021-03-23 09:33:24
U.S. Health Officials Raise Concerns Over AstraZeneca Data,wsj,2021-03-23 09:34:47
Pfizer Goes It Alone to Expand Vaccine Business Beyond Covid-19,wsj,2021-03-23 09:34:47
"Dow, S&P Slip Ahead of Powell’s Testimony",wsj,2021-03-23 09:34:47
Hospitals Stung by Pandemic Seek Remainder of Relief Fund Payouts,wsj,2021-03-23 09:34:47
"Boulder Shooting Leaves 10 Dead, Including Police Officer",wsj,2021-03-23 09:34:47
Tech Stocks Led the Market Rally. Now They’re Falling Behind.,wsj,2021-03-23 09:34:47
Elon Musk Woos China With Praise for Its Climate Plans,wsj,2021-03-23 09:34:47
Prince Harry Takes On a New Title: Chief Impact Officer,wsj,2021-03-23 09:34:47
Airport Retail Shops Pin Hopes on Bump in Travel,wsj,2021-03-23 09:34:47
Netanyahu’s Future in Balance as Israel Votes,wsj,2021-03-23 09:34:47
NFTs Are Music Industry’s Latest Hit,wsj,2021-03-23 09:34:47
The NCAA’s Sweet 16 Busted Your Bracket—Thank These Underdogs,wsj,2021-03-23 09:34:47
"Biden’s Wealthiest Cabinet Officials: Zients, Lander, Rice Top the List",wsj,2021-03-23 09:34:47
A Chef Who Can’t Smell? Covid Forces Some Creative Solutions,wsj,2021-03-23 09:34:47
Chinese Tech Faces New Curbs on Connecting Banks and Borrowers,wsj,2021-03-23 09:34:47
"Wirecard Aided Online Marijuana Sales, Prosecutors Allege",wsj,2021-03-23 09:34:47
London Metal Exchange’s Overhaul Meets Resistance,wsj,2021-03-23 09:34:47
"Microsoft Prepares to Reopen Offices, Enter Hybrid-Work Era",wsj,2021-03-23 09:34:47
Black Steps Down as Apollo Global’s Chairman,wsj,2021-03-23 09:34:47
Flooding Inundates Australia a Year After Wildfires Raged,wsj,2021-03-23 09:34:47
"U.S., Allies Sanction China Over Treatment of Uyghurs",wsj,2021-03-23 09:34:47
Should Central Banks Tame House Prices? New Zealand Gives It a Try,wsj,2021-03-23 09:34:47
Track the Covid-19 Vaccine Rollout,wsj,2021-03-23 09:34:47
Biden Advisers Put Together $3 Trillion Economic Plan,wsj,2021-03-23 09:34:47
"Boston Gets First Black Woman Mayor, Reflecting City’s Changes",wsj,2021-03-23 09:34:47
White House Enlists Groups on Vaccine-Hesitancy Campaign to Sway Conservatives,wsj,2021-03-23 09:34:47
