headline,org,date
Opinion: ‘Trump stocks’ have significantly lagged the U.S. market since 2016 — while ‘Clinton stocks’ have soared,msnmoney,2020-10-20 08:01:02
Things you should never try to sell on eBay,msnmoney,2020-10-20 08:01:02
Gantt Charts: 4 Rules Every Manager Needs to Know,msnmoney,2020-10-20 08:01:02
Citi ThankYou Points guide,msnmoney,2020-10-20 08:01:02
22 Mistakes That Send Energy Bills Soaring,msnmoney,2020-10-20 08:01:02
Seniors On Medicare Are Getting a Big Pay Day,msnmoney,2020-10-20 08:01:02
Vale Is Ramping Up Faster Than Thought in New Blow to Iron Bulls,msnmoney,2020-10-20 08:01:02
The Most Expensive ZIP Code in Every State,msnmoney,2020-10-20 08:01:02
"Mortgage Rates Today, October 20, 2020 | Rates abate",msnmoney,2020-10-20 08:01:02
Unique Tip If Your Car Has Automatic Headlights,msnmoney,2020-10-20 08:01:02
The most luxurious retirement communities in America,msnmoney,2020-10-20 08:01:02
Now presenting: Potential home and auto savings!,msnmoney,2020-10-20 08:01:02
"Intel, IBM, Netflix, Moderna - 5 Things You Must Know Tuesday",msnmoney,2020-10-20 08:01:02
How Trump and Biden would handle the Covid-19 social security crisis,msnmoney,2020-10-20 08:01:02
4 Smart Ways Medicare Beneficiaries Are Cutting Prescription Costs,msnmoney,2020-10-20 08:01:02
Homes in these 25 waterfront cities are a total steal,msnmoney,2020-10-20 08:01:02
"Opinion: Here’s what to know about U.S. stocks over the really long term — 227 years, in fact",msnmoney,2020-10-20 08:01:02
"39 Hottest Gifts Of 2020 (Hurry, These Will Be Gone Very Soon)",msnmoney,2020-10-20 08:01:02
Here's why you should never play the lottery,msnmoney,2020-10-20 08:01:02
3 Key Social Security Numbers You Need to Know,msnmoney,2020-10-20 08:01:02
How much do Americans spend on Halloween?,msnmoney,2020-10-20 08:01:02
Premarket stocks: Why investors shouldn't count on another big stimulus package,msnmoney,2020-10-20 08:01:02
Cool Airbnb and VRBO rentals to book now for winter,msnmoney,2020-10-20 08:01:02
Most wine drinkers in the US don't know these 5 simple Dos and Don'ts,msnmoney,2020-10-20 08:01:02
50 habits to make your first million,msnmoney,2020-10-20 08:01:02
These Elite Colleges Went Virtual — But Raised Tuition Anyway,msnmoney,2020-10-20 08:01:02
Veggie Burger or Veggie ‘Disc’ on Menu? EU Vote Will Decide,msnmoney,2020-10-20 08:01:02
Things every retiree should get rid of,msnmoney,2020-10-20 08:01:02
Showcase these 5 essential skills to show you’re a standout remote worker,msnmoney,2020-10-20 08:01:02
People Say This Wood Restorer Makes Old Cabinets Look New Again,msnmoney,2020-10-20 08:01:02
17 Cities That Are Getting Richer,msnmoney,2020-10-20 08:01:02
BlackRock Says Scale of Restructuring May Exceed 2008 Crisis,msnmoney,2020-10-20 08:01:02
50 Cities Where You Need a Side Hustle To Get By,msnmoney,2020-10-20 08:01:02
China Leisure Spending Remains a Drag on Rebounding Economy,msnmoney,2020-10-20 08:01:02
Best and Worst States for America’s Middle Class,msnmoney,2020-10-20 08:01:02
"Spend $500, get $200 fast with this top card",msnmoney,2020-10-20 08:01:02
10 Tips to Get More Bang From Your Bank,msnmoney,2020-10-20 08:01:02
SNAP and other income-relief programs for seniors,msnmoney,2020-10-20 08:01:02
Lysol Maker Sees Fastest Growth in Decade on Disinfectants,msnmoney,2020-10-20 08:01:02
Here Are the Best Jobs in America — Is Your Job One of Them?,msnmoney,2020-10-20 08:01:02
What is an 80/10/10 piggyback loan?,msnmoney,2020-10-20 08:01:02
60 Beautiful Places Left To Rot And Decay,msnmoney,2020-10-20 08:01:02
10 Things Stopping You From Getting a Relief Check,msnmoney,2020-10-20 08:01:02
Jack Ma’s Ant Receives Hong Kong Exchange Approval for IPO,msnmoney,2020-10-20 08:01:02
People in These States Are Having the Hardest Time Paying Rent,msnmoney,2020-10-20 08:01:02
The top pitfalls to look out for when buying a home,msnmoney,2020-10-20 08:01:02
10 countries where you could retire on just $100K,msnmoney,2020-10-20 08:01:02
Old Man's Neighbor Blocked His Driveway With Cinder Blocks So He Taught Him A Cruel Lesson,msnmoney,2020-10-20 08:01:02
BMW Joins Daimler Getting Boost From Auto-Sales Recovery,msnmoney,2020-10-20 08:01:02
"As Apple Hits $2 Trillion, Which Stocks Are Headed the Other Direction?",msnmoney,2020-10-20 08:01:02
Workplace Etiquette for the Office and Remote,msnmoney,2020-10-20 08:01:02
Things you probably don't know about Costco,msnmoney,2020-10-20 08:01:02
"The Trump administration let aviation companies lay off more than 16,500 workers while taking coronavirus relief funds — some used the money to pay executives — according to a congressional report",msnmoney,2020-10-20 08:01:02
1 Simple Trick to Cut Your Electric Bill by 90%,msnmoney,2020-10-20 08:01:02
15 Cities With the Most Adult Children Living at Home,msnmoney,2020-10-20 08:01:02
"Refi fee necessary because mortgage giants ‘not close to safety and soundness,’ federal regulator says",msnmoney,2020-10-20 08:01:02
States With Scary Death Taxes,msnmoney,2020-10-20 08:01:02
UBS Lines up $1.5 Billion for Buybacks,msnmoney,2020-10-20 08:01:02
What You Can Rent on a Minimum-Wage Salary in Every State,msnmoney,2020-10-20 08:01:02
Eat Just Inc. plans to build its 1st plant protein facility in SG,msnmoney,2020-10-20 08:01:02
"10 Worst States To Retire In, According To 401K Specialists",msnmoney,2020-10-20 08:01:02
5 Ways the Internet Is Changing and 1 Way It’s Staying the Same,msnmoney,2020-10-20 08:01:02
5 Fresh Kitchen Backsplash Ideas,msnmoney,2020-10-20 08:01:02
What to know about retiring abroad,msnmoney,2020-10-20 08:01:02
Dubai’s Union Properties Restructuring Debt to Weather Real Estate Slump,msnmoney,2020-10-20 08:01:02
8 Retirement Costs Overlooked by a Majority of Americans,msnmoney,2020-10-20 08:01:02
5 Surprising Second Acts for Dying Malls,msnmoney,2020-10-20 08:01:02
Why is this glasses selling like hotcakes in Virginia?,msnmoney,2020-10-20 08:01:02
Biggest pizza chains in America,msnmoney,2020-10-20 08:01:02
The sustainable sneaker start-up Allbirds wants to take over your closet,msnmoney,2020-10-20 08:01:02
Secrets for building wealth during a recession,msnmoney,2020-10-20 08:01:02
"WeWork's chairman said Adam Neumann 'may have violated' the terms of his $185 million consulting contract with his former company, and that it's is no longer in effect",msnmoney,2020-10-20 08:01:02
Reasons you shouldn't buy a house,msnmoney,2020-10-20 08:01:02
Google rolls out new program with HBCUs to help Black job seekers secure in-demand jobs,msnmoney,2020-10-20 08:01:02
Homeowners With Old AC Systems Can Get New Energy Efficient Replacement,msnmoney,2020-10-20 08:01:02
The 20 Industries That Will Never Be the Same After the Coronavirus,msnmoney,2020-10-20 08:01:02
Modi to Seek Cash From State-Owned Companies Via Buybacks,msnmoney,2020-10-20 08:01:02
10 ways to DIY your 2nd stimulus check (and forget Congress),msnmoney,2020-10-20 08:01:02
Smart Money Podcast: Sudden Retirement and Finding Lost Money,msnmoney,2020-10-20 08:01:02
"15 strategies to boost your income, starting this weekend",msnmoney,2020-10-20 08:01:02
Lowe's kicks off holiday deals in October and launches Christmas tree delivery program,msnmoney,2020-10-20 08:01:02
"Before you renew Amazon Prime, read this",msnmoney,2020-10-20 08:01:02
Beautiful old homes for sale across America,msnmoney,2020-10-20 08:01:02
How to save for retirement,msnmoney,2020-10-20 08:01:02
"If Amy Coney Barrett Is Confirmed, Will She Be the Richest Supreme Court Justice?",msnmoney,2020-10-20 08:01:02
Top-Ranked U.S. Business Schools Are Losing Vital Foreign Students,msnmoney,2020-10-20 08:01:02
These Are All the States With Trump Properties and Businesses,msnmoney,2020-10-20 08:01:02
25 good careers where you can be your own boss,msnmoney,2020-10-20 08:01:02
Opinion: ‘Trump stocks’ have significantly lagged the U.S. market since 2016 — while ‘Clinton stocks’ have soared,msnmoney,2020-10-20 08:01:02
Things you should never try to sell on eBay,msnmoney,2020-10-20 08:01:02
Gantt Charts: 4 Rules Every Manager Needs to Know,msnmoney,2020-10-20 08:01:02
Citi ThankYou Points guide,msnmoney,2020-10-20 08:01:02
22 Mistakes That Send Energy Bills Soaring,msnmoney,2020-10-20 08:01:02
Seniors On Medicare Are Getting a Big Pay Day,msnmoney,2020-10-20 08:01:02
Vale Is Ramping Up Faster Than Thought in New Blow to Iron Bulls,msnmoney,2020-10-20 08:01:02
The Most Expensive ZIP Code in Every State,msnmoney,2020-10-20 08:01:02
"Mortgage Rates Today, October 20, 2020 | Rates abate",msnmoney,2020-10-20 08:01:02
Unique Tip If Your Car Has Automatic Headlights,msnmoney,2020-10-20 08:01:02
The most luxurious retirement communities in America,msnmoney,2020-10-20 08:01:02
Now presenting: Potential home and auto savings!,msnmoney,2020-10-20 08:01:02
"Intel, IBM, Netflix, Moderna - 5 Things You Must Know Tuesday",msnmoney,2020-10-20 08:01:02
How Trump and Biden would handle the Covid-19 social security crisis,msnmoney,2020-10-20 08:01:02
4 Smart Ways Medicare Beneficiaries Are Cutting Prescription Costs,msnmoney,2020-10-20 08:01:02
Homes in these 25 waterfront cities are a total steal,msnmoney,2020-10-20 08:01:02
"Opinion: Here’s what to know about U.S. stocks over the really long term — 227 years, in fact",msnmoney,2020-10-20 08:01:02
"39 Hottest Gifts Of 2020 (Hurry, These Will Be Gone Very Soon)",msnmoney,2020-10-20 08:01:02
Here's why you should never play the lottery,msnmoney,2020-10-20 08:01:02
3 Key Social Security Numbers You Need to Know,msnmoney,2020-10-20 08:01:02
How much do Americans spend on Halloween?,msnmoney,2020-10-20 08:01:02
Premarket stocks: Why investors shouldn't count on another big stimulus package,msnmoney,2020-10-20 08:01:02
Cool Airbnb and VRBO rentals to book now for winter,msnmoney,2020-10-20 08:01:02
Most wine drinkers in the US don't know these 5 simple Dos and Don'ts,msnmoney,2020-10-20 08:01:02
50 habits to make your first million,msnmoney,2020-10-20 08:01:02
These Elite Colleges Went Virtual — But Raised Tuition Anyway,msnmoney,2020-10-20 08:01:02
Veggie Burger or Veggie ‘Disc’ on Menu? EU Vote Will Decide,msnmoney,2020-10-20 08:01:02
Things every retiree should get rid of,msnmoney,2020-10-20 08:01:02
Showcase these 5 essential skills to show you’re a standout remote worker,msnmoney,2020-10-20 08:01:02
People Say This Wood Restorer Makes Old Cabinets Look New Again,msnmoney,2020-10-20 08:01:02
17 Cities That Are Getting Richer,msnmoney,2020-10-20 08:01:02
BlackRock Says Scale of Restructuring May Exceed 2008 Crisis,msnmoney,2020-10-20 08:01:02
50 Cities Where You Need a Side Hustle To Get By,msnmoney,2020-10-20 08:01:02
China Leisure Spending Remains a Drag on Rebounding Economy,msnmoney,2020-10-20 08:01:02
Best and Worst States for America’s Middle Class,msnmoney,2020-10-20 08:01:02
"Spend $500, get $200 fast with this top card",msnmoney,2020-10-20 08:01:02
10 Tips to Get More Bang From Your Bank,msnmoney,2020-10-20 08:01:02
SNAP and other income-relief programs for seniors,msnmoney,2020-10-20 08:01:02
Lysol Maker Sees Fastest Growth in Decade on Disinfectants,msnmoney,2020-10-20 08:01:02
Here Are the Best Jobs in America — Is Your Job One of Them?,msnmoney,2020-10-20 08:01:02
What is an 80/10/10 piggyback loan?,msnmoney,2020-10-20 08:01:02
60 Beautiful Places Left To Rot And Decay,msnmoney,2020-10-20 08:01:02
10 Things Stopping You From Getting a Relief Check,msnmoney,2020-10-20 08:01:02
Jack Ma’s Ant Receives Hong Kong Exchange Approval for IPO,msnmoney,2020-10-20 08:01:02
People in These States Are Having the Hardest Time Paying Rent,msnmoney,2020-10-20 08:01:02
The top pitfalls to look out for when buying a home,msnmoney,2020-10-20 08:01:02
10 countries where you could retire on just $100K,msnmoney,2020-10-20 08:01:02
Old Man's Neighbor Blocked His Driveway With Cinder Blocks So He Taught Him A Cruel Lesson,msnmoney,2020-10-20 08:01:02
BMW Joins Daimler Getting Boost From Auto-Sales Recovery,msnmoney,2020-10-20 08:01:02
"As Apple Hits $2 Trillion, Which Stocks Are Headed the Other Direction?",msnmoney,2020-10-20 08:01:02
Workplace Etiquette for the Office and Remote,msnmoney,2020-10-20 08:01:02
Things you probably don't know about Costco,msnmoney,2020-10-20 08:01:02
"The Trump administration let aviation companies lay off more than 16,500 workers while taking coronavirus relief funds — some used the money to pay executives — according to a congressional report",msnmoney,2020-10-20 08:01:02
1 Simple Trick to Cut Your Electric Bill by 90%,msnmoney,2020-10-20 08:01:02
15 Cities With the Most Adult Children Living at Home,msnmoney,2020-10-20 08:01:02
"Refi fee necessary because mortgage giants ‘not close to safety and soundness,’ federal regulator says",msnmoney,2020-10-20 08:01:02
States With Scary Death Taxes,msnmoney,2020-10-20 08:01:02
UBS Lines up $1.5 Billion for Buybacks,msnmoney,2020-10-20 08:01:02
What You Can Rent on a Minimum-Wage Salary in Every State,msnmoney,2020-10-20 08:01:02
Eat Just Inc. plans to build its 1st plant protein facility in SG,msnmoney,2020-10-20 08:01:02
"10 Worst States To Retire In, According To 401K Specialists",msnmoney,2020-10-20 08:01:02
5 Ways the Internet Is Changing and 1 Way It’s Staying the Same,msnmoney,2020-10-20 08:01:02
5 Fresh Kitchen Backsplash Ideas,msnmoney,2020-10-20 08:01:02
What to know about retiring abroad,msnmoney,2020-10-20 08:01:02
Dubai’s Union Properties Restructuring Debt to Weather Real Estate Slump,msnmoney,2020-10-20 08:01:02
8 Retirement Costs Overlooked by a Majority of Americans,msnmoney,2020-10-20 08:01:02
5 Surprising Second Acts for Dying Malls,msnmoney,2020-10-20 08:01:02
Why is this glasses selling like hotcakes in Virginia?,msnmoney,2020-10-20 08:01:02
Biggest pizza chains in America,msnmoney,2020-10-20 08:01:02
The sustainable sneaker start-up Allbirds wants to take over your closet,msnmoney,2020-10-20 08:01:02
Secrets for building wealth during a recession,msnmoney,2020-10-20 08:01:02
"WeWork's chairman said Adam Neumann 'may have violated' the terms of his $185 million consulting contract with his former company, and that it's is no longer in effect",msnmoney,2020-10-20 08:01:02
Reasons you shouldn't buy a house,msnmoney,2020-10-20 08:01:02
Google rolls out new program with HBCUs to help Black job seekers secure in-demand jobs,msnmoney,2020-10-20 08:01:02
Homeowners With Old AC Systems Can Get New Energy Efficient Replacement,msnmoney,2020-10-20 08:01:02
The 20 Industries That Will Never Be the Same After the Coronavirus,msnmoney,2020-10-20 08:01:02
Modi to Seek Cash From State-Owned Companies Via Buybacks,msnmoney,2020-10-20 08:01:02
10 ways to DIY your 2nd stimulus check (and forget Congress),msnmoney,2020-10-20 08:01:02
Smart Money Podcast: Sudden Retirement and Finding Lost Money,msnmoney,2020-10-20 08:01:02
"15 strategies to boost your income, starting this weekend",msnmoney,2020-10-20 08:01:02
Lowe's kicks off holiday deals in October and launches Christmas tree delivery program,msnmoney,2020-10-20 08:01:02
"Before you renew Amazon Prime, read this",msnmoney,2020-10-20 08:01:02
Beautiful old homes for sale across America,msnmoney,2020-10-20 08:01:02
How to save for retirement,msnmoney,2020-10-20 08:01:02
"If Amy Coney Barrett Is Confirmed, Will She Be the Richest Supreme Court Justice?",msnmoney,2020-10-20 08:01:02
Top-Ranked U.S. Business Schools Are Losing Vital Foreign Students,msnmoney,2020-10-20 08:01:02
These Are All the States With Trump Properties and Businesses,msnmoney,2020-10-20 08:01:02
25 good careers where you can be your own boss,msnmoney,2020-10-20 08:01:02
Markets don’t actually hate uncertainty,yahoofinance,2020-10-20 08:03:20
"Futures rise, traders hope final stimulus effort yields a deal",yahoofinance,2020-10-20 08:03:20
"Microsoft, SpaceX partner to target space customers: WSJ",yahoofinance,2020-10-20 08:03:20
Goldman poised to pay more than $2B in DOJ’s 1MDB probe,yahoofinance,2020-10-20 08:03:20
How Tiltify engages Generation Y and Generation Z on social issues,yahoofinance,2020-10-20 08:03:20
Home-builder sentiment hits record for third straight months,yahoofinance,2020-10-20 08:03:20
How to upgrade to the iPhone 12,yahoofinance,2020-10-20 08:03:20
"Markets Update, IBM, Netflix & Tesla, Housing Industry Success",yahoofinance,2020-10-20 08:03:20
How to invest in water sustainability,yahoofinance,2020-10-20 08:03:20
"10 countries where you can retire on just $100,000",yahoofinance,2020-10-20 08:03:20
Diesel Inventories Have Done Something In The U.S. Not Seen In At Least 30 Years,yahoofinance,2020-10-20 08:03:20
Jim Cramer: Meet the Magnificent Seven,yahoofinance,2020-10-20 08:03:20
The No. 1 difference between millionaire investors and the rest of us,yahoofinance,2020-10-20 08:03:20
The Bottom Is in for These 3 Stocks? Analysts Say ‘Buy’,yahoofinance,2020-10-20 08:03:20
Parsley Energy Jumps on Pioneer Natural Resources Takeover Talk,yahoofinance,2020-10-20 08:03:20
Hyundai Motor shares dive after engine woes prompt third-quarter profit warning,yahoofinance,2020-10-20 08:03:20
What to Know About Withdrawing Money From a Traditional IRA,yahoofinance,2020-10-20 08:03:20
"Pfizer: The Pace of COVID-19 Vaccine Development Is Remarkable, Says Analyst",yahoofinance,2020-10-20 08:03:20
"Kodak CEO Says Moving Forward On Generic Drug Ingredients Venture, With or Without Federal Loan",yahoofinance,2020-10-20 08:03:20
"Lockheed Martin Tops Q3 Earnings Forecast, Lifts 2020 Outlook",yahoofinance,2020-10-20 08:03:20
Tesla third-quarter registrations in California drop 13%: data,yahoofinance,2020-10-20 08:03:20
9 Best Tech Stocks to Buy in a Recession,yahoofinance,2020-10-20 08:03:20
Is Boeing Stock A Buy Right Now As 737 Max Nears Return?,yahoofinance,2020-10-20 08:03:20
"Procter & Gamble Tops Q1 Earnings Forecast, Boosts 2021 Sales Outlook",yahoofinance,2020-10-20 08:03:20
"Intel, IBM, Netflix, Moderna - 5 Things You Must Know Tuesday",yahoofinance,2020-10-20 08:03:20
P&G raises forecasts as cleaning product sales boom,yahoofinance,2020-10-20 08:03:20
GM Expected To Announce Expanded Electric Vehicle Production,yahoofinance,2020-10-20 08:03:20
Stock market news live updates: Stock futures rise as traders hope final stimulus effort yields a deal,yahoofinance,2020-10-20 08:03:20
"These 3 Penny Stocks Have Massive Upside Potential, Says Cowen",yahoofinance,2020-10-20 08:03:20
"Technology stocks may be about to drown in their own greatness, says JPMorgan",yahoofinance,2020-10-20 08:03:20
Intel agrees to sell its NAND business to SK Hynix for $9 billion,yahoofinance,2020-10-20 08:03:20
"Is Tesla Stock A Buy Right Now? Here's What Earnings, Charts Show",yahoofinance,2020-10-20 08:03:20
"Philip Morris's stock gains after profit, revenue beat expectations",yahoofinance,2020-10-20 08:03:20
DraftKings: 3 Positive Takeaways From the Turner Partnership,yahoofinance,2020-10-20 08:03:20
"Liz Weston: Playing the market is a bad idea, especially now",yahoofinance,2020-10-20 08:03:20
AT&T stock heads for lowest close since March,yahoofinance,2020-10-20 08:03:20
Cybersecurity Stocks To Buy As Covid-19 And Remote Work Speed Shift To Cloud,yahoofinance,2020-10-20 08:03:20
Tesla’s Earnings Will Be Dramatic. How to Play It With Stock Options.,yahoofinance,2020-10-20 08:03:20
What’s Behind the Massive Rally in Nio’s Stock Price? Analyst Weighs In,yahoofinance,2020-10-20 08:03:20
"Logitech Posts Blowout Profits Driven by Growth in Webcams, Game Gear",yahoofinance,2020-10-20 08:03:20
Is Wall Street Bullish On Apple Stock?,yahoofinance,2020-10-20 08:03:20
Kaixin Auto stock pulls back after a ‘surprise’ rocket ride higher,yahoofinance,2020-10-20 08:03:20
"Is American Airlines Stock A Buy? Here's What Earnings, Charts Show",yahoofinance,2020-10-20 08:03:20
Stock Market Today With Jim Cramer: Buy Boeing,yahoofinance,2020-10-20 08:03:20
Many stock investors are too young to remember Black Monday in October 1987  — why that’s a problem,yahoofinance,2020-10-20 08:03:20
Tesla third-quarter registrations in California drop 13% - data,yahoofinance,2020-10-20 08:03:20
"After a Banner Year for IPOs, Here Are the 10 Largest Unicorns Left in the Private Market",yahoofinance,2020-10-20 08:03:20
Value stocks ‘worst for 100 years’,yahoofinance,2020-10-20 08:03:20
All Eyes on Netflix and Snap Ahead of Earnings; Here’s What to Expect,yahoofinance,2020-10-20 08:03:20
Markets don’t actually hate uncertainty: Morning Brief,yahoofinance,2020-10-20 08:03:20
What Just Happened to NIO Stock — and What Investors Should Do About It,yahoofinance,2020-10-20 08:03:20
Transocean Receives NYSE Notice,yahoofinance,2020-10-20 08:03:20
BofA Names Its Top Clean Energy ETF Pick,yahoofinance,2020-10-20 08:03:20
"When retirement arrives sooner than expected: What to do, what to know",yahoofinance,2020-10-20 08:03:20
Netflix Reports Earnings Today. Here’s What to Expect.,yahoofinance,2020-10-20 08:03:20
"UBS gives employees COVID bonus of one week's pay, softens career exit",yahoofinance,2020-10-20 08:03:20
‘We bet on the wrong horse’: I co-signed my nephew’s $55K student loan: He has no degree and no job. What should we do?,yahoofinance,2020-10-20 08:03:20
"Is Baidu Stock A Buy Right Now? Here's What BIDU Stock Chart, Earnings Show",yahoofinance,2020-10-20 08:03:20
Piedmont Lithium to Issue U.S. Shares as Tesla Drives Interest,yahoofinance,2020-10-20 08:03:20
Goldman to pay over $2 billion in DOJ's 1MDB probe - Bloomberg News,yahoofinance,2020-10-20 08:03:20
"Kaixin Auto's stock skyrockets on massive volume, has gained 1,270% in four days",yahoofinance,2020-10-20 08:03:20
"Biogen Alzheimer's Drug Headed For Unfavorable Vote, Says An Analyst's Mock Panel",yahoofinance,2020-10-20 08:03:20
Tesla's Shift On Model 3 In Europe Signals Upside And Weakness,yahoofinance,2020-10-20 08:03:20
WeWork’s Adam Neumann Didn’t Get His Full $185 Million Fee From SoftBank,yahoofinance,2020-10-20 08:03:20
Pioneer Natural Shows M&A Interest In Parsley Energy: WSJ,yahoofinance,2020-10-20 08:03:20
AMC Entertainment's stock falls after stock offering disclosed,yahoofinance,2020-10-20 08:03:20
The $4.2 Trillion Trend Taking Over Wall Street,yahoofinance,2020-10-20 08:03:20
Why those highly paid investing pros do worse than a 401(k) committed to a boring stock index fund,yahoofinance,2020-10-20 08:03:20
"IBM Revenue Beats Estimates, Buoyed by Growth in Cloud Sales",yahoofinance,2020-10-20 08:03:20
"Wall Street Is Preparing for a Biden Victory, Higher Taxes and All",yahoofinance,2020-10-20 08:03:20
Strategist Who Foresaw September Slump Says S&P 500 May Fall 10%,yahoofinance,2020-10-20 08:03:20
Illinois to sell $850 million of bonds as investors brace for junk status,yahoofinance,2020-10-20 08:03:20
Cannabis Countdown: Top 10 Marijuana And Psychedelic Stock News Stories Of The Week,yahoofinance,2020-10-20 08:03:20
"Dow Jones Stocks To Buy And Watch In October 2020: Apple, Microsoft Offer New Buy Points",yahoofinance,2020-10-20 08:03:20
"Netflix, Tesla report earnings results: What to know in the week ahead",yahoofinance,2020-10-20 08:03:20
Magnificent Seven: Cramer's 'Mad Money' Recap (Monday 10/19/20),yahoofinance,2020-10-20 08:03:20
Brookfield Shuffles Real Estate Portfolio With Multiple Deals,yahoofinance,2020-10-20 08:03:20
Want to Buy Mortgage REITs? Here’s How to Pick Them.,yahoofinance,2020-10-20 08:03:20
Philip Morris Reports Earnings Tomorrow. Here’s What to Expect.,yahoofinance,2020-10-20 08:03:20
Year-End Retirement Planning Deadlines for 2020,yahoofinance,2020-10-20 08:03:20
"Biden’s Clean Grid Would Choke Gas, Even Without Fracking Ban",yahoofinance,2020-10-20 08:03:20
Tesla Analyst Raises Price Target To $500 Ahead Of Q3 Print,yahoofinance,2020-10-20 08:03:20
P&G Reports Earnings Tomorrow. Here’s What to Expect.,yahoofinance,2020-10-20 08:03:20
5 Value Stocks In The Real Estate Sector,yahoofinance,2020-10-20 08:03:20
"Is WBA Stock A Buy After Earnings? Here's What Fundamentals, Chart Show",yahoofinance,2020-10-20 08:03:20
"Sweden Bans Huawei, ZTE From New 5G Infrastructure",yahoofinance,2020-10-20 08:03:20
Logitech shares surge as COVID-19 boosts home-working,yahoofinance,2020-10-20 08:03:20
"Latin American payment giant rises amid pandemic, with an eye on China's Ant",yahoofinance,2020-10-20 08:03:20
Why Liquidia's Stock Is Trading Higher Today,yahoofinance,2020-10-20 08:03:20
"Verizon signs up Microsoft, Nokia to help clients build private 5G networks",yahoofinance,2020-10-20 08:03:20
BlackRock Says Scale of Restructuring May Exceed 2008 Crisis,yahoofinance,2020-10-20 08:03:20
Goldman Is Crushing It. Its Stock Remains a Bargain.,yahoofinance,2020-10-20 08:03:20
A Preview Of Calix's Earnings,yahoofinance,2020-10-20 08:03:20
Snap stock on track for record high ahead of earnings,yahoofinance,2020-10-20 08:03:20
Top 4 Mutual Fund Holders of Coca-Cola,yahoofinance,2020-10-20 08:03:20
Intel Agrees to Sell Storage Unit to SK Hynix for $9 Billion,yahoofinance,2020-10-20 08:03:20
"Lockheed Beats On Earnings, Lifts 2020 Views But Cautious On 2021",yahoofinance,2020-10-20 08:03:20
'Halftime Report' Traders Share Their Thoughts On Guggenheim's Bristol-Myers Call,yahoofinance,2020-10-20 08:03:20
"Corsair Stock Called A Play On Esports, PC Gaming Growth",yahoofinance,2020-10-20 08:03:20
"Cathay Pacific to cut 6,000 jobs, axe Cathay Dragon brand amid pandemic - SCMP",yahoofinance,2020-10-20 08:03:20
IBM Shares Slide On Muted Outlook Following Solid Q3 Earnings,yahoofinance,2020-10-20 08:03:20
"WDC Stock: Is It A Buy Right Now? Here's What Earnings, Western Digital Stock Charts Show",yahoofinance,2020-10-20 08:03:20
5 Value Stocks In The Communication Services Sector,yahoofinance,2020-10-20 08:03:20
5G Stocks To Buy And Watch: Will Apple's New IPhones Spark Consumer Upgrades?,yahoofinance,2020-10-20 08:03:20
Summer Produced Big Software IPOs But Only This One Is Near Buy Point,yahoofinance,2020-10-20 08:03:20
Goldman Sachs: 2 Stocks That Could Climb Over 90%,yahoofinance,2020-10-20 08:03:20
