headline,org,date
"Jim Cramer: AbbVie Did 'Much, Much Better Than Expected'",thestreet,2020-11-01 11:02:59
Square Lower on Talks to Buy Credit Karma Tax-Prep Unit,thestreet,2020-11-01 11:02:59
Why Jim Cramer's Not Confident In Exxon's Long-Term Plan,thestreet,2020-11-01 11:02:59
Texas Has Already Surpassed Its 2016 Election Vote Total,thestreet,2020-11-01 11:02:59
"Trupanion Earnings Beats Estimates, Shares Rise",thestreet,2020-11-01 11:02:59
"MGM Stock Off, Analyst Comment Mixed After Earnings",thestreet,2020-11-01 11:02:59
Apple iPhone Supercycle Still in Play - Wedbush Affirms Buy,thestreet,2020-11-01 11:02:59
Jim Cramer Isn't Worried About Apple's iPhone Revenue,thestreet,2020-11-01 11:02:59
Jim Cramer Says Starbucks CEO Kevin Johnson Is Too Bullish,thestreet,2020-11-01 11:02:59
Companies Fret Over Coronavirus Despite Rebound,googlenews,2020-11-01 11:04:52
"Airlines’ new pricing strategy: buy one, get one free",googlenews,2020-11-01 11:04:52
Fund Manager Nightmare Is Biden Without Blue Wave Congress,googlenews,2020-11-01 11:04:52
Israel begins human trials for coronavirus vaccine,googlenews,2020-11-01 11:04:52
Exclusive: Amazon tells India regulator its partner Future Retail is misleading public,googlenews,2020-11-01 11:04:52
Britain starts accelerated review for AstraZeneca's potential COVID-19 vaccine,googlenews,2020-11-01 11:04:52
How to protect yourself when someone in your home has COVID-19,googlenews,2020-11-01 11:04:52
Dutch government halts KLM bailout amid standoff over terms,googlenews,2020-11-01 11:04:52
Explained: The CDC ‘Conditional Sailing’ Order for Cruise Ships,googlenews,2020-11-01 11:04:52
Amazon drops French Black Friday ad campaign as lockdown starts,googlenews,2020-11-01 11:04:52
"Trump launches final, two-day frenzy of campaigning in bid for surprise win",googlenews,2020-11-01 11:04:52
Half of New Orleans area's powerless buildings are in Jefferson Parish,googlenews,2020-11-01 11:04:52
Trick-or-treating during COVID: 'Candypult' saves Halloween 2020,googlenews,2020-11-01 11:04:52
Don't Feed The Bears: Here's What To Do Now,googlenews,2020-11-01 11:04:52
Tech earnings took a dark turn this week with warnings about the coronavirus and election,googlenews,2020-11-01 11:04:52
Exxon Mobil Should Be Accepted For What It Truly Is,googlenews,2020-11-01 11:04:52
Johnson & Johnson to test COVID-19 vaccine in children ages 12 and up - Business Insider,googlenews,2020-11-01 11:04:52
Satoshi Nakamoto's Bitcoin White Paper: A 12-Year Old Summary of Robust Unstructured Simplicity,googlenews,2020-11-01 11:04:52
Netflix price hikes raise US cost of most popular plan by a dollar,googlenews,2020-11-01 11:04:52
Dunkin’ Brands to be bought by Inspire Brands for 11.3 billion,googlenews,2020-11-01 11:04:52
Best Black Friday TV deals available now and coming up,googlenews,2020-11-01 11:04:52
CoxHealth NICU babies dress up in Halloween costumes,googlenews,2020-11-01 11:04:52
3 Ways Saving in a Roth IRA Could Backfire on You,googlenews,2020-11-01 11:04:52
McRib lovers rejoice! McDonald's cult classic is coming back,googlenews,2020-11-01 11:04:52
"Investor on why bitcoin is 'literally the biggest story I've seen,' may hit $1M and top gold's market cap",googlenews,2020-11-01 11:04:52
Oil Markets Tumble On New Lockdown Measures,googlenews,2020-11-01 11:04:52
3 Things About Coronavirus Vaccines That You Almost Certainly Won't Like,googlenews,2020-11-01 11:04:52
"Today's mortgage refinance rates — one rate sees a minor upswing | October 30, 2020",googlenews,2020-11-01 11:04:52
Hands-on with T-Mobile TVision live TV: Worth $10 but not much more,googlenews,2020-11-01 11:04:52
Amazon Q3 Roundup: Analyst Sees Path For Stock To Hit $5K,googlenews,2020-11-01 11:04:52
A couple got married at the Dunkin' drive-thru where they met,googlenews,2020-11-01 11:04:52
Tesla Model 3 Full Self-Driving (FSD) Vs Ford Mustang Mach-E ‘Hands-Free’ Active Drive Assist: Quick Compare,googlenews,2020-11-01 11:04:52
Gold is now looking past the political games,googlenews,2020-11-01 11:04:52
Study testing COVID antibody drug used to treat Trump halted for some patients,googlenews,2020-11-01 11:04:52
Another Shortage of This Grocery Store Staple Is Coming,googlenews,2020-11-01 11:04:52
New Jersey’s pot referendum could be a game changer,googlenews,2020-11-01 11:04:52
Some Georgians could run out of benefits next Monday,googlenews,2020-11-01 11:04:52
UK Bans All Leisure Travel With Latest Lockdown,googlenews,2020-11-01 11:04:52
"SpaceX Finally Has Enough Satellites to Offer Internet Service, According to Elon Musk",googlenews,2020-11-01 11:04:52
Alphabet Was the Winner in Big Tech’s Earnings Extravaganza. Here’s Why.,googlenews,2020-11-01 11:04:52
Airbnb issues warning against Arizona house parties for Halloween weekend,googlenews,2020-11-01 11:04:52
Here's how much debt the average 20-something has—see how you compare,googlenews,2020-11-01 11:04:52
Here's when you can expect your power to be back on,googlenews,2020-11-01 11:04:52
General Motors poaches Delta CFO to fill finance seat,googlenews,2020-11-01 11:04:52
"After NVIDIA and AMD, Marvell Technology Goes Shopping With $10 Billion Inphi Takeover",googlenews,2020-11-01 11:04:52
"People gather to watch Ohio State game, celebrate Halloween despite COVID-19 concerns",googlenews,2020-11-01 11:04:52
Black Friday 2020: The best deals being offered in November,googlenews,2020-11-01 11:04:52
Date Is Set for Merger Between Mylan and Pfizer's Upjohn Unit,googlenews,2020-11-01 11:04:52
"Las Vegas MGM Resorts may partially close, CEO says",googlenews,2020-11-01 11:04:52
Fed eases terms of Main Street lending program to help more small businesses,googlenews,2020-11-01 11:04:52
"2022 GMC Hummer EV: See Inside, Out, and Underneath this new Electric Beast",googlenews,2020-11-01 11:04:52
Apple ordered to pay VirnetX $502.8 million in patent trial,googlenews,2020-11-01 11:04:52
Israel’s Second Lockdown Seems to Be Working Better Than Its First,googlenews,2020-11-01 11:04:52
Gas prices below $2: Coming to a gas station near you,googlenews,2020-11-01 11:04:52
"How Under Armour plans to compete after MyFitness deal, 'soul searching' on its brand",googlenews,2020-11-01 11:04:52
Costco drops Chaokoh coconut milk allegations of forced monkey labor which sees the animals chained,googlenews,2020-11-01 11:04:52
"Powerball Drawing For 10/31/20, Saturday Jackpot is $127 Million",googlenews,2020-11-01 11:04:52
Gold demand plunges to 11-year low – World Gold Council,googlenews,2020-11-01 11:04:52
"Americans are moving out of dense, costly cities",googlenews,2020-11-01 11:04:52
Delta CFO Paul Jacobson announces departure a second time,googlenews,2020-11-01 11:04:52
Twitter: Back In The Bargain Bin,googlenews,2020-11-01 11:04:52
It's Official: A Foreign Company Will Help Mitsubishi Build Japan's Next Fighter,googlenews,2020-11-01 11:04:52
Is Wall Street losing its tech enthusiasm?,googlenews,2020-11-01 11:04:52
‘Hydrogen Wars’ Pit Europe v. China for $700 Billion Business,googlenews,2020-11-01 11:04:52
"China Should Take Part in Creating Global Regulatory Framework for Digital Currency, Xi Says",googlenews,2020-11-01 11:04:52
Europe could be facing a double-dip recession,googlenews,2020-11-01 11:04:52
Larimer County reports nearly 200 more COVID-19 cases Saturday,googlenews,2020-11-01 11:04:52
Modesto Restaurant Chain That Allowed Indoor Dining Against COVID Restrictions Pays $10K Fine,googlenews,2020-11-01 11:04:52
Baby Boomers and high earners now carry the most student loan debt: Fidelity study,googlenews,2020-11-01 11:04:52
Jeep brings the affordable off-road Willys trim to the 2021 Gladiator,googlenews,2020-11-01 11:04:52
Hadassah Launches Vaccine Trial on Humans,googlenews,2020-11-01 11:04:52
AstraZeneca's vaccine candidate could mark a new era for the company,googlenews,2020-11-01 11:04:52
World united in search for Covid vaccine - and access,googlenews,2020-11-01 11:04:52
The effort to find vaccines for Covid-19 is continually breaking records - here's how the search is going,googlenews,2020-11-01 11:04:52
"'Amazon's contention on RIL deal is misconceived': Future Retail tells BSE, NSE",googlenews,2020-11-01 11:04:52
Amazon tells SEBI that Reliance-Future deal will cause e-tailer irreparable harm; asks to suspend review,googlenews,2020-11-01 11:04:52
India's Future Retail says Amazon dispute order not binding on company,googlenews,2020-11-01 11:04:52
"Process M&A application, ignore Amazon letter, Future Retail urges bourses",googlenews,2020-11-01 11:04:52
COVID-19 vaccine trial progressing with help from Valley participants,googlenews,2020-11-01 11:04:52
"U.K. regulator is accelerating reviews of COVID-19 vaccines from Pfizer and AstraZeneca, according to a report",googlenews,2020-11-01 11:04:52
Answering your questions about the COVID-19 vaccine trials,googlenews,2020-11-01 11:04:52
UK accelerates reviews of Pfizer and Astra-Oxford Covid-19 vaccines,googlenews,2020-11-01 11:04:52
Regeneron COVID-19 drug trial halted in sickest patients,googlenews,2020-11-01 11:04:52
"Covid-19 Antibodies Diminish Over Time, But Experts Say There's No Reason to Be Alarmed",googlenews,2020-11-01 11:04:52
Second study testing a COVID-19 antibody drug reports setback,googlenews,2020-11-01 11:04:52
Regeneron halts COVID-19 therapeutic trials on sick patients,googlenews,2020-11-01 11:04:52
Dutch government suspends rescue loan to KLM | News | Flight Global,googlenews,2020-11-01 11:04:52
Dutch Government Withdraws Multi-Billion Euro Airline Bailout After Pilots Refuse Pay Cut,googlenews,2020-11-01 11:04:52
Dutch government halts KLM bailout amid disagreement over cost cuts,googlenews,2020-11-01 11:04:52
Netherlands puts KLM bailout on hold after pilots reject wage freeze,googlenews,2020-11-01 11:04:52
CDC Says Cruises Can Set Sail Again But Passengers Will Not Be Allowed On Board,googlenews,2020-11-01 11:04:52
Couple quarantined on cruise at beginning of pandemic warns about CDC's lift on no-sail order,googlenews,2020-11-01 11:04:52
"Cruise Radio News Briefs | Week of October 25, 2020",googlenews,2020-11-01 11:04:52
December Cruises Removed from Carnival Cruise Line Web Site,googlenews,2020-11-01 11:04:52
Entergy System Hurricane Zeta Restoration Update – 10/31/20 @ 8:00 am,googlenews,2020-11-01 11:04:52
"3 days after Hurricane Zeta, New Orleans area remains patchwork of light and dark",googlenews,2020-11-01 11:04:52
When will my power come back? Estimates for Louisiana | wwltv.com,googlenews,2020-11-01 11:04:52
Restoration Times Now Available for Louisiana Customers Following Zeta,googlenews,2020-11-01 11:04:52
Playing it safe for Halloween,googlenews,2020-11-01 11:04:52
"The best and the worst of Halloween candy, all the way back to the 1930s",googlenews,2020-11-01 11:04:52
Neighbors find safer alternatives to hand out candy this Halloween,googlenews,2020-11-01 11:04:52
Tucson pediatrician says there are many ways to celebrate Halloween safely,googlenews,2020-11-01 11:04:52
U.S. Stocks Have One of Their Worst Pre-Election Weeks Ever. What About Next Week?,googlenews,2020-11-01 11:04:52
"Comic: Presidential Election, Covid-19 Surge To Fuel Volatility In The Week Ahead",googlenews,2020-11-01 11:04:52
These are the worst-performing stocks in October as Big Tech slumps,googlenews,2020-11-01 11:04:52
Stock Market Suffers Worst Week Since March. Here’s Why.,googlenews,2020-11-01 11:04:52
Israel begins clinical trials of its coronavirus vaccine. Here's when to expect results,googlenews,2020-11-01 11:04:52
Should You Be Worried About AstraZeneca Stock?,googlenews,2020-11-01 11:04:52
Volunteer to receive 1st Israeli vaccine shot hails ‘historic opportunity’,googlenews,2020-11-01 11:04:52
"Already, pharmaceutical companies' predictions about Covid-19 vaccines haven't come true",googlenews,2020-11-01 11:04:52
MicroStrategy's bottom line gets beefier on Bitcoin moves: Bad crypto news of the week,googlenews,2020-11-01 11:04:52
"The Crypto Daily – Movers and Shakers – November 1st, 2020",googlenews,2020-11-01 11:04:52
Bitcoin Could Rally to an All-Time High if It Hits One Key Level,googlenews,2020-11-01 11:04:52
Bitcoin reaches $14K for the first time since January 2018 — what’s next?,googlenews,2020-11-01 11:04:52
Netflix will keep raising prices with confidence as its value proposition remains superior to cable TV,googlenews,2020-11-01 11:04:52
Netflix raising US streaming prices amid booming growth,googlenews,2020-11-01 11:04:52
What Netflix's price hikes means for the streaming wars as rivals offer cheaper options,googlenews,2020-11-01 11:04:52
Netflix is raising prices for its standard and premium plans,googlenews,2020-11-01 11:04:52
Arby's Owner Inspire Brands To Acquire Dunkin' And Baskin-Robbins In $11.3 Billion Deal,googlenews,2020-11-01 11:04:52
Atlanta-based company buys Dunkin Donuts for $11.3 billion,googlenews,2020-11-01 11:04:52
Arby’s and Buffalo Wild Wings owner buying Dunkin’ Brands in $11.3B deal,googlenews,2020-11-01 11:04:52
Dunkin' sold in $11.3 billion deal,googlenews,2020-11-01 11:04:52
"Best Buy’s three-day sale on OLED TVs, headphones, and more ends Saturday",googlenews,2020-11-01 11:04:52
Here's how stores are changing Black Friday for the pandemic,googlenews,2020-11-01 11:04:52
This Black Friday is the best time to buy an OLED TV yet – here's why,googlenews,2020-11-01 11:04:52
Best early Black Friday 4K TV deals for the weekend of Halloween,googlenews,2020-11-01 11:04:52
Memorial Hermann NICU babies dress up for their first Halloween,googlenews,2020-11-01 11:04:52
Photos: St. David’s dresses up NICU babies for Halloween,googlenews,2020-11-01 11:04:52
NICU babies get a taste of Halloween thanks to volunteers,googlenews,2020-11-01 11:04:52
SEE IT: NICU Babies At NYU Winthrop Hospital Dressed Up For Halloween,googlenews,2020-11-01 11:04:52
Want to pay the IRS less as a senior? Here are 3 sources of tax-free income for retirees.,googlenews,2020-11-01 11:04:52
The Most Important Retirement Savings Move You Can Make Each Decade,googlenews,2020-11-01 11:04:52
McDonald’s brings back the McRib. When is it available?,googlenews,2020-11-01 11:04:52
"McDonald's Cult Classic, The McRib, Is Coming Back",googlenews,2020-11-01 11:04:52
McDonald's Bringing Back McRib Nationally For 1st Time In 8 Years,googlenews,2020-11-01 11:04:52
McDonalds is bringing back the McRib nationwide on December 2,googlenews,2020-11-01 11:04:52
Bitcoin is the best treasury reserve asset humanity’s ever had,googlenews,2020-11-01 11:04:52
Crude Weekly Price Forecast - Crude Oil Markets Get Hammered,googlenews,2020-11-01 11:04:52
Oil Logs Worst Month Since March as Lockdowns Resurface,googlenews,2020-11-01 11:04:52
"Oil price falls on demand concerns, posts second monthly decline",googlenews,2020-11-01 11:04:52
U.S. Rig Count Rises Despite Coronavirus Threat,googlenews,2020-11-01 11:04:52
Ways to take advantage of low mortgage rates,googlenews,2020-11-01 11:04:52
US long-term mortgage rates flat this week; 30-year at 2.81%,googlenews,2020-11-01 11:04:52
4 reasons mortgage rates could drop further this year,googlenews,2020-11-01 11:04:52
New mortgages predicted to break all-time record in 2021,googlenews,2020-11-01 11:04:52
T-Mobile TVision: Everything you need to know about the new TV service,googlenews,2020-11-01 11:04:52
"T-Mobile Is Positioning Itself to Disrupt Streaming, Cable Stalwarts",googlenews,2020-11-01 11:04:52
"Amazon Advertising Surges, And Plans Upgrades Around Twitch, Video And Platform Usability",googlenews,2020-11-01 11:04:52
8 Wild Numbers From Amazon's Third-Quarter Earnings Report,googlenews,2020-11-01 11:04:52
Amazon says it now has more than 1 million employees,googlenews,2020-11-01 11:04:52
"Amazon's sales, earnings boom in third quarter",googlenews,2020-11-01 11:04:52
Ford Mustang Mach-E Will Get Hands-Free Driver Assist On Some Highways In A Year,googlenews,2020-11-01 11:04:52
Airlines Suffer Blow as England Bans Overseas Leisure Travel,googlenews,2020-11-01 11:04:52
Coronavirus: Travel rules after England goes into second lockdown on Thursday,googlenews,2020-11-01 11:04:52
Airlines suffer blow as England bans non-work overseas travel,googlenews,2020-11-01 11:04:52
England travel ban: Can you travel abroad or go on a UK holiday during the four-week lockdown?,googlenews,2020-11-01 11:04:52
"Like Elon Musk, I Will Be Forfeiting The Earthbound Law Of Gravity On My Martian Settlement",googlenews,2020-11-01 11:04:52
Elon Musk’s Starlink user documents are filled with meme-worthy Easter Eggs,googlenews,2020-11-01 11:04:52
Get ready because fast satellite internet service is coming soon,googlenews,2020-11-01 11:04:52
"Elon Musks SpaceX to follow self-governing principles on Mars, rejects Earths laws",googlenews,2020-11-01 11:04:52
"Alphabet earnings: Google Cloud is in 'investment mode,' analysts say",googlenews,2020-11-01 11:04:52
Jim Cramer Calls Alphabet Earnings Best Quarter He's Ever Seen,googlenews,2020-11-01 11:04:52
"Google ad spend does better than expected, rebounding from pandemic impact",googlenews,2020-11-01 11:04:52
Why BofA Is Raising Its Alphabet Price Target After Q3 Report,googlenews,2020-11-01 11:04:52
"Amid Halloween season, Airbnb reminds users that parties are banned from their Arizona listings",googlenews,2020-11-01 11:04:52
Large parties discouraged for Halloween weekend,googlenews,2020-11-01 11:04:52
Airbnb issues warning against Halloween house parties,googlenews,2020-11-01 11:04:52
"Airbnb Reminds of Party, One-Night Booking Ban In SD County Halloween Weekend",googlenews,2020-11-01 11:04:52
Never Buy These 10 Things With Your Credit Card,googlenews,2020-11-01 11:04:52
American Express Bank Review: A Great Side Savings Account,googlenews,2020-11-01 11:04:52
Expert explains how to teach your teens to build good credit,googlenews,2020-11-01 11:04:52
Best credit union credit cards of 2020,googlenews,2020-11-01 11:04:52
Delta Air Lines CFO Departing To Join General Motors,googlenews,2020-11-01 11:04:52
GM hires new chief financial officer from Delta Airlines,googlenews,2020-11-01 11:04:52
ETFs to Gain as Marvell's Inphi Buyout Creates $40B Giant,googlenews,2020-11-01 11:04:52
SHAREHOLDER ALERT: WeissLaw LLP Investigates Inphi Corporation,googlenews,2020-11-01 11:04:52
Chip Firm Marvell to Buy Rival Semiconductor Company in $10 Billion Deal,googlenews,2020-11-01 11:04:52
"Company News for Oct 30, 2020",googlenews,2020-11-01 11:04:52
Amazon Black Friday UK 2020: early offers on De'Longhi coffee machines and more,googlenews,2020-11-01 11:04:52
"Black Friday 2020 is this month, and it’s going to be tougher than EVER to get a good deal",googlenews,2020-11-01 11:04:52
Game Black Friday sale launched – Here are the best deals,googlenews,2020-11-01 11:04:52
Fed lowers loan size to attract more small businesses to Main Street Lending Program. Again.,googlenews,2020-11-01 11:04:52
Fed opens up Main Street loans to smaller businesses,googlenews,2020-11-01 11:04:52
"Fed reduces loan minimum, easing terms for Main Street program",googlenews,2020-11-01 11:04:52
What the Fed's Major Strategic Change Means for You,googlenews,2020-11-01 11:04:52
2022 GMC Hummer EV Detailed In A Walkaround Video,googlenews,2020-11-01 11:04:52
US jury tells Apple to pay $503 mn in patent case,googlenews,2020-11-01 11:04:52
Apple to Pay $502M USD to VirnetX for Patent Violations,googlenews,2020-11-01 11:04:52
Apple has been ordered to Pay VirnetX over $500 Million for FaceTime Infringing the company's Intellectual Property,googlenews,2020-11-01 11:04:52
Apple ordered to pay VirnetX $503 million for VPN patent lawsuit,googlenews,2020-11-01 11:04:52
Under Armour To Sell MyFitnessPal For $345 Million And Shut Down Endomondo (UA) (UAA),googlenews,2020-11-01 11:04:52
Daily Crunch: Under Armour is selling MyFitnessPal,googlenews,2020-11-01 11:04:52
Under Armour Stock: Why It’s Selling MyFitnessPal for $130 Million Less Than It Paid,googlenews,2020-11-01 11:04:52
Under Armour Reports Impressive Results and Sale of MyFitnessPal Platform,googlenews,2020-11-01 11:04:52
Powerball results for 10/31/20: jackpot worth $127 million,googlenews,2020-11-01 11:04:52
Powerball Winning Numbers Oct. 31; Estimated Jackpot $127 Million,googlenews,2020-11-01 11:04:52
"Powerball Results, Numbers for 10/31/20: Did Anyone Win the $127 Million?",googlenews,2020-11-01 11:04:52
Lotto 47 results for 10/31/20; did anyone win the record $28.1M jackpot?,googlenews,2020-11-01 11:04:52
"Central Banks Dump Gold for the First Time Since 2010, Precious Metal Drops 9% Since August High | Economics",googlenews,2020-11-01 11:04:52
What’s Hitting Demand For Gold Jewellery?,googlenews,2020-11-01 11:04:52
"Gold coins, bars see higher demand in UAE, jewellery sales dip",googlenews,2020-11-01 11:04:52
"India’s gold demand fell 30%, but ‘cautious optimism’ may be returning",googlenews,2020-11-01 11:04:52
"Now That More Americans Can Work From Anywhere, Many Are Planning To Move Away",googlenews,2020-11-01 11:04:52
GM nabs big hire from airline industry as its next CFO,googlenews,2020-11-01 11:04:52
General Motors Appoints Paul Jacobson As Executive VP And CFO,googlenews,2020-11-01 11:04:52
GM's new CFO is a veteran of Delta Air Lines - Business Insider,googlenews,2020-11-01 11:04:52
GM hires new CFO from Delta Air Lines,googlenews,2020-11-01 11:04:52
Twitter Posts Worst Day Since 2014 After Meager User Growth,googlenews,2020-11-01 11:04:52
"Despite Twitter's Positive Third Quarter Results, Shares Dip Sharply",googlenews,2020-11-01 11:04:52
Twitter falls on paltry gains in new users in third quarter,googlenews,2020-11-01 11:04:52
"Twitter Says Election Uncertainty May Crimp Ad Spending, but Brands Circling for Holiday Season",googlenews,2020-11-01 11:04:52
Japan picks Mitsubishi Heavy to develop own stealth fighter,googlenews,2020-11-01 11:04:52
Mitsubishi’s SpaceJet airliner is shelved due to pandemic,googlenews,2020-11-01 11:04:52
Japan Unveils the Lead Developer of its New Stealth Fighter Jet,googlenews,2020-11-01 11:04:52
Japan picks Mitsubishi Heavy to lead development of new stealth jet fighter,googlenews,2020-11-01 11:04:52
European stock markets endure worst week since June,googlenews,2020-11-01 11:04:52
Eurozone records 12.7% growth amid virus fears - News,googlenews,2020-11-01 11:04:52
Eurozone growth soars record 12.7% - but fears grow for winter - World News,googlenews,2020-11-01 11:04:52
Euro zone economy surges in third quarter before expected blow from new lockdowns,googlenews,2020-11-01 11:04:52
2021 Jeep Gladiator Willys revealed,googlenews,2020-11-01 11:04:52
"Jeep Wrangler, Gladiator Get New Mopar Doors-Off Mirror Kit",googlenews,2020-11-01 11:04:52
Here Is Why the V6 EcoDiesel Is the Best Choice for the 2021 Jeep Gladiator,googlenews,2020-11-01 11:04:52
Jeep Finally Fixes Wrangler's Biggest Problem,googlenews,2020-11-01 11:04:52
Worried About a Stock Market Crash? Buy These Recession-Proof Dividend Stocks,motleyfool,2020-11-01 11:06:50
BP vs. Total: Which Oil Company Is Better Positioned for a Green Energy Transition?,motleyfool,2020-11-01 11:06:50
Ford's Huge Earnings Beat Is Great News for the Future -- and for GM,motleyfool,2020-11-01 11:06:50
Is Microsoft Stock a Buy?,motleyfool,2020-11-01 11:06:50
The 1 Reason Why Teladoc Health and Livongo Were So Eager to Merge,motleyfool,2020-11-01 11:06:50
3 Stocks That Could Make You Rich,motleyfool,2020-11-01 11:06:50
4 Reasons Sony's Stock Could Still Head Higher,motleyfool,2020-11-01 11:06:50
"Should You Buy the Pot Stock That's the ""Disneyland of Cannabis""?",motleyfool,2020-11-01 11:06:50
This Nearly 8%-Yielding Oil Stock Remains Committed to Its Dividend,motleyfool,2020-11-01 11:06:50
Better Buy: Baidu vs. MercadoLibre,motleyfool,2020-11-01 11:06:50
Southwest Airlines Weighs 737 MAX 7 vs. A220 Order: The Best Choice May Be Neither,motleyfool,2020-11-01 11:06:50
Want a Big Raise From Social Security? 4 Ways to Snag One,motleyfool,2020-11-01 11:06:50
It's Time to Admit That Fastly Stock Is Drastically Overvalued,motleyfool,2020-11-01 11:06:50
3 Reasons Alphabet Surged on Friday While the Rest of FAANG Plummeted,motleyfool,2020-11-01 11:06:50
5 Reasons 3M Stock is a Buy for Dividend Investors,motleyfool,2020-11-01 11:06:50
Better Buy: Zoom Video Communications vs. Alphabet,motleyfool,2020-11-01 11:06:50
This 11.5%-Yielding Energy Stock Plans to Keep Its Dividend Intact,motleyfool,2020-11-01 11:06:50
3 Ways Saving in a Roth IRA Could Backfire on You,motleyfool,2020-11-01 11:06:50
These 2 Under-the-Radar Stocks Could Be Key to Coronavirus Vaccine Distribution,motleyfool,2020-11-01 11:06:50
"These Companies Will Get Rich Off the 2020 Election, No Matter Who Wins",motleyfool,2020-11-01 11:06:50
"T-Mobile Is Positioning Itself to Disrupt Streaming, Cable Stalwarts",motleyfool,2020-11-01 11:06:50
2021 Federal Tax Brackets and Tax Rates,motleyfool,2020-11-01 11:06:50
3 Stocks That Could Set You Up for Life,motleyfool,2020-11-01 11:06:50
3 Recent IPOs to Add to Your Watch List,motleyfool,2020-11-01 11:06:50
Disruptor Alert: These 2 Companies Are Changing Healthcare,motleyfool,2020-11-01 11:06:50
3 Dividend Stocks to Buy if Donald Trump Wins the Election,motleyfool,2020-11-01 11:06:50
Will You Have to Pay $632 More in Social Security Tax Next Year?,motleyfool,2020-11-01 11:06:50
"SpaceX Finally Has Enough Satellites to Offer Internet Service, According to Elon Musk",motleyfool,2020-11-01 11:06:50
3 Top Industrial Stocks to Buy Ahead of the Election,motleyfool,2020-11-01 11:06:50
3 Stocks to Buy If the Market Crashes in November,motleyfool,2020-11-01 11:06:50
The Best Strategy for Investing in Cannabis Stocks,motleyfool,2020-11-01 11:06:50
Better Buy: Activision Blizzard vs. Microsoft,motleyfool,2020-11-01 11:06:50
3 Top Renewable Energy Stocks to Buy No Matter Who Wins the Election,motleyfool,2020-11-01 11:06:50
3 Reasons to Buy Vertex Pharmaceuticals and 1 Reason Not To,motleyfool,2020-11-01 11:06:50
