headline,org,date
Colombia Trading Like Junk Shows Dilemma Facing Poor Nations,msnmoney,2021-02-08 12:09:53
15 Cities Where People Are Prepared to Work from Home,msnmoney,2021-02-08 12:09:53
Omaha legend puts $91 billion on one 5G stock,msnmoney,2021-02-08 12:09:53
Tesla says you could soon pay for one of its cars with bitcoins,msnmoney,2021-02-08 12:09:53
Don’t forget to budget for these things—or it will cost you,msnmoney,2021-02-08 12:09:53
Mother Uses Genius Trick To Flatten Curled Rug Corners (So Easy),msnmoney,2021-02-08 12:09:53
This IKEA tiny house packs in some BIG ideas,msnmoney,2021-02-08 12:09:53
5 Companies That Pivoted Quickly To Meet Pandemic Demands,msnmoney,2021-02-08 12:09:53
Bitcoin price soars following Tesla's $1.5 billion investment,msnmoney,2021-02-08 12:09:53
0% intro APR is 100% insane,msnmoney,2021-02-08 12:09:53
15 of Your Favorite Companies That Have Gone Out of Business,msnmoney,2021-02-08 12:09:53
20 Questions to Tell If You're Ready to Retire,msnmoney,2021-02-08 12:09:53
House Renovation Costs You Can Cut – and a Few You Can’t,msnmoney,2021-02-08 12:09:53
30 Jobs That Will Soon Be Gone for Good,msnmoney,2021-02-08 12:09:53
"U.S. stocks trade near records, aim to add to biggest weekly rise since November",msnmoney,2021-02-08 12:09:53
13 Ways To Increase Your Car’s Value,msnmoney,2021-02-08 12:09:53
These notes and bills are worth a fortune,msnmoney,2021-02-08 12:09:53
19 Great Ways To Supplement Social Security Every Month That Many Didn't Know,msnmoney,2021-02-08 12:09:53
25 Ways To Fix Your 401(k) Before It’s Too Late,msnmoney,2021-02-08 12:09:53
"EV Company With Almost No Revenue Posts 3,000% Gain in 8 Months",msnmoney,2021-02-08 12:09:53
6 Secret Streaming Services To Get You Through a COVID-19 Winter,msnmoney,2021-02-08 12:09:53
15 Self-Employment Tax Deductions,msnmoney,2021-02-08 12:09:53
Black-Owned Businesses To Support Right Now,msnmoney,2021-02-08 12:09:53
Pennsylvania Homeowners Are Installing Home Backup Batteries to Power Through Blackouts,msnmoney,2021-02-08 12:09:53
South African Lawmakers Question Eskom on Failed Housing Project,msnmoney,2021-02-08 12:09:53
Another beloved pizza chain has filed for bankruptcy,msnmoney,2021-02-08 12:09:53
Best homeowners insurance in Colorado of 2021,msnmoney,2021-02-08 12:09:53
10 Things Frugal People Never Buy,msnmoney,2021-02-08 12:09:53
The $76K 'Birkinstock' sandal cut from real Birkin bags,msnmoney,2021-02-08 12:09:53
24 Unique Gifts Everybody Actually Wants,msnmoney,2021-02-08 12:09:53
10 U.S. Counties at Highest Risk From Natural Disasters,msnmoney,2021-02-08 12:09:53
The best (& worst) times to sell your home,msnmoney,2021-02-08 12:09:53
Money-saving lessons from a Depression-era dad,msnmoney,2021-02-08 12:09:53
"GameStop Shares Drop, Extending 80% Slump From Last Week",msnmoney,2021-02-08 12:09:53
8 Signs That It’s Time for You to Unretire,msnmoney,2021-02-08 12:09:53
Woman Fixes Poor Posture And Back Pain With Simple Trick,msnmoney,2021-02-08 12:09:53
Creativity is the WFH casualty no one is talking about. Here's how to stay inspired while working remotely.,msnmoney,2021-02-08 12:09:53
The government sent people pandemic checks. Now it wants some of that money back,msnmoney,2021-02-08 12:09:53
Brent Oil Tops $60 With Return to Normal Demand in Sight,msnmoney,2021-02-08 12:09:53
Things you should (and shouldn't) buy in February,msnmoney,2021-02-08 12:09:53
"Buying a Home? Check Out Today's Mortgage Rates, Feb. 8",msnmoney,2021-02-08 12:09:53
Cancelled TV Shows: Effective Immediately,msnmoney,2021-02-08 12:09:53
23 Reasons You Will Always Be Poor,msnmoney,2021-02-08 12:09:53
"LIVE: Jim Cramer on Tesla, Bitcoin, AstraZeneca, Stock Market Monday",msnmoney,2021-02-08 12:09:53
Costco and Sam's Club membership perks you didn't know about,msnmoney,2021-02-08 12:09:53
Palantir Surges on Deal to Offer Software Through IBM,msnmoney,2021-02-08 12:09:53
Absolutely massive homes listed for less than $100K,msnmoney,2021-02-08 12:09:53
These Are the Top Financial Advisors in Pennsylvania,msnmoney,2021-02-08 12:09:53
SPAC Tortoise Acquisition Corp. II spikes 47% after announcing merger with EV charging station manufacturer Volta Industries,msnmoney,2021-02-08 12:09:53
This was the minimum wage the year you were born,msnmoney,2021-02-08 12:09:53
Everything you need to know about balance transfer checks,msnmoney,2021-02-08 12:09:53
10 US Cities With Plenty of Jobs and Cheap Housing,msnmoney,2021-02-08 12:09:53
"Tesla Summoned by China Regulators Over Quality, Safety Issues",msnmoney,2021-02-08 12:09:53
Omaha legend puts $91 billion on one 5G stock,msnmoney,2021-02-08 12:09:53
The Most Expensive Super Bowl Commercials of All Time,msnmoney,2021-02-08 12:09:53
History of workers' strikes in America,msnmoney,2021-02-08 12:09:53
"Waiting for a $1,400 stimulus check? Here are 9 ways to make your own",msnmoney,2021-02-08 12:09:53
"Target's activewear brand hits $1 billion in sales, as retailer gains ground in apparel",msnmoney,2021-02-08 12:09:53
Judy Garland and more celebs who died broke,msnmoney,2021-02-08 12:09:53
5 Moves to Ensure You're a Retirement Millionaire,msnmoney,2021-02-08 12:09:53
"Man Who Called Apple in 2003 Says ""Genesis"" Will Be 32 Times Bigger Than 5G",msnmoney,2021-02-08 12:09:53
50 Ways You’re Throwing Money Away,msnmoney,2021-02-08 12:09:53
"Apple’s Dan Riccio Shifts From Hardware Chief to AR, VR Headsets",msnmoney,2021-02-08 12:09:53
Baby boomers retiring will affect the economy – here’s how,msnmoney,2021-02-08 12:09:53
Upstart Rises 879% as Founder Bets on Making Phones in India,msnmoney,2021-02-08 12:09:53
Car Brands With the Best and Worst Buyer Experience,msnmoney,2021-02-08 12:09:53
See problems as supervillains—and 4 other fun ways to fire up your remote teams,msnmoney,2021-02-08 12:09:53
Things Waitresses Notice About You in 3 Seconds,msnmoney,2021-02-08 12:09:53
"18 ways to boost your income, starting right now",msnmoney,2021-02-08 12:09:53
"Dating app Bumble raises the size of its IPO offering to 45 million shares, now expects to raise $1.8 billion",msnmoney,2021-02-08 12:09:53
"Advice From Mark Cuban, Warren Buffett and Other Experts That Can Help You Survive a Crisis",msnmoney,2021-02-08 12:09:53
"Estate Planning Checklist: 5 Tasks to Do Now, While You’re Still Well",msnmoney,2021-02-08 12:09:53
Just How Rich Are President Joe Biden and These Other Big Names?,msnmoney,2021-02-08 12:09:53
Here’s a better way than GameStop attacks for the ‘little guy’ to stick it to Wall Street,msnmoney,2021-02-08 12:09:53
7 Retirement Income Strategies Once Your Portfolio Reaches $500k,msnmoney,2021-02-08 12:09:53
The 15 Best Pizza Deals for Under $10,msnmoney,2021-02-08 12:09:53
Colombia Trading Like Junk Shows Dilemma Facing Poor Nations,msnmoney,2021-02-08 12:09:53
15 Cities Where People Are Prepared to Work from Home,msnmoney,2021-02-08 12:09:53
Omaha legend puts $91 billion on one 5G stock,msnmoney,2021-02-08 12:09:53
Tesla says you could soon pay for one of its cars with bitcoins,msnmoney,2021-02-08 12:09:53
Don’t forget to budget for these things—or it will cost you,msnmoney,2021-02-08 12:09:53
Mother Uses Genius Trick To Flatten Curled Rug Corners (So Easy),msnmoney,2021-02-08 12:09:53
This IKEA tiny house packs in some BIG ideas,msnmoney,2021-02-08 12:09:53
5 Companies That Pivoted Quickly To Meet Pandemic Demands,msnmoney,2021-02-08 12:09:53
Bitcoin price soars following Tesla's $1.5 billion investment,msnmoney,2021-02-08 12:09:53
0% intro APR is 100% insane,msnmoney,2021-02-08 12:09:53
15 of Your Favorite Companies That Have Gone Out of Business,msnmoney,2021-02-08 12:09:53
20 Questions to Tell If You're Ready to Retire,msnmoney,2021-02-08 12:09:53
House Renovation Costs You Can Cut – and a Few You Can’t,msnmoney,2021-02-08 12:09:53
30 Jobs That Will Soon Be Gone for Good,msnmoney,2021-02-08 12:09:53
"U.S. stocks trade near records, aim to add to biggest weekly rise since November",msnmoney,2021-02-08 12:09:53
13 Ways To Increase Your Car’s Value,msnmoney,2021-02-08 12:09:53
These notes and bills are worth a fortune,msnmoney,2021-02-08 12:09:53
19 Great Ways To Supplement Social Security Every Month That Many Didn't Know,msnmoney,2021-02-08 12:09:53
25 Ways To Fix Your 401(k) Before It’s Too Late,msnmoney,2021-02-08 12:09:53
"EV Company With Almost No Revenue Posts 3,000% Gain in 8 Months",msnmoney,2021-02-08 12:09:53
6 Secret Streaming Services To Get You Through a COVID-19 Winter,msnmoney,2021-02-08 12:09:53
15 Self-Employment Tax Deductions,msnmoney,2021-02-08 12:09:53
Black-Owned Businesses To Support Right Now,msnmoney,2021-02-08 12:09:53
Pennsylvania Homeowners Are Installing Home Backup Batteries to Power Through Blackouts,msnmoney,2021-02-08 12:09:53
South African Lawmakers Question Eskom on Failed Housing Project,msnmoney,2021-02-08 12:09:53
Another beloved pizza chain has filed for bankruptcy,msnmoney,2021-02-08 12:09:53
Best homeowners insurance in Colorado of 2021,msnmoney,2021-02-08 12:09:53
10 Things Frugal People Never Buy,msnmoney,2021-02-08 12:09:53
The $76K 'Birkinstock' sandal cut from real Birkin bags,msnmoney,2021-02-08 12:09:53
24 Unique Gifts Everybody Actually Wants,msnmoney,2021-02-08 12:09:53
10 U.S. Counties at Highest Risk From Natural Disasters,msnmoney,2021-02-08 12:09:53
The best (& worst) times to sell your home,msnmoney,2021-02-08 12:09:53
Money-saving lessons from a Depression-era dad,msnmoney,2021-02-08 12:09:53
"GameStop Shares Drop, Extending 80% Slump From Last Week",msnmoney,2021-02-08 12:09:53
8 Signs That It’s Time for You to Unretire,msnmoney,2021-02-08 12:09:53
Woman Fixes Poor Posture And Back Pain With Simple Trick,msnmoney,2021-02-08 12:09:53
Creativity is the WFH casualty no one is talking about. Here's how to stay inspired while working remotely.,msnmoney,2021-02-08 12:09:53
The government sent people pandemic checks. Now it wants some of that money back,msnmoney,2021-02-08 12:09:53
Brent Oil Tops $60 With Return to Normal Demand in Sight,msnmoney,2021-02-08 12:09:53
Things you should (and shouldn't) buy in February,msnmoney,2021-02-08 12:09:53
"Buying a Home? Check Out Today's Mortgage Rates, Feb. 8",msnmoney,2021-02-08 12:09:53
Cancelled TV Shows: Effective Immediately,msnmoney,2021-02-08 12:09:53
23 Reasons You Will Always Be Poor,msnmoney,2021-02-08 12:09:53
"LIVE: Jim Cramer on Tesla, Bitcoin, AstraZeneca, Stock Market Monday",msnmoney,2021-02-08 12:09:53
Costco and Sam's Club membership perks you didn't know about,msnmoney,2021-02-08 12:09:53
Palantir Surges on Deal to Offer Software Through IBM,msnmoney,2021-02-08 12:09:53
Absolutely massive homes listed for less than $100K,msnmoney,2021-02-08 12:09:53
These Are the Top Financial Advisors in Pennsylvania,msnmoney,2021-02-08 12:09:53
SPAC Tortoise Acquisition Corp. II spikes 47% after announcing merger with EV charging station manufacturer Volta Industries,msnmoney,2021-02-08 12:09:53
This was the minimum wage the year you were born,msnmoney,2021-02-08 12:09:53
Everything you need to know about balance transfer checks,msnmoney,2021-02-08 12:09:53
10 US Cities With Plenty of Jobs and Cheap Housing,msnmoney,2021-02-08 12:09:53
"Tesla Summoned by China Regulators Over Quality, Safety Issues",msnmoney,2021-02-08 12:09:53
Omaha legend puts $91 billion on one 5G stock,msnmoney,2021-02-08 12:09:53
The Most Expensive Super Bowl Commercials of All Time,msnmoney,2021-02-08 12:09:53
History of workers' strikes in America,msnmoney,2021-02-08 12:09:53
"Waiting for a $1,400 stimulus check? Here are 9 ways to make your own",msnmoney,2021-02-08 12:09:53
"Target's activewear brand hits $1 billion in sales, as retailer gains ground in apparel",msnmoney,2021-02-08 12:09:53
Judy Garland and more celebs who died broke,msnmoney,2021-02-08 12:09:53
5 Moves to Ensure You're a Retirement Millionaire,msnmoney,2021-02-08 12:09:53
"Man Who Called Apple in 2003 Says ""Genesis"" Will Be 32 Times Bigger Than 5G",msnmoney,2021-02-08 12:09:53
50 Ways You’re Throwing Money Away,msnmoney,2021-02-08 12:09:53
"Apple’s Dan Riccio Shifts From Hardware Chief to AR, VR Headsets",msnmoney,2021-02-08 12:09:53
Baby boomers retiring will affect the economy – here’s how,msnmoney,2021-02-08 12:09:53
Upstart Rises 879% as Founder Bets on Making Phones in India,msnmoney,2021-02-08 12:09:53
Car Brands With the Best and Worst Buyer Experience,msnmoney,2021-02-08 12:09:53
See problems as supervillains—and 4 other fun ways to fire up your remote teams,msnmoney,2021-02-08 12:09:53
Things Waitresses Notice About You in 3 Seconds,msnmoney,2021-02-08 12:09:53
"18 ways to boost your income, starting right now",msnmoney,2021-02-08 12:09:53
"Dating app Bumble raises the size of its IPO offering to 45 million shares, now expects to raise $1.8 billion",msnmoney,2021-02-08 12:09:53
"Advice From Mark Cuban, Warren Buffett and Other Experts That Can Help You Survive a Crisis",msnmoney,2021-02-08 12:09:53
"Estate Planning Checklist: 5 Tasks to Do Now, While You’re Still Well",msnmoney,2021-02-08 12:09:53
Just How Rich Are President Joe Biden and These Other Big Names?,msnmoney,2021-02-08 12:09:53
Here’s a better way than GameStop attacks for the ‘little guy’ to stick it to Wall Street,msnmoney,2021-02-08 12:09:53
7 Retirement Income Strategies Once Your Portfolio Reaches $500k,msnmoney,2021-02-08 12:09:53
The 15 Best Pizza Deals for Under $10,msnmoney,2021-02-08 12:09:53
Stocks rise to reach record highs; Bitcoin prices spike ,yahoofinance,2021-02-08 12:13:01
Every step towards vaccine access matters,yahoofinance,2021-02-08 12:13:01
Musk is serious about crypto as Tesla puts $1.5 billion in bitcoin,yahoofinance,2021-02-08 12:13:01
 Variant concerns rising globally as spread grows in US,yahoofinance,2021-02-08 12:13:01
Consumers are in 'excellent shape' as stocks hit record highs: Laffer Tengler Investments CIO,yahoofinance,2021-02-08 12:13:01
Doctor on COVID safety measures: 'We can’t let our guard down' now that we have vaccines,yahoofinance,2021-02-08 12:13:01
Don't expect a $15 federal minimum wage: Goldman,yahoofinance,2021-02-08 12:13:01
States reopening too soon is risky: doctor on COVID-19,yahoofinance,2021-02-08 12:13:01
Car Insurance for PA Drivers,yahoofinance,2021-02-08 12:13:01
"Your next stimulus check is just weeks away — will you get the full $1,400?",yahoofinance,2021-02-08 12:13:01
3 Monster Growth Stocks That Are Still Undervalued,yahoofinance,2021-02-08 12:13:01
6 Social Security Changes for 2021,yahoofinance,2021-02-08 12:13:01
Ocugen Skyrockets On $23M Capital Raise Issued On 46% Premium,yahoofinance,2021-02-08 12:13:01
7 public companies with exposure to bitcoin,yahoofinance,2021-02-08 12:13:01
Elon Musk is serious about crypto as Tesla puts $1.5 billion in bitcoin,yahoofinance,2021-02-08 12:13:01
Wells Fargo: These 2 Stocks Could Climb at Least 30%,yahoofinance,2021-02-08 12:13:01
We Drove a Ford Mustang Mach-E. We Were Wowed.,yahoofinance,2021-02-08 12:13:01
15 Undervalued Stocks With Strong Earnings Growth in 2021,yahoofinance,2021-02-08 12:13:01
Green Tech Could Create The First Trillionaire,yahoofinance,2021-02-08 12:13:01
A wealth tax is the economic buffer rich nations need,yahoofinance,2021-02-08 12:13:01
BofA Divided as Bankers Cry Foul Over Special Bonus Treatment,yahoofinance,2021-02-08 12:13:01
Yellen Is Retiring the Strong Dollar Policy. What Comes Next Is Tricky.,yahoofinance,2021-02-08 12:13:01
What Is A Dividend? Plus The 5 Best Dividend Stocks Now,yahoofinance,2021-02-08 12:13:01
Stocks are being weird: Morning Brief,yahoofinance,2021-02-08 12:13:01
First Mover: Tesla Sends Bitcoin Mooning Past $44K as Snoop Wins #dogebowl,yahoofinance,2021-02-08 12:13:01
Morning Bell With Jim Cramer: Buy Penn National Gaming,yahoofinance,2021-02-08 12:13:01
"Tesla buys $1.5 billion worth of Bitcoin, says may accept it for payment for products in the 'near future'",yahoofinance,2021-02-08 12:13:01
Why Warren Buffett thinks it's time to refinance your mortgage,yahoofinance,2021-02-08 12:13:01
"DraftKings Stock Jumps On Expanded NFL Partnership, Is It A Buy Right Now?",yahoofinance,2021-02-08 12:13:01
The Biden Stock Market Won’t Be Like the Trump Market. What to Expect.,yahoofinance,2021-02-08 12:13:01
"EV Company With Almost No Revenue Posts 3,000% Gain in 8 Months",yahoofinance,2021-02-08 12:13:01
These Are The Best Robinhood Stocks To Buy Or Watch Now,yahoofinance,2021-02-08 12:13:01
UPDATE 2-Laser maker Coherent receives $6 bln takeover offer from MKS Instruments,yahoofinance,2021-02-08 12:13:01
Ex-OCC Chief Brooks Calls Tesla’s Bitcoin Buy a Bit ‘Scary’ for Rest of World,yahoofinance,2021-02-08 12:13:01
"Once a 'stonk,' Hertz reveals dilemma companies face in Reddit frenzy",yahoofinance,2021-02-08 12:13:01
Palantir Surges on Deal to Offer Software Through IBM,yahoofinance,2021-02-08 12:13:01
"What to Know Before Buying Cassava Sciences, the Hot Alzheimer’s Stock",yahoofinance,2021-02-08 12:13:01
Asian chipmakers rush to boost production to meet global shortage,yahoofinance,2021-02-08 12:13:01
Dow Jones Rises To Record High As Tesla Buys Bitcoin; Market Rally Warning Signs,yahoofinance,2021-02-08 12:13:01
"Hot EV Stock Volta Isn’t Public Yet, but It Is Lighting Up the Market",yahoofinance,2021-02-08 12:13:01
Buy-the-Dip Candidates in the Stock Market: Look at Qualcomm,yahoofinance,2021-02-08 12:13:01
Reddit Pays Ode To GameStop 'Underdogs' In 5-Second Super Bowl Ad,yahoofinance,2021-02-08 12:13:01
Palantir Stock Jumped Because Now It’s Working With IBM,yahoofinance,2021-02-08 12:13:01
Which Crypto Projects Are Based on Ethereum?,yahoofinance,2021-02-08 12:13:01
Investors Have Shunned Utility Stocks. Here Are 6 to Consider.,yahoofinance,2021-02-08 12:13:01
"GameStop Shares Drop, Extending 80% Slump From Last Week",yahoofinance,2021-02-08 12:13:01
Baidu (BIDU) Breaks Out on Street-High Price Target,yahoofinance,2021-02-08 12:13:01
Big Oil’s huge losses raise prospect of mega mergers,yahoofinance,2021-02-08 12:13:01
Cisco Reports Earnings Tuesday. Here’s What to Expect.,yahoofinance,2021-02-08 12:13:01
Ethereum Futures Are Now Trading on CME,yahoofinance,2021-02-08 12:13:01
"Zomedica, Vislink, Senseonics and Other 'Meme' Stocks Soar Again",yahoofinance,2021-02-08 12:13:01
Modi shatters taboo with plan to privatise state banks,yahoofinance,2021-02-08 12:13:01
Here’s a better way than GameStop attacks for the ‘little guy’ to stick it to Wall Street,yahoofinance,2021-02-08 12:13:01
Top Apple Shareholders,yahoofinance,2021-02-08 12:13:01
BP’s Green Push Is Picking Up Speed with Major New Wind Projects. Winds of Change Are Blowing the Stock Higher.,yahoofinance,2021-02-08 12:13:01
Renaissance Hit With $5 Billion in Redemptions Since Dec. 1,yahoofinance,2021-02-08 12:13:01
Palantir stock shoots up after IBM partnership on AI offering for businesses,yahoofinance,2021-02-08 12:13:01
"Americans take to 'buy now, pay later' shopping during pandemic, but can they afford it?",yahoofinance,2021-02-08 12:13:01
These Are The 5 Best Stocks To Buy And Watch Now,yahoofinance,2021-02-08 12:13:01
"Big Pension Buys Up Alibaba, Lilly, and Cisco Stock. Here’s What It Sold.",yahoofinance,2021-02-08 12:13:01
Hong Kong Stocks Are About to Lose Biggest Source of Funds,yahoofinance,2021-02-08 12:13:01
A Look Into Cardinal Health's Debt,yahoofinance,2021-02-08 12:13:01
Cannabis Stocks Watchlist: Stocks to Buy in the Sector,yahoofinance,2021-02-08 12:13:01
AMC Major Stakeholder Wanda Converts Stock To Allow For Sale Amid WallStreetBets Frenzy,yahoofinance,2021-02-08 12:13:01
Westport Fuel Systems Takes Off on Amazon Truck-Engine Deal,yahoofinance,2021-02-08 12:13:01
"Global Payments stock gains after profit beat, Google partnership announcement",yahoofinance,2021-02-08 12:13:01
BIOLASE Raises $14.4M From Maxim Group At 15% Discount,yahoofinance,2021-02-08 12:13:01
Tesla buys $1.5 billion in bitcoin: as Elon Musk jumps on board with cryptocurrency,yahoofinance,2021-02-08 12:13:01
BP powers into UK windfarm sector with giant Irish Sea project,yahoofinance,2021-02-08 12:13:01
Low Expectations Ahead of Coca-Cola (KO) Report,yahoofinance,2021-02-08 12:13:01
Clean Energy Fuels Surges on Deal to Supply L.A. County Metro,yahoofinance,2021-02-08 12:13:01
"Apple Car Talks Aren’t Happening, Say Automakers Hyundai, Kia",yahoofinance,2021-02-08 12:13:01
Global Markets See Inflation Breaking Out to Multiyear Highs,yahoofinance,2021-02-08 12:13:01
"Coherent receives unsolicited buyout bid from MKS Instruments, a month after buyout deal with Lumentum",yahoofinance,2021-02-08 12:13:01
"Three Best ETF Picks For 2021: Value, Financials, Emerging Markets",yahoofinance,2021-02-08 12:13:01
"LUV Stock: Is It A Buy? What Earnings, Value Metrics, Stock Chart Show Today",yahoofinance,2021-02-08 12:13:01
Tilray Signs First Deal to Sell Cannabis to Germany From Portugal Facility,yahoofinance,2021-02-08 12:13:01
How This Small-Cap Fund Excels By Searching For Stocks With Sustained Earnings Power,yahoofinance,2021-02-08 12:13:01
Bonds Are Sending a Message: Inflation Is Coming,yahoofinance,2021-02-08 12:13:01
Battle looms over subprime lending regulation under Biden,yahoofinance,2021-02-08 12:13:01
Is A Career In Oil Still A Safe Bet?,yahoofinance,2021-02-08 12:13:01
Nothing Personal: Why I'm Negative on Sundial Growers,yahoofinance,2021-02-08 12:13:01
Hedge funds bet on oil's 'big comeback' after pandemic hobbles producers,yahoofinance,2021-02-08 12:13:01
Gold’s Current Commodity Costume,yahoofinance,2021-02-08 12:13:01
Best ETFs And Mutual Funds Begin 2021 With A Whimper,yahoofinance,2021-02-08 12:13:01
Zillow stock rises toward a record after upbeat analyst calls ahead of earnings,yahoofinance,2021-02-08 12:13:01
Dire Bond Returns Have 60/40 Managers Juicing Portfolios With FX,yahoofinance,2021-02-08 12:13:01
"Barron's Picks And Pans: Amazon, Biogen, Casey's General Stores, Hilton And More",yahoofinance,2021-02-08 12:13:01
"Renaissance, Pershing Square Among Hedge Funds That Got Clobbered in January",yahoofinance,2021-02-08 12:13:01
UPDATE 1-Indian court lifts hold on Future's $3.4 bln retail deal in setback for Amazon,yahoofinance,2021-02-08 12:13:01
Bitcoin Hits New Record High Over $43K on Tesla News,yahoofinance,2021-02-08 12:13:01
Brent Oil Tops $60 With Return to Normal Demand in Sight,yahoofinance,2021-02-08 12:13:01
Wynn Resorts stock falls after 5.5 million share common stock offering,yahoofinance,2021-02-08 12:13:01
"Cramer Advises Viewers On Snap, nCino And More",yahoofinance,2021-02-08 12:13:01
"Musk’s Tesla says it invested $1.5 billion in bitcoin, sending the cryptocurrency to record levels near $44,000",yahoofinance,2021-02-08 12:13:01
Bitcoin Miner Bitfarms to Raise $31M in Sale of Shares to Institutional Investors,yahoofinance,2021-02-08 12:13:01
Rolls Royce plans summer shutdown to help cut losses,yahoofinance,2021-02-08 12:13:01
Why a Fintech Chose to Go Public With a SPAC. Hint: It’s the Money and the Partner.,yahoofinance,2021-02-08 12:13:01
"REFILE-UPDATE 5-Musk's Tesla electrifies bitcoin with $1.5 bln bet, car payments pledge",yahoofinance,2021-02-08 12:13:01
"Gold climbs for a second session, rebounding from a recent 2-month low",yahoofinance,2021-02-08 12:13:01
"Tesla Invests $1.5B in Bitcoin, Plans to Accept Crypto Payments",yahoofinance,2021-02-08 12:13:01
Chip Shortage Spirals Beyond Cars to Phones and Consoles,yahoofinance,2021-02-08 12:13:01
Electric scooter maker Niu in talks to supply Gojek: CEO,yahoofinance,2021-02-08 12:13:01
Why Hilton Stock Is Primed for Postpandemic Upside,yahoofinance,2021-02-08 12:13:01
Renesas Set To Acquire Apple Supplier Dialog Semiconductor For $5.9B,yahoofinance,2021-02-08 12:13:01
"Notable Insider Buys Of The Past Week: Harley-Davidson, Texas Instruments And More",yahoofinance,2021-02-08 12:13:01
So you made a bundle on GameStop. Get ready to pay the taxes,yahoofinance,2021-02-08 12:13:01
U.S. Steel to offer $500 million of bonds that mature in 2029,yahoofinance,2021-02-08 12:13:01
Well Health Scoops Up CRH Medical For $4 Per Share; CRHM Shares Skyrocket,yahoofinance,2021-02-08 12:13:01
Tesla Invests $1.5 Billion in Bitcoin,wsj,2021-02-08 12:15:57
"SoftBank Turns $11 Billion Profit, Helped by DoorDash",wsj,2021-02-08 12:15:57
"$15 Minimum Wage Would Cut Employment, Reduce Poverty",wsj,2021-02-08 12:15:57
GameStop Frenzy Puts Stock Clearing Rules in Spotlight,wsj,2021-02-08 12:15:57
Malls Spent Billions on Theme Parks to Woo Shoppers. It Made Matters Worse.,wsj,2021-02-08 12:15:57
Trump Lawyers Call Impeachment Trial ‘Political Theater’,wsj,2021-02-08 12:15:57
Demand for Covid-19 Vaccines Overwhelms State Health Providers,wsj,2021-02-08 12:15:57
U.S. Rep. Ron Wright Dies of Covid-19,wsj,2021-02-08 12:15:57
How About That Tampa Bay Defense?,wsj,2021-02-08 12:15:57
Biden’s Bipartisan Hopes Need Not Die Now,wsj,2021-02-08 12:15:57
Can You Create a Company Worth as Much as Airbnb?,wsj,2021-02-08 12:15:57
"Better Data, Cheaper Tech Promise to Unlock Nature’s Secrets",wsj,2021-02-08 12:15:57
The Grandparents Have Gotten Their Covid-19 Vaccine. Is it Finally OK to Visit Them?,wsj,2021-02-08 12:15:57
Angry Robinhood Traders Take Aim at the Wrong Robin Hood,wsj,2021-02-08 12:15:57
"Chrysler, Fiat Dealers Want New Boss to Fix Ailing Brands",wsj,2021-02-08 12:15:57
Amazon Warehouse Workers to Vote on Union: What We Know,wsj,2021-02-08 12:15:57
Apple’s Electric-Vehicle Talks With Hyundai Break Down,wsj,2021-02-08 12:15:57
China’s Car Sales Rose 25% in January,wsj,2021-02-08 12:15:57
WordPress VIP Buying Parse.ly,wsj,2021-02-08 12:15:57
Democrats Are Split on Biden Pick for Top Bank Regulator,wsj,2021-02-08 12:15:57
HNA Group’s Financial Maneuvers Powered Its Rise—and Caused Its Downfall,wsj,2021-02-08 12:15:57
Flood of Cash Pushes Borrowing Costs to Unusual Lows in Europe,wsj,2021-02-08 12:15:57
"After Indian Glacier Bursts, Rescue Workers Search for Hundreds Missing",wsj,2021-02-08 12:15:57
