headline,org,date
5 Things to Watch in the Markets Thursday,msnmoney,2020-12-03 09:51:58
How Much You Need To Be in the Top 5% in Every State,msnmoney,2020-12-03 09:51:58
The Dead Giveaway That Tells You When Amazon’s Giving You A Better Price Than Other Retailers,msnmoney,2020-12-03 09:51:58
30 Important Money Habits for Your Financial Future,msnmoney,2020-12-03 09:51:58
Year in Review: The Year for Facebook,msnmoney,2020-12-03 09:51:58
Expert: “This credit card is so good I signed up personally”,msnmoney,2020-12-03 09:51:58
"Walmart gives bonuses to employees, extends emergency leave as pandemic worsens",msnmoney,2020-12-03 09:51:58
25 Glamorous Jobs With Awful Pay,msnmoney,2020-12-03 09:51:58
Your Guide to 2020 Tax Deductions,msnmoney,2020-12-03 09:51:58
HelloFresh Is Giving 12 Meals Free Including Free Shipping For New Customers,msnmoney,2020-12-03 09:51:58
Are You Below or Above the Poverty Line in Your State?,msnmoney,2020-12-03 09:51:58
Switch and you could save. Rock on.,msnmoney,2020-12-03 09:51:58
"Rent-A-Center boosts dividend by nearly 7%, to yield well above the S&P 500",msnmoney,2020-12-03 09:51:58
4 Top Retirement Planning Tips from Warren Buffett,msnmoney,2020-12-03 09:51:58
14 smart personal finance moves you can make right now,msnmoney,2020-12-03 09:51:58
The most expensive celebrity homes of all time,msnmoney,2020-12-03 09:51:58
"Stock-market values recently reached levels seen on the eve of 1929 crash, by one measure",msnmoney,2020-12-03 09:51:58
39 Gifts That Are Selling Like Hotcakes During The Holidays,msnmoney,2020-12-03 09:51:58
32 reasons to celebrate getting older,msnmoney,2020-12-03 09:51:58
Thursday's Best Mortgage Rates: Dec. 3,msnmoney,2020-12-03 09:51:58
Year in Review: Looking Back at the Huge Year for Zoom,msnmoney,2020-12-03 09:51:58
"Russian in Bank Hack Faces 15 to 20 Years, U.S. Says",msnmoney,2020-12-03 09:51:58
15 Credit Card Hacks for Big Holiday Savings,msnmoney,2020-12-03 09:51:58
7 Mistakes That Can Ruin Your Retirement,msnmoney,2020-12-03 09:51:58
How One Big Mistake Could Cut Your Retirement Investment Accounts in Half,msnmoney,2020-12-03 09:51:58
There’s Still Time To Set Up Your Holiday Financial Plan,msnmoney,2020-12-03 09:51:58
Best Travel Stocks for 2021,msnmoney,2020-12-03 09:51:58
Old-School Services That Have Returned During the Pandemic,msnmoney,2020-12-03 09:51:58
How much of your paycheck should you save?,msnmoney,2020-12-03 09:51:58
Seniors On Medicare Get A Big Boost To SS Checks In 2020,msnmoney,2020-12-03 09:51:58
What the Richest 1% Pay in Taxes in Your State,msnmoney,2020-12-03 09:51:58
"Here are the 3 ways stocks are likely to finish in 2020, says this trader",msnmoney,2020-12-03 09:51:58
Here Is the Tax Burden on the Poorest 20% in Every State,msnmoney,2020-12-03 09:51:58
Nearly half of Americans consider moving due to pandemic,msnmoney,2020-12-03 09:51:58
Where Experts Think Congress Should Spend Stimulus Money,msnmoney,2020-12-03 09:51:58
Unique Tip If Your Car Has Automatic Headlights,msnmoney,2020-12-03 09:51:58
Gold prices head higher for 3rd day in a row,msnmoney,2020-12-03 09:51:58
How Investors Need To Prepare Now for a Biden Administration,msnmoney,2020-12-03 09:51:58
What is mortgage escrow?,msnmoney,2020-12-03 09:51:58
20 tips every landlord should know,msnmoney,2020-12-03 09:51:58
"Amazon, Google, Walmart, and other leading firms, call on Biden, Congress to address climate change",msnmoney,2020-12-03 09:51:58
[Photos] Bo Derek's Teenage Photos That Leaves Nothing to Imagination,msnmoney,2020-12-03 09:51:58
At-home COVID-19 tests and more ways to spend your FSA cash,msnmoney,2020-12-03 09:51:58
"Star loan officer’s advice: Look beyond the rate and consider closing costs, too",msnmoney,2020-12-03 09:51:58
10 awesome financial gifts for kids that teach about money,msnmoney,2020-12-03 09:51:58
Should You Buy Disney Before the Holidays?,msnmoney,2020-12-03 09:51:58
"Just How Rich Are Oprah, Bill Gates and Other Big Names?",msnmoney,2020-12-03 09:51:58
Unique Holiday Gift Ideas for the Men in Your Life,msnmoney,2020-12-03 09:51:58
America's miserable winter could get worse for laid-off workers: Pandemic benefits are about to expire,msnmoney,2020-12-03 09:51:58
The Best Places to Retire If You Can’t Save $1 Million,msnmoney,2020-12-03 09:51:58
Warren Buffett's Berkshire Hathaway will hold its May annual meeting virtually again,msnmoney,2020-12-03 09:51:58
Key Signs You Should Sell Your Home When You Retire,msnmoney,2020-12-03 09:51:58
Google has begun allowing employees to hold some meetings outdoors on campus,msnmoney,2020-12-03 09:51:58
[Photos] Funniest Camping Pic Ever Released,msnmoney,2020-12-03 09:51:58
The 7 Best Bond Funds for Retirement Savers in 2021,msnmoney,2020-12-03 09:51:58
HDFC Bank Ordered to Halt New Digital Products on Glitches,msnmoney,2020-12-03 09:51:58
"The 50 Best Places To Buy a Home for Under $250,000",msnmoney,2020-12-03 09:51:58
This Wildly Popular Investment Has 2 Costly Flaws,msnmoney,2020-12-03 09:51:58
35 Surprising Cities With Low Costs of Living,msnmoney,2020-12-03 09:51:58
Life inside a stock market bubble is great until someone takes out a pin,msnmoney,2020-12-03 09:51:58
Actors Who Were Supposed To Be The Next Big Thing,msnmoney,2020-12-03 09:51:58
Home Renovations That Will Pay You Back,msnmoney,2020-12-03 09:51:58
10 Signs That It’s Time to Find a New Job,msnmoney,2020-12-03 09:51:58
Can You Afford to Die in Your State?,msnmoney,2020-12-03 09:51:58
Global Oil Benchmark Brent Could Soon Incorporate American Crude,msnmoney,2020-12-03 09:51:58
20 Ways To Pay Less at Costco,msnmoney,2020-12-03 09:51:58
Engie Said to Line Up Banks for $6 Billion Services Disposal,msnmoney,2020-12-03 09:51:58
We Will Guess Your Education Level in 25 Questions,msnmoney,2020-12-03 09:51:58
19 Wealth-Building Lessons From the Latest Financial Crises,msnmoney,2020-12-03 09:51:58
Dealmaking on a hot streak — Fintech-as-a-service — DoorDash's IPO paperwork looks off,msnmoney,2020-12-03 09:51:58
The 26 Best Ideas for Home-Based Businesses,msnmoney,2020-12-03 09:51:58
DoorDashing to Six Figures: How to 'Micro Job' Right,msnmoney,2020-12-03 09:51:58
Most Popular Grocery Store in Every State,msnmoney,2020-12-03 09:51:58
Former Don Quijote CEO Arrested on Insider Trading Charges,msnmoney,2020-12-03 09:51:58
[Photos] Bo Derek's Teenage Photos That Leaves Nothing to Imagination,msnmoney,2020-12-03 09:51:58
States Where the Virus Is Spreading the Fastest,msnmoney,2020-12-03 09:51:58
Inside Oprah's $100+ million dream homes,msnmoney,2020-12-03 09:51:58
Your guide to not going broke over the holidays,msnmoney,2020-12-03 09:51:58
Daimler Picks Ex-BMW and VW CEO to Lead Supervisory Board,msnmoney,2020-12-03 09:51:58
The Hardest College to Get Into in Every State,msnmoney,2020-12-03 09:51:58
9 Bathroom Plumbing Mistakes to Avoid,msnmoney,2020-12-03 09:51:58
5 Things to Watch in the Markets Thursday,msnmoney,2020-12-03 09:51:58
How Much You Need To Be in the Top 5% in Every State,msnmoney,2020-12-03 09:51:58
The Dead Giveaway That Tells You When Amazon’s Giving You A Better Price Than Other Retailers,msnmoney,2020-12-03 09:51:58
30 Important Money Habits for Your Financial Future,msnmoney,2020-12-03 09:51:58
Year in Review: The Year for Facebook,msnmoney,2020-12-03 09:51:58
Expert: “This credit card is so good I signed up personally”,msnmoney,2020-12-03 09:51:58
"Walmart gives bonuses to employees, extends emergency leave as pandemic worsens",msnmoney,2020-12-03 09:51:58
25 Glamorous Jobs With Awful Pay,msnmoney,2020-12-03 09:51:58
Your Guide to 2020 Tax Deductions,msnmoney,2020-12-03 09:51:58
HelloFresh Is Giving 12 Meals Free Including Free Shipping For New Customers,msnmoney,2020-12-03 09:51:58
Are You Below or Above the Poverty Line in Your State?,msnmoney,2020-12-03 09:51:58
Switch and you could save. Rock on.,msnmoney,2020-12-03 09:51:58
"Rent-A-Center boosts dividend by nearly 7%, to yield well above the S&P 500",msnmoney,2020-12-03 09:51:58
4 Top Retirement Planning Tips from Warren Buffett,msnmoney,2020-12-03 09:51:58
14 smart personal finance moves you can make right now,msnmoney,2020-12-03 09:51:58
The most expensive celebrity homes of all time,msnmoney,2020-12-03 09:51:58
"Stock-market values recently reached levels seen on the eve of 1929 crash, by one measure",msnmoney,2020-12-03 09:51:58
39 Gifts That Are Selling Like Hotcakes During The Holidays,msnmoney,2020-12-03 09:51:58
32 reasons to celebrate getting older,msnmoney,2020-12-03 09:51:58
Thursday's Best Mortgage Rates: Dec. 3,msnmoney,2020-12-03 09:51:58
Year in Review: Looking Back at the Huge Year for Zoom,msnmoney,2020-12-03 09:51:58
"Russian in Bank Hack Faces 15 to 20 Years, U.S. Says",msnmoney,2020-12-03 09:51:58
15 Credit Card Hacks for Big Holiday Savings,msnmoney,2020-12-03 09:51:58
7 Mistakes That Can Ruin Your Retirement,msnmoney,2020-12-03 09:51:58
How One Big Mistake Could Cut Your Retirement Investment Accounts in Half,msnmoney,2020-12-03 09:51:58
There’s Still Time To Set Up Your Holiday Financial Plan,msnmoney,2020-12-03 09:51:58
Best Travel Stocks for 2021,msnmoney,2020-12-03 09:51:58
Old-School Services That Have Returned During the Pandemic,msnmoney,2020-12-03 09:51:58
How much of your paycheck should you save?,msnmoney,2020-12-03 09:51:58
Seniors On Medicare Get A Big Boost To SS Checks In 2020,msnmoney,2020-12-03 09:51:58
What the Richest 1% Pay in Taxes in Your State,msnmoney,2020-12-03 09:51:58
"Here are the 3 ways stocks are likely to finish in 2020, says this trader",msnmoney,2020-12-03 09:51:58
Here Is the Tax Burden on the Poorest 20% in Every State,msnmoney,2020-12-03 09:51:58
Nearly half of Americans consider moving due to pandemic,msnmoney,2020-12-03 09:51:58
Where Experts Think Congress Should Spend Stimulus Money,msnmoney,2020-12-03 09:51:58
Unique Tip If Your Car Has Automatic Headlights,msnmoney,2020-12-03 09:51:58
Gold prices head higher for 3rd day in a row,msnmoney,2020-12-03 09:51:58
How Investors Need To Prepare Now for a Biden Administration,msnmoney,2020-12-03 09:51:58
What is mortgage escrow?,msnmoney,2020-12-03 09:51:58
20 tips every landlord should know,msnmoney,2020-12-03 09:51:58
"Amazon, Google, Walmart, and other leading firms, call on Biden, Congress to address climate change",msnmoney,2020-12-03 09:51:58
[Photos] Bo Derek's Teenage Photos That Leaves Nothing to Imagination,msnmoney,2020-12-03 09:51:58
At-home COVID-19 tests and more ways to spend your FSA cash,msnmoney,2020-12-03 09:51:58
"Star loan officer’s advice: Look beyond the rate and consider closing costs, too",msnmoney,2020-12-03 09:51:58
10 awesome financial gifts for kids that teach about money,msnmoney,2020-12-03 09:51:58
Should You Buy Disney Before the Holidays?,msnmoney,2020-12-03 09:51:58
"Just How Rich Are Oprah, Bill Gates and Other Big Names?",msnmoney,2020-12-03 09:51:58
Unique Holiday Gift Ideas for the Men in Your Life,msnmoney,2020-12-03 09:51:58
America's miserable winter could get worse for laid-off workers: Pandemic benefits are about to expire,msnmoney,2020-12-03 09:51:58
The Best Places to Retire If You Can’t Save $1 Million,msnmoney,2020-12-03 09:51:58
Warren Buffett's Berkshire Hathaway will hold its May annual meeting virtually again,msnmoney,2020-12-03 09:51:58
Key Signs You Should Sell Your Home When You Retire,msnmoney,2020-12-03 09:51:58
Google has begun allowing employees to hold some meetings outdoors on campus,msnmoney,2020-12-03 09:51:58
[Photos] Funniest Camping Pic Ever Released,msnmoney,2020-12-03 09:51:58
The 7 Best Bond Funds for Retirement Savers in 2021,msnmoney,2020-12-03 09:51:58
HDFC Bank Ordered to Halt New Digital Products on Glitches,msnmoney,2020-12-03 09:51:58
"The 50 Best Places To Buy a Home for Under $250,000",msnmoney,2020-12-03 09:51:58
This Wildly Popular Investment Has 2 Costly Flaws,msnmoney,2020-12-03 09:51:58
35 Surprising Cities With Low Costs of Living,msnmoney,2020-12-03 09:51:58
Life inside a stock market bubble is great until someone takes out a pin,msnmoney,2020-12-03 09:51:58
Actors Who Were Supposed To Be The Next Big Thing,msnmoney,2020-12-03 09:51:58
Home Renovations That Will Pay You Back,msnmoney,2020-12-03 09:51:58
10 Signs That It’s Time to Find a New Job,msnmoney,2020-12-03 09:51:58
Can You Afford to Die in Your State?,msnmoney,2020-12-03 09:51:58
Global Oil Benchmark Brent Could Soon Incorporate American Crude,msnmoney,2020-12-03 09:51:58
20 Ways To Pay Less at Costco,msnmoney,2020-12-03 09:51:58
Engie Said to Line Up Banks for $6 Billion Services Disposal,msnmoney,2020-12-03 09:51:58
We Will Guess Your Education Level in 25 Questions,msnmoney,2020-12-03 09:51:58
19 Wealth-Building Lessons From the Latest Financial Crises,msnmoney,2020-12-03 09:51:58
Dealmaking on a hot streak — Fintech-as-a-service — DoorDash's IPO paperwork looks off,msnmoney,2020-12-03 09:51:58
The 26 Best Ideas for Home-Based Businesses,msnmoney,2020-12-03 09:51:58
DoorDashing to Six Figures: How to 'Micro Job' Right,msnmoney,2020-12-03 09:51:58
Most Popular Grocery Store in Every State,msnmoney,2020-12-03 09:51:58
Former Don Quijote CEO Arrested on Insider Trading Charges,msnmoney,2020-12-03 09:51:58
[Photos] Bo Derek's Teenage Photos That Leaves Nothing to Imagination,msnmoney,2020-12-03 09:51:58
States Where the Virus Is Spreading the Fastest,msnmoney,2020-12-03 09:51:58
Inside Oprah's $100+ million dream homes,msnmoney,2020-12-03 09:51:58
Your guide to not going broke over the holidays,msnmoney,2020-12-03 09:51:58
Daimler Picks Ex-BMW and VW CEO to Lead Supervisory Board,msnmoney,2020-12-03 09:51:58
The Hardest College to Get Into in Every State,msnmoney,2020-12-03 09:51:58
9 Bathroom Plumbing Mistakes to Avoid,msnmoney,2020-12-03 09:51:58
Stocks hold near record levels after jobless claims top estimates,yahoofinance,2020-12-03 09:53:56
Fewer Americans filed new jobless claims than expected,yahoofinance,2020-12-03 09:53:56
Trump-era volatility 'frustrated' business leaders: Box CEO,yahoofinance,2020-12-03 09:53:56
Costco will now sell Beyond Meat meatballs in new deal,yahoofinance,2020-12-03 09:53:56
Luminar CEO: We’re absolutely in this for the long run,yahoofinance,2020-12-03 09:53:56
Business leaders privately ‘incredibly frustrated’ with Trump-era volatility: Box CEO,yahoofinance,2020-12-03 09:53:56
Wall St is already increasing its 2021 price targets,yahoofinance,2020-12-03 09:53:56
House gets ready for historic vote on marijuana,yahoofinance,2020-12-03 09:53:56
"2.25% FIXED Mortgage Refi, No Hidden Fees/Points",yahoofinance,2020-12-03 09:53:56
Kroger Slips After Grocer Reports Lower-Than-Expected Sales,yahoofinance,2020-12-03 09:53:56
I moved out of California in retirement — but it wasn’t because of taxes,yahoofinance,2020-12-03 09:53:56
Do You Own Jumia Technologies? Here's How We'd Play the Stock Now,yahoofinance,2020-12-03 09:53:56
Jim Cramer: Here Comes the 'Pent-Up Demand' Bull Market,yahoofinance,2020-12-03 09:53:56
Splunk Drops on Report of Wider Loss: What Wall Street Is Saying,yahoofinance,2020-12-03 09:53:56
20 electric vehicle stocks besides Tesla and Nio that analysts expect to rise the most over the next year,yahoofinance,2020-12-03 09:53:56
"XPeng downgraded at UBS, as stock has run up too much to keep buying",yahoofinance,2020-12-03 09:53:56
Column: Canceling student debt should be a slam dunk. Here's why,yahoofinance,2020-12-03 09:53:56
Fastest-Growing Companies: 27 Stocks Expecting Up To 711% EPS Growth In 2020,yahoofinance,2020-12-03 09:53:56
Zscaler Soars on Analysts' Earnings Praise,yahoofinance,2020-12-03 09:53:56
"Kroger's stock falls after profit rises above expectations, but sales miss",yahoofinance,2020-12-03 09:53:56
"US Congress Clears Bill That Threatens To Delist Chinese Titans Like Alibaba, Pinduoduo, Nio Over Audit Compliance",yahoofinance,2020-12-03 09:53:56
3 “Strong Buy” Stocks That Could Bloom in 2021,yahoofinance,2020-12-03 09:53:56
"House Passes China Delisting Bill, Sending to Trump for Approval. What That Means for Investors.",yahoofinance,2020-12-03 09:53:56
"Tesla Shares Gain on Goldman Upgrade, Price Target Boost Ahead of S&P 500 Debut",yahoofinance,2020-12-03 09:53:56
"Dow Jones Rallies As Biden Makes China Pledge, Senior Democrat Outlines Stimulus Hope",yahoofinance,2020-12-03 09:53:56
Snowflake Reported Huge Revenue Growth in Its First Quarterly Report. Here’s Why the Stock Is Falling.,yahoofinance,2020-12-03 09:53:56
The 6 Best CRISPR Stocks to Buy Today,yahoofinance,2020-12-03 09:53:56
Michael Burry Of 'The Big Short' Fame Confirms He's Shorting Tesla,yahoofinance,2020-12-03 09:53:56
Billionaire Jim Simons Places Bet on 3 High-Yield Dividend Stocks,yahoofinance,2020-12-03 09:53:56
These 3 EV Entrepreneurs Are Getting Richer Faster Than Elon Musk This Year,yahoofinance,2020-12-03 09:53:56
"Dow Jones Up 3,700 Points From October Low; Time To Sell These Hot Growth Stocks?",yahoofinance,2020-12-03 09:53:56
"House Passes China Stocks Delisting Bill; Threat Grows For Alibaba, JD.com, Nio",yahoofinance,2020-12-03 09:53:56
What Income Reduces Social Security Benefits?,yahoofinance,2020-12-03 09:53:56
Tesla Bear Jim Chanos Says He’d Tell Elon Musk ‘Job Well Done’,yahoofinance,2020-12-03 09:53:56
Investors wanted Nikola to be the next Tesla. It's not.,yahoofinance,2020-12-03 09:53:56
"Zscaler, Okta, and Splunk Earnings Carry a Warning for Investors",yahoofinance,2020-12-03 09:53:56
"Is Amazon Stock A Buy Right Now? Here's What Earnings, Charts Show",yahoofinance,2020-12-03 09:53:56
"Dow Industrials, Stocks Open Higher; Tesla Stock Upgraded, Boeing Pops On 737 Max Flight News",yahoofinance,2020-12-03 09:53:56
Vanguard Loses $590 Million Stock Mandate From Taiwan Funds,yahoofinance,2020-12-03 09:53:56
Why Ethereum and Bitcoin Are Very Different Investments,yahoofinance,2020-12-03 09:53:56
Is GE Stock A Buy As Wall Street Gets Bullish On Turnaround?,yahoofinance,2020-12-03 09:53:56
International Paper's stock jumps toward 2-year high after plans to spin off printing papers business,yahoofinance,2020-12-03 09:53:56
AMC Entertainment's stock drops after filing for sale of up to 200 million shares,yahoofinance,2020-12-03 09:53:56
Citigroup’s Mistaken-Transfer Trial at Risk With 11th-Hour Query,yahoofinance,2020-12-03 09:53:56
Gold Falls to a Critical Threshold. Why Investors Should Take Note.,yahoofinance,2020-12-03 09:53:56
Stock market news live updates: Stocks hold near record levels after jobless claims top estimates,yahoofinance,2020-12-03 09:53:56
"Costco’s November sales rise 15%, slower than previous 2 months",yahoofinance,2020-12-03 09:53:56
Canada asks court to throw out expert affidavit in Huawei CFO's U.S. extradition case,yahoofinance,2020-12-03 09:53:56
"These 2 “Strong Buy” Penny Stocks Could Go Boom, Says Roth Capital",yahoofinance,2020-12-03 09:53:56
Carnival Chairman Micky Arison Sold a Boatload of Stock,yahoofinance,2020-12-03 09:53:56
"Shell’s Cash Flow Story Is ‘Too Good to Ignore.’ It’s Time to Buy the Stock, Says Bernstein.",yahoofinance,2020-12-03 09:53:56
"House Passes China Delisting Bill. What That Means for NIO, Li Auto, and XPeng Stock.",yahoofinance,2020-12-03 09:53:56
Georgia Republican reportedly flipped shares of anti-malware company dozens of times while serving on Senate’s cybersecurity subcommittee,yahoofinance,2020-12-03 09:53:56
Tesla Gains After Goldman Upgrades With Street-High Target,yahoofinance,2020-12-03 09:53:56
3 EV Stocks That Are All Set To Race,yahoofinance,2020-12-03 09:53:56
"Gold Price Pans For A Bottom As Coronavirus Vaccines Near, But This Is Key",yahoofinance,2020-12-03 09:53:56
Managing Your Money After You Retire,yahoofinance,2020-12-03 09:53:56
"Nesco's stock rockets after $1.5 billion acquisition deal, and large equity investment from Platinum, Blackstone",yahoofinance,2020-12-03 09:53:56
Chevron Slashes Long-Term Spending Plan in Wake of Oil Slump,yahoofinance,2020-12-03 09:53:56
What's Next For GE After The Stock's Best Month Ever?,yahoofinance,2020-12-03 09:53:56
Splunk Posts Third Straight Quarterly Loss; Shares Sink About 19%,yahoofinance,2020-12-03 09:53:56
"Verizon Stock Is ‘Simply Too Cheap’ Not to Buy, Analyst Says",yahoofinance,2020-12-03 09:53:56
Flutter to pay $4.2 billion to increase FanDuel stake,yahoofinance,2020-12-03 09:53:56
"3M Targets 2,900 Job Cuts in Updated Global Restructuring Plan",yahoofinance,2020-12-03 09:53:56
Will Microsoft fire back at Salesforce after its $27.7 billion Slack deal?,yahoofinance,2020-12-03 09:53:56
Here’s why DoorDash is the most ridiculous IPO of 2020,yahoofinance,2020-12-03 09:53:56
Tesla Gets Goldman Sachs Upgrade With $780 Price Target,yahoofinance,2020-12-03 09:53:56
5 Value Stocks In The Utilities Sector,yahoofinance,2020-12-03 09:53:56
Morning Bell With Jim Cramer: Pfizer Vaccine Approval Status,yahoofinance,2020-12-03 09:53:56
Palantir Stock Falls As Analyst Says Rally Not Grounded In Fundamentals,yahoofinance,2020-12-03 09:53:56
Dow Jones Futures: CrowdStrike Leads 3 Earnings Breakouts; China Delistings Bill Goes To Trump,yahoofinance,2020-12-03 09:53:56
FuelCell Energy stock drops after share offering,yahoofinance,2020-12-03 09:53:56
9 awesome financial gifts for teaching kids about money,yahoofinance,2020-12-03 09:53:56
"Dollar General Tops Q3 Earnings Forecast, Holds Back on 2021 Profit Guidance",yahoofinance,2020-12-03 09:53:56
"Glaxo downgraded to neutral at UBS, which says European pharma 'cheap but not a bargain'",yahoofinance,2020-12-03 09:53:56
Ripple CEO Walks Back Threat to Leave US,yahoofinance,2020-12-03 09:53:56
"Li Auto, Nio, Xpeng EV Sales Jump As Wall Street Sees Leaders Emerge From The Pack",yahoofinance,2020-12-03 09:53:56
Tesla climbs as Goldman lifts rating to buy and price target to $780,yahoofinance,2020-12-03 09:53:56
What are Inheritance Taxes?,yahoofinance,2020-12-03 09:53:56
"Michaels Cos. tops earnings estimates, to pay $10 million in holiday bonuses",yahoofinance,2020-12-03 09:53:56
Dow Jones Stocks To Buy And Watch In December 2020: Apple Hits New Buy Point,yahoofinance,2020-12-03 09:53:56
Wall Street is already increasing its 2021 price targets: Morning Brief,yahoofinance,2020-12-03 09:53:56
Dollar General Earnings Top Ahead Of Ollie's Bargain Outlet Tonight,yahoofinance,2020-12-03 09:53:56
Novavax: Several Catalysts on the Horizon,yahoofinance,2020-12-03 09:53:56
"Cramer Gives His Opinion On Wells Fargo, Micron And More",yahoofinance,2020-12-03 09:53:56
'Halftime Report' Traders Weigh In On Citi's Disney Call,yahoofinance,2020-12-03 09:53:56
EV Stocks With Long-Term Potential,yahoofinance,2020-12-03 09:53:56
Restaurants and Airlines Are Getting Hammered by the Covid-19 Surge. Why Analysts Say Buy the Dip in the Stocks.,yahoofinance,2020-12-03 09:53:56
Chevron Slashes Capital Spending Plans In Lower Carbon Shift; Sets 2021 Budget at $14 Billion,yahoofinance,2020-12-03 09:53:56
3 Bank Stocks Trading Back Above Their 200 Moving Average,yahoofinance,2020-12-03 09:53:56
Pfizer Jumps After Nabbing First-Ever Coronavirus Vaccine Approval,yahoofinance,2020-12-03 09:53:56
Peloton Is Still in Demand. So Is the Stock.,yahoofinance,2020-12-03 09:53:56
CrowdStrike Stock Rallies as Profits and Revenue Blow Past Guidance,yahoofinance,2020-12-03 09:53:56
Reasons to Buy: Cramer's 'Mad Money' Recap (Wednesday 12/2/20),yahoofinance,2020-12-03 09:53:56
2 Strategies To Trade Thursday's DocuSign Earnings Report Using Options,yahoofinance,2020-12-03 09:53:56
EUR/USD Daily Forecast – Resistance At 1.2155 In Sight,yahoofinance,2020-12-03 09:53:56
"Express shares slide 21% premarket after swinging to bigger-than-expected loss, unveiling job cuts",yahoofinance,2020-12-03 09:53:56
Salesforce slumps 8.5% as its post-Slack selloff continues,yahoofinance,2020-12-03 09:53:56
How to Avoid Paying Taxes on Inherited Property,yahoofinance,2020-12-03 09:53:56
Should You Buy Marijuana Stocks As Biden Begins Transition?,yahoofinance,2020-12-03 09:53:56
Earnings Outlook for DocuSign,yahoofinance,2020-12-03 09:53:56
Can I reverse a Roth conversion?,yahoofinance,2020-12-03 09:53:56
Best Preferred Stock ETFs for Q1 2021,yahoofinance,2020-12-03 09:53:56
Cresco Labs or Curaleaf: Which Stock is the Better Cannabis Play?,yahoofinance,2020-12-03 09:53:56
Insider Sells Carnival's Stock,yahoofinance,2020-12-03 09:53:56
8 Stocks To Play Bitcoin's Resurgence,yahoofinance,2020-12-03 09:53:56
Stock Wars: CVS Health Vs. Walgreens Boots Alliance,yahoofinance,2020-12-03 09:53:56
Is Spotify Stock A Buy Right Now? Here's What IBD Charts Show,yahoofinance,2020-12-03 09:53:56
Oil sees quiet bull market as hedge funds pile in,yahoofinance,2020-12-03 09:53:56
U.S. Jobless Claims Fell Last Week After Recent Rise,wsj,2020-12-03 09:56:25
U.S. Deaths Hit Daily Record as Newly Reported Cases Surge,wsj,2020-12-03 09:56:25
Airline Cards Lose Luster as Coronavirus Persists,wsj,2020-12-03 09:56:25
Chevron Slashes Spending Plans as Coronavirus Hammers Oil Demand,wsj,2020-12-03 09:56:25
"2020 Holiday Sales: How, Where and When Consumers Are Buying",wsj,2020-12-03 09:56:25
"Ahead of U.S. Audit Bill, Chinese Companies Are Finding Their Way Home",wsj,2020-12-03 09:56:25
U.K.’s Covid-19 Vaccine Program to Test Its National Health Service,wsj,2020-12-03 09:56:25
Covid-19 Disbelief Challenges Health-Care Workers,wsj,2020-12-03 09:56:25
Many Companies Turn 401(k) Matches Back On,wsj,2020-12-03 09:56:25
A Rapid Covid Test That’s Also Accurate? NFL Says It Has One,wsj,2020-12-03 09:56:25
Delivery-Only Ghost Kitchens Are Reshaping the Restaurant Industry,wsj,2020-12-03 09:56:25
China’s Zealous Coronavirus Tests on Frozen Food Vex Trade Partners,wsj,2020-12-03 09:56:25
"Sorry, Millennials. Over-40s Are In at Gucci.",wsj,2020-12-03 09:56:25
How Harry Styles Became 2020’s Biggest Fashion Icon,wsj,2020-12-03 09:56:25
U.S. Tech Giants Face Tighter Regulation in Europe,wsj,2020-12-03 09:56:25
"Kroger Reports Strong, But Slowing, Sales Growth",wsj,2020-12-03 09:56:25
