headline,org,date
Obamacare likely to be flashpoint as Republicans try to push through Barrett confirmation,financialtimes,2020-09-28 09:09:06
Executives shift contributions on expectations of Biden victory in November,financialtimes,2020-09-28 09:09:06
Trump’s call for ‘patriotic education’ creates a dilemma for the Democrats,financialtimes,2020-09-28 09:09:06
"Tighter restrictions, the winter economic plan and Labour's new look",financialtimes,2020-09-28 09:09:06
Argentina’s newly restructured dollar bonds have slumped weeks after its restructuring,financialtimes,2020-09-28 09:09:06
FT 2020 masters in management ranking shows strong demand,financialtimes,2020-09-28 09:09:06
The management thinker Roger Martin argues that to save US democratic capitalism we must not view the economy as a machine,financialtimes,2020-09-28 09:09:06
The boss of Tristan Capital on creating a trust culture at work and funding scholarships for black students,financialtimes,2020-09-28 09:09:06
Banking stocks lead broad market advance even as Covid-19 gloom persists,financialtimes,2020-09-28 09:09:06
"Concern over greenback’s 6% fall since April is unwarranted, says Oxford Economics",financialtimes,2020-09-28 09:09:06
Market Questions is the FT’s guide to the week ahead,financialtimes,2020-09-28 09:09:06
National security concerns are not met and its arbitrary interventionism is Beijing-esque ,financialtimes,2020-09-28 09:09:06
Decision follows 3-year fight over ride-hailing company’s safety practices in the city,financialtimes,2020-09-28 09:09:06
Damage from the latest escalation of the trade war will be felt by US as well as Chinese businesses,financialtimes,2020-09-28 09:09:06
Cockamamie TikTok deal fails on every measure,financialtimes,2020-09-28 09:09:06
SMIC: wrong bargaining chip,financialtimes,2020-09-28 09:09:06
Biden presidency won’t be a quick fix for EU-US trade tensions,financialtimes,2020-09-28 09:09:06
"Cleveland-Cliffs, TikTok, Trump, Caesars - 5 Things You Must Know Monday",thestreet,2020-09-28 09:11:02
Inovio Plunges After FDA Puts Partial Hold on Coronavirus Vaccine Trial,thestreet,2020-09-28 09:11:02
Cleveland-Cliffs to Buy ArcelorMittal's U.S. Operations for $1.4 Billion,thestreet,2020-09-28 09:11:02
Devon Energy and WPX Rise Sharply on Confirmation of Merger Pact,thestreet,2020-09-28 09:11:02
"Jim Cramer: Covid Isn't About to Fade, and Neither Is Costco",thestreet,2020-09-28 09:11:02
Meisler: Is the S&P Headed ... Up?,thestreet,2020-09-28 09:11:02
"Guilfoyle: TikTok Reprieve, Muddled Market, Awaiting the Great Debate",thestreet,2020-09-28 09:11:02
Rev Shark: V-Shaped Bounce Conditions Continue to Develop as Market Ignores Politics,thestreet,2020-09-28 09:11:02
Price: Costco: Why Pay More Than the MSRP?,thestreet,2020-09-28 09:11:02
MobileIron to Be Acquired by Ivanti in $872 Million Deal,thestreet,2020-09-28 09:11:02
American Air Shares Up; CEO 'Confident' of Bailout Extension,thestreet,2020-09-28 09:11:02
Uber Shares Leap After Winning Back London License Following Years-Long Battle,thestreet,2020-09-28 09:11:02
Jim Cramer: Chinese Are Trying to Save Some Face in the TikTok Deal,thestreet,2020-09-28 09:11:02
Jim Cramer: The Only Thing I Care About With the EU Is COVID-19,thestreet,2020-09-28 09:11:02
Jim Cramer: Novovax Is a 'Robinhood Stock',thestreet,2020-09-28 09:11:02
Tesla Expands Giga Texas Site,thestreet,2020-09-28 09:11:02
Apple Stock: A Rebound at Last,thestreet,2020-09-28 09:11:02
Charting the Emerging Markets,thestreet,2020-09-28 09:11:02
Advisers Can Help With Effective Tax Planning,thestreet,2020-09-28 09:11:02
Helping Investors Understand an Adviser’s Value,thestreet,2020-09-28 09:11:02
How Advisers Can Help Investors Manage Short-Term Cash Needs,thestreet,2020-09-28 09:11:02
Lydall CEO: Countries Need Domestic Supply Chain of PPE,thestreet,2020-09-28 09:11:02
Jim Cramer Welcomes 'Moronic Selling' of Costco Stock,thestreet,2020-09-28 09:11:02
"Raymond James Analyst: 'Optimistic About Data' From Pfizer, Moderna",thestreet,2020-09-28 09:11:02
How Major Retailers Are Gearing Up For Holiday Season,thestreet,2020-09-28 09:11:02
Patience: The Most Underused Investing Skill,thestreet,2020-09-28 09:11:02
Why Investors Shouldn’t Chase Gold After Its Red-Hot Run,thestreet,2020-09-28 09:11:02
Fisher Investments Reveals the 3 Biggest Risks of Holding Cash,thestreet,2020-09-28 09:11:02
Terrible Unemployment Numbers Don’t Hold Back Stocks,thestreet,2020-09-28 09:11:02
Investors Shouldn’t Worry About Inflation Right Now,thestreet,2020-09-28 09:11:02
States With the Most and Least Improved Unemployment Rates,thestreet,2020-09-28 09:11:02
How Long Should I Keep Paper Checks and Bank Statements?,thestreet,2020-09-28 09:11:02
Advisers Can Help With Effective Tax Planning,thestreet,2020-09-28 09:11:02
The Down Payment Is Just the Beginning for Homeowners: What to Plan For,thestreet,2020-09-28 09:11:02
"Dow Futures Surge, Dollar Retreats After Solid China Data Lifts Global Stocks; Trump Tax Returns, US Politics in Focus",thestreet,2020-09-28 09:11:02
"President Trump Reportedly Avoided Taxes, Has Looming Debts",thestreet,2020-09-28 09:11:02
"Judge Barrett Could Be Confirmed Before Election, Says Senator",thestreet,2020-09-28 09:11:02
Advisers Can Help With Effective Tax Planning,thestreet,2020-09-28 09:11:02
What to Do After You've Filed an Income Tax Extension,thestreet,2020-09-28 09:11:02
Tax Relief for Hurricane Laura: Do You Qualify?,thestreet,2020-09-28 09:11:02
Ex-FDA Doc: Agency Suffering ‘Unprecedented’ Loss of Trust,thestreet,2020-09-28 09:11:02
Game Plan: Cramer's 'Mad Money' Recap (Friday 09/25/20),thestreet,2020-09-28 09:11:02
5 Best Stocks in the Dow This Past Week: Nike Rises High,thestreet,2020-09-28 09:11:02
5 Best Stocks in the S&P 500 This Past Week: Twitter Rises,thestreet,2020-09-28 09:11:02
"MobileIron, Trip.Com: 5 Top Stock Gainers for Friday",thestreet,2020-09-28 09:11:02
Stocks Fly High: What Wall Street's Saying,thestreet,2020-09-28 09:11:02
Tech Funds Saw the Largest Outflows in Over a Year This Week,thestreet,2020-09-28 09:11:02
Stocks Close Higher as Tech Rally Offsets Stimulus and Virus Worry,thestreet,2020-09-28 09:11:02
Palantir's Bankers Reportedly Expect High First-Day Multiples,thestreet,2020-09-28 09:11:02
Apple Temporarily Stops Taking 30% Cut of Facebook Paid Events,thestreet,2020-09-28 09:11:02
Coronavirus Update: Novavax Kicks Off Final Phase of COVID-19 Trial in UK,thestreet,2020-09-28 09:11:02
"The Jordan Brand Is Back Top Stories, Sports and Business News — Sept. 25",thestreet,2020-09-28 09:11:02
Lydall CEO: Countries Need Domestic Supply Chain of PPE,thestreet,2020-09-28 09:11:02
"Judge Barrett Could Be Confirmed Before Election, Says Senator",thestreet,2020-09-28 09:11:02
Uber wins appeal against London ban,googlenews,2020-09-28 09:13:11
"Got $3,000? These High-Growth ETFs Are Begging to Be Bought",googlenews,2020-09-28 09:13:11
IHOP introduces 'IHOPPY Hour' value menu with $5 meals daily from 2-10 p.m.,googlenews,2020-09-28 09:13:11
"Caesars, Apollo make takeover approaches for UK bookmaker William Hill",googlenews,2020-09-28 09:13:11
Amazon’s Prime Day mega sale event will take place October 13-14,googlenews,2020-09-28 09:13:11
Tesla Chinese Rivals Not Losing Sleep Over Planned $25K Electric Vehicle,googlenews,2020-09-28 09:13:11
"Treasury yields higher as investors monitor coronavirus, political developments",googlenews,2020-09-28 09:13:11
Claiming Social Security at 62 Makes Complete Sense If Any of These Factors Apply to You,googlenews,2020-09-28 09:13:11
"Markets Week Ahead: US Dollar, Gold , Dow Jones, Sterling, US Stimulus, NFPs",googlenews,2020-09-28 09:13:11
ArcelorMittal USA sold to Cleveland-Cliffs in end-of-an-era merger,googlenews,2020-09-28 09:13:11
Early Trial Results Show Promise For Johnson & Johnson And Beth Israel Vaccine,googlenews,2020-09-28 09:13:11
Shares in China's biggest chipmaker fall after reports that it could lose access to US technology,googlenews,2020-09-28 09:13:11
New indoor guidelines for Massachusetts restaurants go into effect,googlenews,2020-09-28 09:13:11
Health officials warn of 'alarming' COVID increase in New York City neighborhoods,googlenews,2020-09-28 09:13:11
Tips for a safe Halloween from pediatric infectious disease specialists,googlenews,2020-09-28 09:13:11
The Best Places For Solar Power If You Want To Clean The US Grid,googlenews,2020-09-28 09:13:11
Up to 500000 Sharks Could Die In the Race for a Coronavirus Vaccine,googlenews,2020-09-28 09:13:11
Oil falls as surging virus cases cloud demand outlook,googlenews,2020-09-28 09:13:11
"Health Officials Release Latest COVID-19 Infection Rates For Brooklyn, Queens Neighborhoods",googlenews,2020-09-28 09:13:11
No forgiveness: Small businesses still on hook for rescue loans,googlenews,2020-09-28 09:13:11
Inovio's shares tumble 33% as COVID-19 vaccine trial is put on hold,googlenews,2020-09-28 09:13:11
Scialo Bros. Bakery closes after 104 years in business,googlenews,2020-09-28 09:13:11
Tesla Inks 5-Year Supply Deal With Australian Miner To Satisfy Growing Hunger For Lithium,googlenews,2020-09-28 09:13:11
Qatar Airways Still Has Plenty Of Room To Grow,googlenews,2020-09-28 09:13:11
Bitcoin Balances on Exchanges at 2-Year Low and That May Be a Bullish Sign - CoinDesk,googlenews,2020-09-28 09:13:11
These 3 Renewable-Energy Stocks Are Better Than Tesla,googlenews,2020-09-28 09:13:11
Markets rally on China data and Ping An's HSBC investment,googlenews,2020-09-28 09:13:11
Hawaiian Airlines offering coronavirus testing to travelers,googlenews,2020-09-28 09:13:11
The 5 Fastest-Growing Stocks Warren Buffett Owns,googlenews,2020-09-28 09:13:11
"Asian markets mostly rise, though U.S. sanctions weigh on chip makers",googlenews,2020-09-28 09:13:11
European markets rally as banks bounce; HSBC up 8%,googlenews,2020-09-28 09:13:11
"Tesla to make two new different electric cars at Giga Berlin and Shanghai, Elon Musk confirms",googlenews,2020-09-28 09:13:11
Saudi Arabia Sends Blue Ammonia to Japan in World-First Shipment,googlenews,2020-09-28 09:13:11
Ring Mailbox Sensor: Amazon quietly introduces mail surveillance,googlenews,2020-09-28 09:13:11
The Hyundai Ioniq Cabin Is How Your Car Becomes Your Personal Butler,googlenews,2020-09-28 09:13:11
US-China tensions put Kioxia’s $3.2bn IPO on ice,googlenews,2020-09-28 09:13:11
"TikTok: After Benadryl Challenge hospitalizes teens, FDA issues an official warning",googlenews,2020-09-28 09:13:11
Dept. of Health reports 22 new Pa. deaths from Covid-19,googlenews,2020-09-28 09:13:11
No One’s Too Big to Fail in China’s Property Market,googlenews,2020-09-28 09:13:11
Polestar Announces the Stunning Precept EV Concept Is Going Into Production,googlenews,2020-09-28 09:13:11
"The Best Cities in America For Coffee Obsessives, From Seattle to Honolulu",googlenews,2020-09-28 09:13:11
Virgin Galactic +6% after BofA tips that shares could double,googlenews,2020-09-28 09:13:11
Jensen Ackles As Red Hood: 10 Best Arrowverse Actors' Halloween Costumes,googlenews,2020-09-28 09:13:11
Russia's Novak says global energy players should jointly tackle demand crisis,googlenews,2020-09-28 09:13:11
Dow Jones Futures: Stock Market Rally Shows Bullish Action; How To Game Plan For A Key Week,googlenews,2020-09-28 09:13:11
"Massachusetts real estate transactions for Hampden, Hampshire and Franklin counties, Sept. 27, 2020",googlenews,2020-09-28 09:13:11
"Harley-Davidson Continues LiveWire Offensive, Joins National Drive Electric Week",googlenews,2020-09-28 09:13:11
"AUD/USD Analysis Ahead of Presidential Debate, Supreme Court Nominee Battle",googlenews,2020-09-28 09:13:11
Agreement on $60 million payback in tax incentives expected betw,googlenews,2020-09-28 09:13:11
"Mushrooms linked to salmonella outbreaks in Arizona, 9 other states",googlenews,2020-09-28 09:13:11
A hidden ‘man cave’ was discovered in NYC’s Grand Central Terminal,googlenews,2020-09-28 09:13:11
Portland company’s innovative nuclear reactor OK’d by feds,googlenews,2020-09-28 09:13:11
Don't Claim Social Security Benefits Until You Can Answer These 3 Questions,googlenews,2020-09-28 09:13:11
Honda's electric SUV concept is a peek at a production vehicle,googlenews,2020-09-28 09:13:11
A Man Died After Eating a Bag of Black Licorice Every Day,googlenews,2020-09-28 09:13:11
Oil Falls Below $40 on Uncertain Demand With Libya Supply Rising,googlenews,2020-09-28 09:13:11
Dollar near two-month high as economic recovery risks loom,googlenews,2020-09-28 09:13:11
AOC calls out Wells Fargo CEO for ‘limited pool of Black talent’ comments,googlenews,2020-09-28 09:13:11
Another ECB member weighs in a warning about EUR - Visco worried by EUR strength - mentions intervention,googlenews,2020-09-28 09:13:11
Why traders are not worried that the KuCoin hack will drop Ethereum price,googlenews,2020-09-28 09:13:11
Woman becomes allergic to all food and has to be fed through her heart,googlenews,2020-09-28 09:13:11
OPEC in trouble as oil outlook worsens,googlenews,2020-09-28 09:13:11
Arm swimming in a sea of uncertainty that could sink its business model,googlenews,2020-09-28 09:13:11
Chinese Americans look to new platforms as WeChat's future remains uncertain,googlenews,2020-09-28 09:13:11
"Devon, WPX discussing merger to create $6 billion energy company",googlenews,2020-09-28 09:13:11
"There’s Less Than 1% Chance of Catching Covid-19 Flying, Says Airline Exec",googlenews,2020-09-28 09:13:11
A 28-Year Old Billionaire Wins the SPAC Lottery,googlenews,2020-09-28 09:13:11
Mercedes-Benz Takes the Vision AVTR on a Road Test: Welcome to the Future,googlenews,2020-09-28 09:13:11
"2020 French Open TV, live stream schedule",googlenews,2020-09-28 09:13:11
Sea changes: A preview of the new COVID-related cruise restrictions,googlenews,2020-09-28 09:13:11
Uber granted 18-month London license as judge overturns ban,googlenews,2020-09-28 09:13:11
"Uber Can Continue Operating in London, Judge Rules",googlenews,2020-09-28 09:13:11
Uber London: Why TfL wanted to revoke the taxi firm's licence in the capital,googlenews,2020-09-28 09:13:11
Uber spared from London ban despite 'historical failings',googlenews,2020-09-28 09:13:11
What are authorised participants?,googlenews,2020-09-28 09:13:11
Should You Invest in the Fidelity MSCI Energy Index ETF (FENY)?,googlenews,2020-09-28 09:13:11
3 Reasons ETFs Are Safer Than Single Stocks If the Market Keeps Falling,googlenews,2020-09-28 09:13:11
Here are the 10 most popular ETFs on the ASX,googlenews,2020-09-28 09:13:11
Caesars shoots lower than expected with $3.7 billion William Hill bid,googlenews,2020-09-28 09:13:11
William Hill: Caesars Palace-owner in 'advanced' talks over £2.9bn offer,googlenews,2020-09-28 09:13:11
Caesars bets $3.7 billion on William Hill takeover,googlenews,2020-09-28 09:13:11
Caesars Entertainment to offer 30 million shares in syndicated deal,googlenews,2020-09-28 09:13:11
Amazon Prime Day set for October 13 and 14,googlenews,2020-09-28 09:13:11
Amazon announces Prime Day 2020 dates: How to sign up for access to deals,googlenews,2020-09-28 09:13:11
Amazon Prime Day set for Oct. 13 - Oct.14,googlenews,2020-09-28 09:13:11
Amazon's Prime Day highlights the huge stakes ahead for retail,googlenews,2020-09-28 09:13:11
Flying Cars — and Face Masks — at the Only Major Auto Show of 2020,googlenews,2020-09-28 09:13:11
Crowds at the Beijing Auto Show Signal China's Spenders are Back,googlenews,2020-09-28 09:13:11
Tesla's $25000 Car Doesn't Worry Biggest Rivals in China,googlenews,2020-09-28 09:13:11
See Porsche's Booth at the 2020 Beijing Auto Show From the Comfort of Your Home,googlenews,2020-09-28 09:13:11
4 Unexpected Ways You Can Lose Your Social Security Benefits,googlenews,2020-09-28 09:13:11
Should You Retire During a Pandemic? 3 Things You Should Know,googlenews,2020-09-28 09:13:11
Dow futures surge more than 300 points following a 4-week losing streak,googlenews,2020-09-28 09:13:11
How TV networks will make election projections in 2020,googlenews,2020-09-28 09:13:11
1 Must-Have Investment If You're Worried About a Stock Market Crash,googlenews,2020-09-28 09:13:11
5 things to know before the stock market opens Monday,googlenews,2020-09-28 09:13:11
Cleveland-Cliffs to buy U.S. assets of ArcelorMittal for about $1.4 billion,googlenews,2020-09-28 09:13:11
Exclusive: ArcelorMittal in talks to merge U.S. assets with Cleveland-Cliffs,googlenews,2020-09-28 09:13:11
Cleveland-Cliffs acquires steel giant ArcelorMittal’s US business,googlenews,2020-09-28 09:13:11
Cleveland-Cliffs announces new major deal,googlenews,2020-09-28 09:13:11
Why The Covid-19 Vaccine Trials Are Taking A Long Time,googlenews,2020-09-28 09:13:11
How to feel confident that a COVID-19 vaccine is safe,googlenews,2020-09-28 09:13:11
China administering COVID-19 vaccine without final regulatory approval,googlenews,2020-09-28 09:13:11
China pushes emergency use of COVID vaccine despite concerns,googlenews,2020-09-28 09:13:11
U.S. sanctions on chipmaker SMIC hit at the very heart of China's tech ambitions,googlenews,2020-09-28 09:13:11
"U.S. restricts exports to SMIC, China's largest chipmaker",googlenews,2020-09-28 09:13:11
SMIC Joins the Big Bath of China Security Threats,googlenews,2020-09-28 09:13:11
China needs new long tech march after US attack on SMIC: Global Times editorial,googlenews,2020-09-28 09:13:11
"Massachusetts restaurants to begin seating 10 per table, using bar areas for food service",googlenews,2020-09-28 09:13:11
Massachusetts to loosen seating restrictions at restaurants starting Monday,googlenews,2020-09-28 09:13:11
Massachusetts restaurants allowed to seat 10 people per table and use bar seating starting Monday amid COVID-,googlenews,2020-09-28 09:13:11
Restaurant owners prepare to reopen bar seating Monday,googlenews,2020-09-28 09:13:11
New York Again Hits 1K Coronavirus Cases a Day,googlenews,2020-09-28 09:13:11
"CDC ranks Halloween activities by COVID-19 risk: No trick-or-treating, crowded parties or indoor haunted houses",googlenews,2020-09-28 09:13:11
Pandemic changes the way parents will celebrate Halloween,googlenews,2020-09-28 09:13:11
"CT Halloween, Trick-or-Treating: Take The CT Patch Survey",googlenews,2020-09-28 09:13:11
CDC updates guidelines to safely celebrate Halloween,googlenews,2020-09-28 09:13:11
Rooftop solar: Rate case raises stakes on what’s fair for consumers,googlenews,2020-09-28 09:13:11
New EIA reports confirm continued expansion of renewables' share of US energy and power,googlenews,2020-09-28 09:13:11
Solar auctions to spread PV over the commercial landscape,googlenews,2020-09-28 09:13:11
Utah utility Rocky Mountain Power and solar advocates aren't even close on the value of rooftop PV sent to the grid,googlenews,2020-09-28 09:13:11
Coronavirus Vaccine Could Result in Half a Million Shark Deaths,googlenews,2020-09-28 09:13:11
WHO backs China's emergency use of COVID-19 vaccines,googlenews,2020-09-28 09:13:11
"Conservationists Warn 500,000 Sharks Could Be Killed For Covid-19 Vaccine",googlenews,2020-09-28 09:13:11
How and when will we know a coronavirus vaccine is safe and effective?,googlenews,2020-09-28 09:13:11
Oil steady as surge in virus cases clouds demand recovery,googlenews,2020-09-28 09:13:11
"Oil Price Fundamental Daily Forecast – Weaker Dollar, Demand for Risk Underpinning Prices",googlenews,2020-09-28 09:13:11
Oil Heavyweights Look Ready for a Showdown,googlenews,2020-09-28 09:13:11
Oil slips as surge in virus cases cloud demand recovery,googlenews,2020-09-28 09:13:11
"Reopen New York City: Arrests made after nearly 200 found inside illegal bar in Flushing, Queens",googlenews,2020-09-28 09:13:11
Queens Nightclub Busted for Not Enforcing Distancing Rules,googlenews,2020-09-28 09:13:11
NYC sheriff shuts down karaoke bar for COVID-19 violations,googlenews,2020-09-28 09:13:11
Sheriffs raid a Queens karaoke bar with almost 200 patrons,googlenews,2020-09-28 09:13:11
SBA Administrator visits Savannah small businesses that received PPP loan,googlenews,2020-09-28 09:13:11
"New Mexico small-business loan fund: Few apply, many rejected",googlenews,2020-09-28 09:13:11
"Clearwater doctors got a PPP loan, then dissolved practice — but only on paper",googlenews,2020-09-28 09:13:11
Inovio Shares Plunge After FDA Puts Partial Hold On Coronavirus Vaccine Trial,googlenews,2020-09-28 09:13:11
"Inovio tanks 40% after pausing coronavirus vaccine trial, trading halted | Markets",googlenews,2020-09-28 09:13:11
Inovio Stock Still Has Real Promise Despite Faltering in Vaccine Race,googlenews,2020-09-28 09:13:11
"Trump paid no income taxes in 10 of last 15 years, New York Times reports",googlenews,2020-09-28 09:13:11
Federal Hill's Oldest Bakery Closing in Providence,googlenews,2020-09-28 09:13:11
"After 104 years on Federal Hill, Scialo Bros. Bakery to close",googlenews,2020-09-28 09:13:11
Legendary Scialo Bros. Bakery won't reopen - Food and Dining,googlenews,2020-09-28 09:13:11
Scialo Bros. Bakery Closes after 104 years,googlenews,2020-09-28 09:13:11
"Australia's Piedmont signs lithium ore supply deal with Tesla, shares surge",googlenews,2020-09-28 09:13:11
Tesla gets closer to volume battery cell production with 5-year lithium supply deal,googlenews,2020-09-28 09:13:11
Piedmont Lithium Signs Sales Agreement With Tesla,googlenews,2020-09-28 09:13:11
Australia's Piedmont Lithium signs ore supply agreement with Tesla,googlenews,2020-09-28 09:13:11
"Qatar Airways says losses reach $1.9B amid pandemic, boycott",googlenews,2020-09-28 09:13:11
Qatar Airways Reports Record $1.9+ Billion Loss,googlenews,2020-09-28 09:13:11
Qatar Airways Records Nearly $2bn Annual Loss,googlenews,2020-09-28 09:13:11
Qatar Airways gets $2bn state aid as losses grow amid COVID-19,googlenews,2020-09-28 09:13:11
Grayscale Investments Scooped Up Over 17000 BTC in the Last Seven Days,googlenews,2020-09-28 09:13:11
Ultimate Bitcoin bull case: trader says 23 factors show a rally is due,googlenews,2020-09-28 09:13:11
"Bitcoin Sets Record 63 Straight Days Closing Above $10,000 - CoinDesk",googlenews,2020-09-28 09:13:11
Bitcoin Weekly Outlook: Is BTC/USD About To Surge Higher?,googlenews,2020-09-28 09:13:11
HSBC shares jump after Ping An raises stake,googlenews,2020-09-28 09:13:11
Ping An Seeks to Manage $100 Billion Offshore as Demand Rises,googlenews,2020-09-28 09:13:11
China's Ping An Insurance cements its place as HSBC's biggest shareholder,googlenews,2020-09-28 09:13:11
HSBC records biggest intraday rise from 25-year low after last week's selloff,googlenews,2020-09-28 09:13:11
What We're Reading: Midwest COVID-19 Outbreak; Vaccine Trial Mistrust; Airline to Offer Testing,googlenews,2020-09-28 09:13:11
United to offer coronavirus tests to some passengers,googlenews,2020-09-28 09:13:11
Hawaiian Airlines will offer COVID tests to passengers from L.A.,googlenews,2020-09-28 09:13:11
United Airlines pre-flight COVID-19 tests,googlenews,2020-09-28 09:13:11
Warren Buffett's Berkshire Hathaway gets back to basics with $600 million Scripps deal after shock bets on Snowflake and Barrick Gold | Markets,googlenews,2020-09-28 09:13:11
3 Stocks Warren Buffett Would Love,googlenews,2020-09-28 09:13:11
Commerzbank Names Knof New CEO,googlenews,2020-09-28 09:13:11
Commerzbank’s New CEO Handed Chance to Apply Cost-Cutting Skills,googlenews,2020-09-28 09:13:11
Focus shifts to Commerzbank's strategy after CEO named,googlenews,2020-09-28 09:13:11
European stocks rebound after worst week in three months,googlenews,2020-09-28 09:13:11
Ring’s New “Car Cam” Can Record Police-Driver Interactions using Alexa,googlenews,2020-09-28 09:13:11
Ring Will Launch a Drone as Security Camera for Your Home Next Year,googlenews,2020-09-28 09:13:11
Amazon Ring car cam records when police pull you over with voice activation,googlenews,2020-09-28 09:13:11
Ring introduces an indoor flying drone for home security,googlenews,2020-09-28 09:13:11
Hyundai RM20e: Electric sports car prototype debuts with 810 horsepower,googlenews,2020-09-28 09:13:11
Hyundai N | RM20e – N brand's fun-to-drive philosophy will not be compromised even in EV era,googlenews,2020-09-28 09:13:11
Hyundai's New Electric Hot Hatch Has 810 Blistering Horsepower,googlenews,2020-09-28 09:13:11
The RM20e Is A RWD Hyundai With 800bhp,googlenews,2020-09-28 09:13:11
Chip Maker Kioxia Calls Off $16 Billion IPO After Huawei Fallout,googlenews,2020-09-28 09:13:11
Japanese chipmaker Kioxia delays IPO amid US-China tensions,googlenews,2020-09-28 09:13:11
"Kioxia Delays Plan for IPO, Sending Toshiba Shares Lower",googlenews,2020-09-28 09:13:11
Kioxia’s Ambitious IPO Runs Up Against Reality,googlenews,2020-09-28 09:13:11
FDA Looking Into TikTok 'Benadryl Challenge',googlenews,2020-09-28 09:13:11
FDA issues warning over TikTok 'Benadryl challenge',googlenews,2020-09-28 09:13:11
FDA Warns Of Danger Associated With TikTok ‘Benadryl Challenge’,googlenews,2020-09-28 09:13:11
FDA issues Benadryl warning as it investigates reports of teen injuries and deaths linked to TikTok challenge,googlenews,2020-09-28 09:13:11
"COVID-19 update for Saturday, September 26",googlenews,2020-09-28 09:13:11
"Pa. Health Dept. Reports 1,029 New Coronavirus Cases, Bringing Statewide Total To 155,232",googlenews,2020-09-28 09:13:11
"Coronavirus in Pennsylvania: 1,029 new cases, 155,232 total",googlenews,2020-09-28 09:13:11
"Coronavirus in Pa.: 1,029 new cases reported, more than 155,000 overall",googlenews,2020-09-28 09:13:11
Property Developer China Evergrande Erases Market Losses,googlenews,2020-09-28 09:13:11
"Evergrande Shares Rebound, Bonds Swing in Volatile Trading",googlenews,2020-09-28 09:13:11
SMIC shares in Hong Kong fall following reports of U.S. sanctions; Asia-Pacific markets mixed,googlenews,2020-09-28 09:13:11
"Evergrande tries to stop bond, stock rout from spiraling",googlenews,2020-09-28 09:13:11
"Polestar is actually going to make the Precept, its eco-conscious concept car",googlenews,2020-09-28 09:13:11
