headline,org,date
Mandate for Applied Science will help championship leader comply with new spending cap,financialtimes,2020-09-14 08:35:51
Big Tech groups respond to pressure from employees concerned about climate change,financialtimes,2020-09-14 08:35:51
Fresh recruitment spree will push employee numbers at online retailer close to 1m ,financialtimes,2020-09-14 08:35:51
US streaming service outspends rivals on content as pandemic dents ad-funded broadcasters,financialtimes,2020-09-14 08:35:51
US billionaire looks to downsize portfolio as coronavirus pandemic bites,financialtimes,2020-09-14 08:35:51
Repurposing heritage treasures can do wonders for their value but only if done properly,financialtimes,2020-09-14 08:35:51
Serum Institute warns that companies are not increasing production capacity quickly enough,financialtimes,2020-09-14 08:35:51
The FT analyses the scale of outbreaks and the number of deaths around the world,financialtimes,2020-09-14 08:35:51
Minister resigns after Netanyahu announces 3-week shutdown over Jewish holy period,financialtimes,2020-09-14 08:35:51
Clean energy policies in California drive conversion of waste into ‘renewable diesel’,financialtimes,2020-09-14 08:35:51
Donation from media executive and former Democratic rival comes as polls tighten in critical state,financialtimes,2020-09-14 08:35:51
Influx of donations comes as president’s re-election bid struggles to match Joe Biden’s fundraising,financialtimes,2020-09-14 08:35:51
"Two months after ECJ struck down Privacy Shield, activists are targeting companies for not protecting data",financialtimes,2020-09-14 08:35:51
"If trade financing is out of reach for small and midsized farmers, everyone may suffer",financialtimes,2020-09-14 08:35:51
Have British moves threatened Brexit trade talks? And new rules to limit the spread of coronavirus,financialtimes,2020-09-14 08:35:51
Israel takes a step towards conciliation with the Arab world without solving the Palestine question,financialtimes,2020-09-14 08:35:51
"Rather than kicking their heels while mass gatherings are on hold, runners are increasingly competing in virtual challenges. But can these match the rush of reaching a finishing line?",financialtimes,2020-09-14 08:35:51
Finance experts look at the options as the risk of a no-deal remains high,financialtimes,2020-09-14 08:35:51
Company declarations keep thriving to little obvious effect ,financialtimes,2020-09-14 08:35:51
"Interventions made fixed income less attractive for short-term bets, analysts say",financialtimes,2020-09-14 08:35:51
"Cheap borrowing helped companies through Covid-19 crisis, but repayments are set to be a burden",financialtimes,2020-09-14 08:35:51
Oracle-TikTok deal raises hopes for US-China relations but optimism ebbs over rising Covid-19 cases,financialtimes,2020-09-14 08:35:51
Oracle-TikTok deal raises hopes for US-China relations but optimism ebbs over rising Covid-19 cases,financialtimes,2020-09-14 08:35:51
Big Tech groups respond to pressure from employees concerned about climate change,financialtimes,2020-09-14 08:35:51
Fresh recruitment spree will push employee numbers at online retailer close to 1m ,financialtimes,2020-09-14 08:35:51
Why there is no white knight on the horizon for TikTok in India ,financialtimes,2020-09-14 08:35:51
ByteDance gives bonuses to staff after TikTok turbulence,financialtimes,2020-09-14 08:35:51
"TikTok buyer will face huge challenge, Snap’s Evan Spiegel says",financialtimes,2020-09-14 08:35:51
"TikTok Picks Oracle, Nvidia Buys Arm, Gilead Buys Immunomedics - 5 Things You Must Know Monday",thestreet,2020-09-14 08:37:38
Oracle Surges as TikTok Rejects Microsoft Ahead of U.S. Sale Deadline,thestreet,2020-09-14 08:37:38
Nvidia Buys British Chip Designer Arm for $40 Billion,thestreet,2020-09-14 08:37:38
"Dow Futures Gain as AstraZeneca Resumes Vaccine Trials, Tech and Pharma Deals Boost Sentiment",thestreet,2020-09-14 08:37:38
Jim Cramer: Stock Splits Make Stocks More Attractive,thestreet,2020-09-14 08:37:38
Meisler: Do You Feel a Change in the Air (of the Market)?,thestreet,2020-09-14 08:37:38
Kass: My Tactical Approach to the Market,thestreet,2020-09-14 08:37:38
"Guilfoyle: Challenging Markets, Nvidia Acquires Arm, Oracle Wins TikTok, Vaccine Update",thestreet,2020-09-14 08:37:38
Price: Refuse to Be Gaslighted by Market Pundits,thestreet,2020-09-14 08:37:38
Gilead Sciences Buys Cancer Drug Specialist Immunomedics for $21 Billion,thestreet,2020-09-14 08:37:38
"Nikola Attacks 'Opportunistic' Hindenburg Research Note, Contacts SEC",thestreet,2020-09-14 08:37:38
"Amazon to Hire Another 100,000 Workers Ahead of Holiday Season",thestreet,2020-09-14 08:37:38
"Jim Cramer: It's Going to Be a Luxury That There Used to Be So Many Restaurants, Bars",thestreet,2020-09-14 08:37:38
"Devastating Wildfires Send Consumers Flocking to Home Depot, Says Jim Cramer",thestreet,2020-09-14 08:37:38
Peloton Shares Pop Then Drop Following Strong Earnings Release,thestreet,2020-09-14 08:37:38
Previewing Apple’s Week: Will There Be an iPhone 12?,thestreet,2020-09-14 08:37:38
Is Tesla Planning to Export from Giga Shanghai?,thestreet,2020-09-14 08:37:38
Three Different Ways to Invest in the S&P 500,thestreet,2020-09-14 08:37:38
Financial Advisers Also Are Client Behavior Coaches,thestreet,2020-09-14 08:37:38
How Financial Advisers Can Be Ready for the Next Generation,thestreet,2020-09-14 08:37:38
Small Business Retirement Plans and the SECURE Act,thestreet,2020-09-14 08:37:38
Jim Cramer Remembers 9/11,thestreet,2020-09-14 08:37:38
Jim Cramer Says Sell Nikola,thestreet,2020-09-14 08:37:38
Jim Cramer's Advice for When to Put Money to Work,thestreet,2020-09-14 08:37:38
Tesla Gets the Checkered Flag From UBS With Price-Target Boost,thestreet,2020-09-14 08:37:38
Fisher Investments Reveals the 3 Biggest Risks of Holding Cash,thestreet,2020-09-14 08:37:38
Terrible Unemployment Numbers Don’t Hold Back Stocks,thestreet,2020-09-14 08:37:38
Investors Shouldn’t Worry About Inflation Right Now,thestreet,2020-09-14 08:37:38
Will Bitcoin Ruin Your Tax Return?,thestreet,2020-09-14 08:37:38
Coronavirus Update: Pfizer CEO Says Vaccine Could Be Distributed By Year-End,thestreet,2020-09-14 08:37:38
Alibaba in Talks to Invest $3 Billion in Ride-Hailing Giant Grab,thestreet,2020-09-14 08:37:38
Financial Advisers Also Are Client Behavior Coaches,thestreet,2020-09-14 08:37:38
Is Now a Good Time to Start Investing? Why Waiting Won’t Help,thestreet,2020-09-14 08:37:38
Trim These Two Expenses if You Want to Fatten Your 401(k),thestreet,2020-09-14 08:37:38
Oracle Edges Out Microsoft As Preferred TikTok Buyer - Reports,thestreet,2020-09-14 08:37:38
"Snowflake, Unity Lead Off Busy Tech IPO Season",thestreet,2020-09-14 08:37:38
Watch Out for This Potential Tax Bomb if You Relocated in the Pandemic,thestreet,2020-09-14 08:37:38
Tax-Loss Harvesting Is a Tool for all Seasons,thestreet,2020-09-14 08:37:38
5 Things You Need to Know About a Payroll Tax Deferral,thestreet,2020-09-14 08:37:38
Fast-Tracking Covid Vaccine 'Is Not That Straightforward',thestreet,2020-09-14 08:37:38
Game Plan: Cramer's 'Mad Money' Recap (Friday 9/11/20),thestreet,2020-09-14 08:37:38
"Crocs, Laureate Education, Zumiez: 5 Top Stock Gainers Friday",thestreet,2020-09-14 08:37:38
"Tech Stocks Kept Falling, Others Rose: What Wall Street’s Saying",thestreet,2020-09-14 08:37:38
Stocks Finish Mixed as Tech Extends Loss - Apple Falls 1.3%,thestreet,2020-09-14 08:37:38
Investors Were Interested in Stocks This Week -- Even as S&P 500 Was Pressured,thestreet,2020-09-14 08:37:38
"Top Stories, Sports and Business News — Sept. 11",thestreet,2020-09-14 08:37:38
Report: Apple COO Williams Seen as Tim Cook's 'Heir Apparent',thestreet,2020-09-14 08:37:38
"Louis Vuitton to Sell $1,000 Face Shield",thestreet,2020-09-14 08:37:38
Stock Market Today With Jim Cramer: Wait to Buy Peloton,thestreet,2020-09-14 08:37:38
"Domino's Pizza, Expedia: Latest Upgrades and Downgrades",thestreet,2020-09-14 08:37:38
"Apple to Allow Game Streaming Services on App Store, With Conditions",thestreet,2020-09-14 08:37:38
Jim Cramer Remembers 9/11,thestreet,2020-09-14 08:37:38
"Snowflake, Unity Lead Off Busy Tech IPO Season",thestreet,2020-09-14 08:37:38
"Microsoft, Oracle Lose Bids For TikTok, According To China State TV",googlenews,2020-09-14 08:39:40
Stocks rise as AstraZeneca resumes vaccine trial,googlenews,2020-09-14 08:39:40
Nvidia reaches $40B deal to buy SoftBank's Arm Holdings,googlenews,2020-09-14 08:39:40
"Amazon to hire 100,000 more workers in its latest job spree this year",googlenews,2020-09-14 08:39:40
Delta will use frequent-flyer program to back $6.5 billion in debt,googlenews,2020-09-14 08:39:40
Nikola Sets the Record Straight on False and Misleading Short Seller Report,googlenews,2020-09-14 08:39:40
Gilead Sciences to Acquire Immunomedics for $21 Billion in Cash,googlenews,2020-09-14 08:39:40
AstraZeneca resumes Covid vaccine trials in UK..,googlenews,2020-09-14 08:39:40
2 Sizzling Hot IPOs: Don't Get Burned,googlenews,2020-09-14 08:39:40
"4 Unstoppable Stocks to Buy With $2,500",googlenews,2020-09-14 08:39:40
Pfizer CEO says company will know if vaccine works by end of October,googlenews,2020-09-14 08:39:40
European stocks and U.S. equity futures climb on vaccine hopes and M&A action,googlenews,2020-09-14 08:39:40
5 things to know before the stock market opens Monday,googlenews,2020-09-14 08:39:40
"Despite High Unemployment, Automakers Face A Problem: Not Enough Workers",googlenews,2020-09-14 08:39:40
"Pfizer, BioNTech seek expansion of late-stage Covid vaccine trial",googlenews,2020-09-14 08:39:40
Uniswap Takes Lead Over SushiSwap Less Than 24 Hours After SUSHI Rewards Drop - CoinDesk,googlenews,2020-09-14 08:39:40
New York Sports Club owner files for bankruptcy,googlenews,2020-09-14 08:39:40
Investors Should Avoid Getting Burned by Complex ETFs,googlenews,2020-09-14 08:39:40
"OPEC cuts 2020 oil demand forecast, trims 2021 outlook on pandemic fallout",googlenews,2020-09-14 08:39:40
The Ford Ranger Tremor pickup is a little rumbler,googlenews,2020-09-14 08:39:40
"ECB Vice-President de Guindos says the Bank does not target the EUR exchange rate, but ...",googlenews,2020-09-14 08:39:40
What Elon Musk Thinks Of Bill Gates' Knowledge About Electric Vehicles,googlenews,2020-09-14 08:39:40
BP Says the Era of Oil-Demand Growth Is Over,googlenews,2020-09-14 08:39:40
BART restores full service after shutdown from ‘systemwide computer problem’,googlenews,2020-09-14 08:39:40
Price of Gold Fundamental Weekly Forecast - Fed May Not Deliver What Gold Bulls Want to Hear,googlenews,2020-09-14 08:39:40
"Mortgage rates drop to record low, offering bargains ahead of new fee",googlenews,2020-09-14 08:39:40
Trump doesn't seem to remember what his TikTok deadline actually is,googlenews,2020-09-14 08:39:40
"With 200 Meat Plant Workers Dead, the Feds Issue 2 Fines",googlenews,2020-09-14 08:39:40
Could Social Security Be Out of Money to Pay Benefits in 2023?,googlenews,2020-09-14 08:39:40
This Is How Long You Need To Take CBD To Tell If It's Actually Working,googlenews,2020-09-14 08:39:40
Zipline and Walmart to launch drone deliveries of health and wellness products,googlenews,2020-09-14 08:39:40
Buffett's Japan Bet Is Green Light for Investors: Ed Rogers,googlenews,2020-09-14 08:39:40
"Peeps won't come in Halloween, Christmas shapes this year due to COVID-related production shutdown",googlenews,2020-09-14 08:39:40
Why Fed Officials Are Pushing for More Stimulus From Lawmakers,googlenews,2020-09-14 08:39:40
It's hard to grow vegetables in this mountain town. Then this farmer had an idea,googlenews,2020-09-14 08:39:40
Asian markets gain as investors look ahead to Fed meeting,googlenews,2020-09-14 08:39:40
MTA imposes $50 fine for NYC transit riders with no mask,googlenews,2020-09-14 08:39:40
"Rapper TI Cryptocurrency Fraud: Charged and Fined $75,000 by SEC | Regulation",googlenews,2020-09-14 08:39:40
State reports over 500 new COVID-19 cases for the third day in a row,googlenews,2020-09-14 08:39:40
"Tesla to update Model 3 center console, steering wheel, add heat pump and more, rumor says",googlenews,2020-09-14 08:39:40
No one is coming to save the global economy this time - Business Insider,googlenews,2020-09-14 08:39:40
Big Tech’s India Plans Can’t Seem to Bypass Asia’s Richest Man,googlenews,2020-09-14 08:39:40
Texas AG Says Controversial Chick-fil-A Decision Reversed,googlenews,2020-09-14 08:39:40
Eastern Shore’s positivity rate climbs as Maryland reports 577 newly confirmed coronavirus cases,googlenews,2020-09-14 08:39:40
"Gottlieb says health officials ""failed"" White House during early coronavirus response",googlenews,2020-09-14 08:39:40
"Milton Friedman’s Influential Essay on Business, 50 Years Later",googlenews,2020-09-14 08:39:40
Louis Vuitton Will Sell Luxury Face Shields,googlenews,2020-09-14 08:39:40
Tesla Model Y Quality Update September 2020: Is It Finally Improving?,googlenews,2020-09-14 08:39:40
"Hyundai, Kia expand recalls, tell owners to park vehicles outdoors",googlenews,2020-09-14 08:39:40
Fan Steals Travis Scott Meal Poster From a McDonald's Window: Watch,googlenews,2020-09-14 08:39:40
Singapore Airlines Could Launch Flights To Nowhere Next Month,googlenews,2020-09-14 08:39:40
Las Cruces home could be 1st listed under historic ordinance,googlenews,2020-09-14 08:39:40
These Mistakes Will Take a Huge Bite Out of Your Social Security Income,googlenews,2020-09-14 08:39:40
Carlos Ghosn’s deputy goes on trial in Japan,googlenews,2020-09-14 08:39:40
China’s New Financial Rules to Cover Jack Ma’s Ant Group,googlenews,2020-09-14 08:39:40
United CEO says travel demand unlikely to recover until vaccine is widely distributed,googlenews,2020-09-14 08:39:40
Perelman to sell stake in Scientific Games to Caledonia,googlenews,2020-09-14 08:39:40
Why it's hard to find paper towels again,googlenews,2020-09-14 08:39:40
Bitcoin price abruptly drops 3% after miner outflows hit 5-month high,googlenews,2020-09-14 08:39:40
"U.S. Stock Futures Rise on Reports Related to Vaccines, Deals",googlenews,2020-09-14 08:39:40
"United blocks older crews from sports teams' charter flights, lawsuit claims | TheHill",googlenews,2020-09-14 08:39:40
"The Lucid Air Is A True Engineer's Car, According to Ben Sullins",googlenews,2020-09-14 08:39:40
A Porsche Panamera With Swangas Exists for the Sole Reason of Infuriating You,googlenews,2020-09-14 08:39:40
"Multiple Portland Whole Foods employees test positive for COVID-19, spokesperson says",googlenews,2020-09-14 08:39:40
Tech's Bubble of Calm Is Likely to Prove Brief,googlenews,2020-09-14 08:39:40
"$50,000 reward offered after USPS employee is critically injured in shooting",googlenews,2020-09-14 08:39:40
How much stimulus check money could you get? Calculate it using this tool,googlenews,2020-09-14 08:39:40
"Work from home: Amazon’s 33,000 openings averaging $150,000 in pay to begin as remote jobs",googlenews,2020-09-14 08:39:40
Christmas is coming and it's time to think about it: Dave Ramsey,googlenews,2020-09-14 08:39:40
Hear The Maserati MC20's Engine Sound For The First Time,googlenews,2020-09-14 08:39:40
TikTok will partner with Oracle in the United States after Microsoft loses bid,googlenews,2020-09-14 08:39:40
Oracle wins TikTok bid prior to impending U.S ban,googlenews,2020-09-14 08:39:40
"In TikTok Sale, Microsoft Is No Loser and Oracle No Winner",googlenews,2020-09-14 08:39:40
"TikTok sale: Microsoft out, Oracle to be ‘trusted US partner’",googlenews,2020-09-14 08:39:40
"Vaccine Makers Keep Safety Details Quiet, Alarming Scientists",googlenews,2020-09-14 08:39:40
The Surefire Vaccine Winner Following AstraZeneca's COVID-19 Trial Pause,googlenews,2020-09-14 08:39:40
UK's MHRA allows restart of Oxford/AstraZeneca Covid-19 vaccine trials,googlenews,2020-09-14 08:39:40
AstraZeneca shares gain as coronavirus vaccine trials resume,googlenews,2020-09-14 08:39:40
Nvidia to buy Arm Holdings from SoftBank for $40 billion,googlenews,2020-09-14 08:39:40
"Nvidia, SoftBank Strike a $40 Billion Deal for Arm",googlenews,2020-09-14 08:39:40
SoftBank Doesn't Have an Identity Crisis. Much,googlenews,2020-09-14 08:39:40
Nvidia is acquiring Arm for $40 billion,googlenews,2020-09-14 08:39:40
"Amazon to Hire 100,000 in U.S. and Canada",googlenews,2020-09-14 08:39:40
"Amazon to hire another 100,000 to keep up with online shopping surge",googlenews,2020-09-14 08:39:40
"Amazon to hire further 100,000 workers in US and Canada",googlenews,2020-09-14 08:39:40
"Amazon Hiring 100,000 New Employees in U.S. and Canada",googlenews,2020-09-14 08:39:40
Delta leverages frequent flyer program to borrow $6.5 billion,googlenews,2020-09-14 08:39:40
Delta to Use Frequent-Flier Program to Raise $6.5 Billion,googlenews,2020-09-14 08:39:40
Delta Air Lines and SkyMiles IP to issue bonds and enter term loan for aggregate $6.5 billion,googlenews,2020-09-14 08:39:40
Coronavirus live updates: WHO reports record one-day spike in cases; Delta to raise $6.5 billion,googlenews,2020-09-14 08:39:40
Nikola Is Collapsing Under The Pressure,googlenews,2020-09-14 08:39:40
Nikola Issues Fuller Denial of Short Seller Hindenburg’s Claims,googlenews,2020-09-14 08:39:40
"Nikola ""Is an Intricate Fraud Built on Dozens of Lies"" According To Hindenburg Research Report",googlenews,2020-09-14 08:39:40
Nikola: Assessing Defense Strategy And Potential Fallout From Shortseller Accusations,googlenews,2020-09-14 08:39:40
Gilead CEO Daniel O'Day on acquisition of cancer drugmaker Immunomedics,googlenews,2020-09-14 08:39:40
Immunomedics shares double after Gilead agrees to buy the cancer drugmaker in $21 billion deal,googlenews,2020-09-14 08:39:40
Gilead's $21 Billion Deal Splurge May End in Regret,googlenews,2020-09-14 08:39:40
"Gilead to buy Immunomedics, expanding cancer drug portfolio",googlenews,2020-09-14 08:39:40
Oxford University resumes Covid-19 vaccine trials,googlenews,2020-09-14 08:39:40
Oxford and AstraZeneca resume coronavirus vaccine trial,googlenews,2020-09-14 08:39:40
AstraZeneca resumes COVID-19 vaccine trial after UK green light,googlenews,2020-09-14 08:39:40
"I Never Buy a Stock at IPO, But Snowflake Might Be an Exception",googlenews,2020-09-14 08:39:40
Cloud company Snowflake raises IPO price range to $100 to $110 vs. prior $75 to $85,googlenews,2020-09-14 08:39:40
Software listings head biggest week for IPOs since Uber,googlenews,2020-09-14 08:39:40
Blank-Check IPOs in Europe Show Signs of Life,googlenews,2020-09-14 08:39:40
Virus Update: Pfizer Sees Covid-19 Shot Before Year End,googlenews,2020-09-14 08:39:40
"Pfizer coronavirus vaccine could be given to Americans before end of the year, CEO says",googlenews,2020-09-14 08:39:40
Pfizer CEO says coronavirus vaccine could be distributed to Americans before year's end,googlenews,2020-09-14 08:39:40
Pfizer CEO: Company refused taxpayer money for COVID-19 vaccine development to 'liberate our scientists',googlenews,2020-09-14 08:39:40
European markets give up gains; G4S surges 24% after takeover offer,googlenews,2020-09-14 08:39:40
European Stocks Seen Higher Amid Fresh Vaccine Hopes,googlenews,2020-09-14 08:39:40
European stocks shrug off boost from tech and vaccine progress,googlenews,2020-09-14 08:39:40
European stocks take lead from Asian markets,googlenews,2020-09-14 08:39:40
"Global Cues: Nifty set for +ve open, Dow Fut up 200 pts, S&P Futures up 0.6%, Nasdaq Futures up 1%",googlenews,2020-09-14 08:39:40
Weekly S&P 500 ChartStorm - The Correction Continues,googlenews,2020-09-14 08:39:40
Dow futures jump more than 300 points as Wall Street tries to recover after tech struggles,googlenews,2020-09-14 08:39:40
Dow futures jump 300 points as tech stocks look to recover,googlenews,2020-09-14 08:39:40
"DeFi Investor Turns $200 Into $250,000; SushiSwap Crash Sinks Ether",googlenews,2020-09-14 08:39:40
"Investing in DeFi? Bet on diversification, not short-term gains",googlenews,2020-09-14 08:39:40
Sushiswap's 2 Million Token Airdrop: Founders Face Accusations of 'Making Defi a Joke Again' | Altcoins,googlenews,2020-09-14 08:39:40
The Man Who Saved SushiSwap,googlenews,2020-09-14 08:39:40
Owner of Boston Sports Clubs files for bankruptcy protection,googlenews,2020-09-14 08:39:40
Boston Sports Clubs owner goes bankrupt after gym shutdown,googlenews,2020-09-14 08:39:40
New York Sports Clubs Owner Goes Bankrupt After Gym Shutdown,googlenews,2020-09-14 08:39:40
Owner of Boston Sports Club files for bankruptcy protection,googlenews,2020-09-14 08:39:40
ESG surges as investors search for better corporate citizens,googlenews,2020-09-14 08:39:40
VanEck: There's More Than Gold In Them Thar ETFs,googlenews,2020-09-14 08:39:40
These Funds Let Investors Profit from Companies Hurt by the Pandemic,googlenews,2020-09-14 08:39:40
Subscale markets 'coming of age' push growth in Asia,googlenews,2020-09-14 08:39:40
"Once an American foe, now a friend: OPEC turns 60",googlenews,2020-09-14 08:39:40
OPEC Extends Forecast for Decline in Global Oil Demand,googlenews,2020-09-14 08:39:40
There's No Easy Fix to OPEC's Whack-A-Mole Problem,googlenews,2020-09-14 08:39:40
Faltering oil demand puts new pressure on OPEC+ production agreements,googlenews,2020-09-14 08:39:40
"Toyota Tacoma, Chevy ZR2, and Jeep Rubicon Beware! 2021 Ford Ranger TREMOR Is Here!",googlenews,2020-09-14 08:39:40
Ford Ranger Tremor hopes to dominate midsize truck market,googlenews,2020-09-14 08:39:40
2021 Ford Ranger Tremor Revealed With Serious Off-Road Upgrades,googlenews,2020-09-14 08:39:40
"2021 Ford Ranger Tremor Package Is a Go, Has Nothing But Off-Roading in Mind",googlenews,2020-09-14 08:39:40
ECB's Lagarde shifts burden to governments to aid recovery,googlenews,2020-09-14 08:39:40
ECB President Lagarde spoke over the weekend - the Bank still has an eye on euro strength,googlenews,2020-09-14 08:39:40
Christine Lagarde Has Bigger Problems Than the Euro,googlenews,2020-09-14 08:39:40
The politics of currencies,googlenews,2020-09-14 08:39:40
Elon Musk shares his thoughts on Bill Gates. They're not pleasant,googlenews,2020-09-14 08:39:40
"Elon Musk Says On Twitter Bill Gates ""Has No Clue"" On Electric Trucks",googlenews,2020-09-14 08:39:40
Elon Musk Teases Tesla Battery Day While Saying Bill Gates Has 'No Clue' About Electric Cars,googlenews,2020-09-14 08:39:40
Tesla’s Model 3 electric sedan is getting some serious feature updates,googlenews,2020-09-14 08:39:40
Where Is Future Oil Demand Going To Come From,googlenews,2020-09-14 08:39:40
"Global oil demand may have passed peak, says BP energy report",googlenews,2020-09-14 08:39:40
Fossil fuel demand to take historic knock amid COVID-19 scars: BP,googlenews,2020-09-14 08:39:40
BP projects peak oil demand is very close or already happened,googlenews,2020-09-14 08:39:40
BART Service Restored After Hours of Systemwide Computer Issue Left Thousands Stranded,googlenews,2020-09-14 08:39:40
All BART stations back online after computer issue canceled Sunday morning service,googlenews,2020-09-14 08:39:40
All BART stations 'closed until further notice' due to systemwide computer problem,googlenews,2020-09-14 08:39:40
Update: Bart Restores Service To All Stations,googlenews,2020-09-14 08:39:40
"Gold edges up on weaker dollar, dovish U.S. Fed policy bets",googlenews,2020-09-14 08:39:40
"Gold gains on weaker dollar, all eyes on Fed meeting",googlenews,2020-09-14 08:39:40
"Gold's Low Volatility, Markets Waiting for Wednesday's Fed Talk",googlenews,2020-09-14 08:39:40
"Gold forms daily symmetrical triangle, eyes Fed meeting",googlenews,2020-09-14 08:39:40
"30-Year Mortgage and Refinance Rates for September 14, 2020 | Key rate moves lower",googlenews,2020-09-14 08:39:40
U.S Mortgage Rates Slide to Another Record Low Ahead of This Week’s FOMC,googlenews,2020-09-14 08:39:40
AIB offers range of new fixed rate mortgages,googlenews,2020-09-14 08:39:40
Steepest rise in fixed rates for a decade: Moneyfacts,googlenews,2020-09-14 08:39:40
China would rather see TikTok banned than sold to US company,googlenews,2020-09-14 08:39:40
"China Reportedly Against TikTok’s Forced Sale Over Trump Threat, Would Rather See it Shut Down in US",googlenews,2020-09-14 08:39:40
China willing to let TikTok die over Trump forcing a U.S. acquisition,googlenews,2020-09-14 08:39:40
Jim Cramer: Listen to Oracle for News on TikTok Interest,googlenews,2020-09-14 08:39:40
More than 200 meat plant workers in the U.S. have died of covid-19. Federal regulators just issued two modest fines.,googlenews,2020-09-14 08:39:40
"Billion-dollar meatpacking companies fined total of $30,000 after 10 worker COVID deaths, 1,600 infections",googlenews,2020-09-14 08:39:40
"Editorial: OSHA embarrasses itself, re-lights bitter fires with late, low fine of JBS",googlenews,2020-09-14 08:39:40
'It's A Joke': Family Reacts To $15000 Fine Against Greeley's JBS Plant,googlenews,2020-09-14 08:39:40
Will Your Social Security Benefits Be Taxed? Here's How to Know,googlenews,2020-09-14 08:39:40
New Guidelines Issued on Medical Cannabis for Chronic Pain,googlenews,2020-09-14 08:39:40
Hemp's stumbles reveal hurdles in Wyoming's race to diversify,googlenews,2020-09-14 08:39:40
Hemp-derived CBD: Could it be the solution to the veteran suicide epidemic?,googlenews,2020-09-14 08:39:40
Walmart teams up with Zipline to test limited on-demand drone deliveries,googlenews,2020-09-14 08:39:40
Walmart to start using autonomous drones for 1-hour delivery,googlenews,2020-09-14 08:39:40
Walmart expands drone delivery tests to Arkansas with new Zipline partnership,googlenews,2020-09-14 08:39:40
Amazon and Walmart's emerging delivery drone battle escalates with Zipline deal,googlenews,2020-09-14 08:39:40
Warren Buffett In September: 44 Equities Yield 7 Buy-And-Hold Dividend Picks,googlenews,2020-09-14 08:39:40
Why It's Unlikely Warren Buffett Is Actually Investing In Snowflake,googlenews,2020-09-14 08:39:40
Could Following Warren Buffett's Advice Leave You With the Wrong Investment Mix?,googlenews,2020-09-14 08:39:40
