headline,org,date
'They pick and choose when it's time for us to just be athletes',yahoofinance,2020-08-30 08:39:12
Education job openings spike amid the pandemic: Monster,yahoofinance,2020-08-30 08:39:12
Students question 'full tuition for a diet college experience',yahoofinance,2020-08-30 08:39:12
'You can't hurry love' and a coronavirus vaccine: expert,yahoofinance,2020-08-30 08:39:12
What you should know about Joe Biden’s tax plan,yahoofinance,2020-08-30 08:39:12
Apple outlook as stock split takes effect on Monday,yahoofinance,2020-08-30 08:39:12
Facebook’s Joel Kaplan: The man in the crosshairs,yahoofinance,2020-08-30 08:39:12
Businesses must address income gap: Edward Jones,yahoofinance,2020-08-30 08:39:12
How He Made $2.8M Trading Stocks Part-Time At Home,yahoofinance,2020-08-30 08:39:12
"Stock Splits From Apple, Tesla: Reminders Of Qualcomm Warning",yahoofinance,2020-08-30 08:39:12
Biden retirement proposal would overhaul traditional 401(k) tax benefits,yahoofinance,2020-08-30 08:39:12
5 Cheap Stocks to Buy With High Yield and Good Earnings Power,yahoofinance,2020-08-30 08:39:12
"Dow Jones Futures: Will The Stock Market Rally Strike Out With Apple, Tesla Stock Splits On Tap, TikTok Deal Buzz?",yahoofinance,2020-08-30 08:39:12
What Happens to the Stock Market if Biden Wins?,yahoofinance,2020-08-30 08:39:12
Apple and Tesla are doing stock splits right now. Should you buy?,yahoofinance,2020-08-30 08:39:12
The World’s Top Oil Importer Is Turning Its Back On Saudi Arabia,yahoofinance,2020-08-30 08:39:12
FuelCell Stock is Looking Frothy at These Levels,yahoofinance,2020-08-30 08:39:12
2 “Strong Buy” Stocks Under $3 With Massive Upside Potential,yahoofinance,2020-08-30 08:39:12
These Are The 5 Best Stocks To Buy And Watch Now,yahoofinance,2020-08-30 08:39:12
AT&T Eyeing Sale Of Half Its DirecTV Stake: Report,yahoofinance,2020-08-30 08:39:12
Why Nvidia Stock Still Has More Upside Left,yahoofinance,2020-08-30 08:39:12
Is Big Oil Still a Big Deal?,yahoofinance,2020-08-30 08:39:12
Novavax Is Conducting Clinical Trials: The Ride In NVAX Stock Will Continue To Be Wild,yahoofinance,2020-08-30 08:39:12
Acquiring ARM Holdings Would Be a Game Changer for Nvidia,yahoofinance,2020-08-30 08:39:12
"Barron's Picks And Pans: McDonald's, Salesforce, Starbucks And More",yahoofinance,2020-08-30 08:39:12
Airline Stocks To Watch In The Coronavirus Pandemic: How To Separate Winners From Losers,yahoofinance,2020-08-30 08:39:12
3 Financial Stocks to Buy After Powell’s Speech,yahoofinance,2020-08-30 08:39:12
4 Software Stocks to Buy Based on SaaS Strength,yahoofinance,2020-08-30 08:39:12
Marijuana Stocks Are Setting Up After Long Declines; Should You Buy Them?,yahoofinance,2020-08-30 08:39:12
6 Forgotten Tech Stocks to Buy Now,yahoofinance,2020-08-30 08:39:12
7 Top Stocks Under $5,yahoofinance,2020-08-30 08:39:12
A Huge Sovereign-Wealth Fund Made a Big Bet on GE Stock. Here’s What It Sold.,yahoofinance,2020-08-30 08:39:12
Electrameccanica Vehicles Likely to See $2.50 Before $5,yahoofinance,2020-08-30 08:39:12
"5 Top Stock Trades for Monday: CHWY, TSLA, ZM, APPS, BIG",yahoofinance,2020-08-30 08:39:12
Workhorse Group Needs to Find a Path to Profitability,yahoofinance,2020-08-30 08:39:12
Carlyle Group’s David Rubenstein on How the Pandemic Will Change the Rest of His Life,yahoofinance,2020-08-30 08:39:12
Jon Najarian Sees Unusual Options Activity In Roku And Starbucks,yahoofinance,2020-08-30 08:39:12
"Mr. Powell, If You Want Higher Inflation, Give People Money",yahoofinance,2020-08-30 08:39:12
"As IPO Looms, All You Need to Know About Jack Ma’s Ant Group",yahoofinance,2020-08-30 08:39:12
Get Ready for a Crazy Wave of IPOs. Here Are the Ones to Watch.,yahoofinance,2020-08-30 08:39:12
Xpeng Stock Is Hot. Here’s How Much the EV Industry Is Worth.,yahoofinance,2020-08-30 08:39:12
Mortgage rates tumble toward new lows as refinance fee is delayed,yahoofinance,2020-08-30 08:39:12
Apple CEO Tim Cook Sold Shares Ahead of Stock Split,yahoofinance,2020-08-30 08:39:12
A Big Pension Sold Berkshire Hathaway and Bank of America. Here’s What It Bought.,yahoofinance,2020-08-30 08:39:12
Fastly Takes a Break From Its Impressive Run,yahoofinance,2020-08-30 08:39:12
"VBI Vaccines’ COVID-19 Vaccine Could Be a Game Changer, Says 5-Star Analyst",yahoofinance,2020-08-30 08:39:12
The Investor’s Guide to Rocket Mortgage,yahoofinance,2020-08-30 08:39:12
3 things to know about Apple’s stock split,yahoofinance,2020-08-30 08:39:12
What can Zoom do for a sequel to one of the most astounding earnings blowouts of all time?,yahoofinance,2020-08-30 08:39:12
"Benzinga's Bulls And Bears Of The Week: Apple, Salesforce, Tesla And More",yahoofinance,2020-08-30 08:39:12
"Cramer Shares His Thoughts On Generac, Cisco And More",yahoofinance,2020-08-30 08:39:12
Penny Stocks to Watch for September 2020,yahoofinance,2020-08-30 08:39:12
Retirement Living: Renting vs. Homeownership,yahoofinance,2020-08-30 08:39:12
How Square Stock Received a Pandemic Boost From Cash App,yahoofinance,2020-08-30 08:39:12
"Apple Stock Split Should See 'Strong Retail Demand,' Morgan Stanley Says",yahoofinance,2020-08-30 08:39:12
Gold Weekly Price Forecast – Gold Markets Show Strength Again,yahoofinance,2020-08-30 08:39:12
"Intuitive Surgical, Edwards Lifesciences Lead Five Top Stocks To Watch As Coronavirus Cases Fall, Elective Procedures Rise",yahoofinance,2020-08-30 08:39:12
Tesla Stock Splits After Today’s Close. Monday’s Trading Could Be Crazy.,yahoofinance,2020-08-30 08:39:12
What the Federal Reserve inflation policy means for your retirement savings,yahoofinance,2020-08-30 08:39:12
China's new AI trade rules could hamper a TikTok sale,yahoofinance,2020-08-30 08:39:12
"Buy Costco Stock in Bulk, but Make Sure It’s From the Right Aisle",yahoofinance,2020-08-30 08:39:12
"Apple’s Bet on a Cashless Future Could Pay Big Dividends for Investors, Analyst Says",yahoofinance,2020-08-30 08:39:12
Centricus’s 11th-Hour Bid Adds Intrigue to Waiting Game on TikTok,yahoofinance,2020-08-30 08:39:12
"Ackman sees more gains for his portfolio, urges stock ownership for all Americans",yahoofinance,2020-08-30 08:39:12
7 Earnings Reports to Watch Next Week,yahoofinance,2020-08-30 08:39:12
There are still a few tax breaks for working from home,yahoofinance,2020-08-30 08:39:12
Wedbush Storms Into the Software Space; Here Are 3 Stocks to Buy,yahoofinance,2020-08-30 08:39:12
6 Great Recession Money Lessons That Still Apply Today,yahoofinance,2020-08-30 08:39:12
Ambani to Pay $3.4 Billion for Tycoon Biyani’s Retail Units,yahoofinance,2020-08-30 08:39:12
U.S Mortgage Rates Hit Reverse. Record Low Rates Continue to Drive Buyer Demand,yahoofinance,2020-08-30 08:39:12
Oil Price Fundamental Daily Forecast – US Oil Industry Dodges Widespread Damage to Platforms and Refineries,yahoofinance,2020-08-30 08:39:12
Dell and HP’s PC Sales Are Soaring. Here’s What Is Really Driving Their Stocks Higher.,yahoofinance,2020-08-30 08:39:12
U.S. regulator backs Energy Transfer in Chesapeake pipeline dispute -court filing,yahoofinance,2020-08-30 08:39:12
These money and investing tips can help you through the stock market’s worst month,yahoofinance,2020-08-30 08:39:12
"Is The World's Biggest Marijuana Stock A Buy After Earnings Beat, New Stores Announced?",yahoofinance,2020-08-30 08:39:12
Bankrupt Hertz seeks $5.4M in executive bonuses,yahoofinance,2020-08-30 08:39:12
"Is Snap Stock A Buy Right Now? Here's What Earnings, Charts Show",yahoofinance,2020-08-30 08:39:12
"This Market Rally Has Legs, Six Strategists Say. Here’s Proof",yahoofinance,2020-08-30 08:39:12
"Price Gains And A Big Dividend, Too? Only 6 Stocks Pull It Off",yahoofinance,2020-08-30 08:39:12
Elon Musk's net worth tops $100 billion: Forbes,yahoofinance,2020-08-30 08:39:12
Mike Khouw's QQQ Hedge Going Into Election,yahoofinance,2020-08-30 08:39:12
Ocugen Needs Too Much Time and Too Much Cash,yahoofinance,2020-08-30 08:39:12
Manufacturing defect leads Boeing to ground several 787 jets,yahoofinance,2020-08-30 08:39:12
"Tesla bull says long-term thesis 'still intact,' sees $7,000 price target by 2024",yahoofinance,2020-08-30 08:39:12
Nio shares fall after company announces offering of 75 million shares,yahoofinance,2020-08-30 08:39:12
"Ackman defends capitalism, says wealth gap is a 'black swan' ",yahoofinance,2020-08-30 08:39:12
"Blockchain Bites: Winklevoss’ Wild Prediction, Bitcoin Miners’ Horde, Ethereum’s ‘Critical Bug’",yahoofinance,2020-08-30 08:39:12
One SPAC I Have My Eye One,yahoofinance,2020-08-30 08:39:12
"The Crypto Daily – Movers and Shakers – August 30th, 2020",yahoofinance,2020-08-30 08:39:12
Don’t Let the Pandemic Extinguish Your Early-Retirement Plans. Consider These 4 Tweaks.,yahoofinance,2020-08-30 08:39:12
Apple’s Stock Is About to Split 4-for-1. Here’s What It Means for Investors.,yahoofinance,2020-08-30 08:39:12
"Dow Jones Stocks To Buy And Watch In August 2020: Nike, Pfizer, Visa; Walmart In Buy Range",yahoofinance,2020-08-30 08:39:12
Caution flag comes out as U.S. stock market reaches new records,yahoofinance,2020-08-30 08:39:12
Chapter 9 Is the Best Bad Option for Chicago’s Pensions,yahoofinance,2020-08-30 08:39:12
Psychedelic Drugs Eye Long Trip To Legalization But This U.S. IPO Won't Wait,yahoofinance,2020-08-30 08:39:12
Silver Weekly Price Forecast – Silver Markets Have Strong Week,yahoofinance,2020-08-30 08:39:12
"As Instability Bubbles Up, Square Stock Is a Bet on Whatever the Future Holds",yahoofinance,2020-08-30 08:39:12
Top Marijuana Stock To Expand In Canada's Biggest Retail Market,yahoofinance,2020-08-30 08:39:12
What Apple Investors Should Know Ahead Of Stock Split,yahoofinance,2020-08-30 08:39:12
"What Is Per Diem, and How Is It Taxed?",yahoofinance,2020-08-30 08:39:12
Magic Mushroom Drug-Backer Compass Pathways Files for U.S. IPO,yahoofinance,2020-08-30 08:39:12
China’s Mega Banks Post Worst Profit Slump on Bad Debt Wave,yahoofinance,2020-08-30 08:39:12
These 7 Funds Beat the Market Without Owning the FAAMG Stocks,yahoofinance,2020-08-30 08:39:12
The Differences Between Institutional and Individual Investors,yahoofinance,2020-08-30 08:39:12
What Tesla Investors Should Know Ahead Of Stock Split,yahoofinance,2020-08-30 08:39:12
"'Halftime Report' Traders Weigh In On Boeing, Disney And More",yahoofinance,2020-08-30 08:39:12
"Is Amazon Stock A Buy Right Now? Here's What Earnings, Charts Show",yahoofinance,2020-08-30 08:39:12
What Rolls-Royce’s Big Loss Means for GE Stock,yahoofinance,2020-08-30 08:39:12
"Is DAL Stock A Buy Right Now? Here's What Earnings, Delta Stock Chart Show",yahoofinance,2020-08-30 08:39:12
Revamped Dow’s Gap With S&P 500 Is Set to Widen,wsj,2020-08-30 08:41:25
Companies Rush to Shore Up Covid-19 Testing Ahead of Flu Season,wsj,2020-08-30 08:41:25
The Coronavirus Is Doing Weird Things to the Banking Industry,wsj,2020-08-30 08:41:25
China Tightens Tech Export Rules Amid TikTok Talks,wsj,2020-08-30 08:41:25
Intelligence Office to Stop Briefing Congress on Election Security,wsj,2020-08-30 08:41:25
"In Portland, Man Fatally Shot as Rival Protesters Clash",wsj,2020-08-30 08:41:25
"As Trash Piles Up During Covid, Residents Raise a Stink",wsj,2020-08-30 08:41:25
Airport Shopping Has Been on a Tear for Years. Now What?,wsj,2020-08-30 08:41:25
"For a Few Destinations, Tourism Is Going Strong",wsj,2020-08-30 08:41:25
How Will the NFL Season Be Affected by the Coronavirus Pandemic?,wsj,2020-08-30 08:41:25
Robot Boats Leave Autonomous Cars in Their Wake,wsj,2020-08-30 08:41:25
"Chadwick Boseman’s Career Amplified Black Culture, History",wsj,2020-08-30 08:41:25
The Secrets of Elite College Admissions,wsj,2020-08-30 08:41:25
Renewables Are Primed for Growth in Asia,wsj,2020-08-30 08:41:25
TV Manufacturers Seek to Capture a Bigger Share of Streaming Ad Market,wsj,2020-08-30 08:41:25
Financial Firms Fail to Own Up to Advisers’ Past Misdeeds,wsj,2020-08-30 08:41:25
"The Future of Cleaning Oil Spills: Robots, Wood Chips and Sponges",wsj,2020-08-30 08:41:25
BlackRock Gets Go-Ahead for a Mutual-Fund Business in China,wsj,2020-08-30 08:41:25
"When Nixon Froze Prices, Arnold Weber Enforced the Rules",wsj,2020-08-30 08:41:25
"Barry Sterling, Corporate Lawyer, Found Vocation in Wine",wsj,2020-08-30 08:41:25
Military Service Launched Arnold Spielberg’s Career in Digital Design,wsj,2020-08-30 08:41:25
Trump Surveys Damage From Laura as Cleanup Begins,wsj,2020-08-30 08:41:25
China’s Theme Parks Boom as Tourists Have Nowhere to Go,wsj,2020-08-30 08:41:25
Belarus’s Struggle to Escape Its Soviet Past Pushes It Into Russia’s Embrace,wsj,2020-08-30 08:41:25
A New Way to Wear Leather This Fall,wsj,2020-08-30 08:41:25
The Most Elegant No-Bake Summer Dessert,wsj,2020-08-30 08:41:25
Teachers Retrain to Keep Students on Track in Online Classes,wsj,2020-08-30 08:41:25
We Tested 50 Face Masks to Find the Best,wsj,2020-08-30 08:41:25
 Fed’s Elevation of Employment Goal Reflects a Changed World ,wsj,2020-08-30 08:41:25
" Job Seekers, Homebuyers, Stock Investors Are Expected to Benefit From Fed’s New Strategy ",wsj,2020-08-30 08:41:25
 Powell Headlines Virtual Jackson Hole Conference ,wsj,2020-08-30 08:41:25
 How an Ornate Home Can Avoid Looking Cluttered ,wsj,2020-08-30 08:41:25
 WSJ News Exclusive | Phil Swift of Infomercial Fame Buys Florida Home for $20 Million ,wsj,2020-08-30 08:41:25
 This Retro Decorating Move Will Transform Your Bedroom—for $200 or Less ,wsj,2020-08-30 08:41:25
 Steven Cohen in Exclusive Talks to Buy Majority Stake in New York Mets ,wsj,2020-08-30 08:41:25
 NBA Playoffs Will Resume Saturday After Deal on Voting Initiatives ,wsj,2020-08-30 08:41:25
" As Other Sports Protested Kenosha Shooting, Baseball Struggled to Respond ",wsj,2020-08-30 08:41:25
The Best Way to Ask for a Raise or Promotion,wsj,2020-08-30 08:41:25
Multinational Firms Aim to Standardize Their Retirement Plans,wsj,2020-08-30 08:41:25
The Key to Selling Music in the Streaming Age—From the Man Who Brought You Billie Eilish,wsj,2020-08-30 08:41:25
"Apple Can’t Block ‘Fortnite’ Creator From Developer Tools, Judge Rules",wsj,2020-08-30 08:41:25
WPP Shares Climb as It Says the Worst of the Crisis Is Likely Over,wsj,2020-08-30 08:41:25
Facebook CMO Antonio Lucio to Exit,wsj,2020-08-30 08:41:25
Data-Center Operators Holding Their Own During Pandemic,wsj,2020-08-30 08:41:25
World-Wide AI Spending Expected to Double in Next Four Years,wsj,2020-08-30 08:41:25
"White House Announces $1 Billion Plan to Create AI, Quantum Institutes",wsj,2020-08-30 08:41:25
Volkswagen CFO Plans to Target New Investors With Green Bond,wsj,2020-08-30 08:41:25
Chinese Phone Maker Xiaomi Taps New Finance Chief,wsj,2020-08-30 08:41:25
"SEC to Allow Businesses More Flexibility in Disclosing Risk, Legal Information",wsj,2020-08-30 08:41:25
Herbalife Nutrition Agrees to Pay $123 Million to Settle China Bribery Allegations,wsj,2020-08-30 08:41:25
U.K. Regulator Seeks to Expand Financial Crime Reporting Requirements,wsj,2020-08-30 08:41:25
Supermicro Fined $17.5 Million Over Accounting Violations,wsj,2020-08-30 08:41:25
"From ‘Freezer Farms’ to Jets, Logistics Operators Prepare for a Covid-19 Vaccine",wsj,2020-08-30 08:41:25
"Postmaster General Focused Too Narrowly on Trucking, Some Experts Say",wsj,2020-08-30 08:41:25
Today's Logistics Report: Timing Postal Trucks; Dropping the Groceries; Eyeing Supply-Chain Finance,wsj,2020-08-30 08:41:25
A Huge Sovereign-Wealth Fund Made a Big Bet on GE Stock. Here’s What It Sold.,wsj,2020-08-30 08:41:25
FDA Expands Emergency Use of Gilead’s Remdesivir in All Covid-19 Hospitalizations,wsj,2020-08-30 08:41:25
Why Kellogg and General Mills Stock Have Room to Run,wsj,2020-08-30 08:41:25
"Sweden embraced herd immunity, while the U.K. abandoned the idea — so why do they BOTH have high COVID-19 fatality rates?",wsj,2020-08-30 08:41:25
These money and investing tips can help you through the stock market’s worst month,wsj,2020-08-30 08:41:25
My husband wants 50% of my mother’s inheritance because he earns more than me. I said no. Am I unreasonable?,wsj,2020-08-30 08:41:25
"This Week in Celebrity Homes: Priscilla Presley, Massimo Ferragamo",wsj,2020-08-30 08:41:25
Best Strategies to Win a Bidding War,wsj,2020-08-30 08:41:25
"The Listings of the Week: A Victorian Home in San Diego, A Waterfront Bahamas Villa, and More",wsj,2020-08-30 08:41:25
Post-Opulence Autos: A New Design Trend Influenced by Covid-19,wsj,2020-08-30 08:41:25
Sotheby’s Offers Keith Haring’s Personal Collection,wsj,2020-08-30 08:41:25
Brooklyn Antiquarian Book Fair Goes Virtual,wsj,2020-08-30 08:41:25
Cuomo Gets a Nursing Home Inspection,wsj,2020-08-30 08:41:25
One Step Ahead of the Woke Mob,wsj,2020-08-30 08:41:25
Today’s College Classroom Is a Therapy Session,wsj,2020-08-30 08:41:25
Trump’s RNC Speech Sheds Light on His Re-Election Strategy,wsj,2020-08-30 08:41:25
Thousands Flood National Mall to Protest Racial Injustice,wsj,2020-08-30 08:41:25
"Shinzo Abe, Battling Illness, Resigns as Japan’s Leader: What’s Next",wsj,2020-08-30 08:41:25
What Durable Goods Numbers Say About the U.S. Economy,wsj,2020-08-30 08:41:25
Trump’s Campaign Adviser on the President’s ‘Silent Majority’,wsj,2020-08-30 08:41:25
First Family and White House Add Personal Touch to RNC,wsj,2020-08-30 08:41:25
College Town Economies Brace for Covid Blow,wsj,2020-08-30 08:41:25
Many Predicted the Dollar's Demise. Coronavirus Proved Them Wrong.,wsj,2020-08-30 08:41:25
"Warren Buffett and the $300,000 Haircut",wsj,2020-08-30 08:41:25
"Jacob Blake Shooting: What Happened in Kenosha, Wis.? ",wsj,2020-08-30 08:41:25
Who Is Kyle Rittenhouse and What Happened in the Kenosha Shootings? ,wsj,2020-08-30 08:41:25
One of the Brains Behind Tesla May Have a New Way to Make Electric Cars Cheaper,wsj,2020-08-30 08:41:25
"For a Few Destinations, Tourism Is Doing Better Than Ever",wsj,2020-08-30 08:41:25
Walmart's Looming TikTok Mistake,seekingalpha,2020-08-30 08:43:17
The VIX Is Raising A Red Flag For The Rally,seekingalpha,2020-08-30 08:43:17
Intel Is Down - Not Out,seekingalpha,2020-08-30 08:43:17
Why Residential REITs Are Set To Soar,seekingalpha,2020-08-30 08:43:17
"Stocks To Watch: Nvidia, Intel And Zoom Look To Dazzle",seekingalpha,2020-08-30 08:43:17
The United States Is Going Into Hyperinflation,seekingalpha,2020-08-30 08:43:17
56 Kiplinger Outstanding Dividend Stocks For September,seekingalpha,2020-08-30 08:43:17
Weighing The Week Ahead: Risky Business Or Business As Usual?,seekingalpha,2020-08-30 08:43:17
Wall Street Breakfast: The Week Ahead,seekingalpha,2020-08-30 08:43:17
5 Reasons Why We Like Bank Of New York Mellon So Much,seekingalpha,2020-08-30 08:43:17
I'm Buying These Investments For Fall 2020,seekingalpha,2020-08-30 08:43:17
How should you trade the Apple and Tesla stock splits?,seekingalpha,2020-08-30 08:43:17
"Weekly Wrap: Rapid testing propels airlines, cruise lines",seekingalpha,2020-08-30 08:43:17
Seeking Alpha Catalyst Watch,seekingalpha,2020-08-30 08:43:17
"China tightens tech export rules, complicating TikTok talks",seekingalpha,2020-08-30 08:43:17
"Keep an eye on BPY, BPYU this week as tender offers end, FT's Dizard says",seekingalpha,2020-08-30 08:43:17
DraftKings CEO calls for calm amid SPAC market hype,seekingalpha,2020-08-30 08:43:17
Publishers face hit from upcoming Apple privacy controls,seekingalpha,2020-08-30 08:43:17
"Airlines, lodging are the next wave of this rally – PIMCO CIO",seekingalpha,2020-08-30 08:43:17
AT&T exploring new sale effort for DirecTV - WSJ,seekingalpha,2020-08-30 08:43:17
PPL declares $0.415 dividend,seekingalpha,2020-08-30 08:43:17
CytoDyn to update investors on regulatory and clinical activities September 2,seekingalpha,2020-08-30 08:43:17
Northern Oil And Gas: The Most Overlooked Oil Producer,seekingalpha,2020-08-30 08:43:17
Bachoco: Mexico's Poultry Powerhouse Is Bizarrely Cheap,seekingalpha,2020-08-30 08:43:17
The Fed May Have Signaled The End Of The Bond Bull Market,seekingalpha,2020-08-30 08:43:17
50 Best S&P 500 Stocks Since February Peak,seekingalpha,2020-08-30 08:43:17
Focusing On Portfolio Construction: A Response To Recent Comments,seekingalpha,2020-08-30 08:43:17
KBW examines reinsurance picks in Hurricane Laura's aftermath,seekingalpha,2020-08-30 08:43:17
Baird revisits vertical software favorites for 2021 after 'pause',seekingalpha,2020-08-30 08:43:17
"Evercore weighs comparative growth, COVID opportunities for payment networks",seekingalpha,2020-08-30 08:43:17
After Laura: Wells Fargo picks insurance names to benefit from pricing dynamics,seekingalpha,2020-08-30 08:43:17
Baird notes hot competition marks heavy headwinds for a COVID-19 treatment maker,seekingalpha,2020-08-30 08:43:17
Will A Contentious U.S. Election Rock Markets?,seekingalpha,2020-08-30 08:43:17
The Contribution Conundrum For Underfunded Plans,seekingalpha,2020-08-30 08:43:17
Wall Street Breakfast: The Week Ahead,seekingalpha,2020-08-30 08:43:17
"In July, Money Supply Growth Hit A New High For The Fourth Month In A Row",seekingalpha,2020-08-30 08:43:17
2020 Will Be A Record-Breaking Year For Debt. How Long Can This Last?,seekingalpha,2020-08-30 08:43:17
Coca-Cola's Friday Breakout,seekingalpha,2020-08-30 08:43:17
Citigroup Short: A Bet On The Falling U.S. Dollar,seekingalpha,2020-08-30 08:43:17
"BeiGene COVID-19 Deal And Other News: The Good, Bad And Ugly Of Biopharma",seekingalpha,2020-08-30 08:43:17
Intel Is Down - Not Out,seekingalpha,2020-08-30 08:43:17
"Lions Gate Looks To Library, Digital And Starz To Offset Theatrical",seekingalpha,2020-08-30 08:43:17
5 Reasons Why We Like Bank Of New York Mellon So Much,seekingalpha,2020-08-30 08:43:17
Coca-Cola's Friday Breakout,seekingalpha,2020-08-30 08:43:17
56 Kiplinger Outstanding Dividend Stocks For September,seekingalpha,2020-08-30 08:43:17
"Plaza Retail REIT: A Fully Covered 8% Dividend, 50% Upside Potential And A 92% Rent Collection Rate",seekingalpha,2020-08-30 08:43:17
Dividend Challenger Highlights: Week Of August 30,seekingalpha,2020-08-30 08:43:17
"MUB: National Munis Face Covid Pressures, But The Market Ignores Them",seekingalpha,2020-08-30 08:43:17
DBE: Stay Long The Energy Markets,seekingalpha,2020-08-30 08:43:17
SOYB: Growth Potential Is Not Exhausted,seekingalpha,2020-08-30 08:43:17
The Battle Of The International Dividend ETFs: IDV Vs. VYMI,seekingalpha,2020-08-30 08:43:17
Refinitiv Lipper Chart Of The Week: Net Outflows Continue For Loan Participation Funds,seekingalpha,2020-08-30 08:43:17
Will A Contentious U.S. Election Rock Markets?,seekingalpha,2020-08-30 08:43:17
Wall Street Breakfast: The Week Ahead,seekingalpha,2020-08-30 08:43:17
"In July, Money Supply Growth Hit A New High For The Fourth Month In A Row",seekingalpha,2020-08-30 08:43:17
2020 Will Be A Record-Breaking Year For Debt. How Long Can This Last?,seekingalpha,2020-08-30 08:43:17
MENA Market Outlook: Managing The Economic Fallout,seekingalpha,2020-08-30 08:43:17
Here's what the payroll tax deferral action means for you,cnnbusiness,2020-08-30 08:45:59
"Online school means online tests, along with computerized surveillance",cnnbusiness,2020-08-30 08:45:59
Instagram Reels first impressions: A whole lot of TikToks,cnnbusiness,2020-08-30 08:45:59
How much are you spending on remote learning for your kids? Share your story.,cnnbusiness,2020-08-30 08:45:59
Biden hits Trump where it hurts: in the convention speech ratings,cnnbusiness,2020-08-30 08:45:59
Facebook CEO admits 'operational mistake' in failure to remove Kenosha militia page,cnnbusiness,2020-08-30 08:45:59
Trump wants to create 10 million jobs in 10 months. Here's why that might be tricky,cnnbusiness,2020-08-30 08:45:59
Covid-19 dealt a shock to the world's top economies. Here's who has fared the worst,cnnbusiness,2020-08-30 08:45:59
Herbalife to pay $123 million to settle China bribery charges,cnnbusiness,2020-08-30 08:45:59
Japan's Abe is out. But his economic legacy will last for decades,cnnbusiness,2020-08-30 08:45:59
Damage from Hurricane Laura is far less than initially feared,cnnbusiness,2020-08-30 08:45:59
Late-night takes aim at RNC on final night,cnnbusiness,2020-08-30 08:45:59
Refi rates at 2.42% APR (15 yr). Do you qualify?,cnnbusiness,2020-08-30 08:45:59
Picnic fever is surging. A decades-old basket brand thinks it can make a comeback,cnnbusiness,2020-08-30 08:45:59
What COVID-19 means for the global energy transition.,cnnbusiness,2020-08-30 08:45:59
"Utz, maker of Zapp's and Boulder Canyon chips, is going public",cnnbusiness,2020-08-30 08:45:59
'The Swiss Army knife of bikes:' Cargo bikes are having a moment,cnnbusiness,2020-08-30 08:45:59
"This tiny electric car could cost just $10,000 in the US",cnnbusiness,2020-08-30 08:45:59
Michigan plans to redesign road for self-driving cars,cnnbusiness,2020-08-30 08:45:59
Plan to charge for driving into Manhattan is facing delays,cnnbusiness,2020-08-30 08:45:59
Fiat Chrysler's new Ram 1500 TRX will be the quickest pickup truck ever,cnnbusiness,2020-08-30 08:45:59
Jeff Bezos was already the world's richest man. Now he's worth even more,cnnbusiness,2020-08-30 08:45:59
Elon Musk is the fourth-richest man in the world,cnnbusiness,2020-08-30 08:45:59
Tim Cook reaches billionaire status,cnnbusiness,2020-08-30 08:45:59
Elon Musk just became richer than Warren Buffett,cnnbusiness,2020-08-30 08:45:59
Mark Zuckerberg is now worth $100 billion,cnnbusiness,2020-08-30 08:45:59
See how this company turns garages into affordable housing,cnnbusiness,2020-08-30 08:45:59
Watch how Amazon's new fitness tracker analyzes your tone of voice,cnnbusiness,2020-08-30 08:45:59
Netflix releases 'Enola Holmes' trailer featuring Millie Bobby Brown,cnnbusiness,2020-08-30 08:45:59
What some companies are doing to establish WFH balance,cnnbusiness,2020-08-30 08:45:59
Movie theaters are reopening. We asked an expert if it's safe to go,cnnbusiness,2020-08-30 08:45:59
What your new work life might look like,cnnbusiness,2020-08-30 08:45:59
