headline,org,date
What Election Means for Alternative Energy Stocks,thestreet,2020-10-28 09:07:57
Worried About Election Volatility? 5 Rules to Protect Your Portfolio,thestreet,2020-10-28 09:07:57
Politics and Your Portfolio: Tuning Out the Noise,thestreet,2020-10-28 09:07:57
Presidential Elections and the Market: What History Tells Investors,thestreet,2020-10-28 09:07:57
Why Haven’t Small-Value Stocks Led Yet?,thestreet,2020-10-28 09:07:57
"How Presidential Election Impacts Stocks, Economy: Tips for Investors",thestreet,2020-10-28 09:07:57
The Stock Market and Economy: Still Separate,thestreet,2020-10-28 09:07:57
Online Holiday Sales Could Shatter Previous Records: Adobe Analytics,thestreet,2020-10-28 09:07:57
"Eli Lilly, U.S. in Accord for Covid-19 Antibody",thestreet,2020-10-28 09:07:57
"Bed, Bath & Beyond Outlines Turnaround, Share Buyback Plans",thestreet,2020-10-28 09:07:57
What To Do if You’re Denied for a Student Loan Refinance,thestreet,2020-10-28 09:07:57
Advisers Can Help With When to Claim Social Security,thestreet,2020-10-28 09:07:57
Everything You Need to Know About Filing Taxes on Winnings,thestreet,2020-10-28 09:07:57
Where Is the Best Place to Put Your Savings?,thestreet,2020-10-28 09:07:57
Everything You Need to Know About Filing Taxes on Winnings,thestreet,2020-10-28 09:07:57
What Biden’s 401(k) Tax Plan Could Mean for Investors,thestreet,2020-10-28 09:07:57
What is Form 1099-NEC?,thestreet,2020-10-28 09:07:57
Microsoft Shares Slip Lower Despite Azure-Driven Q1 Earnings Beat,thestreet,2020-10-28 09:07:57
Dow Futures Plunge 600 Points as Coronavirus Infection Surge Rattles Markets: Boeing and GE Earnings in Focus,thestreet,2020-10-28 09:07:57
Looking for Leadership: Cramer's 'Mad Money' Recap (Tuesday 10/27/20),thestreet,2020-10-28 09:07:57
FireEye Higher After Reporting Better-Than-Expected Results,thestreet,2020-10-28 09:07:57
Microsoft Falls After Topping Analyst Q4 Expectations,thestreet,2020-10-28 09:07:57
"First Solar Tops Estimates, Reinstates Guidance",thestreet,2020-10-28 09:07:57
Microsoft Tops Estimates as Cloud Computing Drives Q4,thestreet,2020-10-28 09:07:57
AMD's Blockbuster Deal to Acquire Xilinx: 6 Thoughts,thestreet,2020-10-28 09:07:57
"Harley-Davidson, Tiffany: 5 Top Stock Gainers for Tuesday",thestreet,2020-10-28 09:07:57
Stocks End Mixed as Virus Cases Surge; Tech Lifted by AMD-Xilinx,thestreet,2020-10-28 09:07:57
Visa Plaid Acquisition Sparks DoJ Antitrust Concern,thestreet,2020-10-28 09:07:57
"Amazon Will Hire 100,000 Workers For Holiday Season",thestreet,2020-10-28 09:07:57
Jim Cramer Says 3M Stock Oversold After Good Quarter,thestreet,2020-10-28 09:07:57
Where Is the Best Place to Put Your Savings?,thestreet,2020-10-28 09:07:57
Boeing to cut thousands of additional jobs as it prepares for long air travel slump in pandemic,googlenews,2020-10-28 09:09:59
"Eli Lilly lines up a blockbuster deal for Covid-19 antibody, right after it failed a NIAID trial",googlenews,2020-10-28 09:09:59
"Investors flee risk, dumping stocks and buying bonds, as France nears national lockdown | Markets",googlenews,2020-10-28 09:09:59
"Deutsche Bank swings back to profit in third quarter, beats expectations",googlenews,2020-10-28 09:09:59
Dow futures drop over 600 points as COVID cases rise,googlenews,2020-10-28 09:09:59
Harley-Davidson is getting into the electric bicycle business,googlenews,2020-10-28 09:09:59
Why US Economic Growth Data Will Not Be Quite The Blockbuster It First Appears,googlenews,2020-10-28 09:09:59
Mark Zuckerberg And Jack Dorsey Are Gonna Have A Rotten Day As They Testify Before The Senate,googlenews,2020-10-28 09:09:59
London Heathrow loses its crown to Paris as passenger numbers plummet,googlenews,2020-10-28 09:09:59
Meet the youngest participants in Covid-19 vaccine trials: Teens and tweens,googlenews,2020-10-28 09:09:59
Microsoft Corporation (MSFT) CEO Satya Nadella on Q1 2021 Results - Earnings Call Transcript,googlenews,2020-10-28 09:09:59
Pfizer says Covid-19 vaccine still possible in 2020 despite data lag,googlenews,2020-10-28 09:09:59
Starlink testers will pay $99 per month for SpaceX's satellite internet,googlenews,2020-10-28 09:09:59
The Bugatti Bolide Is an 1825-HP Lightweight Track Monster,googlenews,2020-10-28 09:09:59
The $750 Million Pre-Halloween Bitcoin Options Expiry Has Started to Spook Traders,googlenews,2020-10-28 09:09:59
"Bed Bath & Beyond targets 'stable' sales growth in 2021, low-to-mid single-digit gains by 2023",googlenews,2020-10-28 09:09:59
Jim Cramer: Bank With Advanced Micro's Lisa Su and Go Along for the Ride,googlenews,2020-10-28 09:09:59
Sticker Shock: Why Used-Car Prices Are So High,googlenews,2020-10-28 09:09:59
McDonald's offering free taste of its newest McCafe menu items,googlenews,2020-10-28 09:09:59
Panera Bread adds pizza to menus as customers order more delivery and takeout,googlenews,2020-10-28 09:09:59
Mercedes-Benz is taking a big stake in Aston Martin,googlenews,2020-10-28 09:09:59
Sony's net profit more than doubles,googlenews,2020-10-28 09:09:59
U.S. EPA approves use of controversial Bayer weed killer for five years: RFD TV,googlenews,2020-10-28 09:09:59
"2022 Mercedes SL Spied Testing In Germany, Hear Its Engine",googlenews,2020-10-28 09:09:59
"Why billionaire investor Ray Dalio hates cash and bonds, and says the election won't change his view on the economy",googlenews,2020-10-28 09:09:59
Callaway Golf agrees to buy remainder of Topgolf,googlenews,2020-10-28 09:09:59
New York Times: Tax records show Trump had over $270 million in debt forgiven after failing to repay lenders,googlenews,2020-10-28 09:09:59
Here's How Much You Should Have Saved for Retirement by Age 50,googlenews,2020-10-28 09:09:59
Pfizer third-quarter sales fall 4.3% on pain drug weakness,googlenews,2020-10-28 09:09:59
Burger King's new drive-thru menus will guess what you want to eat,googlenews,2020-10-28 09:09:59
Homebuyer demand may have peaked as mortgage applications eke out a weekly gain,googlenews,2020-10-28 09:09:59
Hawaii to welcome Japanese visitors back in November with pre-travel testing,googlenews,2020-10-28 09:09:59
Oil Rally Stalls On Larger Than Expected Crude Inventory Build,googlenews,2020-10-28 09:09:59
Warren Buffett's 11 Longest-Held Stocks,googlenews,2020-10-28 09:09:59
How to Get the Most Out of Your Medicare Advantage Plan,googlenews,2020-10-28 09:09:59
Coinbase Goes Down as Bitcoin Approaches 2019 Highs - CoinDesk,googlenews,2020-10-28 09:09:59
"Inside Ant, the Company Behind the World’s Biggest IPO",googlenews,2020-10-28 09:09:59
T-Mobile intros three streaming TV services and an Android TV dongle,googlenews,2020-10-28 09:09:59
Raytheon CEO calls suspicions Biden would cut defense spending 'ridiculous',googlenews,2020-10-28 09:09:59
AMD Reports Third Quarter 2020 Financial Results Nasdaq:AMD,googlenews,2020-10-28 09:09:59
Looking for a job? Amazon plans to hire 100000 more workers,googlenews,2020-10-28 09:09:59
"Trader Joe's fish recall: Gluten Free Battered Halibut recalled in 19 states over undeclared wheat, milk allergens",googlenews,2020-10-28 09:09:59
"Today's mortgage refinance rates see little change as market clings to historical lows | October 27, 2020",googlenews,2020-10-28 09:09:59
"Flying can be safer than grocery shopping, Harvard study asserts",googlenews,2020-10-28 09:09:59
Here's Why Exact Sciences Stock Rocketed Higher Today,googlenews,2020-10-28 09:09:59
FCC launches a $9 billion fund to expand 5G in rural areas,googlenews,2020-10-28 09:09:59
Shopify stock gains after company announces TikTok partnership,googlenews,2020-10-28 09:09:59
"Circa’s grand opening in downtown Las Vegas, take the tour — WATCH LIVE",googlenews,2020-10-28 09:09:59
US Army gets first Infantry Squad Vehicle from GM Defense,googlenews,2020-10-28 09:09:59
"Stocks making the biggest moves midday: Hasbro, Dunkin' Brands, AstraZeneca, Delta & more",googlenews,2020-10-28 09:09:59
"How Uber, Lyft, DoorDash drivers are navigating Prop. 22",googlenews,2020-10-28 09:09:59
Precious metals prepare for another price advance,googlenews,2020-10-28 09:09:59
Waymo to bring its autonomous driving technology to Daimler’s semi trucks,googlenews,2020-10-28 09:09:59
No-visitor policy begins Wednesday for MCHS facilities in SE Minnesota,googlenews,2020-10-28 09:09:59
3 ridiculously easy ways to retire wealthier,googlenews,2020-10-28 09:09:59
Why Novavax Stock Is Moving Higher Today,googlenews,2020-10-28 09:09:59
San Diego home prices increasing 3rd-fastest in nation,googlenews,2020-10-28 09:09:59
Investing in These 5 ETFs Could Send Your Kids to College,googlenews,2020-10-28 09:09:59
"California warns of virus uptick, names vaccine ethics panel",googlenews,2020-10-28 09:09:59
"2021 Jaguar E-Pace pounces on more tech, upgraded style",googlenews,2020-10-28 09:09:59
Tiffany and LVMH discuss price cut to settle deal dispute,googlenews,2020-10-28 09:09:59
"SPI Energy Announces Board Approval to Spin Off Solar Juice Co., Ltd. and Settlement of Solar Juice Australia Lawsuits",googlenews,2020-10-28 09:09:59
Hy-Vee becomes first grocery store chain to automate cleaning of shopping carts,googlenews,2020-10-28 09:09:59
Tesla's 'Full Self Driving' Beta Tech Nearly Wrecked This Model 3 Into a Parked Car,googlenews,2020-10-28 09:09:59
HSBC plans to speed up restructuring as profits drop 36%,googlenews,2020-10-28 09:09:59
Amazon Announces First Fulfillment Center in Nebraska,googlenews,2020-10-28 09:09:59
Las Vegas Sands Seeks To Be 'Sans Vegas' By Selling Vegas Strip Casino Resorts,googlenews,2020-10-28 09:09:59
"Alphabet, Facebook and other tech giants could benefit from surprise ad rebound in Q3, analysts predict",googlenews,2020-10-28 09:09:59
Wells Fargo confirms layoffs in effort to 'build stronger company',googlenews,2020-10-28 09:09:59
"‘Greenest, safest’ electric pickup truck to be delivered by September: Lordstown Motors CEO",googlenews,2020-10-28 09:09:59
"Boeing sees Q3 earnings improvement but warns on layoffs as coronavirus, 737 MAX weigh",googlenews,2020-10-28 09:09:59
"Boeing to Cut 7,000 More Jobs as Losses Continue: Live Business Updates",googlenews,2020-10-28 09:09:59
Boeing Cutting More Jobs in Response to Pandemic,googlenews,2020-10-28 09:09:59
"Boeing's Earnings Were Bad, but Not as Bad as Feared",googlenews,2020-10-28 09:09:59
"Lilly antibody drug fails in study of hospitalized Covid patients, other trials go on",googlenews,2020-10-28 09:09:59
Lilly stays confident in possible COVID drug after setback,googlenews,2020-10-28 09:09:59
Stop Waiting on New Covid-19 Treatments. Wear a Mask.,googlenews,2020-10-28 09:09:59
"U.S. agrees to pay Eli Lilly $375 million for 300,000 doses of coronavirus antibody drug",googlenews,2020-10-28 09:09:59
European stocks drop and Dow futures slide 400 points as rising COVID-19 cases set to trigger more restrictions,googlenews,2020-10-28 09:09:59
Europe Stocks Tumble to 5-Month Low; Futures Slide: Markets Wrap,googlenews,2020-10-28 09:09:59
Losing streak for stocks continues as lockdowns loom in France and Germany,googlenews,2020-10-28 09:09:59
Stocks tumble as lockdown fears grip investors,googlenews,2020-10-28 09:09:59
"Wall Street set for a big drop at the open, with Dow futures sinking more than 600 points",googlenews,2020-10-28 09:09:59
AMD’s Lisa Su Redoubles Intel Challenge With Record Xilinx Deal,googlenews,2020-10-28 09:09:59
Global Market Cues: US Equities continue downward trajectory barring stay home stocks,googlenews,2020-10-28 09:09:59
What to watch today: Dow set to fall more than 400 points as Covid cases rise; more earnings coming,googlenews,2020-10-28 09:09:59
Harley-Davidson officially spins off new electric bicycle company with stunning first model,googlenews,2020-10-28 09:09:59
"Riding on Hero MotoCorp, majestic Harley makes India comeback",googlenews,2020-10-28 09:09:59
New Harley-Davidson Serial 1 Electric Bicycle Revealed With Mid-Mounted Motor,googlenews,2020-10-28 09:09:59
"Harley-Davidson reveals its first ebike, and it can be yours in March 2021",googlenews,2020-10-28 09:09:59
"Facebook, Google, Twitter CEOs to tell senators changing liability law will destroy how we communicate online",googlenews,2020-10-28 09:09:59
Social Media CEOs to Come Under Senate Scrutiny,googlenews,2020-10-28 09:09:59
"Twitter, Facebook, Google reportedly to tell Senate new content rules would destroy expression on the Internet",googlenews,2020-10-28 09:09:59
Reform Section 230 Now | Opinion,googlenews,2020-10-28 09:09:59
Heathrow loses claim to being Europe's biggest airport,googlenews,2020-10-28 09:09:59
"Britain's Heathrow Airport slashes outlook, loses European crown",googlenews,2020-10-28 09:09:59
Charles de Gaulle overtakes Heathrow as Europe’s busiest airport,googlenews,2020-10-28 09:09:59
Heathrow says Paris now Europe's largest airport,googlenews,2020-10-28 09:09:59
I'm the FDA point person on COVID-19 vaccines. We'll make sure they're safe and effective.,googlenews,2020-10-28 09:09:59
COVID-19 vaccine distribution should consider both demand and supply | TheHill,googlenews,2020-10-28 09:09:59
"Pfizer's late-stage coronavirus vaccine trial is near complete enrollment with 42,000 volunteers",googlenews,2020-10-28 09:09:59
Historic vaccine race meets harsh reality,googlenews,2020-10-28 09:09:59
Microsoft dips on weak revenue guidance,googlenews,2020-10-28 09:09:59
"Microsoft earnings easily top expectations, but forecast for Xbox's debut quarter dings stock",googlenews,2020-10-28 09:09:59
"Caterpillar, Pfizer, 3M Earnings Come In Better Than Expected, With Microsoft Straight Ahead",googlenews,2020-10-28 09:09:59
"Full Day Ahead: Pharma Earnings, AMD Acquisition in Spotlight Early, with Microsoft After Close",googlenews,2020-10-28 09:09:59
"SpaceX prices Starlink satellite internet service at $99 per month, according to e-mail",googlenews,2020-10-28 09:09:59
SpaceX Starlink public beta begins: It’s $99 a month plus $500 up front,googlenews,2020-10-28 09:09:59
Elon Musk to give away free SpaceX Starlink internet access to rural TX families,googlenews,2020-10-28 09:09:59
SpaceX Starlink: email details price and speeds for beta test,googlenews,2020-10-28 09:09:59
Bugatti unveils a super light hypercar that can top 300 miles an hour,googlenews,2020-10-28 09:09:59
"1,824 HP Bugatti Bolide Track Monster Is The Chiron’s Wet Dream",googlenews,2020-10-28 09:09:59
World Premiere: BUGATTI Bolide,googlenews,2020-10-28 09:09:59
"The 1240kg, Track-Only Bugatti Bolide Has An 1825bhp Chiron Engine",googlenews,2020-10-28 09:09:59
Bitcoin fees spike 198% but Ethereum still more profitable,googlenews,2020-10-28 09:09:59
Crypto lender BlockFi now holds over 5% of Grayscale's Bitcoin Trust shares,googlenews,2020-10-28 09:09:59
"If Bitcoin Passes $14K, Analysts Say Traders 'Should Look to $20,000' Instead of Looking Back | Market Updates",googlenews,2020-10-28 09:09:59
"More Than Half of US Investors Interested in Bitcoin, Grayscale Survey Finds - CoinDesk",googlenews,2020-10-28 09:09:59
UPDATE: Bed Bath & Beyond unveils 3-year transformation plan and resumes share buybacks,googlenews,2020-10-28 09:09:59
AMD is buying a rival chipmaker for $35 billion,googlenews,2020-10-28 09:09:59
Nasdaq Defies Downturn as AMD Buys Xilinx,googlenews,2020-10-28 09:09:59
AMD Is Officially Leaving Intel in the Dust,googlenews,2020-10-28 09:09:59
Cramer reacts to AMD-Xilinx tie-up: 'I think the stock's a steal',googlenews,2020-10-28 09:09:59
McDonald's new pastries are here. Here's how to get them for free,googlenews,2020-10-28 09:09:59
How You Can Get McDonald's New Menu Items For Free,googlenews,2020-10-28 09:09:59
McDonald’s money saving tips: How to get 50% off food plus free hot drinks this week,googlenews,2020-10-28 09:09:59
"How to get a free cup of coffee, tea or hot chocolate at McDonald’s",googlenews,2020-10-28 09:09:59
Panera Is Adding Pizza to Its Menu for the First Time Ever,googlenews,2020-10-28 09:09:59
Brands competing for larger slices of the pandemic pizza boom,googlenews,2020-10-28 09:09:59
Panera Is Rolling Out an Entire Menu of Flatbread Pizzas for Fall,googlenews,2020-10-28 09:09:59
Mercedes And Aston Martin Are Getting More Serious,googlenews,2020-10-28 09:09:59
Aston Martin: Mercedes to take 20% stake in luxury brand,googlenews,2020-10-28 09:09:59
Aston Martin to Gain Tech from Closer Mercedes-Benz Ties,googlenews,2020-10-28 09:09:59
Stroll: Mercedes shareholding “transformational” for Aston Martin,googlenews,2020-10-28 09:09:59
"Sony raises full-year profit outlook after record second quarter on strong gaming, 'Demon Slayer'",googlenews,2020-10-28 09:09:59
Sony's 1H net profit doubles as gaming thrives under COVID,googlenews,2020-10-28 09:09:59
Sony’s new PlayStation is making Japan cross,googlenews,2020-10-28 09:09:59
"Sony Pictures Records $299M Profit In Q2, Off 18% From 2019",googlenews,2020-10-28 09:09:59
Dicamba Approved for Over-the-Top Use 2021 and Beyond,googlenews,2020-10-28 09:09:59
EPA approves dicamba for over-the-top use for next 5 years,googlenews,2020-10-28 09:09:59
EPA reapproves use of pesticide previously struck down in court | TheHill,googlenews,2020-10-28 09:09:59
EPA clears popular weed killer used by cotton farmers,googlenews,2020-10-28 09:09:59
U Spy U.S.-Spec 2021 Mercedes-Benz S-Class In California,googlenews,2020-10-28 09:09:59
Mercedes-Benz May Be Working On A Dedicated Electric Sports Cars,googlenews,2020-10-28 09:09:59
2021 Mercedes-Benz S-Class Advances the High-Tech Luxury Sedan,googlenews,2020-10-28 09:09:59
New Mercedes S-Class 2020 review,googlenews,2020-10-28 09:09:59
"European Equities: US Economic Data, US Politics, and COVID-19 in Focus",googlenews,2020-10-28 09:09:59
AUD/NZD sits mid 1.06 range in early Asia as NZ returns,googlenews,2020-10-28 09:09:59
"As markets gyrate over second-wave fears, here are 2 consumer staple stocks to ride for the long run, from Barclays",googlenews,2020-10-28 09:09:59
"'Orderly' Trump win most favourable outcome for equities, JPMorgan says",googlenews,2020-10-28 09:09:59
Callaway Golf to Buy Rest of Topgolf Entertainment,googlenews,2020-10-28 09:09:59
Callaway Golf just acquired all of Topgolf in an appeal to millennial customers - Business Insider,googlenews,2020-10-28 09:09:59
Callaway bullish on its merger with Topgolf,googlenews,2020-10-28 09:09:59
Blockbuster deal: Callaway announces merger with Topgolf,googlenews,2020-10-28 09:09:59
How Trump Maneuvered His Way Out of Trouble in Chicago,googlenews,2020-10-28 09:09:59
Trump's $1.1BILLION debt mountain: How the President owes huge sums linked to his real estate,googlenews,2020-10-28 09:09:59
Trump’s lenders forgave hundreds of millions in debt — but he paid virtually no taxes on it: NYT,googlenews,2020-10-28 09:09:59
This is what the new Burger King and Popeyes drive-thrus will look like,googlenews,2020-10-28 09:09:59
"Burger King, Tim Hortons, and Popeyes are giving their drive-thrus a modern update",googlenews,2020-10-28 09:09:59
Tim Hortons hoping to battle fall back blues with free coffee,googlenews,2020-10-28 09:09:59
Here's why 10000 Burger King drive-thrus are going digital,googlenews,2020-10-28 09:09:59
Refis lead the way as mortgage applications rise 1.7%,googlenews,2020-10-28 09:09:59
"Japan added to state's pre-travel testing program, but Japan still has it's own restrictions",googlenews,2020-10-28 09:09:59
Flights from Japan to Hawaii resume Nov. 6 with start of international pre-arrivals testing program,googlenews,2020-10-28 09:09:59
Travel from Japan to Hawai‘i Begins Nov. 6 with Pre-Travel Testing Program,googlenews,2020-10-28 09:09:59
Gov Ige gives updates on pre-travel testing program with Japan,googlenews,2020-10-28 09:09:59
Oil falls 4% as rise in U.S. crude stocks fans oversupply fears,googlenews,2020-10-28 09:09:59
Oil Price Fundamental Daily Forecast – Oversupply Fears Fanned by Bearish API Report; EIA on Tap,googlenews,2020-10-28 09:09:59
Venezuela's Oil Industry Could Take Decades To Recover,googlenews,2020-10-28 09:09:59
Here’s the Latest on the Resurgence of Libya’s Oil Industry,googlenews,2020-10-28 09:09:59
Warren Buffett has this advice for investing in a volatile market: Dollar-cost averaging,googlenews,2020-10-28 09:09:59
Stock market crash: I’d listen to Warren Buffett and buy these 2 UK shares for my ISA to get rich,googlenews,2020-10-28 09:09:59
"Got $2,000? 3 Buffett Stocks That Are Screaming Buys",googlenews,2020-10-28 09:09:59
Barrick Gold: What To Expect Next,googlenews,2020-10-28 09:09:59
Deloitte: Medicare Advantage plans that don't embrace telehealth 'will get left behind',googlenews,2020-10-28 09:09:59
Open enrollment begins Sunday. Now is the time to explore the plans.,googlenews,2020-10-28 09:09:59
"Jack Ma is making history again with the Ant IPO, and getting even more wealthy while doing it",googlenews,2020-10-28 09:09:59
Ant Group's History Making IPO Creates BABA Opportunity,googlenews,2020-10-28 09:09:59
The Pessimist’s Guide to Jack Ma’s Record-Breaking Ant Group IPO,googlenews,2020-10-28 09:09:59
Here's why Ant Group is about to shatter IPO records,googlenews,2020-10-28 09:09:59
T-Mobile’s TVision is a cable-cutting package for its mobile customers,googlenews,2020-10-28 09:09:59
Announcing TVision: New TV & Streaming Services from T-Mobile,googlenews,2020-10-28 09:09:59
"T-Mobile announces TVision live TV service starting at $10/month, Apple TV+ and Apple TV 4K promos",googlenews,2020-10-28 09:09:59
"T-Mobile launches new TVision streaming bundles, pricing starts at $10 per month",googlenews,2020-10-28 09:09:59
"Raytheon laying off 20,000 amid commercial aviation slide",googlenews,2020-10-28 09:09:59
Raytheon Stock Sinks As Raytheon Earnings Beat But Sales Plunge 34% In Key Aviation Units,googlenews,2020-10-28 09:09:59
Even This Former Elevator Maker Needs Fewer Floors,googlenews,2020-10-28 09:09:59
Raytheon -7% as defense weakness adds to commercial aerospace woes,googlenews,2020-10-28 09:09:59
Fiverr Announces Third Quarter 2020 Results,googlenews,2020-10-28 09:09:59
"South Plains Financial, Inc. (SPFI) Q3 2020 Earnings Call Transcript",googlenews,2020-10-28 09:09:59
Amalgamated Bank Reports Third Quarter 2020 Financial Results,googlenews,2020-10-28 09:09:59
Fiserv Reports Third Quarter 2020 Results,googlenews,2020-10-28 09:09:59
Amazon Seeking To Hire 1000 Seasonal Workers In Minnesota,googlenews,2020-10-28 09:09:59
"Amazon is hiring 100,000 seasonal staff for the holidays",googlenews,2020-10-28 09:09:59
Amazon looking to hire 1300 workers in SC,googlenews,2020-10-28 09:09:59
"Amazon to hire 100,000 workers for seasonal surge",googlenews,2020-10-28 09:09:59
"Over 4,400 pounds of Trader Joe's fish have been recalled",googlenews,2020-10-28 09:09:59
Trader Joe's has recalled over 4400 pounds of frozen fish,googlenews,2020-10-28 09:09:59
Allergy risk recall: Trader Joe’s gluten-free battered halibut,googlenews,2020-10-28 09:09:59
Sealaska-owned company faces Trader Joe's halibut recall,googlenews,2020-10-28 09:09:59
"Refi Rates Today, October 28, 2020 | Rates drop",googlenews,2020-10-28 09:09:59
"VA loans: How do they work, and who is eligible?",googlenews,2020-10-28 09:09:59
Home equity is surging — here's why now is a 'great time' to refinance,googlenews,2020-10-28 09:09:59
"Mortgage and Refinance Rates for October 28, 2020 | Closely watched rate slides",googlenews,2020-10-28 09:09:59
Low risk or dicey? Two new reports paint different pictures of COVID-19 danger while flying,googlenews,2020-10-28 09:09:59
"Airplane COVID-19 risk 'very low' with masks, other actions, report finds - The Jakarta Post",googlenews,2020-10-28 09:09:59
Harvard study: Air travel presents lower COVID-19 risk than shopping and dining out,googlenews,2020-10-28 09:09:59
Harvard Says Flying Is Safer Than Visiting The Grocery Store,googlenews,2020-10-28 09:09:59
"Exact Sciences buying 2 blood-based cancer screening firms for $2.56B, selling $869M in new stock",googlenews,2020-10-28 09:09:59
Exact Sciences Surges on $2.5 Billion Deal to Buy Thrive,googlenews,2020-10-28 09:09:59
"Sell-siders weigh in on Exact Sciences after Q3 report, announced acquisitions",googlenews,2020-10-28 09:09:59
Why Exact Sciences' $2.15 Billion Deal Has Investors Excited About Cancer-Screening Technology,googlenews,2020-10-28 09:09:59
Pai’s FCC squeezes in one more vote against net neutrality before election,googlenews,2020-10-28 09:09:59
U.S. FCC votes to maintain 2017 repeal of net neutrality rules,googlenews,2020-10-28 09:09:59
FCC reaffirms order rolling back net neutrality regulations | TheHill,googlenews,2020-10-28 09:09:59
The future of net neutrality will be determined next week,googlenews,2020-10-28 09:09:59
TikTok partners with Shopify on social commerce,googlenews,2020-10-28 09:09:59
Shopify to partner with TikTok in bid to woo more merchants to site,googlenews,2020-10-28 09:09:59
Shopify sellers can now boost their businesses more easily on TikTok - Business Insider,googlenews,2020-10-28 09:09:59
TikTok moves into social ecommerce with Shopify deal,googlenews,2020-10-28 09:09:59
A look at Circa ahead of its midnight grand opening,googlenews,2020-10-28 09:09:59
ONLY ON 8: Family of bicyclist killed during an attack Sunday morning in the east valley speaks for first time,googlenews,2020-10-28 09:09:59
PROPERTY PREVIEW: Inside Circa hotel-casino in downtown Las Vegas ahead of grand opening,googlenews,2020-10-28 09:09:59
Neighbors welcome Circa to downtown,googlenews,2020-10-28 09:09:59
GM Defense delivers its first Infantry Squad Vehicles to U.S. Army,googlenews,2020-10-28 09:09:59
Soldiers are about to get a brand new infantry assault buggy to play with,googlenews,2020-10-28 09:09:59
Infantry Squad Vehicle Off-Road | GM Defense,googlenews,2020-10-28 09:09:59
GM delivers first Chevy Colorado ZR2-based infantry vehicles to US Army,googlenews,2020-10-28 09:09:59
Dunkin' deal? How a metro Atlanta fast-food giant keeps feasting,googlenews,2020-10-28 09:09:59
