headline,org,date
"Jhonsa: Business Is Still Good for Skyworks, Cirrus and Other Mobile Chip Suppliers",thestreet,2020-11-04 09:19:07
How to Trade Qualcomm After It Reports Earnings,thestreet,2020-11-04 09:19:07
Hilton Books Better-Than-Expected Third-Quarter Earnings,thestreet,2020-11-04 09:19:07
Healthcare and Drug Stocks In Focus Amid Election Dead Heat,thestreet,2020-11-04 09:19:07
Why Jim Cramer Likes Marvell's Inphi Acquisition,thestreet,2020-11-04 09:19:07
Jim Cramer's Thoughts on AMD and Xilinx,thestreet,2020-11-04 09:19:07
Apple Earnings Preview: Jim Cramer's Game Plan,thestreet,2020-11-04 09:19:07
Tesla Cybertruck Final Range Rumors,thestreet,2020-11-04 09:19:07
How Farfetch Beat Amazon at Luxury E-Commerce,thestreet,2020-11-04 09:19:07
Apple’s Stock Performance After Elections: A Surprising Conclusion,thestreet,2020-11-04 09:19:07
Diversification Key In Investing in Vaccine Race: Expert,thestreet,2020-11-04 09:19:07
Covid Stocks: Where Are the Winners in the 'New Normal?',thestreet,2020-11-04 09:19:07
Is PPE an Investing Opportunity Amid Race to Vaccine?,thestreet,2020-11-04 09:19:07
Do QCDs Still Make Sense in 2020?,thestreet,2020-11-04 09:19:07
Advisers: Explaining Fee-Only Compensation,thestreet,2020-11-04 09:19:07
Financial Advisers Still Need to Keep a Sharp Eye on Inflation,thestreet,2020-11-04 09:19:07
"Jim Cramer: If You Don't Know What's Going to Happen, Don't Buy",thestreet,2020-11-04 09:19:07
Why Jim Cramer Is Tempted to Do Some Selling Election Day,thestreet,2020-11-04 09:19:07
Jim Cramer Says Buy Healthcare Stocks No Matter Election Winner,thestreet,2020-11-04 09:19:07
Pandemic Spruces Up Wayfair Third-Quarter Earnings,thestreet,2020-11-04 09:19:07
Politics and Your Portfolio: Tuning Out the Noise,thestreet,2020-11-04 09:19:07
Presidential Elections and the Market: What History Tells Investors,thestreet,2020-11-04 09:19:07
Why Haven’t Small-Value Stocks Led Yet?,thestreet,2020-11-04 09:19:07
"How Presidential Election Impacts Stocks, Economy: Tips for Investors",thestreet,2020-11-04 09:19:07
The Stock Market and Economy: Still Separate,thestreet,2020-11-04 09:19:07
Morning Bell With Jim Cramer: Buy Alibaba Stock,thestreet,2020-11-04 09:19:07
"Draft Kings, Penn National Surge on Sports-Betting Approvals",thestreet,2020-11-04 09:19:07
Wendy's Falls on Q3 Revenue Miss,thestreet,2020-11-04 09:19:07
"Patience, Election Results, Your Money: Investing Advice LIVE",thestreet,2020-11-04 09:19:07
AMD Higher as Goldman Upgrades to Buy on Valuation,thestreet,2020-11-04 09:19:07
"ADP Reports Sees 365,000 Private Sector Job Gains in October; Non-Farm Payrolls in Focus Friday",thestreet,2020-11-04 09:19:07
New Investors: Get Ready for These Four Tax Hits,thestreet,2020-11-04 09:19:07
New Investors: Get Ready for These Four Tax Hits,thestreet,2020-11-04 09:19:07
Key Dates for Healthcare Reform,thestreet,2020-11-04 09:19:07
Everything You Need to Know About Filing Taxes on Winnings,thestreet,2020-11-04 09:19:07
Six Low-Cost Bathroom Upgrades You Can Do Yourself,thestreet,2020-11-04 09:19:07
"Uber, Lyft Shares Surge As California Passes Ballot Initiative on Driver and Delivery Worker Independence",thestreet,2020-11-04 09:19:07
Futures Seesaw as Election Heads Into Overtime,thestreet,2020-11-04 09:19:07
Bizarrely Bullish: Cramer's 'Mad Money' Recap (Tuesday 11/3/20),thestreet,2020-11-04 09:19:07
FAANG Stocks Among Leading Gainers On Election Day,thestreet,2020-11-04 09:19:07
"Arista Networks, Telenav: 5 Top Stock Gainers for Tuesday",thestreet,2020-11-04 09:19:07
Dow Jumps 550 Points and Stocks Extend Rally on Election Day,thestreet,2020-11-04 09:19:07
YRC Narrows 3rd-Quarter Loss; CFO Resigns,thestreet,2020-11-04 09:19:07
"Walmart, Comcast in Talks to Develop Smart TVs; Roku Slides",thestreet,2020-11-04 09:19:07
Jim Cramer: Recognize That the Government Does Not Do a Lot to Impact Stocks,thestreet,2020-11-04 09:19:07
"Gartner Shares Up as Profit Beats, Guidance Is Raised",thestreet,2020-11-04 09:19:07
"Uber, Lyft Rise Amid Optimism for California Labor-Law Proposal",thestreet,2020-11-04 09:19:07
"Jim Cramer: If You Don't Know What's Going to Happen, Don't Buy",thestreet,2020-11-04 09:19:07
New Investors: Get Ready for These Four Tax Hits,thestreet,2020-11-04 09:19:07
Elections 2020: Stock futures whipsawed as election outcome hangs in balance,googlenews,2020-11-04 09:21:22
Global Industrial Hemp Market 2020-2024: Post-Pandemic Industry Planning Structure of the Industrial Hemp Market | Technavio,googlenews,2020-11-04 09:21:22
"Private payroll growth slows in October, well below expectations",googlenews,2020-11-04 09:21:22
"Nearly $1 billion worth of bitcoin linked to Silk Road black market is on the move, analysis shows",googlenews,2020-11-04 09:21:22
Use your 'I Voted' sticker for deals in the St. Louis area,googlenews,2020-11-04 09:21:22
Wall Street got the election night it feared the most,googlenews,2020-11-04 09:21:22
Why the front bench seat disappeared from cars and may be staged for a comeback in EVs,googlenews,2020-11-04 09:21:22
Jack Ma Loses $3B In A Day After Alibaba's Stock Crash,googlenews,2020-11-04 09:21:22
Cannabis stocks fall as a failed Democratic sweep offsets state referendum wins,googlenews,2020-11-04 09:21:22
Trump Promised a Vaccine by Election Day—None Have Even Applied for Approval,googlenews,2020-11-04 09:21:22
Stock markets wobble on uncertainty in US election,googlenews,2020-11-04 09:21:22
World hedges its bets as America keeps counting its votes,googlenews,2020-11-04 09:21:22
Comcast and Walmart might make smart TVs together,googlenews,2020-11-04 09:21:22
"Dollar climbs, China's yuan, Mexican peso dives as US presidential race too close to call",googlenews,2020-11-04 09:21:22
What Markets Are Telling Us as Election Results Roll In,googlenews,2020-11-04 09:21:22
Nebraska voters saddle up a winner in allowing casino games at racetracks,googlenews,2020-11-04 09:21:22
Tesla Full Self-Driving Beta appears to detect and avoid road debris in video,googlenews,2020-11-04 09:21:22
"Natural Gas Price Fundamental Daily Forecast - Too Many Longs, Bearish Weather Shift Driving Out Weak Bulls",googlenews,2020-11-04 09:21:22
Rise In COVID Cases May Force OPEC To Do The Unthinkable,googlenews,2020-11-04 09:21:22
"Jumbo and FHA mortgage rates set record lows, juicing refinance demand",googlenews,2020-11-04 09:21:22
Land ho! Cruise industry scraps 2020 restart amid COVID surge,googlenews,2020-11-04 09:21:22
"Markets react: what gold, stock prices say about election outcome",googlenews,2020-11-04 09:21:22
"Bitcoin, stocks drop as markets uncertain about US election result",googlenews,2020-11-04 09:21:22
Here's Why Alibaba Shares Sold Off Today,googlenews,2020-11-04 09:21:22
Target Black Friday Deals 2020: Everything You Need To Know,googlenews,2020-11-04 09:21:22
Forget Washington and Jump on These 3 Must-Own Stock Buys,googlenews,2020-11-04 09:21:22
"Stocks making the biggest moves in the premarket: Hilton, Scotts Miracle-Gro, Wendy's & more",googlenews,2020-11-04 09:21:22
Nearly $1B in Bitcoin Moves From Wallet Linked to Silk Road,googlenews,2020-11-04 09:21:22
CherryVale Mall owner files for bankruptcy,googlenews,2020-11-04 09:21:22
5 things to know before the stock market opens Wednesday,googlenews,2020-11-04 09:21:22
"Mega Millions lottery: Did you win Tuesday’s $129M Mega Millions drawing? Results, winning numbers (11/3/2020)",googlenews,2020-11-04 09:21:22
"Owner of East Towne, West Towne malls files for bankruptcy protection amid COVID-19 pandemic",googlenews,2020-11-04 09:21:22
U.S. FDA warns about false positive results from COVID-19 antigen tests,googlenews,2020-11-04 09:21:22
Waymo pulling cars from San Francisco streets fearing election unrest,googlenews,2020-11-04 09:21:22
Stocks rally again worldwide as Election Day finally arrives,googlenews,2020-11-04 09:21:22
"5 at 5: Your Daily Digest for Real Estate Investing, 11/3/2020",googlenews,2020-11-04 09:21:22
"SEC Changes Rules, Making Fundraising Easier for Crypto Firms | Regulation",googlenews,2020-11-04 09:21:22
Walmart lays off shelf-scanning robots for humans,googlenews,2020-11-04 09:21:22
PPP loan forgiveness has barely gotten started. Here's what D.C.-area banks are doing.,googlenews,2020-11-04 09:21:22
Gold Price Forecast: Gold Threatens Election-Night Breakout,googlenews,2020-11-04 09:21:22
Ford Had A Tough Time Convincing Chairman Bill Ford To Give Back Prototype Mustang Mach-E,googlenews,2020-11-04 09:21:22
Southwest flight deplanes at Nashville airport after passenger refuses to wear face mask,googlenews,2020-11-04 09:21:22
2022 Volkswagen Golf R Revealed As The Most Powerful Golf Ever,googlenews,2020-11-04 09:21:22
Bizarrely Bullish: Cramer's 'Mad Money' Recap (Tuesday 11/3/20),googlenews,2020-11-04 09:21:22
Fox News’ Ultimate Boss Suggests News Ratings May Fall Post-Election,googlenews,2020-11-04 09:21:22
Here’s What Some Market Watchers Are Saying About the Election,googlenews,2020-11-04 09:21:22
"COVID-19 updates: 657 new cases, 22 new deaths reported",googlenews,2020-11-04 09:21:22
Ferrari Says It'll Never Go 100 Percent Electric,googlenews,2020-11-04 09:21:22
"Aramco Sticks by $18.75 Billion Dividend, Despite Sharp Fall in Profit",googlenews,2020-11-04 09:21:22
Two Senior Lyft Execs Depart on Eve of California Ballot Showdown,googlenews,2020-11-04 09:21:22
AT&T reportedly considers selling big minority stake in DirecTV,googlenews,2020-11-04 09:21:22
IRS offers new relief options to help with tax bills during coronavirus pandemic,googlenews,2020-11-04 09:21:22
Thanksgiving Options for Dine-In or Takeout in San Diego,googlenews,2020-11-04 09:21:22
"Want $50,000 in Retirement Income? Here's How to Get It.",googlenews,2020-11-04 09:21:22
Type 2 diabetes drug recalled over concerns medication contaminated with possible carcinogen,googlenews,2020-11-04 09:21:22
57% of Medicare Enrollees Make This Dangerous Mistake,googlenews,2020-11-04 09:21:22
JPMorgan warns of another potential regulatory fine tied to weak 'internal controls’ at bank,googlenews,2020-11-04 09:21:22
U.S. election brings win-lose scenarios to the oil and energy sector,googlenews,2020-11-04 09:21:22
Park MGM hotel to close midweek for holiday season,googlenews,2020-11-04 09:21:22
Australian senator says blockchain can make financial compliance easier,googlenews,2020-11-04 09:21:22
California company buys Ann Arbor’s LLamasoft for $1.5B,googlenews,2020-11-04 09:21:22
Over 450 new COVID-19 cases as El Paso County exceeds Stay At Home threshold,googlenews,2020-11-04 09:21:22
San Marcos-based Grande Communications sold as part of $8.1B deal,googlenews,2020-11-04 09:21:22
SpaceX Starlink: Elon Musk details timeline for next stages,googlenews,2020-11-04 09:21:22
U.S. manufacturing near two-year high in October,googlenews,2020-11-04 09:21:22
"3 Big Things Today, November 3, 2020",googlenews,2020-11-04 09:21:22
You'll Want These ETFs in Your Portfolio if the Stock Market Crashes,googlenews,2020-11-04 09:21:22
"The McRib is coming back, baby",googlenews,2020-11-04 09:21:22
2021 BMW iX3 review – the world's best electric SUV? | What Car?,googlenews,2020-11-04 09:21:22
"Bayer takes $10 billion writedown, flags higher Roundup settlement bill",googlenews,2020-11-04 09:21:22
Stock market predicts Trump will defeat Biden,googlenews,2020-11-04 09:21:22
S&P 500 futures dip after early Florida vote results,googlenews,2020-11-04 09:21:22
"Dollar rise, U.S. and Europe futures fall as Trump-Biden presidential race too close",googlenews,2020-11-04 09:21:22
Dow soars by 600 points as investors bet on clear election winner and swift passing of stimulus bill,googlenews,2020-11-04 09:21:22
"Private payrolls grew by 365,000 in October as labor market recovery decelerates: ADP",googlenews,2020-11-04 09:21:22
"US companies added 365,000 jobs in October, missing economist estimates, ADP says - Business Insider",googlenews,2020-11-04 09:21:22
"US private employers add 365,000 jobs in October, missing expectations",googlenews,2020-11-04 09:21:22
"ADP Reports Sees 365,000 Private Sector Job Gains in October; Non-Farm Payrolls in Focus Friday",googlenews,2020-11-04 09:21:22
"Where to get free food on Election Day: Krispy Kreme, McDonald's, more",googlenews,2020-11-04 09:21:22
Election Day Freebies and Deals,googlenews,2020-11-04 09:21:22
"Krispy Kreme, McDonald's, and more fast-food giants are giving away food on Election Day - Business Insider",googlenews,2020-11-04 09:21:22
"Stress-eating through Election Day? Grab freebies from McDonald’s, Wendy’s and Krispy Kreme",googlenews,2020-11-04 09:21:22
Elections 2020: Wall Street's red-hot 'blue wave' trade unravels as election outcome hangs in balance,googlenews,2020-11-04 09:21:22
Stock Markets Confront an Uncertain Election Outcome,googlenews,2020-11-04 09:21:22
Dow logs best day since July as Wall Street doubles down on its Joe Biden bet,googlenews,2020-11-04 09:21:22
Stocks post early gains as Wall Street parses 2020 election,googlenews,2020-11-04 09:21:22
The FDA's cutoff for Covid-19 vaccine effectiveness is 50 percent. What does that mean?,googlenews,2020-11-04 09:21:22
Is Novavax Stock a Buy?,googlenews,2020-11-04 09:21:22
‘Vaccine tourism’ could see Americans flying out to get Covid shot early,googlenews,2020-11-04 09:21:22
Early Covid-19 vaccine hopes have a math problem,googlenews,2020-11-04 09:21:22
US election results catch investors off guard as 'blue wave' trade unravels,googlenews,2020-11-04 09:21:22
LIVE: Joe Biden makes election night statement,googlenews,2020-11-04 09:21:22
Global investors keep powder dry as US election gets tight By Reuters,googlenews,2020-11-04 09:21:22
What a Biden Presidency Would Mean for the Middle East,googlenews,2020-11-04 09:21:22
"Investors brace for close US election result, long count",googlenews,2020-11-04 09:21:22
North American stock markets rise on hopes of decisive U.S. election result,googlenews,2020-11-04 09:21:22
Who is winning the U.S. presidential election?,googlenews,2020-11-04 09:21:22
Delaware Voter Surveys: How Different Groups Voted,googlenews,2020-11-04 09:21:22
"Walmart are Comcast are in talks to manufacture smart TVs, Crude oil on a 2-day-surge",googlenews,2020-11-04 09:21:22
"Comcast, Walmart in Talks to Develop and Distribute Smart TVs",googlenews,2020-11-04 09:21:22
Walmart and Comcast could join forces to take on Roku and Amazon smart TVs,googlenews,2020-11-04 09:21:22
"Comcast, Walmart Could Be Working on Smart TVs Together Soon",googlenews,2020-11-04 09:21:22
10-year Treasury yield drops to 2-week low as election results show no clear winner,googlenews,2020-11-04 09:21:22
Stock markets gripped by US election race – business live,googlenews,2020-11-04 09:21:22
"Gold Shoots Back Above $1900 on U.S. Election Uncertainty, Covid",googlenews,2020-11-04 09:21:22
Finance executives fret as US presidential election too close to call,googlenews,2020-11-04 09:21:22
"Election 2020 results: Nebraskans vote in favor of gambling initiatives, payday lending caps; against slavery",googlenews,2020-11-04 09:21:22
Casino gambling push reaches the finish line in Nebraska; horse racing industry celebrates,googlenews,2020-11-04 09:21:22
Casino gambling will be coming to Fonner Park,googlenews,2020-11-04 09:21:22
Gambling Stocks Rise As More States Legalize Sports Betting,googlenews,2020-11-04 09:21:22
Elon Musk says Tesla was 'about a month' from bankruptcy during Model 3 ramp,googlenews,2020-11-04 09:21:22
Elon Musk Provides Update on Giga Texas With Praise,googlenews,2020-11-04 09:21:22
Musk says new Tesla Cybertruck is coming 'soon',googlenews,2020-11-04 09:21:22
"Tesla projected to create 15,000 jobs at Giga Texas, exceeding estimates",googlenews,2020-11-04 09:21:22
Bearish Near-Term Weather Outlook Is Capping Natural Gas Upside,googlenews,2020-11-04 09:21:22
Cold Weather Thaws Natural-Gas Prices,googlenews,2020-11-04 09:21:22
More Warm Trends Keep Pressure on Natural Gas Futures Early,googlenews,2020-11-04 09:21:22
France rejects America's natural gas over climate change,googlenews,2020-11-04 09:21:22
OPEC and Russia study deeper oil cuts - two sources,googlenews,2020-11-04 09:21:22
"Oil Pushes up on U.S. Inventory Drop, Supply Restrictions",googlenews,2020-11-04 09:21:22
Oil Prices Soar On Major Crude Draw,googlenews,2020-11-04 09:21:22
Oil rises after Trump falsely claims victory in tight U.S. election,googlenews,2020-11-04 09:21:22
"Here Are Today's Best Mortgage & Refinance Rates for November 4, 2020",googlenews,2020-11-04 09:21:22
"30-Year Mortgage Rates for November 3, 2020 | Rates move upward",googlenews,2020-11-04 09:21:22
"Today's best mortgage and refinance rates: Wed, Nov 4, 2020 | Rates shift",googlenews,2020-11-04 09:21:22
3 reasons to refinance into a 15-year mortgage right now,googlenews,2020-11-04 09:21:22
US cruise lines cancel sailings through at least end of 2020,googlenews,2020-11-04 09:21:22
Disney joins major cruise lines extending travel cancelations,googlenews,2020-11-04 09:21:22
Royal Caribbean Group CEO speaks on CDC allowing cruise ships to conditionally sail again,googlenews,2020-11-04 09:21:22
"Cruising won’t resume in U.S. waters until 2021, with lines renewing a voluntary suspension",googlenews,2020-11-04 09:21:22
Nearly $1 billion in bitcoin from the fourth-largest wallet just moved,googlenews,2020-11-04 09:21:22
Bitcoin Volatility Expected to Rise After the US Presidential Election,googlenews,2020-11-04 09:21:22
Bitcoin Briefly Breaks $14000 as US Election Too Close to Call,googlenews,2020-11-04 09:21:22
"Bitcoin Just Rocketed Over $14,000—Here’s Why",googlenews,2020-11-04 09:21:22
Would-be Ant investors fear they'll be left holding the bag,googlenews,2020-11-04 09:21:22
"After halting Ant’s big IPO, China reportedly wants to go further",googlenews,2020-11-04 09:21:22
OP-ED: What's behind the biggest IPO of all time?,googlenews,2020-11-04 09:21:22
Why SolarEdge Technologies Stock Is Trading Lower Today,googlenews,2020-11-04 09:21:22
"The best early Black Friday deals from Amazon, Best Buy, Home Depot, Walmart, and more - Business Insider",googlenews,2020-11-04 09:21:22
The Best Deals From Walmart’s Early Black Friday Sale,googlenews,2020-11-04 09:21:22
When is Black Friday 2020 and where are the best UK deals?,googlenews,2020-11-04 09:21:22
The Skullcandy Sesh Evo are the best true wireless earbuds you'll find on sale for under $25,googlenews,2020-11-04 09:21:22
"Democrat Or Republican, These 3 Stocks Will Be Winners Either Way",googlenews,2020-11-04 09:21:22
"Amazon upgraded at China Renaissance after recent pullback on e-commerce, AWS strength",googlenews,2020-11-04 09:21:22
$1B of Bitcoin from Silk Road wallet moves for first time since 2015,googlenews,2020-11-04 09:21:22
$1B Bitcoin Linked To FBI-Seized Darknet Market Silk Road Is On The Move After 5 Years: Report,googlenews,2020-11-04 09:21:22
Bitcoin Drops as Trump Threatens to Stop Vote Counting,googlenews,2020-11-04 09:21:22
Bitcoin whales tread water and hodl despite recent BTC price drop,googlenews,2020-11-04 09:21:22
These 2 Major Mall Chains Just Filed For Bankruptcy,googlenews,2020-11-04 09:21:22
"Crushed by virus, 2 mall operators, including operator of Brookfield Square, file for bankruptcy",googlenews,2020-11-04 09:21:22
Tennessee-based mall ownership company files Chapter 11 bankruptcy,googlenews,2020-11-04 09:21:22
Owner of CherryVale Mall files for bankruptcy,googlenews,2020-11-04 09:21:22
Virginia Voter Surveys: How Different Groups Voted,googlenews,2020-11-04 09:21:22
Two Bad Election Scenarios Come Back to Haunt Global Markets,googlenews,2020-11-04 09:21:22
Global investors keep powder dry as U.S. election gets tight,googlenews,2020-11-04 09:21:22
FTSE 100 rises in market turmoil as some predict Donald Trump victory but election still too close to call,googlenews,2020-11-04 09:21:22
Mega Millions results for 11/03/20; jackpot worth $129 million,googlenews,2020-11-04 09:21:22
"Mega Millions winning numbers for Tuesday, Nov. 3, 2020; jackpot $129 million",googlenews,2020-11-04 09:21:22
"Mega Millions winning numbers for Tuesday, Nov. 3",googlenews,2020-11-04 09:21:22
Mega Millions Winning Numbers Nov. 3; Estimated Jackpot Blooms To $129 Million,googlenews,2020-11-04 09:21:22
Don't get a false sense of security with Covid-19 testing. Here's why you can test negative but still be infected and contagious,googlenews,2020-11-04 09:21:22
Georgia adds antigen tests and ‘probable’ deaths to coronavirus dashboard,googlenews,2020-11-04 09:21:22
"Rapid coronavirus antigen tests may give false positives, FDA warns",googlenews,2020-11-04 09:21:22
Reporting on COVID-19 rapid antigen tests may skew a state’s overall total,googlenews,2020-11-04 09:21:22
Waymo moved its self-driving cars in San Francisco to a ‘secured location’ in case of election chaos,googlenews,2020-11-04 09:21:22
Waymo pulls self-driving cars in San Francisco as cities nationwide brace for unrest,googlenews,2020-11-04 09:21:22
Waymo Has Taken Its Self-Driving Fleet Off SF Streets Out of Concern For Post-Election Chaos,googlenews,2020-11-04 09:21:22
Waymo to temporarily suspend driving operations in San Francisco amid U.S. election,googlenews,2020-11-04 09:21:22
US STOCKS-Wall St rallies with Election Day underway,googlenews,2020-11-04 09:21:22
"Wall Street jumps on bets of Biden victory, stimulus hopes",googlenews,2020-11-04 09:21:22
Kudlow: Wall Street Executives Will Regret Backing Biden,googlenews,2020-11-04 09:21:22
Wall Street jumps 2% as Americans head to polls,googlenews,2020-11-04 09:21:22
SEC awards $28 million to whistleblower in latest blockbuster payment - Business Insider,googlenews,2020-11-04 09:21:22
SEC Expands Reg CF Fundraising Limits from $1.07M to $5M,googlenews,2020-11-04 09:21:22
SEC Makes It Easier for Crypto Startups to Raise Funds,googlenews,2020-11-04 09:21:22
SEC Extends Effort to Help Private Companies Raise Capital,googlenews,2020-11-04 09:21:22
Walmart Thinks Humans Work Harder - Fires All Robots? | IE,googlenews,2020-11-04 09:21:22
Walmart is reportedly giving up on shelf-scanning robots in favor of humans,googlenews,2020-11-04 09:21:22
The Times view on robot stocktakers: Are Friends Electric?,googlenews,2020-11-04 09:21:22
Walmart drops inventory-tracking robots after humans prove just as effective,googlenews,2020-11-04 09:21:22
COVID-19: New SBA Forms Asking Key Necessity and Liquidity Questions,googlenews,2020-11-04 09:21:22
"PPP Borrowers May Now Apply For $100,000+ Main Street Loans",googlenews,2020-11-04 09:21:22
Now is not the time to freeze small-business lending,googlenews,2020-11-04 09:21:22
SBA 7(a) lending across eastern Pennsylvania declines significantly for second straight year,googlenews,2020-11-04 09:21:22
"Price gains for gold, silver on safe-haven demand amid U.S. election jitters",googlenews,2020-11-04 09:21:22
Daily Gold News: Gold Price vs. U.S. Presidential Election,googlenews,2020-11-04 09:21:22
Gold futures post a second straight gain,googlenews,2020-11-04 09:21:22
Gold price hovering around $1900 as markets expect contested results,googlenews,2020-11-04 09:21:22
Ford Will Build Electric Cars That Real People Can Actually Afford,googlenews,2020-11-04 09:21:22
Ford Mustang Mach-E will have more intuitive and less complicated controls than a Tesla: CEO,googlenews,2020-11-04 09:21:22
Top Exec Says Ford Won't Make Super Duty Electric Pickup Truck – For Now,googlenews,2020-11-04 09:21:22
Ford Says Electric Super Duty Trucks Aren't Happening,googlenews,2020-11-04 09:21:22
Nashville flight evacuated after passenger refuses face mask,googlenews,2020-11-04 09:21:22
Nashville is getting more nonstop flights to Chicago O'Hare,googlenews,2020-11-04 09:21:22
Nashville International Airport passengers deplaned after woman refuses to wear mask,googlenews,2020-11-04 09:21:22
Wondering How to Fly Vegas for Cheap? Tips for Finding Cheap Flights,googlenews,2020-11-04 09:21:22
The premiere of the new Volkswagen Golf R 8,googlenews,2020-11-04 09:21:22
2022 Volkswagen Golf R breaks cover with 315 horsepower and torque vectoring,googlenews,2020-11-04 09:21:22
"2022 VW Golf R Has 315 HP, AWD with a Drift Mode, and a Manual",googlenews,2020-11-04 09:21:22
"315-horsepower 2022 Volkswagen Golf R brings more tech, more performance",googlenews,2020-11-04 09:21:22
Cramer says stocks will dip no matter who wins the election and 'you have to buy',googlenews,2020-11-04 09:21:22
Jim Cramer: The market thinks there will be a clear winner,googlenews,2020-11-04 09:21:22
Morning Bell With Jim Cramer: Buy Plug Power,googlenews,2020-11-04 09:21:22
Jim Cramer: Gold is flashing signs 'you want to see in a chart',googlenews,2020-11-04 09:21:22
Trump delivers remarks in the White House on election night,googlenews,2020-11-04 09:21:22
Fox Corp. Chief Lachlan Murdoch On Donald Trump Possibly Starting Fox News Rival: “We Love Competition”,googlenews,2020-11-04 09:21:22
The Real Reason Fox News Needs Trump to Win,googlenews,2020-11-04 09:21:22
Trump speaks at campaign headquarters on Election Day,googlenews,2020-11-04 09:21:22
"U.S. Futures Erase Loss as Treasuries, Dollar Jump: Markets Wrap",googlenews,2020-11-04 09:21:22
"Stocks Gain, Dollar Dips Ahead of Election Outcome: Markets Wrap",googlenews,2020-11-04 09:21:22
US stock futures edge up before election result,googlenews,2020-11-04 09:21:22
"US futures erase loss; Treasuries, dollar jump on still-undecided election",googlenews,2020-11-04 09:21:22
Pierce County reports fewer than 100 new COVID-19 cases on Tuesday,googlenews,2020-11-04 09:21:22
Pierce County starts week with more than 100 new COVID-19 cases,googlenews,2020-11-04 09:21:22
Spied! Check Out The Ferrari SF90 Stradale Spider,googlenews,2020-11-04 09:21:22
Ferrari LaFerrari Successor Might Have Been Spied For The First Time,googlenews,2020-11-04 09:21:22
Ferrari stock soars as CEO says company has no plans to go electric,googlenews,2020-11-04 09:21:22
High-power cars drive Ferrari earnings to top of guidance,googlenews,2020-11-04 09:21:22
