headline,org,date
"Stock futures rise as vaccine, M&A news draw focus; Oracle shares jump",yahoofinance,2020-09-14 07:58:52
Oracle beats Microsoft for TikTok US —but just partnership,yahoofinance,2020-09-14 07:58:52
Arm founder: $40bn sale of chipmaker to Nvidia 'disaster',yahoofinance,2020-09-14 07:58:52
Stock market's biggest bulls defend their St-high targets,yahoofinance,2020-09-14 07:58:52
"NFL player falsified pandemic loan applications, used proceeds to buy Dior, Gucci luxury goods: DOJ",yahoofinance,2020-09-14 07:58:52
"UBS doubles Tesla price target, stock stays neutral",yahoofinance,2020-09-14 07:58:52
"What you can learn from Bezos, Dalio and Hastings",yahoofinance,2020-09-14 07:58:52
Every investor has 'a silent partner' when trading stocks,yahoofinance,2020-09-14 07:58:52
"2.4% FIXED Mortgage Refi, No Hidden Fees/Points",yahoofinance,2020-09-14 07:58:52
Nikola fires off a detail rebuttal saying Hindenburg short-seller report was 'false and misleading',yahoofinance,2020-09-14 07:58:52
Billionaire David Tepper Picks Up These 2 “Strong Buy” Stocks,yahoofinance,2020-09-14 07:58:52
Liz Weston: Are Medicare Advantage plans worth the risk?,yahoofinance,2020-09-14 07:58:52
Tesla investors should be watching for M&A for S&P inclusion,yahoofinance,2020-09-14 07:58:52
2 Companies That Raised Their Dividends This Week,yahoofinance,2020-09-14 07:58:52
"Nvidia confirms $40B purchase of Arm, bringing together two chip giants",yahoofinance,2020-09-14 07:58:52
"U.S. Stock Futures Rise on Reports Related to Vaccines, Deals",yahoofinance,2020-09-14 07:58:52
"Stock market news live updates: Stock futures rise as vaccine, merger news draw focus; Oracle shares jump",yahoofinance,2020-09-14 07:58:52
AP EXPLAINS: Biden's sizable but not radical tax plans,yahoofinance,2020-09-14 07:58:52
"TikTok Picks Oracle, Nvidia Buys Arm, Gilead Buys Immunomedics - 5 Things You Must Know Monday",yahoofinance,2020-09-14 07:58:52
Citi Has a Message for Oil Bulls: $60 Oil to Return by 2021,yahoofinance,2020-09-14 07:58:52
The stock market’s biggest bulls defend their Street-high targets: Morning Brief,yahoofinance,2020-09-14 07:58:52
Analysts: 3 Tech Stocks to Buy on Weakness,yahoofinance,2020-09-14 07:58:52
Trim These Two Expenses if You Want to Fatten Your 401(k),yahoofinance,2020-09-14 07:58:52
iPhone Makers Among Winners in $6.6 Billion India Plan,yahoofinance,2020-09-14 07:58:52
"Goldman, Deutsche Say U.S. Stock Selloff May Be Close to an End",yahoofinance,2020-09-14 07:58:52
Bearish Bets: 2 Nasdaq Stocks You Should Consider Shorting This Week,yahoofinance,2020-09-14 07:58:52
Gilead Sciences Agrees $21 Billion Takeover Of Cancer Drug Specialist Immunomedics,yahoofinance,2020-09-14 07:58:52
5 Things You May Not Know About Apple Heading Into This Week's Event,yahoofinance,2020-09-14 07:58:52
"Is Amazon's $3,100 stock too pricey?  Then try index funds if you want to invest in the market",yahoofinance,2020-09-14 07:58:52
Gilead to buy cancer drugmaker Immunomedics for $21 billion,yahoofinance,2020-09-14 07:58:52
"Barron's Picks And Pans: Amazon, Crocs, GM, Microsoft And More",yahoofinance,2020-09-14 07:58:52
Cloud company Snowflake raises IPO price range to $100 to $110 vs. prior $75 to $85,yahoofinance,2020-09-14 07:58:52
"Cramer Advises Viewers On Applied Materials, Blackstone And More",yahoofinance,2020-09-14 07:58:52
Elon Musk's 2018 Compensation Plan May Hurt S&P 500 Inclusion,yahoofinance,2020-09-14 07:58:52
"Dow Jones Futures Rise But Stock Market Rally Livin' On The Edge; Nvidia-Arm, TikTok-Oracle Deals, Vaccine News In Focus",yahoofinance,2020-09-14 07:58:52
"Turkey Gets Unprecedented Downgrade, Crisis Warning From Moody’s",yahoofinance,2020-09-14 07:58:52
Why It's Unlikely Warren Buffett Is Actually Investing In Snowflake,yahoofinance,2020-09-14 07:58:52
Nikola’s History of Discrepancies Has Been in Plain Sight,yahoofinance,2020-09-14 07:58:52
IPO Outlook For The Week: Snowflake and Amwell Lead Busy 12 IPO Lineup,yahoofinance,2020-09-14 07:58:52
U.S Mortgage Rates Slide to Another Record Low Ahead of This Week’s FOMC,yahoofinance,2020-09-14 07:58:52
"When you want to retire but your partner doesn’t, money isn’t necessarily the real issue",yahoofinance,2020-09-14 07:58:52
"Gold gains on weaker dollar, all eyes on Fed meeting",yahoofinance,2020-09-14 07:58:52
Nvidia Buys SoftBank’s Arm in Record $40 Billion Chip Deal,yahoofinance,2020-09-14 07:58:52
September Is Off to a Rough Start. These 19 Stocks Aren’t.,yahoofinance,2020-09-14 07:58:52
ViacomCBS Reaches Deal to Sell CNET for $500 Million to Marketing Firm Red Ventures,yahoofinance,2020-09-14 07:58:52
Wave’s whiskey fund buys first tranche of Kentucky bourbon,yahoofinance,2020-09-14 07:58:52
Boeing execs defend safety decisions on 737 MAX development,yahoofinance,2020-09-14 07:58:52
Don't count on a 'Payroll Tax Holiday' at your workplace. Here's why many employers are passing it up.,yahoofinance,2020-09-14 07:58:52
30-year vs. 15-year mortgage: How do you choose for your refinance?,yahoofinance,2020-09-14 07:58:52
"TikTok Turns To Oracle For U.S. Deal, Walmart May Invest: Report",yahoofinance,2020-09-14 07:58:52
Delta launches $6.5 billion debt deal backed by frequent flyer program,yahoofinance,2020-09-14 07:58:52
Walmart expands drone delivery in deal with Zipline,yahoofinance,2020-09-14 07:58:52
J. Jill Restructuring Out of Court,yahoofinance,2020-09-14 07:58:52
New York Sports Clubs Owner Files for Bankruptcy Protection,yahoofinance,2020-09-14 07:58:52
Where Is Future Oil Demand Going To Come From?,yahoofinance,2020-09-14 07:58:52
Fed Must Alter Habits of a Generation in Higher Inflation Quest,yahoofinance,2020-09-14 07:58:52
Ecopetrol aims to drill 100 wells in U.S. Permian Basin by end-2021 - CEO,yahoofinance,2020-09-14 07:58:52
Oil Falls Near $37 With Demand in Focus Before OPEC+ Meeting,yahoofinance,2020-09-14 07:58:52
AstraZeneca shares gain as coronavirus vaccine trials resume,yahoofinance,2020-09-14 07:58:52
Adobe Is the Next Big Software Company to Report Earnings and Wall Street Is Increasingly Bullish,yahoofinance,2020-09-14 07:58:52
Price of Gold Fundamental Weekly Forecast – Fed May Not Deliver What Gold Bulls Want to Hear,yahoofinance,2020-09-14 07:58:52
9 ways to make your own stimulus check (and forget Congress),yahoofinance,2020-09-14 07:58:52
'A scary number' of retail companies are facing bankruptcy amid the coronavirus pandemic,yahoofinance,2020-09-14 07:58:52
World’s gold miners wary of production ramp-up despite price surge,yahoofinance,2020-09-14 07:58:52
Facebook Bounce Could Offer Opportune Profits,yahoofinance,2020-09-14 07:58:52
"Adobe, FedEx, Lennar and Other Stocks to Watch This Week",yahoofinance,2020-09-14 07:58:52
"Benzinga's Bulls And Bears Of The Week: Exxon, Peloton, Uber And More",yahoofinance,2020-09-14 07:58:52
Dow futures jump 300 points as tech stocks look to recover,yahoofinance,2020-09-14 07:58:52
GoodRx to sell up to $969.2 million worth of shares in IPO,yahoofinance,2020-09-14 07:58:52
Walmart expands drone delivery tests to Arkansas with new Zipline partnership,yahoofinance,2020-09-14 07:58:52
"US STOCKS-Futures lifted by M&A activity, vaccine hopes",yahoofinance,2020-09-14 07:58:52
AstraZeneca shares gain as coronvirus vaccine trials resume,yahoofinance,2020-09-14 07:58:52
Manhattan’s Newest Skyscraper Is Opening Up to a Dead Midtown,yahoofinance,2020-09-14 07:58:52
Gilead To Explore Trodelvy Drug Against Different Cancers After $21B Merger With Immunomedics,yahoofinance,2020-09-14 07:58:52
Oil Traders Snap Up Tankers in Sign Second-Wave Glut Is Near,yahoofinance,2020-09-14 07:58:52
"Fed meeting, retail sales: What to know in the week ahead",yahoofinance,2020-09-14 07:58:52
"Amazon Hiring 100,000 New Employees in U.S. and Canada",yahoofinance,2020-09-14 07:58:52
"SoftBank Soars After Arm Deal, Renewed Talks to Go Private",yahoofinance,2020-09-14 07:58:52
Christine Lagarde Has Bigger Problems Than the Euro,yahoofinance,2020-09-14 07:58:52
"Traders Discuss FedEx, United Parcel Service",yahoofinance,2020-09-14 07:58:52
"Century 21, J.C. Penney And J. Crew Are Just 3 Retailers On A Long List Of 2020 Bankruptcies",yahoofinance,2020-09-14 07:58:52
"Student debt is fueling the Black-white wealth gap — and pursuing a college degree has become ‘racialized,’ this professor says",yahoofinance,2020-09-14 07:58:52
"UBS Chairman Explores Merger With Credit Suisse, Report Says",yahoofinance,2020-09-14 07:58:52
Trafigura Says Weak Demand Pushing Oil Back Into Surplus,yahoofinance,2020-09-14 07:58:52
Gilead Sciences to Acquire Immunomedics for $21 Billion; Target Price $75,yahoofinance,2020-09-14 07:58:52
Oracle Won the TikTok Bid After Beating Out Microsoft and Walmart,yahoofinance,2020-09-14 07:58:52
"Scientific Games to sell 34.9% stake to Caledonia, other investors",yahoofinance,2020-09-14 07:58:52
ViacomCBS to sell CNET for $500 million to Red Ventures,yahoofinance,2020-09-14 07:58:52
Nvidia Is Buying Arm Holdings From SoftBank in the Largest Ever Chip Deal,yahoofinance,2020-09-14 07:58:52
Nvidia Buys British Chip Designer Arm for $40 Billion,yahoofinance,2020-09-14 07:58:52
'Fast Money' Traders Share Their Thoughts On Nike,yahoofinance,2020-09-14 07:58:52
"Merck to buy $1 bln stake in Seattle Genetics, co-develop cancer therapy",yahoofinance,2020-09-14 07:58:52
Next Year Looks Rocky for the Stock Market No Matter Who Wins the Election,yahoofinance,2020-09-14 07:58:52
"Amazon To Add 100,000 US, Canada Workers In Fourth Major Hiring Drive During Pandemic",yahoofinance,2020-09-14 07:58:52
Crude Oil Market Might Soon Be In An Oil Glut Era.,yahoofinance,2020-09-14 07:58:52
"Ambani Puts Carlyle, SoftBank on Waiting List for Reliance Retail Stakes",yahoofinance,2020-09-14 07:58:52
U.S. Futures Rally; European Stocks Mixed: Markets Wrap,yahoofinance,2020-09-14 07:58:52
Perelman Nears Scientific Games Stake Sale to Caledonia,yahoofinance,2020-09-14 07:58:52
"Dow to sell U.S. Gulf Coast marine, terminal operations for $620 mln",yahoofinance,2020-09-14 07:58:52
"Oracle Wins Bid for TikTok in U.S., Beating Microsoft",wsj,2020-09-14 08:01:02
U.S. Stock Futures Point to Gains on Wall Street,wsj,2020-09-14 08:01:02
"Amazon to Hire 100,000 in U.S. and Canada",wsj,2020-09-14 08:01:02
Apple’s September Event: No Crowds and Likely No iPhone,wsj,2020-09-14 08:01:02
West Coast Wildfire Death Toll Hits 33,wsj,2020-09-14 08:01:02
Nvidia’s Deal for Arm Signals Loftier Chip Ambition,wsj,2020-09-14 08:01:02
"Arizona, Known as a Covid-19 Hot Spot, Starts to Subdue Its Outbreak",wsj,2020-09-14 08:01:02
Biden Hones Multi-Trillion-Dollar Budget,wsj,2020-09-14 08:01:02
"Exxon’s Bet on Oil, Gas Drags Down U.S. Titan",wsj,2020-09-14 08:01:02
Who Pays for Covid Care? Four Patients. Four Stories.,wsj,2020-09-14 08:01:02
Big Ten Considers Resuming Fall Football,wsj,2020-09-14 08:01:02
NYC Business Groups Add Private Security,wsj,2020-09-14 08:01:02
Funding Secured? A Private SoftBank Seems Unlikely,wsj,2020-09-14 08:01:02
"Yes, Your Dog Can Be Allergic to Your Cat",wsj,2020-09-14 08:01:02
Delta to Use Frequent-Flier Program to Raise $6.5 Billion,wsj,2020-09-14 08:01:02
"In Turkey, Weak Lira Powers Fresh Gold Rush",wsj,2020-09-14 08:01:02
OPEC Extends Forecast for Decline in Global Oil Demand,wsj,2020-09-14 08:01:02
Blank-Check IPOs in Europe Show Signs of Life,wsj,2020-09-14 08:01:02
ViacomCBS Nears Deal to Sell CNET for $500 Million,wsj,2020-09-14 08:01:02
U.S.-Qatar Summit Provides Chance to Address Regional Spat,wsj,2020-09-14 08:01:02
"New York Eases Absentee-Voting Rules, but Advocates Push for More",wsj,2020-09-14 08:01:02
Trump Executive Order Takes New Aim at Drug Prices,wsj,2020-09-14 08:01:02
"Terry Branstad, U.S. Ambassador to China, Is Stepping Down",wsj,2020-09-14 08:01:02
Remote Schooling Out of Reach for Many West Virginia Students Without Internet,wsj,2020-09-14 08:01:02
Tropical Storm Sally Could Hit New Orleans as Category 2 Hurricane,wsj,2020-09-14 08:01:02
Is It OK to Reveal Your Anxiety or Depression to Your Boss?,wsj,2020-09-14 08:01:02
Tall Boots for a Fall of Higher Hopes,wsj,2020-09-14 08:01:02
The Meaningful Summer of Naomi Osaka,wsj,2020-09-14 08:01:02
The American Late-Bloomer Helping to Win the Tour de France,wsj,2020-09-14 08:01:02
The Biggest Money Mistakes People Make in a Recession,wsj,2020-09-14 08:01:02
Your Kids Are Over 18. Which Expenses Should You Stop Paying?,wsj,2020-09-14 08:01:02
Amending a Tax Return Just Got a Lot Easier,wsj,2020-09-14 08:01:02
Facebook Starts an Ad-Free Section for College Students,wsj,2020-09-14 08:01:02
USPS Campaign Aims to Educate Public About Mail-In Ballot Process,wsj,2020-09-14 08:01:02
Ulta Beauty Returns to TV Advertising After a Pandemic Pause,wsj,2020-09-14 08:01:02
"California Utilities Hope Drones, AI Will Lower Risk of Future Wildfires",wsj,2020-09-14 08:01:02
Autonomous Robots Are Coming to the Operating Room,wsj,2020-09-14 08:01:02
Pandemic Tech Spending in China Lifts Alibaba’s Cloud,wsj,2020-09-14 08:01:02
Xerox Names Company Veteran as Interim Finance Chief,wsj,2020-09-14 08:01:02
Deals Are Being Dropped as Buyers Turn Wary During the Pandemic,wsj,2020-09-14 08:01:02
"Lockheed, Micron and Others Pay Bills Early to Protect Suppliers",wsj,2020-09-14 08:01:02
Deutsche’s Compliance Procedures Limit Damage of Sanctions Settlement,wsj,2020-09-14 08:01:02
CFTC Issues Guidance on Corporate Compliance Programs,wsj,2020-09-14 08:01:02
Pactiv Evergreen Discloses Potential FCPA Violations in IPO Filing,wsj,2020-09-14 08:01:02
E-Commerce Driving Shipping Surge at France’s CMA CGM,wsj,2020-09-14 08:01:02
Today’s Logistics Report: Freight Networks Overfilling; Financing the Suppliers; Waiting for Delivery,wsj,2020-09-14 08:01:02
West Coast Freight Networks ‘Bursting at the Seams’ With Surging Imports,wsj,2020-09-14 08:01:02
Next Year Looks Rocky No Matter Who Wins the Election,wsj,2020-09-14 08:01:02
General Motors’ Deal With Nikola Could Double Its Stock Price,wsj,2020-09-14 08:01:02
The Pandemic Helped Crocs Kickstart Growth. Why the Stock Could Double.,wsj,2020-09-14 08:01:02
Uber to issue $500 million eight-year bonds,wsj,2020-09-14 08:01:02
Shares of Lilly and Incyte gain after late-stage study finds their arthritis drug can help reduce COVID-19 recovery time,wsj,2020-09-14 08:01:02
International M&A buoys London trading as investors brace for Bank of England decision this week,wsj,2020-09-14 08:01:02
Historic Michigan Mansion With Panoramic Water Views Is a Book Lover’s Dream,wsj,2020-09-14 08:01:02
Designer of the Waldorf Astoria Towers on Paying Homage to an Iconic Property—And Giving it an Update,wsj,2020-09-14 08:01:02
"Miami, New York Developers Rethink Kids’ Amenity Spaces as More Spend Time at Home",wsj,2020-09-14 08:01:02
Creating Time Capsules to Capture 2020,wsj,2020-09-14 08:01:02
Sotheby’s London to Offer Watches and Islamic Art on Behalf of Museum in Israel,wsj,2020-09-14 08:01:02
Five New Chronographs Kick Off Fall in High Gear,wsj,2020-09-14 08:01:02
Newton’s Law of Stock Momentum,wsj,2020-09-14 08:01:02
How ‘Emergency Use’ Can Help Roll Out a Covid Vaccine,wsj,2020-09-14 08:01:02
‘We Hope They Die’,wsj,2020-09-14 08:01:02
The Rise of TikTok: From Chinese App to Global Sensation,wsj,2020-09-14 08:01:02
Gyms Brace for Fewer Members as At-Home Fitness Rises During Pandemic,wsj,2020-09-14 08:01:02
Researchers Look to Lab-Made Solution for Future Blood Shortages,wsj,2020-09-14 08:01:02
The Rise of TikTok: From Chinese App to Global Sensation,wsj,2020-09-14 08:01:02
How Apple Became the World’s Most Valuable Publicly Traded Company,wsj,2020-09-14 08:01:02
Why America's Jobs Recovery Is Different From Other Countries',wsj,2020-09-14 08:01:02
Record Covid-19 Numbers and Economic Downturn Throw India Into Crisis,wsj,2020-09-14 08:01:02
Researchers Look to Lab-Made Solution for Future Blood Shortages,wsj,2020-09-14 08:01:02
"Oracle Wins Bid for TikTok in U.S., Beating Microsoft",wsj,2020-09-14 08:01:02
How Travel Will Change Post-Pandemic: 10 Expert Predictions,wsj,2020-09-14 08:01:02
How Old Is the Greenland Shark? The Answer Is Slippery,wsj,2020-09-14 08:01:02
Opinion: ‘We Hope They Die’,wsj,2020-09-14 08:01:02
Israel to Shut Down Again as Second Coronavirus Wave Hits,wsj,2020-09-14 08:01:02
TikTok deal reached,cnnbusiness,2020-09-14 08:04:38
Oracle will partner with the app in the United States after Microsoft loses bid,cnnbusiness,2020-09-14 08:04:38
SoftBank is selling British chipmaker ARM to Nvidia for $40 billion,cnnbusiness,2020-09-14 08:04:38
The Fed preps for its final meeting before the election,cnnbusiness,2020-09-14 08:04:38
Disney makes controversial move with latest blockbuster,cnnbusiness,2020-09-14 08:04:38
Most stocks are having a pretty tough 2020,cnnbusiness,2020-09-14 08:04:38
Gilead to acquire Immunomedics for $21 billion,cnnbusiness,2020-09-14 08:04:38
What to expect at Tuesday's Apple event,cnnbusiness,2020-09-14 08:04:38
"Britain is risking a car-crash Brexit of food shortages, another recession and isolation",cnnbusiness,2020-09-14 08:04:38
Why it's hard to find paper towels again,cnnbusiness,2020-09-14 08:04:38
More pandemic fallout: No Peeps for Halloween and Christmas,cnnbusiness,2020-09-14 08:04:38
Elon Musk shares his thoughts on Bill Gates. They're not pleasant,cnnbusiness,2020-09-14 08:04:38
'Mulan' has a lackluster box office debut in China,cnnbusiness,2020-09-14 08:04:38
Nintendo is bringing back a super-retro handheld from the 1980s,cnnbusiness,2020-09-14 08:04:38
Cathay is losing up to $258 million a month as passengers drop nearly 99%,cnnbusiness,2020-09-14 08:04:38
Refi rates at 2.42% APR (15 yr). Do you qualify?,cnnbusiness,2020-09-14 08:04:38
"JCPenney could be finished, even as malls race to save it",cnnbusiness,2020-09-14 08:04:38
The world's top suppliers of disposable gloves are thriving because of the pandemic. Their workers aren't,cnnbusiness,2020-09-14 08:04:38
Vinyl record sales surpass CDs for the first time since the 1980s,cnnbusiness,2020-09-14 08:04:38
Hamburgers are hard on the planet. They're trying to change that,cnnbusiness,2020-09-14 08:04:38
Report: Climate change could create economic chaos,cnnbusiness,2020-09-14 08:04:38
Uber CEO: Climate is a team sport,cnnbusiness,2020-09-14 08:04:38
Starbucks ditches straws for sippy cup lids — mostly,cnnbusiness,2020-09-14 08:04:38
Palm oil that doesn't destroy forests? One entrepreneur thinks he has the answer,cnnbusiness,2020-09-14 08:04:38
A 'tidal wave' of Covid-related workplace lawsuits could be on the way,cnnbusiness,2020-09-14 08:04:38
JPMorgan asks senior managers to return to the office,cnnbusiness,2020-09-14 08:04:38
UK government wants employees back in offices,cnnbusiness,2020-09-14 08:04:38
Okta will let employees WFH permanently,cnnbusiness,2020-09-14 08:04:38
L'Oreal workers are worried they could lose their jobs if they don't return to the office,cnnbusiness,2020-09-14 08:04:38
"This new electric car has over 1,000 horsepower",cnnbusiness,2020-09-14 08:04:38
"Dozens of AmazonBasics product are flagged as dangerous, but many are still being sold",cnnbusiness,2020-09-14 08:04:38
Inside the US shale crisis,cnnbusiness,2020-09-14 08:04:38
Watch Apple's commercial where people blurt out their private info,cnnbusiness,2020-09-14 08:04:38
See how this company turns garages into affordable housing,cnnbusiness,2020-09-14 08:04:38
Working from home isn't for everyone,cnnbusiness,2020-09-14 08:04:38
Mortgage rates have fallen to a record low -- for the 9th time this year,cnnbusiness,2020-09-14 08:04:38
Priscilla Chan's $61 billion mission to help the next generation,cnnbusiness,2020-09-14 08:04:38
"Manhattan had 15,000 empty apartments in August -- a new record",cnnbusiness,2020-09-14 08:04:38
How Oracle ended up with TikTok,cnnbusiness,2020-09-14 08:04:38
Facebook to give paid time off to employees who volunteer as poll workers,cnnbusiness,2020-09-14 08:04:38
QAnon fans spread fake claims about real fires in Oregon,cnnbusiness,2020-09-14 08:04:38
NASA wants to buy moon rocks,cnnbusiness,2020-09-14 08:04:38
"While Trump defies coronavirus safety guidelines at rally, TV networks exercise caution",cnnbusiness,2020-09-14 08:04:38
'The Princess Bride' had a prescient line about mask wearing,cnnbusiness,2020-09-14 08:04:38
Mary Trump says president's 'desperation' led him to accuse Biden of drug use,cnnbusiness,2020-09-14 08:04:38
Doctor calls out journalist Bob Woodward for not releasing tapes sooner,cnnbusiness,2020-09-14 08:04:38
How NASA's Apollo program kicked off Silicon Valley's tech revolution,cnnbusiness,2020-09-14 08:04:38
Jeff Bezos just sold $1.8 billion worth of Amazon stock. Here's why,cnnbusiness,2020-09-14 08:04:38
Bill Nye's experimental spacecraft that sails on sunlight declares mission success ,cnnbusiness,2020-09-14 08:04:38
SpaceX's massive Starship prototype lifts off ,cnnbusiness,2020-09-14 08:04:38
Unilever will stop using oil and gas to make cleaning products by 2030,cnnbusiness,2020-09-14 08:04:38
Scared of going back to the office? Companies hope these apps will help,cnnbusiness,2020-09-14 08:04:38
How virtual reality is tackling racism in the workplace,cnnbusiness,2020-09-14 08:04:38
Zoom is backing away from China — and doubling down on India,cnnbusiness,2020-09-14 08:04:38
Here's what the Burger King of the future will look like,cnnbusiness,2020-09-14 08:04:38
'Super Mario 3D World' and a ton of other classic Mario games are coming to the Nintendo Switch,cnnbusiness,2020-09-14 08:04:38
This discount retailer is crushing it during the pandemic,cnnbusiness,2020-09-14 08:04:38
These people have left big cities for good. Here's where they landed,cnnbusiness,2020-09-14 08:04:38
MacKenzie Scott has become the world's richest woman,cnnbusiness,2020-09-14 08:04:38
Here's what the Burger King of the future will look like,cnnbusiness,2020-09-14 08:04:38
'Super Mario 3D World' and a ton of other classic Mario games are coming to the Nintendo Switch,cnnbusiness,2020-09-14 08:04:38
This discount retailer is crushing it during the pandemic,cnnbusiness,2020-09-14 08:04:38
These people have left big cities for good. Here's where they landed,cnnbusiness,2020-09-14 08:04:38
MacKenzie Scott has become the world's richest woman,cnnbusiness,2020-09-14 08:04:38
Here's what the Burger King of the future will look like,cnnbusiness,2020-09-14 08:04:38
Refi rates at 2.42% APR (15 yr). Do you qualify?,cnnbusiness,2020-09-14 08:04:38
Refi rates near historic lows. Lock in and save now! ,cnnbusiness,2020-09-14 08:04:38
Experts urge Americans to refinance in 2020,cnnbusiness,2020-09-14 08:04:38
Hack your mortgage by refinancing to a 15yr fixed,cnnbusiness,2020-09-14 08:04:38
5 cards charging 0% interest until 2022,cnnbusiness,2020-09-14 08:04:38
Don't Ignore These Offers if you have Excellent Credit,cnnbusiness,2020-09-14 08:04:38
Pay 0% interest until 2022 with a better card,cnnbusiness,2020-09-14 08:04:38
"The fastest way to pay off $10,000 in credit card debt",cnnbusiness,2020-09-14 08:04:38
You'll never guess who just put $91B on 1 5G stock,cnnbusiness,2020-09-14 08:04:38
5 must-have stocks under $49 could be worth $2.2T,cnnbusiness,2020-09-14 08:04:38
This could be the biggest winner of the stock market crash,cnnbusiness,2020-09-14 08:04:38
5 stocks for any White House,cnnbusiness,2020-09-14 08:04:38
Recession-proof your money with these accounts,cnnbusiness,2020-09-14 08:04:38
Recession worries? Protect your assets today,cnnbusiness,2020-09-14 08:04:38
A smarter way to bank and save. Start today!,cnnbusiness,2020-09-14 08:04:38
Want to protect your money? (Take action now),cnnbusiness,2020-09-14 08:04:38
Avoid these 7 mistakes everyone makes hiring financial advisors,cnnbusiness,2020-09-14 08:04:38
This startup is changing how people retire,cnnbusiness,2020-09-14 08:04:38
7 secrets everyone needs to know about financial advisors,cnnbusiness,2020-09-14 08:04:38
Avoid these 5 retirement mistakes at all costs,cnnbusiness,2020-09-14 08:04:38
10 Biggest Companies in the World,cnn,2020-09-14 08:06:19
10 Biggest Shipping Companies,cnn,2020-09-14 08:06:19
10 Biggest Car Companies,cnn,2020-09-14 08:06:19
10 Biggest Trucking Companies,cnn,2020-09-14 08:06:19
Energy Stocks Post Steep September Losses,cnn,2020-09-14 08:06:19
Chewy (CHWY) Trading Lower After Another Losing Quarter,cnn,2020-09-14 08:06:19
10 Biggest Oil Companies,cnn,2020-09-14 08:06:19
5 Biggest ETF Companies,cnn,2020-09-14 08:06:19
10 Biggest Chinese Companies,cnn,2020-09-14 08:06:19
Investing in Apple Stock (AAPL),cnn,2020-09-14 08:06:19
5 Biggest 3D Printing Companies,cnn,2020-09-14 08:06:19
10 Biggest Tech Hardware Companies,cnn,2020-09-14 08:06:19
"How Disney Makes Money: Media Networks and Parks, Experiences",cnn,2020-09-14 08:06:19
"How Nvidia Makes Money: GPU, Automotive, and AI Platforms",cnn,2020-09-14 08:06:19
"How Activision Blizzard Makes Money: Console, PC, and Mobile games",cnn,2020-09-14 08:06:19
How Canopy Growth Makes Money: Recreational and Medical Marijuana,cnn,2020-09-14 08:06:19
How Chipotle Makes Money: restaurants and digital sales,cnn,2020-09-14 08:06:19
How Bank of America Makes Money: consumer banking,cnn,2020-09-14 08:06:19
"Companies Owned by Alphabet (GOOGL), Google's Parent Company",cnn,2020-09-14 08:06:19
5 Companies Owned by BABA,cnn,2020-09-14 08:06:19
If You Had Invested in Berkshire Hathaway When Buffett Took Over,cnn,2020-09-14 08:06:19
Overstock (OSTK) Soars After FINRA Approves tZERO,cnn,2020-09-14 08:06:19
10 Most Profitable Companies in the World,cnn,2020-09-14 08:06:19
How Does Fortnite Make Money?,cnn,2020-09-14 08:06:19
5 Biggest Oil Tanker Companies,cnn,2020-09-14 08:06:19
Quest Diagnostics (DGX) Could Enter New Downtrend,cnn,2020-09-14 08:06:19
Spotify (SPOT) Surges Off Support After Analyst Upgrade,cnn,2020-09-14 08:06:19
10 Biggest Entertainment Companies,cnn,2020-09-14 08:06:19
Nautilus (NLS) Soars After Bullish Citron Report,cnn,2020-09-14 08:06:19
