headline,org,date
Trump Describes Soliciting Bribe From Exxon Mobil,thestreet,2020-10-20 08:43:03
IBM Matches Estimates as Cloud Growth Partly Offsets Legacy Declines,thestreet,2020-10-20 08:43:03
What is an Enrolled Agent for Taxes?,thestreet,2020-10-20 08:43:03
Rules for Claiming a Dependent on Your Tax Return,thestreet,2020-10-20 08:43:03
9 Things You Didn't Know Were Tax Deductions,thestreet,2020-10-20 08:43:03
Here's How Much Money Could Soon Be Deployed Into Market and Economy,thestreet,2020-10-20 08:43:03
"Why Stocks Sold Off, What Wall Street's Saying",thestreet,2020-10-20 08:43:03
"BioSpecifics, Trinseo, Kaixin: 5 Top Stock Gainers for Monday",thestreet,2020-10-20 08:43:03
"Dodgers Head to the World Series: Top Stories, Sports and Business News — Oct. 19",thestreet,2020-10-20 08:43:03
Coronavirus Update: An Update on the Stimulus Talks,thestreet,2020-10-20 08:43:03
Stocks Tumble as Wall Street Monitors Stimulus Negotiations,thestreet,2020-10-20 08:43:03
Verizon Buys Some Rural Assets of KY Wireless Operator Bluegrass Cellular,thestreet,2020-10-20 08:43:03
How to Protect Your Portfolio Against Election Outcomes,thestreet,2020-10-20 08:43:03
Stock Market Today With Jim Cramer: Buy Boeing,thestreet,2020-10-20 08:43:03
Jim Cramer's Retail Stocks to Watch,thestreet,2020-10-20 08:43:03
Over a Million Air Travelers Were Screened on Single Day for First Time Since March,thestreet,2020-10-20 08:43:03
Intel Is Said to Be Near Sale of Memory-Chip Unit for $10B,thestreet,2020-10-20 08:43:03
Jim Cramer Says Bulls Are Settling for a Stimulus Package if Joe Biden Wins,thestreet,2020-10-20 08:43:03
IBM Matches Estimates as Cloud Growth Partly Offsets Legacy Declines,thestreet,2020-10-20 08:43:03
Lowe's kicks off holiday shopping with 'Season of Savings' sale Thursday amid COVID-19 with more online deals,googlenews,2020-10-20 08:45:01
Microsoft to work with Elon Musk's SpaceX in cloud computing for space customers: WSJ,googlenews,2020-10-20 08:45:01
Justice Department to File Long-Awaited Antitrust Suit Against Google,googlenews,2020-10-20 08:45:01
The IBM Stock Is Not Microsoft And It Is Thus Not Poised To Explode In The Near Future,googlenews,2020-10-20 08:45:01
"Stimulus Nears Election Endgame on Pelosi Deadline, Senate Vote",googlenews,2020-10-20 08:45:01
"Technology stocks may be about to drown in their own greatness, says JPMorgan",googlenews,2020-10-20 08:45:01
European shares lack direction; Wall Street set for stronger open,googlenews,2020-10-20 08:45:01
These 3 Under-the-Radar Stocks Are Great Buys Right Now,googlenews,2020-10-20 08:45:01
California to independently review FDA-approved coronavirus vaccines,googlenews,2020-10-20 08:45:01
European stocks steady and U.S. futures rise ahead of self-imposed stimulus talks deadline,googlenews,2020-10-20 08:45:01
Intel sells NAND memory chip business to SK Hynix for $9 billion,googlenews,2020-10-20 08:45:01
U.S. Stock Futures Rise Ahead of Stimulus Talks Deadline,googlenews,2020-10-20 08:45:01
"Ford issues safety recalls for engine-cooling, tire pressure systems on select Transit Connect, Escape vehicles",googlenews,2020-10-20 08:45:01
"Bitcoin trading dominance hits 2017-levels not seen since $20,000 BTC",googlenews,2020-10-20 08:45:01
The $1.6 million SSC Tuatara just became the world's fastest car by topping 316 mph - Business Insider,googlenews,2020-10-20 08:45:01
Tesla Model 3 produced in Giga Shanghai are heading to Europe next week,googlenews,2020-10-20 08:45:01
"After years as CEO of UBS, Sergio Ermotti outlines where he thinks markets are headed",googlenews,2020-10-20 08:45:01
"Texas passenger died of coronavirus while waiting for plane to take off, officials say",googlenews,2020-10-20 08:45:01
"CDC advises booting travelers who refuse to wear masks on planes, trains, buses, other transportation",googlenews,2020-10-20 08:45:01
Exxon denies Trump called CEO for money. But Big Oil is donating way more to Trump than Biden,googlenews,2020-10-20 08:45:01
Air Travel High: TSA Screens 1 Million For 1st Time Since March,googlenews,2020-10-20 08:45:01
"CVS hiring several thousand work-from-home employees among 15,000 openings, with positions in Kansas City",googlenews,2020-10-20 08:45:01
Wall Street seeks rebound after Monday decline as Asian shares mixed Tuesday,googlenews,2020-10-20 08:45:01
Cruise Ship Rescues 24 People From Sinking Boat Off Florida Coast,googlenews,2020-10-20 08:45:01
OPEC Meeting Ends Without Firm Decision On Output Cuts,googlenews,2020-10-20 08:45:01
The sustainable sneaker start-up Allbirds wants to take over your closet,googlenews,2020-10-20 08:45:01
Chinese economy growing as the world still reels from COVID-19,googlenews,2020-10-20 08:45:01
Monetary Stability: The IMF and Fed Chair Jerome Powell Discuss Digital Currency Implications,googlenews,2020-10-20 08:45:01
Next-Gen Energy Efficiency Tech Kills Carbon Capture Dream,googlenews,2020-10-20 08:45:01
Race has played a large role in Uber and Lyft's fight to preserve their business models,googlenews,2020-10-20 08:45:01
"In fresh effort to reopen campuses, state again revises COVID-19 guidance for schools",googlenews,2020-10-20 08:45:01
ConocoPhillips Doubles Down On The Permian Basin And Fracking With Concho Acquisition,googlenews,2020-10-20 08:45:01
Texas woman died of COVID-19 while on commercial flight,googlenews,2020-10-20 08:45:01
Brokers offer retail investors 20x leverage for Ant IPO,googlenews,2020-10-20 08:45:01
'Our house is on fire': Suburban women lead a Trump revolt,googlenews,2020-10-20 08:45:01
Coca-Cola Is Discontinuing TaB,googlenews,2020-10-20 08:45:01
"Halloween costumes we won't miss this year amid the pandemic, protests for racial justice",googlenews,2020-10-20 08:45:01
Walmart’s ad scans released ahead of Black Friday events,googlenews,2020-10-20 08:45:01
Distribution of COVID-19 vaccines faces hurdles as trials near end,googlenews,2020-10-20 08:45:01
Line wraps around parking lot as medical marijuana dispensary opens in Lee's Summit,googlenews,2020-10-20 08:45:01
Montana federal prosecutor warns of dangers of pot legalization ahead of vote,googlenews,2020-10-20 08:45:01
Singapore Airlines Shifts Longest Flight To JFK,googlenews,2020-10-20 08:45:01
"Procter & Gamble beats estimates as sales jump 9%, raises forecast amid strong demand",googlenews,2020-10-20 08:45:01
FDIC survey finds record number of American households obtained a bank account in 2019,googlenews,2020-10-20 08:45:01
Alibaba gets its Whole Foods with new $3.6 billion investment in Chinese supermarket operator,googlenews,2020-10-20 08:45:01
Prominent designer to move fashion studio to Tucson,googlenews,2020-10-20 08:45:01
Julie Sweet | 2020 Most Powerful Women,googlenews,2020-10-20 08:45:01
Verizon teams with Microsoft to offer private 5G mobile edge computing - Stories,googlenews,2020-10-20 08:45:01
The new Porsche Panamera Turbo S E-Hybrid has 690bhp,googlenews,2020-10-20 08:45:01
Verizon's new transaction widens its lead over T-Mobile,googlenews,2020-10-20 08:45:01
"Amazon Prime Day Sales Topped $10.6 Billion, an Analyst Says",googlenews,2020-10-20 08:45:01
What to do after your PPP loan money runs out,googlenews,2020-10-20 08:45:01
"California's fabled wine region is having 'the most horrible, devastating and catastrophic year'",googlenews,2020-10-20 08:45:01
EU probes whether Instagram exposed children's data - Business Insider,googlenews,2020-10-20 08:45:01
Married or divorced? You could be owed an extra $757 per month in Social Security,googlenews,2020-10-20 08:45:01
Magnificent Seven: Cramer's 'Mad Money' Recap (Monday 10/19/20),googlenews,2020-10-20 08:45:01
Pioneer Natural Resources Is in Talks to Buy Parsley Energy,googlenews,2020-10-20 08:45:01
Here are all the Arizona winners from the 2020 Great American Beer Festival,googlenews,2020-10-20 08:45:01
How Much Did COVID Drugs Contribute to Trump’s Recovery?,googlenews,2020-10-20 08:45:01
Four Ohio cities declared 'Rattiest',googlenews,2020-10-20 08:45:01
"Today's mortgage refinance rates hold firm at unprecedented lows, with one rate dipping further | October 19, 2020",googlenews,2020-10-20 08:45:01
"2021 Mercedes-Maybach GLS Starts At $160,500 – Costs Twice As Much As The GLS 450",googlenews,2020-10-20 08:45:01
Flying from Hong Kong to Hong Kong During Covid-19,googlenews,2020-10-20 08:45:01
WeWork Didn’t Blow Up Without Help,googlenews,2020-10-20 08:45:01
Town renames sewage plant after late-night comedian,googlenews,2020-10-20 08:45:01
"LRGH files for Chapter 11 bankruptcy, will stay open as Concord bids on assets",googlenews,2020-10-20 08:45:01
"5 Comments on “Volkswagen Throws Down in Bid to Buy Navistar, Create Heavy Truck Giant...”",googlenews,2020-10-20 08:45:01
Goldman Poised to Pay More Than $2 Billion in DOJ’s 1MDB Probe,googlenews,2020-10-20 08:45:01
"Amazon to bring massive facility to Waco, local officials confirm",googlenews,2020-10-20 08:45:01
"Shoppers plan to visit fewer stores than ever this holiday season, survey says",googlenews,2020-10-20 08:45:01
From air fryers to spin bikes: Lowe's bets on new categories this holiday season,googlenews,2020-10-20 08:45:01
Lowe's will deliver your Christmas tree for free this year,googlenews,2020-10-20 08:45:01
Lowe's expands with new merchandise and activations in seasonal push,googlenews,2020-10-20 08:45:01
Lowe's kicks off holiday deals in October and launches Christmas tree delivery program - Business Insider,googlenews,2020-10-20 08:45:01
Department of Justice will charge Google with multiple violations of federal antitrust law today,googlenews,2020-10-20 08:45:01
The Bottom Is in for These 3 Stocks? Analysts Say ‘Buy’,googlenews,2020-10-20 08:45:01
Tesla third-quarter registrations in California drop 13%: data,googlenews,2020-10-20 08:45:01
Final Presidential Debate to Have Muted Mics,googlenews,2020-10-20 08:45:01
Powell: Fed has made no final decision on digital currency,googlenews,2020-10-20 08:45:01
"US election concerns, record virus cases push stocks down",googlenews,2020-10-20 08:45:01
Asian markets under pressure Tuesday as Wall St falters,googlenews,2020-10-20 08:45:01
"Asian markets under pressure as Wall Street falters, COVID-19 cases rise",googlenews,2020-10-20 08:45:01
European stocks recover after shaky start; caution reigns before U.S. elections,googlenews,2020-10-20 08:45:01
California to Review Vaccine Before Distribution: Newsom,googlenews,2020-10-20 08:45:01
"New California Theme Park Guidelines Coming Tuesday, Gov. Gavin Newsom Says; No Widespread COVID Vaccine Until 2021",googlenews,2020-10-20 08:45:01
Former pharmaceutical exec: What you should know about the race for a vaccine,googlenews,2020-10-20 08:45:01
Moderna's COVID-19 vaccine could get emergency approval in December,googlenews,2020-10-20 08:45:01
Market Wrap: Bitcoin Bounces to $11.8K; Over 10K BTC Locked in Harvest Finance,googlenews,2020-10-20 08:45:01
AUD/USD to target 0.70 after another dovish signal from the RBA – OCBC,googlenews,2020-10-20 08:45:01
My brother is in his mid-50s and nearly lost his home twice. Should I give him half of my inheritance to pay off his mortgage?,googlenews,2020-10-20 08:45:01
Intel Enters Deal to Sell NAND Memory Unit to SK Hynix,googlenews,2020-10-20 08:45:01
SK Hynix to buy Intel's NAND business for $9bln / Chinese delivery service stops BTS shipments,googlenews,2020-10-20 08:45:01
Intel Can Leave Memory Games to Samsung,googlenews,2020-10-20 08:45:01
"Intel is smart to sell memory business, abandoning a market dominated by Samsung",googlenews,2020-10-20 08:45:01
US equities decline ahead of upcoming debate; Nifty likely to open under pressure | 20th Oct,googlenews,2020-10-20 08:45:01
S&P 500 Index to Track Progress on US Stimulus Ahead of Deadline,googlenews,2020-10-20 08:45:01
Stocks sink on dashed hopes for stimulus,googlenews,2020-10-20 08:45:01
Week Ahead: Futures Rise On Stimulus Optimism After Market Roller Coaster,googlenews,2020-10-20 08:45:01
"Ford warns of safety issues with 2020 Escape, Mustang Shelby, Transit Connect",googlenews,2020-10-20 08:45:01
Not just EVs: Ford recalls Transit Connect over increased fire risk; Escape also recalled,googlenews,2020-10-20 08:45:01
"Ford issues safety recalls in North America, Canada",googlenews,2020-10-20 08:45:01
"2020 Ford Escape, Transit Connect recalled for tire pressure, engine issues",googlenews,2020-10-20 08:45:01
"Analyst: Bitcoin bull run will catapult BTC to $30,000",googlenews,2020-10-20 08:45:01
"Bitcoin to Soon Form Signal Last Seen Prior to 2,000% Rally in 2017",googlenews,2020-10-20 08:45:01
‘Old hands selling out’ metric shows Bitcoin price at risk of HODLers dumping,googlenews,2020-10-20 08:45:01
Bitcoin Has Spent Only Three Months Above Its Current Price,googlenews,2020-10-20 08:45:01
"SSC Tuatara smashes top speed record, hits 331 mph",googlenews,2020-10-20 08:45:01
WORLD'S FASTEST ONBOARD: SSC Tuatara hits crazy 331mph top speed! | Top Gear,googlenews,2020-10-20 08:45:01
American SSC Tuatara supercar sets 316 mph speed record on Nevada highway,googlenews,2020-10-20 08:45:01
Production car blasts to record on Highway 160,googlenews,2020-10-20 08:45:01
Tesla admits design flaw led to vehicle rear bumper falling off when driving in puddles of water,googlenews,2020-10-20 08:45:01
Tesla Model 3 Towing Huge 26-Foot Airstream: Range & Power Test,googlenews,2020-10-20 08:45:01
Tesla to export Model 3 vehicles to 10 countries in Europe from China Gigafactory,googlenews,2020-10-20 08:45:01
Tesla slashes its used car warranty — killing another confidence builder,googlenews,2020-10-20 08:45:01
"UBS CEO Ermotti on Earnings, Shareholder Payouts",googlenews,2020-10-20 08:45:01
Exit of UBS CEO Ermotti Leaves Plenty for Successor,googlenews,2020-10-20 08:45:01
UBS is powering through the pandemic,googlenews,2020-10-20 08:45:01
"UBS reports its best third quarter for a decade, with a 99% hike in net profit",googlenews,2020-10-20 08:45:01
A Woman In Her Thirties Died Of COVID-19 On A Plane,googlenews,2020-10-20 08:45:01
Texas woman died of coronavirus 'on the jetway' on flight from Arizona,googlenews,2020-10-20 08:45:01
Coronavirus: Texas woman in her 30s died of COVID-19 while on domestic flight,googlenews,2020-10-20 08:45:01
Texas woman dies of COVID-19 while on commercial flight,googlenews,2020-10-20 08:45:01
CDC criticizes White House medical adviser's discredited mask claim,googlenews,2020-10-20 08:45:01
"CDC rolls out new guidance urging masks for passengers, workers on public transit | TheHill",googlenews,2020-10-20 08:45:01
"CDC to passengers and workers: Wear a mask when you are on a plane, train, bus or other public transit",googlenews,2020-10-20 08:45:01
"CDC issues 'strong recommendation' for mask mandate on airplanes, trains",googlenews,2020-10-20 08:45:01
Offshore Oil & Gas Poised For A Major Rebound,googlenews,2020-10-20 08:45:01
The 2020 election question: Are you ready for $6 a gallon gas?,googlenews,2020-10-20 08:45:01
Vermilion Energy: A Possible Opportunity In This Independent Oil And Gas Operator,googlenews,2020-10-20 08:45:01
ConocoPhillips Becomes First Major U.S. Oil Firm To Pledge Emission Cuts,googlenews,2020-10-20 08:45:01
"TSA screens 1 million passengers in a single day, marking busiest travel day since March",googlenews,2020-10-20 08:45:01
More than 1 million passengers screened for first time since Covid-19 pandemic began,googlenews,2020-10-20 08:45:01
The TSA is screening more than 1 million passengers. So how safe is it to fly?,googlenews,2020-10-20 08:45:01
Airport screenings top 1 million for first time since March | TheHill,googlenews,2020-10-20 08:45:01
"CVS to hire 15000 to help with COVID-19, flu",googlenews,2020-10-20 08:45:01
"CVS to hire thousands of pharmacy techs as it prepares for more Covid-19 cases, rollout of vaccine",googlenews,2020-10-20 08:45:01
CVS hiring several thousand work-from-home employees among 15000 openings,googlenews,2020-10-20 08:45:01
"CVS to hire 15000 employees to support expected COVID-19, flu case increase",googlenews,2020-10-20 08:45:01
Cruise ship rescues 24 people from sinking boat off the coast of Florida,googlenews,2020-10-20 08:45:01
Company wants to turn cruise ship into floating office for techies - Business Insider,googlenews,2020-10-20 08:45:01
Italian Ministry of Health: Confirmed Case of COVID-19 on the MSC Grandiosa,googlenews,2020-10-20 08:45:01
Cruise Line Stocks Falling Again – What Should You Do?,googlenews,2020-10-20 08:45:01
China’s GDP Data Brings Back Oil Bears,googlenews,2020-10-20 08:45:01
Oil prices drop for fourth day as Covid-19 second wave worries intensify,googlenews,2020-10-20 08:45:01
OPEC Is On The Brink Of A Crisis,googlenews,2020-10-20 08:45:01
Oil dips after OPEC+ meeting as Libyan supply boost weighs,googlenews,2020-10-20 08:45:01
"If You Love Allbirds’s Shoes, You’ll Be Excited About Its New Clothing Line",googlenews,2020-10-20 08:45:01
Eco footwear pioneer Allbirds launches apparel line,googlenews,2020-10-20 08:45:01
Allbirds is Venturing Beyond 'Sustainable' Sneakers Into a New Category: Apparel,googlenews,2020-10-20 08:45:01
Allbirds: Does the world need another T-shirt?,googlenews,2020-10-20 08:45:01
China's economic recovery quickens,googlenews,2020-10-20 08:45:01
"China’s economy surges ahead, but young jobseekers face being left behind",googlenews,2020-10-20 08:45:01
Commentary: Options are running out to revive the global economy. Not even China can help this time,googlenews,2020-10-20 08:45:01
Maybe There's Hope for a V-Shaped Recovery After All,googlenews,2020-10-20 08:45:01
Fed Takes Cautious Approach to Possibly Issuing Digital Currency,googlenews,2020-10-20 08:45:01
Fed Chair Jerome Powell says Federal Reserve is researching digital currency,googlenews,2020-10-20 08:45:01
Digital Ruble: Russia Unveils Plans to Test Central Bank Digital Currency | Regulation,googlenews,2020-10-20 08:45:01
Fed's Powell: More important for U.S. to get digital currency right than be first,googlenews,2020-10-20 08:45:01
Big solar farms could dominate the future of a Utah hamlet trying to preserve its small-town feel,googlenews,2020-10-20 08:45:01
InterContinental Energy MD on New Hub for Renewable Energy,googlenews,2020-10-20 08:45:01
7 Solar Stocks That Will Heat Up Your Portfolio,googlenews,2020-10-20 08:45:01
"Sorry, Coal: 66% Conversion Efficiency Eyeballed For Next-Gen “Hot Carrler” Perovskite Solar Cells",googlenews,2020-10-20 08:45:01
State Department of Health releases new COVID-19 guidance for schools,googlenews,2020-10-20 08:45:01
New COVID-19 Guidance For Hawaiʻi Schools Released,googlenews,2020-10-20 08:45:01
Hawai‘i Department of Health Releases Updated COVID-19 Guidance for Schools,googlenews,2020-10-20 08:45:01
DOH updates reopening thresholds for schools,googlenews,2020-10-20 08:45:01
ConocoPhillips buys Concho Resources for $9.7 billion in stock,googlenews,2020-10-20 08:45:01
Conoco plans to retain Midland presence,googlenews,2020-10-20 08:45:01
The oil industry is in crisis. ConocoPhillips is doubling down,googlenews,2020-10-20 08:45:01
"Conoco to buy Concho for $9.7B, creates shale giant",googlenews,2020-10-20 08:45:01
"Ant Group poised to be world's biggest private firm making public debut, with Hong Kong-Shanghai IPO",googlenews,2020-10-20 08:45:01
China's Ant wins Hong Kong nod for $35 billion dual listing: sources,googlenews,2020-10-20 08:45:01
China's Ant wins Hong Kong nod for $35 billion dual listing - sources,googlenews,2020-10-20 08:45:01
"Hong Kong stocks await catalyst as Alibaba hits HK$300, Asian markets slip",googlenews,2020-10-20 08:45:01
"‘No Time to Die’ Stunt Team Used $70,000 Worth of Coca-Cola to Pull Off Motorcycle Stunt",googlenews,2020-10-20 08:45:01
"Coca-Cola Retires Tab, Its First Diet Soda",googlenews,2020-10-20 08:45:01
Coca Cola's Tab soda has been discontinued. Its retirement should have come decades ago.,googlenews,2020-10-20 08:45:01
"Coca-Cola Retiring Storied Tab, Other Products in Brand Cull",googlenews,2020-10-20 08:45:01
34 Halloween Costume Ideas For Your Zoom Party This Year,googlenews,2020-10-20 08:45:01
15 Easy Cat Halloween Makeup Ideas & Tutorials of 2020,googlenews,2020-10-20 08:45:01
Here Are the Best Worst Video Game Halloween Costumes of 2020,googlenews,2020-10-20 08:45:01
QAnon Halloween costumes sold on Amazon,googlenews,2020-10-20 08:45:01
Many Black Friday deals likely to be rolled out online before Thanksgiving,googlenews,2020-10-20 08:45:01
Walmart Black Friday 2020 Ads Revealed,googlenews,2020-10-20 08:45:01
Walmart Black Friday 2020 ads are released and we have a list of the hottest deals,googlenews,2020-10-20 08:45:01
Essential retailer GameStop closing down for Thanksgiving,googlenews,2020-10-20 08:45:01
"What’s Up Doc column: Science, not politics must drive COVID-19 vaccine trials",googlenews,2020-10-20 08:45:01
Japanese research institutions developing COVID-19 vaccine hit by cyberattacks,googlenews,2020-10-20 08:45:01
Pfizer says COVID-19 vaccine could be ready by late November,googlenews,2020-10-20 08:45:01
4 COVID-19 vaccines have reached final stage of testing in United States,googlenews,2020-10-20 08:45:01
Metro's first medical marijuana dispensary opens in Lee's Summit,googlenews,2020-10-20 08:45:01
Line stretches down road as medical marijuana dispensary opens in Lee’s Summit,googlenews,2020-10-20 08:45:01
Medical marijuana for sale for the first time in Missouri state history,googlenews,2020-10-20 08:45:01
Patients can’t ‘really put it into words’ as medical marijuana sales begin in KC area,googlenews,2020-10-20 08:45:01
"One of the world's longest flights, New York to Singapore, to return. Hopeful sign for air travel?",googlenews,2020-10-20 08:45:01
Singapore Airlines set to resume non-stop New York flights,googlenews,2020-10-20 08:45:01
"Singapore Airlines resumes the world's longest flight, to New York",googlenews,2020-10-20 08:45:01
Singapore Airlines marks return to New York with JFK nonstop,googlenews,2020-10-20 08:45:01
Banks try to attract those without accounts as COVID-19 adds to woes,googlenews,2020-10-20 08:45:01
7.1 million American households didn't have a bank account last year—the lowest rate since 2009,googlenews,2020-10-20 08:45:01
"More than 7 million households lacked bank, credit union accounts in 2019: FDIC | TheHill",googlenews,2020-10-20 08:45:01
The share of Americans with bank accounts hit a new high in 2019 — but COVID-19 could undo a decade of progress,googlenews,2020-10-20 08:45:01
Alibaba Takes on Walmart in China With $3.6 Billion Investment in Hypermarket Chain,googlenews,2020-10-20 08:45:01
Alibaba to Spend $3.6 Billion to Boost Sun Art Stake,googlenews,2020-10-20 08:45:01
Alibaba Stock Hits High On Retail Expansion,googlenews,2020-10-20 08:45:01
China’s e-commerce giant Alibaba is expanding its brick-and-mortar empire,googlenews,2020-10-20 08:45:01
Abigail Johnson | 2020 Most Powerful Women,googlenews,2020-10-20 08:45:01
Carol Tomé | 2020 Most Powerful Women,googlenews,2020-10-20 08:45:01
Gail Boudreaux | 2020 Most Powerful Women,googlenews,2020-10-20 08:45:01
Sonia Syngal | 2020 Most Powerful Women,googlenews,2020-10-20 08:45:01
2021 Porsche Panamera Turbo S E-Hybrid Revealed with 689 HP,googlenews,2020-10-20 08:45:01
Porsche Panameras Keep Multiplying!,googlenews,2020-10-20 08:45:01
"2021 Porsche Panamera Turbo S E-Hybrid Gets Unholy 689 HP, 0-60 in Three Seconds",googlenews,2020-10-20 08:45:01
"More 2021 Porsche Panamera variants are updated, including top dog Turbo S E-Hybrid",googlenews,2020-10-20 08:45:01
Verizon agrees to purchase Bluegrass Cellular | About Verizon,googlenews,2020-10-20 08:45:01
Verizon to buy Bluegrass Cellular in continued push into rural service areas,googlenews,2020-10-20 08:45:01
Bluegrass Cellular to be purchased by Verizon | News,googlenews,2020-10-20 08:45:01
Verizon picks up Bluegrass Cellular,googlenews,2020-10-20 08:45:01
"On the heels of Amazon Prime Day’s success, more Black Friday-like deals are starting",googlenews,2020-10-20 08:45:01
New Amazon job openings hint at telehealth expansion: 3 notes,googlenews,2020-10-20 08:45:01
"Amazon: Prime Day’s Success Bodes Well for Q4, Says 5-Star Analyst",googlenews,2020-10-20 08:45:01
Amazon's Early Holiday Deals Are Here — and They're Just As Good As Prime Day Discounts,googlenews,2020-10-20 08:45:01
Banks begin forgiveness applications on PPP loans,googlenews,2020-10-20 08:45:01
Vermont businesses navigate COVID emergency loan repayments,googlenews,2020-10-20 08:45:01
There are solutions for banks reporting major PPP servicing pitfalls,googlenews,2020-10-20 08:45:01
Private equity-backed dermatology groups got COVID-19 small-business loans,googlenews,2020-10-20 08:45:01
EU Regulator Investigates Instagram’s Handling Of Children’s Personal Data,googlenews,2020-10-20 08:45:01
Instagram's handling of children's data sparks EU investigation,googlenews,2020-10-20 08:45:01
Irish regulator investigates Instagram over children's data,googlenews,2020-10-20 08:45:01
Facebook Under Scrutiny Over Handling of Children’s Data on Instagram,googlenews,2020-10-20 08:45:01
"New ad claims President Trump will wipe out Medicare, Social Security",googlenews,2020-10-20 08:45:01
How Trump and Biden Would Handle the COVID-19 Social Security Crisis,googlenews,2020-10-20 08:45:01
7 changes to Social Security in 2021,googlenews,2020-10-20 08:45:01
The Stock Market Is Ignoring the Economy. Here's Why | WSJ,googlenews,2020-10-20 08:45:01
"Jim Cramer says these 7 'thesis' stocks, including Peloton and Netflix, will go higher until coronavirus is controlled",googlenews,2020-10-20 08:45:01
Jim Cramer unveils the 'magnificent 7' stocks investors keep pushing higher during the pandemic,googlenews,2020-10-20 08:45:01
Jim Cramer: Meet the Magnificent Seven - RealMoney,googlenews,2020-10-20 08:45:01
Pioneer Natural Shows M&A Interest In Parsley Energy: WSJ,googlenews,2020-10-20 08:45:01
