headline,org,date
"Election Day, Dow Futures, PayPal, Wayfair - 5 Things You Must Know Tuesday",thestreet,2020-11-03 08:32:49
Wayfair Surges on Pandemic-Driven Third-Quarter Earnings Boost,thestreet,2020-11-03 08:32:49
Dow Futures Surge as Markets Price In Potential Biden Win,thestreet,2020-11-03 08:32:49
PayPal Slumps After Profit Guidance Clouds Third-Quarter Earnings Beat,thestreet,2020-11-03 08:32:49
Jim Cramer: 8 Stocks That Benefit the Most If There's Another Modified Lockdown,thestreet,2020-11-03 08:32:49
Meisler: We Rallied -- And Didn't Even Need the Mega Caps,thestreet,2020-11-03 08:32:49
Rev Shark: Market Looks Ahead as Election Drama Unfolds,thestreet,2020-11-03 08:32:49
Price: Beating Inflation Requires a Portfolio With All the Right ...,thestreet,2020-11-03 08:32:49
"Guilfoyle: My Election Day Wish, Tech Sector Performance, Trading Amazon and 6 Other Stocks",thestreet,2020-11-03 08:32:49
"Election Day 2020 and Your Money, TheStreet's Experts Weigh In",thestreet,2020-11-03 08:32:49
Twitter CEO Jack Dorsey Wins Praise From Activists,thestreet,2020-11-03 08:32:49
"Walmart Ditches Robots, Sticks With Humans for Inventory Control",thestreet,2020-11-03 08:32:49
Why Jim Cramer Likes Marvell's Inphi Acquisition,thestreet,2020-11-03 08:32:49
Jim Cramer's Thoughts on AMD and Xilinx,thestreet,2020-11-03 08:32:49
Apple Earnings Preview: Jim Cramer's Game Plan,thestreet,2020-11-03 08:32:49
Tesla Cybertruck Final Range Rumors,thestreet,2020-11-03 08:32:49
A Simple Guide to Understanding Election Craps,thestreet,2020-11-03 08:32:49
Apple's Earnings Bummer,thestreet,2020-11-03 08:32:49
Diversification Key In Investing in Vaccine Race: Expert,thestreet,2020-11-03 08:32:49
Covid Stocks: Where Are the Winners in the 'New Normal?',thestreet,2020-11-03 08:32:49
Is PPE an Investing Opportunity Amid Race to Vaccine?,thestreet,2020-11-03 08:32:49
Advisers: Explaining Fee-Only Compensation,thestreet,2020-11-03 08:32:49
Financial Advisers Still Need to Keep a Sharp Eye on Inflation,thestreet,2020-11-03 08:32:49
Advisers Can Help With When to Claim Social Security,thestreet,2020-11-03 08:32:49
Jim Cramer Says Buy Stocks Ahead of Tuesday,thestreet,2020-11-03 08:32:49
What Election Outcome Means for Apple Stock,thestreet,2020-11-03 08:32:49
What to Expect From Federal Reserve Under Trump or Biden Presidencies,thestreet,2020-11-03 08:32:49
Jim Cramer: Dunkin' Is Not a 'Solid Competitor' of Starbucks,thestreet,2020-11-03 08:32:49
Politics and Your Portfolio: Tuning Out the Noise,thestreet,2020-11-03 08:32:49
Presidential Elections and the Market: What History Tells Investors,thestreet,2020-11-03 08:32:49
Why Haven’t Small-Value Stocks Led Yet?,thestreet,2020-11-03 08:32:49
"How Presidential Election Impacts Stocks, Economy: Tips for Investors",thestreet,2020-11-03 08:32:49
The Stock Market and Economy: Still Separate,thestreet,2020-11-03 08:32:49
Bristol-Myers Shares Leap After Positive Data From Late-Stage Psoriasis Drug Trial,thestreet,2020-11-03 08:32:49
Twitter Shares Edge Higher As Company Report Endorses CEO Jack Dorsey,thestreet,2020-11-03 08:32:49
November Mortgage Rates Forecast: How Do Presidential Elections Affect Rates?,thestreet,2020-11-03 08:32:49
Best Deals to Look for in November 2020,thestreet,2020-11-03 08:32:49
A New Rotation: Cramer's 'Mad Money' Recap (Monday 11/2/20),thestreet,2020-11-03 08:32:49
"PayPal Q3 Profit Doubled, Beating Estimates; Stock Off",thestreet,2020-11-03 08:32:49
Mondelez Tops Third-Quarter Estimates,thestreet,2020-11-03 08:32:49
Key Dates for Healthcare Reform,thestreet,2020-11-03 08:32:49
Everything You Need to Know About Filing Taxes on Winnings,thestreet,2020-11-03 08:32:49
What Biden’s 401(k) Tax Plan Could Mean for Investors,thestreet,2020-11-03 08:32:49
"Endurance International, Farfetch: 5 Top Stock Gainers for Monday",thestreet,2020-11-03 08:32:49
Dow Ends Higher Ahead of Election Day; Tech Reverses Loss,thestreet,2020-11-03 08:32:49
Tesla to Unveil Updated Cybertruck Design in 'a Month or So',thestreet,2020-11-03 08:32:49
Twitter to Label Tweets That Claim Early Election Victory,thestreet,2020-11-03 08:32:49
Endurance Int'l Jumps on Deal to Be Bought by PE Firm Clearlake,thestreet,2020-11-03 08:32:49
Skillz CEO on Future of Esports and Taking Company Public Via SPAC,thestreet,2020-11-03 08:32:49
Stock Market Today With Jim Cramer: Buy Clorox,thestreet,2020-11-03 08:32:49
"Apple Might Be Launching New MacBooks, AirPods and iPad Pros Relatively Soon",thestreet,2020-11-03 08:32:49
"Jim Cramer Says Stimulus Is Coming After Election, But Jobs Will Disappear",thestreet,2020-11-03 08:32:49
Trading NIO as It Rips Higher After Deliveries Double,thestreet,2020-11-03 08:32:49
Jim Cramer Isn't Worried About Apple's iPhone Revenue,thestreet,2020-11-03 08:32:49
Apple Plans ‘One More Thing’ Event for November 10,thestreet,2020-11-03 08:32:49
Jim Cramer Says Buy Stocks Ahead of Tuesday,thestreet,2020-11-03 08:32:49
Mondelez Tops Third-Quarter Estimates,thestreet,2020-11-03 08:32:49
Ant Group's Jack Ma called in to talk to Chinese regulators ahead of IPO,googlenews,2020-11-03 08:34:47
BNP Paribas posts profit beat for third quarter and maintains guidance for the year,googlenews,2020-11-03 08:34:47
"On election eve, stock markets are ignoring these 2 risky scenarios, warns strategist",googlenews,2020-11-03 08:34:47
The FDA's cutoff for Covid-19 vaccine effectiveness is 50 percent. What does that mean?,googlenews,2020-11-03 08:34:47
"Free food for Election Day: Get freebies at McDonald's, Wendy's, Krispy Kreme and National Sandwich Day deals Tuesday",googlenews,2020-11-03 08:34:47
"Owner of East Towne, West Towne malls files for bankruptcy protection amid COVID-19 pandemic",googlenews,2020-11-03 08:34:47
Norwegian Cruise Line ships won’t sail until 2021,googlenews,2020-11-03 08:34:47
Walmart abandons plan to have robots check store inventories,googlenews,2020-11-03 08:34:47
"What's open on Election Day? Best Buy, White Castle, Adidas have shorter hours. J Crew and Ben & Jerry's are closed",googlenews,2020-11-03 08:34:47
Elon Musk praises Tesla Gigafactory Texas’ ‘great progress’,googlenews,2020-11-03 08:34:47
Profit dives at world's largest oil company but 'signs of recovery',googlenews,2020-11-03 08:34:47
"NYPD issues pre-election warning to known rioters, agitators: 'We know who they are'",googlenews,2020-11-03 08:34:47
‘Bond King’ who called Bitcoin a lie now says BTC is a hedge against inflation,googlenews,2020-11-03 08:34:47
Global stocks and US futures climb as election day begins,googlenews,2020-11-03 08:34:47
Type 2 diabetes drug metformin recalled due to contamination with possible carcinogen,googlenews,2020-11-03 08:34:47
Twitter's Jack Dorsey survives scrutiny from activist investor,googlenews,2020-11-03 08:34:47
Reliance CEO Mukesh Ambani loses billions as oil slump hits shares,googlenews,2020-11-03 08:34:47
A New Rotation: Cramer's 'Mad Money' Recap (Monday 11/2/20),googlenews,2020-11-03 08:34:47
"Stocks making the biggest moves in the premarket: Wayfair, Jazz Pharmaceuticals, Cirrus Logic & more",googlenews,2020-11-03 08:34:47
‘We Will Fight!’ – AMC CEO Adam Aron Channels Winston Churchill; In Talks With ‘More Than A Dozen’ Strategic Investors As Chain Bleeds Red Ink,googlenews,2020-11-03 08:34:47
Oil rises ahead of US elections and as Europe locks down,googlenews,2020-11-03 08:34:47
Missing Child Alert issued for 1-year-old Pasco County boy,googlenews,2020-11-03 08:34:47
Australian Dollar Forecast: AUD/USD Tests Support Ahead of RBA,googlenews,2020-11-03 08:34:47
Whitmer administration leaves restaurants in dark on new COVID rule,googlenews,2020-11-03 08:34:47
Why 2 of Warren Buffett's 3 Worst-Performing Stocks in October Are Great Picks to Buy Right Now,googlenews,2020-11-03 08:34:47
Friendly's restaurant chain files for Chapter 11 bankruptcy protection amid pandemic woes,googlenews,2020-11-03 08:34:47
"PayPal plans a much wider embrace of cryptocurrency, including Venmo use",googlenews,2020-11-03 08:34:47
Potential stock winners and losers from Tuesday's U.S. election,googlenews,2020-11-03 08:34:47
COVID-19 antibodies vanish fast. That doesn’t mean mass reinfection looms,googlenews,2020-11-03 08:34:47
Gasoline just got less expensive in Florida and even cheaper in Tampa Bay,googlenews,2020-11-03 08:34:47
"Tired Of Trump, Deutsche Bank Reportedly Wants Out But Sees No Good Options",googlenews,2020-11-03 08:34:47
Philadelphia's historic City Tavern shutting down due to COVID-19,googlenews,2020-11-03 08:34:47
Zero-sum game: DeFi declines while Bitcoin booms,googlenews,2020-11-03 08:34:47
SEC Extends Effort to Help Private Companies Raise Capital,googlenews,2020-11-03 08:34:47
The Best Black Friday Beauty Deals To Shop In The UK,googlenews,2020-11-03 08:34:47
Dunkin' stock hits new high after $11.3 billion takeover deal,googlenews,2020-11-03 08:34:47
California company buys Ann Arbor’s LLamasoft for $1.5B,googlenews,2020-11-03 08:34:47
European markets advance ahead of U.S. election; BNP Paribas up 6%,googlenews,2020-11-03 08:34:47
Elon Musk: 'Several Thousand More' Starlink Public Beta Invites to Go Out Soon,googlenews,2020-11-03 08:34:47
"Safe-haven buying boosts gold, silver just ahead of U.S. elections",googlenews,2020-11-03 08:34:47
"SolarEdge Technologies, Inc. (SEDG) CEO Zvi Lando on Q3 2020 Results - Earnings Call Transcript",googlenews,2020-11-03 08:34:47
Everyone running for re-election has failed on coronavirus stimulus,googlenews,2020-11-03 08:34:47
Thanksgiving Family Meal Kits for Takeout in Seattle 2020,googlenews,2020-11-03 08:34:47
Encore Boston Harbor shutting down hotel temporarily,googlenews,2020-11-03 08:34:47
San Marcos-based Grande Communications sold as part of $8.1B deal,googlenews,2020-11-03 08:34:47
Gold Rises on U.S. Election Eve With Turmoil Risk Fueling Demand,googlenews,2020-11-03 08:34:47
SolarEdge Announces Third Quarter 2020 Financial Results,googlenews,2020-11-03 08:34:47
Pilots say FAA proposal for Boeing Max training needs work,googlenews,2020-11-03 08:34:47
"China’s digital yuan pilots have processed $300M so far, says PBoC head",googlenews,2020-11-03 08:34:47
"Geauga Lake property sold to developer, promises ‘Geauga Lake District’",googlenews,2020-11-03 08:34:47
Nike Announces It Will Lay Off an Additional 200 Employees at Beaverton Headquarters,googlenews,2020-11-03 08:34:47
"Toyota Teases GR Supra Targa With Removable Top, Art Car And More For Virtual SEMA",googlenews,2020-11-03 08:34:47
Ridgeland woman charged with unemployment fraud,googlenews,2020-11-03 08:34:47
Clorox CEO: Meeting unprecedented demand keeps me up at night,googlenews,2020-11-03 08:34:47
"HEB places purchasing limits on toilet paper, paper towels again",googlenews,2020-11-03 08:34:47
Burger King wants you to order from McDonald's,googlenews,2020-11-03 08:34:47
Amazon worker lawsuit over coronavirus safety dismissed by New York judge,googlenews,2020-11-03 08:34:47
Arizona Lottery searching for winner of $1 million ticket sold in Mesa,googlenews,2020-11-03 08:34:47
Ford's Electric Focus Will Be On Affordable Car And Commercial Vehicles,googlenews,2020-11-03 08:34:47
Recycling Wind Turbine Blades,googlenews,2020-11-03 08:34:47
Daimler and Volvo team up to make fuel cells for trucks and generators,googlenews,2020-11-03 08:34:47
8 from Jacksonville accused of stealing Social Security benefits,googlenews,2020-11-03 08:34:47
Volvo Is Doing A Tesla Imitation,googlenews,2020-11-03 08:34:47
You shouldn’t believe all this talk about a stock-market bubble about to burst — here’s why,googlenews,2020-11-03 08:34:47
"Last Call: So, uh, any plans tomorrow?",googlenews,2020-11-03 08:34:47
Arizona Outlines Possible Path to 100 Percent Clean Power by 2050,googlenews,2020-11-03 08:34:47
"China's manufacturing sector expands for sixth straight month as pandemic fallout fades, private survey shows",googlenews,2020-11-03 08:34:47
Strip resort gets fine for violating COVID-19 safety measures,googlenews,2020-11-03 08:34:47
"3 Big Things Today, November 2, 2020",googlenews,2020-11-03 08:34:47
"US supreme court rejects NFL, DirecTV appeal in Sunday Ticket antitrust suit",googlenews,2020-11-03 08:34:47
Jack Ma Gets Summoned by Beijing Ahead of Ant I.P.O.,googlenews,2020-11-03 08:34:47
Jack Ma Summoned by China Regulators on Eve of Ant Debut,googlenews,2020-11-03 08:34:47
Ant Group is its own GDP indicator for East versus West,googlenews,2020-11-03 08:34:47
OP-ED: What's behind the biggest IPO of all time?,googlenews,2020-11-03 08:34:47
Stocks Advance With U.S. Futures Before Election: Markets Wrap,googlenews,2020-11-03 08:34:47
BNP Paribas Profit Steady as Trading Booms,googlenews,2020-11-03 08:34:47
"BNP Paribas Has Had a Good Crisis, For Now",googlenews,2020-11-03 08:34:47
Trading revenues surge at BNP Paribas,googlenews,2020-11-03 08:34:47
China's Race for First Covid-19 Vaccine Raises Safety Questions,googlenews,2020-11-03 08:34:47
Here’s What a Covid-19 Vaccine Could Be Worth to Pfizer Stock,googlenews,2020-11-03 08:34:47
Early Covid-19 vaccine hopes have a math problem,googlenews,2020-11-03 08:34:47
Covid-vaccine distribution can take tips from how India conducts general elections,googlenews,2020-11-03 08:34:47
Election Day freebies: Here's where voters or poll workers can get free or discounted food,googlenews,2020-11-03 08:34:47
Election Day Freebies and Deals,googlenews,2020-11-03 08:34:47
"Election day freebies and deals from Krispy Kreme, McDonald’s, Planet Fitness and more",googlenews,2020-11-03 08:34:47
How to stress-eat your way through Election Day with free food,googlenews,2020-11-03 08:34:47
Owner of 4 St. Louis-area malls file for bankruptcy,googlenews,2020-11-03 08:34:47
Owner of four St. Louis area malls files for bankruptcy,googlenews,2020-11-03 08:34:47
Two major mall owners file for bankruptcy,googlenews,2020-11-03 08:34:47
"Owner of East Towne, West Towne malls files for bankruptcy protection",googlenews,2020-11-03 08:34:47
Royal Caribbean cancels December 2020 cruises while preparing to restart,googlenews,2020-11-03 08:34:47
Royal Caribbean cancels cruising for 2020,googlenews,2020-11-03 08:34:47
Now Is the Time for Cruise Lines To Shine,googlenews,2020-11-03 08:34:47
Royal Caribbean cancels cruise sailings for the rest of the year after CDC imposes strict rules,googlenews,2020-11-03 08:34:47
"Walmart ends contract with robotics company, opts for human workers instead, report says",googlenews,2020-11-03 08:34:47
"Walmart abandons shelf-scanning robots, lets humans do work",googlenews,2020-11-03 08:34:47
Walmart To Continue Exploiting Human Workforce Instead of Robot One,googlenews,2020-11-03 08:34:47
Walmart is reportedly giving up on shelf-scanning robots in favor of humans,googlenews,2020-11-03 08:34:47
"These stores, restaurants are closed on Election Day",googlenews,2020-11-03 08:34:47
"Election Day 2020: What’s open, what’s closed on Tuesday? Is Election Day a holiday? Banks, mail delivery, UP",googlenews,2020-11-03 08:34:47
Why isn't Election Day a national holiday in the U.S?,googlenews,2020-11-03 08:34:47
Are banks closed on Election Day? A look at what's open and what's not,googlenews,2020-11-03 08:34:47
"Elon Musk Raises Price of Tesla's Full Self-Driving Package to $10,000 USD",googlenews,2020-11-03 08:34:47
"Musk: Tesla Is Changing the Cybertruck and Will Unveil ""In a Month or So""",googlenews,2020-11-03 08:34:47
Tesla is changing the Cybertruck and will unveil it ‘in a month or so’,googlenews,2020-11-03 08:34:47
Elon Musk Had a Private Meeting With Volkswagen's CEO. It's a Lesson in Emotional Intelligence,googlenews,2020-11-03 08:34:47
Saudi Aramco's net profit drops 45% in the third quarter on weak oil demand,googlenews,2020-11-03 08:34:47
"Slumping oil demand, prices drive Saudi Aramco profit 44.6% lower",googlenews,2020-11-03 08:34:47
Oil Giant Aramco Keeps Dividend Despite 45% Slump in Profit,googlenews,2020-11-03 08:34:47
Saudi Aramco third-quarter profit slumps 44.6% as pandemic chokes demand,googlenews,2020-11-03 08:34:47
NYC businesses board up ahead of Election Day,googlenews,2020-11-03 08:34:47
"Macy’s, Saks and Small Stores Brace for Potential N.Y.C. Unrest",googlenews,2020-11-03 08:34:47
NYC businesses board up shops ahead of 2020 presidential election,googlenews,2020-11-03 08:34:47
"On Election Day, the NYPD must stand back",googlenews,2020-11-03 08:34:47
"The U.S. could split up, Gundlach says. Here's how he'd invest for that.",googlenews,2020-11-03 08:34:47
DoubleLine's Gundlach says he thinks gold is going up substantially (comments on Bitcoin also),googlenews,2020-11-03 08:34:47
Gold: A good holding for tail risk ahead – DoubleLine's Gundlach,googlenews,2020-11-03 08:34:47
Absurd Idea of the Day: US Could Split Into More Than One Country,googlenews,2020-11-03 08:34:47
Wall Street rises but market braced for choppy week on eve of U.S. election,googlenews,2020-11-03 08:34:47
This stock market ‘presidential predictor’ is forecasting who will win the White House,googlenews,2020-11-03 08:34:47
"World markets, Wall Street futures rise on US election day",googlenews,2020-11-03 08:34:47
"Democrats favored to take control of U.S. Senate, but results could be delayed",googlenews,2020-11-03 08:34:47
Metformin recall: Type 2 diabetes drug recalled over contamination with possible carcinogen,googlenews,2020-11-03 08:34:47
Another two lots of a diabetes drug recalled for having too much of a carcinogen,googlenews,2020-11-03 08:34:47
US authorities recall type 2 diabetes drug Metformin over contamination with nitrosamine,googlenews,2020-11-03 08:34:47
"Jack Dorsey to remain Twitter CEO, company to finally start stock-repurchase plan",googlenews,2020-11-03 08:34:47
Twitter’s Jack Dorsey Survives Scrutiny From Activist Investor,googlenews,2020-11-03 08:34:47
Dorsey wins support to stay as head of Twitter after board review,googlenews,2020-11-03 08:34:47
Bitcoin bull Jack Dorsey keeps role as Twitter CEO following board review,googlenews,2020-11-03 08:34:47
Mukesh Ambani Loses $6.5 Billion as Oil Sinks Reliance Stock,googlenews,2020-11-03 08:34:47
"Mukesh Ambani, India’s Richest Person, Loses $6.8 Billion After Reliance Shares Fall On Weak Quarterly Earnings",googlenews,2020-11-03 08:34:47
Fake News of Mukesh Ambani Suffering From Pancreatic Cancer And Undergoing Liver Transplant Goes Viral on,googlenews,2020-11-03 08:34:47
"Mukesh Ambani slipped 4 places in the list of top-10 rich, a shock of $ 6.8 billion in a single day",googlenews,2020-11-03 08:34:47
Jim Cramer reacts to JPMorgan strategists' shift from growth to value plays,googlenews,2020-11-03 08:34:47
"Clorox, determined to 'play offense,' to continue increasing ad spend",googlenews,2020-11-03 08:34:47
Monday Market Rally Worries Jim Cramer,googlenews,2020-11-03 08:34:47
Cramer's lightning round: Jumia Technologies is a 'good spec',googlenews,2020-11-03 08:34:47
Austin’s Cirrus Logic announces CEO change,googlenews,2020-11-03 08:34:47
Cirrus Logic Inc (CRUS) Q2 2021 Earnings Call Transcript,googlenews,2020-11-03 08:34:47
"COVID-19 Brutalizes AMC Theatres Quarterly Earnings, Losses Top $900 Million",googlenews,2020-11-03 08:34:47
AMC’s revenue plummets by more than 90 percent as theaters remain empty,googlenews,2020-11-03 08:34:47
AMC seeks stock sale to raise $50 million to stave off bankruptcy,googlenews,2020-11-03 08:34:47
AMC Posts Huge Loss in Latest Quarter - IGN,googlenews,2020-11-03 08:34:47
Impact Of US Election On Crude Oil Market - Researcher,googlenews,2020-11-03 08:34:47
Oil dips as surging coronavirus cases fuel demand concerns,googlenews,2020-11-03 08:34:47
Oil prices tumble as lockdowns stoke recession fears,googlenews,2020-11-03 08:34:47
The Future Landscape Of U.S. Oil,googlenews,2020-11-03 08:34:47
"Missing child alert issued for 1-year-old last seen in Pasco County area, FDLE says",googlenews,2020-11-03 08:34:47
Officers search for toddler who vanished with blue-haired woman,googlenews,2020-11-03 08:34:47
Missing 1-year-old last seen Saturday in Land O' Lakes,googlenews,2020-11-03 08:34:47
FDLE issues missing child alert for 1-year-old boy,googlenews,2020-11-03 08:34:47
RBA tipped to introduce more quantitative easing,googlenews,2020-11-03 08:34:47
Stocks in Asia-Pacific jump ahead of U.S. election; Australian central bank lowers cash rate,googlenews,2020-11-03 08:34:47
The Road Back From Covid Is Looking Long and Hard,googlenews,2020-11-03 08:34:47
Just at the moment the bank is looking like an increasingly temporary place to park your money. David Hargreaves has a look at the latest deposit statistics,googlenews,2020-11-03 08:34:47
New requirement in effect at Michigan bars and restaurants,googlenews,2020-11-03 08:34:47
"Restaurants, bars now required to take contact tracing information",googlenews,2020-11-03 08:34:47
Michigan restaurants to start collecting customer's information,googlenews,2020-11-03 08:34:47
New contact tracing for restaurant patrons begins today,googlenews,2020-11-03 08:34:47
"Another restaurant chain, Friendlys, stumbles in pandemic and declares bankruptcy. There is only one location left in MetroWest.",googlenews,2020-11-03 08:34:47
Friendly's files for bankruptcy and puts itself up for sale,googlenews,2020-11-03 08:34:47
Iconic Restaurant Chain Friendly’s Files for Bankruptcy,googlenews,2020-11-03 08:34:47
Friendly's Restaurants filing for Chapter 11 bankruptcy,googlenews,2020-11-03 08:34:47
"PayPal earnings bolstered by pandemic's e-commerce boom, but fourth-quarter profit outlook falls short",googlenews,2020-11-03 08:34:47
"PayPal’s earnings don’t excite Wall Street, but bring good news for consumer fintech",googlenews,2020-11-03 08:34:47
'This is just the beginning': PayPal CEO highlights planned push to support more digital currencies,googlenews,2020-11-03 08:34:47
PayPal: Irrational Sell-Off,googlenews,2020-11-03 08:34:47
US election result in balance on final day of campaign - BBC News,googlenews,2020-11-03 08:34:47
Potential stock winners and losers from Tuesday's U.S. election,googlenews,2020-11-03 08:34:47
Global conflict watchers issue warning of 'unfamiliar danger' ahead of US election,googlenews,2020-11-03 08:34:47
Antibody treatments: Is this the greatest hope to fight COVID-19?,googlenews,2020-11-03 08:34:47
"Regeneron, Lilly Setbacks Raise Questions on the Effectiveness of Antibodies in Severe COVID-19",googlenews,2020-11-03 08:34:47
Immunity to Covid Decreasing Per New Study,googlenews,2020-11-03 08:34:47
Regeneron to hold Covid-19 patient enrolment in antibody trial,googlenews,2020-11-03 08:34:47
"Gas prices in Idaho, US continue to drop",googlenews,2020-11-03 08:34:47
"Florida gas price discount may continue, but it’s not all good news",googlenews,2020-11-03 08:34:47
Election fuels changes in Rockford-area gas prices,googlenews,2020-11-03 08:34:47
"Gas prices continue to lower in Texas, San Antonio fares better than neighboring cities!",googlenews,2020-11-03 08:34:47
"Tired of Trump, Deutsche Bank wants out but sees no good options, sources say",googlenews,2020-11-03 08:34:47
"Deutsche Bank to cut Trump ties, call in debts after election: Reuters - Business Insider",googlenews,2020-11-03 08:34:47
"Exclusive: Tired of Trump, Deutsche Bank wants out but sees no good options - sources",googlenews,2020-11-03 08:34:47
"Exclusive: Tired of Trump, Deutsche Bank games ways to sever ties with the president – sources",googlenews,2020-11-03 08:34:47
"City Tavern, the colonial-theme restaurant in Old City, has closed",googlenews,2020-11-03 08:34:47
The famous City Tavern closes in Philadelphia because of pandemic,googlenews,2020-11-03 08:34:47
Philly's Famed City Tavern Closes After Business Decreases During Pandemic,googlenews,2020-11-03 08:34:47
Historic Old City restaurant City Tavern closes after 26 years,googlenews,2020-11-03 08:34:47
First Mover: Bitcoin Retreats Before US Election After Dominating Crypto in October,googlenews,2020-11-03 08:34:47
Bitcoin mining difficulty posts biggest drop since ASIC era,googlenews,2020-11-03 08:34:47
BTC traders caught off guard: 3 reasons Bitcoin dropped 2% in just 1 hour,googlenews,2020-11-03 08:34:47
"Blockchain Bites: Digital Yuan's 4M Transactions, Bitcoin's 33-Month High, Uniswap's Second Governance Vote",googlenews,2020-11-03 08:34:47
SEC votes to simplify exempt offering rules for securities,googlenews,2020-11-03 08:34:47
The SEC Just Made Crowdfunding Way More Interesting for Small Startups,googlenews,2020-11-03 08:34:47
SEC Makes It Easier for Crypto Startups to Raise Funds,googlenews,2020-11-03 08:34:47
SEC Finalizes Rule Change That Could (One Day) Juice Token Sales,googlenews,2020-11-03 08:34:47
The best Black Friday 2020 deals available now and coming soon,googlenews,2020-11-03 08:34:47
Cyber Monday 2020 is coming soon — here's what you need to know,googlenews,2020-11-03 08:34:47
Cyber Monday will be your last chance for really good deals in 2020 – here's why,googlenews,2020-11-03 08:34:47
When is Black Friday 2020 and where are the best UK deals?,googlenews,2020-11-03 08:34:47
Software Firm Coupa to Buy Supply-Chain Tech Provider Llamasoft,googlenews,2020-11-03 08:34:47
Ann Arbor AI supply chain company LLamasoft acquired for $1.5 billion by Silicon Valley firm Coupa,googlenews,2020-11-03 08:34:47
Coupa Software Announces Proposed Public Offering of Common Stock by Selling Stockholders,googlenews,2020-11-03 08:34:47
Ann Arbor software maker led by IIT grad bought for $1.5 billion,googlenews,2020-11-03 08:34:47
SpaceX Starlink users provide first impressions and unboxing pictures,googlenews,2020-11-03 08:34:47
Elon Musk: Thousands more Starlink beta invitations in coming days - Business Insider,googlenews,2020-11-03 08:34:47
SpaceX’s Starship rocket flight will look something like this,googlenews,2020-11-03 08:34:47
"Musk Reads: Recognize Mars as a 'free planet,' SpaceX says",googlenews,2020-11-03 08:34:47
