headline,org,date
"Netflix content ‘turning point’, Jack’s back, Samsung robots",financialtimes,2021-01-20 19:31:42
Biden Portfolio: Cramer's 'Mad Money' Recap (Wednesday 1/20/21),thestreet,2021-01-20 19:33:25
BlackRock Filings Hint at Bitcoin Futures Trading,thestreet,2021-01-20 19:33:25
"Collectors Universe Jumps on New, Higher Acquisition Offer",thestreet,2021-01-20 19:33:25
United Airlines Loses $1.9 Billion in Latest Quarter,thestreet,2021-01-20 19:33:25
Jim Cramer: Here Are the Biden Stocks,thestreet,2021-01-20 19:33:25
"Jhonsa: Netflix's Post-Earnings Surge Might Bode Well for Microsoft, Facebook and Amazon",thestreet,2021-01-20 19:33:25
Rev Shark: Tech Gives Push to Market's Rotation,thestreet,2021-01-20 19:33:25
Collins: These 2 Crown Jewels of the Electric Vehicle Industry Remain Private,thestreet,2021-01-20 19:33:25
"Graff: Janet Yellen, Interest Rates, the Fed and the Tapering Threat",thestreet,2021-01-20 19:33:25
Stocks Close at Records as Biden Becomes 46th President,thestreet,2021-01-20 19:33:25
Jack Ma Is Back but Is Alibaba? Let's Look at the Chart,thestreet,2021-01-20 19:33:25
Procter & Gamble Slips After Earnings - Is It a Buying Opportunity?,thestreet,2021-01-20 19:33:25
Microsoft Earnings Review: What Will Matter Most,thestreet,2021-01-20 19:33:25
Why Netflix Keeps on Winning,thestreet,2021-01-20 19:33:25
Tesla Extends Research Contract With Dalhousie University,thestreet,2021-01-20 19:33:25
7 Top Dividend Growth ETFs for 2021,thestreet,2021-01-20 19:33:25
This Fund Could Be ARK ETF's Next Big Winner,thestreet,2021-01-20 19:33:25
Drivers of Disruption and Innovation in the PPE Space,thestreet,2021-01-20 19:33:25
Sectors Driving Disruption in the PPE Market,thestreet,2021-01-20 19:33:25
How Major Companies Played a Role in PPE Manufacturing,thestreet,2021-01-20 19:33:25
Answering Client Questions About Investing in Gold,thestreet,2021-01-20 19:33:25
PPP Forgiveness: What Business Owners Need to Know,thestreet,2021-01-20 19:33:25
Business Trends for Financial Advisors to Watch in 2021,thestreet,2021-01-20 19:33:25
A Guide to the 1098 Form and Your Taxes,thestreet,2021-01-20 19:33:25
IRS Announces E-File Open Day! Be the First In Line for Your Tax Refund,thestreet,2021-01-20 19:33:25
Where’s My Second Stimulus Check?,thestreet,2021-01-20 19:33:25
How Jim Cramer Is Approaching Stock Market Post-Inauguration,thestreet,2021-01-20 19:33:25
"Jim Cramer Has a 'Go List' of Stocks, But Don't Be 'Too Aggressive' Here",thestreet,2021-01-20 19:33:25
Jim Cramer: What Biden Executive Orders Could Mean for EV,thestreet,2021-01-20 19:33:25
Why Ford Is One of Jim Cramer's Favorite Stocks of 2021,thestreet,2021-01-20 19:33:25
"Inauguration Day - The Best Photos of Biden, Harris and Ceremony",thestreet,2021-01-20 19:33:25
Inaugural Gifts: The Story Behind the 32 Pound Etched Vase by Lenox,thestreet,2021-01-20 19:33:25
President Joe Biden's Inauguration: A Video Timeline,thestreet,2021-01-20 19:33:25
Why Stocks Closed at All-Time Highs After Biden Was Sworn In,thestreet,2021-01-20 19:33:25
"Netflix, Utz, Polaris: 5 Top Stock Gainers for Wednesday",thestreet,2021-01-20 19:33:25
7 Stocks to Watch After President Joe Biden's Inauguration,thestreet,2021-01-20 19:33:25
IRS Announces E-File Open Day! Be the First In Line for Your Tax Refund,thestreet,2021-01-20 19:33:25
What's Next for the Stock Market Post-Inauguration?,thestreet,2021-01-20 19:33:25
"Lady Gaga, Jennifer Lopez and Others Attend Inauguration Ceremonies - Video",thestreet,2021-01-20 19:33:25
Penn National Gets Wall-Street-High Price Target at Credit Suisse,thestreet,2021-01-20 19:33:25
Stock Market Today With Jim Cramer: Buy Ford,thestreet,2021-01-20 19:33:25
"Moderna Vaccine Shipments Required Replacement, McKesson Says",thestreet,2021-01-20 19:33:25
Jim Cramer Says EV Strength Will Be Tailwind for Tesla,thestreet,2021-01-20 19:33:25
"Jim Cramer: Be 'Very, Very Careful' With P&G",thestreet,2021-01-20 19:33:25
Jim Cramer Says You'd Pay More for Your Netflix Subscription,thestreet,2021-01-20 19:33:25
Ford Rises as Deutsche Bank Adds to Short-Term-Buy List,thestreet,2021-01-20 19:33:25
Fastenal Reports Rises in Fourth-Quarter Earnings and Revenue,thestreet,2021-01-20 19:33:25
Adamis Soars After Submitting Covid Drug to FDA,thestreet,2021-01-20 19:33:25
Inauguration and the Market: How to Approach Stocks in Biden's First 100 Days,thestreet,2021-01-20 19:33:25
How Jim Cramer Is Approaching Stock Market Post-Inauguration,thestreet,2021-01-20 19:33:25
IRS Announces E-File Open Day! Be the First In Line for Your Tax Refund,thestreet,2021-01-20 19:33:25
Stock market posts best Inauguration Day rise in 36 years as Biden takes office,googlenews,2021-01-20 19:35:24
Amazon offers to help Biden speed delivery of COVID vaccines,googlenews,2021-01-20 19:35:24
United's losses mount but airline expects to surpass 2019 margins in 2023,googlenews,2021-01-20 19:35:24
States report COVID-19 vaccine shortages and cancel appointments,googlenews,2021-01-20 19:35:24
Procter & Gamble Gets Shoppers to Pay Up,googlenews,2021-01-20 19:35:24
BlackRock Gives 2 Funds Go-Ahead to Invest in Bitcoin Futures - CoinDesk,googlenews,2021-01-20 19:35:24
First Cruise Line Officially Requires Vaccines — Will Others Follow?,googlenews,2021-01-20 19:35:24
Trump pardons engineer who copped to stealing a Google secret for Uber,googlenews,2021-01-20 19:35:24
Kinder Morgan Announces Results for Fourth Quarter of 2020; Maintains $0.2625 Per Share Dividend,googlenews,2021-01-20 19:35:24
Mega Millions ticket worth $1 million sold in Lancaster County,googlenews,2021-01-20 19:35:24
"Tesla Inc. stock rises Wednesday, still underperforms market",googlenews,2021-01-20 19:35:24
COVID SCIENCE-S. African virus variant may resist antibody ...,googlenews,2021-01-20 19:35:24
"Alibaba Stock Jumps As Jack Ma Resurfaces, Prompting Sigh Of Relief",googlenews,2021-01-20 19:35:24
Treasury nominee Yellen is looking to curtail use of cryptocurrency,googlenews,2021-01-20 19:35:24
We look at a Ethereum as a crypto-cloud stock and the next possible step of cloud computing: Fundstrat Strategist,googlenews,2021-01-20 19:35:24
Netflix shares see their biggest jump in four years,googlenews,2021-01-20 19:35:24
MyPillow CEO Throws On-Air Tantrum After Retailers Drop His Products Over His Support Of Capitol Riot,googlenews,2021-01-20 19:35:24
"Goldman, Morgan Stanley and JPMorgan make the case for higher valuations by separating from the pack",googlenews,2021-01-20 19:35:24
Consumer bureau director resigns after Biden's inauguration | TheHill,googlenews,2021-01-20 19:35:24
3 Stocks Kicking Off 2021 With Good News,googlenews,2021-01-20 19:35:24
GM's Cruise Partners With Microsoft Because Carmakers Can't Go It Alone Anymore,googlenews,2021-01-20 19:35:24
Security firm Malwarebytes was infected by same hackers who hit SolarWinds,googlenews,2021-01-20 19:35:24
Charter Waves the White Flag on Data Caps as Trump Leaves the Building,googlenews,2021-01-20 19:35:24
"Some CVS, Walgreens locations will soon start offering COVID-19 vaccinations to eligible Massachusetts residents",googlenews,2021-01-20 19:35:24
Aldi becomes latest company to pay employees to take Covid-19 vaccine,googlenews,2021-01-20 19:35:24
Fixed-rate student loan refinancing hits new low in January,googlenews,2021-01-20 19:35:24
Trump's booming stock market in peril as Biden assumes presidency,googlenews,2021-01-20 19:35:24
Volkswagen boss joins Twitter with a jab at Elon Musk,googlenews,2021-01-20 19:35:24
Porsche Pits Taycan Turbo Against 911 GT3 RS & 911 GT3 Cup: Track & Drag,googlenews,2021-01-20 19:35:24
In-person dining at Baltimore restaurants to resume Friday,googlenews,2021-01-20 19:35:24
"Ford must recall 3 million cars with Takata airbags, NHTSA rules",googlenews,2021-01-20 19:35:24
Stellantis jumps 11% in NYSE debut. Here's what you need to know about the world's fourth-largest automaker,googlenews,2021-01-20 19:35:24
Hahn Resigns as F.D.A. Commissioner; Woodcock Named Interim Chief,googlenews,2021-01-20 19:35:24
Telegram: Extremists’ new favorite messaging and social media app,googlenews,2021-01-20 19:35:24
Royal Caribbean Is Selling Its Azamara Cruise Line in $201 Million Deal,googlenews,2021-01-20 19:35:24
Germany to talk to Biden team over securing changes to vaccine distribution,googlenews,2021-01-20 19:35:24
"Plan to vaccinate 2,000 seniors a day on pause in Stanislaus County",googlenews,2021-01-20 19:35:24
Matt Damon looks to sell California home for $21 million,googlenews,2021-01-20 19:35:24
Google is investigating an AI researcher over the handling of sensitive data,googlenews,2021-01-20 19:35:24
Best Buy plans to close Destiny USA store,googlenews,2021-01-20 19:35:24
Mercedes-Benz unveils EQA electric crossover with less than 300 miles of range,googlenews,2021-01-20 19:35:24
"Biden greets, fist bumps media members on his way into White House | TheHill",googlenews,2021-01-20 19:35:24
FuelCell (FCEL) to Report Q4 Earnings: What's in the Offing?,googlenews,2021-01-20 19:35:24
SpaceX Repurposing Oil Rigs From Bankrupt Valaris as Floating Launch Pads,googlenews,2021-01-20 19:35:24
Officials urge pause to Moderna vaccine after allergic reactions,googlenews,2021-01-20 19:35:24
Are Unemployment Benefits Taxable?,googlenews,2021-01-20 19:35:24
Over $5B in US small business relief loans approved in first week -SBA,googlenews,2021-01-20 19:35:24
Spike in lumber and land prices causes homebuilder confidence to fall from epic high,googlenews,2021-01-20 19:35:24
Netflix confirms Shuffle Play feature will officially launch this year,googlenews,2021-01-20 19:35:24
Plug Power Drops After Kerrisdale Unveils Short Position,googlenews,2021-01-20 19:35:24
"Michigan Enters Online Sports Betting Game, With Barstool And DraftKings Ready To Roll",googlenews,2021-01-20 19:35:24
Lake County to reopen immunization scheduling system at 11 a.m. today,googlenews,2021-01-20 19:35:24
Girl Scouts are boycotting cookie season in protest over palm oil concerns: 'They didn't feel it was right to do',googlenews,2021-01-20 19:35:24
Illinois Coronavirus Updates: Chicago Releases New Details on Vaccine Plan,googlenews,2021-01-20 19:35:24
Ether's Rise to Record Highs May Propel Cryptocurrency to $10.5K: Fundstrat Global - CoinDesk,googlenews,2021-01-20 19:35:24
Electric vehicle shocker: StoreDot develops battery that can be charged in five minutes,googlenews,2021-01-20 19:35:24
Obalon Therapeutics stock soars to lead all gainers on massive volume after ReShape merger deal,googlenews,2021-01-20 19:35:24
Parler moves to hosting service owned by Russians after ban,googlenews,2021-01-20 19:35:24
"Watch Out AMD, Intel Is Waking From Its Slumber",googlenews,2021-01-20 19:35:24
Indian stock exchanges clear Future-Reliance deal in setback for Amazon,googlenews,2021-01-20 19:35:24
Stock Market Today With Jim Cramer: Buy Ford,googlenews,2021-01-20 19:35:24
Why Rivian Is On A Roll (And Will Win The Electric Pickup Race),googlenews,2021-01-20 19:35:24
Mobileye CEO Says Tesla's Self Driving Effort Likely To Hit 'Glass Ceiling',googlenews,2021-01-20 19:35:24
Why Solar Energy Stocks Jumped on Tuesday,googlenews,2021-01-20 19:35:24
2 Spirit Airlines agents injured after passengers attack them over size of carry-on bags,googlenews,2021-01-20 19:35:24
"A man was ‘scared to go home due to covid.’ So he spent three months living in Chicago airport, prosecutors say.",googlenews,2021-01-20 19:35:24
"Belk's top lenders, including KKR, looking to avoid taking department store through bankruptcy, WSJ says",googlenews,2021-01-20 19:35:24
Coronavirus: 110 new deaths reported in Orange County over Jan. 18-19,googlenews,2021-01-20 19:35:24
"3 Common Retirement Regrets, and What to Do About Them",googlenews,2021-01-20 19:35:24
"MyPillow's Lindell shrugs off distancing by retailers, presses election fraud claim",googlenews,2021-01-20 19:35:24
"Dow, S&P, Nasdaq close at records as Biden sworn in as 46th U.S. President",googlenews,2021-01-20 19:35:24
"Analysis: Stimulus plans fuel Biden trade, but Wall Street wonders if it can continue",googlenews,2021-01-20 19:35:24
Five Drivers of Markets in a Biden Administration,googlenews,2021-01-20 19:35:24
"ANALYSIS-Stimulus plans fuel Biden trade, but Wall Street wonders if it can continue",googlenews,2021-01-20 19:35:24
Read the full letter Amazon sent to Biden offering to help with Covid-19 vaccines,googlenews,2021-01-20 19:35:24
Amazon to Biden: Prioritize our workers for the vaccine,googlenews,2021-01-20 19:35:24
Amazon offers to help Biden administration with vaccinations,googlenews,2021-01-20 19:35:24
Amazon's Dave Clark offers to help Biden with COVID vaccination effort - Business Insider,googlenews,2021-01-20 19:35:24
United Airlines posts fourth straight quarterly loss and pledges more cost cuts,googlenews,2021-01-20 19:35:24
United Airlines Records $7.1bn Loss For 2020,googlenews,2021-01-20 19:35:24
United Airlines lost $7 billion in 2020 as the pandemic crushed the travel business.,googlenews,2021-01-20 19:35:24
United Airlines Stock Eyes Buy Point Ahead Of Q4 Earnings,googlenews,2021-01-20 19:35:24
Vaccine mailbag: Answers to questions you had about the COVID-19 vaccine,googlenews,2021-01-20 19:35:24
States report vaccine shortages and cancel appointments,googlenews,2021-01-20 19:35:24
In-depth: How the Johnson & Johnson coronavirus vaccine works,googlenews,2021-01-20 19:35:24
"These 11 States Rank Worst in Vaccine Rollout, Says CDC",googlenews,2021-01-20 19:35:24
Procter & Gamble CFO on Q2 earnings beat and raised outlook,googlenews,2021-01-20 19:35:24
P/E Ratio Insights for Procter & Gamble,googlenews,2021-01-20 19:35:24
"P&G raises forecast after earnings top expectations, fueled by 8% jump in sales",googlenews,2021-01-20 19:35:24
Procter & Gamble gets big lift as Americans continue their clean-freak ways,googlenews,2021-01-20 19:35:24
BlackRock filings suggest asset management giant could buy bitcoin futures via certain funds,googlenews,2021-01-20 19:35:24
BlackRock May Start Trading Bitcoin Futures in its Funds,googlenews,2021-01-20 19:35:24
BlackRock Takes First Step Into Crypto Exposure in Two Funds,googlenews,2021-01-20 19:35:24
World's largest asset manager applies to buy bitcoins in pair of funds,googlenews,2021-01-20 19:35:24
Saga cruises says all customers must be vaccinated,googlenews,2021-01-20 19:35:24
Cruise Line Requires All Guests To Be Vaccinated,googlenews,2021-01-20 19:35:24
Saga requires all cruise customers to have Covid vaccine,googlenews,2021-01-20 19:35:24
Saga requires all cruise passengers to have coronavirus vaccine,googlenews,2021-01-20 19:35:24
Trump pardons former Google engineer Anthony Levandowski,googlenews,2021-01-20 19:35:24
Former Google Self-Driving Engineer Levandowski Gets Trump Pardon In Last Night Clemency Spree,googlenews,2021-01-20 19:35:24
Former Google engineer Anthony Levandowski among list of last-minute Trump pardons,googlenews,2021-01-20 19:35:24
"Pardon Me, Did I Do Something Wrong?",googlenews,2021-01-20 19:35:24
Kinder Morgan: The Beat Of A Different Drum,googlenews,2021-01-20 19:35:24
Mega Millions jackpot rises to $970 million with no winners Tuesday,googlenews,2021-01-20 19:35:24
Million-dollar lottery won in Atlantic City,googlenews,2021-01-20 19:35:24
Mississippi Lottery player wins $1 million,googlenews,2021-01-20 19:35:24
Mega Millions jackpot climbs to $970M after Tuesday's drawing finds no winner,googlenews,2021-01-20 19:35:24
Microsoft Corp. stock outperforms market on strong trading day,googlenews,2021-01-20 19:35:24
"Moderna Inc. stock rises Wednesday, still underperforms market",googlenews,2021-01-20 19:35:24
Alphabet Inc. Cl A stock outperforms market on strong trading day,googlenews,2021-01-20 19:35:24
Pfizer Inc. stock underperforms Wednesday when compared to competitors,googlenews,2021-01-20 19:35:24
"Israel is warning that a single dose of the Pfizer vaccine is 'less effective than we hoped' against COVID-19, and it could be a blow to the US and UK strategies",googlenews,2021-01-20 19:35:24
Pfizer tells Canada it will not receive any Covid-19 vaccine doses next week,googlenews,2021-01-20 19:35:24
Wondering when you can get the Covid vaccine? Here's why it's so hard to get an appointment,googlenews,2021-01-20 19:35:24
"A single dose of COVID vaccine may help, but it's not enough",googlenews,2021-01-20 19:35:24
Alibaba's Jack Ma makes first public appearance since October,googlenews,2021-01-20 19:35:24
Billionaire Alibaba founder Jack Ma makes first public appearance in three months,googlenews,2021-01-20 19:35:24
Jack Ma makes his first public appearance in months,googlenews,2021-01-20 19:35:24
"Jack Ma Emerges for First Time Since Ant, Alibaba Crackdown",googlenews,2021-01-20 19:35:24
Jim Cramer reacts to Janet Yellen Treasury confirmation testimony,googlenews,2021-01-20 19:35:24
"'Act big' now to save economy, worry about debt later, Yellen says in Treasury testimony",googlenews,2021-01-20 19:35:24
Why the US dollar’s mini-revival won’t take the wind out of yuan rally,googlenews,2021-01-20 19:35:24
Janet Yellen’s Confirmation Hearing Provides a Glimpse Into the Biden Era,googlenews,2021-01-20 19:35:24
"President Biden to boost US mining, green energy metals - MINING.COM",googlenews,2021-01-20 19:35:24
British PM Johnson says he's looking forward to working with Biden,googlenews,2021-01-20 19:35:24
Vice President Kamala Harris now lives in this house,googlenews,2021-01-20 19:35:24
Hours of Work Needed to Pay Rent in the 10 Largest Cities,googlenews,2021-01-20 19:35:24
"Netflix, IBD Stock Of The Day, Soars On Improved Finances, Possible Buybacks",googlenews,2021-01-20 19:35:24
Netflix Surpasses 200 Million Subscribers - IGN,googlenews,2021-01-20 19:35:24
"Netflix, HBO Max, Disney+ Face Reckoning With Churn",googlenews,2021-01-20 19:35:24
"Netflix and Disney are trading places: Disney is the upstart, Netflix the old guard",googlenews,2021-01-20 19:35:24
Stores drop MyPillow after CEO pushes election conspiracies,googlenews,2021-01-20 19:35:24
Affirm ending relationship with My Pillow and Mike Lindell - Business Insider,googlenews,2021-01-20 19:35:24
MyPillow Doesn't Have Stock and Isn't Publicly Traded,googlenews,2021-01-20 19:35:24
Is My Pillow being 'cancelled' or is its CEO trashing the business all on his own?,googlenews,2021-01-20 19:35:24
Morgan Stanley Fourth-Quarter Trading Beats Estimates,googlenews,2021-01-20 19:35:24
Wall Street Traders Propelled Bumper Quarter for Biggest Banks,googlenews,2021-01-20 19:35:24
"Stocks making the biggest moves in the premarket: Morgan Stanley, Netflix, Pearson & more",googlenews,2021-01-20 19:35:24
"Morgan Stanley Profit Shoots Higher, Fueled by Wall Street",googlenews,2021-01-20 19:35:24
U.S. consumer watchdog director resigns at request of Biden administration,googlenews,2021-01-20 19:35:24
CFPB Director Kathy Kraninger resigns at Biden’s request,googlenews,2021-01-20 19:35:24
Biden's pick for CFPB chief outspoken about enhanced regs for dealers,googlenews,2021-01-20 19:35:24
Trump Consumer Watchdog Kraninger Steps Down at Biden’s Request,googlenews,2021-01-20 19:35:24
Microsoft invests in $30 billion driverless car company Cruise,googlenews,2021-01-20 19:35:24
"Microsoft joins self-driving race in new deal with Cruise, GM",googlenews,2021-01-20 19:35:24
Microsoft invests in Cruise in new $2 billion round,googlenews,2021-01-20 19:35:24
Microsoft bets on GM’s Cruise while Amazon and others back Rivian amid electric vehicle boom,googlenews,2021-01-20 19:35:24
Malwarebytes said it was hacked by the same group who breached SolarWinds,googlenews,2021-01-20 19:35:24
SolarWinds Hackers Access Malwarebytes' Office 365 Emails,googlenews,2021-01-20 19:35:24
SolarWinds hackers also targeted security specialist Malwarebytes,googlenews,2021-01-20 19:35:24
Malwarebytes 'remains safe to use' following attack from SolarWinds threat actor,googlenews,2021-01-20 19:35:24
CVS hiring for vaccine roll out,googlenews,2021-01-20 19:35:24
Why the vaccine rollout was a disaster - Business Insider,googlenews,2021-01-20 19:35:24
1ST IN THE NATION: CVS Health and Walgreens pharmacies launch COVID-19 vaccine sites in Massachusett,googlenews,2021-01-20 19:35:24
"When can I get a COVID vaccine at Walgreens, CVS in N.J.? It depends.",googlenews,2021-01-20 19:35:24
"Companies offering cash, pay incentives to encourage workers to get COVID-19 vaccine",googlenews,2021-01-20 19:35:24
"Aldi workers who get COVID-19 vaccine will receive extra pay, company says",googlenews,2021-01-20 19:35:24
Here's a list of companies paying employees to get Covid-19 vaccinations,googlenews,2021-01-20 19:35:24
Aldi is the latest company to offer employees money for taking the COVID-19 vaccine - Business Insider,googlenews,2021-01-20 19:35:24
Weekly mortgage refinance demand drops 5% after rates hit highest level since November,googlenews,2021-01-20 19:35:24
5/1 adjustable-rate mortgage falls to new record low,googlenews,2021-01-20 19:35:24
Top 5 mortgage refinance questions answered,googlenews,2021-01-20 19:35:24
0% Mortgage Rates Reach Europe. Could That Happen in the U.S.?,googlenews,2021-01-20 19:35:24
Stock market surges as Biden is inaugurated president,googlenews,2021-01-20 19:35:24
Stock market near session highs in record territory Wednesday midday as Biden emphasizes unity in inaugural address,googlenews,2021-01-20 19:35:24
"Jamie Lynn Spears clarifies Tesla, Elon Musk comments blaming them for her cats' deaths",googlenews,2021-01-20 19:35:24
VW CEO teases Tesla’s Elon Musk in Twitter debut,googlenews,2021-01-20 19:35:24
Why Tesla is not a safe stock for long-term investors,googlenews,2021-01-20 19:35:24
No one should be as rich as Elon Musk,googlenews,2021-01-20 19:35:24
Low-priced Porsche Taycan electric sedan launched to take on Tesla Model S,googlenews,2021-01-20 19:35:24
"Porsche adds a cheaper, lighter Taycan to its electric lineup",googlenews,2021-01-20 19:35:24
"Finally Porsche Has Unveiled Its Sub-$100,000 Electric Sedan For The Slightly Less Wealthy Masses",googlenews,2021-01-20 19:35:24
Porsche Taycan gets a new rear-drive model that's the most affordable by far,googlenews,2021-01-20 19:35:24
"COVID-19 Latest: Restaurant Dining, More To Reopen In Baltimore Friday",googlenews,2021-01-20 19:35:24
"Scott lifts some Baltimore dining restrictions, but imposes eating time limits",googlenews,2021-01-20 19:35:24
"Baltimore to allow indoor and outdoor dining to resume Friday, with one hour time limit for patrons",googlenews,2021-01-20 19:35:24
"Some Baltimore restaurateurs say reopening now is too little, too late",googlenews,2021-01-20 19:35:24
Feds reject Ford and Mazda request on recalls,googlenews,2021-01-20 19:35:24
U.S. agency orders Ford to recall 3 million vehicles over air bags,googlenews,2021-01-20 19:35:24
Takata Airbags Recalled Again,googlenews,2021-01-20 19:35:24
"Ford Must Recall 3M Vehicles Due To Dangerous Airbags, Orders NHTSA",googlenews,2021-01-20 19:35:24
FDA Drowned in 'Junk Science'; Sorting Out COVID Variants; Vax Distribution Chaos,googlenews,2021-01-20 19:35:24
India ministry reportedly asked WhatsApp to drop privacy policy changes that sparked backlash,googlenews,2021-01-20 19:35:24
The best WhatsApp alternatives for 2021,googlenews,2021-01-20 19:35:24
KATE THOMPSON DAVY: Facebook ironically played a role in WhatsApp panic,googlenews,2021-01-20 19:35:24
The WhatsApp nation,googlenews,2021-01-20 19:35:24
Royal Caribbean to sell its Azamara brand including 3 ships for $201 million as the company continues to push back 2021 sail dates,googlenews,2021-01-20 19:35:24
Royal Caribbean to sell luxury Azamara cruise line for $201M,googlenews,2021-01-20 19:35:24
Cruise questions first time cruisers are too shy to ask!,googlenews,2021-01-20 19:35:24
Royal Caribbean Won’t Go Down Without A Fight,googlenews,2021-01-20 19:35:24
The Latest: Portugal leads in average virus cases per capita,googlenews,2021-01-20 19:35:24
Italy says it will sue Pfizer over delays in vaccine delivery.,googlenews,2021-01-20 19:35:24
Italy considers legal action over Pfizer vaccine delivery delays,googlenews,2021-01-20 19:35:24
"Delay in Pfizer vaccine shipments frustrate Europe, Canada",googlenews,2021-01-20 19:35:24
Moderna says possible allergic reactions to COVID-19 vaccine under investigation,googlenews,2021-01-20 19:35:24
"Allergic reactions to COVID-19 vaccine remain ‘overwhelmingly rare,’ says expert",googlenews,2021-01-20 19:35:24
San Diego mom describes allergic reaction to Moderna vaccine,googlenews,2021-01-20 19:35:24
Moderna Investigating Reports of Allergic Reactions to Its Coronavirus Vaccine,googlenews,2021-01-20 19:35:24
Matt Damon Is Selling His Luxurious $21 Million Los Angeles Home — See Inside!,googlenews,2021-01-20 19:35:24
Matt Damon Lists Pacific Palisades Mansion for $21 Million,googlenews,2021-01-20 19:35:24
Matt Damon’s Zen retreat in the Palisades lists for $21 million,googlenews,2021-01-20 19:35:24
Matt Damon Lists Pacific Palisades Home for $21 Million,googlenews,2021-01-20 19:35:24
Scoop: Google is investigating the actions of another top AI ethicist,googlenews,2021-01-20 19:35:24
Margaret Mitchell: Google (GOOG) Sidelines New AI Researcher After Timnit Gebru,googlenews,2021-01-20 19:35:24
Google targets AI ethics lead Margaret Mitchell after firing Timnit Gebru,googlenews,2021-01-20 19:35:24
Google takes action against another outspoken A.I. ethics researcher,googlenews,2021-01-20 19:35:24
"Best Buy in Destiny USA to close, 'WARN' notice states",googlenews,2021-01-20 19:35:24
Destiny USA is losing another anchor store,googlenews,2021-01-20 19:35:24
Best Buy closing at Destiny USA,googlenews,2021-01-20 19:35:24
Best Buy at Destiny USA to close in March,googlenews,2021-01-20 19:35:24
Mercedes-Benz' EQA crossover is its first sub-$50000 EV,googlenews,2021-01-20 19:35:24
Mercedes unveils electric compact SUV in bid to outdo Tesla,googlenews,2021-01-20 19:35:24
