headline,org,date
Behind AstraZeneca’s Covid-19 Vaccine Stumble,googlenews,2021-01-29 09:55:13
Gov. Cox becoming more optimistic about COVID-19 vaccine as Utah sees 1761 more cases,googlenews,2021-01-29 09:55:13
"If You're Over 65, You Shouldn't Get This New Vaccine, Experts Warn",googlenews,2021-01-29 09:55:13
"Pfizer Inc. stock rises Thursday, still underperforms market",googlenews,2021-01-29 09:55:13
Robinhood Raises Over $1 Billion From Investors,googlenews,2021-01-29 09:55:13
ECB's Bitcoin Warning: Be Prepared to Lose All Your Money,googlenews,2021-01-29 09:55:13
Hedge fund billionaire Leon Cooperman slams GameStop surge as 'attack on wealthy',googlenews,2021-01-29 09:55:13
The variant that emerged in South Africa is reported in the U.S. for the first time.,googlenews,2021-01-29 09:55:13
"Another 847,000 Americans filed for unemployment benefits in Joe Biden's first week as president",googlenews,2021-01-29 09:55:13
COVID-19 pummels U.S. economy in 2020; performance weakest in 74 years,googlenews,2021-01-29 09:55:13
China's army of small investors want in on the GameStop mania,googlenews,2021-01-29 09:55:13
"Novavax says COVID-19 vaccine is 89.3% effective in UK trial, less in South Africa",googlenews,2021-01-29 09:55:13
Utah Jazz owner Ryan Smith made $153 million in Qualtrics IPO a day after his NBA team snagged first place,googlenews,2021-01-29 09:55:13
Dow jumps 300 points as market stages a strong comeback from biggest sell-off in 3 months,googlenews,2021-01-29 09:55:13
"Walgreens' new CEO Roz Brewer on bias in the C-suite: 'When you’re a Black woman, you get mistaken a lot'",googlenews,2021-01-29 09:55:13
Toyota overtakes Volkswagen as world's biggest automaker,googlenews,2021-01-29 09:55:13
"Discord has turned into a virtual trade floor with memes, stonks, and chaos",googlenews,2021-01-29 09:55:13
"Comcast reports record internet customers, 33 million Peacock sign-ups for NBCUniversal",googlenews,2021-01-29 09:55:13
"From No. 1 to No. 6, Huawei smartphone shipments plunge 41% as U.S. sanctions bite",googlenews,2021-01-29 09:55:13
"Coinbase plans to go public through a direct listing, following Spotify, Slack and Palantir",googlenews,2021-01-29 09:55:13
Reddit user explains short-seller squeeze inception,googlenews,2021-01-29 09:55:13
Billionaire Mets owner Steve Cohen is slammed by team fans and critics over GameStop fiasco,googlenews,2021-01-29 09:55:13
Robinhood CEO speaks to Cuomo after GameStop stock chaos,googlenews,2021-01-29 09:55:13
International police effort takes down 'world's most dangerous' malware network,googlenews,2021-01-29 09:55:13
The ECB is sticking to its block on bank dividends ... for now,googlenews,2021-01-29 09:55:13
Facebook's strong quarter raises social-media stocks,googlenews,2021-01-29 09:55:13
"Mark Cuban says his 11-year-old son 'made trades' in AMC, BlackBerry with Reddit's WallStreetBets: 'He hasn't made money yet'",googlenews,2021-01-29 09:55:13
General Motors partners with Navistar to supply fuel-cell technology for new semitruck,googlenews,2021-01-29 09:55:13
Justice Department investigating Elon Musk's SpaceX following complaint of hiring discrimination,googlenews,2021-01-29 09:55:13
FDA places all alcohol-based hand sanitizers from Mexico on 'import alert',googlenews,2021-01-29 09:55:13
How hedges funds are faring right now amid GameStop short squeeze,googlenews,2021-01-29 09:55:13
Silver Surges as GameStop Day Traders Move Into Other Assets,googlenews,2021-01-29 09:55:13
The Top 5 Most Produced Commercial Aircraft In History,googlenews,2021-01-29 09:55:13
"Buh-bye, skinny jeans: Levi's is embracing a baggy look",googlenews,2021-01-29 09:55:13
Billionaire Peterffy Worried About Integrity of Markets,googlenews,2021-01-29 09:55:13
Reddit Ignites Mall Stock and Fund Cashes Out $500 Million,googlenews,2021-01-29 09:55:13
2021 just got worse: Now there's a Grape-Nuts shortage,googlenews,2021-01-29 09:55:13
How retail investors shook up stocks more than Apple and Microsoft earnings,googlenews,2021-01-29 09:55:13
Tech investor Chamath Paliyhapita shreds California governor: He has done a terrible job,googlenews,2021-01-29 09:55:13
Marlboro maker Altria said cigarette industry shipments flattened in 2020 after years of declines,googlenews,2021-01-29 09:55:13
2022 Acura MDX first drive review: A sharper and smarter luxury SUV,googlenews,2021-01-29 09:55:13
"Chinese consumer spending is set to double by 2030, Morgan Stanley predicts",googlenews,2021-01-29 09:55:13
SSC Tuatara Is Officially The Fastest Production Car In The World,googlenews,2021-01-29 09:55:13
Want greener cars? Focus on fuel efficiency over electric vehicles,googlenews,2021-01-29 09:55:13
His day started with a collision in his brand-new car. It ended with a $2 million lottery prize,googlenews,2021-01-29 09:55:13
Robinhood restricts crypto trading due to market conditions,googlenews,2021-01-29 09:55:13
Virgin Hyperloop shares step-by-step video of its passenger experience,googlenews,2021-01-29 09:55:13
2022 Tesla Model S & Model X REVEALED! – radical changes in detail | What Car?,googlenews,2021-01-29 09:55:13
"Dow Jones Jumps, But Apple, Tesla Slide On Earnings; GME Stock Plunges 67% On Robinhood Ban",googlenews,2021-01-29 09:55:13
"AMD CEO Lisa Su on Q4 earnings, demand and product pipeline",googlenews,2021-01-29 09:55:13
Sen. Sherrod Brown intends to hold hearing on stock market amid GameStop squeeze,googlenews,2021-01-29 09:55:13
Some people see GameStop as a stick-it-to-the-man opportunity: Sorkin,googlenews,2021-01-29 09:55:13
GameStop short squeeze pits small investors vs hedge fund short sellers,googlenews,2021-01-29 09:55:13
GameStop surges 100% as some trading restrictions are lifted,googlenews,2021-01-29 09:55:13
That shoeshine boy with stock tips is now on Reddit and Robinhood — and this bubble will burst like all the others,googlenews,2021-01-29 09:55:13
Opinion | Taking GameStop 'To the Moon': Reddit vs. the Elites,googlenews,2021-01-29 09:55:13
Johnson & Johnson’s Vaccine Offers Strong Protection but Fuels Concern About Variants,googlenews,2021-01-29 09:55:13
"Johnson & Johnson Covid-19 vaccine is 66% effective in global trial, but 85% effective against severe disease, company says",googlenews,2021-01-29 09:55:13
"Johnson & Johnson COVID-19 vaccine 66% effective in global trial, company says",googlenews,2021-01-29 09:55:13
J&J Covid Vaccine Is 66% Effective In Global Clinical Trial,googlenews,2021-01-29 09:55:13
G.M. Will Sell Only Zero-Emission Vehicles by 2035,googlenews,2021-01-29 09:55:13
"GM Says ""We're Going Zero Tailpipe By 2035, Carbon Neutral By 2040"" Will It? Can It?",googlenews,2021-01-29 09:55:13
Opinion: GM ‘aspires’ to be fully electric by 2035. Is that enough? (No),googlenews,2021-01-29 09:55:13
Forgive me for being skeptical about GM and other automakers' lofty carbon ambitions,googlenews,2021-01-29 09:55:13
Covid-19: Novavax vaccine shows 89% efficacy in UK trials @BBC News live - BBC,googlenews,2021-01-29 09:55:13
Novavax’s Vaccine Works Well — Except on Variant First Found in South Africa,googlenews,2021-01-29 09:55:13
Novavax interim data shows its vaccine is 89% effective in U.K. trial,googlenews,2021-01-29 09:55:13
Canada and UK among countries with most vaccine doses ordered per person,googlenews,2021-01-29 09:55:13
Exclusive: AMC Entertainment explores new capital raise amid stock surge - sources,googlenews,2021-01-29 09:55:13
"AMC’s Sudden Surge Makes Winners of Silver Lake, Mudrick",googlenews,2021-01-29 09:55:13
EXCLUSIVE-AMC Entertainment explores new capital raise amid stock surge-sources,googlenews,2021-01-29 09:55:13
Why I'm Not Buying Into the AMC Stock Hype,googlenews,2021-01-29 09:55:13
Chevron Posts Quarterly Loss to Cap Worst Year Since 2016,googlenews,2021-01-29 09:55:13
Chevron Announces Fourth Quarter 2020 Results,googlenews,2021-01-29 09:55:13
"Chevron swings to fourth quarter loss on weak refining, charges",googlenews,2021-01-29 09:55:13
Chevron posts $665m fourth-quarter loss as oil demand drop sinks revenues,googlenews,2021-01-29 09:55:13
"Subway tuna is not tuna, lawsuit alleges",googlenews,2021-01-29 09:55:13
"Subway's tuna doesn't actually have tuna in it, suit claims",googlenews,2021-01-29 09:55:13
"Subway’s tuna does not contain tuna, lawsuit claims, saying the ‘ingredients were not tuna and not fish’",googlenews,2021-01-29 09:55:13
Subway accused of selling fake tuna in footlong fraud lawsuit,googlenews,2021-01-29 09:55:13
Tesla Model 3 Performance 2021 review: see how quick it is 0-60mph... And easy to drift!,googlenews,2021-01-29 09:55:13
"Turkey, Elon Musk’s SpaceX mull new space projects",googlenews,2021-01-29 09:55:13
Tesla Model S upgrade comes with super fast Plaid Mode and 520 miles of range,googlenews,2021-01-29 09:55:13
Battery-cell shortage hinders Tesla's production of Semi truck,googlenews,2021-01-29 09:55:13
"Reddit frenzy pumps up Dogecoin, a cryptocurrency started as a joke, by over 800%",googlenews,2021-01-29 09:55:13
Elon Musk Tweets In Support Of Dogecoin After Price Grows 420% In A Day,googlenews,2021-01-29 09:55:13
WallStreetBets craze pushes dogecoin up 5x in 24 hours,googlenews,2021-01-29 09:55:13
Robinhood restricts crypto trading 'due to extraordinary market conditions',googlenews,2021-01-29 09:55:13
Every crazy thing that happened in Apple and Facebook’s privacy feud today,googlenews,2021-01-29 09:55:13
Facebook CEO Mark Zuckerberg on seeing Apple as one of our biggest competitors,googlenews,2021-01-29 09:55:13
Facebook and Apple Blowout Profits Fail to Satisfy,googlenews,2021-01-29 09:55:13
Apple CEO links Facebook's business model to real-world violence,googlenews,2021-01-29 09:55:13
"Stocks making the biggest moves in the premarket: American Airlines, GameStop, Apple & more",googlenews,2021-01-29 09:55:13
Pandemic pushes Southwest to first full-year loss since 1972,googlenews,2021-01-29 09:55:13
Reddit Traders Turn to American Airlines After GameStop,googlenews,2021-01-29 09:55:13
American Airlines spikes more than 30 percent after mention in Reddit forum,googlenews,2021-01-29 09:55:13
Chinese Conglomerate HNA Says Creditors Filed Petition for Its Bankruptcy,googlenews,2021-01-29 09:55:13
HNA Group enters bankruptcy restructuring as it buckles under debt,googlenews,2021-01-29 09:55:13
"China's HNA Group faces bankruptcy, restructuring ruling",googlenews,2021-01-29 09:55:13
China Plans Sale of HNA's Non-Aviation Assets Via Trust,googlenews,2021-01-29 09:55:13
Biden order could turn out to be ‘nail in the coffin’ for oil and gas,googlenews,2021-01-29 09:55:13
Russia Expects Oil Between $45 And $80 By 2035,googlenews,2021-01-29 09:55:13
Editorial: Get ready for higher energy prices,googlenews,2021-01-29 09:55:13
North Dakota Senators introduce POWER Act to protect oil and gas industry,googlenews,2021-01-29 09:55:13
Just 0.04% of Israelis caught COVID-19 after two shots of Pfizer vaccine,googlenews,2021-01-29 09:55:13
"Israel moves to head of vaccine queue, offering Pfizer access to country’s health-care database",googlenews,2021-01-29 09:55:13
Novartis pitches in to help produce Pfizer/BioNTech COVID-19 vaccine,googlenews,2021-01-29 09:55:13
Coronavirus: Feds insist Canada still on track for 4M Pfizer doses by March despite planning data,googlenews,2021-01-29 09:55:13
"German officials say AstraZeneca vaccine shouldn't be given to over-65s, citing lack of data",googlenews,2021-01-29 09:55:13
Coronavirus live news: AstraZeneca publishes EU contract; Moderna to cut Italy deliveries by 20%,googlenews,2021-01-29 09:55:13
Why Europe’s Vaccine Politics Are Worse Than America’s,googlenews,2021-01-29 09:55:13
What can moral philosophy tell us about the Covid 'vaccine nationalism' row?,googlenews,2021-01-29 09:55:13
UDOH Report: No increase in suicides or overdoses during pandemic,googlenews,2021-01-29 09:55:13
Utahns won't have to prove underlying health conditions to get ahead in vaccine line,googlenews,2021-01-29 09:55:13
2 Million Utahns Have Now Been Tested For COVID-19; No New Deaths Reported,googlenews,2021-01-29 09:55:13
Utah vaccine doses may triple; Gov. Cox ‘more optimistic’ than ever,googlenews,2021-01-29 09:55:13
Here's why COVID-19 vaccine side effects are 'a sign your body is working',googlenews,2021-01-29 09:55:13
"COVID-19 death rate significantly higher among pregnant women, research shows",googlenews,2021-01-29 09:55:13
"Canada expects further Pfizer vaccine delay, prompting protests",googlenews,2021-01-29 09:55:13
VIDEO: New recommendations from WHO tell pregnant women to hold off on Moderna's vaccine,googlenews,2021-01-29 09:55:13
"Dow Jones Futures Signal Further Losses For Stock Market Rally, GME Stock, Vaccine Maker Novavax Soar",googlenews,2021-01-29 09:55:13
"LIVE | Apple, GameStop, Tesla: Live Stock Market Breakdown - Jan. 28",googlenews,2021-01-29 09:55:13
"Tesla Inc. stock falls Thursday, underperforms market",googlenews,2021-01-29 09:55:13
"U.S. Index Futures Slide Amid China Squeeze, Retail Volatility",googlenews,2021-01-29 09:55:13
Leon Cooperman on GameStop Reddit speculators: 'I'm not damning them' but it will 'end in tears',googlenews,2021-01-29 09:55:13
Billionaire investor Lee Cooperman on GameStop: This is not going to end well for the public,googlenews,2021-01-29 09:55:13
'Cry Me a River': Sanders Hits Back as Billionaire Investor Whines About Potential Tax Hikes Amid GameStop Fiasco,googlenews,2021-01-29 09:55:13
Reddit traders behind GameStop mania have animosity toward Wall Street elite: PredIQt CEO,googlenews,2021-01-29 09:55:13
First case of South Africa COVID-19 variant confirmed in US | WNT,googlenews,2021-01-29 09:55:13
Covid-19: Novavax vaccine shows 89% efficacy in UK trials,googlenews,2021-01-29 09:55:13
Coronavirus variant first seen in South Africa identified in South Carolina,googlenews,2021-01-29 09:55:13
Novavax says its Covid-19 vaccine is 90% effective in late-stage trial,googlenews,2021-01-29 09:55:13
Another grim US jobs report amid stock market frenzy,googlenews,2021-01-29 09:55:13
"Jobless claims rise less than expected at 847,000 first-time applicants",googlenews,2021-01-29 09:55:13
"U.S. Jobless Claims Drop; Still At 847,000 As Pandemic Rages",googlenews,2021-01-29 09:55:13
"Jobless claims fall slightly as another 847,000 Americans apply for unemployment aid",googlenews,2021-01-29 09:55:13
"COVID-19 savages US economy, 2020 performance worst in 74 years | World News | WION News",googlenews,2021-01-29 09:55:13
Last year's American economy shrank the most since 1946,googlenews,2021-01-29 09:55:13
The Economy Keeps Growing,googlenews,2021-01-29 09:55:13
2020 was the worst year for economic growth since World War II,googlenews,2021-01-29 09:55:13
China’s Top Bottled-Water Group Swells to an $85 Billion Valuation,googlenews,2021-01-29 09:55:13
How US Sanctions Affect China Investors,googlenews,2021-01-29 09:55:13
China's army of small investors want in on the GameStop mania,googlenews,2021-01-29 09:55:13
Qualtrics CEO and Founder discuss the 20 year journey to IPO: It's been an incredible run,googlenews,2021-01-29 09:55:13
Qualtrics hits the stock market shattering Utah records for highest IPO,googlenews,2021-01-29 09:55:13
Qualtrics Founder Ryan Smith: 'Nobody Else Has Ever Done Anything Like This!',googlenews,2021-01-29 09:55:13
"Qualtrics IPO indicates SAP still undervalued, says its CFO",googlenews,2021-01-29 09:55:13
New Walgreens CEO Roz Brewer Takes Helm During Coronavirus Pandemic,googlenews,2021-01-29 09:55:13
Roz Brewer to Become the Only Black Woman Leading a Fortune 500 Company,googlenews,2021-01-29 09:55:13
"Rosalind Brewer, the newly minted Walgreens CEO, is someone you should know",googlenews,2021-01-29 09:55:13
Incoming Walgreens CEO Roz Brewer on advancing corporate diversity - Business Insider,googlenews,2021-01-29 09:55:13
Toyota beats Volkswagen to become World's No.1 car seller in 2020,googlenews,2021-01-29 09:55:13
Toyota named worlds best-selling automaker,googlenews,2021-01-29 09:55:13
Toyota beats VW Group in global sales in 2020,googlenews,2021-01-29 09:55:13
Toyota Overtakes VW As World's Best-Selling Carmaker,googlenews,2021-01-29 09:55:13
WallStreetBets founder on GameStop: There is no precedent for this,googlenews,2021-01-29 09:55:13
Discord says working with 'Wallstreetbets' team to moderate its new server,googlenews,2021-01-29 09:55:13
How Reddit gamed the stock of GameStop,googlenews,2021-01-29 09:55:13
Reddit co-founder Alexis Ohanian says GameStop stock market war is ‘seminal moment’ for finance,googlenews,2021-01-29 09:55:13
Peacock hit 33 million signups before The Office even arrived,googlenews,2021-01-29 09:55:13
"Comcast reports record internet customers, 33 million Peacock sign-ups",googlenews,2021-01-29 09:55:13
"‘The Office’ Peacock Viewing Is Ahead Of Netflix Pace, NBCU Chief Jeff Shell Says, With Service Off To “Promising” Start",googlenews,2021-01-29 09:55:13
Does Peacock Need the Olympics?,googlenews,2021-01-29 09:55:13
Apple is still in the 'early innings' amid strong 5G iPhone sales,googlenews,2021-01-29 09:55:13
Huawei smartphone shipments plummet amid U.S. sanctions,googlenews,2021-01-29 09:55:13
Apple retakes second place in smartphone shipment rankings as sanctions bite Huawei,googlenews,2021-01-29 09:55:13
The iOS 14.5 update is coming — your iPhone will get this amazing new privacy feature,googlenews,2021-01-29 09:55:13
Coinbase is going public via direct listing,googlenews,2021-01-29 09:55:13
Coinbase officially announces bid to become public company via direct listing,googlenews,2021-01-29 09:55:13
"Coinbase to Become Publicly Traded, Announces Proposed Direct Listing of Shares - CoinDesk",googlenews,2021-01-29 09:55:13
Coinbase Global Intends to Go Public Via Direct Listing,googlenews,2021-01-29 09:55:13
Steve Cohen and Dave Portnoy feud over GameStop on Twitter,googlenews,2021-01-29 09:55:13
Connect the Dots: Gamestop stock market battle,googlenews,2021-01-29 09:55:13
UnStoppable - The frenzied rise of GameStop | Finance & economics,googlenews,2021-01-29 09:55:13
Billionaire MLB owner Steven Cohen defiant after GameStop loss and says he’s ‘trying to make a living’,googlenews,2021-01-29 09:55:13
Jordan Belfort: Robinhood shutting down GameStop activity because massive liability,googlenews,2021-01-29 09:55:13
"Robinhood restricts GameStop trades, among others",googlenews,2021-01-29 09:55:13
Here's what traveling by hyperloop might be like,googlenews,2021-01-29 09:55:13
Rick Davis retires from CNN after more than 40 years,googlenews,2021-01-29 09:55:13
Emotet Botnet Disrupted by Global Law Enforcement Campaign,googlenews,2021-01-29 09:55:13
"End of Emotet: A blow to cyber crime, but don’t drop your guard",googlenews,2021-01-29 09:55:13
The Cybersecurity 202: International law enforcement took down a leading cybercrime gang,googlenews,2021-01-29 09:55:13
Emotet botnet takedown - what you need to know | The State of Security,googlenews,2021-01-29 09:55:13
"ECB in ‘Currency War’ Over Euro, Commerzbank Strategist Says",googlenews,2021-01-29 09:55:13
Rehn Says ECB Is Watching Euro and Ready to Use All Tools,googlenews,2021-01-29 09:55:13
ECB's Schnabel Says Bank-Government Dependence Can Boost Growth,googlenews,2021-01-29 09:55:13
ECB's Enria: Banks must stay 'careful and attentive' to credit risks,googlenews,2021-01-29 09:55:13
"Wallstreetbets: Finance expert on why Gamestop, AMC, BlackBerry and other stocks are going haywire",googlenews,2021-01-29 09:55:13
"Insiders at GameStop, BlackBerry, LaCroix Maker Are Suddenly Sitting on Big Stock Gains",googlenews,2021-01-29 09:55:13
Opinion: Short squeezes reveal investor anger and cynicism,googlenews,2021-01-29 09:55:13
Billionaire Mark Cuban says his 11-year-old son made money with Wall Street Bets traders and he 'loves' w..,googlenews,2021-01-29 09:55:13
GM's Hydrogen Fuel Cell Semis Seem Like A Small (Or Possibly Very Big) Part Of The Solution,googlenews,2021-01-29 09:55:13
GM's latest foray into trucking: Partnering with Navistar on hydrogen-powered big rigs,googlenews,2021-01-29 09:55:13
"General Motors (GM), Navistar Team Up for Hydrogen Truck Project",googlenews,2021-01-29 09:55:13
Sumitomo Corporation of Americas makes strategic investment in hydrogen fuel provider OneH2,googlenews,2021-01-29 09:55:13
SpaceX is being investigated by the DoJ over alleged hiring discrimination - Business Insider,googlenews,2021-01-29 09:55:13
DOJ Investigating SpaceX Over Hiring Discrimination Complaint,googlenews,2021-01-29 09:55:13
SpaceX valuation to hit at least $60 billion in new funding round - Business Insider,googlenews,2021-01-29 09:55:13
US probes Elon Musk's SpaceX after hiring discrimination complaint,googlenews,2021-01-29 09:55:13
FDA Issues Alert On All Alcohol-Based Hand Sanitizers Imported From Mexico,googlenews,2021-01-29 09:55:13
FDA places import alert on Mexican hand sanitizers over ‘toxic ingredients’ – see the list of sanitizers to avoid,googlenews,2021-01-29 09:55:13
FDA Warns Hand Sanitizers Imported From Mexico Contain Toxic Unlisted Ingredients,googlenews,2021-01-29 09:55:13
FDA Issues Import Alert On Hand Sanitizer From Mexico,googlenews,2021-01-29 09:55:13
15 Short-Squeeze Stocks Doubling as Strong Stocks to Buy,googlenews,2021-01-29 09:55:13
"The Big Short-Squeeze: More Than A David vs. Goliath Story (GME, AMC, & BBBY)",googlenews,2021-01-29 09:55:13
Is Express Next in Line for a Short Squeeze?,googlenews,2021-01-29 09:55:13
Investment terms that will help you understand the GameStop/stock market saga,googlenews,2021-01-29 09:55:13
Levi’s is joining the sweatpants trend with its Red tab line,googlenews,2021-01-29 09:55:13
Skinny jeans still in fashion Levi's CEO says as denim sales plunge - Business Insider,googlenews,2021-01-29 09:55:13
Levi Strauss sales decline alleviated by digital and DTC,googlenews,2021-01-29 09:55:13
Levi's sales are down as remote workers turn to loungewear over jeans,googlenews,2021-01-29 09:55:13
Grape-Nuts cereal experiencing nationwide shortage due to pandemic-related constraints,googlenews,2021-01-29 09:55:13
Seeing a Grape-Nuts cereal shortage? Here's why,googlenews,2021-01-29 09:55:13
COVID-19 pandemic triggers a Grape-Nuts cereal shortage,googlenews,2021-01-29 09:55:13
There is a Grape-Nuts shortage CNN,googlenews,2021-01-29 09:55:13
TECHnalysis Research President on Apple’s record earnings: iPhone sales were ‘a little surprising’,googlenews,2021-01-29 09:55:13
Facebook Is Now the Market's Most Undervalued Growth Stock -- And It's Going to $400,googlenews,2021-01-29 09:55:13
"Tesla, Facebook, and Apple report earnings, here's a breakdown:",googlenews,2021-01-29 09:55:13
Buy Apple on Its Earnings Dip? Let’s Look at the Charts,googlenews,2021-01-29 09:55:13
A Gamestop catalyst sets his sites on metals,googlenews,2021-01-29 09:55:13
CULTURE: Chamath Palihapitiya Debates CNBC's Scott Wapner on GameStop Stocks,googlenews,2021-01-29 09:55:13
Billionaire investor Chamath Palihapitiya says GameStop's rally is no different than how Wall Street missed out on Tesla's surge,googlenews,2021-01-29 09:55:13
"CEO Makes $500k Off GameStop Stock Run, Donates It to Barstool Fund for Businesses",googlenews,2021-01-29 09:55:13
"Altria eyes investments in cigarette alternatives, beats revenue estimates",googlenews,2021-01-29 09:55:13
"Altria Launches New $2 Billion Stock Buyback as Q4 Sales Beat, Profits Miss",googlenews,2021-01-29 09:55:13
"Altria Revenue Beats Estimates, Profit Lags During Pandemic",googlenews,2021-01-29 09:55:13
Altria earns miss in 4Q despite strong cigarette sales,googlenews,2021-01-29 09:55:13
"2022 Acura MDX Review | Acura's Luxury SUV Gets a Redesign | Price, Interior, MPG & More",googlenews,2021-01-29 09:55:13
2022 Acura MDX | Review & Road Test,googlenews,2021-01-29 09:55:13
2022 Acura MDX Review: You Call This a Luxury SUV?,googlenews,2021-01-29 09:55:13
2022 Acura MDX SH-AWD: A Driver's Family Hauler,googlenews,2021-01-29 09:55:13
"Stocks to buy: Top stock picks for Q4 earnings, Morgan Stanley",googlenews,2021-01-29 09:55:13
Morgan Stanley names its 'high conviction' Europe stocks set to surprise this earnings season,googlenews,2021-01-29 09:55:13
"SSC Tuatara claims the fastest production-car speed record, this time for real",googlenews,2021-01-29 09:55:13
The 1750 HP SSC Tuatara breaks the world speed record for fastest production hypercar!,googlenews,2021-01-29 09:55:13
Here’s to hoping that there’s no controversy with this run,googlenews,2021-01-29 09:55:13
SSC Tuatara hits 282.9mph on second top speed run,googlenews,2021-01-29 09:55:13
"After Robinhood Blunder, Blockfolio Will Pay Users Dogecoin for Trading",googlenews,2021-01-29 09:55:13
Here’s What Riding the 600 MPH Virgin Hyperloop Could Look Like in 2030,googlenews,2021-01-29 09:55:13
Virgin Hyperloop Releases Concept Video of Future We Want to Become Reality,googlenews,2021-01-29 09:55:13
This Is What It's Like to Ride In Virgin's Hyperloop,googlenews,2021-01-29 09:55:13
"Virgin Unveils Hyperloop Pod Design, the Raised Aisles Seem Like a Bad Idea",googlenews,2021-01-29 09:55:13
"EV maker Lucid has a paint shop conceived for 400,000 vehicles a year",googlenews,2021-01-29 09:55:13
Why AMD Stock Dropped Today,googlenews,2021-01-29 09:55:13
"Will AMD, Nvidia Or Intel Stock Grow The Most By 2022?",googlenews,2021-01-29 09:55:13
AMD recorded almost 1000% jump in profit in Q4 2020,googlenews,2021-01-29 09:55:13
"AMD expects gaming, data center to remain strong in 2021 as quarterly revenue tops $3 billion for first time",googlenews,2021-01-29 09:55:13
David Tepper warning to market speculators: 'It didn't end well in 1999',googlenews,2021-01-29 09:55:13
Billionaire David Tepper says 'gangup.inc' war on shorts might not end well for stock-market investors,googlenews,2021-01-29 09:55:13
David Tepper: Be careful playing this speculative market game,googlenews,2021-01-29 09:55:13
