headline,org,date
US-China investment flows belie geopolitical tensions,financialtimes,2021-02-06 10:01:41
Biden to order review of critical US supply chains,financialtimes,2021-02-06 10:01:41
Beijing lays down a marker in South China Sea,financialtimes,2021-02-06 10:01:41
"Buy Trulieve Cannabis, Not Sundial Growers",thestreet,2021-02-06 10:03:27
Apple Talks With Hyundai-Kia Reportedly Pauses,thestreet,2021-02-06 10:03:27
Tax Considerations for Fantasy Sports Fans,thestreet,2021-02-06 10:03:27
Game Plan: Cramer's 'Mad Money' Recap (Friday 2/5/21),thestreet,2021-02-06 10:03:27
Jim Cramer: How Will Stocks That Thrived Amid Covid Do Post-Pandemic? Who Knows,thestreet,2021-02-06 10:03:27
Graff: Why the January Jobs Report Isn't as Bad as It Looks,thestreet,2021-02-06 10:03:27
Bengali: We Are Back to Brent Levels Where Russia/Saudi Tensions Started Last Year,thestreet,2021-02-06 10:03:27
"Guilfoyle: 2 Firms, 2 Opportunities: BP and Palantir",thestreet,2021-02-06 10:03:27
Rev Shark: Profit-Taking Is Kicking In: Here Are Some Names on My Shopping List,thestreet,2021-02-06 10:03:27
Jim Cramer: I Remain A 'Gigantic Believer' In Penn National,thestreet,2021-02-06 10:03:27
Fox Cancels 'Lou Dobbs Tonight',thestreet,2021-02-06 10:03:27
Buy the Dip in Peloton? Let's Check the Charts,thestreet,2021-02-06 10:03:27
Apple Stock This Week: Earnings Season in the Rearview Mirror,thestreet,2021-02-06 10:03:27
Tesla Semi Production/Timeline Rumors,thestreet,2021-02-06 10:03:27
Marijuana ETF Soars as Industry Conditions Keep Improving,thestreet,2021-02-06 10:03:27
4 ETFs That Got Swept Up in the GameStop Frenzy,thestreet,2021-02-06 10:03:27
Breaking Down The COVID Discount and Its Impact on the Commercial Real Estate Market,thestreet,2021-02-06 10:03:27
The Future of Land Values in 2021,thestreet,2021-02-06 10:03:27
Here’s What Retail Recovery Looks Like In 2021,thestreet,2021-02-06 10:03:27
Five Stock Market Myths That Are Keeping You From Investing,thestreet,2021-02-06 10:03:27
Four Financial ‘Experts’ You Should Never Listen To,thestreet,2021-02-06 10:03:27
Answering Client Questions About Investing in Gold,thestreet,2021-02-06 10:03:27
Tax Law Changes in 2020 That Can Fatten Your Refund,thestreet,2021-02-06 10:03:27
Tax Considerations for Fantasy Sports Fans,thestreet,2021-02-06 10:03:27
Tax Implications of Buying and Selling Stocks During the Market Downturn,thestreet,2021-02-06 10:03:27
Jim Cramer: The Chip Shortage Is 'Very Real',thestreet,2021-02-06 10:03:27
Why Jim Cramer Thinks Robinhood Should Call Salesforce,thestreet,2021-02-06 10:03:27
Jim Cramer: I Remain A 'Gigantic Believer' In Penn National,thestreet,2021-02-06 10:03:27
Jim Cramer: GameStop Has Become a 'Comedy of Errors',thestreet,2021-02-06 10:03:27
Tax Law Changes in 2020 That Can Fatten Your Refund,thestreet,2021-02-06 10:03:27
Amazon's Request to Delay Union Vote in Alabama Gets Rejected,thestreet,2021-02-06 10:03:27
"Plantronics, Activision, Penn National: 5 Top Stock Gainers for Friday",thestreet,2021-02-06 10:03:27
"S&P 500, Nasdaq Close at Records as Weak Jobs Report Boosts Stimulus Bets",thestreet,2021-02-06 10:03:27
Twist Bioscience Drops Most in 10 Months After JPMorgan Downgrade,thestreet,2021-02-06 10:03:27
Pizza Makers Could Get Big Slice of Super Bowl Pie,thestreet,2021-02-06 10:03:27
Stock Market Today With Jim Cramer: How to Trade Ford,thestreet,2021-02-06 10:03:27
"Jim Cramer: Watch Peloton, Don't Make a DecisionDraftPublish",thestreet,2021-02-06 10:03:27
"February 5, 1870: The First Female-Owned American Stock Brokerage Opened On Wall Street",thestreet,2021-02-06 10:03:27
"Oatly, Vegan-Food Firm Backed by Jay-Z and Oprah, Mulls IPO",thestreet,2021-02-06 10:03:27
"Nikola, Qualcomm, Tesla: Weekly Upgrades and Downgrades",thestreet,2021-02-06 10:03:27
Activision Tops Earnings Estimates: What Wall Street Is Saying,thestreet,2021-02-06 10:03:27
National Beverage to Declare 1-For-1 Stock Split; Shares Rise,thestreet,2021-02-06 10:03:27
How to Trade Pinterest After Blowout Earnings,thestreet,2021-02-06 10:03:27
Plantronics Jumps on Blowout Quarter and Strong Guidance,thestreet,2021-02-06 10:03:27
TikTok Competitors: Can Anyone Come Close?,thestreet,2021-02-06 10:03:27
Snap Gets Analysts' Support After First-Quarter-Loss Forecast,thestreet,2021-02-06 10:03:27
PayPal Says It's Cooperating With CFPB Investigation Into Venmo,thestreet,2021-02-06 10:03:27
GoPro Falls Sharply After Revenue Misses Estimates,thestreet,2021-02-06 10:03:27
Jim Cramer: The Chip Shortage Is 'Very Real',thestreet,2021-02-06 10:03:27
Stock Market Today With Jim Cramer: How to Trade Ford,thestreet,2021-02-06 10:03:27
"Oregon says sorry, it will miss target for paying unemployment benefits to self-employed workers",googlenews,2021-02-06 10:05:24
Kroger Offers $100 Bonus To Employees Who Get Vaccinated,googlenews,2021-02-06 10:05:24
Here's Why You Should Expect a 20% Stock Market Crash in 2021,googlenews,2021-02-06 10:05:24
CDC paid Deloitte $44 million for faulty vaccine appointment system - Business Insider,googlenews,2021-02-06 10:05:24
"Amazon’s New CEO, Andy Jassy, Can Either Help Workers and Sellers—or Automate Them Away",googlenews,2021-02-06 10:05:24
Bitcoin Investment In 2021: What Should We Expect?,googlenews,2021-02-06 10:05:24
White House says it is working to speed early production of J&J COVID-19 vaccine,googlenews,2021-02-06 10:05:24
States are taking back unused Covid vaccine doses from nursing homes,googlenews,2021-02-06 10:05:24
"Melvin Capital, GameStop and the road to disaster",googlenews,2021-02-06 10:05:24
Biden’s dream of reviving America’s labor force faces a mounting threat: automation,googlenews,2021-02-06 10:05:24
FDA Approves New Treatment For Adults With Relapsed Or Refractory Large-B-Cell Lymphoma,googlenews,2021-02-06 10:05:24
"DHEC: 2,745 new COVID-19 cases, 54 more deaths reported Friday",googlenews,2021-02-06 10:05:24
UK variant found in Hawaii; Iowa governor lifting mask requirements. Latest COVID-19 updates.,googlenews,2021-02-06 10:05:24
States are looking to help their vulnerable communities as vaccine distribution ramps up,googlenews,2021-02-06 10:05:24
State aims to concentrate on seniors with next vaccine shipment,googlenews,2021-02-06 10:05:24
Robinhood offers loans to buy stock — they were 14 times more likely to default,googlenews,2021-02-06 10:05:24
"Parler offered Trump Organization a 40% ownership stake for exclusive postings, report says",googlenews,2021-02-06 10:05:24
Elon Musk’s Dogecoin Tweeting Has Believers Barking for More,googlenews,2021-02-06 10:05:24
Pentagon deploys troops to fuel COVID-19 vaccine drive,googlenews,2021-02-06 10:05:24
"Defense Department sending 1,000 troops to assist with vaccinations",googlenews,2021-02-06 10:05:24
Delay Second Doses? A Guide To The Latest COVID-19 Vaccine Debate,googlenews,2021-02-06 10:05:24
Smith's Food & Drug to offer limited supply of free COVID-19 vaccines next week,googlenews,2021-02-06 10:05:24
"2020 ETF Trends: Opportunity Expands, Fees Contract",googlenews,2021-02-06 10:05:24
Online car seller Vroom promises torture-free car buying in first Super Bowl ad,googlenews,2021-02-06 10:05:24
Fake N95 masks have flooded the market. Here's how to tell the difference,googlenews,2021-02-06 10:05:24
Jeff Bezos Is Stepping Back: Where Amazon Stock Goes From Here,googlenews,2021-02-06 10:05:24
"1216 more COVID-19 cases, 17 deaths reported Friday in Utah",googlenews,2021-02-06 10:05:24
How the US plans to capture the EV battery market,googlenews,2021-02-06 10:05:24
Allegheny County's 7-day covid case average continues to fall,googlenews,2021-02-06 10:05:24
Workhorse Group (WKHS) Stock Sinks As Market Gains: What You Should Know,googlenews,2021-02-06 10:05:24
Kroger to pay $100 to workers who get COVID-19 vaccination,googlenews,2021-02-06 10:05:24
Super Bowl Covid-19 concerns,googlenews,2021-02-06 10:05:24
Bloomberg: Apple car talks with Hyundai/Kia are 'paused',googlenews,2021-02-06 10:05:24
BREAKING: At least one dead and six injured in shooting at a resort in Illinois,googlenews,2021-02-06 10:05:24
"As coronavirus variants spread, FDA drawing up guidance for adjusted vaccines, diagnostics",googlenews,2021-02-06 10:05:24
Amazon Fails to Stall Unionization Vote in Alabama,googlenews,2021-02-06 10:05:24
"After learning of sister’s cancer, stray bullet kills father of 3 in Miami-Dade",googlenews,2021-02-06 10:05:24
"FOCUS-Walgreens, CVS beef up protections against threat of 'bot' attacks on vaccine program",googlenews,2021-02-06 10:05:24
How to Get Free Food on Super Bowl Sunday,googlenews,2021-02-06 10:05:24
Luckin Coffee Goes Bankrupt With Chapter 15 Filing,googlenews,2021-02-06 10:05:24
"Israel Covid-19 Vaccination Leads to Decline in New Cases, Hospitalizations",googlenews,2021-02-06 10:05:24
Most Colorado counties will move to lower coronavirus restrictions on Saturday as dial system changes,googlenews,2021-02-06 10:05:24
"These mini massage guns make great Valentine's Day gifts, starting at $40",googlenews,2021-02-06 10:05:24
Today's Tesla Share Price Fully Values 2025 Future,googlenews,2021-02-06 10:05:24
Dow Jones Futures: Congress Fast Tracks Biden Stimulus Plan; Market Rally Warning Signs,googlenews,2021-02-06 10:05:24
Clover Health responds to critical report from Hindenburg Research,googlenews,2021-02-06 10:05:24
Johnson & Johnson files for FDA emergency use authorization for COVID-19 vaccine,googlenews,2021-02-06 10:05:24
"Popular baby foods contain arsenic, lead, cadmium, mercury, Congress says",googlenews,2021-02-06 10:05:24
"Tweaking COVID vaccines to fight variants won’t require big trials, FDA says",googlenews,2021-02-06 10:05:24
Miami mayor says Elon Musk will tunnel under the city for just $30 million,googlenews,2021-02-06 10:05:24
U.S. employment growth likely rebounded; more government money still needed,googlenews,2021-02-06 10:05:24
"Ford 'is pulling a GM' with its bet on electric vehicles, and Wall Street applauds",googlenews,2021-02-06 10:05:24
You can refinance your home with no closing costs — but there's a major downside,googlenews,2021-02-06 10:05:24
Why Sean Hannity's claims on QAnon aren't adding up,googlenews,2021-02-06 10:05:24
TikTok Rival Kuaishou's Stock Soars in Hong Kong Market Debut,googlenews,2021-02-06 10:05:24
Estee Lauder shares pop 7% after company snaps three straight quarters of sales declines,googlenews,2021-02-06 10:05:24
"3 Big Things Today, February 5, 2021",googlenews,2021-02-06 10:05:24
"UK in a ‘different place’ from the euro zone on negative rates, Bank of England says",googlenews,2021-02-06 10:05:24
The pandemic could continue for seven years under current vaccination rate,googlenews,2021-02-06 10:05:24
"As ‘Low Quality’ Stages a Comeback, This Utility Could Break Out",googlenews,2021-02-06 10:05:24
How the Pandemic Left the $25 Billion Hudson Yards Eerily Deserted,googlenews,2021-02-06 10:05:24
Robinhood has stopped limiting GameStop shares,googlenews,2021-02-06 10:05:24
Klobuchar targets Big Tech with biggest antitrust overhaul in 45 years,googlenews,2021-02-06 10:05:24
Digital yuan could bust the United States,googlenews,2021-02-06 10:05:24
Former baseball superstar Alex Rodriguez files to form $575 million SPAC as IPO craze continues,googlenews,2021-02-06 10:05:24
"GPB Capital Holdings CEO, two others indicted on fraud, conspiracy charges",googlenews,2021-02-06 10:05:24
Wall Street Breakfast: Robinhood Removes GameStop Limits,googlenews,2021-02-06 10:05:24
Denmark to build world's first energy island in the North Sea,googlenews,2021-02-06 10:05:24
Ford forced to cut profitable F-150 pickup truck production due to semiconductor chip shortage,googlenews,2021-02-06 10:05:24
"Kroger to pay $100 to all workers who get COVID-19 vaccine, other perks",googlenews,2021-02-06 10:05:24
Long-term unemployment is close to a Great Recession record,googlenews,2021-02-06 10:05:24
First-time jobless claims drop sharply in Illinois amid COVID-19 pandemic,googlenews,2021-02-06 10:05:24
More covid relief is urgent. January’s jobs report shows where the need is greatest.,googlenews,2021-02-06 10:05:24
Coloradans may not be able to open new federal unemployment claims for weeks yet,googlenews,2021-02-06 10:05:24
Hackers intercepted a Covid-19 vaccination appointment hotline in Pennsylvania,googlenews,2021-02-06 10:05:24
"CVS, Walgreens step up ‘bot’ defense ahead of COVID-19 vaccine appointment rush",googlenews,2021-02-06 10:05:24
Equity plays key role in vaccine distribution,googlenews,2021-02-06 10:05:24
Kroger to pay $100 to all associates who receive COVID-19 vaccine,googlenews,2021-02-06 10:05:24
"A No-Bid Contract to Track Covid Vaccinations Draws Frustration, and a Cease-and-Desist",googlenews,2021-02-06 10:05:24
Listen to Jeff Bezos: Buy These 7 'Hyperinnovative' Stocks,googlenews,2021-02-06 10:05:24
Incoming Amazon CEO Shows Direction of Tech: Palmisano,googlenews,2021-02-06 10:05:24
Guys like Bezos dream of us trapped at home with a remote control and a phone,googlenews,2021-02-06 10:05:24
The Amazon machine: Jeff Bezos’s revolution — and complicated legacy,googlenews,2021-02-06 10:05:24
What’s a Roth 401(k)? Does the 4% rule work? Can I buy a home right before retirement? MarketWatch answers your questions,googlenews,2021-02-06 10:05:24
Corporate Treasuries Are Figuring Out Bitcoin on the Balance Sheet,googlenews,2021-02-06 10:05:24
Individual investors are back — here's what it means for the stock market,googlenews,2021-02-06 10:05:24
"GameStop stock soars on the day, but suffers a big, first weekly loss since the trading frenzy started",googlenews,2021-02-06 10:05:24
Covid-19 Live Updates: New York to Expand Vaccine Access to People With Chronic Conditions,googlenews,2021-02-06 10:05:24
Watch live: Biden Covid response team holds briefing after J&J requests FDA OK for vaccine,googlenews,2021-02-06 10:05:24
"It’s time to trust China, Russia’s Covid-19 vaccines",googlenews,2021-02-06 10:05:24
Johnson & Johnson Stock Belongs In Every Portfolio,googlenews,2021-02-06 10:05:24
Why GameStop Stock Rebounded Today,googlenews,2021-02-06 10:05:24
Reddit stopped rogue r/WallStreetBets mods from taking over the community,googlenews,2021-02-06 10:05:24
The Long and Short of the GameStop Bubble,googlenews,2021-02-06 10:05:24
Hedge funds resume role as Wall Street’s villains,googlenews,2021-02-06 10:05:24
Bristol Myers Squibb's CAR-T liso-cel wins long-delayed FDA nod,googlenews,2021-02-06 10:05:24
Liso-cel Receives FDA Approval for the Treatment of R/R Large B-Cell Lymphoma,googlenews,2021-02-06 10:05:24
"U.S. Food and Drug Administration Approves Bristol Myers Squibb's Breyanzi (lisocabtagene maraleucel), a New CAR T Cell Therapy for Adults with Relapsed or Refractory Large B-cell Lymphoma",googlenews,2021-02-06 10:05:24
CAR-T Cell Therapy Receives FDA Approval to Treat Certain Types of Large B-Cell Lymphoma,googlenews,2021-02-06 10:05:24
"If you've had Covid-19, here's what you should know about vaccines, variants and more",googlenews,2021-02-06 10:05:24
Mass. patient says CVS website forced COVID-19 vaccine appointment in Connecticut,googlenews,2021-02-06 10:05:24
"COVID Vaccine Availability Continues To Fall Short, But New Offerings Could Help",googlenews,2021-02-06 10:05:24
Illinois mom denied COVID-19 vaccine over breastfeeding concerns: 'I was shocked',googlenews,2021-02-06 10:05:24
More contagious UK variant of coronavirus identified in Hawaii,googlenews,2021-02-06 10:05:24
Highly transmissible COVID-19 variant found in Hawaii,googlenews,2021-02-06 10:05:24
"Hawaii reports 101 new coronavirus infections, bringing the state’s total to 26,286",googlenews,2021-02-06 10:05:24
"Visitor numbers continue to climb | News, Sports, Jobs",googlenews,2021-02-06 10:05:24
"Virginia woman dies shortly after Covid vaccination, though no link has been found",googlenews,2021-02-06 10:05:24
What Went Wrong With The U.S. Coronavirus Vaccine Rollout?,googlenews,2021-02-06 10:05:24
Pennsylvania’s new Secretary of Health has to get more shots into arms -- now | PennLive Editorial,googlenews,2021-02-06 10:05:24
"‘Good news’: Oregon to get 20% more vaccines, timeline for vaccinating teachers, seniors improves, governor s",googlenews,2021-02-06 10:05:24
Coronavirus: Kroger will pay $100 to employees who get vaccinated,googlenews,2021-02-06 10:05:24
COVID-19 pandemic: Feb. 4 marks one year since Texas opened State Medical Operations Center.,googlenews,2021-02-06 10:05:24
Donald Trump’s Business Sought A Stake In Parler Before He Would Join,googlenews,2021-02-06 10:05:24
"'These people just want to censor me,' fired Parler CEO says free speech platform is trying to muzzle him",googlenews,2021-02-06 10:05:24
Parler offered Trump Org 40% ownership stake for exclusivity deal - Business Insider,googlenews,2021-02-06 10:05:24
Former Parler CEO John Matze says he's 'not exactly sure why' he was terminated,googlenews,2021-02-06 10:05:24
"Dodgecoin surges after Elon Musk tweet, plus ethereum hits all-time-high",googlenews,2021-02-06 10:05:24
Elon Musk's Dogecoin Tweets Worry Crypto Community — Situation 'Seriously Damaging',googlenews,2021-02-06 10:05:24
"Elon Musk sent Dogecoin soaring last week. Here are 6 times the Tesla boss has moved markets, from GameSt..",googlenews,2021-02-06 10:05:24
Bitcoin rally takes crypto market value to another record,googlenews,2021-02-06 10:05:24
States may need to pester thousands of people about a second Covid-19 vaccine dose,googlenews,2021-02-06 10:05:24
Coronavirus vaccine: J&J files for emergency use authorization from the FDA for one shot vaccine,googlenews,2021-02-06 10:05:24
Opinion: How India became a vaccine-making powerhouse,googlenews,2021-02-06 10:05:24
State of vaccine supply: ‘Opaque.’ Unpredictable. ‘Hard to Pin Down.’,googlenews,2021-02-06 10:05:24
659k COVID-19 vaccinations given in state,googlenews,2021-02-06 10:05:24
Is It Ever OK To Jump Ahead In The Vaccine Line?,googlenews,2021-02-06 10:05:24
Answering your questions on the Federal Pharmacy Program,googlenews,2021-02-06 10:05:24
"Shelby County lags state in vaccine distribution, according to state data",googlenews,2021-02-06 10:05:24
Retail ETF with highest short interest was blown up by GameStop,googlenews,2021-02-06 10:05:24
International Report: Q4 2020,googlenews,2021-02-06 10:05:24
4 ETFs That Got Swept Up In The GameStop Frenzy,googlenews,2021-02-06 10:05:24
'SLV' Powers Weekly Inflows,googlenews,2021-02-06 10:05:24
"'Coolest I have found so far': Why more than 7,000 reviewers swear by this high-tech face mask",googlenews,2021-02-06 10:05:24
Pandemic gamble: 'Made in USA' face masks,googlenews,2021-02-06 10:05:24
Here's how to tell the difference between a fake N95 mask and a real one,googlenews,2021-02-06 10:05:24
Apple's update to allow unlocking device while wearing face mask,googlenews,2021-02-06 10:05:24
Jeff Bezos Doesn’t Have Time to Be CEO of Amazon,googlenews,2021-02-06 10:05:24
Amazon’s Retail Side Won’t Be a Side Hustle,googlenews,2021-02-06 10:05:24
Commentary: Jeff Bezos changed the world through Amazon. He will be a hard act to follow,googlenews,2021-02-06 10:05:24
Ignore Amazon's Self-Serving Position on the $15 Minimum Wage by Alfredo Ortiz,googlenews,2021-02-06 10:05:24
"Centre County Adds 51 COVID-19 Cases; Pennsylvania Reports 4,688",googlenews,2021-02-06 10:05:24
Here's how Pennsylvania currently ranks in the nationwide coronavirus vaccine rollout,googlenews,2021-02-06 10:05:24
Department of Health provides an update on COVID-19 in Pennsylvania,googlenews,2021-02-06 10:05:24
"4,688 new COVID cases confirmed, 234 in our central region on Feb. 5",googlenews,2021-02-06 10:05:24
COVID vaccinations for restaurant workers,googlenews,2021-02-06 10:05:24
Covid vaccine 'deserts' and tech woes: Publix's Florida rollout highlights risks as retailers play a larger role,googlenews,2021-02-06 10:05:24
"Allegheny Co. Health Dept.’s 211 Hotline To Set Up COVID-19 Vaccination Appointments Receives More Than 15,000 Calls Per Second",googlenews,2021-02-06 10:05:24
"This age group is most responsible for COVID-19 spread, study says",googlenews,2021-02-06 10:05:24
Activision Blizzard (ATVI) Vs Electronic Arts (EA): Which Gaming Stock Is A Better Buy?,googlenews,2021-02-06 10:05:24
"The Zacks Analyst Blog Highlights: Intel, Taiwan Semiconductor Manufacturing and Advanced Micro Devices",googlenews,2021-02-06 10:05:24
Tufin Software (TUFN) May Report Negative Earnings: Know the Trend Ahead of Next Week's Release,googlenews,2021-02-06 10:05:24
"Company News for Feb 5, 2021",googlenews,2021-02-06 10:05:24
Super Bowl parties could lead to another spike in COVID-19 cases,googlenews,2021-02-06 10:05:24
Don't Share Anything If You're Going to a Super Bowl Party,googlenews,2021-02-06 10:05:24
Column: We fear Super Bowl Sunday may become a super spreader event,googlenews,2021-02-06 10:05:24
Fresno County health experts say don’t spread COVID at Super Bowl parties. Stay home,googlenews,2021-02-06 10:05:24
Apple’s car project could put it on a collision course with Tesla,googlenews,2021-02-06 10:05:24
"Apple Talks With Hyundai, Kia on Electric Car Paused Recently",googlenews,2021-02-06 10:05:24
Apple Has Reportedly Hit Pause on Electric Car Talks with Hyundai and Kia,googlenews,2021-02-06 10:05:24
Apple Suspends Apple Car Talks Due to Hyundai Spilling the Beans on the Project,googlenews,2021-02-06 10:05:24
"Bloomingdale shooting at Indian Lakes Hotel leaves 1 dead, several hurt, village official says",googlenews,2021-02-06 10:05:24
"1 dead, at least 3 others wounded in shooting at hotel in west suburban Bloomingdale",googlenews,2021-02-06 10:05:24
"1 dead, multiple injured after Bloomingdale shooting",googlenews,2021-02-06 10:05:24
The Front Page: Oxford vaccine works on Kent strain; more UK snow; Kamala Harris 'glass ceiling' art,googlenews,2021-02-06 10:05:24
Spain limits AstraZeneca jab to the under-55s,googlenews,2021-02-06 10:05:24
UK backs CureVac effort to make vaccine for COVID variants,googlenews,2021-02-06 10:05:24
Oxford says COVID-19 vaccine with AstraZeneca works against UK variant,googlenews,2021-02-06 10:05:24
Why Amazon Insisted On An In-Person Union Election During A Raging Pandemic,googlenews,2021-02-06 10:05:24
Blow to Amazon as Alabama warehouse workers given go-ahead for union vote,googlenews,2021-02-06 10:05:24
Amazon loses attempt to delay milestone union vote at Alabama warehouse,googlenews,2021-02-06 10:05:24
"Amazon loses effort to halt Alabama union drive, voting begins next week",googlenews,2021-02-06 10:05:24
Group home brings trouble to neighborhood in south Miami-Dade County,googlenews,2021-02-06 10:05:24
"Two die after shooting in Miami-Dade’s Gladeview, police say",googlenews,2021-02-06 10:05:24
Detectives Investigate Fatal Double Shooting In NW Miami,googlenews,2021-02-06 10:05:24
Ten South Florida recruits the Miami Hurricanes should prioritize in the Class of 2022,googlenews,2021-02-06 10:05:24
Chicken Wings For Your Super Bowl Menu,googlenews,2021-02-06 10:05:24
"Fast, cheap & delicious: The perfect Super Bowl snack Mediafeed",googlenews,2021-02-06 10:05:24
Get your wing fix for the Super Bowl,googlenews,2021-02-06 10:05:24
Buffalo Chicken Dip! 5 easiest Super Bowl recipes - ABC15 Digital,googlenews,2021-02-06 10:05:24
Luckin Coffee files for bankruptcy in the US,googlenews,2021-02-06 10:05:24
Luckin Coffee Is Filing for Bankruptcy. The Stock Could Go to Zero.,googlenews,2021-02-06 10:05:24
China's Luckin Coffee Just Filed for Bankruptcy Protection,googlenews,2021-02-06 10:05:24
China's Luckin Coffee files for bankruptcy protection,googlenews,2021-02-06 10:05:24
Most of Denver metro area moving to Level Yellow on Saturday,googlenews,2021-02-06 10:05:24
New COVID-19 dial framework in Colorado means looser restrictions starting this weekend,googlenews,2021-02-06 10:05:24
These are the counties moving to level yellow of COVID dial 2.0 this weekend,googlenews,2021-02-06 10:05:24
COVID-19 dial update means many counties move to yellow this weekend,googlenews,2021-02-06 10:05:24
Amazon gifts under $20 for Valentine's Day,googlenews,2021-02-06 10:05:24
Alternative Valentine's Day Gift Ideas,googlenews,2021-02-06 10:05:24
You Don’t Say: Make every day Valentine’s Day for those you love,googlenews,2021-02-06 10:05:24
2021 Valentine's Day Gift Guide,googlenews,2021-02-06 10:05:24
Tesla’s $25k compact car may see real-world road tests sooner than expected,googlenews,2021-02-06 10:05:24
Watch Tesla Model Y Giga Press At Work In Vivid Detail,googlenews,2021-02-06 10:05:24
Tesla's newly updated designs for Model S and Model X,googlenews,2021-02-06 10:05:24
Elon Musk says don't buy a Tesla during production ramps for best quality - Business Insider,googlenews,2021-02-06 10:05:24
"S&P 500, Nasdaq post best weekly gains in three months",googlenews,2021-02-06 10:05:24
Why You Must Prepare for the Stock Market's Inevitable Slowdown,googlenews,2021-02-06 10:05:24
"S&P 500, Nasdaq close at record highs as $1.9 trillion stimulus package works its way through Congress",googlenews,2021-02-06 10:05:24
"Australian Dollar Forecast: S&P 500 Gains Fail to Inspire, Why the Struggle?",googlenews,2021-02-06 10:05:24
Chamath Palihapitiya-backed Clover Health gets notice of SEC investigation,googlenews,2021-02-06 10:05:24
Clover Health calls Hindenburg attack a desperate attempt to position itself as a 'white knight',googlenews,2021-02-06 10:05:24
Clover Health Stock: Chamath Palihapitiya Faces Some Awkward Questions,googlenews,2021-02-06 10:05:24
Where Will This Hot SPAC Be in 10 Years?,googlenews,2021-02-06 10:05:24
Rock Hill man shares experience with Johnson & Johnson vaccine trial ahead of three-week FDA review,googlenews,2021-02-06 10:05:24
COVID-19 update as Johnson and Johnson prepares for FDA approval,googlenews,2021-02-06 10:05:24
"A New Vaccine, Protection Against Strains, and More Coronavirus News",googlenews,2021-02-06 10:05:24
