headline,org,date
"Tesla Rises on Goldman Upgrade, Price Target Boost Ahead of S&P 500 Debut",thestreet,2020-12-03 10:33:23
Splunk Drops on Report of Wider Loss: What Wall Street Is Saying,thestreet,2020-12-03 10:33:23
Jim Cramer: Are Bankruptcies Low? No! They're Soaring,thestreet,2020-12-03 10:33:23
"Meisler: Choppy Waters Now, Rocky Waters Might Follow",thestreet,2020-12-03 10:33:23
Rev Shark: This Is the Year of the Stock-Picker and It Isn't Over Yet,thestreet,2020-12-03 10:33:23
"Price: Talking Heads Tarnish Option Selling, but It's a Golden Strategy",thestreet,2020-12-03 10:33:23
Jhonsa: Not All of Tech Is in a Bubble -- But Certain Parts of it Arguably Are,thestreet,2020-12-03 10:33:23
6 Best Travel Stocks for 2021,thestreet,2020-12-03 10:33:23
Kroger Slips After Grocer Reports Lower-Than-Expected Sales,thestreet,2020-12-03 10:33:23
Snowflake Sales Spark Flurry of Analyst Price-Target Upgrades,thestreet,2020-12-03 10:33:23
Elon Musk Is Fortune’s 2020 Businessperson of the Year,thestreet,2020-12-03 10:33:23
Why Wall Street Is Warming Up to Apple,thestreet,2020-12-03 10:33:23
Why Taiwan Towers Over the Chip Industry,thestreet,2020-12-03 10:33:23
Drivers of Disruption and Innovation in the PPE Space,thestreet,2020-12-03 10:33:23
Sectors Driving Disruption in the PPE Market,thestreet,2020-12-03 10:33:23
How Major Companies Played a Role in PPE Manufacturing,thestreet,2020-12-03 10:33:23
Disability Insurance: Planning for a More Secure Future,thestreet,2020-12-03 10:33:23
The Longevity Economy and The Factors That Have Given Rise to the Current Landscape,thestreet,2020-12-03 10:33:23
Year-End Planning Issues for Investors and Advisers,thestreet,2020-12-03 10:33:23
7 Tax Advantages of Getting Married,thestreet,2020-12-03 10:33:23
The Top Corporate Tax Havens in the World,thestreet,2020-12-03 10:33:23
Top 8 Year-End Tax Tips,thestreet,2020-12-03 10:33:23
Jim Cramer Says Analysts Have Salesforce Buying Slack 'All Wrong',thestreet,2020-12-03 10:33:23
U.K. Approval of Pfizer Vaccine Gives Jim Cramer More Confidence in U.S. Rollout,thestreet,2020-12-03 10:33:23
"McDonald's McRib Is Back In All Its Sweet, Saucy Glory",thestreet,2020-12-03 10:33:23
Walmart Looks to Take on Amazon With Rollback of Shipping Fees,thestreet,2020-12-03 10:33:23
What do low Interest Rates Mean for Investors?,thestreet,2020-12-03 10:33:23
Politics and Your Portfolio: Tuning Out the Noise,thestreet,2020-12-03 10:33:23
Presidential Elections and the Market: What History Tells Investors,thestreet,2020-12-03 10:33:23
Why Haven’t Small-Value Stocks Led Yet?,thestreet,2020-12-03 10:33:23
"How Presidential Election Impacts Stocks, Economy: Tips for Investors",thestreet,2020-12-03 10:33:23
Facebook Will Remove Misinforming Posts About Covid-19 Vaccine,thestreet,2020-12-03 10:33:23
"LIVE: Jim Cramer on Jobless Claims, Snowflake, Stock Market Thursday",thestreet,2020-12-03 10:33:23
Signet Jewelers Rises After Beating Q3 Earnings Estimates,thestreet,2020-12-03 10:33:23
"Express Plunges on Wide Loss, Job Cuts",thestreet,2020-12-03 10:33:23
"5 Best Stories on Real Money: Stimulus, Sentiment and Silver",thestreet,2020-12-03 10:33:23
Waddell & Reed Soars on Accord for $1.7 Billion Sale to Macquarie,thestreet,2020-12-03 10:33:23
Expedia and JetBlue Are Among Some of the Best Travel Stocks for 2021,thestreet,2020-12-03 10:33:23
Patriarch Organization's CEO Shares His Market Predictions for 2021,thestreet,2020-12-03 10:33:23
Zscaler Soars on Analysts' Earnings Praise,thestreet,2020-12-03 10:33:23
Jobless Claims Fall as Companies Keep Hiring Through Pandemic,thestreet,2020-12-03 10:33:23
Chevron Slashes Capital Spending Plans In Lower Carbon Shift; Sets 2021 Budget at $14 Billion,thestreet,2020-12-03 10:33:23
How Confident Are Student Loan Borrowers About Making Payments?,thestreet,2020-12-03 10:33:23
"Dollar General Tops Q3 Earnings Forecast, Holds Back on 2021 Profit Guidance",thestreet,2020-12-03 10:33:23
7 Tax Advantages of Getting Married,thestreet,2020-12-03 10:33:23
Facebook Faces Antitrust Lawsuit From as Many as 40 U.S. States,thestreet,2020-12-03 10:33:23
"3M Targets 2,900 Job Cuts in Updated Global Restructuring Plan",thestreet,2020-12-03 10:33:23
What You Should Know About Donating Points and Miles to Charity,thestreet,2020-12-03 10:33:23
"Dow Futures Gain As Weekly Jobless Claims Drop to 712,000; Dollar Slumps to April 2018 Lows",thestreet,2020-12-03 10:33:23
"Covid-19's Deadliest Day, Snowflake, Splunk, Jobless Claims - 5 Things You Must Know Thursday",thestreet,2020-12-03 10:33:23
Jim Cramer Says Analysts Have Salesforce Buying Slack 'All Wrong',thestreet,2020-12-03 10:33:23
Expedia and JetBlue Are Among Some of the Best Travel Stocks for 2021,thestreet,2020-12-03 10:33:23
Hackers targeting key actors in vaccine supply chain,googlenews,2020-12-03 10:35:31
Elon Musk warns staff Tesla stock price could get 'crushed like a souffle under a sledgehammer',googlenews,2020-12-03 10:35:31
"Fauci: UK approved Pfizer vaccine too fast, not as 'careful' as FDA - Business Insider",googlenews,2020-12-03 10:35:31
Jobless claims hit pandemic-era low as hiring continues even with rising Covid cases,googlenews,2020-12-03 10:35:31
Chevron Slashes Spending Plans as Coronavirus Hammers Oil Demand,googlenews,2020-12-03 10:35:31
"Two dozen businesses at Trump and Kushner properties received federal loans, new PPP data shows",googlenews,2020-12-03 10:35:31
"Walmart gives bonuses to employees, extends emergency leave as pandemic worsens",googlenews,2020-12-03 10:35:31
"Google fired illegally surveilled and fired organizers, NLRB complaint alleges | TheHill",googlenews,2020-12-03 10:35:31
"A Hawaii couple knew they had coronavirus before flying. They boarded a flight anyway and were arrested, police say.",googlenews,2020-12-03 10:35:31
Initial vaccine distribution will cover fraction of health care workers,googlenews,2020-12-03 10:35:31
"Singapore Allows Cruises. Yes, There are Limits.",googlenews,2020-12-03 10:35:31
Safe trip? Aboard the revamped Boeing 737 MAX's 1st public flight,googlenews,2020-12-03 10:35:31
U.S. Stocks Edge Up as Unemployment Claims Drop,googlenews,2020-12-03 10:35:31
Wall Street is already increasing its 2021 price targets: Morning Brief,googlenews,2020-12-03 10:35:31
"Former Zappos CEO Tony Hsieh died without a will, family says",googlenews,2020-12-03 10:35:31
Robservations: Dish Network blackout of Nexstar stations exploits viewers,googlenews,2020-12-03 10:35:31
"Deadlocked on oil production cuts, OPEC and its allies resume talks",googlenews,2020-12-03 10:35:31
Institutions rushing into $19K Bitcoin as GBTC premium hits 6-month high,googlenews,2020-12-03 10:35:31
"Frank Carney, Pizza Hut co-founder, dies at 82",googlenews,2020-12-03 10:35:31
Airlines can soon deny emotional support animals free flights,googlenews,2020-12-03 10:35:31
"Black Friday slumps, but some retailers are OK with that: Earlier deals, Cyber Monday come to the rescue",googlenews,2020-12-03 10:35:31
Singapore is the first country to approve the sale of lab-grown meat,googlenews,2020-12-03 10:35:31
Why Salesforce Stock Plunged Today,googlenews,2020-12-03 10:35:31
Here are the 108 active COVID-19 workplace outbreaks in Oregon,googlenews,2020-12-03 10:35:31
Katie Porter Spars With Mnuchin At Hearing: 'Ridiculous You're Play Acting… You Have No Legal Degree',googlenews,2020-12-03 10:35:31
Delisting Chinese Stocks in the U.S. Won’t Sever Their Access to Global Capital,googlenews,2020-12-03 10:35:31
Moncef Slaoui: 100 million Americans vaccinated by March 2021 - Business Insider,googlenews,2020-12-03 10:35:31
"75,000 Kansans to get COVID-19 vaccinations by month’s end, Gov. Kelly announces",googlenews,2020-12-03 10:35:31
"Tesla (TSLA) could sell 20 million electric cars per year, says out-of-touch Goldman Sachs",googlenews,2020-12-03 10:35:31
UPDATE: Brookings Post Office will re-open after 'environmental issue',googlenews,2020-12-03 10:35:31
"3M is cutting another 2,900 jobs",googlenews,2020-12-03 10:35:31
Trump silent as UK is first to authorize vaccine,googlenews,2020-12-03 10:35:31
"HPE, a touchstone of Silicon Valley, moving headquarters to Houston to save costs, recruit talent",googlenews,2020-12-03 10:35:31
COVID-19 vaccine trial participant describes side effects,googlenews,2020-12-03 10:35:31
Where COVID-19 is hitting the counties around D-FW the hardest,googlenews,2020-12-03 10:35:31
Coronavirus update: OWS official says '100% no interference with the FDA',googlenews,2020-12-03 10:35:31
"20 people won South African lottery after playing 5, 6, 7, 8, 9 and 10 -- sparking fraud calls",googlenews,2020-12-03 10:35:31
"Lon Adams, who developed the recipe for Slim Jim jerky, dies of Covid-19",googlenews,2020-12-03 10:35:31
Brown Butter Espresso Cookies Recipe,googlenews,2020-12-03 10:35:31
UPS drivers told not to pick up shipments from major retailers amid pandemic-fueled holiday surge: report | TheHill,googlenews,2020-12-03 10:35:31
XPO Logistics Plans Two-Way Split,googlenews,2020-12-03 10:35:31
Nevada doctor responds to President Trump's 'fake' hospital claims,googlenews,2020-12-03 10:35:31
Reasons to Buy: Cramer's 'Mad Money' Recap (Wednesday 12/2/20),googlenews,2020-12-03 10:35:31
Knox County Board of Health passes 10 person social gathering limit,googlenews,2020-12-03 10:35:31
These Trump supporters say big tech is biased. Here's why they're on Parler,googlenews,2020-12-03 10:35:31
Hesperia man arrested in connection with catalytic converter thefts,googlenews,2020-12-03 10:35:31
COVID-19 updates: Fort Worth man in his 20s among latest deaths,googlenews,2020-12-03 10:35:31
Facebook could face an antitrust lawsuit from at least 20 states as soon as next week,googlenews,2020-12-03 10:35:31
"I finally broke up with the McRib after its latest N.J. return and you should, too",googlenews,2020-12-03 10:35:31
Six ways Washington's never-ending gridlock on COVID-19 stimulus is hurting ordinary Americans,googlenews,2020-12-03 10:35:31
2 Surprising Coronavirus Vaccine Stocks to Buy Right Now,googlenews,2020-12-03 10:35:31
Starbucks offering free coffee to health care workers and first responders for the entire month of December,googlenews,2020-12-03 10:35:31
Sephora is opening up mini shops inside Kohl's stores,googlenews,2020-12-03 10:35:31
"IPO floodgates open as Airbnb, DoorDash prep stock-market debuts",googlenews,2020-12-03 10:35:31
"Nasdaq Requirements Erase Women, Requires Companies to Hire Director Who ‘Self-Identifies as Female’",googlenews,2020-12-03 10:35:31
"US economic activity is slowing as virus surges, Fed reports",googlenews,2020-12-03 10:35:31
Solar panel recycling in the US — a looming issue that could harm industry growth and reputation,googlenews,2020-12-03 10:35:31
Rhode Island facilities moving COVID-19 patients to field hospital to free up beds | TheHill,googlenews,2020-12-03 10:35:31
"A second stimulus check isn't off the table yet, but it may be delayed",googlenews,2020-12-03 10:35:31
"Macquarie Group to Acquire Waddell & Reed Financial, Inc. for $1.7 Billion",googlenews,2020-12-03 10:35:31
Nikola shares see another ugly sell-off in volatile trading as insider lockup period expires,googlenews,2020-12-03 10:35:31
Dyal Capital in Talks to Combine With Owl Rock Capital,googlenews,2020-12-03 10:35:31
Texas waitress complains restaurant is refusing to pay $2000 tip left to her by a generous customer,googlenews,2020-12-03 10:35:31
Why I'm Planning for Early Retirement Even Though I Don't Want to Quit Working,googlenews,2020-12-03 10:35:31
This ETF Could Help Grow Your Retirement Account,googlenews,2020-12-03 10:35:31
Traders Haven't Been This Bullish On Oil Since August,googlenews,2020-12-03 10:35:31
DHEC reports highest percent positive of COVID-19 cases since September,googlenews,2020-12-03 10:35:31
Vineyard Wind pauses U.S. permitting over switch to GE turbines,googlenews,2020-12-03 10:35:31
"AWS: Containers, serverless, and cloud-native computing oh my!",googlenews,2020-12-03 10:35:31
Self-driving robotaxis are taking off in China,googlenews,2020-12-03 10:35:31
UCSF doctor releases timeline for COVID-19 vaccine: When will you get it?,googlenews,2020-12-03 10:35:31
Coronavirus: Hackers targeted Covid vaccine supply 'cold chain',googlenews,2020-12-03 10:35:31
Hackers Are Targeting the Covid-19 Vaccine ‘Cold Chain’,googlenews,2020-12-03 10:35:31
IBM warns hackers targeting COVID vaccine 'cold chain' supply process,googlenews,2020-12-03 10:35:31
How AI-powered video compression could make an honest man out of Elon Musk,googlenews,2020-12-03 10:35:31
Elon Musk warns employees Tesla's stock could 'get crushed like a soufflé under a sledgehammer',googlenews,2020-12-03 10:35:31
Elon Musk’s $139 Billion Fortune Leads Huge EV Wealth Gains,googlenews,2020-12-03 10:35:31
"'Big Short' investor Michael Burry reveals he's short Tesla, tells Elon Musk to issue more stock at its 'ridiculous price'",googlenews,2020-12-03 10:35:31
What it feels like to get an mRNA coronavirus vaccine,googlenews,2020-12-03 10:35:31
Health & Welfare: 'We anticipate that before the end of the year we could have the COVID-19 vaccine in Idaho',googlenews,2020-12-03 10:35:31
"Vaccine roll-out in UK, Russia is great news",googlenews,2020-12-03 10:35:31
The ‘last mile’ for COVID-19 vaccines could be the biggest challenge yet,googlenews,2020-12-03 10:35:31
"Another 712,000 Americans filed for unemployment benefits last week",googlenews,2020-12-03 10:35:31
"LIVE: Jim Cramer on Jobless Claims, Snowflake, Stock Market Thursday",googlenews,2020-12-03 10:35:31
Live Market Updates: US Jobless Claims Drop,googlenews,2020-12-03 10:35:31
Gold price ignores better-than-expected U.S. weekly jobless claims data,googlenews,2020-12-03 10:35:31
"Chevron cuts capital spend plans, prioritizing US oil plays",googlenews,2020-12-03 10:35:31
Chevron Slashes Long-Term Spending Plan in Wake of Oil Slump,googlenews,2020-12-03 10:35:31
"More than 600 companies got the maximum $10M in PPP loans, disadvantaging small businesses",googlenews,2020-12-03 10:35:31
SBA reveals full list of recipients of PPP loans; See list of all Valley companies receiving loans,googlenews,2020-12-03 10:35:31
"Donald Trump and Jared Kushner receive $3.65m in PPP loan money intended for small businesses, report says",googlenews,2020-12-03 10:35:31
"Trump Organization, Kushner Companies benefited from pandemic relief loans: report | TheHill",googlenews,2020-12-03 10:35:31
Walmart to give employees bonuses,googlenews,2020-12-03 10:35:31
"Walmart, Like Amazon, to Pay Holiday Bonuses to U.S. Workers",googlenews,2020-12-03 10:35:31
Walmart to give 4th round of bonuses to workers since virus,googlenews,2020-12-03 10:35:31
"Google illegally spied on workers before firing them, US labor board alleges",googlenews,2020-12-03 10:35:31
Google Hit With Surprise Labor Rights Complaint Over Fired Workers,googlenews,2020-12-03 10:35:31
"U.S. Labor Board accuses Google of spying on employees, discouraging worker organization, and retaliation",googlenews,2020-12-03 10:35:31
"Google violated U.S. labor laws in clampdown on worker organizing, regulator says",googlenews,2020-12-03 10:35:31
Couple who tested positive for Covid are arrested after boarding flight,googlenews,2020-12-03 10:35:31
"Couple Knew They Had COVID, Took Flight Anyway",googlenews,2020-12-03 10:35:31
Couple knowingly boards SFO flight to Hawaii after positive COVID-19 tests,googlenews,2020-12-03 10:35:31
A couple was arrested after allegedly traveling to Hawaii knowing they tested positive for Covid-19,googlenews,2020-12-03 10:35:31
"Vaccination cards will be issued to everyone getting Covid-19 vaccine, health officials say",googlenews,2020-12-03 10:35:31
"US hopes to vaccinate 20M this year, 100M by end of February",googlenews,2020-12-03 10:35:31
Warp Speed official urges patience on Covid vaccine: 'We are not going to turn anybody away',googlenews,2020-12-03 10:35:31
The NIH’s Top Vaccine Maker Wants Warp Speed To Be the New Normal,googlenews,2020-12-03 10:35:31
Royal Caribbean cancels cruises through February 2021 while preparing to restart,googlenews,2020-12-03 10:35:31
Corporate America’s Cash Burn Problem Is Getting Worse,googlenews,2020-12-03 10:35:31
Why Royal Caribbean Stock Jumped 40% in November,googlenews,2020-12-03 10:35:31
Royal Caribbean releases new Europe summer 2022 cruises to book,googlenews,2020-12-03 10:35:31
Boeing 737 Max will return to service by end of year,googlenews,2020-12-03 10:35:31
American Airlines starts Boeing 737 Max flights to boost confidence in jets after fatal crashes,googlenews,2020-12-03 10:35:31
Boeing 737 Max Returns To Skies In Test Flight | TODAY,googlenews,2020-12-03 10:35:31
737 MAX jets begin flying in and out of Grant County International Airport,googlenews,2020-12-03 10:35:31
Tesla 'won't be disruptive' towards S&P 500: Analyst on market volatility,googlenews,2020-12-03 10:35:31
"S&P 500 Index opens little changed near 3,670",googlenews,2020-12-03 10:35:31
"Dow rises more than 100 points as Boeing jumps 5%, Nasdaq hits record",googlenews,2020-12-03 10:35:31
S&P 500 hits record as investors await fiscal deal,googlenews,2020-12-03 10:35:31
4 Top Retirement Planning Tips from Warren Buffett,googlenews,2020-12-03 10:35:31
3 “Strong Buy” Stocks That Could Bloom in 2021,googlenews,2020-12-03 10:35:31
Devon Energy Announces First-Quarter 2021 Cash Dividend for Common Stockholders,googlenews,2020-12-03 10:35:31
19 Wealth-Building Lessons From the Latest Financial Crises,googlenews,2020-12-03 10:35:31
Tony Hsieh's family checking on ex-Zappos CEO estate plan,googlenews,2020-12-03 10:35:31
"Colleagues fear Zappos founder Tony Hsieh's alleged alcohol, nitrous oxide use played role in death: report",googlenews,2020-12-03 10:35:31
"Tony Hsieh, former Zappos CEO, died without will",googlenews,2020-12-03 10:35:31
"Drug use by Zappos founder had been growing at time of death, report says",googlenews,2020-12-03 10:35:31
Nexstar Stations And WGN America Go Dark On Dish Network,googlenews,2020-12-03 10:35:31
Dish Network customers lose Nexstar's local TV stations in 115 markets over failed negotiations,googlenews,2020-12-03 10:35:31
"FOX8, other Nexstar stations removed from DISH lineup",googlenews,2020-12-03 10:35:31
Dish Network removes all FOX4 programming from its system,googlenews,2020-12-03 10:35:31
Is OPEC Finally Making Progress Towards An Oil Output Deal,googlenews,2020-12-03 10:35:31
Oil sees quiet bull market as hedge funds pile in,googlenews,2020-12-03 10:35:31
Oil drops as OPEC+ resume talks on output cut extension after impasse,googlenews,2020-12-03 10:35:31
Will OPEC Increase Oil Production In January,googlenews,2020-12-03 10:35:31
Market Wrap: Bitcoin Flat at $19K While Ether Options Traders Bet Bearish on 2021 - CoinDesk,googlenews,2020-12-03 10:35:31
65% of Traders on Paypal Ready to Use Bitcoin to Pay for Goods and Services: Survey | News,googlenews,2020-12-03 10:35:31
Bitcoin hitting $200K by December 2021 is now ‘conservative’ — Willy Woo,googlenews,2020-12-03 10:35:31
Bitcoin Price Surges After US Proposes Stablecoin Law,googlenews,2020-12-03 10:35:31
"He Co-Founded Pizza Hut, Then Switched to Papa John's",googlenews,2020-12-03 10:35:31
Pizza Hut co-founder Frank Carney dies from pneumonia at 82,googlenews,2020-12-03 10:35:31
"Pizza Hut co-founder Frank Carney, a disciplined business giant, dies at 82",googlenews,2020-12-03 10:35:31
"Community remembers Frank Carney, Pizza Hut co-founder, who dies at 82",googlenews,2020-12-03 10:35:31
New rules for emotional support animals on planes,googlenews,2020-12-03 10:35:31
Feds: No more ‘comfort’ animals on flights,googlenews,2020-12-03 10:35:31
Dept. of Transportation tightens definition of service animals allowed on planes,googlenews,2020-12-03 10:35:31
Finally: Tough new rules about 'service' animals on planes,googlenews,2020-12-03 10:35:31
Data Reveals Top Holiday Trends,googlenews,2020-12-03 10:35:31
"NRF: Black Friday isn't dead, next year could be biggest ever - Business Insider",googlenews,2020-12-03 10:35:31
"2020 Holiday Sales: How, Where and When Consumers Are Buying",googlenews,2020-12-03 10:35:31
"Black Friday, Cyber Monday sales disappoint, another sign the economic recovery is stumbling",googlenews,2020-12-03 10:35:31
Singapore Is Now the First Country To Approve Lab-Grown Meat,googlenews,2020-12-03 10:35:31
The world's first lab-grown chicken has been approved,googlenews,2020-12-03 10:35:31
Meat developed using animal cells approved for sale in Singapore,googlenews,2020-12-03 10:35:31
"Singapore approves sale of lab-grown meat, makes history with Eat Just",googlenews,2020-12-03 10:35:31
Marc Benioff Sets His Sights on Microsoft,googlenews,2020-12-03 10:35:31
Everyone has an opinion on the $27.7B Slack acquisition,googlenews,2020-12-03 10:35:31
"Yes, Salesforce is Buying Slack, but They Also Reported a Very Nice Quarter",googlenews,2020-12-03 10:35:31
Salesforce’s Splashy Slack Deal Isn't Worth the Risk,googlenews,2020-12-03 10:35:31
"Oregon doctor and staff refuse to wear masks during pandemic, calling Covid 'common cold'",googlenews,2020-12-03 10:35:31
"Coronavirus in Oregon: State reports 1,244 new cases, double-digit deaths for second straight day",googlenews,2020-12-03 10:35:31
Nearly a dozen COVID-19 cases linked to Portland Walmart,googlenews,2020-12-03 10:35:31
"Oregon reports 18 more COVID-19 deaths, 1244 new cases",googlenews,2020-12-03 10:35:31
"Powell, Mnuchin Embrace New Stimulus After Fed Lending Rift",googlenews,2020-12-03 10:35:31
Katie Porter in heated exchange with Mnuchin: 'You're play-acting to be a lawyer' | TheHill,googlenews,2020-12-03 10:35:31
"Deal on fresh US coronavirus relief eluding congressional Republicans, Democrats",googlenews,2020-12-03 10:35:31
"Powell Says No Rift With Mnuchin, Signals Fed Not Stepping Back",googlenews,2020-12-03 10:35:31
Threat to remove Chinese firms from Wall Street is now on Trump's desk,googlenews,2020-12-03 10:35:31
Bill forcing Chinese firms to meet U.S. accounting standards passes Congress,googlenews,2020-12-03 10:35:31
"House Passes China Delisting Bill, Sending to Trump for Approval. What That Means for Investors.",googlenews,2020-12-03 10:35:31
House passes bill that could delist Chinese companies from U.S. stock exchanges,googlenews,2020-12-03 10:35:31
Will there be side effects from a COVID-19 vaccine? When can you get it? We answer your vaccine questions,googlenews,2020-12-03 10:35:31
Moderna plans to test COVID-19 vaccine on children,googlenews,2020-12-03 10:35:31
While You Were Sleeping: Coronavirus updates for December 3,googlenews,2020-12-03 10:35:31
"To roll out Covid-19 vaccines, vaccinate everyone in several hot zones",googlenews,2020-12-03 10:35:31
Tesla climbs as Goldman lifts rating to buy and price target to $780,googlenews,2020-12-03 10:35:31
Goldman Sachs upgrades Tesla and says the stock has massive upside of over 30%,googlenews,2020-12-03 10:35:31
Tesla Gets Goldman Sachs Upgrade With $780 Price Target,googlenews,2020-12-03 10:35:31
"Top Analyst Upgrades and Downgrades: CrowdStrike, Equinix, JPMorgan, Lyft, Snowflake, Splunk, Tesla, Xpeng, Zscaler and More",googlenews,2020-12-03 10:35:31
"3M to cut 2,900 jobs in restructuring",googlenews,2020-12-03 10:35:31
"3M cutting 2,900 jobs as Minnesota-based company restructures",googlenews,2020-12-03 10:35:31
"Post-it maker 3M to cut 2,900 jobs globally in new restructuring",googlenews,2020-12-03 10:35:31
"3M will cut 2,900 jobs in restructuring",googlenews,2020-12-03 10:35:31
FDA chief meets with Meadows again as Trump remains frustrated with pace of vaccine approval,googlenews,2020-12-03 10:35:31
FDA Head Defends Covid-19 Vaccine-Approval Process,googlenews,2020-12-03 10:35:31
"Despite Urgency And Pressure, FDA Commissioner Stephen Hahn Says 'Corners Cannot Be Cut' In Authorizing COVID-19 Vaccine",googlenews,2020-12-03 10:35:31
What We Know About the U.S. COVID-19 Vaccine Distribution Plan,googlenews,2020-12-03 10:35:31
The company that literally started Silicon Valley is moving to Texas,googlenews,2020-12-03 10:35:31
Hewlett Packard Enterprise's move to Houston could spur 'technology renaissance',googlenews,2020-12-03 10:35:31
Economy: Hewlett Packard Enterprise eyes big job increase at San Jose tech hub,googlenews,2020-12-03 10:35:31
Chuck DeVore: Hewlett Packard packs up -- Will California ever get fed up with losing to Texas?,googlenews,2020-12-03 10:35:31
COVID-19 deaths rising in Pa. and across U.S. as CDC director gives dire warning; Moderna’s plan to test vacci,googlenews,2020-12-03 10:35:31
"What you need to know about coronavirus on Thursday, December 3",googlenews,2020-12-03 10:35:31
Singapore's HSA reviewing Covid-19 vaccine data from Moderna,googlenews,2020-12-03 10:35:31
HSA evaluating initial data on COVID-19 vaccine submitted by Moderna for use in Singapore,googlenews,2020-12-03 10:35:31
North Texas prepares for reopening rollbacks as COVID hospitalizations stay above 15%,googlenews,2020-12-03 10:35:31
"North Texas Restaurants, Bars Talk Of Impact If Openings Scaled Back Due To High Covid-19 Hospitali",googlenews,2020-12-03 10:35:31
"Dallas County reports 1,640 new COVID-19 cases, 3 deaths as hospitalizations remain above 15%",googlenews,2020-12-03 10:35:31
"Dallas County Adds 1,640 COVID-19 Cases Wednesday, 3 More Deaths",googlenews,2020-12-03 10:35:31
December 2 coronavirus news,googlenews,2020-12-03 10:35:31
How Massachusetts plans to distribute a COVID-19 vaccine,googlenews,2020-12-03 10:35:31
City of Cambridge Prepares To Distribute COVID-19 Vaccines | News,googlenews,2020-12-03 10:35:31
Drugmaker Merck divests stake in vaccine-maker Moderna,googlenews,2020-12-03 10:35:31
Powerball results for 12/02/20; did anyone win the $228M jackpot?,googlenews,2020-12-03 10:35:31
"South Africa's lottery probed as 5, 6, 7, 8, 9 and 10 drawn and 20 win",googlenews,2020-12-03 10:35:31
"Powerball Results, Numbers for 12/2/20: Did Anyone Win the $228 Million?",googlenews,2020-12-03 10:35:31
