headline,org,date
Stocks week ahead: Saying goodbye to a wild 2020,msnmoney,2021-01-03 10:26:24
What Experts Say 2021 Will Look Like for Your Wallet,msnmoney,2021-01-03 10:26:24
Make This One Money Move Now - Before The Inauguration. Click Here,msnmoney,2021-01-03 10:26:24
Give Your 401(k) a 2021 Checkup in 5 Simple Steps,msnmoney,2021-01-03 10:26:24
The tips you need to meet your 2021 financial goals,msnmoney,2021-01-03 10:26:24
"Spend $500, get $200 fast with this top card",msnmoney,2021-01-03 10:26:24
Valuation Caution Returns as Emerging Markets Face 2021 Reality,msnmoney,2021-01-03 10:26:24
The worst things no one tells you about retirement,msnmoney,2021-01-03 10:26:24
Can’t afford an estate plan? Here’s what you can do without spending a fortune,msnmoney,2021-01-03 10:26:24
Americans Are Obsessed With New Blanket That Puts You To Sleep In Minutes,msnmoney,2021-01-03 10:26:24
Charming tiny home communities across America,msnmoney,2021-01-03 10:26:24
"Before you renew Amazon Prime, read this",msnmoney,2021-01-03 10:26:24
Iran to Boost Oil Output Via $1.2 Billion Deal With Local Firms,msnmoney,2021-01-03 10:26:24
Reasons shopping at Costco is the worst,msnmoney,2021-01-03 10:26:24
Fast Vaccination Drive Boosts Israeli Economic Outlook This Year,msnmoney,2021-01-03 10:26:24
"New Year's resolutions that can save you $1,000 or more",msnmoney,2021-01-03 10:26:24
India Seeks Expressions of Interest for Stake in State-Run BEML,msnmoney,2021-01-03 10:26:24
0% APR Until 2022 is 100% Insane,msnmoney,2021-01-03 10:26:24
Jobs that could grow during the pandemic and recession,msnmoney,2021-01-03 10:26:24
"Save, invest & earn more in 2021—here's how",msnmoney,2021-01-03 10:26:24
Countries where people retire the youngest,msnmoney,2021-01-03 10:26:24
Fiat and PSA’s Against-All-Odds Merger Nears the Finish Line,msnmoney,2021-01-03 10:26:24
10 Ways To Bounce Back From a Heavy Spending Month on Your Credit Card,msnmoney,2021-01-03 10:26:24
"Surgeon: When The Buzzing In Your Ears Won't Stop, Do This (Watch)",msnmoney,2021-01-03 10:26:24
Robo advisor vs. financial advisor: Which should you choose?,msnmoney,2021-01-03 10:26:24
Home upgrades that will save you money in 2021,msnmoney,2021-01-03 10:26:24
"Rarely have market timers been as bullish as they are now, which is a warning sign for stocks",msnmoney,2021-01-03 10:26:24
15 things that will cost more in 2021,msnmoney,2021-01-03 10:26:24
Love gift cards? 22 ways you can get them for free,msnmoney,2021-01-03 10:26:24
Best & Worst Refi Mortgage Companies of 2021,msnmoney,2021-01-03 10:26:24
Top Money Moves I’m Making Now To Save My Bank Account in 2021,msnmoney,2021-01-03 10:26:24
Deutsche Bank CEO Seeks Key Role in Banking Consolidation: Welt,msnmoney,2021-01-03 10:26:24
Return Policies for Gifts Your Friends and Family Bought Online,msnmoney,2021-01-03 10:26:24
8 Surprising Things No One Tells You About Retirement,msnmoney,2021-01-03 10:26:24
The Most Anticipated IPOs of 2021,msnmoney,2021-01-03 10:26:24
Seniors Are Now Entitled To 19 Incredible Discounts During Tough Times,msnmoney,2021-01-03 10:26:24
Tesla hit half-million car target in 2020,msnmoney,2021-01-03 10:26:24
The 7 worst ways people will use their stimulus checks,msnmoney,2021-01-03 10:26:24
6 Times You Should Not DIY a Home Improvement Project,msnmoney,2021-01-03 10:26:24
How To Manage All the Extra Debt You Piled Up in 2020,msnmoney,2021-01-03 10:26:24
Weekend reads: The streaming services worth paying for in 2021,msnmoney,2021-01-03 10:26:24
"West Chester, Pennsylvania: Are You Aware Of This?",msnmoney,2021-01-03 10:26:24
Costco mistakes that could cost you big money,msnmoney,2021-01-03 10:26:24
11 Secret Uses for Everyday Items That Save Money,msnmoney,2021-01-03 10:26:24
13 Things Seniors Can Get for Free — or Almost Free,msnmoney,2021-01-03 10:26:24
Tesla short-sellers lost $38 billion throughout the automaker's colossal 2020 rally,msnmoney,2021-01-03 10:26:24
How to prepare for working past retirement age,msnmoney,2021-01-03 10:26:24
[Photos] Sandra Bullock's Son Finally Confirms the Rumors,msnmoney,2021-01-03 10:26:24
11 unlucky celebrities who lost dream homes,msnmoney,2021-01-03 10:26:24
The big differences between Costco and Costco.com,msnmoney,2021-01-03 10:26:24
"‘This is the top, kids. I’m a millionaire’: Investor rides 70x winner to hit milestone — and he’s not selling.",msnmoney,2021-01-03 10:26:24
10 Job Skills Worth Six-Figure Salaries,msnmoney,2021-01-03 10:26:24
3 Mortgage REITs to Buy Now,msnmoney,2021-01-03 10:26:24
Our 5 Stock Picks To Retire Early,msnmoney,2021-01-03 10:26:24
Celebs who are famously cheap,msnmoney,2021-01-03 10:26:24
Tech stocks surged along with COVID-19. Don’t expect the same in 2021,msnmoney,2021-01-03 10:26:24
15 Things Experts Say You Should Never Skimp On,msnmoney,2021-01-03 10:26:24
What will Joe Biden do to mortgage rates? Here's what experts say,msnmoney,2021-01-03 10:26:24
15 Painless Ways You Can Cut Costs in 2021,msnmoney,2021-01-03 10:26:24
Beijing says it will take 'necessary measures' in response to NYSE delisting of 3 Chinese companies,msnmoney,2021-01-03 10:26:24
If You Have Sliding Doors in Your Home This Is a Must Read,msnmoney,2021-01-03 10:26:24
Start 2021 Off Right With Your January Financial Checklist,msnmoney,2021-01-03 10:26:24
44 expensive bathroom mistakes people always make,msnmoney,2021-01-03 10:26:24
True Story: How One Man Retired by Age 30,msnmoney,2021-01-03 10:26:24
Big predictions for the year ahead on Wall Street,msnmoney,2021-01-03 10:26:24
Things you should stop buying in 2021,msnmoney,2021-01-03 10:26:24
Best small towns to raise a family in every state,msnmoney,2021-01-03 10:26:24
This Tiny Streaming Company is Making Fast-Acting Investors Rich,msnmoney,2021-01-03 10:26:24
Things you should and should not buy in January,msnmoney,2021-01-03 10:26:24
Airbus Said to Deliver About 560 Planes Last Year With Late Push,msnmoney,2021-01-03 10:26:24
18 Resolutions To Get Rich in 2021,msnmoney,2021-01-03 10:26:24
Both Powerball and Mega Millions jackpots are above $400 million. Here's what to do if you win,msnmoney,2021-01-03 10:26:24
15 ways to give yourself a raise in the new year,msnmoney,2021-01-03 10:26:24
McDonald's Travis Scott collaboration unleashed a new era of celebrity menu items - with one specific twist in common,msnmoney,2021-01-03 10:26:24
Stocks week ahead: Saying goodbye to a wild 2020,msnmoney,2021-01-03 10:26:24
What Experts Say 2021 Will Look Like for Your Wallet,msnmoney,2021-01-03 10:26:24
Make This One Money Move Now - Before The Inauguration. Click Here,msnmoney,2021-01-03 10:26:24
Give Your 401(k) a 2021 Checkup in 5 Simple Steps,msnmoney,2021-01-03 10:26:24
The tips you need to meet your 2021 financial goals,msnmoney,2021-01-03 10:26:24
"Spend $500, get $200 fast with this top card",msnmoney,2021-01-03 10:26:24
Valuation Caution Returns as Emerging Markets Face 2021 Reality,msnmoney,2021-01-03 10:26:24
The worst things no one tells you about retirement,msnmoney,2021-01-03 10:26:24
Can’t afford an estate plan? Here’s what you can do without spending a fortune,msnmoney,2021-01-03 10:26:24
Americans Are Obsessed With New Blanket That Puts You To Sleep In Minutes,msnmoney,2021-01-03 10:26:24
Charming tiny home communities across America,msnmoney,2021-01-03 10:26:24
"Before you renew Amazon Prime, read this",msnmoney,2021-01-03 10:26:24
Iran to Boost Oil Output Via $1.2 Billion Deal With Local Firms,msnmoney,2021-01-03 10:26:24
Reasons shopping at Costco is the worst,msnmoney,2021-01-03 10:26:24
Fast Vaccination Drive Boosts Israeli Economic Outlook This Year,msnmoney,2021-01-03 10:26:24
"New Year's resolutions that can save you $1,000 or more",msnmoney,2021-01-03 10:26:24
India Seeks Expressions of Interest for Stake in State-Run BEML,msnmoney,2021-01-03 10:26:24
0% APR Until 2022 is 100% Insane,msnmoney,2021-01-03 10:26:24
Jobs that could grow during the pandemic and recession,msnmoney,2021-01-03 10:26:24
"Save, invest & earn more in 2021—here's how",msnmoney,2021-01-03 10:26:24
Countries where people retire the youngest,msnmoney,2021-01-03 10:26:24
Fiat and PSA’s Against-All-Odds Merger Nears the Finish Line,msnmoney,2021-01-03 10:26:24
10 Ways To Bounce Back From a Heavy Spending Month on Your Credit Card,msnmoney,2021-01-03 10:26:24
"Surgeon: When The Buzzing In Your Ears Won't Stop, Do This (Watch)",msnmoney,2021-01-03 10:26:24
Robo advisor vs. financial advisor: Which should you choose?,msnmoney,2021-01-03 10:26:24
Home upgrades that will save you money in 2021,msnmoney,2021-01-03 10:26:24
"Rarely have market timers been as bullish as they are now, which is a warning sign for stocks",msnmoney,2021-01-03 10:26:24
15 things that will cost more in 2021,msnmoney,2021-01-03 10:26:24
Love gift cards? 22 ways you can get them for free,msnmoney,2021-01-03 10:26:24
Best & Worst Refi Mortgage Companies of 2021,msnmoney,2021-01-03 10:26:24
Top Money Moves I’m Making Now To Save My Bank Account in 2021,msnmoney,2021-01-03 10:26:24
Deutsche Bank CEO Seeks Key Role in Banking Consolidation: Welt,msnmoney,2021-01-03 10:26:24
Return Policies for Gifts Your Friends and Family Bought Online,msnmoney,2021-01-03 10:26:24
8 Surprising Things No One Tells You About Retirement,msnmoney,2021-01-03 10:26:24
The Most Anticipated IPOs of 2021,msnmoney,2021-01-03 10:26:24
Seniors Are Now Entitled To 19 Incredible Discounts During Tough Times,msnmoney,2021-01-03 10:26:24
Tesla hit half-million car target in 2020,msnmoney,2021-01-03 10:26:24
The 7 worst ways people will use their stimulus checks,msnmoney,2021-01-03 10:26:24
6 Times You Should Not DIY a Home Improvement Project,msnmoney,2021-01-03 10:26:24
How To Manage All the Extra Debt You Piled Up in 2020,msnmoney,2021-01-03 10:26:24
Weekend reads: The streaming services worth paying for in 2021,msnmoney,2021-01-03 10:26:24
"West Chester, Pennsylvania: Are You Aware Of This?",msnmoney,2021-01-03 10:26:24
Costco mistakes that could cost you big money,msnmoney,2021-01-03 10:26:24
11 Secret Uses for Everyday Items That Save Money,msnmoney,2021-01-03 10:26:24
13 Things Seniors Can Get for Free — or Almost Free,msnmoney,2021-01-03 10:26:24
Tesla short-sellers lost $38 billion throughout the automaker's colossal 2020 rally,msnmoney,2021-01-03 10:26:24
How to prepare for working past retirement age,msnmoney,2021-01-03 10:26:24
[Photos] Sandra Bullock's Son Finally Confirms the Rumors,msnmoney,2021-01-03 10:26:24
11 unlucky celebrities who lost dream homes,msnmoney,2021-01-03 10:26:24
The big differences between Costco and Costco.com,msnmoney,2021-01-03 10:26:24
"‘This is the top, kids. I’m a millionaire’: Investor rides 70x winner to hit milestone — and he’s not selling.",msnmoney,2021-01-03 10:26:24
10 Job Skills Worth Six-Figure Salaries,msnmoney,2021-01-03 10:26:24
3 Mortgage REITs to Buy Now,msnmoney,2021-01-03 10:26:24
Our 5 Stock Picks To Retire Early,msnmoney,2021-01-03 10:26:24
Celebs who are famously cheap,msnmoney,2021-01-03 10:26:24
Tech stocks surged along with COVID-19. Don’t expect the same in 2021,msnmoney,2021-01-03 10:26:24
15 Things Experts Say You Should Never Skimp On,msnmoney,2021-01-03 10:26:24
What will Joe Biden do to mortgage rates? Here's what experts say,msnmoney,2021-01-03 10:26:24
15 Painless Ways You Can Cut Costs in 2021,msnmoney,2021-01-03 10:26:24
Beijing says it will take 'necessary measures' in response to NYSE delisting of 3 Chinese companies,msnmoney,2021-01-03 10:26:24
If You Have Sliding Doors in Your Home This Is a Must Read,msnmoney,2021-01-03 10:26:24
Start 2021 Off Right With Your January Financial Checklist,msnmoney,2021-01-03 10:26:24
44 expensive bathroom mistakes people always make,msnmoney,2021-01-03 10:26:24
True Story: How One Man Retired by Age 30,msnmoney,2021-01-03 10:26:24
Big predictions for the year ahead on Wall Street,msnmoney,2021-01-03 10:26:24
Things you should stop buying in 2021,msnmoney,2021-01-03 10:26:24
Best small towns to raise a family in every state,msnmoney,2021-01-03 10:26:24
This Tiny Streaming Company is Making Fast-Acting Investors Rich,msnmoney,2021-01-03 10:26:24
Things you should and should not buy in January,msnmoney,2021-01-03 10:26:24
Airbus Said to Deliver About 560 Planes Last Year With Late Push,msnmoney,2021-01-03 10:26:24
18 Resolutions To Get Rich in 2021,msnmoney,2021-01-03 10:26:24
Both Powerball and Mega Millions jackpots are above $400 million. Here's what to do if you win,msnmoney,2021-01-03 10:26:24
15 ways to give yourself a raise in the new year,msnmoney,2021-01-03 10:26:24
McDonald's Travis Scott collaboration unleashed a new era of celebrity menu items - with one specific twist in common,msnmoney,2021-01-03 10:26:24
Investors are bullish on 2021,yahoofinance,2021-01-03 10:28:31
"Tesla 2020 deliveries beat estimates, but fall short of Musk's target",yahoofinance,2021-01-03 10:28:31
"Dizzying valuations, IPO craze tick boxes on bubble checklist",yahoofinance,2021-01-03 10:28:31
What caused Bitcoin's 2020 price surge and may keep fueling it,yahoofinance,2021-01-03 10:28:31
What opportunities investors should look for in 2021,yahoofinance,2021-01-03 10:28:31
Zillow Economist on what to expect from the real estate market in 2021,yahoofinance,2021-01-03 10:28:31
What the new stimulus deal means for your wallet,yahoofinance,2021-01-03 10:28:31
Fed policy in 2021: Three things to watch,yahoofinance,2021-01-03 10:28:31
"2.18% FIXED Mortgage Refi, No Hidden Fees/Points",yahoofinance,2021-01-03 10:28:31
"Barron's First Picks And Pans Of 2021: Disney, Home Depot, Intel, Nike, Nordstrom And More",yahoofinance,2021-01-03 10:28:31
What will Joe Biden do to mortgage rates? Here's what experts say,yahoofinance,2021-01-03 10:28:31
"Dow Jones Futures: Stock Market Rally Lessons For 2021; Tesla, Nio Sales Soar; 25 Stocks In Buy Range Now",yahoofinance,2021-01-03 10:28:31
Roth TSP vs. Roth IRA: How Do They Compare?,yahoofinance,2021-01-03 10:28:31
S&P 500 Has Only Been This Expensive One Other Time — At The Peak Of The Dot-Com Bubble,yahoofinance,2021-01-03 10:28:31
Barron’s Best Income Investments for 2021,yahoofinance,2021-01-03 10:28:31
10 SPACs Trading Under $11 For Investors To Consider In 2021,yahoofinance,2021-01-03 10:28:31
Venezuela’s Maduro Plans Shift to Fully Digitalized Economy,yahoofinance,2021-01-03 10:28:31
This new plastics company backed by Pepsi is trying to save the planet,yahoofinance,2021-01-03 10:28:31
The 7 worst ways people will use their stimulus checks,yahoofinance,2021-01-03 10:28:31
10 Worst Performing S&P 500 Stocks Of 2020,yahoofinance,2021-01-03 10:28:31
"Benzinga's Final Bulls And Bears Of The Year: Alibaba, Apple, Intel, Tesla And More",yahoofinance,2021-01-03 10:28:31
Exploding Debt Levels Mean Stocks Can't Go ‘To the Moon’ Forever,yahoofinance,2021-01-03 10:28:31
"Will Shopify Stock Reach $2,000 By 2022?",yahoofinance,2021-01-03 10:28:31
Newmont Is One of Barron’s Top Stock Picks for the New Year. Here’s Why.,yahoofinance,2021-01-03 10:28:31
3 Beaten-Down Stocks Insiders Scooped Up as 2020 Ended,yahoofinance,2021-01-03 10:28:31
"Notable Insider Buys Of The Past Week: Danimer Scientific, Cheniere Energy Partners And More",yahoofinance,2021-01-03 10:28:31
Kass: My Best Pick for 2021 - Short Tesla,yahoofinance,2021-01-03 10:28:31
Which Countries Have Responded Best to Covid-19?,yahoofinance,2021-01-03 10:28:31
"Tesla Cuts Prices In China. That Could Be Bad News for NIO, Li, and XPeng",yahoofinance,2021-01-03 10:28:31
Lidar Is Coming To XPeng as Tesla Holds Out on the Self-Driving Technology,yahoofinance,2021-01-03 10:28:31
"Bitcoin Blasts Past $34K for First Time, Less Than 24 Hours After Blowing Through $30K",yahoofinance,2021-01-03 10:28:31
More store closings in 2021? These are the most vulnerable major retailers of 2021 as pandemic continues,yahoofinance,2021-01-03 10:28:31
Microsoft Soared in 2020 as It Captured Cloud Business. There’s More To Come.,yahoofinance,2021-01-03 10:28:31
3 New ETFs For 2021: Rookies Ready To Come Of Age,yahoofinance,2021-01-03 10:28:31
Investors are convinced the stock market party will continue in 2021,yahoofinance,2021-01-03 10:28:31
Why President Biden Won’t Be Bad For Natural Gas,yahoofinance,2021-01-03 10:28:31
Gilead Sciences or Biogen: Which Biotech Stock is a Better Pick for 2021?,yahoofinance,2021-01-03 10:28:31
China Is Fueling South America’s Oil Boom,yahoofinance,2021-01-03 10:28:31
How One Bad Oil Bet Sparked A Global Trading Disaster,yahoofinance,2021-01-03 10:28:31
Delta Air Lines CEO expects positive cash flow by spring,yahoofinance,2021-01-03 10:28:31
"Bitcoin breaks $32,000 as 2020 surge continues into new year",yahoofinance,2021-01-03 10:28:31
New stimulus checks are arriving — what if you were counting on more money?,yahoofinance,2021-01-03 10:28:31
Fiat and PSA’s Against-All-Odds Merger Nears the Finish Line,yahoofinance,2021-01-03 10:28:31
Tesla Releases Delivery Numbers on a Saturday and They’re Pretty Good,yahoofinance,2021-01-03 10:28:31
"GM, Deere, Visa Lead Post-Pandemic Plays Near Buy Points To Start 2021",yahoofinance,2021-01-03 10:28:31
Mortgage rates begin 2021 at a place no one would have believed a year ago,yahoofinance,2021-01-03 10:28:31
Cambodia Prepares To Produce Its First Oil,yahoofinance,2021-01-03 10:28:31
NYSE to Delist Chinese Telco Giants on U.S. Executive Order,yahoofinance,2021-01-03 10:28:31
Home Depot Nailed 2020. Why the Stock Could Do It Again in 2021.,yahoofinance,2021-01-03 10:28:31
"Bitcoin Blasts Past $34K for First Time, Hours After Blowing Through $30K",yahoofinance,2021-01-03 10:28:31
What Is Expected In The Energy Market In 2021?,yahoofinance,2021-01-03 10:28:31
U.S Mortgage Rates Rise in the Final Week of the Year,yahoofinance,2021-01-03 10:28:31
7 Key Tips to Improve Your Trading in 2021,yahoofinance,2021-01-03 10:28:31
Deutsche Bank should play leading role in banking consolidation - CEO,yahoofinance,2021-01-03 10:28:31
The hottest IPOs on deck for 2021 include these familiar names,yahoofinance,2021-01-03 10:28:31
"Wall Street Weekahead: Investors bullish on stocks, hoping for a brighter 2021",yahoofinance,2021-01-03 10:28:31
"Psyched: The First Psychedelics ETF, Beckley Raises $19M, 3 Companies Go Public",yahoofinance,2021-01-03 10:28:31
"Delays in holiday deliveries, delays in returns, plague small businesses",yahoofinance,2021-01-03 10:28:31
The Future Turns 50 This Year,yahoofinance,2021-01-03 10:28:31
U.S. dollar suffers first annual drop since 2017,yahoofinance,2021-01-03 10:28:31
"Tesla Deliveries Fall Just Short Of Musk's 500,000 Target For 2020",yahoofinance,2021-01-03 10:28:31
What Needs to Happen for Salesforce Stock to Work in 2021,yahoofinance,2021-01-03 10:28:31
"A Week In San Diego, CA, On $23 An Hour",yahoofinance,2021-01-03 10:28:31
Why Impact Investing and Crypto Are Mutually Beneficial,yahoofinance,2021-01-03 10:28:31
Treasury Market’s Bets on 2021 Reflation Face January Reckoning,yahoofinance,2021-01-03 10:28:31
"Stablecoins, ‘Unsung Heroes’ and Other Institutional Crypto Takeaways",yahoofinance,2021-01-03 10:28:31
The Housing Market Was on Fire in 2020. Analysts Think These Home Builders Could Gain the Most in 2021.,yahoofinance,2021-01-03 10:28:31
12 ways to give yourself a raise in the new year,yahoofinance,2021-01-03 10:28:31
Seeking Gold 2401 (+26%) in 2021,yahoofinance,2021-01-03 10:28:31
"Mutual Funds, ETFs, Bitcoin Showed Strong Gains In 2020",yahoofinance,2021-01-03 10:28:31
‘Long-Hauler’: When Covid-19’s Symptoms Last and Last,yahoofinance,2021-01-03 10:28:31
"5 tricks to save you an extra $2,021 in 2021",yahoofinance,2021-01-03 10:28:31
Turkey Yearly Inflation Miss Sets Stage for High Rates Into 2021,yahoofinance,2021-01-03 10:28:31
China Oil Majors May Face U.S. Delisting After Telcos Cut,yahoofinance,2021-01-03 10:28:31
Valuation Caution Returns as Emerging Markets Face 2021 Reality,yahoofinance,2021-01-03 10:28:31
Iran to Boost Oil Output Via $1.2 Billion Deal With Local Firms,yahoofinance,2021-01-03 10:28:31
Key Execs Transition from Old to New Penney’s,yahoofinance,2021-01-03 10:28:31
Is a Home Office Actually More Productive? Some Workers Think So.,yahoofinance,2021-01-03 10:28:31
A big year for the likes of Amazon and Netflix meant misery on Main Street,yahoofinance,2021-01-03 10:28:31
"Dizzying Valuations, IPO Craze Tick Boxes on Bubble Checklist",yahoofinance,2021-01-03 10:28:31
"Bitcoin soars to a new record above $33,000 Saturday",yahoofinance,2021-01-03 10:28:31
"Bitcoin Breaks Above $30,000 to Hit Another Record High",yahoofinance,2021-01-03 10:28:31
Your stimulus check got sliced in half — here's how to make up the rest,yahoofinance,2021-01-03 10:28:31
U.S. Corporate Bond Sales Line Up Amid High-Stakes Vote,yahoofinance,2021-01-03 10:28:31
"The Week Ahead: Georgia Elections, December Jobs and 8 Earnings Reports to Watch",yahoofinance,2021-01-03 10:28:31
"Bitcoin rallies above $30,000 for first time",yahoofinance,2021-01-03 10:28:31
"UAE Stocks Rise Most in Mideast, Track Global Peers: Inside EM",yahoofinance,2021-01-03 10:28:31
Nike Has Soared During Covid. So Have Investors’ Expectations For 2021.,yahoofinance,2021-01-03 10:28:31
The Dow Trailed the S&P 500 in 2020. It Was the Blue Chips’ Worst Relative Performance Since 1998.,yahoofinance,2021-01-03 10:28:31
OPEC+ Emerges From 2020 Chaos to Face Delicate Balancing Act,yahoofinance,2021-01-03 10:28:31
Italy gives UK finance firms six-month operating extension post-Brexit,yahoofinance,2021-01-03 10:28:31
"Bitcoin value surges past $30,000 (£22,000) for first time",yahoofinance,2021-01-03 10:28:31
Credit Spreads Could Get Tighter This Year. What You Need to Know.,yahoofinance,2021-01-03 10:28:31
USD/JPY Fundamental Weekly Forecast – Yen Bulls Hoping Democrats Gain Control of US Senate,yahoofinance,2021-01-03 10:28:31
Year Ends With Record-Breaking Month in U.S. for Covid-19,yahoofinance,2021-01-03 10:28:31
Trading Rewind: Revisiting Q3 2020,yahoofinance,2021-01-03 10:28:31
Investors Bet the ‘Everything Rally’ Will Continue,wsj,2021-01-03 10:31:36
Pelosi Faces Narrow Margin in House Speaker Vote,wsj,2021-01-03 10:31:36
"Economists Expect Tough Winter, Then a Rebound",wsj,2021-01-03 10:31:36
Startups Using SPACs Have Fewer Limits on Promoting Stock,wsj,2021-01-03 10:31:36
GOP Senators to Contest Some Electoral College Results,wsj,2021-01-03 10:31:36
U.S. Vaccine Rollout Falls Behind Goals,wsj,2021-01-03 10:31:36
The Pandemic Likely Improved Your Commute to Work,wsj,2021-01-03 10:31:36
How the American Mortgage Machine Works,wsj,2021-01-03 10:31:36
Do You Need to Get an M.B.A.?,wsj,2021-01-03 10:31:36
Fitness Apps for Crushing New Year’s Resolutions at Home,wsj,2021-01-03 10:31:36
N.Y. Transit System’s Trial-and-Error Approach to Covid Safety,wsj,2021-01-03 10:31:36
The Family-Friendly Workout to Fight Cabin Fever,wsj,2021-01-03 10:31:36
Alabama and Ohio State Traveled Different Roads to the Same Place,wsj,2021-01-03 10:31:36
Covid-19 Shipping Logjam Hits China’s Exporters,wsj,2021-01-03 10:31:36
Double Stock-Market Bubble Brings Toil and (Perhaps) Trouble,wsj,2021-01-03 10:31:36
Trump Leaves Trade War for Biden to Win,wsj,2021-01-03 10:31:36
Musk Steers Tesla to Record Deliveries,wsj,2021-01-03 10:31:36
"Reluctant Whisky Baron Launched a Global Hit, Glenfiddich",wsj,2021-01-03 10:31:36
Wall Street Executive Reinvented Himself as Broadway Producer,wsj,2021-01-03 10:31:36
Master of Public Relations Repaired Damaged Reputations,wsj,2021-01-03 10:31:36
"Republicans Pour Resources Into Georgia, Trying to Keep Senate Control",wsj,2021-01-03 10:31:36
Russia’s Hackers Help Kremlin Play Geopolitics,wsj,2021-01-03 10:31:36
Wave of Black Politicians Takes Office in Brazil,wsj,2021-01-03 10:31:36
Novelist Charles Yu Worries America Is Getting Less Inclusive,wsj,2021-01-03 10:31:36
Gorpcore: How Arc’teryx Parkas and Salomon Hiking Boots Became High Fashion,wsj,2021-01-03 10:31:36
Coronavirus-Based Web Series Give New York Creatives an Outlet,wsj,2021-01-03 10:31:36
You’re Never Too Old to Become a Beginner,wsj,2021-01-03 10:31:36
"As 2020 Limps to an End, Ad Executives Look Warily to 2021",wsj,2021-01-03 10:31:36
The Regulatory Issues Madison Avenue May Face in 2021,wsj,2021-01-03 10:31:36
Super Bowl Advertisers Gravitate to Humor in a Hard Time,wsj,2021-01-03 10:31:36
"For CIOs, There’s No Place Like Home (Office)",wsj,2021-01-03 10:31:36
"Shift Gears, Accelerate: CIOs Reordered IT Priorities in 2020",wsj,2021-01-03 10:31:36
"Post-Pandemic, Office Life May Never Be the Same, CIOs Say",wsj,2021-01-03 10:31:36
CFOs in 2021 Will Keep an Eye on These 10 Things,wsj,2021-01-03 10:31:36
Finance Executives Look to Advance Libor Transition in 2021,wsj,2021-01-03 10:31:36
Barnes & Noble Education CFO Eyes More Cuts as Campuses Remain Closed,wsj,2021-01-03 10:31:36
Defense-Bill Override Paves Way for Overhaul of Anti-Money-Laundering Rules,wsj,2021-01-03 10:31:36
FBI Increasingly Probes for Corruption Overseas,wsj,2021-01-03 10:31:36
Defense Bill Proposes to Expand SEC’s Authority in Seeking Disgorgement,wsj,2021-01-03 10:31:36
Radial Looks to Build on a Year of Frantic Logistics Growth,wsj,2021-01-03 10:31:36
Shipping Faces New Turmoil in European Emissions Trading Plan,wsj,2021-01-03 10:31:36
Logistics Report: Delivering More Doses; Crackdown on Alibaba; Peloton’s Faster Gear,wsj,2021-01-03 10:31:36
Tesla Releases Delivery Numbers and They’re Pretty Good,wsj,2021-01-03 10:31:36
"Covid-19 Will Go, But Streaming Live Theater Is Here to Stay",wsj,2021-01-03 10:31:36
Seniors Can Stay Fit During the Pandemic With Basic Weight Training. Here’s How.,wsj,2021-01-03 10:31:36
Here’s why the Georgia runoff elections for the U.S. Senate could turn into a ‘big deal’ for markets,wsj,2021-01-03 10:31:36
After one hell of a year --- 10 New Year's resolutions to stay on top of the world in 2021,wsj,2021-01-03 10:31:36
