headline,org,date
"With TikTok, Trump takes on 100 million more Americans",yahoofinance,2020-09-19 08:21:53
Supreme Court Justice Ruth Bader Ginsburg dead at 87,yahoofinance,2020-09-19 08:21:53
Netflix cancellations surge 'materially' amid 'Cuties' furor,yahoofinance,2020-09-19 08:21:53
"Fiscal fizzle saps US recovery, a possible boost to Biden",yahoofinance,2020-09-19 08:21:53
"'Shifting to home delivery and home shipping, its really kept us alive': Pat LaFrieda on COVID-19 impact on business",yahoofinance,2020-09-19 08:21:53
‘Small-caps have a great opportunity ahead of themselves’: Needham Small Cap Growth Fund Portfolio Manager,yahoofinance,2020-09-19 08:21:53
This PPP tweak could save small businesses $7B,yahoofinance,2020-09-19 08:21:53
Lumber prices could slow down housing market,yahoofinance,2020-09-19 08:21:53
How to invest in water sustainability,yahoofinance,2020-09-19 08:21:53
"Stock market is at the start of a selloff, says veteran trader Larry Williams",yahoofinance,2020-09-19 08:21:53
Perelman Selling Almost Everything as Pandemic Roils His Empire,yahoofinance,2020-09-19 08:21:53
Are You A Winner Or Loser Under Joe Biden's 401(k) Plan?,yahoofinance,2020-09-19 08:21:53
Tesla Battery Day Will Be ‘Mind Blowing.’ Here’s What to Expect.,yahoofinance,2020-09-19 08:21:53
3 Big Dividend Stocks Yielding Over 8%; JMP Says ‘Buy’,yahoofinance,2020-09-19 08:21:53
"Apple, Microsoft, FANG Stocks Downgraded Amid Tech Sell-Off",yahoofinance,2020-09-19 08:21:53
First Psychedelic Drug Stock Hits $1 Billion In Debut After Upsized IPO,yahoofinance,2020-09-19 08:21:53
Billionaire investor Ray Dalio on capitalism’s crisis: The world is going to change ‘in shocking ways’ in the next five years,yahoofinance,2020-09-19 08:21:53
Analysts Say These 3 Stocks Are Their Top Picks for 2020 and Beyond,yahoofinance,2020-09-19 08:21:53
Want to retire rich? Start by unlearning some conventional wisdom,yahoofinance,2020-09-19 08:21:53
Wells Fargo: These 2 Stocks Could Deliver Triple-Digit Wins,yahoofinance,2020-09-19 08:21:53
Robinhood’s speedy rise is shaking up the brokerage market,yahoofinance,2020-09-19 08:21:53
Semiconductor Stocks To Buy And Watch Before Third-Quarter Earnings,yahoofinance,2020-09-19 08:21:53
Nio Shares Volatile After EV Maker Announces Redemption Of 8.6% Nio China Stake,yahoofinance,2020-09-19 08:21:53
The Greatest Trade of All Time—and What Bill Ackman Is Investing in Now,yahoofinance,2020-09-19 08:21:53
Is Apple Stock A Buy Ahead Of iPhone 12 Launch Event?,yahoofinance,2020-09-19 08:21:53
The Tech Boom Is Slowing. A Sector Rotation Is Picking Up Steam.,yahoofinance,2020-09-19 08:21:53
Is Pfizer Stock a Buy Right Now? This Is What You Need to Know,yahoofinance,2020-09-19 08:21:53
"Don’t Count Bank Stocks Out Just Yet. For One Thing, They’re Cheap.",yahoofinance,2020-09-19 08:21:53
"Warren Buffett Stocks: Veeva, Lululemon Among 18 Stocks On This Screen",yahoofinance,2020-09-19 08:21:53
Snowflake CEO: 'I am the biggest bull on this country in every way',yahoofinance,2020-09-19 08:21:53
Here’s the Latest Electric-Truck Company to Go Public,yahoofinance,2020-09-19 08:21:53
3 “Strong Buy” Healthcare Stocks With Major Catalysts Approaching,yahoofinance,2020-09-19 08:21:53
Why Albertsons Is a Buy: More Meals at Home and the Stock Is Cheap,yahoofinance,2020-09-19 08:21:53
The biggest semiconductor deal in history should have been even bigger,yahoofinance,2020-09-19 08:21:53
Morning Bell With Jim Cramer: Moderna Vaccine Updates,yahoofinance,2020-09-19 08:21:53
Short Sellers Piling Into Chinese Stocks As Trade Tensions Rise,yahoofinance,2020-09-19 08:21:53
"Boeing Gets Good 737 MAX News, but the Stock Is Sliding",yahoofinance,2020-09-19 08:21:53
Why are people working longer? It’s not what you think,yahoofinance,2020-09-19 08:21:53
Is it Too Late to Get Involved With General Electric?,yahoofinance,2020-09-19 08:21:53
"Do Ship Sales Make Carnival Stock A Buy Right Now? Here's What Earnings, Charts Show",yahoofinance,2020-09-19 08:21:53
3 Artificial intelligence Stocks to Consider as the Trend Heats Up,yahoofinance,2020-09-19 08:21:53
Arm Holdings Could Make Nvidia the World’s Most Important Chip Maker. Here’s How,yahoofinance,2020-09-19 08:21:53
Jim Cramer: You Saw Snowflake. Now Get Ready for the Blizzard,yahoofinance,2020-09-19 08:21:53
Is America’s Favorite Retirement Plan Broken?,yahoofinance,2020-09-19 08:21:53
What NOT to do with your retirement savings in a crisis,yahoofinance,2020-09-19 08:21:53
"Pete Najarian Sees Unusual Options Activity In AMD, Bausch Health And Applied Materials",yahoofinance,2020-09-19 08:21:53
Column: How a botched COVID 'loan' to Kodak made the company and government look like idiots,yahoofinance,2020-09-19 08:21:53
"Roth IRAs for Kids: Facts, Benefits, and Eligibility",yahoofinance,2020-09-19 08:21:53
A $700 Million CMBS Portfolio Is On the Brink as Malls Collapse,yahoofinance,2020-09-19 08:21:53
"Stock market news live updates: Tech rout drags Nasdaq, S&P 500 to lowest in at least 6 weeks; Dow slides nearly 1%",yahoofinance,2020-09-19 08:21:53
"Short Sellers Have Lost Nearly $1.3B On DraftKings, Penn National",yahoofinance,2020-09-19 08:21:53
7 Closed-End Funds With Big Dividends,yahoofinance,2020-09-19 08:21:53
"Amid layoffs and allegations of fraud, the FBI has arrested NS8's CEO following its $100+ million summer financing",yahoofinance,2020-09-19 08:21:53
Tesla’s Big Battery Day Event: What to Expect,yahoofinance,2020-09-19 08:21:53
The Race Is on to Win the 5G Battle. T-Mobile Has the Lead.,yahoofinance,2020-09-19 08:21:53
"‘Magic Mushroom’ Company Goes Mainstream, Jumps 71% Post-IPO",yahoofinance,2020-09-19 08:21:53
Is Cisco Stock A Buy Or Sell? Tech Icon May Need Big Acquisition Amid Covid-19,yahoofinance,2020-09-19 08:21:53
What NJ millionaire's tax means for your finances,yahoofinance,2020-09-19 08:21:53
Why This Tesla Analyst Says Energy Will Become $200B Business For Automaker,yahoofinance,2020-09-19 08:21:53
World's Top 10 Internet Companies,yahoofinance,2020-09-19 08:21:53
Volkswagen Has A Very Ambitious Production Target For Its Electric Vehicle Line,yahoofinance,2020-09-19 08:21:53
SoftBank Deal to Sell Arm Has $1.25 Billion Breakup Clause. Nvidia Pays $750 Million Licensing Fee.,yahoofinance,2020-09-19 08:21:53
"Nasdaq Falls 117 Points; Apple Stock Hit, But IPOs Unity Software, Compass Pathways Debut With Bullish Gains",yahoofinance,2020-09-19 08:21:53
Do You Own The 10 Most Expensive Stocks Right Now?,yahoofinance,2020-09-19 08:21:53
"All Change at Brooks Brothers: Flagship in Flux, New Designer Near",yahoofinance,2020-09-19 08:21:53
Elon Musk’s Pay Helps Tesla Get a Record Price Target,yahoofinance,2020-09-19 08:21:53
"Stock Market Rally Reverses Lower: Apple, Adobe, Nvidia, Nikola, Snowflake, TikTok, Fed Meeting In Focus",yahoofinance,2020-09-19 08:21:53
5 Value Stocks In The Basic Materials Sector,yahoofinance,2020-09-19 08:21:53
TikTok's abrupt end would send a 'chill to the boardroom': IMD Business prof,yahoofinance,2020-09-19 08:21:53
A Biotech Pro Bought Up These 3 Stocks,yahoofinance,2020-09-19 08:21:53
Are Medicare Advantage Plans Worth the Risk?,yahoofinance,2020-09-19 08:21:53
"Top Stocks Nvidia, Taiwan Semi Still In Reach Thanks To These Tech Plays",yahoofinance,2020-09-19 08:21:53
Top Oil and Gas Penny Stocks for Q4 2020,yahoofinance,2020-09-19 08:21:53
"Here's How Much Investing $1,000 In AMD At Dot-Com Bubble Peak Would Be Worth Today",yahoofinance,2020-09-19 08:21:53
How Tesla Makes Money: all-electric cars and energy generation,yahoofinance,2020-09-19 08:21:53
What Is an Excellent Credit Score?,yahoofinance,2020-09-19 08:21:53
"Chamath Palihapitiya Launches Three More SPACs: IPOD, IPOE, IPOF",yahoofinance,2020-09-19 08:21:53
"Cramer Advises Viewers On Peloton, Vale And More",yahoofinance,2020-09-19 08:21:53
Is Shopify Stock A Buy As Online Spending Soars During Pandemic?,yahoofinance,2020-09-19 08:21:53
"Judge narrows Tesla lawsuit against former employee, dismisses defamation counterclaim",yahoofinance,2020-09-19 08:21:53
Why Westport Fuel Systems Stock Is Trading Higher Today,yahoofinance,2020-09-19 08:21:53
Supply and Demand: Cramer's 'Mad Money' Recap (Friday  9/18/20),yahoofinance,2020-09-19 08:21:53
Hertz Bonuses Rejected by Judge Who Calls Them ‘Offensive’,yahoofinance,2020-09-19 08:21:53
Fidelity’s $230 billion man explains why he dumped Tesla shares but still bets big on Warren Buffett,yahoofinance,2020-09-19 08:21:53
Fed’s Kashkari decries ‘absurd’ U.S. financial system that needs bailout every 10 years,yahoofinance,2020-09-19 08:21:53
Are These 6 Leading Growth Stocks Topping Out? O'Neil Protégé Says This Is What To Look For,yahoofinance,2020-09-19 08:21:53
"51Job, U.S. Steel, Sorrento: 5 Top Stock Gainers for Thursday",yahoofinance,2020-09-19 08:21:53
General Electric Analyst Targets $1.5B In Industrial FCF In 2021,yahoofinance,2020-09-19 08:21:53
Mega-cap tech stock selloff has the QQQs on track for biggest monthly drop since the financial crisis,yahoofinance,2020-09-19 08:21:53
Rivian Provides A New Teaser - But Can It Deliver?,yahoofinance,2020-09-19 08:21:53
"5 Top Stock Trades for Friday: TWLO, MU, F, INO, X",yahoofinance,2020-09-19 08:21:53
Mondelez Cuts Its Stake in Keurig Dr. Pepper Stock,yahoofinance,2020-09-19 08:21:53
Luminar’s Young Founder to Have Full Control When Firm Goes Public,yahoofinance,2020-09-19 08:21:53
UPS Plans Management Buyouts in Bid to Trim Payroll Costs,yahoofinance,2020-09-19 08:21:53
"The Daily Biotech Pulse: Roche's COVID Combo Therapy Reduces Need For Ventilation, ESMO Presentations",yahoofinance,2020-09-19 08:21:53
Electric vehicle tech provider XL Fleet to merge with SPAC Pivotal Investment in deal valued at about $1 billion,yahoofinance,2020-09-19 08:21:53
Oil Has Best Week Since June After Saudis Defend Market Recovery,yahoofinance,2020-09-19 08:21:53
GameStop Stock Rides the Wave of Sony PlayStation 5 Preorders,yahoofinance,2020-09-19 08:21:53
Top Casino Stocks for Q4 2020,yahoofinance,2020-09-19 08:21:53
Supreme Court Justice Ruth Bader Ginsburg Dies at 87,wsj,2020-09-19 08:24:10
Pioneering jurist was a key figure in fight for women’s legal equality,wsj,2020-09-19 08:24:10
Court Vacancy Creates Prospect of Bitter Nomination Fight,wsj,2020-09-19 08:24:10
Moderate Republicans in the Senate Under Pressure,wsj,2020-09-19 08:24:10
Justice’s Death Affects Everything in Last Stretch of Campaign,wsj,2020-09-19 08:24:10
"White House Bans Chinese Apps, Citing Security Concerns",wsj,2020-09-19 08:24:10
"Islamic State Still Brims With Cash, Ambition",wsj,2020-09-19 08:24:10
Death Toll From Covid-19 Pandemic Extends Far Beyond Virus Victims,wsj,2020-09-19 08:24:10
BlackRock ETF Business Wins Big After Fed Taps It for Help,wsj,2020-09-19 08:24:10
Saudi Royal Family Divides Over Potential Embrace of Israel,wsj,2020-09-19 08:24:10
"Stocks Finish Week Lower, Dragged Down by Tech Shares",wsj,2020-09-19 08:24:10
Portland Police Worry About More Unrest,wsj,2020-09-19 08:24:10
The Incredible Shrinking GM: Barra Bets Smaller Is Better,wsj,2020-09-19 08:24:10
Companies’ New Back-to-Work Dilemma: Who Returns First?,wsj,2020-09-19 08:24:10
2021 Best Colleges in America: Harvard Leads the Rankings,wsj,2020-09-19 08:24:10
Hollywood Blockbusters’ New Supervillain: Empty Seats,wsj,2020-09-19 08:24:10
"Huang’s Law Is the New Moore’s Law, and Explains Why Nvidia Wants Arm",wsj,2020-09-19 08:24:10
What the Old Establishment Can Teach the New Tech Elite,wsj,2020-09-19 08:24:10
How to Think Long Term With Near-Zero Rates,wsj,2020-09-19 08:24:10
McDonald’s Former CEO Says He Should Keep His Multimillion-Dollar Severance,wsj,2020-09-19 08:24:10
How a Styling Executive Fashioned His Path to the Top,wsj,2020-09-19 08:24:10
Millions Are House-Rich but Cash-Poor. Wall Street Landlords Are Ready.,wsj,2020-09-19 08:24:10
Some Investors Tried to Win by Losing Less. They Lost Anyway.,wsj,2020-09-19 08:24:10
Six Charged With Bribing Amazon Workers to Boost Third-Party Sellers,wsj,2020-09-19 08:24:10
"Farm Aid, Election Security Stall Spending Bill",wsj,2020-09-19 08:24:10
Michigan Judge Extends Mail-In Ballot Deadline,wsj,2020-09-19 08:24:10
Trump Administration Grants $11.6 Billion in Aid to Puerto Rico,wsj,2020-09-19 08:24:10
Shinzo Abe Visits Tokyo War Shrine Linked to Militarist Past,wsj,2020-09-19 08:24:10
"Rain Brings Fire Relief in Oregon, but Raises Mudslide Concern",wsj,2020-09-19 08:24:10
Federal Audit Highlights Questions About Safety Standards for Airline Passenger Evacuations,wsj,2020-09-19 08:24:10
It’s Time to Revive the Interesting Breakfast,wsj,2020-09-19 08:24:10
Balance and Speed Drills From an NHL Strength Guru,wsj,2020-09-19 08:24:10
How to Navigate Covid-19 Travel Restrictions,wsj,2020-09-19 08:24:10
New York’s Star Attractions Are Reopening. Here’s What You Need to Know.,wsj,2020-09-19 08:24:10
 Fed Issues New Bank Guidance to Improve Main Street Loan Access ,wsj,2020-09-19 08:24:10
" Jobless Rates in Northeast, West Are Highest in Nation ",wsj,2020-09-19 08:24:10
 Fed's Kashkari Says New Forward Guidance Could Have Been Stronger ,wsj,2020-09-19 08:24:10
" L.A. Property Where Artie Shaw, Lana Turner Once Lived Lists for $46.5 Million ",wsj,2020-09-19 08:24:10
 Built Black and White in Beverly Hills Post Office ,wsj,2020-09-19 08:24:10
" A Massive, Modern Los Angeles Home ",wsj,2020-09-19 08:24:10
 The U.S. Open Briefly Looked Easy. Then Winged Foot Attacked. ,wsj,2020-09-19 08:24:10
" After the Big Ten’s Football Reversal, Focus Shifts to the Pac-12 ",wsj,2020-09-19 08:24:10
 Alex Caruso: The LeBron of Playing With LeBron ,wsj,2020-09-19 08:24:10
The Biggest Money Mistakes People Make in a Recession,wsj,2020-09-19 08:24:10
How Covid-19 Derailed My Financial Goals,wsj,2020-09-19 08:24:10
Should Parents Give Each Child an Equal Inheritance?,wsj,2020-09-19 08:24:10
Microsoft and Sony Square Off With Multiple Game Consoles; Amazon Music Joins the Podcast Battle,wsj,2020-09-19 08:24:10
Omnicom Shakes Up Media-Agency Ranks Amid Pandemic,wsj,2020-09-19 08:24:10
Facebook Starts an Ad-Free Section for College Students,wsj,2020-09-19 08:24:10
"Pandemic Broadband Speeds Are Faster, but Insufficient for Some",wsj,2020-09-19 08:24:10
Nasdaq Ramps Up Cloud Move,wsj,2020-09-19 08:24:10
"California Utilities Hope Drones, AI Will Lower Risk of Future Wildfires",wsj,2020-09-19 08:24:10
EasyJet Names New CFO to Aid With Recovery,wsj,2020-09-19 08:24:10
PG&E CFO Leaving for Another Utility,wsj,2020-09-19 08:24:10
Companies Brace for Higher Taxes After U.S. Election,wsj,2020-09-19 08:24:10
Swedbank Under Investigation By Swedish Regulator in New Probe,wsj,2020-09-19 08:24:10
SEC Charges Former NS8 Chief With Defrauding Investors,wsj,2020-09-19 08:24:10
The Morning Risk Report,wsj,2020-09-19 08:24:10
Today’s Logistics Report: Planning Vaccine Delivery; Germany’s Export Cloud; Assembling Ford Trucks,wsj,2020-09-19 08:24:10
Maersk Prepares Job Cuts as It Extends Reorganization,wsj,2020-09-19 08:24:10
East Coast Ports Get More Shipping Volumes as Trade Routes Change,wsj,2020-09-19 08:24:10
Five Assets Retirement Portfolios Should Hold to Hedge Against Inflation,wsj,2020-09-19 08:24:10
A Biotech Pro Bought Up These 3 Stocks,wsj,2020-09-19 08:24:10
Covid Is Making Cash History. How to Profit From the Digital-Payment Future.,wsj,2020-09-19 08:24:10
The easy part of the U.S. economic recovery is over. Now comes the hard part,wsj,2020-09-19 08:24:10
"Two teachers face a difficult choice: One welcomes ‘normalcy,’ while another feels ‘rage.’ COVID-19 has radically altered their feelings about school",wsj,2020-09-19 08:24:10
My late husband did not see his son in 30 years. Should I mail his son photos and other memorabilia — and risk him making a claim on his estate? ,wsj,2020-09-19 08:24:10
Rockefeller Family’s Longtime Manhattan Apartment Lists for $11.5 Million,wsj,2020-09-19 08:24:10
Celebrity Chef Tory McPhail Lists New Orleans Home for $1.5 Million,wsj,2020-09-19 08:24:10
"18th Century ‘Old House,’ Set on the River Thames, Lists in Oxfordshire, England",wsj,2020-09-19 08:24:10
Gerhard Richter’s Abstraktes Bild to Lead Sotheby’s October Sales in Hong Kong,wsj,2020-09-19 08:24:10
Great Escapes: How ‘Pandemic University’ Founder Omar Mouallem Spends His Free Time,wsj,2020-09-19 08:24:10
The Trouble With Opportunity Zone Investments,wsj,2020-09-19 08:24:10
The Ginsburg Vacancy,wsj,2020-09-19 08:24:10
The ‘Systemic Racism’ Dodge,wsj,2020-09-19 08:24:10
The Russia Farce Continues,wsj,2020-09-19 08:24:10
What Does a Second Coronavirus Lockdown Look Like? Ask Israel,wsj,2020-09-19 08:24:10
Justice Ruth Bader Ginsburg Dies at 87,wsj,2020-09-19 08:24:10
The Rise of TikTok: From Chinese App to Global Sensation,wsj,2020-09-19 08:24:10
"Trump, Biden React to the Death of Ruth Bader Ginsburg",wsj,2020-09-19 08:24:10
Storm Sally Leaves Trail of Destruction Across Gulf Coast,wsj,2020-09-19 08:24:10
iOS 14: 14 Tips for Apple’s New iPhone Operating System,wsj,2020-09-19 08:24:10
Residents Return to Ruins After Fires Tear Through Southern Oregon,wsj,2020-09-19 08:24:10
Some Covid-19 Survivors Grapple With Large Medical Bills ,wsj,2020-09-19 08:24:10
2021 Best Colleges in America: Harvard Leads the University Rankings,wsj,2020-09-19 08:24:10
Saudi Royal Family Divides Over Potential Embrace of Israel    ,wsj,2020-09-19 08:24:10
Best Colleges 2021: Explore the Full WSJ/THE College Ranking List,wsj,2020-09-19 08:24:10
Millions Are House-Rich but Cash-Poor. Wall Street Landlords Are Ready.,wsj,2020-09-19 08:24:10
"U.S. Bans Chinese Apps TikTok and WeChat, Citing Security Concerns",wsj,2020-09-19 08:24:10
The Truth: Your S&P 500 ETF Is Riskier Than You Realize,seekingalpha,2020-09-19 08:26:02
Retirement: Preservation Of Income Is Your Best Friend,seekingalpha,2020-09-19 08:26:02
The 10 Most Beaten-Up Technology Stocks This Month,seekingalpha,2020-09-19 08:26:02
"50 Billionaire Holdings, 27 Pay Dividends, 2 To Buy In September",seekingalpha,2020-09-19 08:26:02
A Century Of Fiscal And Monetary Policy: Analogues To 2020,seekingalpha,2020-09-19 08:26:02
Magellan Midstream: A Bubble Beater That Yields 11%,seekingalpha,2020-09-19 08:26:02
AT&T: A Bad Choice,seekingalpha,2020-09-19 08:26:02
Snowflake May Melt Before Your Eyes,seekingalpha,2020-09-19 08:26:02
An Important Warning For A Major Sector Rotation,seekingalpha,2020-09-19 08:26:02
"S&P 500 Weekly Update: Relax, This Sector Rotation Is Healthy",seekingalpha,2020-09-19 08:26:02
7%-10% Yields: Liberty All-Star Growth And Liberty All-Star Equity Funds,seekingalpha,2020-09-19 08:26:02
Seeking Alpha Catalyst Watch,seekingalpha,2020-09-19 08:26:02
Late market run recoups COVID losses; S&P off slightly for week,seekingalpha,2020-09-19 08:26:02
Moderna and Pfizer set different efficacy bars in pivotal COVID-19 trials,seekingalpha,2020-09-19 08:26:02
"Tesla Energy to become $200B revenue business, Piper analyst predicts",seekingalpha,2020-09-19 08:26:02
"Barclays sees valuations at dot-com bubble levels, cuts megacaps",seekingalpha,2020-09-19 08:26:02
Vanguard High Dividend Yield ETF declares quarterly distribution of $0.7053,seekingalpha,2020-09-19 08:26:02
"Big investors should demand that banks hold more capital, Kashkari says",seekingalpha,2020-09-19 08:26:02
Restaurants continue steady climb in latest Baird survey,seekingalpha,2020-09-19 08:26:02
MetLife said to start process to sell P&C business - Inside P&C,seekingalpha,2020-09-19 08:26:02
Travel related stocks tumble on U.K. lockdown fears,seekingalpha,2020-09-19 08:26:02
AMD to take 20% share of notebook processor market in 2020,seekingalpha,2020-09-19 08:26:02
Snowflake IPO: Don't Buy Into The Frenzy,seekingalpha,2020-09-19 08:26:02
What Resolves A Bifurcated Market?,seekingalpha,2020-09-19 08:26:02
Palantir Direct NYSE Listing Preview,seekingalpha,2020-09-19 08:26:02
Why New Investors Choose Bad REITs,seekingalpha,2020-09-19 08:26:02
Why Apple One's Bundles Miss The Mark,seekingalpha,2020-09-19 08:26:02
Restaurants continue steady climb in latest Baird survey,seekingalpha,2020-09-19 08:26:02
"Rise of low-code app platforms suggests growth for these names, Needham says",seekingalpha,2020-09-19 08:26:02
BofA highlights two mid-cap banks set to gain from NYC rebound,seekingalpha,2020-09-19 08:26:02
"Luxury names look to take wallet share despite pandemic, UBS finds",seekingalpha,2020-09-19 08:26:02
"Evercore adds industrial, energy names to best small/mid-cap ideas list",seekingalpha,2020-09-19 08:26:02
The Fed's New Guidance: Surprising Is Not Convincing,seekingalpha,2020-09-19 08:26:02
S&P 500 Forward EPS Estimates Still Increasing,seekingalpha,2020-09-19 08:26:02
Growth And Momentum Equity Factors Lead Market Rebound,seekingalpha,2020-09-19 08:26:02
"MacroView: Newton, Physics And The Market Bubble",seekingalpha,2020-09-19 08:26:02
An Important Warning For A Major Sector Rotation,seekingalpha,2020-09-19 08:26:02
"Meredith Corporation: A Low-Risk, High-Uncertainty Bet",seekingalpha,2020-09-19 08:26:02
Zuora: Betting On Mean Reversion,seekingalpha,2020-09-19 08:26:02
"In A Weak Banking Sector, Investors Taking A 'Wait And See' Approach With TCF Financial",seekingalpha,2020-09-19 08:26:02
"Citizens Financial's Discount Is Shrinking, But It's Still Too Wide Relative To The Opportunity",seekingalpha,2020-09-19 08:26:02
"Vistra Corp.: Bullish On Value, FCF, And Improving Credit Outlook",seekingalpha,2020-09-19 08:26:02
Magellan Midstream: A Bubble Beater That Yields 11%,seekingalpha,2020-09-19 08:26:02
Corporate Office Properties: A Safe 4.7% Yield From A Defensive Play,seekingalpha,2020-09-19 08:26:02
Dunkin' Brands Is A Pandemic-Safe Buy,seekingalpha,2020-09-19 08:26:02
"CenturyLink, Now Lumen, Does Not Have A Payout Problem",seekingalpha,2020-09-19 08:26:02
Solar Capital: Solid 9.5% Dividend Yield,seekingalpha,2020-09-19 08:26:02
"LGI: Strong Global Equities Fund, 7.23% Distribution Yield, 10.9% Discount To NAV",seekingalpha,2020-09-19 08:26:02
Invesco International Dividend Achievers ETF: Risks To Consider,seekingalpha,2020-09-19 08:26:02
IAU: It Is Time To Buy Gold,seekingalpha,2020-09-19 08:26:02
It's Still Not The Time To Buy KOLD,seekingalpha,2020-09-19 08:26:02
XLU: Utilities Dashboard For September,seekingalpha,2020-09-19 08:26:02
The Fed's New Guidance: Surprising Is Not Convincing,seekingalpha,2020-09-19 08:26:02
Growth And Momentum Equity Factors Lead Market Rebound,seekingalpha,2020-09-19 08:26:02
"MacroView: Newton, Physics And The Market Bubble",seekingalpha,2020-09-19 08:26:02
Michigan Consumer Sentiment: September Prelim Improved,seekingalpha,2020-09-19 08:26:02
"Markets Broaden Out, Finally",seekingalpha,2020-09-19 08:26:02
Here's what happens to WeChat on Sunday ...,cnnbusiness,2020-09-19 08:28:57
... And here's what will to happen to TikTok on Sunday,cnnbusiness,2020-09-19 08:28:57
TikTok: Is the security threat real?,cnnbusiness,2020-09-19 08:28:57
"You might be surprised who's moving in to those sad, abandoned malls",cnnbusiness,2020-09-19 08:28:57
Stocks tumble at the end of a turbulent week,cnnbusiness,2020-09-19 08:28:57
Lyft sketches a future for city streets with fewer cars,cnnbusiness,2020-09-19 08:28:57
"Raytheon announces 15,000 job cuts ",cnnbusiness,2020-09-19 08:28:57
Deutsche Bank allows work-from-home until July 2021,cnnbusiness,2020-09-19 08:28:57
The US economy needs more help. Congress is too divided to provide it,cnnbusiness,2020-09-19 08:28:57
Unity Software shares surge 44% on Wall Street debut as IPO market sizzles,cnnbusiness,2020-09-19 08:28:57
Small stocks may thrive in 2021 — no matter who wins the election,cnnbusiness,2020-09-19 08:28:57
"Six months into the pandemic, this 128-year old shoe store is still standing",cnnbusiness,2020-09-19 08:28:57
US billionaires' fortunes have skyrocketed $845 billion since March,cnnbusiness,2020-09-19 08:28:57
Canadian police charge Tesla driver who was allegedly doing 90 miles per hour while asleep ,cnnbusiness,2020-09-19 08:28:57
Refi rates at 2.47% APR (15 yr). Do you qualify?,cnnbusiness,2020-09-19 08:28:57
Workers fear humans implanted with microchips will steal their jobs,cnnbusiness,2020-09-19 08:28:57
Joe Rogan spread dangerous misinformation about fires. Now he says he's sorry,cnnbusiness,2020-09-19 08:28:57
The workplace lawsuits have begun,cnnbusiness,2020-09-19 08:28:57
Seven-foot robots are stacking shelves in Tokyo convenience stores,cnnbusiness,2020-09-19 08:28:57
Robot 'bees' could help save the world's honey bees,cnnbusiness,2020-09-19 08:28:57
Your Roomba just got a lot smarter,cnnbusiness,2020-09-19 08:28:57
White Castle is testing a burger-grilling robot ,cnnbusiness,2020-09-19 08:28:57
Robot dogs join US Air Force exercise,cnnbusiness,2020-09-19 08:28:57
Amazon's stock is getting beat by a warehouse chain. And it's not Costco,cnnbusiness,2020-09-19 08:28:57
Sea cucumbers are helping Costco clean up in China,cnnbusiness,2020-09-19 08:28:57
This discount retailer is crushing it during the pandemic,cnnbusiness,2020-09-19 08:28:57
Walmart unveils $98-a-year subscription service,cnnbusiness,2020-09-19 08:28:57
Home Depot to offer two months of Black Friday deals,cnnbusiness,2020-09-19 08:28:57
Watch: Apple unveils latest line-up of colorful iPads,cnnbusiness,2020-09-19 08:28:57
Nissan gives a glimpse of its first Z car in more than a decade,cnnbusiness,2020-09-19 08:28:57
See robot stacking shelves in Japan,cnnbusiness,2020-09-19 08:28:57
Here's one major issue Trump and Biden agree on,cnnbusiness,2020-09-19 08:28:57
The vaccine race: Firms face unprecedented challenges,cnnbusiness,2020-09-19 08:28:57
"To help working parents, companies are getting creative",cnnbusiness,2020-09-19 08:28:57
WeWork CEO talks about its new tenants ,cnnbusiness,2020-09-19 08:28:57
N95 masks are still in hot demand. 3M is trying to answer the call,cnnbusiness,2020-09-19 08:28:57
