headline,org,date
Trump executive orders also require removal of social media app WeChat from Apple and Google’s app stores in US ,financialtimes,2020-09-18 09:11:19
"Until global data privacy standards are agreed upon, everybody stands to lose",financialtimes,2020-09-18 09:11:19
US chip company seeks to calm political furore over takeover of Cambridge-based tech company,financialtimes,2020-09-18 09:11:19
ByteDance proposes US IPO for TikTok to woo White House,financialtimes,2020-09-18 09:11:19
Trump flags concerns about Oracle-TikTok deal ,financialtimes,2020-09-18 09:11:19
TikTok/Oracle: Inartful dodge,financialtimes,2020-09-18 09:11:19
"TikTok, WeChat Downloads Blocked From Sunday, Says Commerce Department",thestreet,2020-09-18 09:12:59
"Dow Futures, Coronavirus, Unity Software - 5 Things You Must Know Friday",thestreet,2020-09-18 09:12:59
Unity Software Raises $1.3 Billion as IPO Priced at $52,thestreet,2020-09-18 09:12:59
Beyond Meat Slumps After J.P. Morgan Downgrade Cites Stock Overshoot,thestreet,2020-09-18 09:12:59
Jim Cramer: Post-Snowflake Hangover Puts Easy-to-Understand Stocks Back on Map,thestreet,2020-09-18 09:12:59
Rev Shark: The Indices Aren't Telling the Truth About the Stock Market,thestreet,2020-09-18 09:12:59
Meisler: Here's Where We've Gone in Two Weeks: Not Far,thestreet,2020-09-18 09:12:59
Price: Still Chasing Big Momentum Stocks? Stop,thestreet,2020-09-18 09:12:59
"Guilfoyle: 50-Day Line in the Sand, Don't Blame Powell, Crude Awakening",thestreet,2020-09-18 09:12:59
UPS Plans Management Buyouts in Bid to Trim Payroll Costs,thestreet,2020-09-18 09:12:59
"As Goes Amazon, So Goes the Nasdaq? Here’s the Trade",thestreet,2020-09-18 09:12:59
Uber Hires Amazon Exec to Fill Chief Technology Officer Role,thestreet,2020-09-18 09:12:59
Jim Cramer: Moderna's All Over the Place,thestreet,2020-09-18 09:12:59
"Fed Decision Is Huge Market Positive, But Here's What Has Cramer Worried",thestreet,2020-09-18 09:12:59
Jim Cramer's Stock to Buy Ahead of the Election,thestreet,2020-09-18 09:12:59
Apple Stock: The Rout Continues,thestreet,2020-09-18 09:12:59
Piper Sandler Raises Tesla Price Target to $515,thestreet,2020-09-18 09:12:59
Here's What the Charts Tell Us About Amazon and Alphabet,thestreet,2020-09-18 09:12:59
Apple Watch SE: Why It Matters to Investors,thestreet,2020-09-18 09:12:59
How Financial Advisers can Work With Robo-Advisers,thestreet,2020-09-18 09:12:59
For Advisers: Assessing Risk Tolerance,thestreet,2020-09-18 09:12:59
Charles Schwab Shares Off After Revenue Update,thestreet,2020-09-18 09:12:59
Jim Cramer: We'll Get Healthier About COVID-19 as a Nation Once the Election Is Over,thestreet,2020-09-18 09:12:59
Jobless Claims Reflect Slowing Economic Recovery,thestreet,2020-09-18 09:12:59
What Has Jim Cramer So Concerned About the Economy,thestreet,2020-09-18 09:12:59
Coronavirus Update: Eli Lilly and Amgen to Manufacture Possible COVID-19 Drugs,thestreet,2020-09-18 09:12:59
Why Investors Shouldn’t Chase Gold After Its Red-Hot Run,thestreet,2020-09-18 09:12:59
Fisher Investments Reveals the 3 Biggest Risks of Holding Cash,thestreet,2020-09-18 09:12:59
Terrible Unemployment Numbers Don’t Hold Back Stocks,thestreet,2020-09-18 09:12:59
Investors Shouldn’t Worry About Inflation Right Now,thestreet,2020-09-18 09:12:59
Will Bitcoin Ruin Your Tax Return?,thestreet,2020-09-18 09:12:59
Roche Reports Phase 3 Progress for Its Covid Pneumonia Treatment,thestreet,2020-09-18 09:12:59
Google Pulls India's Paytm App From Play Store,thestreet,2020-09-18 09:12:59
How Financial Advisers can Work With Robo-Advisers,thestreet,2020-09-18 09:12:59
How to Choose the Right Off-Road Vehicle,thestreet,2020-09-18 09:12:59
"Dow Futures Slip As Markets Key On Rising COVID infections, Weakening US Data",thestreet,2020-09-18 09:12:59
Flurry of IPO Deals: Cramer's 'Mad Money' Recap (Thursday 9/17/20),thestreet,2020-09-18 09:12:59
5 Biggest Dow Losers Thursday as Stocks Sell Off,thestreet,2020-09-18 09:12:59
Watch Out for This Potential Tax Bomb if You Relocated in the Pandemic,thestreet,2020-09-18 09:12:59
Tax-Loss Harvesting Is a Tool for all Seasons,thestreet,2020-09-18 09:12:59
5 Things You Need to Know About a Payroll Tax Deferral,thestreet,2020-09-18 09:12:59
"51Job, U.S. Steel, Sorrento: 5 Top Stock Gainers Thursday",thestreet,2020-09-18 09:12:59
Sony Has an Early Mindshare Lead on Microsoft in the Next-Gen Console Wars,thestreet,2020-09-18 09:12:59
"Stocks Fall, Investors Digest the Future: What Wall Street’s Saying",thestreet,2020-09-18 09:12:59
Stocks Stumble as Federal Reserve Points to U.S. Recovery Risks,thestreet,2020-09-18 09:12:59
Accenture Invests $3 Billion to Help Companies Migrate to the Cloud,thestreet,2020-09-18 09:12:59
"NFL Coronavirus Testing: Top Stories, Sports and Business News — Sept. 17",thestreet,2020-09-18 09:12:59
TikTok Plans a U.S. IPO if Cleared by the White House,thestreet,2020-09-18 09:12:59
Bubble Economy: How NBA Athletes Are Supporting Minority-Owned Restaurants,thestreet,2020-09-18 09:12:59
Nvidia's New Graphics Card Sells Out Online,thestreet,2020-09-18 09:12:59
Penn National Share-Price Target at Stifel Is Wall Street High,thestreet,2020-09-18 09:12:59
"Snowflake, eBay, Nutanix: Midday Tech Stock Movers",thestreet,2020-09-18 09:12:59
Pactiv Evergreen Shares Slump After IPO,thestreet,2020-09-18 09:12:59
Jim Cramer: We'll Get Healthier About COVID-19 as a Nation Once the Election Is Over,thestreet,2020-09-18 09:12:59
5 Biggest Dow Losers Thursday as Stocks Sell Off,thestreet,2020-09-18 09:12:59
US will ban WeChat and TikTok downloads on Sunday,googlenews,2020-09-18 09:14:58
Moderna CEO expects to know in November whether COVID-19 vaccine works,googlenews,2020-09-18 09:14:58
Coronavirus vaccine: Moderna CEO discusses vaccine development,googlenews,2020-09-18 09:14:58
Two Pharma Companies Released Their Coronavirus Vaccine Blueprints In A Bid To Regain Public Trust,googlenews,2020-09-18 09:14:58
Moderna would seek limited emergency use of COVID-19 vaccine based on early data,googlenews,2020-09-18 09:14:58
How Much Will the Covid-19 Vaccine Cost? | WSJ,googlenews,2020-09-18 09:14:58
"Coronavirus deaths surpass 197K in the US, also physician talks vaccine timeline and COVID-19 risks",googlenews,2020-09-18 09:14:58
"CaixaBank and Bankia to merge, creating Spain’s largest bank",googlenews,2020-09-18 09:14:58
"Unemployment Claims Dip, but Layoffs Remain a Worry",googlenews,2020-09-18 09:14:58
Wanted: People who want to get paid to taste cheeseburgers,googlenews,2020-09-18 09:14:58
"Pfizer vaccine trial bets on early win against coronavirus, documents show",googlenews,2020-09-18 09:14:58
Dow Jones Futures: Market Rally Against Ropes,googlenews,2020-09-18 09:14:58
Oversupply Adds To Grim Oil Demand Outlook,googlenews,2020-09-18 09:14:58
IPO like it’s 1999: Market hitting dot-com-boom levels as Snowflake and other cloud-software stocks keep popping,googlenews,2020-09-18 09:14:58
"Connecting the dots, how market participants interpreted yesterday's FOMC meeting",googlenews,2020-09-18 09:14:58
"Moderna, Inc.: All Signs Point To An Impending Rally",googlenews,2020-09-18 09:14:58
Tesla Battery Day Is Coming. Here’s What to Expect.,googlenews,2020-09-18 09:14:58
Moderna CEO: We expect to know if Covid-19 vaccine works in November,googlenews,2020-09-18 09:14:58
Fed makes its last stand in struggle to keep potent in age of low interest rates,googlenews,2020-09-18 09:14:58
Walmart to Raise Wages for Some Workers,googlenews,2020-09-18 09:14:58
Tech bubble? Credit Suisse strategists say 'no' but say it's time to get pickier with these stocks,googlenews,2020-09-18 09:14:58
"Ohio dad creates ""candy chute"" to keep trick-or-treaters safe in middle of COVID-19",googlenews,2020-09-18 09:14:58
Australia's 7-Hour 'Flight to Nowhere' Sells Out Instantly As People Lose Their Damn Minds Hoping to Feel Norm,googlenews,2020-09-18 09:14:58
"'I think it's time to start putting cash to work,' Jim Cramer says",googlenews,2020-09-18 09:14:58
"To Revive Ailing Tourism Economy, Hawaii Says Out-of-State Travelers Can Now Bypass 2-Week Quarantine",googlenews,2020-09-18 09:14:58
Nevada approves plan to re-open bars in Clark County,googlenews,2020-09-18 09:14:58
Apple will launch its online store in India on September 23,googlenews,2020-09-18 09:14:58
Daughter's plea helps save her father's taco truck during pandemic,googlenews,2020-09-18 09:14:58
Towing Race: 2021 Ford F-150 PowerBoost Pitted Against the Ram 1500 HEMI eTorque,googlenews,2020-09-18 09:14:58
Powerball jackpot winning ticket worth $94M sold at New York liquor store,googlenews,2020-09-18 09:14:58
"Georgia tops 300,000 cases; decline in new cases flattens",googlenews,2020-09-18 09:14:58
Lilly and Amgen partner to manufacture potential coronavirus drugs,googlenews,2020-09-18 09:14:58
"Papa John’s To Add Headquarters In Atlanta, Shift Some Operations From Louisville",googlenews,2020-09-18 09:14:58
BOE Steps Up Negative Rates Work as Economic Threats Mount,googlenews,2020-09-18 09:14:58
Blue Bell ordered to pay record fine of $17.25 million over listeria outbreak,googlenews,2020-09-18 09:14:58
Mortgage rates remain near record lows — now the challenge will be finding a lender willing to give you one,googlenews,2020-09-18 09:14:58
House Republicans push to reopen Paycheck Protection Program amid coronavirus relief gridlock,googlenews,2020-09-18 09:14:58
Facebook Accused of Watching Instagram Users Through Cameras,googlenews,2020-09-18 09:14:58
EPA approves Pine-Sol to kill coronavirus on surfaces,googlenews,2020-09-18 09:14:58
A Covid Surcharge on Restaurant Checks? Some Owners Are Wary,googlenews,2020-09-18 09:14:58
2 Lansing businesses fined for COVID-19 workplace safety violations,googlenews,2020-09-18 09:14:58
Trump Casts New Doubt On Any Deal To Keep TikTok Alive In U.S.,googlenews,2020-09-18 09:14:58
3000 students haven't logged on for the first week of school in Salt Lake City,googlenews,2020-09-18 09:14:58
Hemingway's favorite Key West bar set to reopen,googlenews,2020-09-18 09:14:58
Bar owners devastated after Gov. Abbott announces other businesses can expand capacity,googlenews,2020-09-18 09:14:58
"Bristol-Myers Squibb Cuts Deal, Delaying Threat to Top-Selling Revlimid",googlenews,2020-09-18 09:14:58
Carnival Cruise Line cancels all trips until at least end of January,googlenews,2020-09-18 09:14:58
Dairy Queen gets trolled by TikTok user with Travis Scott music,googlenews,2020-09-18 09:14:58
The Volkswagen Taos And The Most Legendary Repair Manual Ever Written,googlenews,2020-09-18 09:14:58
BioNTech buys Novartis site to boost EU vaccine production,googlenews,2020-09-18 09:14:58
"Mayo Clinic launches COVID tracking tool that breaks down numbers by county, predicts future cases",googlenews,2020-09-18 09:14:58
Minnesota hits end of $300 weekly jobless bonus; jobs recovery sped up last month,googlenews,2020-09-18 09:14:58
Canada Tesla driver charged over 'napping while speeding',googlenews,2020-09-18 09:14:58
Wynn Las Vegas reveals 548 positive COVID-19 cases among employees,googlenews,2020-09-18 09:14:58
I-X Center closure could cost Cleveland Hopkins International Airport more than $2M a year,googlenews,2020-09-18 09:14:58
Hurricane Sally’s remains rake Georgia,googlenews,2020-09-18 09:14:58
"U.S. Government Takes Aim at Riot Games, Epic Games, and Others Tied to Tencent",googlenews,2020-09-18 09:14:58
AstraZeneca vaccine volunteer developed spinal inflammation & ‘rare neurological condition’ after two doses – report,googlenews,2020-09-18 09:14:58
Why Dave & Buster's Stock Is Trading Lower Today,googlenews,2020-09-18 09:14:58
Hong Kong Is a Troubling Case Study in the Death of Democracy,googlenews,2020-09-18 09:14:58
Gov. John Bel Edwards halts Jefferson Parish Council's attempt at moving into phase 3,googlenews,2020-09-18 09:14:58
Ericsson to buy US wireless networking firm Cradlepoint in $1.1B deal,googlenews,2020-09-18 09:14:58
Why SoftBank's Arm Holdings Sale Is a Winning Move,googlenews,2020-09-18 09:14:58
Taco Bell leaves customers dumbfounded after announcing ‘ridiculous’ new menu item: ‘Why though?’,googlenews,2020-09-18 09:14:58
Beverly Hills police arrest 44 for unemployment funds fraud,googlenews,2020-09-18 09:14:58
U.S. consumer spending appears to slow in August,googlenews,2020-09-18 09:14:58
"Covid-19 cases in Europe: Why Spain, France, the UK, and other countries face new outbreaks",googlenews,2020-09-18 09:14:58
"Raytheon to eliminate more than 15,000 jobs, citing airline downturn",googlenews,2020-09-18 09:14:58
Yuengling beer will be available in more states as part of new partnership with Molson Coors,googlenews,2020-09-18 09:14:58
"Half of Texas restaurants might shut down in 6 months, survey says",googlenews,2020-09-18 09:14:58
"Trump administration to ban Americans from downloading TikTok, WeChat",googlenews,2020-09-18 09:14:58
Trump to block U.S. downloads of TikTok and WeChat on Sunday,googlenews,2020-09-18 09:14:58
Trump Is Wrong About TikTok. China’s Plans Are Much More Sinister.,googlenews,2020-09-18 09:14:58
Breaking: USA bans WeChat and TikTok from the Google Play Store and Apple App Store,googlenews,2020-09-18 09:14:58
"Live updates: Three-quarters of Americans worry over vaccine haste, as global coronavirus cases top 30 million",googlenews,2020-09-18 09:14:58
Are Western attacks on the Russian Covid-19 vaccine a corporate cold war against humanity?,googlenews,2020-09-18 09:14:58
Coronavirus Vaccine: Moderna and Pfizer Reveal Secret Blueprints Trials,googlenews,2020-09-18 09:14:58
BioNTech buys German site from Novartis to boost vaccine output,googlenews,2020-09-18 09:14:58
Moderna CEO updates timing for COVID-19 vaccine trial results,googlenews,2020-09-18 09:14:58
"Moderna expects to know if its coronavirus vaccine works by November, CEO says",googlenews,2020-09-18 09:14:58
Two HBCU presidents joined Covid-19 vaccine trials to highlight the importance of Black participation,googlenews,2020-09-18 09:14:58
Moderna trial investigator worries about political pressure in vaccine approval process,googlenews,2020-09-18 09:14:58
Coronavirus Stocks: Can mRNA From Covid Fight Be Used To Cure Cancer?,googlenews,2020-09-18 09:14:58
Israel goes into second coronavirus lockdown: Live news,googlenews,2020-09-18 09:14:58
Moderna says it will begin developing a vaccine for seasonal flu,googlenews,2020-09-18 09:14:58
Moderna expects coronavirus vaccine results in November: report,googlenews,2020-09-18 09:14:58
Covid vaccine hopes rise as Pfizer trials bet on an early win,googlenews,2020-09-18 09:14:58
Pfizer vaccine trial bets on early win against coronavirus,googlenews,2020-09-18 09:14:58
"Caixabank, Bankia agree merger terms",googlenews,2020-09-18 09:14:58
Spanish banks merge in sign of hard economic times ahead,googlenews,2020-09-18 09:14:58
"CaixaBank, Bankia approve merger",googlenews,2020-09-18 09:14:58
"Caixabank, Bankia Agree to Create Biggest Spanish Lender",googlenews,2020-09-18 09:14:58
Jobless claims were lower than expected but employment growth is still sluggish,googlenews,2020-09-18 09:14:58
"Another 860,000 Americans filed for unemployment benefits last week",googlenews,2020-09-18 09:14:58
Editorial: Unemployment money shows need for better planning,googlenews,2020-09-18 09:14:58
Inequality: millions still left behind by US economic recovery,googlenews,2020-09-18 09:14:58
This is the Tastiest Fast-Food Cheeseburger,googlenews,2020-09-18 09:14:58
"These Restaurants Are Giving Out Free Food For National Cheeseburger Day, So Consider Dinner Planned",googlenews,2020-09-18 09:14:58
Celebrate! It's National Cheeseburger Day,googlenews,2020-09-18 09:14:58
The cheeseburger underdogs: 5 restaurants off the beefin' path dishing out quality ground rounds,googlenews,2020-09-18 09:14:58
Nasdaq Futures Rise 50 Pts; Tik Tok Saga Continues,googlenews,2020-09-18 09:14:58
Stocks fall as investors grapple with Fed's recovery timeline,googlenews,2020-09-18 09:14:58
"Wall Street Close: Economic data not up to the mark, 'Big-tech' weighs benchmarks down",googlenews,2020-09-18 09:14:58
Wall Street slumps as Big Tech once again leads decliners,googlenews,2020-09-18 09:14:58
Oil rises on supply deficit forecast and storm in Gulf,googlenews,2020-09-18 09:14:58
"OPEC+ pressures Iraq, UAE to further cut oil production",googlenews,2020-09-18 09:14:58
America’s domination of oil and gas will not cow China,googlenews,2020-09-18 09:14:58
"Climate needs less oil, how will producing nations react? | TheHill",googlenews,2020-09-18 09:14:58
Snowflake shares tumble 10% a day after IPO surge,googlenews,2020-09-18 09:14:58
Investors try to figure out what caused Snowflake's IPO surge,googlenews,2020-09-18 09:14:58
"Forget Snowflake, Cloudera Is a Better Big Data Stock",googlenews,2020-09-18 09:14:58
"Snowflake's first-day pop means IPO left $3.8 billion on the table, the most in 12 years",googlenews,2020-09-18 09:14:58
Gold Price Forecast: What Will Spark a XAU/USD Break Out Rally?,googlenews,2020-09-18 09:14:58
Gold Price Prediction – Prices Slip but Hold Support,googlenews,2020-09-18 09:14:58
Gold has room to test support at $1900 as Fed disappoints - Saxo Bank,googlenews,2020-09-18 09:14:58
Gold Price Analysis: XAU/USD in no-man's land awaiting a catalyst,googlenews,2020-09-18 09:14:58
"Tesla's stock set to extend pullback, as volatility continues ahead of next week's Battery Day",googlenews,2020-09-18 09:14:58
Bill Gates Talks About Elon Musk Saying He Built Great Electric Cars,googlenews,2020-09-18 09:14:58
Who will rule the Teslaverse?,googlenews,2020-09-18 09:14:58
Tesla ‘Roadrunner’ cell leak hints that Battery Day will be more insane than expected,googlenews,2020-09-18 09:14:58
Vaccine Leaders Make Trial Plans Public in Transparency Push,googlenews,2020-09-18 09:14:58
Biontech buys German site to ramp up Covid-19 vaccine production,googlenews,2020-09-18 09:14:58
Dr Reddys Labs gains for second straight day on Covid vaccine deal,googlenews,2020-09-18 09:14:58
Coronavirus Essential podcast | India's COVID-19 number reaches 50 lakh cases; country to receive 100...,googlenews,2020-09-18 09:14:58
The market isn't convinced the Federal Reserve can achieve its inflation objective,googlenews,2020-09-18 09:14:58
Powell Laid the Blueprint for Tech’s Eventual Wreck With QE Punt,googlenews,2020-09-18 09:14:58
New Fed approach takes inflation targeting more seriously | TheHill,googlenews,2020-09-18 09:14:58
Powell Can’t Disguise the Limits of Monetary Policy,googlenews,2020-09-18 09:14:58
Walmart boosts pay for 165000 hourly associates nationwide,googlenews,2020-09-18 09:14:58
"Walmart is giving 165,000 employees a pay rise between $15 and $30 per",googlenews,2020-09-18 09:14:58
"Walmart increasing pay for 165,000 hourly workers | TheHill",googlenews,2020-09-18 09:14:58
"Walmart Responds to Changing Retail Structure, Increased Pickup and Delivery With Pay Hikes",googlenews,2020-09-18 09:14:58
Dad's love for Halloween leads to 'candy chute' creation for trick-or-treating,googlenews,2020-09-18 09:14:58
"Officials in New Jersey, Delaware and Pennsylvania weigh in on trick-or-treating",googlenews,2020-09-18 09:14:58
POLL RESULTS: Cancel trick-or-treating? Boston.com readers are split on the scary subject,googlenews,2020-09-18 09:14:58
Ohio dad creates 'candy chute' for socially distanced trick-or-treating this Halloween,googlenews,2020-09-18 09:14:58
Travellers in Asia snap up 'flights to nowhere',googlenews,2020-09-18 09:14:58
Qantas To Look At Operating More Flights To Nowhere,googlenews,2020-09-18 09:14:58
Qantas seven-hour flight to nowhere sells out in 10 minutes,googlenews,2020-09-18 09:14:58
An airline offered people a 'flight to nowhere' and it sold out in just 10 minutes,googlenews,2020-09-18 09:14:58
Cramer: Today's action was reminiscent of past boom-bust IPO cycles,googlenews,2020-09-18 09:14:58
US Stocks: Add IPOs to the List of Reasons for Current Volatility,googlenews,2020-09-18 09:14:58
Jim Cramer urges patience before buying newly public Amwell: 'It's too hot right now',googlenews,2020-09-18 09:14:58
Jim Cramer: 'I think Penn National has terrific prospects',googlenews,2020-09-18 09:14:58
Hawaii tentatively reopening to tourists October 15,googlenews,2020-09-18 09:14:58
Gov. David Ige assembles new COVID response team,googlenews,2020-09-18 09:14:58
Hawaii to ease self-quarantine rule on Oct. 15,googlenews,2020-09-18 09:14:58
Hawaii to allow travelers to skip quarantine with virus test,googlenews,2020-09-18 09:14:58
"Las Vegas Bars, Taverns, Breweries and Pubs to Reopen",googlenews,2020-09-18 09:14:58
Apple Online Store Launching in India on September 23: Apple to Sell iPhone Directly to You,googlenews,2020-09-18 09:14:58
Apple brings online store to India September 23,googlenews,2020-09-18 09:14:58
Apple to launch first online store in India next week,googlenews,2020-09-18 09:14:58
Apple's online store is opening in India on September 23rd,googlenews,2020-09-18 09:14:58
Hundreds flock to Texas man's taco truck after daughter's heartbreaking tweet,googlenews,2020-09-18 09:14:58
Community comes together to support food truck owner,googlenews,2020-09-18 09:14:58
Daughter's tweet helps save her father's food truck,googlenews,2020-09-18 09:14:58
Texas taco truck’s business booms after owner’s daughter asks for support on Twitter,googlenews,2020-09-18 09:14:58
Ford's making its electric F-150 a serious work truck in bid to set it apart from Tesla and GM pickups,googlenews,2020-09-18 09:14:58
Can a Tuned V6 Ford F-150 Out Tow a Stock Chevy Silverado V8? Of Course It Can - But By How Much?,googlenews,2020-09-18 09:14:58
Here's Your First Look at the Electric Ford F-150's Luminous New Face,googlenews,2020-09-18 09:14:58
"Ford Says All-Electric F-150 Will Be a No-Nonsense Work Truck, Unlike Others",googlenews,2020-09-18 09:14:58
$94 million jackpot-winning Powerball ticket sold in New York liquor store,googlenews,2020-09-18 09:14:58
Lotto Texas jackpot now largest in North America,googlenews,2020-09-18 09:14:58
"Daily Lotto South Africa Lottery Results For Sep 17, 2020 - Winning Numbers - Republic World",googlenews,2020-09-18 09:14:58
Lottoland goes 2-for-2 in legal lottery disputes in Australia,googlenews,2020-09-18 09:14:58
"Georgia surpasses 300,000 cumulative cases of COVID-19 since pandemic began",googlenews,2020-09-18 09:14:58
"Georgia COVID-19 cases surpass 300,000 mark",googlenews,2020-09-18 09:14:58
"UPDATE: Georgia reports 300,903 confirmed COVID-19 cases statewide, with 5,809 in Columbus",googlenews,2020-09-18 09:14:58
Where is the state of Georgia right now in its response to the COVID-19 pandemic?,googlenews,2020-09-18 09:14:58
Study hints antibody drug may cut COVID-19 hospitalizations,googlenews,2020-09-18 09:14:58
"Eli Lilly, Amgen join forces to scale production of COVID-19 antibody cocktails",googlenews,2020-09-18 09:14:58
Eli Lilly Reaches COVID-19 Antibody Therapy Manufacturing Deal With Amgen,googlenews,2020-09-18 09:14:58
What Are Monoclonal Antibodies? Eli Lilly Claims Drug Helps Mild-to-moderate COVID-19 Patients,googlenews,2020-09-18 09:14:58
Papa John's to open new headquarters in Atlanta,googlenews,2020-09-18 09:14:58
Papa John's founder John Schnatter saddened and disappointed by chain's Atlanta move,googlenews,2020-09-18 09:14:58
Papa John's pizza chain headquarters moving to metro Atlanta,googlenews,2020-09-18 09:14:58
"After 36 years, Papa John's moves some operations out of its hometown",googlenews,2020-09-18 09:14:58
"Bank of England eyes sub-zero rates in face of virus, Brexit",googlenews,2020-09-18 09:14:58
Bank of England to Step Up Talks on Negative Rates,googlenews,2020-09-18 09:14:58
Check your financial plans are 'negative interest rate ready,googlenews,2020-09-18 09:14:58
No-Deal Brexit May Be the Trigger for BOE to Use Negative Rates,googlenews,2020-09-18 09:14:58
Blue Bell Ordered To Pay $17.25 Million In Criminal Penalties For Shipping Contaminated Products,googlenews,2020-09-18 09:14:58
Blue Bell ice cream's listeria outbreak draws record $17.25 million fine,googlenews,2020-09-18 09:14:58
Blue Bell ordered to pay $17.25M after 2015 listeria contamination,googlenews,2020-09-18 09:14:58
Blue Bell To Pay $17.25 Million Over Listeria Contamination,googlenews,2020-09-18 09:14:58
Should you lock or float your mortgage rate today?,googlenews,2020-09-18 09:14:58
"Here Are Today's Best Mortgage & Refinance Rates for September 17, 2020",googlenews,2020-09-18 09:14:58
"The Fed doesn't directly set mortgage rates, but its near-zero policy is still good for borrowers",googlenews,2020-09-18 09:14:58
Why are the lowest mortgage rates so hard to capture?,googlenews,2020-09-18 09:14:58
New data shows small businesses in communities of color had unequal access to federal COVID-19 relief,googlenews,2020-09-18 09:14:58
ACAP Signs Deal With Biz2Credit to License PPP Forgiveness Platform,googlenews,2020-09-18 09:14:58
AICPA urges passage of 'PPP 2' legislation,googlenews,2020-09-18 09:14:58
DC Businesses In Majority Black Neighborhoods Waited Longer For Federal Aid,googlenews,2020-09-18 09:14:58
Lawsuit accuses Facebook of using mobile phone cameras to spy on Instagram users | TheHill,googlenews,2020-09-18 09:14:58
Facebook And Instagram Appeared To Go Down For Some Users Thursday Afternoon,googlenews,2020-09-18 09:14:58
Facebook and Instagram down? Outages reported on social media,googlenews,2020-09-18 09:14:58
Facebook allegedly spies on Instagram users through selfie cameras,googlenews,2020-09-18 09:14:58
NYC Restaurants Will Be Able to Add a COVID-19 Surcharge to Checks,googlenews,2020-09-18 09:14:58
NYC Council Approves Optional 10% Restaurant Surcharge Fee,googlenews,2020-09-18 09:14:58
NYC restaurants can charge diners an extra 10 percent fee during COVID-19 pandemic,googlenews,2020-09-18 09:14:58
New coronavirus tax on diners is no way to save restaurant industry (opinion),googlenews,2020-09-18 09:14:58
