headline,org,date
"Developed nations’ recovery hit through trade links unless they help more, research finds",financialtimes,2021-01-24 10:34:59
"As senate majority leader, the veteran Democrat must balance an impeachment trial with an ambitious legislative plan",financialtimes,2021-01-24 10:34:59
The development of city-regions should not be at London’s expense,financialtimes,2021-01-24 10:34:59
Forecasts of unemployment resulting from coronavirus pandemic have been revised downwards,financialtimes,2021-01-24 10:34:59
US stresses ‘special relationship’ after conversation with UK prime minister but no mention is made of trade,financialtimes,2021-01-24 10:34:59
"Macron establishes ‘memories and truth commission’, while Algiers awaits full apology",financialtimes,2021-01-24 10:34:59
ClearGlass finds 242 asset managers met its minimum quality standards for provision of cost and performance data,financialtimes,2021-01-24 10:34:59
"Analysts are sceptical that, even with US support, oil company can succeed in Kurdish-held area",financialtimes,2021-01-24 10:34:59
"Research suggests B.1.1.7 is more likely to result in death, but fatality rates are still lower than when pandemic began",financialtimes,2021-01-24 10:34:59
"Video: Covid-19 won’t end globalisation, but it could force it into complete stasis",financialtimes,2021-01-24 10:34:59
The pandemic motivated buyers to move away from downtown areas into the outskirts — but price growth still lags other US cities,financialtimes,2021-01-24 10:34:59
"After a month in hospital, FT critic Tim Hayward reflects on his battle with coronavirus",financialtimes,2021-01-24 10:34:59
From ‘Bridgerton’ to ‘The Great’ the once-cosy genre is taking risks — and holding a mirror to our times ,financialtimes,2021-01-24 10:34:59
Bellwethers for global oil industry say activity is picking up but caution recovery still fragile,financialtimes,2021-01-24 10:34:59
Prime minister attacks AstraZeneca and BioNTech/Pfizer for lower than expected deliveries,financialtimes,2021-01-24 10:34:59
Ottawa’s acquiescence to Biden move on pipeline draws condemnation from leaders in oil-rich Alberta,financialtimes,2021-01-24 10:34:59
Deal with Republicans provides time to consider Biden appointments and stimulus,financialtimes,2021-01-24 10:34:59
Anti-establishment populists in the Netherlands and Estonia are on the back foot,financialtimes,2021-01-24 10:34:59
"A new era for the 'special relationship'. Plus, how is the Brexit trade deal working on the ground?",financialtimes,2021-01-24 10:34:59
Challenges facing next chancellor of Europe’s biggest economy,financialtimes,2021-01-24 10:34:59
Surging optimism about a boom in 2021 depends on heavy public spending and a rapid rollout of new Covid vaccines,financialtimes,2021-01-24 10:34:59
"This week in the business of sport: leagues count cost of selling to private equity, fallout from the US election puts new price on women’s basketball, and more.",financialtimes,2021-01-24 10:34:59
African-American slugger defied death threats to break Babe Ruth’s home run record,financialtimes,2021-01-24 10:34:59
Market Questions is the FT’s guide to the week ahead,financialtimes,2021-01-24 10:34:59
Business surveys show a slowdown in activity on the continent as Covid-19 lockdowns persist,financialtimes,2021-01-24 10:34:59
Regulators tighten focus as institutions flirt with exposure to cryptocurrency,financialtimes,2021-01-24 10:34:59
Expansion of franchises such as Demon Slayer reflects shifts in the ownership and ambitions of a $24bn-a-year industry,financialtimes,2021-01-24 10:34:59
"Google’s Loon deflated, conlang conundrums, Galaxy S21 reviews",financialtimes,2021-01-24 10:34:59
ICO investigation was put on hold in May last year because of coronavirus pandemic,financialtimes,2021-01-24 10:34:59
Poland delays planned abortion restrictions amid protests,financialtimes,2021-01-24 10:34:59
German-Polish relations hit snag over new ambassador to Warsaw,financialtimes,2021-01-24 10:34:59
Polish opposition challenges ‘not democratic’ election result,financialtimes,2021-01-24 10:34:59
Apple and Tesla Are Among Top Earnings Coming This Week,thestreet,2021-01-24 10:36:41
Tech Stock Winners of a Biden Presidency,thestreet,2021-01-24 10:36:41
Jim Cramer on GameStop: Beware of Short Squeeze,thestreet,2021-01-24 10:36:41
Is It Safe to Buy Bitcoin After Its Recent 20% Correction?,thestreet,2021-01-24 10:36:41
Jim Cramer: The Market Now Acts Like a Market of Stocks Than a Bushel or a Peck,thestreet,2021-01-24 10:36:41
Collins: GameStop and the Dangerous Game of Gamma Squeezes,thestreet,2021-01-24 10:36:41
Bengali: Oil Specs Are All in and Long - Too Much Too Soon?,thestreet,2021-01-24 10:36:41
"Jhonsa: 2021 and 2022 Look Difficult for Intel, While 2023 -- Might -- Be Better",thestreet,2021-01-24 10:36:41
Sebastian: A Johnson & Johnson Play Ahead of Earnings,thestreet,2021-01-24 10:36:41
IBM's Disappointing Revenue Deals a Bearish Blow to the Stock,thestreet,2021-01-24 10:36:41
Why Terrell Davis Dove Into Business of CBD - Sport of Money,thestreet,2021-01-24 10:36:41
Jim Cramer: How Reported Hack Impacted Intel Stock After Earnings,thestreet,2021-01-24 10:36:41
Apple This Week: Earnings Around the Corner,thestreet,2021-01-24 10:36:41
Where Tesla Goes From Here,thestreet,2021-01-24 10:36:41
"Carson Palmer Explains NFL Concussion Protocol, Previews AFC and NFC Championships",thestreet,2021-01-24 10:36:41
4 ETFs for Adding a 9% Yield to Your Portfolio,thestreet,2021-01-24 10:36:41
Breaking Down The COVID Discount and Its Impact on the Commercial Real Estate Market,thestreet,2021-01-24 10:36:41
The Future of Land Values in 2021,thestreet,2021-01-24 10:36:41
Here’s What Retail Recovery Looks Like In 2021,thestreet,2021-01-24 10:36:41
Four Financial ‘Experts’ You Should Never Listen To,thestreet,2021-01-24 10:36:41
Answering Client Questions About Investing in Gold,thestreet,2021-01-24 10:36:41
PPP Forgiveness: What Business Owners Need to Know,thestreet,2021-01-24 10:36:41
The Home Office Deduction,thestreet,2021-01-24 10:36:41
The Child Tax Credit,thestreet,2021-01-24 10:36:41
What Documents Do I Need to Bring to My Tax Preparer?,thestreet,2021-01-24 10:36:41
3 Alternative Energy Stocks to Watch During Biden's First 100 Days,thestreet,2021-01-24 10:36:41
Why Terrell Davis Dove Into Business of CBD - Sport of Money,thestreet,2021-01-24 10:36:41
Jim Cramer: Alphabet Looks Like a Monopoly But Isn't,thestreet,2021-01-24 10:36:41
Jim Cramer on GameStop: Beware of Short Squeeze,thestreet,2021-01-24 10:36:41
Best Stocks in the Past Week: BlackBerry Rises From Ashes,thestreet,2021-01-24 10:36:41
Game Plan: Cramer's 'Mad Money' Recap (Friday 1/22/21),thestreet,2021-01-24 10:36:41
GameStop Shares Sprint Higher After Citron Abandons Stock,thestreet,2021-01-24 10:36:41
"GameStop, Sierra Wireless, Jumia: 5 Top Stock Gainers for Friday",thestreet,2021-01-24 10:36:41
"Nasdaq Closes at Record, Stocks Mixed on Worry Over Virus Impact on Growth",thestreet,2021-01-24 10:36:41
"United Wholesale Mortgage CEO on Going Public, Housing Sector in 2021",thestreet,2021-01-24 10:36:41
What Jim Cramer Likes About WM Holdings,thestreet,2021-01-24 10:36:41
Why Jim Cramer Would Add American Eagle to His Portfolio,thestreet,2021-01-24 10:36:41
"Under Armour, Tesla, Peloton: Weekly Upgrades and Downgrades",thestreet,2021-01-24 10:36:41
Jim Cramer: IBM Stock Is Trading Correctly After Earnings,thestreet,2021-01-24 10:36:41
Stock Market Today With Jim Cramer: IBM and Intel Disappoint,thestreet,2021-01-24 10:36:41
"Where Consumers Spend Stimulus Money, Which Stocks Benefit Most",thestreet,2021-01-24 10:36:41
Jim Cramer: Buy CSX Stock,thestreet,2021-01-24 10:36:41
United Airlines CEO Wants Vaccine Mandatory for Employees,thestreet,2021-01-24 10:36:41
Tesla's Musk Offers $100M Reward for Best Carbon-Capture Tech,thestreet,2021-01-24 10:36:41
Seagate Drops Even as Earnings and Revenue Beat Estimates,thestreet,2021-01-24 10:36:41
"What IBM, Intel Tell Jim Cramer About Markets Friday",thestreet,2021-01-24 10:36:41
"Sports Gambling Stocks, Such as DraftKings, Drop Despite Michigan Legalization",thestreet,2021-01-24 10:36:41
Carnival Extends U.S. Cruise Suspensions Through April 30,thestreet,2021-01-24 10:36:41
3 Alternative Energy Stocks to Watch During Biden's First 100 Days,thestreet,2021-01-24 10:36:41
What Jim Cramer Likes About WM Holdings,thestreet,2021-01-24 10:36:41
Manufacturing Rebound Has Suppliers Struggling to Keep Up,googlenews,2021-01-24 10:38:36
World’s Economic Recovery Gets Delayed by Slow Vaccine Rollouts,googlenews,2021-01-24 10:38:36
$1 billion Mega Millions winning ticket sold in Michigan,googlenews,2021-01-24 10:38:36
3 Top Healthcare Stocks That Can Make You Richer in 2021 (and Beyond),googlenews,2021-01-24 10:38:36
Tesla accuses engineer of stealing crucial company software,googlenews,2021-01-24 10:38:36
Leaders of Vaccine Rollout Deliver Some of World’s Top Gains,googlenews,2021-01-24 10:38:36
Rule Breaker Investing: 5 Stocks Rolled Up at Random,googlenews,2021-01-24 10:38:36
"Uber, After Buying Postmates, Lays Off More Than 180 Employees",googlenews,2021-01-24 10:38:36
Pennsylvania Department of Labor and Industry to resume unemployment payments for PUA program,googlenews,2021-01-24 10:38:36
Pfizer/BioNTech COVID-19 vaccine supply to rise with FDA label change,googlenews,2021-01-24 10:38:36
Bay Area ICU availability is nearly double Sacramento’s. Why is it still locked down and Sacramento is not?,googlenews,2021-01-24 10:38:36
"Coronavirus daily news updates, January 23: What to know today about COVID-19 in the Seattle area, Washington state and the world",googlenews,2021-01-24 10:38:36
Walmart expanding COVID-19 vaccine program to South Carolina,googlenews,2021-01-24 10:38:36
Why Stephanie Link Is A Buyer Of IBM,googlenews,2021-01-24 10:38:36
How Biden's administration will increase COVID vaccine supply | GMA,googlenews,2021-01-24 10:38:36
"Chicago, Cook County allowed to restart indoor dining with COVID restrictions",googlenews,2021-01-24 10:38:36
UK vaccine roll-out speeds up but doctors want quicker second dose,googlenews,2021-01-24 10:38:36
Why Elon Musk is pushing Signal,googlenews,2021-01-24 10:38:36
NCDHHS: State’s first identified case of B.1.1.7 COVID-19 variant is in Meck Co.,googlenews,2021-01-24 10:38:36
U.S. works to get more COVID-19 vaccine doses amid concerns over new variant,googlenews,2021-01-24 10:38:36
AOC cheers wage increase for Teamsters at NYC produce market,googlenews,2021-01-24 10:38:36
Mine OK'd in Trump's last days may boost Biden energy plan,googlenews,2021-01-24 10:38:36
"Cleaning Goes Wrong, Ruining 1.9K Vaccine Doses",googlenews,2021-01-24 10:38:36
"Miami-Dade’s wealthiest ZIP codes are also the most vaccinated for COVID-19, data shows",googlenews,2021-01-24 10:38:36
"Powerball lottery: Did you win Saturday’s $20M Powerball drawing? Winning numbers, live results (1/23/2021)",googlenews,2021-01-24 10:38:36
"Did the Facebook app force log you out, too?",googlenews,2021-01-24 10:38:36
Boil Water Notice issued in areas of Hamburg and Orchard Park,googlenews,2021-01-24 10:38:36
Pfizer Can Count Bonus Doses Toward Fulfilling Contracts With Feds,googlenews,2021-01-24 10:38:36
Janet Yellen Clarifies Her Stance on Bitcoin — Promises 'Effective' Crypto Regulation – Regulation Bitcoin News,googlenews,2021-01-24 10:38:36
CVS And Walgreens To Offer In-Store Covid Vaccinations | NBC Nightly News,googlenews,2021-01-24 10:38:36
Godiva Chocolates to close all 128 North American stores due to COVID pandemic,googlenews,2021-01-24 10:38:36
Several Louisiana Walmart stores and Sam's Clubs to begin coronavirus vaccine administration,googlenews,2021-01-24 10:38:36
Hawaii reports 4 additional COVID-19 deaths as state passes 25K total case mark,googlenews,2021-01-24 10:38:36
'It was a nightmare': Major delays force some to leave Delaware vaccine events without their shot,googlenews,2021-01-24 10:38:36
Amazon could face a new union push and antitrust scrutiny under the Biden administration,googlenews,2021-01-24 10:38:36
'I want to feel safe again': Americans lament slow pace of U.S. COVID-19 vaccine rollout,googlenews,2021-01-24 10:38:36
"What's Working: Here's how Colorado is rolling out federal unemployment benefits, plus Paycheck loans are hopping",googlenews,2021-01-24 10:38:36
"Colorado 3rd Safest State During COVID Pandemic, Study Finds",googlenews,2021-01-24 10:38:36
If It Looks Like a Bubble and Swims Like a Bubble...,googlenews,2021-01-24 10:38:36
United Airlines CEO wants to make Covid vaccine mandatory for employees,googlenews,2021-01-24 10:38:36
Google's threat to block Australia over content fees sparks anger,googlenews,2021-01-24 10:38:36
"Dow Jones Dips As Intel, IBM Weigh; Nasdaq Hits New High Ahead Of Apple Earnings",googlenews,2021-01-24 10:38:36
LIST: Here are the Houston-area hospitals receiving COVID-19 vaccine,googlenews,2021-01-24 10:38:36
Norwegian requiring its crew members to get the COVID-19 vaccine - Business Insider,googlenews,2021-01-24 10:38:36
Man dead after drive-by shooting on the city's west side,googlenews,2021-01-24 10:38:36
One man arrested after making false security threat on Alaska Airlines flight from Seattle,googlenews,2021-01-24 10:38:36
Monoclonal antibodies can prevent COVID-19—but successful vaccines complicate their future,googlenews,2021-01-24 10:38:36
"Bill Gates shares photo of his coronavirus vaccine, says 'I feel great'",googlenews,2021-01-24 10:38:36
"AMD earnings: If Intel gets its act together, can AMD maintain swollen valuation?",googlenews,2021-01-24 10:38:36
Chick-Fil-A manager saves the day after backup at SC COVID-19 vaccination site,googlenews,2021-01-24 10:38:36
"Teen arrested after stealing $1 million from Kroger, police say",googlenews,2021-01-24 10:38:36
"Apple, Tesla and Facebook ready to report record sales in busiest week of earnings",googlenews,2021-01-24 10:38:36
"Customer leaves 'Covid sucks!' message and a $1,400 tip at a Colorado restaurant",googlenews,2021-01-24 10:38:36
"Ford will recall 3 million vehicles for airbag problems, after losing fight with safety regulator",googlenews,2021-01-24 10:38:36
Loon’s bubble bursts—Alphabet shuts down Internet balloon company,googlenews,2021-01-24 10:38:36
CEOs stepped up during the Trump era. They're not off the hook,googlenews,2021-01-24 10:38:36
Federal Trade Commission Warning Consumers Of ‘Brushing’ Package Delivery Scam,googlenews,2021-01-24 10:38:36
Amazon urging halt to union mail-in vote at Bessemer warehouse,googlenews,2021-01-24 10:38:36
The 3 Worst Ways to Invest in Bitcoin,googlenews,2021-01-24 10:38:36
Candy company will pay you $30 an hour to eat sweets,googlenews,2021-01-24 10:38:36
"Man used $2M in COVID relief for a Bentley, Tesla, Las Vegas condos: feds",googlenews,2021-01-24 10:38:36
Exclusive: AstraZeneca to cut EU's COVID vaccine deliveries by 60% in first quarter - EU source,googlenews,2021-01-24 10:38:36
"FAA still investigating wheel that fell off small plane, landed in Chicago family's yard",googlenews,2021-01-24 10:38:36
ADHS's request for more COVID-19 vaccines denied by federal government as state surpasses 400K vaccinations,googlenews,2021-01-24 10:38:36
Google Threatens to Pull Site From Australia If This Law Gets Passed,googlenews,2021-01-24 10:38:36
"1,800 Instacart workers are losing their jobs. No one agrees on who fired them.",googlenews,2021-01-24 10:38:36
Report: Genesee County is contender for $17 billion Samsung chip-making plant,googlenews,2021-01-24 10:38:36
"U.S. Proved Oil Reserves Remain Flat, Natural Gas Reserves Decline",googlenews,2021-01-24 10:38:36
American Airlines has so much extra wine that it is starting a delivery service,googlenews,2021-01-24 10:38:36
Legendary investor Jeremy Grantham says Biden's $1.9 trillion stimulus plan will make the stock market bu..,googlenews,2021-01-24 10:38:36
Saturday’s Powerball jackpot estimated at $20 million,googlenews,2021-01-24 10:38:36
A Look at Michigan’s largest lottery wins,googlenews,2021-01-24 10:38:36
Winning $1 billion Mega Millions ticket sold in Michigan,googlenews,2021-01-24 10:38:36
Someone In Michigan Just Won A Billion Dollars,googlenews,2021-01-24 10:38:36
"Tesla has accused an engineer of downloading about 26,000 sensitive files in his first week",googlenews,2021-01-24 10:38:36
Tesla claims a software engineer stole critical automated software from its WARP Drive system,googlenews,2021-01-24 10:38:36
Tesla claims its former engineer stole secrets just days into the job,googlenews,2021-01-24 10:38:36
"Tesla sues former employee for allegedly stealing 26,000 confidential files",googlenews,2021-01-24 10:38:36
How to Make 2021 Your Best Financial Year Ever,googlenews,2021-01-24 10:38:36
Investing Advice as We Start a New Year,googlenews,2021-01-24 10:38:36
Extension of Unemployment Benefits To Resume In Pennsylvania,googlenews,2021-01-24 10:38:36
NBC10 Responds: Some Snags in CARES Act Unemployment,googlenews,2021-01-24 10:38:36
L&I: PA to begin issuing Pandemic Emergency Unemployment benefits this week,googlenews,2021-01-24 10:38:36
Financial relief now available to thousands of South Carolinians who’ve gone months without work,googlenews,2021-01-24 10:38:36
U.K. doctors raise concerns over 12-week gap between vaccine doses,googlenews,2021-01-24 10:38:36
FDA gives approval for syringes to extract an extra dose from vials of the COVID-19 vaccine,googlenews,2021-01-24 10:38:36
WHO Says Africa to Receive Vaccine Doses in March,googlenews,2021-01-24 10:38:36
COVID: British doctors seek review of gap between Pfizer vaccine doses,googlenews,2021-01-24 10:38:36
Bay Area Vaccination Rate Likely to Lag Demand for Months,googlenews,2021-01-24 10:38:36
"Techies may go, but San Francisco’s stalwarts carry on",googlenews,2021-01-24 10:38:36
ICU capacity: Bay Area sees significant jump in available beds,googlenews,2021-01-24 10:38:36
Bay Area ramps up mass vaccination sites,googlenews,2021-01-24 10:38:36
Amazon’s offering to help Biden’s vaccine push. There may be a reason why.,googlenews,2021-01-24 10:38:36
Coronavirus Texas: Pregnant Houston councilmember Abbie Kamin gets COVID-19 vaccine publicly,googlenews,2021-01-24 10:38:36
Can Biden pull off 100 million doses in 100 days? Plus more virus questions answered,googlenews,2021-01-24 10:38:36
Coronavirus: US launches ambitious vaccine plan as new COVID-19 strains spread,googlenews,2021-01-24 10:38:36
Seniors receive COVID-19 vaccine at North Dade Health Center in Miami Gardens,googlenews,2021-01-24 10:38:36
You Can Now Get Your COVID Vaccine at Walmart in These 10 States,googlenews,2021-01-24 10:38:36
"COVID-19 Vaccinations Available For Miami-Dade & Broward Teachers, School Employees 65 And Older This Weekend",googlenews,2021-01-24 10:38:36
"Walmart expands COVID-19 vaccination program to 7 more states, aims to provide 13 million doses per month",googlenews,2021-01-24 10:38:36
Indoor dining resumes in Chicago and suburban Cook County as COVID-19 infection rates fall,googlenews,2021-01-24 10:38:36
Indoor Dining Now Allowed In Chicago And Cook County,googlenews,2021-01-24 10:38:36
Diners Celebrate Chicago's Move Into Mitigation Tier Allowing Indoor Dining,googlenews,2021-01-24 10:38:36
"Seniors, shelters eager to get the COVID-19 vaccine as Illinois enters the next phase — but they hope the pace picks up",googlenews,2021-01-24 10:38:36
"Volkswagen Boss Joins Twitter, Takes A Playful Dig At Elon Musk",googlenews,2021-01-24 10:38:36
Elon Musk offers $100 mln prize for carbon capture,googlenews,2021-01-24 10:38:36
Musk’s $100 million prize is for tech the world desperately needs,googlenews,2021-01-24 10:38:36
Elon Musk Contributing $100 Million To Discover Carbon Capture Technology That Works,googlenews,2021-01-24 10:38:36
North Carolina's first reported case of new COVID-19 strain found in Mecklenburg County,googlenews,2021-01-24 10:38:36
NC reports first case of highly-contagious COVID-19 variant,googlenews,2021-01-24 10:38:36
1st case of new COVID-19 variant in NC detected in Charlotte area,googlenews,2021-01-24 10:38:36
NC hospitals are canceling appointments as state routes vaccine doses to mass events,googlenews,2021-01-24 10:38:36
Hunts Point Strike Is the Bold Labor Action the Country Needs,googlenews,2021-01-24 10:38:36
Deal ends weeklong strike at largest US produce market,googlenews,2021-01-24 10:38:36
“We Fought ’Em Hard”: Hunts Point Produce Workers Toast Victory After Approving Contract,googlenews,2021-01-24 10:38:36
"Hunts Point Produce Market in the Bronx, striking workers reach tentative agreement",googlenews,2021-01-24 10:38:36
Some Patients In New Jersey Receive Second Moderna Shot,googlenews,2021-01-24 10:38:36
"Nearly 2,000 vaccine doses spoiled at Boston hospital",googlenews,2021-01-24 10:38:36
CDC: Severe allergic reactions to COVID-19 vaccine are rare,googlenews,2021-01-24 10:38:36
"Nearly 2,000 doses of Moderna’s COVID-19 vaccine spoil at Jamaica Plain VA hospital",googlenews,2021-01-24 10:38:36
Doc: COVID vaccination plan for long-term care was 'faulty' - The Vicksburg Post,googlenews,2021-01-24 10:38:36
UM Conducts Study On Impact Of High-Blood Pressure Medications On COVID Patients,googlenews,2021-01-24 10:38:36
Another 32 vaccination sites set to open across England,googlenews,2021-01-24 10:38:36
'We are frontline workers': Hospice workers want COVID-19 vaccine priority,googlenews,2021-01-24 10:38:36
Were you logged out of your Facebook account on Friday? This is why.,googlenews,2021-01-24 10:38:36
Facebook says ‘configuration change’ caused some users to be logged out unexpectedly,googlenews,2021-01-24 10:38:36
Facebook Says a ‘Configuration Change’ Is the Reason a Ton of Users Were Logged Out on Friday,googlenews,2021-01-24 10:38:36
Facebook Blames 'Configuration Change' for Mobile App Logouts,googlenews,2021-01-24 10:38:36
Boil water notice issued for parts of Hamburg and Orchard Park,googlenews,2021-01-24 10:38:36
Boil water notice for towns of Hamburg and Orchard Park,googlenews,2021-01-24 10:38:36
Care home residents dying after first jab as Boris Johnson gambles on vaccine delay,googlenews,2021-01-24 10:38:36
Yellen nomination sails through Senate panel; final vote set for Monday,googlenews,2021-01-24 10:38:36
Yellen Defends Stimulus Plan Price Tag,googlenews,2021-01-24 10:38:36
Secretary Yellen's first action on bitcoin will set the tone for the next four years | TheHill,googlenews,2021-01-24 10:38:36
How will the Biden administration approach digital currency?,googlenews,2021-01-24 10:38:36
Maine shifts some vaccine doses away from CVS and Walgreens,googlenews,2021-01-24 10:38:36
The COVID update and open line.,googlenews,2021-01-24 10:38:36
Walgreens administers 1 million COVID-19 vaccines,googlenews,2021-01-24 10:38:36
Godiva closing all its US chocolate shops as pandemic slumps sales,googlenews,2021-01-24 10:38:36
"Godiva to close all stores, including seven in Bay Area",googlenews,2021-01-24 10:38:36
Godiva to shut down all 128 brick-and-mortar stores in North America,googlenews,2021-01-24 10:38:36
Godiva closing all 128 stores in N. America amid pandemic,googlenews,2021-01-24 10:38:36
Walmart to offer COVID-19 vaccinations in 7 states - Wink News,googlenews,2021-01-24 10:38:36
Colorado Health Experts Working On 'Playbook' For Mass COVID Vaccine Distribution,googlenews,2021-01-24 10:38:36
"Attorney for doctor accused of stealing COVID-19 vaccine says DA investigation false, client was following CDC, health guidelines",googlenews,2021-01-24 10:38:36
"After ‘unacceptable’ vaccine cancellations, Miami-Dade mayor orders end to overbooking",googlenews,2021-01-24 10:38:36
Lawmakers working to manage deer population in Maui County,googlenews,2021-01-24 10:38:36
Health director: Intended second doses went to 1st doses instead,googlenews,2021-01-24 10:38:36
Hawaii sees 4 new coronavirus-related deaths on Oahu and 134 infections statewide with total cases topping 25K,googlenews,2021-01-24 10:38:36
"Hawaii’s vaccine rollout climbs past 94,000",googlenews,2021-01-24 10:38:36
Drive-Thru COVID-19 Vaccine Clinic Causes Traffic Jams in Delaware City,googlenews,2021-01-24 10:38:36
"Heavy traffic delays expected around Delaware City, Georgetown vaccination events",googlenews,2021-01-24 10:38:36
Saturday morning Indiana COVID-19 headlines,googlenews,2021-01-24 10:38:36
These States Are Safest During the Pandemic,googlenews,2021-01-24 10:38:36
"Colorado considered one of the safest states during COVID-19, according to report",googlenews,2021-01-24 10:38:36
Local chaplains provide comfort during COVID-19 pandemic,googlenews,2021-01-24 10:38:36
United Airlines Looks To Mandate Vaccinations For Employees,googlenews,2021-01-24 10:38:36
United CEO Wants Mandatory COVID-19 Vaccines for Employees,googlenews,2021-01-24 10:38:36
United Airlines CEO wants to make COVID-19 vaccine mandatory for employees — if other companies go along,googlenews,2021-01-24 10:38:36
United Goes Big And Bold With Seven Changes To The Airline,googlenews,2021-01-24 10:38:36
Google Threatens to Pull Search Engine From Australia | Game Rant,googlenews,2021-01-24 10:38:36
Google threatens to pull search engine in Australia,googlenews,2021-01-24 10:38:36
Google’s Going to Regret Its Australia Search Threat,googlenews,2021-01-24 10:38:36
Australia's Proposed Media Code Turns Up the Heat on Google and Facebook,googlenews,2021-01-24 10:38:36
"Nasdaq Closes at Record, Stocks Mixed on Worry Over Virus Impact on Growth",googlenews,2021-01-24 10:38:36
Stock ETFs Slip on Dampened Stimulus Outlook,googlenews,2021-01-24 10:38:36
"Dow Jones, Nasdaq Pare Earlier Losses; Microsoft Stock Flashes Buy Signal",googlenews,2021-01-24 10:38:36
US STOCKS-Wall Street pauses at record highs after Biden inauguration,googlenews,2021-01-24 10:38:36
Mayor Turner gives update on COIVD vaccines in Houston,googlenews,2021-01-24 10:38:36
