headline,org,date
"‘It’s a grim cut off’: Washington abandoned a stimulus deal, so much of America’s temporary financial safety net will expire",msnmoney,2020-11-01 10:22:12
Why pennies still exist and other money trivia,msnmoney,2020-11-01 10:22:12
"November Surprise: What ""Second Wave"" Means for Stocks",msnmoney,2020-11-01 10:22:12
Want a Big Raise From Social Security? 4 Ways to Snag One,msnmoney,2020-11-01 10:22:12
Warning signs a job isn't as good as it sounds,msnmoney,2020-11-01 10:22:12
New Car Gadget Magically Removes Scratches & Dents,msnmoney,2020-11-01 10:22:12
Allegro Record IPO a Boon for E-Commerce Investors in Poland,msnmoney,2020-11-01 10:22:12
"Thanks to COVID-19, Holiday Shopping Is Going To Be Really Different This Year",msnmoney,2020-11-01 10:22:12
Best bank account bonuses for November 2020,msnmoney,2020-11-01 10:22:12
Man Who Predicted 2020 Crash Issues Next Major Warning,msnmoney,2020-11-01 10:22:12
Where to sell clothes online for quick cash,msnmoney,2020-11-01 10:22:12
"Before you renew Amazon Prime, read this",msnmoney,2020-11-01 10:22:12
Huawei Plans to Build Chip Plant Without U.S. Technology: FT,msnmoney,2020-11-01 10:22:12
Things you should never try to sell on eBay,msnmoney,2020-11-01 10:22:12
16 easy ways you can save money right now,msnmoney,2020-11-01 10:22:12
Tips for avoiding utility bill scams,msnmoney,2020-11-01 10:22:12
Mars Wrigley warehouse workers say they're getting yelled at for washing their hands and wiping down equipment amid an $8 billion boom for candy this Halloween,msnmoney,2020-11-01 10:22:12
The Best Song Of All Time Is Mostly Forgotten Today,msnmoney,2020-11-01 10:22:12
Tiffany Trump’s Wealth Is a Fraction of Ivanka’s and the Other Trump Kids’ Fortunes,msnmoney,2020-11-01 10:22:12
8 Jobs That Employers Most Often Want Retirees to Do,msnmoney,2020-11-01 10:22:12
"See How Much Money Warren Buffett, Dana White and 35 Other CEOs Are Pouring Into the Election",msnmoney,2020-11-01 10:22:12
Our Coronavirus World Is Undernourished,msnmoney,2020-11-01 10:22:12
America’s 12 Wealthiest Presidents,msnmoney,2020-11-01 10:22:12
How to buy Apple devices without paying Apple prices,msnmoney,2020-11-01 10:22:12
3 Websites That Pay You for Shopping,msnmoney,2020-11-01 10:22:12
Employment during COVID-19 by the numbers,msnmoney,2020-11-01 10:22:12
Alibaba’s 3-year experiment,msnmoney,2020-11-01 10:22:12
Never Buy These 10 Things With Your Credit Card,msnmoney,2020-11-01 10:22:12
Inside Selena Gomez's stunning homes from Texas to LA,msnmoney,2020-11-01 10:22:12
23 New Gadgets That Will Sell Out Before the Holidays,msnmoney,2020-11-01 10:22:12
5 Overlooked Ways to Save Money in November,msnmoney,2020-11-01 10:22:12
‘We’re Going to Ground the Plane’: How Boeing’s Max Was Parked,msnmoney,2020-11-01 10:22:12
Hacks for reducing your monthly bills,msnmoney,2020-11-01 10:22:12
How to get the lowest 15-year mortgage rate for your refinance,msnmoney,2020-11-01 10:22:12
Restaurants See New Wave of COVID-19 Restrictions as US Cases Surge,msnmoney,2020-11-01 10:22:12
The Tallest Men In Hollywood: Their Real Heights,msnmoney,2020-11-01 10:22:12
"Review: The 2020 Lamborghini EVO RWD is the most fun for the least amount of money at a starting price of $208,000",msnmoney,2020-11-01 10:22:12
Almost Every State Is In Debt Thanks to COVID-19 — What Now?,msnmoney,2020-11-01 10:22:12
Mortgage rates stick near record lows and deliver more savings,msnmoney,2020-11-01 10:22:12
How Much Will It Cost To Get the Coronavirus Vaccine?,msnmoney,2020-11-01 10:22:12
Opinion: The asset class you probably haven’t even considered,msnmoney,2020-11-01 10:22:12
The Biggest Celebs Who Are Funding Trump's Presidency,msnmoney,2020-11-01 10:22:12
All the New Numbers You Need To Know for Planning Ahead on Taxes,msnmoney,2020-11-01 10:22:12
7 haunted houses that were once worth over $1 million,msnmoney,2020-11-01 10:22:12
10 Products That Make Screen Time Safer,msnmoney,2020-11-01 10:22:12
"Stocks face a choppy ride after the election, analysts say",msnmoney,2020-11-01 10:22:12
9 strategies for getting more money than a stimulus check,msnmoney,2020-11-01 10:22:12
"Bladder: When You Just Can't Stop Peeing, Do This for Incredible Relief",msnmoney,2020-11-01 10:22:12
"How Investing Can Turn Your Pocket Change Into $60,000 or More",msnmoney,2020-11-01 10:22:12
Ways investing will change in the next 25 years,msnmoney,2020-11-01 10:22:12
Opinion: People are spending over three times more money ‘gambling’ on hot stocks than at casinos and on lottery tickets and sports betting,msnmoney,2020-11-01 10:22:12
Planning Your Thanksgiving Road Trip? See Average Gas Prices in Every State,msnmoney,2020-11-01 10:22:12
San Francisco Realtors Are Offering Huge Incentives to Sell Condos. What Does This Mean for Investors?,msnmoney,2020-11-01 10:22:12
 [Pics] You Cant Fix Stupid But you Can Laugh At It,msnmoney,2020-11-01 10:22:12
Household products that are a complete waste of money,msnmoney,2020-11-01 10:22:12
Election whale trade — Bank of America equities shakeup — Charles Schwab layoffs,msnmoney,2020-11-01 10:22:12
30 toys that defined the '80s,msnmoney,2020-11-01 10:22:12
How to determine your retirement goals,msnmoney,2020-11-01 10:22:12
States Where the Rich Get Richer and the Poor Get Poorer,msnmoney,2020-11-01 10:22:12
Investors were disappointed by mega-cap tech guidance last week — but UBS says investors should stay invested and focus on 3 key areas,msnmoney,2020-11-01 10:22:12
Your Heart May Be Under Attack,msnmoney,2020-11-01 10:22:12
11 Dividend Growth Stocks Delivering Double-Digit Increases,msnmoney,2020-11-01 10:22:12
"98,000 new Covid-19 cases. And the worst may be yet to come.",msnmoney,2020-11-01 10:22:12
Things every retiree should get rid of,msnmoney,2020-11-01 10:22:12
7 Secrets You Should Learn From 401(k) Millionaires,msnmoney,2020-11-01 10:22:12
Military Money: Here’s What Men and Women in Uniform Earn,msnmoney,2020-11-01 10:22:12
"As the market falls and investor fear builds, assessing the odds of a year-end comeback",msnmoney,2020-11-01 10:22:12
Homeowners With Old AC Systems Can Get New Energy Efficient Replacement,msnmoney,2020-11-01 10:22:12
"From $300,000 in Debt to Zero — How Real People Repaid Their Debts Fast",msnmoney,2020-11-01 10:22:12
Extreme living: tough homes at the end of the Earth,msnmoney,2020-11-01 10:22:12
What the Fed’s Major Strategic Change Means for You,msnmoney,2020-11-01 10:22:12
The Race for Texas’s Powerful Energy Regulator Is Heating Up,msnmoney,2020-11-01 10:22:12
25 Ways To Score a Good Deal on a Car Out of State,msnmoney,2020-11-01 10:22:12
COVID-19 is hitting minorities harder—here's how,msnmoney,2020-11-01 10:22:12
"‘It’s a grim cut off’: Washington abandoned a stimulus deal, so much of America’s temporary financial safety net will expire",msnmoney,2020-11-01 10:22:12
Why pennies still exist and other money trivia,msnmoney,2020-11-01 10:22:12
"November Surprise: What ""Second Wave"" Means for Stocks",msnmoney,2020-11-01 10:22:12
Want a Big Raise From Social Security? 4 Ways to Snag One,msnmoney,2020-11-01 10:22:12
Warning signs a job isn't as good as it sounds,msnmoney,2020-11-01 10:22:12
New Car Gadget Magically Removes Scratches & Dents,msnmoney,2020-11-01 10:22:12
Allegro Record IPO a Boon for E-Commerce Investors in Poland,msnmoney,2020-11-01 10:22:12
"Thanks to COVID-19, Holiday Shopping Is Going To Be Really Different This Year",msnmoney,2020-11-01 10:22:12
Best bank account bonuses for November 2020,msnmoney,2020-11-01 10:22:12
Man Who Predicted 2020 Crash Issues Next Major Warning,msnmoney,2020-11-01 10:22:12
Where to sell clothes online for quick cash,msnmoney,2020-11-01 10:22:12
"Before you renew Amazon Prime, read this",msnmoney,2020-11-01 10:22:12
Huawei Plans to Build Chip Plant Without U.S. Technology: FT,msnmoney,2020-11-01 10:22:12
Things you should never try to sell on eBay,msnmoney,2020-11-01 10:22:12
16 easy ways you can save money right now,msnmoney,2020-11-01 10:22:12
Tips for avoiding utility bill scams,msnmoney,2020-11-01 10:22:12
Mars Wrigley warehouse workers say they're getting yelled at for washing their hands and wiping down equipment amid an $8 billion boom for candy this Halloween,msnmoney,2020-11-01 10:22:12
The Best Song Of All Time Is Mostly Forgotten Today,msnmoney,2020-11-01 10:22:12
Tiffany Trump’s Wealth Is a Fraction of Ivanka’s and the Other Trump Kids’ Fortunes,msnmoney,2020-11-01 10:22:12
8 Jobs That Employers Most Often Want Retirees to Do,msnmoney,2020-11-01 10:22:12
"See How Much Money Warren Buffett, Dana White and 35 Other CEOs Are Pouring Into the Election",msnmoney,2020-11-01 10:22:12
Our Coronavirus World Is Undernourished,msnmoney,2020-11-01 10:22:12
America’s 12 Wealthiest Presidents,msnmoney,2020-11-01 10:22:12
How to buy Apple devices without paying Apple prices,msnmoney,2020-11-01 10:22:12
3 Websites That Pay You for Shopping,msnmoney,2020-11-01 10:22:12
Employment during COVID-19 by the numbers,msnmoney,2020-11-01 10:22:12
Alibaba’s 3-year experiment,msnmoney,2020-11-01 10:22:12
Never Buy These 10 Things With Your Credit Card,msnmoney,2020-11-01 10:22:12
Inside Selena Gomez's stunning homes from Texas to LA,msnmoney,2020-11-01 10:22:12
23 New Gadgets That Will Sell Out Before the Holidays,msnmoney,2020-11-01 10:22:12
5 Overlooked Ways to Save Money in November,msnmoney,2020-11-01 10:22:12
‘We’re Going to Ground the Plane’: How Boeing’s Max Was Parked,msnmoney,2020-11-01 10:22:12
Hacks for reducing your monthly bills,msnmoney,2020-11-01 10:22:12
How to get the lowest 15-year mortgage rate for your refinance,msnmoney,2020-11-01 10:22:12
Restaurants See New Wave of COVID-19 Restrictions as US Cases Surge,msnmoney,2020-11-01 10:22:12
The Tallest Men In Hollywood: Their Real Heights,msnmoney,2020-11-01 10:22:12
"Review: The 2020 Lamborghini EVO RWD is the most fun for the least amount of money at a starting price of $208,000",msnmoney,2020-11-01 10:22:12
Almost Every State Is In Debt Thanks to COVID-19 — What Now?,msnmoney,2020-11-01 10:22:12
Mortgage rates stick near record lows and deliver more savings,msnmoney,2020-11-01 10:22:12
How Much Will It Cost To Get the Coronavirus Vaccine?,msnmoney,2020-11-01 10:22:12
Opinion: The asset class you probably haven’t even considered,msnmoney,2020-11-01 10:22:12
The Biggest Celebs Who Are Funding Trump's Presidency,msnmoney,2020-11-01 10:22:12
All the New Numbers You Need To Know for Planning Ahead on Taxes,msnmoney,2020-11-01 10:22:12
7 haunted houses that were once worth over $1 million,msnmoney,2020-11-01 10:22:12
10 Products That Make Screen Time Safer,msnmoney,2020-11-01 10:22:12
"Stocks face a choppy ride after the election, analysts say",msnmoney,2020-11-01 10:22:12
9 strategies for getting more money than a stimulus check,msnmoney,2020-11-01 10:22:12
"Bladder: When You Just Can't Stop Peeing, Do This for Incredible Relief",msnmoney,2020-11-01 10:22:12
"How Investing Can Turn Your Pocket Change Into $60,000 or More",msnmoney,2020-11-01 10:22:12
Ways investing will change in the next 25 years,msnmoney,2020-11-01 10:22:12
Opinion: People are spending over three times more money ‘gambling’ on hot stocks than at casinos and on lottery tickets and sports betting,msnmoney,2020-11-01 10:22:12
Planning Your Thanksgiving Road Trip? See Average Gas Prices in Every State,msnmoney,2020-11-01 10:22:12
San Francisco Realtors Are Offering Huge Incentives to Sell Condos. What Does This Mean for Investors?,msnmoney,2020-11-01 10:22:12
 [Pics] You Cant Fix Stupid But you Can Laugh At It,msnmoney,2020-11-01 10:22:12
Household products that are a complete waste of money,msnmoney,2020-11-01 10:22:12
Election whale trade — Bank of America equities shakeup — Charles Schwab layoffs,msnmoney,2020-11-01 10:22:12
30 toys that defined the '80s,msnmoney,2020-11-01 10:22:12
How to determine your retirement goals,msnmoney,2020-11-01 10:22:12
States Where the Rich Get Richer and the Poor Get Poorer,msnmoney,2020-11-01 10:22:12
Investors were disappointed by mega-cap tech guidance last week — but UBS says investors should stay invested and focus on 3 key areas,msnmoney,2020-11-01 10:22:12
Your Heart May Be Under Attack,msnmoney,2020-11-01 10:22:12
11 Dividend Growth Stocks Delivering Double-Digit Increases,msnmoney,2020-11-01 10:22:12
"98,000 new Covid-19 cases. And the worst may be yet to come.",msnmoney,2020-11-01 10:22:12
Things every retiree should get rid of,msnmoney,2020-11-01 10:22:12
7 Secrets You Should Learn From 401(k) Millionaires,msnmoney,2020-11-01 10:22:12
Military Money: Here’s What Men and Women in Uniform Earn,msnmoney,2020-11-01 10:22:12
"As the market falls and investor fear builds, assessing the odds of a year-end comeback",msnmoney,2020-11-01 10:22:12
Homeowners With Old AC Systems Can Get New Energy Efficient Replacement,msnmoney,2020-11-01 10:22:12
"From $300,000 in Debt to Zero — How Real People Repaid Their Debts Fast",msnmoney,2020-11-01 10:22:12
Extreme living: tough homes at the end of the Earth,msnmoney,2020-11-01 10:22:12
What the Fed’s Major Strategic Change Means for You,msnmoney,2020-11-01 10:22:12
The Race for Texas’s Powerful Energy Regulator Is Heating Up,msnmoney,2020-11-01 10:22:12
25 Ways To Score a Good Deal on a Car Out of State,msnmoney,2020-11-01 10:22:12
COVID-19 is hitting minorities harder—here's how,msnmoney,2020-11-01 10:22:12
"How the Fed, working from home, prevented a US economic collapse",yahoofinance,2020-11-01 10:24:22
New Jersey’s pot referendum could be a game changer,yahoofinance,2020-11-01 10:24:22
"Investor on why bitcoin may hit $1M, top gold's market cap",yahoofinance,2020-11-01 10:24:22
Israel starts human trials of Covid vaccine as schools reopen,yahoofinance,2020-11-01 10:24:22
Biden author on the biggest misconception about the candidate,yahoofinance,2020-11-01 10:24:22
Influencers with Andy Serwer: Michael Corbat,yahoofinance,2020-11-01 10:24:22
"Starbucks, Dunkin' to close hundreds of stores",yahoofinance,2020-11-01 10:24:22
Analyst: Take open enrollment more seriously this year,yahoofinance,2020-11-01 10:24:22
Multi-asset investing for uncertain times,yahoofinance,2020-11-01 10:24:22
"The truth about Trump's tax cuts by the numbers, not by Biden: Andy Puzder",yahoofinance,2020-11-01 10:24:22
"I’m 52, won’t live past 80 and have $1.6 million. ‘I am tired of both the rat race and workplace politics.’ Should I retire?",yahoofinance,2020-11-01 10:24:22
"Dow Jones Futures: After Worst Week Since March, Don't Feed The Bears! Here's What To Do Now",yahoofinance,2020-11-01 10:24:22
Gold Price Predictions If Biden Or Trump Wins Presidency,yahoofinance,2020-11-01 10:24:22
"A Big Pension Bought AT&T, Ford, and PayPal Stock. Here’s What It Sold.",yahoofinance,2020-11-01 10:24:22
You can still claim Social Security spousal benefits — even if your spouse is gone,yahoofinance,2020-11-01 10:24:22
Investor: Bitcoin 'literally the biggest story I've seen',yahoofinance,2020-11-01 10:24:22
Suze Orman says don't ever make these money mistakes,yahoofinance,2020-11-01 10:24:22
6 of the Best Monthly Dividend Stocks to Fortify Your Portfolio,yahoofinance,2020-11-01 10:24:22
"Investors should brace for bumpy markets after the election, analysts say",yahoofinance,2020-11-01 10:24:22
The Newest Electric Car Stock Climbs On First Day Of Trading,yahoofinance,2020-11-01 10:24:22
25 Percent of Floater Fleet Could be Scrapped,yahoofinance,2020-11-01 10:24:22
"10 Stocks Turned $10,000 Into $449,652 In 10 Months",yahoofinance,2020-11-01 10:24:22
7 Penny Stocks With a ‘Strong Buy’ Rating,yahoofinance,2020-11-01 10:24:22
"Royal Dutch Shell, AbbVie, and 2 Other Companies That Boosted Their Dividends This Week",yahoofinance,2020-11-01 10:24:22
5 Stocks to Buy No Matter Who Wins the Election,yahoofinance,2020-11-01 10:24:22
European Countries Are Locking Down Again. These 21 Stocks Could Withstand Another Downturn.,yahoofinance,2020-11-01 10:24:22
"Alibaba Stock, JD.com Lead 5 Top China Internet Stocks To Watch This Week",yahoofinance,2020-11-01 10:24:22
Moderna Stock Will Jump in Value On Completing Covid-19 Vaccine Tests,yahoofinance,2020-11-01 10:24:22
These Are The 5 Best Stocks To Buy And Watch Now,yahoofinance,2020-11-01 10:24:22
"Visa and Mastercard have a lot in common, but COVID-19 puts one key difference in focus",yahoofinance,2020-11-01 10:24:22
"Last Week's Notable Insider Buys: IBM, Intel, Raytheon And More",yahoofinance,2020-11-01 10:24:22
Prospect of Biden winning could spur deal-making rush ahead of tax hikes,yahoofinance,2020-11-01 10:24:22
Fund Manager Nightmare Is Biden Without Blue Wave Congress,yahoofinance,2020-11-01 10:24:22
"I’m a 32-year-old stay-at-home mom, and my husband earns $150,000 a year. Will I ever be able to enjoy a retirement?",yahoofinance,2020-11-01 10:24:22
"Benzinga's Bulls And Bears Of The Week: FAANGS, Ford, Visa And More",yahoofinance,2020-11-01 10:24:22
"Google ad costs, not its alleged monopoly, irks businesses",yahoofinance,2020-11-01 10:24:22
India's Future Retail says Amazon dispute order not binding on company,yahoofinance,2020-11-01 10:24:22
"After Taking Intel Out, Is AMD About to Dethrone Nvidia? Analyst Weighs In",yahoofinance,2020-11-01 10:24:22
"China eases rules, widens US$222 billion inbound investment path, offering the renminbi as a safe haven against global volatility",yahoofinance,2020-11-01 10:24:22
Future Retail says Amazon dispute order not binding on company,yahoofinance,2020-11-01 10:24:22
"Canada turns on oil taps as prices rise, curbs lift",yahoofinance,2020-11-01 10:24:22
Retirement Savings Can Be Hard for Freelance Workers. Here’s How One Is Doing It.,yahoofinance,2020-11-01 10:24:22
7 Clean Energy Stocks To Watch Ahead Of The U.S. Election,yahoofinance,2020-11-01 10:24:22
Zambia's risk of default highlights Africa's debt crisis,yahoofinance,2020-11-01 10:24:22
Ex-Shell Manager Appointed Karoon CEO,yahoofinance,2020-11-01 10:24:22
Netflix is upping its prices -- what it means for streaming,yahoofinance,2020-11-01 10:24:22
Should You Buy Apple (AAPL) Stock?,yahoofinance,2020-11-01 10:24:22
3 Great Stocks to Buy on the Dip,yahoofinance,2020-11-01 10:24:22
"India's October gasoline, gasoil sales exceed pre-coronavirus levels",yahoofinance,2020-11-01 10:24:22
"The Crypto Daily – Movers and Shakers – November 1st, 2020",yahoofinance,2020-11-01 10:24:22
"A Huge Bank Sold Comcast, Barrick Gold, and Berkshire Hathaway Stock. Here’s What It Bought.",yahoofinance,2020-11-01 10:24:22
"Israel's Bezeq expects third-quarter write-down, raises 2020 profit outlook",yahoofinance,2020-11-01 10:24:22
4 Index Funds to Buy For a Diversified Portfolio,yahoofinance,2020-11-01 10:24:22
How to get the lowest 15-year mortgage rate for your refinance,yahoofinance,2020-11-01 10:24:22
"'Soul searching' led Under Armour to sell unit, refocus ",yahoofinance,2020-11-01 10:24:22
U.S. Stocks Have One of Their Worst Pre-Election Weeks Ever. What About Next Week?,yahoofinance,2020-11-01 10:24:22
How Large Option Traders Are Playing Twitter Following 20% Sell-Off,yahoofinance,2020-11-01 10:24:22
The Bottom Is in for These 3 Stocks? Analysts Say ‘Buy’,yahoofinance,2020-11-01 10:24:22
U.S Mortgage Rates Hold Steady Ahead of Next Week’s Presidential Election,yahoofinance,2020-11-01 10:24:22
"Does CDC Hint Of Cruise Resumption Make Carnival Stock A Buy Right Now? Here's What Earnings, Charts Show",yahoofinance,2020-11-01 10:24:22
This Challenged Gulf Nation Is Betting Big On Natural Gas,yahoofinance,2020-11-01 10:24:22
"The Week In Cannabis: Stocks Down, More Celebrity Moves, Earnings And Policy News",yahoofinance,2020-11-01 10:24:22
How Novavax Has a 2-Pronged Approach to Vaccine Sales,yahoofinance,2020-11-01 10:24:22
Exxon Pressed On Dividend As Huge Writedown Looms While Chevron Earnings Surprise,yahoofinance,2020-11-01 10:24:22
General Electric’s Stock Price Is Stuck. Here’s What It Will Take to Get It Rising Again.,yahoofinance,2020-11-01 10:24:22
Student loan payments will restart soon — here's how to prepare,yahoofinance,2020-11-01 10:24:22
"Psyched: St. Vincent OKs Psychedelics Program, Delic To Go Public, Field Trip Drug Update",yahoofinance,2020-11-01 10:24:22
You lost your job but found one that pays less. Here's how to make it work for you and your retirement plans,yahoofinance,2020-11-01 10:24:22
Netherlands puts KLM bailout on hold after pilots reject wage freeze,yahoofinance,2020-11-01 10:24:22
Is The World's Biggest Marijuana Stock A Buy As New Leaders Change Course?,yahoofinance,2020-11-01 10:24:22
Mortgage rates stick near record lows and deliver more savings,yahoofinance,2020-11-01 10:24:22
"Coronavirus update: U.S. counts almost 100,000 cases in new one-day record; The Lancet says Trump pandemic response is ‘disastrous’",yahoofinance,2020-11-01 10:24:22
"FedEx showcases autonomous tech, robotics helping its network as volume continues surge",yahoofinance,2020-11-01 10:24:22
These money and investing tips can help you keep politics separate from your portfolio,yahoofinance,2020-11-01 10:24:22
"An $8.8B Deal Puts Dunkin' Donuts Under Same Roof As Sonic, Jimmy John's",yahoofinance,2020-11-01 10:24:22
The Surveys Say: Americans Feel Anxious About Their Retirement Savings Amid Pandemic,yahoofinance,2020-11-01 10:24:22
"Op-ed: Predatory payday lending is getting worse, and Congress needs to act",yahoofinance,2020-11-01 10:24:22
"Mideast Stocks Slump on Lower Oil, U.S. Election Risk: Inside EM",yahoofinance,2020-11-01 10:24:22
The boom in US GDP does not match what’s happening to Americans’ wallets,yahoofinance,2020-11-01 10:24:22
"Nasdaq Hits Correction Mode, Dow Touches 200-Day Moving Average In Volatile Friday Trade",yahoofinance,2020-11-01 10:24:22
The moment of truth for stock-market investors? Election Day looms and the most crucial stretch of 2020 awaits,yahoofinance,2020-11-01 10:24:22
AMD Has Big Ambitions. Why That’s Becoming a Risk for the Stock.,yahoofinance,2020-11-01 10:24:22
Lordstown Motors: Can GM’s Old Plant Beat It?,yahoofinance,2020-11-01 10:24:22
Dunkin’ Brands Is Being Bought by Arby’s Owner in $11.3 Billion Deal,yahoofinance,2020-11-01 10:24:22
Is OFS Consolidation About to Take Off?,yahoofinance,2020-11-01 10:24:22
"China Should Take Part in Creating Global Regulatory Framework for Digital Currency, Xi Says",yahoofinance,2020-11-01 10:24:22
"Fintech Focus Roundup For October 31, 2020",yahoofinance,2020-11-01 10:24:22
Surging Libyan Oil Output Nears 1 Million Barrels a Day,yahoofinance,2020-11-01 10:24:22
Trying to find the most tax-friendly place to retire? It’s not so simple,yahoofinance,2020-11-01 10:24:22
$14K: Bitcoin Briefly Hits Highest Level Since January 2018,yahoofinance,2020-11-01 10:24:22
Cenovus and Husky in $24B Combination,yahoofinance,2020-11-01 10:24:22
3 Industrial Stocks to Watch if the U.S. Recovery Mimics China,yahoofinance,2020-11-01 10:24:22
"With No Cuts Left to Make, Big Oil Sits and Waits for a Recovery",yahoofinance,2020-11-01 10:24:22
Is stimulus still stimulus if people don’t spend it?,yahoofinance,2020-11-01 10:24:22
Spirit Airlines Analyst: Q4 Guidance 'Refreshingly Differentiated',yahoofinance,2020-11-01 10:24:22
What Credit Score Do You Need to Buy a House?,yahoofinance,2020-11-01 10:24:22
People are spending over three times more money ‘gambling’ on hot stocks than at casinos and on lottery tickets and sports betting,yahoofinance,2020-11-01 10:24:22
Mortgage holidays extended for up to six months,yahoofinance,2020-11-01 10:24:22
Trump-Biden Election Looms Large As Dow Jones Collapses,yahoofinance,2020-11-01 10:24:22
Puerto Rico debt restructuring hits snag in public clash,yahoofinance,2020-11-01 10:24:22
4 Tax Triggers New Investors Need to Know About,yahoofinance,2020-11-01 10:24:22
PDO Dishes Out $1B+ Contracts to GES,yahoofinance,2020-11-01 10:24:22
Fed Not Expected to Ramp Up Bond Buying This Year or Next,yahoofinance,2020-11-01 10:24:22
INX applies to list digital token on Canadian Securities Exchange,yahoofinance,2020-11-01 10:24:22
Videogames Are More Popular Than Ever. Here’s the Stock That Could Benefit Most,yahoofinance,2020-11-01 10:24:22
"Aurora Cannabis Forecasts Sales At High End, But Marijuana Stocks Fall",yahoofinance,2020-11-01 10:24:22
Exclusive: Goldman money funds' liquidity buffer swells before U.S. election,yahoofinance,2020-11-01 10:24:22
Bond Traders Face Whirlwind Week That’s Make-or-Break for 2020,yahoofinance,2020-11-01 10:24:22
Arby's and Buffalo Wild Wings owner buying Dunkin' Brands,yahoofinance,2020-11-01 10:24:22
Trump Trails Biden by 10 Points in National Poll,wsj,2020-11-01 10:26:43
The Only Wall Street Consensus Is the Election Will Be Felt for Years,wsj,2020-11-01 10:26:43
Trump Campaigns in Five States as Biden Concentrates on Pennsylvania,wsj,2020-11-01 10:26:43
"Airlines’ New Pricing Strategy: Buy One, Get One Free",wsj,2020-11-01 10:26:43
Companies Fret Over Pandemic Despite Rebound in Demand,wsj,2020-11-01 10:26:43
Staffing at Some Nursing Homes Plummeted During Early Outbreaks,wsj,2020-11-01 10:26:43
England Set for Limited Lockdown to Slow Coronavirus,wsj,2020-11-01 10:26:43
Tech Workers Take to the Mountains,wsj,2020-11-01 10:26:43
Joe Rogan’s Podcast Sparks Tensions Inside Spotify,wsj,2020-11-01 10:26:43
The New Rules for Networking,wsj,2020-11-01 10:26:43
Fed Turns Attention to Asset Purchases,wsj,2020-11-01 10:26:43
Health Care in Spotlight as ACA Enrollment Begins,wsj,2020-11-01 10:26:43
Photos of the Week,wsj,2020-11-01 10:26:43
Public-Health Experts Are Rewriting Pandemic Rules for Governments—and Their Gyms,wsj,2020-11-01 10:26:43
Ex-Inmates Struggle in a Banking System Not Made for Them,wsj,2020-11-01 10:26:43
Payments Companies Give Credit Where It’s Due—to Debit,wsj,2020-11-01 10:26:43
Cows Make Climate Change Worse. Could Seaweed Help?,wsj,2020-11-01 10:26:43
