headline,org,date
Oil Faces 'Significant Headwinds' Over Next Few Years: Analyst,thestreet,2021-01-31 10:21:44
XPeng Drops After Recall of Over Half of SUVs Delivered,thestreet,2021-01-31 10:21:44
What This Analyst Liked About Honeywell's Quarter,thestreet,2021-01-31 10:21:44
Why Investors Should Keep Earnings in Mind As Stocks Sell Off Friday,thestreet,2021-01-31 10:21:44
Schwab Says It Didn't Suspend Trading in Hot Stocks on Thursday,thestreet,2021-01-31 10:21:44
AztraZeneca Covid-19 Vaccine Gets EU Approval for Use in All Adults,thestreet,2021-01-31 10:21:44
Biogen Analysts Laud FDA Extension of Alzheimer's Drug Review,thestreet,2021-01-31 10:21:44
"Tesla Gets Second $1,000 Price Target, From Argus",thestreet,2021-01-31 10:21:44
American Airlines to Offer Up to $1.1 Billion of Stock,thestreet,2021-01-31 10:21:44
"Jim Cramer's Top Analyst on GameStop, Robinhood, J&J, Stock Market Friday",thestreet,2021-01-31 10:21:44
Cryptocurrency Exchange Coinbase to Join Direct IPO Club,thestreet,2021-01-31 10:21:44
Honeywell Beats on Strong Automation and PPE Sales,thestreet,2021-01-31 10:21:44
‘We Are Not in Another 1999-Like Tech Bubble’ - Dan Ives,thestreet,2021-01-31 10:21:44
How This Veteran Trader Understands GME 'Phenomenon',thestreet,2021-01-31 10:21:44
The GameStop short squeeze was 'the grand awakening': expert,googlenews,2021-01-31 10:24:05
WallStreetBets Founder Is 'Fascinated' Watching GameStop Frenzy From Sidelines,googlenews,2021-01-31 10:24:05
"Which Is the Best COVID Vaccine Stock: Pfizer, BioNTech, Moderna, Johnson & Johnson, or Novavax?",googlenews,2021-01-31 10:24:05
"GameStop mayhem hits close to home for co-founder's son, who's active on WallStreetBets",googlenews,2021-01-31 10:24:05
Amazon Faces Familiar Opponent in Alabama Union Election,googlenews,2021-01-31 10:24:05
Vaccines For Data: Israel's Pfizer Deal Drives Quick Rollout — And Privacy Worries,googlenews,2021-01-31 10:24:05
"Mets owner Steve Cohen leaves Twitter, citing threats and ""misinformation""",googlenews,2021-01-31 10:24:05
Robinhood CEO refutes 'conspiracy theory' that hedge funds prompted GameStop trading halt,googlenews,2021-01-31 10:24:05
"Trading Platform Company IG Group Joins In Halting Of New Trades in GameStop, AMC",googlenews,2021-01-31 10:24:05
"After Massive Dogecoin Crash, Ripple’s XRP Has Suddenly Rocketed Higher",googlenews,2021-01-31 10:24:05
NYC nursing home resident who was denied a vaccine dies of COVID-19,googlenews,2021-01-31 10:24:05
"Which Is the Best Covid Vaccine? Rivals Are Pfizer, Astra, Modern and Sputnik",googlenews,2021-01-31 10:24:05
Fresh data show toll South African virus variant takes on vaccine efficacy,googlenews,2021-01-31 10:24:05
EU to block vaccine exports amid AstraZeneca delivery spat | DW News,googlenews,2021-01-31 10:24:05
"As California virus cases fall, more people than ever dying",googlenews,2021-01-31 10:24:05
"After a wild week of stocks, you can’t stream most of the biggest Wall Street films",googlenews,2021-01-31 10:24:05
Biden's First U.S. Jobs Report to Show Challenge Ahead: Eco Week,googlenews,2021-01-31 10:24:05
Is the weakness of Bitcoin after the 'Elon Musk pump' hinting at a bull trap?,googlenews,2021-01-31 10:24:05
Three listed units of China's HNA disclose embezzlements of nearly $10 billion,googlenews,2021-01-31 10:24:05
"Don't share a photo of that COVID-19 vaccination card on social media, BBB warns",googlenews,2021-01-31 10:24:05
Moderna cuts COVID-19 vaccine shipments to Canada,googlenews,2021-01-31 10:24:05
People are sharing their vaccination cards on social media. Here's why you probably shouldn't,googlenews,2021-01-31 10:24:05
AMC: Enjoy Your Dilution,googlenews,2021-01-31 10:24:05
Jessica Simpson Weighs In On That Subway Tuna Controversy,googlenews,2021-01-31 10:24:05
"Man dies after COVID shot, but his family says to get the vaccine",googlenews,2021-01-31 10:24:05
Order Girl Scout cookies on GrubHub starting Monday,googlenews,2021-01-31 10:24:05
Tim Cook May Have Just Ended Facebook,googlenews,2021-01-31 10:24:05
"Robinhood, Reddit Protected From Lawsuits by User Agreement, Congress",googlenews,2021-01-31 10:24:05
"Virus Controls Put Damper on China's Holidays, Economic Recovery",googlenews,2021-01-31 10:24:05
Investors are using this app to automatically join the Robinhood class-action lawsuit amid GameStop chaos,googlenews,2021-01-31 10:24:05
"TEN 324 - Tesla's amazing Q4, GM, Nissan Pledge Carbon Neutrality, Faraday Future Back From the Dead",googlenews,2021-01-31 10:24:05
Jesse Watters: Sleepy Joe got woke,googlenews,2021-01-31 10:24:05
MDH: Vendor Erroneously Sent COVID-19 Vaccination Cancelation Messages,googlenews,2021-01-31 10:24:05
These 3 Red-Hot Stocks Could Plunge More than 50% -- If Wall Street's Right,googlenews,2021-01-31 10:24:05
BBB Warning: Don’t Post Your COVID Vaccine Card On Social Media,googlenews,2021-01-31 10:24:05
GM looks to sell only emission-free vehicles by 2035,googlenews,2021-01-31 10:24:05
Private Equity Firm Silver Lake Cashes In AMC Shares For A $113 Million Gain,googlenews,2021-01-31 10:24:05
Jim Chanos laments politicisation of ‘surreal’ GameStop saga,googlenews,2021-01-31 10:24:05
Elon Musk's SpaceX reportedly violated terms of FAA license,googlenews,2021-01-31 10:24:05
City gives hundreds of COVID-19 vaccinations Saturday at Union Station,googlenews,2021-01-31 10:24:05
SEC Says It Will Protect Retail Investors From 'Abusive' Activity in Wake of GameStop Frenzy,googlenews,2021-01-31 10:24:05
"Southwest Airlines Just Made a Long-Awaited Change, and It Looks Like the End of an Era",googlenews,2021-01-31 10:24:05
What's Working: What happened after the Colorado Dept. of Labor emailed 230000 people that federal benefits were restarting,googlenews,2021-01-31 10:24:05
Hyundai execs wary of Apple electric car partnership: Report - Business Insider,googlenews,2021-01-31 10:24:05
‘Like Wartime’: Canadian Companies Unite to Start Mass Virus Testing,googlenews,2021-01-31 10:24:05
Moderna to increase doses per vial as U.S. COVID-19 vaccination ramps up,googlenews,2021-01-31 10:24:05
WhatsApp Is Now Using Its Version of Stories to Convince Users It’s Committed to Their Privacy,googlenews,2021-01-31 10:24:05
How to access the full Play Store on the Chromecast with Google TV,googlenews,2021-01-31 10:24:05
Here’s how to get the COVID-19 vaccine at Fenway Park,googlenews,2021-01-31 10:24:05
Rep. Stephen Lynch tests positive for COVID-19 after getting second dose of vaccine,googlenews,2021-01-31 10:24:05
Toys R Us' last two stores in the U.S. are closed for good,googlenews,2021-01-31 10:24:05
"COVID-19 in South Dakota: 116 total new cases; Death toll rises to 1,775; Active cases at 2,894",googlenews,2021-01-31 10:24:05
4 questions to ask yourself before refinancing your mortgage,googlenews,2021-01-31 10:24:05
10-year-old San Antonio boy cashes in on GameStop stocks,googlenews,2021-01-31 10:24:05
Dog owner looking for GrubHub delivery driver caught on camera stealing their dog,googlenews,2021-01-31 10:24:05
GameStop curbs put clearing houses under the spotlight,googlenews,2021-01-31 10:24:05
You've heard about GameStop stocks soaring. Did you know a Brockton native was behind it?,googlenews,2021-01-31 10:24:05
"GameStop mayhem, Robinhood scandal, Musk tweets, DOGE explodes: Hodler's Digest",googlenews,2021-01-31 10:24:05
General Motors aims to be carbon neutral by 2040,googlenews,2021-01-31 10:24:05
How a High-Ranking Nissan Executive Escaped His Own Trap,googlenews,2021-01-31 10:24:05
American Airlines plans another $1 billion stock sale after big rally,googlenews,2021-01-31 10:24:05
Gambling addiction experts see familiar aspects in Robinhood app,googlenews,2021-01-31 10:24:05
Zuckerberg Hasn't Convinced Australia to Back Down From New Law,googlenews,2021-01-31 10:24:05
People are sharing their vaccination cards on social media. Why you probably shouldn’t do that,googlenews,2021-01-31 10:24:05
"Why Carnival, Royal Caribbean, and Norwegian Cruise Line Stocks All Sank Friday",googlenews,2021-01-31 10:24:05
How Reddit beat hedge funds using options strategy: Veteran trader,googlenews,2021-01-31 10:24:05
Hundreds get COVID-19 vaccine at clinic in Gig Harbor,googlenews,2021-01-31 10:24:05
"India plans to introduce law to ban Bitcoin, other private cryptocurrencies",googlenews,2021-01-31 10:24:05
South Carolina school principal Henry Darby works night shift at Walmart to help students,googlenews,2021-01-31 10:24:05
Russia may fine citizens for using SpaceX's Starlink internet. Here's how Elon Musk's service poses a threat to authoritarian regimes.,googlenews,2021-01-31 10:24:05
GameStop: what it reveals about the US stockmarket | The Economist,googlenews,2021-01-31 10:24:05
The Silicon Valley Start-Up That Caused Wall Street Chaos,googlenews,2021-01-31 10:24:05
An uprising against Wall Street? Hardly. GameStop was about the absurdity of the stock market,googlenews,2021-01-31 10:24:05
Potential regulations on hedge funds over GameStop frenzy is not prudent,googlenews,2021-01-31 10:24:05
Social media stocks dip amid GameStop-Reddit frenzy. Why two top names could fall further,googlenews,2021-01-31 10:24:05
Reddit WallStreetBets Founder Calls GameStop Stock Frenzy A 'Symbolic Movement',googlenews,2021-01-31 10:24:05
GameStop's stock surge and QAnon couldn't seem more different -- yet they have this trait in common,googlenews,2021-01-31 10:24:05
A year ago on Reddit I suggested investing in GameStop. But I never expected this,googlenews,2021-01-31 10:24:05
Dr. Fauci Calls Johnson & Johnson's COVID-19 Vaccine 'Good News' | TODAY,googlenews,2021-01-31 10:24:05
Moderna vaccine creator calls Johnson & Johnson's competing shot a 'darn good' tool to fight the pandemic,googlenews,2021-01-31 10:24:05
Coronavirus mutations add urgency to vaccination effort as experts warn of long battle ahead,googlenews,2021-01-31 10:24:05
Pros And Cons Of Johnson & Johnson's Covid Vaccine | The 11th Hour | MSNBC,googlenews,2021-01-31 10:24:05
"Ignore the Reddit-fueled spike, GameStop is actually still in trouble",googlenews,2021-01-31 10:24:05
How GameStop went from dying relic to 'meme stock' - Business Insider,googlenews,2021-01-31 10:24:05
"GameStop signals a new, destabilizing collision between social media and the real world",googlenews,2021-01-31 10:24:05
How One True GameStop Believer Scored Big After Years of Work,googlenews,2021-01-31 10:24:05
Israel Covid vaccine data shows extremely low rate of infections,googlenews,2021-01-31 10:24:05
The unlikely nation winning the coronavirus vaccine race,googlenews,2021-01-31 10:24:05
New York Mets owner Steve Cohen taking break from Twitter following threats tied to stock flurry,googlenews,2021-01-31 10:24:05
Hedge fund billionaire Steve Cohen leaves Twitter after family receives threats amid GameStop backlash,googlenews,2021-01-31 10:24:05
"Hedge fund billionaire, owner of Mets leaves Twitter, citing threats | Daily Sabah",googlenews,2021-01-31 10:24:05
Mets owner Steve Cohen leaves Twitter after threats,googlenews,2021-01-31 10:24:05
"What If WallStreetBets Wanted to Boost Good Companies Instead, Like Netflix or Amazon?",googlenews,2021-01-31 10:24:05
"Billionaire Ken Griffin faces controversy involving Wall Street chat rooms, Robinhood trading app and GameStop's stock",googlenews,2021-01-31 10:24:05
"Beware the little guy getting really, really angry. | Maria Panaritis",googlenews,2021-01-31 10:24:05
"In GameStop mania, there are no good guys or bad guys",googlenews,2021-01-31 10:24:05
How GameStop Frenzy Has Impacted The Stock Market | TODAY,googlenews,2021-01-31 10:24:05
"Dow Jones Futures: What To Do Before Monday's Stock Market Open; GME Stock, Nio In Focus",googlenews,2021-01-31 10:24:05
"Nokia Stock Is Serious, GameStop Stock Is a Game",googlenews,2021-01-31 10:24:05
Better Buy: Intel or All 30 Dow Jones Stocks?,googlenews,2021-01-31 10:24:05
XRP's Price Just Jumped 40%. Here's Why,googlenews,2021-01-31 10:24:05
Ripple demands to know why Ether isn't a security as XRP defense gets desperate By Cointelegraph,googlenews,2021-01-31 10:24:05
"Ethereum, Litecoin, and Ripple’s XRP – Daily Tech Analysis – January 30th, 2021",googlenews,2021-01-31 10:24:05
XRP price spikes as Ripple pushes back against SEC’s $1.3 billion lawsuit,googlenews,2021-01-31 10:24:05
COVID vaccine cancellation messages incorrectly sent to Minnesota seniors,googlenews,2021-01-31 10:24:05
FEMA is deploying or supporting vaccination sites in 11 states,googlenews,2021-01-31 10:24:05
Vaccines won’t end this COVID nightmare,googlenews,2021-01-31 10:24:05
Life after Covid: The people who will re-enter society last,googlenews,2021-01-31 10:24:05
Covid-19: Pfizer or Sputnik? The race to inject prompts calls for choice,googlenews,2021-01-31 10:24:05
Pfizer or Sputnik? Race to vaccinate prompts calls for choice,googlenews,2021-01-31 10:24:05
"The EU-AstraZeneca vaccine fight, explained",googlenews,2021-01-31 10:24:05
EU gives itself power to block coronavirus vaccine shipments to Australia | ABC News,googlenews,2021-01-31 10:24:05
EU leaders are indulging in vaccine rows the continent cannot afford,googlenews,2021-01-31 10:24:05
EU backtracks in UK shot export row as WHO warns against ‘vaccine nationalism’,googlenews,2021-01-31 10:24:05
"In California, COVID-19 deaths surge at record pace as cases decline",googlenews,2021-01-31 10:24:05
"One in 1,000 Californians have died from COVID-19 as California passes new milestone",googlenews,2021-01-31 10:24:05
"California Tops 40,000 COVID-19 Deaths; Fatalities Still High But Cases Continue Dropping",googlenews,2021-01-31 10:24:05
"COVID Has Now Killed 1 In 1,000 Californians",googlenews,2021-01-31 10:24:05
"Dogecoin and Bitcoin Crash as ""Elon Musk Effect"" Subsides",googlenews,2021-01-31 10:24:05
Analyst says Bitcoin price sell-off may occur as Chinese New Year approaches By Cointelegraph,googlenews,2021-01-31 10:24:05
Bitcoin price chart shows 'Elon Musk' pump was an outlier — So what happens now?,googlenews,2021-01-31 10:24:05
"Elon Musk Fires Up Shopify, CD Projekt With Twitter Blasts",googlenews,2021-01-31 10:24:05
Chinese travel conglomerate HNA Group faces bankruptcy – Business Traveller,googlenews,2021-01-31 10:24:05
Chinese conglomerate HNA goes bankrupt,googlenews,2021-01-31 10:24:05
Creditors seek bankruptcy of China's once high-flying HNA,googlenews,2021-01-31 10:24:05
Creditors seek bankruptcy for Avolon backer HNA,googlenews,2021-01-31 10:24:05
"Canada to quarantine travelers, suspend flights south",googlenews,2021-01-31 10:24:05
Canada's New Travel Restrictions Impacting Bay Area,googlenews,2021-01-31 10:24:05
Canada announces new COVID-19 travel precautions,googlenews,2021-01-31 10:24:05
Canada imposes more travel restrictions for COVID-19,googlenews,2021-01-31 10:24:05
The Reddit Army Bailout: Desperate Companies Get New Lifelines,googlenews,2021-01-31 10:24:05
'The trade of a lifetime': Silver Lake and Mudrick have reaped huge gains from their AMC investments as Reddit,googlenews,2021-01-31 10:24:05
Jessica Simpson reacts to Subway's lawsuit with hilarious joke about her infamous 2003 tuna mishap,googlenews,2021-01-31 10:24:05
Jessica Simpson reacts to Subway tuna lawsuit with epic response,googlenews,2021-01-31 10:24:05
The latest Subway lawsuit alleges there is no tuna in the tuna sub. Maybe it’s time for a Supreme Sandwich Court,googlenews,2021-01-31 10:24:05
"2 customers sue Subway, claiming tuna is 'anything but tuna'",googlenews,2021-01-31 10:24:05
Wake County to receive 3900 COVID-19 vaccine doses this week,googlenews,2021-01-31 10:24:05
What's the difference between all the Covid vaccines?,googlenews,2021-01-31 10:24:05
"No, The Vaccine Is Not The Virus! | SAYS In A Nutshell",googlenews,2021-01-31 10:24:05
UNIAN: EU welcomes allocation of 117000 doses of COVID-19 vaccine to Ukraine | KyivPost - Ukraine's Global Voice,googlenews,2021-01-31 10:24:05
Data Privacy is one of this century's top issues says Tim Cook (VIDEO),googlenews,2021-01-31 10:24:05
"iOS 14 still hasn’t delivered its most exciting features, and Apple knows it",googlenews,2021-01-31 10:24:05
"This Week in Apps: GameStop madness hits trading apps, Apple privacy changes, Clubhouse becomes a unicorn",googlenews,2021-01-31 10:24:05
Apple CEO & Zuckerberg fires shots at each other | Online privacy battle intensifies | Tim Cook,googlenews,2021-01-31 10:24:05
"China's factory activity, service sector growth are moderating",googlenews,2021-01-31 10:24:05
China’s New Covid-19 Outbreaks Trip Up Economic Momentum,googlenews,2021-01-31 10:24:05
"China's manufacturing, services sectors weaken in January",googlenews,2021-01-31 10:24:05
Growth in China's services sector slows in Jan - official PMI,googlenews,2021-01-31 10:24:05
"Analysis: Robinhood and Reddit protected from lawsuits by user agreement, Congress",googlenews,2021-01-31 10:24:05
Why Bitcoin [BTC] Could be Next GameStop [GME]?,googlenews,2021-01-31 10:24:05
Why GameStop matters to us all,googlenews,2021-01-31 10:24:05
GameStop Saga Gives Nightmares To Wall Street Powerhouses As Redditors Game The Market | CRUX,googlenews,2021-01-31 10:24:05
The New Tesla Model S Is Crazy In So Many Ways,googlenews,2021-01-31 10:24:05
Don't Fall for Elon Musk's Self-Driving Car Fallacy,googlenews,2021-01-31 10:24:05
"Diesel pickup sales; GM fuel cells; Tesla Roadster, Semi, Model S Plaid updates: The Week In Reverse",googlenews,2021-01-31 10:24:05
Should Tesla Try To Acquire Ford Or GM In 2021?,googlenews,2021-01-31 10:24:05
"COVID In Minnesota: MDH Reports 1,087 New Cases, 19 More Deaths",googlenews,2021-01-31 10:24:05
This big Wall Street player made out like a bandit on AMC stock,googlenews,2021-01-31 10:24:05
Silver Lake cashes out on AMC for $713 million after Reddit-fueled rally,googlenews,2021-01-31 10:24:05
AMC backer Silver Lake sells shares for $113 million profit amid surge - Business Insider,googlenews,2021-01-31 10:24:05
AMC Stock Roars Back As GameStop Frenzy Resumes; Silver Lake Sells Entire Stake On Runup – Update,googlenews,2021-01-31 10:24:05
A Reddit Army Descends on Hedge Funds Chained by Risk Models,googlenews,2021-01-31 10:24:05
Women Investing GME AMC Stocks - Women on Subreddit r/wallstreetbets,googlenews,2021-01-31 10:24:05
The game that hedge funds want to stop,googlenews,2021-01-31 10:24:05
Retail Investors vs. Hedge Fund: What Should You Do?,googlenews,2021-01-31 10:24:05
Musk's SpaceX violated its launch license in explosive Starship test: the Verge,googlenews,2021-01-31 10:24:05
Musk's SpaceX violated its launch license in explosive Starship test: The Verge,googlenews,2021-01-31 10:24:05
I Agree With Elon: The FAA Doesn’t Do New Things Very Well,googlenews,2021-01-31 10:24:05
SpaceX Starship launch reportedly violated an FAA license,googlenews,2021-01-31 10:24:05
St. Louis City vaccinates nearly 4000 people in three days,googlenews,2021-01-31 10:24:05
Photos: City holds first public vaccination event at Union Station,googlenews,2021-01-31 10:24:05
"St. Louis City vaccinates nearly 4,000 people",googlenews,2021-01-31 10:24:05
Oregon will cut certain extended jobless benefits due to lower unemployment rates,googlenews,2021-01-31 10:24:05
Oregon's declining jobless rate means shift in extended unemployment benefits,googlenews,2021-01-31 10:24:05
Oregon's extended benefits end due to dropping unemployment rates,googlenews,2021-01-31 10:24:05
"After month of delays, Michigan unemployment agency says jobless can certify this weekend",googlenews,2021-01-31 10:24:05
Hyundai said to be 'agonizing' over Apple's electric car,googlenews,2021-01-31 10:24:05
Hyundai executives are reportedly split over Apple Car manufacturing partnership - GSMArena.com news,googlenews,2021-01-31 10:24:05
Hyundai executives 'divided' over Apple Car partnership,googlenews,2021-01-31 10:24:05
Hyundai said to be 'agonizing' over Apple's electric car,googlenews,2021-01-31 10:24:05
Moderna asks FDA to approve more doses per COVID vaccine vial: reports - Business Insider,googlenews,2021-01-31 10:24:05
"Kentucky seeing increase in COVID-19 vaccine distribution, officials say",googlenews,2021-01-31 10:24:05
"Moderna asks FDA to authorize 5 additional doses per Covid vaccine vial to speed distribution, source tells CNBC",googlenews,2021-01-31 10:24:05
Jim Cramer weighs in on Johnson & Johnson's Covid-19 vaccine trial results,googlenews,2021-01-31 10:24:05
WhatsApp is using Status messages—its version of Stories— to try to reassure users about privacy,googlenews,2021-01-31 10:24:05
WhatsApp desperately wants you to know that it's committed to your privacy,googlenews,2021-01-31 10:24:05
WhatsApp tries to ease users’ privacy fears with Status messages,googlenews,2021-01-31 10:24:05
Why Are People Suddenly Looking for WhatsApp Alternatives?,googlenews,2021-01-31 10:24:05
"Google Play bans open-source Matrix client Element, citing “abusive content”",googlenews,2021-01-31 10:24:05
Five Trading Apps That Are Not Robinhood,googlenews,2021-01-31 10:24:05
Google Play Store will soon let Android users download gambling apps,googlenews,2021-01-31 10:24:05
Google pulls Element's Android chat app over content it doesn't control,googlenews,2021-01-31 10:24:05
"North Dakota reports 105 new COVID-19 cases, hospitalizations, active cases dip",googlenews,2021-01-31 10:24:05
"South Dakota reports 7 deaths, 116 new cases",googlenews,2021-01-31 10:24:05
The call for volunteers,googlenews,2021-01-31 10:24:05
"105 new Covid cases, 3 more deaths in North Dakota",googlenews,2021-01-31 10:24:05
"Today's mortgage and refinance rates: January 30, 2021 | Rates decrease",googlenews,2021-01-31 10:24:05
U.S Mortgage Rates Fall for a 2nd Consecutive Week Supporting Demand,googlenews,2021-01-31 10:24:05
Will Joe Biden cause mortgage rates to rise? See what experts say,googlenews,2021-01-31 10:24:05
"Today's mortgage and refinance rates: January 31, 2021 | Rates drop",googlenews,2021-01-31 10:24:05
"A 10-Year-Old GameStop Investor Cashed In. His Return? Over 5,000%",googlenews,2021-01-31 10:24:05
A 10-year-old investor made big bucks on the GameStop shares he got for Kwanzaa,googlenews,2021-01-31 10:24:05
10-year-old investor from San Antonio cashes in on GameStop stock rise,googlenews,2021-01-31 10:24:05
Texas fifth-grader cashes in GameStop stock his mom gave him 2 years ago,googlenews,2021-01-31 10:24:05
"Pizza delivery driver steals dog, owner says",googlenews,2021-01-31 10:24:05
Family: Dog stolen by Grubhub driver from Jax Beach home,googlenews,2021-01-31 10:24:05
"Grubhub driver accused of stealing dog arrested by Jacksonville Beach police, police find dog inside man's home",googlenews,2021-01-31 10:24:05
Roaring Kitty Wanted to Break a 4-Minute Mile. He Broke Wall Street Instead.,googlenews,2021-01-31 10:24:05
"Meet Keith Gill, the man who drove the GameStop Reddit mania and made millions",googlenews,2021-01-31 10:24:05
How a guy in his basement helped fuel the GameStop frenzy,googlenews,2021-01-31 10:24:05
GameStop Promoter Keith Gill Was No “Amateur” Trader; He Held Sophisticated Trading Licenses and Worked in the Finance Industry,googlenews,2021-01-31 10:24:05
"GM To Axe Gas Vehicles By 2035, Become Carbon Neutral By 2040",googlenews,2021-01-31 10:24:05
General Motors to eliminate gas powered production,googlenews,2021-01-31 10:24:05
General Motors to go emissions-free by 2035 | Auto-news – Gulf News,googlenews,2021-01-31 10:24:05
General Motors Aims to Be Carbon Neutral by 2040 | Chief Investment Officer,googlenews,2021-01-31 10:24:05
Nissan exec says legal fears led to Carlos Ghosn flip,googlenews,2021-01-31 10:24:05
Carlos Ghosn's reign is detailed and dissected in a Tokyo courtroom,googlenews,2021-01-31 10:24:05
From trusted Ghosn adviser to nemesis: High-powered Nissan executive Hari Nada’s great escape,googlenews,2021-01-31 10:24:05
Judge OKs extradition of 2 wanted in ex-Nissan boss' escape,googlenews,2021-01-31 10:24:05
"If shares of American get the GameStop treatment, what does that mean for the airline?",googlenews,2021-01-31 10:24:05
American Airlines set to issue $1B in new stock after price run-up,googlenews,2021-01-31 10:24:05
Why Airline Shares Fell Today,googlenews,2021-01-31 10:24:05
American Airlines set to issue new stock after price run-up,googlenews,2021-01-31 10:24:05
"With GameStop, Robinhood broke the biggest rule of branding",googlenews,2021-01-31 10:24:05
"Robinhood faces lawsuits after restricting trading on some stocks, as politicians demand answers",googlenews,2021-01-31 10:24:05
Robinhood to ease trading restrictions Friday morning,googlenews,2021-01-31 10:24:05
Zuckerberg lobbies Josh Frydenberg over plan to force Facebook and Google to pay for news content,googlenews,2021-01-31 10:24:05
Facebook’s Mark Zuckerberg hasn’t convinced Australia pull back new law,googlenews,2021-01-31 10:24:05
Australia snafu shows need for clarity on U.S. digital policy,googlenews,2021-01-31 10:24:05
Mark Zuckerberg hasn’t convinced Australia to back down from new law,googlenews,2021-01-31 10:24:05
"PortMiami And Carnival Cruise Line Break Ground On Terminal F, Future Home Of Carnival Celebration",googlenews,2021-01-31 10:24:05
Carnival Cruise Line Breaks Ground on New Miami Terminal,googlenews,2021-01-31 10:24:05
"PortMiami breaks ground for the 'fun terminal,' Carnival's F",googlenews,2021-01-31 10:24:05
Work Begins on Expanding Carnival's Terminal F in Miami,googlenews,2021-01-31 10:24:05
Pierce County error forces COVID-19 vaccine appointment cancelations,googlenews,2021-01-31 10:24:05
Pierce County closing in on 400 deaths from COVID-19 since the start of outbreak,googlenews,2021-01-31 10:24:05
Pierce County reports 204 new COVID-19 cases on Saturday,googlenews,2021-01-31 10:24:05
Bitcoin could be like the FAANG stocks for the next decade - but it will take more than the buy-in of the..,googlenews,2021-01-31 10:24:05
EUR/USD to Shrug Off Any Hints of an ECB Interest Rate Cut,googlenews,2021-01-31 10:24:05
