headline,org,date
"Dow Futures Gain, Dollar Retreats As Markets Track On-Again, Off-Again Stimulus Talks",msnmoney,2020-10-09 09:25:58
30 Greatest Threats to Your Retirement,msnmoney,2020-10-09 09:25:58
This Checkout Hack Can Drop Your Home Depot Total Instantly,msnmoney,2020-10-09 09:25:58
"Microsoft will reportedly allow its 150,000 employees to work from home permanently, the latest tech giant to do so",msnmoney,2020-10-09 09:25:58
25 Experts’ Predictions on When We Will Bounce Back From COVID-19,msnmoney,2020-10-09 09:25:58
19 Brilliant Ways To Supplement Social Security That Many Don't Know,msnmoney,2020-10-09 09:25:58
Four charts can explain the small-cap surge and signal what investors should do,msnmoney,2020-10-09 09:25:58
The best and worst things to buy at the dollar store,msnmoney,2020-10-09 09:25:58
4 Reasons Over-Reliance on Social Security Is a Recipe for Disaster,msnmoney,2020-10-09 09:25:58
Grandma Uses Trick To Turn Dusty House Into Fresh Air Paradise,msnmoney,2020-10-09 09:25:58
"Not Just Amazon: Prime Day Deals From Walmart, Target, and More",msnmoney,2020-10-09 09:25:58
Quicken Loans Urges Homeowners To Switch To A 15-Year Fixed,msnmoney,2020-10-09 09:25:58
"Census Bureau says it’s complying with order to keep counting, but complaints continue to pile up from workers",msnmoney,2020-10-09 09:25:58
26 States That Do Not Tax Social Security Income,msnmoney,2020-10-09 09:25:58
"Here Are Today’s Best Mortgage & Refinance Rates for October 9, 2020",msnmoney,2020-10-09 09:25:58
15 ways to check 'Make more money' off your weekend to-do list,msnmoney,2020-10-09 09:25:58
Opinion: Value stocks are poised to crush growth stocks after the presidential election,msnmoney,2020-10-09 09:25:58
23 New Gadgets That Could Be Gone Before the Holidays,msnmoney,2020-10-09 09:25:58
Don’t Make These 6 Medicare Plan Mistakes,msnmoney,2020-10-09 09:25:58
How to request a credit line increase with Wells Fargo,msnmoney,2020-10-09 09:25:58
"50 company logos, then and now",msnmoney,2020-10-09 09:25:58
Ugandan Court Declares Syndicated Loan Illegal in Shock Ruling,msnmoney,2020-10-09 09:25:58
Household products that are a complete waste of money,msnmoney,2020-10-09 09:25:58
Roofer: I Use This ‘Trick’ To Keep My Gutters Clean at ALL Times,msnmoney,2020-10-09 09:25:58
Coronavirus mortgage bailouts fall below 3 million in pandemic's sharpest decline,msnmoney,2020-10-09 09:25:58
Why Tesla and Amazon Stock Prices Are Skyrocketing and Google and Facebook Are Nosediving,msnmoney,2020-10-09 09:25:58
5 things to know before the stock market opens Friday,msnmoney,2020-10-09 09:25:58
Trump's latest miracle drug and 12 controversial Covid-19 price hikes,msnmoney,2020-10-09 09:25:58
5 ways to achieve financial security,msnmoney,2020-10-09 09:25:58
19 Brilliant Ways To Supplement Social Security That Many Don't Know,msnmoney,2020-10-09 09:25:58
See How Much Americans Are Spending on Takeout Amid the Pandemic,msnmoney,2020-10-09 09:25:58
Millennials Embrace Baby Boom Icon Folgers Coffee,msnmoney,2020-10-09 09:25:58
A history of disastrous product launches,msnmoney,2020-10-09 09:25:58
Here's how to 'lock' your credit report,msnmoney,2020-10-09 09:25:58
Most Expensive States To Get a Speeding Ticket — and the Car Models That Get the Most,msnmoney,2020-10-09 09:25:58
Refinance rates from 2.25% APR (15yrs). Do you qualify?,msnmoney,2020-10-09 09:25:58
What to expect from Amazon Prime Day this year,msnmoney,2020-10-09 09:25:58
Paying for Amazon Prime? Don't miss these hidden perks,msnmoney,2020-10-09 09:25:58
Yelp says it will now warn users about businesses accused of racism,msnmoney,2020-10-09 09:25:58
30 Best Jobs If You Want To Retire Early,msnmoney,2020-10-09 09:25:58
"Pipeline Billionaire Follows Playbook, Stepping Down But Staying",msnmoney,2020-10-09 09:25:58
25 Celeb Couples We Totally Forgot Were Married,msnmoney,2020-10-09 09:25:58
Best and Worst States to Be Poor in America,msnmoney,2020-10-09 09:25:58
"LSE Seals $5 Billion Borsa Sale to Euronext, Italian Banks",msnmoney,2020-10-09 09:25:58
20 highest- and lowest-paying jobs in healthcare,msnmoney,2020-10-09 09:25:58
Ask Bankrate: Saving for a down payment. Where should I keep my money?,msnmoney,2020-10-09 09:25:58
The most practical financial tips from past challenging times,msnmoney,2020-10-09 09:25:58
This Is The Present Everybody Talks About,msnmoney,2020-10-09 09:25:58
Op-ed: These targeted tax credits would help fuel growth,msnmoney,2020-10-09 09:25:58
15 Work Conversations That Could Cost You Your Job,msnmoney,2020-10-09 09:25:58
How employee ratings can push companies on diversity and inclusion,msnmoney,2020-10-09 09:25:58
30 Places in America That Are Getting Poorer,msnmoney,2020-10-09 09:25:58
"Honda Beefs Up Pickup, SUVs to Bolster Light-Truck Market Share",msnmoney,2020-10-09 09:25:58
 [Pics] You Cant Fix Stupid But you Can Laugh At It,msnmoney,2020-10-09 09:25:58
14 Important Reverse Mortgage Facts,msnmoney,2020-10-09 09:25:58
Things I Wish I Knew Before Selling My First Home,msnmoney,2020-10-09 09:25:58
The 10 Best-Paying Jobs That Don’t Require an Advanced Degree,msnmoney,2020-10-09 09:25:58
Apple Prepares to Launch 5G iPhones Into Unready U.S. Market,msnmoney,2020-10-09 09:25:58
Where Your Car Is Most Likely to Be Stolen in Every State,msnmoney,2020-10-09 09:25:58
Why Gazprom’s $7.6 Billion Polish Fine Is Just the Start,msnmoney,2020-10-09 09:25:58
Drone Captures What No One Was Supposed To See,msnmoney,2020-10-09 09:25:58
Everyday words that are actually brand names,msnmoney,2020-10-09 09:25:58
10 Things That Can Ding Your Social Security Payments,msnmoney,2020-10-09 09:25:58
These States Have the Best Chance To Bounce Back From the Coronavirus Unemployment Tsunami,msnmoney,2020-10-09 09:25:58
Evergrande’s $21 Billion Sales Blitz Fails to Impress,msnmoney,2020-10-09 09:25:58
"Grubhub, Postmates and the Biggest Startup Acquisitions of 2020",msnmoney,2020-10-09 09:25:58
Are There Jobs That Let You Set Your Own Hours?,msnmoney,2020-10-09 09:25:58
17 Dubai Photos That Will Definitely Make You Think Twice About Visiting,msnmoney,2020-10-09 09:25:58
"Best Cities To Retire on a Budget of $1,500 a Month",msnmoney,2020-10-09 09:25:58
Ant’s IPO Runs Low on Time to Avoid U.S. Election Turbulence,msnmoney,2020-10-09 09:25:58
25 Tried-and-True Jobs That Will Last Through Any Recession,msnmoney,2020-10-09 09:25:58
15 Jobs That Will Shrink the Fastest Over the Next Decade,msnmoney,2020-10-09 09:25:58
40 Money Habits That Can Leave You Broke,msnmoney,2020-10-09 09:25:58
AMD Is Said in Talks to Buy Rival Xilinx in $30 Billion Deal,msnmoney,2020-10-09 09:25:58
Washington: 2 or More Hernia Surgeries After 2006?,msnmoney,2020-10-09 09:25:58
12 Crucial Money Tips for Every Phase of Your Financial Life,msnmoney,2020-10-09 09:25:58
Banner Life Insurance Review 2020,msnmoney,2020-10-09 09:25:58
"Thanks to Coronavirus, Auto Theft Is Rampant — Here’s How To Protect Yourself",msnmoney,2020-10-09 09:25:58
"South African Stocks Climb as AngloGold, Gold Fields Lead Gains",msnmoney,2020-10-09 09:25:58
The 7 Fastest Ways to Catch Up on Retirement Savings,msnmoney,2020-10-09 09:25:58
"5 at 5: Your Daily Digest for Real Estate Investing, 10/08/2020",msnmoney,2020-10-09 09:25:58
"Dow Futures Gain, Dollar Retreats As Markets Track On-Again, Off-Again Stimulus Talks",msnmoney,2020-10-09 09:25:58
30 Greatest Threats to Your Retirement,msnmoney,2020-10-09 09:25:58
This Checkout Hack Can Drop Your Home Depot Total Instantly,msnmoney,2020-10-09 09:25:58
"Microsoft will reportedly allow its 150,000 employees to work from home permanently, the latest tech giant to do so",msnmoney,2020-10-09 09:25:58
25 Experts’ Predictions on When We Will Bounce Back From COVID-19,msnmoney,2020-10-09 09:25:58
19 Brilliant Ways To Supplement Social Security That Many Don't Know,msnmoney,2020-10-09 09:25:58
Four charts can explain the small-cap surge and signal what investors should do,msnmoney,2020-10-09 09:25:58
The best and worst things to buy at the dollar store,msnmoney,2020-10-09 09:25:58
4 Reasons Over-Reliance on Social Security Is a Recipe for Disaster,msnmoney,2020-10-09 09:25:58
Grandma Uses Trick To Turn Dusty House Into Fresh Air Paradise,msnmoney,2020-10-09 09:25:58
"Not Just Amazon: Prime Day Deals From Walmart, Target, and More",msnmoney,2020-10-09 09:25:58
Quicken Loans Urges Homeowners To Switch To A 15-Year Fixed,msnmoney,2020-10-09 09:25:58
"Census Bureau says it’s complying with order to keep counting, but complaints continue to pile up from workers",msnmoney,2020-10-09 09:25:58
26 States That Do Not Tax Social Security Income,msnmoney,2020-10-09 09:25:58
"Here Are Today’s Best Mortgage & Refinance Rates for October 9, 2020",msnmoney,2020-10-09 09:25:58
15 ways to check 'Make more money' off your weekend to-do list,msnmoney,2020-10-09 09:25:58
Opinion: Value stocks are poised to crush growth stocks after the presidential election,msnmoney,2020-10-09 09:25:58
23 New Gadgets That Could Be Gone Before the Holidays,msnmoney,2020-10-09 09:25:58
Don’t Make These 6 Medicare Plan Mistakes,msnmoney,2020-10-09 09:25:58
How to request a credit line increase with Wells Fargo,msnmoney,2020-10-09 09:25:58
"50 company logos, then and now",msnmoney,2020-10-09 09:25:58
Ugandan Court Declares Syndicated Loan Illegal in Shock Ruling,msnmoney,2020-10-09 09:25:58
Household products that are a complete waste of money,msnmoney,2020-10-09 09:25:58
Roofer: I Use This ‘Trick’ To Keep My Gutters Clean at ALL Times,msnmoney,2020-10-09 09:25:58
Coronavirus mortgage bailouts fall below 3 million in pandemic's sharpest decline,msnmoney,2020-10-09 09:25:58
Why Tesla and Amazon Stock Prices Are Skyrocketing and Google and Facebook Are Nosediving,msnmoney,2020-10-09 09:25:58
5 things to know before the stock market opens Friday,msnmoney,2020-10-09 09:25:58
Trump's latest miracle drug and 12 controversial Covid-19 price hikes,msnmoney,2020-10-09 09:25:58
5 ways to achieve financial security,msnmoney,2020-10-09 09:25:58
19 Brilliant Ways To Supplement Social Security That Many Don't Know,msnmoney,2020-10-09 09:25:58
See How Much Americans Are Spending on Takeout Amid the Pandemic,msnmoney,2020-10-09 09:25:58
Millennials Embrace Baby Boom Icon Folgers Coffee,msnmoney,2020-10-09 09:25:58
A history of disastrous product launches,msnmoney,2020-10-09 09:25:58
Here's how to 'lock' your credit report,msnmoney,2020-10-09 09:25:58
Most Expensive States To Get a Speeding Ticket — and the Car Models That Get the Most,msnmoney,2020-10-09 09:25:58
Refinance rates from 2.25% APR (15yrs). Do you qualify?,msnmoney,2020-10-09 09:25:58
What to expect from Amazon Prime Day this year,msnmoney,2020-10-09 09:25:58
Paying for Amazon Prime? Don't miss these hidden perks,msnmoney,2020-10-09 09:25:58
Yelp says it will now warn users about businesses accused of racism,msnmoney,2020-10-09 09:25:58
30 Best Jobs If You Want To Retire Early,msnmoney,2020-10-09 09:25:58
"Pipeline Billionaire Follows Playbook, Stepping Down But Staying",msnmoney,2020-10-09 09:25:58
25 Celeb Couples We Totally Forgot Were Married,msnmoney,2020-10-09 09:25:58
Best and Worst States to Be Poor in America,msnmoney,2020-10-09 09:25:58
"LSE Seals $5 Billion Borsa Sale to Euronext, Italian Banks",msnmoney,2020-10-09 09:25:58
20 highest- and lowest-paying jobs in healthcare,msnmoney,2020-10-09 09:25:58
Ask Bankrate: Saving for a down payment. Where should I keep my money?,msnmoney,2020-10-09 09:25:58
The most practical financial tips from past challenging times,msnmoney,2020-10-09 09:25:58
This Is The Present Everybody Talks About,msnmoney,2020-10-09 09:25:58
Op-ed: These targeted tax credits would help fuel growth,msnmoney,2020-10-09 09:25:58
15 Work Conversations That Could Cost You Your Job,msnmoney,2020-10-09 09:25:58
How employee ratings can push companies on diversity and inclusion,msnmoney,2020-10-09 09:25:58
30 Places in America That Are Getting Poorer,msnmoney,2020-10-09 09:25:58
"Honda Beefs Up Pickup, SUVs to Bolster Light-Truck Market Share",msnmoney,2020-10-09 09:25:58
 [Pics] You Cant Fix Stupid But you Can Laugh At It,msnmoney,2020-10-09 09:25:58
14 Important Reverse Mortgage Facts,msnmoney,2020-10-09 09:25:58
Things I Wish I Knew Before Selling My First Home,msnmoney,2020-10-09 09:25:58
The 10 Best-Paying Jobs That Don’t Require an Advanced Degree,msnmoney,2020-10-09 09:25:58
Apple Prepares to Launch 5G iPhones Into Unready U.S. Market,msnmoney,2020-10-09 09:25:58
Where Your Car Is Most Likely to Be Stolen in Every State,msnmoney,2020-10-09 09:25:58
Why Gazprom’s $7.6 Billion Polish Fine Is Just the Start,msnmoney,2020-10-09 09:25:58
Drone Captures What No One Was Supposed To See,msnmoney,2020-10-09 09:25:58
Everyday words that are actually brand names,msnmoney,2020-10-09 09:25:58
10 Things That Can Ding Your Social Security Payments,msnmoney,2020-10-09 09:25:58
These States Have the Best Chance To Bounce Back From the Coronavirus Unemployment Tsunami,msnmoney,2020-10-09 09:25:58
Evergrande’s $21 Billion Sales Blitz Fails to Impress,msnmoney,2020-10-09 09:25:58
"Grubhub, Postmates and the Biggest Startup Acquisitions of 2020",msnmoney,2020-10-09 09:25:58
Are There Jobs That Let You Set Your Own Hours?,msnmoney,2020-10-09 09:25:58
17 Dubai Photos That Will Definitely Make You Think Twice About Visiting,msnmoney,2020-10-09 09:25:58
"Best Cities To Retire on a Budget of $1,500 a Month",msnmoney,2020-10-09 09:25:58
Ant’s IPO Runs Low on Time to Avoid U.S. Election Turbulence,msnmoney,2020-10-09 09:25:58
25 Tried-and-True Jobs That Will Last Through Any Recession,msnmoney,2020-10-09 09:25:58
15 Jobs That Will Shrink the Fastest Over the Next Decade,msnmoney,2020-10-09 09:25:58
40 Money Habits That Can Leave You Broke,msnmoney,2020-10-09 09:25:58
AMD Is Said in Talks to Buy Rival Xilinx in $30 Billion Deal,msnmoney,2020-10-09 09:25:58
Washington: 2 or More Hernia Surgeries After 2006?,msnmoney,2020-10-09 09:25:58
12 Crucial Money Tips for Every Phase of Your Financial Life,msnmoney,2020-10-09 09:25:58
Banner Life Insurance Review 2020,msnmoney,2020-10-09 09:25:58
"Thanks to Coronavirus, Auto Theft Is Rampant — Here’s How To Protect Yourself",msnmoney,2020-10-09 09:25:58
"South African Stocks Climb as AngloGold, Gold Fields Lead Gains",msnmoney,2020-10-09 09:25:58
The 7 Fastest Ways to Catch Up on Retirement Savings,msnmoney,2020-10-09 09:25:58
"5 at 5: Your Daily Digest for Real Estate Investing, 10/08/2020",msnmoney,2020-10-09 09:25:58
Stock futures extend gains with stimulus prospects in focus,yahoofinance,2020-10-09 09:38:29
There are two U.S. labor markets,yahoofinance,2020-10-09 09:38:29
The gov't 'is AWOL’ on student loan protections: Calif AG,yahoofinance,2020-10-09 09:38:29
Fed's Evans: Fed can 'provide more accommodation' with QE,yahoofinance,2020-10-09 09:38:29
Donald Trump’s presidency is like being ‘stuck in an acid trip’: Kurt Andersen,yahoofinance,2020-10-09 09:38:29
Yahoo Finance Presents: Chicago Fed Bank Pres. Charles Evans,yahoofinance,2020-10-09 09:38:29
Americans OK with higher taxes – with conditions,yahoofinance,2020-10-09 09:38:29
"Podcast: Groundhogs Day in markets, IBM, Apple news",yahoofinance,2020-10-09 09:38:29
Multi-asset investing for uncertain times,yahoofinance,2020-10-09 09:38:29
Millennials Make Tons Of Money On Their New Favorite Stock,yahoofinance,2020-10-09 09:38:29
"Jim Cramer: Here Are 2 Oil Trades to Consider, Otherwise You're on Your Own",yahoofinance,2020-10-09 09:38:29
Bank of America's 8 Best Stocks to Buy in Q4,yahoofinance,2020-10-09 09:38:29
Value stocks are poised to crush growth stocks after the presidential election,yahoofinance,2020-10-09 09:38:29
Dow Jones Futures Rise As Trump Reportedly Wants 'Big Deal' On Stimulus Again; Alibaba Leads Three Breakouts,yahoofinance,2020-10-09 09:38:29
Trump steel tariffs bring job losses to swing state Michigan,yahoofinance,2020-10-09 09:38:29
Xilinx Shares Surge on Reports of $30 Billion AMD Takeover,yahoofinance,2020-10-09 09:38:29
Think your nest egg is safe sitting in cash? Think again — billionaire investor explains where some of that money should go instead,yahoofinance,2020-10-09 09:38:29
What the Harvard endowment’s below-average grade can teach you about index funds and your investments,yahoofinance,2020-10-09 09:38:29
"AMD's stock sinks, Xilinx soars after WSJ report of advanced merger talks",yahoofinance,2020-10-09 09:38:29
General Electric Shares Jump After Goldman Sachs Resumes Coverage With 'Buy' Rating,yahoofinance,2020-10-09 09:38:29
Raymond James Predicts Over 100% Rally for These 3 Stocks,yahoofinance,2020-10-09 09:38:29
You can still claim Social Security spousal benefits — even if your spouse is gone,yahoofinance,2020-10-09 09:38:29
FuelCell Energy's stock surges toward a 4-day win streak after DOE project award,yahoofinance,2020-10-09 09:38:29
3 Tech Stocks In Berkshire Hathaway's Portfolio,yahoofinance,2020-10-09 09:38:29
Biden’s worst tax idea,yahoofinance,2020-10-09 09:38:29
"AMD, Xilinx, Trump and Stimulus - 5 Things You Must Know Friday",yahoofinance,2020-10-09 09:38:29
Workhorse Short Seller Says USPS Bid Unlikely To Pan Out,yahoofinance,2020-10-09 09:38:29
You might still get a 2nd stimulus check — here's the possible timing,yahoofinance,2020-10-09 09:38:29
Warren Buffett says this is the way you get through COVID financially,yahoofinance,2020-10-09 09:38:29
JPMorgan and 5 Other Big Banks Report Earnings Next Week. Here’s What to Expect.,yahoofinance,2020-10-09 09:38:29
Bill Ackman Gives Further Clues on Potential Targets for His SPAC,yahoofinance,2020-10-09 09:38:29
Weed stocks surge as Kamala Harris vows to decriminalize pot in debate,yahoofinance,2020-10-09 09:38:29
Zoom Video's stock gains after Mizuho analyst's bullish call ahead of 'key catalyst' next week,yahoofinance,2020-10-09 09:38:29
"DraftKings Tumbles On New NFL Covid Cases, Secondary Offering Price",yahoofinance,2020-10-09 09:38:29
Volkswagen Expects 90% Electric Car Sales in 2021; Target Price $159,yahoofinance,2020-10-09 09:38:29
Nvidia: Next Stop $700? This Analyst Thinks So,yahoofinance,2020-10-09 09:38:29
IBM CEO: Why we just made this landmark business move,yahoofinance,2020-10-09 09:38:29
Stock market news live updates: Stock futures extend gains with stimulus prospects in focus,yahoofinance,2020-10-09 09:38:29
Apple Will Release Its 5G iPhones Next Week. Morgan Stanley Says It’s a Bigger Deal Than Wall Street Thinks.,yahoofinance,2020-10-09 09:38:29
Airline Stocks To Watch In The Coronavirus Pandemic: How To Separate Winners From Losers,yahoofinance,2020-10-09 09:38:29
IBM to split into two as it reinvents itself,yahoofinance,2020-10-09 09:38:29
Google Sister Waymo Rolls Out Self-Driving Taxi Service To The Public,yahoofinance,2020-10-09 09:38:29
Here’s the real cost of stock splits that Buffett knows and Apple and Tesla ignored,yahoofinance,2020-10-09 09:38:29
"Dow Jones Today, Futures Aim For October Surprise; Deal Chatter Ignites Xilinx",yahoofinance,2020-10-09 09:38:29
"Amazon's stock gains after Mizuho analyst boosts target to $4,000",yahoofinance,2020-10-09 09:38:29
Goldman’s Abby Joseph Cohen Warns Over ‘Considerable’ Market Downside,yahoofinance,2020-10-09 09:38:29
5 Value Stocks In The Energy Sector,yahoofinance,2020-10-09 09:38:29
Icahn sees energy sector rebound but urges patience,yahoofinance,2020-10-09 09:38:29
"Why the Worst Could Be Over for Visa and Mastercard, and How PayPal Could Keep Rising",yahoofinance,2020-10-09 09:38:29
AMD Is Said in Talks to Buy Rival Xilinx in $30 Billion Deal,yahoofinance,2020-10-09 09:38:29
Mallinckrodt Bankruptcy Would Hand Control Over to Bondholders,yahoofinance,2020-10-09 09:38:29
Which Social Media Stock Will Grow The Most By 2025?,yahoofinance,2020-10-09 09:38:29
GameStop Stock Spikes on Back-End Software Deal With Microsoft,yahoofinance,2020-10-09 09:38:29
Top Stocks In Emerging Markets Are Racking Up Triple-Digit Gains,yahoofinance,2020-10-09 09:38:29
Taiwan Semiconductor News Brightens Outlook For Chip Earnings Season,yahoofinance,2020-10-09 09:38:29
2 Stock Picks From the Analysts Who Consistently Get It Right,yahoofinance,2020-10-09 09:38:29
"Coronavirus update: U.S. death toll tops 211,000 as doctors caution that Trump is entering a key phase in his diagnosis",yahoofinance,2020-10-09 09:38:29
Here’s why the prospect of a Democratic clean sweep in November’s elections is rattling a sleepy U.S. bond market,yahoofinance,2020-10-09 09:38:29
Is The Biggest Bank Stock By Market Cap A Buy Now?,yahoofinance,2020-10-09 09:38:29
These restaurants have filed for bankruptcy and many more are at risk,yahoofinance,2020-10-09 09:38:29
"Tesla: Use Any Stock Weakness to Snap Up Shares, Says Analyst",yahoofinance,2020-10-09 09:38:29
Most Americans support higher taxes if it's spent on these 2 things: Poll,yahoofinance,2020-10-09 09:38:29
Factbox: What a second Trump term would mean for U.S. financial policy,yahoofinance,2020-10-09 09:38:29
"Harley-Davidson’s CEO Is Making Changes. That Should Fuel the Stock, One Analyst Says.",yahoofinance,2020-10-09 09:38:29
Bottom Fishers Jumping Into Royal Caribbean (RCL),yahoofinance,2020-10-09 09:38:29
Is Gilead Stock a Buy Right Now? This Is What You Need to Know,yahoofinance,2020-10-09 09:38:29
4 Propane Stocks To Watch Heading Into A COVID Winter,yahoofinance,2020-10-09 09:38:29
GameStop Shares Surge On Microsoft Partnership,yahoofinance,2020-10-09 09:38:29
"Beyond Meat, Nike Among 4 Leaderboard Breakout Stocks To Watch",yahoofinance,2020-10-09 09:38:29
Moderna: Coronavirus Vaccine Patents Will Go Unenforced During Pandemic,yahoofinance,2020-10-09 09:38:29
Are Solar Panels Worth It in 2020?,yahoofinance,2020-10-09 09:38:29
US hits all of Iran's financial sector with sanctions,yahoofinance,2020-10-09 09:38:29
Roku's Stock Gets A New Street-High Price Target,yahoofinance,2020-10-09 09:38:29
How a 457 Plan Works After Retirement,yahoofinance,2020-10-09 09:38:29
McDonald's Hikes Dividend As Sales Continue To Rebound,yahoofinance,2020-10-09 09:38:29
A Tale of 3 Chip Stocks; 2 to Buy and 1 to Avoid,yahoofinance,2020-10-09 09:38:29
IBD 50 Stocks To Watch: Will Workday's Wild Ride Continue?,yahoofinance,2020-10-09 09:38:29
Palihapitiya's Next Three SPACs Raise $2.1B In IPOs,yahoofinance,2020-10-09 09:38:29
"Gold jumps on weaker dollar, U.S. stimulus bets",yahoofinance,2020-10-09 09:38:29
DraftKings Just Sold 32 Million Shares. More Stock Could Be Coming on the Market.,yahoofinance,2020-10-09 09:38:29
Palihapitiya’s Three New Blank-Check Firms Raise $2.1 Billion in IPOs,yahoofinance,2020-10-09 09:38:29
The US Beverage Brands Making A Splash In The Cannabis And CBD Drinks Market,yahoofinance,2020-10-09 09:38:29
"Citigroup fine 'another black mark,' analyst says — but it's not 'life threatening'",yahoofinance,2020-10-09 09:38:29
A Solar Merger That Just Closed Will Transform the Industry. Vivint’s CEO Explains How.,yahoofinance,2020-10-09 09:38:29
What Does SunPower's Debt Look Like?,yahoofinance,2020-10-09 09:38:29
Why Gazprom’s $7.6 Billion Polish Fine Is Just the Start,yahoofinance,2020-10-09 09:38:29
HCA to return $6 bln COVID-19 relief funding; sees Q3 revenue ahead of estimates,yahoofinance,2020-10-09 09:38:29
"Carnival reports smaller-than-expected loss, says cruising still in demand",yahoofinance,2020-10-09 09:38:29
Why New Highs for Gold Prices May Be Out of Reach,yahoofinance,2020-10-09 09:38:29
FuelCell Energy stock powers higher after bullish call from J.P. Morgan,yahoofinance,2020-10-09 09:38:29
Wells Fargo: These 3 “Strong Buy” Stocks Have Over 70% Upside Potential,yahoofinance,2020-10-09 09:38:29
"'Patriotic' millionaires hit Trump on taxes, call for reform",yahoofinance,2020-10-09 09:38:29
"It’s Time to Buy One of 2020’s Worst-Performing Stocks, Analyst Says. Here’s Why.",yahoofinance,2020-10-09 09:38:29
"Is WBA Stock A Buy Ahead Of Earnings? Here's What Fundamentals, Chart Show",yahoofinance,2020-10-09 09:38:29
A light at the end of the pandemic tunnel? Rolls-Royce shares double in a week,yahoofinance,2020-10-09 09:38:29
Workhorse Shares Shrug Off Short-Seller Report’s Allegations,yahoofinance,2020-10-09 09:38:29
Global stocks up as blue wave hopes lift U.S. stimulus bets,yahoofinance,2020-10-09 09:38:29
"GM, Honda-Led Group Launches Blockchain-Based Electric Vehicle Charging Network",yahoofinance,2020-10-09 09:38:29
Fox Is An Under-The-Radar Play On US Sports Gambling,yahoofinance,2020-10-09 09:38:29
U.S. Stocks on Course for Best Week Since August,wsj,2020-10-09 09:41:36
Chinese Exports to the U.S. Get a Lifeline From Coronavirus-Related Demand,wsj,2020-10-09 09:41:36
"Trump Mulls Florida Rally Saturday, Says No to Virtual Debate",wsj,2020-10-09 09:41:36
AMD Is in Advanced Talks to Buy Xilinx,wsj,2020-10-09 09:41:36
Why Disney World Is Open but Disneyland Is Closed,wsj,2020-10-09 09:41:36
Antibody Drugs Touted by Trump Could Be Next to Get Authorized for Covid-19,wsj,2020-10-09 09:41:36
Conservative Activist Grabbed Trump’s Eye on Diversity Training,wsj,2020-10-09 09:41:36
Nobel Peace Prize Is Awarded to the World Food Program,wsj,2020-10-09 09:41:36
It’s Easier to Avoid Taxes When You Own a Business,wsj,2020-10-09 09:41:36
On the Front Lines of Stopping Covid-19 on College Campuses: Resident Advisers,wsj,2020-10-09 09:41:36
Coronavirus Hit the U.S. Long Before We Knew,wsj,2020-10-09 09:41:36
Covid Is Crushing Small Businesses. That’s Bad News for American Innovation.,wsj,2020-10-09 09:41:36
Group Most Likely to Get Covid-19 Is Least Likely to Die From It,wsj,2020-10-09 09:41:36
"During a Zoom Frog Dissection, Students Posted Vomit Emojis. Welcome to the Virtual Field Trip.",wsj,2020-10-09 09:41:36
The Oil Market Has an Aviation Problem,wsj,2020-10-09 09:41:36
"Wheat Prices Skyrocket After Dry Weather, Coronavirus Lockdowns",wsj,2020-10-09 09:41:36
The German Car Industry Musters for a New Tech Battle,wsj,2020-10-09 09:41:36
Alibaba Stock Hits Record,wsj,2020-10-09 09:41:36
