headline,org,date
"Boeing Posts Narrower Q3 Loss, Outlines 11,000 More Job Cuts",msnmoney,2020-10-28 08:27:14
Tips for avoiding utility bill scams,msnmoney,2020-10-28 08:27:14
Switch and you could save. Rock on.,msnmoney,2020-10-28 08:27:14
"Refi Rates Today, October 28, 2020 | Rates drop",msnmoney,2020-10-28 08:27:14
"5 Ways to Survive Divorce, Emotionally and Financially",msnmoney,2020-10-28 08:27:14
The Man Who Picked Bitcoin in 2016 Has New Urgent Prediction,msnmoney,2020-10-28 08:27:14
"Dividends and buybacks are rebounding, but it's not all good news",msnmoney,2020-10-28 08:27:14
Energy assistance programs in every state,msnmoney,2020-10-28 08:27:14
Homebuyer demand may have peaked as mortgage applications eke out a weekly gain,msnmoney,2020-10-28 08:27:14
23 New Gadgets That Will Sell Out Before Holidays,msnmoney,2020-10-28 08:27:14
28 Investing Tips From Today’s Financial Geniuses,msnmoney,2020-10-28 08:27:14
5 Reasons Why You Should Consider a Cooled Mattress Topper,msnmoney,2020-10-28 08:27:14
Don't Buy Macy's Until These 3 Things Happen,msnmoney,2020-10-28 08:27:14
25 Car Theft Capitals of the U.S.,msnmoney,2020-10-28 08:27:14
Here's How Much You Should Have Saved for Retirement by Age 50,msnmoney,2020-10-28 08:27:14
What retirement was like the year you were born,msnmoney,2020-10-28 08:27:14
"What you need to know about coronavirus on Wednesday, October 28",msnmoney,2020-10-28 08:27:14
Americans Are Obsessed With New Blanket That Puts You To Sleep In Minutes,msnmoney,2020-10-28 08:27:14
Where to sell clothes for quick cash,msnmoney,2020-10-28 08:27:14
These 10 budgeting tricks can help you get control of your money,msnmoney,2020-10-28 08:27:14
The truth about rats and car engines,msnmoney,2020-10-28 08:27:14
Dow Futures Plunge as Coronavirus Infection Surge Spooks Markets: Boeing and GE Earnings in Focus,msnmoney,2020-10-28 08:27:14
Common household items you can sell for cash,msnmoney,2020-10-28 08:27:14
What You Need to Know About Buying Laminate Flooring,msnmoney,2020-10-28 08:27:14
Panera Bread adds pizza to menus as customers order more delivery and takeout,msnmoney,2020-10-28 08:27:14
Ways you can go broke while trying to get rich,msnmoney,2020-10-28 08:27:14
4 Home Office Tools That Seasoned Remote Workers Recommend,msnmoney,2020-10-28 08:27:14
25 Hot Jobs That Pay More Than $100K a Year,msnmoney,2020-10-28 08:27:14
Mercedes-Benz is taking a big stake in Aston Martin,msnmoney,2020-10-28 08:27:14
Seniors On Medicare Are Getting a Big Pay Day,msnmoney,2020-10-28 08:27:14
States Where Identity Theft Runs Rampant,msnmoney,2020-10-28 08:27:14
McDonald's new pastries are here. Here's how to get them for free,msnmoney,2020-10-28 08:27:14
6 ways Americans are bracing their finances for the election,msnmoney,2020-10-28 08:27:14
"Travelers can work abroad in an island paradise — if they make $100,000+",msnmoney,2020-10-28 08:27:14
27 Best Strategies To Get the Most Out of Your 401(k),msnmoney,2020-10-28 08:27:14
Best Credit Cards of October 2020,msnmoney,2020-10-28 08:27:14
Brett Kavanaugh Is About to Get a Lot More Powerful,msnmoney,2020-10-28 08:27:14
15 Aldi shopping secrets that will save you even more,msnmoney,2020-10-28 08:27:14
The Fed Is Really Running Out of Firepower,msnmoney,2020-10-28 08:27:14
How to make money online,msnmoney,2020-10-28 08:27:14
"Reddit employees will keep their coveted San Francisco salaries if they move to more affordable cities, bucking the trend of pay cuts for workers leaving Silicon Valley",msnmoney,2020-10-28 08:27:14
1 Thing Every Senior Should Know Before Medicare Open Enrollment,msnmoney,2020-10-28 08:27:14
Bill Gates and 15 More Rich People Who Won’t Leave Money to Their Kids,msnmoney,2020-10-28 08:27:14
EQT to Buy Chevron Appalachian Shale Gas Assets for $735 Million,msnmoney,2020-10-28 08:27:14
The Total Amount of Unclaimed Money in Every State — Is Some of It Yours?,msnmoney,2020-10-28 08:27:14
"The Rule of 72 is a quick, simple way to figure how long it'll take for your savings and investments to double in value",msnmoney,2020-10-28 08:27:14
"Best Places To Own a Home For Less Than $1,000 a Month",msnmoney,2020-10-28 08:27:14
Forget Expensive Windows (Do This Instead),msnmoney,2020-10-28 08:27:14
Sony Raises Profit Forecast Ahead of Big PlayStation 5 Debut,msnmoney,2020-10-28 08:27:14
The most and least tax-friendly states for retirees,msnmoney,2020-10-28 08:27:14
Deutsche Bank Boosts Securities Unit Outlook on Trading Boom,msnmoney,2020-10-28 08:27:14
Waiters Reveal 15 Best Ways To Dine Out on a Budget,msnmoney,2020-10-28 08:27:14
5 Credit Mistakes That Can Haunt You,msnmoney,2020-10-28 08:27:14
Top NYC Doctor Debunks Hyped-Up Health Myths,msnmoney,2020-10-28 08:27:14
13 Best Stocks to Buy If Joe Biden Wins the Presidency,msnmoney,2020-10-28 08:27:14
Another Chinese Fintech Firm Is Going Public at the Same Time as Ant Group,msnmoney,2020-10-28 08:27:14
Cheap renovations that increase home value,msnmoney,2020-10-28 08:27:14
"5 at 5: Your Daily Digest for Real Estate Investing, 10/27/2020",msnmoney,2020-10-28 08:27:14
10 Home Renovations To Make Before You Retire,msnmoney,2020-10-28 08:27:14
The Pessimist’s Guide to Jack Ma’s Record-Breaking Ant IPO,msnmoney,2020-10-28 08:27:14
Virginia Launches New Policy For Cars Used Less Than 50 Miles/Day,msnmoney,2020-10-28 08:27:14
"How Much a 3,000-Square-Foot Home Costs in Each State",msnmoney,2020-10-28 08:27:14
"Delivery Hero’s Quarterly Orders, Sales Double as Demand Surges",msnmoney,2020-10-28 08:27:14
"See How Much Money Warren Buffett, Dana White and 35 Other CEOs Are Pouring Into the Election",msnmoney,2020-10-28 08:27:14
South Korean Winners and Losers in U.S. Vote: Election Guide,msnmoney,2020-10-28 08:27:14
Can You Get Paid to Vote During Work Hours? Every State’s Rules,msnmoney,2020-10-28 08:27:14
How Could Biden's Proposed 401(k) Tax Rules Impact Real Estate Investors?,msnmoney,2020-10-28 08:27:14
Remember Him? Better Sit Down Before You See What He Looks Like Now,msnmoney,2020-10-28 08:27:14
Work-from-home jobs that pay well,msnmoney,2020-10-28 08:27:14
ANA’s New Budget Carrier Faces Skepticism Even Before It Flies,msnmoney,2020-10-28 08:27:14
15 Cities With the Highest Cost-of-Living Adjusted Salaries,msnmoney,2020-10-28 08:27:14
'I'm going under trying to find a job': What it's like looking for work during the pandemic,msnmoney,2020-10-28 08:27:14
30 American Ghost Towns,msnmoney,2020-10-28 08:27:14
Malaysia’s Jaya Grocer Chain Owners Weigh Stake Sale,msnmoney,2020-10-28 08:27:14
"Boeing Posts Narrower Q3 Loss, Outlines 11,000 More Job Cuts",msnmoney,2020-10-28 08:27:14
Tips for avoiding utility bill scams,msnmoney,2020-10-28 08:27:14
Switch and you could save. Rock on.,msnmoney,2020-10-28 08:27:14
"Refi Rates Today, October 28, 2020 | Rates drop",msnmoney,2020-10-28 08:27:14
"5 Ways to Survive Divorce, Emotionally and Financially",msnmoney,2020-10-28 08:27:14
The Man Who Picked Bitcoin in 2016 Has New Urgent Prediction,msnmoney,2020-10-28 08:27:14
"Dividends and buybacks are rebounding, but it's not all good news",msnmoney,2020-10-28 08:27:14
Energy assistance programs in every state,msnmoney,2020-10-28 08:27:14
Homebuyer demand may have peaked as mortgage applications eke out a weekly gain,msnmoney,2020-10-28 08:27:14
23 New Gadgets That Will Sell Out Before Holidays,msnmoney,2020-10-28 08:27:14
28 Investing Tips From Today’s Financial Geniuses,msnmoney,2020-10-28 08:27:14
5 Reasons Why You Should Consider a Cooled Mattress Topper,msnmoney,2020-10-28 08:27:14
Don't Buy Macy's Until These 3 Things Happen,msnmoney,2020-10-28 08:27:14
25 Car Theft Capitals of the U.S.,msnmoney,2020-10-28 08:27:14
Here's How Much You Should Have Saved for Retirement by Age 50,msnmoney,2020-10-28 08:27:14
What retirement was like the year you were born,msnmoney,2020-10-28 08:27:14
"What you need to know about coronavirus on Wednesday, October 28",msnmoney,2020-10-28 08:27:14
Americans Are Obsessed With New Blanket That Puts You To Sleep In Minutes,msnmoney,2020-10-28 08:27:14
Where to sell clothes for quick cash,msnmoney,2020-10-28 08:27:14
These 10 budgeting tricks can help you get control of your money,msnmoney,2020-10-28 08:27:14
The truth about rats and car engines,msnmoney,2020-10-28 08:27:14
Dow Futures Plunge as Coronavirus Infection Surge Spooks Markets: Boeing and GE Earnings in Focus,msnmoney,2020-10-28 08:27:14
Common household items you can sell for cash,msnmoney,2020-10-28 08:27:14
What You Need to Know About Buying Laminate Flooring,msnmoney,2020-10-28 08:27:14
Panera Bread adds pizza to menus as customers order more delivery and takeout,msnmoney,2020-10-28 08:27:14
Ways you can go broke while trying to get rich,msnmoney,2020-10-28 08:27:14
4 Home Office Tools That Seasoned Remote Workers Recommend,msnmoney,2020-10-28 08:27:14
25 Hot Jobs That Pay More Than $100K a Year,msnmoney,2020-10-28 08:27:14
Mercedes-Benz is taking a big stake in Aston Martin,msnmoney,2020-10-28 08:27:14
Seniors On Medicare Are Getting a Big Pay Day,msnmoney,2020-10-28 08:27:14
States Where Identity Theft Runs Rampant,msnmoney,2020-10-28 08:27:14
McDonald's new pastries are here. Here's how to get them for free,msnmoney,2020-10-28 08:27:14
6 ways Americans are bracing their finances for the election,msnmoney,2020-10-28 08:27:14
"Travelers can work abroad in an island paradise — if they make $100,000+",msnmoney,2020-10-28 08:27:14
27 Best Strategies To Get the Most Out of Your 401(k),msnmoney,2020-10-28 08:27:14
Best Credit Cards of October 2020,msnmoney,2020-10-28 08:27:14
Brett Kavanaugh Is About to Get a Lot More Powerful,msnmoney,2020-10-28 08:27:14
15 Aldi shopping secrets that will save you even more,msnmoney,2020-10-28 08:27:14
The Fed Is Really Running Out of Firepower,msnmoney,2020-10-28 08:27:14
How to make money online,msnmoney,2020-10-28 08:27:14
"Reddit employees will keep their coveted San Francisco salaries if they move to more affordable cities, bucking the trend of pay cuts for workers leaving Silicon Valley",msnmoney,2020-10-28 08:27:14
1 Thing Every Senior Should Know Before Medicare Open Enrollment,msnmoney,2020-10-28 08:27:14
Bill Gates and 15 More Rich People Who Won’t Leave Money to Their Kids,msnmoney,2020-10-28 08:27:14
EQT to Buy Chevron Appalachian Shale Gas Assets for $735 Million,msnmoney,2020-10-28 08:27:14
The Total Amount of Unclaimed Money in Every State — Is Some of It Yours?,msnmoney,2020-10-28 08:27:14
"The Rule of 72 is a quick, simple way to figure how long it'll take for your savings and investments to double in value",msnmoney,2020-10-28 08:27:14
"Best Places To Own a Home For Less Than $1,000 a Month",msnmoney,2020-10-28 08:27:14
Forget Expensive Windows (Do This Instead),msnmoney,2020-10-28 08:27:14
Sony Raises Profit Forecast Ahead of Big PlayStation 5 Debut,msnmoney,2020-10-28 08:27:14
The most and least tax-friendly states for retirees,msnmoney,2020-10-28 08:27:14
Deutsche Bank Boosts Securities Unit Outlook on Trading Boom,msnmoney,2020-10-28 08:27:14
Waiters Reveal 15 Best Ways To Dine Out on a Budget,msnmoney,2020-10-28 08:27:14
5 Credit Mistakes That Can Haunt You,msnmoney,2020-10-28 08:27:14
Top NYC Doctor Debunks Hyped-Up Health Myths,msnmoney,2020-10-28 08:27:14
13 Best Stocks to Buy If Joe Biden Wins the Presidency,msnmoney,2020-10-28 08:27:14
Another Chinese Fintech Firm Is Going Public at the Same Time as Ant Group,msnmoney,2020-10-28 08:27:14
Cheap renovations that increase home value,msnmoney,2020-10-28 08:27:14
"5 at 5: Your Daily Digest for Real Estate Investing, 10/27/2020",msnmoney,2020-10-28 08:27:14
10 Home Renovations To Make Before You Retire,msnmoney,2020-10-28 08:27:14
The Pessimist’s Guide to Jack Ma’s Record-Breaking Ant IPO,msnmoney,2020-10-28 08:27:14
Virginia Launches New Policy For Cars Used Less Than 50 Miles/Day,msnmoney,2020-10-28 08:27:14
"How Much a 3,000-Square-Foot Home Costs in Each State",msnmoney,2020-10-28 08:27:14
"Delivery Hero’s Quarterly Orders, Sales Double as Demand Surges",msnmoney,2020-10-28 08:27:14
"See How Much Money Warren Buffett, Dana White and 35 Other CEOs Are Pouring Into the Election",msnmoney,2020-10-28 08:27:14
South Korean Winners and Losers in U.S. Vote: Election Guide,msnmoney,2020-10-28 08:27:14
Can You Get Paid to Vote During Work Hours? Every State’s Rules,msnmoney,2020-10-28 08:27:14
How Could Biden's Proposed 401(k) Tax Rules Impact Real Estate Investors?,msnmoney,2020-10-28 08:27:14
Remember Him? Better Sit Down Before You See What He Looks Like Now,msnmoney,2020-10-28 08:27:14
Work-from-home jobs that pay well,msnmoney,2020-10-28 08:27:14
ANA’s New Budget Carrier Faces Skepticism Even Before It Flies,msnmoney,2020-10-28 08:27:14
15 Cities With the Highest Cost-of-Living Adjusted Salaries,msnmoney,2020-10-28 08:27:14
'I'm going under trying to find a job': What it's like looking for work during the pandemic,msnmoney,2020-10-28 08:27:14
30 American Ghost Towns,msnmoney,2020-10-28 08:27:14
Malaysia’s Jaya Grocer Chain Owners Weigh Stake Sale,msnmoney,2020-10-28 08:27:14
Economic data continues to beat expectations,yahoofinance,2020-10-28 08:29:06
"Boeing burns nearly $5B as COVID, 737 MAX weigh",yahoofinance,2020-10-28 08:29:06
UPS quarterly profit beats as pandemic spurs home deliveries,yahoofinance,2020-10-28 08:29:06
GE reports smaller loss as business recovers from pandemic lows,yahoofinance,2020-10-28 08:29:06
Raoul Pal on his outlook for monetary and fiscal policy,yahoofinance,2020-10-28 08:29:06
'NOT DONE: Women Remaking America' director Sara Wolitzky on how the fight for equality has gone mainstream,yahoofinance,2020-10-28 08:29:06
‘Owners aren’t just going to wake up’ on NFL protests,yahoofinance,2020-10-28 08:29:06
"Here's why 10,000 Burger Kings are going digital",yahoofinance,2020-10-28 08:29:06
"2.25% FIXED Mortgage Refi, No Hidden Fees/Points",yahoofinance,2020-10-28 08:29:06
Most investors now expect the U.S. stock market to crash like it did in October 1987 — why that’s good news,yahoofinance,2020-10-28 08:29:06
"Dow Jones Futures Dive 450 Points, As Microsoft Drops On Revenue Guidance; First Solar Surges On Earnings",yahoofinance,2020-10-28 08:29:06
Americans are bracing their finances for the election — should you?,yahoofinance,2020-10-28 08:29:06
"Dow Jones Futures Tumble 500 Points, As Microsoft Falls On Earnings; Apple, Tesla Drop, While First Solar Soars On Earnings",yahoofinance,2020-10-28 08:29:06
3 Stocks Flashing Signs of Strong Insider Buying,yahoofinance,2020-10-28 08:29:06
"GE Stock Jumps On Surprise Earnings, Rebounding Cash Flow; CEO Hails 'Accelerating Transformation'",yahoofinance,2020-10-28 08:29:06
"Boeing sees Q3 earnings improvement but warns on layoffs as coronavirus, 737 MAX weigh",yahoofinance,2020-10-28 08:29:06
A Biden Presidency Could Complicate Your Estate Taxes and Planning. Start Preparing Now.,yahoofinance,2020-10-28 08:29:06
"Jim Cramer Talks AMD, Inovio And Honda Motors",yahoofinance,2020-10-28 08:29:06
United Parcel Service Delivers Big Third-Quarter Earnings Beat,yahoofinance,2020-10-28 08:29:06
"Why billionaire investor Ray Dalio hates cash and bonds, and says the election won’t change his view on the economy",yahoofinance,2020-10-28 08:29:06
"FAANG Stocks Present Buy Opportunities, Says Cramer",yahoofinance,2020-10-28 08:29:06
Apple Reports Earnings Tomorrow. Here’s What to Expect.,yahoofinance,2020-10-28 08:29:06
"An ‘enormous’ stock-market bubble has already popped, says David Einhorn",yahoofinance,2020-10-28 08:29:06
Rolls-Royce Gets Investor Nod for $2.6 Billion Equity Sale,yahoofinance,2020-10-28 08:29:06
David Einhorn Says Tech Stocks Are in an ‘Enormous’ Bubble,yahoofinance,2020-10-28 08:29:06
"AMD, Tesla, JD.com Struggle With Early Buy Points, But This Is The Real Problem",yahoofinance,2020-10-28 08:29:06
"Stock market news live updates: Stock futures open lower, Dow futures shed 100+ points",yahoofinance,2020-10-28 08:29:06
"General Electric Posts Surprise Q3 Profit, Sees Improving Industrial Cash Flow",yahoofinance,2020-10-28 08:29:06
Artificial Intelligence Stocks To Buy And Watch Amid Rising AI Competition,yahoofinance,2020-10-28 08:29:06
The Dow Isn’t Bouncing Back From Monday’s Selloff. Here’s Why.,yahoofinance,2020-10-28 08:29:06
"Microsoft stock flat despite better-than-expected earnings, strong Azure growth",yahoofinance,2020-10-28 08:29:06
"Oil prices down sharply as COVID cases rise, data shows increase in U.S. inventories",yahoofinance,2020-10-28 08:29:06
World’s Biggest ETF Is Losing Cash Faster Than Any of Its Peers,yahoofinance,2020-10-28 08:29:06
401(k) and IRA Penalties That Don't Apply in 2020,yahoofinance,2020-10-28 08:29:06
"Parent of BMW's Chinese partner defaults on a bond, as declining car sales pile on to the debt woes of China's corporate borrowers",yahoofinance,2020-10-28 08:29:06
"Is Amazon Stock A Buy Right Now? Here's What Earnings, Charts Show",yahoofinance,2020-10-28 08:29:06
How to cope if Amy Coney Barrett means the end of Obamacare,yahoofinance,2020-10-28 08:29:06
GE Jumps on Surprise Profit as CEO Larry Culp Sees Turnaround Accelerating,yahoofinance,2020-10-28 08:29:06
"First Solar, Enphase Stock, Two Leaders From The No. 1 Group, Shine On Earnings",yahoofinance,2020-10-28 08:29:06
UPDATE: Bed Bath & Beyond unveils 3-year transformation plan and resumes share buybacks,yahoofinance,2020-10-28 08:29:06
"UPS Stock In Buy Zone As E-Commerce Boom Fuels Earnings, Accelerating Sales Growth",yahoofinance,2020-10-28 08:29:06
EQT to Buy Chevron Appalachian Shale Gas Assets for $735 Million,yahoofinance,2020-10-28 08:29:06
Fisker to Debut Wednesday in Latest SPAC Blank Check Offering,yahoofinance,2020-10-28 08:29:06
Oppenheimer: These 3 Stocks Are Poised to Surge by at Least 60%,yahoofinance,2020-10-28 08:29:06
Best Tech Stocks To Buy Or Watch Now: 5 Growth Stocks Leading The Stock Market,yahoofinance,2020-10-28 08:29:06
"Boeing, Microsoft, General Electric, Dodgers - 5 Things You Must Know Wednesday",yahoofinance,2020-10-28 08:29:06
Is Apple Stock A Buy Right Now? Here's What Its Stock Chart Shows,yahoofinance,2020-10-28 08:29:06
10 High-Yielding Stocks That Should Please Investors Looking for Income,yahoofinance,2020-10-28 08:29:06
Dynatrace Earnings Triple; Cloud Software Maker's Stock Rises,yahoofinance,2020-10-28 08:29:06
7 Types of Fixed-Income Investments,yahoofinance,2020-10-28 08:29:06
Where Is the Best Place to Put Your Savings?,yahoofinance,2020-10-28 08:29:06
Dow Futures Plunge as Coronavirus  Infection Surge Spooks Markets: Boeing and GE Earnings in Focus,yahoofinance,2020-10-28 08:29:06
Raytheon Technologies Deepens Cuts As Aviation Sales Plunge,yahoofinance,2020-10-28 08:29:06
The Oil Industry Trend That Could Pump Stock Prices Higher,yahoofinance,2020-10-28 08:29:06
Akamai Stock Slides in Late Trading Despite Earnings Beat,yahoofinance,2020-10-28 08:29:06
Gold dips on stronger dollar; coronavirus concerns cap losses,yahoofinance,2020-10-28 08:29:06
Wells Fargo Hits Lowest Since 2009 as Investors Await Strategy,yahoofinance,2020-10-28 08:29:06
Boston Scientific Q3 earnings top estimates,yahoofinance,2020-10-28 08:29:06
What is Jack Ma's Ant Group and how does it make money?,yahoofinance,2020-10-28 08:29:06
Tupperware's stock soars after big profit and revenue beats,yahoofinance,2020-10-28 08:29:06
Josh Brown Shares His Thoughts On UPS,yahoofinance,2020-10-28 08:29:06
The Pessimist’s Guide to Jack Ma’s Record-Breaking Ant IPO,yahoofinance,2020-10-28 08:29:06
These solar stocks are now a ‘sell’ at UBS given post-election uncertainty,yahoofinance,2020-10-28 08:29:06
Blackstone third-quarter earnings rise on strong asset sales,yahoofinance,2020-10-28 08:29:06
Is Apple Stock a Buy Ahead of Earnings? This Is What You Need to Know,yahoofinance,2020-10-28 08:29:06
"American Airlines (AAL) Stock Still Worth $18, Says Analyst",yahoofinance,2020-10-28 08:29:06
Las Vegas Sands Seeks To Be 'Sans Vegas' By Selling Vegas Strip Casino Resorts,yahoofinance,2020-10-28 08:29:06
"GE's stock jumps after surprise profit and free cash flow, revenue falls less than forecast",yahoofinance,2020-10-28 08:29:06
Raytheon Technologies Is Technically Weak,yahoofinance,2020-10-28 08:29:06
Palantir Stock Just Got a Bunch of New Ratings. What Wall Street Is Saying.,yahoofinance,2020-10-28 08:29:06
"Pickup trucks, Jeeps drive FCA back into black",yahoofinance,2020-10-28 08:29:06
Etsy Reports Earnings Today. Here’s What to Expect.,yahoofinance,2020-10-28 08:29:06
"Cramer Gives His Opinion On Nordstrom, American Airlines And More",yahoofinance,2020-10-28 08:29:06
"Advanced Micro Devices Lisa Su Does It Again, and Here's How to Play It",yahoofinance,2020-10-28 08:29:06
"Is Raytheon Stock A Buy As Elite Status Fades? Here's What Earnings, Chart Say",yahoofinance,2020-10-28 08:29:06
A Look Into NextEra Energy's Debt,yahoofinance,2020-10-28 08:29:06
Zoom (ZM) Could Add to Historic Gains,yahoofinance,2020-10-28 08:29:06
Todd Gordon's Qualcomm Options Trade,yahoofinance,2020-10-28 08:29:06
"JPMorgan Sees S&P at 3,900 If Trump Wins Election: Taking Stock",yahoofinance,2020-10-28 08:29:06
The 2-cent solution to close the racial wealth gap: A call for U.S. companies to invest in Black communities,yahoofinance,2020-10-28 08:29:06
IRS Boosts 2021 Income Limits For IRA Deductions,yahoofinance,2020-10-28 08:29:06
"Blackrock, Bezos And Musk Charging Ahead in this $30 Trillion Mega-Trend",yahoofinance,2020-10-28 08:29:06
Why Uber And Lyft Are Trading Lower Today,yahoofinance,2020-10-28 08:29:06
Europe Stocks Tumble to 5-Month Low; Futures Slide: Markets Wrap,yahoofinance,2020-10-28 08:29:06
"Is Ford Stock A Buy Ahead Of Earnings? Here's What Fundamentals, Chart Show",yahoofinance,2020-10-28 08:29:06
"Is BYND Stock A Buy Right Now? Here's What Beyond Meat Earnings, Chart Show",yahoofinance,2020-10-28 08:29:06
GE posts quarterly profit as business recovers from pandemic lows,yahoofinance,2020-10-28 08:29:06
"Is DAL Stock A Buy Right Now? Here's What Earnings, Delta Stock Chart Show",yahoofinance,2020-10-28 08:29:06
"Boeing Posts Narrower Q3 Loss, Outlines 11,000 More Job Cuts",yahoofinance,2020-10-28 08:29:06
GE reports smaller loss as business recovers from pandemic lows,yahoofinance,2020-10-28 08:29:06
"Rolls-Royce to temporarily close factories, cut benefits - FT",yahoofinance,2020-10-28 08:29:06
"Millionaires' financial decisions are different in a few surprising ways, study finds",yahoofinance,2020-10-28 08:29:06
Pfizer Earnings Beat But Sales Miss; Crucial Covid-19 Vaccine Trials Advance,yahoofinance,2020-10-28 08:29:06
Oil Slumps With Europe’s Coronavirus Restrictions Growing,yahoofinance,2020-10-28 08:29:06
Which E-Commerce Stock Will Grow The Most By 2025?,yahoofinance,2020-10-28 08:29:06
‘Don’t sell!’ The man who wrote ‘A Random Walk Down Wall Street’ urges calm amid market volatility,yahoofinance,2020-10-28 08:29:06
Ex-Trump adviser Gary Cohn would back Biden’s proposed 28% corporate tax rate,yahoofinance,2020-10-28 08:29:06
Exclusive: Chevron to lay off about 25% of Noble Energy employees after merger,yahoofinance,2020-10-28 08:29:06
Boeing Earnings Are Coming; Here’s What Matters,yahoofinance,2020-10-28 08:29:06
Stocks With Solid Balance Sheets Have Been 2020 Winners. They Will Be Again in 2021.,yahoofinance,2020-10-28 08:29:06
AMD grabs Xilinx for $35 billion as chip industry consolidation continues,yahoofinance,2020-10-28 08:29:06
Little-Known Financial Benefits of Divorce,yahoofinance,2020-10-28 08:29:06
Like the Nasdaq-100? Here’s its ‘baby brother’ in a new ETF,yahoofinance,2020-10-28 08:29:06
Sony Raises Profit Forecast Ahead of Big PlayStation 5 Debut,yahoofinance,2020-10-28 08:29:06
"Big 5 stock falls after Q3 results, dividend increase",yahoofinance,2020-10-28 08:29:06
Mexican president pledges to ban outsourcing of jobs,yahoofinance,2020-10-28 08:29:06
Chairman Plattner buys nearly $300 million in SAP stock,yahoofinance,2020-10-28 08:29:06
Short-sellers have made a killing on these 5 stocks so far this year,yahoofinance,2020-10-28 08:29:06
"Surviving in This Environment, Shaky Recovery, Lilly and Pfizer Setbacks",yahoofinance,2020-10-28 08:29:06
Stock Futures Point to Selloff on Rising Virus Cases,wsj,2020-10-28 08:31:28
Pandemic Drives More Boeing Job Cuts,wsj,2020-10-28 08:31:28
Tariffs Didn’t Fuel Revival for American Steel,wsj,2020-10-28 08:31:28
"Severe Covid-19 Cases Leave Lasting Effects, Including on Mental State",wsj,2020-10-28 08:31:28
Social Media CEOs to Come Under Senate Scrutiny,wsj,2020-10-28 08:31:28
WSJ/NBC News Study Finds No Late Shift Toward Trump So Far,wsj,2020-10-28 08:31:28
Philadelphia Sees More Unrest After Police Shoot and Kill Walter Wallace Jr.,wsj,2020-10-28 08:31:28
Dodgers Win World Series and Enter Covid-19 Chaos,wsj,2020-10-28 08:31:28
Inside Uber and DoorDash’s Push to Win California Ballot Race,wsj,2020-10-28 08:31:28
Cheese Makers Reel as Pandemic Sows Market Chaos,wsj,2020-10-28 08:31:28
Coronavirus Economy Is Mixed Bag for Credit-Card Issuers,wsj,2020-10-28 08:31:28
Tiny Brain Implants Hold Big Promise for Immobilized Patients,wsj,2020-10-28 08:31:28
Pandemic Is Ray of Light for Solar Industry,wsj,2020-10-28 08:31:28
"Covid Closed Hong Kong's Beaches, but It Couldn't Keep Swimmers Out of the Ocean",wsj,2020-10-28 08:31:28
London’s Centuries-Old Insurance Market Investigates Its Slavery Role,wsj,2020-10-28 08:31:28
NYSE’s Top Markets Cop to Take Cryptocurrency Job at Andreessen Horowitz,wsj,2020-10-28 08:31:28
Blackstone Earnings Tick Higher as Tech Lifts Portfolio,wsj,2020-10-28 08:31:28
Visa’s Planned Purchase of Plaid Faces Antitrust Scrutiny at the Justice Department,wsj,2020-10-28 08:31:28
"Deutsche Bank Swings to Profit, Lowers Bad-Loan Provisions",wsj,2020-10-28 08:31:28
UPS Posts Strong Gains as Package Volumes Swell,wsj,2020-10-28 08:31:28
Sony Gets Lift From Stay-at-Home Demand Ahead of PlayStation 5 Launch,wsj,2020-10-28 08:31:28
