headline,org,date
"AMC secures $100 million investment, but bankruptcy concerns still loom",msnmoney,2020-12-11 09:44:21
Companies That Performed Exceptionally Well in 2020,msnmoney,2020-12-11 09:44:21
"Before You Renew Amazon Prime, Read This",msnmoney,2020-12-11 09:44:21
"No, you don't have to go to your company's virtual holiday party",msnmoney,2020-12-11 09:44:21
The Average Social Security Check the Year You Were Born,msnmoney,2020-12-11 09:44:21
Top credit card wipes out interest until 2022 (seriously),msnmoney,2020-12-11 09:44:21
Tesla joining the S&P 500 is going to be ‘the mother of all’ stock-market events,msnmoney,2020-12-11 09:44:21
The Average Price of Christmas Trees at Top US Retailers,msnmoney,2020-12-11 09:44:21
Why You Should Plan for 3 Different Retirements,msnmoney,2020-12-11 09:44:21
These Sleeves Might Transform Your Knees,msnmoney,2020-12-11 09:44:21
You should make a career plan―here’s how,msnmoney,2020-12-11 09:44:21
20 Questions to Tell If You're Ready to Retire,msnmoney,2020-12-11 09:44:21
China's iron ore prices spike 10% to a record high on supply concerns,msnmoney,2020-12-11 09:44:21
10 Types of People Who Shouldn't Set Foot in Costco,msnmoney,2020-12-11 09:44:21
22 clever ways you can earn free gift cards,msnmoney,2020-12-11 09:44:21
Every reason Costco is an annoying place to shop,msnmoney,2020-12-11 09:44:21
PG&E Expects Loss of at Least $275 Million for Deadly Zogg Fire,msnmoney,2020-12-11 09:44:21
39 Gifts That Are Selling Like Hotcakes During The Holidays,msnmoney,2020-12-11 09:44:21
9 Holiday Hazards That Cause Pet Emergencies (and Big Vet Bills),msnmoney,2020-12-11 09:44:21
Friday's Best Mortgage Rates: Dec. 11,msnmoney,2020-12-11 09:44:21
Francesca's and more pandemic bankruptcies,msnmoney,2020-12-11 09:44:21
Ericsson Shares Slump as It Starts Legal Fight With Samsung,msnmoney,2020-12-11 09:44:21
8 Tips to Balance Your Full-Time Job With a Side Hustle,msnmoney,2020-12-11 09:44:21
Virginia Launches New Guidelines For Cars Used Less Than 50 Miles/Day,msnmoney,2020-12-11 09:44:21
"Stock-market sentiment hitting ‘ludicrous’ territory, but when will bulls ‘pay the piper’?",msnmoney,2020-12-11 09:44:21
Cool multi-home compounds for rent across America,msnmoney,2020-12-11 09:44:21
"Columbus, Ohio, real estate market overview",msnmoney,2020-12-11 09:44:21
11 ways Costco can save you money on your car,msnmoney,2020-12-11 09:44:21
Pfizer Moves Forward With FDA Approval — What Does It Mean for the Stock Market?,msnmoney,2020-12-11 09:44:21
Seniors Are Now Entitled To 19 Incredible Discounts During Tough Times,msnmoney,2020-12-11 09:44:21
"AMC secures $100 million investment, but bankruptcy concerns still loom",msnmoney,2020-12-11 09:44:21
Companies That Performed Exceptionally Well in 2020,msnmoney,2020-12-11 09:44:21
"Before You Renew Amazon Prime, Read This",msnmoney,2020-12-11 09:44:21
"No, you don't have to go to your company's virtual holiday party",msnmoney,2020-12-11 09:44:21
The Average Social Security Check the Year You Were Born,msnmoney,2020-12-11 09:44:21
Top credit card wipes out interest until 2022 (seriously),msnmoney,2020-12-11 09:44:21
Tesla joining the S&P 500 is going to be ‘the mother of all’ stock-market events,msnmoney,2020-12-11 09:44:21
The Average Price of Christmas Trees at Top US Retailers,msnmoney,2020-12-11 09:44:21
Why You Should Plan for 3 Different Retirements,msnmoney,2020-12-11 09:44:21
These Sleeves Might Transform Your Knees,msnmoney,2020-12-11 09:44:21
You should make a career plan―here’s how,msnmoney,2020-12-11 09:44:21
20 Questions to Tell If You're Ready to Retire,msnmoney,2020-12-11 09:44:21
China's iron ore prices spike 10% to a record high on supply concerns,msnmoney,2020-12-11 09:44:21
10 Types of People Who Shouldn't Set Foot in Costco,msnmoney,2020-12-11 09:44:21
22 clever ways you can earn free gift cards,msnmoney,2020-12-11 09:44:21
Every reason Costco is an annoying place to shop,msnmoney,2020-12-11 09:44:21
PG&E Expects Loss of at Least $275 Million for Deadly Zogg Fire,msnmoney,2020-12-11 09:44:21
39 Gifts That Are Selling Like Hotcakes During The Holidays,msnmoney,2020-12-11 09:44:21
9 Holiday Hazards That Cause Pet Emergencies (and Big Vet Bills),msnmoney,2020-12-11 09:44:21
Friday's Best Mortgage Rates: Dec. 11,msnmoney,2020-12-11 09:44:21
Francesca's and more pandemic bankruptcies,msnmoney,2020-12-11 09:44:21
Ericsson Shares Slump as It Starts Legal Fight With Samsung,msnmoney,2020-12-11 09:44:21
8 Tips to Balance Your Full-Time Job With a Side Hustle,msnmoney,2020-12-11 09:44:21
Virginia Launches New Guidelines For Cars Used Less Than 50 Miles/Day,msnmoney,2020-12-11 09:44:21
"Stock-market sentiment hitting ‘ludicrous’ territory, but when will bulls ‘pay the piper’?",msnmoney,2020-12-11 09:44:21
Cool multi-home compounds for rent across America,msnmoney,2020-12-11 09:44:21
"Columbus, Ohio, real estate market overview",msnmoney,2020-12-11 09:44:21
11 ways Costco can save you money on your car,msnmoney,2020-12-11 09:44:21
Pfizer Moves Forward With FDA Approval — What Does It Mean for the Stock Market?,msnmoney,2020-12-11 09:44:21
Seniors Are Now Entitled To 19 Incredible Discounts During Tough Times,msnmoney,2020-12-11 09:44:21
"Stock fall, stimulus progress still elusive",yahoofinance,2020-12-11 09:46:18
Economic recovery should ‘be targeted’: Michael Eric Dyson,yahoofinance,2020-12-11 09:46:18
"Pfizer authorization imminent, first shots expected next week",yahoofinance,2020-12-11 09:46:18
Lots of IPOs have doubled this year — most since tech bubble,yahoofinance,2020-12-11 09:46:18
We’re prepared to deal with any side effects: UMass Memorial CEO on COVID vaccine recipients,yahoofinance,2020-12-11 09:46:18
Antitrust lawsuits are 'Facebook’s worst nightmare’: Author Sarah Frier,yahoofinance,2020-12-11 09:46:18
How Biden’s presidency will differ from Obama’s,yahoofinance,2020-12-11 09:46:18
Melinda Gates: It's time to regulate social media,yahoofinance,2020-12-11 09:46:18
"2.18% FIXED Mortgage Refi, No Hidden Fees/Points",yahoofinance,2020-12-11 09:46:18
2 Stocks That Are Flirting With a Bottom; Analysts Say ‘Buy’,yahoofinance,2020-12-11 09:46:18
Cramer Says Time To Take Profit In These Electric Vehicle SPAC Stocks,yahoofinance,2020-12-11 09:46:18
8 Best Monthly Dividend Stocks to Buy Now,yahoofinance,2020-12-11 09:46:18
Suze Orman says these are the biggest money no-nos,yahoofinance,2020-12-11 09:46:18
Citigroup Execs Tried to ‘Lessen the Pain’ of $900 Million Error,yahoofinance,2020-12-11 09:46:18
Elon Musk Decries ‘M.B.A.-ization’ of America,yahoofinance,2020-12-11 09:46:18
Tesla’s China Rival Nio Joins Race for Cash with Share Sale,yahoofinance,2020-12-11 09:46:18
"Why Airbnb being valued at $101 billion and DoorDash at $66 billion may end badly, quickly",yahoofinance,2020-12-11 09:46:18
"‘You don't need Congress’: Biden increasingly pressured to unilaterally forgive up to $50,000 student debt",yahoofinance,2020-12-11 09:46:18
Stocks Due for a Quick Pop and Stocks Due to Drop,yahoofinance,2020-12-11 09:46:18
FDA Panel Clears Path for Authorizing Pfizer Covid-19 Shot,wsj,2020-12-11 09:48:53
GOP See Bipartisan Group’s Covid-Aid Effort Falling Short,wsj,2020-12-11 09:48:53
U.S. Stocks Open Lower on Stimulus Worries,wsj,2020-12-11 09:48:53
SoftBank’s Rocky Year Ends on a Winning Streak,wsj,2020-12-11 09:48:53
Whose Workers Are Most Essential? Big Industries Vie for Vaccine Priority,wsj,2020-12-11 09:48:53
Barr Kept Hunter Biden Probes From Public View,wsj,2020-12-11 09:48:53
"Break Up Facebook? It’s Complicated, Tech Experts Say",wsj,2020-12-11 09:48:53
Dylan’s Catalog Sale Shows a Tax Advantage for Songwriters,wsj,2020-12-11 09:48:53
The Dicey Economics of Investing in Fossil Fuels Now,wsj,2020-12-11 09:48:53
House Maps Show Americans Growing Apart,wsj,2020-12-11 09:48:53
Former Hong Kong Lawmaker Seeks Asylum in the U.S.,wsj,2020-12-11 09:48:53
"The Year of Covid. And (Hopefully) the Year of Easy, Home-Based Testing",wsj,2020-12-11 09:48:53
Don’t Judge a Holiday Gift by Its Cover: Perfect Packages Raise Hopes,wsj,2020-12-11 09:48:53
"Despite Covid-19, Older People Are Still Happier",wsj,2020-12-11 09:48:53
MetLife to Sell Home-Insurance Unit to Zurich for $4 Billion,wsj,2020-12-11 09:48:53
Disney+ Continues Its Rapid Growth,wsj,2020-12-11 09:48:53
Ferrari CEO Resigns After Bout With Covid-19,wsj,2020-12-11 09:48:53
Lululemon Gets Another Sales Bump From Cooped-Up Shoppers,wsj,2020-12-11 09:48:53
Costco Keeps Drawing Homebound Shoppers,wsj,2020-12-11 09:48:53
Disney May Finally Make Netflix Sweat,wsj,2020-12-11 09:48:53
Airbnb Stock Price Skyrockets in Market Debut as IPOs Boom,wsj,2020-12-11 09:48:53
"To Sell Luxury Online, Deep Pockets Matter More Than Ever",wsj,2020-12-11 09:48:53
Track the Rising Coronavirus Case Count,wsj,2020-12-11 09:48:53
Xi Ramps Up Control of China’s Private Sector,wsj,2020-12-11 09:48:53
"Israelis Flock to the Gulf, Undeterred by Warning of Iranian Attacks",wsj,2020-12-11 09:48:53
How Covid-19 Ripped Through the Baltimore Ravens,wsj,2020-12-11 09:48:53
New Vacation-Homes Sites That Cater to Millennials,wsj,2020-12-11 09:48:53
Zen Ten: Private Rail Cars for a Luxurious Trip,wsj,2020-12-11 09:48:53
"MLS, the Pandemic and a Very Long Season",wsj,2020-12-11 09:48:53
LinkedIn Starts Testing Ads in ‘Stories’,wsj,2020-12-11 09:48:53
Adam Gerhart Named Global CEO of Media Agency Mindshare,wsj,2020-12-11 09:48:53
Nielsen Sets Timeline for Big Change in TV Ratings,wsj,2020-12-11 09:48:53
Facebook Lawsuits Take Aim at Data-Sharing Tool Key to Digital Economy,wsj,2020-12-11 09:48:53
Smarter Cars: Auto Makers Experiment With Chips That Think Like Humans,wsj,2020-12-11 09:48:53
C3.ai Rides Tech-Friendly Stock Market in IPO,wsj,2020-12-11 09:48:53
Broadcom Elevates Accounting Chief to CFO,wsj,2020-12-11 09:48:53
Cigna Promotes Company Veteran to CFO Role,wsj,2020-12-11 09:48:53
P&G Promotes Baby-Care Executive Andre Schulten to CFO,wsj,2020-12-11 09:48:53
Treasury Provides More Clarity on Banks’ Sharing Information,wsj,2020-12-11 09:48:53
U.S. Sanctions Accused Human Rights Abusers in Several Countries,wsj,2020-12-11 09:48:53
Surge in Physical Threats During Pandemic Complicates Employee Security Efforts,wsj,2020-12-11 09:48:53
"Natural Gas, Propane Are Early Winners in Quest for Clean Ship Fuels",wsj,2020-12-11 09:48:53
"For Airlines, Dry Ice in Vaccine Transport Demands Special Attention",wsj,2020-12-11 09:48:53
Today's Logistics Report: Last-Mile Caution; Defending YRC’s Backing; Russia’s Supply-Chain Woes,wsj,2020-12-11 09:48:53
10 Reasons to Buy Ralph Lauren Stock,wsj,2020-12-11 09:48:53
NIO Is Selling More Stock. That’s Good and Bad News.,wsj,2020-12-11 09:48:53
Global Equities Fall as U.S. Stimulus Talks Drag on,wsj,2020-12-11 09:48:53
Tesla joining the S&P 500 is going to be 'the mother of all' stock-market events,wsj,2020-12-11 09:48:53
Dow skids lower Friday amid setbacks on U.S. fiscal relief package and Brexit ,wsj,2020-12-11 09:48:53
"Stock-market sentiment hitting 'ludicrous' territory, but when will bulls 'pay the piper'?",wsj,2020-12-11 09:48:53
Americans Mulling Foreign Purchases Should Act Fast,wsj,2020-12-11 09:48:53
Grand Neo-Georgian Mansion Stands Just Outside New Zealand’s Capital City,wsj,2020-12-11 09:48:53
Former Bel Air Estate of Zsa Zsa Gabor Sells for $16 Million,wsj,2020-12-11 09:48:53
Turner Impact Capital Seeks to Strengthen Workforce Housing,wsj,2020-12-11 09:48:53
Good Company: How Beyond Good Built Transparency in African Chocolate Production,wsj,2020-12-11 09:48:53
Why Wealth Advisers Urge Active Planning for Philanthropy,wsj,2020-12-11 09:48:53
How to Give Shareholders a Say on Corporate Social Responsibility,wsj,2020-12-11 09:48:53
"Stocks Laugh at Economic Uncertainty, for Now",wsj,2020-12-11 09:48:53
Forced to Retire? It Might Not Be as Bad as You Fear,wsj,2020-12-11 09:48:53
Breaking Up Facebook,wsj,2020-12-11 09:48:53
Judge Sullivan’s Final ‘Verdict’,wsj,2020-12-11 09:48:53
There’s More to Politics Than Policy,wsj,2020-12-11 09:48:53
How Elon Musk Found Stock Success Amid the Covid Pandemic,wsj,2020-12-11 09:48:53
Emergency Use of Covid-19 Vaccine One Step Closer After FDA Panel Vote,wsj,2020-12-11 09:48:53
How Airbnb Rebounded During the Pandemic,wsj,2020-12-11 09:48:53
We Are Now In Crash Territory,seekingalpha,2020-12-11 09:50:41
AT&T's Massive Misstep,seekingalpha,2020-12-11 09:50:41
Wall Street Breakfast: Prepare For A No-Deal Brexit,seekingalpha,2020-12-11 09:50:41
2020: Year Of The 'New Retail' Investor,seekingalpha,2020-12-11 09:50:41
Tesla Vs. NIO: EV Giant Showdown,seekingalpha,2020-12-11 09:50:41
The Best Big-Cap Stocks To Buy On A Pullback,seekingalpha,2020-12-11 09:50:41
Buy The Oil Majors As Proxies To The Recovery,seekingalpha,2020-12-11 09:50:41
17 Upcoming Dividend Increases,seekingalpha,2020-12-11 09:50:41
The Sun Is Setting On Tesla's Solar Business,seekingalpha,2020-12-11 09:50:41
Tracking Chase Coleman's Tiger Global Portfolio - Q3 2020 Update,seekingalpha,2020-12-11 09:50:41
Medical Stocks 2021 Outlook: 2 Strong Tailwinds Should Drive Favorable Performance,seekingalpha,2020-12-11 09:50:41
Tesla shares downgraded to Hold at Jefferies despite 'messianic brand' positioning,seekingalpha,2020-12-11 09:50:41
Luminar Technologies shares slide 7% as rival Innoviz announces $1.4B SPAC merger with Collective Growth,seekingalpha,2020-12-11 09:50:41
"Industrials rally stalling, but Caterpillar could step up: At the Open",seekingalpha,2020-12-11 09:50:41
S&P 500 continues its December malaise with vaccine progress priced in,seekingalpha,2020-12-11 09:50:41
Americans could begin getting Pfizer vaccine on Monday - HHS's Alex Azar,seekingalpha,2020-12-11 09:50:41
"Apple's in-house modem plans don't change positive Qualcomm thesis, says Canaccord bull",seekingalpha,2020-12-11 09:50:41
"Viatris says, up to 20% of workforce may be impacted in restructure",seekingalpha,2020-12-11 09:50:41
CRISPR Therapeutics enters into a share sale agreement with Jefferies,seekingalpha,2020-12-11 09:50:41
"Crown Castle up, American Tower down as Deutsche Bank shifts ratings",seekingalpha,2020-12-11 09:50:41
Merck-Pfizer win positive opinion from EU for cancer therapy,seekingalpha,2020-12-11 09:50:41
China's Auto sales saw double-digit growth in November led by EV sales,seekingalpha,2020-12-11 09:50:41
Exxon reports first discovery offshore Suriname,seekingalpha,2020-12-11 09:50:41
Where Fundamentals Meet Technicals: Stocks And Commodities,seekingalpha,2020-12-11 09:50:41
Buffett's Response To A Trying Year Speaks Volumes About Berkshire And The Markets,seekingalpha,2020-12-11 09:50:41
Take Profits On Luminar After 100% Gain In Shares,seekingalpha,2020-12-11 09:50:41
Berkshire Hathaway: Intrinsic Value Estimate Exceeds $300 Per Class B Share,seekingalpha,2020-12-11 09:50:41
"Airbnb Is Bound To Be An Exciting Trip, But No Bargain",seekingalpha,2020-12-11 09:50:41
"Oppenheimer starts electronic component maker with Street-high target, seeing core franchise strengths",seekingalpha,2020-12-11 09:50:41
BofA weighs unlikely upside 'surprises' for 2021 in biopharmaceuticals,seekingalpha,2020-12-11 09:50:41
A healthcare solutions provider with 33% upside is (spoiler alert) Baird's first contender for 2021 Best Ideas,seekingalpha,2020-12-11 09:50:41
"J.P. Morgan downgrades these high-multiple software names, expecting a rotation with vaccine recovery",seekingalpha,2020-12-11 09:50:41
Oppenheimer finds top idea in oversold consumer-finance name,seekingalpha,2020-12-11 09:50:41
Gold: Don't Get Left Behind The Short Squeeze,seekingalpha,2020-12-11 09:50:41
Gold And Silver Base Building In Preparation Of Next Rally,seekingalpha,2020-12-11 09:50:41
"Natural Gas: Obviously, We Bought The Dip",seekingalpha,2020-12-11 09:50:41
Capital Product Partners Will Eventually Catch Up With Peers,seekingalpha,2020-12-11 09:50:41
What You Need To Know About Altria's Collapse,seekingalpha,2020-12-11 09:50:41
Capital Product Partners Will Eventually Catch Up With Peers,seekingalpha,2020-12-11 09:50:41
Zymeworks: Oncology Drug Discovery Company With Major Big Pharma Deals,seekingalpha,2020-12-11 09:50:41
Tractor Supply Company Isn't Seeing Much Love,seekingalpha,2020-12-11 09:50:41
The Best Big-Cap Stocks To Buy On A Pullback,seekingalpha,2020-12-11 09:50:41
Goldman Sachs Disrupting The Other Large Banks,seekingalpha,2020-12-11 09:50:41
What You Need To Know About Altria's Collapse,seekingalpha,2020-12-11 09:50:41
11% Payback At The Pump: Global Partners LP,seekingalpha,2020-12-11 09:50:41
Data Center REITs: Cloud Is Getting Crowded,seekingalpha,2020-12-11 09:50:41
Retail Opportunity Investments: This Grocery-Anchored Retail REIT's Shares Are Still Attractive,seekingalpha,2020-12-11 09:50:41
Will IBM Finally Turn Green? We Are Tired Of The Red And Blue,seekingalpha,2020-12-11 09:50:41
Letting ProShares Short Dow 30 Loose On Investors,seekingalpha,2020-12-11 09:50:41
"U.S. Weekly FundFlows Insight Report: Despite Record Market Highs, Investors Turn Conservative For The Fund-Flows Week",seekingalpha,2020-12-11 09:50:41
ProShares S&P Midcap 400 Dividend Aristocrats ETF: More Attractive Than The Large-Cap Alternative,seekingalpha,2020-12-11 09:50:41
iShares ESG MSCI USA ETF: For Another Day,seekingalpha,2020-12-11 09:50:41
"AGG: Record-Low Returns, Record-High Risks",seekingalpha,2020-12-11 09:50:41
Gold: Don't Get Left Behind The Short Squeeze,seekingalpha,2020-12-11 09:50:41
Gold And Silver Base Building In Preparation Of Next Rally,seekingalpha,2020-12-11 09:50:41
"Natural Gas: Obviously, We Bought The Dip",seekingalpha,2020-12-11 09:50:41
The Ugly Natural Gas Market Leads To A Bullish Reversal,seekingalpha,2020-12-11 09:50:41
Bitcoin: All-Time High Remains In Sight,seekingalpha,2020-12-11 09:50:41
Losing out on $4 billion,cnnbusiness,2020-12-11 10:06:29
Airbnb's stunning Wall Street debut left a ton of money on the table. It's part of a trend,cnnbusiness,2020-12-11 10:06:29
Airbnb just debuted on Wall Street. Now it's worth more than Marriott and Hilton combined,cnnbusiness,2020-12-11 10:06:29
The market has rarely been this expensive — and nobody cares,cnnbusiness,2020-12-11 10:06:29
The mind-boggling logistics of transporting one of the most important vaccines in history,cnnbusiness,2020-12-11 10:06:29
Biden's economic plan is bold. Is it possible?,cnnbusiness,2020-12-11 10:06:29
Pound heading for a crash if Britain fails to get a Brexit trade deal,cnnbusiness,2020-12-11 10:06:29
The antitrust case against Facebook: Here's what you need to know,cnnbusiness,2020-12-11 10:06:29
"Disney+ is about to get a lot bigger, and more expensive",cnnbusiness,2020-12-11 10:06:29
Analysis: Disney+ announcements are an 'earth-shaking' development in the streaming wars ,cnnbusiness,2020-12-11 10:06:29
"The Wan Chai connection: The Washington-accused drug lords, gun runners and dictators' financiers tied to one Hong Kong district",cnnbusiness,2020-12-11 10:06:29
Bloomberg journalist detained in Beijing for allegedly 'endangering national security',cnnbusiness,2020-12-11 10:06:29
"For many Americans, the economic and financial effects of the pandemic have been devastating",cnnbusiness,2020-12-11 10:06:29
Refi rates at 2.34% APR (15 yr). Do you qualify?,cnnbusiness,2020-12-11 10:06:29
A mother's dilemma: Pay the bills or buy Christmas presents?,cnnbusiness,2020-12-11 10:06:29
Small town company’s big time growth through Amazon,cnnbusiness,2020-12-11 10:06:29
Joe Biden and Kamala Harris named Time Person of the Year,cnnbusiness,2020-12-11 10:06:29
Millions on food stamps can't grocery shop online. Here's why,cnnbusiness,2020-12-11 10:06:29
Economist: It will take years for jobs to recover,cnnbusiness,2020-12-11 10:06:29
42% of Americans earn less than they did pre-Covid,cnnbusiness,2020-12-11 10:06:29
Frustrated restaurant owner blasts shutdown,cnnbusiness,2020-12-11 10:06:29
Why Americans need a stimulus deal in three stats,cnnbusiness,2020-12-11 10:06:29
Here's what happened during SpaceX's Mars prototype rocket test flight,cnnbusiness,2020-12-11 10:06:29
Here's how NASA fared under Trump,cnnbusiness,2020-12-11 10:06:29
"Space is becoming too crowded, Rocket Lab CEO warns",cnnbusiness,2020-12-11 10:06:29
Russia is filming a movie in space,cnnbusiness,2020-12-11 10:06:29
SpaceX gets almost $900 million in federal subsidies to deliver broadband to rural America,cnnbusiness,2020-12-11 10:06:29
See this SpaceX rocket's fiery crash landing,cnnbusiness,2020-12-11 10:06:29
"These Georgia voters are mired in misinformation. Now, some may not vote",cnnbusiness,2020-12-11 10:06:29
Small space? Tight budget? Try these holiday decorations,cnnbusiness,2020-12-11 10:06:29
Goldbelly is shipping food from iconic restaurants nationwide,cnnbusiness,2020-12-11 10:06:29
Bon Appetit had a culture problem. She wants to change that,cnnbusiness,2020-12-11 10:06:29
Taylor Swift released two albums in 2020. Most of us are just trying to get by,cnnbusiness,2020-12-11 10:06:29
A mother's dilemma: Pay the bills or buy Christmas presents?,cnnbusiness,2020-12-11 10:06:29
"The Covid Divide: The pandemic has plunged some into poverty, and boosted savings for others",cnnbusiness,2020-12-11 10:06:29
What struggling homeowners need to know before the end of the year,cnnbusiness,2020-12-11 10:06:29
Airbnb just debuted on Wall Street. Now it's worth more than Marriott and Hilton combined,cnnbusiness,2020-12-11 10:06:29
The antitrust case against Facebook: Here's what you need to know,cnnbusiness,2020-12-11 10:06:29
Chinese tech companies bet big on India. Now they're being shut out,cnnbusiness,2020-12-11 10:06:29
Space X's Mars prototype rocket exploded yesterday. Here's what happened on the flight,cnnbusiness,2020-12-11 10:06:29
Bloomberg journalist detained in Beijing for allegedly 'endangering national security',cnnbusiness,2020-12-11 10:06:29
Taylor Swift gives fans second surprise album of 2020,cnnbusiness,2020-12-11 10:06:29
Disney+ announcements are an 'earth-shaking' development in the streaming wars ,cnnbusiness,2020-12-11 10:06:29
"After arrest, Jimmy Lai denies colluding with foreign forces (August, 2020)",cnnbusiness,2020-12-11 10:06:29
Why some food brands want you to know their climate impact,cnnbusiness,2020-12-11 10:06:29
How smart nets and scanners could keep more fish in the sea,cnnbusiness,2020-12-11 10:06:29
Smart sensors could track social distancing in the office,cnnbusiness,2020-12-11 10:06:29
Perovskites could revolutionize solar power,cnnbusiness,2020-12-11 10:06:29
How NASA's Apollo program kicked off Silicon Valley's tech revolution,cnnbusiness,2020-12-11 10:06:29
Jeff Bezos just sold $1.8 billion worth of Amazon stock. Here's why,cnnbusiness,2020-12-11 10:06:29
Bill Nye's experimental spacecraft that sails on sunlight declares mission success ,cnnbusiness,2020-12-11 10:06:29
SpaceX's massive Starship prototype lifts off ,cnnbusiness,2020-12-11 10:06:29
Meet the woman tasked with turning around scandal-plagued Bon Appétit,cnnbusiness,2020-12-11 10:06:29
The number of Black female founders in the million dollar club just doubled,cnnbusiness,2020-12-11 10:06:29
See a swarm of drones replant forests devastated by wildfires,cnnbusiness,2020-12-11 10:06:29
What's next for America's favorite news podcast,cnnbusiness,2020-12-11 10:06:29
Refinance rates at 2.34% APR (15yr). Calculate your rate now,cnnbusiness,2020-12-11 10:06:29
Skip this month's payment if you refinance today.,cnnbusiness,2020-12-11 10:06:29
You could save thousands in interest with a cash-out refi,cnnbusiness,2020-12-11 10:06:29
Hack your mortgage by refinancing to a 15yr fixed,cnnbusiness,2020-12-11 10:06:29
Save a fortune on interest with these credit cards,cnnbusiness,2020-12-11 10:06:29
Don't leave money on the table! Get a cashback card,cnnbusiness,2020-12-11 10:06:29
"Spend $500, get $200 fast with this top card",cnnbusiness,2020-12-11 10:06:29
5 cards charging 0% interest until 2022,cnnbusiness,2020-12-11 10:06:29
Another Amazon? This stock may have similar growth,cnnbusiness,2020-12-11 10:06:29
You'll never guess who just put $91B on 1 5G stock,cnnbusiness,2020-12-11 10:06:29
5 must-have stocks under $49 could be worth $2.2T,cnnbusiness,2020-12-11 10:06:29
This could be the biggest winner of the stock market crash,cnnbusiness,2020-12-11 10:06:29
Want holiday cash? Check out these bank bonus offers,cnnbusiness,2020-12-11 10:06:29
Limited Time Only: Get $100 Bonus Offer (exp 12/31),cnnbusiness,2020-12-11 10:06:29
Check out today's best checking account offers,cnnbusiness,2020-12-11 10:06:29
Protect your money with today's top bank accounts,cnnbusiness,2020-12-11 10:06:29
Avoid these 7 mistakes everyone makes hiring financial advisors,cnnbusiness,2020-12-11 10:06:29
This startup is changing how people retire,cnnbusiness,2020-12-11 10:06:29
7 secrets everyone needs to know about financial advisors,cnnbusiness,2020-12-11 10:06:29
Avoid these 5 retirement mistakes at all costs,cnnbusiness,2020-12-11 10:06:29
Broadcom (AVGO) Selling Off Despite Strong Quarter,cnn,2020-12-11 10:08:08
Disney (DIS) Investor Day 2020 Highlights,cnn,2020-12-11 10:08:08
Airbnb Adds Heat to the IPO Boom,cnn,2020-12-11 10:08:08
Levi Strauss (LEVI) Jumps After Goldman Sachs Upgrade,cnn,2020-12-11 10:08:08
Facebook Risks Popular Apps in Antitrust Lawsuits,cnn,2020-12-11 10:08:08
DoorDash (DASH) Opening Print Could Offer Profitable Trades,cnn,2020-12-11 10:08:08
Roku (ROKU) Jumps After Analysts Cite 2021 Potential,cnn,2020-12-11 10:08:08
Starbucks Names Mellody Hobson Non-Executive Chairman,cnn,2020-12-11 10:08:08
Is It Time to Buy Intel (INTC)?,cnn,2020-12-11 10:08:08
Microsoft (MSFT) Makes Azure Digital Twins Generally Available,cnn,2020-12-11 10:08:08
U.S. Steel (X) Doubles in Price in Just 6 Weeks,cnn,2020-12-11 10:08:08
2 Hospital Stocks Set to Benefit Beyond the Pandemic,cnn,2020-12-11 10:08:08
Betterment Co-Founder Jonathan Stein Steps Down as CEO,cnn,2020-12-11 10:08:08
