headline,org,date
How to invest in stocks if record-high prices and volatility make you nervous,yahoofinance,2020-09-08 08:10:56
Tech stocks lead markets lower for a third straight day,yahoofinance,2020-09-08 08:10:56
Nikola and GM team up to make this super electric truck,yahoofinance,2020-09-08 08:10:56
What Wall St. pros are saying about last week's selling,yahoofinance,2020-09-08 08:10:56
Sell-off isn't driven by economic or virus news: Strategist,yahoofinance,2020-09-08 08:10:56
China purchase commitments miss targets for Trump’s trade deal,yahoofinance,2020-09-08 08:10:56
Powell: Masks can lead to 'enormous' economic gains,yahoofinance,2020-09-08 08:10:56
Why stocks and the economy actually aren't disconnected,yahoofinance,2020-09-08 08:10:56
Virginia Mortgage Rates Fall Off a Cliff,yahoofinance,2020-09-08 08:10:56
"My parents have $50,000 in credit-card debt and $50,000 in a home-equity loan. My father works part-time and my mother refuses to work. How can we help?",yahoofinance,2020-09-08 08:10:56
What Wall St pros are saying about last week's selling,yahoofinance,2020-09-08 08:10:56
"Tesla, Boeing, Dow Futures, Slack - 5 Things You Must Know Tuesday",yahoofinance,2020-09-08 08:10:56
Stock market news live updates: Stock futures point toward a third straight day of losses,yahoofinance,2020-09-08 08:10:56
U.S. Stocks Could Fall Further With ‘Three-Day Rule’ in Play,yahoofinance,2020-09-08 08:10:56
"Don't bet against the U.S. market, it's likely going higher, BlackRock's Rieder says",yahoofinance,2020-09-08 08:10:56
Exclusive: Exxon downsizes global empire as Wall Street worries about dividend,yahoofinance,2020-09-08 08:10:56
"Tesla completed stock offering, which helped trigger last week's selloff",yahoofinance,2020-09-08 08:10:56
Which FAANG Stock Will Grow The Most By 2025?,yahoofinance,2020-09-08 08:10:56
Japanese Billionaire Regrets Losing $41 Million in Stock Trading,yahoofinance,2020-09-08 08:10:56
13 Stocks That Both Growth and Value Investors Will Love,yahoofinance,2020-09-08 08:10:56
"Apple Drops on Negative Goldman Outlook, Possible iPhone Delays",yahoofinance,2020-09-08 08:10:56
The ‘Stretch IRA’ Estate Planning Strategy Is Gone. Here Are 4 Other Options.,yahoofinance,2020-09-08 08:10:56
Tesla Declines Accelerate After S&P 500 Snub,yahoofinance,2020-09-08 08:10:56
"These 3 “Strong Buy” Retail Stocks Look Compelling, Say Analysts",yahoofinance,2020-09-08 08:10:56
Nikola and GM team up to make this 900-horsepower super electric truck,yahoofinance,2020-09-08 08:10:56
Tesla Shares Slump as S&P 500 Inclusion Remains Elusive,yahoofinance,2020-09-08 08:10:56
Baker Hughes Stock Has Crumbled. The CEO Bought Up Shares.,yahoofinance,2020-09-08 08:10:56
Money Markets Have a $750 Billion Problem in Zero-Rate World,yahoofinance,2020-09-08 08:10:56
FAA investigating manufacturing flaws in Boeing 787 jetliners,yahoofinance,2020-09-08 08:10:56
Nasdaq Whale Theory for Tech Stock Surge Is Stirring Doubts,yahoofinance,2020-09-08 08:10:56
It’s Time to Get Bullish on Bank Stocks. Here’s Why.,yahoofinance,2020-09-08 08:10:56
Bearish Bets: 2 Fragile-Looking Stocks You Should Consider Shorting This Week,yahoofinance,2020-09-08 08:10:56
"Aurora names Miguel Martin CEO with immediate effect, to book up to C$1.8 billion in impairment charges",yahoofinance,2020-09-08 08:10:56
Oil Slumps Toward $40 in London With Demand Outlook Souring,yahoofinance,2020-09-08 08:10:56
"Holiday-shortened week, Peloton and Slack earnings: What to know in the week ahead",yahoofinance,2020-09-08 08:10:56
Nokia takes a hit as Samsung secures Verizon 5G deal,yahoofinance,2020-09-08 08:10:56
How to invest in stocks if record-high prices and volatility make you nervous: Morning Brief,yahoofinance,2020-09-08 08:10:56
"No Nord Stream 2? No problem for Germany, economists say",yahoofinance,2020-09-08 08:10:56
Tesla Stockholders Were Betting on It Being Added to the S&P 500. Why Those Hopes Were Dashed.,yahoofinance,2020-09-08 08:10:56
Tesla Under Pressure After SP-500 Snub,yahoofinance,2020-09-08 08:10:56
Goldman Sachs Joins Alibaba-backed Ant’s IPO of Up to $30 Billion Syndicate; Target Price $250,yahoofinance,2020-09-08 08:10:56
Boeing Shares Slide As FAA Probes Manufacturing Flaws in 787 Dreamliner,yahoofinance,2020-09-08 08:10:56
"Tesla shares slide in premarket trade, dragging Nasdaq 100 futures lower",yahoofinance,2020-09-08 08:10:56
Intel Stock Is Down 16% This Year. CEO Bob Swan Shares His Strategy Going Forward.,yahoofinance,2020-09-08 08:10:56
"Dear Wall Street, Your Boss Wants You to Come Back to the Office",yahoofinance,2020-09-08 08:10:56
Jump in Hottest Hong Kong IPO Makes Founder China’s Second Richest,yahoofinance,2020-09-08 08:10:56
"These 2 Stocks Are Worth Buying Despite Recent Market Headwinds, Says Wedbush",yahoofinance,2020-09-08 08:10:56
COMEX’s Gold and Silver Futures Market Trade Data Not Adding Up,yahoofinance,2020-09-08 08:10:56
Trump? Biden? How To Make Money No Matter Who Wins,yahoofinance,2020-09-08 08:10:56
Peloton follows Apple in offering new upgraded versions of existing products,yahoofinance,2020-09-08 08:10:56
"Tech Leads Stocks Lower, Nasdaq Futures Slump: Markets Wrap",yahoofinance,2020-09-08 08:10:56
SoftBank shares slide 7% as tech stock options bets unnerve investors,yahoofinance,2020-09-08 08:10:56
What to Expect in the Markets This Week,yahoofinance,2020-09-08 08:10:56
How to score the lowest 15-year mortgage rate for your refinance,yahoofinance,2020-09-08 08:10:56
"Nasdaq futures down sharply after last week’s tech rout, Dow slips too",yahoofinance,2020-09-08 08:10:56
FAA investigating manufacturing flaws in Boeing 787 jetliners,yahoofinance,2020-09-08 08:10:56
Expectations Running High Ahead Of Peloton Earnings,yahoofinance,2020-09-08 08:10:56
Tony Zhang's Apple Options Trade,yahoofinance,2020-09-08 08:10:56
Goldman’s Oppenheimer Says Tech Can Continue Driving Bull Market,yahoofinance,2020-09-08 08:10:56
"Benzinga's Bulls And Bears Of The Week: Apple, Costco, FedEx And More",yahoofinance,2020-09-08 08:10:56
China Set to Be Top World Corn Buyer on Crop Woes and Demand,yahoofinance,2020-09-08 08:10:56
Gold slips on stronger dollar as focus turns to ECB policy,yahoofinance,2020-09-08 08:10:56
New Blackouts Darken California,yahoofinance,2020-09-08 08:10:56
Pakistan seeking relief from $5.8B fine over mining lease,yahoofinance,2020-09-08 08:10:56
Giant Trader Footprints Leave Trail to Tech Options Strategies,yahoofinance,2020-09-08 08:10:56
EUR/USD Bullish ABC at High Volume Support Zone,yahoofinance,2020-09-08 08:10:56
"Cloud company Sumo Logic to offer 14.8 million shares in planned IPO, priced at $17 to $21 each",yahoofinance,2020-09-08 08:10:56
Peloton Reports Earnings This Week. Here’s What to Expect.,yahoofinance,2020-09-08 08:10:56
Why bankruptcy must be an option for homeowners and small businesses to survive this COVID-19 recession,yahoofinance,2020-09-08 08:10:56
Mylan to pay equivlant of $757 million to buy Aspen's  Europe thrombosis business,yahoofinance,2020-09-08 08:10:56
Steve Grasso Prefers Cyclicals Over Tech Right Now,yahoofinance,2020-09-08 08:10:56
Bitcoin Options Suggest Investors Hedging but Still Long-Term Bullish,yahoofinance,2020-09-08 08:10:56
Oil slides over 3% to lowest since June on demand fears,yahoofinance,2020-09-08 08:10:56
Samsung Electronics wins $6.6 billion Verizon order for network equipment,yahoofinance,2020-09-08 08:10:56
"Oil Industry Talent Has Fled Or Been Fired, So What Comes Next?",yahoofinance,2020-09-08 08:10:56
AB InBev starts search for long-time CEO Brito's successor: FT,yahoofinance,2020-09-08 08:10:56
Experts: Homeowners must move fast to beat new mortgage refinance fee,yahoofinance,2020-09-08 08:10:56
China Seeks to Dent Coal Addiction With Mega Power Complexes,yahoofinance,2020-09-08 08:10:56
"The bull market has plenty of room to run, but a 10% selloff can’t be ruled out, says Goldman",yahoofinance,2020-09-08 08:10:56
African Nations Say They’re Being Ripped Off by Wall Street,yahoofinance,2020-09-08 08:10:56
"II-VI Sell-Off is an Overreaction, Says Five-Star Analyst",yahoofinance,2020-09-08 08:10:56
Egypt in Talks Over Plan to Sell Power to Europe and Africa,yahoofinance,2020-09-08 08:10:56
Japan's Softbank Maverick Makes Billions as 'Nasdaq Whale',yahoofinance,2020-09-08 08:10:56
Progress Software's stock set to rally after raised profit outlook,yahoofinance,2020-09-08 08:10:56
Australia turns to idled factories to pull it out of COVID slump,yahoofinance,2020-09-08 08:10:56
"How IBM Makes Money: Software, Global Business, Tech Services",yahoofinance,2020-09-08 08:10:56
Lululemon Athletica Earnings Preview,yahoofinance,2020-09-08 08:10:56
Silver Price Daily Forecast – Silver Stays Near The 20 EMA,yahoofinance,2020-09-08 08:10:56
"Alphabet Inc. Cl A stock falls Monday, underperforms market",yahoofinance,2020-09-08 08:10:56
"Slack, Peloton, Chewy, and Other Stocks to Watch This Week",yahoofinance,2020-09-08 08:10:56
SoftBank’s Big Options Bet Tests Investor Faith in Masayoshi Son,yahoofinance,2020-09-08 08:10:56
Brexit ‘Trash Talking’ Lifts U.K. Debt Demand to $99 Billion,yahoofinance,2020-09-08 08:10:56
Gold Price Forecast – Gold Markets Quiet on Labor Day,yahoofinance,2020-09-08 08:10:56
Nasdaq Futures Resume Declines With Valuation Angst Lingering,yahoofinance,2020-09-08 08:10:56
S&P 500 Price Forecast – S&P Futures Finding Support at Big Figure,yahoofinance,2020-09-08 08:10:56
How bitcoin met the real world in Africa,yahoofinance,2020-09-08 08:10:56
Argentina Exits Ninth Default After $65 Billion Debt Deal,yahoofinance,2020-09-08 08:10:56
Crude Oil Price Forecast – Crude Oil Markets Pull Back,yahoofinance,2020-09-08 08:10:56
EUR/USD Price Forecast – Euro Pulls Back Slightly,yahoofinance,2020-09-08 08:10:56
"Oil falls after Saudi cuts prices, China slows imports",yahoofinance,2020-09-08 08:10:56
Crude Oil Slips As Saudi Arabia Cuts Official Selling Prices,yahoofinance,2020-09-08 08:10:56
"Daily Gold News: Monday, September 7 – Gold Price Continues Sideways",yahoofinance,2020-09-08 08:10:56
Beyond Meat signs deal to open production facility near Shanghai,yahoofinance,2020-09-08 08:10:56
"Whale Watching, Winning Streak Ends, Nagging Questions: Market Recon",yahoofinance,2020-09-08 08:10:56
"Eli Lilly’s Price Target Raised to $176 with Overweight Rating, $214 in Best Case: Morgan Stanley",yahoofinance,2020-09-08 08:10:56
Tony Zhang Advises Viewer On FedEx Ahead Of Earnings,yahoofinance,2020-09-08 08:10:56
"Notable Insider Buys Last Week: Avis Budget, SmileDirectClub And More",yahoofinance,2020-09-08 08:10:56
Big trade houses see persisting oil stocks bubble,yahoofinance,2020-09-08 08:10:56
Siemens Considers Bentley Systems Bid in New Digital Push,yahoofinance,2020-09-08 08:10:56
Temasek’s China Exposure Surpasses Singapore for First Time,yahoofinance,2020-09-08 08:10:56
"Starbucks adds plant-based items to Asian menus from Beyond Meat, others",yahoofinance,2020-09-08 08:10:56
"Nio gets bullish endorsement from Deutsche Bank, but stock falls",yahoofinance,2020-09-08 08:10:56
Latest Ethereum price and analysis (ETH to USD),yahoofinance,2020-09-08 08:10:56
"Global stocks struggle as tech remains fragile, pound slides",yahoofinance,2020-09-08 08:10:56
Is the Stock Market Open Today? Here Are the Hours for Labor Day 2020.,yahoofinance,2020-09-08 08:10:56
Oil Extends Drop After Saudi Price Cuts Show Demand Concern,yahoofinance,2020-09-08 08:10:56
Cheap seats give Chinese airlines a much-needed passenger bounce,yahoofinance,2020-09-08 08:10:56
The ECB decision is coming — here’s what to expect,yahoofinance,2020-09-08 08:10:56
Need Cash? Read This Before You Take an Early Roth IRA Withdrawal During the Pandemic.,yahoofinance,2020-09-08 08:10:56
U.S. Stock Futures Decline Following Tech Slide,wsj,2020-09-08 08:13:16
"Tesla, Apple, Amazon Down Premarket",wsj,2020-09-08 08:13:16
"Mortgage Market Booms, Even as Virus Hits Economy",wsj,2020-09-08 08:13:16
Production Problems Spur Broad FAA Review of Boeing Dreamliner Lapses,wsj,2020-09-08 08:13:16
Covid-19 Pandemic Has Made Opioid Crisis Worse,wsj,2020-09-08 08:13:16
"Peloton Rides Covid-19 Wave, Adding Products, Cutting Bike Price",wsj,2020-09-08 08:13:16
Boris Johnson’s Plan to Pick Business Winners Stalls Brexit Talks,wsj,2020-09-08 08:13:16
Vaccine Economics: Where Profit and Public Health Collide,wsj,2020-09-08 08:13:16
"Tokyo Olympics Can Coexist With Covid-19, Organizers Say",wsj,2020-09-08 08:13:16
‘We Can’t Just Limp Along’: Americans Reinvent Fall,wsj,2020-09-08 08:13:16
How Apple Became the World’s Most Valuable Publicly Traded Company,wsj,2020-09-08 08:13:16
What It’s Like to Lead Customer Experience at an Airline During the Pandemic,wsj,2020-09-08 08:13:16
Locked Down in the Ritz-Carlton: Winning the Quarantine Hotel Lottery,wsj,2020-09-08 08:13:16
Shopify Is One of the Biggest Pandemic Winners,wsj,2020-09-08 08:13:16
Chinese Car Sales Rebound at Fastest Rate in More Than Two Years,wsj,2020-09-08 08:13:16
Gannett Hires Spotify Veteran in Push for Digital News Subscribers,wsj,2020-09-08 08:13:16
SoftBank’s $4 Billion Tech Option Gambit Feels Like Déjà Vu,wsj,2020-09-08 08:13:16
How Investors Can Harness the Power of Wind,wsj,2020-09-08 08:13:16
Stock Investors Stay Bearish on Apartments,wsj,2020-09-08 08:13:16
Covid-19 Outbreaks Spell Trouble for Student-Housing Owners,wsj,2020-09-08 08:13:16
SL Green’s $3 Billion One Vanderbilt in New York City Faces Big Challenges,wsj,2020-09-08 08:13:16
Belarus Says Major Opposition Leader Detained at Border With Ukraine,wsj,2020-09-08 08:13:16
New Blackouts Darken California,wsj,2020-09-08 08:13:16
U.S. Military Is Offered New Bases in the Pacific,wsj,2020-09-08 08:13:16
The Art World Tiptoes Back With Virtual Sculpture and Chatty Avatars,wsj,2020-09-08 08:13:16
How Does Djokovic Rally From His U.S. Open Bounce?,wsj,2020-09-08 08:13:16
Can You Get Covid-19 From Your Dog? Here’s What Disease Experts Say,wsj,2020-09-08 08:13:16
Why Billy Porter Takes Breaks From the News,wsj,2020-09-08 08:13:16
Pros and Cons of a Do-It-Yourself Annuity in Retirement,wsj,2020-09-08 08:13:16
Investors Still Believe They Can Beat the Stock Market,wsj,2020-09-08 08:13:16
"For Student-Loan Borrowers, There Is Some Relief—but That Isn’t the Whole Story",wsj,2020-09-08 08:13:16
Ulta Beauty Returns to TV Advertising After a Pandemic Pause,wsj,2020-09-08 08:13:16
Advertisers Look for Ways Out as Coronavirus Roils Fall TV,wsj,2020-09-08 08:13:16
New ‘LUMAscape’ Highlights Black-Owned Businesses in Media and Marketing,wsj,2020-09-08 08:13:16
Most Businesses Weren’t Ready for Covid-19. Domino’s Delivered.,wsj,2020-09-08 08:13:16
Remote-Work Technology Fuels M&A Activity During Pandemic,wsj,2020-09-08 08:13:16
PG&E Hires Technology Veteran as CIO,wsj,2020-09-08 08:13:16
Railcar Makers Cut Costs as Pandemic Adds to Industry Woes,wsj,2020-09-08 08:13:16
"CFOs Worry About Salary, Benefit Costs as Pandemic Drags On",wsj,2020-09-08 08:13:16
Companies Issue New Bonds to Pay Down Short-Term Debt Amid Pandemic,wsj,2020-09-08 08:13:16
Treasury and Delaware Sign Pact to Boost Sanctions Enforcement,wsj,2020-09-08 08:13:16
"Pandemic Is An Opportunity to Clean House, Compliance Experts Say",wsj,2020-09-08 08:13:16
Justice Department Gets New Acting Fraud Section Chief,wsj,2020-09-08 08:13:16
Truckers Are Seeing Growing Freight Volumes,wsj,2020-09-08 08:13:16
Container Volumes Shipped to the U.S. Surge After Pandemic Downturn,wsj,2020-09-08 08:13:16
Today’s Logistics Report: Trucking’s Restocking Rush; Combining Auto Parts; Cargo Ship Disaster,wsj,2020-09-08 08:13:16
Why Your Fund Manager Isn’t Looking for Fraud,wsj,2020-09-08 08:13:16
The Head-Scratching Math Behind When to Claim Social Security Benefits,wsj,2020-09-08 08:13:16
These Stocks Will Benefit From Covid-Related Trends,wsj,2020-09-08 08:13:16
UPDATE: Nikola shares soar 45% premarket on news of GM partnership; GM to receive $2 billion in Nikola stock,wsj,2020-09-08 08:13:16
"Nio gets bullish endorsement from Deutsche Bank, but stock falls",wsj,2020-09-08 08:13:16
Packaging company Pactiv Evergreen to offer 41.03 million shares in IPO priced at $18 to $21 each,wsj,2020-09-08 08:13:16
Classic 19th-Century English Home With a Modern Swimming Complex Tucked Behind the Gardens,wsj,2020-09-08 08:13:16
Helpful Hubs to Control All Your Smart Home Gadgets,wsj,2020-09-08 08:13:16
Lead-Up to Labor Day Saw 11 Contracts Signed in Manhattan Luxury Homes,wsj,2020-09-08 08:13:16
20 Minutes With: Hypergiant Industries’ Chief Ethics Officer Will Griffin on Diversity and Ethics in Technology,wsj,2020-09-08 08:13:16
Five Holistic Getaways to Restore Health & Wellness this Fall,wsj,2020-09-08 08:13:16
Lord Snowdon’s Private Collection Is up for Auction at Christie’s Online,wsj,2020-09-08 08:13:16
All the President’s Norms,wsj,2020-09-08 08:13:16
Will Courts Pick the Next President?,wsj,2020-09-08 08:13:16
The Fed Puts Its Independence on the Line,wsj,2020-09-08 08:13:16
How Apple Became the World’s Most Valuable Publicly Traded Company,wsj,2020-09-08 08:13:16
China Increases Pressure on Foreign Journalists,wsj,2020-09-08 08:13:16
Inside the ‘Tear of God’: A Unique House on Crete That Filters the Sun,wsj,2020-09-08 08:13:16
U.S. Debt Poised to Reach Milestone Not Seen Since World War II,wsj,2020-09-08 08:13:16
Schools Reopen in Covid-19 Ground Zero—How Wuhan Did It,wsj,2020-09-08 08:13:16
Why America's Jobs Recovery Is Different From Other Countries',wsj,2020-09-08 08:13:16
Researchers Look to Lab-Made Solution for Future Blood Shortages,wsj,2020-09-08 08:13:16
"Pence Headlines as RNC Focuses on Military, Law Enforcement",wsj,2020-09-08 08:13:16
‘Really Diabolical’: Inside the Coronavirus That Outsmarted Science,wsj,2020-09-08 08:13:16
New U.S. Coronavirus Infections Slow as Labor Day Holiday Winds Down,wsj,2020-09-08 08:13:16
Netflix’s Reed Hastings Deems Remote Work ‘a Pure Negative’ ,wsj,2020-09-08 08:13:16
"Colleges Send Students Home Amid Outbreaks, Raising New Threat",wsj,2020-09-08 08:13:16
"The 1918 Pandemic Was Deadlier, but College Football Continued. Here’s Why.",wsj,2020-09-08 08:13:16
Sentiment Speaks: Do You Really Think We Are About To Crash When Everyone Is Expecting It?,seekingalpha,2020-09-08 08:15:04
Wall Street Breakfast: Heavy Losses For Tech,seekingalpha,2020-09-08 08:15:04
This 'Mini-Crash' Is Likely Only The Beginning,seekingalpha,2020-09-08 08:15:04
"15 High-Yield, Low Volatility Blue-Chips For The Ultimate Crash-Proof Retirement Portfolio",seekingalpha,2020-09-08 08:15:04
General Electric: Just When You Thought Things Couldn't Possibly Get Worse,seekingalpha,2020-09-08 08:15:04
"Amazon's Profits, AWS, And Advertising",seekingalpha,2020-09-08 08:15:04
Buy The Dip Or Regret Missing It,seekingalpha,2020-09-08 08:15:04
Microsoft: Time For A Dividend Raise,seekingalpha,2020-09-08 08:15:04
The House Of Cards Is Ready To Collapse,seekingalpha,2020-09-08 08:15:04
The Crash Proof Portfolio: Do This Now,seekingalpha,2020-09-08 08:15:04
Apple Explains Today's Investing Risks,seekingalpha,2020-09-08 08:15:04
"Nasdaq futures reverse to trade down 2%, doubts swirl over SoftBank theory",seekingalpha,2020-09-08 08:15:04
Crude tumbles further as Saudi price cut highlights weak demand,seekingalpha,2020-09-08 08:15:04
GM and Nikola soar after striking strategic partnership; GM to take 11% stake,seekingalpha,2020-09-08 08:15:04
Tesla -12% after S&P 500 snub sends shockwaves,seekingalpha,2020-09-08 08:15:04
Permian drilling permits up 80% ahead of presidential election,seekingalpha,2020-09-08 08:15:04
Nio lands new bull rating from Deutsche Bank,seekingalpha,2020-09-08 08:15:04
Aurora Cannabis appoints new CEO; sees adjusted gross margin of 46 - 50%; goodwill impairment charges expected up to $1.8B,seekingalpha,2020-09-08 08:15:04
Peloton gains after revealing pricing of new products,seekingalpha,2020-09-08 08:15:04
Leerink softens view on Moderna on competitive pressures on COVID-19 vaccine,seekingalpha,2020-09-08 08:15:04
Merck's gefapixant successful in late-stage chronic cough studies,seekingalpha,2020-09-08 08:15:04
Trump considers 'decoupling' U.S. from China,seekingalpha,2020-09-08 08:15:04
Calm Down: This Time Won't Be Different,seekingalpha,2020-09-08 08:15:04
Closed-End Funds: Clough's 3 Global Hybrid Funds,seekingalpha,2020-09-08 08:15:04
A Leading Internet Retailer In The Bargain Bin: eBay,seekingalpha,2020-09-08 08:15:04
Snowflake: Unfreezing The Data Market,seekingalpha,2020-09-08 08:15:04
Ladder Capital: The Pieces Are In Place For Long-Term Success,seekingalpha,2020-09-08 08:15:04
Baird finds resilience in credit bureaus' Q2 results,seekingalpha,2020-09-08 08:15:04
"Revisiting models shows concerns seem overblown on residential REITs, JPM says",seekingalpha,2020-09-08 08:15:04
"Precision ag buzz points to upside for this equipment maker, BofA says",seekingalpha,2020-09-08 08:15:04
"EV upside shows which auto suppliers to own into 2021, UBS says",seekingalpha,2020-09-08 08:15:04
"For oil/gas, this election just means more, Wells Fargo says",seekingalpha,2020-09-08 08:15:04
Essential Properties Was My Top Pick In 2019 - And It's No One-Hit Wonder,seekingalpha,2020-09-08 08:15:04
The House Of Cards Is Ready To Collapse,seekingalpha,2020-09-08 08:15:04
Turning Point Or Bump?,seekingalpha,2020-09-08 08:15:04
Sentiment Speaks: Do You Really Think We Are About To Crash When Everyone Is Expecting It?,seekingalpha,2020-09-08 08:15:04
The 'K-Shaped' Recovery And The Need For More Fiscal Stimulus - Joe Brusuelas Talks With Alpha Trader (Podcast),seekingalpha,2020-09-08 08:15:04
Cresco Labs Is Going To Struggle But It's Worth Collecting Shares,seekingalpha,2020-09-08 08:15:04
St. Joe Company Is On The Verge Of An Earnings Inflection Point And The Stock Is About To Soar,seekingalpha,2020-09-08 08:15:04
Vista Outdoor Inc.: Buy The Dip For Value And Growth 'Ammunition',seekingalpha,2020-09-08 08:15:04
Pershing Square Holdings: Reasons To Back Bill Ackman Into The End Of 2020,seekingalpha,2020-09-08 08:15:04
PayPal Powering Pandemic Purchases For Cyber 5,seekingalpha,2020-09-08 08:15:04
Essential Properties Was My Top Pick In 2019 - And It's No One-Hit Wonder,seekingalpha,2020-09-08 08:15:04
"September 2020 Stocks - Materials, Communications And Consumer Goods",seekingalpha,2020-09-08 08:15:04
Microsoft: Time For A Dividend Raise,seekingalpha,2020-09-08 08:15:04
Digital Realty Trust: Get Ready To Buy,seekingalpha,2020-09-08 08:15:04
Viper Energy Partners: Expect A Lower Yield In The Future,seekingalpha,2020-09-08 08:15:04
"Western Asset Cuts: DMO Most Affected, Sell Alert For MHF",seekingalpha,2020-09-08 08:15:04
RQI: Discount Tightens - Still A 'Buy' For A Quality REIT Play,seekingalpha,2020-09-08 08:15:04
A Look At Dividend Capture In CEFs,seekingalpha,2020-09-08 08:15:04
"MSCI World - It's U.S. Stocks And Tech, Not 'The World'",seekingalpha,2020-09-08 08:15:04
IGV: Software For The 21st Century - Buy The Dip,seekingalpha,2020-09-08 08:15:04
The House Of Cards Is Ready To Collapse,seekingalpha,2020-09-08 08:15:04
Sentiment Speaks: Do You Really Think We Are About To Crash When Everyone Is Expecting It?,seekingalpha,2020-09-08 08:15:04
"U.S. Threats To Decouple From China, And The Greenback Strengthens",seekingalpha,2020-09-08 08:15:04
On My Mind: Saving For Sunnier Days,seekingalpha,2020-09-08 08:15:04
Monthly Market Monitor - August 2020,seekingalpha,2020-09-08 08:15:04
SoftBank gets burned,cnnbusiness,2020-09-08 08:17:12
The conglomerate takes a $10 billion hit after being unmasked as Nasdaq 'whale',cnnbusiness,2020-09-08 08:17:12
Australian journalists evacuated from China after five-day diplomatic standoff,cnnbusiness,2020-09-08 08:17:12
China imposes new visa restrictions targeting US media,cnnbusiness,2020-09-08 08:17:12
Why the Australia-EU trade model isn't a 'good outcome' for Britain,cnnbusiness,2020-09-08 08:17:12
A multibillion-dollar shopping obsession finally goes mainstream in China,cnnbusiness,2020-09-08 08:17:12
The latest trend in RV'ing: Boondocking,cnnbusiness,2020-09-08 08:17:12
This $1.7M RV lets you go off the grid,cnnbusiness,2020-09-08 08:17:12
Trump attacks the sixth-richest woman in the world for her ties to The Atlantic,cnnbusiness,2020-09-08 08:17:12
The Atlantic's editor-in-chief says his story about Trump calling vets 'losers' is just the beginning,cnnbusiness,2020-09-08 08:17:12
Analysis: Fox News broadcast prompts Trump to target diversity training,cnnbusiness,2020-09-08 08:17:12
'The Princess Bride' cast is reuniting and Ted Cruz is livid about why,cnnbusiness,2020-09-08 08:17:12
Refi rates at 2.42% APR (15 yr). Do you qualify?,cnnbusiness,2020-09-08 08:17:12
"Jobs in these industries won't come back, even after the pandemic ",cnnbusiness,2020-09-08 08:17:12
'Tenet' finally hits US theaters with $20.2 million opening,cnnbusiness,2020-09-08 08:17:12
Bottled water company founder is now China's third-richest man,cnnbusiness,2020-09-08 08:17:12
Airbnb CEO: People are booking months-long stays,cnnbusiness,2020-09-08 08:17:12
"The airline industry could halve, United chairman says",cnnbusiness,2020-09-08 08:17:12
Take your vacation days before you regret it,cnnbusiness,2020-09-08 08:17:12
"American Airlines may lay off 19,000 workers",cnnbusiness,2020-09-08 08:17:12
Airlines desperately need people to fly. That's why the top 3 US carriers are dumping change fees,cnnbusiness,2020-09-08 08:17:12
90% of employers say working remotely hasn't hurt productivity,cnnbusiness,2020-09-08 08:17:12
Evictions are halted: Here's what you need to know,cnnbusiness,2020-09-08 08:17:12
What your new work life might look like,cnnbusiness,2020-09-08 08:17:12
Where do you want to work? ,cnnbusiness,2020-09-08 08:17:12
Fannie and Freddie extend freeze on foreclosures and some evictions,cnnbusiness,2020-09-08 08:17:12
"See Burger King's new three-lane (yes, 3!) drive-thru design",cnnbusiness,2020-09-08 08:17:12
