headline,org,date
‘I Didn’t Buy It to Sell It. Ever.’ MicroStrategy CEO on buying $425M of BTC - CoinDesk,googlenews,2020-09-19 09:09:04
6 new mouth-watering fast-food items,googlenews,2020-09-19 09:09:04
Trump and Biden Virtually Tied in University of Michigan Consumer Sentiment Survey,googlenews,2020-09-19 09:09:04
Why Dave & Buster's Stock Is Rebounding Today After Crashing Yesterday,googlenews,2020-09-19 09:09:04
Bill Gates says Elon Musk couldn't be confused with Steve Jobs - Business Insider,googlenews,2020-09-19 09:09:04
State agents cite three Northeast Ohio bars accused of violating coronavirus-related liquor restrictions,googlenews,2020-09-19 09:09:04
Distributed Energy Scores Big Win in US Wholesale Markets with FERC Order 2222,googlenews,2020-09-19 09:09:04
"Fed's Bostic on Inflation, Economic Outlook and China Trade",googlenews,2020-09-19 09:09:04
"Stocks making the biggest moves midday: U.S. Steel, Tesla, Unity Software, Beyond Meat & more",googlenews,2020-09-19 09:09:04
The hot tech IPOs just keep coming,googlenews,2020-09-19 09:09:04
"Dow Futures, Coronavirus, Unity Software - 5 Things You Must Know Friday",googlenews,2020-09-19 09:09:04
Unity shares close up 31% following market debut,googlenews,2020-09-19 09:09:04
US will ban WeChat and TikTok downloads on Sunday,googlenews,2020-09-19 09:09:04
Trump’s TikTok battle is setting him up for another defeat,googlenews,2020-09-19 09:09:04
The WeChat ban is a difficult but necessary step toward openness in China,googlenews,2020-09-19 09:09:04
TikTok Files Complaint Against Trump Administration to Block US Ban: Report,googlenews,2020-09-19 09:09:04
What are the Fed's new hurdles for rate hikes? Only the Fed knows,googlenews,2020-09-19 09:09:04
Dollar And Treasuries Call Federal Reserve Bluff,googlenews,2020-09-19 09:09:04
New Fed approach takes inflation targeting more seriously | TheHill,googlenews,2020-09-19 09:09:04
The Fed Has Vowed Not to Take Away the Punch Bowl. That’s a Major Policy Shift.,googlenews,2020-09-19 09:09:04
California says fraud inflated jobless claims in recent weeks,googlenews,2020-09-19 09:09:04
"Weekly unemployment claims filed in Pennsylvania reach new pandemic low, down 7% from previous week’s report",googlenews,2020-09-19 09:09:04
COVID-19 danger still driving joblessness,googlenews,2020-09-19 09:09:04
US jobless claims decline only slightly as aid deadlock persists - The Jakarta Post,googlenews,2020-09-19 09:09:04
Clark County health officials see COVID-19 ramifications from air pollution,googlenews,2020-09-19 09:09:04
"Nevada adds 501 new COVID-19 cases, 18 deaths",googlenews,2020-09-19 09:09:04
Over 25% of people who contracted COVID-19 in Clark Co. reported visiting hotel or resort,googlenews,2020-09-19 09:09:04
Clark County sees uptick in COVID-19 cases of 302,googlenews,2020-09-19 09:09:04
Walmart giving pay raises to hourly workers,googlenews,2020-09-19 09:09:04
"Walmart to change store jobs, raise wages",googlenews,2020-09-19 09:09:04
"Walmart raising wages for about 165,000 workers",googlenews,2020-09-19 09:09:04
Walmart creates new lead roles with pay of up to $30 an hour for supercenter managers,googlenews,2020-09-19 09:09:04
"National Cheeseburger Day: Find deals at McDonald’s, Burger King, and more",googlenews,2020-09-19 09:09:04
CBSN Minnesota's 'Daybreaker': National Cheeseburger Day!,googlenews,2020-09-19 09:09:04
Feed Yourself on These National Cheeseburger Day Deals,googlenews,2020-09-19 09:09:04
Celebrate National Cheeseburger Day in style,googlenews,2020-09-19 09:09:04
Massachusetts no longer has the country’s highest unemployment rate,googlenews,2020-09-19 09:09:04
RI Now Has 2nd Highest Unemployment in US,googlenews,2020-09-19 09:09:04
Pennsylvania Unemployment Rate At 10.3% In August,googlenews,2020-09-19 09:09:04
"More than half of Pa. nonfarm jobs lost at the start of the pandemic are now filled, news release says",googlenews,2020-09-19 09:09:04
California unemployment rate dips with help of temporary jobs,googlenews,2020-09-19 09:09:04
What pandemic rebound? Only 27% of Southern California’s lost jobs replaced,googlenews,2020-09-19 09:09:04
"California's Unemployment Rate Falls, But Many Job Gains May Not Last",googlenews,2020-09-19 09:09:04
California unemployment is falling. But economy still in deep hole from COVID-19 shutdown,googlenews,2020-09-19 09:09:04
Roku and Comcast reach agreement to carry Peacock on Roku,googlenews,2020-09-19 09:09:04
"NBCUniversal, Roku reach video distribution deal",googlenews,2020-09-19 09:09:04
"Roku, Comcast reach distribution deal",googlenews,2020-09-19 09:09:04
Roku may lose some NBC channels as dispute over Peacock streaming deal heats up,googlenews,2020-09-19 09:09:04
Stocks end lower after a turbulent week,googlenews,2020-09-19 09:09:04
Dow futures slip early Friday but S&P 500 and Nasdaq aim to rebound to end the week,googlenews,2020-09-19 09:09:04
3 Blue-Chip Stocks to Trade,googlenews,2020-09-19 09:09:04
"S&P, Nasdaq in Third Weekly Loss as Tech Bulls Bail",googlenews,2020-09-19 09:09:04
Here's what the electric Ford F-150 looks like,googlenews,2020-09-19 09:09:04
Ford Wants You to Remember How Good For America the F-150 Is,googlenews,2020-09-19 09:09:04
"Ford reveals the electric F-150's futuristic, LED-festooned front end",googlenews,2020-09-19 09:09:04
"Ford's New Electric F-150 Will Be the Fastest, Most Powerful F-150 Ever",googlenews,2020-09-19 09:09:04
"$100,000 in bribes helped fraudulent Amazon sellers earn $100 million, DOJ says",googlenews,2020-09-19 09:09:04
DOJ charges six people in scheme to bribe Amazon employees to 'gain upper hand' on marketplace,googlenews,2020-09-19 09:09:04
Charge: 6 sellers bribed Amazon employees to gain advantage worth $100 million,googlenews,2020-09-19 09:09:04
U.S. Justice Department indicts six with conspiracy to pay bribes to Amazon employees,googlenews,2020-09-19 09:09:04
Hawaii to reopen to visitors with pre-travel COVID testing,googlenews,2020-09-19 09:09:04
"To Revive Ailing Tourism Economy, Hawaii Says Out-of-State Travelers Can Now Bypass 2-Week Quarantine",googlenews,2020-09-19 09:09:04
Hawaii tentatively reopening to tourists October 15,googlenews,2020-09-19 09:09:04
Hawaii to allow travelers to skip quarantine with virus test,googlenews,2020-09-19 09:09:04
"Moderna CEO downplays vaccine timeline pressure: 'We don't want the first, we want the best'",googlenews,2020-09-19 09:09:04
Refinancing your mortgage will cost more thanks to an 'adverse market' fee,googlenews,2020-09-19 09:09:04
3 Reasons to Switch Mortgage Lenders When You Refinance,googlenews,2020-09-19 09:09:04
"Mortgage and real estate news this week: Falling rates, refi rush",googlenews,2020-09-19 09:09:04
How to Think Long Term With Near-Zero Interest Rates,googlenews,2020-09-19 09:09:04
Fed's Bullard says 'biggest growth quarter of all time' will lift inflation,googlenews,2020-09-19 09:09:04
"Fed's Bostic Says U.S. Economy Slowing, Needs Fiscal Aid",googlenews,2020-09-19 09:09:04
Fed's Kashkari says pandemic aid was also 'banking bailout',googlenews,2020-09-19 09:09:04
Kashkari Urges Big Investors to Demand Banks Hold More Capital,googlenews,2020-09-19 09:09:04
"Ohio unemployment down, but COVID-19 economic recovery slowing",googlenews,2020-09-19 09:09:04
"More than 320,000 jobless Ohioans continue to file for unemployment",googlenews,2020-09-19 09:09:04
"More than 16,000 Ohioans filed for unemployment last week",googlenews,2020-09-19 09:09:04
"Coronavirus: Number of Ohio unemployment claims still high, but continue downward trend",googlenews,2020-09-19 09:09:04
State Fair Vendors Getting Creative To Stay In Business,googlenews,2020-09-19 09:09:04
Arizona State Fair to host drive-thru state fair food event,googlenews,2020-09-19 09:09:04
"Big Tex photo drive-thru, pop-up events allow North Texans to get their State Fair fix this weekend",googlenews,2020-09-19 09:09:04
What to expect from the Kern County Fair Food Drive-Thru,googlenews,2020-09-19 09:09:04
"Bolstering Case for Single Payer, Study Shows For-Profit Insurer Plans Pay Hospitals Nearly 250% More Than Medicare",googlenews,2020-09-19 09:09:04
Gap between what private insurers and Medicare pay hospitals is growing,googlenews,2020-09-19 09:09:04
Houston-area hospitals are charging more than twice Medicare rates,googlenews,2020-09-19 09:09:04
"Private-public insurance hospital bill gap in Wisconsin among highest, report says",googlenews,2020-09-19 09:09:04
Blue Bell Creameries slapped with $17M fine for listeria outbreak,googlenews,2020-09-19 09:09:04
Blue Bell ordered to pay record fine,googlenews,2020-09-19 09:09:04
Blue Bell to pay $17M penalty for 2015 listeria outbreak,googlenews,2020-09-19 09:09:04
Blue Bell ordered to pay $17.25M for 2015 listeria contamination,googlenews,2020-09-19 09:09:04
Solar Power Costs Dropped Dramatically In 2018,googlenews,2020-09-19 09:09:04
California Wildfires Heat Up These 3 Stocks' Solar Battery Prospects,googlenews,2020-09-19 09:09:04
Opinion: BP's wind tilt is more steady breeze than gale,googlenews,2020-09-19 09:09:04
Legislator opens door for regulators to weaken rule that helps rooftop solar market,googlenews,2020-09-19 09:09:04
"CaixaBank and Bankia to merge, creating Spain’s largest bank",googlenews,2020-09-19 09:09:04
"Caixabank, Bankia agree merger terms",googlenews,2020-09-19 09:09:04
CaixaBank and Bankia merge paving the way for Spain to create biggest domestic bank worth more than $786 billion | Markets,googlenews,2020-09-19 09:09:04
"Look for More European Bank Mergers After Spain’s Big Tie-up, Says Citigroup.",googlenews,2020-09-19 09:09:04
Jim Cramer previews corporate earnings reports for the trading week of Sept. 21,googlenews,2020-09-19 09:09:04
US Stocks: Add IPOs to the List of Reasons for Current Volatility,googlenews,2020-09-19 09:09:04
Morning Bell With Jim Cramer: Moderna Vaccine Updates,googlenews,2020-09-19 09:09:04
Cramer's lightning round: I like Plug Power,googlenews,2020-09-19 09:09:04
Lilly partnering with company for antibody production,googlenews,2020-09-19 09:09:04
Lilly and Amgen to collaborate for manufacturing COVID-19 antibody therapies,googlenews,2020-09-19 09:09:04
Apple to launch first online store in India next week,googlenews,2020-09-19 09:09:04
"Apple Store Online in India: Opening date, iPhone trade-ins, and more!",googlenews,2020-09-19 09:09:04
Apple's online store is opening in India on September 23rd,googlenews,2020-09-19 09:09:04
Apple to Begin Online Sales in India Ahead of Holiday Season,googlenews,2020-09-19 09:09:04
Oil Gains Ground As Saudi Arabia Pushes For Full Compliance With OPEC+ Deal,googlenews,2020-09-19 09:09:04
Coronavirus crisis gives oil exporters a crash course in energy transition,googlenews,2020-09-19 09:09:04
"Climate needs less oil, how will producing nations react? | TheHill",googlenews,2020-09-19 09:09:04
"OPEC+ urges 'full conformity' with production cuts, and Saudi Arabia's energy minister warns market gamblers will be hurt 'like hell' | Markets",googlenews,2020-09-19 09:09:04
"Tesla battery day will be 'potentially narrative changing,' says Morgan Stanley",googlenews,2020-09-19 09:09:04
Elon Musk $13 Billion Richer In One Week As Tesla Stock Rises Ahead Of ‘Battery Day’,googlenews,2020-09-19 09:09:04
"Top Stories This Week: Tesla Gears Up for Battery Day, 3 Silver Stock Picks",googlenews,2020-09-19 09:09:04
Tesla’s Big Battery Day Event: What to Expect,googlenews,2020-09-19 09:09:04
The Flight Goes Nowhere. And It's Sold Out.,googlenews,2020-09-19 09:09:04
Qantas latest in growing list of airlines to launch scenic flight to nowhere,googlenews,2020-09-19 09:09:04
Nowhere beckons for Asia-Pacific airlines | Opinion | Flight Global,googlenews,2020-09-19 09:09:04
People Are Paying Good Money for Flights to Nowhere and It's OK,googlenews,2020-09-19 09:09:04
Facebook sued for allegedly spying on Instagram users through their cameras,googlenews,2020-09-19 09:09:04
iPhone camera and iOS 14 at crux of Facebook & Instagram spying lawsuit,googlenews,2020-09-19 09:09:04
"Facebook spied on Instagram users through their iPhone cameras, a new lawsuit claims",googlenews,2020-09-19 09:09:04
Lawsuit accuses Instagram of peeping with iPhone camera,googlenews,2020-09-19 09:09:04
Papa John's founder John Schnatter saddened and disappointed by chain's Atlanta move,googlenews,2020-09-19 09:09:04
Papa John's to open new headquarters in Atlanta,googlenews,2020-09-19 09:09:04
Papa John's pizza chain headquarters moving to metro Atlanta,googlenews,2020-09-19 09:09:04
"Louisville, state business leaders react to Papa John's headquarters news",googlenews,2020-09-19 09:09:04
This tweak to the PPP could save small businesses $7 billion,googlenews,2020-09-19 09:09:04
Did the Paycheck Protection Program work as designed?,googlenews,2020-09-19 09:09:04
Restructurings in the Age of COVID-19 and the CARES Act | New York Law Journal,googlenews,2020-09-19 09:09:04
ACAP Signs Deal With Biz2Credit to License PPP Forgiveness Platform,googlenews,2020-09-19 09:09:04
Nvidia’s Deal for Arm Holdings Is Risky and Very Smart,googlenews,2020-09-19 09:09:04
"Jensen Huang, the chip pioneer strides to the top",googlenews,2020-09-19 09:09:04
Why Arm's sale to Nvidia has stunned the tech industry,googlenews,2020-09-19 09:09:04
"Tech Tent: ARM, TikTok and the battle for tech supremacy",googlenews,2020-09-19 09:09:04
"Last call for Pennsylvania bars and restaurants will be at 11 p.m., effective Monday",googlenews,2020-09-19 09:09:04
On-site alcohol sales in Pa. to be extended one hour to 11 p.m.,googlenews,2020-09-19 09:09:04
"Bars, restaurant owners say Gov. Wolf's new mandate is 'double-edge sword'",googlenews,2020-09-19 09:09:04
Gov. Wolf pushes Pennsylvania's last call to 11 pm,googlenews,2020-09-19 09:09:04
Is your Bed Bath & Beyond store closing? See the full list of the 63 stores slated to close by the end of 2020,googlenews,2020-09-19 09:09:04
Bed Bath & Beyond release list of stores to close in 2020,googlenews,2020-09-19 09:09:04
"Bed Bath & Beyond store closings: 6 NY locations, 1 in Syracuse area, to shut down",googlenews,2020-09-19 09:09:04
"Bed Bath & Beyond closing 3 stores in NYC, 2 in NJ, 4 in CT",googlenews,2020-09-19 09:09:04
"TikTok CEO asks Instagram, Facebook to help fight TikTok ban",googlenews,2020-09-19 09:09:04
TikTok files complaint against US ban,googlenews,2020-09-19 09:09:04
How to Use Instagram Reels,googlenews,2020-09-19 09:09:04
TikTok CEO asks Instagram and Facebook to help fight ban,googlenews,2020-09-19 09:09:04
Ericsson to buy US wireless networking firm Cradlepoint in $1.1B deal,googlenews,2020-09-19 09:09:04
Boise-based Cradlepoint sells for $1.1 billion,googlenews,2020-09-19 09:09:04
Ericsson targets enterprise with $1.1B Cradlepoint acquisition,googlenews,2020-09-19 09:09:04
Ericsson Plunks $1.1B on Cradlepoint to Boost 5G WAN in Enterprise,googlenews,2020-09-19 09:09:04
Cal/OSHA Order Sets New Virus Protections Following Oakland McDonald's Worker's Testimony,googlenews,2020-09-19 09:09:04
Sept. 18 coronavirus roundup for San Benito County,googlenews,2020-09-19 09:09:04
MSC Cruises Reports a Successful Restart to Cruising,googlenews,2020-09-19 09:09:04
Carnival Cruise Line selling 18 ships amid coronavirus pandemic,googlenews,2020-09-19 09:09:04
Carnival Cruise Line Cancels Trips Into 2021,googlenews,2020-09-19 09:09:04
MSC Cruises Releases Photos of First Ship to Resume Operations,googlenews,2020-09-19 09:09:04
"Roche arthritis drug reduces likelihood COVID-19 patients will need ventilator, company claims",googlenews,2020-09-19 09:09:04
"Genentech Drug Benefits Patients with COVID-19-Associated Pneumonia, Study Shows",googlenews,2020-09-19 09:09:04
Roche's Actemra reduces ventilation need in Covid-19 patients,googlenews,2020-09-19 09:09:04
"Roche rises on word of COVID trial win, new test and European cancer drug nod",googlenews,2020-09-19 09:09:04
Over 500 Las Vegas Wynn Resorts Employees Test Positive for COVID-19,googlenews,2020-09-19 09:09:04
Encore poker room reopening this month,googlenews,2020-09-19 09:09:04
Las Vegas Sands reveals 424 employees tested positive for COVID-19,googlenews,2020-09-19 09:09:04
Wynn Resorts: 548 Las Vegas Employees Tested Positive for Covid-19,googlenews,2020-09-19 09:09:04
"Soybean Prices Hit Two-Year High, Buoyed by Chinese Demand",googlenews,2020-09-19 09:09:04
"August weather may have sparked funds, China to get long corn and soybeans, analyst says",googlenews,2020-09-19 09:09:04
10 days in a row for soybean sales to China,googlenews,2020-09-19 09:09:04
"Farmers to plant more soybeans next year, stand pat on corn",googlenews,2020-09-19 09:09:04
How to File Your DeFi Taxes in the US,googlenews,2020-09-19 09:09:04
Ethereum's Gas Spike Forces Coinbase Pro to Pass Network Fees to Customers,googlenews,2020-09-19 09:09:04
"Blockchain Bites: Airdrops, Record Volumes, $1B BTC on Ethereum - CoinDesk",googlenews,2020-09-19 09:09:04
Etherum Fees Double In a Week As DeFi Heats Up,googlenews,2020-09-19 09:09:04
Your Bill May Be 10% Higher - City Council Passes COVID-19 Recovery Charge For Restaurants,googlenews,2020-09-19 09:09:04
NYC & Company launches tourism revitalization program,googlenews,2020-09-19 09:09:04
Watch Hot Zone: Anger as NYC in-person school delayed; eateries won’t hit diners with COVID surcharge,googlenews,2020-09-19 09:09:04
Restaurants fire back over optional COVID-19 recovery charge bill,googlenews,2020-09-19 09:09:04
Lunken Airport restaurant to close permanently,googlenews,2020-09-19 09:09:04
Sky Galley closing after decades of business,googlenews,2020-09-19 09:09:04
Sky Galley restaurant at Lunken Airport to close permanently,googlenews,2020-09-19 09:09:04
Sky Galley restaurant at Cincinnati's Lunken Airport is closing for good this Sunday,googlenews,2020-09-19 09:09:04
Cracker Barrel to add mimosas and other alcoholic drinks to menus,googlenews,2020-09-19 09:09:04
Cracker Barrel adding alcoholic drinks to its menus,googlenews,2020-09-19 09:09:04
East Ridge Cracker Barrel to sell alcohol,googlenews,2020-09-19 09:09:04
Terre Haute Cracker Barrel among chain restaurants adding alcoholic drinks to its menu,googlenews,2020-09-19 09:09:04
Tesla wins key ruling in legal battle against former employee,googlenews,2020-09-19 09:09:04
Tesla wins case against Gigafactory whistleblower,googlenews,2020-09-19 09:09:04
Tesla wins lawsuit against former employee accused of hacking company data,googlenews,2020-09-19 09:09:04
"Tesla wins case against former employee accused of hacking, transferring data",googlenews,2020-09-19 09:09:04
EPA approves Pine-Sol to kill coronavirus on surfaces,googlenews,2020-09-19 09:09:04
Pine-Sol now approved to kill coronavirus on surfaces: EPA,googlenews,2020-09-19 09:09:04
Pine-Sol’s claims to kill coronavirus on surfaces approved by US Environmental Protection Agency,googlenews,2020-09-19 09:09:04
EPA approves Pine-Sol as cleaning product you can use to kill coronavirus on surfaces,googlenews,2020-09-19 09:09:04
NYC tries $50 fines to get scofflaws to don masks on subway,googlenews,2020-09-19 09:09:04
"Reopen NYC: MTA says they've handed out 180,000 free face masks since start of $50 fine",googlenews,2020-09-19 09:09:04
"When a Bus Driver Told a Rider to Wear a Mask, 'He Knocked Me Out Cold'",googlenews,2020-09-19 09:09:04
Here's How MTA Riders Did Since the Mask Fine Went Into Effect Monday,googlenews,2020-09-19 09:09:04
"You could earn $50,000 by being this beer company’s ‘Chief Exploration Officer'",googlenews,2020-09-19 09:09:04
"Michelob Ultra will pay 'Chief Exploration Officer' $50,000 to explore national parks",googlenews,2020-09-19 09:09:04
Michelob Ultra looking to pay ‘chief exploration officer’ $50K to visit national parks,googlenews,2020-09-19 09:09:04
Love spending time outdoors? A beer company is paying for someone to explore national parks,googlenews,2020-09-19 09:09:04
Only 14M Bitcoin (BTC) Will Ever be In Circulation - Crypto Analyst,googlenews,2020-09-19 09:09:04
4 Things You Should Know Before You Short Bitcoin On Margin,googlenews,2020-09-19 09:09:04
MicroStrategy CEO says ‘Bitcoin scales just fine as store of value’,googlenews,2020-09-19 09:09:04
"Despite Cautiously Rising, On-Chain Data Says Bitcoin Is Due for a Steep Correction",googlenews,2020-09-19 09:09:04
"U.S. consumer sentiment climbs, inflation falls in September",googlenews,2020-09-19 09:09:04
"Democrats boost U.S. consumer sentiment, current account deficit widens 52.9%",googlenews,2020-09-19 09:09:04
"US consumer sentiment hit a 6-month high in September, beating economist forecasts",googlenews,2020-09-19 09:09:04
GDP and Election Implications as Consumer Spending and Consumer Sentiment Conflict,googlenews,2020-09-19 09:09:04
Nearly 300 employees to be laid off at Dave & Buster’s in Rochester after COVID-19 forced closure,googlenews,2020-09-19 09:09:04
Dave & Buster's in Henrietta to lay off nearly 300 workers,googlenews,2020-09-19 09:09:04
"Dave & Buster’s warns of possibility of its bankruptcy, layoffs: report",googlenews,2020-09-19 09:09:04
Dave & Buster’s Sinks 26% On Bankruptcy Threat Report; Truist Says Buy,googlenews,2020-09-19 09:09:04
Bill Gates on the difference between Elon Musk and Steve Jobs,googlenews,2020-09-19 09:09:04
Bill Gates debunks Elon Musk’s comparisons to Steve Jobs,googlenews,2020-09-19 09:09:04
Bill Gates Responds To Elon Musk’s Disparaging Tweet,googlenews,2020-09-19 09:09:04
Is Elon Musk The New Steve Jobs? Bill Gates Says No,googlenews,2020-09-19 09:09:04
"Seven Ohio bars cited for violation of COVID-19 alcohol curfew, three bars in Northeast Ohio included on the list",googlenews,2020-09-19 09:09:04
"State cites 3 area bars for serving too late, social distance violations",googlenews,2020-09-19 09:09:04
3 Northeast Ohio bars among those cited overnight for violating coronavirus orders,googlenews,2020-09-19 09:09:04
Three local bars cited for violating state COVID-19 rules – BG Independent News,googlenews,2020-09-19 09:09:04
Unity Software Caps Off a Week of Blockbuster IPOs,motleyfool,2020-09-19 09:11:12
2 Cheap Stocks to Buy Before the COVID-19 Vaccine,motleyfool,2020-09-19 09:11:12
3 Top Stocks Under $20,motleyfool,2020-09-19 09:11:12
"Before You Buy Snowflake, Take a Look at These Cloud Software Companies",motleyfool,2020-09-19 09:11:12
"Good News, Seniors: You're Probably Getting a Social Security Raise in 2021",motleyfool,2020-09-19 09:11:12
Microsoft and Sony Are Racing to Offer Gamers More Exclusive Titles,motleyfool,2020-09-19 09:11:12
Where Will Cisco Systems Be in 5 Years?,motleyfool,2020-09-19 09:11:12
"You Don't Need a Stock Split to Buy Amazon, Even If You Don't Have $3,100",motleyfool,2020-09-19 09:11:12
Why This Under-the-Radar Stock Is a Buy,motleyfool,2020-09-19 09:11:12
Are the Gains Over for This Early Leader in the Coronavirus Vaccine Race?,motleyfool,2020-09-19 09:11:12
Is This 5G Stock About to Crush the Market Once Again?,motleyfool,2020-09-19 09:11:12
Is Cresco Labs Stock a Buy?,motleyfool,2020-09-19 09:11:12
3 Tech Stocks to Buy in the Market Correction,motleyfool,2020-09-19 09:11:12
Is Aurora Cannabis Stock a Buy?,motleyfool,2020-09-19 09:11:12
Here Are the Top Signs We're Headed for an Extended Bear Market,motleyfool,2020-09-19 09:11:12
How Much You Need for Retirement Depends on These 4 Factors,motleyfool,2020-09-19 09:11:12
"Average Americans Would Need an Extra $145,650 to Adjust for Social Security Cuts",motleyfool,2020-09-19 09:11:12
Better Marijuana Stock: Aphria vs. Aurora Cannabis,motleyfool,2020-09-19 09:11:12
3 Surprising Ways You Can Play the Electric-Vehicle Revolution,motleyfool,2020-09-19 09:11:12
3 Reasons You'll Regret Retiring Early,motleyfool,2020-09-19 09:11:12
2 Industrial Stocks You Can Buy and Hold for the Next Decade,motleyfool,2020-09-19 09:11:12
"""Mulan"" Looks Like a Big Win for Disney+",motleyfool,2020-09-19 09:11:12
"With Oil Crashing Again, These 3 Stocks Are Buys",motleyfool,2020-09-19 09:11:12
3 Stocks Everyone Else Hates (But I Love),motleyfool,2020-09-19 09:11:12
Is GrowGeneration a Buy?,motleyfool,2020-09-19 09:11:12
Better Cannabis Stock: Charlotte's Web or Cresco Labs?,motleyfool,2020-09-19 09:11:12
Where Will Amgen Be in 1 Year?,motleyfool,2020-09-19 09:11:12
We Ask Successful Investors: Are You Afraid of the Stock Market Right Now?,motleyfool,2020-09-19 09:11:12
These 3 Stocks Will Safeguard Your Retirement Plans During a Market Crash,motleyfool,2020-09-19 09:11:12
Is Cronos Group Stock a Buy?,motleyfool,2020-09-19 09:11:12
These 2 Companies Will Win Big From a Second Stimulus Check,motleyfool,2020-09-19 09:11:12
Is Stock Market Crash 2.0 Imminent?,motleyfool,2020-09-19 09:11:12
Investing Lessons From Retail Stock Market Earnings Season,motleyfool,2020-09-19 09:11:12
What to Look for When Nike Reports Q1 Earnings on Tuesday,motleyfool,2020-09-19 09:11:12
Is This Market Correction the Right Time to Buy Fluidigm?,motleyfool,2020-09-19 09:11:12
Here's How Investors Can Build a Diversified Portfolio in a Matter of Minutes,motleyfool,2020-09-19 09:11:12
Better Coronavirus Stock: AstraZeneca or Moderna?,motleyfool,2020-09-19 09:11:12
The Truth About Social Security and Immigration,motleyfool,2020-09-19 09:11:12
The 4 Fastest-Growing Stocks Robinhood Investors Are Buying,motleyfool,2020-09-19 09:11:12
Why You Should Avoid Buying Eastman Kodak Stock Right Now,motleyfool,2020-09-19 09:11:12
Unity Software Allowing Employees to Sell Company Shares on Day One,motleyfool,2020-09-19 09:11:12
Why the Apple Watch Is a Big Deal,motleyfool,2020-09-19 09:11:12
Why You Must Re-evaluate Your Portfolio Now,motleyfool,2020-09-19 09:11:12
Google Telehealth Partner Amwell Zooms 28% Higher in First Days of Trading,motleyfool,2020-09-19 09:11:12
Supreme Court Justice Ruth Bader Ginsburg dies from cancer at 87,foxbusiness,2020-09-19 09:13:47
Record of decisions with economic impacts,foxbusiness,2020-09-19 09:13:47
"
Cook, Zuckerberg, other biz leaders react",foxbusiness,2020-09-19 09:13:47
