headline,org,date
Stocks week ahead: Gamestop proves the death of the individual investor was greatly exaggerated,msnmoney,2021-01-31 09:18:40
How Rich Are These Top CEOs?,msnmoney,2021-01-31 09:18:40
These 8 words sent me on a 39-year family quest,msnmoney,2021-01-31 09:18:40
"The majority of Americans were forced to withdraw from their retirement in 2020, survey says",msnmoney,2021-01-31 09:18:40
Why Now Is the Time To Invest In These 10 Companies,msnmoney,2021-01-31 09:18:40
1 Simple Trick to Cut Your Electric Bill by 90%,msnmoney,2021-01-31 09:18:40
"Apple breaks Sundance record with $25 million acquisition of the movie 'Coda,' outbidding Netflix and Amazon",msnmoney,2021-01-31 09:18:40
What Actually Happens If You Don’t Pay Your Taxes,msnmoney,2021-01-31 09:18:40
7 Signs That You’re Ready To Buy a House,msnmoney,2021-01-31 09:18:40
Unique Tip If Your Car Has Automatic Headlights,msnmoney,2021-01-31 09:18:40
A popular chocolate shop and more chains closing locations,msnmoney,2021-01-31 09:18:40
West Chester: Why I Bought Tiny Hearing Aids Online,msnmoney,2021-01-31 09:18:40
"GameStop mayhem hits close to home for co-founder's son, who's active on WallStreetBets",msnmoney,2021-01-31 09:18:40
"Mountain Dew, moonshine, and more secret brand histories",msnmoney,2021-01-31 09:18:40
Approaching Retirement? Here's How You Should Think About Your Stock Investments,msnmoney,2021-01-31 09:18:40
Signs that you should be preparing to buy a new car,msnmoney,2021-01-31 09:18:40
"SABIC expects vaccine rollout to boost its petrochemical sales, earnings",msnmoney,2021-01-31 09:18:40
Woman Fixes Poor Posture And Back Pain With Simple Trick,msnmoney,2021-01-31 09:18:40
Charming cabins for sale across America,msnmoney,2021-01-31 09:18:40
When should you invest in a taxable account?,msnmoney,2021-01-31 09:18:40
What It Takes To Save $1 Million for Retirement,msnmoney,2021-01-31 09:18:40
Shandong Xinchao Plans $420 Million U.S. Energy Asset Purchase,msnmoney,2021-01-31 09:18:40
6 Uncommon Job Benefits You Should Demand Right Now,msnmoney,2021-01-31 09:18:40
1 Simple Trick to Cut Your Electric Bill by 90%,msnmoney,2021-01-31 09:18:40
Lifestyle creep: What it is & how to avoid it,msnmoney,2021-01-31 09:18:40
Another beloved pizza chain filed for bankruptcy this week,msnmoney,2021-01-31 09:18:40
Israel’s FinTLV Raises $120 Million for New Fintech Fund,msnmoney,2021-01-31 09:18:40
How divorce is different since the pandemic,msnmoney,2021-01-31 09:18:40
19 lazy ways to make money,msnmoney,2021-01-31 09:18:40
24 Unique Gifts Everybody Actually Wants,msnmoney,2021-01-31 09:18:40
Warren Buffett’s 15 Biggest Money Mistakes — and What You Can Learn From Them,msnmoney,2021-01-31 09:18:40
TPG Sells More Than 10% of Novotech to Investors Ahead of IPO,msnmoney,2021-01-31 09:18:40
21 investing mistakes to avoid,msnmoney,2021-01-31 09:18:40
9 Ways to Screw Up a Job Search When You’re 50 or Older,msnmoney,2021-01-31 09:18:40
Myths about home-buying that need to be debunked,msnmoney,2021-01-31 09:18:40
Best & Worst Refinance Mortgage Companies of 2021,msnmoney,2021-01-31 09:18:40
Robinhood Struggles With the Monster It Created,msnmoney,2021-01-31 09:18:40
40 Cities That Could Be Poised For a Housing Crisis,msnmoney,2021-01-31 09:18:40
7 Tricks Grocery Stores Use to Make You Spend More,msnmoney,2021-01-31 09:18:40
Just How Rich Are President Joe Biden and These Other Big Names?,msnmoney,2021-01-31 09:18:40
GameStop and Reddit news: Here are the 5 things you need to know,msnmoney,2021-01-31 09:18:40
How to buy Apple devices without paying Apple prices,msnmoney,2021-01-31 09:18:40
Saving strategies that could cost you money,msnmoney,2021-01-31 09:18:40
Inside Oprah's amazing homes: from Promised Land to her Maui farmhouse,msnmoney,2021-01-31 09:18:40
IRS Delayed Refunds Last Year for Millions of Taxpayers — Here’s How To Get Yours Faster,msnmoney,2021-01-31 09:18:40
Here’s what the robot fund that’s beating the S&P 500 is investing in now,msnmoney,2021-01-31 09:18:40
What Income Level Is Considered Middle Class in Your State?,msnmoney,2021-01-31 09:18:40
She sticks a rose stalk into a potato and look what happens a week later!,msnmoney,2021-01-31 09:18:40
Lucky American lottery winners who kept on winning,msnmoney,2021-01-31 09:18:40
"Katie, Keanu, and other famously cheap celebs",msnmoney,2021-01-31 09:18:40
"The ‘ice is cracking’ on the bull market, one stock-market analyst warns",msnmoney,2021-01-31 09:18:40
Forget GameStop: The best investments to make in 2021,msnmoney,2021-01-31 09:18:40
22 ways to score free gift cards,msnmoney,2021-01-31 09:18:40
Rare Photographs Capture Chilling Historical Moments,msnmoney,2021-01-31 09:18:40
"Absolutely massive homes listed for less than $100,000",msnmoney,2021-01-31 09:18:40
How an options-trading frenzy is lifting stocks and stirring fears of a market bubble,msnmoney,2021-01-31 09:18:40
The dirtiest and cleanest cities in the U.S.,msnmoney,2021-01-31 09:18:40
The last 2 Toys 'R' Us stores in the US have closed down after the COVID-19 pandemic hit sales,msnmoney,2021-01-31 09:18:40
Homeowners association horror stories,msnmoney,2021-01-31 09:18:40
Why Refinancing Your Debt to a Lower Rate Doesn't Always Save You Money,msnmoney,2021-01-31 09:18:40
1 Simple Trick to Cut Your Electric Bill by 90%,msnmoney,2021-01-31 09:18:40
23 Secret Ways To Save Money on Amazon,msnmoney,2021-01-31 09:18:40
"Short sellers down a net $54 billion on U.S. positions so far this year, data provider says",msnmoney,2021-01-31 09:18:40
6 People Who Faced Tax Audits Have These Tips for You,msnmoney,2021-01-31 09:18:40
The best county for retirees in every state,msnmoney,2021-01-31 09:18:40
10 Billionaires Like Oprah Winfrey Who Grew Up Poor,msnmoney,2021-01-31 09:18:40
Best Healthcare Stocks to Buy in 2021,msnmoney,2021-01-31 09:18:40
Rare Photographs Capture Chilling Last Known Moments,msnmoney,2021-01-31 09:18:40
Why You Shouldn’t Assume You’re Getting a Tax Refund,msnmoney,2021-01-31 09:18:40
Don’t wait for another stimulus check to fix your finances: Take this 5-day money challenge now,msnmoney,2021-01-31 09:18:40
15 Best Tax Tips for Investors,msnmoney,2021-01-31 09:18:40
An open letter to the GameStop army on Reddit,msnmoney,2021-01-31 09:18:40
10 Jobs That Grant You These Unique Tax Deductions,msnmoney,2021-01-31 09:18:40
3 Effective Strategies I've Used to Boost My Retirement Savings,msnmoney,2021-01-31 09:18:40
Stocks week ahead: Gamestop proves the death of the individual investor was greatly exaggerated,msnmoney,2021-01-31 09:18:40
How Rich Are These Top CEOs?,msnmoney,2021-01-31 09:18:40
These 8 words sent me on a 39-year family quest,msnmoney,2021-01-31 09:18:40
"The majority of Americans were forced to withdraw from their retirement in 2020, survey says",msnmoney,2021-01-31 09:18:40
Why Now Is the Time To Invest In These 10 Companies,msnmoney,2021-01-31 09:18:40
1 Simple Trick to Cut Your Electric Bill by 90%,msnmoney,2021-01-31 09:18:40
"Apple breaks Sundance record with $25 million acquisition of the movie 'Coda,' outbidding Netflix and Amazon",msnmoney,2021-01-31 09:18:40
What Actually Happens If You Don’t Pay Your Taxes,msnmoney,2021-01-31 09:18:40
7 Signs That You’re Ready To Buy a House,msnmoney,2021-01-31 09:18:40
Unique Tip If Your Car Has Automatic Headlights,msnmoney,2021-01-31 09:18:40
A popular chocolate shop and more chains closing locations,msnmoney,2021-01-31 09:18:40
West Chester: Why I Bought Tiny Hearing Aids Online,msnmoney,2021-01-31 09:18:40
"GameStop mayhem hits close to home for co-founder's son, who's active on WallStreetBets",msnmoney,2021-01-31 09:18:40
"Mountain Dew, moonshine, and more secret brand histories",msnmoney,2021-01-31 09:18:40
Approaching Retirement? Here's How You Should Think About Your Stock Investments,msnmoney,2021-01-31 09:18:40
Signs that you should be preparing to buy a new car,msnmoney,2021-01-31 09:18:40
"SABIC expects vaccine rollout to boost its petrochemical sales, earnings",msnmoney,2021-01-31 09:18:40
Woman Fixes Poor Posture And Back Pain With Simple Trick,msnmoney,2021-01-31 09:18:40
Charming cabins for sale across America,msnmoney,2021-01-31 09:18:40
When should you invest in a taxable account?,msnmoney,2021-01-31 09:18:40
What It Takes To Save $1 Million for Retirement,msnmoney,2021-01-31 09:18:40
Shandong Xinchao Plans $420 Million U.S. Energy Asset Purchase,msnmoney,2021-01-31 09:18:40
6 Uncommon Job Benefits You Should Demand Right Now,msnmoney,2021-01-31 09:18:40
1 Simple Trick to Cut Your Electric Bill by 90%,msnmoney,2021-01-31 09:18:40
Lifestyle creep: What it is & how to avoid it,msnmoney,2021-01-31 09:18:40
Another beloved pizza chain filed for bankruptcy this week,msnmoney,2021-01-31 09:18:40
Israel’s FinTLV Raises $120 Million for New Fintech Fund,msnmoney,2021-01-31 09:18:40
How divorce is different since the pandemic,msnmoney,2021-01-31 09:18:40
19 lazy ways to make money,msnmoney,2021-01-31 09:18:40
24 Unique Gifts Everybody Actually Wants,msnmoney,2021-01-31 09:18:40
Warren Buffett’s 15 Biggest Money Mistakes — and What You Can Learn From Them,msnmoney,2021-01-31 09:18:40
TPG Sells More Than 10% of Novotech to Investors Ahead of IPO,msnmoney,2021-01-31 09:18:40
21 investing mistakes to avoid,msnmoney,2021-01-31 09:18:40
9 Ways to Screw Up a Job Search When You’re 50 or Older,msnmoney,2021-01-31 09:18:40
Myths about home-buying that need to be debunked,msnmoney,2021-01-31 09:18:40
Best & Worst Refinance Mortgage Companies of 2021,msnmoney,2021-01-31 09:18:40
Robinhood Struggles With the Monster It Created,msnmoney,2021-01-31 09:18:40
40 Cities That Could Be Poised For a Housing Crisis,msnmoney,2021-01-31 09:18:40
7 Tricks Grocery Stores Use to Make You Spend More,msnmoney,2021-01-31 09:18:40
Just How Rich Are President Joe Biden and These Other Big Names?,msnmoney,2021-01-31 09:18:40
GameStop and Reddit news: Here are the 5 things you need to know,msnmoney,2021-01-31 09:18:40
How to buy Apple devices without paying Apple prices,msnmoney,2021-01-31 09:18:40
Saving strategies that could cost you money,msnmoney,2021-01-31 09:18:40
Inside Oprah's amazing homes: from Promised Land to her Maui farmhouse,msnmoney,2021-01-31 09:18:40
IRS Delayed Refunds Last Year for Millions of Taxpayers — Here’s How To Get Yours Faster,msnmoney,2021-01-31 09:18:40
Here’s what the robot fund that’s beating the S&P 500 is investing in now,msnmoney,2021-01-31 09:18:40
What Income Level Is Considered Middle Class in Your State?,msnmoney,2021-01-31 09:18:40
She sticks a rose stalk into a potato and look what happens a week later!,msnmoney,2021-01-31 09:18:40
Lucky American lottery winners who kept on winning,msnmoney,2021-01-31 09:18:40
"Katie, Keanu, and other famously cheap celebs",msnmoney,2021-01-31 09:18:40
"The ‘ice is cracking’ on the bull market, one stock-market analyst warns",msnmoney,2021-01-31 09:18:40
Forget GameStop: The best investments to make in 2021,msnmoney,2021-01-31 09:18:40
22 ways to score free gift cards,msnmoney,2021-01-31 09:18:40
Rare Photographs Capture Chilling Historical Moments,msnmoney,2021-01-31 09:18:40
"Absolutely massive homes listed for less than $100,000",msnmoney,2021-01-31 09:18:40
How an options-trading frenzy is lifting stocks and stirring fears of a market bubble,msnmoney,2021-01-31 09:18:40
The dirtiest and cleanest cities in the U.S.,msnmoney,2021-01-31 09:18:40
The last 2 Toys 'R' Us stores in the US have closed down after the COVID-19 pandemic hit sales,msnmoney,2021-01-31 09:18:40
Homeowners association horror stories,msnmoney,2021-01-31 09:18:40
Why Refinancing Your Debt to a Lower Rate Doesn't Always Save You Money,msnmoney,2021-01-31 09:18:40
1 Simple Trick to Cut Your Electric Bill by 90%,msnmoney,2021-01-31 09:18:40
23 Secret Ways To Save Money on Amazon,msnmoney,2021-01-31 09:18:40
"Short sellers down a net $54 billion on U.S. positions so far this year, data provider says",msnmoney,2021-01-31 09:18:40
6 People Who Faced Tax Audits Have These Tips for You,msnmoney,2021-01-31 09:18:40
The best county for retirees in every state,msnmoney,2021-01-31 09:18:40
10 Billionaires Like Oprah Winfrey Who Grew Up Poor,msnmoney,2021-01-31 09:18:40
Best Healthcare Stocks to Buy in 2021,msnmoney,2021-01-31 09:18:40
Rare Photographs Capture Chilling Last Known Moments,msnmoney,2021-01-31 09:18:40
Why You Shouldn’t Assume You’re Getting a Tax Refund,msnmoney,2021-01-31 09:18:40
Don’t wait for another stimulus check to fix your finances: Take this 5-day money challenge now,msnmoney,2021-01-31 09:18:40
15 Best Tax Tips for Investors,msnmoney,2021-01-31 09:18:40
An open letter to the GameStop army on Reddit,msnmoney,2021-01-31 09:18:40
10 Jobs That Grant You These Unique Tax Deductions,msnmoney,2021-01-31 09:18:40
3 Effective Strategies I've Used to Boost My Retirement Savings,msnmoney,2021-01-31 09:18:40
The GameStop short squeeze was 'the grand awakening': expert,yahoofinance,2021-01-31 09:20:44
Xiaomi says legal complaint against US to protect its interests,yahoofinance,2021-01-31 09:20:44
China's HNA discloses embezzlements of nearly $10 billion,yahoofinance,2021-01-31 09:20:44
Panasonic to stop making solar panels facing China prices,yahoofinance,2021-01-31 09:20:44
'This is a great earnings season and the economy looks like it’s doing okay': Strategist on the state of the market,yahoofinance,2021-01-31 09:20:44
Coronavirus update: J&J vaccine 72% effective in US trial; South African strain found in U.S.,yahoofinance,2021-01-31 09:20:44
Robinhood CEO on why it suspended GameStop trading,yahoofinance,2021-01-31 09:20:44
Will the SEC sue GME traders? Could be 'weird' challenge,yahoofinance,2021-01-31 09:20:44
Car Insurance for PA Drivers,yahoofinance,2021-01-31 09:20:44
"Dow Jones Futures: What To Do Before Monday's Stock Market Open; GME Stock, Nio In Focus",yahoofinance,2021-01-31 09:20:44
Nine Investors Instantly Make $16 Billion On GameStop Stock 'Squeeze',yahoofinance,2021-01-31 09:20:44
"After GME, Dogecoin and Bitcoin, Chinese Traders Are Betting What Will Pump Next",yahoofinance,2021-01-31 09:20:44
The biggest losers from the GameStop turmoil? An early list,yahoofinance,2021-01-31 09:20:44
10 Short Squeeze Candidates Under $10,yahoofinance,2021-01-31 09:20:44
7 Tech Stocks That Could Be the Future FAANG,yahoofinance,2021-01-31 09:20:44
The GameStop short squeeze was 'the grand awakening': expert,yahoofinance,2021-01-31 09:20:44
Why Are So Many Americans Predicting A Housing Market Crash?,yahoofinance,2021-01-31 09:20:44
Best Dividend Stocks For 2021: Four Strong-Yield Stocks Beating The S&P 500,yahoofinance,2021-01-31 09:20:44
"4 Top Stock Trades for Monday: AAPL, AMD, SLV, SPY",yahoofinance,2021-01-31 09:20:44
"Reddit and Robinhood gamified the stock market, and it’s going to end badly",yahoofinance,2021-01-31 09:20:44
"How the tale of Reddit, GameStop, Robinhood is really about 5 big trends",yahoofinance,2021-01-31 09:20:44
AT&T Stock: Money for Bits,yahoofinance,2021-01-31 09:20:44
10 Ways to Reduce Your 401(k) Taxes,yahoofinance,2021-01-31 09:20:44
7 Stocks Under $10 to Buy for February,yahoofinance,2021-01-31 09:20:44
Top 10 Short Positions Held By Hedge Funds Today,yahoofinance,2021-01-31 09:20:44
A Major Pension Bought Tesla and Schwab Stock. Here’s What It Sold.,yahoofinance,2021-01-31 09:20:44
"Barron's Latest Picks And Pans: Roundtable Picks, Quantumscape, Commodities And More",yahoofinance,2021-01-31 09:20:44
"Robinhood Expands Trading Restrictions To 50 Stocks, Including GameStop, General Motors, Starbucks, Several SPACs",yahoofinance,2021-01-31 09:20:44
FuelCell Stock Could Lose Some Power,yahoofinance,2021-01-31 09:20:44
Gold Churns but Silver (Finally) Returns!,yahoofinance,2021-01-31 09:20:44
"The Upcoming Catalyst That Could Move Chinese EV Stocks Nio, Xpeng, Li Auto",yahoofinance,2021-01-31 09:20:44
Two Oil Stocks To Watch In 2021,yahoofinance,2021-01-31 09:20:44
"Billionaire Steve Cohen quits Twitter, citing threats in GameStop uproar",yahoofinance,2021-01-31 09:20:44
"3 AI Stocks to Buy That Aren’t Nvidia, Google or IBM",yahoofinance,2021-01-31 09:20:44
"Reddit-fueled investing mania will end with many losers, says expert who predicts Dow 35,000",yahoofinance,2021-01-31 09:20:44
"Is GM Stock A Buy? General Motors Has 380% Upside, Analyst Says",yahoofinance,2021-01-31 09:20:44
What minimum-wage increases did to McDonald’s restaurants — and their employees,yahoofinance,2021-01-31 09:20:44
These Are The 5 Best Stocks To Buy And Watch Now,yahoofinance,2021-01-31 09:20:44
Robinhood Limits Trading for SNDL Stock: What You Need to Know,yahoofinance,2021-01-31 09:20:44
Dow Jones Stocks To Buy And Watch In January 2021: Apple Tumbles,yahoofinance,2021-01-31 09:20:44
Top 5 Dogecoin Pumps Through the Ages,yahoofinance,2021-01-31 09:20:44
Short-selling guru Citron says won't publish research again,yahoofinance,2021-01-31 09:20:44
What Will The Death Of Keystone XL Mean For Canada?,yahoofinance,2021-01-31 09:20:44
Why BlackBerry Stock Will Eventually Ride Much Higher,yahoofinance,2021-01-31 09:20:44
"After 10 Years of Underperformance, Commodities Are Set to Boom. Here’s How to Play the Rally.",yahoofinance,2021-01-31 09:20:44
Now More Than Ever Why Pfizer Stock Is a Buy,yahoofinance,2021-01-31 09:20:44
GameStop Short Nightmare Shows Few Signs of Becoming a Contagion,yahoofinance,2021-01-31 09:20:44
Rule 72(t) Can Let You Tap Retirement Accounts Early Without Penalty. Should You?,yahoofinance,2021-01-31 09:20:44
"Benzinga's Bulls And Bears Of The Week: Apple, Boeing, Netflix, Starbucks And More",yahoofinance,2021-01-31 09:20:44
A Reddit Army Descends on Hedge Funds Chained by Risk Models,yahoofinance,2021-01-31 09:20:44
Married Couples: Is It Better to File Taxes Jointly or Separately?,yahoofinance,2021-01-31 09:20:44
The GameStop Revolt Has Just Begun. Get Ready.,yahoofinance,2021-01-31 09:20:44
3 Undervalued Lithium Stocks That Could Still Benefit From the EV Craze,yahoofinance,2021-01-31 09:20:44
Hyundai said to be 'agonizing' over Apple's electric car,yahoofinance,2021-01-31 09:20:44
Social Security Fraud: What Is It Costing Taxpayers?,yahoofinance,2021-01-31 09:20:44
"The Ultimate Warren Buffett Stock Is Near Buy Zone, But Should You Buy It?",yahoofinance,2021-01-31 09:20:44
Ripple Responds to SEC Lawsuit Over XRP Sales,yahoofinance,2021-01-31 09:20:44
3 Ways to Play the Boom in Silver Stocks,yahoofinance,2021-01-31 09:20:44
Joe Biden to reopen Obamacare health insurance markets — here's how to save on premiums,yahoofinance,2021-01-31 09:20:44
Large Pension Bets Big on EV Stocks Tesla and Nio. Here’s What It Sold.,yahoofinance,2021-01-31 09:20:44
Ericsson Crushed Earnings Expectations. It Has Become a Highly Profitable 5G Player.,yahoofinance,2021-01-31 09:20:44
5 Gun Stocks Rising on Current Events,yahoofinance,2021-01-31 09:20:44
Selling GameStop Short Was a Flop. Options Are No Slam Dunk.,yahoofinance,2021-01-31 09:20:44
"The Week Ahead In Biotech: Merck, Pfizer In Earnings Mix, Plus Adamas, Mallinckrodt FDA Decisions, IPOs And More",yahoofinance,2021-01-31 09:20:44
Penny Stocks to Buy Using Technical Analysis for February 2021,yahoofinance,2021-01-31 09:20:44
Star Peak Energy Stock Will Double After SPAC Merger,yahoofinance,2021-01-31 09:20:44
I lived ‘adventurously’ but now my debts equal half my savings and we live ‘hand to mouth’ — how can I save for retirement?,yahoofinance,2021-01-31 09:20:44
"Is PayPal Stock A Buy Right Now Amid Bitcoin Boost? Here's What Earnings, Charts Show",yahoofinance,2021-01-31 09:20:44
Put Your Money Elsewhere While the Speculators Fight Over Luckin Stock,yahoofinance,2021-01-31 09:20:44
Three listed units of China's HNA disclose embezzlements of nearly $10 billion,yahoofinance,2021-01-31 09:20:44
FB Stock A Buy? Facebook Crushes Q4 Earnings But Predicts 'High Opt-Out Rates',yahoofinance,2021-01-31 09:20:44
Nio Stock Reverses Lower Despite 40% In Further Upside Seen,yahoofinance,2021-01-31 09:20:44
"DraftKings Stock Surges On Latest Analyst Upgrades, Is It A Buy Right Now?",yahoofinance,2021-01-31 09:20:44
The Top 7 Hot Stocks to Buy for 2021’s Biggest Trends,yahoofinance,2021-01-31 09:20:44
"Trading Platform Company IG Group Joins In Halting Of New Trades in GameStop, AMC",yahoofinance,2021-01-31 09:20:44
Switchback Energy Acquisition’s Green Cred Isn’t Enough,yahoofinance,2021-01-31 09:20:44
Electricity Market Set For A Major Rebound,yahoofinance,2021-01-31 09:20:44
The stock market wars: U.S. lawmaker Ocasio-Cortez breaks it down,yahoofinance,2021-01-31 09:20:44
3 SaaS Stocks to Consider as the Trend Heats Up,yahoofinance,2021-01-31 09:20:44
Rocket Companies CEO: 'This Is Not A Stock You Want To Be Short',yahoofinance,2021-01-31 09:20:44
GM just sped up the depreciation of everything it owns,yahoofinance,2021-01-31 09:20:44
"Inverters Are Critical to Solar Power. Tesla Wants to Own It, But That Won’t Be Easy.",yahoofinance,2021-01-31 09:20:44
"Microsoft, ServiceNow Among Five Long-Term Leaders Near Buy Points",yahoofinance,2021-01-31 09:20:44
Reddit Investors Piling Into Silver Drive Up Prices a Second Day,yahoofinance,2021-01-31 09:20:44
Dividends Keep Roaring Back. 9 Companies That Raised Their Payouts This Week.,yahoofinance,2021-01-31 09:20:44
MO Stock: Is Marlboro Maker Altria A Buy After Q4 Earnings?,yahoofinance,2021-01-31 09:20:44
Infrastructure Stocks and Funds Offer Solid Dividend Yields. Here’s Where to Look.,yahoofinance,2021-01-31 09:20:44
Reddit Crew May Find Commodities Harder After Roiling Silver,yahoofinance,2021-01-31 09:20:44
GameStop Erased the Stock Market’s January Gains. February Could Be Worse.,yahoofinance,2021-01-31 09:20:44
5 Value Stocks To Watch In The Basic Materials Sector,yahoofinance,2021-01-31 09:20:44
Will Joe Biden cause mortgage rates to rise? See what experts say,yahoofinance,2021-01-31 09:20:44
Avoid QuantumScape Stock Until All of These Legal Headaches Shake Out,yahoofinance,2021-01-31 09:20:44
Workhorse Stock Is Electric but Could Need a Recharge,yahoofinance,2021-01-31 09:20:44
5 Value Stocks To Watch In The Consumer Defensive Sector,yahoofinance,2021-01-31 09:20:44
Matt Maddox: a swift but painful overhaul of Wynn Resorts,yahoofinance,2021-01-31 09:20:44
"$180M Bitcoin Trust Completes Canadian IPO, Fully Invested on First Day",yahoofinance,2021-01-31 09:20:44
Is Wells Fargo Stock A Buy As Warren Buffett Continues To Cut Stake?,yahoofinance,2021-01-31 09:20:44
Investors Should Get the Fix on Hyliion Holdings Soon,yahoofinance,2021-01-31 09:20:44
Morgan Stanley Upgrades Boeing On Being 'Ready For Takeoff',yahoofinance,2021-01-31 09:20:44
"Luckin’s Business Is Surprisingly Solid, But Luckin Stock Still Is a No-Go",yahoofinance,2021-01-31 09:20:44
"Schwab clarifies 'confusion' over response to trading activity in stocks like GameStop, AMC and Express",yahoofinance,2021-01-31 09:20:44
What to Watch for in Retirement Plans Under President Biden,yahoofinance,2021-01-31 09:20:44
Why We Sold GM Stock Early,yahoofinance,2021-01-31 09:20:44
"All Over the World, Small Investors Jump Into the GameStop Frenzy",yahoofinance,2021-01-31 09:20:44
Breaking Down Novavax's Coronavirus Vaccine Data: 2 Analyst Takes,yahoofinance,2021-01-31 09:20:44
Pershing Square Tontine Has a Reddit Problem,yahoofinance,2021-01-31 09:20:44
"AMD: Growth Is Already Priced Into the Stock, Says Analyst",yahoofinance,2021-01-31 09:20:44
Robinhood CEO refutes GameStop hedge fund 'conspiracy theory' and reveals what actually happened,yahoofinance,2021-01-31 09:20:44
"Dow Jones Slumps 450 Points As Apple Sell-Off Continues; Bitcoin Surges, But GameStop, AMC Fade Off Highs",yahoofinance,2021-01-31 09:20:44
Investors Consider Next Move as Signs of a Bubble Mount,wsj,2021-01-31 09:23:28
GameStop Frenzy Puts Spotlight on Trading Firm Citadel Securities,wsj,2021-01-31 09:23:28
Some Health-Care Workers Are Still Saying No to a Covid Vaccine,wsj,2021-01-31 09:23:28
Amazon Faces Familiar Opponent in Alabama Union Election,wsj,2021-01-31 09:23:28
China’s New Covid-19 Outbreaks Trip Up Economic Momentum,wsj,2021-01-31 09:23:28
Lead Lawyers Leave Trump’s Impeachment Defense Team,wsj,2021-01-31 09:23:28
"Pushed by Pandemic, More Parents Go All-In for Home Schooling",wsj,2021-01-31 09:23:28
U.S. Family’s Search for a Son Lost in Syria’s ‘Bermuda Triangle’,wsj,2021-01-31 09:23:28
Ten GOP Senators Push Biden for Smaller Covid-19 Relief Package,wsj,2021-01-31 09:23:28
How to Go Freelance During the Covid-19 Pandemic,wsj,2021-01-31 09:23:28
CEO Posted Selfie in Front of the U.S. Capitol on Jan. 6. Some Customers Are Boycotting.,wsj,2021-01-31 09:23:28
New Yorkers Drive Six Hours to Nab Covid-19 Vaccine,wsj,2021-01-31 09:23:28
Streaming vs. Cable: How to Save Money Watching Live TV,wsj,2021-01-31 09:23:28
National-Security Panel Is Reviewing Past Startup Deals Tied to Chinese Investors,wsj,2021-01-31 09:23:28
Uber Eats Reunites ‘Wayne’s World’ for a Super Bowl Ad,wsj,2021-01-31 09:23:28
Boy Scouts’ Coed Recruiting Touched Off ‘Ground War’ With Girl Scouts,wsj,2021-01-31 09:23:28
"Covid-19 Safety Measures, Supply Constraints Crimp Manufacturers",wsj,2021-01-31 09:23:28
Banks Brace for Tougher Rules Under Biden,wsj,2021-01-31 09:23:28
Professor Aimed to Break Lawyers’ Monopoly on Legal Services,wsj,2021-01-31 09:23:28
Stan Kurland Escaped Wreckage of Countrywide Financial,wsj,2021-01-31 09:23:28
Job-Hopping CEO Joseph Vittoria Ran Both Hertz and Avis,wsj,2021-01-31 09:23:28
Embattled Marjorie Taylor Greene Says She Has Trump’s Backing,wsj,2021-01-31 09:23:28
"After Scripted Rollouts of Executive Orders, Biden’s Task Gets Harder",wsj,2021-01-31 09:23:28
Businessman Bernie Moreno Likely to Enter Ohio Senate Contest,wsj,2021-01-31 09:23:28
Hunt for Virus Variants Looks to Ramp Up in New York Labs,wsj,2021-01-31 09:23:28
A Valentine’s Day Gift Guide for Optimists,wsj,2021-01-31 09:23:28
