headline,org,date
First Person: How Health Insurance Provider Aetna Has Been Operating…,msnmoney,2020-08-30 08:52:17
Trump Announces Cut to 2020 Steel Import Quota From Brazil,msnmoney,2020-08-30 08:52:17
"Stimulus check money: A $1,200 payment might still go out in 2020",msnmoney,2020-08-30 08:52:17
U.S. Jobless Rate Set to Return to Single Digits: Eco Week Ahead,msnmoney,2020-08-30 08:52:17
How to get 'Call of Duty: Black Ops Cold War' beta download code from…,msnmoney,2020-08-30 08:52:17
What It Was Really Like For This Guy To Be A 10-Year-Old College Student,msnmoney,2020-08-30 08:52:17
"Sony confirms it is ""exploring"" the idea of bringing more…",msnmoney,2020-08-30 08:52:17
Mexico Finance Minister Says Budget to be Tighter: El Universal,msnmoney,2020-08-30 08:52:17
Trump’s China Sanctions Fail Russian History Test,msnmoney,2020-08-30 08:52:17
10 Golden Rules to Avoid Getting Scammed,msnmoney,2020-08-30 08:52:17
How Much Data Is Too Much During the Pandemic?,msnmoney,2020-08-30 08:52:17
"As IPO Looms, All You Need to Know About Jack Ma’s Ant Group",msnmoney,2020-08-30 08:52:17
The Top 9 Reasons Americans Spend Their Golden Years Working,msnmoney,2020-08-30 08:52:17
"This Hidden Feature Makes Credit Cards Easier, Safer to Use",msnmoney,2020-08-30 08:52:17
Rishi's dinners won't stop businesses feeling empty by autumn,msnmoney,2020-08-30 08:52:17
Opinion: Should we rethink how we tax Social Security benefits?,msnmoney,2020-08-30 08:52:17
Computex 2016: It's a wrap!,msnmoney,2020-08-30 08:52:17
"USA Today - ""The Wall"" - Tohono Oodham",msnmoney,2020-08-30 08:52:17
USA Today - The Wall - 'Drug Smuggling',msnmoney,2020-08-30 08:52:17
SteadXP gimbal stabilizer test,msnmoney,2020-08-30 08:52:17
Technology Stocks: Is There a Bubble?,msnmoney,2020-08-30 08:52:17
Opinion: Insiders are now unloading stocks — here’s why you…,msnmoney,2020-08-30 08:52:17
It’s Independent Bookstore day!,msnmoney,2020-08-30 08:52:17
"Your Car's Touchscreen Is Three Times Dirtier Than a Toilet, Study Finds",msnmoney,2020-08-30 08:52:17
This 10.5% Dividend Stock Pays Cash Every Month,msnmoney,2020-08-30 08:52:17
How to Earn CDL Knife Blueprint in Warzone on Championship Sunday,msnmoney,2020-08-30 08:52:17
Marijuana is only legal in 11 states but a House vote coming next month…,msnmoney,2020-08-30 08:52:17
US virus cases approach six million,msnmoney,2020-08-30 08:52:17
San Diego mayor announces winning developer to build new…,msnmoney,2020-08-30 08:52:17
Argentina’s Ruling Bloc Proposes New Tax on Millionaires,msnmoney,2020-08-30 08:52:17
New technology export rules in China could affect TikTok sale to a US…,msnmoney,2020-08-30 08:52:17
College Republicans Raise Money for Alleged Murderer Kyle…,msnmoney,2020-08-30 08:52:17
Coronavirus vaccine maker Moderna enrolls more minorities,msnmoney,2020-08-30 08:52:17
'I may never give up': Behind the fight against predatory for-profit…,msnmoney,2020-08-30 08:52:17
This 1 TSX Tech Stock Returned 80% in Just 1 Month,msnmoney,2020-08-30 08:52:17
"I’m 52, won’t live past 80 and have $1.6 million. ‘I am tired of both the rat…",msnmoney,2020-08-30 08:52:17
Too risky? Fed pressed to expand aid to some businesses,msnmoney,2020-08-30 08:52:17
Centricus’s 11th-Hour Bid Adds Intrigue to Waiting Game on TikTok,msnmoney,2020-08-30 08:52:17
"Stimulus check: Income limit, eligibility, fine print and how the first…",msnmoney,2020-08-30 08:52:17
3 Reasons the TSX Index Can Still Hit Record Highs in 2020,msnmoney,2020-08-30 08:52:17
These money and investing tips can help you through the stock market’s worst month,msnmoney,2020-08-30 08:52:17
3 Social Security Mistakes That Could Shrink Your Benefits in Retirement,msnmoney,2020-08-30 08:52:17
Picnic fever is surging. A decades-old basket brand thinks it can make a comeback,msnmoney,2020-08-30 08:52:17
"20 ‘Boring’ Jobs That Pay $100,000 or More",msnmoney,2020-08-30 08:52:17
China tightens export rules to jeopardize TikTok deal: reports,msnmoney,2020-08-30 08:52:17
"Should I Take Social Security Now and Invest It, or Wait Until I’m 70?",msnmoney,2020-08-30 08:52:17
5 things to know about Tesla ahead of its 5-for-1 stock split,msnmoney,2020-08-30 08:52:17
CRB: How to Get the New $400/Week EI for Fall 2020!,msnmoney,2020-08-30 08:52:17
"Cruise operators took a deep bruising from COVID-19, but history…",msnmoney,2020-08-30 08:52:17
Mortgage rates tumble toward new lows as refinance fee is delayed,msnmoney,2020-08-30 08:52:17
The Layoff Economy Returns,msnmoney,2020-08-30 08:52:17
"Yes, you can be a millionaire. Here's how",msnmoney,2020-08-30 08:52:17
New wave of layoffs points to fresh hurdles for U.S. economic recovery…,msnmoney,2020-08-30 08:52:17
How a real estate side hustle helped add $1 million to this couple's…,msnmoney,2020-08-30 08:52:17
I'm a reporter who's going to be working from my Brooklyn apartment…,msnmoney,2020-08-30 08:52:17
Retail bankruptcies in August: Here's who filed and who might be next,msnmoney,2020-08-30 08:52:17
The rise and fall of the suburb: How a reflection of the American Dream…,msnmoney,2020-08-30 08:52:17
Market posts one of the strongest July-August rallies in history as…,msnmoney,2020-08-30 08:52:17
"The 50 Cheapest, Safest Places to Buy a Home in the Pandemic",msnmoney,2020-08-30 08:52:17
Opinion: Investors should be wary of Warren Buffett’s crash warning,msnmoney,2020-08-30 08:52:17
8 Types of Companies That Check Your Credit Report,msnmoney,2020-08-30 08:52:17
Sarah Palin Gets Trial Date in New York Times Defamation Suit,msnmoney,2020-08-30 08:52:17
10 Ways Anyone Can Earn More Income,msnmoney,2020-08-30 08:52:17
"Centricus, Triller Seek to Buy TikTok Assets for $20 Billion",msnmoney,2020-08-30 08:52:17
7 Rules for Using Real Estate Investments for Passive Income,msnmoney,2020-08-30 08:52:17
Nearly 190K Ram pickups recalled for poorly installed floor mats,msnmoney,2020-08-30 08:52:17
Ready to Retire? Do This 3-Step Checklist to Make Sure,msnmoney,2020-08-30 08:52:17
Oil Posts Weekly Gain With Refineries on the Mend After Laura,msnmoney,2020-08-30 08:52:17
9 Hidden Dangers of Owning a Tiny Home,msnmoney,2020-08-30 08:52:17
GoodRx files to go public with a rare characteristic: Profits,msnmoney,2020-08-30 08:52:17
6 Great Recession Money Lessons That Still Apply Today,msnmoney,2020-08-30 08:52:17
Prosecutors ask We Build the Wall founder to tone down rhetoric after arrest,msnmoney,2020-08-30 08:52:17
"Remote work has saved Americans $91 billion in commuting costs, or…",msnmoney,2020-08-30 08:52:17
Fed Officials Play Down Need to Boost Rate Guidance in September,msnmoney,2020-08-30 08:52:17
How Fast COVID-19 Was Spreading in Each State Before and After Social…,msnmoney,2020-08-30 08:52:17
"Dow erases 2020 loss, S&P 500 and Nasdaq notch fresh records",msnmoney,2020-08-30 08:52:17
6 Signs Your Budget Needs a Makeover,msnmoney,2020-08-30 08:52:17
"Workday, Cheesecake Factory: 5 Big Stock Gainers for Friday",msnmoney,2020-08-30 08:52:17
How to get a cash advance with Capital One,msnmoney,2020-08-30 08:52:17
"In a Year of Uncertainty, Should You Still Buy Stocks?",msnmoney,2020-08-30 08:52:17
The competitive edge virtual learning provides during a downturn,msnmoney,2020-08-30 08:52:17
"Coca-Cola Offers 4,000 North America Buyouts; Job Cuts to Follow",msnmoney,2020-08-30 08:52:17
These Are the 30 Best Small Towns To Retire in America,msnmoney,2020-08-30 08:52:17
"After New Zealand, Global Stock Exchanges Face Reminder of…",msnmoney,2020-08-30 08:52:17
How we pulled off an all-virtual intern program this summer,msnmoney,2020-08-30 08:52:17
"MGM to cut 18,000 workers who were previously furloughed",msnmoney,2020-08-30 08:52:17
How to Handle Money Effectively as a Blended Family,msnmoney,2020-08-30 08:52:17
"Lord & Taylor closes its doors, ending a nearly 200-year-old legacy",msnmoney,2020-08-30 08:52:17
How Do I Find a Meaningful Job From Home?,msnmoney,2020-08-30 08:52:17
Amazon Buys Electric Mercedes Vans in Green Effort,msnmoney,2020-08-30 08:52:17
You Should Never Buy These 12 Things New,msnmoney,2020-08-30 08:52:17
Trudeau’s Deficit Balloons With Income Support Smashing Records,msnmoney,2020-08-30 08:52:17
"5 at 5: Your Daily Digest for Real Estate Investing, 08/27/2020",msnmoney,2020-08-30 08:52:17
Pretzel-maker Utz readies for market debut after gaining share during…,msnmoney,2020-08-30 08:52:17
SoFi expert: Here’s how you should respond to Trump’s executive order…,msnmoney,2020-08-30 08:52:17
Future of Jeep to be unveiled Thursday with hybrid electric Wrangler…,msnmoney,2020-08-30 08:52:17
Stimulus Check Update: Second Payment Still Not in Sight,msnmoney,2020-08-30 08:52:17
"Swedish 'buy now, pay later' fintech giant Klarna reports sevenfold jump…",msnmoney,2020-08-30 08:52:17
The best Airbnbs in the Hamptons,msnmoney,2020-08-30 08:52:17
What Happens to the Stock Market if Biden Wins?,msnmoney,2020-08-30 08:52:17
12 affordable online courses that could help advance your career…,msnmoney,2020-08-30 08:52:17
"As FTSE reshuffle looms, ITV could get the boot",msnmoney,2020-08-30 08:52:17
A documentarian finds the perfect solution to happiness—what…,msnmoney,2020-08-30 08:52:17
Ulta Beauty Jumps on Second-Quarter Earnings Beat,msnmoney,2020-08-30 08:52:17
Dollar-cost averaging: Use it to boost your investment returns over…,msnmoney,2020-08-30 08:52:17
Hurricane Laura Property Damage in U.S. May Reach $12 Billion,msnmoney,2020-08-30 08:52:17
Don't overlook the little things,msnmoney,2020-08-30 08:52:17
What the resignation of Japan's Prime Minister Shinzo Abe could mean…,msnmoney,2020-08-30 08:52:17
Will Apartment Renter Preferences Change in the Next Year?,msnmoney,2020-08-30 08:52:17
5 things to know before the stock market opens Friday,msnmoney,2020-08-30 08:52:17
History of workers' strikes in America,msnmoney,2020-08-30 08:52:17
Next up for the Federal Reserve: Convincing the markets it can do what…,msnmoney,2020-08-30 08:52:17
It Just Got Harder to Get a Mortgage — Here’s How to Skirt the Rules,msnmoney,2020-08-30 08:52:17
Hudson Yards developer says Related is collecting 50% of rents on New…,msnmoney,2020-08-30 08:52:17
Fosun Chief Sees Profit Rebound to ‘Normal’ Levels Next Year,msnmoney,2020-08-30 08:52:17
Why Outdoor Space Matters When Buying a Home,msnmoney,2020-08-30 08:52:17
Single People Will Make Up 30% of Car Buyers in China by 2030,msnmoney,2020-08-30 08:52:17
"July pending home sales jump over 15% annually, as properties go under…",msnmoney,2020-08-30 08:52:17
Musk Confirms Tesla Factory Was Target of Thwarted Cyberattack,msnmoney,2020-08-30 08:52:17
Gap Says Online Growth Helped to Limit Second-Quarter Sales Drop,msnmoney,2020-08-30 08:52:17
5 Key Takeaways From Powell’s Jackson Hole Fed Speech,msnmoney,2020-08-30 08:52:17
Iconic Portland bookstore Powell's says it won't sell directly on Amazon…,msnmoney,2020-08-30 08:52:17
What does 0 percent APR mean?,msnmoney,2020-08-30 08:52:17
3 Top Dividend Stocks for a Better Retirement,msnmoney,2020-08-30 08:52:17
Investing Scams Aren't New: 5 Lessons from the Great British Bicycle…,msnmoney,2020-08-30 08:52:17
Toll Brothers Reports Record Contract Signings Despite Pandemic,msnmoney,2020-08-30 08:52:17
Education job openings spike amid the pandemic: Monster,msnmoney,2020-08-30 08:52:17
3 Stocks Poised for Huge Growth Over the Next Decade,msnmoney,2020-08-30 08:52:17
"Qatar sets new minimum wage, lifts restriction on changing jobs",msnmoney,2020-08-30 08:52:17
"If You'd Invested $5,000 In BioNTech's IPO, This Is How Much Money…",msnmoney,2020-08-30 08:52:17
Can Roku Keep Rocking?,msnmoney,2020-08-30 08:52:17
Stock market crash: I’d invest just £50 per week in cheap UK shares in…,msnmoney,2020-08-30 08:52:17
Can You Refinance if You're Underwater on a Mortgage?,msnmoney,2020-08-30 08:52:17
3 Potentially Explosive Tech Stocks to Buy in September,msnmoney,2020-08-30 08:52:17
"Dwayne ""The Rock"" Johnson: Wrestler, Actor, Investing Genius",msnmoney,2020-08-30 08:52:17
State Pension worries? I plan to retire in comfort with this simple trick,msnmoney,2020-08-30 08:52:17
Have £1k to invest in the FTSE 100? Here’s what I’d do,msnmoney,2020-08-30 08:52:17
This secret FTSE 250 growth stock just hit an all-time high. And it’s…,msnmoney,2020-08-30 08:52:17
Lian Li desktop PC hands-on,msnmoney,2020-08-30 08:52:17
Stock Market Crash Preparation: Follow Warren Buffett’s Top…,msnmoney,2020-08-30 08:52:17
3 Investing Tricks to Double Your Money,msnmoney,2020-08-30 08:52:17
"Bahrain Plans Return to Debt Market With Mix of Bonds, Sukuk",msnmoney,2020-08-30 08:52:17
"In the Race for a Coronavirus Vaccine, Can There Be Multiple…",msnmoney,2020-08-30 08:52:17
Want to Retire in 2021? 3 Tips to Make That Happen.,msnmoney,2020-08-30 08:52:17
Should AstraZeneca Be Your Next Coronavirus Buy?,msnmoney,2020-08-30 08:52:17
Demolition turns to development dreams at St. Johns River Power…,msnmoney,2020-08-30 08:52:17
3 Reasons It's Not Too Late to Buy Aphria Stock,msnmoney,2020-08-30 08:52:17
A-League Summaries,msnmoney,2020-08-30 08:52:17
Companies announce plans to hire hundreds in Jacksonville area,msnmoney,2020-08-30 08:52:17
3 Solar Stocks That Are Better Than Tesla,msnmoney,2020-08-30 08:52:17
States where SNAP use is soaring,msnmoney,2020-08-30 08:52:17
"China Lithium Giant Expects to Access Funds, Warns of Asset Sale",msnmoney,2020-08-30 08:52:17
Female Fund Managers Beat Men at Stock Picks: Goldman,msnmoney,2020-08-30 08:52:17
China's big banks brace for lagging COVID-19 risks as bad loans rise,msnmoney,2020-08-30 08:52:17
6 modern loft homes,msnmoney,2020-08-30 08:52:17
Here's How Post Office Delays Can Affect Us Financially -- Beyond…,msnmoney,2020-08-30 08:52:17
2 Stocks Warren Buffett Would Love,msnmoney,2020-08-30 08:52:17
Losing the extra $600 unemployment benefit may not have stopped…,msnmoney,2020-08-30 08:52:17
Vani Kola: The Kalaari Podcast | Growing true north metrics - with…,msnmoney,2020-08-30 08:52:17
Thinking about moving to a state with lower taxes? These are the mistakes…,msnmoney,2020-08-30 08:52:17
Lufthansa Weighs Cutting More Jobs as Travel Slump Endures,msnmoney,2020-08-30 08:52:17
Will Moderna's Gains Keep Going When the Pandemic Is Over?,msnmoney,2020-08-30 08:52:17
Why Alphabet Should Split Its Stock,msnmoney,2020-08-30 08:52:17
3 Tiny Stocks Robinhood Investors Should Be Buying,msnmoney,2020-08-30 08:52:17
Wizz Air to cut flights as Hungary closes borders to foreigners,msnmoney,2020-08-30 08:52:17
3 Things to Watch in the Stock Market This Week,msnmoney,2020-08-30 08:52:17
How COVID-19 has changed funerals,msnmoney,2020-08-30 08:52:17
2 Big Medicare Changes Joe Biden Wants to Make,msnmoney,2020-08-30 08:52:17
China’s Mega Banks Post Worst Profit Slump on Bad Debt Wave,msnmoney,2020-08-30 08:52:17
Stock market crash: 2 of the best UK shares I’d buy in an ISA to make a…,msnmoney,2020-08-30 08:52:17
"Telecom Italia Will Name CEO at Network Company, Repubblica…",msnmoney,2020-08-30 08:52:17
Italy’s Misiani Says Economy Still Seen Shrinking Less Than 10%,msnmoney,2020-08-30 08:52:17
A 22-year-old heavyweight called Daniel Dubois knocked his op…,msnmoney,2020-08-30 08:52:17
Column: Jacksonville missed a chance to evaluate JEA sale,msnmoney,2020-08-30 08:52:17
"BP to Sell London Headquarters as Work Style Shifts, Times Says",msnmoney,2020-08-30 08:52:17
Next stimulus bill: You may get more than a check,msnmoney,2020-08-30 08:52:17
How I’d invest like Warren Buffett to get rich and retire early,msnmoney,2020-08-30 08:52:17
Column: Oil spills remain a threat for Florida,msnmoney,2020-08-30 08:52:17
I think eSports could make investors filthy rich. Here’s how I’m playing it,msnmoney,2020-08-30 08:52:17
Sunak’s Summer of Love With U.K. Voters Faces Its Reckoning,msnmoney,2020-08-30 08:52:17
How you could make £1m from UK shares with £50 per week,msnmoney,2020-08-30 08:52:17
Goldman Sees Risk of ‘Grind Lower’ in Dollar-Shekel After Breach,msnmoney,2020-08-30 08:52:17
Cheaper Diamonds Fire Life Into the Hidden World of Gem Trading,msnmoney,2020-08-30 08:52:17
Is Big Oil Still a Big Deal?,msnmoney,2020-08-30 08:52:17
UK's Sunak considers sweeping tax hikes to plug COVID-19 hole…,msnmoney,2020-08-30 08:52:17
9 cheap renovating tips to up your house’s resale value,msnmoney,2020-08-30 08:52:17
Matthew Perry Downsizes Into Pacific Palisades Cottage,msnmoney,2020-08-30 08:52:17
"#EntMELive Webinar Invite | Bitcoin Volatility: The Crypto Craze, and…",msnmoney,2020-08-30 08:52:17
"Moderna's Patents Probed by U.S. Defense Department, FT Says",msnmoney,2020-08-30 08:52:17
Rhonda Morris: Well Done Chevron Virtual Summer Interns!,msnmoney,2020-08-30 08:52:17
First Person: How Health Insurance Provider Aetna Has Been Operating…,msnmoney,2020-08-30 08:52:17
Trump Announces Cut to 2020 Steel Import Quota From Brazil,msnmoney,2020-08-30 08:52:17
"Stimulus check money: A $1,200 payment might still go out in 2020",msnmoney,2020-08-30 08:52:17
U.S. Jobless Rate Set to Return to Single Digits: Eco Week Ahead,msnmoney,2020-08-30 08:52:17
How to get 'Call of Duty: Black Ops Cold War' beta download code from…,msnmoney,2020-08-30 08:52:17
What It Was Really Like For This Guy To Be A 10-Year-Old College Student,msnmoney,2020-08-30 08:52:17
"Sony confirms it is ""exploring"" the idea of bringing more…",msnmoney,2020-08-30 08:52:17
Mexico Finance Minister Says Budget to be Tighter: El Universal,msnmoney,2020-08-30 08:52:17
Trump’s China Sanctions Fail Russian History Test,msnmoney,2020-08-30 08:52:17
10 Golden Rules to Avoid Getting Scammed,msnmoney,2020-08-30 08:52:17
How Much Data Is Too Much During the Pandemic?,msnmoney,2020-08-30 08:52:17
"As IPO Looms, All You Need to Know About Jack Ma’s Ant Group",msnmoney,2020-08-30 08:52:17
The Top 9 Reasons Americans Spend Their Golden Years Working,msnmoney,2020-08-30 08:52:17
"This Hidden Feature Makes Credit Cards Easier, Safer to Use",msnmoney,2020-08-30 08:52:17
Rishi's dinners won't stop businesses feeling empty by autumn,msnmoney,2020-08-30 08:52:17
Opinion: Should we rethink how we tax Social Security benefits?,msnmoney,2020-08-30 08:52:17
Computex 2016: It's a wrap!,msnmoney,2020-08-30 08:52:17
"USA Today - ""The Wall"" - Tohono Oodham",msnmoney,2020-08-30 08:52:17
USA Today - The Wall - 'Drug Smuggling',msnmoney,2020-08-30 08:52:17
SteadXP gimbal stabilizer test,msnmoney,2020-08-30 08:52:17
Technology Stocks: Is There a Bubble?,msnmoney,2020-08-30 08:52:17
Opinion: Insiders are now unloading stocks — here’s why you…,msnmoney,2020-08-30 08:52:17
It’s Independent Bookstore day!,msnmoney,2020-08-30 08:52:17
"Your Car's Touchscreen Is Three Times Dirtier Than a Toilet, Study Finds",msnmoney,2020-08-30 08:52:17
This 10.5% Dividend Stock Pays Cash Every Month,msnmoney,2020-08-30 08:52:17
How to Earn CDL Knife Blueprint in Warzone on Championship Sunday,msnmoney,2020-08-30 08:52:17
Marijuana is only legal in 11 states but a House vote coming next month…,msnmoney,2020-08-30 08:52:17
US virus cases approach six million,msnmoney,2020-08-30 08:52:17
San Diego mayor announces winning developer to build new…,msnmoney,2020-08-30 08:52:17
Argentina’s Ruling Bloc Proposes New Tax on Millionaires,msnmoney,2020-08-30 08:52:17
New technology export rules in China could affect TikTok sale to a US…,msnmoney,2020-08-30 08:52:17
College Republicans Raise Money for Alleged Murderer Kyle…,msnmoney,2020-08-30 08:52:17
Coronavirus vaccine maker Moderna enrolls more minorities,msnmoney,2020-08-30 08:52:17
'I may never give up': Behind the fight against predatory for-profit…,msnmoney,2020-08-30 08:52:17
This 1 TSX Tech Stock Returned 80% in Just 1 Month,msnmoney,2020-08-30 08:52:17
"I’m 52, won’t live past 80 and have $1.6 million. ‘I am tired of both the rat…",msnmoney,2020-08-30 08:52:17
Too risky? Fed pressed to expand aid to some businesses,msnmoney,2020-08-30 08:52:17
Centricus’s 11th-Hour Bid Adds Intrigue to Waiting Game on TikTok,msnmoney,2020-08-30 08:52:17
"Stimulus check: Income limit, eligibility, fine print and how the first…",msnmoney,2020-08-30 08:52:17
3 Reasons the TSX Index Can Still Hit Record Highs in 2020,msnmoney,2020-08-30 08:52:17
"
Updated
                                            Three things you need to know about Apple’s stock split
                                        ",marketwatch,2020-08-30 08:54:24
"
Updated
                                            New York Restaurant Owner Warns of ‘Slow Death for the Industry’ Unless There Are Changes
                                        ",marketwatch,2020-08-30 08:54:24
"
Barron's
                                            A Huge Sovereign-Wealth Fund Made a Big Bet on GE Stock. Here’s What It Sold.
                                        ",marketwatch,2020-08-30 08:54:24
"
Updated
                                            Sweden embraced herd immunity, while the U.K. abandoned the idea — so why do they BOTH have high COVID-19 fatality rates?
                                        ",marketwatch,2020-08-30 08:54:24
"
                                            These money and investing tips can help you through the stock market’s worst month
                                        ",marketwatch,2020-08-30 08:54:24
"
Updated
                                            My husband wants 50% of my mother’s inheritance because he earns more than me. I said no. Am I unreasonable?
                                        ",marketwatch,2020-08-30 08:54:24
"
Updated
                                            My husband and I are worth $3.7 million, but I’m afraid I’ll spend my way into the poor house if he dies. When I was single, I bounced checks. What can I do?
                                        ",marketwatch,2020-08-30 08:54:24
"
Updated
                                            10 ways to avoid a penalty for taking an early retirement-account withdrawal because of COVID-19
                                        ",marketwatch,2020-08-30 08:54:24
"
Updated
                                            Advice for Salesforce staff who reported having a mental-health issue — and all workers during the COVID-19 pandemic 
                                        ",marketwatch,2020-08-30 08:54:24
"
Updated
                                            ‘I tried walking more than 3 blocks, paying the price with chest pains and crippling fatigue’: One woman’s long-haul recovery from COVID-19 
                                        ",marketwatch,2020-08-30 08:54:24
"
                            
                            3 things investors should know about Apple’s 4-for-1 stock split
                        ",marketwatch,2020-08-30 08:54:24
"
                            
                            3 things investors should know about Apple’s 4-for-1 stock split
                        ",marketwatch,2020-08-30 08:54:24
"
                            
                            What the Federal Reserve inflation policy means for your retirement savings
                        ",marketwatch,2020-08-30 08:54:24
"
                            
                            With the party conventions now over, what’s next in U.S. election campaign 2020?
                        ",marketwatch,2020-08-30 08:54:24
"
                            
                            Hurricane Laura cleanup begins; weeks without power or water ahead
                        ",marketwatch,2020-08-30 08:54:24
"
                            
                            Were they a threat? Police shootings reignite legal debate
                        ",marketwatch,2020-08-30 08:54:24
"
                            
                            Weekend reads: Where to retire if you want to avoid extreme weather
                        ",marketwatch,2020-08-30 08:54:24
"
                            
                            These ‘Dividend Aristocrat’ stocks have been raising their dividends for decades, and there have been no dividend cuts during the pandemic
                        ",marketwatch,2020-08-30 08:54:24
"
Opinion: 
                            The assault on Social Security is under way
                        ",marketwatch,2020-08-30 08:54:24
"
                            
                            Losing the extra $600 unemployment benefit may not have stopped Americans from spending money, J.P. Morgan credit-card data show
                        ",marketwatch,2020-08-30 08:54:24
"
                            
                            Cruise operators took a deep bruising from COVID-19, but history says they will recover
                        ",marketwatch,2020-08-30 08:54:24
"
                            
                            Moderna and Pfizer’s COVID-19 vaccine candidates require ultralow temperatures, raising questions about storage, distribution
                        ",marketwatch,2020-08-30 08:54:24
Is Additional Treasury Issuance Driving A Steeper Yield Curve?,marketwatch,2020-08-30 08:54:24
"
                            
                            The Fed’s New Policy Means Rates Will Stay Lower Longer. The Price: Financial Turbulence.
                        ",marketwatch,2020-08-30 08:54:24
"
                            
                            ‘I hate the humidity and can do with a lot less snow and ice, and my husband hates the extreme heat’ — where should we retire?
                        ",marketwatch,2020-08-30 08:54:24
"
                            
                            Cities and states face $1 trillion budget mess. There will be more trouble ahead
                        ",marketwatch,2020-08-30 08:54:24
"
                            
                            What can Zoom do for a sequel to one of the most astounding earnings blowouts of all time?
                        ",marketwatch,2020-08-30 08:54:24
