headline,org,date
Tesla founders Martin Eberhard and Marc Tarpenning talk about the early days and bringing on Elon Musk,msnmoney,2021-02-06 09:07:38
5 Signs You’re About To Overpay on That House You Want,msnmoney,2021-02-06 09:07:38
Wall Street Insider Quietly “Predicts” Massive Stock Market Event,msnmoney,2021-02-06 09:07:38
Individual investors are back — here’s what it means for the stock market,msnmoney,2021-02-06 09:07:38
The government sent people pandemic checks. Now it wants some of that money back,msnmoney,2021-02-06 09:07:38
Expert: “This credit card is so good I signed up personally”,msnmoney,2021-02-06 09:07:38
Inside Nick Jonas' beautiful homes,msnmoney,2021-02-06 09:07:38
Homeowners association horror stories,msnmoney,2021-02-06 09:07:38
"This is America’s rare chance to undo the economic wrongs of decades, these strategists say",msnmoney,2021-02-06 09:07:38
"Man Who Predicted 2020 Crash Now Says: Do This Before ""Big"" Change",msnmoney,2021-02-06 09:07:38
The 10 Most Popular Home Improvements Amid COVID-19,msnmoney,2021-02-06 09:07:38
Omaha legend puts $91 billion on one 5G stock,msnmoney,2021-02-06 09:07:38
Have a 401(k) and HSA? Don't Make This Mistake,msnmoney,2021-02-06 09:07:38
Another beloved pizza chain has filed for bankruptcy,msnmoney,2021-02-06 09:07:38
"Elon Musk sent Dogecoin soaring last week. Here are 6 times the Tesla boss has moved markets, from GameStop to Sandstorm",msnmoney,2021-02-06 09:07:38
This beloved chocolate shop is closing all of its locations,msnmoney,2021-02-06 09:07:38
6 Features That Determine a Home's Sale Price,msnmoney,2021-02-06 09:07:38
Top credit card wipes out interest until 2022 (seriously),msnmoney,2021-02-06 09:07:38
Cost To Own a Car for a Year in Every State,msnmoney,2021-02-06 09:07:38
China Approves Second Coronavirus Vaccine for Public Use,msnmoney,2021-02-06 09:07:38
Things you should (and shouldn't) buy in February,msnmoney,2021-02-06 09:07:38
30 short-term financial goals you can crush,msnmoney,2021-02-06 09:07:38
16 Fascinating Things You Never Knew About ATMs,msnmoney,2021-02-06 09:07:38
Meet TUSHY: Your Bumhole's New BFF,msnmoney,2021-02-06 09:07:38
'Big Short' investor Michael Burry paved the way for the GameStop frenzy when he bought a stake in 2019. Here's the story of Burry's game-changing bet.,msnmoney,2021-02-06 09:07:38
Do not make these mistakes when selling a used car,msnmoney,2021-02-06 09:07:38
Adding to Your Winners Can Make You Richer. Here's Why.,msnmoney,2021-02-06 09:07:38
Salaries for Some of America’s Toughest Jobs,msnmoney,2021-02-06 09:07:38
Benchmark’s Bill Gurley Takes Aim at Latest IPO Gains,msnmoney,2021-02-06 09:07:38
"The High Quality, Easy Way to Cut Nails for Seniors",msnmoney,2021-02-06 09:07:38
How Spending Money in These 10 Ways Will Actually Make You Happier,msnmoney,2021-02-06 09:07:38
The 3 Most Problematic Social Security Myths: Debunked,msnmoney,2021-02-06 09:07:38
These investments could blow up in 2021,msnmoney,2021-02-06 09:07:38
Daimler Braces for Questions About Job Cuts After Truck Spinoff,msnmoney,2021-02-06 09:07:38
12 Warm and Cozy Ski Chalets for the 21st Century,msnmoney,2021-02-06 09:07:38
Clever Trick To Turn Dusty House Into Fresh Air Paradise,msnmoney,2021-02-06 09:07:38
"Buying a Home? Check Out Today's Mortgage Rates, Feb. 6 & 7",msnmoney,2021-02-06 09:07:38
Where 51 CEOs Went To College,msnmoney,2021-02-06 09:07:38
"Porsche Plans Assembly Plant in Malaysia, Edge Reports",msnmoney,2021-02-06 09:07:38
16 Effective Ways To Trick Yourself Into Saving Money,msnmoney,2021-02-06 09:07:38
Game Plan: Cramer's 'Mad Money' Recap (Friday 2/5/21),msnmoney,2021-02-06 09:07:38
Inventions That Solve Everyday Problems,msnmoney,2021-02-06 09:07:38
The Biggest Salary Negotiation Mistakes You’re Making,msnmoney,2021-02-06 09:07:38
7 Stores That Match — or Beat — Amazon Prices,msnmoney,2021-02-06 09:07:38
Where Your Money Should Go To Prepare You for More COVID-19 Restrictions,msnmoney,2021-02-06 09:07:38
Cramer's week ahead: Fundamentals matter again after Reddit trading frenzy,msnmoney,2021-02-06 09:07:38
Football Players From These Colleges Make the Most Total NFL Money,msnmoney,2021-02-06 09:07:38
"Before you renew Amazon Prime, read this",msnmoney,2021-02-06 09:07:38
"Activision stock price sees 1984 levels, record valuation on expansion plans",msnmoney,2021-02-06 09:07:38
15 Tricks That Will Help You Save Even More at Trader Joe’s,msnmoney,2021-02-06 09:07:38
Ex-Shell Gas Trader Pleads Guilty Over Role in Scheme,msnmoney,2021-02-06 09:07:38
21 Pharmacy Chains Ready to Give COVID-19 Vaccines,msnmoney,2021-02-06 09:07:38
Chip Shortages Force More Cuts at North American Auto Plants,msnmoney,2021-02-06 09:07:38
Why Is Everyone Using This Breathing Trainer?,msnmoney,2021-02-06 09:07:38
Costco and Sam's Club membership perks you didn't know about,msnmoney,2021-02-06 09:07:38
Why Millennials Fall Short Saving for Retirement,msnmoney,2021-02-06 09:07:38
50 Things Every 50-Something Should Know About Retirement,msnmoney,2021-02-06 09:07:38
Fiscal stimulus prospects and strong earnings tailwind may propel stocks in the week ahead,msnmoney,2021-02-06 09:07:38
Common Money Myths About Millennials,msnmoney,2021-02-06 09:07:38
"How To Improve Your Presentation, Meeting and Interview Skills on Zoom",msnmoney,2021-02-06 09:07:38
"If You ever Shop at Home Depot, You're Going to Love This Hack",msnmoney,2021-02-06 09:07:38
American Cities That Added Jobs During the Pandemic,msnmoney,2021-02-06 09:07:38
"How to invest in equity crowdfunding, a way to give small private firms a boost - and possibly profit yourself",msnmoney,2021-02-06 09:07:38
Hidden Obstacles That Keep People From Retirement,msnmoney,2021-02-06 09:07:38
Stash vs. Acorns vs. Robinhood — which is the best investing app?,msnmoney,2021-02-06 09:07:38
17 Companies Facebook Famously Purchased — and How They’re Doing Now,msnmoney,2021-02-06 09:07:38
The IRS says teachers can deduct hand sanitizer costs and how Dolly Parton’s Super Bowl ad glosses over the reality for millions of gig workers,msnmoney,2021-02-06 09:07:38
Hydrogen Peroxide Hacks You Wish You Knew Sooner,msnmoney,2021-02-06 09:07:38
How COVID-19 Has Transformed the Way We Spend,msnmoney,2021-02-06 09:07:38
Oil Extends Weekly Gain With Brent Pushing Toward $60 a Barrel,msnmoney,2021-02-06 09:07:38
Fortune 500 Companies That Hire Remote Workers,msnmoney,2021-02-06 09:07:38
Economy Explained: How To Calculate Your Debt-to-Income Ratio,msnmoney,2021-02-06 09:07:38
Don’t Let Car Repairs Break the Bank — Here’s How To Cut Costs,msnmoney,2021-02-06 09:07:38
"Hippo in Talks to Merge With Mark Pincus, Reid Hoffman SPAC",msnmoney,2021-02-06 09:07:38
35 Household Items That Worth More Than Your House,msnmoney,2021-02-06 09:07:38
How Emergencies Like Coronavirus Expose Nonsense Business Practices,msnmoney,2021-02-06 09:07:38
Former baseball superstar Alex Rodriguez files to form $575 million SPAC as IPO craze continues,msnmoney,2021-02-06 09:07:38
15 Money Myths That Can Destroy Your Retirement,msnmoney,2021-02-06 09:07:38
"Apple Talks With Hyundai, Kia on Electric Car Paused Recently",msnmoney,2021-02-06 09:07:38
States With the Highest Number of COVID-19 Cases,msnmoney,2021-02-06 09:07:38
5 renovations that can impact your home insurance,msnmoney,2021-02-06 09:07:38
Tesla founders Martin Eberhard and Marc Tarpenning talk about the early days and bringing on Elon Musk,msnmoney,2021-02-06 09:07:38
5 Signs You’re About To Overpay on That House You Want,msnmoney,2021-02-06 09:07:38
Wall Street Insider Quietly “Predicts” Massive Stock Market Event,msnmoney,2021-02-06 09:07:38
Individual investors are back — here’s what it means for the stock market,msnmoney,2021-02-06 09:07:38
The government sent people pandemic checks. Now it wants some of that money back,msnmoney,2021-02-06 09:07:38
Expert: “This credit card is so good I signed up personally”,msnmoney,2021-02-06 09:07:38
Inside Nick Jonas' beautiful homes,msnmoney,2021-02-06 09:07:38
Homeowners association horror stories,msnmoney,2021-02-06 09:07:38
"This is America’s rare chance to undo the economic wrongs of decades, these strategists say",msnmoney,2021-02-06 09:07:38
"Man Who Predicted 2020 Crash Now Says: Do This Before ""Big"" Change",msnmoney,2021-02-06 09:07:38
The 10 Most Popular Home Improvements Amid COVID-19,msnmoney,2021-02-06 09:07:38
Omaha legend puts $91 billion on one 5G stock,msnmoney,2021-02-06 09:07:38
Have a 401(k) and HSA? Don't Make This Mistake,msnmoney,2021-02-06 09:07:38
Another beloved pizza chain has filed for bankruptcy,msnmoney,2021-02-06 09:07:38
"Elon Musk sent Dogecoin soaring last week. Here are 6 times the Tesla boss has moved markets, from GameStop to Sandstorm",msnmoney,2021-02-06 09:07:38
This beloved chocolate shop is closing all of its locations,msnmoney,2021-02-06 09:07:38
6 Features That Determine a Home's Sale Price,msnmoney,2021-02-06 09:07:38
Top credit card wipes out interest until 2022 (seriously),msnmoney,2021-02-06 09:07:38
Cost To Own a Car for a Year in Every State,msnmoney,2021-02-06 09:07:38
China Approves Second Coronavirus Vaccine for Public Use,msnmoney,2021-02-06 09:07:38
Things you should (and shouldn't) buy in February,msnmoney,2021-02-06 09:07:38
30 short-term financial goals you can crush,msnmoney,2021-02-06 09:07:38
16 Fascinating Things You Never Knew About ATMs,msnmoney,2021-02-06 09:07:38
Meet TUSHY: Your Bumhole's New BFF,msnmoney,2021-02-06 09:07:38
'Big Short' investor Michael Burry paved the way for the GameStop frenzy when he bought a stake in 2019. Here's the story of Burry's game-changing bet.,msnmoney,2021-02-06 09:07:38
Do not make these mistakes when selling a used car,msnmoney,2021-02-06 09:07:38
Adding to Your Winners Can Make You Richer. Here's Why.,msnmoney,2021-02-06 09:07:38
Salaries for Some of America’s Toughest Jobs,msnmoney,2021-02-06 09:07:38
Benchmark’s Bill Gurley Takes Aim at Latest IPO Gains,msnmoney,2021-02-06 09:07:38
"The High Quality, Easy Way to Cut Nails for Seniors",msnmoney,2021-02-06 09:07:38
How Spending Money in These 10 Ways Will Actually Make You Happier,msnmoney,2021-02-06 09:07:38
The 3 Most Problematic Social Security Myths: Debunked,msnmoney,2021-02-06 09:07:38
These investments could blow up in 2021,msnmoney,2021-02-06 09:07:38
Daimler Braces for Questions About Job Cuts After Truck Spinoff,msnmoney,2021-02-06 09:07:38
12 Warm and Cozy Ski Chalets for the 21st Century,msnmoney,2021-02-06 09:07:38
Clever Trick To Turn Dusty House Into Fresh Air Paradise,msnmoney,2021-02-06 09:07:38
"Buying a Home? Check Out Today's Mortgage Rates, Feb. 6 & 7",msnmoney,2021-02-06 09:07:38
Where 51 CEOs Went To College,msnmoney,2021-02-06 09:07:38
"Porsche Plans Assembly Plant in Malaysia, Edge Reports",msnmoney,2021-02-06 09:07:38
16 Effective Ways To Trick Yourself Into Saving Money,msnmoney,2021-02-06 09:07:38
Game Plan: Cramer's 'Mad Money' Recap (Friday 2/5/21),msnmoney,2021-02-06 09:07:38
Inventions That Solve Everyday Problems,msnmoney,2021-02-06 09:07:38
The Biggest Salary Negotiation Mistakes You’re Making,msnmoney,2021-02-06 09:07:38
7 Stores That Match — or Beat — Amazon Prices,msnmoney,2021-02-06 09:07:38
Where Your Money Should Go To Prepare You for More COVID-19 Restrictions,msnmoney,2021-02-06 09:07:38
Cramer's week ahead: Fundamentals matter again after Reddit trading frenzy,msnmoney,2021-02-06 09:07:38
Football Players From These Colleges Make the Most Total NFL Money,msnmoney,2021-02-06 09:07:38
"Before you renew Amazon Prime, read this",msnmoney,2021-02-06 09:07:38
"Activision stock price sees 1984 levels, record valuation on expansion plans",msnmoney,2021-02-06 09:07:38
15 Tricks That Will Help You Save Even More at Trader Joe’s,msnmoney,2021-02-06 09:07:38
Ex-Shell Gas Trader Pleads Guilty Over Role in Scheme,msnmoney,2021-02-06 09:07:38
21 Pharmacy Chains Ready to Give COVID-19 Vaccines,msnmoney,2021-02-06 09:07:38
Chip Shortages Force More Cuts at North American Auto Plants,msnmoney,2021-02-06 09:07:38
Why Is Everyone Using This Breathing Trainer?,msnmoney,2021-02-06 09:07:38
Costco and Sam's Club membership perks you didn't know about,msnmoney,2021-02-06 09:07:38
Why Millennials Fall Short Saving for Retirement,msnmoney,2021-02-06 09:07:38
50 Things Every 50-Something Should Know About Retirement,msnmoney,2021-02-06 09:07:38
Fiscal stimulus prospects and strong earnings tailwind may propel stocks in the week ahead,msnmoney,2021-02-06 09:07:38
Common Money Myths About Millennials,msnmoney,2021-02-06 09:07:38
"How To Improve Your Presentation, Meeting and Interview Skills on Zoom",msnmoney,2021-02-06 09:07:38
"If You ever Shop at Home Depot, You're Going to Love This Hack",msnmoney,2021-02-06 09:07:38
American Cities That Added Jobs During the Pandemic,msnmoney,2021-02-06 09:07:38
"How to invest in equity crowdfunding, a way to give small private firms a boost - and possibly profit yourself",msnmoney,2021-02-06 09:07:38
Hidden Obstacles That Keep People From Retirement,msnmoney,2021-02-06 09:07:38
Stash vs. Acorns vs. Robinhood — which is the best investing app?,msnmoney,2021-02-06 09:07:38
17 Companies Facebook Famously Purchased — and How They’re Doing Now,msnmoney,2021-02-06 09:07:38
The IRS says teachers can deduct hand sanitizer costs and how Dolly Parton’s Super Bowl ad glosses over the reality for millions of gig workers,msnmoney,2021-02-06 09:07:38
Hydrogen Peroxide Hacks You Wish You Knew Sooner,msnmoney,2021-02-06 09:07:38
How COVID-19 Has Transformed the Way We Spend,msnmoney,2021-02-06 09:07:38
Oil Extends Weekly Gain With Brent Pushing Toward $60 a Barrel,msnmoney,2021-02-06 09:07:38
Fortune 500 Companies That Hire Remote Workers,msnmoney,2021-02-06 09:07:38
Economy Explained: How To Calculate Your Debt-to-Income Ratio,msnmoney,2021-02-06 09:07:38
Don’t Let Car Repairs Break the Bank — Here’s How To Cut Costs,msnmoney,2021-02-06 09:07:38
"Hippo in Talks to Merge With Mark Pincus, Reid Hoffman SPAC",msnmoney,2021-02-06 09:07:38
35 Household Items That Worth More Than Your House,msnmoney,2021-02-06 09:07:38
How Emergencies Like Coronavirus Expose Nonsense Business Practices,msnmoney,2021-02-06 09:07:38
Former baseball superstar Alex Rodriguez files to form $575 million SPAC as IPO craze continues,msnmoney,2021-02-06 09:07:38
15 Money Myths That Can Destroy Your Retirement,msnmoney,2021-02-06 09:07:38
"Apple Talks With Hyundai, Kia on Electric Car Paused Recently",msnmoney,2021-02-06 09:07:38
States With the Highest Number of COVID-19 Cases,msnmoney,2021-02-06 09:07:38
5 renovations that can impact your home insurance,msnmoney,2021-02-06 09:07:38
El-Erian on GameStop frenzy: 'We came close to a market accident',yahoofinance,2021-02-06 09:09:48
Companies should 'be ashamed’ for fighting wage hike: Clyburn,yahoofinance,2021-02-06 09:09:48
Op-Ed: How US business leaders can restore faith in capitalism,yahoofinance,2021-02-06 09:09:48
Facebook hates Apple's new privacy feature — here's how it works,yahoofinance,2021-02-06 09:09:48
Dogecoin in the spotlight after Elon Musk tweets,yahoofinance,2021-02-06 09:09:48
COVID-19 and Taxes: What you need to know before filing your 2020 return,yahoofinance,2021-02-06 09:09:48
This week in Bidenomics: Lucky timing,yahoofinance,2021-02-06 09:09:48
We'll get back all jobs lost in 2023: Zandi,yahoofinance,2021-02-06 09:09:48
"Arlington, Virginia: Why Americans Are Revisiting Their Insurance..",yahoofinance,2021-02-06 09:09:48
"Cramer Shares His Thoughts On Upwork, 3D Systems, More",yahoofinance,2021-02-06 09:09:48
Four High Dividend Stocks You Can Count On,yahoofinance,2021-02-06 09:09:48
"The worst ways people will use their next stimulus check, according to Suze Orman",yahoofinance,2021-02-06 09:09:48
The Biden Stock Market Won’t Be Like the Trump Market. What to Expect.,yahoofinance,2021-02-06 09:09:48
Dow Rallies As Kamala Harris Breaks Senate Stimulus Deadlock; GameStop Surges Amid Breakouts,yahoofinance,2021-02-06 09:09:48
2 “Strong Buy” Penny Stocks With Over 200% Upside on the Horizon,yahoofinance,2021-02-06 09:09:48
What’s a Roth 401(k)? Does the 4% rule work? Can I buy a home right before retirement? MarketWatch answers your questions,yahoofinance,2021-02-06 09:09:48
A Bubble Is Inflating. Where Can Investors Hide?,yahoofinance,2021-02-06 09:09:48
"Mohamed El-Erian on the GameStop short squeeze: 'We came very, very close to a market accident'",yahoofinance,2021-02-06 09:09:48
Electric Aircraft Startup Archer to Go Public at Multibillion Dollar Valuation via SPAC – Sources,yahoofinance,2021-02-06 09:09:48
Mystery Trade Adds Almost $9 Billion to Vanguard S&P 500 ETF,yahoofinance,2021-02-06 09:09:48
Is AMD Stock A Buy After Chipmaker's Fourth-Quarter Earnings Report?,yahoofinance,2021-02-06 09:09:48
"Biggest U.S. Pension Bought More NIO and Activision Stock, and 2 Retailers",yahoofinance,2021-02-06 09:09:48
"Is Ford Stock A Buy Now After Earnings Surprise, EV Investment?",yahoofinance,2021-02-06 09:09:48
Why is the stock market ripping higher again?,yahoofinance,2021-02-06 09:09:48
The 5G Revolution Could Send These 3 Stocks Higher,yahoofinance,2021-02-06 09:09:48
The most shorted securities in the world aren’t stocks,yahoofinance,2021-02-06 09:09:48
These 3 Firms Could Be the Next SPAC Targets,yahoofinance,2021-02-06 09:09:48
Investors Have Shunned Utilities Despite Their Steady Dividends. Here Are 6 to Consider for Yield.,yahoofinance,2021-02-06 09:09:48
See The Best Stocks To Buy And Watch Being Bought By The Best Mutual Funds,yahoofinance,2021-02-06 09:09:48
"Vaxart Stock Takes a Hit, but Is It Warranted? Analyst Weighs In",yahoofinance,2021-02-06 09:09:48
"Wall Street Veteran Says Market Could Plunge 15%, Sounding Alarm About Bubbles",yahoofinance,2021-02-06 09:09:48
Dow Jones Futures: Congress Fast Tracks Biden Stimulus Plan; Market Rally Warning Signs,yahoofinance,2021-02-06 09:09:48
Novavax Hits Record High After Seeking Covid Vaccine OK; Is It A Buy?,yahoofinance,2021-02-06 09:09:48
More Than Two Dozen Funds Returned More Than 100% Last Year. Here’s Why That’s Not Good News.,yahoofinance,2021-02-06 09:09:48
Keystone XL’s Collapse Leaves Canada’s Oil Heartland Seeking Payback,yahoofinance,2021-02-06 09:09:48
"The Ultimate Warren Buffett Stock Is In Buy Zone, But Should You Buy It?",yahoofinance,2021-02-06 09:09:48
"Zoom Video, Shopify Lead Five Stocks Racing Past Buy Points",yahoofinance,2021-02-06 09:09:48
‘Moment of weakness’: Amateur investors left counting GameStop losses,yahoofinance,2021-02-06 09:09:48
"The Week In Cannabis: Stocks Up By Double-Digits On Jazz Pharma's GWPH Acquisition, Potential Federal Moves",yahoofinance,2021-02-06 09:09:48
Chip Shortage Spirals Beyond Cars to Phones and Game Consoles,yahoofinance,2021-02-06 09:09:48
Is Apple Stock A Buy Amid Growing Apple Car Speculation?,yahoofinance,2021-02-06 09:09:48
"First Mover: It’s ‘Dorsey’s Node’ as Bitcoin Marches Higher, DOGE Chokes",yahoofinance,2021-02-06 09:09:48
"Koss’s CEO Sold 36,000 Shares. It’s Not His First Time Cashing in This Week.",yahoofinance,2021-02-06 09:09:48
These 4 Small-Cap EV Stocks Are Soaring. Why Now?,yahoofinance,2021-02-06 09:09:48
Ocugen: There’s a New Potential Covid-19 Vaccine at the Gate,yahoofinance,2021-02-06 09:09:48
"3M, Yum! Brands, and Other Companies That Raised Their Dividends This Week",yahoofinance,2021-02-06 09:09:48
"Why BofA Is Bullish On Wynn, Penn National Despite The Pandemic's Impact On Casinos",yahoofinance,2021-02-06 09:09:48
U.S. Market Wrap and Forecast for Monday,yahoofinance,2021-02-06 09:09:48
"4 Qualcomm Analysts On 'Capacity-Constrained' Quarter, 2021 Outlook",yahoofinance,2021-02-06 09:09:48
Bitcoin Rally Takes Crypto Market Value to New Record,yahoofinance,2021-02-06 09:09:48
Clover Health calls Hindenburg attack a desperate attempt to position itself as a 'white knight',yahoofinance,2021-02-06 09:09:48
What Is the Generation-Skipping Transfer Tax?,yahoofinance,2021-02-06 09:09:48
"EV Battery Maker QuantumScape Is Full of Promise, but the Price Is Too Steep",yahoofinance,2021-02-06 09:09:48
Zoom Video: Short Interest Falls Amid Cash Raise; Is Acquisition Coming?,yahoofinance,2021-02-06 09:09:48
"Lawmakers Call On Biden To Cancel $50,000 Of Student Debt Immediately",yahoofinance,2021-02-06 09:09:48
"BP, Exxon And Shell – Giants Or Dinosaurs In The Making?",yahoofinance,2021-02-06 09:09:48
"Why Some Semiconductor Stocks Got A Lift From Earnings, And Others Didn't",yahoofinance,2021-02-06 09:09:48
Luckin Coffee Is Filing for Bankruptcy. The Stock Could Go to Zero.,yahoofinance,2021-02-06 09:09:48
"Silver’s rally gets snuffed out, but the precious metal remains undervalued",yahoofinance,2021-02-06 09:09:48
Here Are 3 Cannabis Stocks to Consider as They Face Significant Debt Issues,yahoofinance,2021-02-06 09:09:48
"Should Amazon Try To Acquire Alibaba, Jumia Or eBay In 2021?",yahoofinance,2021-02-06 09:09:48
What’s the best way to reduce the taxes on my estate?,yahoofinance,2021-02-06 09:09:48
The Best Defense Stocks For Today — And The Future,yahoofinance,2021-02-06 09:09:48
Is Roku Stock A Buy Ahead Of Its Fourth-Quarter Earnings Report?,yahoofinance,2021-02-06 09:09:48
"Cassava: Alzheimer’s Study Results Are Promising but It’s Early Days, Says Analyst",yahoofinance,2021-02-06 09:09:48
Best Dividend ETFs for Q2 2021,yahoofinance,2021-02-06 09:09:48
"Melvin Capital, GameStop and the road to disaster",yahoofinance,2021-02-06 09:09:48
Is T-Mobile Stock A Buy? Upcoming Investor Day Key Amid 5G Wireless Auction,yahoofinance,2021-02-06 09:09:48
Alaska seeks to build natgas pipe from North Slope to Fairbanks,yahoofinance,2021-02-06 09:09:48
[video]The Average Retirement Savings by Age Group,yahoofinance,2021-02-06 09:09:48
5 Value Stocks In The Basic Materials Sector,yahoofinance,2021-02-06 09:09:48
Home-Price Surge Says Inflation Is Real. The Fed Clings to Illusion It Isn’t.,yahoofinance,2021-02-06 09:09:48
The Wave of Biotech IPOs Continues. Here Are 7 Stocks That Hit the Market,yahoofinance,2021-02-06 09:09:48
Why Plug Power Is Rising For Fourth Straight Session,yahoofinance,2021-02-06 09:09:48
"Apple Talks With Hyundai, Kia on Electric Car Paused Recently",yahoofinance,2021-02-06 09:09:48
Platinum Prices Are Poised to Bounce Back. Here are Stocks and Funds to Play It.,yahoofinance,2021-02-06 09:09:48
"As ‘Low Quality’ Stages a Comeback, This Utility Stock Looks Set to Break Out",yahoofinance,2021-02-06 09:09:48
"Goldman says stay overweight U.S. equities, Bitcoin not an investable asset class in a portfolio",yahoofinance,2021-02-06 09:09:48
Looking For Yield? Look To REITs,yahoofinance,2021-02-06 09:09:48
Game Plan: Cramer's 'Mad Money' Recap (Friday 2/5/21),yahoofinance,2021-02-06 09:09:48
"Americans Will Bet $4.3B On The Super Bowl, But Vegas Casino Stocks May Miss Out",yahoofinance,2021-02-06 09:09:48
Nokia Stock Falls After Earnings. Look Out for ‘Atypical Volatility.’,yahoofinance,2021-02-06 09:09:48
Is Qualcomm Stock A Buy Right Now After Mixed Earnings Report?,yahoofinance,2021-02-06 09:09:48
Is TLRY Stock A Buy As U.S. Lawmakers Focus On Cannabis Reform?,yahoofinance,2021-02-06 09:09:48
Simple Trusts vs. Complex Trusts,yahoofinance,2021-02-06 09:09:48
Ether seeks to escape bitcoin's shadow with CME futures launch,yahoofinance,2021-02-06 09:09:48
What to Know About Filing Taxes,yahoofinance,2021-02-06 09:09:48
Regeneron Pulls Off Double-Digit Growth As Cholesterol Drug Pads Sales,yahoofinance,2021-02-06 09:09:48
GameStop Stock Jumps As Robinhood Lifts Trading Limits But Regulators Are Just Getting Started,yahoofinance,2021-02-06 09:09:48
Biotech Surpasses GameStop as Best-Performing Retail Pick,yahoofinance,2021-02-06 09:09:48
Sundial Growers Closes $74.5M Offering After Being Targeted By WallStreetBets,yahoofinance,2021-02-06 09:09:48
Avoiding The Apple Stock Earnings Drawdown,yahoofinance,2021-02-06 09:09:48
The S&P 500 is currently mirroring 2009-2010 to a 'creepy' degree: veteran hedge funder,yahoofinance,2021-02-06 09:09:48
How Is Social Security Tax Calculated?,yahoofinance,2021-02-06 09:09:48
A Huge Number of Oil Supertankers Are Pointing at China’s Ports,yahoofinance,2021-02-06 09:09:48
5 Value Stocks In The Financial Services Sector,yahoofinance,2021-02-06 09:09:48
This Top Tech Stock Play In Buy Zone After 110% Run,yahoofinance,2021-02-06 09:09:48
Baby boomers face financial distress and age discrimination,yahoofinance,2021-02-06 09:09:48
"Atlantic American stock rockets nearly four-fold toward 34-year high, with no news released",yahoofinance,2021-02-06 09:09:48
There Are Still 16 Meme Stocks With at Least 100% Gains in 2021,yahoofinance,2021-02-06 09:09:48
"DNA, Genomics Company 23andMe Gets SPAC Deal: What Investors Should Know",yahoofinance,2021-02-06 09:09:48
Hedge funds resume role as Wall Street’s villains,yahoofinance,2021-02-06 09:09:48
Recent Hot IPO Unity Software Tumbles On Forecast For Slowing Sales,yahoofinance,2021-02-06 09:09:48
"Prudential CEO mulls shrinking life insurance, ""low growth"" businesses",yahoofinance,2021-02-06 09:09:48
Solar Stocks Have Been Thriving—Here’s Why That Could Continue,yahoofinance,2021-02-06 09:09:48
Disney earnings preview: Can Disney+ maintain its torrid pace to sustain the Magic Kingdom?,yahoofinance,2021-02-06 09:09:48
XPeng’s EV Deliveries Were Better Than Rivals’. The Stock Is Down.,yahoofinance,2021-02-06 09:09:48
"Money Is Pouring Into Emerging Markets, and Out of the U.S. What That Means For Investors.",yahoofinance,2021-02-06 09:09:48
"Dow Rallies As J&J Gains, Senate OKs Budget Plan For Biden Stimulus Bill",yahoofinance,2021-02-06 09:09:48
Biden Backs Off $15 Wage as Virus-Aid Plan Takes Shape,wsj,2021-02-06 09:12:34
Some Skip the Line to Get a Covid-19 Vaccine,wsj,2021-02-06 09:12:34
Musk’s Dogecoin Tweeting Has Believers Barking for More,wsj,2021-02-06 09:12:34
