headline,org,date
Fired Tyson manager defends COVID-19 bets as morale booster,msnmoney,2020-12-29 11:54:15
15 Cities With the Highest Rent-to-Price Ratio,msnmoney,2020-12-29 11:54:15
FDA Warns Against Using These 9 Hand Sanitizers,msnmoney,2020-12-29 11:54:15
Should You Invest in Real Estate With Bitcoin?,msnmoney,2020-12-29 11:54:15
Smart investments to make in 2021,msnmoney,2020-12-29 11:54:15
"Green Chef Is Giving $90 OFF Across Four Boxes, Including Free Shipping On The First Box Today!",msnmoney,2020-12-29 11:54:15
Boeing 737 Max returns to U.S. skies after nearly 2 years,msnmoney,2020-12-29 11:54:15
Stores With the Best and Worst Return Policies,msnmoney,2020-12-29 11:54:15
Stocks Turn Mixed After Record Open on Relief-Package Optimism,msnmoney,2020-12-29 11:54:15
"HelloFresh Winter Sale: Get $90 OFF Across Four Boxes, Including Free Shipping On The First Box!!",msnmoney,2020-12-29 11:54:15
How Much You Need To Live Comfortably in 50 Major US Cities,msnmoney,2020-12-29 11:54:15
Calculate Your New House Payment In Just A Few Steps,msnmoney,2020-12-29 11:54:15
These are the 50 most expensive small towns in America,msnmoney,2020-12-29 11:54:15
7 Kirkland Signature Items to Avoid at Costco,msnmoney,2020-12-29 11:54:15
Best Healthcare Stocks to Buy for 2021,msnmoney,2020-12-29 11:54:15
10 financial resolutions to make for the new year,msnmoney,2020-12-29 11:54:15
New York Passes 'Strongest Bill' Against Evictions,msnmoney,2020-12-29 11:54:15
These $19k SUVs Will Make You Trade in Your Car,msnmoney,2020-12-29 11:54:15
Things you should stop buying in 2021,msnmoney,2020-12-29 11:54:15
Airbus Nears 550 Deliveries in Year Derailed by Covid-19,msnmoney,2020-12-29 11:54:15
10 Survival Tips for Lottery Winners,msnmoney,2020-12-29 11:54:15
FHA vs. Conventional Loans in Plain English,msnmoney,2020-12-29 11:54:15
You have days left to spend your FSA cash,msnmoney,2020-12-29 11:54:15
"[Photos] Sportscasters Salaries Released, Viewers Are Upset",msnmoney,2020-12-29 11:54:15
These married former Apple execs used lessons learned from Steve Jobs to pivot their small business during Covid,msnmoney,2020-12-29 11:54:15
What to Wear When Working From Home,msnmoney,2020-12-29 11:54:15
What 2020 Tax Credit Do I Qualify For?,msnmoney,2020-12-29 11:54:15
Reasons shopping at Costco is the worst,msnmoney,2020-12-29 11:54:15
The pandemic's new chefs and foodies: How the health crisis shaped what we cook and crave,msnmoney,2020-12-29 11:54:15
Dancers stun the crowd after their sudden collapse,msnmoney,2020-12-29 11:54:15
2020 in Review: Iconic US Businesses That Filed for Bankruptcy,msnmoney,2020-12-29 11:54:15
Turning 66 Next Year? Beware This Social Security Change,msnmoney,2020-12-29 11:54:15
Richest ZIP Codes in Every State,msnmoney,2020-12-29 11:54:15
"Boeing 737 MAX, $2,000 Checks, Novavax Vaccine - 5 Things You Must Know Tuesday",msnmoney,2020-12-29 11:54:15
The best time to buy almost anything in 2021,msnmoney,2020-12-29 11:54:15
Unique Tip If Your Car Has Automatic Headlights,msnmoney,2020-12-29 11:54:15
"Here's how companies factor in environmental, social and corporate governance concerns",msnmoney,2020-12-29 11:54:15
The most expensive celebrity homes of all time,msnmoney,2020-12-29 11:54:15
Is an employee's student loan repayment benefit taxed as income?,msnmoney,2020-12-29 11:54:15
19 Areas To Invest In During a Financial Crisis,msnmoney,2020-12-29 11:54:15
Will the Biden Presidency Hurt the Stock Market?,msnmoney,2020-12-29 11:54:15
These Clingy Dog Breeds Will Stay by Your Side,msnmoney,2020-12-29 11:54:15
Retirement accounts you need to build your nest egg,msnmoney,2020-12-29 11:54:15
"What Is Sundae, and Should Investors Use It?",msnmoney,2020-12-29 11:54:15
The 15 Best Tech Stocks to Buy for 2021,msnmoney,2020-12-29 11:54:15
"Retail’s Boom-and-Bust 2020, in 10 Charts",msnmoney,2020-12-29 11:54:15
Return Policies for Gifts Your Friends and Family Bought Online,msnmoney,2020-12-29 11:54:15
PayPal Has 300 Million Members – Yet Few Have This Upgrade,msnmoney,2020-12-29 11:54:15
68% of Americans Had a Financial Setback in 2020: How to Recover,msnmoney,2020-12-29 11:54:15
The Year of Delivery: Companies That Surged in 2020,msnmoney,2020-12-29 11:54:15
"Best Mutual Fund, ETF Opportunities for 2021",msnmoney,2020-12-29 11:54:15
How Long $1 Million in Savings Will Last in Every State,msnmoney,2020-12-29 11:54:15
12 passive income ideas to help you make money in 2021,msnmoney,2020-12-29 11:54:15
7 Mistakes That Can Ruin Your Retirement,msnmoney,2020-12-29 11:54:15
Companies With the Happiest Employees,msnmoney,2020-12-29 11:54:15
Covid vaccine gives small businesses enough hope to go bankrupt,msnmoney,2020-12-29 11:54:15
Salaries by Profession for 15 Flexible Career Fields,msnmoney,2020-12-29 11:54:15
Market Rallies During the Holiday Week,msnmoney,2020-12-29 11:54:15
Safe (but fun!) ways to ring in 2021,msnmoney,2020-12-29 11:54:15
50 personal finance resolutions to make for 2021,msnmoney,2020-12-29 11:54:15
7 Discounts Seniors Get Only if They Ask,msnmoney,2020-12-29 11:54:15
Never mind 90210. These are the richest ZIP codes in America,msnmoney,2020-12-29 11:54:15
World’s Top Cigar Producer Enjoys Boom Amid Covid Lockdowns,msnmoney,2020-12-29 11:54:15
5 Ways to Track Your Budget in the Years Before You Retire,msnmoney,2020-12-29 11:54:15
Vedanta Resources to Issue $400 Million Notes to Oaktree,msnmoney,2020-12-29 11:54:15
2020 in Review: The Year for Google,msnmoney,2020-12-29 11:54:15
3 Free Ways to Learn Digital Skills for Remote Jobs,msnmoney,2020-12-29 11:54:15
The Genius Hack Every Home Depot Shopper Should Know,msnmoney,2020-12-29 11:54:15
How To Talk to Your Parents About Their Estate Plan (Without Making It Awkward),msnmoney,2020-12-29 11:54:15
"Ant Considers Holding Company With Regulation Similar to Bank, Sources Say",msnmoney,2020-12-29 11:54:15
How To Get Your Money Back on ‘Nonrefundable’ Items,msnmoney,2020-12-29 11:54:15
20 Things That Are Actually Worth Stockpiling,msnmoney,2020-12-29 11:54:15
Beloved shopping catalogs we miss buying from,msnmoney,2020-12-29 11:54:15
Stanford Scientists Create a Billionaire Factory,msnmoney,2020-12-29 11:54:15
Fired Tyson manager defends COVID-19 bets as morale booster,msnmoney,2020-12-29 11:54:15
15 Cities With the Highest Rent-to-Price Ratio,msnmoney,2020-12-29 11:54:15
FDA Warns Against Using These 9 Hand Sanitizers,msnmoney,2020-12-29 11:54:15
Should You Invest in Real Estate With Bitcoin?,msnmoney,2020-12-29 11:54:15
Smart investments to make in 2021,msnmoney,2020-12-29 11:54:15
"Green Chef Is Giving $90 OFF Across Four Boxes, Including Free Shipping On The First Box Today!",msnmoney,2020-12-29 11:54:15
Boeing 737 Max returns to U.S. skies after nearly 2 years,msnmoney,2020-12-29 11:54:15
Stores With the Best and Worst Return Policies,msnmoney,2020-12-29 11:54:15
Stocks Turn Mixed After Record Open on Relief-Package Optimism,msnmoney,2020-12-29 11:54:15
"HelloFresh Winter Sale: Get $90 OFF Across Four Boxes, Including Free Shipping On The First Box!!",msnmoney,2020-12-29 11:54:15
How Much You Need To Live Comfortably in 50 Major US Cities,msnmoney,2020-12-29 11:54:15
Calculate Your New House Payment In Just A Few Steps,msnmoney,2020-12-29 11:54:15
These are the 50 most expensive small towns in America,msnmoney,2020-12-29 11:54:15
7 Kirkland Signature Items to Avoid at Costco,msnmoney,2020-12-29 11:54:15
Best Healthcare Stocks to Buy for 2021,msnmoney,2020-12-29 11:54:15
10 financial resolutions to make for the new year,msnmoney,2020-12-29 11:54:15
New York Passes 'Strongest Bill' Against Evictions,msnmoney,2020-12-29 11:54:15
These $19k SUVs Will Make You Trade in Your Car,msnmoney,2020-12-29 11:54:15
Things you should stop buying in 2021,msnmoney,2020-12-29 11:54:15
Airbus Nears 550 Deliveries in Year Derailed by Covid-19,msnmoney,2020-12-29 11:54:15
10 Survival Tips for Lottery Winners,msnmoney,2020-12-29 11:54:15
FHA vs. Conventional Loans in Plain English,msnmoney,2020-12-29 11:54:15
You have days left to spend your FSA cash,msnmoney,2020-12-29 11:54:15
"[Photos] Sportscasters Salaries Released, Viewers Are Upset",msnmoney,2020-12-29 11:54:15
These married former Apple execs used lessons learned from Steve Jobs to pivot their small business during Covid,msnmoney,2020-12-29 11:54:15
What to Wear When Working From Home,msnmoney,2020-12-29 11:54:15
What 2020 Tax Credit Do I Qualify For?,msnmoney,2020-12-29 11:54:15
Reasons shopping at Costco is the worst,msnmoney,2020-12-29 11:54:15
The pandemic's new chefs and foodies: How the health crisis shaped what we cook and crave,msnmoney,2020-12-29 11:54:15
Dancers stun the crowd after their sudden collapse,msnmoney,2020-12-29 11:54:15
2020 in Review: Iconic US Businesses That Filed for Bankruptcy,msnmoney,2020-12-29 11:54:15
Turning 66 Next Year? Beware This Social Security Change,msnmoney,2020-12-29 11:54:15
Richest ZIP Codes in Every State,msnmoney,2020-12-29 11:54:15
"Boeing 737 MAX, $2,000 Checks, Novavax Vaccine - 5 Things You Must Know Tuesday",msnmoney,2020-12-29 11:54:15
The best time to buy almost anything in 2021,msnmoney,2020-12-29 11:54:15
Unique Tip If Your Car Has Automatic Headlights,msnmoney,2020-12-29 11:54:15
"Here's how companies factor in environmental, social and corporate governance concerns",msnmoney,2020-12-29 11:54:15
The most expensive celebrity homes of all time,msnmoney,2020-12-29 11:54:15
Is an employee's student loan repayment benefit taxed as income?,msnmoney,2020-12-29 11:54:15
19 Areas To Invest In During a Financial Crisis,msnmoney,2020-12-29 11:54:15
Will the Biden Presidency Hurt the Stock Market?,msnmoney,2020-12-29 11:54:15
These Clingy Dog Breeds Will Stay by Your Side,msnmoney,2020-12-29 11:54:15
Retirement accounts you need to build your nest egg,msnmoney,2020-12-29 11:54:15
"What Is Sundae, and Should Investors Use It?",msnmoney,2020-12-29 11:54:15
The 15 Best Tech Stocks to Buy for 2021,msnmoney,2020-12-29 11:54:15
"Retail’s Boom-and-Bust 2020, in 10 Charts",msnmoney,2020-12-29 11:54:15
Return Policies for Gifts Your Friends and Family Bought Online,msnmoney,2020-12-29 11:54:15
PayPal Has 300 Million Members – Yet Few Have This Upgrade,msnmoney,2020-12-29 11:54:15
68% of Americans Had a Financial Setback in 2020: How to Recover,msnmoney,2020-12-29 11:54:15
The Year of Delivery: Companies That Surged in 2020,msnmoney,2020-12-29 11:54:15
"Best Mutual Fund, ETF Opportunities for 2021",msnmoney,2020-12-29 11:54:15
How Long $1 Million in Savings Will Last in Every State,msnmoney,2020-12-29 11:54:15
12 passive income ideas to help you make money in 2021,msnmoney,2020-12-29 11:54:15
7 Mistakes That Can Ruin Your Retirement,msnmoney,2020-12-29 11:54:15
Companies With the Happiest Employees,msnmoney,2020-12-29 11:54:15
Covid vaccine gives small businesses enough hope to go bankrupt,msnmoney,2020-12-29 11:54:15
Salaries by Profession for 15 Flexible Career Fields,msnmoney,2020-12-29 11:54:15
Market Rallies During the Holiday Week,msnmoney,2020-12-29 11:54:15
Safe (but fun!) ways to ring in 2021,msnmoney,2020-12-29 11:54:15
50 personal finance resolutions to make for 2021,msnmoney,2020-12-29 11:54:15
7 Discounts Seniors Get Only if They Ask,msnmoney,2020-12-29 11:54:15
Never mind 90210. These are the richest ZIP codes in America,msnmoney,2020-12-29 11:54:15
World’s Top Cigar Producer Enjoys Boom Amid Covid Lockdowns,msnmoney,2020-12-29 11:54:15
5 Ways to Track Your Budget in the Years Before You Retire,msnmoney,2020-12-29 11:54:15
Vedanta Resources to Issue $400 Million Notes to Oaktree,msnmoney,2020-12-29 11:54:15
2020 in Review: The Year for Google,msnmoney,2020-12-29 11:54:15
3 Free Ways to Learn Digital Skills for Remote Jobs,msnmoney,2020-12-29 11:54:15
The Genius Hack Every Home Depot Shopper Should Know,msnmoney,2020-12-29 11:54:15
How To Talk to Your Parents About Their Estate Plan (Without Making It Awkward),msnmoney,2020-12-29 11:54:15
"Ant Considers Holding Company With Regulation Similar to Bank, Sources Say",msnmoney,2020-12-29 11:54:15
How To Get Your Money Back on ‘Nonrefundable’ Items,msnmoney,2020-12-29 11:54:15
20 Things That Are Actually Worth Stockpiling,msnmoney,2020-12-29 11:54:15
Beloved shopping catalogs we miss buying from,msnmoney,2020-12-29 11:54:15
Stanford Scientists Create a Billionaire Factory,msnmoney,2020-12-29 11:54:15
"Stocks pare gains after hitting record highs, Nasdaq dips ",yahoofinance,2020-12-29 11:57:26
'Patriotic Millionaire': Americans will spend stimulus fast,yahoofinance,2020-12-29 11:57:26
Fed extends Main Street Lending Program to Jan. 8,yahoofinance,2020-12-29 11:57:26
First U.S. commercial Boeing 737 MAX since 2019 departs Miami,yahoofinance,2020-12-29 11:57:26
Here’s what has to happen for Tesla to grow into its valuation,yahoofinance,2020-12-29 11:57:26
Square had a huge year in 2020. What's next?,yahoofinance,2020-12-29 11:57:26
Home price growth surges at pace not seen since 2014,yahoofinance,2020-12-29 11:57:26
The economic chart of the year,yahoofinance,2020-12-29 11:57:26
Multi-asset investing for uncertain times,yahoofinance,2020-12-29 11:57:26
"These 2 Penny Stocks Are Poised to Go Boom, Say Analysts",yahoofinance,2020-12-29 11:57:26
Investors Lose $609 Billion On 8 Giant Stocks This Year,yahoofinance,2020-12-29 11:57:26
"We’re 56, have $400,000 in debt, can save $50,000 a year and just want to retire — what should we do?",yahoofinance,2020-12-29 11:57:26
Best Dividend Stocks For 2021: Five Strong-Yield Stocks Beating The S&P 500,yahoofinance,2020-12-29 11:57:26
Is my stimulus check taxable income? Will it reduce my tax return? Burning questions about the second COVID-19 stimulus,yahoofinance,2020-12-29 11:57:26
Daily – Vickers Top Insider Picks for 12/29/2020,yahoofinance,2020-12-29 11:57:26
Congress is giving you a new stimulus check — here's when to expect it,yahoofinance,2020-12-29 11:57:26
"Goldman’s Sheila Patel, Chairman of $1.8 Trillion Manager, to Retire",yahoofinance,2020-12-29 11:57:26
These are the 20 worst-performing S&P 500 stocks of 2020 — analysts see double-digit rebounds for 6 of them in 2021,yahoofinance,2020-12-29 11:57:26
These Are the 12 Most Overvalued Stocks in America Right Now,yahoofinance,2020-12-29 11:57:26
16 Ethereum Predictions From a Crypto Oracle,yahoofinance,2020-12-29 11:57:26
Daily – Vickers Top Buyers & Sellers for 12/29/2020,yahoofinance,2020-12-29 11:57:26
"Now that Trump has signed the stimulus checks bill, when do you get your cash?",yahoofinance,2020-12-29 11:57:26
"Boeing 737 MAX, $2,000 Checks, Novavax Vaccine - 5 Things You Must Know Tuesday",yahoofinance,2020-12-29 11:57:26
China EV Maker Inks Deal With State-Owned Bank Amid Beijing Crackdown,yahoofinance,2020-12-29 11:57:26
Is My Stimulus Check Taxable Income? Will It Reduce My Tax Return? What to Know.,yahoofinance,2020-12-29 11:57:26
"Dow Jones Rallies To Record High As House Approves $2,000 Stimulus Checks; Apple Hits New Buy Point",yahoofinance,2020-12-29 11:57:26
Technical Assessment: Bullish in the Intermediate-Term,yahoofinance,2020-12-29 11:57:26
"Here’s where to invest your money before traders start ‘rotating, if not stampeding’ out of stocks, according to one Warren Buffett disciple",yahoofinance,2020-12-29 11:57:26
Tesla: Soaring share price creates army of 'Teslanaires',yahoofinance,2020-12-29 11:57:26
Dow Jones Stocks To Buy And Watch In December 2020: Apple Reverses From New Buy Point,yahoofinance,2020-12-29 11:57:26
Warren Buffett's 6 tricks for teaching kids about money,yahoofinance,2020-12-29 11:57:26
A Bear Market in Stocks Could Still Happen. Here’s When to Worry.,yahoofinance,2020-12-29 11:57:26
Analyst Report: IMAX Corporation,yahoofinance,2020-12-29 11:57:26
VMware files suit against former exec for moving to rival company,yahoofinance,2020-12-29 11:57:26
Stanford Scientists Create a Billionaire Factory,yahoofinance,2020-12-29 11:57:26
Warren Buffett Called Bitcoin 'Rat Poison' — Now It's Closing In On Berkshire Hathaway's Valuation,yahoofinance,2020-12-29 11:57:26
Nio Day Set For Jan. 9: What You Need To Know,yahoofinance,2020-12-29 11:57:26
"Is PayPal Stock A Buy Right Now? Here's What Earnings, Charts Show",yahoofinance,2020-12-29 11:57:26
"Analyst Report: Groupon, Inc.",yahoofinance,2020-12-29 11:57:26
GILD Stock: Using Options To Buy The Stock At A 7% Discount,yahoofinance,2020-12-29 11:57:26
Ambani Sold a Tech Dream for $27 Billion. Now He Has to Deliver,yahoofinance,2020-12-29 11:57:26
Look past this Santa Claus rally and see how January’s stock market return could affect all of 2021,yahoofinance,2020-12-29 11:57:26
"Alibaba Regulatory Woes A 'Nirvana Set Up' For FAANG Stocks, Says Analyst",yahoofinance,2020-12-29 11:57:26
Best Dividend Stocks for January 2021,yahoofinance,2020-12-29 11:57:26
Daily – Vickers Top Insider Picks for 12/28/2020,yahoofinance,2020-12-29 11:57:26
How To Combat Depression After Retirement,yahoofinance,2020-12-29 11:57:26
Wells Fargo: 3 Chip Stocks to Buy as We Head Into 2021,yahoofinance,2020-12-29 11:57:26
QuantumScape Was Unknown. Now It’s One of the Most Valuable Stocks in the Car Industry.,yahoofinance,2020-12-29 11:57:26
Coinbase to Suspend XRP Trading Following SEC Suit Against Ripple,yahoofinance,2020-12-29 11:57:26
Global investors flee from Chinese tech stocks after the government crackdown on Ant and Alibaba,yahoofinance,2020-12-29 11:57:26
Daily Spotlight: China Lags on GDP/Capita,yahoofinance,2020-12-29 11:57:26
Big Data Companies And Data Analytics: The Stocks To Buy And Watch,yahoofinance,2020-12-29 11:57:26
Best Healthcare Stocks to Buy for 2021,yahoofinance,2020-12-29 11:57:26
Norwegian Cruise Line Floats A Rising RS Rating As Future Bookings Rise,yahoofinance,2020-12-29 11:57:26
Wall Street Is Pounding The Table For These Semiconductor Stocks,yahoofinance,2020-12-29 11:57:26
Gold Rebound Pauses As Investors Await Two Key Signals,yahoofinance,2020-12-29 11:57:26
Weekly Stock List,yahoofinance,2020-12-29 11:57:26
Is Gilead Stock A Buy As The Company Expands Through Buyouts?,yahoofinance,2020-12-29 11:57:26
Alibaba Is Down 30% in 2 Months. Buy the Dip.,yahoofinance,2020-12-29 11:57:26
Eaton Is One of Barron’s Top Stock Picks for the New Year. Here’s Why.,yahoofinance,2020-12-29 11:57:26
"Is Etsy Stock A Buy Right Now? Here's What Earnings, Charts Show",yahoofinance,2020-12-29 11:57:26
"Record 5G Spectrum Auction Pauses As Investors Mull Verizon, AT&T, Comcast Bidding",yahoofinance,2020-12-29 11:57:26
Analyst Report: CarMax Inc,yahoofinance,2020-12-29 11:57:26
Analysts See More Gains for Chip Stocks. Here Are Their Top Picks.,yahoofinance,2020-12-29 11:57:26
Snap Shares Surge on Goldman Sachs Price Target Boost to Wall Street-High $70,yahoofinance,2020-12-29 11:57:26
Brexit 'big bang' to trigger tectonic trading rift in Europe,yahoofinance,2020-12-29 11:57:26
"Is QQQ Stock A Buy Right Now? Here's What Earnings, Charts Show",yahoofinance,2020-12-29 11:57:26
Best Growth Stocks for January 2021,yahoofinance,2020-12-29 11:57:26
Market Digest: KMX,yahoofinance,2020-12-29 11:57:26
Auto Parts Maker Timken Co. Opens Factory In Mexico,yahoofinance,2020-12-29 11:57:26
Arcturus Slumps Amid Analyst Pessimism on Vaccine,yahoofinance,2020-12-29 11:57:26
AI chipmaker Graphcore raises $222M at a $2.77B valuation and puts an IPO in its sights,yahoofinance,2020-12-29 11:57:26
Will Plug Power Stock Reach $50 By 2022?,yahoofinance,2020-12-29 11:57:26
"WDC Stock: Is It A Buy Right Now? Here's What Earnings, Western Digital Stock Charts Show",yahoofinance,2020-12-29 11:57:26
"Stock market news live updates: Stocks pare gains after hitting record highs, Nasdaq dips",yahoofinance,2020-12-29 11:57:26
3 Monster Growth Stocks That Can Charge Forward in 2021,yahoofinance,2020-12-29 11:57:26
"Dow Jones, Up 765 Points In December, Hits New Highs; When To Buy Microsoft",yahoofinance,2020-12-29 11:57:26
Bill Ackman Has Had Another Blockbuster Year. His Fund Is Still Cheap.,yahoofinance,2020-12-29 11:57:26
IBD 50 Stocks To Watch: No. 2-Ranked Semiconductor Stock In A Buy Range,yahoofinance,2020-12-29 11:57:26
Jack Ma's Ant Mulls Creating Holding Company To Resolve Regulatory Crisis: Report,yahoofinance,2020-12-29 11:57:26
Apple Hits Record After December Surge Sends It Past Amazon,yahoofinance,2020-12-29 11:57:26
Is GM Stock A Buy? General Motors Rebounds Bullishly As EV Momentum Faces Key Test,yahoofinance,2020-12-29 11:57:26
Is JNJ Stock A Buy As It Ramps Coronavirus Vaccine Testing Efforts?,yahoofinance,2020-12-29 11:57:26
"Bitcoin Rally Likely To Peak Out In Coming Weeks, Says Technical Analyst",yahoofinance,2020-12-29 11:57:26
CME Tops in Bitcoin Futures Rankings Amid Rapidly Growing Institutional Interest,yahoofinance,2020-12-29 11:57:26
Are Your Financial Advisor Fees Tax Deductible?,yahoofinance,2020-12-29 11:57:26
Why Pinduoduo Could Be 'Primary Beneficiary' Of Alibaba's China Regulatory Misfortunes,yahoofinance,2020-12-29 11:57:26
Special Report: UAE emerges as hub for companies helping Venezuela avoid U.S. oil sanctions,yahoofinance,2020-12-29 11:57:26
"Tesla Becoming New AOL, Cryptocurrency Resurgence And 8 Other Top Wells Fargo Predictions For 2021",yahoofinance,2020-12-29 11:57:26
Bausch Health to repay another $275 million of senior secured term loans,yahoofinance,2020-12-29 11:57:26
"Palantir: Risk/Reward Unfavorable at Current Valuation, Say Analysts",yahoofinance,2020-12-29 11:57:26
5 Value Stocks In The Healthcare Sector,yahoofinance,2020-12-29 11:57:26
"Yes, the stock market’s looking like the dot-com bubble — no, it’s not time to sell, strategist says",yahoofinance,2020-12-29 11:57:26
"DraftKings, Skillz SPAC Team Launch $1.5 Billion Spinning Eagle: What Investors Should Know",yahoofinance,2020-12-29 11:57:26
How retirement planning needs to change in the new year,yahoofinance,2020-12-29 11:57:26
Tesla’s Dominant Position in China Could Be Threatened Next Year,yahoofinance,2020-12-29 11:57:26
"Is Starbucks Stock A Buy Right Now? Here's What Earnings, Stock Chart Show",yahoofinance,2020-12-29 11:57:26
"Zoom Stock Falls, Growth Stocks Take A Hit As Dow Hits A Record",yahoofinance,2020-12-29 11:57:26
Dow Jones Futures Rise: Apple Eyes Breakout As Tech Giants Lead Stock Market Rally,yahoofinance,2020-12-29 11:57:26
Is Pfizer Stock A Buy On A New U.S. Supply Deal For Covid Vaccine?,yahoofinance,2020-12-29 11:57:26
Tesla Price Target Raised by Cowen on Strong Q4 Output,yahoofinance,2020-12-29 11:57:26
Return On Capital Employed Overview: AT&T,yahoofinance,2020-12-29 11:57:26
McKesson Stock May Be the Real Covid Vaccine Winner. Here’s Why.,yahoofinance,2020-12-29 11:57:26
"3M Had a Solid 2020, but the Stock Doesn’t Show It",yahoofinance,2020-12-29 11:57:26
Mizuho's Top Semiconductor Stocks For 2021: Do You Own Them?,yahoofinance,2020-12-29 11:57:26
"Alibaba: Despite Government Probe, the ‘Buy’ Thesis Remains Intact",yahoofinance,2020-12-29 11:57:26
Understanding Two Harbors Investment's Ex-Dividend Date,yahoofinance,2020-12-29 11:57:26
"Want To Boost Your 401(k) Balance By $68,723? Read This",yahoofinance,2020-12-29 11:57:26
3 Ways to Play the $30 Trillion ESG Boom in 2021,yahoofinance,2020-12-29 11:57:26
Boeing’s 737 MAX Returns to U.S. Commercial Service,wsj,2020-12-29 12:00:09
China Eyes Shrinking Jack Ma’s Business Empire,wsj,2020-12-29 12:00:09
Inside the Google-Facebook Ad Deal at Heart of the Price-Fixing Lawsuit,wsj,2020-12-29 12:00:09
House Votes to Override Trump Veto of Defense Bill,wsj,2020-12-29 12:00:09
Pandemic Reshapes U.S. Employment Across Industries,wsj,2020-12-29 12:00:09
Rare Small-Business Win Keeps Hope Alive for Insurance Payouts,wsj,2020-12-29 12:00:09
Georgia Military Who Backed Biden Could Help Determine Senate Control,wsj,2020-12-29 12:00:09
"New Dietary Guidelines Don’t Cut Sugar, Alcohol Limits",wsj,2020-12-29 12:00:09
These Tech Firms Pay Workers the Same Rates Across U.S.,wsj,2020-12-29 12:00:09
Fashion Designer Pierre Cardin Dies at 98,wsj,2020-12-29 12:00:09
Superhero Franchise Creators See Big Screen as Lifeblood,wsj,2020-12-29 12:00:09
All I Want for Sports in 2021? You!,wsj,2020-12-29 12:00:09
"Your 2021 Budget: Plan Ahead, but Not Too Far Ahead",wsj,2020-12-29 12:00:09
"School Went Online This Year, Including MIT’s Swimming Test",wsj,2020-12-29 12:00:09
The Year in Pictures,wsj,2020-12-29 12:00:09
Bitcoin Looks to Gain Traction in Payments,wsj,2020-12-29 12:00:09
How NYSE’s Top Salesman Fought for IPOs in 2020,wsj,2020-12-29 12:00:09
Politico to Acquire Energy Trade Publication E&E News,wsj,2020-12-29 12:00:09
Covid-19 Vaccine Outlook Revives Return-to-Office Plans,wsj,2020-12-29 12:00:09
EPA Sets Emissions Limits for Jet Aircraft,wsj,2020-12-29 12:00:09
Track the Rising Coronavirus Case Count,wsj,2020-12-29 12:00:09
Pushback on Xi’s Vision for China Spreads Beyond U.S.,wsj,2020-12-29 12:00:09
Japan Group to Lend Vietnam $1.8 Billion for Coal-Fired Power,wsj,2020-12-29 12:00:09
Tech Choices Dictate Teen Friendships During Pandemic,wsj,2020-12-29 12:00:09
"Lamborghini, Maserati, Mini, T-Bucket: Our Favorite My Ride Cars of 2020",wsj,2020-12-29 12:00:09
Airlines Aren’t Making It Easy to Use Covid Credits,wsj,2020-12-29 12:00:09
Lip Balms That Won’t Stick to a Mask,wsj,2020-12-29 12:00:09
The Regulatory Issues Madison Avenue May Face in 2021,wsj,2020-12-29 12:00:09
Super Bowl Advertisers Gravitate to Humor in a Hard Time,wsj,2020-12-29 12:00:09
Echo of Coronavirus Didn’t Keep Beer Drinkers From Corona,wsj,2020-12-29 12:00:09
Nashville Bombing Exposes Weak Point for Business Communications,wsj,2020-12-29 12:00:09
CIOs Question a Full Return to the Office,wsj,2020-12-29 12:00:09
"Logging Off: Overtaxed CIOs Find Balance in Hikes, Pandemic Puppies",wsj,2020-12-29 12:00:09
Barnes & Noble Education CFO Eyes More Cuts as Campuses Remain Closed,wsj,2020-12-29 12:00:09
CFOs Share Their Favorite Reads of 2020,wsj,2020-12-29 12:00:09
Yogurt Maker Chobani Recruits New CFO as It Continues to Expand,wsj,2020-12-29 12:00:09
