headline,org,date
Stock futures fall after record-setting rally; investors look ahead to jobless claims ,yahoofinance,2020-09-03 08:15:12
The Fed's concerning commentary about the labor market,yahoofinance,2020-09-03 08:15:12
Facebook to halt new political ads just before U.S. election,yahoofinance,2020-09-03 08:15:12
Germany promises Musk full support for Tesla's Berlin plant,yahoofinance,2020-09-03 08:15:12
Influencers with Andy Serwer: Mario Gabelli,yahoofinance,2020-09-03 08:15:12
Yahoo Finance Presents: CDC Director Dr. Robert Redfield,yahoofinance,2020-09-03 08:15:12
Billionaire investor's ‘problem’ with Tesla stock,yahoofinance,2020-09-03 08:15:12
"Move over Tesla, meet this electric car newcomer",yahoofinance,2020-09-03 08:15:12
How to invest in water sustainability,yahoofinance,2020-09-03 08:15:12
"I’m 60, my spouse is 45 — can I retire if our expenses are $12,000 a month?",yahoofinance,2020-09-03 08:15:12
Tesla’s stock sinks again to kick off a correction after disclosure of another large seller,yahoofinance,2020-09-03 08:15:12
Well Fargo Says These 2 Stocks Could Rally Over 70% From Current Levels,yahoofinance,2020-09-03 08:15:12
"Investors have little to lose, much to gain with these three unloved stocks, says contrarian manager",yahoofinance,2020-09-03 08:15:12
Tesla Set to Extend Declines After Leading Investor Cuts Stake,yahoofinance,2020-09-03 08:15:12
How retirees should invest in a time of record-low interest rates,yahoofinance,2020-09-03 08:15:12
Rules That Warren Buffett Lives By,yahoofinance,2020-09-03 08:15:12
"Be Ready To Distribute A COVID-19 Vaccine In Two Months, CDC Tells All States",yahoofinance,2020-09-03 08:15:12
Another EV Stock Is Coming. This Time It’s All About the Batteries,yahoofinance,2020-09-03 08:15:12
"Ciena Earnings, Revenue Top Estimates; Shares In Optical Gear Maker Fall",yahoofinance,2020-09-03 08:15:12
3 “Strong Buy” Dividend Stocks Yielding Over 6%,yahoofinance,2020-09-03 08:15:12
"Zuora, CrowdStrike, Broadcom, Robinhood - 5 Things You Must Know Thursday",yahoofinance,2020-09-03 08:15:12
"Dow Jones Futures Fall As Stock Market Rally Risks Mount; Tesla, Apple Slide, Hot IPOs Rocket, CrowdStrike Tumble On Earnings",yahoofinance,2020-09-03 08:15:12
‘We Are Witnessing a Major Melt-up.’ Why the Stock Market Gets a Little Scarier Every Day,yahoofinance,2020-09-03 08:15:12
Stock market news live updates: Stock futures fall after record-setting rally; investors look ahead to jobless claims,yahoofinance,2020-09-03 08:15:12
"Tesla analyst is bullish on what the company is doing with its high-priced stock, raises price target to $550",yahoofinance,2020-09-03 08:15:12
Goldman Sachs Gold; Buffett Sacks Goldman,yahoofinance,2020-09-03 08:15:12
Rocket Stock Is Falling After the Company Reported Earnings,yahoofinance,2020-09-03 08:15:12
13 Cheap Stocks That Could Be Traps for Value Investors,yahoofinance,2020-09-03 08:15:12
The Fed's concerning commentary about the labor market: Morning Brief,yahoofinance,2020-09-03 08:15:12
Barstool’s Portnoy reveals personal investment strategy: ‘It’s been six-figure days’,yahoofinance,2020-09-03 08:15:12
Oil Drops Again With OPEC Supply and Wavering Demand in Focus,yahoofinance,2020-09-03 08:15:12
Is Tesla stock now in dangerous bubble territory? This shocking new number should frighten the bulls,yahoofinance,2020-09-03 08:15:12
"As Tesla surges 600% off its 2020 low, meet the next electric car newcomer going public",yahoofinance,2020-09-03 08:15:12
"Novavax publishes more data on vaccine study, stock rises 4%",yahoofinance,2020-09-03 08:15:12
'Fast Money' Traders Give Their Opinion On AT&T,yahoofinance,2020-09-03 08:15:12
Two Giant Growth Funds Suffer Biggest Selling Stampede on Record,yahoofinance,2020-09-03 08:15:12
5 Stocks to Sell or Stay Away From in September,yahoofinance,2020-09-03 08:15:12
DocuSign Earnings Preview,yahoofinance,2020-09-03 08:15:12
"Campbell Soup beats profit and sales expectations, but stock falls",yahoofinance,2020-09-03 08:15:12
Vanguard opposes this Wall Street tax its founder John Bogle favored — and that says a lot about mutual funds today,yahoofinance,2020-09-03 08:15:12
Macy's will probably disappear before you know it: strategist,yahoofinance,2020-09-03 08:15:12
Minting Millionaires And Building Buzz At Nikola,yahoofinance,2020-09-03 08:15:12
"Blackstone, GIP Offer To Buy $18.4B-Worth Railroad Operator Kansas City Southern",yahoofinance,2020-09-03 08:15:12
"PagerDuty Plunges on Disappointing Forecast, Bucking Cloud Trend",yahoofinance,2020-09-03 08:15:12
A Currency War Is the Last Thing the World Needs,yahoofinance,2020-09-03 08:15:12
3 Pharma Stocks That Are COVID-19 Resistant,yahoofinance,2020-09-03 08:15:12
"Nvidia's Advance Continues, Here's How to Trade the Stock",yahoofinance,2020-09-03 08:15:12
"The pros are getting ready for a market crash — retail investors, not so much, top economist warns",yahoofinance,2020-09-03 08:15:12
"Apple Stock Spikes To Record High, Then Reverses, In Volatile Session",yahoofinance,2020-09-03 08:15:12
VW-backed U.S. battery maker QuantumScape to go public at $3.3 bln valuation,yahoofinance,2020-09-03 08:15:12
These 74 stocks in the S&P 500 hit all-time records on Wednesday,yahoofinance,2020-09-03 08:15:12
What is India trying to achieve from a trade standoff with China?,yahoofinance,2020-09-03 08:15:12
Rocket Companies First Quarterly Earnings Report Shows Closed Loan Volume Up 126% At $72B,yahoofinance,2020-09-03 08:15:12
The Largest Oil Play Of The Decade? Interview With Daniel Jarvie,yahoofinance,2020-09-03 08:15:12
‘Lone Wolf’ Tycoon Creates 68 Millionaires With Water Empire,yahoofinance,2020-09-03 08:15:12
2 Problems Tesla Creates For The S&P 500,yahoofinance,2020-09-03 08:15:12
"Lululemon Athletica Analysts Size Up Retailer Ahead Of Q2 Report, Talk Mirror Acquisition",yahoofinance,2020-09-03 08:15:12
"Rocket Cos. shares sink despite swinging to a profit, record loan originations",yahoofinance,2020-09-03 08:15:12
US STOCKS-Futures slip as tech rally pauses; economic data awaited,yahoofinance,2020-09-03 08:15:12
"Abbot Labs: New COVID-19 Antibody Test Is a Game Changer, Says Analyst",yahoofinance,2020-09-03 08:15:12
Ant’s Mega IPO Sets Up Jack Ma to Escalate War With Tencent,yahoofinance,2020-09-03 08:15:12
Inovio shares tumble 8% after short seller Muddy Waters says don't believe the COVID-19 vaccine hype,yahoofinance,2020-09-03 08:15:12
Fulgent Shares Up 10% On COVID-19 Testing Deal For New York Schools,yahoofinance,2020-09-03 08:15:12
Electric Car IPO Stock Ramps Up Deliveries As Market Recovers,yahoofinance,2020-09-03 08:15:12
"Ciena tops profit and revenue expectations, but stock falls as impact of order slowdown to continue",yahoofinance,2020-09-03 08:15:12
Investors Are on the Hunt for the Next Zoom. Here Are 8 Candidates.,yahoofinance,2020-09-03 08:15:12
"Is Ford Stock A Buy Now, After Earnings? Here's What Fundamentals, Chart Show",yahoofinance,2020-09-03 08:15:12
Stocks Are Cheap If Fed Controls the Yield Curve,yahoofinance,2020-09-03 08:15:12
Oppenheimer: These 3 Penny Stocks Have Triple-Digit Upside Potential,yahoofinance,2020-09-03 08:15:12
A Tesla Analyst Goes All In on the Stock Price—for an Odd Reason,yahoofinance,2020-09-03 08:15:12
"Signet's stock surges after much narrower-than-expected loss, upbeat sales outlook",yahoofinance,2020-09-03 08:15:12
Where and How to Power Up Profits in Plug Power Stock,yahoofinance,2020-09-03 08:15:12
Why Opko Health's Stock Is Trading Higher Today,yahoofinance,2020-09-03 08:15:12
"Colorado couple sees $200,000 in student debt discharged by judge",yahoofinance,2020-09-03 08:15:12
Nvidia Option Trader Makes $4.8M Bet On 10% More Upside,yahoofinance,2020-09-03 08:15:12
"Amazon, Verizon may invest over $4 billion in India's Vodafone Idea - report",yahoofinance,2020-09-03 08:15:12
Michaels Cos. shares soar premarket after earnings trounce estimates,yahoofinance,2020-09-03 08:15:12
Is Boeing Stock A Buy Right Now In Aviation's New Era Of Survival Mode?,yahoofinance,2020-09-03 08:15:12
Exxon Mobil Gets Set To Shrink As Oil Price Recovery Stagnates,yahoofinance,2020-09-03 08:15:12
Pfizer Rises On Coronavirus Vaccine Supply Deals — But Is PFE Stock A Buy?,yahoofinance,2020-09-03 08:15:12
What Schlumberger’s Fracking Exit Says About the Future of U.S. Oil,yahoofinance,2020-09-03 08:15:12
Conn's shares soar 17% premarket after retailer posts surprise profit,yahoofinance,2020-09-03 08:15:12
Buffett Seen Liberating His Successor With Not-So-Buffett Moves,yahoofinance,2020-09-03 08:15:12
A Preview Of Broadcom's Earnings,yahoofinance,2020-09-03 08:15:12
"Ford wants to cut 1,400 salaried jobs in U.S.: Who is targeted",yahoofinance,2020-09-03 08:15:12
Could DocuSign And CrowdStrike Follow Zoom's Earnings Footsteps?,yahoofinance,2020-09-03 08:15:12
This Election Could Be Really Weird. Hedge Your Portfolio.,yahoofinance,2020-09-03 08:15:12
China Can Easily Cut Off More of Australia’s Commodities Exports,yahoofinance,2020-09-03 08:15:12
J.C. Penney Lenders Consider Teaming Up With Outside Bidders,yahoofinance,2020-09-03 08:15:12
Facebook to Limit Political Ads Week Before Election,wsj,2020-09-03 08:17:30
Jobless Claims Seen Easing as Economy Begins to Improve,wsj,2020-09-03 08:17:30
Big Gains in Black-Owned Firms From Juneteenth Bets Prove Fleeting,wsj,2020-09-03 08:17:30
Samsung’s Future Includes a $2 Billion ‘Super Plant’,wsj,2020-09-03 08:17:30
"Hot Back-to-School Items During Coronavirus Are Tents, Webcams",wsj,2020-09-03 08:17:30
"Juul to Cut More Jobs, Explore Exiting Europe and Asia",wsj,2020-09-03 08:17:30
"Trump Will Roll Back More Regulations if Re-Elected, EPA Chief Says",wsj,2020-09-03 08:17:30
"Covid-19 Tests: Answers on Cost, Accuracy and Turnaround Time",wsj,2020-09-03 08:17:30
Schools Reopen in Covid-19 Ground Zero—How Wuhan Did It,wsj,2020-09-03 08:17:30
Fiat Chrysler Puts a Bigger Spotlight on Jeep,wsj,2020-09-03 08:17:30
Baseball Hall of Famer Tom Seaver Dies at 75,wsj,2020-09-03 08:17:30
A Glut of Refineries Is the Oil Industry’s Next Problem,wsj,2020-09-03 08:17:30
Starved for Italy? Mark Your Calendar for Next Fall’s Harvest Time,wsj,2020-09-03 08:17:30
This Year’s Big Online Scam—Puppies,wsj,2020-09-03 08:17:30
"Blackstone, GIP Make Takeover Bid for Kansas City Southern",wsj,2020-09-03 08:17:30
Advertisers Look for Ways Out as Coronavirus Roils Fall TV,wsj,2020-09-03 08:17:30
Robinhood Faces SEC Probe for Not Disclosing Deals With High-Speed Traders,wsj,2020-09-03 08:17:30
Excess Money Sees European Banks Spurn Short-Term Borrowing,wsj,2020-09-03 08:17:30
Warren Buffett and the Market That Foreign Money Forgot,wsj,2020-09-03 08:17:30
"Trump, Biden Campaigns Turn to Streaming Services to Reach Voters",wsj,2020-09-03 08:17:30
Postal Delays Spill Into Congressional Races,wsj,2020-09-03 08:17:30
"What Is Known of Michael Reinoehl, Person of Interest in Portland Killing",wsj,2020-09-03 08:17:30
China Clamps Down on Inner Mongolians Protesting Mandarin-Language Rules,wsj,2020-09-03 08:17:30
Dozens Missing After Cargo Ship Sinks Near Japan,wsj,2020-09-03 08:17:30
Venezuelan Opposition Politician Backs Elections in Break With Guaidó,wsj,2020-09-03 08:17:30
"Putin Critic Poisoned With Novichok, Berlin Says",wsj,2020-09-03 08:17:30
"As World Turns Inward, Abe’s Japan Has Turned Outward",wsj,2020-09-03 08:17:30
"What to Watch: With ‘Cobra Kai,’ a Middle-Aged Karate Kid Feud Has Become a Netflix Hit",wsj,2020-09-03 08:17:30
How to Stop Eye Strain When You Relentlessly Stare at Screens,wsj,2020-09-03 08:17:30
Second-Home Buyers Are Flocking to Wales. Some Locals Aren’t Happy About It.,wsj,2020-09-03 08:17:30
"The 1918 Pandemic Was Deadlier, but College Football Continued. Here’s Why.",wsj,2020-09-03 08:17:30
Financial Strategies for Retirees (or Near Retirees),wsj,2020-09-03 08:17:30
How Readers Say They Reacted to the Market Selloff,wsj,2020-09-03 08:17:30
Some States Offer Insured Versions of ‘529’ Plans,wsj,2020-09-03 08:17:30
New ‘LUMAScape’ Highlights Black-Owned Businesses in Media and Marketing,wsj,2020-09-03 08:17:30
TV Manufacturers Seek to Capture a Bigger Share of Streaming Ad Market,wsj,2020-09-03 08:17:30
WPP Shares Climb as It Says the Worst of the Crisis Is Likely Over,wsj,2020-09-03 08:17:30
Intel CIO Says AI Playing a Growing Role in Chipmaker’s Operations,wsj,2020-09-03 08:17:30
"AI, Cloud Aim to Enhance the U.S. Open Fan Experience",wsj,2020-09-03 08:17:30
Data-Center Operators Holding Their Own During Pandemic,wsj,2020-09-03 08:17:30
"CFOs Worry About Salary, Benefit Costs as Pandemic Drags On",wsj,2020-09-03 08:17:30
Companies Issue New Bonds to Pay Down Short-Term Debt Amid Pandemic,wsj,2020-09-03 08:17:30
"Auditors Struggle to Access Data, Count Inventory During Remote Work",wsj,2020-09-03 08:17:30
SEC Cancels Vote on Controversial Whistleblower Program Reforms,wsj,2020-09-03 08:17:30
The Morning Risk Report,wsj,2020-09-03 08:17:30
U.S. Increasingly Uses Trade Blacklist for Foreign Policy Goals,wsj,2020-09-03 08:17:30
Shipping Lines Learn to Make Money By Balancing Supply and Demand,wsj,2020-09-03 08:17:30
Robot Trucks Are Seeking Inroads Into Freight Business,wsj,2020-09-03 08:17:30
Today's Logistics Report: Delivering Wallet Share; China Revs Up; Running on Fumes,wsj,2020-09-03 08:17:30
"Why a $3.6B ESG Fund Likes Amazon, Starbucks, and Danaher Stock",wsj,2020-09-03 08:17:30
This Election Could Be Really Weird. Hedge Your Portfolio.,wsj,2020-09-03 08:17:30
Another EV Stock Is Coming. This Time It’s All About the Batteries.,wsj,2020-09-03 08:17:30
AMC to start opening movie theaters in New Jersey on Friday,wsj,2020-09-03 08:17:30
GM and Honda to collaborate in North America,wsj,2020-09-03 08:17:30
Vanguard opposes this Wall Street tax its founder John Bogle favored — and that says a lot about mutual funds today,wsj,2020-09-03 08:17:30
New Turnkey Villa in a Gated Country Club on Spain’s Costa del Sol,wsj,2020-09-03 08:17:30
Do Commercial Property Tax Changes Affect Residential U.S. Properties?,wsj,2020-09-03 08:17:30
Real Estate Scion Daniel Tishman Lists 57-Acre Westchester Estate,wsj,2020-09-03 08:17:30
"In Response to Covid-19, U.S. Donors Made More Unrestricted Grants",wsj,2020-09-03 08:17:30
Mark Zuckerberg and Priscilla Chan Commit $300 Million to Voting Efforts,wsj,2020-09-03 08:17:30
Worldwise: Doctors Without Borders USA Executive Director Avril Benoit’s Favorite Things,wsj,2020-09-03 08:17:30
Allow Us to Present the Pandemic Bill,wsj,2020-09-03 08:17:30
What Could Go Wrong on Election Day,wsj,2020-09-03 08:17:30
The Culture Wars Are Back,wsj,2020-09-03 08:17:30
U.S. Debt Poised to Reach Milestone Not Seen Since World War II,wsj,2020-09-03 08:17:30
Schools Reopen in Covid-19 Ground Zero—How Wuhan Did It,wsj,2020-09-03 08:17:30
U.S. Postal Service Financial Crisis Started Well Before Covid-19 Hit,wsj,2020-09-03 08:17:30
‘My Hands Are Tied’: Behind One NYC Family’s Back-to-School Decisions,wsj,2020-09-03 08:17:30
"Pence Headlines as RNC Focuses on Military, Law Enforcement",wsj,2020-09-03 08:17:30
Trump’s Campaign Adviser on the President’s ‘Silent Majority’,wsj,2020-09-03 08:17:30
Rural Families Struggle With Work and School With No Home Internet,wsj,2020-09-03 08:17:30
Thousands Flood National Mall to Protest Racial Injustice,wsj,2020-09-03 08:17:30
Trump Administration Asks States to Be Ready for Vaccine by November ,wsj,2020-09-03 08:17:30
Covid-19 Deaths Significantly Reduced by Use of Steroids,wsj,2020-09-03 08:17:30
"U.S. Debt to Exceed Size of Economy Next Year, a Postwar First",wsj,2020-09-03 08:17:30
South Dakota Cowboy Who Won $232.1 Million Powerball Lists $41.15 Million Ranch,wsj,2020-09-03 08:17:30
The Pandemic Is Making College Students Question the Price of Their Education,wsj,2020-09-03 08:17:30
"Yes, The Crash Is Coming",seekingalpha,2020-09-03 08:19:17
September Will Be Ugly,seekingalpha,2020-09-03 08:19:17
"13 High-Yield, Low Volatility Blue-Chip Bargains Retirees Will Love",seekingalpha,2020-09-03 08:19:17
Wall Street Breakfast: Get Ready For Vaccine Distribution,seekingalpha,2020-09-03 08:19:17
"Retirement Strategy: Insurance Firms Haven't Yet Recovered - Time To Buy Aflac, A Dividend Aristocrat",seekingalpha,2020-09-03 08:19:17
Barrick Gold: It's A Trap,seekingalpha,2020-09-03 08:19:17
5 Reasons A Stock Correction May Be Imminent,seekingalpha,2020-09-03 08:19:17
This Is Where The Money Fueling The Stock Market Is Coming From,seekingalpha,2020-09-03 08:19:17
Equity Residential: Invest Like A Grave Dancer,seekingalpha,2020-09-03 08:19:17
Enterprise Products Partners: A 54% Upside With Strong Alignment Of Interest,seekingalpha,2020-09-03 08:19:17
"Amarin's Vascepa Data, And Other News: The Good, Bad And Ugly Of Biopharma",seekingalpha,2020-09-03 08:19:17
Novavax higher after positive early data on COVID-19 vaccine candidate,seekingalpha,2020-09-03 08:19:17
Futures finally take a breather ahead of jobless claims,seekingalpha,2020-09-03 08:19:17
Tesla -7% as selling pressure extends for a second day,seekingalpha,2020-09-03 08:19:17
Altria defended at BofA as tobacco upside seen outweighing Juul headaches,seekingalpha,2020-09-03 08:19:17
NIO August deliveries surge 104%,seekingalpha,2020-09-03 08:19:17
"Verizon, Amazon may put $4B into Vodafone Idea - report",seekingalpha,2020-09-03 08:19:17
"NVAX, WLL among premarket gainers",seekingalpha,2020-09-03 08:19:17
Big Tech responds to European tech taxes by passing on fees,seekingalpha,2020-09-03 08:19:17
Moderna R&D event September 17,seekingalpha,2020-09-03 08:19:17
Akebia down big after vadadustat misses safety endpoints in late-stage studies in CKD anemia,seekingalpha,2020-09-03 08:19:17
"Sanofi/GSK initiate Phase 1/2 COVID-19 trial, first results expected early December",seekingalpha,2020-09-03 08:19:17
Yikes,seekingalpha,2020-09-03 08:19:17
KMF: Strategic Policy Shift Provides A Potentially Brighter Future,seekingalpha,2020-09-03 08:19:17
Why Apple's Problem With 'Fortnite' Could Have Epic Consequences,seekingalpha,2020-09-03 08:19:17
"Diageo Buys Aviation Gin, I'm Buying Diageo Stock",seekingalpha,2020-09-03 08:19:17
Stripe: The Internet's Most Undervalued Company,seekingalpha,2020-09-03 08:19:17
"EV upside shows which auto suppliers to own into 2021, UBS says",seekingalpha,2020-09-03 08:19:17
"For oil/gas, this election just means more, Wells Fargo says",seekingalpha,2020-09-03 08:19:17
"Evercore's food scan hints at plays for odd back-to-school season, post-COVID world",seekingalpha,2020-09-03 08:19:17
Wells Fargo eyes credit-card issuers handling the storm,seekingalpha,2020-09-03 08:19:17
"Baird still believes this pharma will double, after seeing rival data",seekingalpha,2020-09-03 08:19:17
ETF Battles: BND Vs. TLT,seekingalpha,2020-09-03 08:19:17
"Retirement Strategy: Insurance Firms Haven't Yet Recovered - Time To Buy Aflac, A Dividend Aristocrat",seekingalpha,2020-09-03 08:19:17
"The Schrodinger's Cat Market And The Key To Trading It: Cash, Equities, Gold, Crypto",seekingalpha,2020-09-03 08:19:17
"Risk Premia Forecasts: Major Asset Classes - September 2, 2020",seekingalpha,2020-09-03 08:19:17
Blue Chip DRiP Portfolio: August Dividends + Covered Call Income,seekingalpha,2020-09-03 08:19:17
UniFirst Corporation: Clean Balance Sheet Could Lead To Upside,seekingalpha,2020-09-03 08:19:17
"Amarin's Vascepa Data, And Other News: The Good, Bad And Ugly Of Biopharma",seekingalpha,2020-09-03 08:19:17
Truist Financial: A Strong Regional Player With Earnings Growth Potential,seekingalpha,2020-09-03 08:19:17
Enterprise Products Partners: A 54% Upside With Strong Alignment Of Interest,seekingalpha,2020-09-03 08:19:17
Globe Telecom: A Mix Of Defensiveness And Growth,seekingalpha,2020-09-03 08:19:17
"Retirement Strategy: Insurance Firms Haven't Yet Recovered - Time To Buy Aflac, A Dividend Aristocrat",seekingalpha,2020-09-03 08:19:17
Blue Chip DRiP Portfolio: August Dividends + Covered Call Income,seekingalpha,2020-09-03 08:19:17
Equity Residential: Invest Like A Grave Dancer,seekingalpha,2020-09-03 08:19:17
Contrarian Value Play: Dividend Champion Banks For Double-Digit Return,seekingalpha,2020-09-03 08:19:17
ONEOK: Management Still Fighting To Save Their Choking Dividend,seekingalpha,2020-09-03 08:19:17
ETF Battles: BND Vs. TLT,seekingalpha,2020-09-03 08:19:17
Prepare To Buy The Pullback In SVXY,seekingalpha,2020-09-03 08:19:17
SPXU Enters Positive Drift Regime,seekingalpha,2020-09-03 08:19:17
The ETF Trader For The Week Of 8/31-9/4,seekingalpha,2020-09-03 08:19:17
HYI: Fully Covered 7.69% Yield At A Discount,seekingalpha,2020-09-03 08:19:17
"The Schrodinger's Cat Market And The Key To Trading It: Cash, Equities, Gold, Crypto",seekingalpha,2020-09-03 08:19:17
"Risk Premia Forecasts: Major Asset Classes - September 2, 2020",seekingalpha,2020-09-03 08:19:17
Fed Dials Up Inflation Target... Own Gold,seekingalpha,2020-09-03 08:19:17
September Will Be Ugly,seekingalpha,2020-09-03 08:19:17
Corrective Forces Maintain Grip,seekingalpha,2020-09-03 08:19:17
Huge debt boom,cnnbusiness,2020-09-03 08:21:46
US debt is expected to pass 100% of GDP. Investors don't seem to mind,cnnbusiness,2020-09-03 08:21:46
Facebook will limit some advertising in the week before the US election -- but it will let politicians run ads with lies ,cnnbusiness,2020-09-03 08:21:46
The stock market thinks Joe Biden is going to beat Donald Trump,cnnbusiness,2020-09-03 08:21:46
Check out Coach Bill Belichick's new Subway commercial,cnnbusiness,2020-09-03 08:21:46
"First toilet paper, then yeast. Now laptops are hard to find",cnnbusiness,2020-09-03 08:21:46
"United says it will furlough 16,000 workers",cnnbusiness,2020-09-03 08:21:46
Walmart will add breastfeeding pods in 100 stores for nursing moms -- and the idea started with one associate,cnnbusiness,2020-09-03 08:21:46
"Ford will cut 1,400 salaried jobs, offering early retirement",cnnbusiness,2020-09-03 08:21:46
Twitter investigating apparent hack of account tied to Indian prime minister,cnnbusiness,2020-09-03 08:21:46
Google Maps rolls out traffic lights feature,cnnbusiness,2020-09-03 08:21:46
Intel has a new logo and jingle,cnnbusiness,2020-09-03 08:21:46
Refi rates at 2.42% APR (15 yr). Do you qualify?,cnnbusiness,2020-09-03 08:21:46
MacKenzie Scott has become the world's richest woman,cnnbusiness,2020-09-03 08:21:46
Here's what the Burger King of the future will look like,cnnbusiness,2020-09-03 08:21:46
Evictions are stopped: Here's what you need to know,cnnbusiness,2020-09-03 08:21:46
The Rolls-Royce Ghost was so quiet the engineers had to make it louder,cnnbusiness,2020-09-03 08:21:46
McLaren is betting on hybrids for its supercar future,cnnbusiness,2020-09-03 08:21:46
GM unveils its first fully-electric Cadillac SUV,cnnbusiness,2020-09-03 08:21:46
This Lamborghini offers more fun for a lot less money,cnnbusiness,2020-09-03 08:21:46
"This tiny electric car could cost just $10,000 in the US. But there are tradeoffs",cnnbusiness,2020-09-03 08:21:46
The US is adding jobs. But the recovery could take years,cnnbusiness,2020-09-03 08:21:46
India's economy shrinks at fastest pace on record,cnnbusiness,2020-09-03 08:21:46
Australia's in a historic recession,cnnbusiness,2020-09-03 08:21:46
Covid-19 will permanently change the world economy,cnnbusiness,2020-09-03 08:21:46
The pandemic dealt a shock to the world's top economies. Here's who fared the worst,cnnbusiness,2020-09-03 08:21:46
See the new Rolls-Royce Ghost,cnnbusiness,2020-09-03 08:21:46
Millions of Americans are out of work. Why is the stock market soaring?,cnnbusiness,2020-09-03 08:21:46
See how this company turns garages into affordable housing,cnnbusiness,2020-09-03 08:21:46
"See Samsung's new $2,000 foldable phone",cnnbusiness,2020-09-03 08:21:46
Movie theaters are reopening. We asked an expert if it's safe to go,cnnbusiness,2020-09-03 08:21:46
It's been 6 months of working from home. Here's what we've learned ,cnnbusiness,2020-09-03 08:21:46
These people have left big cities for good. Here's where they landed,cnnbusiness,2020-09-03 08:21:46
How much are you spending on remote learning for your kids? Share your story.,cnnbusiness,2020-09-03 08:21:46
What your new work life might look like,cnnbusiness,2020-09-03 08:21:46
India bans PUBG in latest crackdown on Chinese apps,cnnbusiness,2020-09-03 08:21:46
"Pakistan blocks Tinder, Grindr and other dating apps ",cnnbusiness,2020-09-03 08:21:46
Startups race to show what alternatives to Uber and Lyft could look like for California drivers,cnnbusiness,2020-09-03 08:21:46
"Samsung's new folding smartphone will set you back $1,999",cnnbusiness,2020-09-03 08:21:46
"How 'Tenet' could be a hit, even during a pandemic",cnnbusiness,2020-09-03 08:21:46
"Biden had a bigger TV audience for his convention, but Trump keeps declaring victory anyway",cnnbusiness,2020-09-03 08:21:46
Harry and Meghan sign production deal with Netflix ,cnnbusiness,2020-09-03 08:21:46
Charlie Hebdo to reprint controversial cartoons as terror trial begins,cnnbusiness,2020-09-03 08:21:46
How NASA's Apollo program kicked off Silicon Valley's tech revolution,cnnbusiness,2020-09-03 08:21:46
Jeff Bezos just sold $1.8 billion worth of Amazon stock. Here's why,cnnbusiness,2020-09-03 08:21:46
Bill Nye's experimental spacecraft that sails on sunlight declares mission success ,cnnbusiness,2020-09-03 08:21:46
SpaceX's massive Starship prototype lifts off ,cnnbusiness,2020-09-03 08:21:46
Unilever will stop using oil and gas to make cleaning products by 2030,cnnbusiness,2020-09-03 08:21:46
Scared of going back to the office? Companies hope these apps will help,cnnbusiness,2020-09-03 08:21:46
How virtual reality is tackling racism in the workplace,cnnbusiness,2020-09-03 08:21:46
Zoom is backing away from China — and doubling down on India,cnnbusiness,2020-09-03 08:21:46
The office is dead. Get yourself a backyard shed,cnnbusiness,2020-09-03 08:21:46
Cargo bikes are having a moment,cnnbusiness,2020-09-03 08:21:46
