headline,org,date
"Peugeot shareholders vote to merge with Fiat Chrysler, create world's fourth-largest car maker",msnmoney,2021-01-04 08:49:04
Money-saving energy tips for winter,msnmoney,2021-01-04 08:49:04
How to buy Apple devices without paying Apple prices,msnmoney,2021-01-04 08:49:04
Turning 66 in 2021? Here's What You Need to Know,msnmoney,2021-01-04 08:49:04
Smart investments to make in 2021,msnmoney,2021-01-04 08:49:04
This is a slam dunk if you want a one-card wallet in 2021,msnmoney,2021-01-04 08:49:04
Foxconn Seals Manufacturing Deal With Chinese EV Startup Byton,msnmoney,2021-01-04 08:49:04
27 Things Babies Born in 2021 Will Never Know,msnmoney,2021-01-04 08:49:04
"Mortgage Interest Rates Today, January 4, 2021 | Rates ease",msnmoney,2021-01-04 08:49:04
"If You Have Blurry Or Hazy Headlights, Here Is One Easy Fix",msnmoney,2021-01-04 08:49:04
Retirement Planning at Midlife: 6 Tips for a Secure Future,msnmoney,2021-01-04 08:49:04
Make This One Money Move Now - Before The Inauguration. Click Here,msnmoney,2021-01-04 08:49:04
Investors handicapping the new market year see similarities to 2010's recovery and 1999's risk binge,msnmoney,2021-01-04 08:49:04
The best time to buy almost anything in 2021,msnmoney,2021-01-04 08:49:04
4 Ways to Invest in Real Estate to Generate Income,msnmoney,2021-01-04 08:49:04
Home upgrades that will save you money in 2021,msnmoney,2021-01-04 08:49:04
"Google Workers Launch Union, Escalating Tension With Management",msnmoney,2021-01-04 08:49:04
The Best Deals For January - Under $19k SUVs,msnmoney,2021-01-04 08:49:04
Companies that went bankrupt in 2020,msnmoney,2021-01-04 08:49:04
Will Covid Stimulus Be the Breakthrough Carbon Capture Has Been Waiting For?,msnmoney,2021-01-04 08:49:04
10 Things Social Security Recipients Need to Know About Their Second Stimulus Check,msnmoney,2021-01-04 08:49:04
"Ways you can save, invest & earn more in 2021",msnmoney,2021-01-04 08:49:04
Things you should and should not buy in January,msnmoney,2021-01-04 08:49:04
"[Photos] She Posted This Photo Online, Her Boss Sees It and Gives Her an Ultimatum",msnmoney,2021-01-04 08:49:04
Slave Labor at Brazilian Cattle Farms Focus of New Report,msnmoney,2021-01-04 08:49:04
18 Resolutions To Get Rich in 2021,msnmoney,2021-01-04 08:49:04
How finding a job will be different in 2021,msnmoney,2021-01-04 08:49:04
72% of Americans Believe in a Better 2021 After a Year in Financial ‘Survival Mode’,msnmoney,2021-01-04 08:49:04
"Tesla jumps 3% after nearly hitting 500,000 deliveries in 2020",msnmoney,2021-01-04 08:49:04
Top credit card wipes out interest until 2022 (seriously),msnmoney,2021-01-04 08:49:04
How To Get Your Money Back on ‘Nonrefundable’ Items,msnmoney,2021-01-04 08:49:04
Mortgage rate forecast: Coronavirus vaccines will push rates up slightly in 2021,msnmoney,2021-01-04 08:49:04
What Experts Say 2021 Will Look Like for Your Wallet,msnmoney,2021-01-04 08:49:04
"After ECB Dividend Cap Flouted, Finnish FSA Mulls Next Step",msnmoney,2021-01-04 08:49:04
The tips you need to meet your 2021 financial goals,msnmoney,2021-01-04 08:49:04
The 24 Hottest Gadgets of 2021,msnmoney,2021-01-04 08:49:04
7 Sources of Tax-Free Retirement Income,msnmoney,2021-01-04 08:49:04
Your stimulus check got sliced in half — here's how to make up the rest,msnmoney,2021-01-04 08:49:04
Wall Street will kick out three big Chinese telecom companies,msnmoney,2021-01-04 08:49:04
Charming tiny home communities across America,msnmoney,2021-01-04 08:49:04
21 Things You Should Always Buy at a Dollar Store,msnmoney,2021-01-04 08:49:04
These Clingy Dog Breeds Will Stay by Your Side,msnmoney,2021-01-04 08:49:04
Reasons shopping at Costco is the worst,msnmoney,2021-01-04 08:49:04
Airbus Shares Gain With 560-Plane Target in Sight at End of 2020,msnmoney,2021-01-04 08:49:04
"New Year's resolutions that can save you $1,000 or more",msnmoney,2021-01-04 08:49:04
Jack Ma Skips Cherished TV Show After Beijing Tightens Screws,msnmoney,2021-01-04 08:49:04
Jobs that could grow during the pandemic and recession,msnmoney,2021-01-04 08:49:04
The Royal Family Is Cringing At Meghan Markle's Net Worth,msnmoney,2021-01-04 08:49:04
5 ways to achieve financial security,msnmoney,2021-01-04 08:49:04
Countries where people retire the youngest,msnmoney,2021-01-04 08:49:04
China Makes Rating Firm Pay for Debt Defaults for First Time,msnmoney,2021-01-04 08:49:04
10 Ways To Bounce Back From a Heavy Spending Month on Your Credit Card,msnmoney,2021-01-04 08:49:04
Covid is making college students rethink their ‘dream job’ and plans for after graduation,msnmoney,2021-01-04 08:49:04
These Clingy Dog Breeds Will Stay by Your Side,msnmoney,2021-01-04 08:49:04
15 things that will cost more in 2021,msnmoney,2021-01-04 08:49:04
Iraq Picks Chinese Firm for $2 Billion Oil Prepayment Deal,msnmoney,2021-01-04 08:49:04
Top Money Moves I’m Making Now To Save My Bank Account in 2021,msnmoney,2021-01-04 08:49:04
"Samsung to launch its newest Galaxy smartphones on Jan. 14, earlier than usual",msnmoney,2021-01-04 08:49:04
Return Policies for Gifts Your Friends and Family Bought Online,msnmoney,2021-01-04 08:49:04
Can’t afford an estate plan? Here’s what you can do without spending a fortune,msnmoney,2021-01-04 08:49:04
"[Photos] She Posted This Photo Online, Her Boss Sees It and Gives Her an Ultimatum",msnmoney,2021-01-04 08:49:04
The Most Anticipated IPOs of 2021,msnmoney,2021-01-04 08:49:04
Singapore Continues Slow Recovery From Worst Economic Slump,msnmoney,2021-01-04 08:49:04
The 7 worst ways people will use their stimulus checks,msnmoney,2021-01-04 08:49:04
Robo advisor vs. financial advisor: Which should you choose?,msnmoney,2021-01-04 08:49:04
How To Manage All the Extra Debt You Piled Up in 2020,msnmoney,2021-01-04 08:49:04
Billions of Dollars at Stake for India Banks in 2021 Court Cases,msnmoney,2021-01-04 08:49:04
These Are the Top Financial Advisors in Virginia,msnmoney,2021-01-04 08:49:04
Costco mistakes that could cost you big money,msnmoney,2021-01-04 08:49:04
Love gift cards? 22 ways you can get them for free,msnmoney,2021-01-04 08:49:04
13 Things Seniors Can Get for Free — or Almost Free,msnmoney,2021-01-04 08:49:04
Studios are experimenting with film release models. Here's what that could mean for movie piracy,msnmoney,2021-01-04 08:49:04
How to prepare for working past retirement age,msnmoney,2021-01-04 08:49:04
6 Times You Should Not DIY a Home Improvement Project,msnmoney,2021-01-04 08:49:04
Drone Captures What No One Was Supposed To See,msnmoney,2021-01-04 08:49:04
The big differences between Costco and Costco.com,msnmoney,2021-01-04 08:49:04
"These Four Companies, Led By Apple, Had Market Caps Over $1 Trillion At The End Of 2020",msnmoney,2021-01-04 08:49:04
10 Job Skills Worth Six-Figure Salaries,msnmoney,2021-01-04 08:49:04
11 Secret Uses for Everyday Items That Save Money,msnmoney,2021-01-04 08:49:04
Celebs who are famously cheap,msnmoney,2021-01-04 08:49:04
Philippine Bourse Eyes More IPOs in 2021 Amid ‘Fragile’ Recovery,msnmoney,2021-01-04 08:49:04
"Peugeot shareholders vote to merge with Fiat Chrysler, create world's fourth-largest car maker",msnmoney,2021-01-04 08:49:04
Money-saving energy tips for winter,msnmoney,2021-01-04 08:49:04
How to buy Apple devices without paying Apple prices,msnmoney,2021-01-04 08:49:04
Turning 66 in 2021? Here's What You Need to Know,msnmoney,2021-01-04 08:49:04
Smart investments to make in 2021,msnmoney,2021-01-04 08:49:04
This is a slam dunk if you want a one-card wallet in 2021,msnmoney,2021-01-04 08:49:04
Foxconn Seals Manufacturing Deal With Chinese EV Startup Byton,msnmoney,2021-01-04 08:49:04
27 Things Babies Born in 2021 Will Never Know,msnmoney,2021-01-04 08:49:04
"Mortgage Interest Rates Today, January 4, 2021 | Rates ease",msnmoney,2021-01-04 08:49:04
"If You Have Blurry Or Hazy Headlights, Here Is One Easy Fix",msnmoney,2021-01-04 08:49:04
Retirement Planning at Midlife: 6 Tips for a Secure Future,msnmoney,2021-01-04 08:49:04
Make This One Money Move Now - Before The Inauguration. Click Here,msnmoney,2021-01-04 08:49:04
Investors handicapping the new market year see similarities to 2010's recovery and 1999's risk binge,msnmoney,2021-01-04 08:49:04
The best time to buy almost anything in 2021,msnmoney,2021-01-04 08:49:04
4 Ways to Invest in Real Estate to Generate Income,msnmoney,2021-01-04 08:49:04
Home upgrades that will save you money in 2021,msnmoney,2021-01-04 08:49:04
"Google Workers Launch Union, Escalating Tension With Management",msnmoney,2021-01-04 08:49:04
The Best Deals For January - Under $19k SUVs,msnmoney,2021-01-04 08:49:04
Companies that went bankrupt in 2020,msnmoney,2021-01-04 08:49:04
Will Covid Stimulus Be the Breakthrough Carbon Capture Has Been Waiting For?,msnmoney,2021-01-04 08:49:04
10 Things Social Security Recipients Need to Know About Their Second Stimulus Check,msnmoney,2021-01-04 08:49:04
"Ways you can save, invest & earn more in 2021",msnmoney,2021-01-04 08:49:04
Things you should and should not buy in January,msnmoney,2021-01-04 08:49:04
"[Photos] She Posted This Photo Online, Her Boss Sees It and Gives Her an Ultimatum",msnmoney,2021-01-04 08:49:04
Slave Labor at Brazilian Cattle Farms Focus of New Report,msnmoney,2021-01-04 08:49:04
18 Resolutions To Get Rich in 2021,msnmoney,2021-01-04 08:49:04
How finding a job will be different in 2021,msnmoney,2021-01-04 08:49:04
72% of Americans Believe in a Better 2021 After a Year in Financial ‘Survival Mode’,msnmoney,2021-01-04 08:49:04
"Tesla jumps 3% after nearly hitting 500,000 deliveries in 2020",msnmoney,2021-01-04 08:49:04
Top credit card wipes out interest until 2022 (seriously),msnmoney,2021-01-04 08:49:04
How To Get Your Money Back on ‘Nonrefundable’ Items,msnmoney,2021-01-04 08:49:04
Mortgage rate forecast: Coronavirus vaccines will push rates up slightly in 2021,msnmoney,2021-01-04 08:49:04
What Experts Say 2021 Will Look Like for Your Wallet,msnmoney,2021-01-04 08:49:04
"After ECB Dividend Cap Flouted, Finnish FSA Mulls Next Step",msnmoney,2021-01-04 08:49:04
The tips you need to meet your 2021 financial goals,msnmoney,2021-01-04 08:49:04
The 24 Hottest Gadgets of 2021,msnmoney,2021-01-04 08:49:04
7 Sources of Tax-Free Retirement Income,msnmoney,2021-01-04 08:49:04
Your stimulus check got sliced in half — here's how to make up the rest,msnmoney,2021-01-04 08:49:04
Wall Street will kick out three big Chinese telecom companies,msnmoney,2021-01-04 08:49:04
Charming tiny home communities across America,msnmoney,2021-01-04 08:49:04
21 Things You Should Always Buy at a Dollar Store,msnmoney,2021-01-04 08:49:04
These Clingy Dog Breeds Will Stay by Your Side,msnmoney,2021-01-04 08:49:04
Reasons shopping at Costco is the worst,msnmoney,2021-01-04 08:49:04
Airbus Shares Gain With 560-Plane Target in Sight at End of 2020,msnmoney,2021-01-04 08:49:04
"New Year's resolutions that can save you $1,000 or more",msnmoney,2021-01-04 08:49:04
Jack Ma Skips Cherished TV Show After Beijing Tightens Screws,msnmoney,2021-01-04 08:49:04
Jobs that could grow during the pandemic and recession,msnmoney,2021-01-04 08:49:04
The Royal Family Is Cringing At Meghan Markle's Net Worth,msnmoney,2021-01-04 08:49:04
5 ways to achieve financial security,msnmoney,2021-01-04 08:49:04
Countries where people retire the youngest,msnmoney,2021-01-04 08:49:04
China Makes Rating Firm Pay for Debt Defaults for First Time,msnmoney,2021-01-04 08:49:04
10 Ways To Bounce Back From a Heavy Spending Month on Your Credit Card,msnmoney,2021-01-04 08:49:04
Covid is making college students rethink their ‘dream job’ and plans for after graduation,msnmoney,2021-01-04 08:49:04
These Clingy Dog Breeds Will Stay by Your Side,msnmoney,2021-01-04 08:49:04
15 things that will cost more in 2021,msnmoney,2021-01-04 08:49:04
Iraq Picks Chinese Firm for $2 Billion Oil Prepayment Deal,msnmoney,2021-01-04 08:49:04
Top Money Moves I’m Making Now To Save My Bank Account in 2021,msnmoney,2021-01-04 08:49:04
"Samsung to launch its newest Galaxy smartphones on Jan. 14, earlier than usual",msnmoney,2021-01-04 08:49:04
Return Policies for Gifts Your Friends and Family Bought Online,msnmoney,2021-01-04 08:49:04
Can’t afford an estate plan? Here’s what you can do without spending a fortune,msnmoney,2021-01-04 08:49:04
"[Photos] She Posted This Photo Online, Her Boss Sees It and Gives Her an Ultimatum",msnmoney,2021-01-04 08:49:04
The Most Anticipated IPOs of 2021,msnmoney,2021-01-04 08:49:04
Singapore Continues Slow Recovery From Worst Economic Slump,msnmoney,2021-01-04 08:49:04
The 7 worst ways people will use their stimulus checks,msnmoney,2021-01-04 08:49:04
Robo advisor vs. financial advisor: Which should you choose?,msnmoney,2021-01-04 08:49:04
How To Manage All the Extra Debt You Piled Up in 2020,msnmoney,2021-01-04 08:49:04
Billions of Dollars at Stake for India Banks in 2021 Court Cases,msnmoney,2021-01-04 08:49:04
These Are the Top Financial Advisors in Virginia,msnmoney,2021-01-04 08:49:04
Costco mistakes that could cost you big money,msnmoney,2021-01-04 08:49:04
Love gift cards? 22 ways you can get them for free,msnmoney,2021-01-04 08:49:04
13 Things Seniors Can Get for Free — or Almost Free,msnmoney,2021-01-04 08:49:04
Studios are experimenting with film release models. Here's what that could mean for movie piracy,msnmoney,2021-01-04 08:49:04
How to prepare for working past retirement age,msnmoney,2021-01-04 08:49:04
6 Times You Should Not DIY a Home Improvement Project,msnmoney,2021-01-04 08:49:04
Drone Captures What No One Was Supposed To See,msnmoney,2021-01-04 08:49:04
The big differences between Costco and Costco.com,msnmoney,2021-01-04 08:49:04
"These Four Companies, Led By Apple, Had Market Caps Over $1 Trillion At The End Of 2020",msnmoney,2021-01-04 08:49:04
10 Job Skills Worth Six-Figure Salaries,msnmoney,2021-01-04 08:49:04
11 Secret Uses for Everyday Items That Save Money,msnmoney,2021-01-04 08:49:04
Celebs who are famously cheap,msnmoney,2021-01-04 08:49:04
Philippine Bourse Eyes More IPOs in 2021 Amid ‘Fragile’ Recovery,msnmoney,2021-01-04 08:49:04
Stock futures rise as equities look to kick off new year higher,yahoofinance,2021-01-04 08:51:12
NIO and Tesla shares rise after record deliveries,yahoofinance,2021-01-04 08:51:12
Chipotle's newest food is anti-carb and it will cost you $2 extra,yahoofinance,2021-01-04 08:51:12
"Google workers launch union, escalating tension with managers",yahoofinance,2021-01-04 08:51:12
What opportunities investors should look for in 2021,yahoofinance,2021-01-04 08:51:12
Zillow Economist on what to expect from the real estate market in 2021,yahoofinance,2021-01-04 08:51:12
Fed policy in 2021: Three things to watch,yahoofinance,2021-01-04 08:51:12
‘Reebok needs to go Black’: Master P,yahoofinance,2021-01-04 08:51:12
"Arlington, Virginia: Why Americans Are Revisiting Their Insurance..",yahoofinance,2021-01-04 08:51:12
3 “Strong Buy” Stocks Set for Monster Growth in 2021,yahoofinance,2021-01-04 08:51:12
Bitcoin Suddenly Drops 13% as Altcoins Continue to Rise,yahoofinance,2021-01-04 08:51:12
The Bubble Isn’t What You Think It Is,yahoofinance,2021-01-04 08:51:12
Inovio to partner with Chinese biotech on COVID-19 vaccine candidate in Greater China,yahoofinance,2021-01-04 08:51:12
Artificial Intelligence Stocks To Buy And Watch Amid Rising AI Competition,yahoofinance,2021-01-04 08:51:12
Is Social Security Taxable? Can I Avoid Paying Taxes on Benefits?,yahoofinance,2021-01-04 08:51:12
"Dow Jones Futures Rise As Tesla, Nio Soar: Stock Market Rally Lessons For 2021; 25 Stocks In Buy Range",yahoofinance,2021-01-04 08:51:12
7 Value Stocks That Could Outperform in 2021,yahoofinance,2021-01-04 08:51:12
What will Joe Biden do to mortgage rates? Here's what experts say,yahoofinance,2021-01-04 08:51:12
Worried about retirement? Jump down ‘one of the darkest rabbit holes’ and you’ll find plenty of company,yahoofinance,2021-01-04 08:51:12
The Rise of the Semi-Retired Life,yahoofinance,2021-01-04 08:51:12
How the Secure Act 2.0 will push your retirement savings into overdrive,yahoofinance,2021-01-04 08:51:12
These Are The 5 Best Stocks To Buy And Watch Now,yahoofinance,2021-01-04 08:51:12
The Correction in AstraZeneca Could Be Nearing an End,yahoofinance,2021-01-04 08:51:12
Roth TSP vs. Roth IRA: How Do They Compare?,yahoofinance,2021-01-04 08:51:12
Favorite Stocks Held By One Of Fidelity's Top 2020 U.S. Diversified Stock Funds,yahoofinance,2021-01-04 08:51:12
Explainer: How investors view the Georgia U.S. Senate runoff,yahoofinance,2021-01-04 08:51:12
Xpeng Reports 112% Rise In 2020 Deliveries: What Investors Need To Know,yahoofinance,2021-01-04 08:51:12
Foxconn Seals Manufacturing Deal With Chinese EV Startup Byton,yahoofinance,2021-01-04 08:51:12
"Is Zoom Stock A Buy Right Now? Here's What Earnings, Charts Show",yahoofinance,2021-01-04 08:51:12
"Barron's First Picks And Pans Of 2021: Disney, Home Depot, Intel, Nike, Nordstrom And More",yahoofinance,2021-01-04 08:51:12
"Can you expect a third stimulus check, under Joe Biden?",yahoofinance,2021-01-04 08:51:12
S&P 500 Has Only Been This Expensive One Other Time — At The Peak Of The Dot-Com Bubble,yahoofinance,2021-01-04 08:51:12
Apple Veterans’ Lidar Startup Adds $200 Million to SPAC Deal,yahoofinance,2021-01-04 08:51:12
Retirement Without Savings?,yahoofinance,2021-01-04 08:51:12
10 Top SPAC Picks For Investors To Consider In 2021,yahoofinance,2021-01-04 08:51:12
More Good News Is Coming For Tesla Stock In January,yahoofinance,2021-01-04 08:51:12
Nio's Record Run Continues As Deliveries Spike 121% In December; EV Maker Confirms Sedan Launch On 'Nio Day',yahoofinance,2021-01-04 08:51:12
"Gold Roars Out of Blocks in 2021 as Real Yields, Dollar Decline",yahoofinance,2021-01-04 08:51:12
"If You're Buying ETFs And Not Doing This, You're Missing Out",yahoofinance,2021-01-04 08:51:12
"Sure, we could see another year of double-digit returns: Morning Brief",yahoofinance,2021-01-04 08:51:12
Is EOS the New BTC? Pay Attention to Peter Thiel,yahoofinance,2021-01-04 08:51:12
Cuts likely as Fiat Chrysler-PSA merger nears approval,yahoofinance,2021-01-04 08:51:12
"Icahn Sells $600 Million Herbalife Stake, Gives Up Board Seats",yahoofinance,2021-01-04 08:51:12
Here Are Barron’s Best Income Investments for the New Year,yahoofinance,2021-01-04 08:51:12
DeVere Group CEO Sold Half of Bitcoin Holdings at Christmas Highs,yahoofinance,2021-01-04 08:51:12
10 SPACs Trading Under $11 For Investors To Consider In 2021,yahoofinance,2021-01-04 08:51:12
The 7 worst ways people will use their stimulus checks,yahoofinance,2021-01-04 08:51:12
Chinese Telecoms Dented in Hong Kong as NYSE Moves to Remove Them,yahoofinance,2021-01-04 08:51:12
Top Restaurant Stocks Poised For Biggest Gains In A Generation: Analysts,yahoofinance,2021-01-04 08:51:12
Teledyne to acquire Flir Systems in cash-and-stock deal valued at about $8 billion,yahoofinance,2021-01-04 08:51:12
Rolls-Royce introduces a car for the 'post-opulence era',yahoofinance,2021-01-04 08:51:12
Exclusive - Vietnam buys Indian rice for first time in decades: industry officials,yahoofinance,2021-01-04 08:51:12
Teledyne to Acquire FLIR Systems in $8 Billion Cash-and-Stock Deal,yahoofinance,2021-01-04 08:51:12
Brookfield Asset Management offers to buy limited partnership units of Brookfield Property for $5.9 billion,yahoofinance,2021-01-04 08:51:12
Oil eases after hitting multi-month high before OPEC+ meeting,yahoofinance,2021-01-04 08:51:12
Micron Nears Resistance Ahead of Earnings,yahoofinance,2021-01-04 08:51:12
Tesla Poised for Expansion After Just Missing 2020 Target,yahoofinance,2021-01-04 08:51:12
Brookfield Bids to Take Brookfield Property Partners Private,yahoofinance,2021-01-04 08:51:12
Common Post-Retirement Risks You Should Know,yahoofinance,2021-01-04 08:51:12
"Ether Price Passes $1,150 to Hit Highest Since January 2018",yahoofinance,2021-01-04 08:51:12
"Benzinga's Final Bulls And Bears Of The Year: Alibaba, Apple, Intel, Tesla And More",yahoofinance,2021-01-04 08:51:12
Is GM Stock A Buy? General Motors' EV Momentum Faces Key Test,yahoofinance,2021-01-04 08:51:12
Venezuela’s Maduro Plans Shift to Fully Digitalized Economy,yahoofinance,2021-01-04 08:51:12
Explainer-How investors view the Georgia U.S. Senate runoff,yahoofinance,2021-01-04 08:51:12
How To Plan for Medical Expenses in Retirement,yahoofinance,2021-01-04 08:51:12
Centene to acquire Magellan Health in deal with enterprise value of $2.2 billion,yahoofinance,2021-01-04 08:51:12
Five Crucial Retirement Savings Decisions For 2021,yahoofinance,2021-01-04 08:51:12
"Tesla, FLIR Systems, Roku, Magellan Health - Monday's Premarket Movers",yahoofinance,2021-01-04 08:51:12
The hottest IPOs on deck for 2021 include these familiar names,yahoofinance,2021-01-04 08:51:12
"Earnings to Watch Next Week: Carnival, RPM, Constellation Brands and Walgreens Boots Alliance in Focus",yahoofinance,2021-01-04 08:51:12
Gold begins 2021 with 2% jump as dollar falters,yahoofinance,2021-01-04 08:51:12
"10 IPOs To Watch Out For In 2021, Including Petco, Poshmark, Bumble, Coinbase And More",yahoofinance,2021-01-04 08:51:12
Tesla Roars To All-Time Highs After Record 2020 Delivery Total; Market Value Nears $700 Billion,yahoofinance,2021-01-04 08:51:12
"Ethereum Steals Bitcoin's Thunder As It Storms Past $1,100",yahoofinance,2021-01-04 08:51:12
Seeking Gold 2401 (+26%) in 2021,yahoofinance,2021-01-04 08:51:12
Tesla's Production Road 'Bumpy' But Munster Estimates 40% Higher Deliveries In 2021,yahoofinance,2021-01-04 08:51:12
‘He stopped paying all the bills’: My cheating husband stole my stimulus check — twice,yahoofinance,2021-01-04 08:51:12
Gilead Sciences or Biogen: Which Biotech Stock is a Better Pick for 2021?,yahoofinance,2021-01-04 08:51:12
What Is Expected In The Energy Market In 2021?,yahoofinance,2021-01-04 08:51:12
"Will Tesla, Apple and Amazon Help The QQQ ETF Reach $400 By 2022?",yahoofinance,2021-01-04 08:51:12
"Dow Jones Today, Futures Rise As Europe Rallies Into 2021; Tesla, Nio Lead EV Surge; Flir Spikes On Teledyne Takeover",yahoofinance,2021-01-04 08:51:12
China Threatens Retaliation Against NYSE Move To Delist Country's Major Telecom Operators,yahoofinance,2021-01-04 08:51:12
Pinduoduo Worker’s Death Renews Scrutiny of 996 Work Culture,yahoofinance,2021-01-04 08:51:12
Should you refinance to a 30- or 15-year mortgage in today's economy?,yahoofinance,2021-01-04 08:51:12
"The Crypto Daily – Movers and Shakers – January 4th, 2021",yahoofinance,2021-01-04 08:51:12
Ladbrokes owner says MGM's $11 billion takeover bet undervalues company,yahoofinance,2021-01-04 08:51:12
"Bitcoin slumps, slamming brakes on New Year rally",yahoofinance,2021-01-04 08:51:12
U.S. Futures Rise With Europe Stocks; Gold Jumps: Markets Wrap,yahoofinance,2021-01-04 08:51:12
3 New ETFs For 2021: Rookies Ready To Come Of Age,yahoofinance,2021-01-04 08:51:12
Mortgage rates begin 2021 at a place no one would have believed a year ago,yahoofinance,2021-01-04 08:51:12
Pinduoduo faces labour probe after employee death-newspaper,yahoofinance,2021-01-04 08:51:12
Dentsply Sirona acquires clear aligner provider Byte in all-cash deal valued at 1.04 billion,yahoofinance,2021-01-04 08:51:12
China’s Three Big Telcos Slide on NYSE Move to Delist Shares,yahoofinance,2021-01-04 08:51:12
Indian shares close at record highs as country approves COVID-19 vaccines,yahoofinance,2021-01-04 08:51:12
Microsoft Soared in 2020 as It Captured Cloud Business. There’s More To Come.,yahoofinance,2021-01-04 08:51:12
"The Week In Cannabis: DEA Research Licenses, Wisconsin, An Israeli Index, M&A, And More",yahoofinance,2021-01-04 08:51:12
Li Auto Crushes Delivery Guidance. The Chinese EV Sector Remains Hot.,yahoofinance,2021-01-04 08:51:12
My Top 10 Predictions for 2021,yahoofinance,2021-01-04 08:51:12
Argentina’s Credibility Crisis,yahoofinance,2021-01-04 08:51:12
Why The EPS Rating Is One Key To Picking The Best Stocks,yahoofinance,2021-01-04 08:51:12
"Notable Insider Buys Of The Past Week: Danimer Scientific, Cheniere Energy Partners And More",yahoofinance,2021-01-04 08:51:12
Bitcoin’s Rally Comes to a Halt as Prices Fall Most Since March,yahoofinance,2021-01-04 08:51:12
Stock Forecast For 2021: Top Fund Managers Like These,yahoofinance,2021-01-04 08:51:12
Investors are convinced the stock market party will continue in 2021,yahoofinance,2021-01-04 08:51:12
XPeng Is the Latest EV Company to Report Positive Delivery News,yahoofinance,2021-01-04 08:51:12
"Tesla 2020 Vehicle Deliveries Top Estimates, But Shy of Elon Musk’s Target",yahoofinance,2021-01-04 08:51:12
Applied Materials Lifts Bid for Kokusai Electric to $3.5 Billion,yahoofinance,2021-01-04 08:51:12
New stimulus checks are arriving — what if you were counting on more money?,yahoofinance,2021-01-04 08:51:12
"The Home Builder Stocks That Could Gain the Most in 2021, According to Analysts",yahoofinance,2021-01-04 08:51:12
Trump Pressured Georgia Official to ‘Find’ Votes,wsj,2021-01-04 08:54:01
MGM Makes $11 Billion Offer for Ladbrokes Owner Entain,wsj,2021-01-04 08:54:01
Stock Futures Point to Extended Rally,wsj,2021-01-04 08:54:01
Iran Begins Enriching Uranium to 20% Purity,wsj,2021-01-04 08:54:01
Crush of Covid-19 Patients Strains U.S. Hospitals,wsj,2021-01-04 08:54:01
Fidelity’s Challenge Is to Turn Day Traders Into Longtime Clients,wsj,2021-01-04 08:54:01
Roku Nears Deal to Buy Rights to Quibi’s Content,wsj,2021-01-04 08:54:01
British Judge Rejects U.S. Request to Extradite Assange,wsj,2021-01-04 08:54:01
Manufacturers Overcame Covid Setbacks to End 2020 on High,wsj,2021-01-04 08:54:01
North Korea Requests Covid-19 Vaccines From Global Group,wsj,2021-01-04 08:54:01
"Your NFL Playoffs—Including, Yes, the Cleveland Browns",wsj,2021-01-04 08:54:01
"Covid-19 Vaccines Are in Demand, but Thousands More Workers Are Needed to Make Them",wsj,2021-01-04 08:54:01
