headline,org,date
'The door is going to be largely shut' to Chinese tech in the US,yahoofinance,2020-07-18 20:39:41
Disney cuts ad spending on Facebook: WSJ,yahoofinance,2020-07-18 20:39:41
How to get out of the COVID-19 testing mess,yahoofinance,2020-07-18 20:39:41
We're accepting more death 'as normal': David Rubenstein,yahoofinance,2020-07-18 20:39:41
Caribbean nations sell discounted citizenships,yahoofinance,2020-07-18 20:39:41
"Americans will tolerate ‘1,000 people dying a day’ of coronavirus [Video]",yahoofinance,2020-07-18 20:39:41
Students may have Big Tech to thank for visa reversal,yahoofinance,2020-07-18 20:39:41
DC Mayor on why she boosted police funding,yahoofinance,2020-07-18 20:39:41
Multi-asset investing for uncertain times,yahoofinance,2020-07-18 20:39:41
Coronavirus update: U.S. reports yet another  record case tally for a single day while global cases top 14 million,yahoofinance,2020-07-18 20:39:41
Why early retirement IS all it’s cracked up to be,yahoofinance,2020-07-18 20:39:41
Oppenheimer: These 2 “Strong Buy” Stocks Are Poised to Surge by Over 80%,yahoofinance,2020-07-18 20:39:41
"Dow Jones Futures: Coronavirus Stock Market Rally Awaits Tesla Earnings, AstraZeneca Vaccine News",yahoofinance,2020-07-18 20:39:41
These Are The 5 Best Stocks To Buy And Watch Now,yahoofinance,2020-07-18 20:39:41
"Cramer Gives His Opinion On Boeing, Coca-Cola And More",yahoofinance,2020-07-18 20:39:41
Nikola stock tanks after stock-sales filing,yahoofinance,2020-07-18 20:39:41
Walgreens and 3 Other Companies That Raised Dividends This Week,yahoofinance,2020-07-18 20:39:41
Cisco Fires Workers for Racial Comments During Diversity Forum,yahoofinance,2020-07-18 20:39:41
China’s Bull Run Could Signal a Wall Street Stampede,yahoofinance,2020-07-18 20:39:41
Is the ‘great rotation’ in the stock market under way as coronavirus cases surge? Or is it a false dawn? Here’s what experts think,yahoofinance,2020-07-18 20:39:41
NIO share price reflects 'over-optimism': Goldman,yahoofinance,2020-07-18 20:39:41
I want to take money out of my Roth IRA tax-free — when can I do that?,yahoofinance,2020-07-18 20:39:41
U.S. Oil Companies Are Drilling Again. Here’s Who’s Ramping Up.,yahoofinance,2020-07-18 20:39:41
"Tesla’s prayer for profit, earnings tests for Intel and Microsoft highlight first big week of coronavirus-tainted earnings",yahoofinance,2020-07-18 20:39:41
Annuities Can Help Your Retirement Portfolio Stay Afloat. These Are the Best Ones,yahoofinance,2020-07-18 20:39:41
8 Third-Quarter Stock Picks That Bank of America Loves,yahoofinance,2020-07-18 20:39:41
Warren Buffett may have found a stock he likes — his own,yahoofinance,2020-07-18 20:39:41
"Bulls And Bears Of The Week: Disney, GE, Tesla And More",yahoofinance,2020-07-18 20:39:41
Wells Fargo Stock Has Been Beaten Down. It Could Be a Buy.,yahoofinance,2020-07-18 20:39:41
Netflix hits a rough patch as Peacock spreads its wings,yahoofinance,2020-07-18 20:39:41
Kraft Heinz Stock Could Reward Long-Term Shareholders,yahoofinance,2020-07-18 20:39:41
"The Week In Cannabis: Stocks On The Rise, Earnings, Big Cannabis Sales, Moves In Argentina",yahoofinance,2020-07-18 20:39:41
"A Low-Volatility Manager Sold Microsoft, Disney and Apple Stock. Here’s What It Bought.",yahoofinance,2020-07-18 20:39:41
"Barron's Picks And Pans: Dollar General, IAC, Wells Fargo And More",yahoofinance,2020-07-18 20:39:41
International Business Machines Earnings: What to look for from IBM,yahoofinance,2020-07-18 20:39:41
"Yes, It’s Boarding Time for Virgin Galactic Stock",yahoofinance,2020-07-18 20:39:41
Amazon (AMZN) Stock Is Under the Microscope Ahead of Earnings,yahoofinance,2020-07-18 20:39:41
Tesla Sales Will Skyrocket—But Its Stock Is Too High. Making Sense of Two Polls.,yahoofinance,2020-07-18 20:39:41
Marathon Petroleum May Get $15B-Plus Bid for Speedway Unit,yahoofinance,2020-07-18 20:39:41
"Johnson & Johnson Stock Is Too Cheap, Goldman Says",yahoofinance,2020-07-18 20:39:41
"Stuck With Coal Pits the World Needs, But Few Want",yahoofinance,2020-07-18 20:39:41
"Norwegian, Carnival, Royal Caribbean Extend Losses As CDC Furthers Cruise Sail Ban",yahoofinance,2020-07-18 20:39:41
Novavax (NVAX) Is a Long-Term Coronavirus Play,yahoofinance,2020-07-18 20:39:41
Ericsson Stock Is Soaring Because the Swedish Telecom is Winning in 5G,yahoofinance,2020-07-18 20:39:41
Norwegian Announces Pricing Of Its $250M Public Offering,yahoofinance,2020-07-18 20:39:41
"With mortgage rates now under 3%, most home loans are due for a refinance, study says",yahoofinance,2020-07-18 20:39:41
Court backs Trump expansion of cheap health insurance plans,yahoofinance,2020-07-18 20:39:41
Game Plan: Cramer's 'Mad Money' Recap (Friday  7/17/20),yahoofinance,2020-07-18 20:39:41
The hidden risk in your S&P 500 index fund,yahoofinance,2020-07-18 20:39:41
5 Biopharma Stocks That Are Affordable And Growing,yahoofinance,2020-07-18 20:39:41
Home Depot Leads 5 Stocks In Or Near Buy Zones From The Market Rally's Hottest Sector,yahoofinance,2020-07-18 20:39:41
"Looking Longer-Term, Barrick Gold Could Double in Price From Here",yahoofinance,2020-07-18 20:39:41
"Top Mutual Fund Manager Spells Out Bets On Amazon, Microsoft, Facebook",yahoofinance,2020-07-18 20:39:41
Detroit Smackdown: Ford’s New Bronco Collides with Fiat Chrysler’s Jeep,yahoofinance,2020-07-18 20:39:41
Cruise stocks hit hard as CDC extension of no-sail order could be just the beginning,yahoofinance,2020-07-18 20:39:41
"When will I get my tax refund? ‘We’re focused on the paper returns,’ the IRS says as it reopens offices",yahoofinance,2020-07-18 20:39:41
"Coin shortage: COVID-19 stole our change, and this is what stores are doing to get more",yahoofinance,2020-07-18 20:39:41
Analyst Sees 60% Upside for Nabriva (NBRV) Following  Merck Deal,yahoofinance,2020-07-18 20:39:41
"The Daily Biotech Pulse: 2 IPOs, Nabriva Pneumonia Drug Gets Canadian Regulatory Nod, PhaseBio Doses First COVID-19 Trial Patient",yahoofinance,2020-07-18 20:39:41
Now Might Not Be the Greatest Time in the World to Buy Southwest Stock,yahoofinance,2020-07-18 20:39:41
"China's regulators break down Xiao Jianhua's financial empire, seizing Tomorrow Group's insurers, trust firms and brokers",yahoofinance,2020-07-18 20:39:41
The SPY ETF Is a Great Hangout In These Turbulent Times,yahoofinance,2020-07-18 20:39:41
Drone Package Delivery Dreams Reanimate a Tiny Stock in Kansas,yahoofinance,2020-07-18 20:39:41
Amazon settles lawsuit with former employee who went to Google Cloud,yahoofinance,2020-07-18 20:39:41
China is Shopping More Online. Alibaba Stock Will Benefit.,yahoofinance,2020-07-18 20:39:41
"Is MA Stock A Buy Right Now? Here's What Earnings, Mastercard Stock Chart Show",yahoofinance,2020-07-18 20:39:41
Remark Will Lose Value We Get Closer To a Coronavirus Vaccine,yahoofinance,2020-07-18 20:39:41
Annuities Have Long Gotten a Bad Rap. Retirement Experts Now Say Savers Should Consider Basic Options for Guaranteed Income.,yahoofinance,2020-07-18 20:39:41
Tips on Delaying Social Security Benefits,yahoofinance,2020-07-18 20:39:41
Big Weekly Gain For The Dow As Pfizer Advances In Coronavirus Drug Race,yahoofinance,2020-07-18 20:39:41
Nutanix Gains Place on The Information's Takeover Target List,yahoofinance,2020-07-18 20:39:41
[video]Microsoft Reports Earnings on Wednesday: 8 Important Things to Watch,yahoofinance,2020-07-18 20:39:41
"Moderna Keeps Surging, MGM Stumbles",yahoofinance,2020-07-18 20:39:41
Mortgage rates hit new low under 3%; forecast says they're going lower,yahoofinance,2020-07-18 20:39:41
Moderna’s 370% Rally Has Cost Short Sellers $1.5 Billion in 2020,yahoofinance,2020-07-18 20:39:41
"5 Stock Gainers for Friday: VBI Vaccines, Moderna, Novavax",yahoofinance,2020-07-18 20:39:41
Delta Air Lines: Investors Look Beyond the Horizon,yahoofinance,2020-07-18 20:39:41
Qualcomm CEO Steve Mollenkopf Sold Large Block of Shares,yahoofinance,2020-07-18 20:39:41
Abbott Tacks On Massive Coronavirus Test Growth — But Is ABT Stock A Buy?,yahoofinance,2020-07-18 20:39:41
"World faces staggering jobs challenge, says Microsoft president",yahoofinance,2020-07-18 20:39:41
The Next Big Tech IPO Could Be a Little Known Chip Business Inside SoftBank,yahoofinance,2020-07-18 20:39:41
"Is Snap Stock A Buy Right Now? Here's What Earnings, Charts Show",yahoofinance,2020-07-18 20:39:41
Virgin Galactic Breaks Out After Appointing a New CEO,yahoofinance,2020-07-18 20:39:41
Here's why Warren Buffett would tell you to refinance your mortgage,yahoofinance,2020-07-18 20:39:41
Why Eldorado Resorts Is Trading Lower Today,yahoofinance,2020-07-18 20:39:41
SoftBank Quietly Sells Another $2.2 Billion of Its Alibaba Stake,yahoofinance,2020-07-18 20:39:41
"Don’t Take Risks You Can’t Afford to Take, a Barron’s Top Advisor Says",yahoofinance,2020-07-18 20:39:41
9 Cheap Retail Stocks With High Expectations for Earnings,yahoofinance,2020-07-18 20:39:41
Is JNJ Stock A Buy As Pharma Giant Speeds Up Coronavirus Vaccine Plans?,yahoofinance,2020-07-18 20:39:41
FedEx is utilizing robotic arms to sort packages at a Memphis facility,yahoofinance,2020-07-18 20:39:41
U.S. Asks Judge to Block Miner’s Share Sale of Citgo Parent,yahoofinance,2020-07-18 20:39:41
"FOREX-Dollar falls, euro hovers at 4-month high as EU negotiates rescue fund",yahoofinance,2020-07-18 20:39:41
"Palantir IPO Is A Multibillion-Dollar Deal, Wrapped In An Enigma",yahoofinance,2020-07-18 20:39:41
Statement purportedly by Chinese oligarch's Tomorrow Group hits back at regulators for breaking up Xiao Jianhua's conglomerate,yahoofinance,2020-07-18 20:39:41
"Microsoft, Domino's, ServiceNow Among 20 Stocks On IBD Long-Term Leaders List",yahoofinance,2020-07-18 20:39:41
Nvidia Drives Top Tech Stock Play Near Buy Point In Coronavirus Market Rally,yahoofinance,2020-07-18 20:39:41
Graham Holdings Is a Smaller—and Cheaper—Berkshire Hathaway,yahoofinance,2020-07-18 20:39:41
Fastly Stock: Traders Need To Slow Down,yahoofinance,2020-07-18 20:39:41
Bored bank customers flock to day-trading platforms during pandemic,yahoofinance,2020-07-18 20:39:41
"As Trump and Biden trade age insults, older workers suffer",yahoofinance,2020-07-18 20:39:41
How to Retire into a Bear Market,yahoofinance,2020-07-18 20:39:41
Gold Price Prediction – Prices Rise and Finish the Week up 0.66%,yahoofinance,2020-07-18 20:39:41
Rise in 5G sales buoys Ericsson's quarterly profit,yahoofinance,2020-07-18 20:39:41
Coca-Cola Reports Earnings Next Week. Here’s What to Expect.,yahoofinance,2020-07-18 20:39:41
Tech Finally Took It on the Chin. Why Its Reversal Is Worrisome.,yahoofinance,2020-07-18 20:39:41
Does IBM's Recent Rally Suggest Upside Ahead of Earnings?,yahoofinance,2020-07-18 20:39:41
CARES Act mortgage forbearance repayment options,yahoofinance,2020-07-18 20:39:41
Singapore’s Hottest Stock Is Set to Continue Its Winning Streak,yahoofinance,2020-07-18 20:39:41
Weekend reads: Tesla’s earnings report is  next moment of truth for bulls and bears,yahoofinance,2020-07-18 20:39:41
Latest Ripple price and analysis (XRP to USD),yahoofinance,2020-07-18 20:39:41
Why Dynavax's Stock Is Trading Higher Today,yahoofinance,2020-07-18 20:39:41
Judge dismisses harassment lawsuit against Wynn Resorts,yahoofinance,2020-07-18 20:39:41
Your Midyear Retirement Finances Review,yahoofinance,2020-07-18 20:39:41
Will the Coronavirus Make Zynga Stock Great Again?,yahoofinance,2020-07-18 20:39:41
Signal Says Gold Stock Could Keep Shining,yahoofinance,2020-07-18 20:39:41
The open secret in commercial real estate is that owners regularly take cash out of properties — here’s a look at how much,yahoofinance,2020-07-18 20:39:41
Gold Could Overtake Treasuries in Global Hedging Battle,yahoofinance,2020-07-18 20:39:41
"Jailed executive in Wirecard scandal offers confession, lawyer says",yahoofinance,2020-07-18 20:39:41
7 Smaller Retailers Give Amazon.com A Run For Its Money,yahoofinance,2020-07-18 20:39:41
JPMorgan uncovers why 'day' traders in S&P 500 were left behind,seekingalpha,2020-07-18 20:41:25
"Secret to U.S. fiscal, growth enhancement is structural, Moody's writes",seekingalpha,2020-07-18 20:41:25
White House officials look to withhold funds for coronavirus testing - WP,seekingalpha,2020-07-18 20:41:25
"Disney, Facebook's No.1 advertiser, slashes its spend",seekingalpha,2020-07-18 20:41:25
Weekly Wrap: Retail Holds Its Own Without Amazon,seekingalpha,2020-07-18 20:41:25
Weekly Wrap: Retail Holds Its Own Without Amazon,seekingalpha,2020-07-18 20:41:25
Defensive stocks help the market wrap the week higher,seekingalpha,2020-07-18 20:41:25
JPMorgan uncovers why 'day' traders in S&P 500 were left behind,seekingalpha,2020-07-18 20:41:25
Beat up banks may be best bet on vaccine,seekingalpha,2020-07-18 20:41:25
"Disney, Facebook's No.1 advertiser, slashes its spend",seekingalpha,2020-07-18 20:41:25
"Secret to U.S. fiscal, growth enhancement is structural, Moody's writes",seekingalpha,2020-07-18 20:41:25
White House officials look to withhold funds for coronavirus testing - WP,seekingalpha,2020-07-18 20:41:25
"Nikola tumbles 18.4% on share offer filing by company, holders",seekingalpha,2020-07-18 20:41:25
Seeking Alpha Catalyst Watch,seekingalpha,2020-07-18 20:41:25
I Put Half Of My Net Worth Into These Investments,seekingalpha,2020-07-18 20:41:25
Why A Short-Term Melt-Up Seems Likely Here,seekingalpha,2020-07-18 20:41:25
"Stocks To Watch: Vaccine Players, Earnings Blitz And Fiscal Debate",seekingalpha,2020-07-18 20:41:25
Altria's Upcoming Dividend Increase,seekingalpha,2020-07-18 20:41:25
Stocks Are About To Get A Lot More Expensive,seekingalpha,2020-07-18 20:41:25
Top Stocks To Buy Now,seekingalpha,2020-07-18 20:41:25
Silver Investment Demand Exploding,seekingalpha,2020-07-18 20:41:25
The Fed Has Invested In AT&T Debt - What Are You Waiting For?,seekingalpha,2020-07-18 20:41:25
NuStar: Grab A 12%-Plus Yield On These Overlooked Preferreds,seekingalpha,2020-07-18 20:41:25
"QQQX: Sell Now, Buy On The Next Crash",seekingalpha,2020-07-18 20:41:25
"Retirement Strategy: Low-Priced Dividend Investments That Pay Monthly - JHB, JFR, PHT",seekingalpha,2020-07-18 20:41:25
The Bullish Case For Bitcoin,seekingalpha,2020-07-18 20:41:25
Netflix: The Reckoning Is Here,seekingalpha,2020-07-18 20:41:25
Just How Risky Are CEFs When Building A 8%-10% Balanced Portfolio Yield?,seekingalpha,2020-07-18 20:41:25
"Q2-season margins will lift these E&C firms, Baird says",seekingalpha,2020-07-18 20:41:25
'Uncorrelated' fund manager talks SPACs and new long ideas,seekingalpha,2020-07-18 20:41:25
Oppenheimer sees 56% upside in this wireless standard patent holder,seekingalpha,2020-07-18 20:41:25
Dental sector check-up from Baird expects ongoing upside in Q2,seekingalpha,2020-07-18 20:41:25
These big tech names are integral to Fund's S&P-beating strategy,seekingalpha,2020-07-18 20:41:25
Slate Office REIT: The 11% Dividend Yield Remains Fully Covered,seekingalpha,2020-07-18 20:41:25
"Gold Is In Gorilla Mode, Technically Speaking",seekingalpha,2020-07-18 20:41:25
Global X ETFs: 2020 Second Half Outlook,seekingalpha,2020-07-18 20:41:25
Dividend Challenger Highlights: Week Of July 19,seekingalpha,2020-07-18 20:41:25
Dividend Champion And Contender Highlights: Week Of July 19,seekingalpha,2020-07-18 20:41:25
Glu Mobile: Buy On Pullbacks,seekingalpha,2020-07-18 20:41:25
PNC Financial: Credit Costs Appear To Have Peaked,seekingalpha,2020-07-18 20:41:25
Model N: Cloud Strategy Taking Off,seekingalpha,2020-07-18 20:41:25
Analog Devices: Better Days Ahead For This Semiconductor Player,seekingalpha,2020-07-18 20:41:25
Reading Calumet Specialty Products' Tea Leaves,seekingalpha,2020-07-18 20:41:25
Slate Office REIT: The 11% Dividend Yield Remains Fully Covered,seekingalpha,2020-07-18 20:41:25
Dividend Challenger Highlights: Week Of July 19,seekingalpha,2020-07-18 20:41:25
Dividend Champion And Contender Highlights: Week Of July 19,seekingalpha,2020-07-18 20:41:25
Consolidated Edison: 25% Annualized Yield On A Dividend Aristocrat's Next Payout,seekingalpha,2020-07-18 20:41:25
Coronavirus Claims Casualty Ahead Of REIT Earnings Season,seekingalpha,2020-07-18 20:41:25
SIL Top 10 Holdings: Jurisdiction Is A Risk,seekingalpha,2020-07-18 20:41:25
"QQQX: Sell Now, Buy On The Next Crash",seekingalpha,2020-07-18 20:41:25
The Reasons Why I Bought VPU This Week,seekingalpha,2020-07-18 20:41:25
Vanguard International Dividend Appreciation ETF: Central Banks' Policies Should Support Its Valuation,seekingalpha,2020-07-18 20:41:25
O'Shares Global Internet Giants ETF: Targeted Exposure To The Momentum Growth Stocks,seekingalpha,2020-07-18 20:41:25
"Gold Is In Gorilla Mode, Technically Speaking",seekingalpha,2020-07-18 20:41:25
Global X ETFs: 2020 Second Half Outlook,seekingalpha,2020-07-18 20:41:25
Weekly High Frequency Indicators: Forecast And Nowcast Stabilize As Domestic U.S. Pandemic Progress Reverses,seekingalpha,2020-07-18 20:41:25
Good News/Bad News For Earnings Season And Markets,seekingalpha,2020-07-18 20:41:25
"MacroView: Value Is Dead, Long Live Value Investing",seekingalpha,2020-07-18 20:41:25
Weekly Wrap: Retail Holds Its Own Without Amazon,seekingalpha,2020-07-18 20:41:25
Defensive stocks help the market wrap the week higher,seekingalpha,2020-07-18 20:41:25
JPMorgan uncovers why 'day' traders in S&P 500 were left behind,seekingalpha,2020-07-18 20:41:25
Beat up banks may be best bet on vaccine,seekingalpha,2020-07-18 20:41:25
"Disney, Facebook's No.1 advertiser, slashes its spend",seekingalpha,2020-07-18 20:41:25
"Secret to U.S. fiscal, growth enhancement is structural, Moody's writes",seekingalpha,2020-07-18 20:41:25
White House officials look to withhold funds for coronavirus testing - WP,seekingalpha,2020-07-18 20:41:25
"Nikola tumbles 18.4% on share offer filing by company, holders",seekingalpha,2020-07-18 20:41:25
Seeking Alpha Catalyst Watch,seekingalpha,2020-07-18 20:41:25
I Put Half Of My Net Worth Into These Investments,seekingalpha,2020-07-18 20:41:25
Why A Short-Term Melt-Up Seems Likely Here,seekingalpha,2020-07-18 20:41:25
"Stocks To Watch: Vaccine Players, Earnings Blitz And Fiscal Debate",seekingalpha,2020-07-18 20:41:25
Altria's Upcoming Dividend Increase,seekingalpha,2020-07-18 20:41:25
Stocks Are About To Get A Lot More Expensive,seekingalpha,2020-07-18 20:41:25
Top Stocks To Buy Now,seekingalpha,2020-07-18 20:41:25
Silver Investment Demand Exploding,seekingalpha,2020-07-18 20:41:25
The Fed Has Invested In AT&T Debt - What Are You Waiting For?,seekingalpha,2020-07-18 20:41:25
NuStar: Grab A 12%-Plus Yield On These Overlooked Preferreds,seekingalpha,2020-07-18 20:41:25
"QQQX: Sell Now, Buy On The Next Crash",seekingalpha,2020-07-18 20:41:25
"Retirement Strategy: Low-Priced Dividend Investments That Pay Monthly - JHB, JFR, PHT",seekingalpha,2020-07-18 20:41:25
The Bullish Case For Bitcoin,seekingalpha,2020-07-18 20:41:25
Netflix: The Reckoning Is Here,seekingalpha,2020-07-18 20:41:25
Just How Risky Are CEFs When Building A 8%-10% Balanced Portfolio Yield?,seekingalpha,2020-07-18 20:41:25
"Q2-season margins will lift these E&C firms, Baird says",seekingalpha,2020-07-18 20:41:25
'Uncorrelated' fund manager talks SPACs and new long ideas,seekingalpha,2020-07-18 20:41:25
Oppenheimer sees 56% upside in this wireless standard patent holder,seekingalpha,2020-07-18 20:41:25
Dental sector check-up from Baird expects ongoing upside in Q2,seekingalpha,2020-07-18 20:41:25
These big tech names are integral to Fund's S&P-beating strategy,seekingalpha,2020-07-18 20:41:25
Slate Office REIT: The 11% Dividend Yield Remains Fully Covered,seekingalpha,2020-07-18 20:41:25
"Gold Is In Gorilla Mode, Technically Speaking",seekingalpha,2020-07-18 20:41:25
Global X ETFs: 2020 Second Half Outlook,seekingalpha,2020-07-18 20:41:25
Dividend Challenger Highlights: Week Of July 19,seekingalpha,2020-07-18 20:41:25
Dividend Champion And Contender Highlights: Week Of July 19,seekingalpha,2020-07-18 20:41:25
Glu Mobile: Buy On Pullbacks,seekingalpha,2020-07-18 20:41:25
PNC Financial: Credit Costs Appear To Have Peaked,seekingalpha,2020-07-18 20:41:25
Model N: Cloud Strategy Taking Off,seekingalpha,2020-07-18 20:41:25
Analog Devices: Better Days Ahead For This Semiconductor Player,seekingalpha,2020-07-18 20:41:25
Reading Calumet Specialty Products' Tea Leaves,seekingalpha,2020-07-18 20:41:25
Slate Office REIT: The 11% Dividend Yield Remains Fully Covered,seekingalpha,2020-07-18 20:41:25
Dividend Challenger Highlights: Week Of July 19,seekingalpha,2020-07-18 20:41:25
Dividend Champion And Contender Highlights: Week Of July 19,seekingalpha,2020-07-18 20:41:25
Consolidated Edison: 25% Annualized Yield On A Dividend Aristocrat's Next Payout,seekingalpha,2020-07-18 20:41:25
Coronavirus Claims Casualty Ahead Of REIT Earnings Season,seekingalpha,2020-07-18 20:41:25
SIL Top 10 Holdings: Jurisdiction Is A Risk,seekingalpha,2020-07-18 20:41:25
"QQQX: Sell Now, Buy On The Next Crash",seekingalpha,2020-07-18 20:41:25
The Reasons Why I Bought VPU This Week,seekingalpha,2020-07-18 20:41:25
Vanguard International Dividend Appreciation ETF: Central Banks' Policies Should Support Its Valuation,seekingalpha,2020-07-18 20:41:25
O'Shares Global Internet Giants ETF: Targeted Exposure To The Momentum Growth Stocks,seekingalpha,2020-07-18 20:41:25
"Gold Is In Gorilla Mode, Technically Speaking",seekingalpha,2020-07-18 20:41:25
Global X ETFs: 2020 Second Half Outlook,seekingalpha,2020-07-18 20:41:25
Weekly High Frequency Indicators: Forecast And Nowcast Stabilize As Domestic U.S. Pandemic Progress Reverses,seekingalpha,2020-07-18 20:41:25
Good News/Bad News For Earnings Season And Markets,seekingalpha,2020-07-18 20:41:25
"MacroView: Value Is Dead, Long Live Value Investing",seekingalpha,2020-07-18 20:41:25
4 new products that show Corporate America is getting serious about climate change,cnnbusiness,2020-07-18 20:43:29
TikTok turned this skincare brand into a cult favorite ,cnnbusiness,2020-07-18 20:43:29
A trove of Apollo spaceflight hardware just sold at auction,cnnbusiness,2020-07-18 20:43:29
Twitter says some accounts had personal data stolen in massive hack,cnnbusiness,2020-07-18 20:43:29
How the massive Twitter hack may have happened,cnnbusiness,2020-07-18 20:43:29
Why it's getting harder to get exact change,cnnbusiness,2020-07-18 20:43:29
Ex-Trump economist says White House was warned of potential pandemic disaster in September,cnnbusiness,2020-07-18 20:43:29
Instagram's TikTok clone is going global,cnnbusiness,2020-07-18 20:43:29
NASA astronauts on historic SpaceX mission aiming for August 2 return,cnnbusiness,2020-07-18 20:43:29
Mark Zuckerberg slams President Trump for undermining health experts,cnnbusiness,2020-07-18 20:43:29
"Fed opens $600 billion Main Street program to colleges, hospitals and other nonprofits",cnnbusiness,2020-07-18 20:43:29
Here's what you need to know about inflation,cnnbusiness,2020-07-18 20:43:29
Refi rates at 2.53% APR (15 yr). Do you qualify?,cnnbusiness,2020-07-18 20:43:29
Her biscuit restaurant was a local favorite. Then the pandemic hit,cnnbusiness,2020-07-18 20:43:29
I attended a virtual conference with an AI version of Deepak Chopra. It was bizarre and transfixing,cnnbusiness,2020-07-18 20:43:29
Fox's Chris Wallace fact checks Trump,cnnbusiness,2020-07-18 20:43:29
Walmart is the latest to require all customers in US stores to wear masks ,cnnbusiness,2020-07-18 20:43:29
Best Buy customers must wear masks in stores,cnnbusiness,2020-07-18 20:43:29
"9,000 Starbucks will require customers to wear masks",cnnbusiness,2020-07-18 20:43:29
Airlines ban passengers who refuse to wear masks,cnnbusiness,2020-07-18 20:43:29
Trump says masks are a 'double-edged sword.' Goldman Sachs says they could help save the economy,cnnbusiness,2020-07-18 20:43:29
These electric car startups are looking to take on Tesla,cnnbusiness,2020-07-18 20:43:29
"Nissan unveils its first electric SUV, the Ariya",cnnbusiness,2020-07-18 20:43:29
Zipcar's customer service outrages its users,cnnbusiness,2020-07-18 20:43:29
Ford is bringing back the Bronco,cnnbusiness,2020-07-18 20:43:29
"Fiat Chrysler and PSA Group will have a new name: Stellantis. Yes, it's dumb",cnnbusiness,2020-07-18 20:43:29
Ford unveils new line of iconic Broncos,cnnbusiness,2020-07-18 20:43:29
How masks are reshaping the face of the retail economy,cnnbusiness,2020-07-18 20:43:29
"This island sold for $6M, after only a video tour",cnnbusiness,2020-07-18 20:43:29
See the TikTok video that got Disney's attention,cnnbusiness,2020-07-18 20:43:29
Myth vs. reality: What negative interest rates really mean,cnnbusiness,2020-07-18 20:43:29
Intern life in a pandemic,cnnbusiness,2020-07-18 20:43:29
Mortgage rates fall below 3% for first time ever,cnnbusiness,2020-07-18 20:43:29
This is what internships look like in a remote world ,cnnbusiness,2020-07-18 20:43:29
Small businesses say time and money are running out fast,cnnbusiness,2020-07-18 20:43:29
Why Silicon Valley's biggest companies are investing billions in India,cnnbusiness,2020-07-18 20:43:29
"Gearing up for the Xbox Series X, Microsoft has stopped making the Xbox One X",cnnbusiness,2020-07-18 20:43:29
"Lyft is providing some drivers with vehicle partitions for free, while others will have to pay ",cnnbusiness,2020-07-18 20:43:29
Twitter's massive hack could be even worse than it seems,cnnbusiness,2020-07-18 20:43:29
Mary Trump's book breaks record with mammoth sales,cnnbusiness,2020-07-18 20:43:29
Netflix names Ted Sarandos co-CEO as stock takes a tumble on soft guidance,cnnbusiness,2020-07-18 20:43:29
Furloughs turn into job losses as Vox Media lays off 72 staffers,cnnbusiness,2020-07-18 20:43:29
"New poll reaffirms that most Americans don't trust the President, but they do trust Dr. Fauci",cnnbusiness,2020-07-18 20:43:29
How NASA's Apollo program kicked off Silicon Valley's tech revolution,cnnbusiness,2020-07-18 20:43:29
Jeff Bezos just sold $1.8 billion worth of Amazon stock. Here's why,cnnbusiness,2020-07-18 20:43:29
