headline,org,date
5 Reasons Not to Worry About Another Stock Market Crash,googlenews,2020-10-25 10:03:31
Updates: SpaceX launches 60 Starlink satellites from Cape Canaveral,googlenews,2020-10-25 10:03:31
Where can Southwest Airlines take me? Here are some possible destinations for Savannah,googlenews,2020-10-25 10:03:31
"Federal report: Staffing, fraud attempts hinder unemployment claims processing",googlenews,2020-10-25 10:03:31
Tesla Called FSD Beta Testers Warning Not To Do Anything Dumb or FSD Removed,googlenews,2020-10-25 10:03:31
Metro East will soon have COVID-19 restrictions again,googlenews,2020-10-25 10:03:31
Medicare Advantage Plans to Offer More Supplemental Benefits in 2021,googlenews,2020-10-25 10:03:31
Breakthrough 3D Solar Panel Design Increases Light Absorption By 125% – A Potential Game-Changer,googlenews,2020-10-25 10:03:31
Active Bitcoin Addresses at Highest Since 2017's $20K Price Record - CoinDesk,googlenews,2020-10-25 10:03:31
How Coke Is Shaking Things Up — and Why Its Stock Is a Buy,googlenews,2020-10-25 10:03:31
"Dow Jones Futures: Stock Market Rally Faces Pivotal Week; Microsoft, Tesla Near Buy Points",googlenews,2020-10-25 10:03:31
Huawei patents a clamshell foldable smartphone design with a larger cover display,googlenews,2020-10-25 10:03:31
You Won't Be Able to Shop at This Store at the Mall Again,googlenews,2020-10-25 10:03:31
Sviatoslav Richter: How I practise the piano – Slipped Disc,googlenews,2020-10-25 10:03:31
Intel's Data Center Business Disappoints in Q3,googlenews,2020-10-25 10:03:31
Home tests could help in the fight against the coronavirus. So where are they?,googlenews,2020-10-25 10:03:31
Macy's Cancels Santa Claus,googlenews,2020-10-25 10:03:31
Mortgage Rates Fall To 50-Year Low,googlenews,2020-10-25 10:03:31
"The Hummer is making a comeback — and this time, it's all-electric",googlenews,2020-10-25 10:03:31
Tesla is collecting insane amount of data from its Full Self-Driving test fleet,googlenews,2020-10-25 10:03:31
"Powerball Numbers For 10/24/20, Saturday Jackpot was $102 Million",googlenews,2020-10-25 10:03:31
Gold smuggler's gait gives him away as Paypal launches price action moon mission: Bad crypto news of the week,googlenews,2020-10-25 10:03:31
"Amazon (AMZN) To Open 700,000 Sq. Ft Fulfillment Center In Waco, Texas",googlenews,2020-10-25 10:03:31
Americans fear rising cost of working from home as pandemic continues,googlenews,2020-10-25 10:03:31
Quibi Is Hollywood’s Biggest Short-Form Failure—but Not Its First,googlenews,2020-10-25 10:03:31
Coca-Cola European Partners in talks to buy Coca-Cola Amatil: Bloomberg,googlenews,2020-10-25 10:03:31
"GM’s electric ‘supertruck’ revives Hummer brand — an icon to some, anathema to others",googlenews,2020-10-25 10:03:31
Coke is canceling 200 drink brands,googlenews,2020-10-25 10:03:31
McBroken Site Tells You Which McDonald's Ice Cream Machines Are Working,googlenews,2020-10-25 10:03:31
Saudi Chemicals Maker Sabic Posts Profit as Demand Revives,googlenews,2020-10-25 10:03:31
"Video shows Maumee bar with employees not wearing masks, no social distancing during Ohio State game",googlenews,2020-10-25 10:03:31
"Rodents blamed for massive Paris Las Vegas power outage, safety questions remain",googlenews,2020-10-25 10:03:31
The rumors are true: Tony Roma's Waikiki closing,googlenews,2020-10-25 10:03:31
Tesla Has The Best Battery Out of 7 Competing Electric Vehicle Batteries,googlenews,2020-10-25 10:03:31
State tells SW IL officials COVID-19 restrictions will likely be reintroduced Wednesday,googlenews,2020-10-25 10:03:31
Best life insurance companies for 2020,googlenews,2020-10-25 10:03:31
"2021 Ford Bronco Costs $29,995 To $63,100. Here's A Full Price Breakdown",googlenews,2020-10-25 10:03:31
Walmart sues feds to settle pharmacies' role in opioid crisis,googlenews,2020-10-25 10:03:31
"Social media scammers net $117M targeting shoppers, romance seekers: FTC",googlenews,2020-10-25 10:03:31
Michigan man who accidentally bought extra lottery ticket wins two $1M prizes,googlenews,2020-10-25 10:03:31
A Lack Of Vision Is Driving AMC To Bankruptcy. What’s Next?,googlenews,2020-10-25 10:03:31
Wells Fargo Reverses Decision to Scrap 401(k) Match,googlenews,2020-10-25 10:03:31
American Airlines plans customer tours of Boeing 737 Max and pilot calls to boost confidence in jets,googlenews,2020-10-25 10:03:31
Heavy police presence spotted at Walden Galleria on Saturday,googlenews,2020-10-25 10:03:31
China Reconsiders Its Global Strategy for the Yuan,googlenews,2020-10-25 10:03:31
Norfolk man lied on coronavirus relief loan applications. And it wasn’t his first fraud scheme. - The Virginian-Pilot,googlenews,2020-10-25 10:03:31
"AT&T cuts more than 8,700 workers in third quarter amid COVID-19",googlenews,2020-10-25 10:03:31
Tesla Insurance Could Be 30–40% Of The Value Of Tesla’s Car Business,googlenews,2020-10-25 10:03:31
Fuggedaboutit! New Jersey is the most-hated state in America,googlenews,2020-10-25 10:03:31
"Uber drivers sue, say company 'coerced' them to support Prop 22",googlenews,2020-10-25 10:03:31
Why Is Everyone Talking About Moderna Stock?,googlenews,2020-10-25 10:03:31
Gold Looks For Footing After Pause Button Hit on U.S. Stimulus,googlenews,2020-10-25 10:03:31
Walmart extending shopping hours,googlenews,2020-10-25 10:03:31
Chick-fil-A Will Be Releasing A Gift Pack Full Of 3 Popular Sauces And It Makes A Perfect Stocking Stuffer,googlenews,2020-10-25 10:03:31
"Early Black Friday Deals Have Moved Online, But They're Still Not Worth the Stress",googlenews,2020-10-25 10:03:31
Here are tips from financial advisors for getting your Medicare coverage right,googlenews,2020-10-25 10:03:31
"US tentatively approves Delta, WestJet alliance",googlenews,2020-10-25 10:03:31
"Amazon to Open 700,000 Square-Foot Robotics Fulfillment Center in Texas",googlenews,2020-10-25 10:03:31
"Report: Manhattan Rent Drops Below $3,000 For 1st Time Since 2011",googlenews,2020-10-25 10:03:31
3 Important Social Security Changes That Joe Biden Wants to Make,googlenews,2020-10-25 10:03:31
"In 2021, you could earn up to $18,960 without having it impact your Social Security benefits",googlenews,2020-10-25 10:03:31
Here's the Average Social Security Benefit in 2021,googlenews,2020-10-25 10:03:31
3 Social Security Strategies to Bankroll Your Retirement,googlenews,2020-10-25 10:03:31
Delta Air Lines Passenger Ban List Over Masks Crosses 400,googlenews,2020-10-25 10:03:31
American Airlines Earnings: More Bad News,googlenews,2020-10-25 10:03:31
About 500 Passengers Now Banned From Flying on Delta for Refusing Masks: Report,googlenews,2020-10-25 10:03:31
Delta Just Reminded Everyone It's the Only Airline Doing Something Every Traveler Can Appreciate,googlenews,2020-10-25 10:03:31
COVID-19 is pummelling Europe's eateries – and winter is coming,googlenews,2020-10-25 10:03:31
Virus is pummeling Europe's eateries — and winter is coming,googlenews,2020-10-25 10:03:31
Virus is pummeling Europe's eateries - and winter is coming,googlenews,2020-10-25 10:03:31
COVID-19 is pummeling Europe's eateries — and winter is coming,googlenews,2020-10-25 10:03:31
"J&J, AstraZeneca resume trials of COVID-19 vaccines",googlenews,2020-10-25 10:03:31
Who will get a COVID-19 vaccine first in Arizona? The state has a plan,googlenews,2020-10-25 10:03:31
Better Coronavirus Stock: Moderna vs. Pfizer,googlenews,2020-10-25 10:03:31
Two Major Coronavirus Vaccine Trials Have Restarted After Being Paused For Safety Investigations,googlenews,2020-10-25 10:03:31
"Ca. Court says Uber and Lyft must classify drivers as employees, but what about Proposition 22?",googlenews,2020-10-25 10:03:31
Human Capital: Court ruling could mean trouble for Uber and Lyft as gig workers may finally become employees,googlenews,2020-10-25 10:03:31
How California's ballot measure Prop. 22 affects rideshare drivers,googlenews,2020-10-25 10:03:31
"Uber, Lyft futures on the line in Prop. 22 fight",googlenews,2020-10-25 10:03:31
FDA Approves First COVID-19 Drug: Antiviral Remdesivir,googlenews,2020-10-25 10:03:31
Remdesivir offers little benefit: WHO,googlenews,2020-10-25 10:03:31
Remdesivir drug hailed as treatment for COVID-19 following FDA approval,googlenews,2020-10-25 10:03:31
Mexico will not follow FDA in approving Gilead's COVID-19 drug,googlenews,2020-10-25 10:03:31
"Ant Group IPO pricing 'history's largest,' says Alibaba's Jack Ma",googlenews,2020-10-25 10:03:31
Inside Ant’s army of advisers selling the world’s largest IPO,googlenews,2020-10-25 10:03:31
"Ant Group IPO pricing 'history's largest', says Alibaba's Jack Ma",googlenews,2020-10-25 10:03:31
"Exclusive: Ant may raise up to $17 billion in Shanghai IPO leg as investors submit bids, say sources",googlenews,2020-10-25 10:03:31
Trump to hold rally at Lehigh Valley manufacturer,googlenews,2020-10-25 10:03:31
New Covid Cases Climb to 5-Month High in Lehigh County,googlenews,2020-10-25 10:03:31
Sources: President Trump to visit Lehigh Valley Monday,googlenews,2020-10-25 10:03:31
Miracle League hosts trunk-or-treat for players and families (PHOTOS),googlenews,2020-10-25 10:03:31
Google's long-time rivals say DOJ antitrust suit shows it's lost its 'halo' in the eyes of regulators,googlenews,2020-10-25 10:03:31
"Apple, Google and a Deal That Controls the Internet",googlenews,2020-10-25 10:03:31
The Battle That Will Define Big Tech for Decades - OneZero,googlenews,2020-10-25 10:03:31
Google Could Miss Out on Innovation Due to Antitrust Suit: Palmisano,googlenews,2020-10-25 10:03:31
SpaceX adds another 60 satellites to Starlink network – Spaceflight Now,googlenews,2020-10-25 10:03:31
"SpaceX Falcon 9 rocket ties turnaround record, nears 1000 Starlink satellites launched",googlenews,2020-10-25 10:03:31
About 3% of Starlinks Have Failed So Far,googlenews,2020-10-25 10:03:31
SpaceX Launch 100th Successful Falcon Mission,googlenews,2020-10-25 10:03:31
Southwest Airlines joins others filling all available seats,googlenews,2020-10-25 10:03:31
Southwest Airlines plans to re-open middle seats to passengers in December,googlenews,2020-10-25 10:03:31
"Airlines' Losses Mount Amid Pandemic, but Travel Demand Shows Some Improvement",googlenews,2020-10-25 10:03:31
S.C. Lowcountry could see impact of new airline service at Savannah airport,googlenews,2020-10-25 10:03:31
Corpus Christi man admits to taking over $200000 in unemployment benefits,googlenews,2020-10-25 10:03:31
"Hourlong waits. 120,000 unanswered calls in one day. How unemployment claims overwhelmed Missouri",googlenews,2020-10-25 10:03:31
The U.S. Unemployment Numbers Are Not Being Manipulated,googlenews,2020-10-25 10:03:31
"Black unemployment 'showed little change' last month, according to BLS - Business Insider",googlenews,2020-10-25 10:03:31
"Tesla’s ‘Full Self-Driving’ Is 99.9% There, Just 1,000 Times Further To Go",googlenews,2020-10-25 10:03:31
"Tesla Posts Fifth Consecutive Quarter Of Profits, Global Sales Up 44 Percent",googlenews,2020-10-25 10:03:31
"Federal Regulators Are Keeping a Close Watch on Tesla's ""Self-Driving"" Beta Test",googlenews,2020-10-25 10:03:31
Tesla’s ‘Full Self-Driving’ beta test has caught the attention of federal safety regulators,googlenews,2020-10-25 10:03:31
"Medicare Advantage Milestones: Perennial Consortium, UCare Bring Senior Living Plans to Market",googlenews,2020-10-25 10:03:31
5 Medicare Myths That Could Destroy Your Retirement,googlenews,2020-10-25 10:03:31
Why Solar Stocks Are Crushing the Market in 2020,googlenews,2020-10-25 10:03:31
Renewables: A Decade Of Progress Toward A Clean Energy Future,googlenews,2020-10-25 10:03:31
All of South Australia's power comes from solar panels in world first for major jurisdiction,googlenews,2020-10-25 10:03:31
3 Solar Stocks That Could Win From the 2020 Election,googlenews,2020-10-25 10:03:31
Bitcoin Breaks To New 2020 High on PayPal News: This Was The Weekly Crypto Market Update,googlenews,2020-10-25 10:03:31
"PayPal’s Move Will Boost Crypto Adoption, Not Its Profits: Morgan Stanley Analysts",googlenews,2020-10-25 10:03:31
CoinCorner CEO: Bitcoin Network Not Ready for PayPal Effect,googlenews,2020-10-25 10:03:31
PayPal is shilling crypto on the internet,googlenews,2020-10-25 10:03:31
Coca-Cola is discontinuing about 200 brands; water category could see more cuts,googlenews,2020-10-25 10:03:31
"Coca-Cola is discontinuing about 200 brands; Goodbye TaB, Odwalla, Zico",googlenews,2020-10-25 10:03:31
"Coca-Cola Plans To Discontinue 200 Drink Brands, About Half of Its Total",googlenews,2020-10-25 10:03:31
Coca-Cola emerges from lockdown blues,googlenews,2020-10-25 10:03:31
"S&P, Nasdaq close higher as stimulus talks in spotlight",googlenews,2020-10-25 10:03:31
Dow Jones Industrial Average Dropped This Past Week. Why it Isn’t Time to Worry.,googlenews,2020-10-25 10:03:31
Growth stocks have outperformed value by a wide margin … but will it last?,googlenews,2020-10-25 10:03:31
Stocks End Mixed as Lawmakers Continue Stimulus Talks,googlenews,2020-10-25 10:03:31
Huawei Mate 40 Pro: Gorgeous design doesn't make up for this phone's biggest problem,googlenews,2020-10-25 10:03:31
Huawei might be working on a foldable phone with clamshell design - GSMArena.com news,googlenews,2020-10-25 10:03:31
Top 5 points that make the Kirin 9000 SoC special,googlenews,2020-10-25 10:03:31
How the Kirin 990E 5G differs from the Kirin 990 and Kirin 990 5G,googlenews,2020-10-25 10:03:31
"Goodbye Gap: Retailer, to shutter 350 stores by 2024",googlenews,2020-10-25 10:03:31
Gap Inc. will close 350 stores and exit malls entirely,googlenews,2020-10-25 10:03:31
Gap expects to return to profitable growth in 2021,googlenews,2020-10-25 10:03:31
Gap signals major withdrawal from malls across the U.S.,googlenews,2020-10-25 10:03:31
Intel (INTC): Explanation Of The 10.58% Drop In Price,googlenews,2020-10-25 10:03:31
AMD earnings: Gain expected from Intel's pain yet again,googlenews,2020-10-25 10:03:31
Intel Needs To Engineer Its Financial Future,googlenews,2020-10-25 10:03:31
Intel: Another Solid Quarter,googlenews,2020-10-25 10:03:31
Costco offering at-home COVID-19 tests for $130-$140,googlenews,2020-10-25 10:03:31
Costco begins selling at-home COVID-19 test kits,googlenews,2020-10-25 10:03:31
Santa Won't Visit Macy's for the First Time in 159 Years | CBR,googlenews,2020-10-25 10:03:31
Macy's cancels in-person Santa visits for holiday season,googlenews,2020-10-25 10:03:31
Santa Claus won't be coming to Macy's this year,googlenews,2020-10-25 10:03:31
New York's grounded Santas get ready for a grotto Christmas via Zoom,googlenews,2020-10-25 10:03:31
Today's Mortgage and Refinance Rates for October 24 and 25,googlenews,2020-10-25 10:03:31
3 Reasons to Consider a Cash-Out Refinance Today,googlenews,2020-10-25 10:03:31
Don't Believe This Week's Mortgage Rate News. Here's Why,googlenews,2020-10-25 10:03:31
What is a short refinance?,googlenews,2020-10-25 10:03:31
GMC Hummer EV Survives JerryRigEverything’s Deep Tech Dive,googlenews,2020-10-25 10:03:31
The Hummer EV isn't the first electric truck in GMC history,googlenews,2020-10-25 10:03:31
An In-Depth Look At The 2022 GMC Hummer EV Interior Dimensions,googlenews,2020-10-25 10:03:31
Quick timetable for Hummer pickup will set GM standard for EV development,googlenews,2020-10-25 10:03:31
The Tesla Model S Value Proposition Is Astounding,googlenews,2020-10-25 10:03:31
"Tesla to recall nearly 50,000 cars from China over safety concerns",googlenews,2020-10-25 10:03:31
Tesla takes advantage of rare tactic on Model Y to battle cabin noise,googlenews,2020-10-25 10:03:31
Watch Tesla Full Self-Driving Beta in a full 30-minute realistic trip,googlenews,2020-10-25 10:03:31
"Powerball lottery: Did you win Saturday’s $102M Powerball drawing? Winning numbers, live results (10/24/2020)",googlenews,2020-10-25 10:03:31
Winning numbers drawn in ‘Bonus Match 5’ game,googlenews,2020-10-25 10:03:31
Mega Millions results for 10/23/20; jackpot worth $97 million,googlenews,2020-10-25 10:03:31
"Powerball Results, Numbers for 10/24/20: Did Anyone Win the $102 Million?",googlenews,2020-10-25 10:03:31
"Paypal's Crypto Embrace: Morgan Stanley Says Move Boon for Mass Adoption, Critics Say Payment Giant Violates Crypto Principles | Fintech",googlenews,2020-10-25 10:03:31
PayPal’s Bitcoin Strategy Is Not About Bitcoin,googlenews,2020-10-25 10:03:31
'The definition of institutional money has evolved' during the Bitcoin era | CME managing director,googlenews,2020-10-25 10:03:31
Bitcoin Shoots Up to New Year-to-Date High After $13k Daily Close,googlenews,2020-10-25 10:03:31
COVID-19 deaths make mark in McLennan County history,googlenews,2020-10-25 10:03:31
"Amazon (AMZN) To Open 700,000 Fulfillment Center In Waco, Texas",googlenews,2020-10-25 10:03:31
Area health district reports two more deaths and 74 new cases of Covid-19,googlenews,2020-10-25 10:03:31
Will Investors Learn From Quibi's Failure?,googlenews,2020-10-25 10:03:31
Quibi was supposed to be a haven for creatives before it shut down,googlenews,2020-10-25 10:03:31
"Quibi Will End Its Service on December 1, 2020",googlenews,2020-10-25 10:03:31
"Inside Quibi's Abrupt Shutdown: ""This Is Not How They Wanted It to Go""",googlenews,2020-10-25 10:03:31
GMC Hummer EV vs. Tesla Cybertruck: SHOCKING PERFORMANCE,googlenews,2020-10-25 10:03:31
GM Reveals Early Sketches Of Reborn GMC Hummer,googlenews,2020-10-25 10:03:31
GMC Hummer EV Sketches Show What Could Have Been,googlenews,2020-10-25 10:03:31
General Motors is investing $2 billion in electric vehicles — Here's what to know,googlenews,2020-10-25 10:03:31
"Coca-Cola discontinuing brands like Tab, Zico, Odwalla: full list - Business Insider",googlenews,2020-10-25 10:03:31
"Ta-ta, Tab: Coke is canceling 200 drink brands",googlenews,2020-10-25 10:03:31
Coca-Cola Is About To Break Out,googlenews,2020-10-25 10:03:31
McDonald’s fan creates live map to track every broken ice cream machine in America,googlenews,2020-10-25 10:03:31
Is your local McDonald's ice cream machine broken? A new map has the answer (finally).,googlenews,2020-10-25 10:03:31
Engineer makes website to check on status of McDonald's ice cream machines,googlenews,2020-10-25 10:03:31
Customer creates app to track which McDonald’s ice cream machines are broken,googlenews,2020-10-25 10:03:31
"SABIC Q3 net profit up 47% as sales volume rises, some impairments reversed",googlenews,2020-10-25 10:03:31
"Sabic Q3 net profit up 47% as sales volumes rise, some impairments reversed",googlenews,2020-10-25 10:03:31
"Saudi Arabia's Al Rajhi Bank reports 3% drop in Q3 profit, impairments up",googlenews,2020-10-25 10:03:31
Tony Roma’s to close up its last Hawaii restaurant,googlenews,2020-10-25 10:03:31
How much switching to an electric vehicle could really save you,googlenews,2020-10-25 10:03:31
Electric-car mania turns Asian battery makers into power brokers,googlenews,2020-10-25 10:03:31
"Tesla Semi update, GMC Hummer EV, battery tech teases, wireless charging: The Week in Reverse",googlenews,2020-10-25 10:03:31
Wall Street analysts tore down 7 competing electric-vehicle batteries — and say Tesla is once again leading th,googlenews,2020-10-25 10:03:31
What is short-term life insurance? Temporary coverage to fill the gap,googlenews,2020-10-25 10:03:31
Ford family members auctioning Bronco First Edition for charity,googlenews,2020-10-25 10:03:31
"2021 Ford Bronco Painted Hardtops Delayed, Price Dropped",googlenews,2020-10-25 10:03:31
KIMTEK® Corporation Included with Bronco® + Filson Wildland Fire Rig Concept,googlenews,2020-10-25 10:03:31
2021 Ford Bronco: How we'd spec it,googlenews,2020-10-25 10:03:31
Walmart Is Under Fire For Its Policies Around This Medication,googlenews,2020-10-25 10:03:31
Former US Attorney Sues DOJ for Walmart Over Opioid Policies | Texas Lawyer,googlenews,2020-10-25 10:03:31
Walmart Files Pre-emptive Lawsuit Against U.S. Government,googlenews,2020-10-25 10:03:31
Walmart files lawsuit seeking to prove its pharmacists are not responsible for opioid crisis,googlenews,2020-10-25 10:03:31
"Social media scams surging amid coronavirus pandemic, FTC reports",googlenews,2020-10-25 10:03:31
"BPD warns of phone scams, offers tips to protect yourself",googlenews,2020-10-25 10:03:31
"FTC: Social media scammers targeting shoppers, lovelorn, netted $117M",googlenews,2020-10-25 10:03:31
Social media isn't just for political fights; it's great for scams too,googlenews,2020-10-25 10:03:31
Detroit man wins $2 million after accidentally buying an extra lottery ticket,googlenews,2020-10-25 10:03:31
"Man buys extra lottery ticket by mistake, wins $2M",googlenews,2020-10-25 10:03:31
"'Bummed' Michigan man buys extra lottery ticket, wins $1 million twice",googlenews,2020-10-25 10:03:31
"Michigan man accidentally buys two lottery tickets, wins $1 million twice",googlenews,2020-10-25 10:03:31
"Dallas-based Studio Movie Grill files bankruptcy, citing ‘unparalleled impact from COVID-19’",googlenews,2020-10-25 10:03:31
AMC Entertainment is facing bankruptcy,googlenews,2020-10-25 10:03:31
Is an Outdated Business Model a Bigger Risk Than COVID-19 for AMC Entertainment Stock?,googlenews,2020-10-25 10:03:31
Theater chain Studio Movie Grill files for Chapter 11 bankruptcy,googlenews,2020-10-25 10:03:31
Wells Fargo: Transforming From a Value Buy to a Value Trap,googlenews,2020-10-25 10:03:31
Wells Fargo does U-turn on cutting perk for high-earning workers,googlenews,2020-10-25 10:03:31
Wells Fargo Is Weighing a Sale of Its Asset Management Business,googlenews,2020-10-25 10:03:31
Goldman Sachs named as a potential buyer of Wells asset management unit,googlenews,2020-10-25 10:03:31
Could Southwest Airlines Order The Airbus A220?,googlenews,2020-10-25 10:03:31
American Airlines Plans 737 MAX Tours to Boost Customer Confidence,googlenews,2020-10-25 10:03:31
American Accelerates Fleet Simplification – What Does This Mean?,googlenews,2020-10-25 10:03:31
Southwest Airlines looking for 737 max aternative as A220,googlenews,2020-10-25 10:03:31
"China central bank's draft law provides legal basis for digital currency, outlaws all digital tokens",googlenews,2020-10-25 10:03:31
"China Drafts Law to Legalize Digital Yuan, Outlawing Competitors",googlenews,2020-10-25 10:03:31
China Is Reconsidering Yuan Internationalization Strategy,googlenews,2020-10-25 10:03:31
"China will improve yuan flexibility, central bank governor says",googlenews,2020-10-25 10:03:31
Five men face COVID loan fraud charges,googlenews,2020-10-25 10:03:31
Guidance on PPP loan forgiveness still unclear | Lehigh Valley Regional News,googlenews,2020-10-25 10:03:31
Norfolk man pleads guilty to COVID-19 loan fraud scheme,googlenews,2020-10-25 10:03:31
"PPP loans add costs, delays to healthcare M&A",googlenews,2020-10-25 10:03:31
Analysis: Texas is one of the ‘most hated’ states in the nation,googlenews,2020-10-25 10:03:31
Analysis: New Jersey is the 'most hated' state in America,googlenews,2020-10-25 10:03:31
Report: Texas named among the 'most hated states' in America,googlenews,2020-10-25 10:03:31
Report ranks NJ as 'most hated state' and the state's Twitter account is having none of it,googlenews,2020-10-25 10:03:31
Daily Crunch: Uber and Lyft defeated again in court,googlenews,2020-10-25 10:03:31
"Uber drivers sue Uber, claiming app is coercing them into voting yes on anti-labor proposition",googlenews,2020-10-25 10:03:31
Uber And Lyft's California Reckoning Is Nearly Here,googlenews,2020-10-25 10:03:31
"Uber, Lyft must make drivers employees: Appeals Court",googlenews,2020-10-25 10:03:31
Moderna's chief medical officer explains why their vaccine is better,googlenews,2020-10-25 10:03:31
“I Have Done Humanity a Big Friggin’ Favor”,googlenews,2020-10-25 10:03:31
Better Coronavirus Stock: Moderna or Novavax?,googlenews,2020-10-25 10:03:31
Enrollment is complete for Moderna’s Phase 3 COVID-19 vaccine trial,googlenews,2020-10-25 10:03:31
Gold Forecast: XAU/USD at the Mercy of a Fiscal Stimulus Deal,googlenews,2020-10-25 10:03:31
"Gold gains on weaker dollar, virus woes ahead of US election",googlenews,2020-10-25 10:03:31
"Interest Rates and Gold Prices Rise vs Weak Dollar After Final US Debate, China Set to Stockpile Copper to 2025 | Gold News",googlenews,2020-10-25 10:03:31
"Gold slips below $1,900/oz as dollar stems declines",googlenews,2020-10-25 10:03:31
Chick-fil-A Will Be Releasing A Gift Pack Full Of Its Sauces That You Can Order For The Holidays,googlenews,2020-10-25 10:03:31
Chick-fil-A sauces will soon be sold at select grocery stores to help fund employee scholarships,googlenews,2020-10-25 10:03:31
Chick-fil-A sauce to be available in stores,googlenews,2020-10-25 10:03:31
Chick-fil-A sauces set to hit grocery shelves nationwide in early 2021,googlenews,2020-10-25 10:03:31
Here's a Black Friday preview and a look at what stores will be closed on Thanksgiving,googlenews,2020-10-25 10:03:31
LIST: These stores will be closed on Thanksgiving Day,googlenews,2020-10-25 10:03:31
"Best Black Friday TV deals 2020: Amazon, Best Buy, Walmart and more",googlenews,2020-10-25 10:03:31
Black Friday 2020 – Best Buy reveals incredible early deals – here are the best on offer,googlenews,2020-10-25 10:03:31
"US shows support for airline venture between Delta, WestJet",googlenews,2020-10-25 10:03:31
"U.S. government approves alliance between WestJet and Delta, with conditions",googlenews,2020-10-25 10:03:31
Canada’s airlines need a federal bailout before it’s too late — but all carriers should offer customers cash refunds first,googlenews,2020-10-25 10:03:31
"US signs off on Delta and WestJet partnership, if they give up LaGuardia slots",googlenews,2020-10-25 10:03:31
Gov. Abbott announces new Amazon Fulfillment Center site in Waco,googlenews,2020-10-25 10:03:31
It's official: Central Texas Amazon facility will create 1000 new jobs,googlenews,2020-10-25 10:03:31
"Abbott, Waco officials laud Amazon center promising 1,000 jobs",googlenews,2020-10-25 10:03:31
