headline,org,date
Jim Cramer on Morgan Stanley buying Eaton Vance for $7 billion,googlenews,2020-10-09 10:24:13
U.S. Unemployment Claims Remained Elevated Last Week,googlenews,2020-10-09 10:24:13
Avatar Airlines Wants British Airways' 747s,googlenews,2020-10-09 10:24:13
Southern California mortgage brokers suspected in fraudulent loan applications,googlenews,2020-10-09 10:24:13
"Potential COVID-19 vaccines not affected by dominant ""G-strain""",googlenews,2020-10-09 10:24:13
This Analyst Thinks Tesla Stock Is Headed to $578,googlenews,2020-10-09 10:24:13
What Mainers can expect when recreational marijuana sales start Friday,googlenews,2020-10-09 10:24:13
JetBlue's debt downgraded deeper into junk territory by Fitch,googlenews,2020-10-09 10:24:13
Southwest Airlines will have 12 new daily flights from MIA. Here are the details,googlenews,2020-10-09 10:24:13
Amazon shows off its new Rivian-built electric delivery van,googlenews,2020-10-09 10:24:13
Norway's Oil & Gas Strikes Could Take 25% Of Production Offline,googlenews,2020-10-09 10:24:13
"Lowe’s hosting trick-or-treat event with free pumpkin, candy for kids",googlenews,2020-10-09 10:24:13
Ruby Tuesday closes 185 restaurants after filing bankruptcy,googlenews,2020-10-09 10:24:13
Trump pushes FDA to speed review of Regeneron and Eli Lilly COVID-19 treatments: report,googlenews,2020-10-09 10:24:13
"Rocket Report: China unveils big rocket plans, SpaceX’s “secret” launch",googlenews,2020-10-09 10:24:13
COVID-19 cases in NYC continue to rise as city nears threshold,googlenews,2020-10-09 10:24:13
Boeing Is Reportedly Talking To Alaska Airlines About A 737 MAX Order,googlenews,2020-10-09 10:24:13
"Short-term pandemic-related costs ate into Domino's profit line, CEO says",googlenews,2020-10-09 10:24:13
Wall Street firms see Fed tapering bond buys starting next year,googlenews,2020-10-09 10:24:13
5 things to know before the stock market opens Friday,googlenews,2020-10-09 10:24:13
60 Employees Leave Coinbase Over CEO’s Pledge To Be Apolitical,googlenews,2020-10-09 10:24:13
Google’s Supreme Court faceoff with Oracle was a disaster for Google,googlenews,2020-10-09 10:24:13
COVID-19: Knox County turns 'orange' for first time in two months,googlenews,2020-10-09 10:24:13
French court backs media in landmark case against Google as they demand compensation for content,googlenews,2020-10-09 10:24:13
Justice Department rolls out report detailing cryptocurrency security threats | TheHill,googlenews,2020-10-09 10:24:13
Citi faces $400 million fine following executive shake up - Business Insider,googlenews,2020-10-09 10:24:13
"Kroger, one of America’s largest grocery chains, experiments with ghost kitchens and delivery in the Midwest",googlenews,2020-10-09 10:24:13
Ripple Enters Lending With XRP Credit Lines to Fund Global Payments - CoinDesk,googlenews,2020-10-09 10:24:13
Tesla Full Self-Driving Beta Update Expected In Weeks: Musk,googlenews,2020-10-09 10:24:13
"Audi teases electric e-tron GT production version, releases ‘progressive’ sound of the supercar",googlenews,2020-10-09 10:24:13
IBM CEO and executive chair on spinning off IT infrastructure unit,googlenews,2020-10-09 10:24:13
IBM to split into two companies by end of 2021,googlenews,2020-10-09 10:24:13
Boring IBM Just Got a Lot More Interesting,googlenews,2020-10-09 10:24:13
Opinion: Boring IBM just got a lot more interesting,googlenews,2020-10-09 10:24:13
LSE Will Sell Borsa Italiana To Euronext. Why It's Good News All Around,googlenews,2020-10-09 10:24:13
Host of Elite Firms Bag Roles On €4B Borsa Italiana Sale,googlenews,2020-10-09 10:24:13
The London Stock Exchange is selling Italy's only stock market platform to Euronext for $5 billion | Markets,googlenews,2020-10-09 10:24:13
LSE agrees to sell Borsa Italiana to Euronext for 4.3 billion euros,googlenews,2020-10-09 10:24:13
What the U.S. election means for Europe,googlenews,2020-10-09 10:24:13
How Trump’s presidency has helped the EU,googlenews,2020-10-09 10:24:13
"Trump or Biden, the U.S. and Europe Will Split",googlenews,2020-10-09 10:24:13
European Stocks Mixed; Virus Surge Competes with U.S. Stimulus Hopes,googlenews,2020-10-09 10:24:13
"Trump's ""miracle"" COVID-19 treatment was developed using cells derived from an aborted fetus: report",googlenews,2020-10-09 10:24:13
Fact check: Trump's antibody therapy not made from fetal stem cells but fetal-derived cells used during testing,googlenews,2020-10-09 10:24:13
Antibody Drugs Touted by Trump Could Be Next to Get Authorized for Covid-19,googlenews,2020-10-09 10:24:13
COVID-19 drug trial looking for participants,googlenews,2020-10-09 10:24:13
Netflix is pushing for huge international expansion after successes with 'Sex Education' and 'The Crown',googlenews,2020-10-09 10:24:13
Netflix to triple London office space as it cashes in on British success stories,googlenews,2020-10-09 10:24:13
AMD Is in Advanced Talks to Buy Xilinx,googlenews,2020-10-09 10:24:13
AMD nearing potential $30 billion deal to buy rival chip maker Xilinx,googlenews,2020-10-09 10:24:13
AMD Reportedly In Advanced Talks To Buy Xilinx for Roughly $30 Billion,googlenews,2020-10-09 10:24:13
A Peek Into The Markets: US Stock Futures Up; AMD In Talks To Buy Xilinx,googlenews,2020-10-09 10:24:13
"Gilead's remdesivir shaved five days off COVID-19 recovery time, reduced risk of death in some",googlenews,2020-10-09 10:24:13
Gilead CEO: 'We have ample supply' of remdesivir for hospitalized coronavirus patients,googlenews,2020-10-09 10:24:13
Gilead CEO on promising study results for remdesivir Covid-19 treatment,googlenews,2020-10-09 10:24:13
Final Results of National Institute of Allergy and Infectious Diseases’ ACTT-1 Trial Published in New England Journal of Medicine Expand Clinical Benefits of Veklury® (remdesivir) for the Treatment of COVID-19,googlenews,2020-10-09 10:24:13
"Target, Walmart announce deals on Amazon Prime Day l GMA",googlenews,2020-10-09 10:24:13
"Best Buy misreads calendar, thinks Black Friday starts next Tuesday",googlenews,2020-10-09 10:24:13
"Early Prime Day deals live now: cheapest-ever Echo Show 5 now $45, Nintendo Switch in stock and more",googlenews,2020-10-09 10:24:13
"Best early Prime Day deals 2020: Sales on smart home devices, Galaxy phones, headphones, & more",googlenews,2020-10-09 10:24:13
Johnson & Johnson to supply up to 400M doses of potential COVID-19 vaccine to EU,googlenews,2020-10-09 10:24:13
HHS Secretary Azar says U.S. could have enough coronavirus vaccine doses for every American by March,googlenews,2020-10-09 10:24:13
Op-Ed: Politics and public acceptance of a COVID-19 vaccine,googlenews,2020-10-09 10:24:13
7 looming questions about the rollout of a Covid-19 vaccine - STAT,googlenews,2020-10-09 10:24:13
Qatar Airways Plans to Expand Network to 124 Destinations by End of 2020,googlenews,2020-10-09 10:24:13
Qatar Airways offer evokes huge response from teachers,googlenews,2020-10-09 10:24:13
Limited Edition Rolls Royce Ghost Rolls Into DFW,googlenews,2020-10-09 10:24:13
Rolls Royce's shares post record week on capital raising push,googlenews,2020-10-09 10:24:13
Moderna Vows to Not Enforce Covid-19 Vaccine Patents During Pandemic,googlenews,2020-10-09 10:24:13
"Moderna vaccine trial in Boston going ‘extremely well,’ still looking for more participants",googlenews,2020-10-09 10:24:13
Merck kicks back rights to early-phase RSV jab to Moderna,googlenews,2020-10-09 10:24:13
Moderna signs defense contract to create mobile vaccine manufacturing,googlenews,2020-10-09 10:24:13
"Waymo finally launches an actual public, driverless taxi service",googlenews,2020-10-09 10:24:13
Waymo starts to open driverless ride-hailing service to the public,googlenews,2020-10-09 10:24:13
Ride in a car without a driver in Chandler and more local news,googlenews,2020-10-09 10:24:13
Waymo to launch fully driverless service to the public — a first just in time for the pandemic,googlenews,2020-10-09 10:24:13
JPMorgan pledges $30 billion to address racial wealth gap,googlenews,2020-10-09 10:24:13
JPMorgan pledges $5 million to help diverse Philly workers and businesses,googlenews,2020-10-09 10:24:13
JPMorgan Chase is making massive $30 billion investment in racial equity in the US | TheHill,googlenews,2020-10-09 10:24:13
JPMorgan Chase makes $30 billion commitment to help close America's racial wealth gap,googlenews,2020-10-09 10:24:13
Child with negative test spreads COVID to 11 family members,googlenews,2020-10-09 10:24:13
Drive thru pop-up COVID-19 testing sites open across Monterey County,googlenews,2020-10-09 10:24:13
Hy-Vee expands drive-up COVID-19 tests to over 150 pharmacies,googlenews,2020-10-09 10:24:13
United Supermarkets pharmacies now offering at-home COVID-19 testing kits,googlenews,2020-10-09 10:24:13
Yelp says it will now alert users to businesses who have been accused of racist behavior,googlenews,2020-10-09 10:24:13
Yelp flagging businesses accused of racism on its review platform,googlenews,2020-10-09 10:24:13
Yelp Says It Will Mark Pages of Businesses Accused of Racist Conduct,googlenews,2020-10-09 10:24:13
Yelp to label businesses accused of 'racist behavior' amid discrimination uptick,googlenews,2020-10-09 10:24:13
"SBA and Treasury Announce Simpler PPP Forgiveness for Loans of $50,000 or Less",googlenews,2020-10-09 10:24:13
PPP loan meant to help small businesses stay open went instead to buying gift cards,googlenews,2020-10-09 10:24:13
"Paycheck Protection Program scam: Some federal funds administered during COVID-19 pandemic stolen by criminals, FBI says",googlenews,2020-10-09 10:24:13
Covid Is Crushing Small Businesses. That’s Bad News for American Innovation.,googlenews,2020-10-09 10:24:13
"First Came Flights to Nowhere. Now, This",googlenews,2020-10-09 10:24:13
"Singapore Will Launch Cruises Again, But With No Destinations",googlenews,2020-10-09 10:24:13
"Singapore restarting cruises: Boost for economy, but not plain sailing",googlenews,2020-10-09 10:24:13
Singapore launches luxury cruises to nowhere,googlenews,2020-10-09 10:24:13
Regeneron asks FDA for emergency approval of COVID-19 antibody treatment given to Trump,googlenews,2020-10-09 10:24:13
Trump is promising free antibody treatments for everyone. It won’t be that simple.,googlenews,2020-10-09 10:24:13
"As Trump hails Regeneron treatment, his administration tries to block the science it used",googlenews,2020-10-09 10:24:13
"Trump's claim to have been ""cured"" of COVID-19 is ""bombastic"" and not based in fact, experts say",googlenews,2020-10-09 10:24:13
Central bank digital currencies: foundational principles and core features,googlenews,2020-10-09 10:24:13
Central banks sketch out digital currency as China forges ahead,googlenews,2020-10-09 10:24:13
Bank of Japan to begin digital currency proof-of-concept in 2021,googlenews,2020-10-09 10:24:13
Central banks and BIS publish first central bank digital currency (CBDC) report laying out key requirements,googlenews,2020-10-09 10:24:13
"UK economy grew less than expected in August, as recovery from the coronavirus pandemic slows",googlenews,2020-10-09 10:24:13
"UK economy stumbles in August, clouding recovery",googlenews,2020-10-09 10:24:13
U.K. economy records slowest GDP rise since pandemic,googlenews,2020-10-09 10:24:13
The UK economic recovery is running out of steam - GDP grew just 2.1% in August despite government support | Markets,googlenews,2020-10-09 10:24:13
"280,000 ceiling fans sold at Lowe’s are being recalled",googlenews,2020-10-09 10:24:13
280000 ceiling fans sold at Lowe's are being recalled,googlenews,2020-10-09 10:24:13
Recall on Lowe's ceiling fan,googlenews,2020-10-09 10:24:13
"Ceiling fans sold at Lowe's recalled over falling, injury hazard",googlenews,2020-10-09 10:24:13
"Microsoft's 150,000 employees can work from home permanently: report - Business Insider",googlenews,2020-10-09 10:24:13
Microsoft reportedly letting employees work from home permanently,googlenews,2020-10-09 10:24:13
Microsoft Tells Employees That They Can Work From Home Permanently,googlenews,2020-10-09 10:24:13
Microsoft: Most employees can work from home less than 50 percent of the time,googlenews,2020-10-09 10:24:13
Covid drug given to Trump developed using cells derived from aborted fetus,googlenews,2020-10-09 10:24:13
Fact Check: Here's the Deal With Trump's Antibody Cocktail and Fetal Cells,googlenews,2020-10-09 10:24:13
Trump's COVID drug was developed using aborted fetal tissue,googlenews,2020-10-09 10:24:13
Covid drug used to treat Trump was tested using foetus cells,googlenews,2020-10-09 10:24:13
Person in custody in suspicious death case in Virginia Beach,googlenews,2020-10-09 10:24:13
USPS investigating after undelivered mail found in dumpster in Virginia Beach,googlenews,2020-10-09 10:24:13
Man charged with murder after woman found dead in Virginia Beach,googlenews,2020-10-09 10:24:13
ODU reports coronavirus outbreak at residence hall,googlenews,2020-10-09 10:24:13
WarnerMedia Plans Thousands of Job Cuts in Restructuring,googlenews,2020-10-09 10:24:13
TNT Reportedly To Be Affected As WarnerMedia Looks To Cut Thousands Of Jobs,googlenews,2020-10-09 10:24:13
"WarnerMedia, Its Ranks Already Thinner, Looks To Shed Thousands More Jobs Amid COVID-19",googlenews,2020-10-09 10:24:13
WarnerMedia plans thousands of job cuts in restructuring - WSJ,googlenews,2020-10-09 10:24:13
Chevron (CVX) Announces Noble Energy Acquisition Deal Closure,googlenews,2020-10-09 10:24:13
Virgin Hyperloop picks West Virginia to test system,googlenews,2020-10-09 10:24:13
Virgin Hyperloop selects West Virginia to test its futuristic transport system,googlenews,2020-10-09 10:24:13
West Virginia's higher education system expects to be intertwined with Virgin Hyperloop,googlenews,2020-10-09 10:24:13
Hyperloop test track sought by Missouri heading to West Virginia instead,googlenews,2020-10-09 10:24:13
Dollar General to open new stores targeting wealthier shoppers,googlenews,2020-10-09 10:24:13
"Dollar General targets a higher-end shopper in the suburbs with new store, Popshelf",googlenews,2020-10-09 10:24:13
Dollar General takes aim at more affluent shoppers with a new chain called ‘popshelf’,googlenews,2020-10-09 10:24:13
Dollar General hopes to lure suburban women to new store ‘Popshelf’,googlenews,2020-10-09 10:24:13
Fact check: Pence says there are no more hurricanes now than 100 years ago,googlenews,2020-10-09 10:24:13
Trust Index: Pence says no more hurricanes today than 100 years ago,googlenews,2020-10-09 10:24:13
When asked about climate change Mike pence gave this WILD answer,googlenews,2020-10-09 10:24:13
Feds say August derecho was $1 billion disaster,googlenews,2020-10-09 10:24:13
"Square buys $50 million in bitcoin, says cryptocurrency 'aligns with company's purpose'",googlenews,2020-10-09 10:24:13
Twitter's Jack Dorsey reveals how and why Square invested $50 million into a block of nearly 5000 bitcoins | Currency News | Financial and Business News | Markets Insider,googlenews,2020-10-09 10:24:13
Market Wrap: Bitcoin Surges on Square News to $10.9K; December Ether Options Pile Up - CoinDesk,googlenews,2020-10-09 10:24:13
"Bitcoin price breaks $11K, crypto traders optimistic about BTC’s action",googlenews,2020-10-09 10:24:13
"With $20 billion in deals this year, Morgan Stanley pivots further away from risky Wall Street",googlenews,2020-10-09 10:24:13
Morgan Stanley's Gorman on $7 Billion Eaton Vance Deal,googlenews,2020-10-09 10:24:13
Morgan Stanley Gets Just What It Wanted in Eaton Vance,googlenews,2020-10-09 10:24:13
Morgan Stanley to Buy Eaton Vance for $7 Billion,googlenews,2020-10-09 10:24:13
840000 Americans File For First-Time Unemployment Benefits | NBC News NOW,googlenews,2020-10-09 10:24:13
Jobless claims were worse than expected amid slowdown in hiring,googlenews,2020-10-09 10:24:13
"U.S. weekly jobless claims total 840000, vs 825000 estimate",googlenews,2020-10-09 10:24:13
There are two U.S. labor markets: Morning Brief,googlenews,2020-10-09 10:24:13
British Airways retires its final Boeing 747 airplane,googlenews,2020-10-09 10:24:13
British Airways 'Queen of Skies' jumbos bid farewell | WION News | World News,googlenews,2020-10-09 10:24:13
Only 35 Passenger Boeing 747s Remain In Service,googlenews,2020-10-09 10:24:13
British Airways' last two 747 jumbo jets take-off,googlenews,2020-10-09 10:24:13
Refinance and mortgage loans booming in Maine,googlenews,2020-10-09 10:24:13
Should you roll your student loans into your mortgage?,googlenews,2020-10-09 10:24:13
Red-hot home prices have more consumers saying now is a bad time to buy,googlenews,2020-10-09 10:24:13
"30-Year Interest Rates for October 9, 2020 | Rates dip",googlenews,2020-10-09 10:24:13
Tesla’s 4680 battery cell production facility is ramping its operations,googlenews,2020-10-09 10:24:13
Tesla’s robot snake charger is not dead yet,googlenews,2020-10-09 10:24:13
"2021 Tesla Model 3 Getting A Few Upgrades, Here’s What To Expect From The Electric Sedan",googlenews,2020-10-09 10:24:13
"Tesla “snake charger” wasn’t just a creepy one-off, suggests Elon Musk",googlenews,2020-10-09 10:24:13
Maine prepares for opening of retail marijuana shops,googlenews,2020-10-09 10:24:13
A long road: Weed goes on sale years after approval in Maine,googlenews,2020-10-09 10:24:13
Adults can now buy recreational marijuana in Maine,googlenews,2020-10-09 10:24:13
Eliot’s Sweet Dirt digs in for Maine’s marijuana market,googlenews,2020-10-09 10:24:13
Rating agencies positive on Serba Dinamik's planned bond buyback,googlenews,2020-10-09 10:24:13
Serba Dinamik among Fitch Ratings' top 50 Asian high-yield corporate issuers,googlenews,2020-10-09 10:24:13
Fitch warns of steep path without tourists,googlenews,2020-10-09 10:24:13
Southwest Airlines Will Start Nonstop Flights From BWI To Miami In November,googlenews,2020-10-09 10:24:13
Southwest to begin non-stop service from Oakland to Palm Springs,googlenews,2020-10-09 10:24:13
Southwest Airlines to fly between Oakland and Palm Springs for $79 roundtrip,googlenews,2020-10-09 10:24:13
Southwest Airlines Announces Seasonal Flights To Telluride Starting In December,googlenews,2020-10-09 10:24:13
Amazon unveils its new electric delivery vans built by Rivian,googlenews,2020-10-09 10:24:13
"Amazon unveils its first custom, all-electric delivery van from Rivian",googlenews,2020-10-09 10:24:13
Check out Amazon’s newly unveiled electric delivery truck,googlenews,2020-10-09 10:24:13
Amazon Reveals Its First Customized All-Electric Delivery Vehicle,googlenews,2020-10-09 10:24:13
Norway oil strike could hit international markets,googlenews,2020-10-09 10:24:13
Oil heads for weekly gain amid Norwegian supply cut,googlenews,2020-10-09 10:24:13
US oil-export projects stall,googlenews,2020-10-09 10:24:13
Hurricane Delta shuts most U.S. offshore oil output in 15 years,googlenews,2020-10-09 10:24:13
"Rheumatoid arthritis drug cuts coronavirus deaths in clinical trial, Eli Lilly says",googlenews,2020-10-09 10:24:13
Coronavirus treatment: Regeneron and Eli Lilly seek EUA clearance for antibody treatment,googlenews,2020-10-09 10:24:13
Trump Says Eli Lilly Drug to Be Approved And He’s Not Contagious,googlenews,2020-10-09 10:24:13
Eli Lilly Seeks EUA Use For Antibody Treatment,googlenews,2020-10-09 10:24:13
The pandemic lifted Domino's sales. But that's not the full story,googlenews,2020-10-09 10:24:13
Domino's Pizza Inc (DPZ) Q3 2020 Earnings Call Transcript,googlenews,2020-10-09 10:24:13
Domino's Pizza CEO: More expenses to operate in the coroaonvirus world,googlenews,2020-10-09 10:24:13
Drive-thru dominates even as dine-in restrictions ease,googlenews,2020-10-09 10:24:13
Fed Officials Maintain Calls for Fiscal Aid to Protect Recovery,googlenews,2020-10-09 10:24:13
"With no expectation of fiscal stimulus soon, Fed's Rosengren sees recovery hampered",googlenews,2020-10-09 10:24:13
Will someone please listen to the Federal Reserve chairman? | COMMENTARY,googlenews,2020-10-09 10:24:13
Jerome Powell’s Big Political Gamble,googlenews,2020-10-09 10:24:13
Dow Jones Futures Rise As President Trump Reportedly Wants 'Big Deal' On Stimulus Again; Alibaba Leads Three Breakouts,googlenews,2020-10-09 10:24:13
"Stimulus hopes lift futures, S&P 500 set for second straight weekly gain",googlenews,2020-10-09 10:24:13
Donald Trump & His Supposed Economic Success,googlenews,2020-10-09 10:24:13
10 things you need to know before the opening bell | Markets Insider,googlenews,2020-10-09 10:24:13
Crypto CEO shows workers who disagree with ‘apolitical’ mission the door,googlenews,2020-10-09 10:24:13
5% of Coinbase Employees Take Severance Offer Over 'Apolitical' Stance - CoinDesk,googlenews,2020-10-09 10:24:13
Coinbase to lose scores of staffers over politics ban,googlenews,2020-10-09 10:24:13
Coinbase CEO says 'about 5% of employees' have taken severance packages after controversial 'mission' post,googlenews,2020-10-09 10:24:13
U.S. Supreme Court divided over Google’s bid to end Oracle’s Android copyright lawsuit,googlenews,2020-10-09 10:24:13
Supreme Court hears copyright battle between Google and Oracle,googlenews,2020-10-09 10:24:13
Today’s Supreme Court Hearing On A $9 Billion Case Involving Oracle And Google Could Reshape The Software Industry,googlenews,2020-10-09 10:24:13
6 Takeaways From Google v. Oracle at SCOTUS | National Law Journal,googlenews,2020-10-09 10:24:13
"Knox County Health Dept.: Region COVID-19 hospitalizations hit record high; hospitals urge public to get tested, follow guidelines",googlenews,2020-10-09 10:24:13
Knox County Health Department update on COVID-19,googlenews,2020-10-09 10:24:13
'We are very concerned' | More people are being hospitalized for COVID-19 in East Tennessee,googlenews,2020-10-09 10:24:13
KCHD 'very concerned' as Knox Co. reports highest number of hospitalizations since beginning of pandemic,googlenews,2020-10-09 10:24:13
"Google must talk to French publishers about paying for their content, court says",googlenews,2020-10-09 10:24:13
"Google must negotiate pay with publishers for content, French court rules",googlenews,2020-10-09 10:24:13
"Google must negotiate to pay for French news, appeals court confirms",googlenews,2020-10-09 10:24:13
Google to Pay $1 Billion to News Publishers,googlenews,2020-10-09 10:24:13
DOJ Warns of Possible ‘Oncoming Storm’ in Report Detailing Dangers of Terrorist Use of Crypto,googlenews,2020-10-09 10:24:13
U.S. Justice Department publishes cryptocurrency 'enforcement framework',googlenews,2020-10-09 10:24:13
Community reacts to new DoJ crypto enforcement guidelines,googlenews,2020-10-09 10:24:13
The DOJ Takes Aim at Privacy in New Crypto Framework - CoinDesk,googlenews,2020-10-09 10:24:13
Citigroup fined $400 million over 'longstanding' internal failures,googlenews,2020-10-09 10:24:13
"Citigroup fine 'another black mark,' analyst says — but it's not 'life threatening'",googlenews,2020-10-09 10:24:13
Citibank fined $400 million,googlenews,2020-10-09 10:24:13
Citigroup Is Slapped with a $400 Million Fine for Doing Something So Bad It Can't Be Spoken Out Loud,googlenews,2020-10-09 10:24:13
Kroger launches ghost kitchen delivery in Midwest,googlenews,2020-10-09 10:24:13
"Kroger to add ghost kitchens at stores for meal pickup, delivery",googlenews,2020-10-09 10:24:13
Kroger brings ClusterTruck 'ghost kitchens' on-premise for meal delivery,googlenews,2020-10-09 10:24:13
"ClusterTruck, Kroger Launch New 'Ghost Kitchens'",googlenews,2020-10-09 10:24:13
Ripple launches 'Line of Credit' — to provide loans in XRP,googlenews,2020-10-09 10:24:13
Ripple co-founder: XRP price is not tied to On-Demand Liquidity,googlenews,2020-10-09 10:24:13
"Ethereum, Litecoin, and Ripple's XRP – Daily Tech Analysis – October 9th, 2020",googlenews,2020-10-09 10:24:13
"XRP: Three Heads Are Better Than One, But Could Mean No New ATH Until 2023",googlenews,2020-10-09 10:24:13
Tesla is doing a Model 3 refresh and we’ve seen it,googlenews,2020-10-09 10:24:13
"Tesla's new battery will contribute to 'significant production risk' at Berlin factory, Musk says",googlenews,2020-10-09 10:24:13
Wrong turn: Four reasons why Tesla ditching its PR team may backfire,googlenews,2020-10-09 10:24:13
"Elon Musk is pushing to build 500,000 vehicles this year - Business Insider",googlenews,2020-10-09 10:24:13
2021 Audi E Tron GT Teaser 6,googlenews,2020-10-09 10:24:13
"Audi Reveals e-tron GT Prototype, Shows Factory Where It Will Be Built",googlenews,2020-10-09 10:24:13
New Audi e-tron GT ride review,googlenews,2020-10-09 10:24:13
Audi e-tron GT Sound Teased - You're Going to Need Your Headphones for This,googlenews,2020-10-09 10:24:13
4 Great Stocks You Can Buy With $300,motleyfool,2020-10-09 10:26:13
These 3 Stocks Are Absurdly Overvalued Right Now,motleyfool,2020-10-09 10:26:13
2 Top Growth Stocks to Buy Right Now,motleyfool,2020-10-09 10:26:13
What the Stock Market Did Last Time There Was a Contested Election,motleyfool,2020-10-09 10:26:13
3 Reasons Electronic Arts Is a Buy,motleyfool,2020-10-09 10:26:13
Roku Channel's Availability on Amazon Fire TV Could Vastly Expand Its Reach,motleyfool,2020-10-09 10:26:13
Microsoft Takes Shots at Apple in New App Store Principles,motleyfool,2020-10-09 10:26:13
Why I'm Buying More Anaplan Stock,motleyfool,2020-10-09 10:26:13
5 Rules for Claiming Social Security on Your Ex-Spouse After Divorce,motleyfool,2020-10-09 10:26:13
"If You Invested $5,000 in Peloton's IPO, This Is How Much Money You'd Have Now",motleyfool,2020-10-09 10:26:13
These 3 Stocks Are Absurdly Overvalued Right Now,motleyfool,2020-10-09 10:26:13
"Why Centennial Resource Development, QEP Resources, and Northern Oil and Gas Rocketed as Much as 20% Thursday",motleyfool,2020-10-09 10:26:13
Three Pitfalls of Only Using a 401(k) for Retirement,motleyfool,2020-10-09 10:26:13
Are Banks Reserving Enough for Commercial Real Estate Default Risk?,motleyfool,2020-10-09 10:26:13
Ad-Supported Alternatives Are Starting to Chip Away at Netflix's Dominance,motleyfool,2020-10-09 10:26:13
