headline,org,date
Coronavirus tracked: the latest figures as countries fight Covid-19 resurgence | Free to read,financialtimes,2020-09-03 08:58:11
Amazon to increase UK workforce by a third this year,financialtimes,2020-09-03 08:58:11
Pandemic crisis: Global economic recovery tracker ,financialtimes,2020-09-03 08:58:11
Airbnb turns down approach from Bill Ackman Spac,financialtimes,2020-09-03 08:58:11
US puts new restrictions on Chinese diplomats,financialtimes,2020-09-03 08:58:11
Joe Biden raises a record $364.5m in August ,financialtimes,2020-09-03 08:58:11
"US corporate bond issuance hits $1.919tn in 2020, beating full-year record",financialtimes,2020-09-03 08:58:11
Coronavirus tracked: the latest figures as countries fight Covid-19 resurgence | Free to read,financialtimes,2020-09-03 08:58:11
Pandemic crisis: Global economic recovery tracker ,financialtimes,2020-09-03 08:58:11
"Alexei Navalny poisoned with nerve agent novichok, says Germany",financialtimes,2020-09-03 08:58:11
UK economic recovery tracker: the latest activity data,financialtimes,2020-09-03 08:58:11
UK house prices surge to record high,financialtimes,2020-09-03 08:58:11
Home truths in the eastern Mediterranean,financialtimes,2020-09-03 08:58:11
Fed’s inflation shift is another blow to ‘safe’ assets,financialtimes,2020-09-03 08:58:11
What my first flight for four months told me about the future of travel,financialtimes,2020-09-03 08:58:11
Poland needs a clear plan for kicking a dirty habit,financialtimes,2020-09-03 08:58:11
K-pop/Big Hit: family matters,financialtimes,2020-09-03 08:58:11
Are the winds blowing in Biden’s favour? ,financialtimes,2020-09-03 08:58:11
Scots should ask hard questions on independence,financialtimes,2020-09-03 08:58:11
The strange comfort of a five-eyed monster,financialtimes,2020-09-03 08:58:11
Donald Trump has dragged Joe Biden on to his own turf,financialtimes,2020-09-03 08:58:11
Will the pandemic bring high-rise service charges back to earth?,financialtimes,2020-09-03 08:58:11
Monty Don: ‘I wouldn’t sell my spade for a million pounds’,financialtimes,2020-09-03 08:58:11
Why cities must make more of their rivers,financialtimes,2020-09-03 08:58:11
"Kings Arms, Mevagissey: ‘One mouthful is honestly enough to justify the trip’ — restaurant review",financialtimes,2020-09-03 08:58:11
Six films to watch this week,financialtimes,2020-09-03 08:58:11
Putting existential risk on the agenda,financialtimes,2020-09-03 08:58:11
"Strong euro woes, DHL on Vaccine access, KKR eyes Japan",financialtimes,2020-09-03 08:58:11
Why India is struggling to cope with Covid-19,financialtimes,2020-09-03 08:58:11
Why India is struggling to cope with Covid-19,financialtimes,2020-09-03 08:58:11
China and the US: the arms race in space,financialtimes,2020-09-03 08:58:11
Why TikTok and WeChat are the new front line in the US-China tech war,financialtimes,2020-09-03 08:58:11
How Venezuela's oil industry collapsed,financialtimes,2020-09-03 08:58:11
Future of work: how managers are harnessing employees’ hidden skills ,financialtimes,2020-09-03 08:58:11
The US and climate: New York’s bold green plans hit opposition ,financialtimes,2020-09-03 08:58:11
FT Health: Holding governments to account for Covid-19 response,financialtimes,2020-09-03 08:58:11
Why Warren Buffett is gambling on Japan’s distinctive dealmakers ,financialtimes,2020-09-03 08:58:11
EU sounds alarm on critical raw materials shortages,financialtimes,2020-09-03 08:58:11
Tata: transforming a conglomerate for India and the world ,financialtimes,2020-09-03 08:58:11
Hong Kong steps up currency interventions to most since 2009,financialtimes,2020-09-03 08:58:11
Euro weakens as ECB policymakers grow wary of recent rally,financialtimes,2020-09-03 08:58:11
Laos faces sovereign default as forex reserves dip below $1bn ,financialtimes,2020-09-03 08:58:11
"US corporate bond issuance hits $1.919tn in 2020, beating full-year record",financialtimes,2020-09-03 08:58:11
Investors pounce on Germany’s first green bond sale,financialtimes,2020-09-03 08:58:11
Greek debt sale ‘bodes well’ for busy eurozone issuance,financialtimes,2020-09-03 08:58:11
Facebook bans Indian ruling party politician for extremist content ,financialtimes,2020-09-03 08:58:11
Coronavirus drives UK authorities to embrace electric scooters,financialtimes,2020-09-03 08:58:11
Amazon to increase UK workforce by a third this year,financialtimes,2020-09-03 08:58:11
Speculation in tech stocks points to wild swings,financialtimes,2020-09-03 08:58:11
Tech implants health warning,financialtimes,2020-09-03 08:58:11
India bans 118 Chinese apps as Himalayan border tensions surge ,financialtimes,2020-09-03 08:58:11
Currency’s appreciation could lead to central bank cutting its inflation forecast,financialtimes,2020-09-03 08:58:11
Markets predict elevated volatility after burst of trading in call options on Apple and Tesla,financialtimes,2020-09-03 08:58:11
"Pandemic has unlocked big opportunities, says US private equity group’s Tokyo chief",financialtimes,2020-09-03 08:58:11
Surge in payments sparks claims Trump is trying to buy agricultural vote ahead of election,financialtimes,2020-09-03 08:58:11
An ideological contest rages between Reaganite libertarians and post-Trump conservatives,financialtimes,2020-09-03 08:58:11
"As profession-based privilege supplants hereditary privilege, three new books champion essential blue-collar skills",financialtimes,2020-09-03 08:58:11
Economists worry that parents will need to leave the workforce to teach their children,financialtimes,2020-09-03 08:58:11
"US city of 100,000 residents has faced days of unrest following shooting of Jacob Blake ",financialtimes,2020-09-03 08:58:11
Islamist insurgency threatens development of vast offshore gasfields,financialtimes,2020-09-03 08:58:11
Critics warn of complacency but Bern believes the country must learn to live with virus,financialtimes,2020-09-03 08:58:11
Lenders bankroll largest fossil fuel producers and users as carbon pledges fail to make a dent,financialtimes,2020-09-03 08:58:11
Research reveals how action for gender parity could add trillions to economies,financialtimes,2020-09-03 08:58:11
Health secretary Matt Hancock fears return to more serious phase of coronavirus pandemic,financialtimes,2020-09-03 08:58:11
"New Delhi keen to reopen economy despite confirming 83,000 infections in 24 hours",financialtimes,2020-09-03 08:58:11
Two-thirds of world unlikely to have easy access to vaccines requiring frozen storage,financialtimes,2020-09-03 08:58:11
Accommodation booking business continues to plan traditional IPO for now,financialtimes,2020-09-03 08:58:11
Tensions between Washington and Beijing are rising ahead of US election,financialtimes,2020-09-03 08:58:11
Majority of Democratic candidate’s contributions came from small online donations ,financialtimes,2020-09-03 08:58:11
Companies have rushed to raise cash in a debt market boosted by the Fed,financialtimes,2020-09-03 08:58:11
Europe can no longer rely on the US to act as referee in the Greek stand-off with Turkey,financialtimes,2020-09-03 08:58:11
Toby Ord talks to Gideon Rachman about his book The Precipice,financialtimes,2020-09-03 08:58:11
The euro’s rise is worrying top policymakers at the European Central Bank,financialtimes,2020-09-03 08:58:11
Some businesses are applying the lessons of lockdown to introduce new ways of organising and overseeing work,financialtimes,2020-09-03 08:58:11
The state’s ambitious goals to cut emissions are being slowed by a tortuous planning process ,financialtimes,2020-09-03 08:58:11
"Nigeria’s Chikwe Ihekweazu on polio, coronavirus trajectory, vaccine vexation",financialtimes,2020-09-03 08:58:11
City’s monetary authority has sold HK$132bn this year to steady the exchange rate,financialtimes,2020-09-03 08:58:11
Currency depreciation helps power European stocks higher,financialtimes,2020-09-03 08:58:11
Finance ministry asks China for advice on restructuring its debt,financialtimes,2020-09-03 08:58:11
BJP’s Raja Singh accused of posting hate material against Rohingya refugees and Muslims  ,financialtimes,2020-09-03 08:58:11
"After years as a closed market, thousands of e-scooters will hit British streets in the coming weeks",financialtimes,2020-09-03 08:58:11
"Ecommerce group to add 7,000 more engineers, pickers and packers by year-end in response to rising online demand",financialtimes,2020-09-03 08:58:11
Euro weakens as ECB policymakers grow wary of recent rally,financialtimes,2020-09-03 08:58:11
Fresh jolt of Brexit uncertainty knocks sterling versus dollar ,financialtimes,2020-09-03 08:58:11
Investors have never been more bullish on the euro,financialtimes,2020-09-03 08:58:11
Jobless Claims Below 1 Million Under New Labor Department Tally,thestreet,2020-09-03 09:00:09
Novavax Gains Following Promising Covid-19 Vaccine Trials,thestreet,2020-09-03 09:00:09
Sanofi Fast-Tracking Covid-19 Vaccine to Human Trials,thestreet,2020-09-03 09:00:09
Robinhood Faces SEC Fraud Investigation: Report,thestreet,2020-09-03 09:00:09
Jim Cramer: My Top Five Market Takeaways,thestreet,2020-09-03 09:00:09
Rev Shark: Appetite to Put Liquidity to Work in Stocks Remains Strong,thestreet,2020-09-03 09:00:09
Collins: Why Investing in Tesla Is a Bit Like Texas Hold 'Em Poker,thestreet,2020-09-03 09:00:09
"Guilfoyle: Waves of Buying, Above-Average Indices, Vaccine Mania",thestreet,2020-09-03 09:00:09
Kass: Did I Have My Stan Druckenmiller Moment Wednesday?,thestreet,2020-09-03 09:00:09
Rocket Sinks Following First Post-IPO Earnings Report,thestreet,2020-09-03 09:00:09
The Importance of Apple to All Stock Investors,thestreet,2020-09-03 09:00:09
"Zoom CEO: Offices Are Coming Back, But Will Look Very Different Post-COVID",thestreet,2020-09-03 09:00:09
Watch: How Nvidia Extended Its Lead Over Competitors,thestreet,2020-09-03 09:00:09
Why Investors Should Consider Adding a Cybersecurity Stock to Their Portfolios,thestreet,2020-09-03 09:00:09
Why Exxon's Job Cuts Are 'A Sign of the Times',thestreet,2020-09-03 09:00:09
Tesla Begins Sending Battery Day Invitations,thestreet,2020-09-03 09:00:09
Apple Makes a Case for Its App Store,thestreet,2020-09-03 09:00:09
What's Going on in the Markets? A Must Read ZH Explanation,thestreet,2020-09-03 09:00:09
GameStop Defies the Odds,thestreet,2020-09-03 09:00:09
Retirement Savings Solutions to Weather Stormy Markets,thestreet,2020-09-03 09:00:09
How Advisers Can Help Clients Integrate ESG Factors,thestreet,2020-09-03 09:00:09
How Financial Advisers Can Help Widows and Widowers,thestreet,2020-09-03 09:00:09
How the Jobs Report Could 'Set the Tone' for the Next Couple of Weeks,thestreet,2020-09-03 09:00:09
"Michael Jordan Takes Equity Stake in DraftKings, Joins Board",thestreet,2020-09-03 09:00:09
Why Jim Cramer's Action Alerts PLUS Is Trimming Tech This Week,thestreet,2020-09-03 09:00:09
AMC Wagers on 'Tenet' Drawing Movie-Lovers Back Into the Dark,thestreet,2020-09-03 09:00:09
Fisher Investments Reveals the 3 Biggest Risks of Holding Cash,thestreet,2020-09-03 09:00:09
Terrible Unemployment Numbers Don’t Hold Back Stocks,thestreet,2020-09-03 09:00:09
Investors Shouldn’t Worry About Inflation Right Now,thestreet,2020-09-03 09:00:09
Will Bitcoin Ruin Your Tax Return?,thestreet,2020-09-03 09:00:09
Coronavirus Update: Vaccine News From Sanofi and Novovax,thestreet,2020-09-03 09:00:09
Facebook Ramps Up November Election Safeguards,thestreet,2020-09-03 09:00:09
Signet Jewelers Results Beat Estimates - Shares Rise,thestreet,2020-09-03 09:00:09
"5 Best Stories on Real Money: Tesla, Buffett, Inflation",thestreet,2020-09-03 09:00:09
The Decade of the 2000s Sees More Women as Breadwinners and CEOs,thestreet,2020-09-03 09:00:09
Why Older Adults Might Have Trouble Getting Credit Cards,thestreet,2020-09-03 09:00:09
Report: NCAA to Furlough Staff of 600 Employees for Minimum of Three Weeks,thestreet,2020-09-03 09:00:09
Tax-Loss Harvesting Is a Tool for all Seasons,thestreet,2020-09-03 09:00:09
5 Things You Need to Know About a Payroll Tax Deferral,thestreet,2020-09-03 09:00:09
Advising Investors with Concentrated Stock Positions,thestreet,2020-09-03 09:00:09
"Zuora Shares Fall After it Tops Quarterly Estimates, But Issues Soft Guidance",thestreet,2020-09-03 09:00:09
CrowdStrike Drops Despite Strong Quarterly Results,thestreet,2020-09-03 09:00:09
5 Biggest Dow Gainers Wednesday,thestreet,2020-09-03 09:00:09
Stocks Rose Despite Poor Jobs Report: What Wall Street’s Saying,thestreet,2020-09-03 09:00:09
"Brown-Forman, Flying Eagle: 5 Top Gainers for Wednesday",thestreet,2020-09-03 09:00:09
"S&P 500 and Nasdaq Close at Records - Dow Up 450, or 1.6%",thestreet,2020-09-03 09:00:09
Airbnb Reportedly Rejects Ackman SPAC Proposal,thestreet,2020-09-03 09:00:09
"DraftKings Drafts MJ: Top Stories, Sports and Business News — Sept. 2",thestreet,2020-09-03 09:00:09
Al Roker: I Don't Understand People Who Have 5-Year Plans,thestreet,2020-09-03 09:00:09
Amarin Shares Off - Analysts Mull Prospects of Patent-Case Appeal,thestreet,2020-09-03 09:00:09
Prince Harry and Meghan Sign Netflix Content Production Deal,thestreet,2020-09-03 09:00:09
"United Airlines to Cut 16,000 Jobs When U.S. Aid Runs Out",thestreet,2020-09-03 09:00:09
How the Jobs Report Could 'Set the Tone' for the Next Couple of Weeks,thestreet,2020-09-03 09:00:09
Report: NCAA to Furlough Staff of 600 Employees for Minimum of Three Weeks,thestreet,2020-09-03 09:00:09
"U.S. weekly jobless claims total 881,000, vs 950,000 expected",googlenews,2020-09-03 09:02:24
3 Game-Changing Stocks That Are Better Buys Than Tesla,googlenews,2020-09-03 09:02:24
China has successfully kneecapped Trump's TikTok ban as sale talks hit a speed bump - Business Insider,googlenews,2020-09-03 09:02:24
Novavax provides additional data on COVID-19 vaccine candidate,googlenews,2020-09-03 09:02:24
Manufacturing data points to a V-shape recovery: Morning Brief,googlenews,2020-09-03 09:02:24
"Amazon to create 10,000 new permanent jobs in U.K. this year",googlenews,2020-09-03 09:02:24
Airbnb spurns approach to go public through Bill Ackman's blank-check company,googlenews,2020-09-03 09:02:24
Bill Gates-backed vehicle battery supplier to go public through SPAC deal,googlenews,2020-09-03 09:02:24
Here's what the Burger King of the future will look like,googlenews,2020-09-03 09:02:24
Covid Vaccine Frontrunners Will Soon See Their Moment of Truth,googlenews,2020-09-03 09:02:24
GlaxoSmithKline and Sanofi Just Launched the First Human Trial of Their Covid-19 Vaccine,googlenews,2020-09-03 09:02:24
U.S. private payrolls undershoot expectations; labor market recovery losing speed,googlenews,2020-09-03 09:02:24
Apple more valuable than the entire FTSE 100,googlenews,2020-09-03 09:02:24
Macy’s to open smaller stores outside of malls for financial recovery,googlenews,2020-09-03 09:02:24
Stock futures dip as Wall Street takes a breather after strong start to September,googlenews,2020-09-03 09:02:24
HealthPartners recruiting Minnesotans for COVID-19 vaccine trial,googlenews,2020-09-03 09:02:24
"Pilots at LAX report seeing ""guy in a jetpack"" 3000 feet in the air",googlenews,2020-09-03 09:02:24
Heathrow seeks staff pay cuts with jobs warning,googlenews,2020-09-03 09:02:24
"United To Furlough Up To 16,000 According To Leaked Memo",googlenews,2020-09-03 09:02:24
Samsung’s Drugmaking Future Includes a $2 Billion ‘Super Plant’ Bigger Than the Louvre,googlenews,2020-09-03 09:02:24
"Its Electric Grid Under Strain, California Turns to Batteries",googlenews,2020-09-03 09:02:24
2021 Mercedes-Benz S-Class is ready for Level 3 automated driving,googlenews,2020-09-03 09:02:24
"Stocks making the biggest moves in the premarket: Facebook, Tesla, Kansas City Southern, Costco & more",googlenews,2020-09-03 09:02:24
Oil Price Rally Stalls As U.S. Fuel Demand Falters,googlenews,2020-09-03 09:02:24
"Pittsburgh universities report COVID-19 cases on campus, focus on student safety",googlenews,2020-09-03 09:02:24
"Gold and silver trade dramatically lower, as $2000 remains resistance",googlenews,2020-09-03 09:02:24
"American, Delta And Alaska Airlines All Slashing Change Fees",googlenews,2020-09-03 09:02:24
A Top Fed Official Warns That Economic Risks Aren’t Over,googlenews,2020-09-03 09:02:24
El Cerrito apartment development files for Ch. 11 bankruptcy,googlenews,2020-09-03 09:02:24
Charlotte Clymer | 2020 40 under 40 in Government and Politics,googlenews,2020-09-03 09:02:24
Walmart Plus takes on Amazon Prime with cheaper $98 membership fee,googlenews,2020-09-03 09:02:24
MacKenzie Scott has become the world's richest woman,googlenews,2020-09-03 09:02:24
"Walmart gets creative, goes virtual as it plans for holiday toy shopping",googlenews,2020-09-03 09:02:24
"The Best Appliance Sales Of Labor Day 2020: On-Sale Refrigerators, Dishwashers & More",googlenews,2020-09-03 09:02:24
Robinhood Probed by SEC Over Payments From High-Speed Traders,googlenews,2020-09-03 09:02:24
"Mortgage Rates Today, September 3, 2020 | Rates slide",googlenews,2020-09-03 09:02:24
"Ford is offering buyouts to U.S. salaried workers with aim of cutting 1,400 jobs: WSJ",googlenews,2020-09-03 09:02:24
Natural Gas Price Forecast - Natural Gas Markets Bounce Hard,googlenews,2020-09-03 09:02:24
The New 2021 Hyundai Tucson Is Really Going to Look Like This,googlenews,2020-09-03 09:02:24
Amazon's invite-only grocery store revealed in exclusive photos - Business Insider,googlenews,2020-09-03 09:02:24
"MTA violence: 2 bus attacks, 1 train conductor assaulted in 24 hours, agency says",googlenews,2020-09-03 09:02:24
Altice USA Offers $7.8 Billion Deal for Canada's Cogeco,googlenews,2020-09-03 09:02:24
Market Wrap: Bitcoin Falls to $11.1K; Ethereum Miners at Record Fee Percentage - CoinDesk,googlenews,2020-09-03 09:02:24
Here's Why Shopify Stock Declined Today,googlenews,2020-09-03 09:02:24
Trump pivots to narrow coronavirus testing strategy as election looms,googlenews,2020-09-03 09:02:24
"Odeon's Bove upgrades Wells Fargo to Buy, citing its 'formidable presence'",googlenews,2020-09-03 09:02:24
"Amazon, Verizon may invest over $4 billion in India's Vodafone Idea: report",googlenews,2020-09-03 09:02:24
SoftBank Vision Fund 2 leads $100 million Series C in digital therapeutics company Biofourmis,googlenews,2020-09-03 09:02:24
Momo Announces Unaudited Financial Results for the Second Quarter of 2020,googlenews,2020-09-03 09:02:24
"AbbVie to face House committee subpoena over Humira, Imbruvica pricing strategies: chairwoman",googlenews,2020-09-03 09:02:24
"CrowdStrike Holdings, Inc. (CRWD) Q2 2021 Earnings Call Transcript",googlenews,2020-09-03 09:02:24
News Wrap: Black former McDonald's franchise owners sue company,googlenews,2020-09-03 09:02:24
Tesla's stock falls again as pullback is set to extend to 3rd day,googlenews,2020-09-03 09:02:24
Bank of England's Bailey slams EU barrier to investment banking services after Brexit,googlenews,2020-09-03 09:02:24
Branson’s Airline Saved as Ruling Caps Race Against Clock,googlenews,2020-09-03 09:02:24
New Treatment for Lou Gehrig's Disease Shows Promise,googlenews,2020-09-03 09:02:24
"One Week From Reveal, Lucid Air Does a Sub-10 Quarter Mile",googlenews,2020-09-03 09:02:24
Silver price down nearly 4% after ECB pushes back on strong euro,googlenews,2020-09-03 09:02:24
"Blackstone, GIP make takeover bid for Kansas City Southern",googlenews,2020-09-03 09:02:24
These Charts Tell You That the USD is Back,googlenews,2020-09-03 09:02:24
Amazon’s Biggest Leap Was Boring,googlenews,2020-09-03 09:02:24
The Importance of the FERS Special Retirement Supplement,googlenews,2020-09-03 09:02:24
Swiss regulator starts enforcement proceedings against Credit Suisse over spying scandal,googlenews,2020-09-03 09:02:24
"What is phase 3, and how close are we to a covid-19 vaccine?",googlenews,2020-09-03 09:02:24
Popular Boston bar The Pour House up for sale,googlenews,2020-09-03 09:02:24
2 GM apprentices stopped the show with demonstration for Ivanka Trump,googlenews,2020-09-03 09:02:24
Verizon spent $1.9 billion to catch up on 5G spectrum,googlenews,2020-09-03 09:02:24
Reese's made a breakfast cake so you can have dessert in the morning,googlenews,2020-09-03 09:02:24
Uber requiring mask selfies from some passengers before trips | TheHill,googlenews,2020-09-03 09:02:24
Skillz CEO: Going public via SPAC is just one step in becoming a 'hundred-year company',googlenews,2020-09-03 09:02:24
U.S. Unemployment Claims Fell in Latest Week,googlenews,2020-09-03 09:02:24
Unemployment claims figures could be much lower because of new seasonal adjustment approach,googlenews,2020-09-03 09:02:24
"US weekly jobless claims hit 881,000, fewer filings than economists expected - Business Insider",googlenews,2020-09-03 09:02:24
5 things to know before the stock market opens Thursday,googlenews,2020-09-03 09:02:24
2 Problems Tesla Creates For The S&P 500,googlenews,2020-09-03 09:02:24
Tesla’s stock story is one of newbs and rubes — but not quite the way you think it is,googlenews,2020-09-03 09:02:24
Stock Split Fever for Apple and Tesla Could Be a Warning Sign,googlenews,2020-09-03 09:02:24
Trump’s TikTok deal has an algorithm problem,googlenews,2020-09-03 09:02:24
TikTok reportedly forced to weigh new options for U.S. sale after China's latest restrictions,googlenews,2020-09-03 09:02:24
TikTok is learning how to do business in a divided world,googlenews,2020-09-03 09:02:24
Tech: Who will buy TikTok and is it worth US$60 billion?,googlenews,2020-09-03 09:02:24
"Novavax coronavirus vaccine is safe, published results show",googlenews,2020-09-03 09:02:24
Novavax Strikes Covid-19 Vaccine Deal With Canada As Investors Take Profits,googlenews,2020-09-03 09:02:24
"Scientists see downsides to top Covid-19 vaccines from Russia, China",googlenews,2020-09-03 09:02:24
Covid vaccine frontrunners will face their moment of truth this month itself,googlenews,2020-09-03 09:02:24
PMI data show 'near-stalling' of eurozone services sector in August,googlenews,2020-09-03 09:02:24
Spain's services sector recovery halted in August: PMI,googlenews,2020-09-03 09:02:24
"UK Final Services PMI misses estimates with 58.8 in August, GBP/USD stays below 1.33",googlenews,2020-09-03 09:02:24
European markets rise with economic data in focus; Melrose up 13%,googlenews,2020-09-03 09:02:24
"Amazon to create 7,000 UK jobs",googlenews,2020-09-03 09:02:24
"Amazon steps up hiring spree with push for 7,000 new staff in UK",googlenews,2020-09-03 09:02:24
"Amazon creating 7,000 new jobs in major boost for the economy",googlenews,2020-09-03 09:02:24
"Amazon announces 10,000 new permanent UK roles",googlenews,2020-09-03 09:02:24
Airbnb Snubs Billionaire Bill Ackman's Offer To Go Public Via SPAC Merger: Report,googlenews,2020-09-03 09:02:24
Airbnb allegedly holding out on Bill Ackman's blank-check offer,googlenews,2020-09-03 09:02:24
Airbnb Rebuffs Approach From Bill Ackman’s SPAC,googlenews,2020-09-03 09:02:24
Tracking Bill Ackman's Pershing Square Portfolio - Q2 2020 Update,googlenews,2020-09-03 09:02:24
Take a look at Burger King's new 'touchless' restaurant designs with solar panels and outdoor seating,googlenews,2020-09-03 09:02:24
Burger King Introduces Restaurants for a Post-COVID World,googlenews,2020-09-03 09:02:24
"See Burger King's new three-lane (yes, 3!) drive-thru design",googlenews,2020-09-03 09:02:24
Burger King Whoppers Will Cost Just £1.99 Thanks To Whopper Wednesdays,googlenews,2020-09-03 09:02:24
"Covid-19 Vaccine Early Data Expected by September 15, But How Effective Will a Shot be?",googlenews,2020-09-03 09:02:24
Local woman part of COVID-19 vaccine trial worries after sudden change to appointment | KVUE,googlenews,2020-09-03 09:02:24
"As COVID Vaccine Trials Set To Start In Minnesota, Some Experts Doubt Safe Drug Will Be Ready By November",googlenews,2020-09-03 09:02:24
Where Will Moderna Be in 1 Year?,googlenews,2020-09-03 09:02:24
Sanofi and Glaxo Start Human Trials for Covid-19 Vaccine,googlenews,2020-09-03 09:02:24
IU School of Medicine selected for COVID-19 vaccine clinical trial,googlenews,2020-09-03 09:02:24
GSK and Sanofi to start human trials of potential Covid-19 vaccine,googlenews,2020-09-03 09:02:24
Sanofi Starts Trials of Covid Shot After Early Data Impress,googlenews,2020-09-03 09:02:24
"Private payrolls grow by 428,000 but miss expectations, ADP report says",googlenews,2020-09-03 09:02:24
"US economy adds 428,000 private payrolls in August, sharply missing expectations: ADP",googlenews,2020-09-03 09:02:24
"US private employers add 428,000 jobs in August, signaling slow recovery from pandemic",googlenews,2020-09-03 09:02:24
"U.S. private payrolls undershoot expectations, point to stalling labor market recovery",googlenews,2020-09-03 09:02:24
How valuable is Apple? Just ask the FTSE 100,googlenews,2020-09-03 09:02:24
"As Apple exceeds the FTSE 100's value, should UK investors buy its shares?",googlenews,2020-09-03 09:02:24
Market report: ITV relegated after Covid horror show,googlenews,2020-09-03 09:02:24
Coronavirus: ITV relegated from FTSE 100 after horror show for shares and replaced by B&M,googlenews,2020-09-03 09:02:24
Macy's CEO sees huge opportunity in luxury retail as other chains go bankrupt,googlenews,2020-09-03 09:02:24
Macy's is planning a future outside of malls,googlenews,2020-09-03 09:02:24
"Macy's rethinks holidays in the time of COVID-19 with new gifts, online focus",googlenews,2020-09-03 09:02:24
"Macy's and Bloomingdales Plan on Opening New, Smaller Stores Outside of Malls",googlenews,2020-09-03 09:02:24
"Two pros on investment opportunities as the S&P 500, Nasdaq hit new records",googlenews,2020-09-03 09:02:24
Wall Street heads for mixed open with Nasdaq once again expected to be the star,googlenews,2020-09-03 09:02:24
These 74 stocks in the S&P 500 hit all-time records on Wednesday,googlenews,2020-09-03 09:02:24
5 Large-Cap Index Funds That Don't Track the S&P 500,googlenews,2020-09-03 09:02:24
