headline,org,date
"Jim Cramer Says Take Gains, Raise Capital In Stock Market Friday",googlenews,2020-12-12 12:00:00
Walmart prepares to administer Covid vaccines at stores across the U.S.,googlenews,2020-12-12 12:00:00
These were the most Googled questions of 2020. We have many of the answers.,googlenews,2020-12-12 12:00:00
Covid-19 took the personal out of personal training. Here's how trainers adapted,googlenews,2020-12-12 12:00:00
Bitcoin Is The Move – Bitcoin Magazine,googlenews,2020-12-12 12:00:00
"Unprompted pay-it-forward chain lasts 2 days, 900 cars at Minnesota Dairy Queen",googlenews,2020-12-12 12:00:00
Bill and Melinda Gates Foundation pledges another $250million to fight COVID,googlenews,2020-12-12 12:00:00
"Lululemon earnings, sales top estimates on strong demand for workout gear",googlenews,2020-12-12 12:00:00
Mark Zuckerberg reportedly tells Facebook employees they will NOT be required to get COVID vaccine,googlenews,2020-12-12 12:00:00
Oracle reports slow revenue growth as licensing and hardware businesses decline,googlenews,2020-12-12 12:00:00
Firing Backlash Led to Google CEO Apology: Timnit Gebru,googlenews,2020-12-12 12:00:00
SpaceX's latest Starship prototype COLLAPSES on the launch pad,googlenews,2020-12-12 12:00:00
Jim Cramer: History Will Repeat Itself If We Don't Fix the IPO Market,googlenews,2020-12-12 12:00:00
Pfizer Inc. stock underperforms Friday when compared to competitors,googlenews,2020-12-12 12:00:00
"FDA's Covid-19 vaccine authorization is a 'monumental moment,' expert says. It came on the deadliest day of the pandemic",googlenews,2020-12-12 12:00:00
Pfizer factory prepares to ship vaccine nationwide,googlenews,2020-12-12 12:00:00
Dr. Marc Siegel: COVID vaccine is a holiday gift for all. Keep taking precautions but know help is on the way,googlenews,2020-12-12 12:00:00
Biden starts countering Trump's messaging on vaccine,googlenews,2020-12-12 12:00:00
AstraZeneca to Buy Alexion for $39 Billion in Rare-Disease Push,googlenews,2020-12-12 12:00:00
AstraZeneca to buy Alexion for $39 billion to expand in immunology,googlenews,2020-12-12 12:00:00
AstraZeneca to Buy Alexion for $39 Billion,googlenews,2020-12-12 12:00:00
AstraZeneca buying drug developer Alexion for $39 billion,googlenews,2020-12-12 12:00:00
One stunning Airbnb chart perfectly encapsulates the ongoing IPO-market frenzy,googlenews,2020-12-12 12:00:00
Back in ’99 and 2000 the tech companies going public were very young and smaller than Doordash and Airbnb: Professor,googlenews,2020-12-12 12:00:00
Breakingviews - Airbnb IPO surge puts pressure on next unicorns,googlenews,2020-12-12 12:00:00
"What Warren Buffett Says About High-Profile IPOs Like Airbnb, DoorDash",googlenews,2020-12-12 12:00:00
COVID vaccine update: FDA grants emergency use authorization for Pfizer shot | WATCH LIVE UPDATE,googlenews,2020-12-12 12:00:00
Federal advisory panel recommends FDA approval for Pfizer COVID-19 vaccine,googlenews,2020-12-12 12:00:00
FDA Panel Endorses Covid-19 Vaccine,googlenews,2020-12-12 12:00:00
"Pa. Halts School Sports, Bans Indoor Dining as COVID-19 Cases Surge",googlenews,2020-12-12 12:00:00
"Oracle is moving its headquarters from Silicon Valley to Austin, Texas",googlenews,2020-12-12 12:00:00
"Oracle is moving its headquarters from California to Austin, Texas",googlenews,2020-12-12 12:00:00
"Software giant Oracle relocating its headquarters to Texas, governor says",googlenews,2020-12-12 12:00:00
"Oracle Moves Headquarters to Texas, Joining Valley Exodus",googlenews,2020-12-12 12:00:00
Get a Dozen Doughnuts for $1 at Krispy Kreme to Celebrate the 'Day of the Dozens',googlenews,2020-12-12 12:00:00
North Carolina's new COVID-19 restrictions now in effect as state sets new COVID-19 record,googlenews,2020-12-12 12:00:00
"NC reports 'staggering' 7,500 new coronavirus infections",googlenews,2020-12-12 12:00:00
NC Gov. Cooper says COVID curfews have had success in 2 states. Have they?,googlenews,2020-12-12 12:00:00
"NC ‘seeing impact of Thanksgiving gatherings’ as state reports 7,540 new virus case",googlenews,2020-12-12 12:00:00
Walmart to administer coronavirus vaccines following FDA approval,googlenews,2020-12-12 12:00:00
Patience Needed For Residents Wondering About Receiving COVID-19 Vaccine At Local Pharmacies,googlenews,2020-12-12 12:00:00
Walgreens may begin Covid vaccinations at nursing homes before Christmas,googlenews,2020-12-12 12:00:00
"In an effort to end the pandemic, US greenlights first COVID-19 vaccine for emergency use",googlenews,2020-12-12 12:00:00
New concerns as COVID-19 hospitalizations hit record high,googlenews,2020-12-12 12:00:00
Stop the Surge in California: Save lives this holiday season,googlenews,2020-12-12 12:00:00
"California COVID update: State breaks 3 COVID-19 records in 1 day as cases, hospitalizations and ICU patients reach new peak",googlenews,2020-12-12 12:00:00
Renting in the Valley is getting harder as more people move to the Valley amid COVID-19,googlenews,2020-12-12 12:00:00
Colorado Springs business owners sue Gov. Polis over COVID-19 restrictions,googlenews,2020-12-12 12:00:00
"2 Level Red triggers down for Denver, 1 to go",googlenews,2020-12-12 12:00:00
Polis: 'Ball is in our court' as COVID-19 cases level off,googlenews,2020-12-12 12:00:00
The State Has Opened 5 New Coronavirus Testing Sites Across Colorado,googlenews,2020-12-12 12:00:00
'Way behind the curve': The messaging failures around coronavirus vaccine distribution,googlenews,2020-12-12 12:00:00
Trump praises Operation Warp Speed after Pfizer vaccine authorization - Business Insider,googlenews,2020-12-12 12:00:00
HHS Secretary Azar: How Operation Warp Speed delivered a COVID vaccine in record time,googlenews,2020-12-12 12:00:00
How the White House Followed the Science to Enable a Quick Vaccine | Opinion,googlenews,2020-12-12 12:00:00
I'm in the Johnson & Johnson COVID-19 vaccine trial — here's what it's like - Business Insider,googlenews,2020-12-12 12:00:00
COVID-19 vaccine trial data approved,googlenews,2020-12-12 12:00:00
This COVID Vaccine Stock Is the Safest Bet of All,googlenews,2020-12-12 12:00:00
3 Santa Clara County hospitals out of ICU beds; 1700 new cases in single day,googlenews,2020-12-12 12:00:00
Nearly 100 COVID-19 Cases Linked to Unlawful Basketball Tournament,googlenews,2020-12-12 12:00:00
Bay Area county launches door-to-door testing amid 'dire' surge,googlenews,2020-12-12 12:00:00
COVID Surge: Santa Clara County To Send Teams Door-to-Door To Administer Tests,googlenews,2020-12-12 12:00:00
COVID-19 vaccine debate: Who gets them after healthcare workers?,googlenews,2020-12-12 12:00:00
Porter Ranch Pharmacist Gearing Up For COVID-19 Vaccination Rollout,googlenews,2020-12-12 12:00:00
What You Need To Know About The COVID Vaccine Ahead Of Its Arrival,googlenews,2020-12-12 12:00:00
Jim Cramer explains which Covid-19 vaccine candidates he's bullish on,googlenews,2020-12-12 12:00:00
"Sanofi, GlaxoSmithKline delay COVID-19 vaccine rollout to late 2021",googlenews,2020-12-12 12:00:00
Covid vaccine by Sanofi-GSK delayed after disappointing results in older patients,googlenews,2020-12-12 12:00:00
Trump campaign reacts to news of active Hunter Biden investigation,googlenews,2020-12-12 12:00:00
Cargo carriers are poised to begin deliveries of the coronavirus vaccine,googlenews,2020-12-12 12:00:00
These containers used to ship fresh tuna. Now they'll deliver Covid-19 vaccines,googlenews,2020-12-12 12:00:00
"Walgreens, CVS Health to administer first vaccines to U.S. nursing homes on Dec 21 - executives",googlenews,2020-12-12 12:00:00
How Lufthansa Prepares To Ship 10 Million Covid Vaccine Doses A Day | Big Business,googlenews,2020-12-12 12:00:00
'The Wrath Of Mark': 4 Takeaways From The Government's Case Against Facebook,googlenews,2020-12-12 12:00:00
The antitrust case against Facebook: Here's what you need to know,googlenews,2020-12-12 12:00:00
The Trustbusters Come for Facebook. Finally.,googlenews,2020-12-12 12:00:00
Break up Facebook? That’s a tough sell.,googlenews,2020-12-12 12:00:00
Cuomo announces NYC must close indoor dining as COVID rates rise,googlenews,2020-12-12 12:00:00
New York's Gov. Cuomo a contender for attorney general under Biden - Business Insider,googlenews,2020-12-12 12:00:00
Cuomo: Gyms and salons in Orange Zones allowed to reopen with restrictions,googlenews,2020-12-12 12:00:00
"Of dining and dying: There’s a credible case for shuttering indoor dining entirely, but not like this",googlenews,2020-12-12 12:00:00
Scams likely to heat up after COVID-19 vaccine rollout,googlenews,2020-12-12 12:00:00
Law enforcement warns public of COVID-19 vaccine scammers,googlenews,2020-12-12 12:00:00
How to avoid COVID-19 vaccine scams circulating Puget Sound,googlenews,2020-12-12 12:00:00
Beware of COVID-19 Vaccine Scams,googlenews,2020-12-12 12:00:00
India readies for 600 million COVID vaccine jabs; to use standard cold storage: top government expert,googlenews,2020-12-12 12:00:00
Covid-19 vaccine rollout to be a huge logisitical headache for India,googlenews,2020-12-12 12:00:00
US offers to help increase production of Pfizer/BioNTech Covid vaccine,googlenews,2020-12-12 12:00:00
Covid-19: Serum Institute of India may get emergency use approval for Covishield soon,googlenews,2020-12-12 12:00:00
From Elon Musk to Oracle — the coronavirus accelerates California exodus,googlenews,2020-12-12 12:00:00
Leaked Email from Elon Musk Shows Urges Employees To Scale Up Production,googlenews,2020-12-12 12:00:00
Elon Musk's move to Texas is a publicity stunt that reveals how Tesla is maturing as an automaker,googlenews,2020-12-12 12:00:00
Elon Musk appears immune to criticism as Tesla ignores the media,googlenews,2020-12-12 12:00:00
How to Break Up Facebook,googlenews,2020-12-12 12:00:00
Why the FTC's antitrust lawsuit against Facebook matters - Business Insider,googlenews,2020-12-12 12:00:00
"Facebook case is an important start, but more is needed",googlenews,2020-12-12 12:00:00
The lawsuits against Facebook don’t go far enough,googlenews,2020-12-12 12:00:00
What's next for the COVID-19 vaccine after authorization? | KVUE,googlenews,2020-12-12 12:00:00
COVID-19 survivors share their story: 'Wear a mask all the time',googlenews,2020-12-12 12:00:00
"Travis County reports 2 more coronavirus deaths, 382 new cases",googlenews,2020-12-12 12:00:00
"If new COVID-19 cases don't slow, Austin may soon move to Stage 5 with city curfew possible",googlenews,2020-12-12 12:00:00
Walmart mobilizes to help in vaccination distribution,googlenews,2020-12-12 12:00:00
How the first COVID-19 vaccine doses will be distributed,googlenews,2020-12-12 12:00:00
Covid-19: Peer-reviewed report shows Oxford vaccine is safe – but how effective is it?,googlenews,2020-12-12 12:00:00
UPS begins shipping kits in advance of Pfizer vaccine,googlenews,2020-12-12 12:00:00
How the Paycheck Protection Program (PPP) helped a Clinton Township business survive the pandemic,googlenews,2020-12-12 12:00:00
Small-business loans to big companies prompt Congress to overhaul PPP rules,googlenews,2020-12-12 12:00:00
How to cut through PPP-loan confusion and avoid leaving money on the table,googlenews,2020-12-12 12:00:00
"'Thanks a lot,' say business owners who got PPP loans under $100",googlenews,2020-12-12 12:00:00
Florida taps Pinellas County for Pfizer’s COVID-19 vaccine pilot program,googlenews,2020-12-12 12:00:00
Germany records new high in COVID deaths +++ US endorses BioNTech Pfizer Vaccine | Covid Update,googlenews,2020-12-12 12:00:00
Hospitals and healthcare workers rehearsing coronavirus vaccine delivery,googlenews,2020-12-12 12:00:00
US allows emergency COVID-19 vaccine in bid to end pandemic,googlenews,2020-12-12 12:00:00
"Disney leads Dow as S&P, Nasdaq slip",googlenews,2020-12-12 12:00:00
Global equities flat ; oil settles at 9-month high of over $50/bbl | Global Cues 11 Dec,googlenews,2020-12-12 12:00:00
"Nasdaq, S&P 500 Cut Losses As Disney Boosts Dow; Chipotle, EXP World Near Buy Zones",googlenews,2020-12-12 12:00:00
Stimulus uncertainty hems in Wall Street; Disney soars,googlenews,2020-12-12 12:00:00
$1 million Mega Millions lottery ticket sold in Louisville,googlenews,2020-12-12 12:00:00
"Mega Millions lottery: Did you win Friday’s $276M Mega Millions drawing? Results, winning numbers (12/11/2020)",googlenews,2020-12-12 12:00:00
"Winning lottery ticket worth $1,000,000 sold in Louisville | News",googlenews,2020-12-12 12:00:00
Live Mega Millions results for 12/11/20; jackpot worth $276 million,googlenews,2020-12-12 12:00:00
Virgin Galactic preparing for test flight from New Mexico spaceport,googlenews,2020-12-12 12:00:00
Why Virgin Galactic Stock Popped 7.5% -- Then Gave Most of It Back,googlenews,2020-12-12 12:00:00
SpaceShipTwo's next big test flight could happen this weekend,googlenews,2020-12-12 12:00:00
Virgin Galactic’s first spaceflight from New Mexico lifts off,googlenews,2020-12-12 12:00:00
"Your money, Your Future: When do PUA benefits end?",googlenews,2020-12-12 12:00:00
‘We’re already too late’: Unemployment lifeline to lapse even with an aid deal,googlenews,2020-12-12 12:00:00
California unemployment: A million Californians will lose benefits day after Christmas if Congress doesn't act,googlenews,2020-12-12 12:00:00
Nevada DETR investigating PUA claims after 635% jump,googlenews,2020-12-12 12:00:00
New jobless claims surge in Illinois as COVID-19 continues to wreak havoc on economy,googlenews,2020-12-12 12:00:00
"Pennsylvania’s unemployment claims jump 73% from previous week’s figures, more than 40,000 new claims filed la",googlenews,2020-12-12 12:00:00
US jobless claims spike to 853000 while Congress stalls further aid,googlenews,2020-12-12 12:00:00
Watch Now: $400 more coming to 120k Oklahomans as unemployment claims rise 55% from last week,googlenews,2020-12-12 12:00:00
New Ferrari CEO Suddenly Steps Down After COVID-19 Hospitalization,googlenews,2020-12-12 12:00:00
Ferrari CEO Louis Camilleri steps down after battle with COVID-19,googlenews,2020-12-12 12:00:00
Ferrari Owners and F1 Fans Get Some Troubling News,googlenews,2020-12-12 12:00:00
Ferrari saddened to lose 'incredible' support from CEO Camilleri,googlenews,2020-12-12 12:00:00
U.S. remains in top spot for new COVID cases,googlenews,2020-12-12 12:00:00
U.S. sees more than 3300 coronavirus deaths in one day as hospitals struggle,googlenews,2020-12-12 12:00:00
"This Winter America Will See More ‘Deaths per Day Than 9/11 or Pearl Harbor,’ CDC Director Says",googlenews,2020-12-12 12:00:00
Vietnam jails Hanoi CDC chief for overstating COVID-19 gear cost,googlenews,2020-12-12 12:00:00
Should Murray City allow short-term rentals?,googlenews,2020-12-12 12:00:00
Maverik Center COVID-19 testing site has new location,googlenews,2020-12-12 12:00:00
"2183 more COVID-19 cases, 9 deaths reported Friday in Utah, but count may be artificially low",googlenews,2020-12-12 12:00:00
Nine More Utahns Have Died From COVID-19; ICUs 92% Full,googlenews,2020-12-12 12:00:00
"West Virginia Gov. Justice: Viatris will work with state to try to find new operator, save jobs at soon-to-close Mylan Morgantown plant",googlenews,2020-12-12 12:00:00
"Shutdown planned for July 31 at former Mylan plant in Morgantown; 1,500 jobs to be lost",googlenews,2020-12-12 12:00:00
"Mylan's Morgantown manufacturing plant to close, nearly 1500 jobs will be lost",googlenews,2020-12-12 12:00:00
"Pfizer-Mylan combo Viatris to slash up to 9000 jobs, shutter manufacturing plants in global cost-cutting drive",googlenews,2020-12-12 12:00:00
CDC and ACIP hold emergency meeting regarding COVID-19 vaccine (LIVE) | USA TODAY,googlenews,2020-12-12 12:00:00
Should ER Doctors Like Me Really Get the COVID-19 Vaccine First?,googlenews,2020-12-12 12:00:00
Uber Wants Its Non-Employee Drivers to Get Early Vaccines,googlenews,2020-12-12 12:00:00
It’s Vaccine Time. Industries Jostle in the Line for Shots.,googlenews,2020-12-12 12:00:00
Dr. Hamilton on the Mechanism of Action of OP-1250 in HR+/HER2- Metastatic Breast Cancer,googlenews,2020-12-12 12:00:00
iDFS Not Improved 1-Year of Added Palbociclib to Endocrine Therapy in HR+/HER2- Breast Cancer,googlenews,2020-12-12 12:00:00
Tesetaxel with Reduced Dose of Xeloda Improves Progression-Free Survival in Breast Cancer,googlenews,2020-12-12 12:00:00
MEDSIR IDs Drugs & Biomarkers for Best Palbociclib+Endocrine Therapy Success,googlenews,2020-12-12 12:00:00
Boston Dynamics sells to Hyundai Motor Group in $1.1 billion deal,googlenews,2020-12-12 12:00:00
"Hyundai To Take Over Boston Dynamics, Maker Of 'Spot' The Robot Dog",googlenews,2020-12-12 12:00:00
"The Briefing: Hyundai Buys Majority Stake In Boston Dynamics, Tink Lands $103M, And More",googlenews,2020-12-12 12:00:00
Hyundai confirms its $1.1 billion acquisition of Boston Dynamics,googlenews,2020-12-12 12:00:00
What you can and can't do under the county's new stay-home order,googlenews,2020-12-12 12:00:00
Sonoma County Prepares for Stay-Home Order Beginning Saturday,googlenews,2020-12-12 12:00:00
Stay-at-home order begins in Sonoma County,googlenews,2020-12-12 12:00:00
"Sonoma County reacts to new stay-home order with resignation, annoyance, sadness, confusion",googlenews,2020-12-12 12:00:00
S&P Drops Apartment Investment Ahead of Tesla’s Arrival,googlenews,2020-12-12 12:00:00
CNN spoke to Trump supporters about election results. See what they had to say,googlenews,2020-12-12 12:00:00
See the holiday movies making 2020 a record year for LGBTQ representation,googlenews,2020-12-12 12:00:00
Mother struggles to keep the lights on this Christmas,googlenews,2020-12-12 12:00:00
Ben & Jerry’s Partners Colin Kaepernick To Launch New Vegan Ice Cream,googlenews,2020-12-12 12:00:00
Roundup: Colin Kaepernick Ice Cream; Matthew Berry Has COVID; Everything is Star Wars,googlenews,2020-12-12 12:00:00
Colin Kaepernick Joins Forces With Ben and Jerry's for New Flavor,googlenews,2020-12-12 12:00:00
Clay Travis Mocks Colin Kaepernick For Getting Ice Cream Brand Endorsement,googlenews,2020-12-12 12:00:00
New York Restaurants Say They Are Worse Off,googlenews,2020-12-12 12:00:00
Survey: More than half of restaurant owners considering closing businesses until end of pandemic,googlenews,2020-12-12 12:00:00
More than half of New York restaurants say they're in danger of closing,googlenews,2020-12-12 12:00:00
Pandemic impacting NY restaurants far worse than national average,googlenews,2020-12-12 12:00:00
Moving to Texas: Why Tesla's Elon Musk and big tech are leaving California,googlenews,2020-12-12 12:00:00
Elon Musk is moving from California to Texas,googlenews,2020-12-12 12:00:00
"Missed Tesla’s 12,551% rise? Don’t feel so bad.",googlenews,2020-12-12 12:00:00
Elon Musk says ‘too many MBAs’ are running American companies,googlenews,2020-12-12 12:00:00
"Today's Mortgage Rates -- December 11, 2020: Rates Holding Fairly Steady",googlenews,2020-12-12 12:00:00
U.S. long-term mortgage rates maintain record lows; 30-year at 2.71 percent,googlenews,2020-12-12 12:00:00
How does a cash out refinance affect taxes?,googlenews,2020-12-12 12:00:00
"Today's Best Mortgage and Refinance Rates: December 11, 2020 | Rates Tick Down",googlenews,2020-12-12 12:00:00
Cramer's week ahead: This is the time to speculate,googlenews,2020-12-12 12:00:00
Cramer: Expected FDA vaccine authorization gives the market new hope,googlenews,2020-12-12 12:00:00
"Pfizer Covid Vaccine, Disney, Costco, Airbnb - 5 Things You Must Know Friday",googlenews,2020-12-12 12:00:00
"Cramer calls IPO pricing ‘broken’ and ‘embarrassing’ after Airbnb, DoorDash debuts skyrocket",googlenews,2020-12-12 12:00:00
Walmart to give COVID-19 vaccine following FDA approval,googlenews,2020-12-12 12:00:00
Vaccine rollout: How doses will safely make it from the airport to hospitals and pharmacies,googlenews,2020-12-12 12:00:00
China's Covid-19 vaccine trials stopped in Peru,googlenews,2020-12-12 12:00:00
Google’s Year In Search finds people searched ‘why’ more than ever in 2020,googlenews,2020-12-12 12:00:00
Here's what New Yorkers were searching for in 2020,googlenews,2020-12-12 12:00:00
Shakira Was the Most Searched Artist on Google This Year,googlenews,2020-12-12 12:00:00
The top trending Google searches of 2020 included everything from the election to the PlayStation 5 - see the,googlenews,2020-12-12 12:00:00
"Bitcoin Whales Buy Low, Sell High; Retail Investors Chase Rallies: Data - CoinDesk",googlenews,2020-12-12 12:00:00
Crypto Chartbook: Bitcoin Riches Through A Routine,googlenews,2020-12-12 12:00:00
Editorial: Growing Institutional FOMO Is Making Bitcoin [BTC] Highly Underpriced,googlenews,2020-12-12 12:00:00
"Bitcoin price correction continues, dashing hopes of $20K in 2020",googlenews,2020-12-12 12:00:00
Over 900 cars participate in pay-it-forward at Dairy Queen drive-thru,googlenews,2020-12-12 12:00:00
More than 900 Dairy Queen customers pay for each other’s meals at Minnesota drive-thru,googlenews,2020-12-12 12:00:00
More than 900 drive-thru customers 'pay it forward' for nearly 3 straight days,googlenews,2020-12-12 12:00:00
More than 900 Dairy Queen customers pay it forward at Minnesota drive-thru,googlenews,2020-12-12 12:00:00
Bill Gates makes bleak prediction for when coronavirus pandemic will finally end,googlenews,2020-12-12 12:00:00
Melinda Gates: It's time to have some good regulation on social media platforms,googlenews,2020-12-12 12:00:00
Bill Gates on vaccine fight: 'There's a lot of heroes' to ending pandemic,googlenews,2020-12-12 12:00:00
Open Society Foundations Taps Former UN Executive as Leader,googlenews,2020-12-12 12:00:00
"Lululemon Dashes Past Q3 Analyst Expectations With Revenue, EPS Beats",googlenews,2020-12-12 12:00:00
Here’s When Lululemon Will Launch Its First-Ever Shoe Collection,googlenews,2020-12-12 12:00:00
Jim Cramer Says Buy Lululemon Stock,googlenews,2020-12-12 12:00:00
"Lululemon, No Longer Just for the Slim, Captures New Customers",googlenews,2020-12-12 12:00:00
Zuckerberg Says Facebook Employees Won't Need Vaccine to Return to Work,googlenews,2020-12-12 12:00:00
Mark Zuckerberg: Facebook staff won't need a vaccine for office return - Business Insider,googlenews,2020-12-12 12:00:00
Mark Zuckerberg Tells Staff COVID-19 Vaccine Won't Be Necessary to Return to Work,googlenews,2020-12-12 12:00:00
"No, Facebook will not force its employees to get vaccinated to go back to the office",googlenews,2020-12-12 12:00:00
"The Zacks Analyst Blog Highlights: Lululemon, Oracle, Costco and Broadcom",googlenews,2020-12-12 12:00:00
Oracle Beats Estimates on Strong Cloud Results,googlenews,2020-12-12 12:00:00
Oracle Projects Growing Revenue After Years of Cloud Slog,googlenews,2020-12-12 12:00:00
"ETFs to Gain on Oracle's Q2 Earnings Beat, Upbeat View",googlenews,2020-12-12 12:00:00
Google CEO Sundar Pichai apologized for the dismissal of artificial intelligence researcher Timnit Gebru - Silicon Valley,googlenews,2020-12-12 12:00:00
Google chief apologizes after prominent Black employee is fired,googlenews,2020-12-12 12:00:00
Google CEO Criticized For Response to AI Researcher's Exit,googlenews,2020-12-12 12:00:00
Google CEO's apology for Timnit Gebru firing misses the mark,googlenews,2020-12-12 12:00:00
SpaceX's next Starship prototype is leaning awkwardly inside its hangar,googlenews,2020-12-12 12:00:00
Starbound: SpaceX Starship prototype successfully launches – Port Isabel-South Padre Press,googlenews,2020-12-12 12:00:00
SpaceX’s Next Starship Test Likely Delayed As Accident Damages Prototype,googlenews,2020-12-12 12:00:00
SpaceX ship falls over before launch just days after predecessor rocket explodes on test flight,googlenews,2020-12-12 12:00:00
Airbnb Valuation - Growth Is Expensive,googlenews,2020-12-12 12:00:00
Airbnb skyrockets in market debut opening at $146 a jump of 115% above the company's IPO price,googlenews,2020-12-12 12:00:00
Can Airbnb Sustain a $100 Billion Valuation? New Skift Research,googlenews,2020-12-12 12:00:00
Airbnb more than doubles in biggest 2020 U.S. IPO,googlenews,2020-12-12 12:00:00
Facebook Inc. Cl A stock underperforms Friday when compared to competitors,googlenews,2020-12-12 12:00:00
"Netflix Inc. stock rises Friday, outperforms market",googlenews,2020-12-12 12:00:00
Microsoft Corp. stock outperforms competitors on strong trading day,googlenews,2020-12-12 12:00:00
"BioNTech SE ADR stock falls Friday, underperforms market",googlenews,2020-12-12 12:00:00
"Successful Investors: What Would You Do in 2021 With a Blank Slate and $5,000?",motleyfool,2020-12-12 12:01:42
FDA Authorizes Pfizer and BioNTech's Coronavirus Vaccine,motleyfool,2020-12-12 12:01:42
Forget Exxon: These 3 Energy Stocks Are Better Options Now,motleyfool,2020-12-12 12:01:42
3 Top Small-Cap Stocks to Buy Right Now,motleyfool,2020-12-12 12:01:42
FDA Authorizes Pfizer and BioNTech's Coronavirus Vaccine,motleyfool,2020-12-12 12:01:42
AstraZeneca to Buy Alexion Pharmaceuticals for $39 Billion,motleyfool,2020-12-12 12:01:42
These Americans Will Receive COVID Vaccines First,motleyfool,2020-12-12 12:01:42
Apple Finally Started Making Its In-House Modem Earlier This Year,motleyfool,2020-12-12 12:01:42
The GE Business You've Never Heard Of: And Why It Really Matters,motleyfool,2020-12-12 12:01:42
Maxed Out Your Retirement Plan? Here's Another Way to Build Long-Term Wealth,motleyfool,2020-12-12 12:01:42
"Forget Fuel Cells, Solar Is a Better Way to Invest in Renewable Energy",motleyfool,2020-12-12 12:01:42
Confident That an Effective Coronavirus Vaccine is Coming? Consider These 3 ETFs,motleyfool,2020-12-12 12:01:42
Forget AT&T: This Telecom Is a Better Dividend Stock,motleyfool,2020-12-12 12:01:42
Why Your Healthcare Costs as a Senior Could Be Higher Than Planned,motleyfool,2020-12-12 12:01:42
"How to Raise Your Credit Score From ""Poor"" to ""Good"" by 2022",motleyfool,2020-12-12 12:01:42
Why Stitch Fix Stock Is Soaring,motleyfool,2020-12-12 12:01:42
3 Big Winners From the Coronavirus Vaccines,motleyfool,2020-12-12 12:01:42
