headline,org,date
"Swaths of UK coastline are eroding at an alarming rate. Yet the government lacks a coherent action plan, say critics",financialtimes,2020-08-09 10:53:01
"You will regret the decision to swap the metropolis for the patchy WiFi, sumac-free countryside",financialtimes,2020-08-09 10:53:01
Key figures detained as Lukashenko faces challenge in presidential election,financialtimes,2020-08-09 10:53:01
Tree cover losses increase 77% as collapse in economies pushes exploitation of resources  ,financialtimes,2020-08-09 10:53:01
SARB under pressure from politicians to take more direct role in stimulating economy,financialtimes,2020-08-09 10:53:01
Beijing’s ‘mask diplomacy’ will boost trade and investment in traditional American zone of influence,financialtimes,2020-08-09 10:53:01
Second-quarter net income at Warren Buffett’s conglomerate rises by 87% on the previous year,financialtimes,2020-08-09 10:53:01
Science commentator Anjana Ahuja explores a diet created to address overprodution and unhealthy eating habits,financialtimes,2020-08-09 10:53:01
The president’s niece on fear and greed in the Trump family — and why she wrote her explosive tell-all memoir ,financialtimes,2020-08-09 10:53:01
How it became the most successful wine category of the past two decades,financialtimes,2020-08-09 10:53:01
"The editor-in-chief of British Vogue on activism, hope — and how he’s making a modern, multicultural magazine",financialtimes,2020-08-09 10:53:01
Wall St wants to know financial impact on broadcasting company of fewer games due to coronavirus,financialtimes,2020-08-09 10:53:01
"Private equity-owned tenants pay less than listed peers, says one US property group",financialtimes,2020-08-09 10:53:01
US takes action against territory’s top official Carrie Lam and moves to ban TikTok and WeChat,financialtimes,2020-08-09 10:53:01
Party worries billionaire rapper’s presidential attempt could divert votes from Joe Biden,financialtimes,2020-08-09 10:53:01
Commerce patterns have not shifted much recently. That is about to change dramatically,financialtimes,2020-08-09 10:53:01
"Can the Covid-19 test, track and trace be fixed in time? ",financialtimes,2020-08-09 10:53:01
Sinan Ulgen on the Hagia Sophia controversy and Turkish actions in Syria and Libya,financialtimes,2020-08-09 10:53:01
Four charts shine light on once-mighty sector now under siege ,financialtimes,2020-08-09 10:53:01
Lawyers should expect career changes and more working from home,financialtimes,2020-08-09 10:53:01
Ben Meng spearheaded a bold overhaul of much of $400bn fund’s investment portfolio,financialtimes,2020-08-09 10:53:01
Inflation worries return to fuel a surge in price of the precious metal,financialtimes,2020-08-09 10:53:01
Market Questions is the FT’s guide to the week ahead,financialtimes,2020-08-09 10:53:01
Concerns start to grow among analysts over the longer-term inflation outlook,financialtimes,2020-08-09 10:53:01
Two-year-old brand cracked the world’s top 10 handsets with cheap and relatively high-spec devices,financialtimes,2020-08-09 10:53:01
This new GPS system should mean you never lose your cat – or dog – again,financialtimes,2020-08-09 10:53:01
A deal between software groups would mark latest move in wave of tech consolidation,financialtimes,2020-08-09 10:53:01
Saudi Aramco extends payment plan as it closes $69bn Sabic deal ,financialtimes,2020-08-09 10:53:01
‘Thriving’ oil demand prompts Saudi Aramco to lift prices,financialtimes,2020-08-09 10:53:01
Saudi foreign reserves fall as sovereign wealth fund spends overseas,financialtimes,2020-08-09 10:53:01
"Scientists Begin to Uncover Covid-19's Potential Toll on Brain, Nervous System",thestreet,2020-08-09 10:54:56
Netflix Stock Could Be on the Verge of a Big Rally,thestreet,2020-08-09 10:54:56
Covid Stimulus Talks Break Down - Now What?,thestreet,2020-08-09 10:54:56
How to Trade Uber Stock After Earnings Dip,thestreet,2020-08-09 10:54:56
Jim Cramer: No Shinola! Sellers Are Wrong on These 3 Stocks,thestreet,2020-08-09 10:54:56
"Collins: With TikTok on the Clock, I'm Eyeing These Charts",thestreet,2020-08-09 10:54:56
Rev Shark: Trading the Market Bubble of 2020,thestreet,2020-08-09 10:54:56
Meisler: Charting the QQQs,thestreet,2020-08-09 10:54:56
"Graff: Jobs Report Looks Solid, but Tough Questions Remain",thestreet,2020-08-09 10:54:56
Chinese Tech Stocks Slump -- and Facebook and Snap Gain -- Following Trump Orders,thestreet,2020-08-09 10:54:56
How Brands Are Navigating the Uncertainty of Back-to-School,thestreet,2020-08-09 10:54:56
"July Jobs Report Shows Solid 1.8 Million Gain: Government, Retail Hiring Boost Headline Total",thestreet,2020-08-09 10:54:56
Easy Money Has Already Been Made In Etsy,thestreet,2020-08-09 10:54:56
Jim Cramer Says Nancy Pelosi Has the Upper Hand in Stimulus Talks,thestreet,2020-08-09 10:54:56
Why This Analyst Likes NortonLifeLock Stock,thestreet,2020-08-09 10:54:56
"Trump Signs 4 Executive Orders, One Requires States Pay 25% of the Cost",thestreet,2020-08-09 10:54:56
Alibaba Spinoff to Unlock Massive Value,thestreet,2020-08-09 10:54:56
Rare Apple Downgrade and the Bearish Case,thestreet,2020-08-09 10:54:56
Financial Planning for Folks Who Lose Their Jobs in Their ‘50s,thestreet,2020-08-09 10:54:56
Advising Investors with Concentrated Stock Positions,thestreet,2020-08-09 10:54:56
Estate Planning Is not Just for the Wealthy,thestreet,2020-08-09 10:54:56
"Analyst Who Called Gold $2,000 Is Now Predicting $2,500 By Year-End",thestreet,2020-08-09 10:54:56
What July Jobs Report Says About Economic Recovery,thestreet,2020-08-09 10:54:56
A TikTok Acquisition Hasn't Been Priced Into Microsoft Stock Yet: Analyst,thestreet,2020-08-09 10:54:56
"Back-to-School: For Brands and Retailers, It's 'A Year Like No Other'",thestreet,2020-08-09 10:54:56
Terrible Unemployment Numbers Don’t Hold Back Stocks,thestreet,2020-08-09 10:54:56
Investors Shouldn’t Worry About Inflation Right Now,thestreet,2020-08-09 10:54:56
Will Bitcoin Ruin Your Tax Return?,thestreet,2020-08-09 10:54:56
"Royal Caribbean, Marriott and Cisco Earnings on Tap in Week Ahead",thestreet,2020-08-09 10:54:56
"August 9, 1989: President George H. W. Bush Signs Legislation in the Wake of the Savings and Loan Crisis",thestreet,2020-08-09 10:54:56
"Personal Finance Focus: Back-to-School Savings, Credit Scores and More",thestreet,2020-08-09 10:54:56
Berkshire Hathaway Expected to Earn $2.12 a Share,thestreet,2020-08-09 10:54:56
"Trending Market News Friday - U.S. Debt, Biogen, Mortgage Rates",thestreet,2020-08-09 10:54:56
Markets Risk-On Friday: What Wall Street's Saying,thestreet,2020-08-09 10:54:56
"5 Stock Gainers for Friday: Stamps.com, Overstock.com",thestreet,2020-08-09 10:54:56
Advising Investors with Concentrated Stock Positions,thestreet,2020-08-09 10:54:56
Advisers can Help With Restricted Stock Units,thestreet,2020-08-09 10:54:56
TurboTax Guide to Filing Your Taxes Late,thestreet,2020-08-09 10:54:56
"Stocks End Mixed on Stimulus Talks, U.S.-China Worries, Jobs Data",thestreet,2020-08-09 10:54:56
"What to Watch This Weekend: Top Stories, Sports and Business News — August 7",thestreet,2020-08-09 10:54:56
Up to 40 Million People in America Are at Risk of Eviction: Report,thestreet,2020-08-09 10:54:56
Novavax Partners With Takeda for Japan Output of Covid Drug,thestreet,2020-08-09 10:54:56
What Will the Bond Market Do if Trump Wins the November Election?,thestreet,2020-08-09 10:54:56
Biotech Stocks Are Flying High. Should You Buy Regeneron?,thestreet,2020-08-09 10:54:56
Schools In New York State to Reopen in the Fall,thestreet,2020-08-09 10:54:56
Biogen-Eisai Alzheimer's Drug Gets FDA Priority Review,thestreet,2020-08-09 10:54:56
The History Behind Warren Buffett's Berkshire Hathaway,thestreet,2020-08-09 10:54:56
Midday Market Update: Sentiment Improves,thestreet,2020-08-09 10:54:56
Pfizer to Produce Gilead Virus-Treatment Candidate Remdesivir,thestreet,2020-08-09 10:54:56
Morning Bell With Jim Cramer: When to Buy Honeywell Shares,thestreet,2020-08-09 10:54:56
"Analyst Who Called Gold $2,000 Is Now Predicting $2,500 By Year-End",thestreet,2020-08-09 10:54:56
"5 Stock Gainers for Friday: Stamps.com, Overstock.com",thestreet,2020-08-09 10:54:56
"Saudi Aramco's profit plunges, sees signs of oil market recovery",googlenews,2020-08-09 10:57:35
This Company Boasted to Trump About Its Covid-19 Vaccine. Experts Are Skeptical.,googlenews,2020-08-09 10:57:35
Make-or-Break Time Coming for Fans of Treasury Curve Steepener,googlenews,2020-08-09 10:57:35
Coronavirus has already dealt a blow to Social Security's finances. Trump's payroll tax holiday could make it worse,googlenews,2020-08-09 10:57:35
Bill Gates: Coronavirus pandemic will end 'for the rich world' by late 2021,googlenews,2020-08-09 10:57:35
Riley Drive Entertainment's Lenexa restaurants face 'insurmountable obstacle',googlenews,2020-08-09 10:57:35
Eastman Kodak's $765 million U.S. loan agreement on hold after recent allegations,googlenews,2020-08-09 10:57:35
Salmonella outbreak linked to onions expands to 43 states,googlenews,2020-08-09 10:57:35
It is the state’s largest PPP loan scheme. Three from South Florida have been charged,googlenews,2020-08-09 10:57:35
One-in-Three Americans Would Decline a Free COVID-19 Vaccine,googlenews,2020-08-09 10:57:35
U.S. Sovereign Ratings Impact: What If Congress Doesn’t Pass Stimulus?,googlenews,2020-08-09 10:57:35
"Be Like Buffett: ""Bet on America"" With These 3 Stocks to Buy Now",googlenews,2020-08-09 10:57:35
Retirement: The Social Security Time Bomb,googlenews,2020-08-09 10:57:35
"Krispy Kreme offering free doughnuts, coffee for ‘Educator Appreciation Week’",googlenews,2020-08-09 10:57:35
"Venza and Model Y driven, Cadillac Lyriq revealed, Cybertrucks for all: The Week in Reverse",googlenews,2020-08-09 10:57:35
Florida's elderly 'Romeo and Juliet' risk COVID-19 for one final embrace,googlenews,2020-08-09 10:57:35
Amazon takes up to 25 percent off clothing and more for Big Summer Sale,googlenews,2020-08-09 10:57:35
Cryptocurrency Mining Profitability in 2020: Is It Possible?,googlenews,2020-08-09 10:57:35
"Uber's ride-hailing business is 'a mess,' analysts say, and the stock is sputtering",googlenews,2020-08-09 10:57:35
Mark Zuckerberg Just Joined an Elite 3-Member Club as a Centibillionaire,googlenews,2020-08-09 10:57:35
Bath Iron Works and union reach tentative deal to end strike in Maine,googlenews,2020-08-09 10:57:35
WarnerMedia shakes itself up to focus on HBO Max,googlenews,2020-08-09 10:57:35
Why you should never tell a kid they're getting an 'allowance': Dave Ramsey,googlenews,2020-08-09 10:57:35
Brightline cut ties with Virgin Enterprises. No more rebranding but projects continue,googlenews,2020-08-09 10:57:35
"Despite agreement, China purchase of US agriculture lags",googlenews,2020-08-09 10:57:35
Capital One ordered to pay $80 million penalty for its role in a 2019 data breach,googlenews,2020-08-09 10:57:35
Novavax Partners With Takeda to Sell Its Coronavirus Vaccine in Japan,googlenews,2020-08-09 10:57:35
"If You'd Invested $1,000 in Pfizer During the Last Recession, This Is How Much You Would Have Today",googlenews,2020-08-09 10:57:35
"Powerball lottery: Did you win Saturday’s $158M Powerball drawing? Winning numbers, live results (08/08/2020)",googlenews,2020-08-09 10:57:35
Human Capital: Uber and Lyft’s ongoing battle with the law and a brief history of diversity at Snap,googlenews,2020-08-09 10:57:35
"Alaska Airlines offering travelers buy 1, get 1 free deal with tickets this weekend",googlenews,2020-08-09 10:57:35
Here's what happened to the stock market on Friday,googlenews,2020-08-09 10:57:35
"I’ve Tried Thousands of Beauty Products This Year, But These Are The 7 I’m Buying at the Nordstrom Anniversary Sale",googlenews,2020-08-09 10:57:35
Wall Street Week Ahead: Bargain-hunters look to U.S. real estate stocks as S&P nears records,googlenews,2020-08-09 10:57:35
Oil spill threatens ecological disaster as Mauritius declares emergency,googlenews,2020-08-09 10:57:35
Why global investors can’t ignore Turkey’s latest currency woes,googlenews,2020-08-09 10:57:35
Mortgage rates hit another all-time low,googlenews,2020-08-09 10:57:35
"2023 Cadillac Lyriq revealed, 2020 Audi A6 Allroad tested and more: Roadshow's week in review",googlenews,2020-08-09 10:57:35
"Tight on quarters: Businesses, banks scramble as pandemic causes coin shortage",googlenews,2020-08-09 10:57:35
"Power Line: Top oil-industry salaries, Exxon warns of job cuts - Business Insider",googlenews,2020-08-09 10:57:35
Wolf says ‘tough decisions’ paying off as Pennsylvania’s COVID numbers improve,googlenews,2020-08-09 10:57:35
New Chapter in U.S.-China Ties Marked by Confrontation,googlenews,2020-08-09 10:57:35
"80,000 airline workers face furloughs due to COVID-19",googlenews,2020-08-09 10:57:35
"Pulling pranks, bidding for Yahoo, and launching a $1 billion basketball stunt: Rocket founder Dan Gilber..",googlenews,2020-08-09 10:57:35
"SpaceX, United Launch Alliance win millions in contracts with Pentagon",googlenews,2020-08-09 10:57:35
A growing number of cruise lines are canceling sailings into 2021,googlenews,2020-08-09 10:57:35
This ETF Could Help Grow Your Retirement Account,googlenews,2020-08-09 10:57:35
Trump advisors urge delisting of U.S.-listed Chinese firms that fail to meet audit standards,googlenews,2020-08-09 10:57:35
UPS plans heavy holiday fees amid coronavirus-related shipment surge,googlenews,2020-08-09 10:57:35
Canada brewery apologises for beer named 'pubic hair' in Maori,googlenews,2020-08-09 10:57:35
Restaurants hope customers cash in on Tax-Free Weekend,googlenews,2020-08-09 10:57:35
What a WeChat ban would mean for Americans,googlenews,2020-08-09 10:57:35
Intercontinental Exchange’s most recent aggressive move raises brows,googlenews,2020-08-09 10:57:35
2021 Ford Bronco petition calls for wider manual transmission availability,googlenews,2020-08-09 10:57:35
ADDING MULTIMEDIA FDA Approves Genentech's Evrysdi (risdiplam) for Treatment of Spinal Muscular Atrophy (SMA) in Adults and Children 2 Months and Older,googlenews,2020-08-09 10:57:35
Virus causing financial pain even for people still working,googlenews,2020-08-09 10:57:35
Mortgage Rates Will Drop Further In Coming Weeks,googlenews,2020-08-09 10:57:35
Joe Biden predicts there will be an electric Corvette and he's probably right,googlenews,2020-08-09 10:57:35
Potential COVID-19 exposure at 12 Oneida County locations,googlenews,2020-08-09 10:57:35
"Cancer-causing ‘forever chemicals,’ found in McDonald’s, Wendy’s and Burger King food packaging: reports",googlenews,2020-08-09 10:57:35
Whataburger rolls out massive food truck,googlenews,2020-08-09 10:57:35
Coronavirus: Gates Foundation invests in $3 vaccine for poorer countries,googlenews,2020-08-09 10:57:35
"12,000 workers still stranded on cruise ships in American waters because of coronavirus",googlenews,2020-08-09 10:57:35
T-Mobile Touts Its Move Past AT&T,googlenews,2020-08-09 10:57:35
"Businesses blast key Fed program, saying banks not interested in lending",googlenews,2020-08-09 10:57:35
Massive Short Squeeze Prompts Chainlink (LINK) Price to Rally 52%,googlenews,2020-08-09 10:57:35
"RECALL UPDATE: Onions recalled for possible salmonella include Walmart, Publix, Food Lion, more",googlenews,2020-08-09 10:57:35
Atlassian says employees can work from home permanently - Business Insider,googlenews,2020-08-09 10:57:35
"AAA Study Finds Driver Assistance Systems Lacking, Particularly Lane Keeping Assist",googlenews,2020-08-09 10:57:35
Epic Systems loosens mandates on employees returning to work,googlenews,2020-08-09 10:57:35
Saudi Aramco profit drops 50% for first half of the year as pandemic batters oil price,googlenews,2020-08-09 10:57:35
Saudi Arabia Turns Off America’s Oil Taps Again,googlenews,2020-08-09 10:57:35
Saudi Aramco Says Profit Fell 73 Percent as Demand for Oil Shrank,googlenews,2020-08-09 10:57:35
Saudi Aramco half-year profits plunge 50% from virus impact,googlenews,2020-08-09 10:57:35
July unemployment gains lag behind previous months' job growth,googlenews,2020-08-09 10:57:35
"Introducing The Colorado Sun's column on jobs, unemployment and hiring: What's Working?",googlenews,2020-08-09 10:57:35
Opinion: Jobs report shows U.S. economy is in for a long slog,googlenews,2020-08-09 10:57:35
Coronavirus: U.S. adds 1.8 million jobs in July as pandemic continues,googlenews,2020-08-09 10:57:35
Bill Gates says most coronavirus tests in US 'completely garbage' - Business Insider,googlenews,2020-08-09 10:57:35
"Bill Gates Calls US Coronavirus Tests ‘Complete Garbage,' Rips Donald Trump’s ‘Muzzling’ of the CDC",googlenews,2020-08-09 10:57:35
"Windows, Gates and a firewall: Microsoft's delicate castle in China - The Jakarta Post",googlenews,2020-08-09 10:57:35
Bill Gates is spending $150 million to try to make a coronavirus vaccine as cheap as $3,googlenews,2020-08-09 10:57:35
DFC says 'allegations of wrongdoing' have put Kodak deal on hold,googlenews,2020-08-09 10:57:35
Kodak pharma deal held up over reported questions about stock move,googlenews,2020-08-09 10:57:35
Eastman Kodak Share Price Set to Tumble As $765mln Loan Held Up,googlenews,2020-08-09 10:57:35
DFC says Kodak deal on hold,googlenews,2020-08-09 10:57:35
Salmonella linked to onions,googlenews,2020-08-09 10:57:35
Salmonella outbreak linked to onions expands to hundreds of people sickened in 43 states,googlenews,2020-08-09 10:57:35
Coeur d'Alene Press,googlenews,2020-08-09 10:57:35
Onions recalled as more than 600 Americans get sick,googlenews,2020-08-09 10:57:35
The Paycheck Protection Program expires today. The future of the small business rescue plan is in limbo as stimulus talks stall,googlenews,2020-08-09 10:57:35
Some Utah companies getting PPP loans reported having zero employees,googlenews,2020-08-09 10:57:35
PPP loan application window closing,googlenews,2020-08-09 10:57:35
Lawmakers’ Efforts to Restart PPP Stalled by Broader Fight,googlenews,2020-08-09 10:57:35
Covid-19: only half of Britons would definitely have vaccination,googlenews,2020-08-09 10:57:35
Coronavirus vaccine: How much will it cost to immunize and will everyone be able to get it?,googlenews,2020-08-09 10:57:35
'This is not a live virus:' Addressing vaccine trial misconceptions in Las Vegas,googlenews,2020-08-09 10:57:35
Universities in Ankara pool resources to develop Covid-19 vaccine,googlenews,2020-08-09 10:57:35
"Fitch affirms Russia’s sovereign rating at BBB, outlook stable",googlenews,2020-08-09 10:57:35
"After Moody’s, Fitch warns of credit rating risk from uncontained virus",googlenews,2020-08-09 10:57:35
Fitch Ratings sees ‘larger investments’ by telcos in 2021,googlenews,2020-08-09 10:57:35
Buffett buys back record $5.1 billion in Berkshire stock as coronavirus hits operating earnings,googlenews,2020-08-09 10:57:35
Buffett's Grim View of Air Travel Realized in $10 Billion Charge,googlenews,2020-08-09 10:57:35
"Profit up 87% at Buffett's Berkshire, but coronavirus slows businesses",googlenews,2020-08-09 10:57:35
Stock market crash: I'd follow Warren Buffett and buy good-value shares to make a million,googlenews,2020-08-09 10:57:35
Biden says Trump executive order is 'a reckless war on Social Security' | TheHill,googlenews,2020-08-09 10:57:35
"Next Year's Social Security Raise Will Probably Be Meager, at Best",googlenews,2020-08-09 10:57:35
"Next Year's Social Security Raise Will Probably Be Meager, at Best",googlenews,2020-08-09 10:57:35
Joe Biden says Donald Trump is waging a reckless war on Social Security,googlenews,2020-08-09 10:57:35
"Cadillac takes on Tesla, debuts all-electric Lyriq",googlenews,2020-08-09 10:57:35
Cadillac says new electric SUV has features to take on Tesla,googlenews,2020-08-09 10:57:35
"GM unveils its electric Tesla competitor, the Cadillac Lyriq",googlenews,2020-08-09 10:57:35
"Cadillac Lyriq pricing to start under $75,000",googlenews,2020-08-09 10:57:35
"Florida Man, 90, Dies of Coronavirus After Saying Final Farewell to His Wife on Her Deathbed",googlenews,2020-08-09 10:57:35
Devoted Husband Dies Of Coronavirus After Visiting Wife On Her Deathbed,googlenews,2020-08-09 10:57:35
90-year-old ‘Romeo’ dies after likely contracting coronavirus during visit with dying wife: report,googlenews,2020-08-09 10:57:35
Husband: ’The opportunity to say goodbye and hold her hand was worth his life,googlenews,2020-08-09 10:57:35
The Best Under-$30 Clothing and Shoe Deals Hiding in Amazon’s Big Summer Sale,googlenews,2020-08-09 10:57:35
"The best online shopping deals this weekend: Lululemon leggings, face masks in bulk, Amazon summer sale",googlenews,2020-08-09 10:57:35
"Shop Amazon’s Big Summer Sale For Savings on Fashion, Home, Back To School and More",googlenews,2020-08-09 10:57:35
"Amazon Big Summer Sale Event underway with a slew of deals on home essentials, electronics and more",googlenews,2020-08-09 10:57:35
"$11,500 is the Bitcoin Level To Watch During BTC's Weekly Close",googlenews,2020-08-09 10:57:35
"Massive TV campaign launched for Bitcoin, Ethereum and Ripple (XRP)",googlenews,2020-08-09 10:57:35
The Price of Bitcoin Is Facing Its Final Resistance Zone Before $15K,googlenews,2020-08-09 10:57:35
North America may be emerging as the hodling hub of the world,googlenews,2020-08-09 10:57:35
Uber rides take COVID-19 hit but food-delivery business doubles,googlenews,2020-08-09 10:57:35
Uber Earnings Don’t Bode Well for Lyft’s Results Next Week,googlenews,2020-08-09 10:57:35
Delivery becomes Uber's primary business,googlenews,2020-08-09 10:57:35
Uber Sees $1.8bn Loss As Pandemic Stalls Revenue,googlenews,2020-08-09 10:57:35
Mark Zuckerberg Got $5.3 Billion Richer This Week Following Instagram’s Launch Of TikTok Competitor,googlenews,2020-08-09 10:57:35
Mark Zuckerberg joins three-person 'Centibillionaire Club',googlenews,2020-08-09 10:57:35
"Opinion: The TikTok copycat wars are underway, but which app is winning?",googlenews,2020-08-09 10:57:35
Facebook's Zuckerberg sees net worth surpass $100bn,googlenews,2020-08-09 10:57:35
6 Burning Questions After WarnerMedia's Massive Restructure,googlenews,2020-08-09 10:57:35
"WarnerMedia restructures to focus on HBO Max, senior executives out",googlenews,2020-08-09 10:57:35
WarnerMedia execs Max-ed out,googlenews,2020-08-09 10:57:35
Why Is HBO Max Still Not on Roku or Amazon Fire TV?,googlenews,2020-08-09 10:57:35
Virgin Trains no more: Brightline severs ties with Richard Branson empire,googlenews,2020-08-09 10:57:35
Digest: Brightline ends marketing agreement with Virgin Group,googlenews,2020-08-09 10:57:35
Brightline terminates relationship with Virgin Trains but says Virgin disputes the parting,googlenews,2020-08-09 10:57:35
Brightline to drop 'Virgin Trains' brand after licensing termination,googlenews,2020-08-09 10:57:35
Trump advisers urge delisting of some US-listed Chinese firms,googlenews,2020-08-09 10:57:35
How the pandemic and Trump's art of unpredictability have changed China's calculations,googlenews,2020-08-09 10:57:35
White House Plans to Tighten Rules for U.S.-Listed Chinese Companies. Here’s How It Could Play Out.,googlenews,2020-08-09 10:57:35
Trump Interrupts the China Day-Trading Party,googlenews,2020-08-09 10:57:35
Capital One fined $80 million in data breach,googlenews,2020-08-09 10:57:35
Capital One Will Pay $80 Million Fine for Data Breach During Cloud Transfer,googlenews,2020-08-09 10:57:35
Bank regulators crack down on Capital One after its massive data breach,googlenews,2020-08-09 10:57:35
Novavax Partners With Takeda for Japan Output of Covid Drug,googlenews,2020-08-09 10:57:35
COVID-19 Vaccine Developer Has Promising Results From Early Trial,googlenews,2020-08-09 10:57:35
Takeda to supply Novavax's coronavirus vaccine candidate in Japan,googlenews,2020-08-09 10:57:35
"Novavax Announces Deals to Sell Covid-19 Vaccine in India, Japan, and Low-Income Countries",googlenews,2020-08-09 10:57:35
Powerball Drawing For 08/08/20: Saturday Jackpot is $158 Million,googlenews,2020-08-09 10:57:35
Powerball numbers: Did you win Saturday’s $158 million jackpot?,googlenews,2020-08-09 10:57:35
"LOTTO RESULTS LIVE: winning National Lottery numbers for Saturday, August 8, 2020",googlenews,2020-08-09 10:57:35
"Powerball Results, Numbers for 8/8/20: Did Anyone Win the $158 Million?",googlenews,2020-08-09 10:57:35
"Labor of Law: Jones Day Defends Leave Policy | Uber, Lyft Face New Claims | What If an Employee Refuses to Return to Work? | Seyfarth Partner Heads to DOL",googlenews,2020-08-09 10:57:35
"Uber CEO: Labor unions driven by 'politics,' not drivers' interests - Business Insider",googlenews,2020-08-09 10:57:35
"Judge says Uber, Lyft preliminary injunction ruling to come in ‘a matter of days’",googlenews,2020-08-09 10:57:35
"Uber, Lyft drivers in limbo as judge hears arguments in case brought by California",googlenews,2020-08-09 10:57:35
Alaska Airlines announces 'BOGO' deal,googlenews,2020-08-09 10:57:35
"Airline travel may not be for everyone right now, but for those who do want to fly, deals are abundant",googlenews,2020-08-09 10:57:35
"Airline COVID-19 safety rules, compared: Masks, middle seats",googlenews,2020-08-09 10:57:35
Alaska Airlines Launches Buy One Get One Free Fare Sale,googlenews,2020-08-09 10:57:35
Nordstrom shoppers are crazy about these cozy pajamas—and they're on sale,googlenews,2020-08-09 10:57:35
UGG boots are seriously discounted for Nordstrom's Anniversary Sale,googlenews,2020-08-09 10:57:35
The Top 12 Brands to Know From the New Nordstrom Beauty Pop-In,googlenews,2020-08-09 10:57:35
Chrissy Teigen uses this cozy throw every single day—and it's on sale,googlenews,2020-08-09 10:57:35
What credit score is required to buy a house?,googlenews,2020-08-09 10:57:35
Mortgage rates fall to record low. So should you refinance?,googlenews,2020-08-09 10:57:35
30-year mortgage rates sink to another record low,googlenews,2020-08-09 10:57:35
