headline,org,date
"Stock futures rise, Nasdaq paces toward back-to-back sessions of gains ",yahoofinance,2020-09-15 07:49:06
The most important economic question right now,yahoofinance,2020-09-15 07:49:06
"Minkoff: Fashion is having a 'reckoning' with racism, justice",yahoofinance,2020-09-15 07:49:06
Oil market remains fragile as pandemic drives down demand,yahoofinance,2020-09-15 07:49:06
Miami Mayor Francis Suarez on COVID-19 impact on the city,yahoofinance,2020-09-15 07:49:06
Real estate expert on why the housing market is not inflated,yahoofinance,2020-09-15 07:49:06
"Podcast: TikTok & Nvidia, Nikola/Tesla battles, more",yahoofinance,2020-09-15 07:49:06
States struggling the most financially amid COVID,yahoofinance,2020-09-15 07:49:06
Multi-asset investing for uncertain times,yahoofinance,2020-09-15 07:49:06
Biden’s 401(k) plan: Changing tax incentive for retirement is a great idea,yahoofinance,2020-09-15 07:49:06
"Stock market’s 7% pullback? Get ready for more, as a 2009-style ‘stair-step’ rally continues, says Wall Street bull",yahoofinance,2020-09-15 07:49:06
Is Apple Stock A Buy Ahead Of Fall Product Launch Event?,yahoofinance,2020-09-15 07:49:06
The 5G Revolution Could Send These 3 Stocks Higher,yahoofinance,2020-09-15 07:49:06
"For Ray Dalio, a Year of Losses, Withdrawals and Uneasy Staff",yahoofinance,2020-09-15 07:49:06
Still The No. 1 Rule For Stock Market Investors: Always Cut Your Losses Short,yahoofinance,2020-09-15 07:49:06
Best Tech Stocks To Buy Or Watch Now: 5 Growth Stocks Leading The Stock Market,yahoofinance,2020-09-15 07:49:06
Morgan Stanley: 2 Strong Value Stocks to Buy Now,yahoofinance,2020-09-15 07:49:06
"'Very Capable' Team Vetted Nikola Ahead Of $2B Deal, GM CEO Says",yahoofinance,2020-09-15 07:49:06
Joe Biden’s Tax Plan Explained,yahoofinance,2020-09-15 07:49:06
Big Oil Goes Looking for a Career Change,yahoofinance,2020-09-15 07:49:06
6 Bond Replacements To Consider For Your Portfolio,yahoofinance,2020-09-15 07:49:06
Here are the states struggling the most financially during the pandemic,yahoofinance,2020-09-15 07:49:06
"Dow Futures, Apple, Nikola, FedEx - 5 Things You Must Know Tuesday",yahoofinance,2020-09-15 07:49:06
Jim Cramer: Is This Market Undervalued?,yahoofinance,2020-09-15 07:49:06
"Nikola releases more detailed rebuttal to short-seller report, addresses 'rolling down hill' video",yahoofinance,2020-09-15 07:49:06
Kodak $765M Loan Deal Under Scanner Of Federal Agency That Put It Together,yahoofinance,2020-09-15 07:49:06
Ethiopia is demonetizing its economy with new currency to tackle hoarding and illegal trade,yahoofinance,2020-09-15 07:49:06
Carnival Sees Q3 Loss of Around $3 Billion But Says Bookings Starting To Improve,yahoofinance,2020-09-15 07:49:06
Pfizer Poised for Drop After 31% Rally Amid Covid Vaccine Push,yahoofinance,2020-09-15 07:49:06
The most important economic question right now: Morning Brief,yahoofinance,2020-09-15 07:49:06
Jefferies Raises Nvidia Target After Announcement Of ARM Deal,yahoofinance,2020-09-15 07:49:06
FedEx Reports Earnings Tuesday. Here’s What To Expect.,yahoofinance,2020-09-15 07:49:06
Manhattan’s Newest Skyscraper Opens Up to a Dead Midtown,yahoofinance,2020-09-15 07:49:06
12 Beaten Up Stocks That Could Bounce in the Recovery,yahoofinance,2020-09-15 07:49:06
"Millionaires Would Pay Up Under Biden Tax Plans, Study Shows",yahoofinance,2020-09-15 07:49:06
Is Boeing Stock A Buy Right Now In Aviation's New Era Of Survival Mode?,yahoofinance,2020-09-15 07:49:06
Micron Stock Is Still Cheap. Here’s Why That Could Be an Opportunity for Investors.,yahoofinance,2020-09-15 07:49:06
"Sirius XM CEO James Meyer to retire, CFO David Frear to pursue other opportunities",yahoofinance,2020-09-15 07:49:06
Citigroup Resumes Job Cuts Ahead of Risk-Related Reprimand,yahoofinance,2020-09-15 07:49:06
"These 3 Penny Stocks Could Double (Or More), Says BTIG",yahoofinance,2020-09-15 07:49:06
Pfizer Highlights Dozens of Drugs in Its Pipeline. Here’s What It Means to Growth.,yahoofinance,2020-09-15 07:49:06
Nikola Stock Has Slipped. Founder Trevor Milton Bought Up Shares.,yahoofinance,2020-09-15 07:49:06
Oil Demand May Have Already Peaked. Here’s Which Stocks Will Win—and Lose.,yahoofinance,2020-09-15 07:49:06
Wells Fargo Stock: ‘Not So Much a Question of If but When the Stock Will Work’,yahoofinance,2020-09-15 07:49:06
Analyzing Sorrento Therapeutics's Unusual Options Activity,yahoofinance,2020-09-15 07:49:06
Jim Cramer: Stock Splits Make Stocks More Attractive,yahoofinance,2020-09-15 07:49:06
Peloton has nearly $2 billion in cash — and it plans to spend it,yahoofinance,2020-09-15 07:49:06
Cannabis Countdown: Top 10 Marijuana And Psychedelic Stock News Stories Of The Week,yahoofinance,2020-09-15 07:49:06
Snowflake Boosts IPO Price Range to $100- $110,yahoofinance,2020-09-15 07:49:06
Billionaire David Tepper Picks Up These 2 “Strong Buy” Stocks,yahoofinance,2020-09-15 07:49:06
Bill Gross Says Investors Should Play Defense as Stimulus Ebbs,yahoofinance,2020-09-15 07:49:06
10 Largest Beverage Companies,yahoofinance,2020-09-15 07:49:06
Overstock Stock Is Up 975% This Year. How Much Higher Can It Go?,yahoofinance,2020-09-15 07:49:06
Fiat Chrysler shares boosted by PSA merger deal revision,yahoofinance,2020-09-15 07:49:06
Lennar’s Earnings Beat Expectations. Its Stock Is Falling.,yahoofinance,2020-09-15 07:49:06
A Growing Debt Mountain Is Starting to Crack as Asia Buyers Balk,yahoofinance,2020-09-15 07:49:06
6 Investments to Offset Potential Inflation,yahoofinance,2020-09-15 07:49:06
Can You Retire Comfortably if You Only Work a Part-Time Job?,yahoofinance,2020-09-15 07:49:06
Cassava Sciences rockets on heavy volume after Alzheimer's drug trial results prompts analyst upgrade,yahoofinance,2020-09-15 07:49:06
"‘There Is Little Money to Be Made Almost Anywhere in The World,’ Bill Gross Says",yahoofinance,2020-09-15 07:49:06
SEC opens probe as GM CEO Mary Barra defends Nikola partnership,yahoofinance,2020-09-15 07:49:06
10 Biggest Renewable Energy Companies,yahoofinance,2020-09-15 07:49:06
Online Gambling Stock Surges Past Buy Range On ESPN Deal,yahoofinance,2020-09-15 07:49:06
Oil Rises With China Economic Data Countering Demand Fears,yahoofinance,2020-09-15 07:49:06
"Nikola shares take wild ride after denial of short-seller’s allegations, report of SEC inquiry",yahoofinance,2020-09-15 07:49:06
"Nvidia Aims To Take On Intel, AMD In Servers With Arm Acquisition",yahoofinance,2020-09-15 07:49:06
"Vanguard faults Alphabet on CEO pay, names new proxy chief",yahoofinance,2020-09-15 07:49:06
Gold gains as dollar softens ahead of Fed meeting,yahoofinance,2020-09-15 07:49:06
IPO market gears up for busiest week since May 2019 — when Uber went public — with 12 deals on tap,yahoofinance,2020-09-15 07:49:06
"Stock market news live updates: Stock futures rise, Nasdaq paces toward back-to-back sessions of gains",yahoofinance,2020-09-15 07:49:06
Billionaires Line Up to Take Their Unloved Companies Private,yahoofinance,2020-09-15 07:49:06
Liz Weston: Are Medicare Advantage plans worth the risk?,yahoofinance,2020-09-15 07:49:06
"CVS Health cuts net earnings outlook, but maintains adjusted EPS guidance",yahoofinance,2020-09-15 07:49:06
BioNTech shares jump premarket on news of 375 million euros in German funding for COVID-19 vaccine,yahoofinance,2020-09-15 07:49:06
"Dow Jones Stocks To Buy And Watch In September 2020: Amgen, Apple, Home Depot, Microsoft",yahoofinance,2020-09-15 07:49:06
Christine Lagarde Has Bigger Problems Than the Euro,yahoofinance,2020-09-15 07:49:06
BioNTech wins $445 mln German grant for COVID-19 vaccine,yahoofinance,2020-09-15 07:49:06
Nvidia’s deal with Arm paves the path to a trillion-dollar market value,yahoofinance,2020-09-15 07:49:06
Analysts: 3 Tech Stocks to Buy on Weakness,yahoofinance,2020-09-15 07:49:06
Cloud Software Firm Snowflake Leads a Slate of Tech IPOs on the Horizon,yahoofinance,2020-09-15 07:49:06
AP EXPLAINS: Biden's sizable but not radical tax plans,yahoofinance,2020-09-15 07:49:06
Delta Taps Miles For Debt After Analyst Warns Some Demand 'Permanently Destroyed',yahoofinance,2020-09-15 07:49:06
"Buy Kimco Stock, Sell Macerich, Morgan Stanley Says. It’s All About REIT Cash Flow.",yahoofinance,2020-09-15 07:49:06
Arm co-founder starts 'Save Arm' campaign to keep independence amid $40B Nvidia deal,yahoofinance,2020-09-15 07:49:06
"What Are FANG Stocks, And Should You Invest In Them?",yahoofinance,2020-09-15 07:49:06
EU Tells Xi That China Must Show Investment Deal Worthwhile,yahoofinance,2020-09-15 07:49:06
Fintech Startup Klarna Is Valued at $10.65 Billion in New Funding,yahoofinance,2020-09-15 07:49:06
"I moved into my in-laws’ home. My husband wants to pay his parents’ mortgage, but it will come out of my income. How can I protect myself?",yahoofinance,2020-09-15 07:49:06
PepsiCo's new DriftWell aimed at aiding relaxation and sleep,yahoofinance,2020-09-15 07:49:06
Tesla Stock Rises as Musk Tweets About ‘Many Exciting Things’ Coming on Batteries,yahoofinance,2020-09-15 07:49:06
Arm Co-Founder On Nvidia Deal: Sale To 'Americans' A 'Disaster' For Europe,yahoofinance,2020-09-15 07:49:06
"U.S. shale oil output to drop 68,000 bpd to 7.64 million bpd in October - EIA",yahoofinance,2020-09-15 07:49:06
Gilead Makes Its Biggest Buy Ever And Gets A 'Flagship' Cancer Drug,yahoofinance,2020-09-15 07:49:06
Confused About What Oracle’s Deal With TikTok Means? Here’s What to Look For.,yahoofinance,2020-09-15 07:49:06
Things Look Less Dim for Verizon Communications After Acquisition,yahoofinance,2020-09-15 07:49:06
Verizon Is Paying $6.3 Billion for TracFone. How the Deal Is a Strategy Shift for Verizon.,yahoofinance,2020-09-15 07:49:06
IBD Stock Of The Day: Gold Stock Agnico Eagle Breaks Out On Fed Hopes,yahoofinance,2020-09-15 07:49:06
Think U.S. Stock Market Gains Are Concentrated? Just Look at India,yahoofinance,2020-09-15 07:49:06
Unusual Options Activity Insight: Shopify,yahoofinance,2020-09-15 07:49:06
Don't count on a 'Payroll Tax Holiday' at your workplace. Here's why many employers are passing it up.,yahoofinance,2020-09-15 07:49:06
"GoodRx offers founders $500M, nets $100M investment from Silver Lake, and makes quiet acquisition before IPO",yahoofinance,2020-09-15 07:49:06
Senior HSBC mainland China banker defects to Bank of America,yahoofinance,2020-09-15 07:49:06
Icahn’s Navistar Presses VW to Boost Bid From $3.6 Billion,yahoofinance,2020-09-15 07:49:06
Tencent becomes latest Chinese firm to invest in Singapore with new Southeast Asia hub,yahoofinance,2020-09-15 07:49:06
Adobe Reports Earnings Tomorrow. Here’s What to Expect.,yahoofinance,2020-09-15 07:49:06
A Look Into Mallinckrodt's Debt,yahoofinance,2020-09-15 07:49:06
"Nikola: Fundamental Questions Still Remain, Says Analyst",yahoofinance,2020-09-15 07:49:06
Palantir filing suggests valuation of around $25 billion ahead of U.S. listing,yahoofinance,2020-09-15 07:49:06
Exclusive: EU to delay euro clearing decision on Brexit divorce threat - source,yahoofinance,2020-09-15 07:49:06
Cloud company Snowflake raises IPO price range to $100 to $110 vs. prior $75 to $85,yahoofinance,2020-09-15 07:49:06
10 Major Upcoming IPOs to Watch in 2020,yahoofinance,2020-09-15 07:49:06
Options Pits Buzzing Ahead of Adobe's Q3 Report,yahoofinance,2020-09-15 07:49:06
Nikola Stock Rebounds As Key Analyst Defends EV Maker; SEC Probe Buzz Hits Shares Late,yahoofinance,2020-09-15 07:49:06
Best Telecom ETFs for Q4 2020,yahoofinance,2020-09-15 07:49:06
Pound Traders See Opportunity in U.K.-EU Brexit Dispute,yahoofinance,2020-09-15 07:49:06
DraftKings Stock Hits a Record on the Back of a Deal With ESPN,yahoofinance,2020-09-15 07:49:06
Berkshire's BNSF names first female CEO of big U.S. railroad,yahoofinance,2020-09-15 07:49:06
Fake Meat Stocks: 6 Biggest Winners in the Meatless Revolution,yahoofinance,2020-09-15 07:49:06
'Like somebody turned off a switch': Small businesses say USPS delays are hitting them hard,yahoofinance,2020-09-15 07:49:06
Oracle Deal With TikTok to Undergo U.S. Security Review,wsj,2020-09-15 07:51:23
U.S. Stock Futures Tick Up Ahead of Economic Data,wsj,2020-09-15 07:51:23
"China’s Economy Picks Up Speed as Shoppers, Moviegoers Return",wsj,2020-09-15 07:51:23
Former Nissan Executive Greg Kelly Pleads Not Guilty at Tokyo Trial,wsj,2020-09-15 07:51:23
Smoke and Winds Worsen in Deadly West Coast Wildfires,wsj,2020-09-15 07:51:23
Calpers Weighs Curbs on Investment Chief’s Personal Holdings,wsj,2020-09-15 07:51:23
Covid-19 Test Maker Examines False-Positive Results in Nursing Homes,wsj,2020-09-15 07:51:23
"Apple Event: New Watch, iPad Expected as iPhone Seen Coming Later",wsj,2020-09-15 07:51:23
"Making Offices Safe for Workers, and Making Money Doing It",wsj,2020-09-15 07:51:23
Steven Cohen Reaches Deal to Buy New York Mets,wsj,2020-09-15 07:51:23
Is There Life on Venus? Scientists Say Maybe,wsj,2020-09-15 07:51:23
The NBA Bubble Was Built for Comebacks,wsj,2020-09-15 07:51:23
The End of a Cycling Dynasty,wsj,2020-09-15 07:51:23
Want to Return Your Lockdown Pink Hair to Normal? It’s Not So Easy,wsj,2020-09-15 07:51:23
Ernst & Young Says Auditors Should Play Bigger Role in Detecting Fraud,wsj,2020-09-15 07:51:23
Chinese Companies in Pentagon Spotlight Hire Global Banks to Sell Dollar Bonds,wsj,2020-09-15 07:51:23
A Spoonful of Suga Could Sweeten Japan’s Post-Abe Economy,wsj,2020-09-15 07:51:23
How Biotech Investors Can Survive Election Season,wsj,2020-09-15 07:51:23
German Stocks Show Strength in Europe’s Battered Market,wsj,2020-09-15 07:51:23
Kraft Heinz Plans $2 Billion in Cost Cuts,wsj,2020-09-15 07:51:23
H&M’s Coronavirus Recovery Beats Expectations,wsj,2020-09-15 07:51:23
Facebook Buys REI’s Headquarters as Pandemic Prompts Sale,wsj,2020-09-15 07:51:23
Hurricane Sally Churns Toward Central Gulf Coast,wsj,2020-09-15 07:51:23
"After Navalny Poisoning, Putin’s Loyalists Win Big in Russian Elections",wsj,2020-09-15 07:51:23
Israel Girds for Covid-19 Disruptions to Jewish Holidays,wsj,2020-09-15 07:51:23
A New Prescription: A Dose of Live Music for Hospital Patients,wsj,2020-09-15 07:51:23
I Watch Sports for a Living. There Are Too Many Sports Right Now.,wsj,2020-09-15 07:51:23
"As Out-of-Towners Light Up Lake Tahoe, a Waterfront Home Lists for $44 Million",wsj,2020-09-15 07:51:23
New Insights Into Dreams and What They Say About Us,wsj,2020-09-15 07:51:23
" Economy Week Ahead: Consumers, Industrial Output and Central Banks ",wsj,2020-09-15 07:51:23
 Why Fed Officials Are Pushing for More Stimulus From Lawmakers ,wsj,2020-09-15 07:51:23
 Pandemic Job Market Has Bright Spots for Recent High School Grads ,wsj,2020-09-15 07:51:23
 A Castle Amid the Pines ,wsj,2020-09-15 07:51:23
 An Investor Bought a Coral Gables Home for $27.8 Million Last Year. Now He’s Relisting It for $49.9 Million. ,wsj,2020-09-15 07:51:23
" As Out-of-Towners Light Up Lake Tahoe, a Waterfront Home Lists for $44 Million ",wsj,2020-09-15 07:51:23
 The NFL is Back and Sports Bettors Are Following ,wsj,2020-09-15 07:51:23
 Don’t Blame Politics for NFL’s Slow Start ,wsj,2020-09-15 07:51:23
 The End of a Cycling Dynasty ,wsj,2020-09-15 07:51:23
"When One Spouse Gets an Inheritance, It Can Be Hard on a Marriage",wsj,2020-09-15 07:51:23
How to Keep Debt From Wrecking a New Marriage,wsj,2020-09-15 07:51:23
How the Secure Act Could Affect Retirement Savers,wsj,2020-09-15 07:51:23
Facebook Starts an Ad-Free Section for College Students,wsj,2020-09-15 07:51:23
USPS Campaign Aims to Educate Public About Mail-In Ballot Process,wsj,2020-09-15 07:51:23
Ulta Beauty Returns to TV Advertising After a Pandemic Pause,wsj,2020-09-15 07:51:23
"California Utilities Hope Drones, AI Will Lower Risk of Future Wildfires",wsj,2020-09-15 07:51:23
Autonomous Robots Are Coming to the Operating Room,wsj,2020-09-15 07:51:23
Pandemic Tech Spending in China Lifts Alibaba’s Cloud,wsj,2020-09-15 07:51:23
U.K. Names Chief for New Accounting Board,wsj,2020-09-15 07:51:23
Xerox Names Company Veteran as Interim Finance Chief,wsj,2020-09-15 07:51:23
Deals Are Being Dropped as Buyers Turn Wary During the Pandemic,wsj,2020-09-15 07:51:23
Deutsche’s Compliance Procedures Limit Damage of Sanctions Settlement,wsj,2020-09-15 07:51:23
The Morning Risk Report,wsj,2020-09-15 07:51:23
CFTC Issues Guidance on Corporate Compliance Programs,wsj,2020-09-15 07:51:23
West Coast Freight Networks ‘Bursting at the Seams’ With Surging Imports,wsj,2020-09-15 07:51:23
E-Commerce Driving Shipping Surge at France’s CMA CGM,wsj,2020-09-15 07:51:23
Today’s Logistics Report: Shipping’s E-Commerce Drive; Short-Selling Nikola; Trucking’s Cyber Guards,wsj,2020-09-15 07:51:23
A Reopened Beauty Boutique Is Focusing on Sustaining its Momentum,wsj,2020-09-15 07:51:23
William Hill Stock Surges on Caesars’ Deal With ESPN,wsj,2020-09-15 07:51:23
Why Micron Stock Could Be an Opportunity for Investors,wsj,2020-09-15 07:51:23
"Dow aims to extend gains as investors await Apple event, fresh economic data and start of Fed meeting",wsj,2020-09-15 07:51:23
"Francesca's shares slide premarket as retailer says it's exploring options, sees doubt it can continue as going concern",wsj,2020-09-15 07:51:23
"Carnival's stock slumps after ship disposals increased, net loss outlook",wsj,2020-09-15 07:51:23
Devoted Fans of J.R.R. Tolkien Will Love This House on the California Coast,wsj,2020-09-15 07:51:23
Smart Tech to Babyproof Your Home,wsj,2020-09-15 07:51:23
Elvis Presley’s Former Los Angeles Home Sells for Nearly $30 Million,wsj,2020-09-15 07:51:23
Picasso’s Portrait of Dora Maar Could Fetch $30 Million at Christie’s,wsj,2020-09-15 07:51:23
Online-Only Auction Sales Rise 255% in 2020,wsj,2020-09-15 07:51:23
The Future of Private Jets,wsj,2020-09-15 07:51:23
Biden of the Climate Apocalypse,wsj,2020-09-15 07:51:23
The Misguided Antitrust Attack on Big Tech,wsj,2020-09-15 07:51:23
Confessions of a New Gun Owner,wsj,2020-09-15 07:51:23
Some Covid-19 Survivors Grapple With Large Medical Bills,wsj,2020-09-15 07:51:23
The Rise of TikTok: From Chinese App to Global Sensation,wsj,2020-09-15 07:51:23
"Trump, Biden Present Different Views on Wildfires",wsj,2020-09-15 07:51:23
U.S. Debt Poised to Reach Milestone Not Seen Since World War II,wsj,2020-09-15 07:51:23
Why America's Jobs Recovery Is Different From Other Countries',wsj,2020-09-15 07:51:23
Trump and Biden Both Want to Reduce the Number of U.S. Troops Abroad,wsj,2020-09-15 07:51:23
Gyms Brace for Fewer Members as At-Home Fitness Rises During Pandemic,wsj,2020-09-15 07:51:23
Researchers Look to Lab-Made Solution for Future Blood Shortages,wsj,2020-09-15 07:51:23
"Oracle Wins Bid for TikTok in U.S., Beating Microsoft",wsj,2020-09-15 07:51:23
Opinion: ‘We Hope They Die’,wsj,2020-09-15 07:51:23
Flu vs. Covid: Ways to Identify Symptoms and Differences,wsj,2020-09-15 07:51:23
Smoke and Winds Worsen in Deadly West Coast Wildfires,wsj,2020-09-15 07:51:23
How Travel Will Change Post-Pandemic: 10 Expert Predictions,wsj,2020-09-15 07:51:23
Zoom's Blank Check: What To Do When You Have An Expensive Stock And No Moats,seekingalpha,2020-09-15 07:53:10
AbbVie: The Time Is Now,seekingalpha,2020-09-15 07:53:10
Rating Apple's New Multiple Against 3 Scenarios,seekingalpha,2020-09-15 07:53:10
This Is One Of The Greatest Secular Growth Trends,seekingalpha,2020-09-15 07:53:10
"Snowflake IPO: Don't Overpay, $50 Target Price",seekingalpha,2020-09-15 07:53:10
General Electric's Moat Continues To Deteriorate,seekingalpha,2020-09-15 07:53:10
UDR: A Diamond In The Rough And New Strong Buy Pick,seekingalpha,2020-09-15 07:53:10
Wall Street Breakfast: 'Time Flies' At Apple Event,seekingalpha,2020-09-15 07:53:10
Energy Transfer Remains A Strong Buy,seekingalpha,2020-09-15 07:53:10
Buy These 5 Unknown Dividend Stocks With Yields Up To 10.8%,seekingalpha,2020-09-15 07:53:10
First Look At Snowflake's IPO,seekingalpha,2020-09-15 07:53:10
Carnival -3% after filing to sell up to $1B worth of shares,seekingalpha,2020-09-15 07:53:10
Walmart launches highly anticipated delivery service,seekingalpha,2020-09-15 07:53:10
3M guides Q3 revenue above consensus,seekingalpha,2020-09-15 07:53:10
Futures indicate more gains as rebound gains steam,seekingalpha,2020-09-15 07:53:10
Amazon launches Luxury Stores with Oscar de la Renta collections,seekingalpha,2020-09-15 07:53:10
EMA accepts Bristol Myers application for O+Y for first-line treatment of type of lung cancer,seekingalpha,2020-09-15 07:53:10
CVS Health reaffirms full year adjusted EPS guidance ahead of investor meetings,seekingalpha,2020-09-15 07:53:10
European regulators thumbs up on Mylan-Upjohn tie-up,seekingalpha,2020-09-15 07:53:10
Novavax boosts COVID-19 vaccine production capacity to 2B doses per year,seekingalpha,2020-09-15 07:53:10
Microsoft teams up with BP to achieve net zero carbon goals and sustainable future,seekingalpha,2020-09-15 07:53:10
Alibaba considering Zhaopin investment - The Information,seekingalpha,2020-09-15 07:53:10
Argonaut Gold: Ana Paula Sale A Smart Move,seekingalpha,2020-09-15 07:53:10
Closed-End Funds: Semi-Annual And Annual Distribution Payers,seekingalpha,2020-09-15 07:53:10
XYLD: S&P 500 Covered Call ETF - 6.76% Yield,seekingalpha,2020-09-15 07:53:10
"UPS: New CEO, New Strategy To Deliver Sustainable Alpha",seekingalpha,2020-09-15 07:53:10
The Chemist's 'High-High-Low' Closed-End Fund Report: August 2020,seekingalpha,2020-09-15 07:53:10
UBS examines election impacts on communications/media names,seekingalpha,2020-09-15 07:53:10
J.P. Morgan weighs names to gain from sporting goods' direct-to-consumer shift,seekingalpha,2020-09-15 07:53:10
"Evercore picks automakers, suppliers to gain from early valuation roll",seekingalpha,2020-09-15 07:53:10
CFRA latest to pick infrastructure winners in a White House turnover,seekingalpha,2020-09-15 07:53:10
"Oppenheimer weighs prospects of Biden victory for industrial, resource names",seekingalpha,2020-09-15 07:53:10
BlackBerry Must Deliver Now,seekingalpha,2020-09-15 07:53:10
AbbVie: The Time Is Now,seekingalpha,2020-09-15 07:53:10
The Dollar Softens Ahead Of The FOMC,seekingalpha,2020-09-15 07:53:10
Virios Therapeutics Seeks IPO For Fibromyalgia Pain Treatment,seekingalpha,2020-09-15 07:53:10
CytoDyn: Bulls Continue To Get Torpedoed But The Thesis Remain Afloat,seekingalpha,2020-09-15 07:53:10
CytoDyn: Bulls Continue To Get Torpedoed But The Thesis Remain Afloat,seekingalpha,2020-09-15 07:53:10
Rating Apple's New Multiple Against 3 Scenarios,seekingalpha,2020-09-15 07:53:10
"Like A Phoenix, Melrose Is Currently On Fire, But It Will Rise From The Ashes And Take Flight",seekingalpha,2020-09-15 07:53:10
E-L Financial Trades At 46% Of Book Value With Potential Catalysts,seekingalpha,2020-09-15 07:53:10
First Majestic Lands Major Financing From Sprott,seekingalpha,2020-09-15 07:53:10
AbbVie: The Time Is Now,seekingalpha,2020-09-15 07:53:10
UDR: A Diamond In The Rough And New Strong Buy Pick,seekingalpha,2020-09-15 07:53:10
"Federal Realty Investment Trust: Dividend-Capture Covered Calls, Aristocrat Income",seekingalpha,2020-09-15 07:53:10
14% Yields With High Risk From AG Mortgage Preferred Shares,seekingalpha,2020-09-15 07:53:10
SteelPath September MLP Updates And News,seekingalpha,2020-09-15 07:53:10
SIVR Weekly: Patience While Some ETF Investors Get Frustrated,seekingalpha,2020-09-15 07:53:10
"4 Funds Bought In August, Mixture Of Opportunity And Speculation",seekingalpha,2020-09-15 07:53:10
Global X SuperDividend REIT ETF: A Potential Safe Haven For An 8% Yield,seekingalpha,2020-09-15 07:53:10
Vanguard Value ETF: Now May Be The Time To Dive In,seekingalpha,2020-09-15 07:53:10
VXZ: Not A Strong Portfolio Hedge In Volatile Times,seekingalpha,2020-09-15 07:53:10
The Dollar Softens Ahead Of The FOMC,seekingalpha,2020-09-15 07:53:10
"World Markets Update: September 14, 2020",seekingalpha,2020-09-15 07:53:10
SteelPath September MLP Updates And News,seekingalpha,2020-09-15 07:53:10
Natural Gas Will Gain From Energy Storage Constraint,seekingalpha,2020-09-15 07:53:10
A Benign Price Cycle For Gold,seekingalpha,2020-09-15 07:53:10
One bright spot,cnnbusiness,2020-09-15 07:55:16
There's an emerging winner of the pandemic economy,cnnbusiness,2020-09-15 07:55:16
China's economy shrugs off global slump as shoppers join the recovery,cnnbusiness,2020-09-15 07:55:16
Apple TV+ and gaming made a splash last year. We haven't heard much since,cnnbusiness,2020-09-15 07:55:16
This was Apple's first 'iPad.' It failed miserably,cnnbusiness,2020-09-15 07:55:16
The great grocery boom is slowing down,cnnbusiness,2020-09-15 07:55:16
Facebook buys an unused headquarters even as employees work remotely,cnnbusiness,2020-09-15 07:55:16
Trump's TikTok showdown is poised to reward his Silicon Valley allies,cnnbusiness,2020-09-15 07:55:16
'Oracle just completely saved the day': TikTok users react to looming deal,cnnbusiness,2020-09-15 07:55:16
How Oracle ended up with TikTok,cnnbusiness,2020-09-15 07:55:16
Trump administration provides first details on how a TikTok ban would work,cnnbusiness,2020-09-15 07:55:16
YouTube announces its own TikTok competitor,cnnbusiness,2020-09-15 07:55:16
Mall owner Simon Property Group will keep stores closed on Thanksgiving,cnnbusiness,2020-09-15 07:55:16
Refi rates at 2.42% APR (15 yr). Do you qualify?,cnnbusiness,2020-09-15 07:55:16
What to expect at Tuesday's Apple event,cnnbusiness,2020-09-15 07:55:16
"FedEx is hiring 70,000 workers to meet holiday season demand",cnnbusiness,2020-09-15 07:55:16
Daimler to pay $1.5 billion in emissions cheating settlement with the US,cnnbusiness,2020-09-15 07:55:16
Pepsi's new drink aims to help you sleep,cnnbusiness,2020-09-15 07:55:16
How to help employees deal with guilt after layoffs,cnnbusiness,2020-09-15 07:55:16
What companies are doing to set WFH balance,cnnbusiness,2020-09-15 07:55:16
Hate working from home? Here's how to make it better,cnnbusiness,2020-09-15 07:55:16
