headline,org,date
The Future of Land Values in 2021,thestreet,2021-02-01 15:51:46
Here’s What Retail Recovery Looks Like In 2021,thestreet,2021-02-01 15:51:46
Five Stock Market Myths That Are Keeping You From Investing,thestreet,2021-02-01 15:51:46
Four Financial ‘Experts’ You Should Never Listen To,thestreet,2021-02-01 15:51:46
Answering Client Questions About Investing in Gold,thestreet,2021-02-01 15:51:46
Should You and Your Spouse File Taxes Jointly or Separately?,thestreet,2021-02-01 15:51:46
Ways to Increase Your Tax Refund You Never Thought About,thestreet,2021-02-01 15:51:46
How to Evolve Your Financial Goals When Your Income Has Changed,thestreet,2021-02-01 15:51:46
Jim Cramer on GameStop's Future: Where He Sees a 'Suboptimal' Situation,thestreet,2021-02-01 15:51:46
Reddit-Fueled Retail Investing Fever Has Crossed the U.S. Border,thestreet,2021-02-01 15:51:46
Short-Selling: What Jim Cramer Learned From His Experiences,thestreet,2021-02-01 15:51:46
"Silver Becomes the Next GameStop, Hitting Eight-Year Highs",thestreet,2021-02-01 15:51:46
Why Jim Cramer Prefers Bitcoin Over Silver,thestreet,2021-02-01 15:51:46
First Solar Pares Losses as Silver Price Concerns Weigh on Stock,thestreet,2021-02-01 15:51:46
Stock Market Today With Jim Cramer: WallStreetBets and Stocks,thestreet,2021-02-01 15:51:46
"Jim Cramer: What Reported Talks Between Exxon, Chevron Say About Oil Industry",thestreet,2021-02-01 15:51:46
Why Jim Cramer Doesn't Like Piper Sandler's Tesla Price Target Boost,thestreet,2021-02-01 15:51:46
Moderna Slides as Bank of America Cuts to Underperform on Valuation,thestreet,2021-02-01 15:51:46
Jim Cramer Says Lowe's Demonstrates Problem With 'Static' Analyst Notes,thestreet,2021-02-01 15:51:46
Virgin Galactic Announces New Launch Window Beginning Feb. 13,thestreet,2021-02-01 15:51:46
What Jim Cramer Wants to See From Robinhood,thestreet,2021-02-01 15:51:46
"Reddit, Robinhood, Risk: Jim Cramer's Stock Market Breakdown",thestreet,2021-02-01 15:51:46
"iShares Silver Trust, Virgin Galactic, Viela Bio: 5 Stock Gainers for Monday",thestreet,2021-02-01 15:51:46
Stitch Fix Downgraded to Hold by Stifel on Valuation,thestreet,2021-02-01 15:51:46
American Airlines Dips as Seaport Global Sees Extended Recovery,thestreet,2021-02-01 15:51:46
"Dan Ives on Tech Outlook, Biden Presidency, Tesla and More",thestreet,2021-02-01 15:51:46
How to Break Diversity Barriers on Wall Street,thestreet,2021-02-01 15:51:46
Eaton Corp. Up on Pact to Buy Cobham Refueling Unit in $2.83B Deal,thestreet,2021-02-01 15:51:46
Bed Bath & Beyond Off; 'Experiences' to Replace 'Things' Post-Pandemic,thestreet,2021-02-01 15:51:46
Exxon and Chevron Talked Merger - Senator Voices Concerns,thestreet,2021-02-01 15:51:46
"Apple Reportedly Issuing Bonds, Even With $36 Billion Cash on Hand",thestreet,2021-02-01 15:51:46
Jim Cramer on GameStop's Future: Where He Sees a 'Suboptimal' Situation,thestreet,2021-02-01 15:51:46
Jim Cramer Says Lowe's Demonstrates Problem With 'Static' Analyst Notes,thestreet,2021-02-01 15:51:46
"Rapper Ja Rule says GameStop frenzy, stock market can be fun for young investors but be careful",googlenews,2021-02-01 15:53:44
"Economy to grow at fastest pace since 1999, says Congressional Budget Office",googlenews,2021-02-01 15:53:44
Silver surges as Reddit army targets precious metals,googlenews,2021-02-01 15:53:44
"Stocks climb in calmer trading, while silver prices jump",googlenews,2021-02-01 15:53:44
"U.S. House subcommittee to investigate Tyson, other meat companies",googlenews,2021-02-01 15:53:44
U.S. construction spending hits record high in December,googlenews,2021-02-01 15:53:44
Questions surround AstraZeneca vaccine use for elderly,googlenews,2021-02-01 15:53:44
WPP shares rise after deal with TikTok,googlenews,2021-02-01 15:53:44
Elon Musk claims Neuralink created a brain implant that a monkey is using ‘to play video games with his mind’,googlenews,2021-02-01 15:53:44
COVID-19 vaccines to stress-test grocery stores and pharmacies,googlenews,2021-02-01 15:53:44
JetBlue reveals suites with sliding doors for London flights,googlenews,2021-02-01 15:53:44
"Dow Jones Today, Stocks Rebound Amid Stimulus Talks; Tesla's Target Doubled, Reddit Crew Buys Silver",googlenews,2021-02-01 15:53:44
"AMC Entertainment, Tesla and Exxon Rise Premarket By Investing.com",googlenews,2021-02-01 15:53:44
All the Celebrities Who Have Received the COVID-19 Vaccine,googlenews,2021-02-01 15:53:44
Biden approves $230m for Covid home test kits that take 15 minutes and are 95% accurate,googlenews,2021-02-01 15:53:44
"Popeyes gets into GameStop, AMC stock action with free food while Subway has a tuna deal following lawsuit",googlenews,2021-02-01 15:53:44
When Will The Ride End? Analyzing GameStop Short Squeeze By Looking At History,googlenews,2021-02-01 15:53:44
2 Stocks That Wall Street Hates but You'll Probably Like,googlenews,2021-02-01 15:53:44
Ghost kitchens and delivery-only restaurants may be too popular for their own good,googlenews,2021-02-01 15:53:44
The impact of the GameStop and AMC drama on the corporate bond market,googlenews,2021-02-01 15:53:44
Ford vehicles will run on Android Auto starting in 2023,googlenews,2021-02-01 15:53:44
Northeast blizzard complicates Covid-19 vaccination efforts,googlenews,2021-02-01 15:53:44
Major snowstorm creating widespread flight disruptions,googlenews,2021-02-01 15:53:44
"Michigan restaurants can officially reopen indoor dining today with curfew, other COVID safety restrictions",googlenews,2021-02-01 15:53:44
MTA Outdoor Subway Service in NY Will Be Shut Down Due to Storm,googlenews,2021-02-01 15:53:44
How the GameStop options frenzy could price itself out of existence,googlenews,2021-02-01 15:53:44
Bing to the rescue: Microsoft happy to step in if Google pulls out of Australia,googlenews,2021-02-01 15:53:44
First commercial biofuel booster rocket launches in Maine,googlenews,2021-02-01 15:53:44
PPP Aid to Small Businesses: How Much Did $500 Billion Help?,googlenews,2021-02-01 15:53:44
Personal data of 1.4 million Washington unemployment claimants exposed in hack of state auditor,googlenews,2021-02-01 15:53:44
Dunkin' rolls out 'Free Coffee Mondays' following hundreds of store closings,googlenews,2021-02-01 15:53:44
"Exxon Mobil, Chevron CEOs discussed merger: report",googlenews,2021-02-01 15:53:44
Don't Share Your Vaccine Card on Social Media,googlenews,2021-02-01 15:53:44
Private jet company Wheels Up to go public in a $2 billion SPAC deal that could help it unlock new markets,googlenews,2021-02-01 15:53:44
Robinhood Forced to Raise Another $2.4 Billion Despite Limiting GameStop Trades,googlenews,2021-02-01 15:53:44
"Facebook strikes back against Apple privacy change, prompts users to accept tracking to get 'better ads experience'",googlenews,2021-02-01 15:53:44
Tilman Fertitta Enters Into Deal To Take Golden Nugget/Landry's Public,googlenews,2021-02-01 15:53:44
Gold prices holding steady following drop in U.S. ISM Manufacturing Index,googlenews,2021-02-01 15:53:44
Goldman Expects Oil Demand To Rebound To 100 Million Bpd By August,googlenews,2021-02-01 15:53:44
"Novavax: After 'Spectacular' COVID Vaccine Data Fuels Big Upside, Investors' Next Call Is A Tough One",googlenews,2021-02-01 15:53:44
"Today's mortgage refinance rates climb upward | February 1, 2021",googlenews,2021-02-01 15:53:44
The government can help people pay off student loans and be fair about it. Here's how.,googlenews,2021-02-01 15:53:44
"As Virgin Galactic gets swept up in GameStop mania, it gets back to flying",googlenews,2021-02-01 15:53:44
"The Verge’s 2021 Valentine’s Day Gift Guide for girlfriends, boyfriends, and partners",googlenews,2021-02-01 15:53:44
23 Black leaders who are shaping history today,googlenews,2021-02-01 15:53:44
See Nike's new 'hands-free' shoe,googlenews,2021-02-01 15:53:44
"Amazon, Alphabet and Salesforce are all investing in a $28 billion company that crunches big data",googlenews,2021-02-01 15:53:44
Citadel Silver Holding Exposes Rifts in WallStreetBets Army,googlenews,2021-02-01 15:53:44
XRP Pump Fails to Materialize as Price Crashes 40% From Day's High - CoinDesk,googlenews,2021-02-01 15:53:44
"Wall Street Breakfast: Hi-Ho, Silver! Away!",googlenews,2021-02-01 15:53:44
26 Stocks Moving in Monday's Pre-Market Session,googlenews,2021-02-01 15:53:44
Analyst says AMC stock now a 'sell' as price target drops to $1,googlenews,2021-02-01 15:53:44
Jim Cramer on the short squeeze hitting silver prices,googlenews,2021-02-01 15:53:44
GOP protesters 'Re-Occupy Wall Street' over GameStop stock controversy,googlenews,2021-02-01 15:53:44
Dr. Fauci Says These 2 Side Effects Mean Your COVID Vaccine Is Working,googlenews,2021-02-01 15:53:44
"Another Promising Vaccine, This One From Johnson & Johnson",googlenews,2021-02-01 15:53:44
"3 Big Things Today, February 1, 2021",googlenews,2021-02-01 15:53:44
Will China's NIO Be the First Real 'Tesla Killer'?,googlenews,2021-02-01 15:53:44
Ford (F) to Post Q4 Earnings: What's in Store for the Stock?,googlenews,2021-02-01 15:53:44
Resist the urge to share a picture of your vaccine card,googlenews,2021-02-01 15:53:44
Who Are The People Making Money In The GameStop Stock Frenzy? | TODAY,googlenews,2021-02-01 15:53:44
"As Chicago re-enters Phase 4, non-essential curfew lifted but indoor capacity won’t change, mayor says",googlenews,2021-02-01 15:53:44
Shares of audio technology company Agora soar as investors try to jump on Clubhouse app's growth,googlenews,2021-02-01 15:53:44
Spin? Tesla website hid normal steering wheel option to bizarre yoke,googlenews,2021-02-01 15:53:44
Silver surges past $30 as retail investors pile in,googlenews,2021-02-01 15:53:44
Oakland Airport now selling COVID-19 tests in vending machines,googlenews,2021-02-01 15:53:44
How GameStop Changed The Market Forever,googlenews,2021-02-01 15:53:44
Toys R Us closes its last 2 US stores,googlenews,2021-02-01 15:53:44
Confused about this GameStop saga? Here are the 5 things you need to know,googlenews,2021-02-01 15:53:44
"Verizon plans virtual Fortnite stadium, big game ad and star-studded concert around Super Bowl",googlenews,2021-02-01 15:53:44
Silver is surging but users on WallStreetBets say they're not behind the rally,googlenews,2021-02-01 15:53:44
Ilhan Omar pushes for new tax on stock trades amid GameStop frenzy,googlenews,2021-02-01 15:53:44
Why the GameStop stock frenzy is likely to end in a financial crisis,googlenews,2021-02-01 15:53:44
GameStop (GME) Is Old News After Reddit Discovers Silver Futures,googlenews,2021-02-01 15:53:44
CBO: Real GDP expected to grow 3.7% in 2021,googlenews,2021-02-01 15:53:44
"U.S. unemployment rate to remain above pre-pandemic level through decade, CBO says",googlenews,2021-02-01 15:53:44
"The Economy Is Improving Faster Than Expected, the U.S. Budget Office Says",googlenews,2021-02-01 15:53:44
"CBO sees rapid growth recovery, labor force returning to pre-pandemic level by 2022",googlenews,2021-02-01 15:53:44
Silver Coin Sites Seize Up as Buying Frenzy Takes Hold,googlenews,2021-02-01 15:53:44
Reddit-Inspired Army Takes Aim at Silver,googlenews,2021-02-01 15:53:44
Gold price boosted by silver-buying frenzy - MINING.COM,googlenews,2021-02-01 15:53:44
"In Silver, Redditors Find a Fit for Raging Against Establishment",googlenews,2021-02-01 15:53:44
Stocks Climbed as Online Traders Send Silver Soaring,googlenews,2021-02-01 15:53:44
"Stocks edging higher before opening bell, could be in for another rollercoaster week",googlenews,2021-02-01 15:53:44
US stock futures turn positive after worst week since October,googlenews,2021-02-01 15:53:44
Stocks rally as Wall Street tries to move past short squeeze jitters,googlenews,2021-02-01 15:53:44
"Clyburn targets OSHA, meatpacking companies with investigation of COVID-19 outbreaks",googlenews,2021-02-01 15:53:44
"U.S. House panel launches inquiry into COVID outbreaks at JBS, other meatpackers",googlenews,2021-02-01 15:53:44
House panel launches probe into meatpackers' coronavirus response,googlenews,2021-02-01 15:53:44
Congress panel investigating Covid-19 worker safety at meatpacking firms,googlenews,2021-02-01 15:53:44
Elon Musk says he’s a supporter of bitcoin and thinks it will get ‘broad acceptance’ in finance,googlenews,2021-02-01 15:53:44
Elon Musk: Neuralink enabled monkey to 'play video games using his mind' - Business Insider,googlenews,2021-02-01 15:53:44
Elon Musk asks one job interview question that will catch out anyone who lies,googlenews,2021-02-01 15:53:44
Elon Musk's Neuralink implanted a chip into a monkey's brain and now he 'can play video games using his mind',googlenews,2021-02-01 15:53:44
Revealed: New JetBlue Mint Suite & Mint Studio!,googlenews,2021-02-01 15:53:44
Welcome to the Suite Life | JetBlue Mint,googlenews,2021-02-01 15:53:44
JetBlue just unveiled its new Mint business class suites that will soon take passengers to London - take a look,googlenews,2021-02-01 15:53:44
"First look: JetBlue’s brand-new Mint Suite, Mint Studio business class",googlenews,2021-02-01 15:53:44
Comparing three COVID vaccines,googlenews,2021-02-01 15:53:44
The top COVID news stories you missed in the past few days,googlenews,2021-02-01 15:53:44
Why Some Who Are Vaccinated Still Get Coronavirus,googlenews,2021-02-01 15:53:44
The latest on the coronavirus pandemic and vaccines: Live updates,googlenews,2021-02-01 15:53:44
U.S. Cuts $231 Million Deal To Provide 15-Minute COVID-19 At-Home Tests,googlenews,2021-02-01 15:53:44
"A fast, at-home coronavirus test will be available to Americans this year",googlenews,2021-02-01 15:53:44
At-home Covid-19 test to ramp up production with $231.8 million federal contract,googlenews,2021-02-01 15:53:44
U.S. to pay testing company $231 million to speed up production of at-home COVID-19 tests,googlenews,2021-02-01 15:53:44
Popeyes has embraced the tendies meme with 'free tendies' after GameStop stock mania,googlenews,2021-02-01 15:53:44
Popeyes Gets in on GameStop Stock Phenomenon With ‘Free Tendies’ for Populist Traders,googlenews,2021-02-01 15:53:44
Popeyes Is Offering Free Tenders & Jumping On The Stock Market Craze,googlenews,2021-02-01 15:53:44
Popeyes jumps into the GameStop debate,googlenews,2021-02-01 15:53:44
GameStop Short Interest Plunges in Sign Traders Are Covering,googlenews,2021-02-01 15:53:44
GameStop (GME) Stocks Halted; Shares Drop 34% as Short Interest Drops,googlenews,2021-02-01 15:53:44
Editorial: The game that is GameStop,googlenews,2021-02-01 15:53:44
Will GameStop Activism Ruin Your Retirement?,googlenews,2021-02-01 15:53:44
Ford is switching to Android OS for infotainment in 2023,googlenews,2021-02-01 15:53:44
Ford and Google sign six-year deal for in-car connectivity and cloud services,googlenews,2021-02-01 15:53:44
Ford says ‘millions’ of its vehicles will run on Google’s Android starting in 2023,googlenews,2021-02-01 15:53:44
"Ford names Google preferred cloud provider, all vehicles will run Android by 2023",googlenews,2021-02-01 15:53:44
"Pandemic logistics help wanted: Fast-food managers, road race experts",googlenews,2021-02-01 15:53:44
First day of Phase 2 vaccinations running smoothly as major snowstorm approaches,googlenews,2021-02-01 15:53:44
Fenway Park mass COVID-19 vaccination site now open,googlenews,2021-02-01 15:53:44
What Massachusetts residents should bring to COVID-19 vaccine appointments,googlenews,2021-02-01 15:53:44
Massive snowstorm hits the East Coast: Live updates,googlenews,2021-02-01 15:53:44
INTERVIEW: CT Airport Authority provides update on flights during Winter Storm Cooper,googlenews,2021-02-01 15:53:44
30 flights cancelled between Santo Domingo and eastern US due to snow storm,googlenews,2021-02-01 15:53:44
"Philadelphia International Airport Open, Flights Arriving And Departing",googlenews,2021-02-01 15:53:44
"As Michigan restaurants reopen, owners say outdoor dining could be here to stay",googlenews,2021-02-01 15:53:44
Survey found 40% of MI restaurants may not reopen under tighter capacity restrictions,googlenews,2021-02-01 15:53:44
"Mayor, bar owner cautions indoor dining reopening isn't a 'green light'",googlenews,2021-02-01 15:53:44
Michigan bars and restaurants prepare to reopen Feb. 1,googlenews,2021-02-01 15:53:44
MTA set to halt above-ground subway service as snows batters NYC,googlenews,2021-02-01 15:53:44
MTA chairman offers commuter updates as snowstorm snarls transit,googlenews,2021-02-01 15:53:44
"Winter Storm Update: Outdoor subway service suspended, mass transit impacted by massive snowstorm",googlenews,2021-02-01 15:53:44
Transit options restricted with subways and trains stopping early as nor'easter overtakes snow removal capacities in New York City,googlenews,2021-02-01 15:53:44
"If Google pulls out of Australia, prime minister says Microsoft's Bing could take its place",googlenews,2021-02-01 15:53:44
"As Google eyes Australia exit, Microsoft talks Bing with PM",googlenews,2021-02-01 15:53:44
Searching for alternative search engines,googlenews,2021-02-01 15:53:44
"What Google, Facebook changes really mean",googlenews,2021-02-01 15:53:44
bluShift launches first commercial rocket powered by biofuel,googlenews,2021-02-01 15:53:44
Maine company successfully launches prototype rocket,googlenews,2021-02-01 15:53:44
Startup tests hybrid engine for small launch vehicle,googlenews,2021-02-01 15:53:44
Police misconduct / Snow storm / Aroostook rocket launch,googlenews,2021-02-01 15:53:44
$500 billion in aid to small businesses: How much did it help? - Wichita Business Journal,googlenews,2021-02-01 15:53:44
"PPP lending going a lot smoother this time around, Utah banks say",googlenews,2021-02-01 15:53:44
Some businesses staying afloat during pandemic through Paycheck Protection Program,googlenews,2021-02-01 15:53:44
$500 billion in aid to small businesses: How much did it help? - Baltimore Business Journal,googlenews,2021-02-01 15:53:44
New WA data breach exposes personal info of 1.6 million people who applied for unemployment,googlenews,2021-02-01 15:53:44
Data breach compromised info of 1.6 million Washingtonians who sought unemployment,googlenews,2021-02-01 15:53:44
Personal data of Washington state applicants seeking unemployment benefits hacked,googlenews,2021-02-01 15:53:44
Some Washingtonian's personnel data possibly exposed during hack of state auditor,googlenews,2021-02-01 15:53:44
Dunkin' Giving Away Free Coffee To Perks Members,googlenews,2021-02-01 15:53:44
Dunkin' launches Free Coffee Mondays through February,googlenews,2021-02-01 15:53:44
Dunkin’ is giving out free coffee every Monday in February,googlenews,2021-02-01 15:53:44
Dunkin' announces Free Coffee Mondays,googlenews,2021-02-01 15:53:44
"Exxon, Chevron CEOs Discussed Merger",googlenews,2021-02-01 15:53:44
"Chevron and Exxon discussed merger last year after Covid pandemic devastated oil prices, reports say",googlenews,2021-02-01 15:53:44
Exxon-Chevron Merger Talk Smacks of Big Oil on Defensive,googlenews,2021-02-01 15:53:44
Wall Street analysts say Chevron merger talks a sideshow before Exxon loss,googlenews,2021-02-01 15:53:44
"Stop posting pictures of your COVID-19 vaccine card on social media, BBB warns",googlenews,2021-02-01 15:53:44
"Don't share COVID-19 vaccine card on social media, BBB warns",googlenews,2021-02-01 15:53:44
Alert reveals why you should NOT post photos of your Covid vaccine card on social media,googlenews,2021-02-01 15:53:44
BBB says personal data at risk if CDC vaccination card is posted on social media,googlenews,2021-02-01 15:53:44
Why private aviation company Wheels Up is going public through a SPAC,googlenews,2021-02-01 15:53:44
"Wheels Up, The Leading Brand In Private Aviation, Announces Plans To Become Publicly-Traded Via SPAC Merger With Aspirational Consumer Lifestyle Corp.",googlenews,2021-02-01 15:53:44
Wheels Up to become public company in Q2,googlenews,2021-02-01 15:53:44
Private jet company Wheels Up to join SPAC boom,googlenews,2021-02-01 15:53:44
Facebook makes the case for activity tracking to iOS 14 users in new pop-ups,googlenews,2021-02-01 15:53:44
Facebook testing notification to users about Apple privacy changes,googlenews,2021-02-01 15:53:44
"On iPhones, Facebook and Apple begin a war of pop-up messages",googlenews,2021-02-01 15:53:44
Facebook prompt will encourage ad tracking opt-in ahead of Apple’s privacy push,googlenews,2021-02-01 15:53:44
Golden Nugget casinos to go public through SPAC merger,googlenews,2021-02-01 15:53:44
"Houston billionaire Tilman Fertitta to take restaurant, gaming empire public",googlenews,2021-02-01 15:53:44
"Tilman Fertitta, billionaire Houston Rockets owner, taking Landry's Inc. and Golden Nugget Casino public",googlenews,2021-02-01 15:53:44
"Tilman Fertitta, hit hard by the COVID pandemic, takes part of his business public again",googlenews,2021-02-01 15:53:44
U.S. manufacturing sector slows; prices paid by factories highest since 2011 - ISM,googlenews,2021-02-01 15:53:44
Manufacturing PMI® at 58.7%; January 2021 Manufacturing ISM® Report On Business®,googlenews,2021-02-01 15:53:44
"U.S. manufacturers still growing rapidly, ISM finds, despite COVID setbacks",googlenews,2021-02-01 15:53:44
Factories Grow at Slower Pace in January,googlenews,2021-02-01 15:53:44
Oil jumps more than 2% as supply cuts take effect,googlenews,2021-02-01 15:53:44
"Reddit trends, volatility in stock markets could spill over to crude oil prices",googlenews,2021-02-01 15:53:44
Saudi Arabia's Oil Fears Look Well Founded,googlenews,2021-02-01 15:53:44
Tighter Oil Markets Send Oil Prices Higher,googlenews,2021-02-01 15:53:44
Which Covid-19 Vaccine Should You Choose?,googlenews,2021-02-01 15:53:44
"Results from Novavax vaccine trials in the UK and South Africa differ: why, and does it matter?",googlenews,2021-02-01 15:53:44
Moderna president: Some emerging COVID strains ‘better at hiding’ from vaccines,googlenews,2021-02-01 15:53:44
Boris Johnson plays down fears of Covid vaccines being ineffective against new variants,googlenews,2021-02-01 15:53:44
How to snare the lowest 15-year mortgage rate for your refinance,googlenews,2021-02-01 15:53:44
"Today's mortgage rates continue to move away from record lows | February 1, 2021",googlenews,2021-02-01 15:53:44
"Current Mortgage Rates -- Feb. 1, 2021: Rates Largely Stable",googlenews,2021-02-01 15:53:44
"Today's mortgage and refinance rates: February 1, 2021 | Rates go down",googlenews,2021-02-01 15:53:44
What The New Stimulus Package Could Mean For Your Student Loans And Student Loan Cancellation,googlenews,2021-02-01 15:53:44
How to handle student loan payments during COVID,googlenews,2021-02-01 15:53:44
Opinion | What Canceling Student Debt Would Do for the Racial Wealth Gap,googlenews,2021-02-01 15:53:44
Biden administration extends pause on student loan payments,googlenews,2021-02-01 15:53:44
Virgin Galactic shares pop as company plans to redo spaceflight test as early as Feb. 13,googlenews,2021-02-01 15:53:44
Why Virgin Galactic Stock Exploded Higher on Monday,googlenews,2021-02-01 15:53:44
Virgin Galactic plans next rocket-powered test flight for February 13th,googlenews,2021-02-01 15:53:44
Virgin Galactic to resume SpaceShipTwo test flights in mid-February,googlenews,2021-02-01 15:53:44
"For Valentine’s Day, Get Your Partner a Gift You Want",googlenews,2021-02-01 15:53:44
Holland America Offers Valentine's Day Promo,googlenews,2021-02-01 15:53:44
The 14 Best Romantic Movies on Netflix to Watch This Valentine’s Day,googlenews,2021-02-01 15:53:44
Here's How You Can Celebrate Valentine's Day Safely Amid the COVID-19 Pandemic,googlenews,2021-02-01 15:53:44
31 Black-Owned Businesses That'll Take Your Valentine's Day Gift To The Next Level,googlenews,2021-02-01 15:53:44
Support these NorCal Black-owned businesses for Black History Month,googlenews,2021-02-01 15:53:44
21 Black Beauty Brand Founders Changing The Industry,googlenews,2021-02-01 15:53:44
Databricks raises $1 billion funding round at $28 billion valuation,googlenews,2021-02-01 15:53:44
Databricks raises $1B at $28B valuation as it reaches $425M ARR,googlenews,2021-02-01 15:53:44
"Databricks, champion of data ""lakehouse"" model, closes $1B series G funding round",googlenews,2021-02-01 15:53:44
Databricks Raises $1 Billion Series G Investment at $28 Billion Valuation,googlenews,2021-02-01 15:53:44
The Citadel Link: What Ken Griffin Has to Do With GameStop,googlenews,2021-02-01 15:53:44
GameStop Frenzy Puts Spotlight on Trading Giant Citadel Securities,googlenews,2021-02-01 15:53:44
Ken Griffin's Citadel silver holding exposes rifts in WallStreetBets army,googlenews,2021-02-01 15:53:44
Five Things You Need to Know to Start Your Day,googlenews,2021-02-01 15:53:44
XRP Erases SEC-Led Drop as Supporters Pump Price Over $0.60,googlenews,2021-02-01 15:53:44
"XRP soars as much as 50% and Dogecoin jumps, as day traders flex their muscles and Elon Musk adds to cryp..",googlenews,2021-02-01 15:53:44
Ripple formally responds to SEC lawsuit,googlenews,2021-02-01 15:53:44
"Why XRP Is Skyrocketing As Dogecoin, Bitcoin, Others Retreat",googlenews,2021-02-01 15:53:44
GME stock price edging down as Wall Street tries to get a grip on Reddit stocks,googlenews,2021-02-01 15:53:44
"GameStop, AMC jump as retail trading frenzy builds",googlenews,2021-02-01 15:53:44
"GameStop, AMC, Silver Stocks Continue Rally Pre-Market",googlenews,2021-02-01 15:53:44
"January Market Wrap: Volatile Month, Forecasts Similar For Remainder Of 2021",googlenews,2021-02-01 15:53:44
"AMC Entertainment stock now a 'sell' at MKM, as analyst's price target drops to $1",googlenews,2021-02-01 15:53:44
Forget the AMC Entertainment Rally; This Analyst Says Its Stock Is Only Worth $1,googlenews,2021-02-01 15:53:44
AMC Stock Is a Popular Thriller Risk Takers Shouldn't Miss Out On,googlenews,2021-02-01 15:53:44
AMC Trades Higher Even as MKM Cuts Theater Chain to Sell,googlenews,2021-02-01 15:53:44
Cramer: GameStop trading frenzy unlikely big enough to topple entire stock market,googlenews,2021-02-01 15:53:44
