headline,org,date
Dow Futures Resume Surge on Election Day As Markets Price-in Potential Biden Win,msnmoney,2020-11-03 07:50:55
75 stocking stuffers they'll actually use,msnmoney,2020-11-03 07:50:55
The Dead Giveaway That Tells You When Amazon’s Giving You A Better Price Than Other Retailers,msnmoney,2020-11-03 07:50:55
"Current Mortgage Rates, November 3, 2020 | Rates up",msnmoney,2020-11-03 07:50:55
The best things to buy in November,msnmoney,2020-11-03 07:50:55
23 New Gadgets That Will Sell Out Before Holidays,msnmoney,2020-11-03 07:50:55
G4S Rejects Takeover Proposal From Allied Universal,msnmoney,2020-11-03 07:50:55
7 Ways to Protect Your Retirement From Investment Fraud,msnmoney,2020-11-03 07:50:55
Planning for Early Retirement When You Have Equity Compensation,msnmoney,2020-11-03 07:50:55
"39 Hottest Gifts Of 2020 (Hurry, These Will Be Gone Very Soon)",msnmoney,2020-11-03 07:50:55
20 ways to earn extra money before Black Friday,msnmoney,2020-11-03 07:50:55
48 Movies So Disturbing People Walked Out Of The Theater,msnmoney,2020-11-03 07:50:55
"Energy stocks have not flashed this bearish signal since 1931, Oppenheimer analyst says",msnmoney,2020-11-03 07:50:55
What Covid-19 means for shopping malls this holiday season,msnmoney,2020-11-03 07:50:55
"A bankrupt airline's stock has soared 130% this year, even though it hasn't flown once in 2020",msnmoney,2020-11-03 07:50:55
Your grocery store shopping strategy during the Coronavirus crisis,msnmoney,2020-11-03 07:50:55
Mortgages and loans to pay for home renovations,msnmoney,2020-11-03 07:50:55
Seniors On Medicare Get A Big Boost To SS Checks In 2020,msnmoney,2020-11-03 07:50:55
Fascinating facts about campaign signs,msnmoney,2020-11-03 07:50:55
Bayer’s Costs to Fight Future Roundup Lawsuits Climb,msnmoney,2020-11-03 07:50:55
What to do if your seasonal job isn't available this year,msnmoney,2020-11-03 07:50:55
"I’m a CEO, and I believe we should ‘hire’ political candidates based on these 3 factors",msnmoney,2020-11-03 07:50:55
All the ways you'll lose money by getting divorced,msnmoney,2020-11-03 07:50:55
[Pics] Here’s What Happens When You Accidentally Eat Mold,msnmoney,2020-11-03 07:50:55
Stop stressing about which party is better for the stock market: The data shows it doesn't matter much,msnmoney,2020-11-03 07:50:55
The Most Googled Money Questions — Answered,msnmoney,2020-11-03 07:50:55
Are you 50? Money milestones you should have reached by now,msnmoney,2020-11-03 07:50:55
The most luxurious retirement communities in America,msnmoney,2020-11-03 07:50:55
BNP Paribas rises as much as 7% after beating expectations with 3rd quarter results,msnmoney,2020-11-03 07:50:55
The Best Song Of All Time Is Mostly Forgotten Today,msnmoney,2020-11-03 07:50:55
Biggest winners and losers from last month's stock market,msnmoney,2020-11-03 07:50:55
Oil Giant Aramco Keeps Dividend Despite 45% Slump in Profit,msnmoney,2020-11-03 07:50:55
10 Best Marijuana Stocks to Buy for 2021,msnmoney,2020-11-03 07:50:55
"Bonuses, Dividends Pit Europe Banks Against Economic Wardens",msnmoney,2020-11-03 07:50:55
Why the Holidays Are the Perfect Time for a Career Makeover,msnmoney,2020-11-03 07:50:55
Grandma Uses Trick To Turn Dusty House Into Fresh Air Paradise,msnmoney,2020-11-03 07:50:55
Inside Some Groovy 1970’s Time Capsule Homes,msnmoney,2020-11-03 07:50:55
The Salary You Need To Afford Rent in Every State,msnmoney,2020-11-03 07:50:55
Old Mutual CEO Reboots Strategy After Brawl With Predecessor,msnmoney,2020-11-03 07:50:55
The 50 Richest Countries in the World,msnmoney,2020-11-03 07:50:55
This Wildly Popular Investment Has 2 Costly Flaws,msnmoney,2020-11-03 07:50:55
"Have Gum Disease Or Tooth Decay, Do This Immediately (Genius!)",msnmoney,2020-11-03 07:50:55
11 Things You Can Get Free in November,msnmoney,2020-11-03 07:50:55
Billionaire Adani Set to Develop Sri Lanka’s Port Terminal,msnmoney,2020-11-03 07:50:55
Major pandemic bankruptcies to date — and who could be next,msnmoney,2020-11-03 07:50:55
10 Signs That It’s Time to Find a New Job,msnmoney,2020-11-03 07:50:55
Things you probably don't know about Costco,msnmoney,2020-11-03 07:50:55
Drone Captures What No One Was Supposed To See,msnmoney,2020-11-03 07:50:55
Hong Kong Seen Selling Bills to Mop Up Cash After Ant’s IPO,msnmoney,2020-11-03 07:50:55
How Much It Cost to Retire in the Year You Were Born,msnmoney,2020-11-03 07:50:55
9 Indestructible Products That Are Worth the Price,msnmoney,2020-11-03 07:50:55
9 COVID-19 Money Habits To Stick With Next Year,msnmoney,2020-11-03 07:50:55
Delivery Giant Meituan Said to Weigh Second Listing in China,msnmoney,2020-11-03 07:50:55
48 Movies So Disturbing People Walked Out Of The Theater,msnmoney,2020-11-03 07:50:55
From Coolidge to Trump: Job Creation Under Every President,msnmoney,2020-11-03 07:50:55
"BNP Joins European Peers With Trading Beat, Lower Provisions",msnmoney,2020-11-03 07:50:55
Chick-fil-A and 23 More Companies With Surprisingly Great 401(k) Plans,msnmoney,2020-11-03 07:50:55
"State Taxes on the Ballot 2020 -- Pot, Real Estate and More",msnmoney,2020-11-03 07:50:55
Worst Periods for the American Economy Since 1900,msnmoney,2020-11-03 07:50:55
Magic Johnson Selling Gels Shows Why Alibaba Escaped Trump,msnmoney,2020-11-03 07:50:55
Born Into Billions: Meet America's Richest Heirs,msnmoney,2020-11-03 07:50:55
11 mistakes to avoid when you buy a house,msnmoney,2020-11-03 07:50:55
20 Highest Rated Companies for Work-Life Balance During the COVID-19 Crisis,msnmoney,2020-11-03 07:50:55
The Fastest-Growing Job in Each State,msnmoney,2020-11-03 07:50:55
That Pricey Buyout Now Looks Like a Bargain,msnmoney,2020-11-03 07:50:55
Simple ways to save money every day of the month,msnmoney,2020-11-03 07:50:55
Katy and Orlando's Montecito mansion: celebrity real estate in November,msnmoney,2020-11-03 07:50:55
"Have Gum Disease Or Tooth Decay, Do This Immediately (Genius!)",msnmoney,2020-11-03 07:50:55
100 fascinating facts about money,msnmoney,2020-11-03 07:50:55
BAT Buys Dryft Sciences’ Pouches Business in Oral Nicotine Push,msnmoney,2020-11-03 07:50:55
You can buy these holiday tech gifts for under 50 bucks,msnmoney,2020-11-03 07:50:55
Three Ways Dollar-Cost Averaging Helps Investors,msnmoney,2020-11-03 07:50:55
The cities Americans are fleeing the fastest in 2020,msnmoney,2020-11-03 07:50:55
Traders Eye Cheap Rubles as Hedge Against Trump Election Win,msnmoney,2020-11-03 07:50:55
"[Photos] This is Why She Left The Ring for Good, Look Closer",msnmoney,2020-11-03 07:50:55
Top college in America for 50 different rankings,msnmoney,2020-11-03 07:50:55
Dow Futures Resume Surge on Election Day As Markets Price-in Potential Biden Win,msnmoney,2020-11-03 07:50:55
75 stocking stuffers they'll actually use,msnmoney,2020-11-03 07:50:55
The Dead Giveaway That Tells You When Amazon’s Giving You A Better Price Than Other Retailers,msnmoney,2020-11-03 07:50:55
"Current Mortgage Rates, November 3, 2020 | Rates up",msnmoney,2020-11-03 07:50:55
The best things to buy in November,msnmoney,2020-11-03 07:50:55
23 New Gadgets That Will Sell Out Before Holidays,msnmoney,2020-11-03 07:50:55
G4S Rejects Takeover Proposal From Allied Universal,msnmoney,2020-11-03 07:50:55
7 Ways to Protect Your Retirement From Investment Fraud,msnmoney,2020-11-03 07:50:55
Planning for Early Retirement When You Have Equity Compensation,msnmoney,2020-11-03 07:50:55
"39 Hottest Gifts Of 2020 (Hurry, These Will Be Gone Very Soon)",msnmoney,2020-11-03 07:50:55
20 ways to earn extra money before Black Friday,msnmoney,2020-11-03 07:50:55
48 Movies So Disturbing People Walked Out Of The Theater,msnmoney,2020-11-03 07:50:55
"Energy stocks have not flashed this bearish signal since 1931, Oppenheimer analyst says",msnmoney,2020-11-03 07:50:55
What Covid-19 means for shopping malls this holiday season,msnmoney,2020-11-03 07:50:55
"A bankrupt airline's stock has soared 130% this year, even though it hasn't flown once in 2020",msnmoney,2020-11-03 07:50:55
Your grocery store shopping strategy during the Coronavirus crisis,msnmoney,2020-11-03 07:50:55
Mortgages and loans to pay for home renovations,msnmoney,2020-11-03 07:50:55
Seniors On Medicare Get A Big Boost To SS Checks In 2020,msnmoney,2020-11-03 07:50:55
Fascinating facts about campaign signs,msnmoney,2020-11-03 07:50:55
Bayer’s Costs to Fight Future Roundup Lawsuits Climb,msnmoney,2020-11-03 07:50:55
What to do if your seasonal job isn't available this year,msnmoney,2020-11-03 07:50:55
"I’m a CEO, and I believe we should ‘hire’ political candidates based on these 3 factors",msnmoney,2020-11-03 07:50:55
All the ways you'll lose money by getting divorced,msnmoney,2020-11-03 07:50:55
[Pics] Here’s What Happens When You Accidentally Eat Mold,msnmoney,2020-11-03 07:50:55
Stop stressing about which party is better for the stock market: The data shows it doesn't matter much,msnmoney,2020-11-03 07:50:55
The Most Googled Money Questions — Answered,msnmoney,2020-11-03 07:50:55
Are you 50? Money milestones you should have reached by now,msnmoney,2020-11-03 07:50:55
The most luxurious retirement communities in America,msnmoney,2020-11-03 07:50:55
BNP Paribas rises as much as 7% after beating expectations with 3rd quarter results,msnmoney,2020-11-03 07:50:55
The Best Song Of All Time Is Mostly Forgotten Today,msnmoney,2020-11-03 07:50:55
Biggest winners and losers from last month's stock market,msnmoney,2020-11-03 07:50:55
Oil Giant Aramco Keeps Dividend Despite 45% Slump in Profit,msnmoney,2020-11-03 07:50:55
10 Best Marijuana Stocks to Buy for 2021,msnmoney,2020-11-03 07:50:55
"Bonuses, Dividends Pit Europe Banks Against Economic Wardens",msnmoney,2020-11-03 07:50:55
Why the Holidays Are the Perfect Time for a Career Makeover,msnmoney,2020-11-03 07:50:55
Grandma Uses Trick To Turn Dusty House Into Fresh Air Paradise,msnmoney,2020-11-03 07:50:55
Inside Some Groovy 1970’s Time Capsule Homes,msnmoney,2020-11-03 07:50:55
The Salary You Need To Afford Rent in Every State,msnmoney,2020-11-03 07:50:55
Old Mutual CEO Reboots Strategy After Brawl With Predecessor,msnmoney,2020-11-03 07:50:55
The 50 Richest Countries in the World,msnmoney,2020-11-03 07:50:55
This Wildly Popular Investment Has 2 Costly Flaws,msnmoney,2020-11-03 07:50:55
"Have Gum Disease Or Tooth Decay, Do This Immediately (Genius!)",msnmoney,2020-11-03 07:50:55
11 Things You Can Get Free in November,msnmoney,2020-11-03 07:50:55
Billionaire Adani Set to Develop Sri Lanka’s Port Terminal,msnmoney,2020-11-03 07:50:55
Major pandemic bankruptcies to date — and who could be next,msnmoney,2020-11-03 07:50:55
10 Signs That It’s Time to Find a New Job,msnmoney,2020-11-03 07:50:55
Things you probably don't know about Costco,msnmoney,2020-11-03 07:50:55
Drone Captures What No One Was Supposed To See,msnmoney,2020-11-03 07:50:55
Hong Kong Seen Selling Bills to Mop Up Cash After Ant’s IPO,msnmoney,2020-11-03 07:50:55
How Much It Cost to Retire in the Year You Were Born,msnmoney,2020-11-03 07:50:55
9 Indestructible Products That Are Worth the Price,msnmoney,2020-11-03 07:50:55
9 COVID-19 Money Habits To Stick With Next Year,msnmoney,2020-11-03 07:50:55
Delivery Giant Meituan Said to Weigh Second Listing in China,msnmoney,2020-11-03 07:50:55
48 Movies So Disturbing People Walked Out Of The Theater,msnmoney,2020-11-03 07:50:55
From Coolidge to Trump: Job Creation Under Every President,msnmoney,2020-11-03 07:50:55
"BNP Joins European Peers With Trading Beat, Lower Provisions",msnmoney,2020-11-03 07:50:55
Chick-fil-A and 23 More Companies With Surprisingly Great 401(k) Plans,msnmoney,2020-11-03 07:50:55
"State Taxes on the Ballot 2020 -- Pot, Real Estate and More",msnmoney,2020-11-03 07:50:55
Worst Periods for the American Economy Since 1900,msnmoney,2020-11-03 07:50:55
Magic Johnson Selling Gels Shows Why Alibaba Escaped Trump,msnmoney,2020-11-03 07:50:55
Born Into Billions: Meet America's Richest Heirs,msnmoney,2020-11-03 07:50:55
11 mistakes to avoid when you buy a house,msnmoney,2020-11-03 07:50:55
20 Highest Rated Companies for Work-Life Balance During the COVID-19 Crisis,msnmoney,2020-11-03 07:50:55
The Fastest-Growing Job in Each State,msnmoney,2020-11-03 07:50:55
That Pricey Buyout Now Looks Like a Bargain,msnmoney,2020-11-03 07:50:55
Simple ways to save money every day of the month,msnmoney,2020-11-03 07:50:55
Katy and Orlando's Montecito mansion: celebrity real estate in November,msnmoney,2020-11-03 07:50:55
"Have Gum Disease Or Tooth Decay, Do This Immediately (Genius!)",msnmoney,2020-11-03 07:50:55
100 fascinating facts about money,msnmoney,2020-11-03 07:50:55
BAT Buys Dryft Sciences’ Pouches Business in Oral Nicotine Push,msnmoney,2020-11-03 07:50:55
You can buy these holiday tech gifts for under 50 bucks,msnmoney,2020-11-03 07:50:55
Three Ways Dollar-Cost Averaging Helps Investors,msnmoney,2020-11-03 07:50:55
The cities Americans are fleeing the fastest in 2020,msnmoney,2020-11-03 07:50:55
Traders Eye Cheap Rubles as Hedge Against Trump Election Win,msnmoney,2020-11-03 07:50:55
"[Photos] This is Why She Left The Ring for Good, Look Closer",msnmoney,2020-11-03 07:50:55
Top college in America for 50 different rankings,msnmoney,2020-11-03 07:50:55
Market history tells us to brace for election surprises,yahoofinance,2020-11-03 07:52:52
Stock futures jump as Election Day kicks off ,yahoofinance,2020-11-03 07:52:52
Profit dives at world's largest oil company but 'signs of recovery',yahoofinance,2020-11-03 07:52:52
Microsoft to invest in Ant Group-backed Indonesian startup Bukalapak,yahoofinance,2020-11-03 07:52:52
Apple announces Nov. 10th event,yahoofinance,2020-11-03 07:52:52
Trump threatens to fire Fauci as COVID-19 cases rise,yahoofinance,2020-11-03 07:52:52
Retirement expert on the 'minimum' you should be doing,yahoofinance,2020-11-03 07:52:52
America ‘needs to repent’ – even Biden: Sen advisor,yahoofinance,2020-11-03 07:52:52
"Arlington, Virginia: Why Americans Are Revisiting Their Insurance..",yahoofinance,2020-11-03 07:52:52
"The U.S. could split up, Gundlach says. Here’s how he’d invest for that.",yahoofinance,2020-11-03 07:52:52
"Dow Jones Jumps 400 Points As Biden Lead Narrows; Software Stocks Lag, Amazon Hit Again",yahoofinance,2020-11-03 07:52:52
What Pullback? JPMorgan Says These 2 Stocks Could Surge Over 60%,yahoofinance,2020-11-03 07:52:52
"The $110 Trillion Trend That Bezos, Buffet And Musk Are Betting On",yahoofinance,2020-11-03 07:52:52
Market history tells us to hold on for election surprises: Morning Brief,yahoofinance,2020-11-03 07:52:52
"Is Nio Stock A Buy Right Now As Chinese EVs Boom? Here's What Earnings, Stock Chart Show",yahoofinance,2020-11-03 07:52:52
Dow Jones Futures Signal Election 2020 Stock Market Rally As Trump Vs Biden Race Ends,yahoofinance,2020-11-03 07:52:52
3 “Strong Buy” Stocks Insiders Are Snapping Up,yahoofinance,2020-11-03 07:52:52
"PayPal's earnings don't excite Wall Street, but bring good news for consumer fintech",yahoofinance,2020-11-03 07:52:52
"AT&T Stock: Is It A Buy Right Now? Here's What Earnings, Charts Show",yahoofinance,2020-11-03 07:52:52
Retirement expert explains ‘what everybody should be doing at a minimum’,yahoofinance,2020-11-03 07:52:52
Bausch Health tops revenue estimates and reiterates guidance,yahoofinance,2020-11-03 07:52:52
Monday Market Rally Worries Jim Cramer,yahoofinance,2020-11-03 07:52:52
NIO stock touches all-time highs after doubling EV deliveries to a new monthly record,yahoofinance,2020-11-03 07:52:52
How Large Option Traders Are Playing Carnival After CDC Lifted 'No Sail' Order,yahoofinance,2020-11-03 07:52:52
9 Upgraded Stocks to Buy in November,yahoofinance,2020-11-03 07:52:52
10 rules that made Warren Buffett a billionaire,yahoofinance,2020-11-03 07:52:52
Jim Cramer: 8 Stocks That Benefit the Most If There's Another Modified Lockdown,yahoofinance,2020-11-03 07:52:52
Why AMC Shares Surged After-Hours Despite Massive Q3 Net Loss,yahoofinance,2020-11-03 07:52:52
Trump or Biden? 5 Stocks to Buy No Matter Who Wins the Election.,yahoofinance,2020-11-03 07:52:52
Shell upped to overweight and BP lifted to equal-weight at Morgan Stanley,yahoofinance,2020-11-03 07:52:52
A Pfizer Analyst's 3 Possible Coronavirus Vaccine Readout Scenarios,yahoofinance,2020-11-03 07:52:52
"Column: 23,000 households reported income over $10 million last year. The IRS audited seven",yahoofinance,2020-11-03 07:52:52
"SolarEdge stock falls 15% on Q3 sales miss, weaker Q4 sales guidance",yahoofinance,2020-11-03 07:52:52
"Exclusive: Tired of Trump, Deutsche Bank games ways to sever ties with the president - sources",yahoofinance,2020-11-03 07:52:52
Wayfair Earnings Crush Views; Stock Soars,yahoofinance,2020-11-03 07:52:52
Stock market news live updates: Stock futures jump as Election Day kicks off,yahoofinance,2020-11-03 07:52:52
Jack Ma Gets a Warning From China on Ant’s Rapid Expansion,yahoofinance,2020-11-03 07:52:52
You shouldn’t believe all this talk about a stock-market bubble about to burst — here’s why,yahoofinance,2020-11-03 07:52:52
"Is MO Stock A Buy As Juul Writedowns Pile Up? Here's What Earnings, Altria Stock Chart Show",yahoofinance,2020-11-03 07:52:52
MOVES-Citigroup names Anand Selva global head of consumer banking,yahoofinance,2020-11-03 07:52:52
Merck Is Pursuing Two Coronavirus Vaccines — Is Merck Stock A Buy?,yahoofinance,2020-11-03 07:52:52
"Don’t Abandon Fastly Stock Just Yet, Says Analyst",yahoofinance,2020-11-03 07:52:52
"Futures rise as investors bet on Biden victory, more stimulus",yahoofinance,2020-11-03 07:52:52
"What to Look for in Berkshire Hathaway Earnings: Buybacks, Investments Updates, and Cash Holdings",yahoofinance,2020-11-03 07:52:52
"Chipmaker Skyworks Crushes Fiscal Q4 Targets, Raises Outlook",yahoofinance,2020-11-03 07:52:52
Setback for Nokia in German patent battle with Lenovo,yahoofinance,2020-11-03 07:52:52
A New Rotation: Cramer's 'Mad Money' Recap (Monday 11/2/20),yahoofinance,2020-11-03 07:52:52
Cathie Wood Increases Teladoc Holdings Across Ark ETFs,yahoofinance,2020-11-03 07:52:52
Citigroup Names New Consumer Banking Head,yahoofinance,2020-11-03 07:52:52
Is The Ultimate Warren Buffett Stock A Buy After Building A Base?,yahoofinance,2020-11-03 07:52:52
"Nio Doubles October Deliveries; Xpeng, Li Auto Continue Strong Run",yahoofinance,2020-11-03 07:52:52
Corn Rally Sparks Green Fuel Rethink by Chinese Energy Giant,yahoofinance,2020-11-03 07:52:52
Realty Income Corp.: 3Q Earnings Snapshot,yahoofinance,2020-11-03 07:52:52
"On election eve, stock markets are ignoring these two risky scenarios, warns strategist",yahoofinance,2020-11-03 07:52:52
'We think we're in the early stages of a bull market': Strategist,yahoofinance,2020-11-03 07:52:52
"Here's How Much Investing $1,000 In PayPal's 2015 Spinoff Would Be Worth Today",yahoofinance,2020-11-03 07:52:52
China Guzzles Saudi Arabian Oil While Riyadh Keeps U.S. Flow Low,yahoofinance,2020-11-03 07:52:52
Wayfair stock soars 13% after results swing to a profit,yahoofinance,2020-11-03 07:52:52
CureVac Posts Positive Early Data For Its Covid-19 Vaccine Candidate,yahoofinance,2020-11-03 07:52:52
Here’s What a Covid-19 Vaccine Could Be Worth to Pfizer Stock,yahoofinance,2020-11-03 07:52:52
Which Consumer Staples Stock Will Grow The Most By 2025?,yahoofinance,2020-11-03 07:52:52
Bayer’s Costs to Fight Future Roundup Lawsuits Climb,yahoofinance,2020-11-03 07:52:52
"U.S. Supreme Court rejects NFL, DirecTV appeal in TV package suit",yahoofinance,2020-11-03 07:52:52
Boeing Could Test March Low,yahoofinance,2020-11-03 07:52:52
"Casino Earnings: Why BofA Is Bullish On Penn National, Bearish On MGM",yahoofinance,2020-11-03 07:52:52
Medicare Advantage Plans: How to Compare,yahoofinance,2020-11-03 07:52:52
Dow Futures Resume Surge on Election Day As Markets Price-in Potential Biden Win,yahoofinance,2020-11-03 07:52:52
5 Value Stocks In The Healthcare Sector,yahoofinance,2020-11-03 07:52:52
'Closing Bell' Analysts Share Their Thoughts On Apple,yahoofinance,2020-11-03 07:52:52
When To Sell Stocks: Use 10-Day Moving Average Get Ahead Of Sell Signals,yahoofinance,2020-11-03 07:52:52
Novavax Expands Facilities As It Readies Covid-19 Vaccine Candidate,yahoofinance,2020-11-03 07:52:52
SAP’s CEO Says Sales Weakness Is Evidence of Cloud Transition,yahoofinance,2020-11-03 07:52:52
Analysis: Investors brace for another wild ride on U.S. Election Night,yahoofinance,2020-11-03 07:52:52
"Johnson Controls stock gains after profit and revenue beats, upbeat outlook",yahoofinance,2020-11-03 07:52:52
Why The Best Outcome For Intel Shareholders Is To Break Up The Chipmaker,yahoofinance,2020-11-03 07:52:52
YRC Worldwide: Q3 Earnings Insights,yahoofinance,2020-11-03 07:52:52
"Election Day, Dow Futures, PayPal, Wayfair - 5 Things You Must Know Tuesday",yahoofinance,2020-11-03 07:52:52
"Chinese Stocks To Watch: After 167% Gain, Alibaba, Amazon Rival JD.com Tests New Breakout",yahoofinance,2020-11-03 07:52:52
"Tech Workers Take to the Mountains, Bringing Silicon Valley With Them",yahoofinance,2020-11-03 07:52:52
"Is Amazon Stock A Buy Right Now? Here's What Earnings, Charts Show",yahoofinance,2020-11-03 07:52:52
"Dow Jones Jumps, Small Caps Lead As Trump Nears Biden With Election Due",yahoofinance,2020-11-03 07:52:52
PayPal Shares Slump After Profit Guidance Clouds Q3 Earnings Beat,yahoofinance,2020-11-03 07:52:52
Bitcoin’s Mining Difficulty Sees Largest Percentage Drop in 9 Years,yahoofinance,2020-11-03 07:52:52
"Is Cisco Stock A Buy Or Sell? Tech Icon Struggles Despite Dividend, Acquisitions",yahoofinance,2020-11-03 07:52:52
"The next bear market will be the worst in at least 78 years, warns co-founder of Soros’s legendary Quantum Fund",yahoofinance,2020-11-03 07:52:52
"Exclusive: Tired of Trump, Deutsche Bank wants out but sees no good options - sources",yahoofinance,2020-11-03 07:52:52
Stocks Surge and Dollar Drops on U.S. Election Day: Markets Wrap,yahoofinance,2020-11-03 07:52:52
Transocean: Q3 Earnings Insights,yahoofinance,2020-11-03 07:52:52
"US STOCKS-Futures rise as investors bet on Biden victory, more stimulus",yahoofinance,2020-11-03 07:52:52
"Is Costco Stock A Buy Right Now? Here's What Earnings, Chart Say",yahoofinance,2020-11-03 07:52:52
"Humana beats profit and revenue expectations, boosts MA membership growth outlook",yahoofinance,2020-11-03 07:52:52
Ant Group Trades at 50% Premium in Hong Kong Gray Market,yahoofinance,2020-11-03 07:52:52
Twitter CEO Jack Dorsey Survives Elliott Ax As Company Offers Concessions,yahoofinance,2020-11-03 07:52:52
Did Callaway Golf Sink A Birdie By Buying Topgolf At A 50% Discount To IPO Price?,yahoofinance,2020-11-03 07:52:52
PayPal’s Earnings Beat Expectations. Why the Stock Is Tumbling.,yahoofinance,2020-11-03 07:52:52
Cannabis Countdown: Top 10 Marijuana And Psychedelic Stock News Stories Of The Week,yahoofinance,2020-11-03 07:52:52
Mukesh Ambani Loses $6.5 Billion as Oil Sinks Reliance Stock,yahoofinance,2020-11-03 07:52:52
Jack Ma Gets Summoned By Chinese Regulators Ahead Of Ant Group's IPO,yahoofinance,2020-11-03 07:52:52
Fubo TV Stock Rallies as Buy Ratings Pour In,yahoofinance,2020-11-03 07:52:52
Argentina Is In Desperate Need Of An Oil Boom,yahoofinance,2020-11-03 07:52:52
Bitcoin’s Implied Volatility Rises Ahead of US Election,yahoofinance,2020-11-03 07:52:52
Malls Dragged Into Bankruptcy by Carnage at Retail Tenants,yahoofinance,2020-11-03 07:52:52
Airline Stocks Were Already Getting Slammed. The Election Is Making It Worse.,yahoofinance,2020-11-03 07:52:52
"Barron's Picks And Pans: AT&T, GE, Zynga And More",yahoofinance,2020-11-03 07:52:52
China's Appetite For Meat Is Still Growing,yahoofinance,2020-11-03 07:52:52
PayPal tops estimates amid surge in online shopping but outlook disappoints,yahoofinance,2020-11-03 07:52:52
J.C. Penney Settles With Lender Group Ahead of Sale Hearing,yahoofinance,2020-11-03 07:52:52
A viral pun in China foreshadows the biggest shadow over Ant’s monster IPO,yahoofinance,2020-11-03 07:52:52
These 4 Companies Boosted Their Dividends This Week,yahoofinance,2020-11-03 07:52:52
America Heads to the Polls as Election Day Dawns,wsj,2020-11-03 07:55:23
"White House, Senate in focus as long campaign winds down",wsj,2020-11-03 07:55:23
"Tense Campaign Between Trump, Biden Reaches Election-Day Climax",wsj,2020-11-03 07:55:23
"Democrats Expected to Keep House Control, Though Tight Races Abound",wsj,2020-11-03 07:55:23
Officials on Watch for Disinformation If Results Are Delayed,wsj,2020-11-03 07:55:23
Stock Futures Rise Heading Into Election Day,wsj,2020-11-03 07:55:23
Vienna Terrorist Attacker Is Named as Kujtim Fejzulai,wsj,2020-11-03 07:55:23
Utilities Stocks Shed ‘Safety’ Image as Investors Bet on Blue-Wave Bump,wsj,2020-11-03 07:55:23
Natural-Gas Drillers Outshine Oil Peers as Covid-19 Surges,wsj,2020-11-03 07:55:23
Quibi Was Supposed to Revolutionize Hollywood. Here’s Why It Failed.,wsj,2020-11-03 07:55:23
Even One Case of the Coronavirus Is Too Many in Some Parts of the World,wsj,2020-11-03 07:55:23
Walmart Scraps Plan to Have Robots Scan Shelves,wsj,2020-11-03 07:55:23
Big Tech Enlists Hollywood to Boost Enhanced Reality,wsj,2020-11-03 07:55:23
"Come for the Desk, Stay for the Pool",wsj,2020-11-03 07:55:23
How to Buy a Home Together When You’re Not Married,wsj,2020-11-03 07:55:23
Emptied Sports Stadiums Tackle Losses With New Experiences,wsj,2020-11-03 07:55:23
What Makes People Abuse Robots?,wsj,2020-11-03 07:55:23
Jeffrey Epstein’s Palm Beach Mansion to Be Demolished,wsj,2020-11-03 07:55:23
What’s the Most Productive Workspace? Might Be the Pub,wsj,2020-11-03 07:55:23
Twitter’s Jack Dorsey Survives Scrutiny From Activist Investor,wsj,2020-11-03 07:55:23
"Aramco Sticks by $18.75 Billion Dividend, Despite Sharp Fall in Profit",wsj,2020-11-03 07:55:23
Bayer Posts Third-Quarter Loss on Agriculture Woes,wsj,2020-11-03 07:55:23
"Malls’ Decline Pushes Landlords CBL, PREIT to Bankruptcy",wsj,2020-11-03 07:55:23
