headline,org,date
"Apple, Tesla and Facebook ready to report record sales in busiest week of earnings",msnmoney,2021-01-24 09:41:25
Charming cabins for sale across America,msnmoney,2021-01-24 09:41:25
"Americans Are Abandoning These States, And Fast",msnmoney,2021-01-24 09:41:25
How Joe Biden’s Tax Plan Could Affect You,msnmoney,2021-01-24 09:41:25
Cozy Craftsman houses for sale across America,msnmoney,2021-01-24 09:41:25
A slam dunk if you need a balance transfer,msnmoney,2021-01-24 09:41:25
Why Dealmakers Expect Tech M&A to Keep Up Its Red-Hot Run,msnmoney,2021-01-24 09:41:25
Unique mountain vacation rentals,msnmoney,2021-01-24 09:41:25
5 high-growth themes and the stock-market ETFs that can deliver big gains in 2021,msnmoney,2021-01-24 09:41:25
"Man Who Predicted 2020 Crash Says ""Now Is The Time""",msnmoney,2021-01-24 09:41:25
Things you should stop buying in 2021,msnmoney,2021-01-24 09:41:25
Sean Connery's Old Mansion is Unsellable and it's No Secret Why,msnmoney,2021-01-24 09:41:25
What is lifestyle creep & why should you avoid it?,msnmoney,2021-01-24 09:41:25
Reasons you shouldn't play the lottery,msnmoney,2021-01-24 09:41:25
Junk Sales Set to Break January Record: U.S. Credit Week Ahead,msnmoney,2021-01-24 09:41:25
COVID-19 changed esports—here's how,msnmoney,2021-01-24 09:41:25
37 jobs that can withstand a recession,msnmoney,2021-01-24 09:41:25
"Where Should You Invest $1,000 in 2021?",msnmoney,2021-01-24 09:41:25
How to hire the right employee in 11 steps,msnmoney,2021-01-24 09:41:25
"He began buying Tesla at just $7.50, and now he’s retiring at 39 years old with $12 million worth — he still refuses to sell a single share",msnmoney,2021-01-24 09:41:25
Best National Banks for Your Money,msnmoney,2021-01-24 09:41:25
How to winterize a house,msnmoney,2021-01-24 09:41:25
Venmo Is Riddled with Scams – Is Zelle Any Safer?,msnmoney,2021-01-24 09:41:25
"Before you renew Amazon Prime, read this",msnmoney,2021-01-24 09:41:25
Billionaire investor: Enjoy the bull market while it lasts,msnmoney,2021-01-24 09:41:25
What Does Joe Biden’s Presidency Mean for Your Bank Account?,msnmoney,2021-01-24 09:41:25
15 ways to make sure you have enough to retire on,msnmoney,2021-01-24 09:41:25
Worst Places To Spend Your Golden Years and Where To Retire Instead,msnmoney,2021-01-24 09:41:25
"Stock-market legend sees few weeks of ‘putting your last, desperate chips into the game’—then pop",msnmoney,2021-01-24 09:41:25
Fire Sale on These 2020 SUVs: Deals Under $15K,msnmoney,2021-01-24 09:41:25
The biggest money scandals of the last decade,msnmoney,2021-01-24 09:41:25
The 10 Best State Capitals for Starting a Career,msnmoney,2021-01-24 09:41:25
What Covid-19 did to divorces,msnmoney,2021-01-24 09:41:25
13 Dumb Investing Moves — and How to Avoid Them,msnmoney,2021-01-24 09:41:25
Just How Rich Are President Joe Biden and These Other Big Names?,msnmoney,2021-01-24 09:41:25
New Car Gadget Magically Removes Scratches & Dents,msnmoney,2021-01-24 09:41:25
"Grocery sales soared in 2020 due to COVID-19, but analysts forecast a 2021 crash back to Earth",msnmoney,2021-01-24 09:41:25
These Red Flags on Your 2020 Tax Return Could Spark Interest From the IRS,msnmoney,2021-01-24 09:41:25
20 U.S. housing markets most at risk from climate change,msnmoney,2021-01-24 09:41:25
6 Ways to Avoid Spending Too Much at Warehouse Stores,msnmoney,2021-01-24 09:41:25
Microsoft earnings: The SolarWinds hack may be a good thing for Azure,msnmoney,2021-01-24 09:41:25
Rare Photographs Capture Chilling Last Known Moments,msnmoney,2021-01-24 09:41:25
Small debts that can wreck your credit score,msnmoney,2021-01-24 09:41:25
"AMD earnings: If Intel gets its act together, can AMD maintain swollen valuation?",msnmoney,2021-01-24 09:41:25
The most expensive pets money can buy,msnmoney,2021-01-24 09:41:25
"The S&P 500 won’t even keep up with inflation in the next 10 years, this accurate indicator shows",msnmoney,2021-01-24 09:41:25
Homeowners association horror stories,msnmoney,2021-01-24 09:41:25
She sticks a rose stalk into a potato and look what happens a week later!,msnmoney,2021-01-24 09:41:25
"Only 50% of Consumers Think It's a Good Time to Sell a Home, Fannie Mae Reports",msnmoney,2021-01-24 09:41:25
These Are the Coolest Tax Deductions You’re Missing Out On,msnmoney,2021-01-24 09:41:25
Why Disney+ is becoming more popular than other streaming services in some Asian markets,msnmoney,2021-01-24 09:41:25
How Much the 10 Most Common Car Repairs Cost — and How To Afford Them,msnmoney,2021-01-24 09:41:25
11 sneaky ways that online retailers get you to spend more,msnmoney,2021-01-24 09:41:25
Rare Photographs Capture Chilling Historical Moments,msnmoney,2021-01-24 09:41:25
Your month-by-month money guide for 2021,msnmoney,2021-01-24 09:41:25
Mask mandate: Biden signs order requiring masks for US interstate travelers,msnmoney,2021-01-24 09:41:25
Renovations To Make — and Skip — Before Selling Your Home,msnmoney,2021-01-24 09:41:25
These ‘lucky seven’ ETFs have left the S&P 500 in the dust,msnmoney,2021-01-24 09:41:25
30 Reasons It’s Hard To Retire at 65,msnmoney,2021-01-24 09:41:25
Brooklyn to Bel Air: Beyoncé and Jay-Z’s beautiful homes,msnmoney,2021-01-24 09:41:25
She sticks a rose stalk into a potato and look what happens a week later!,msnmoney,2021-01-24 09:41:25
The troubling state of women's retirement savings,msnmoney,2021-01-24 09:41:25
Here are Wall Street’s favorite oil stocks for a 2021 recovery,msnmoney,2021-01-24 09:41:25
20 most expensive states to retire in,msnmoney,2021-01-24 09:41:25
What is passive income & how can it work for you?,msnmoney,2021-01-24 09:41:25
"Before It Became the Norm, Which States Had the Most Remote Workers?",msnmoney,2021-01-24 09:41:25
Is 2021 finally the year for smart glasses? Here's why some experts still say no,msnmoney,2021-01-24 09:41:25
"[Pics] Michael Jordan's Wife Used To Be Good Looking, But What She Looks Like Now Is",msnmoney,2021-01-24 09:41:25
Steps Small Businesses Can Take To Bounce Back in 2021,msnmoney,2021-01-24 09:41:25
Rents Continue Double-Digit Drop: Markets Landlords Are Suffering Most,msnmoney,2021-01-24 09:41:25
Make These Simple But Essential Game Day Snacks for Under $12,msnmoney,2021-01-24 09:41:25
"Warren Buffett's Berkshire Hathaway has scored a 3,000% gain on its BYD investment. Here's the story of its bet on the Chinese electric-vehicle company.",msnmoney,2021-01-24 09:41:25
20 Smart Things to Do With Your Tax Refund,msnmoney,2021-01-24 09:41:25
The best ways to use your home equity,msnmoney,2021-01-24 09:41:25
"Apple, Tesla and Facebook ready to report record sales in busiest week of earnings",msnmoney,2021-01-24 09:41:25
Charming cabins for sale across America,msnmoney,2021-01-24 09:41:25
"Americans Are Abandoning These States, And Fast",msnmoney,2021-01-24 09:41:25
How Joe Biden’s Tax Plan Could Affect You,msnmoney,2021-01-24 09:41:25
Cozy Craftsman houses for sale across America,msnmoney,2021-01-24 09:41:25
A slam dunk if you need a balance transfer,msnmoney,2021-01-24 09:41:25
Why Dealmakers Expect Tech M&A to Keep Up Its Red-Hot Run,msnmoney,2021-01-24 09:41:25
Unique mountain vacation rentals,msnmoney,2021-01-24 09:41:25
5 high-growth themes and the stock-market ETFs that can deliver big gains in 2021,msnmoney,2021-01-24 09:41:25
"Man Who Predicted 2020 Crash Says ""Now Is The Time""",msnmoney,2021-01-24 09:41:25
Things you should stop buying in 2021,msnmoney,2021-01-24 09:41:25
Sean Connery's Old Mansion is Unsellable and it's No Secret Why,msnmoney,2021-01-24 09:41:25
What is lifestyle creep & why should you avoid it?,msnmoney,2021-01-24 09:41:25
Reasons you shouldn't play the lottery,msnmoney,2021-01-24 09:41:25
Junk Sales Set to Break January Record: U.S. Credit Week Ahead,msnmoney,2021-01-24 09:41:25
COVID-19 changed esports—here's how,msnmoney,2021-01-24 09:41:25
37 jobs that can withstand a recession,msnmoney,2021-01-24 09:41:25
"Where Should You Invest $1,000 in 2021?",msnmoney,2021-01-24 09:41:25
How to hire the right employee in 11 steps,msnmoney,2021-01-24 09:41:25
"He began buying Tesla at just $7.50, and now he’s retiring at 39 years old with $12 million worth — he still refuses to sell a single share",msnmoney,2021-01-24 09:41:25
Best National Banks for Your Money,msnmoney,2021-01-24 09:41:25
How to winterize a house,msnmoney,2021-01-24 09:41:25
Venmo Is Riddled with Scams – Is Zelle Any Safer?,msnmoney,2021-01-24 09:41:25
"Before you renew Amazon Prime, read this",msnmoney,2021-01-24 09:41:25
Billionaire investor: Enjoy the bull market while it lasts,msnmoney,2021-01-24 09:41:25
What Does Joe Biden’s Presidency Mean for Your Bank Account?,msnmoney,2021-01-24 09:41:25
15 ways to make sure you have enough to retire on,msnmoney,2021-01-24 09:41:25
Worst Places To Spend Your Golden Years and Where To Retire Instead,msnmoney,2021-01-24 09:41:25
"Stock-market legend sees few weeks of ‘putting your last, desperate chips into the game’—then pop",msnmoney,2021-01-24 09:41:25
Fire Sale on These 2020 SUVs: Deals Under $15K,msnmoney,2021-01-24 09:41:25
The biggest money scandals of the last decade,msnmoney,2021-01-24 09:41:25
The 10 Best State Capitals for Starting a Career,msnmoney,2021-01-24 09:41:25
What Covid-19 did to divorces,msnmoney,2021-01-24 09:41:25
13 Dumb Investing Moves — and How to Avoid Them,msnmoney,2021-01-24 09:41:25
Just How Rich Are President Joe Biden and These Other Big Names?,msnmoney,2021-01-24 09:41:25
New Car Gadget Magically Removes Scratches & Dents,msnmoney,2021-01-24 09:41:25
"Grocery sales soared in 2020 due to COVID-19, but analysts forecast a 2021 crash back to Earth",msnmoney,2021-01-24 09:41:25
These Red Flags on Your 2020 Tax Return Could Spark Interest From the IRS,msnmoney,2021-01-24 09:41:25
20 U.S. housing markets most at risk from climate change,msnmoney,2021-01-24 09:41:25
6 Ways to Avoid Spending Too Much at Warehouse Stores,msnmoney,2021-01-24 09:41:25
Microsoft earnings: The SolarWinds hack may be a good thing for Azure,msnmoney,2021-01-24 09:41:25
Rare Photographs Capture Chilling Last Known Moments,msnmoney,2021-01-24 09:41:25
Small debts that can wreck your credit score,msnmoney,2021-01-24 09:41:25
"AMD earnings: If Intel gets its act together, can AMD maintain swollen valuation?",msnmoney,2021-01-24 09:41:25
The most expensive pets money can buy,msnmoney,2021-01-24 09:41:25
"The S&P 500 won’t even keep up with inflation in the next 10 years, this accurate indicator shows",msnmoney,2021-01-24 09:41:25
Homeowners association horror stories,msnmoney,2021-01-24 09:41:25
She sticks a rose stalk into a potato and look what happens a week later!,msnmoney,2021-01-24 09:41:25
"Only 50% of Consumers Think It's a Good Time to Sell a Home, Fannie Mae Reports",msnmoney,2021-01-24 09:41:25
These Are the Coolest Tax Deductions You’re Missing Out On,msnmoney,2021-01-24 09:41:25
Why Disney+ is becoming more popular than other streaming services in some Asian markets,msnmoney,2021-01-24 09:41:25
How Much the 10 Most Common Car Repairs Cost — and How To Afford Them,msnmoney,2021-01-24 09:41:25
11 sneaky ways that online retailers get you to spend more,msnmoney,2021-01-24 09:41:25
Rare Photographs Capture Chilling Historical Moments,msnmoney,2021-01-24 09:41:25
Your month-by-month money guide for 2021,msnmoney,2021-01-24 09:41:25
Mask mandate: Biden signs order requiring masks for US interstate travelers,msnmoney,2021-01-24 09:41:25
Renovations To Make — and Skip — Before Selling Your Home,msnmoney,2021-01-24 09:41:25
These ‘lucky seven’ ETFs have left the S&P 500 in the dust,msnmoney,2021-01-24 09:41:25
30 Reasons It’s Hard To Retire at 65,msnmoney,2021-01-24 09:41:25
Brooklyn to Bel Air: Beyoncé and Jay-Z’s beautiful homes,msnmoney,2021-01-24 09:41:25
She sticks a rose stalk into a potato and look what happens a week later!,msnmoney,2021-01-24 09:41:25
The troubling state of women's retirement savings,msnmoney,2021-01-24 09:41:25
Here are Wall Street’s favorite oil stocks for a 2021 recovery,msnmoney,2021-01-24 09:41:25
20 most expensive states to retire in,msnmoney,2021-01-24 09:41:25
What is passive income & how can it work for you?,msnmoney,2021-01-24 09:41:25
"Before It Became the Norm, Which States Had the Most Remote Workers?",msnmoney,2021-01-24 09:41:25
Is 2021 finally the year for smart glasses? Here's why some experts still say no,msnmoney,2021-01-24 09:41:25
"[Pics] Michael Jordan's Wife Used To Be Good Looking, But What She Looks Like Now Is",msnmoney,2021-01-24 09:41:25
Steps Small Businesses Can Take To Bounce Back in 2021,msnmoney,2021-01-24 09:41:25
Rents Continue Double-Digit Drop: Markets Landlords Are Suffering Most,msnmoney,2021-01-24 09:41:25
Make These Simple But Essential Game Day Snacks for Under $12,msnmoney,2021-01-24 09:41:25
"Warren Buffett's Berkshire Hathaway has scored a 3,000% gain on its BYD investment. Here's the story of its bet on the Chinese electric-vehicle company.",msnmoney,2021-01-24 09:41:25
20 Smart Things to Do With Your Tax Refund,msnmoney,2021-01-24 09:41:25
The best ways to use your home equity,msnmoney,2021-01-24 09:41:25
Scaramucci to Biden: 'Now is not the time to raise taxes',yahoofinance,2021-01-24 09:43:29
GOP may be willing to compromise under Biden: ex-WH advisor,yahoofinance,2021-01-24 09:43:29
"Dr. Martens set to go public, announce cornerstone investors",yahoofinance,2021-01-24 09:43:29
Trans Mountain pipeline shines after KXL's demise,yahoofinance,2021-01-24 09:43:29
‘Poor management’ of vaccine distribution in New York,yahoofinance,2021-01-24 09:43:29
‘The defense production act can be used as a incentive rather than a weapon’: NAM CEO,yahoofinance,2021-01-24 09:43:29
Biden should forget about unifying the country,yahoofinance,2021-01-24 09:43:29
Here are the world’s best places to retire in 2021,yahoofinance,2021-01-24 09:43:29
15 Year Fixed Mortgage 1.90% APR,yahoofinance,2021-01-24 09:43:29
"Here's how celebrities use mortgages to build wealth (and you can, too)",yahoofinance,2021-01-24 09:43:29
Suze Orman says these are Americans' biggest money blunders,yahoofinance,2021-01-24 09:43:29
7 Dividend Aristocrats That Will Outlive Us All,yahoofinance,2021-01-24 09:43:29
"Dow Jones Futures: Stock Market Rally Extended As Apple, Tesla Lead Earnings Tsunami",yahoofinance,2021-01-24 09:43:29
5 Stocks to Buy in 2021 for Rapid-Fire Growth,yahoofinance,2021-01-24 09:43:29
Don’t Buy CCIV Stock Now. But Pounce on the Lucid Motors Merger,yahoofinance,2021-01-24 09:43:29
"Microsoft Steps Closer To A Breakout; When To Buy Alibaba, Epam, Thermo Fisher",yahoofinance,2021-01-24 09:43:29
7 Undervalued Stocks That Could Perk Up Under Democratic Leadership,yahoofinance,2021-01-24 09:43:29
The Originator of ‘the 4% Rule’ Thinks It’s Off the Mark. He Says It Now Could Be Up to 4.5%.,yahoofinance,2021-01-24 09:43:29
"Apple, Tesla and Facebook ready to report record sales in busiest week of earnings",yahoofinance,2021-01-24 09:43:29
Tesla Accuses Employee Who Worked For Company For Less Than 2 Weeks Of Stealing Trade Secrets,yahoofinance,2021-01-24 09:43:29
"Will Carnival, Royal Caribbean Or Norwegian Stock Grow The Most By 2022?",yahoofinance,2021-01-24 09:43:29
Secretive EV Battery Maker QuantumScape Is a Stock to Avoid,yahoofinance,2021-01-24 09:43:29
How Biden's student loan forgiveness could throw you a big tax bomb,yahoofinance,2021-01-24 09:43:29
EVgo to go public via SPAC in bid to power EV charging expansion,yahoofinance,2021-01-24 09:43:29
Top Stocks to Buy in 11 Different Sectors,yahoofinance,2021-01-24 09:43:29
"Benzinga's Weekly Bulls And Bears: Eli Lilly, Ford, GameStop, Intel, McDonald's And More",yahoofinance,2021-01-24 09:43:29
Top Cannabis Analysts Share Why They Are Bullish on These 2 Stocks,yahoofinance,2021-01-24 09:43:29
AT&T Reportedly In Talks To Sell Piece Of DirecTV To Private Equity Firm,yahoofinance,2021-01-24 09:43:29
Stop the Fixation With Bitcoin and Invest in Ethereum,yahoofinance,2021-01-24 09:43:29
A survey says we're holding on to too much cash — do this instead,yahoofinance,2021-01-24 09:43:29
"Stock-market legend sees few weeks of ‘putting your last, desperate chips into the game’—then pop",yahoofinance,2021-01-24 09:43:29
Why Stephanie Link Is A Buyer Of IBM,yahoofinance,2021-01-24 09:43:29
"4 Top Stock Trades for Monday: BBBY, PLTR, FUBO, ORCL",yahoofinance,2021-01-24 09:43:29
3 Top Cloud Software Picks From Goldman Sachs Among 12 Initiations,yahoofinance,2021-01-24 09:43:29
"With Biden, you could get a 'stimulus check' for health insurance",yahoofinance,2021-01-24 09:43:29
Germany urges Taiwan to help ease auto chip shortage,yahoofinance,2021-01-24 09:43:29
2 “Strong Buy” FAANG Stocks to Watch Heading Into Earnings,yahoofinance,2021-01-24 09:43:29
GM and Ford Stock Finally Capture Some of Tesla’s Heat. Why This Is Only the Beginning.,yahoofinance,2021-01-24 09:43:29
‘Abidin’ Biden by Gold,yahoofinance,2021-01-24 09:43:29
Nio Stock Is a Proper Vehicle to Bet on the EV Revolution,yahoofinance,2021-01-24 09:43:29
"Palantir Stock, IBD Stock Of The Day, Claws Back As Other Top Software IPOs Struggle",yahoofinance,2021-01-24 09:43:29
EVgo Is Merging With a SPAC to Go Public,yahoofinance,2021-01-24 09:43:29
AT&T earnings to kick off a defining year for telecom giant,yahoofinance,2021-01-24 09:43:29
"The Week Ahead In Biotech (Jan 24-30): J&J, Lilly to Kickstart Big Pharma Earnings, Amgen FDA Decision and More",yahoofinance,2021-01-24 09:43:29
The Top 7 Stocks to Buy for Biden’s First 100 Days,yahoofinance,2021-01-24 09:43:29
Tesla earnings: Can sales growth match stock’s rise?,yahoofinance,2021-01-24 09:43:29
Plug Power CEO Nets $35.4M In Planned Sale Of Hydrogen Fuel Cell Company's Stock,yahoofinance,2021-01-24 09:43:29
"Is Home Depot Stock A Buy Right Now After A Key Upgrade? Here's What Earnings, Charts Show",yahoofinance,2021-01-24 09:43:29
"BlackRock, Intel, and Other Companies That Raised Their Dividends This Week",yahoofinance,2021-01-24 09:43:29
Now May Not Be a Good Time to Charge Into Switchback Energy,yahoofinance,2021-01-24 09:43:29
How to Maximize Social Security Benefits: 6 Ways,yahoofinance,2021-01-24 09:43:29
How the National Debt Affects Your Investments,yahoofinance,2021-01-24 09:43:29
Americans tend to blow an inheritance — here’s how to be prudent and have some fun too,yahoofinance,2021-01-24 09:43:29
It’s Time to Give GOEV Stock a Green Light,yahoofinance,2021-01-24 09:43:29
Should Inovio Be On Your Buy List As It Tackles A Coronavirus Vaccine?,yahoofinance,2021-01-24 09:43:29
JPMorgan Upgrades Ford: 'Incoming Tide Of Hot New Products',yahoofinance,2021-01-24 09:43:29
How to get your affairs in order if your spouse is dying,yahoofinance,2021-01-24 09:43:29
Play Bill Ackman’s SPAC Without the Inherent Frothiness,yahoofinance,2021-01-24 09:43:29
7 Best Tech Index Funds to Buy Now,yahoofinance,2021-01-24 09:43:29
This former Michigan State University basketball player started selling mortgages in his 20s now he's worth more than $11 billion,yahoofinance,2021-01-24 09:43:29
"Carnival Stock Is Slumping, and Executives Are Selling Stock",yahoofinance,2021-01-24 09:43:29
Why Morgan Stanley Is Downgrading Globalstar After Strong Rally,yahoofinance,2021-01-24 09:43:29
"Aurora Cannabis: Another Day, Another Dilution",yahoofinance,2021-01-24 09:43:29
Robotic Surgery Giant Expects Hospitals To 'Clamp Down' — Shares Dive,yahoofinance,2021-01-24 09:43:29
Getting stimulus checks out more quickly is goal of new Biden executive order,yahoofinance,2021-01-24 09:43:29
Short Squeeze Sends GameStop Shares to 2007 Levels. What Happens Next.,yahoofinance,2021-01-24 09:43:29
U.S Mortgage Rates Fall as COVID-19 Infection Rates Pin Back U.S Treasury Yields,yahoofinance,2021-01-24 09:43:29
A Perfect Buying Opportunity Presents Itself in Nio Stock,yahoofinance,2021-01-24 09:43:29
Ethereum’s Road to $2K: 3 Reasons to Be Bullish,yahoofinance,2021-01-24 09:43:29
Elon Musk's SpaceX plans natural-gas drilling in Texas: report,yahoofinance,2021-01-24 09:43:29
Should you invest in stocks or real estate?,yahoofinance,2021-01-24 09:43:29
"After IBM's Mixed Q4, 3 Analysts On Whether 2021 Will Be A Turnaround Year",yahoofinance,2021-01-24 09:43:29
5 Best Auto Stocks to Buy In 2021,yahoofinance,2021-01-24 09:43:29
"Stock-market bulls brace for major gut check as earnings, Fed and GDP loom",yahoofinance,2021-01-24 09:43:29
How Advisors Handle Aging Clients Who Want To Dump All Their Stock,yahoofinance,2021-01-24 09:43:29
Every Warren Buffett Needs a Charlie Munger,yahoofinance,2021-01-24 09:43:29
Small Tax Change May Have Big Impact on Life Insurance,yahoofinance,2021-01-24 09:43:29
3 Reasons Growth Investors Should Still Consider Square Stock,yahoofinance,2021-01-24 09:43:29
28 Investment Ideas From Barron’s Roundtable Experts to Beat the Market This Year,yahoofinance,2021-01-24 09:43:29
Get ready for Apple’s first $100 billion quarter in history,yahoofinance,2021-01-24 09:43:29
Intel Released Its Earnings Results Early. Here’s What We Know.,yahoofinance,2021-01-24 09:43:29
Big Investment Firm Bought Up Gold Stocks and Microsoft. Here’s What It Sold.,yahoofinance,2021-01-24 09:43:29
2 Key Reasons Xpeng Stock Belongs On Your Radar,yahoofinance,2021-01-24 09:43:29
Why Microsoft and 5 Other Software Stocks Could Still Be Buys,yahoofinance,2021-01-24 09:43:29
IRS ‘stands ready’ to send out third round of stimulus checks and process tax returns,yahoofinance,2021-01-24 09:43:29
News and analysis for those planning for or living in retirement,yahoofinance,2021-01-24 09:43:29
28 Undervalued European Stocks Set to Beat Pre-Covid Earnings in 2021,yahoofinance,2021-01-24 09:43:29
Ocugen Is Hanging On By a Thread With Its Latest Indian Biotech Deal,yahoofinance,2021-01-24 09:43:29
"United Airlines launches new employee exit deals with pay, memo shows",yahoofinance,2021-01-24 09:43:29
Blockchain Bites: Clearing the Record on Yellen’s Crypto Concerns and the Bitcoin Double-Spend Fracas,yahoofinance,2021-01-24 09:43:29
GameStop Stock Is Just the Latest Sign of a Speculative Frenzy,yahoofinance,2021-01-24 09:43:29
Taiwan says asking chip firms to help ease auto chip shortage,yahoofinance,2021-01-24 09:43:29
Liberty Media SPAC IPO: 11 Things to Know as Liberty Launches LMACU Stock,yahoofinance,2021-01-24 09:43:29
"GE earnings: Can Q4 results, FCF guidance support the stock’s record rally?",yahoofinance,2021-01-24 09:43:29
Ford’s ‘hot’ new cars earn its stock an upgrade to buy from J.P. Morgan,yahoofinance,2021-01-24 09:43:29
10 Biggest Insurance Companies,yahoofinance,2021-01-24 09:43:29
Weekend reads: Buy GM and sell Tesla,yahoofinance,2021-01-24 09:43:29
ADMP Stock: 4 Things to Know About Adamis Pharma Today as Shares Rocket Again,yahoofinance,2021-01-24 09:43:29
Is DraftKings Stock A Buy Or Sell Right Now After Michigan Launches Sports Betting?,yahoofinance,2021-01-24 09:43:29
It’s the Year of Digital Infrastructure. Here Are 4 Stocks to Buy.,yahoofinance,2021-01-24 09:43:29
Apple Stock Nears Another Record. Analysts’ iPhone Outlooks Keep Going Up.,yahoofinance,2021-01-24 09:43:29
Walmart Stock Could Rise More Than 35% if Everything Falls Into Place,yahoofinance,2021-01-24 09:43:29
XPeng Stock Will Electrify Your Portfolio,yahoofinance,2021-01-24 09:43:29
"EV Charging Network With Tesla, GM Ties To Go Public As ChargePoint IPO Nears",yahoofinance,2021-01-24 09:43:29
"AMD earnings: If Intel gets its act together, can AMD maintain swollen valuation?",yahoofinance,2021-01-24 09:43:29
Silver Weekly Price Forecast – Silver Has Been All Over the Place,yahoofinance,2021-01-24 09:43:29
Schlumberger Earnings Were Impressive. Why Its Stock Dipped.,yahoofinance,2021-01-24 09:43:29
Golden Nugget Online Gaming Stock May See $20 Before $40,yahoofinance,2021-01-24 09:43:29
Volkswagen looks to claim damages from suppliers over chip shortages,yahoofinance,2021-01-24 09:43:29
Bullish Stock Bets Explode as Indexes Keep Hitting Highs,wsj,2021-01-24 09:46:12
Covid’s Financial Toll Mounts on Homeowners,wsj,2021-01-24 09:46:12
Biden’s ‘Buy American’ Plan Eyed Warily,wsj,2021-01-24 09:46:12
China Joins Push to Rein In Big Tech Companies,wsj,2021-01-24 09:46:12
Trump Pressed DOJ to Ask Supreme Court to Overturn Election Results,wsj,2021-01-24 09:46:12
AstraZeneca’s Vaccine Shortfall Threatens EU Inoculation Plans,wsj,2021-01-24 09:46:12
Manufacturing Rebound Has Suppliers Struggling to Keep Up,wsj,2021-01-24 09:46:12
Russia Clamps Down on Demonstrations for Alexei Navalny,wsj,2021-01-24 09:46:12
15 Personal-Finance Lessons We Can All Learn From the Year of Covid-19,wsj,2021-01-24 09:46:12
From AirPods to Bose: The Best Noise-Canceling Headphones,wsj,2021-01-24 09:46:12
She Traded In Her Oil Industry Job to Design Cowboy Boots for the Office,wsj,2021-01-24 09:46:12
"Before Filing Your 2020 Taxes, Here Are Answers to Some Common Questions",wsj,2021-01-24 09:46:12
Try This Six-Week Home Workout Routine to Build Better Habits,wsj,2021-01-24 09:46:12
"Apple, Microsoft and Tesla Headline Busy Earnings Week",wsj,2021-01-24 09:46:12
When SPACs Attack! A New Force Is Invading Wall Street.,wsj,2021-01-24 09:46:12
Samsung Eyes Investing Up to $17 Billion in New U.S. Chip Plant,wsj,2021-01-24 09:46:12
He Said ‘Buy’ as Stocks Crashed,wsj,2021-01-24 09:46:12
"A Restaurant Owner, Hurt by the Pandemic, Gets Advice on Shoring Up His Personal Finances",wsj,2021-01-24 09:46:12
Larry King Dies at 87,wsj,2021-01-24 09:46:12
"Peter Huber Provoked Debate on Medicine, the Environment",wsj,2021-01-24 09:46:12
Michele Evans Oversaw Lockheed Martin’s Biggest Project,wsj,2021-01-24 09:46:12
"On the 100th Anniversary of ‘Robot,’ They’re Finally Taking Over",wsj,2021-01-24 09:46:12
Undertakers Take Front Lines in South Africa’s Virus Fight,wsj,2021-01-24 09:46:12
India’s Covid-19 Vaccinations Get Off to Bumpy Start,wsj,2021-01-24 09:46:12
