headline,org,date
"Stock futures jump, Dow futures gain 300+ points",yahoofinance,2020-09-28 08:22:42
Investors should remember this if they fear a contested election,yahoofinance,2020-09-28 08:22:42
Netflix price hikes could mean up to $1B in extra sales in 2021,yahoofinance,2020-09-28 08:22:42
Judge temporarily blocks Trump action on TikTok,yahoofinance,2020-09-28 08:22:42
MoMA celebrates over 90 years of history,yahoofinance,2020-09-28 08:22:42
Roku's deal with Peacock offers ad tailwind: Needham,yahoofinance,2020-09-28 08:22:42
"If voters’ top concern is health care, Biden will win",yahoofinance,2020-09-28 08:22:42
Democrats would add 7M more jobs than GOP: analysis,yahoofinance,2020-09-28 08:22:42
"2.4% FIXED Mortgage Refi, No Hidden Fees/Points",yahoofinance,2020-09-28 08:22:42
Sell the day and go away? U.S. stock returns come overnight,yahoofinance,2020-09-28 08:22:42
Trump reportedly paid no federal tax in 10 of the last 15 years: 75 million of Americans pay no federal income tax — here’s why,yahoofinance,2020-09-28 08:22:42
Nikola Founder Milton’s Fall Reveals What His Backers Feared,yahoofinance,2020-09-28 08:22:42
Who Killed Sears? Fifty Years on the Road to Ruin,yahoofinance,2020-09-28 08:22:42
Trump reportedly paid no federal tax in 10 of the last 15 years. Why 75 million U.S. households pay no federal income tax,yahoofinance,2020-09-28 08:22:42
"Australia's Piedmont signs lithium ore supply deal with Tesla, shares surge",yahoofinance,2020-09-28 08:22:42
Inside the JPMorgan Trading Desk the U.S. Called a Crime Ring,yahoofinance,2020-09-28 08:22:42
Cleveland-Cliffs to Buy ArcelorMittal USA for $1.4 Billion,yahoofinance,2020-09-28 08:22:42
Remington Auctioned Off to Seven Bidders in Bankruptcy Court,yahoofinance,2020-09-28 08:22:42
A 28-Year Old Billionaire Wins the SPAC Lottery,yahoofinance,2020-09-28 08:22:42
Siemens' record 16 billion euro spin-off falls in Frankfurt debut,yahoofinance,2020-09-28 08:22:42
"Stock market news live updates: Stock futures jump, Dow futures gain 300+ points",yahoofinance,2020-09-28 08:22:42
"These 2 Small-Cap Tech Stocks Are Grossly Undervalued, Says Needham",yahoofinance,2020-09-28 08:22:42
Opinion: Why Mr. Market doesn’t care if democracy is collapsing,yahoofinance,2020-09-28 08:22:42
'Take home' lawsuits over COVID infections could be costly for U.S. employers,yahoofinance,2020-09-28 08:22:42
"NY Times: Trump paid $750 in US income taxes in 2016, 2017",yahoofinance,2020-09-28 08:22:42
China’s Largest Chipmaker Sinks After U.S. Restrictions,yahoofinance,2020-09-28 08:22:42
Nikola Corp's founder purchased truck designs from third party - FT,yahoofinance,2020-09-28 08:22:42
These Are The 5 Best Stocks To Buy And Watch Now,yahoofinance,2020-09-28 08:22:42
"Alibaba, PepsiCo, Micron, Chevron, and Other Stocks for Investors to Watch This Week",yahoofinance,2020-09-28 08:22:42
Here’s the silver lining for stocks if Democrats ‘sweep’ November election,yahoofinance,2020-09-28 08:22:42
Something investors should remember if they fear a contested election: Morning Brief,yahoofinance,2020-09-28 08:22:42
Caesars Says $3.7 Billion Bid High Enough for William Hill,yahoofinance,2020-09-28 08:22:42
The Unintended Consequences Of Fossil Fuel Divestment,yahoofinance,2020-09-28 08:22:42
"Michigan cherry farmers could lose jobs, livelihoods amid tough competition from overseas",yahoofinance,2020-09-28 08:22:42
Bearish Bets: 2 Healthcare Stocks You Should Consider Shorting This Week,yahoofinance,2020-09-28 08:22:42
Gold Stocks Are Bracing For A Seasonal Plunge,yahoofinance,2020-09-28 08:22:42
Retirement Literacy Quiz Stumps 8 in 10. The Results Suggest Longevity Risks.,yahoofinance,2020-09-28 08:22:42
Devon to Buy WPX for $2.56 Billion to Expand in Permian Oil,yahoofinance,2020-09-28 08:22:42
"ServiceNow, Nvidia, Qualcomm Near Buy Points In Stock Market Rally Attempt",yahoofinance,2020-09-28 08:22:42
HSBC Posts Biggest Jump Since 2009 as China’s Ping An Buys,yahoofinance,2020-09-28 08:22:42
Where's the Stock Market Headed Into Year-End? A Technical Look and Strategy,yahoofinance,2020-09-28 08:22:42
Tesla Chinese Rivals Not Losing Sleep Over Planned $25K Electric Vehicle,yahoofinance,2020-09-28 08:22:42
"CVS Stock: Is It A Buy Right Now? Here's What Earnings, Charts Show As CVS Customers Don Masks",yahoofinance,2020-09-28 08:22:42
"Tesla Supplier Panasonic Trails Samsung In Battery Patents, But Japan Tops Overall: Study",yahoofinance,2020-09-28 08:22:42
Warren Buffett’s Berkshire Hathaway Sold This Health-Care Stock,yahoofinance,2020-09-28 08:22:42
Is Gold About to Move Higher?,yahoofinance,2020-09-28 08:22:42
"Barron's Picks And Pans: Peloton, Truist, Western Digital And More",yahoofinance,2020-09-28 08:22:42
Huawei CFO Meng back in Canadian court fighting U.S. extradition,yahoofinance,2020-09-28 08:22:42
Emotions can mess up an investment plan. Beware of 6 irrational ways to make decisions,yahoofinance,2020-09-28 08:22:42
Cleveland-Cliffs to buy U.S. assets of ArcelorMittal,yahoofinance,2020-09-28 08:22:42
Netflix price hike looms — here's how much more money Netflix may haul in,yahoofinance,2020-09-28 08:22:42
What to Expect in the Markets This Week,yahoofinance,2020-09-28 08:22:42
Costco Sells Off Despite Strong Quarter,yahoofinance,2020-09-28 08:22:42
Forget Congress. Here's how to get a 2nd stimulus check by DIY,yahoofinance,2020-09-28 08:22:42
Siemens Energy Recovers After Initial Slump on Frankfurt Debut,yahoofinance,2020-09-28 08:22:42
Sweden's Atlas Copco agrees to buy Perceptron to expand into machine vision,yahoofinance,2020-09-28 08:22:42
"Dow Futures Surge, Dollar Retreats After Solid China Data Lifts Global Stocks; Trump Tax Returns, US Politics in Focus",yahoofinance,2020-09-28 08:22:42
"Dow Jones Stocks To Buy And Watch In September 2020: Amgen, Apple, Home Depot, Microsoft",yahoofinance,2020-09-28 08:22:42
Devon Energy and WPX Rise Sharply on Confirmation of Merger Pact,yahoofinance,2020-09-28 08:22:42
MobileIron to be acquired by Ivanti in all-cash deal valued at about $872 million,yahoofinance,2020-09-28 08:22:42
Cleveland-Cliffs to Buy ArcelorMittal's U.S. Operations for $1.4 Billion,yahoofinance,2020-09-28 08:22:42
"Value of U.S. commercial property slashed by 27%, Financial Times reports",yahoofinance,2020-09-28 08:22:42
"Investors swamp IPO for K-Pop band BTS management label, prices at top of range",yahoofinance,2020-09-28 08:22:42
Weibo-owner Sina to go private in $2.6 billion deal with CEO-led firm,yahoofinance,2020-09-28 08:22:42
"Notable Insider Buys Last Week: Snowflake, Broadcom And More",yahoofinance,2020-09-28 08:22:42
"Bulls And Bears Of The Week: Chevron, Oracle, Twitter And More",yahoofinance,2020-09-28 08:22:42
"After Deploying Almost $9 Trillion, Crisis Fighters Face New Dilemmas",yahoofinance,2020-09-28 08:22:42
Is the controversial Netflix “Keeper Test” good management?,yahoofinance,2020-09-28 08:22:42
Devon Energy and WPX to combine in all-stock merger of equals with enterprise value of about $12 billion,yahoofinance,2020-09-28 08:22:42
Gold drops as equities rebound; Trump-Biden debate eyed,yahoofinance,2020-09-28 08:22:42
This Preferred From a John Malone-Controlled Company Offers an 8% Yield,yahoofinance,2020-09-28 08:22:42
"Cleveland-Cliffs, TikTok, Trump, Caesars - 5 Things You Must Know Monday",yahoofinance,2020-09-28 08:22:42
The Fidelity Magellan ETF Isn’t Peter Lynch’s but It’s Still Interesting,yahoofinance,2020-09-28 08:22:42
"You can ‘turn cash into anything,’ says big investor on why he’s putting more of it on the sidelines",yahoofinance,2020-09-28 08:22:42
Gulf Nations Are Desperate For Higher Oil Prices,yahoofinance,2020-09-28 08:22:42
Oil Erases Losses With Dollar Falling But Uncertain Demand Looms,yahoofinance,2020-09-28 08:22:42
Europe Stocks Rally Most in 3 Weeks; Futures Gain: Markets Wrap,yahoofinance,2020-09-28 08:22:42
Exclusive: ArcelorMittal in talks to merge U.S. assets with Cleveland-Cliffs - sources,yahoofinance,2020-09-28 08:22:42
JPMorgan Says Usual Hedges Aren’t Working as They Once Did,yahoofinance,2020-09-28 08:22:42
Trump’s TikTok Download Ban Is Blocked by Judge,wsj,2020-09-28 08:25:14
Stock Futures Rally as Traders Bet on Volatile Election Season,wsj,2020-09-28 08:25:14
Uber Wins Back License to Operate in London After Yearslong Battle,wsj,2020-09-28 08:25:14
"Nikola’s Business Model Relies on Big Leaps in Technology, Large Declines in Costs",wsj,2020-09-28 08:25:14
Those Dying From Covid-19 Are Least Likely to Own Life Insurance,wsj,2020-09-28 08:25:14
Hearing in ‘Fortnite’ Maker’s Apple Lawsuit to Test Antitrust Claims,wsj,2020-09-28 08:25:14
Trump Declines to Say How Much He Has Paid in Federal Income Taxes,wsj,2020-09-28 08:25:14
"Cipollone, Meadows Lead White House Effort to Confirm Barrett to Supreme Court",wsj,2020-09-28 08:25:14
Amazon’s Late Prime Day Is Set to Fuel Record End to Year,wsj,2020-09-28 08:25:14
Some Google Search Rivals Lose Footing on Android System,wsj,2020-09-28 08:25:14
What to Know About Tuesday’s Debate,wsj,2020-09-28 08:25:14
You Can Go Back to the Office—You Just Need a VR Headset,wsj,2020-09-28 08:25:14
"MLB Finished Its Pandemic Season—but 2021 Would Be ‘Devastating’ Without Fans, Commissioner Says",wsj,2020-09-28 08:25:14
"Some Travelers Miss Flying So Much, They’re Taking Planes to Nowhere",wsj,2020-09-28 08:25:14
"Devon Energy, WPX Announce Merger",wsj,2020-09-28 08:25:14
Chinese Retailer JD.com’s Health-Care Business Plans Hong Kong IPO,wsj,2020-09-28 08:25:14
Developer China Evergrande Erases Market Losses,wsj,2020-09-28 08:25:14
‘Fallen Angels’ Fall Short of Expectations,wsj,2020-09-28 08:25:14
Kioxia Calls Off $16 Billion IPO After Huawei Fallout,wsj,2020-09-28 08:25:14
Covid Blunts Unilever’s Edge in Emerging Markets,wsj,2020-09-28 08:25:14
Steel Giant ArcelorMittal to Sell U.S. Business to Cleveland-Cliffs,wsj,2020-09-28 08:25:14
Caesars Makes $3.7 Billion Offer for U.K. Bookmaker William Hill,wsj,2020-09-28 08:25:14
"Students Return to School Buildings, but Teachers Work Remotely",wsj,2020-09-28 08:25:14
Israel Emerges as Top Destination for American Teens Amid Pandemic,wsj,2020-09-28 08:25:14
Pakistan’s Top Court to Weigh Reinstating Death Sentence on Accused Killer of WSJ Reporter,wsj,2020-09-28 08:25:14
AirPods Pro Are Even Better a Year Later,wsj,2020-09-28 08:25:14
Teachers Find Higher Pay and Growing Options in Covid Pods,wsj,2020-09-28 08:25:14
Roland-Garros Prepares to Plow Through Second Wave,wsj,2020-09-28 08:25:14
Pandemic Frees Formerly Office-Bound Workers to Experiment With New Lifes,wsj,2020-09-28 08:25:14
" Economy Week Ahead: Factories, Consumer Spending and Employment ",wsj,2020-09-28 08:25:14
 U.S. Durable-Goods Orders Rise for Fourth Straight Month ,wsj,2020-09-28 08:25:14
" Economy Week Ahead: Factories, Consumer Spending and Employment ",wsj,2020-09-28 08:25:14
 White Kitchens Are Getting Kicked to the Curb ,wsj,2020-09-28 08:25:14
 John Legend and Chrissy Teigen Buy Beverly Hills Home for $17.5 Million ,wsj,2020-09-28 08:25:14
 This Miami Beach Home Is Not Like the Other Ones ,wsj,2020-09-28 08:25:14
" In Baseball’s Pandemic Playoffs, the Schedule Could Decide the Pennant ",wsj,2020-09-28 08:25:14
" Bama Fans Learn About Supply, Demand and Covid ",wsj,2020-09-28 08:25:14
 Roland-Garros Prepares to Plow Through Europe’s Second Wave ,wsj,2020-09-28 08:25:14
"Even in Streaming TV, Advertisers Are Dealing With Fraud",wsj,2020-09-28 08:25:14
Microsoft’s Brand Chief on Working With the NFL During Covid,wsj,2020-09-28 08:25:14
Procter & Gamble Calls for Change to Annual TV Ad-Buying Process,wsj,2020-09-28 08:25:14
Cloud Startups Ride Wave of Pandemic-Fueled Investments,wsj,2020-09-28 08:25:14
Enterprise Tech Efforts Move Beyond Survival Mode,wsj,2020-09-28 08:25:14
New Tech Chief of Startup Hypergiant Envisions Closer Human-AI Collaboration,wsj,2020-09-28 08:25:14
Herman Miller Waits for Employers to Step Up Orders for New Office Furniture,wsj,2020-09-28 08:25:14
"Citigroup Names Next Controller, Accounting Chief",wsj,2020-09-28 08:25:14
"Companies Adjust Earnings for Covid-19 Costs, but Are They Still a One-Time Expense?",wsj,2020-09-28 08:25:14
Whistleblower in Orthofix Bribery Case Awarded $1.8 Million,wsj,2020-09-28 08:25:14
Keysight Technologies Agrees to Settle Sanctions Case,wsj,2020-09-28 08:25:14
SEC Votes to Amend Whistleblower-Award Rules,wsj,2020-09-28 08:25:14
Europe Invites a Trade Battle in its Fight Against Shipping Pollution,wsj,2020-09-28 08:25:14
E-Commerce Surge Draws Investment to Online Retail Logistics Providers,wsj,2020-09-28 08:25:14
Volkswagen Trucking Business Invests in Self-Driving Truck Developer TuSimple,wsj,2020-09-28 08:25:14
3 Retailers That Have Done Well In a Tough September,wsj,2020-09-28 08:25:14
Global Stocks Rise as M&A News Brings Back Buyers,wsj,2020-09-28 08:25:14
This Preferred From a John Malone-Controlled Company Offers an 8% Yield,wsj,2020-09-28 08:25:14
"Oil edges higher, but fears about coronavirus-fueled hit to demand weigh",wsj,2020-09-28 08:25:14
Hologic shares gain on authorization of COVID-19 test for asymptomatic people,wsj,2020-09-28 08:25:14
Shares in HSBC rise 10% after China’s Ping An raises stake,wsj,2020-09-28 08:25:14
A Guide to the Season’s New Developments,wsj,2020-09-28 08:25:14
A Costa Rican Retreat Within an Amenity-Filled Resort,wsj,2020-09-28 08:25:14
"An Israeli Architect on His Country’s Real Estate Boom, City Life, and Changes Brought on by Covid",wsj,2020-09-28 08:25:14
The Future of Travel in 2020 and Beyond,wsj,2020-09-28 08:25:14
"Driving BMW’s X6 M Competition—Stylish, Fast, and Versatile",wsj,2020-09-28 08:25:14
"Christie’s to Offer Masterpieces by Cy Twombly, Mark Rothko, and Willem de Kooning",wsj,2020-09-28 08:25:14
"During Coronavirus, Every Day Is Take Your Daughter to Work Day",wsj,2020-09-28 08:25:14
Time’s Up CEO Tina Tchen Fights for Workplace Equality. Covid-19 Makes That Job Harder.,wsj,2020-09-28 08:25:14
What Equal Opportunity in the Workplace Means,wsj,2020-09-28 08:25:14
The Importance of Amy Coney Barrett,wsj,2020-09-28 08:25:14
What Kind of Judge Is Amy Coney Barrett?,wsj,2020-09-28 08:25:14
Florida and the Cuban Vote,wsj,2020-09-28 08:25:14
"Who Is Judge Amy Coney Barrett, Trump’s Supreme Court Pick?",wsj,2020-09-28 08:25:14
Protests Continue Into Third Night After Breonna Taylor Decision,wsj,2020-09-28 08:25:14
"In Wisconsin, Suburban Voters Are Divided Over Police, Virus Response",wsj,2020-09-28 08:25:14
iOS 14: 14 Tips for Apple’s New iPhone Operating System,wsj,2020-09-28 08:25:14
Trump Says He Isn't Prepared to Sign Off on TikTok Deal,wsj,2020-09-28 08:25:14
Trump Denies New York Times Report on His Income Taxes,wsj,2020-09-28 08:25:14
"In Wisconsin, Suburban Voters Are Divided Over Police, Virus Response",wsj,2020-09-28 08:25:14
Poll Shows Which Voters Trump and Biden Need to Win Over in Debates,wsj,2020-09-28 08:25:14
"Grocers Stockpile, Build ‘Pandemic Pallets’ Ahead of Winter",wsj,2020-09-28 08:25:14
AirPods Pro Are Even Better a Year Later ,wsj,2020-09-28 08:25:14
Judge Halts Trump Administration TikTok Download Ban,wsj,2020-09-28 08:25:14
What Amy Coney Barrett Could Mean for Future of the Supreme Court,wsj,2020-09-28 08:25:14
Trump Declines to Say How Much He Has Paid in Federal Income Taxes ,wsj,2020-09-28 08:25:14
Brookfield Property's 12% Yield Is Screaming 'Buy Me',seekingalpha,2020-09-28 08:27:07
Retirement Strategy: Not One But Two Gifts For Dividend Investors,seekingalpha,2020-09-28 08:27:07
"The Sell-Off Is Overdone, The Correction May Not Be",seekingalpha,2020-09-28 08:27:07
A Classic Bubble Is Starting To Deflate,seekingalpha,2020-09-28 08:27:07
"Market Is Still Overvalued, But Here Are Some Picks",seekingalpha,2020-09-28 08:27:07
VGT: How The Vanguard IT ETF Compares To The QQQ And IGV,seekingalpha,2020-09-28 08:27:07
PIMCO Gives Investors Another Scare,seekingalpha,2020-09-28 08:27:07
Microsoft: Adding To Its Diversified Growth Empire,seekingalpha,2020-09-28 08:27:07
"Wall Street Breakfast: Global Markets Churn Higher On China Economic Data, M&A Buzz",seekingalpha,2020-09-28 08:27:07
My Thesis That The Nasdaq 100 Would Bounce Was Correct - Here's What May Happen Next,seekingalpha,2020-09-28 08:27:07
Consider Adding This Little-Known DGI Stock To Your Portfolio,seekingalpha,2020-09-28 08:27:07
FDA places partial hold on Inovio's pivotal COVID-19 vaccine study,seekingalpha,2020-09-28 08:27:07
"Global markets churn higher on China economic data, M&A buzz",seekingalpha,2020-09-28 08:27:07
Uber +6% after winning legal battle in London,seekingalpha,2020-09-28 08:27:07
Seeking Alpha Catalyst Watch,seekingalpha,2020-09-28 08:27:07
Piedmont Lithium inks sales agreement with Tesla,seekingalpha,2020-09-28 08:27:07
Nikola One design said to have originated from Rimac designer,seekingalpha,2020-09-28 08:27:07
Virgin Galactic +6% after BofA tips that shares could double,seekingalpha,2020-09-28 08:27:07
"Amazon confirms Oct. 13, 14 Prime Day event; deals start now",seekingalpha,2020-09-28 08:27:07
"Lam Research, KLA shares drop after SMIC's U.S. ban",seekingalpha,2020-09-28 08:27:07
Devon Energy buys WPX Energy in all-stock deal,seekingalpha,2020-09-28 08:27:07
W. P. Carey in a $44M sale-leaseback,seekingalpha,2020-09-28 08:27:07
Workhorse Group +5% to track back from drop after Tesla Battery Day,seekingalpha,2020-09-28 08:27:07
"The Nest Egg Portfolio: Orange Belgium Is Re-Entering The Portfolio, Anticipating A 3.5-4% Dividend Yield",seekingalpha,2020-09-28 08:27:07
Supreme Uncertainty Hits REITs,seekingalpha,2020-09-28 08:27:07
Blue Chip Cullen/Frost Could Make You Bank (Lots Of Money),seekingalpha,2020-09-28 08:27:07
Focus On 2021 And 2022,seekingalpha,2020-09-28 08:27:07
Canadian Gold Juniors' Valuations: Q3 2020,seekingalpha,2020-09-28 08:27:07
BofA shakes out election scenario winners in hospitals/managed care,seekingalpha,2020-09-28 08:27:07
Wells Fargo stays positive on oil/gas names as it looks to 'Shale 3.0',seekingalpha,2020-09-28 08:27:07
JPMorgan revises rideshare estimates downward on slower than expected recovery,seekingalpha,2020-09-28 08:27:07
UBS trend screen offers high-conviction picks to navigate 'cross currents',seekingalpha,2020-09-28 08:27:07
"BofA's shale picks look to 'less bad' second half, recovery into 2022",seekingalpha,2020-09-28 08:27:07
Revisiting Our Thesis On Eaton Vance: We Are Still Bullish,seekingalpha,2020-09-28 08:27:07
Upland Software: A Fast-Growing Cloud Firm For Consideration,seekingalpha,2020-09-28 08:27:07
BioLife Solutions: High Volatility And Growth,seekingalpha,2020-09-28 08:27:07
"Pason Systems: Weaknesses Galore, Balance Sheet Holds It Together",seekingalpha,2020-09-28 08:27:07
A Correction In Commodities- Another Buying Opportunity In The PICK ETF,seekingalpha,2020-09-28 08:27:07
Revisiting Our Thesis On Eaton Vance: We Are Still Bullish,seekingalpha,2020-09-28 08:27:07
BioLife Solutions: High Volatility And Growth,seekingalpha,2020-09-28 08:27:07
Ironwood Is Worth A Look As A Speculative Investment,seekingalpha,2020-09-28 08:27:07
"COVID-19 Creating Near-Term Turbulence For Hillrom, But The Transformation Is Intact",seekingalpha,2020-09-28 08:27:07
Opportunity In Liberty Global After M&A,seekingalpha,2020-09-28 08:27:07
PIMCO Gives Investors Another Scare,seekingalpha,2020-09-28 08:27:07
Brookfield Property's 12% Yield Is Screaming 'Buy Me',seekingalpha,2020-09-28 08:27:07
Xylem's Current Valuation Makes No Sense,seekingalpha,2020-09-28 08:27:07
Magellan Midstream Partners: This 12.2% Yielder Is A Conviction Buy At Its Current Price,seekingalpha,2020-09-28 08:27:07
Canadian All-Star Stocks: Dividend Increases - Week Of Sept. 28,seekingalpha,2020-09-28 08:27:07
A Correction In Commodities- Another Buying Opportunity In The PICK ETF,seekingalpha,2020-09-28 08:27:07
Refinitiv Lipper Chart Of The Week: Tech Sector Funds Fall Out Of Favor,seekingalpha,2020-09-28 08:27:07
Fund Spotlight: DoubleLine Yield Opportunities - This New Fund Looks Attractive,seekingalpha,2020-09-28 08:27:07
PIMCO Gives Investors Another Scare,seekingalpha,2020-09-28 08:27:07
VGT: How The Vanguard IT ETF Compares To The QQQ And IGV,seekingalpha,2020-09-28 08:27:07
EUR/CAD Could Hit 1.60 Even With Greater Oil Market Stability,seekingalpha,2020-09-28 08:27:07
Australian Gold Juniors: Grade Is King,seekingalpha,2020-09-28 08:27:07
A Classic Bubble Is Starting To Deflate,seekingalpha,2020-09-28 08:27:07
Weekly S&P 500 ChartStorm - The Balance Is Shifting,seekingalpha,2020-09-28 08:27:07
Australian Gold Juniors' Valuations: Q3 2020,seekingalpha,2020-09-28 08:27:07
A risky strategy,cnnbusiness,2020-09-28 08:29:26
Trump is stealing China's playbook to deal with TikTok,cnnbusiness,2020-09-28 08:29:26
"Judge rules TikTok can avoid a ban in the US, for now",cnnbusiness,2020-09-28 08:29:26
NYT: Trump paid no income taxes in 10 out of 15 years beginning in 2000,cnnbusiness,2020-09-28 08:29:26
The New York Times' coverage of Trump's taxes is an emperor-has-no-clothes moment,cnnbusiness,2020-09-28 08:29:26
Trump says the economy is booming. He's right — but you don't feel it,cnnbusiness,2020-09-28 08:29:26
Chris Wallace won't fact check Trump and Biden during the debate,cnnbusiness,2020-09-28 08:29:26
This week will determine whether the IPO market is for real,cnnbusiness,2020-09-28 08:29:26
Caesars could buy William Hill for $3.7 billion as sports betting booms,cnnbusiness,2020-09-28 08:29:26
Shares in China's biggest chipmaker fall after reports that it could lose access to US technology  ,cnnbusiness,2020-09-28 08:29:26
Amazon Prime Day set for October 13 and 14,cnnbusiness,2020-09-28 08:29:26
"Uber can continue operating in London, judge says",cnnbusiness,2020-09-28 08:29:26
"Cockroaches, porn and a bloody pig mask: How eBay harassed bloggers",cnnbusiness,2020-09-28 08:29:26
Elon Musk criticizes OpenAI exclusively licensing GPT-3 to Microsoft,cnnbusiness,2020-09-28 08:29:26
Refi rates at 2.40% APR (15 yr). Do you qualify?,cnnbusiness,2020-09-28 08:29:26
"Worried about more shortages, grocery stores are stockpiling goods",cnnbusiness,2020-09-28 08:29:26
Remote work could spell doom for your favorite dry cleaner and lunch spot,cnnbusiness,2020-09-28 08:29:26
Big Hit IPO makes BTS millionaires and their producer a billionaire ,cnnbusiness,2020-09-28 08:29:26
Deaths of Breonna Taylor and George Floyd change the body cam industry,cnnbusiness,2020-09-28 08:29:26
Tech firms are still helping police scan your face,cnnbusiness,2020-09-28 08:29:26
"Dollar General is vulnerable to crime, police say",cnnbusiness,2020-09-28 08:29:26
Ford pressured to stop selling police cars,cnnbusiness,2020-09-28 08:29:26
Uber self-driving car operator charged in pedestrian death,cnnbusiness,2020-09-28 08:29:26
Amazon says the $500 Peloton knock-off isn't from Amazon after all ,cnnbusiness,2020-09-28 08:29:26
Apple takes on Peloton with Fitness+ service,cnnbusiness,2020-09-28 08:29:26
Peloton cuts the price of its most popular bike,cnnbusiness,2020-09-28 08:29:26
Sales of Peloton surge 172% ,cnnbusiness,2020-09-28 08:29:26
Peloton president: Nothing beats the convenience of home,cnnbusiness,2020-09-28 08:29:26
This is Volkswagen's first electric SUV,cnnbusiness,2020-09-28 08:29:26
Electric road will power public buses in Tel Aviv,cnnbusiness,2020-09-28 08:29:26
Uber Eats' new ad pits Luke Skywalker against Capt. Picard,cnnbusiness,2020-09-28 08:29:26
See the Marvel 'WandaVision' series trailer,cnnbusiness,2020-09-28 08:29:26
See robot stacking shelves in Japan,cnnbusiness,2020-09-28 08:29:26
So you want to lower your rent? Here's how to negotiate,cnnbusiness,2020-09-28 08:29:26
So you're working remotely and want to move? Read this first,cnnbusiness,2020-09-28 08:29:26
"Volkswagen unveils the ID.4, its new all-electric SUV",cnnbusiness,2020-09-28 08:29:26
Are you rockin' the WFH mullet?,cnnbusiness,2020-09-28 08:29:26
"Among Us, a murder mystery set in space, is the latest multimillion dollar craze in video games",cnnbusiness,2020-09-28 08:29:26
How Jack Ma built China's money supermarket into a $200 billion company,cnnbusiness,2020-09-28 08:29:26
Why Amazon's new Alexa conversation feature is so hard to pull off,cnnbusiness,2020-09-28 08:29:26
Google will temporarily stop running election ads after Election Day,cnnbusiness,2020-09-28 08:29:26
Stelter: Trump will call this 'fake news.' Here's the truth,cnnbusiness,2020-09-28 08:29:26
Debates commission co-chair: We don't expect moderators to be fact-checkers,cnnbusiness,2020-09-28 08:29:26
"The biggest movies that have been delayed, and when you can expect to see them now",cnnbusiness,2020-09-28 08:29:26
Chris Rock will host the season premiere of 'Saturday Night Live',cnnbusiness,2020-09-28 08:29:26
How NASA's Apollo program kicked off Silicon Valley's tech revolution,cnnbusiness,2020-09-28 08:29:26
Jeff Bezos just sold $1.8 billion worth of Amazon stock. Here's why,cnnbusiness,2020-09-28 08:29:26
Bill Nye's experimental spacecraft that sails on sunlight declares mission success ,cnnbusiness,2020-09-28 08:29:26
SpaceX's massive Starship prototype lifts off ,cnnbusiness,2020-09-28 08:29:26
South Africa has the world's worst youth unemployment. This job-matching site wants to change that,cnnbusiness,2020-09-28 08:29:26
How smart tech could help save the world's honey bees,cnnbusiness,2020-09-28 08:29:26
Seven-foot robots are stacking shelves in Tokyo convenience stores,cnnbusiness,2020-09-28 08:29:26
Unilever will stop using oil and gas to make cleaning products by 2030,cnnbusiness,2020-09-28 08:29:26
Nissan gives us an early glimpse of its first new Z sports car in over a decade,cnnbusiness,2020-09-28 08:29:26
Seven-foot robots are stacking shelves in Tokyo convenience stores,cnnbusiness,2020-09-28 08:29:26
Pepsi is launching a drink to help you relax,cnnbusiness,2020-09-28 08:29:26
Amazon's stock is getting beat by a warehouse chain. And it's not Costco,cnnbusiness,2020-09-28 08:29:26
