headline,org,date
Taco Bell's mea culpa to vegetarians: Potatoes are back and it will test Beyond Meat menu item,msnmoney,2021-01-14 08:19:39
20 Most-Overlooked Tax Breaks and Deductions,msnmoney,2021-01-14 08:19:39
"Why January 20th Could Set off ""Second Wave"" for Stocks",msnmoney,2021-01-14 08:19:39
The 3 Smartest Places to Stash Your Money Now,msnmoney,2021-01-14 08:19:39
Places where the rich hide money from the IRS,msnmoney,2021-01-14 08:19:39
2.18% FIXED Mortgage Refinance - No Hidden Fees or Points,msnmoney,2021-01-14 08:19:39
Goldman Sachs says the S&P 500 will rise 14% in 2021. Here’s the road map,msnmoney,2021-01-14 08:19:39
10 Fast-Growing Careers for Remote Jobs in 2021,msnmoney,2021-01-14 08:19:39
New Survey Finds that COVID-19 has Changed How We Think About Money,msnmoney,2021-01-14 08:19:39
HelloFresh New Year Sale: Get 12 Meals Free Including Free First Box Shipping,msnmoney,2021-01-14 08:19:39
Things every retiree should toss in 2021,msnmoney,2021-01-14 08:19:39
"Before you renew Amazon Prime, read this",msnmoney,2021-01-14 08:19:39
Dow futures tick higher ahead of Biden stimulus plans,msnmoney,2021-01-14 08:19:39
The Best Place To Work in Your State,msnmoney,2021-01-14 08:19:39
Targeted Stimulus Checks Are an Easier Sell to Lawmakers. Here's How They Could Work,msnmoney,2021-01-14 08:19:39
23 Ridiculous Tax Loopholes,msnmoney,2021-01-14 08:19:39
"Trump Impeachment, Biden's $2 Trillion Plan, Alibaba, Delta - 5 Things You Must Know Thursday",msnmoney,2021-01-14 08:19:39
These $19k SUVs Will Make You Trade in Your Car,msnmoney,2021-01-14 08:19:39
How To Upgrade Your At-Home Work Space for 2021,msnmoney,2021-01-14 08:19:39
Taking a Multivitamin? Here’s Why You Should Reconsider,msnmoney,2021-01-14 08:19:39
The worst things no one tells you about retirement,msnmoney,2021-01-14 08:19:39
"Delta halves cash burn in the fourth quarter, narrows losses to cap worst year ever",msnmoney,2021-01-14 08:19:39
T-Mobile and Sprint — and 5 Other Surprising Company Mergers During COVID-19,msnmoney,2021-01-14 08:19:39
All Senior Drivers Should Claim This Large Reward This January (Check If You Qualify) ,msnmoney,2021-01-14 08:19:39
Best countries to retire to in 2021,msnmoney,2021-01-14 08:19:39
Will Delivery Services Stay Popular Through 2021?,msnmoney,2021-01-14 08:19:39
"More than 2,700 people banned by U.S. airlines",msnmoney,2021-01-14 08:19:39
How a Democrat-controlled Senate could affect seniors,msnmoney,2021-01-14 08:19:39
The pros and cons of buying a waterfront home,msnmoney,2021-01-14 08:19:39
16 Highly Unnecessary Things People Waste Money On (You’re Guilty Of Many),msnmoney,2021-01-14 08:19:39
Looking To Change Careers Due to COVID-19? You’re Not Alone,msnmoney,2021-01-14 08:19:39
UBS Fund Pursues $400 Million Stake in SoftBank-Backed Paytm,msnmoney,2021-01-14 08:19:39
These Red Flags on Your 2020 Tax Return Could Spark Interest From the IRS,msnmoney,2021-01-14 08:19:39
Losing sleep over money? Here are 14 ways to get some rest,msnmoney,2021-01-14 08:19:39
23 Celebrities Convicted of Tax Evasion,msnmoney,2021-01-14 08:19:39
How This Grandma Had Attacker Running Scared Without Using Force,msnmoney,2021-01-14 08:19:39
‘Reckoning’ ahead? Why investors continue to ignore ’emerging market’–style U.S. politics,msnmoney,2021-01-14 08:19:39
The NBA and 27 Major Companies Donating To Fight Inequality,msnmoney,2021-01-14 08:19:39
A custodial account is a financial account that parents manage in their child's name - a tool to transfer and build wealth that can invest in almost any asset,msnmoney,2021-01-14 08:19:39
All the New Numbers You Need To Know for Planning Ahead on Taxes,msnmoney,2021-01-14 08:19:39
Renault CEO Lays Out Plan to Slowly Improve Profitability,msnmoney,2021-01-14 08:19:39
Rarely Seen Photos Capture A Darker Side To Nature,msnmoney,2021-01-14 08:19:39
Here’s How Much Your State Collects on Every Type of Tax,msnmoney,2021-01-14 08:19:39
ByteDance’s Chief Rival Wins HKEX Nod for $5 Billion IPO,msnmoney,2021-01-14 08:19:39
Mega Millions Jackpot Reaches $750 Million – See 23 Lottery Winners Who Lost It All,msnmoney,2021-01-14 08:19:39
Xi Jinping wants Starbucks and Howard Schultz to help repair US-China ties,msnmoney,2021-01-14 08:19:39
Retirement accounts you need to build your nest egg,msnmoney,2021-01-14 08:19:39
Turns out your hand can tell you a lot about your personality,msnmoney,2021-01-14 08:19:39
37 of the most recession-proof jobs,msnmoney,2021-01-14 08:19:39
"The Best-Paying, Fastest-Growing Jobs in Each State",msnmoney,2021-01-14 08:19:39
TSMC Plans Spending Blitz of Up to $28 Billion as Intel Founders,msnmoney,2021-01-14 08:19:39
10 Brilliant Ways To Reduce Your Taxes in Retirement,msnmoney,2021-01-14 08:19:39
1 in 5 Americans is planning a risky financial move. Do this instead,msnmoney,2021-01-14 08:19:39
How to buy Apple devices without paying Apple prices,msnmoney,2021-01-14 08:19:39
How Long $500K Will Last in Retirement in Each State,msnmoney,2021-01-14 08:19:39
Warren Buffett's Berkshire Hathaway scores $1.5 billion gain on GM stock in under 4 months,msnmoney,2021-01-14 08:19:39
Why You Shouldn’t Do Your Own Taxes Anymore,msnmoney,2021-01-14 08:19:39
Carmakers Crying Out for Chips Fuels Growth for Globalfoundries,msnmoney,2021-01-14 08:19:39
15 things that will cost more in 2021,msnmoney,2021-01-14 08:19:39
Leasing a car: How to do it and mistakes to avoid,msnmoney,2021-01-14 08:19:39
Virginia Launches New Policy For Cars Used Less Than 50 Miles/Day,msnmoney,2021-01-14 08:19:39
How the Pandemic Has Changed Banking – Maybe Forever,msnmoney,2021-01-14 08:19:39
The Startup With Thousands of Electric Vehicles and Hundreds of Collisions,msnmoney,2021-01-14 08:19:39
15 of the Best Money Moves You Can Make in 2021,msnmoney,2021-01-14 08:19:39
How DIY Projects Are Helping People Through the Pandemic,msnmoney,2021-01-14 08:19:39
6 Things Worth Investing In To Help You Keep Your Resolutions,msnmoney,2021-01-14 08:19:39
"US bans Xinjiang cotton products, tomatoes over forced labour",msnmoney,2021-01-14 08:19:39
53 Over Hyped Actors That Simply Vanished,msnmoney,2021-01-14 08:19:39
"Zune, Fire Phone and More of the Biggest Product Flops From 20 Major Companies",msnmoney,2021-01-14 08:19:39
Should You Have a Water Alarm In Your Home?,msnmoney,2021-01-14 08:19:39
Best Checking Accounts in 2021,msnmoney,2021-01-14 08:19:39
Uniqlo Owner’s Stock Hits Record as Shoppers Go Casual in Pandemic,msnmoney,2021-01-14 08:19:39
The 15 Best-Paying Cities for Millennials,msnmoney,2021-01-14 08:19:39
UBS Analysts Say Evergrande May Tumble in Dramatic Sell Call,msnmoney,2021-01-14 08:19:39
Hidden Features In Cars: No.19 Is In Every Car & No One Knows,msnmoney,2021-01-14 08:19:39
State Economies Hit Hardest by COVID-19,msnmoney,2021-01-14 08:19:39
Real moms share their money-saving tips,msnmoney,2021-01-14 08:19:39
Best National Banks for Your Money,msnmoney,2021-01-14 08:19:39
Delivery Hero Turkey Workers Seek Precedent-Setting Unionization,msnmoney,2021-01-14 08:19:39
Most Affordable Colleges With Best Outcomes In Every State,msnmoney,2021-01-14 08:19:39
Generali CEO Planning to Shake Up Top Management in Revamp,msnmoney,2021-01-14 08:19:39
Taco Bell's mea culpa to vegetarians: Potatoes are back and it will test Beyond Meat menu item,msnmoney,2021-01-14 08:19:39
20 Most-Overlooked Tax Breaks and Deductions,msnmoney,2021-01-14 08:19:39
"Why January 20th Could Set off ""Second Wave"" for Stocks",msnmoney,2021-01-14 08:19:39
The 3 Smartest Places to Stash Your Money Now,msnmoney,2021-01-14 08:19:39
Places where the rich hide money from the IRS,msnmoney,2021-01-14 08:19:39
2.18% FIXED Mortgage Refinance - No Hidden Fees or Points,msnmoney,2021-01-14 08:19:39
Goldman Sachs says the S&P 500 will rise 14% in 2021. Here’s the road map,msnmoney,2021-01-14 08:19:39
10 Fast-Growing Careers for Remote Jobs in 2021,msnmoney,2021-01-14 08:19:39
New Survey Finds that COVID-19 has Changed How We Think About Money,msnmoney,2021-01-14 08:19:39
HelloFresh New Year Sale: Get 12 Meals Free Including Free First Box Shipping,msnmoney,2021-01-14 08:19:39
Things every retiree should toss in 2021,msnmoney,2021-01-14 08:19:39
"Before you renew Amazon Prime, read this",msnmoney,2021-01-14 08:19:39
Dow futures tick higher ahead of Biden stimulus plans,msnmoney,2021-01-14 08:19:39
The Best Place To Work in Your State,msnmoney,2021-01-14 08:19:39
Targeted Stimulus Checks Are an Easier Sell to Lawmakers. Here's How They Could Work,msnmoney,2021-01-14 08:19:39
23 Ridiculous Tax Loopholes,msnmoney,2021-01-14 08:19:39
"Trump Impeachment, Biden's $2 Trillion Plan, Alibaba, Delta - 5 Things You Must Know Thursday",msnmoney,2021-01-14 08:19:39
These $19k SUVs Will Make You Trade in Your Car,msnmoney,2021-01-14 08:19:39
How To Upgrade Your At-Home Work Space for 2021,msnmoney,2021-01-14 08:19:39
Taking a Multivitamin? Here’s Why You Should Reconsider,msnmoney,2021-01-14 08:19:39
The worst things no one tells you about retirement,msnmoney,2021-01-14 08:19:39
"Delta halves cash burn in the fourth quarter, narrows losses to cap worst year ever",msnmoney,2021-01-14 08:19:39
T-Mobile and Sprint — and 5 Other Surprising Company Mergers During COVID-19,msnmoney,2021-01-14 08:19:39
All Senior Drivers Should Claim This Large Reward This January (Check If You Qualify) ,msnmoney,2021-01-14 08:19:39
Best countries to retire to in 2021,msnmoney,2021-01-14 08:19:39
Will Delivery Services Stay Popular Through 2021?,msnmoney,2021-01-14 08:19:39
"More than 2,700 people banned by U.S. airlines",msnmoney,2021-01-14 08:19:39
How a Democrat-controlled Senate could affect seniors,msnmoney,2021-01-14 08:19:39
The pros and cons of buying a waterfront home,msnmoney,2021-01-14 08:19:39
16 Highly Unnecessary Things People Waste Money On (You’re Guilty Of Many),msnmoney,2021-01-14 08:19:39
Looking To Change Careers Due to COVID-19? You’re Not Alone,msnmoney,2021-01-14 08:19:39
UBS Fund Pursues $400 Million Stake in SoftBank-Backed Paytm,msnmoney,2021-01-14 08:19:39
These Red Flags on Your 2020 Tax Return Could Spark Interest From the IRS,msnmoney,2021-01-14 08:19:39
Losing sleep over money? Here are 14 ways to get some rest,msnmoney,2021-01-14 08:19:39
23 Celebrities Convicted of Tax Evasion,msnmoney,2021-01-14 08:19:39
How This Grandma Had Attacker Running Scared Without Using Force,msnmoney,2021-01-14 08:19:39
‘Reckoning’ ahead? Why investors continue to ignore ’emerging market’–style U.S. politics,msnmoney,2021-01-14 08:19:39
The NBA and 27 Major Companies Donating To Fight Inequality,msnmoney,2021-01-14 08:19:39
A custodial account is a financial account that parents manage in their child's name - a tool to transfer and build wealth that can invest in almost any asset,msnmoney,2021-01-14 08:19:39
All the New Numbers You Need To Know for Planning Ahead on Taxes,msnmoney,2021-01-14 08:19:39
Renault CEO Lays Out Plan to Slowly Improve Profitability,msnmoney,2021-01-14 08:19:39
Rarely Seen Photos Capture A Darker Side To Nature,msnmoney,2021-01-14 08:19:39
Here’s How Much Your State Collects on Every Type of Tax,msnmoney,2021-01-14 08:19:39
ByteDance’s Chief Rival Wins HKEX Nod for $5 Billion IPO,msnmoney,2021-01-14 08:19:39
Mega Millions Jackpot Reaches $750 Million – See 23 Lottery Winners Who Lost It All,msnmoney,2021-01-14 08:19:39
Xi Jinping wants Starbucks and Howard Schultz to help repair US-China ties,msnmoney,2021-01-14 08:19:39
Retirement accounts you need to build your nest egg,msnmoney,2021-01-14 08:19:39
Turns out your hand can tell you a lot about your personality,msnmoney,2021-01-14 08:19:39
37 of the most recession-proof jobs,msnmoney,2021-01-14 08:19:39
"The Best-Paying, Fastest-Growing Jobs in Each State",msnmoney,2021-01-14 08:19:39
TSMC Plans Spending Blitz of Up to $28 Billion as Intel Founders,msnmoney,2021-01-14 08:19:39
10 Brilliant Ways To Reduce Your Taxes in Retirement,msnmoney,2021-01-14 08:19:39
1 in 5 Americans is planning a risky financial move. Do this instead,msnmoney,2021-01-14 08:19:39
How to buy Apple devices without paying Apple prices,msnmoney,2021-01-14 08:19:39
How Long $500K Will Last in Retirement in Each State,msnmoney,2021-01-14 08:19:39
Warren Buffett's Berkshire Hathaway scores $1.5 billion gain on GM stock in under 4 months,msnmoney,2021-01-14 08:19:39
Why You Shouldn’t Do Your Own Taxes Anymore,msnmoney,2021-01-14 08:19:39
Carmakers Crying Out for Chips Fuels Growth for Globalfoundries,msnmoney,2021-01-14 08:19:39
15 things that will cost more in 2021,msnmoney,2021-01-14 08:19:39
Leasing a car: How to do it and mistakes to avoid,msnmoney,2021-01-14 08:19:39
Virginia Launches New Policy For Cars Used Less Than 50 Miles/Day,msnmoney,2021-01-14 08:19:39
How the Pandemic Has Changed Banking – Maybe Forever,msnmoney,2021-01-14 08:19:39
The Startup With Thousands of Electric Vehicles and Hundreds of Collisions,msnmoney,2021-01-14 08:19:39
15 of the Best Money Moves You Can Make in 2021,msnmoney,2021-01-14 08:19:39
How DIY Projects Are Helping People Through the Pandemic,msnmoney,2021-01-14 08:19:39
6 Things Worth Investing In To Help You Keep Your Resolutions,msnmoney,2021-01-14 08:19:39
"US bans Xinjiang cotton products, tomatoes over forced labour",msnmoney,2021-01-14 08:19:39
53 Over Hyped Actors That Simply Vanished,msnmoney,2021-01-14 08:19:39
"Zune, Fire Phone and More of the Biggest Product Flops From 20 Major Companies",msnmoney,2021-01-14 08:19:39
Should You Have a Water Alarm In Your Home?,msnmoney,2021-01-14 08:19:39
Best Checking Accounts in 2021,msnmoney,2021-01-14 08:19:39
Uniqlo Owner’s Stock Hits Record as Shoppers Go Casual in Pandemic,msnmoney,2021-01-14 08:19:39
The 15 Best-Paying Cities for Millennials,msnmoney,2021-01-14 08:19:39
UBS Analysts Say Evergrande May Tumble in Dramatic Sell Call,msnmoney,2021-01-14 08:19:39
Hidden Features In Cars: No.19 Is In Every Car & No One Knows,msnmoney,2021-01-14 08:19:39
State Economies Hit Hardest by COVID-19,msnmoney,2021-01-14 08:19:39
Real moms share their money-saving tips,msnmoney,2021-01-14 08:19:39
Best National Banks for Your Money,msnmoney,2021-01-14 08:19:39
Delivery Hero Turkey Workers Seek Precedent-Setting Unionization,msnmoney,2021-01-14 08:19:39
Most Affordable Colleges With Best Outcomes In Every State,msnmoney,2021-01-14 08:19:39
Generali CEO Planning to Shake Up Top Management in Revamp,msnmoney,2021-01-14 08:19:39
The housing market tells the whole story,yahoofinance,2021-01-14 08:21:39
Stock futures point to a mixed open,yahoofinance,2021-01-14 08:21:39
Pace of new jobless claims filed likely same as prior week,yahoofinance,2021-01-14 08:21:39
"Delta posts steep quarterly, annual earnings loss",yahoofinance,2021-01-14 08:21:39
Influencers with Andy Serwer: Haim Saban,yahoofinance,2021-01-14 08:21:39
New Coronavirus Strains Found in the U.S.,yahoofinance,2021-01-14 08:21:39
Bank earnings to outline optimism for recovery in 2021,yahoofinance,2021-01-14 08:21:39
"Rubio asks Biden for $2,000 stimulus checks on day 1",yahoofinance,2021-01-14 08:21:39
"2.18% FIXED Mortgage Refi, No Hidden Fees/Points",yahoofinance,2021-01-14 08:21:39
Biden's Boom: The $30 Trillion ESG Sector Is Set To Explode In 2021,yahoofinance,2021-01-14 08:21:39
"8 Top Stocks Will Soar Again In 2021, Analysts Say",yahoofinance,2021-01-14 08:21:39
"Trump Impeachment, Biden's $2 Trillion Plan, Alibaba, Delta - 5 Things You Must Know Thursday",yahoofinance,2021-01-14 08:21:39
I took care of my late mother for 8 years. Am I obliged to tell my sisters she made me co-owner of a substantial bank account?,yahoofinance,2021-01-14 08:21:39
Plug Power stock set to snap long win streak after J.P. Morgan says it is 'fully valued',yahoofinance,2021-01-14 08:21:39
Canopy Growth says it has an option to acquire more than 10% of TerrAscend,yahoofinance,2021-01-14 08:21:39
Taiwan Semiconductor Posts Mixed Q4 Results But Its Outlook Tops Views,yahoofinance,2021-01-14 08:21:39
J.P. Morgan Predicts 30%-Plus Rally for These 2 Stocks,yahoofinance,2021-01-14 08:21:39
Households are plundering 401(k)s to survive the COVID-19 crisis,yahoofinance,2021-01-14 08:21:39
Alibaba Launches Electric Sedan In Partnership With China's Largest Automaker: What You Need To Know,yahoofinance,2021-01-14 08:21:39
Why Cramer Sees Intel Shakeup As A Buy Opportunity In Rival Chipmaker,yahoofinance,2021-01-14 08:21:39
"Aphria's stock surges after reporting surprise profit, revenue that rose above expectations",yahoofinance,2021-01-14 08:21:39
Virgin Galactic Soars After ARK Investment Files for Space ETF,yahoofinance,2021-01-14 08:21:39
Tesla Leads 10 Top-Selling EVs In China But New Rival Surprises,yahoofinance,2021-01-14 08:21:39
The Most Important Oil Find Of The Next Decade Could Be Here,yahoofinance,2021-01-14 08:21:39
Chesapeake Energy to emerge from bankruptcy court as a $5.13 billion enterprise,yahoofinance,2021-01-14 08:21:39
"Why Plug Power's Lead In Fuel Cell, Hydrogen Space Could Create 'Outsized Winner'",yahoofinance,2021-01-14 08:21:39
"These 2 Penny Stocks Could Surge Over 300%, Say Analysts",yahoofinance,2021-01-14 08:21:39
"Delta posts steep Q4, annual loss",yahoofinance,2021-01-14 08:21:39
The housing market tells the whole story: Morning Brief,yahoofinance,2021-01-14 08:21:39
Mark Cuban Says He's Been Holding Crypto For Years Without Selling Anything,yahoofinance,2021-01-14 08:21:39
Virgin Galactic jumps after ARK files to launch space exploration ETF,yahoofinance,2021-01-14 08:21:39
"U.S. Decides Against Investing Ban on Alibaba, Tencent and Baidu",yahoofinance,2021-01-14 08:21:39
"Is GE Stock A Buy In 2021 Amid Stimulus, Infrastructure Hopes?",yahoofinance,2021-01-14 08:21:39
Wells Fargo CEO to unveil cost-cutting plan,yahoofinance,2021-01-14 08:21:39
10 of the Best Cheap Stocks to Buy Under $10,yahoofinance,2021-01-14 08:21:39
Dow Jones Rallies As McConnell Blocks Early Trump Impeachment; Airbnb Hits Buy Zone,yahoofinance,2021-01-14 08:21:39
TSMC Plans Spending Blitz of Up to $28 Billion as Intel Founders,yahoofinance,2021-01-14 08:21:39
"Elon Musk tweet sent this penny stock soaring, but company insiders didn't sell shares",yahoofinance,2021-01-14 08:21:39
GameStop Stock Soars as Short Sellers Take a Hit,yahoofinance,2021-01-14 08:21:39
"Dow Jones Futures: Biden Stimulus Plan Due; Taiwan Semi Earnings Mixed; Apple, Airbnb, DoorDash Flash Buy Signals",yahoofinance,2021-01-14 08:21:39
Petco Stock Prices Above Views In Third IPO With New Rival On The Way,yahoofinance,2021-01-14 08:21:39
"Chesapeake Approved to Exit Bankruptcy, Cut $7 Billion in Debt",yahoofinance,2021-01-14 08:21:39
"Bitcoin bull who sees price hitting $500,000 is bullish on Biden's expected SEC pick",yahoofinance,2021-01-14 08:21:39
Express stock soars after reaching agreement on $140 million in additional financing,yahoofinance,2021-01-14 08:21:39
Bank earnings to outline optimism for economic recovery in 2021,yahoofinance,2021-01-14 08:21:39
3 Utilities Stocks Ready to Power Ahead,yahoofinance,2021-01-14 08:21:39
Is fuboTV Stock a Buy Right Now? This Is What You Need to Know,yahoofinance,2021-01-14 08:21:39
"GameStop stock soars more than 60% in apparent short squeeze, but analyst points to another reason",yahoofinance,2021-01-14 08:21:39
"Cramer Shares His Thoughts On Kodak, Apple And More",yahoofinance,2021-01-14 08:21:39
Can Intel’s ‘boy wonder’ pull a Steve Jobs?,yahoofinance,2021-01-14 08:21:39
Palantir downgraded to sell by Citi,yahoofinance,2021-01-14 08:21:39
Plug Power: Cementing Its Place as a Major Hydrogen Economy Player,yahoofinance,2021-01-14 08:21:39
Bitcoin in Race for Adoption Before Central Banks Launch Digital Currencies: Australia’s Macquarie,yahoofinance,2021-01-14 08:21:39
Replay Available: Churchill Capital CEO Klein at Fireside Chat with IPO Edge for ICR Conference,yahoofinance,2021-01-14 08:21:39
Rules That Warren Buffett Lives By,yahoofinance,2021-01-14 08:21:39
Signet expects fourth-quarter sales to beat consensus estimates,yahoofinance,2021-01-14 08:21:39
Norwegian Cruise Lines Fights to Survive,yahoofinance,2021-01-14 08:21:39
Affirm CFO: We won't deal with retailers not 'aligned to our values',yahoofinance,2021-01-14 08:21:39
"Many desperate Americans are planning risky financial moves, survey finds",yahoofinance,2021-01-14 08:21:39
An Overview of Businesses Owned by Amazon,yahoofinance,2021-01-14 08:21:39
"'Buy Now, Pay Later' Wave Could Boost PayPal Stock, Disrupt Credit Firms",yahoofinance,2021-01-14 08:21:39
"TSMC Boosts Q1 Revenue Forecast, Apple Supplier Sees Surging Global Chip Demand",yahoofinance,2021-01-14 08:21:39
Gold Takes Step Back As Fed Fears Offset Stimulus Hopes,yahoofinance,2021-01-14 08:21:39
Gold on back foot ahead of Biden's U.S. stimulus plan,yahoofinance,2021-01-14 08:21:39
"Crypto Market Update: Bitcoin Posts Massive Recovery, XRP Faces Grayscale Setback",yahoofinance,2021-01-14 08:21:39
NIO Stock: Short-Term or Long-Term Put Option Sales?,yahoofinance,2021-01-14 08:21:39
Why I'm Souring on Lemonade,yahoofinance,2021-01-14 08:21:39
"Bitcoin Won't Replace Gold, Will Become Less Dominant In Crypto: Peltz International",yahoofinance,2021-01-14 08:21:39
Is Apple Stock A Buy Right Now? Here's What IBD Charts Show,yahoofinance,2021-01-14 08:21:39
DraftKings (DKNG) Could Hit New Highs,yahoofinance,2021-01-14 08:21:39
6 Best Utility Stocks to Buy,yahoofinance,2021-01-14 08:21:39
More of Trump’s Banks Cut Ties as Backlash Grows Over Violence,yahoofinance,2021-01-14 08:21:39
Cannabis Companies Entered 2021 With A Bang,yahoofinance,2021-01-14 08:21:39
Run-up in U.S. Treasury yields a ‘savior’ for income-starved investors,yahoofinance,2021-01-14 08:21:39
"BlackRock stock heads toward another record after profit, revenue rise above expectations",yahoofinance,2021-01-14 08:21:39
Estate Planning: 16 Things to Do Before You Die,yahoofinance,2021-01-14 08:21:39
How to Trade Delta Air Lines After Earnings Report,yahoofinance,2021-01-14 08:21:39
Here's What it Took to Help My Millennial Colleague Plan Her Million-Dollar Nest Egg,yahoofinance,2021-01-14 08:21:39
AST CEO Avellan Wants to Go Where No Broadband Has Been Before,yahoofinance,2021-01-14 08:21:39
7 Undervalued Tech Stocks With 'Buy' Ratings,yahoofinance,2021-01-14 08:21:39
"Affirm IPO Stock Soars As Trading Begins, Raising $1.2 Billion",yahoofinance,2021-01-14 08:21:39
This Analyst Finds ‘Everything’ He Ever Wanted in NIO Stock,yahoofinance,2021-01-14 08:21:39
Penny stock Zomedica jumps 250% after someone paid Netflix star Carole Baskin $299 for a mention,yahoofinance,2021-01-14 08:21:39
Zoom Raised $1.75B in Offering. Morgan Stanley Says Wall Street Is Too Bearish.,yahoofinance,2021-01-14 08:21:39
Two-year-old NUVIA sells to Qualcomm for $1.4 billion,yahoofinance,2021-01-14 08:21:39
"Yes, You Can Build A $1 Million IRA With Realistic Savings",yahoofinance,2021-01-14 08:21:39
2 SPAC Stocks to Consider as the Trend Heats Up,yahoofinance,2021-01-14 08:21:39
Analyzing Nikola's Unusual Options Activity,yahoofinance,2021-01-14 08:21:39
"The Daily Biotech Pulse: Bausch Health Issues Positive Pre-Announcement, Acorda Streamlines Operations",yahoofinance,2021-01-14 08:21:39
Will Micron Stock Reach $200 By 2022?,yahoofinance,2021-01-14 08:21:39
Nokia signs up Google for building cloud-based 5G network,yahoofinance,2021-01-14 08:21:39
Stock market news live updates: Stock futures point to a mixed open,yahoofinance,2021-01-14 08:21:39
Exxon Mobil Upgraded as J.P. Morgan Says Estimates Too Low,yahoofinance,2021-01-14 08:21:39
"Here's How Much Investing $1,000 In Wells Fargo Stock 5 Years Ago Would Be Worth Today",yahoofinance,2021-01-14 08:21:39
Occidental Petroleum Stock Enters Richer Territory With 81 RS Rating,yahoofinance,2021-01-14 08:21:39
ROCE Insights For AcelRx Pharmaceuticals,yahoofinance,2021-01-14 08:21:39
Mortgage rates to home prices: 8 housing predictions for 2021,yahoofinance,2021-01-14 08:21:39
"Dow Futures Climb on Reports Of $2 Trillion Biden Stimulus, China Trade Data; Weekly Jobless Claims in Focus",yahoofinance,2021-01-14 08:21:39
PayPal becomes first foreign firm in China with full ownership of payments business,yahoofinance,2021-01-14 08:21:39
Why Alibaba's Stock Is Trading Higher Today,yahoofinance,2021-01-14 08:21:39
5 Stocks to Play the Next Surge in Natural Gas,yahoofinance,2021-01-14 08:21:39
OPEC leaves 2021 forecast for oil-demand growth unchanged,yahoofinance,2021-01-14 08:21:39
5 Best Semiconductor Stocks to Buy for 2021,yahoofinance,2021-01-14 08:21:39
"If you don't own Amazon stock, 'you're actually short': veteran trader",yahoofinance,2021-01-14 08:21:39
10 Biggest Telecommunications Companies,yahoofinance,2021-01-14 08:21:39
Newmont board approves share buyback program for up to $1 billion,yahoofinance,2021-01-14 08:21:39
Exclusive: Indian automaker Mahindra cuts over half of North America workforce - sources,yahoofinance,2021-01-14 08:21:39
"Delta Air Lines Posts Q4 Loss of $2.1 Billion, Sees 2021 Recovery",yahoofinance,2021-01-14 08:21:39
"Boosted By Barstool, Penn National's Stock Passes MGM, $100 Share Price: So What's Next?",yahoofinance,2021-01-14 08:21:39
Trump Impeachment Sets Up Another Trial in the Senate,wsj,2021-01-14 08:24:20
Trial would occur after President-elect Joe Biden takes office on Jan. 20,wsj,2021-01-14 08:24:20
Trump Impeachment Deepens GOP Divide,wsj,2021-01-14 08:24:20
"The Scene at the Capitol: Raw Nerves, Sharp Words, Troops on Guard",wsj,2021-01-14 08:24:20
Facebook Turned on Trump After Internal Warning Signs Surged,wsj,2021-01-14 08:24:20
Jobless Claims Likely Rose as Virus Drives Layoffs,wsj,2021-01-14 08:24:20
Bank Earnings Expected to Show a Messy Quarter,wsj,2021-01-14 08:24:20
Stock Futures Creep Up Ahead of Biden’s Stimulus Speech,wsj,2021-01-14 08:24:20
"BlackRock’s Fourth-Quarter Profit Rises on ETF, Bond Fund Inflows",wsj,2021-01-14 08:24:20
"Florida’s Covid-19 Vaccines Draw Foreigners, Snowbirds",wsj,2021-01-14 08:24:20
