headline,org,date
Donald Trump makes another new business move,msnmoney,2021-04-02 08:18:15
"Biden keeps saying 'no one making under $400,000' will see their taxes go up under his proposals. But the threshold applies to households, not individuals.",msnmoney,2021-04-02 08:18:15
4-Layer Made in USA ASTM Level 3 Face Mask with 98%+ Filtration!,msnmoney,2021-04-02 08:18:15
Dream home builds that ended in disaster,msnmoney,2021-04-02 08:18:15
"If You Get an Email From the IRS With These 3 Words, Don't Click on It",msnmoney,2021-04-02 08:18:15
"Most Comfortable Shoes: ""These Shoes Are Like Walking On Clouds""",msnmoney,2021-04-02 08:18:15
My aunt took over from me as my grandmother’s power of attorney and executor of my grandfather’s $1.3 million estate. Should I retaliate?,msnmoney,2021-04-02 08:18:15
14 Reasons You Will Regret an RV in Retirement,msnmoney,2021-04-02 08:18:15
6 ‘Retirement Killers’ to Avoid at All Costs,msnmoney,2021-04-02 08:18:15
This Will Purify The Air In Your House In No Time,msnmoney,2021-04-02 08:18:15
31 simple projects that could increase the value of your home,msnmoney,2021-04-02 08:18:15
See Bonanza's Star Tim Matheson's Pictures At 72,msnmoney,2021-04-02 08:18:15
How much should you have in savings at each age?,msnmoney,2021-04-02 08:18:15
20 Things You Should Always Buy at a Dollar Store,msnmoney,2021-04-02 08:18:15
I’m a Retiree — Should I Rent or Own My Home?,msnmoney,2021-04-02 08:18:15
5 Financial Benefits of Being Married in Retirement,msnmoney,2021-04-02 08:18:15
"10 Best Home Improvement Projects You Can Do for $1,400 or Less",msnmoney,2021-04-02 08:18:15
People Are Freaking Out About The Jeep Grand Cherokee Price Drop,msnmoney,2021-04-02 08:18:15
14 Products That Flopped Big-Time,msnmoney,2021-04-02 08:18:15
15 Surprising Things You Can Clean in a Washing Machine,msnmoney,2021-04-02 08:18:15
IRS announces new batch of COVID-19 payments,msnmoney,2021-04-02 08:18:15
Divorced or Widowed? Brace Yourself for These 5 Retirement Challenges,msnmoney,2021-04-02 08:18:15
6 Reasons You Should Stop Hiding Cash at Home,msnmoney,2021-04-02 08:18:15
1 reason to buy this necklace for your daughter  ,msnmoney,2021-04-02 08:18:15
Bing Crosby’s former estate with 'secret room' hits the market for $13.75 million — take a look inside,msnmoney,2021-04-02 08:18:15
Here's how much money Americans in their 40s have in their 401(k) accounts,msnmoney,2021-04-02 08:18:15
15 unconventional jobs that pay really well,msnmoney,2021-04-02 08:18:15
My wife’s father left her a home and share in a trust. This subsidizes our lifestyle. Should I convince her to make a will?,msnmoney,2021-04-02 08:18:15
6 Silly Tidbits of Money Advice That Will Make You Poorer,msnmoney,2021-04-02 08:18:15
Americans With Credit Card Debt Could Be In for a Big Surprise,msnmoney,2021-04-02 08:18:15
"This 34-year-old mom quit her job to work on her side hustle full-time—and made $300,000 in one year",msnmoney,2021-04-02 08:18:15
What's behind America's retirement crisis,msnmoney,2021-04-02 08:18:15
"Tips for Planting, Growing and Caring for Peonies",msnmoney,2021-04-02 08:18:15
How to Take a Pension: A Math Formula Drives 1 Retiree’s Choice,msnmoney,2021-04-02 08:18:15
7 common credit score myths you should never believe,msnmoney,2021-04-02 08:18:15
"16 Highly Unnecessary Things You're Wasting Money On During The Pandemic (Please, Stop Doing Them)",msnmoney,2021-04-02 08:18:15
5 Ways to Save at Dollar Tree,msnmoney,2021-04-02 08:18:15
The Secret to a Happy Retirement? A Schedule,msnmoney,2021-04-02 08:18:15
"More $1,400 stimulus checks are coming – here’s when",msnmoney,2021-04-02 08:18:15
These Grocery Items Are About to Get More Expensive,msnmoney,2021-04-02 08:18:15
New stimulus check for the unemployed might be coming in May,msnmoney,2021-04-02 08:18:15
Take A Look At Who Is Sean Hannity's New Girlfriend,msnmoney,2021-04-02 08:18:15
"‘I cut his hair because he won’t pay for a haircut’: My multimillionaire husband is 90. I’ve looked after him for 41 years, but he won’t help my son",msnmoney,2021-04-02 08:18:15
Don’t laminate your COVID vaccination card before doing these 5 things,msnmoney,2021-04-02 08:18:15
17 Things Frugal People Never Buy,msnmoney,2021-04-02 08:18:15
10 Useless Purchases You Need to Stop Making,msnmoney,2021-04-02 08:18:15
The No. 1 superstition that stops people from buying a home,msnmoney,2021-04-02 08:18:15
Denise Richards's Old Mansion is Unsellable,msnmoney,2021-04-02 08:18:15
Least educated counties in Ohio,msnmoney,2021-04-02 08:18:15
10 Things That Can Ding Your Social Security Payments,msnmoney,2021-04-02 08:18:15
Turning 60? Ask Yourself These 4 Important Questions,msnmoney,2021-04-02 08:18:15
US futures and the dollar rise ahead of what traders expect to be a bumper employment report,msnmoney,2021-04-02 08:18:15
When is the Best Time to Start Growing a Garden?,msnmoney,2021-04-02 08:18:15
Warren Buffett Just Poured $15 Billion in What Could be the Hottest Trend of the Decade,msnmoney,2021-04-02 08:18:15
Does a Year Make a Difference? How to Know Whether to Retire Now or Later,msnmoney,2021-04-02 08:18:15
Critics slam the Fed as home prices rise at a historic rate,msnmoney,2021-04-02 08:18:15
14 Things You Can Get for Free in April,msnmoney,2021-04-02 08:18:15
How to tell if you're making this classic money mistake,msnmoney,2021-04-02 08:18:15
17 Products Still in Short Supply Due to COVID-9,msnmoney,2021-04-02 08:18:15
15 cities where you could score a home for under $100K,msnmoney,2021-04-02 08:18:15
When Can You Retire? Take This Quiz,msnmoney,2021-04-02 08:18:15
"How to retire at 45 with $35,000 per year in passive income",msnmoney,2021-04-02 08:18:15
10 best retirement plans in 2021,msnmoney,2021-04-02 08:18:15
These 3 investment mistakes can wipe out any money you make in the stock market,msnmoney,2021-04-02 08:18:15
Is the Stock Market Open or Closed on Good Friday?,msnmoney,2021-04-02 08:18:15
50 surprising facts about American personal finance,msnmoney,2021-04-02 08:18:15
Donald Trump makes another new business move,msnmoney,2021-04-02 08:18:15
"Biden keeps saying 'no one making under $400,000' will see their taxes go up under his proposals. But the threshold applies to households, not individuals.",msnmoney,2021-04-02 08:18:15
4-Layer Made in USA ASTM Level 3 Face Mask with 98%+ Filtration!,msnmoney,2021-04-02 08:18:15
Dream home builds that ended in disaster,msnmoney,2021-04-02 08:18:15
"If You Get an Email From the IRS With These 3 Words, Don't Click on It",msnmoney,2021-04-02 08:18:15
"Most Comfortable Shoes: ""These Shoes Are Like Walking On Clouds""",msnmoney,2021-04-02 08:18:15
My aunt took over from me as my grandmother’s power of attorney and executor of my grandfather’s $1.3 million estate. Should I retaliate?,msnmoney,2021-04-02 08:18:15
14 Reasons You Will Regret an RV in Retirement,msnmoney,2021-04-02 08:18:15
6 ‘Retirement Killers’ to Avoid at All Costs,msnmoney,2021-04-02 08:18:15
This Will Purify The Air In Your House In No Time,msnmoney,2021-04-02 08:18:15
31 simple projects that could increase the value of your home,msnmoney,2021-04-02 08:18:15
See Bonanza's Star Tim Matheson's Pictures At 72,msnmoney,2021-04-02 08:18:15
How much should you have in savings at each age?,msnmoney,2021-04-02 08:18:15
20 Things You Should Always Buy at a Dollar Store,msnmoney,2021-04-02 08:18:15
I’m a Retiree — Should I Rent or Own My Home?,msnmoney,2021-04-02 08:18:15
5 Financial Benefits of Being Married in Retirement,msnmoney,2021-04-02 08:18:15
"10 Best Home Improvement Projects You Can Do for $1,400 or Less",msnmoney,2021-04-02 08:18:15
People Are Freaking Out About The Jeep Grand Cherokee Price Drop,msnmoney,2021-04-02 08:18:15
14 Products That Flopped Big-Time,msnmoney,2021-04-02 08:18:15
15 Surprising Things You Can Clean in a Washing Machine,msnmoney,2021-04-02 08:18:15
IRS announces new batch of COVID-19 payments,msnmoney,2021-04-02 08:18:15
Divorced or Widowed? Brace Yourself for These 5 Retirement Challenges,msnmoney,2021-04-02 08:18:15
6 Reasons You Should Stop Hiding Cash at Home,msnmoney,2021-04-02 08:18:15
1 reason to buy this necklace for your daughter  ,msnmoney,2021-04-02 08:18:15
Bing Crosby’s former estate with 'secret room' hits the market for $13.75 million — take a look inside,msnmoney,2021-04-02 08:18:15
Here's how much money Americans in their 40s have in their 401(k) accounts,msnmoney,2021-04-02 08:18:15
15 unconventional jobs that pay really well,msnmoney,2021-04-02 08:18:15
My wife’s father left her a home and share in a trust. This subsidizes our lifestyle. Should I convince her to make a will?,msnmoney,2021-04-02 08:18:15
6 Silly Tidbits of Money Advice That Will Make You Poorer,msnmoney,2021-04-02 08:18:15
Americans With Credit Card Debt Could Be In for a Big Surprise,msnmoney,2021-04-02 08:18:15
"This 34-year-old mom quit her job to work on her side hustle full-time—and made $300,000 in one year",msnmoney,2021-04-02 08:18:15
What's behind America's retirement crisis,msnmoney,2021-04-02 08:18:15
"Tips for Planting, Growing and Caring for Peonies",msnmoney,2021-04-02 08:18:15
How to Take a Pension: A Math Formula Drives 1 Retiree’s Choice,msnmoney,2021-04-02 08:18:15
7 common credit score myths you should never believe,msnmoney,2021-04-02 08:18:15
"16 Highly Unnecessary Things You're Wasting Money On During The Pandemic (Please, Stop Doing Them)",msnmoney,2021-04-02 08:18:15
5 Ways to Save at Dollar Tree,msnmoney,2021-04-02 08:18:15
The Secret to a Happy Retirement? A Schedule,msnmoney,2021-04-02 08:18:15
"More $1,400 stimulus checks are coming – here’s when",msnmoney,2021-04-02 08:18:15
These Grocery Items Are About to Get More Expensive,msnmoney,2021-04-02 08:18:15
New stimulus check for the unemployed might be coming in May,msnmoney,2021-04-02 08:18:15
Take A Look At Who Is Sean Hannity's New Girlfriend,msnmoney,2021-04-02 08:18:15
"‘I cut his hair because he won’t pay for a haircut’: My multimillionaire husband is 90. I’ve looked after him for 41 years, but he won’t help my son",msnmoney,2021-04-02 08:18:15
Don’t laminate your COVID vaccination card before doing these 5 things,msnmoney,2021-04-02 08:18:15
17 Things Frugal People Never Buy,msnmoney,2021-04-02 08:18:15
10 Useless Purchases You Need to Stop Making,msnmoney,2021-04-02 08:18:15
The No. 1 superstition that stops people from buying a home,msnmoney,2021-04-02 08:18:15
Denise Richards's Old Mansion is Unsellable,msnmoney,2021-04-02 08:18:15
Least educated counties in Ohio,msnmoney,2021-04-02 08:18:15
10 Things That Can Ding Your Social Security Payments,msnmoney,2021-04-02 08:18:15
Turning 60? Ask Yourself These 4 Important Questions,msnmoney,2021-04-02 08:18:15
US futures and the dollar rise ahead of what traders expect to be a bumper employment report,msnmoney,2021-04-02 08:18:15
When is the Best Time to Start Growing a Garden?,msnmoney,2021-04-02 08:18:15
Warren Buffett Just Poured $15 Billion in What Could be the Hottest Trend of the Decade,msnmoney,2021-04-02 08:18:15
Does a Year Make a Difference? How to Know Whether to Retire Now or Later,msnmoney,2021-04-02 08:18:15
Critics slam the Fed as home prices rise at a historic rate,msnmoney,2021-04-02 08:18:15
14 Things You Can Get for Free in April,msnmoney,2021-04-02 08:18:15
How to tell if you're making this classic money mistake,msnmoney,2021-04-02 08:18:15
17 Products Still in Short Supply Due to COVID-9,msnmoney,2021-04-02 08:18:15
15 cities where you could score a home for under $100K,msnmoney,2021-04-02 08:18:15
When Can You Retire? Take This Quiz,msnmoney,2021-04-02 08:18:15
"How to retire at 45 with $35,000 per year in passive income",msnmoney,2021-04-02 08:18:15
10 best retirement plans in 2021,msnmoney,2021-04-02 08:18:15
These 3 investment mistakes can wipe out any money you make in the stock market,msnmoney,2021-04-02 08:18:15
Is the Stock Market Open or Closed on Good Friday?,msnmoney,2021-04-02 08:18:15
50 surprising facts about American personal finance,msnmoney,2021-04-02 08:18:15
"Stock futures rise ahead of jobs report, market holiday",yahoofinance,2021-04-02 08:25:06
God and man collide in Bill Hwang’s dueling lives,yahoofinance,2021-04-02 08:25:06
Coinbase gets all-clear from SEC to list on Nasdaq,yahoofinance,2021-04-02 08:25:06
Texas threatens to become next flash point on voting rules,yahoofinance,2021-04-02 08:25:06
Netflix spends upwards of $450 million to secure 'Knives Out' sequels: Reports,yahoofinance,2021-04-02 08:25:06
How Alliance Group is helping MiLB clubs struggling amid covid-19,yahoofinance,2021-04-02 08:25:06
Fed officials on fence about digital US dollar,yahoofinance,2021-04-02 08:25:06
UBI in Oakland is the first only for people of color,yahoofinance,2021-04-02 08:25:06
The 2021 Jeep Grand Cherokee Is Stunning And Cheap,yahoofinance,2021-04-02 08:25:06
Is the Stock Market Closed Today? Here Are the Hours for Good Friday 2021.,yahoofinance,2021-04-02 08:25:06
Home Sales Could Keep Falling. Demand Isn’t the Problem.,yahoofinance,2021-04-02 08:25:06
Cramer Says Forget Tech And Look To These Sectors In Q2,yahoofinance,2021-04-02 08:25:06
"Keep on Buying These 3 EV Stocks, Says Analyst Following Conference",yahoofinance,2021-04-02 08:25:06
"Americans Got Richer in 2020. Here Are 5 Charts Showing Who Benefited, and How.",yahoofinance,2021-04-02 08:25:06
"Reconsider your retirement plan, Vanguard says",yahoofinance,2021-04-02 08:25:06
"'No toilet paper, again?' Brace yourself for a new wave of shortages",yahoofinance,2021-04-02 08:25:06
Mortgage Firms Warned to Prepare for a ‘Tidal Wave’ of Distress,yahoofinance,2021-04-02 08:25:06
2 “Strong Buy” Stocks Insiders Are Snapping Up,yahoofinance,2021-04-02 08:25:06
Tesla Stock Reverses Ahead Of Q1 Deliveries Data As New Rival Sees Big Gain,yahoofinance,2021-04-02 08:25:06
Is the stock market open Good Friday? Here are the exchanges closed on the holiday and on Easter Monday,yahoofinance,2021-04-02 08:25:06
Are Any Marijuana Stocks Good Buys As New York Legalizes?,yahoofinance,2021-04-02 08:25:06
Palantir CEO Karp Discloses $10.3 Million Stock Sale. That’s the Tip of the Iceberg.,yahoofinance,2021-04-02 08:25:06
3 Monster Growth Stocks That Could Soar Higher,yahoofinance,2021-04-02 08:25:06
5 of the Best Stocks to Buy for April,yahoofinance,2021-04-02 08:25:06
These semiconductor stocks might benefit the most from Biden’s spending plan,yahoofinance,2021-04-02 08:25:06
Bitcoin Is Trading Near Record-High Again But Analyst Says We Are Staring At A Meltdown,yahoofinance,2021-04-02 08:25:06
"GM, Ford U.S. Sales Rise; Mustang Mach-E Roars As VW Reports First ID.4 Sales",yahoofinance,2021-04-02 08:25:06
God and Man Collide in Bill Hwang’s Dueling Lives on Wall Street,yahoofinance,2021-04-02 08:25:06
Reddit trading guru Keith Gill looks to have made over $25 million on his GameStop bet,yahoofinance,2021-04-02 08:25:06
"Coinbase gets all-clear from SEC, setting stage for landmark crypto listing",yahoofinance,2021-04-02 08:25:06
4 Dow Jones Stocks To Buy And Watch In April 2021: Microsoft Nears Buy Point,yahoofinance,2021-04-02 08:25:06
These ViacomCBS Option Traders Think A Bounce Is Due,yahoofinance,2021-04-02 08:25:06
Lucid Motors Offers A Look Inside Its Plant. The View Is Impressive.,yahoofinance,2021-04-02 08:25:06
Bristol Myers In Over $1B Tax Brawl After Accidental Disclosure Of Offshore Patents Setup: NYT,yahoofinance,2021-04-02 08:25:06
Top money mangers expect these green-energy companies to benefit most from Biden’s infrastructure plan,yahoofinance,2021-04-02 08:25:06
"Stock market news live updates: Stock futures rise ahead of jobs report, market holiday",yahoofinance,2021-04-02 08:25:06
Microsoft: Let’s Shed Some Light on That US Army Contract,yahoofinance,2021-04-02 08:25:06
The Battle Over Tesla Stock Is Over—For Now,yahoofinance,2021-04-02 08:25:06
Biden singles out Amazon for not paying federal taxes,yahoofinance,2021-04-02 08:25:06
Biden Infrastructure Plan Could Be Boon For These EV Stocks,yahoofinance,2021-04-02 08:25:06
1 in 4 Americans have no retirement savings — and those who do aren’t saving enough,yahoofinance,2021-04-02 08:25:06
Fourth stimulus check: Biden urged to add payments to infrastructure plan,yahoofinance,2021-04-02 08:25:06
"Cathie Wood’s Ark Innovation ‘ill-prepared to grapple with a major plot twist’ in stock market, warns Morningstar analyst",yahoofinance,2021-04-02 08:25:06
"Pinduoduo, Shopify, PayPal, LendingTree, JD.com — What Cathy Wood's Ark Bought And Sold On Wednesday",yahoofinance,2021-04-02 08:25:06
9 Top-Rated ETFs to Buy,yahoofinance,2021-04-02 08:25:06
Here are the ETFs to help you invest in the Biden infrastructure plan,yahoofinance,2021-04-02 08:25:06
Inherited $500K? Or $1 Million? How to Make That Money Act Like a Monthly Pension.,yahoofinance,2021-04-02 08:25:06
2 Chip-Equipment Makers to Play the Semiconductor Shortage,yahoofinance,2021-04-02 08:25:06
How many hedge funds are a margin call away from Archegos-style implosion?,yahoofinance,2021-04-02 08:25:06
IRA Contribution Limits in 2020 & 2021,yahoofinance,2021-04-02 08:25:06
IRA Versus 401(k): Which Is Better?,yahoofinance,2021-04-02 08:25:06
El-Erian: Archegos 'is the third near accident this year so far',yahoofinance,2021-04-02 08:25:06
Pending home sales plunge for the second straight month,yahoofinance,2021-04-02 08:25:06
Micron Bulls Find More Reasons to Smile,yahoofinance,2021-04-02 08:25:06
A Swing Trade In AMAT Stock Could Turn Into Something More,yahoofinance,2021-04-02 08:25:06
"Is Nikola A Buy Right Now? Here's What Fund Sponsorship, NKLA Stock Chart Show",yahoofinance,2021-04-02 08:25:06
"How AT&T Makes Money: Communications, WarnerMedia, and Latin America",yahoofinance,2021-04-02 08:25:06
"Frontier Airlines Stock Falls In Debut, After Brutal Year For Industry",yahoofinance,2021-04-02 08:25:06
Riot Blockchain Stock Price Target Gets a Big Boost,yahoofinance,2021-04-02 08:25:06
Americans are bracing for higher taxes under Joe Biden,yahoofinance,2021-04-02 08:25:06
Market Wrap: Bitcoin Stuck Below $60K; Cardano’s Sixfold 1Q Gains Led CoinDesk 20,yahoofinance,2021-04-02 08:25:06
Chip maker TSMC to invest $100 billion to grow manufacturing capacity,yahoofinance,2021-04-02 08:25:06
Why oil prices rallied after OPEC+ said it will gradually raise production,yahoofinance,2021-04-02 08:25:06
Leveraged Blowout: How Hwang’s Archegos Blindsided Global Banks,yahoofinance,2021-04-02 08:25:06
XPeng and NIO Delivered More Electric Vehicles in March. Here’s How They Compare.,yahoofinance,2021-04-02 08:25:06
QuantumScape Rockets Higher Because There’s More Good News,yahoofinance,2021-04-02 08:25:06
Is It Time To Buy AbbVie Stock — Or Will Pfizer's Bad News Continue To Hurt?,yahoofinance,2021-04-02 08:25:06
"My parents claimed me on their 2019 taxes and received my third stimulus check, but I don’t qualify based on my 2020 taxes. Will the IRS ask for it back?",yahoofinance,2021-04-02 08:25:06
Stimulus checks sent to 130M Americans so far. Delayed payments for some Social Security beneficiaries to roll out.,yahoofinance,2021-04-02 08:25:06
U.S. Jobs Growth Is Set to Take Off as Economy Recovers,wsj,2021-04-02 08:26:26
Biden $2.3 Trillion Infrastructure Plan Faces Difficult Path,wsj,2021-04-02 08:26:26
EV Companies Went Public With Big Plans. They’re Quickly Hitting Snags.,wsj,2021-04-02 08:26:26
Iran Nuclear Deal Participants to Meet Next Week,wsj,2021-04-02 08:26:26
"The Mortgage Market Is Roaring, But Lots of People Can’t Get a Loan",wsj,2021-04-02 08:26:26
Inside Archegos’s Epic Meltdown,wsj,2021-04-02 08:26:26
FDA Probes Cause of Failed Johnson & Johnson Covid-19 Vaccine Batch,wsj,2021-04-02 08:26:26
15 CEOs Reflect on Lessons From Their Pandemic Year,wsj,2021-04-02 08:26:26
"Taiwan Train Derails, Killing at Least 41 People",wsj,2021-04-02 08:26:26
Supervisor Says Chauvin Used Force Longer Than Necessary,wsj,2021-04-02 08:26:26
Church Openings for Easter Vary Across the U.S. and World,wsj,2021-04-02 08:26:26
Gonzaga's Case as College Basketball’s Best Team Ever,wsj,2021-04-02 08:26:26
Unused Student Loans? Here Is the Smart Thing to Do,wsj,2021-04-02 08:26:26
Revolutionary War Buffs Rebel Against Pandemic,wsj,2021-04-02 08:26:26
Auto Makers Start 2021 Strongly Despite Supply Constraints,wsj,2021-04-02 08:26:26
CFOs Zero In on Shareholders as Stock Volatility Soars,wsj,2021-04-02 08:26:26
"Google, Facebook, Amazon, Apple and Microsoft. Call Them Tech Frenemies for Life.",wsj,2021-04-02 08:26:26
GM Vows to Send More Advertising Dollars to Black-Owned Media Firms,wsj,2021-04-02 08:26:26
TSMC to Invest $100 Billion to Increase Semiconductor Output,wsj,2021-04-02 08:26:26
California Wine Companies See Opportunity in IPO Boom,wsj,2021-04-02 08:26:26
High-Frequency Traders Eye Satellites for Speed Boost,wsj,2021-04-02 08:26:26
Coinbase Global Sets Direct Listing for April 14 to Go Public,wsj,2021-04-02 08:26:26
Track the Covid-19 Vaccine Rollout,wsj,2021-04-02 08:26:26
Manhattan Residential Sales Soar to Highest Level in 14 Years,wsj,2021-04-02 08:26:26
Pro-Union Measures Temper Left’s Discontent With Infrastructure Plan,wsj,2021-04-02 08:26:26
"California Shooting Suspect Knew the Victims, Police Say",wsj,2021-04-02 08:26:26
A National Park That’s Ideal for Meditative Walks,wsj,2021-04-02 08:26:26
The Cycling Fans Who Watch the Trees,wsj,2021-04-02 08:26:26
Behind Carhartt’s Booming Year—From Workwear to Golden Globes Fashion,wsj,2021-04-02 08:26:26
‘Concrete Cowboy’: Riding the Inner-City Range,wsj,2021-04-02 08:26:26
Google’s Ad Changes Prompt Big Brands to Revamp Data Strategies,wsj,2021-04-02 08:26:26
TV Maker Vizio Goes Public as Company Sets Sights on Ads and Software,wsj,2021-04-02 08:26:26
Demand for Digital Ad Services Fuels Growth at S4,wsj,2021-04-02 08:26:26
California Lawmaker Says National Privacy Law Is a Priority,wsj,2021-04-02 08:26:26
Businesses Take a Hurry-Up-and-Wait Approach to AI,wsj,2021-04-02 08:26:26
Startup Productiv Raises $45 Million in New Funding,wsj,2021-04-02 08:26:26
Planet Fitness CFO Looks to Add Customers as Competitors Struggle During Pandemic,wsj,2021-04-02 08:26:26
Broadridge CFO Looks to Reduce Debt After $2.5 Billion Deal,wsj,2021-04-02 08:26:26
Activision Blizzard Names New CFO as Poaching Suit Against Netflix Continues,wsj,2021-04-02 08:26:26
Questions Linger Over Corporate Ownership Registry for Industry,wsj,2021-04-02 08:26:26
Swiss Regulator Lifts FIFA-Related Acquisition Ban on Julius Baer,wsj,2021-04-02 08:26:26
Deutsche Bank Reorganizes Risk and Compliance Functions,wsj,2021-04-02 08:26:26
America’s Imports Are Stuck on Ships Floating Just Off Los Angeles,wsj,2021-04-02 08:26:26
Freight Companies Brace for Post-Suez Port Backups,wsj,2021-04-02 08:26:26
Today's Logistics Report: Demand Outpaces Deliveries; Racing for Chips; Tight Automotive Inventories,wsj,2021-04-02 08:26:26
"U.S. May Not Need AstraZeneca Vaccine, Fauci Says",wsj,2021-04-02 08:26:26
Americans Are Ready to Shed the Pandemic Pounds. This Stock Can Benefit. ,wsj,2021-04-02 08:26:26
Phillips Enters NFT Craze With a Work by Mad Dog Jones,wsj,2021-04-02 08:26:26
Friday's jobs report will be released to a closed stock market---that's only occurred 12 times since 1980,wsj,2021-04-02 08:26:26
U.S. Treasury yields trade steady before March jobs report,wsj,2021-04-02 08:26:26
"U.S. seen adding almost 700,000 jobs in March as the economy revved up ",wsj,2021-04-02 08:26:26
Three Chandeliers Illuminate the Indoor Pool at This Gated North London Mansion,wsj,2021-04-02 08:26:26
"Get Ready Prime Central London Sellers, a Window is Opening Soon",wsj,2021-04-02 08:26:26
"Manhattan’s Sales Market Continues to Recover, But Luxury Closings Lag",wsj,2021-04-02 08:26:26
Clyfford Still’s ‘PH-568’ Could Fetch HK$145 Million at Its Debut Auction,wsj,2021-04-02 08:26:26
Good Company: Thread Tales’ Ethically Produced Luxury Knitwear,wsj,2021-04-02 08:26:26
Sotheby’s Wine and Spirits Sales Drop 22% Amid Pandemic,wsj,2021-04-02 08:26:26
What Covid-19 Taught Us About Telemedicine,wsj,2021-04-02 08:26:26
Researchers Look for Ways to Make Drug Trials More Diverse,wsj,2021-04-02 08:26:26
VR Brings Joy to People in Assisted-Living Facilities,wsj,2021-04-02 08:26:26
Woke and Weak CEOs,wsj,2021-04-02 08:26:26
U.K. Vaccination Puts U.S. to Shame,wsj,2021-04-02 08:26:26
Biden’s Stumble in the Global Tax Race,wsj,2021-04-02 08:26:26
China Targets H&M With Xinjiang Propaganda Made for Home and Abroad,wsj,2021-04-02 08:26:26
Testing Elon Musk's Starlink: Is It Really a Rural Internet Game Changer?,wsj,2021-04-02 08:26:26
California Wine Companies See Opportunity in IPO Boom,wsj,2021-04-02 08:26:26
DIY Stimulus Plan - 3 Dividends You Don't Want To Miss,seekingalpha,2021-04-02 08:27:18
Forget Tesla - These 2 High-Yielding Stocks Win No Matter What,seekingalpha,2021-04-02 08:27:18
"Ben Graham And Warren Buffett Agree: Own Many Solid Stocks, But Learn To Recognize A Big Winner",seekingalpha,2021-04-02 08:27:18
My 36 Stock $338K Portfolio: Back Into China,seekingalpha,2021-04-02 08:27:18
"Fat Yields, Less Risk",seekingalpha,2021-04-02 08:27:18
Why Stimulus Can't Stave Off The Impending Market Correction,seekingalpha,2021-04-02 08:27:18
Why The China Trade Is Not Over,seekingalpha,2021-04-02 08:27:18
7 Upcoming Dividend Increases To Start Q2,seekingalpha,2021-04-02 08:27:18
The Best Tech Stocks To Snag During A Dip,seekingalpha,2021-04-02 08:27:18
"Q1 Update: ""4 Dividend Dominators For 2021 - Companies With More Than 70% Upside""",seekingalpha,2021-04-02 08:27:18
What I Learned From My Tesla Short Carnage,seekingalpha,2021-04-02 08:27:18
"Treasury yields steady ahead of payrolls, with bullish guesses at +1 million",seekingalpha,2021-04-02 08:27:18
"Lion? Lamb? March's best stocks, strategies into April",seekingalpha,2021-04-02 08:27:18
Is the stock market open Good Friday?,seekingalpha,2021-04-02 08:27:18
