headline,org,date
COVID-19 has created a ‘flight to safety’ for American job hunters,msnmoney,2020-12-16 08:32:07
How to Save on Taxes With Qualified Charitable Distributions,msnmoney,2020-12-16 08:32:07
The Dead Giveaway That Tells You When Amazon’s Giving You A Better Price Than Other Retailers,msnmoney,2020-12-16 08:32:07
"Current Refinance Rates, December 16, 2020 | Rates ease",msnmoney,2020-12-16 08:32:07
Fixer-uppers around America begging to be pretty again,msnmoney,2020-12-16 08:32:07
2.18% FIXED Mortgage Refinance - No Hidden Fees or Points,msnmoney,2020-12-16 08:32:07
Premarket stocks: Wall Street won't stop betting on the Fed,msnmoney,2020-12-16 08:32:07
Free Self-Care Ideas Inspired by These Businesses,msnmoney,2020-12-16 08:32:07
"Don't Make This $24,000 Retirement Savings Mistake",msnmoney,2020-12-16 08:32:07
The Best Kept Secret to An Itch Free Dog,msnmoney,2020-12-16 08:32:07
End 2020 Right With These Smart Savings Tips,msnmoney,2020-12-16 08:32:07
Virginia Launches New Guidelines For Cars Used Less Than 50 Miles/Day,msnmoney,2020-12-16 08:32:07
Satellite Firm AST Is Going Public in Blank-Check Deal,msnmoney,2020-12-16 08:32:07
24 Ways To Stretch Your Unemployment Benefits,msnmoney,2020-12-16 08:32:07
How to furnish your first apartment on a budget,msnmoney,2020-12-16 08:32:07
11 Craziest Money-Losing Wall Street Moves in History,msnmoney,2020-12-16 08:32:07
20 small-cap stocks loved by analysts for 2021,msnmoney,2020-12-16 08:32:07
39 Gifts That Are Selling Like Hotcakes During The Holidays,msnmoney,2020-12-16 08:32:07
The Best Suburbs for Your Wallet — and Peace of Mind,msnmoney,2020-12-16 08:32:07
Can the Post-Vaccine Market Make Short-Term Rental Landlords Rich?,msnmoney,2020-12-16 08:32:07
5 Cheap Ways To Make Winter at Home More Fun,msnmoney,2020-12-16 08:32:07
"While you’re buying value stocks for your portfolio, add some diversity too",msnmoney,2020-12-16 08:32:07
Samuel L. Jackson and 34 Other Celebrities Who Got Rich and Famous Later in Life,msnmoney,2020-12-16 08:32:07
Drop These Tech Stocks Before 2021?,msnmoney,2020-12-16 08:32:07
"Refinance demand jumps 105% annually, as mortgage rates set 15th record low of 2020",msnmoney,2020-12-16 08:32:07
10 financial superstars and the habits that made them rich,msnmoney,2020-12-16 08:32:07
EU Inspection of Belarus Nuclear Plant This Week Canceled,msnmoney,2020-12-16 08:32:07
Holiday gifts you can get at the dollar store,msnmoney,2020-12-16 08:32:07
9 low-risk investments to consider for your portfolio,msnmoney,2020-12-16 08:32:07
Seniors Are Now Entitled To 19 Incredible Discounts During Tough Times,msnmoney,2020-12-16 08:32:07
Top Money Moves I’m Making Now To Save My Bank Account in 2021,msnmoney,2020-12-16 08:32:07
China’s Top Chipmaker Slides After Co-CEO Abruptly Quits,msnmoney,2020-12-16 08:32:07
7 Cities Where Incomes Have Gone Down the Most,msnmoney,2020-12-16 08:32:07
"Fund Your IRA, Cut Your Taxes",msnmoney,2020-12-16 08:32:07
Smart tax moves to make before the end of the year,msnmoney,2020-12-16 08:32:07
These $19k SUVs Will Make You Trade in Your Car,msnmoney,2020-12-16 08:32:07
Why Tesla bulls are in the driver’s seat as the stock nears inclusion in the S&P 500,msnmoney,2020-12-16 08:32:07
"How Obama, Biden and Other Elected Officials Have Made Millions by Being in Office",msnmoney,2020-12-16 08:32:07
Billionaire Ken Griffin - owner of America's most expensive home - is selling his Miami penthouses for at least 20% less than he paid for them 5 years ago,msnmoney,2020-12-16 08:32:07
25 Ways To Maximize Your Retirement Benefits,msnmoney,2020-12-16 08:32:07
Thailand Halts Domestic Travel Subsidy Amid Corruption Probe,msnmoney,2020-12-16 08:32:07
[Photos] Celebs Who Have Destroyed Their Looks,msnmoney,2020-12-16 08:32:07
10 Gift-Giving Mistakes to Avoid in 2020,msnmoney,2020-12-16 08:32:07
In debt? Here's how to get out,msnmoney,2020-12-16 08:32:07
Avoid These 11 Money Mistakes People Make in Their 40s,msnmoney,2020-12-16 08:32:07
WeDoctor Close to Raising $350 Million Even as CFO Quits,msnmoney,2020-12-16 08:32:07
Surprising Things You Never Knew About Tipping,msnmoney,2020-12-16 08:32:07
The Wealthiest Town in America is in Virginia,msnmoney,2020-12-16 08:32:07
"In 2021 the 9-to-5 Will Become the 3-2-2, a Harvard Business School Professor Predicts",msnmoney,2020-12-16 08:32:07
Over Half of Americans Are Missing Out on Free Money — Are You One of Them?,msnmoney,2020-12-16 08:32:07
Hong Kong’s Lalamove Seeks Funds at $8 Billion Valuation,msnmoney,2020-12-16 08:32:07
The Riskiest Places To Swipe Your Credit Card,msnmoney,2020-12-16 08:32:07
"A top equity fund that counts Apple, Tesla, and Berkshire Hathaway among its largest holdings has become the first of its kind to exceed $1 trillion in assets",msnmoney,2020-12-16 08:32:07
Unsold 2018 SUVs Going for Pennies on the Dollar: Great For Seniors,msnmoney,2020-12-16 08:32:07
You Might Actually Be Able To Afford a Mansion in These 20 States,msnmoney,2020-12-16 08:32:07
APR: What it is & how it's calculated,msnmoney,2020-12-16 08:32:07
People who should never set foot in Costco,msnmoney,2020-12-16 08:32:07
Xpeng Delivers First EVs to Norway in Slow-Going Europe Entry,msnmoney,2020-12-16 08:32:07
How Each State Is Managing Schools During the Pandemic,msnmoney,2020-12-16 08:32:07
Inside Howard Marks’ New Holmby Hills Mansion,msnmoney,2020-12-16 08:32:07
One Little-Known Tech Stock to Invest in Now,msnmoney,2020-12-16 08:32:07
10 Ways to Stand Out at Work,msnmoney,2020-12-16 08:32:07
Detergent Turns Former Teacher Into One of China’s Richest Women,msnmoney,2020-12-16 08:32:07
"Biden, Vaccines and Interest Rates: What’s Next for Your Money in 2021?",msnmoney,2020-12-16 08:32:07
What I learned when I bought a house during COVID-19,msnmoney,2020-12-16 08:32:07
3 Ways to Protect a Credit Card You Aren’t Using,msnmoney,2020-12-16 08:32:07
Deutsche Bank Wins Dismissal of Lawsuits by Postbank Investors,msnmoney,2020-12-16 08:32:07
Virginia Drivers With No DUI’s Should Claim This Large Reward In December,msnmoney,2020-12-16 08:32:07
Pet insurance: Is it worth the price?,msnmoney,2020-12-16 08:32:07
Top 11 financial New Year’s resolutions and how to fulfill them,msnmoney,2020-12-16 08:32:07
Cities With the Lowest Poverty Rates,msnmoney,2020-12-16 08:32:07
Ghana GDP Contracts For a Second Quarter as Industry Stalls,msnmoney,2020-12-16 08:32:07
Billionaires That Have Gone Broke,msnmoney,2020-12-16 08:32:07
"What is a homeowners association, or HOA?",msnmoney,2020-12-16 08:32:07
COVID-19 has created a ‘flight to safety’ for American job hunters,msnmoney,2020-12-16 08:32:07
How to Save on Taxes With Qualified Charitable Distributions,msnmoney,2020-12-16 08:32:07
The Dead Giveaway That Tells You When Amazon’s Giving You A Better Price Than Other Retailers,msnmoney,2020-12-16 08:32:07
"Current Refinance Rates, December 16, 2020 | Rates ease",msnmoney,2020-12-16 08:32:07
Fixer-uppers around America begging to be pretty again,msnmoney,2020-12-16 08:32:07
2.18% FIXED Mortgage Refinance - No Hidden Fees or Points,msnmoney,2020-12-16 08:32:07
Premarket stocks: Wall Street won't stop betting on the Fed,msnmoney,2020-12-16 08:32:07
Free Self-Care Ideas Inspired by These Businesses,msnmoney,2020-12-16 08:32:07
"Don't Make This $24,000 Retirement Savings Mistake",msnmoney,2020-12-16 08:32:07
The Best Kept Secret to An Itch Free Dog,msnmoney,2020-12-16 08:32:07
End 2020 Right With These Smart Savings Tips,msnmoney,2020-12-16 08:32:07
Virginia Launches New Guidelines For Cars Used Less Than 50 Miles/Day,msnmoney,2020-12-16 08:32:07
Satellite Firm AST Is Going Public in Blank-Check Deal,msnmoney,2020-12-16 08:32:07
24 Ways To Stretch Your Unemployment Benefits,msnmoney,2020-12-16 08:32:07
How to furnish your first apartment on a budget,msnmoney,2020-12-16 08:32:07
11 Craziest Money-Losing Wall Street Moves in History,msnmoney,2020-12-16 08:32:07
20 small-cap stocks loved by analysts for 2021,msnmoney,2020-12-16 08:32:07
39 Gifts That Are Selling Like Hotcakes During The Holidays,msnmoney,2020-12-16 08:32:07
The Best Suburbs for Your Wallet — and Peace of Mind,msnmoney,2020-12-16 08:32:07
Can the Post-Vaccine Market Make Short-Term Rental Landlords Rich?,msnmoney,2020-12-16 08:32:07
5 Cheap Ways To Make Winter at Home More Fun,msnmoney,2020-12-16 08:32:07
"While you’re buying value stocks for your portfolio, add some diversity too",msnmoney,2020-12-16 08:32:07
Samuel L. Jackson and 34 Other Celebrities Who Got Rich and Famous Later in Life,msnmoney,2020-12-16 08:32:07
Drop These Tech Stocks Before 2021?,msnmoney,2020-12-16 08:32:07
"Refinance demand jumps 105% annually, as mortgage rates set 15th record low of 2020",msnmoney,2020-12-16 08:32:07
10 financial superstars and the habits that made them rich,msnmoney,2020-12-16 08:32:07
EU Inspection of Belarus Nuclear Plant This Week Canceled,msnmoney,2020-12-16 08:32:07
Holiday gifts you can get at the dollar store,msnmoney,2020-12-16 08:32:07
9 low-risk investments to consider for your portfolio,msnmoney,2020-12-16 08:32:07
Seniors Are Now Entitled To 19 Incredible Discounts During Tough Times,msnmoney,2020-12-16 08:32:07
Top Money Moves I’m Making Now To Save My Bank Account in 2021,msnmoney,2020-12-16 08:32:07
China’s Top Chipmaker Slides After Co-CEO Abruptly Quits,msnmoney,2020-12-16 08:32:07
7 Cities Where Incomes Have Gone Down the Most,msnmoney,2020-12-16 08:32:07
"Fund Your IRA, Cut Your Taxes",msnmoney,2020-12-16 08:32:07
Smart tax moves to make before the end of the year,msnmoney,2020-12-16 08:32:07
These $19k SUVs Will Make You Trade in Your Car,msnmoney,2020-12-16 08:32:07
Why Tesla bulls are in the driver’s seat as the stock nears inclusion in the S&P 500,msnmoney,2020-12-16 08:32:07
"How Obama, Biden and Other Elected Officials Have Made Millions by Being in Office",msnmoney,2020-12-16 08:32:07
Billionaire Ken Griffin - owner of America's most expensive home - is selling his Miami penthouses for at least 20% less than he paid for them 5 years ago,msnmoney,2020-12-16 08:32:07
25 Ways To Maximize Your Retirement Benefits,msnmoney,2020-12-16 08:32:07
Thailand Halts Domestic Travel Subsidy Amid Corruption Probe,msnmoney,2020-12-16 08:32:07
[Photos] Celebs Who Have Destroyed Their Looks,msnmoney,2020-12-16 08:32:07
10 Gift-Giving Mistakes to Avoid in 2020,msnmoney,2020-12-16 08:32:07
In debt? Here's how to get out,msnmoney,2020-12-16 08:32:07
Avoid These 11 Money Mistakes People Make in Their 40s,msnmoney,2020-12-16 08:32:07
WeDoctor Close to Raising $350 Million Even as CFO Quits,msnmoney,2020-12-16 08:32:07
Surprising Things You Never Knew About Tipping,msnmoney,2020-12-16 08:32:07
The Wealthiest Town in America is in Virginia,msnmoney,2020-12-16 08:32:07
"In 2021 the 9-to-5 Will Become the 3-2-2, a Harvard Business School Professor Predicts",msnmoney,2020-12-16 08:32:07
Over Half of Americans Are Missing Out on Free Money — Are You One of Them?,msnmoney,2020-12-16 08:32:07
Hong Kong’s Lalamove Seeks Funds at $8 Billion Valuation,msnmoney,2020-12-16 08:32:07
The Riskiest Places To Swipe Your Credit Card,msnmoney,2020-12-16 08:32:07
"A top equity fund that counts Apple, Tesla, and Berkshire Hathaway among its largest holdings has become the first of its kind to exceed $1 trillion in assets",msnmoney,2020-12-16 08:32:07
Unsold 2018 SUVs Going for Pennies on the Dollar: Great For Seniors,msnmoney,2020-12-16 08:32:07
You Might Actually Be Able To Afford a Mansion in These 20 States,msnmoney,2020-12-16 08:32:07
APR: What it is & how it's calculated,msnmoney,2020-12-16 08:32:07
People who should never set foot in Costco,msnmoney,2020-12-16 08:32:07
Xpeng Delivers First EVs to Norway in Slow-Going Europe Entry,msnmoney,2020-12-16 08:32:07
How Each State Is Managing Schools During the Pandemic,msnmoney,2020-12-16 08:32:07
Inside Howard Marks’ New Holmby Hills Mansion,msnmoney,2020-12-16 08:32:07
One Little-Known Tech Stock to Invest in Now,msnmoney,2020-12-16 08:32:07
10 Ways to Stand Out at Work,msnmoney,2020-12-16 08:32:07
Detergent Turns Former Teacher Into One of China’s Richest Women,msnmoney,2020-12-16 08:32:07
"Biden, Vaccines and Interest Rates: What’s Next for Your Money in 2021?",msnmoney,2020-12-16 08:32:07
What I learned when I bought a house during COVID-19,msnmoney,2020-12-16 08:32:07
3 Ways to Protect a Credit Card You Aren’t Using,msnmoney,2020-12-16 08:32:07
Deutsche Bank Wins Dismissal of Lawsuits by Postbank Investors,msnmoney,2020-12-16 08:32:07
Virginia Drivers With No DUI’s Should Claim This Large Reward In December,msnmoney,2020-12-16 08:32:07
Pet insurance: Is it worth the price?,msnmoney,2020-12-16 08:32:07
Top 11 financial New Year’s resolutions and how to fulfill them,msnmoney,2020-12-16 08:32:07
Cities With the Lowest Poverty Rates,msnmoney,2020-12-16 08:32:07
Ghana GDP Contracts For a Second Quarter as Industry Stalls,msnmoney,2020-12-16 08:32:07
Billionaires That Have Gone Broke,msnmoney,2020-12-16 08:32:07
"What is a homeowners association, or HOA?",msnmoney,2020-12-16 08:32:07
There's no reason to worry about inflation in 2021,yahoofinance,2020-12-16 08:34:14
Stock futures rise ahead of Fed decision,yahoofinance,2020-12-16 08:34:14
"Weed companies Aphria, Tilray said to be in merger talks",yahoofinance,2020-12-16 08:34:14
Facebook attacks Apple’s iOS changes in newspaper ads,yahoofinance,2020-12-16 08:34:14
Former poker champion says this common mistake is a ‘huge problem’ in business,yahoofinance,2020-12-16 08:34:14
Gooding and Company reveals 'European Sporting & Historic Collection' car auction,yahoofinance,2020-12-16 08:34:14
The hottest housing market of 2020,yahoofinance,2020-12-16 08:34:14
"Podcast: Apple's ambition, 'Escape from NY', Facebook taps OnlyFans",yahoofinance,2020-12-16 08:34:14
Multi-asset investing for uncertain times,yahoofinance,2020-12-16 08:34:14
Shift Into Hydrogen Could Lift These 3 Stocks Higher,yahoofinance,2020-12-16 08:34:14
Vanguard Makes History With the First $1 Trillion Equity Fund,yahoofinance,2020-12-16 08:34:14
Don’t contribute to your 2020 IRA until you read this,yahoofinance,2020-12-16 08:34:14
GE’s stock jumps after two Wall Street analysts raise their targets by more than 40%,yahoofinance,2020-12-16 08:34:14
"Tilray, Aphria, Twitter - Wednesday's Premarket Movers",yahoofinance,2020-12-16 08:34:14
Tilray stock soars after 'reverse' merger deal with Aphria at a 23% premium,yahoofinance,2020-12-16 08:34:14
Aphria and Tilray’s Merger Could Create the Largest Cannabis Company in the World,yahoofinance,2020-12-16 08:34:14
"Berkshire's Charlie Munger Warns Against Market Frenzy, Expects Lower Returns In Next Decade",yahoofinance,2020-12-16 08:34:14
"Tesla is a 'prime' candidate to see its stock plummet after it enters S&P 500, analyst says",yahoofinance,2020-12-16 08:34:14
This elite Israeli army squad member is behind a startup going public in a $1.4 billion SPAC deal,yahoofinance,2020-12-16 08:34:14
This month’s hottest IPO isn’t DoorDash or Airbnb — it’s artificial-intelligence company C3.ai,yahoofinance,2020-12-16 08:34:14
6 Alternative Energy Stocks To Watch For Q1 2021 As Renewables Heat Up,yahoofinance,2020-12-16 08:34:14
Dow Jones Futures Rise As Coronavirus Stimulus Deal Expected 'Soon'; Apple Hits New Buy Point,yahoofinance,2020-12-16 08:34:14
Palantir vs Verint: Which SaaS Stock Is A Better Pick?,yahoofinance,2020-12-16 08:34:14
"Tesla Fated For Similar Downfall As Tilray, Stock To Hit $60-$80 Levels In 2021, Says Long-Term Bear",yahoofinance,2020-12-16 08:34:14
These Semiconductor Stocks Called Top Picks For 2021,yahoofinance,2020-12-16 08:34:14
Warren Buffett's 6 tricks to teach kids about money,yahoofinance,2020-12-16 08:34:14
IRS is ‘setting the trap’ for bitcoin and virtual currency investors on 2020 tax form,yahoofinance,2020-12-16 08:34:14
Aphria and Tilray to Merge In $4 Billion All-Stock Pot Deal,yahoofinance,2020-12-16 08:34:14
Bank of America Flags Sell Signal for Stocks as Investors Rush Out of Cash,yahoofinance,2020-12-16 08:34:14
China Secures 100M Doses Of Pfizer-BioNTech COVID-19 Vaccine For 2021,yahoofinance,2020-12-16 08:34:14
Here Are The 6 Stocks That Will Shake Up The Nasdaq,yahoofinance,2020-12-16 08:34:14
"Aphria, Tilray To Form Largest Cannabis Company By Sales In Merger",yahoofinance,2020-12-16 08:34:14
Blink Charging Signs New Deal As Auto Giants Back EV Incentives,yahoofinance,2020-12-16 08:34:14
"Rich States Uncover Tax Windfall, Undercutting Push for More Aid",yahoofinance,2020-12-16 08:34:14
Top Cruise Line Stocks for Q1 2021,yahoofinance,2020-12-16 08:34:14
"Exxon Could Outperform Chevron in 2021, Analyst Predicts",yahoofinance,2020-12-16 08:34:14
Luminar stock plunges after news that Mobileye plans to make its own lidar sensors,yahoofinance,2020-12-16 08:34:14
"Aurora Cannabis stock rallies after revising credit facility terms, Aurora Sun facility closure",yahoofinance,2020-12-16 08:34:14
3 Monster Growth Stocks That Can Rip Higher,yahoofinance,2020-12-16 08:34:14
Apartment Investment Completes Separation Into Two Companies,yahoofinance,2020-12-16 08:34:14
Nokia sees flat margins at 5G networks business in 2021,yahoofinance,2020-12-16 08:34:14
J.P. Morgan: 2 Stocks to Buy (And 1 to Avoid),yahoofinance,2020-12-16 08:34:14
Is Pfizer Stock A Buy After FDA Authorizes Its Coronavirus Vaccine?,yahoofinance,2020-12-16 08:34:14
Is Lockheed Stock A Buy As Big F-35 Deal Clears Hurdle?,yahoofinance,2020-12-16 08:34:14
"Camping World, Lordstown Motors Partner On Sales And Electric RV",yahoofinance,2020-12-16 08:34:14
Southwest to take delivery of 35 737 MAX jets through end-2021,yahoofinance,2020-12-16 08:34:14
"Oracle’s Larry Ellison Says He Has Moved to Hawaii, Fleeing California",yahoofinance,2020-12-16 08:34:14
Here’s How to Play Chip Stocks After the 2020 Rally,yahoofinance,2020-12-16 08:34:14
China’s Top Chipmaker Slides After Co-CEO Abruptly Quits,yahoofinance,2020-12-16 08:34:14
"Stock market news live updates: Stock futures rise as lawmakers press ahead with stimulus talks, traders await Fed",yahoofinance,2020-12-16 08:34:14
Top Electric Car Stocks for Q1 2021,yahoofinance,2020-12-16 08:34:14
The stock market flashes a major new sell signal: BofA survey,yahoofinance,2020-12-16 08:34:14
Roku (ROKU) Could Hit $500 in 2021,yahoofinance,2020-12-16 08:34:14
Nikola Tre BEV semi-truck prototype arrives in US,yahoofinance,2020-12-16 08:34:14
BofA Raises Price Targets For Lithium Producers,yahoofinance,2020-12-16 08:34:14
Is Workhorse Stock a Buy Right Now? This Is What You Need to Know,yahoofinance,2020-12-16 08:34:14
Is Qualcomm Stock A Buy Right Now Amid 5G Growth Wave?,yahoofinance,2020-12-16 08:34:14
Why Alibaba rival Pinduoduo is investing in agritech,yahoofinance,2020-12-16 08:34:14
"Quantumscape, Kodak Among Analyst's Top Short Squeeze Candidates",yahoofinance,2020-12-16 08:34:14
Chinese Streamer iQIYI to Raise New Finance in Debt and Equity Markets,yahoofinance,2020-12-16 08:34:14
Will Disney's Stock Reach $250 By 2022?,yahoofinance,2020-12-16 08:34:14
SoftBank Nears Another Win as Tokopedia Weighs Sale to Billionaires’ SPAC. An IPO Is Also Being Mulled.,yahoofinance,2020-12-16 08:34:14
Top Tesla Shareholders,yahoofinance,2020-12-16 08:34:14
16 Bank Stocks That Could Outpace the Sector in 2021,yahoofinance,2020-12-16 08:34:14
Moderna or Pfizer: Which Stock Offers A More Compelling Growth Story?,yahoofinance,2020-12-16 08:34:14
IRA Contribution Limits in 2020,yahoofinance,2020-12-16 08:34:14
BP takes majority stake in U.S. carbon offset firm Finite Carbon,yahoofinance,2020-12-16 08:34:14
"This is ‘the most dramatic thing that’s almost ever happened in the entire world history of finance,’ according to Warren Buffett’s sidekick",yahoofinance,2020-12-16 08:34:14
Gold will disappoint investors in 2021 — here’s why the bulls’ arguments don’t hold up,yahoofinance,2020-12-16 08:34:14
"Arvinas’ Cancer Drug Has Blockbuster Potential, Says Analyst",yahoofinance,2020-12-16 08:34:14
How Much Is Bitcoin Really Worth? A New Pricing Model Is Bad News for Bulls.,yahoofinance,2020-12-16 08:34:14
Is Costco Good For Mortgages?,yahoofinance,2020-12-16 08:34:14
"3 Internet Stocks to Buy—and 1 to Hold—for 2021, According to Piper Sandler",yahoofinance,2020-12-16 08:34:14
"Stock Picks: Find The Best Growth Stocks To Buy With Lessons From ZM Stock, Apple, Veeva",yahoofinance,2020-12-16 08:34:14
"Tilray, Aphria, Wish IPO, Federal Reserve - 5 Things You Must Know Wednesday",yahoofinance,2020-12-16 08:34:14
Lordstown Motors and Camping World Have a Deal. Why It’s Big for the EV Industry.,yahoofinance,2020-12-16 08:34:14
Dow Jones Stocks To Buy And Watch In December 2020: Apple Jumps 5% To Hit New Buy Point,yahoofinance,2020-12-16 08:34:14
"'Halftime Report' Traders Advise Viewers On Ontrak , Bristol-Myers Squibb And SL Green Realty",yahoofinance,2020-12-16 08:34:14
"Nio, not Tesla, is the better EV stock pick for 2021",yahoofinance,2020-12-16 08:34:14
Snowflake Sees $20 Billion Wipeout in Week as Lockup Expires,yahoofinance,2020-12-16 08:34:14
Wall Street Likes the Huntington-TCF Deal. Expect More Regional Bank Marriages in 2021.,yahoofinance,2020-12-16 08:34:14
10 Ways to Play a 2021 Oil-and-Gas Stock Rebound,yahoofinance,2020-12-16 08:34:14
Ant Group's chairman Eric Jing breaks silence after halt in largest global IPO with a corporate 'check-up' and rehabilitation plan,yahoofinance,2020-12-16 08:34:14
GE Released a Manifesto for Climate Change. It Involves Hydrogen.,yahoofinance,2020-12-16 08:34:14
"Top Analyst Recommends Pair Trade: Buy NIO, Sell Xpeng",yahoofinance,2020-12-16 08:34:14
Why Comcast Is 'Ready To Breakout' In 2021,yahoofinance,2020-12-16 08:34:14
Is it wise for retirees to actively trade stocks? What we can learn from 2020,yahoofinance,2020-12-16 08:34:14
Wish prices IPO at $24 to raise more than $1 billion,yahoofinance,2020-12-16 08:34:14
"Is BYND Stock A Buy? Here's What Beyond Meat Earnings, Chart Show",yahoofinance,2020-12-16 08:34:14
Boeing's Share-Price Target Lifted by J.P. Morgan,yahoofinance,2020-12-16 08:34:14
"Evercore ISI starts covering Nikola stock at hold, says next year will be ‘vital’",yahoofinance,2020-12-16 08:34:14
IBM Acquires Fintech Startup Expertus To Strengthen Banking Solutions,yahoofinance,2020-12-16 08:34:14
Top-Rated Stocks: Marvell Technology's Technical Ratings Rise,yahoofinance,2020-12-16 08:34:14
"5G Stocks To Buy And Watch: Apple, Wireless Firms, Chipmakers, Infrastructure Plays",yahoofinance,2020-12-16 08:34:14
Column: Trump's election lawyers should be disbarred,yahoofinance,2020-12-16 08:34:14
"Analysis-After COVID shock, U.S. Treasury market set for new scrutiny",yahoofinance,2020-12-16 08:34:14
Financially fragile Americans during COVID-19 have difficulty answering these 15 money questions — can you?,yahoofinance,2020-12-16 08:34:14
Bitcoin Hits 2-Week High Above $19.7K,yahoofinance,2020-12-16 08:34:14
The government suspended required minimum distributions — but should you still take one before year’s end?,yahoofinance,2020-12-16 08:34:14
"Moderna: Multi-Year Opportunity for mRNA-1273, Says Analyst",yahoofinance,2020-12-16 08:34:14
There's no reason to worry about inflation in 2021: Morning Brief,yahoofinance,2020-12-16 08:34:14
Alibaba's Ant Says 'Looking Into The Mirror' After IPO Fallout,yahoofinance,2020-12-16 08:34:14
Cannabis Countdown: Top 10 Marijuana And Psychedelic Stock News Stories Of The Week,yahoofinance,2020-12-16 08:34:14
20 small-cap stocks loved by analysts for 2021,yahoofinance,2020-12-16 08:34:14
Wish Is Poised to Price IPO at Least at Top of Range,yahoofinance,2020-12-16 08:34:14
Is Moderna Stock A Buy As FDA Panel Meets To Discuss Covid Vaccine?,yahoofinance,2020-12-16 08:34:14
"Tesla may be ‘the most remarkable market story of them all,’ says strategist",yahoofinance,2020-12-16 08:34:14
P/E Ratio Insights for Dropbox,yahoofinance,2020-12-16 08:34:14
'Trading Nation' Traders Discuss Peloton And Planet Fitness,yahoofinance,2020-12-16 08:34:14
U.S. Consumers Hold Back on Early Holiday Spending,wsj,2020-12-16 08:37:08
Massachusetts Regulators to File Complaint Against Robinhood,wsj,2020-12-16 08:37:08
Covid-19 Vaccine Trial Volunteers Note Occasional Harsh Side Effects,wsj,2020-12-16 08:37:08
U.S. Stock Futures Tick Up as Investors Await Stimulus Deal,wsj,2020-12-16 08:37:08
‘Personnel Is Policy’: Four Themes Emerge as Biden Selects Team,wsj,2020-12-16 08:37:08
December Fed Meeting to Focus on Asset Purchases,wsj,2020-12-16 08:37:08
Huawei Gets Conditional Green Light in Germany,wsj,2020-12-16 08:37:08
Strict Covid-19 Restrictions Prompt Defiance and Anger in California,wsj,2020-12-16 08:37:08
BP Boosts Its Bet on Trees,wsj,2020-12-16 08:37:08
"New Business Owners Look Beyond Covid-19, and Winter",wsj,2020-12-16 08:37:08
Snowstorm Forecast to Blanket Parts of East Coast,wsj,2020-12-16 08:37:08
The Los Angeles Chargers Are the NFL’s Best Losers,wsj,2020-12-16 08:37:08
Teacher Shortage Compounds Covid Crisis in Schools,wsj,2020-12-16 08:37:08
The 2020 Response to a Downturn: Trade Up,wsj,2020-12-16 08:37:08
MSCI Drops Chinese Stocks on U.S. Blacklist,wsj,2020-12-16 08:37:08
"Texas’ Tax Advantage Is All About Individuals, Not Business Taxes",wsj,2020-12-16 08:37:08
EU Unveils Plans to Help Banks Clean Up Soured Covid-19 Loans,wsj,2020-12-16 08:37:08
Investors Pile Into ETFs Devoted to ESG,wsj,2020-12-16 08:37:08
StockX Snags $2.8 Billion Valuation in Latest Funding Round,wsj,2020-12-16 08:37:08
Europe’s Economy Steadies as Vaccine Hopes Cheer Businesses,wsj,2020-12-16 08:37:08
Paris Is Fined for Breaking France’s Gender Rules—by Hiring Too Many Women,wsj,2020-12-16 08:37:08
Mexico Passes Law Restricting Foreign Security Agents,wsj,2020-12-16 08:37:08
Big Tech and Antitrust: A Path Forward,wsj,2020-12-16 08:37:08
Executions Fall to 29-Year Low,wsj,2020-12-16 08:37:08
Lawmakers Move Closer to Covid-19 Relief Pact,wsj,2020-12-16 08:37:08
