headline,org,date
Pima County imposes mandatory curfew,googlenews,2020-12-16 09:15:39
Man arrested for chasing Maine McDonald's employees with chainsaw,googlenews,2020-12-16 09:15:39
Michigan AG issues consumer alert amid influx COVID-19 vaccine scams,googlenews,2020-12-16 09:15:39
7 Holiday Cookie Recipes To Bake With Your Loved Ones This Season,googlenews,2020-12-16 09:15:39
"Stock futures trade higher ahead of retail sales, Fed decision",googlenews,2020-12-16 09:15:39
Amazon will make custom-fitted $25 T-shirts after photographing your body,googlenews,2020-12-16 09:15:39
Former Kalamazoo police chief was ousted,googlenews,2020-12-16 09:15:39
Euro zone business activity 'close to stabilizing' in December despite Covid lockdowns,googlenews,2020-12-16 09:15:39
First shipment of the Pfizer vaccine has been delivered to WellSpan Good Samaritan Hospital,googlenews,2020-12-16 09:15:39
"‘Christmas could be even worse’: Gov. Cooper urges N.C. residents not to travel, gather during holidays",googlenews,2020-12-16 09:15:39
Tesla Lays Bare Dangers Of Passive Investing,googlenews,2020-12-16 09:15:39
Oil Inventories Rose by 1.97M Barrels Last Week: API,googlenews,2020-12-16 09:15:39
"57 additional COVID-19 cases, no new deaths reported in Hawaii as vaccinations begin",googlenews,2020-12-16 09:15:39
The U.S. government spent billions on a system for detecting hacks. The Russians outsmarted it.,googlenews,2020-12-16 09:15:39
"North Dakota reports 13 additional COVID-19 deaths, decrease in active cases",googlenews,2020-12-16 09:15:39
"Lordstown will partner with Camping World for an electric RV, service locations",googlenews,2020-12-16 09:15:39
Stock index giant MSCI to remove some Chinese stocks under U.S. pressure,googlenews,2020-12-16 09:15:39
Most doses of a COVID-19 treatment are going unused,googlenews,2020-12-16 09:15:39
Delta launches ‘COVID-free’ flights to Europe on Tuesday,googlenews,2020-12-16 09:15:39
"All The Oomph, Minus The Vroom? Electric Pickups Take Aim At American Market",googlenews,2020-12-16 09:15:39
Walmart will test driverless delivery trucks in Arkansas next year,googlenews,2020-12-16 09:15:39
Clark Atlanta receives largest donation ever from philanthropist MacKenzie Scott,googlenews,2020-12-16 09:15:39
New Google Antitrust Lawsuit Could Be Filed As Soon As Thursday,googlenews,2020-12-16 09:15:39
New Yorkers fleeing to Florida amid pandemic have turned Palm Beach into the Hamptons of the South,googlenews,2020-12-16 09:15:39
"Coronavirus latest: 579,357 cases in Ohio; 224,890 in Kentucky; 434,642 in Indiana",googlenews,2020-12-16 09:15:39
See Alaska Airlines' Covid-19 'Safety Dance',googlenews,2020-12-16 09:15:39
"AAA expects 30% fewer holiday travelers between Dec. 23 and Jan. 3, due to COVID concerns",googlenews,2020-12-16 09:15:39
9 Tech Companies Ordered To Hand Over Information On User Data Collections,googlenews,2020-12-16 09:15:39
Lori Vallow Daybell attorney files motion to disqualify special prosecutor,googlenews,2020-12-16 09:15:39
Ford Mustang Mach-E: Ford's First Serious Tesla Rival Deemed A Winner,googlenews,2020-12-16 09:15:39
Killing the Economy: UK Sees Record Job Losses,googlenews,2020-12-16 09:15:39
"San Francisco board condemns naming of local hospital for Facebook's Mark Zuckerberg, wife Priscilla Chan",googlenews,2020-12-16 09:15:39
Twitter is shutting down its live video streaming app Periscope,googlenews,2020-12-16 09:15:39
"US regulators OK genetically modified pig for food, drugs",googlenews,2020-12-16 09:15:39
Astra narrowly misses reaching orbit on second launch,googlenews,2020-12-16 09:15:39
"iPhone factory workers say they haven’t been paid, cause millions in damages",googlenews,2020-12-16 09:15:39
FDA allows use of over-the-counter home test for COVID-19,googlenews,2020-12-16 09:15:39
Coworker of man found dead off I-295 charged with murder,googlenews,2020-12-16 09:15:39
Facebook’s UK users will lose EU privacy protections next year,googlenews,2020-12-16 09:15:39
Where to order Christmas takeout in the East Bay,googlenews,2020-12-16 09:15:39
Warren Buffett and Goldman Sachs boss call for small business relief,googlenews,2020-12-16 09:15:39
MacKenzie Scott donates $4.2 billion to 384 organizations,googlenews,2020-12-16 09:15:39
MacKenzie Scott Announces $4.2 Billion More in Charitable Giving,googlenews,2020-12-16 09:15:39
"MacKenzie Scott, Jeff Bezos's Ex-Wife, Gives Away $4.2 Billion in Four Months",googlenews,2020-12-16 09:15:39
"MacKenzie Scott, Amazon CEO Jeff Bezos's ex-wife, donates $4.2 billion in last four months",googlenews,2020-12-16 09:15:39
"Moderna Vaccine Is Highly Protective and Prevents Severe Covid, Data Show",googlenews,2020-12-16 09:15:39
Edelman: COVID-19 vaccine a promising development — if enough people will get it | COMMENTARY,googlenews,2020-12-16 09:15:39
"What you need to know about coronavirus on Wednesday, December 16",googlenews,2020-12-16 09:15:39
"Now that we have a Covid vaccine, we can't let immigration politics trump public health",googlenews,2020-12-16 09:15:39
U.S. Retail Sales Fell 1.1% in November,googlenews,2020-12-16 09:15:39
Bad news for holiday shopping: Retail sales tumbled in November,googlenews,2020-12-16 09:15:39
"Retail Spending Tumbles, Despite Holiday Sales: Live Business Updates",googlenews,2020-12-16 09:15:39
"US retail sales miss November estimates as economy, holiday spending slow - Business Insider",googlenews,2020-12-16 09:15:39
"Rich States Uncover Tax Windfall, Undercutting Push for More Aid",googlenews,2020-12-16 09:15:39
"Texas’ Tax Advantage Is All About Individuals, Not Business Taxes",googlenews,2020-12-16 09:15:39
Op-ed: The clock is ticking. Here are some money moves to make before the year ends,googlenews,2020-12-16 09:15:39
6 Tax-Related Things Real Estate Investors Can Do Before Dec. 31,googlenews,2020-12-16 09:15:39
EU announces sweeping new rules that could force breakups and hefty fines for Big Tech,googlenews,2020-12-16 09:15:39
"Current EU laws not enough to address big tech antitrust issues, policy counsel says",googlenews,2020-12-16 09:15:39
Biden gives Big Tech plenty of ‘likes’ for the help,googlenews,2020-12-16 09:15:39
Instant View: U.S. tech firms face new EU rules for business practices,googlenews,2020-12-16 09:15:39
A fund operated by the multi-billion dollar investment firm Ruffer has bought bitcoin,googlenews,2020-12-16 09:15:39
4 Big Reasons Bitcoin Belongs in Your Portfolio - CoinDesk,googlenews,2020-12-16 09:15:39
"Bitcoin Just Smashed Through $20,000—What’s Next?",googlenews,2020-12-16 09:15:39
Ruffer Investment Co. Holds Bitcoin – Bitcoin Magazine,googlenews,2020-12-16 09:15:39
Everything That Happened Today in the Fight Against the Coronavirus | NBC New York,googlenews,2020-12-16 09:15:39
"New York Is on the Verge of Fully Shutting Down Again, Governor Warns",googlenews,2020-12-16 09:15:39
NY Republicans want to check Andrew Cuomo's emergency COVID-19 powers,googlenews,2020-12-16 09:15:39
"Snowstorm takes aim at Northeast, shuts down New York City dining: Latest forecast",googlenews,2020-12-16 09:15:39
Stock market news live updates: Stock futures edge higher as lawmakers press ahead with stimulus talks,googlenews,2020-12-16 09:15:39
World stocks advance after stimulus talks lift Wall St,googlenews,2020-12-16 09:15:39
"GLOBAL MARKETS-Asia stocks climb on vaccine, U.S. stimulus optimism; dollar skids",googlenews,2020-12-16 09:15:39
"Dow Rises Sharply on Vaccine Optimism, Stimulus Talks",googlenews,2020-12-16 09:15:39
"Aphria, Tilray stocks jump after report that cannabis companies are discussing merger",googlenews,2020-12-16 09:15:39
"Tilray, Aphria in merger talks, deal could be announced tomorrow",googlenews,2020-12-16 09:15:39
"Aphria, Tilray Combine to Create Biggest Cannabis Company",googlenews,2020-12-16 09:15:39
"Aphria, Tilray to form 'largest global cannabis company'",googlenews,2020-12-16 09:15:39
Amazon: Trump corruption the only plausible explanation for Microsoft winning $10B cloud deal,googlenews,2020-12-16 09:15:39
Twitter Will Use Amazon Web Services to Power User Feeds,googlenews,2020-12-16 09:15:39
Amazon: New CloudShell gives you command-line access to AWS from a browser,googlenews,2020-12-16 09:15:39
"Amazon Continues Legal Fight For $10B JEDI Contract, Calls It Politically Corrupted Decision",googlenews,2020-12-16 09:15:39
Satellite Firm AST Is Going Public in Blank-Check Deal,googlenews,2020-12-16 09:15:39
"Walgreens, CVS ready to administer COVID-19 vaccine",googlenews,2020-12-16 09:15:39
Walgreens unveils COVID-19 vaccine plan for the general public and long-term care facilities,googlenews,2020-12-16 09:15:39
"Long-term care facilities, nursing homes in NC expected to get COVID-19 vaccine by end of year",googlenews,2020-12-16 09:15:39
"CVS, Walgreens and HEB pharmacies plan COVID-19 vaccine rollout",googlenews,2020-12-16 09:15:39
Government and industry reeling after Russian hackers pierce internal networks,googlenews,2020-12-16 09:15:39
Why the US government hack is literally keeping security experts awake at night,googlenews,2020-12-16 09:15:39
What We Know About Russia's Latest Alleged Hack Of The U.S. Government,googlenews,2020-12-16 09:15:39
White House National Security Adviser O’Brien Cuts Trip Short to Address SolarWinds Hack,googlenews,2020-12-16 09:15:39
Pfizer Covid-19 vaccine arrives in Louisiana,googlenews,2020-12-16 09:15:39
Nurse who received 1st COVID-19 vaccination in US hopes she's an inspiration,googlenews,2020-12-16 09:15:39
"Coronavirus vaccines: Fears, fact and fiction | DW News",googlenews,2020-12-16 09:15:39
"Daily coronavirus updates: Positivity rate, hospitalizations show glimmers of hope, though surge remains serious statewide",googlenews,2020-12-16 09:15:39
Verishop's Imran Khan says recent IPO pops show 'epic level of incompetency' from bankers,googlenews,2020-12-16 09:15:39
Wish prices IPO at $24 to raise more than $1 billion,googlenews,2020-12-16 09:15:39
2020 Was a Big Year for IPOs. It Might Be Tech Bubble 2.0.,googlenews,2020-12-16 09:15:39
Wish IPO Puts $16.4 Billion Valuation On E-Commerce Company,googlenews,2020-12-16 09:15:39
China’s Top Chipmaker Slides After Co-CEO Abruptly Quits,googlenews,2020-12-16 09:15:39
"Taiwan, Biden and China's High-Tech Ambitions",googlenews,2020-12-16 09:15:39
Chinese chipmaker SMIC falls 5% as co-CEO plans to resign and it faces removal from MSCI indexes,googlenews,2020-12-16 09:15:39
Shares of China’s chief chipmaker plunge after co-CEO departs without warning,googlenews,2020-12-16 09:15:39
SolarWinds hides list of high-profile customers after devastating hack,googlenews,2020-12-16 09:15:39
Hack brings unwanted attention to obscure but vital IT firm,googlenews,2020-12-16 09:15:39
SolarWinds Orion Platform hacked! Does Dominion Voting Systems use SolarWinds?,googlenews,2020-12-16 09:15:39
"Microsoft, FireEye confirm SolarWinds supply chain attack",googlenews,2020-12-16 09:15:39
"Lenawee County COVID-19 Update: December 15th, 2020",googlenews,2020-12-16 09:15:39
"Oregon Health Authority reports 54 additional deaths linked to COVID-19; more than 1,000 new cases statewide",googlenews,2020-12-16 09:15:39
"Oregon reports record 54 coronavirus deaths; 1,129 new cases",googlenews,2020-12-16 09:15:39
"The 1st Oregonians will be vaccinated against COVID-19 Wednesday, following 48 states that already started",googlenews,2020-12-16 09:15:39
Former FDA chief on FDA report on Moderna's Covid-19 vaccine,googlenews,2020-12-16 09:15:39
Which delivery service will ship your package in time l GMA,googlenews,2020-12-16 09:15:39
FedEx’s Big Speed Edge Over UPS Is Eroding at Crucial Moment,googlenews,2020-12-16 09:15:39
Holiday shipping rush in full swing,googlenews,2020-12-16 09:15:39
"Christmas shipping deadlines are fast approaching, some are today",googlenews,2020-12-16 09:15:39
Trust Index: Is there a link between Bell’s palsy & vaccine?,googlenews,2020-12-16 09:15:39
Will people be given proof that they've received COVID-19 vaccine?,googlenews,2020-12-16 09:15:39
How many people in Texas have had the COVID-19 vaccine?,googlenews,2020-12-16 09:15:39
Companies have limited options when convincing Covid-19 vaccine skeptics,googlenews,2020-12-16 09:15:39
Andiamo's liquor license suspended for violating state ban on indoor dining,googlenews,2020-12-16 09:15:39
"MLCC suspends another 8 liquor licenses, including Andiamo Warren",googlenews,2020-12-16 09:15:39
"8 more Michigan eateries get liquor licenses suspended, including Andiamo",googlenews,2020-12-16 09:15:39
"Andiamo, Polski's cited for violating state orders | Cops and Courts",googlenews,2020-12-16 09:15:39
Gmail suffers another outage,googlenews,2020-12-16 09:15:39
Gmail Services Appear to Suffer Another Widespread Outage,googlenews,2020-12-16 09:15:39
"Google confirms its second outage, addresses problems with Gmail",googlenews,2020-12-16 09:15:39
Google: Here's what caused our big global outage,googlenews,2020-12-16 09:15:39
Video: Mayor speaks about COVID-19 vaccine,googlenews,2020-12-16 09:15:39
EXPLAINER: Why is the EU taking so long to OK vaccine?,googlenews,2020-12-16 09:15:39
Thousands of frontline workers in Orlando sign up for COVID-19 vaccine,googlenews,2020-12-16 09:15:39
Europeans chafe at wait for approval of COVID-19 vaccine,googlenews,2020-12-16 09:15:39
Man Allegedly Goes Full 'Grand Theft Auto' With a Chainsaw at Westbrook McDonald's,googlenews,2020-12-16 09:15:39
Man chases people with chainsaw at Westbrook McDonald's,googlenews,2020-12-16 09:15:39
Portland man accused of chasing McDonald's employees with chainsaw,googlenews,2020-12-16 09:15:39
Portland man arrested after robbing a McDonald's with a chainsaw,googlenews,2020-12-16 09:15:39
"As Puppy Scams Peak, Adopt A Pet Instead At A Shelter Near Culver",googlenews,2020-12-16 09:15:39
First came news of a vaccine. Now come the scams.,googlenews,2020-12-16 09:15:39
Authorities warn of COVID-19 vaccine scams,googlenews,2020-12-16 09:15:39
Beware of vaccine scams,googlenews,2020-12-16 09:15:39
Chocolate Gingerbread Cookies,googlenews,2020-12-16 09:15:39
The Best Snickerdoodle Cookies - NatashasKitchen.com,googlenews,2020-12-16 09:15:39
Ina Garten's Favorite Christmas Cookie Is Made With This Simple Dough: Just 5 Ingredients for a Variety of Cookies,googlenews,2020-12-16 09:15:39
David Atherton's Christmas tree cookies – festive biscuits that double up as tree decor,googlenews,2020-12-16 09:15:39
Amazon's $25 custom T-shirt service uses virtual body doubles,googlenews,2020-12-16 09:15:39
Amazon's new custom T-shirt service asks you to upload photos of yourself,googlenews,2020-12-16 09:15:39
"Amazon Fashion launches a custom clothing service, Made for You",googlenews,2020-12-16 09:15:39
Amazon Fashion Hops on the Customization Train,googlenews,2020-12-16 09:15:39
Fourth Amazon truck stolen in Cleveland area in recent weeks,googlenews,2020-12-16 09:15:39
COVID-19: Where do Indiana’s firefighters fit into the state’s vaccination plan?,googlenews,2020-12-16 09:15:39
Body found on GVSU campus was first-year student,googlenews,2020-12-16 09:15:39
Cleveland VA plans to begin coronavirus vaccinations Wednesday,googlenews,2020-12-16 09:15:39
Flash eurozone PMI beats forecasts and reaches two-month high,googlenews,2020-12-16 09:15:39
Europe’s Economy Steadies as Vaccine Hopes Cheer Businesses,googlenews,2020-12-16 09:15:39
Rebound in eurozone business activity overshadowed by fresh lockdowns,googlenews,2020-12-16 09:15:39
Eurozone flash Manufacturing PMI comes in at 55.5 for December; EUR/USD reclaims 1.2200,googlenews,2020-12-16 09:15:39
First COVID Vaccine in New York Administered to Black Healthcare Worker | TMZ TV,googlenews,2020-12-16 09:15:39
WellSpan Health receives first doses of COVID-19 vaccine,googlenews,2020-12-16 09:15:39
Newton-Wellesley Hospital To Receive COVID-19 Vaccine Tuesday,googlenews,2020-12-16 09:15:39
Samaritan Health Services COVID-19 vaccine update,googlenews,2020-12-16 09:15:39
"‘The Christmas holidays could be even worse’: Gov. Roy Cooper, health secretary ask North Carolinians not to travel for the holidays, get tested before any gatherings",googlenews,2020-12-16 09:15:39
COVID patients in NC hospitals double in month,googlenews,2020-12-16 09:15:39
Will Gov. Cooper launch more restrictions? How to watch today’s press conference.,googlenews,2020-12-16 09:15:39
A second COVID vaccine could make its way to North Carolina next week,googlenews,2020-12-16 09:15:39
"Tesla is a 'prime' candidate to see its stock plummet after it enters S&P 500, analyst says",googlenews,2020-12-16 09:15:39
Will Tesla rally continue after it joins the S&P?,googlenews,2020-12-16 09:15:39
Why Tesla bulls are in the driver’s seat as the stock nears inclusion in the S&P 500,googlenews,2020-12-16 09:15:39
Here's how much 5% invested in Tesla could have made for S&P 500 index fund investor,googlenews,2020-12-16 09:15:39
Oil Reverses After API Reports Inventory Build Across The Board,googlenews,2020-12-16 09:15:39
Oil dips on demand worries as COVID-19 lockdowns tighten,googlenews,2020-12-16 09:15:39
Crude Oil Prices Susceptible to Near-Term Profit-Taking,googlenews,2020-12-16 09:15:39
Will Oil Continue To Rally In 2021,googlenews,2020-12-16 09:15:39
"Coronavirus: DOH reports 57 new cases, brings state total to 19,480",googlenews,2020-12-16 09:15:39
"This is Now (December 15, 2020)",googlenews,2020-12-16 09:15:39
"Hawaii reports 57 new coronavirus infections as statewide total grows to 19,480",googlenews,2020-12-16 09:15:39
"Vaccines arrive in Hawaii, thousands more on the way",googlenews,2020-12-16 09:15:39
Breakingviews - Sensitive U.S. hack is one more problem for Biden,googlenews,2020-12-16 09:15:39
Cyberattack hits US treasury and commerce departments,googlenews,2020-12-16 09:15:39
Cybersecurity breach takes in hundreds of thousands of organisations,googlenews,2020-12-16 09:15:39
Where do you fall in line for the COVID-19 vaccine?,googlenews,2020-12-16 09:15:39
"Five new COVID-19 cases in Brookings Co. Tuesday, Dec. 15",googlenews,2020-12-16 09:15:39
"COVID-19 in South Dakota: 345 new total cases; Death toll rises to 1,261; Active cases at 11,519",googlenews,2020-12-16 09:15:39
Feeding South Dakota receives donation just in time for holidays,googlenews,2020-12-16 09:15:39
"Lordstown Motors, Camping World Will Build an Electric RV Together",googlenews,2020-12-16 09:15:39
"Camping World, Lordstown Motors Partner On Sales And Electric RV",googlenews,2020-12-16 09:15:39
"Lordstown Motors, Camping World announce joint venture, plans for all-electric RV",googlenews,2020-12-16 09:15:39
"Lordstown Motors, Camping World to make 'special announcement'",googlenews,2020-12-16 09:15:39
MSCI to Delete Chinese Cos. From GIMI Indexes,googlenews,2020-12-16 09:15:39
MSCI drops seven Chinese companies from indices,googlenews,2020-12-16 09:15:39
MSCI Drops Chinese Stocks on U.S. Blacklist,googlenews,2020-12-16 09:15:39
"MSCI chops Chinese firms from global indexes, but will keep them elsewhere",googlenews,2020-12-16 09:15:39
Only 5-20% of antibody drug doses shipped to states are used: Operation Warp Speed,googlenews,2020-12-16 09:15:39
Covid live updates: First Pfizer vaccine doses are given across the U.S.,googlenews,2020-12-16 09:15:39
COVID-19 vaccines may prevent disease up to 3 years: Operation Warp Speed official says,googlenews,2020-12-16 09:15:39
Giving Trump credit for the vaccine is the best way for Biden to unite the country,googlenews,2020-12-16 09:15:39
Delta's new travel corridor offers quarantine-free access to the Netherlands,googlenews,2020-12-16 09:15:39
First fully COVID-tested Delta flight departs Atlanta to Amsterdam,googlenews,2020-12-16 09:15:39
Delta’s ‘COVID-Free’ Flights from Atlanta begin Tuesday evening,googlenews,2020-12-16 09:15:39
Delta Air Lines in talks to add more quarantine-free flights,googlenews,2020-12-16 09:15:39
Walmart will use fully driverless trucks to make deliveries in 2021,googlenews,2020-12-16 09:15:39
Walmart removes the safety driver from autonomous trucking tests,googlenews,2020-12-16 09:15:39
Walmart to go driverless in expanded Arkansas pilot of middle-mile delivery,googlenews,2020-12-16 09:15:39
"Walmart, Gatik announce fully driverless delivery operation in Arkansas",googlenews,2020-12-16 09:15:39
"MacKenzie Scott, the world’s richest woman, gifts $25 million to Alcorn State",googlenews,2020-12-16 09:15:39
Winston-Salem State receives $30 million donation from MacKenzie Scott; largest-ever gift from a single donor,googlenews,2020-12-16 09:15:39
"Delaware State University receives $20M donation, largest in school's history",googlenews,2020-12-16 09:15:39
Philanthropist MacKenzie Scott donates $20 million to UMES,googlenews,2020-12-16 09:15:39
States close to filing new Google antitrust suit,googlenews,2020-12-16 09:15:39
Texas hiring two law firms for Google probe team,googlenews,2020-12-16 09:15:39
Google antitrust lawsuit from state AGs to be filed this week: report - Business Insider,googlenews,2020-12-16 09:15:39
Google to Face Off With Ken Starr in Texas Antitrust Lawsuit,googlenews,2020-12-16 09:15:39
"Housing market trend heading to Florida: Single-family homes to rent, not buy",googlenews,2020-12-16 09:15:39
Deadline for Palm Beach County food and rent assistance Thursday,googlenews,2020-12-16 09:15:39
New COVID-19 curfews are in effect for Miami and the town of Palm Beach,googlenews,2020-12-16 09:15:39
Palm Beach average age drops rapidly as lockdown-weary New York families flee to Florida,googlenews,2020-12-16 09:15:39
"2 more Louisville hospital systems, others in KY receive first shipments of COVID-19 vaccines",googlenews,2020-12-16 09:15:39
St. Elizabeth Hospital receives first doses of COVID-19 vaccine,googlenews,2020-12-16 09:15:39
"Gov. Beshear reports 2,946 new cases; 8.53% positivity rate",googlenews,2020-12-16 09:15:39
Governor Beshear meets with Dr. Birx,googlenews,2020-12-16 09:15:39
Alaska Airlines outlines coronavirus safety protocol to the tune of 'Safety Dance',googlenews,2020-12-16 09:15:39
Alaska Airlines creates ‘Safety Dance’ video about flying during the coronavirus pandemic,googlenews,2020-12-16 09:15:39
Alaska Airlines parodied an ’80s song to promote COVID-19 safety,googlenews,2020-12-16 09:15:39
Alaska Airlines Releases Hilarious Safety Video,googlenews,2020-12-16 09:15:39
"At least 75% of Americans will stay home this holiday season due to the pandemic, AAA predicts",googlenews,2020-12-16 09:15:39
Holiday travel: Will Californians heed the warnings and stay home?,googlenews,2020-12-16 09:15:39
AAA projects large drop in holiday travel,googlenews,2020-12-16 09:15:39
"At least 34M fewer Americans to travel this holiday season, AAA says",googlenews,2020-12-16 09:15:39
"Lori Vallow's lawyer asking for prosecutor to be disqualified, alleging witness tampering",googlenews,2020-12-16 09:15:39
Detroit Strikes Back! 2021 Ford Mustang Mach-E First Drive Review,googlenews,2020-12-16 09:15:39
Ford's all-electric Mustang Mach-E makes its showroom debut,googlenews,2020-12-16 09:15:39
2021 Ford Mustang Mach-E Is Ford's Best EV Ever,googlenews,2020-12-16 09:15:39
2021 Ford Mustang Mach-E First Drive | Worth the hype,googlenews,2020-12-16 09:15:39
Twitter is shutting down Periscope,googlenews,2020-12-16 09:15:39
Twitter is shutting down its Periscope apps,googlenews,2020-12-16 09:15:39
Periscope is shutting down in March 2021,googlenews,2020-12-16 09:15:39
Twitter ending Periscope in March,googlenews,2020-12-16 09:15:39
Rocket startup Astra reaches space for the first time with second launch attempt from Alaska,googlenews,2020-12-16 09:15:39
Astra reaches space during 2nd orbital test launch,googlenews,2020-12-16 09:15:39
SpaceX and NASA alumni just took another company to space for the first time,googlenews,2020-12-16 09:15:39
Launch startup Astra’s rocket reaches space,googlenews,2020-12-16 09:15:39
Violence erupts at iPhone assembly factory in India over unpaid wages,googlenews,2020-12-16 09:15:39
Wistron violence could sour Apple's 'Make In India' plans,googlenews,2020-12-16 09:15:39
Both govt and Apple need to address issues from Wistron strike,googlenews,2020-12-16 09:15:39
Riots at Apple supplier's India plant cause up to $7 million in damage,googlenews,2020-12-16 09:15:39
First Over-The-Counter At-Home COVID-19 Test About To Hit Stores Called 'Game Changer',googlenews,2020-12-16 09:15:39
Epidemiologist: Rapid At-Home Tests Could End the Pandemic,googlenews,2020-12-16 09:15:39
FDA approves first non-prescription COVID-19 test kit | Home COVID-19 test | World News,googlenews,2020-12-16 09:15:39
At-home over-the-counter coronavirus antigen test kit gets FDA authorization,googlenews,2020-12-16 09:15:39
RI schools to resume classes on staggered schedule in January,googlenews,2020-12-16 09:15:39
Rhode Island Schools To Stagger Return After Holiday Break,googlenews,2020-12-16 09:15:39
Pinpoint Weather 12,googlenews,2020-12-16 09:15:39
Rhode Island announces staggered return to school in January,googlenews,2020-12-16 09:15:39
"Exclusive-Facebook to move UK users to California terms, avoiding EU privacy rules",googlenews,2020-12-16 09:15:39
"Facebook to move UK users out of EU’s privacy jurisdiction next year, post-brexit",googlenews,2020-12-16 09:15:39
"Facebook to move UK users to California terms, avoiding EU privacy rules",googlenews,2020-12-16 09:15:39
Facebook to move all UK users onto US agreements,googlenews,2020-12-16 09:15:39
Order Christmas dinner from these local restaurants for an at-home feast,googlenews,2020-12-16 09:15:39
A list of South Bend area restaurants open for Christmas Eve and Christmas Day,googlenews,2020-12-16 09:15:39
10 Festive Christmas Eve Meals in Miami,googlenews,2020-12-16 09:15:39
"Christmas takeout from Denver restaurants, 2020 edition",googlenews,2020-12-16 09:15:39
'It's an economic war'— Warren Buffett urges Congress to extend relief for small businesses,googlenews,2020-12-16 09:15:39
