headline,org,date
Palantir stock shoots up after IBM partnership on AI offering for businesses,googlenews,2021-02-08 13:10:15
18 Actually Romantic Things to Do This Valentine’s Day,googlenews,2021-02-08 13:10:15
Should You Buy Corsair (CRSR) Ahead of Earnings?,googlenews,2021-02-08 13:10:15
Ethereum Futures Are Now Trading on CME - CoinDesk,googlenews,2021-02-08 13:10:15
Businesses add COVID-19 fees to bills,googlenews,2021-02-08 13:10:15
Rocket start-up ABL Space to launch first-ever mission from Europe for Lockheed Martin,googlenews,2021-02-08 13:10:15
"Here Are the Healthiest, Least Healthy Cities in America",googlenews,2021-02-08 13:10:15
"Local bars, restaurants brace themselves for pandemic losses on Super Bowl Sunday",googlenews,2021-02-08 13:10:15
"DHEC: 2,228 new COVID-19 cases, 35 more deaths reported Sunday",googlenews,2021-02-08 13:10:15
China’s tech giants face new anti-monopoly rules,googlenews,2021-02-08 13:10:15
"Getaway, a startup building tiny cabins, raises $41.7M",googlenews,2021-02-08 13:10:15
EXCLUSIVE: SBA Hid Comms With Planned Parenthood Amid GOP Criticism Over PPP Loans,googlenews,2021-02-08 13:10:15
"59.3 million doses of COVID-19 vaccines distributed, 39 million administered: U.S. CDC",googlenews,2021-02-08 13:10:15
Taiwan senses opportunity to bolster relations with west after chip shortages,googlenews,2021-02-08 13:10:15
"In Alabama, Workers At Amazon Warehouse Are Poised For Union Vote",googlenews,2021-02-08 13:10:15
Ranting About GM’s Electric Vehicle Super Bowl Ads (Ugh),googlenews,2021-02-08 13:10:15
Camp Hill-based Rite Aid among pharmacies to receive COVID-19 vaccine,googlenews,2021-02-08 13:10:15
Big Oil Stocks Rally Despite Democrats' Fossil-Fuel Stance,googlenews,2021-02-08 13:10:15
Hong Kong Stocks Are About to Lose Biggest Source of Funds,googlenews,2021-02-08 13:10:15
"Here is Minnesota's COVID-19 update for Sunday, Feb. 7",googlenews,2021-02-08 13:10:15
"GameStop stock falls to extend last week's record selloff, as trading volume drops off",googlenews,2021-02-08 13:10:15
Four Seasons Total Landscaping Super Bowl commercial: Fiverr ad features Philly small biz - On top of Philly news,googlenews,2021-02-08 13:10:15
"A woman wins a 6-figure lottery prize. The next day, she wins again",googlenews,2021-02-08 13:10:15
Consulting giant McKinsey allegedly fed the opioid crisis. Now an affiliate may profit from treating addicts.,googlenews,2021-02-08 13:10:15
What recovery? Clothes retailers cut orders while factories fight to survive,googlenews,2021-02-08 13:10:15
Statistics show thousands of Minnesotans will die after getting the COVID vaccine — but not because of it | INFORUM,googlenews,2021-02-08 13:10:15
The Week in Business: The Meme Stock Bubble Bursts,googlenews,2021-02-08 13:10:15
"Volta Industries, Inc. and Tortoise Acquisition Corp. II Announce Planned Merger Combined Company to Remain on the NYSE",googlenews,2021-02-08 13:10:15
The New Dawn In Cannabis Has Arrived,googlenews,2021-02-08 13:10:15
"Free food for Super Bowl LV: Here's where to get free wings, pizza deals and free delivery",googlenews,2021-02-08 13:10:15
Here's Why Mastercard Could Get Much Bigger,googlenews,2021-02-08 13:10:15
"Tesla's investment in bitcoin is a really big deal, says Galaxy Digital's Novogratz",googlenews,2021-02-08 13:10:15
Rolls-Royce plans two-week shutdown of civil aerospace business,googlenews,2021-02-08 13:10:15
"Weary postal workers hope Biden will bring new tone, change",googlenews,2021-02-08 13:10:15
Nokia selected by Deutsche Telekom to modernize optical transport network (NYSE:NOK),googlenews,2021-02-08 13:10:15
Tesla invests about $1.50 billion in bitcoin,googlenews,2021-02-08 13:10:15
Dollar steadies after U.S. jobs-related losses,googlenews,2021-02-08 13:10:15
"Renaissance, Pershing Square among hedge funds that got clobbered in January",googlenews,2021-02-08 13:10:15
Washington’s hospitals send N95 masks to 3M for testing and discover many are knockoffs,googlenews,2021-02-08 13:10:15
The Biden Stimulus vs. the Bond Market,googlenews,2021-02-08 13:10:15
"Musk's Tesla says it invested $1.5 billion in bitcoin, prices hit record at $44,000",googlenews,2021-02-08 13:10:15
"Tesla buys $1.5 billion in bitcoin, plans to accept it as payment",googlenews,2021-02-08 13:10:15
Elon Musk Works His Magic on Dogecoin and Bitcoin,googlenews,2021-02-08 13:10:15
"Op-Ed: Tesla, Elon Musk, GameStop, Short-Sellers, & The Future",googlenews,2021-02-08 13:10:15
Reddit Pays Ode To GameStop 'Underdogs' In 5-Second Super Bowl Ad,googlenews,2021-02-08 13:10:15
Reddit and Robinhood both ran Super Bowl ads - Were they effective?,googlenews,2021-02-08 13:10:15
These 12 lessons from the GameStop and AMC frenzy can help you make money trading stocks (or at least lose less),googlenews,2021-02-08 13:10:15
"Niall Ferguson: GameStop, Robinhood, Reddit and the Wind Trade",googlenews,2021-02-08 13:10:15
"Dow, S&P 500 and Nasdaq hit record highs at open",googlenews,2021-02-08 13:10:15
Dow rises more than 100 points to a record high as rally continues,googlenews,2021-02-08 13:10:15
"Futures hit record high on stimulus hopes, speedy vaccine rollout",googlenews,2021-02-08 13:10:15
Wall Street at record highs on stimulus bets,googlenews,2021-02-08 13:10:15
The Grandparents Have Gotten Their Covid-19 Vaccine. Is it Finally OK to Visit Them?,googlenews,2021-02-08 13:10:15
Why Johnson & Johnson's Vaccine Data Is Actually Great News,googlenews,2021-02-08 13:10:15
The coronavirus vaccines have shattered expectations,googlenews,2021-02-08 13:10:15
Johnson & Johnson vaccine: Is it more effective than flu shot in fighting illness?,googlenews,2021-02-08 13:10:15
AstraZeneca’s Vaccine Does Not Work Well Against Virus Variant in South Africa,googlenews,2021-02-08 13:10:15
South Africa pauses AstraZeneca vaccine rollout after study shows it offers less protection against variant,googlenews,2021-02-08 13:10:15
Live updates: Biden says Trump administration handling of pandemic was ‘more dire than we thought’,googlenews,2021-02-08 13:10:15
Factbox: Latest on the worldwide spread of the coronavirus,googlenews,2021-02-08 13:10:15
Clubhouse discussion app knocked offline in China,googlenews,2021-02-08 13:10:15
Beijing blocks access to Clubhouse app after surge in user numbers,googlenews,2021-02-08 13:10:15
Clubhouse's China Push Faces Major Obstacles,googlenews,2021-02-08 13:10:15
"Clubhouse is no 'free speech heaven,' say Chinese mainland users",googlenews,2021-02-08 13:10:15
Target activewear brand generated more than $1B in sales in first year,googlenews,2021-02-08 13:10:15
Target's Activewear Line All in Motion Becomes a Billion-dollar Brand,googlenews,2021-02-08 13:10:15
"Hyundai, Kia shares tumble after automakers say they're not in talks with Apple to develop a car",googlenews,2021-02-08 13:10:15
"CORRECTED-UPDATE 1-Hyundai Motor, Kia say they are not in talks with Apple on autonomous car development",googlenews,2021-02-08 13:10:15
Hyundai now says it's not in talks with Apple to develop autonomous electric car,googlenews,2021-02-08 13:10:15
Hyundai and Kia are no longer in talks with Apple over an autonomous EV,googlenews,2021-02-08 13:10:15
Tesla Summoned by Chinese Regulators on Quality Issues,googlenews,2021-02-08 13:10:15
Tesla quality complaints prompt meeting with Chinese regulators,googlenews,2021-02-08 13:10:15
Chinese regulators call in Tesla after customers complain,googlenews,2021-02-08 13:10:15
Why Tesla Owners May Have To Pay To Replace Their Touch Screens Halfway Through Life Of Vehicle,googlenews,2021-02-08 13:10:15
Are Ford Stock Investors Starting to Believe In A Connected EV Future?,googlenews,2021-02-08 13:10:15
Better Buy: Alphabet vs. The Trade Desk,googlenews,2021-02-08 13:10:15
Wynn Resorts Announces Public Offering of Common Stock,googlenews,2021-02-08 13:10:15
Wynn Resorts Falls on Public Offering of 5.5 Million Shares,googlenews,2021-02-08 13:10:15
"Americans earning $60000 should get stimulus checks, says Yellen",googlenews,2021-02-08 13:10:15
10 things you need to know before the opening bell,googlenews,2021-02-08 13:10:15
US Treasury Chief: Would Take Years for US Economy to Recover Without Aid Deal,googlenews,2021-02-08 13:10:15
"U.S. Treasury's Yellen: Americans earning $60,000 should get stimulus checks",googlenews,2021-02-08 13:10:15
"Some grocery stores fight ""hero pay"" for frontline workers",googlenews,2021-02-08 13:10:15
"Fred Meyer, QFC will pay workers $100 to be vaccinated",googlenews,2021-02-08 13:10:15
Kroger offers employees $100 to get vaccinated against COVID,googlenews,2021-02-08 13:10:15
Price Chopper and Tops Markets to merge,googlenews,2021-02-08 13:10:15
"Price Chopper, Tops Markets to Merge",googlenews,2021-02-08 13:10:15
Tops Markets to merge with Price Chopper,googlenews,2021-02-08 13:10:15
Joining forces: Price Chopper/Market 32 and Tops Market to merge,googlenews,2021-02-08 13:10:15
Expert says Americans shouldn't be concerned about cutting time to produce COVID-19 vaccine,googlenews,2021-02-08 13:10:15
"Differences among Johnson & Johnson, Pfizer and Moderna COVID-19 vaccines",googlenews,2021-02-08 13:10:15
"The Covid-19 news is bad, but there's room for optimism",googlenews,2021-02-08 13:10:15
Stark differences among SE Asia's vaccination strategies,googlenews,2021-02-08 13:10:15
Oil prices near their highest levels since around beginning of pandemic,googlenews,2021-02-08 13:10:15
Another EV Stock Is Coming to Market. What It Means for Oil Investors.,googlenews,2021-02-08 13:10:15
Crude oil’s price recovery has been too fast for OPEC+ unity,googlenews,2021-02-08 13:10:15
Oil's Recovery Is Too Fast for Its Own Good,googlenews,2021-02-08 13:10:15
"SoftBank Turns $11 Billion Profit, Helped by DoorDash",googlenews,2021-02-08 13:10:15
SoftBank’s Vision Fund Posts Record $8 Billion Profit on IPO Boom,googlenews,2021-02-08 13:10:15
SoftBank posts third-quarter profit gain as Vision Fund rallies,googlenews,2021-02-08 13:10:15
SoftBank's Vision Fund posted a record $8 billion profit in the third quarter as its bets on DoorDash and..,googlenews,2021-02-08 13:10:15
Reddit Crashes Super Bowl With 5-Second Ad Addressing GameStop Drama,googlenews,2021-02-08 13:10:15
Reddit bought a five-second Super Bowl spot celebrating GameStock,googlenews,2021-02-08 13:10:15
"If you blinked, you probably missed Reddit's Super Bowl commercial",googlenews,2021-02-08 13:10:15
Reddit’s 5-Second Regional Super Bowl Spot Was Inspired by the GameStop Stock Debacle,googlenews,2021-02-08 13:10:15
Dialog Agrees to $6 Billion Takeover by Renesas Electronics,googlenews,2021-02-08 13:10:15
Renesas agrees to buy Apple supplier Dialog Semi for $5.9 billion in cash,googlenews,2021-02-08 13:10:15
Connected car consolidation as Renesas acquires Dialog for €4.9 billion,googlenews,2021-02-08 13:10:15
Dialog Semiconductor In $6B Takeover Talks By Renesas Electronics,googlenews,2021-02-08 13:10:15
Former FDA chief Dr. Scott Gottlieb on making Covid vaccines widely available,googlenews,2021-02-08 13:10:15
Former FDA chief predicts states will make COVID-19 vaccines 'generally available' by April,googlenews,2021-02-08 13:10:15
Covid live updates: 24-hour mass vaccination site opening in NYC; AstraZeneca adapting its vaccine for variants,googlenews,2021-02-08 13:10:15
Scott Gottlieb: Coronavirus Vaccine Supply Will Outstrip Demand 'Sooner Than We Think',googlenews,2021-02-08 13:10:15
Shell enters supply deal with Amazon to provide renewable energy,googlenews,2021-02-08 13:10:15
Amazon unveils its largest single renewable energy project ever,googlenews,2021-02-08 13:10:15
Amazon Unveils its Largest-Ever Renewable Energy Project,googlenews,2021-02-08 13:10:15
"Shell, Mitsubishi unit Eneco to supply wind power to Amazon's European facilities",googlenews,2021-02-08 13:10:15
"The who, what and where of Elon Musk's $100 million prize money for carbon capture innovation",googlenews,2021-02-08 13:10:15
Elon Musk funds $100 million contest for carbon removal,googlenews,2021-02-08 13:10:15
Elon Musk pledges $100 million for new X Prize carbon removal competition,googlenews,2021-02-08 13:10:15
Elon Musk's $100 million carbon capture XPrize competition starts today,googlenews,2021-02-08 13:10:15
Parents of Alex Kearns sue Robinhood for wrongful death over suicide - Business Insider,googlenews,2021-02-08 13:10:15
Parents File Lawsuit Against Robinhood For Wrongful Death Of Son,googlenews,2021-02-08 13:10:15
Family set to sue Robinhood over son's suicide,googlenews,2021-02-08 13:10:15
Watch CBS This Morning: Family set to sue Robinhood over son's suicide - Full show on CBS All Access,googlenews,2021-02-08 13:10:15
"5 Stocks To Watch For February 8, 2021",googlenews,2021-02-08 13:10:15
"EV Stock Blink (BLNK) Posts 3,000% Gain in 8 Months Despite Little Revenue",googlenews,2021-02-08 13:10:15
ESG Investing Demand in Hong Kong Increasing: RS Group,googlenews,2021-02-08 13:10:15
48 Stocks Moving in Monday's Pre-Market Session,googlenews,2021-02-08 13:10:15
Global Markets See Inflation Breaking Out to Multiyear Highs,googlenews,2021-02-08 13:10:15
Treasury yields dip after 30-year yield briefly tops 2% for the first time in about a year,googlenews,2021-02-08 13:10:15
30-Year Treasury Yield at 2% Is Just a Distraction,googlenews,2021-02-08 13:10:15
Ultra-Long US Treasuries Are An Ultra-Long Shot,googlenews,2021-02-08 13:10:15
"Today's mortgage and refinance rates: February 8, 2021 | Rates up",googlenews,2021-02-08 13:10:15
"Buying a Home? Check Out Today's Mortgage Rates, Feb. 8",googlenews,2021-02-08 13:10:15
"Mortgage rate deals for February 8, 2021: Top offers from lenders",googlenews,2021-02-08 13:10:15
Mortgage Rates Hold Steady Amidst Rising House Prices and Strong Demand,googlenews,2021-02-08 13:10:15
"Freed from Amazon, Jeff Bezos plans space race",googlenews,2021-02-08 13:10:15
An unleashed Jeff Bezos will seek to shift space venture Blue Origin into hyperdrive,googlenews,2021-02-08 13:10:15
"BRUCE WHITFIELD: Dear Mr President, it’s time to take some tips from Jeff Bezos",googlenews,2021-02-08 13:10:15
CEO Spotlight | Bezos second most famous CEO,googlenews,2021-02-08 13:10:15
Palantir Surges on Deal to Offer Software Through IBM,googlenews,2021-02-08 13:10:15
Palantir and IBM partner on cloud data product,googlenews,2021-02-08 13:10:15
IBM and Palantir Partner to Help Businesses Easily Deploy Powerful and Open AI Applications; Unlock Valuable Data Across Hybrid Cloud Environments,googlenews,2021-02-08 13:10:15
Palantir leaps 15% after revealing partnership with IBM on artificial-intelligence applications,googlenews,2021-02-08 13:10:15
"20 Bay Area blow-out meals for Valentine’s Day, whether outdoor dining or takeout",googlenews,2021-02-08 13:10:15
The best Valentine's Day takeout meals for a romantic date night at home,googlenews,2021-02-08 13:10:15
Wichita restaurants are cooking up special meals and deals for Valentine’s Day 2021,googlenews,2021-02-08 13:10:15
Valentine’s Day Dining and Takeout Specials in San Diego,googlenews,2021-02-08 13:10:15
Are Stocks Overvalued? What the Logic Says,googlenews,2021-02-08 13:10:15
Walt Disney (DIS) to Report Q1 Earnings: What's in the Cards?,googlenews,2021-02-08 13:10:15
Aurora Cannabis (ACB) to Post Q2 Earnings: What's in Store?,googlenews,2021-02-08 13:10:15
"Hasbro (HAS) Q4 Earnings and Revenues Beat Estimates, Rise Y/Y",googlenews,2021-02-08 13:10:15
CME is about to open its doors to ETH futures trading,googlenews,2021-02-08 13:10:15
"Bitcoin (BTC/USD), Ethereum (ETH/USD) Outlooks - Setting Up for Fresh Highs?",googlenews,2021-02-08 13:10:15
Which Crypto Projects Are Based on Ethereum?,googlenews,2021-02-08 13:10:15
"CME Launches Ethereum Futures, ETH Price Stays Steady",googlenews,2021-02-08 13:10:15
ABL Space tapped to launch the first orbital rocket from Britain,googlenews,2021-02-08 13:10:15
Lockheed Martin selects ABL rocket for Shetland launches,googlenews,2021-02-08 13:10:15
Rough Landing Expected for the Glut of New Small-Rocket Makers,googlenews,2021-02-08 13:10:15
Lockheed Martin selects ABL Space Systems for UK launch,googlenews,2021-02-08 13:10:15
"This Texas city is among the healthiest in the US, report says. Here’s why",googlenews,2021-02-08 13:10:15
"Austin among the top ten healthiest cities in the US, study finds",googlenews,2021-02-08 13:10:15
"Jackson, Gulfport rated among unhealthiest cities in US",googlenews,2021-02-08 13:10:15
'Superspreader' Sunday? LA County officials warn against Super Bowl gatherings,googlenews,2021-02-08 13:10:15
"Super Bowl Sunday sees crowds hit the grocery stores, not the bar amid COVID-19",googlenews,2021-02-08 13:10:15
Not the typical Super Bowl for WNY restaurants and bars,googlenews,2021-02-08 13:10:15
Getting Your Super Bowl Wings from—Gasp—a Pizza Chain? We Ranked Your Options.,googlenews,2021-02-08 13:10:15
Asia-Pacific stocks mostly rise; China announces new anti-monopoly rules aimed at tech giants,googlenews,2021-02-08 13:10:15
China Issues Monopoly Regulations for Internet Sector,googlenews,2021-02-08 13:10:15
China implements new anti-monopoly rules targeting tech giants,googlenews,2021-02-08 13:10:15
China's new anti-monopoly rules are long-term positive for financial markets: State Street,googlenews,2021-02-08 13:10:15
Small businesses not taking advantage of COVID-19 Loan Guarantee Scheme,googlenews,2021-02-08 13:10:15
"'This was a lifeline.' 62,000 Cape and Islands jobs saved with $585M in PPP loans",googlenews,2021-02-08 13:10:15
PPP loans: Do's and don'ts for small business owners,googlenews,2021-02-08 13:10:15
Alabama Amazon workers to vote on unionizing,googlenews,2021-02-08 13:10:15
"Amazon Is Trying to Crush a Unionization Effort in Bessemer, Alabama",googlenews,2021-02-08 13:10:15
Alabama Amazon employees pushing for union: ‘We’re doing this for you all’,googlenews,2021-02-08 13:10:15
"Amazon's mushrooming power has met an unlikely foe: Bessemer, Alabama",googlenews,2021-02-08 13:10:15
A Super Bowl Ad That the Biden Presidency Made Possible,googlenews,2021-02-08 13:10:15
Audi Norway punches back at GM's Will Ferrell Super Bowl commercial,googlenews,2021-02-08 13:10:15
Norway responds to GM and Will Ferrell’s EV challenge… with mackerel-slapping?,googlenews,2021-02-08 13:10:15
"'No way, Norway': Will Ferrell anchors GM's electric vehicle drive in comic Super Bowl ad",googlenews,2021-02-08 13:10:15
"54 Maryland, Virginia CVS pharmacies to offer COVID vaccines starting Thursday",googlenews,2021-02-08 13:10:15
"30-40000 more vaccines coming to Ohio pharmacies, starting next week",googlenews,2021-02-08 13:10:15
Select pharmacies set to administer vaccine as early as next week,googlenews,2021-02-08 13:10:15
COVID-19 roundup: Here's what you missed this week,googlenews,2021-02-08 13:10:15
US Democrats fear ill wind from Biden's climate policies in oil states,googlenews,2021-02-08 13:10:15
A Disillusioned ExxonMobil Engineer Quits to Take Action on Climate Change and Stop ‘Making the World Worse’,googlenews,2021-02-08 13:10:15
"Bob Marshall: Biden hasn’t declared war on oil, the world has – and Louisiana will be the winner",googlenews,2021-02-08 13:10:15
Is A Career In Oil Still A Safe Bet,googlenews,2021-02-08 13:10:15
"Hong Kong Proposes Tightening Rules on Stock, Bond Sales",googlenews,2021-02-08 13:10:15
Asia-Pacific Shares Weekly Recap: Supported Across the Board by US Stimulus Hopes,googlenews,2021-02-08 13:10:15
Put health ahead of festivities at crucial time for all in Hong Kong,googlenews,2021-02-08 13:10:15
What are the real intentions behind the BN(O) visa offer to Hongkongers?,googlenews,2021-02-08 13:10:15
Minnesota hospitals criticize state's COVID-19 vaccine allocations,googlenews,2021-02-08 13:10:15
Why Four Seasons Landscaping — of Trump Press Conference Fame — Is in a Super Bowl Ad,googlenews,2021-02-08 13:10:15
Opportunity Knocks | Fiverr Big Game Commercial Extended Cut (2021),googlenews,2021-02-08 13:10:15
Four Seasons Total Landscaping Getting Doc Treatment,googlenews,2021-02-08 13:10:15
Super Bowl commercials 2021: Four Seasons Total Landscaping spot was incredible,googlenews,2021-02-08 13:10:15
"An Idaho woman wins a 6-figure lottery prize. The next day, she wins again",googlenews,2021-02-08 13:10:15
Painkiller fallout: Vermont gets $1.5 million in multi-state opioid settlement with McKinsey,googlenews,2021-02-08 13:10:15
Hawaii to receive $2 million in opioid epidemic settlement,googlenews,2021-02-08 13:10:15
"17 new COVID-19 deaths, 1,030 cases reported by MDH in latest data",googlenews,2021-02-08 13:10:15
"Saturday coronavirus update: 17 new MN deaths, 1,030 more cases",googlenews,2021-02-08 13:10:15
"Hot EV Stock Volta Isn’t Public Yet, but It Is Lighting Up the Market",googlenews,2021-02-08 13:10:15
EV Charging Company Volta Finds SPAC Deal: What Investors Should Know,googlenews,2021-02-08 13:10:15
SPAC Tortoise Acquisition Corp. II spikes 47% after announcing merger with EV charging station manufactur..,googlenews,2021-02-08 13:10:15
SNPR SPAC Joins the EV Charging Bandwagon With Volta Merger,googlenews,2021-02-08 13:10:15
Chrissy Teigen's Mom's Thai Crispy Chicken Wings Are the Perfect Super Bowl Food,googlenews,2021-02-08 13:10:15
Sunday Brunch: Chicken Wings with Buffalo Sauce,googlenews,2021-02-08 13:10:15
Pizzerias anticipate record breaking sales for Super Bowl Sunday,googlenews,2021-02-08 13:10:15
"Despite smaller gatherings, a Norfolk restaurant is making thousands of wings for Super Bowl Sunday",googlenews,2021-02-08 13:10:15
In Pictures: Rolls-Royce UltraFan Building Blocks,googlenews,2021-02-08 13:10:15
Rolls-Royce Plans Summer Temporary Shutdown Of Engine Plants,googlenews,2021-02-08 13:10:15
Rolls-Royce to temporarily shut jet engine plants to stem losses,googlenews,2021-02-08 13:10:15
Rolls-Royce Says It Will Briefly Shut UK Engine Factories,googlenews,2021-02-08 13:10:15
"USPS workers want change, but Biden can't fire Louis DeJoy",googlenews,2021-02-08 13:10:15
Postal workers union head hopes Biden makes “bold appointments”,googlenews,2021-02-08 13:10:15
What can Dems do to get the US Postal Service back on track?,googlenews,2021-02-08 13:10:15
Battle looms over future of the U.S. Postal Service,googlenews,2021-02-08 13:10:15
WSHA: Hundreds of thousands of counterfeit N95 masks purchased by Washington hospitals,googlenews,2021-02-08 13:10:15
"300,000 fake N95 masks distributed to dozens of Washington hospitals",googlenews,2021-02-08 13:10:15
Millions of potentially fake N95 masks pulled from local hospital shelves,googlenews,2021-02-08 13:10:15
"Coronavirus daily news updates, February 8: What to know today about COVID-19 in the Seattle area, Washington state and the world",googlenews,2021-02-08 13:10:15
Why markets are nervously watching the Larry v Janet stoush,googlenews,2021-02-08 13:10:15
Could Biden’s rescue package lead the US down a dangerous road?,googlenews,2021-02-08 13:10:15
Biden's $1.9trn stimulus may not be needed if vaccine does its job,googlenews,2021-02-08 13:10:15
Global equities set another record high as rally resumes,googlenews,2021-02-08 13:10:15
3 Top Tech Stocks to Buy Right Now,motleyfool,2021-02-08 13:12:19
3 Stocks to Avoid This Week,motleyfool,2021-02-08 13:12:19
Here's Why Mastercard Could Get Much Bigger,motleyfool,2021-02-08 13:12:19
Is Tesla Really Worth $800 Billion?,motleyfool,2021-02-08 13:12:19
These 2 Hot IPO Stocks Are Lighting Up the Stock Market Monday,motleyfool,2021-02-08 13:12:19
Why Affirm Stock Jumped Today,motleyfool,2021-02-08 13:12:19
Why Teradata Stock Soared Today,motleyfool,2021-02-08 13:12:19
Why NIO Stock Is Higher Today,motleyfool,2021-02-08 13:12:19
Tencent's Battle With ByteDance Could Attract Antitrust Regulators,motleyfool,2021-02-08 13:12:19
Why AMC Entertainment Stock Was Down 12% Today,motleyfool,2021-02-08 13:12:19
Why Nokia's Stock Jumped 25% in January,motleyfool,2021-02-08 13:12:19
Better Buy: Alphabet vs. The Trade Desk,motleyfool,2021-02-08 13:12:19
Why ANGI Homeservices Stock Rocketed 18% at the Open Today,motleyfool,2021-02-08 13:12:19
Delta to Block Middle Seats Through End of April,motleyfool,2021-02-08 13:12:19
Amazon Unveils its Largest-Ever Renewable Energy Project,motleyfool,2021-02-08 13:12:19
AMC Entertainment Investor Wanda Converts Stock to Cash In on Short-Selling Mania,motleyfool,2021-02-08 13:12:19
Are Investors Overlooking Spectrum Brands?,motleyfool,2021-02-08 13:12:19
Why Veru Stock Is Skyrocketing Today,motleyfool,2021-02-08 13:12:19
Uber and Lyft: A Tale of Two Earnings Reports,motleyfool,2021-02-08 13:12:19
Why Ceragon Networks Stock Dropped Today,motleyfool,2021-02-08 13:12:19
EA Is Officially Bringing Back Its Highly Requested College Football Franchise,motleyfool,2021-02-08 13:12:19
Why SPAC Tortoise Acquisition II Stock Is Surging Today,motleyfool,2021-02-08 13:12:19
"Forget Boston Beer, Constellation Brands Is a Better Growth Stock",motleyfool,2021-02-08 13:12:19
Why Huya Is Tumbling Over 9% Today,motleyfool,2021-02-08 13:12:19
Bumble IPO Heats Up as the Company Raises Fundraising Target to $1.8 Billion,motleyfool,2021-02-08 13:12:19
Why ExOne Stock Popped 18% on Monday,motleyfool,2021-02-08 13:12:19
Why SPAC Decarbonization Plus Acquisition Stock Is Higher Today,motleyfool,2021-02-08 13:12:19
Why Westport Fuel Systems Stock Jumped Over 40% Monday Morning,motleyfool,2021-02-08 13:12:19
Is Target a Great Dividend Stock?,motleyfool,2021-02-08 13:12:19
Why Shares of Silvergate Capital Jumped This Morning,motleyfool,2021-02-08 13:12:19
Americans Who Passed Away in 2020 Still Entitled to Stimulus Checks,motleyfool,2021-02-08 13:12:19
Why Lemonade Stock Soared 18.6% in January,motleyfool,2021-02-08 13:12:19
These 3 Value Stocks Are Absurdly Cheap Right now,motleyfool,2021-02-08 13:12:19
2 Stocks to Avoid This Week,motleyfool,2021-02-08 13:12:19
Should You Buy Bitcoin or Just Mine It? It's Complicated.,motleyfool,2021-02-08 13:12:19
