headline,org,date
Oil giant Aramco sticks with dividend even as profit crashes,yahoofinance,2020-08-09 10:13:46
How the Polestar 2 stacks up vs. Tesla,yahoofinance,2020-08-09 10:13:46
"Trump extends unemployment, defers payroll tax",yahoofinance,2020-08-09 10:13:46
Space industry moving to 'leadership by seasoned execs',yahoofinance,2020-08-09 10:13:46
"Legion M, the first fan-owned entertainment company, announces seventh round of fundraising",yahoofinance,2020-08-09 10:13:46
"Beijing doesn’t want to “poison the business climate in China”, says expert",yahoofinance,2020-08-09 10:13:46
Labor market shifting 'from degrees to skills',yahoofinance,2020-08-09 10:13:46
Risk of allowing banks to artificially boost capital ratios,yahoofinance,2020-08-09 10:13:46
How to invest in water sustainability,yahoofinance,2020-08-09 10:13:46
Dow Jones Futures: Trump Extends Unemployment Benefits; Four Stock Market Rally Risks,yahoofinance,2020-08-09 10:13:46
China wields coronavirus to nationalize American-owned carmaker,yahoofinance,2020-08-09 10:13:46
Warren Buffett Signals Big Shift In Investing Stance As Berkshire Reports,yahoofinance,2020-08-09 10:13:46
The 7 Best 5G Stocks to Buy Now,yahoofinance,2020-08-09 10:13:46
"Stock-market expert sees a ‘monstrous’ rally taking hold next week, if one recent trend holds",yahoofinance,2020-08-09 10:13:46
Eastman Kodak's $765 million U.S. loan agreement on hold after recent allegations,yahoofinance,2020-08-09 10:13:46
Why Caesars Stock Is One of the Best Plays on a Return to Normalcy,yahoofinance,2020-08-09 10:13:46
3 Monster Growth Stocks That Can Rip Higher,yahoofinance,2020-08-09 10:13:46
"4 Top Stock Trades for Monday: FSLY, BABA, DDOG, S&P 500",yahoofinance,2020-08-09 10:13:46
These Are The 5 Best Stocks To Buy And Watch Now,yahoofinance,2020-08-09 10:13:46
Bearish Bets: 2 Well-Known Stocks You Should Consider Shorting This Week,yahoofinance,2020-08-09 10:13:46
Berkshire Hathaway's Profit Up by 87% Amidst Business Slowdown,yahoofinance,2020-08-09 10:13:46
"A Big Pension Bought GE, Merck and Intel Stock. It Sold This Biotech.",yahoofinance,2020-08-09 10:13:46
Ex-Boeing Pilot at Center of 737 MAX Probe to Leave Southwest Airlines,yahoofinance,2020-08-09 10:13:46
"Nio Stock Is Pricey, But the Company’s Growth Outlook Is Enticing",yahoofinance,2020-08-09 10:13:46
Could Carnival Stock Retest Lows as Sailings Get Delayed?,yahoofinance,2020-08-09 10:13:46
How to Trade Nvidia as It Shatters Another Record Here,yahoofinance,2020-08-09 10:13:46
Buffett Bought Back His Own Stock While Selling Others,yahoofinance,2020-08-09 10:13:46
7 5G Stocks That Will Lead the Next Technological Revolution,yahoofinance,2020-08-09 10:13:46
Nokia Stock Is Breaking Out of Its Long Slump,yahoofinance,2020-08-09 10:13:46
10 Small-Cap Stocks Ready to Become Large Caps,yahoofinance,2020-08-09 10:13:46
"As Plug Power Stock Surges, Take Profits Before It Falls to Earth",yahoofinance,2020-08-09 10:13:46
"Potential Deal for TikTok’s US Operations Could be Compelling Strategic Fit for Microsoft, Target Price $230: Morgan Stanley",yahoofinance,2020-08-09 10:13:46
3 Gambling Stocks to Buy After Penn National Gaming’s Earnings Pop,yahoofinance,2020-08-09 10:13:46
Mike Khouw's Alibaba Trade Ahead Of Earnings,yahoofinance,2020-08-09 10:13:46
"Barron's Picks And Pans: Berkshire Hathaway, Estee Lauder And More",yahoofinance,2020-08-09 10:13:46
Get Long Alibaba Stock Into Earnings With Confidence,yahoofinance,2020-08-09 10:13:46
Why CrowdStrike Stock Can Hit New All-Time Highs,yahoofinance,2020-08-09 10:13:46
Why I'm Building Positions in This One Group of REITs,yahoofinance,2020-08-09 10:13:46
"Gold Prices Expected to Stay Above $2,000, on Growing Global Geopolitical Uncertainty",yahoofinance,2020-08-09 10:13:46
"A Huge Pension Sold Apple, Microsoft and GE Stock. It Bought This Biotech.",yahoofinance,2020-08-09 10:13:46
"Microsoft, Amazon Lead Five Stocks To Watch In Or Near Buy Zones",yahoofinance,2020-08-09 10:13:46
3 Stocks Flashing Signs of Strong Insider Buying,yahoofinance,2020-08-09 10:13:46
Delta Air Lines Stock Could Benefit From Virgin Atlantic’s Bankruptcy,yahoofinance,2020-08-09 10:13:46
U.S Mortgage Rates Hit a New Record Low,yahoofinance,2020-08-09 10:13:46
"Electrameccanica Vehicles Is a Silly, Pointless Gimmick",yahoofinance,2020-08-09 10:13:46
XpresSpa Shares Are Facing More Problems,yahoofinance,2020-08-09 10:13:46
Bank of America Stocks Chief Gallo Considers Leaving After Snub,yahoofinance,2020-08-09 10:13:46
Apple Stock Is Worth Nearly $2 Trillion. 8 Reasons That’s Not Ridiculous.,yahoofinance,2020-08-09 10:13:46
Why Etsy Stock Remains a Long-Term Powerhouse,yahoofinance,2020-08-09 10:13:46
Earnings Outlook for Inovio Pharmaceuticals,yahoofinance,2020-08-09 10:13:46
"Apple, Facebook, Microsoft Lead Stock Market Rally; Teladoc-Livongo Deal Panned; Fastly, Datadog Dumped: Weekly Review",yahoofinance,2020-08-09 10:13:46
DraftKings Stock Will Likely See $30 Before $40,yahoofinance,2020-08-09 10:13:46
Charts Say to Avoid American Airlines for Now,yahoofinance,2020-08-09 10:13:46
"Suze Orman: Americans get this 'wrong, wrong, wrong' about financial advisers",yahoofinance,2020-08-09 10:13:46
Intel CEO Robert Swan Bought Shares After They Plunged,yahoofinance,2020-08-09 10:13:46
"Gold, Apple Stock, and Just About Everything Else Is Flying. There’s a Reason for That.",yahoofinance,2020-08-09 10:13:46
3 Overbought Stocks to Buy in Today’s Frothy Market,yahoofinance,2020-08-09 10:13:46
US Stock Market:  Jobs Data Rattles Investors as Money Moves from Growth to Value Stocks,yahoofinance,2020-08-09 10:13:46
Morning Bell With Jim Cramer: When to Buy Honeywell Shares,yahoofinance,2020-08-09 10:13:46
The Presidential Election Will Be Here in Less Than 100 Days. What It Means for the Stock Market.,yahoofinance,2020-08-09 10:13:46
"Dow Jones Stocks To Buy And Watch In August 2020: Nike, Pfizer, Visa, Walmart",yahoofinance,2020-08-09 10:13:46
"Upcoming Tailwinds Will Push Micron Stock Forward, Says 5-Star Analyst",yahoofinance,2020-08-09 10:13:46
Warren Buffett’s Berkshire Hathaway Reported Earnings. What You Need to Know.,yahoofinance,2020-08-09 10:13:46
Kodak’s Government Loan Appears to Be on Hold. Expect More Wild Trading Ahead.,yahoofinance,2020-08-09 10:13:46
Kodak’s $765 Million Government Loan on Hold Pending Probe,yahoofinance,2020-08-09 10:13:46
Is Southwest Airlines the Safest Bet on Airline Stocks?,yahoofinance,2020-08-09 10:13:46
10 Biggest Silver Mining Companies,yahoofinance,2020-08-09 10:13:46
Three Ways to Play Gold,yahoofinance,2020-08-09 10:13:46
Plug Power’s Earnings Crushed Forecasts. Wall Street Sees Lots to Like.,yahoofinance,2020-08-09 10:13:46
How you can cut the pricey cost of a mortgage refinance,yahoofinance,2020-08-09 10:13:46
Chinese EV maker Xpeng files for U.S. listing after rival surges,yahoofinance,2020-08-09 10:13:46
COVID-19 thrown a wrench into retirement planning? Don't panic.,yahoofinance,2020-08-09 10:13:46
Gold Forecast – Possible Spike High Complete,yahoofinance,2020-08-09 10:13:46
The CEO who made one of Silicon Valley’s worst acquisitions wants a $400 million blank check,yahoofinance,2020-08-09 10:13:46
Buffett’s Grim View of Air Travel Realized in $10 Billion Charge,yahoofinance,2020-08-09 10:13:46
Buy JetBlue Stock for a Long-Term Recovery,yahoofinance,2020-08-09 10:13:46
"Chevron Misses on Earnings, but Shares Stabilize",yahoofinance,2020-08-09 10:13:46
Hot rookies and not-so-hot pot companies hop on the slowing earnings parade,yahoofinance,2020-08-09 10:13:46
"WarnerMedia restructures to focus on HBO Max, senior executives out",yahoofinance,2020-08-09 10:13:46
7 Earnings Reports to Watch Next Week,yahoofinance,2020-08-09 10:13:46
"The Week In Cannabis: FDA Approves Epidiolex For TSC, Brett Favre Joins The Industry, Stocks In Red",yahoofinance,2020-08-09 10:13:46
Why Gold and TIPS Are the Best Protection for a Falling Stock Market,yahoofinance,2020-08-09 10:13:46
Oil giants' production cuts come to 1 million bpd as they post massive writedowns,yahoofinance,2020-08-09 10:13:46
Oil Giant Aramco Sticks With Dividend Even as Profit Crashes,yahoofinance,2020-08-09 10:13:46
Susan Rice Sells Netflix Options as Biden’s Running Mate Decision Nears,yahoofinance,2020-08-09 10:13:46
Needham: Time to Turn Bullish on These 2 Stocks,yahoofinance,2020-08-09 10:13:46
These money and investing tips aim to keep your investment portfolio grounded in reality,yahoofinance,2020-08-09 10:13:46
"Facebook Takes on TikTok, But That’s Not Why It’s a Buy",yahoofinance,2020-08-09 10:13:46
"Profit up 87% at Buffett’s Berkshire, but coronavirus slows businesses",yahoofinance,2020-08-09 10:13:46
Ilumina Stock Is Falling After an Earnings Disappointment. Bulls Don’t Budge.,yahoofinance,2020-08-09 10:13:46
Pete Najarian Sees Unusual Options Activity In Snap And Jumia,yahoofinance,2020-08-09 10:13:46
"The Crypto Daily – Movers and Shakers – August 9th, 2020",yahoofinance,2020-08-09 10:13:46
"Netflix Stock Has Surged, Prompting a Sale from Ambassador Susan Rice",yahoofinance,2020-08-09 10:13:46
How Virgin Galactic Can Overcome Its Second Quarter Losses,yahoofinance,2020-08-09 10:13:46
"Nasdaq Slumps 1.2%, Hurt By Software Sell-Off; Solar Stocks Are Flying — Here's Why",yahoofinance,2020-08-09 10:13:46
German fintech company Wirecard possibly robbed before its collapse,yahoofinance,2020-08-09 10:13:46
"Turkish Lira’s Plunge Throws Institutional, Economic Challenges Into Sharp Focus",yahoofinance,2020-08-09 10:13:46
What The November Election Means For Casino Stocks,yahoofinance,2020-08-09 10:13:46
First Solar Stock Is a Buy After Earnings. Here’s Why.,yahoofinance,2020-08-09 10:13:46
"What investors should do if they think the stock market is in a bubble, according to the folks who wrote the book on bubbles",yahoofinance,2020-08-09 10:13:46
"Trump, Biden, and Taxes: What to Expect",yahoofinance,2020-08-09 10:13:46
Melt-Up Continues While Metals Warn of Risks,yahoofinance,2020-08-09 10:13:46
Oil Drilling Drops to 15-Year Low With Shale in Full Retreat,yahoofinance,2020-08-09 10:13:46
There Are So Many Stocks to Buy — Ocugen Isn’t One of Them,yahoofinance,2020-08-09 10:13:46
Wall Street Weekahead: Bargain-hunters look to U.S. real estate stocks as S&P nears records,yahoofinance,2020-08-09 10:13:46
"Epic mortgage rates plummet to new low, offering more savings to homeowners and homebuyers",yahoofinance,2020-08-09 10:13:46
"Barron's Picks And Pans: Biden, ESG And Reopening Picks",yahoofinance,2020-08-09 10:13:46
Trump or Biden? These ETFs Should Climb Either Way.,yahoofinance,2020-08-09 10:13:46
Is The OPEC+ Alliance Coming To An End?,yahoofinance,2020-08-09 10:13:46
"Pipeline Court Ruling Helps Some Oil Companies, but Big Risks Remain",yahoofinance,2020-08-09 10:13:46
Calpers CIO’s Mysterious Exit Was Preceded by Months of Torment,yahoofinance,2020-08-09 10:13:46
"Novavax Announces Deals to Sell Covid-19 Vaccine in India, Japan, and Low-Income Countries",yahoofinance,2020-08-09 10:13:46
10 Biggest Software Companies,yahoofinance,2020-08-09 10:13:46
Silver Price Daily Forecast – Silver Sets Multi-Year High At $29.85,yahoofinance,2020-08-09 10:13:46
Unusual Options Activity Insight: Sorrento Therapeutics,yahoofinance,2020-08-09 10:13:46
"'Halftime Report' Traders Share Their Thoughts On Micron, Caterpillar And More",yahoofinance,2020-08-09 10:13:46
These 2 Stocks Can Double From Their Current Prices,yahoofinance,2020-08-09 10:13:46
Nvidia: Sell Or Hold Depends On Your Time Frame,yahoofinance,2020-08-09 10:13:46
"Dropbox boasted solid results, but its CFO’s departure is worrisome",yahoofinance,2020-08-09 10:13:46
5 Safe And Cheap Dividend Stocks To Invest In (August 2020),seekingalpha,2020-08-09 10:15:32
The Top Monthly Pay Dividend Stocks And Funds For August,seekingalpha,2020-08-09 10:15:32
Why REITs Should Pummel Tech,seekingalpha,2020-08-09 10:15:32
Retirement: The Social Security Time Bomb,seekingalpha,2020-08-09 10:15:32
Gold Likely To Double And Then Triple From Here,seekingalpha,2020-08-09 10:15:32
"Mastercard: Fair Value Now, But A Strong Buy On Any Pullback",seekingalpha,2020-08-09 10:15:32
"No Deal, No Problem",seekingalpha,2020-08-09 10:15:32
Big Tech: Why Opportunities Are Gone And Where To Find Alpha Next,seekingalpha,2020-08-09 10:15:32
"Stocks To Watch: Barrick Gold, Hedge Fund Reveals And Election Plays",seekingalpha,2020-08-09 10:15:32
If It Looks Like 1999 And It Smells Like 1999...,seekingalpha,2020-08-09 10:15:32
How do gold and silver compare as investments?,seekingalpha,2020-08-09 10:15:32
Trump seeks to suspend payroll taxes and extend unemployment benefits,seekingalpha,2020-08-09 10:15:32
Seeking Alpha Catalyst Watch,seekingalpha,2020-08-09 10:15:32
How will stocks perform under different U.S. election scenarios?,seekingalpha,2020-08-09 10:15:32
A warning about real estate and REITs from famed hedge fund manager Seth Klarman of Baupost,seekingalpha,2020-08-09 10:15:32
"As gold attracts new investors, gold ETF expenses come under scrutiny; here's the cheapest",seekingalpha,2020-08-09 10:15:32
Kodak loan deal on hold after allegations,seekingalpha,2020-08-09 10:15:32
Weekly Wrap: Is gold the new tech?,seekingalpha,2020-08-09 10:15:32
Qualcomm lobbying Washington to roll back Huawei restrictions,seekingalpha,2020-08-09 10:15:32
Berkshire Hathaway ratchets up stock buybacks in Q2,seekingalpha,2020-08-09 10:15:32
Time To Think Ahead,seekingalpha,2020-08-09 10:15:32
The Reason CenturyLink Stock Is Priced So Low,seekingalpha,2020-08-09 10:15:32
Microsoft: Frac To The Future,seekingalpha,2020-08-09 10:15:32
Carvana: Cracks In The Story,seekingalpha,2020-08-09 10:15:32
IMF July Buys: The 14 Stocks Added To My Portfolio,seekingalpha,2020-08-09 10:15:32
"A pharma with doubling potential, ahead of pivotal pedriatic trial data",seekingalpha,2020-08-09 10:15:32
KBW dives into what it takes to make these fintech names work,seekingalpha,2020-08-09 10:15:32
"Value investing giant pounds table on conglomerate amid insider buying clues, dividend strategy",seekingalpha,2020-08-09 10:15:32
Needham looks to 67% upside in equipment maker's next market inroad,seekingalpha,2020-08-09 10:15:32
"Evercore gets more positive on 2020 retail, and highlights names to benefit.",seekingalpha,2020-08-09 10:15:32
Dream Office Real Estate Investment Trust 2020 Q2 - Results - Earnings Call Presentation,seekingalpha,2020-08-09 10:15:32
Ready Capital Corporation 2020 Q2 - Results - Earnings Call Presentation,seekingalpha,2020-08-09 10:15:32
"PennyMac Financial Services, Inc. 2020 Q2 - Results - Earnings Call Presentation",seekingalpha,2020-08-09 10:15:32
"Elevate Credit, Inc. 2020 Q2 - Results - Earnings Call Presentation",seekingalpha,2020-08-09 10:15:32
Cushman & Wakefield plc 2020 Q2 - Results - Earnings Call Presentation,seekingalpha,2020-08-09 10:15:32
BlackRock: Paying Up For Quality,seekingalpha,2020-08-09 10:15:32
Union Pacific: Best In Class Rail Play,seekingalpha,2020-08-09 10:15:32
"Biogen's Alzheimer's Drug And Other News: The Good, Bad And Ugly Of Biopharma",seekingalpha,2020-08-09 10:15:32
"Mastercard: Fair Value Now, But A Strong Buy On Any Pullback",seekingalpha,2020-08-09 10:15:32
PTC Therapeutics Looks Like A Better Value After Recent Pullback,seekingalpha,2020-08-09 10:15:32
The Top Monthly Pay Dividend Stocks And Funds For August,seekingalpha,2020-08-09 10:15:32
Dividend Challenger Highlights: Week Of August 9,seekingalpha,2020-08-09 10:15:32
Dividend Champion And Contender Highlights: Week Of August 9,seekingalpha,2020-08-09 10:15:32
Blackstone Mortgage Trust: Strong Liquidity With A 10.4% Yield,seekingalpha,2020-08-09 10:15:32
Publicis Group: Still A 4% Yield After A 50% (Temporary) Dividend Cut,seekingalpha,2020-08-09 10:15:32
"TIP ETF: Inflation Protection, With A Side Of Risk",seekingalpha,2020-08-09 10:15:32
ETF Battles: IJR Vs. IWM,seekingalpha,2020-08-09 10:15:32
Fund Investors Seek The Perceived Safety Of Gold For The Week And Year,seekingalpha,2020-08-09 10:15:32
U.S. Weekly FundFlows Insight Report: Investors Withdraw $7.2 Billion From Equity Funds And ETFs During The Fund-Flows Week,seekingalpha,2020-08-09 10:15:32
ARKW: Waning Momentum In High-Growth Internet Stocks Highlights Risks,seekingalpha,2020-08-09 10:15:32
Gold Likely To Double And Then Triple From Here,seekingalpha,2020-08-09 10:15:32
USD/CHF Remains Bearish As Global USD Demand Remains Relatively Weak,seekingalpha,2020-08-09 10:15:32
Central Bank Week In Review 8/3-8/7,seekingalpha,2020-08-09 10:15:32
Elevated Chinese Floating Storage Still Represent The Biggest Headwind For Oil Markets In The Near Term,seekingalpha,2020-08-09 10:15:32
EIA's Electric Power Monthly - July 2020 Edition With Data For May,seekingalpha,2020-08-09 10:15:32
5 Safe And Cheap Dividend Stocks To Invest In (August 2020),seekingalpha,2020-08-09 10:15:32
The Top Monthly Pay Dividend Stocks And Funds For August,seekingalpha,2020-08-09 10:15:32
Why REITs Should Pummel Tech,seekingalpha,2020-08-09 10:15:32
Retirement: The Social Security Time Bomb,seekingalpha,2020-08-09 10:15:32
Gold Likely To Double And Then Triple From Here,seekingalpha,2020-08-09 10:15:32
"Mastercard: Fair Value Now, But A Strong Buy On Any Pullback",seekingalpha,2020-08-09 10:15:32
"No Deal, No Problem",seekingalpha,2020-08-09 10:15:32
Big Tech: Why Opportunities Are Gone And Where To Find Alpha Next,seekingalpha,2020-08-09 10:15:32
"Stocks To Watch: Barrick Gold, Hedge Fund Reveals And Election Plays",seekingalpha,2020-08-09 10:15:32
If It Looks Like 1999 And It Smells Like 1999...,seekingalpha,2020-08-09 10:15:32
How do gold and silver compare as investments?,seekingalpha,2020-08-09 10:15:32
Trump seeks to suspend payroll taxes and extend unemployment benefits,seekingalpha,2020-08-09 10:15:32
Seeking Alpha Catalyst Watch,seekingalpha,2020-08-09 10:15:32
How will stocks perform under different U.S. election scenarios?,seekingalpha,2020-08-09 10:15:32
A warning about real estate and REITs from famed hedge fund manager Seth Klarman of Baupost,seekingalpha,2020-08-09 10:15:32
"As gold attracts new investors, gold ETF expenses come under scrutiny; here's the cheapest",seekingalpha,2020-08-09 10:15:32
Kodak loan deal on hold after allegations,seekingalpha,2020-08-09 10:15:32
Weekly Wrap: Is gold the new tech?,seekingalpha,2020-08-09 10:15:32
Qualcomm lobbying Washington to roll back Huawei restrictions,seekingalpha,2020-08-09 10:15:32
Berkshire Hathaway ratchets up stock buybacks in Q2,seekingalpha,2020-08-09 10:15:32
Time To Think Ahead,seekingalpha,2020-08-09 10:15:32
The Reason CenturyLink Stock Is Priced So Low,seekingalpha,2020-08-09 10:15:32
Microsoft: Frac To The Future,seekingalpha,2020-08-09 10:15:32
Carvana: Cracks In The Story,seekingalpha,2020-08-09 10:15:32
IMF July Buys: The 14 Stocks Added To My Portfolio,seekingalpha,2020-08-09 10:15:32
"A pharma with doubling potential, ahead of pivotal pedriatic trial data",seekingalpha,2020-08-09 10:15:32
KBW dives into what it takes to make these fintech names work,seekingalpha,2020-08-09 10:15:32
"Value investing giant pounds table on conglomerate amid insider buying clues, dividend strategy",seekingalpha,2020-08-09 10:15:32
Needham looks to 67% upside in equipment maker's next market inroad,seekingalpha,2020-08-09 10:15:32
"Evercore gets more positive on 2020 retail, and highlights names to benefit.",seekingalpha,2020-08-09 10:15:32
Dream Office Real Estate Investment Trust 2020 Q2 - Results - Earnings Call Presentation,seekingalpha,2020-08-09 10:15:32
Ready Capital Corporation 2020 Q2 - Results - Earnings Call Presentation,seekingalpha,2020-08-09 10:15:32
"PennyMac Financial Services, Inc. 2020 Q2 - Results - Earnings Call Presentation",seekingalpha,2020-08-09 10:15:32
"Elevate Credit, Inc. 2020 Q2 - Results - Earnings Call Presentation",seekingalpha,2020-08-09 10:15:32
Cushman & Wakefield plc 2020 Q2 - Results - Earnings Call Presentation,seekingalpha,2020-08-09 10:15:32
BlackRock: Paying Up For Quality,seekingalpha,2020-08-09 10:15:32
Union Pacific: Best In Class Rail Play,seekingalpha,2020-08-09 10:15:32
"Biogen's Alzheimer's Drug And Other News: The Good, Bad And Ugly Of Biopharma",seekingalpha,2020-08-09 10:15:32
"Mastercard: Fair Value Now, But A Strong Buy On Any Pullback",seekingalpha,2020-08-09 10:15:32
PTC Therapeutics Looks Like A Better Value After Recent Pullback,seekingalpha,2020-08-09 10:15:32
The Top Monthly Pay Dividend Stocks And Funds For August,seekingalpha,2020-08-09 10:15:32
Dividend Challenger Highlights: Week Of August 9,seekingalpha,2020-08-09 10:15:32
Dividend Champion And Contender Highlights: Week Of August 9,seekingalpha,2020-08-09 10:15:32
Blackstone Mortgage Trust: Strong Liquidity With A 10.4% Yield,seekingalpha,2020-08-09 10:15:32
Publicis Group: Still A 4% Yield After A 50% (Temporary) Dividend Cut,seekingalpha,2020-08-09 10:15:32
"TIP ETF: Inflation Protection, With A Side Of Risk",seekingalpha,2020-08-09 10:15:32
ETF Battles: IJR Vs. IWM,seekingalpha,2020-08-09 10:15:32
Fund Investors Seek The Perceived Safety Of Gold For The Week And Year,seekingalpha,2020-08-09 10:15:32
U.S. Weekly FundFlows Insight Report: Investors Withdraw $7.2 Billion From Equity Funds And ETFs During The Fund-Flows Week,seekingalpha,2020-08-09 10:15:32
ARKW: Waning Momentum In High-Growth Internet Stocks Highlights Risks,seekingalpha,2020-08-09 10:15:32
Gold Likely To Double And Then Triple From Here,seekingalpha,2020-08-09 10:15:32
USD/CHF Remains Bearish As Global USD Demand Remains Relatively Weak,seekingalpha,2020-08-09 10:15:32
Central Bank Week In Review 8/3-8/7,seekingalpha,2020-08-09 10:15:32
Elevated Chinese Floating Storage Still Represent The Biggest Headwind For Oil Markets In The Near Term,seekingalpha,2020-08-09 10:15:32
EIA's Electric Power Monthly - July 2020 Edition With Data For May,seekingalpha,2020-08-09 10:15:32
Does BP's conversion signal the end of Big Oil?,cnnbusiness,2020-08-09 10:17:43
How SpaceX and NASA overcame a bitter culture clash to bring back US astronaut launches,cnnbusiness,2020-08-09 10:17:43
"Without childcare, it will be a rough road to recovery",cnnbusiness,2020-08-09 10:17:43
'Everything is gone.' Flooding in China ruins farmers and risks rising food prices,cnnbusiness,2020-08-09 10:17:43
These unknown brands took over store shelves while Purell and Clorox disappeared,cnnbusiness,2020-08-09 10:17:43
What a WeChat ban would mean for Americans,cnnbusiness,2020-08-09 10:17:43
Buffett's Berkshire Hathaway earnings jumped 87% as it recovers from the pandemic,cnnbusiness,2020-08-09 10:17:43
Instacart went on a hiring spree. These workers got squeezed,cnnbusiness,2020-08-09 10:17:43
"Trump, TikTok and a dangerous precedent for democracy  ",cnnbusiness,2020-08-09 10:17:43
The reality of the US jobs rebound: Part-time work and less pay,cnnbusiness,2020-08-09 10:17:43
The truth about TikTok's security threat,cnnbusiness,2020-08-09 10:17:43
Refi rates at 2.47% APR (15 yr). Do you qualify?,cnnbusiness,2020-08-09 10:17:43
Joe Biden predicts there will be an electric Corvette and he's probably right,cnnbusiness,2020-08-09 10:17:43
Chef Robert Irvine: How restaurants can survive the pandemic,cnnbusiness,2020-08-09 10:17:43
What a WeChat ban would mean for Americans,cnnbusiness,2020-08-09 10:17:43
Covid-19 is taking elevator anxiety to the next level. This firm has a solution,cnnbusiness,2020-08-09 10:17:43
Michelin star meals at home: How fine dining pivoted,cnnbusiness,2020-08-09 10:17:43
'Mulan' is finally heading to Disney+... for $30,cnnbusiness,2020-08-09 10:17:43
How Kodak went from photography to pharma,cnnbusiness,2020-08-09 10:17:43
A Japanese robotics startup has invented a smart mask that translates into eight languages,cnnbusiness,2020-08-09 10:17:43
Manhattan apartment sales plunge while the suburbs boom,cnnbusiness,2020-08-09 10:17:43
Is now the time to refinance your mortgage?,cnnbusiness,2020-08-09 10:17:43
New York City rents slide as vacancies hit a record,cnnbusiness,2020-08-09 10:17:43
Mortgage rates hit another all-time low,cnnbusiness,2020-08-09 10:17:43
Home sales jumped nearly 21% in June,cnnbusiness,2020-08-09 10:17:43
"No, this isn't a flying grain silo. It's SpaceX's Starship prototype",cnnbusiness,2020-08-09 10:17:43
See the new Samsung Galaxy Note20,cnnbusiness,2020-08-09 10:17:43
Russian misinformation isn't new. Social media just made it easier to spread,cnnbusiness,2020-08-09 10:17:43
She lost her job in 2008. Lingering fear prepared her for 2020,cnnbusiness,2020-08-09 10:17:43
Watch the new 'Got Milk?' ads,cnnbusiness,2020-08-09 10:17:43
GM unveils its first fully-electric Cadillac SUV,cnnbusiness,2020-08-09 10:17:43
Working parents are struggling right now. One company is trying to help by opening a daycare,cnnbusiness,2020-08-09 10:17:43
"Four-day workweek? Yes, please",cnnbusiness,2020-08-09 10:17:43
"To fight pandemic burnout, this company is trying four-day workweeks",cnnbusiness,2020-08-09 10:17:43
SpaceX and ULA win military launch competition worth $653 million -- and that's just the start,cnnbusiness,2020-08-09 10:17:43
What is WeChat and why does Trump want to ban it?,cnnbusiness,2020-08-09 10:17:43
Big Tech's head-spinning rules for the 2020 election,cnnbusiness,2020-08-09 10:17:43
Tencent just became Trump's new target in the tech war with China,cnnbusiness,2020-08-09 10:17:43
Three top executives depart WarnerMedia as CEO Jason Kilar announces focus on HBO Max,cnnbusiness,2020-08-09 10:17:43
Why 'negative partisanship' explains so many of America's political problems,cnnbusiness,2020-08-09 10:17:43
E! News is canceled after 29 years on air,cnnbusiness,2020-08-09 10:17:43
New documentary 'On The Trail' captures how tough it is on the 2020 trail,cnnbusiness,2020-08-09 10:17:43
How NASA's Apollo program kicked off Silicon Valley's tech revolution,cnnbusiness,2020-08-09 10:17:43
Jeff Bezos just sold $1.8 billion worth of Amazon stock. Here's why,cnnbusiness,2020-08-09 10:17:43
